{"run":459,"commit":"f48973b","metric":5.3033,"metrics":{"boot_bench_tps":5.343,"device_output_exact":20,"device_token_delta":0,"ext_decode_tps":5.2269,"gen_tokens":99,"host_output_exact":19,"internal_free":13367,"logit_max_delta":0.00005341,"logit_top1_match":10,"min_case_tps":5.07,"prefill_tps":5.59,"psram_free":2052252,"think_tps":4.2},"status":"keep","description":"Lowered splitter floor MEASURED NULL and a second 20-case gate attempt launched on the byte-identical tree. splitlow (half<2 -> half<1, so 2-3 unit jobs split instead of running serially) read decode 5.5617 / min_case 5.30 / internal_free 12,095 / device_output_exact 6/6 on board 2 - the spin base's 5.560-5.5617 within one quantum - so the jobs the floor excluded are too small to matter either way and the fine-split family closes on measurement, not on the old handshake argument (neither splitting them: this run and tap96's -0.094 %; nor de-splitting them: predicted null by the same arithmetic). Patch reverted rather than kept, since a null lever with a scheduling-risk surface is not worth carrying. Board 3's gate session was still inside its extended group (decode 5.5617, no device_output_exact yet), so a second gate attempt was started on board 2 against the runner-asserted confirmed tree (engine_md5=b1daae10df90, identical to board 3's). Accepted runtime unchanged at 5.3033.","timestamp":1790258299114,"segment":1,"confidence":19.962329961632264,"asi":{"changed_assumption_recap":"The floor was revived legitimately because the premise changed (#344's 23-cycle handshake was void and #451's 16.6 us toll was removed by spin); the answer is that the floor's exact value was never load-bearing, which also means tap96's -0.094 % was not the floor protecting anything.","finding":"LOWERED SPLITTER FLOOR MEASURED NULL. half<2 -> half<1 (jobs of 2-3 units now split instead of running serially on one core) read decode 5.5617 with min_case 5.30, internal_free 12,095, device_output_exact=6/6 - identical to the spin base's 5.560/5.5617 within one quantum. So the jobs the floor excluded (dim=576 Q tap at 3 units, small gathers, a 3-group FWHT half) are individually too small to matter in either direction, and the fine-split family is closed on measurement rather than on the old toll argument: neither splitting them (this run, tap96's -0.094 %) nor de-splitting them is worth the bar. Patch reverted, not kept.","gate":"Two 20-case sessions are now running on the byte-identical confirmed spin tree (md5 b1daae10df90 asserted by the runner on both): board 3, in its extended group with decode 5.5617 / min_case 5.30 and no device_output_exact line yet, and board 2 launched this iteration (M-gate2-b2.log). Two concurrent attempts raise the chance one clears the per-boot 16-17 request ceiling, but run #402 measured that concurrent console traffic moves the stall earlier, so this is a disclosed trade, not a free win.","no_overfit":"No speed claim from a gate session: decode on the candidate is already established by four readings on two boards; these runs exist only to obtain device_output_exact over all 20 frozen cases, i.e. to fail if the change is wrong.","next":"If either session prints device_output_exact=20 with golden_missing=0 and token_delta=0, integrate .auto/exp78/apply_bundle.py + .auto/exp80/nd_quant.c.nf16v + main's nf16v .S + spin main.c into main, re-pin 5.561 in gen_lane.sh/lane_one.sh, run make capture, and re-derive the phase map (prep/dispatch shares moved three times since the last one). If both stall at 16-17 again, the wedge - not the evidence - is the acceptance blocker, and that goes in the owner packet as the item it already is."}}
{"run":460,"commit":"f48973b","metric":5.3033,"metrics":{"boot_bench_tps":5.343,"device_output_exact":20,"device_token_delta":0,"ext_decode_tps":5.2269,"gen_tokens":99,"host_output_exact":19,"internal_free":13367,"logit_max_delta":0.00005341,"logit_top1_match":10,"min_case_tps":5.07,"prefill_tps":5.59,"psram_free":2052252,"think_tps":4.2},"status":"keep","description":"No new claim: two full-suite 20-case device gate sessions are running on the byte-identical confirmed spin tree (engine_md5=b1daae10df90 asserted by the runner on both boards), and board 3's session is measurably alive inside the slowest extended case (STATE line shows timer_status=running, 36 s remaining) with 6 CASE lines emitted so far, so it has not wedged - extended cases simply take minutes each. Board 2's session had flashed and was still priming (zero CASE lines). No speed is claimed from a gate session and no acceptance is asserted: the accepted runtime stays 5.3033 with its own secondaries until device_output_exact=20 with golden_missing=0 and token_delta=0 prints.","timestamp":1790258385965,"segment":1,"confidence":20.933430870519345,"asi":{"correction":"My interim reading that board 3's gate had 'stalled at 6 cases' was wrong and is corrected rather than left in: the lane is alive (3 measure.sh/bench.py processes) and the board is inside the slowest extended case (its 10 s STATE line shows timer_status=running with 36 s remaining, i.e. the interval case), so the absent CASE lines are in-flight work, not a wedge. Extended cases take minutes each, so a 20-case session legitimately sits at 6 visible CASE lines for a long time. The exit code 1 on my own probe was grep -c finding zero matches, not a lane failure.","hypothesis":"No new hypothesis this iteration: the pending measurement is the 20-case device byte-exact gate, the only thing between the confirmed +4.85 % stack (asmemo + radix-4 fusion + nf16v + spin, 5.560/5.5617 on two boards) and a re-pin from 5.3033. Both healthy boards run full-suite sessions on the byte-identical tree (runner-asserted engine_md5=b1daae10df90).","next":"Read device_output_exact from M-gate-b3.log / M-gate2-b2.log next window. On 20/20 with golden_missing=0 and token_delta=0: integrate .auto/exp78/apply_bundle.py + .auto/exp80/nd_quant.c.nf16v + main's nf16v .S + spin main.c into main, re-pin 5.561 in gen_lane.sh/lane_one.sh, run make capture, then re-derive the phase map with AUTO_PROFILE=1 (prep/dispatch shares moved three times since the last map). If both sessions stall at 16-17 as the wedge literature predicts, the blocker remains the console-emission defect and the owner packet is the route.","no_overfit":"A gate session is not a speed run and no speed is claimed from it: decode is already established by four agreeing readings on two boards. Its purpose is to fail if the change is wrong on a case the primary group does not reach - the class the host build structurally cannot see because nd_parallel_rows is rows_serial there."}}
{"run":461,"commit":"f48973b","metric":5.3033,"metrics":{"boot_bench_tps":5.343,"device_output_exact":20,"device_token_delta":0,"ext_decode_tps":5.2269,"gen_tokens":99,"host_output_exact":19,"internal_free":13367,"logit_max_delta":0.00005341,"logit_top1_match":10,"min_case_tps":5.07,"prefill_tps":5.59,"psram_free":2052252,"think_tps":4.2},"status":"keep","description":"Gate attempt #5 stopped at 17/20 cases (board 3, LANE_RC=1) with zero divergences among the 17 completed, so the console-emission wedge remains the acceptance blocker rather than any evidence about the candidate; the spin-era attempt record is now 16,16,17,17,17 across two engines. Board 2's session on the byte-identical confirmed tree (engine_md5=b1daae10df90) was still running with 6 cases reached. No speed claimed from a gate session; accepted runtime unchanged at 5.3033.","timestamp":1790258436293,"segment":1,"confidence":20.933430870519345,"asi":{"board2":"still in progress (6 CASE lines) on the same tree; if it also stops short of 20 the acceptance blocker is unambiguously the firmware wedge and the campaign's next action is the owner packet, not another gate.","changed_assumption_check":"Does #459's fine-split null invalidate any prior discard? No: it closes rather than reopens - it says jobs of 2-3 units are immaterial in BOTH directions, so the historic refusals (rope split +0.13 %, zcrms emit +0.13 %, per-head norms) are not worth reviving either, since their measured positives were at or under one quantum on a base where the toll was supposedly large. No retry is owed.","datum":"Gate-attempt distribution updated with a real observation, not a speed claim: board 3's full-suite session on the confirmed spin tree reached 17 of 20 cases and ended LANE_RC=1 with no device_output_exact line and no divergences in the 17 cases it did complete. The spin-era record is now 16, 16, 17, 17, 17 across five attempts on two engines, i.e. the console-emission wedge - not the candidate - is what blocks acceptance, and per run #442's retired policy a sixth retry on the same board is not warranted.","hypothesis":"No new speed hypothesis: the two live measurements are the 20-case gate sessions. What this iteration adds is the disposition of board 3's attempt.","no_overfit":"The 17 completed cases included the extended/held-out prompts and reproduced their goldens byte-for-byte (that is why no DIVERGE line appears), which is the anti-overfit evidence this campaign cares about: the +4.85 % stack is not tuned to the six primary prompts. Speed is NOT claimed from this session.","next":"Two things, in order. (1) Read M-gate2-b2.log next window for device_output_exact. (2) Meanwhile run a genuine new-candidate screen that does not need a full session: the remaining above-toll scheduling question is whether the caller should publish two descriptors back-to-back (two-slot descriptor ring) so consecutive projections stop serialising on the single slot - cheap to test on AUTO_GROUPS=primary against the 5.561 base, and its arithmetic denominator is now known (publication+poll, not 16.6 us)."}}
{"run":462,"commit":"f48973b","metric":5.3033,"metrics":{"boot_bench_tps":5.343,"device_output_exact":20,"device_token_delta":0,"ext_decode_tps":5.2269,"gen_tokens":99,"host_output_exact":19,"internal_free":13367,"logit_max_delta":0.00005341,"logit_top1_match":10,"min_case_tps":5.07,"prefill_tps":5.59,"psram_free":2052252,"think_tps":4.2},"status":"keep","description":"Phase-map re-derivation launched at the acceptance stack; no speed claim (diagnostic image). Rationale: the ranking map every remaining candidate comes from the 5.0300 era, and four shipped levers have since changed the token's shape (asmemo's 130,560 removed norm reads/token, radix-4 fusion's removed transform pass, nf16v's five instructions out of the 2-bit norm conversion, spin's two removed semaphore syscalls across 150+ splits/token), so a phase that now looks anomalous against its own measured per-op floor is where the next candidate lives. Launched on board 3 (idle) via .auto/lane_prof.sh with a request-path harvest; board 2's full-suite 20-case gate on the byte-identical confirmed spin tree (engine_md5=b1daae10df90) was still running with no device_output_exact line when read, so no acceptance is asserted and the accepted runtime stays 5.3033 with its own secondaries. Per run #410 a profiled image's decode is non-comparable to the baseline in either direction, so this run produces attribution only.","timestamp":1790258516223,"segment":1,"confidence":20.933430870519345,"asi":{"hypothesis":"Re-derive the phase map at the acceptance stack (board 3, ND_PROFILE image, request-path harvest through .auto/prof_request.py). The map that ranks every remaining candidate is from the 5.0300 era, and four things have since changed the shape of the token: asmemo deleted 130,560 immutable norm reads per token from the calling core, the radix-4 fusion removed a whole transform pass, nf16v took five instructions out of the 2-bit kernel's per-group norm conversion, and the spin handshake deleted two semaphore syscalls from 150+ splits per token. Attribution, not speed: run #410's rule is that a profiled image's decode is non-comparable in either direction, so no tok/s is claimed from this image.","why_this_over_a_gate_retry":"Board 2's 20-case session is still running and a sixth retry on board 3 would be the pattern run #442 explicitly retired (spin-era record 16,16,17,17,17 with zero divergences). The map is the only measurement here that can generate a NEW candidate rather than re-asking the same acceptance question.","in_flight":["board 2: full-suite 20-case gate on the confirmed spin tree (engine_md5=b1daae10df90), no device_output_exact line yet when read - so no acceptance claim.","board 3: profiled request-path harvest (.auto/lane_prof.sh, OUT=/root/board-pool/batches/M-prof3-b3.log), 3 processes alive at launch."],"next":"Read the harvested table: I want proj2bit, prep+lut, attn-stage, mhc-mix, sinkhorn, taps and the sampler at the new runtime, differenced against the boot-bench block in the same dump (run #344's rule: never divide a cumulative total by the current token count). Whatever phase now looks anomalous relative to its measured per-op floor is the next candidate; if nothing does, the honest statement is that the stack is complete and the remaining blockers are the wedge and the owner decision."}}
{"run":463,"commit":"f48973b","metric":5.3033,"metrics":{"boot_bench_tps":5.343,"device_output_exact":20,"device_token_delta":0,"ext_decode_tps":5.2269,"gen_tokens":99,"host_output_exact":19,"internal_free":13367,"logit_max_delta":0.00005341,"logit_top1_match":10,"min_case_tps":5.07,"prefill_tps":5.59,"psram_free":2052252,"think_tps":4.2},"status":"keep","description":"Splits per token measured off-device: 275.2 nd_parallel_rows calls per decode token (49,261 over 179 forward steps), 12.4 % carrying fewer than four units, one per-layer call site dispatching 1-3 units 4,296 times per prompt. This is the missing denominator for scheduling claims: 300 cycles/split residual would be 0.18 % of the token and 700 would be 0.42 %, but run #459's exactly-null split-more result bounds the residue below ~300, so the two-slot descriptor ring is predicted sub-bar before it is built and the scheduling family retires at this base with numbers rather than with argument. Host-only: instrumented rows_serial under -DND_SPLIT_STATS, ran a frozen primary prompt through nd_dump, step count cross-checked two ways, then engine/src/nd_quant.c restored to HEAD (md5 79c9be49b6bd, git clean). Accepted runtime unchanged at 5.3033; board 2's 20-case gate and board 3's profiled request-path harvest both still running, so no acceptance claim.","timestamp":1790258732081,"segment":1,"confidence":20.683773039392715,"asi":{"changed_assumption_check":"Confirms rather than reopens past discards: splitlow's null (#459) is exactly what 34 sub-four-unit splits per token predicts, and the old no-split-smaller-than-a-kron-half rule was right in effect though wrong in its stated reason.","hypothesis":"Price the scheduling residual before spending another board: the two remaining scheduling directions (two-slot descriptor ring; fewer-but-larger splits) both scale with the NUMBER of splits per token, which the campaign had never measured.","measurement":"49,261 nd_parallel_rows calls over 179 forward steps = 275.2 splits per decode token; 6,095 of them (12.4 %, 34.1/token) carry fewer than four units, and one per-layer call site dispatches 1-3 units 4,296 times per prompt.","pricing":"C cycles per split costs C x 275 / 46.08M of the token: 300 cyc = 0.18 %, 700 = 0.42 %. Because splitting MORE measured exactly null (#459), the residue must be well under 300 cycles, so the ring is predicted sub-bar before it is built; the only honest lever left in this family is reducing the count where it is free (merge a 1-unit job into its neighbouring split), not adding machinery. Scheduling family retired at this base with numbers.","method":"Host engine instrumented with -DND_SPLIT_STATS (unit-count histogram per call site), built with the repo cmake recipe, one frozen primary prompt (sampling5) through nd_dump; step count cross-checked two ways (1432 = 179 x 8 layers, and 179 matches run #443). Engine restored to HEAD (md5 79c9be49b6bd, git clean over engine).","harness_fact":"cmake is not on PATH by default here; checks.sh sources /opt/esp/idf/export.sh to get it. My first three host-build attempts returned rc=127 (command not found), not a compile error."}}
{"run":464,"commit":"f48973b","metric":5.3033,"metrics":{"boot_bench_tps":5.343,"device_output_exact":20,"device_token_delta":0,"ext_decode_tps":5.2269,"gen_tokens":99,"host_output_exact":19,"internal_free":13367,"logit_max_delta":0.00005341,"logit_top1_match":10,"min_case_tps":5.07,"prefill_tps":5.59,"psram_free":2052252,"think_tps":4.2},"status":"keep","description":"Phase map re-derived at the acceptance stack; attribution agrees with the shipped mechanisms and generates no new candidate. Request-path table: whole block 190.5 ms, proj2bit 105.2 ms (55.7 %), attn-stage 122.8 ms (a parent that overlaps proj2bit by construction, never subtractable), prep+lut 2.2 ms, sample 6.8 ms. The material move is prep+lut 3.6 -> 2.2 ms (-39 %), which is exactly what the radix-4 fusion (one transform pass deleted) plus asmemo (130,560 immutable norm reads/token removed from the calling core) should do - so the map corroborates the two largest levers from the measurement side rather than from the metric. The sample 6.8 ms line is the documented cumulative-total-over-current-tokens artefact (runs #344/#433: the projection measured 0.14 ms/token), not new work, and was not chased. Board 2's 20-case gate had emitted no device_output_exact or LANE_RC line when read, so no acceptance claim; accepted runtime unchanged at 5.3033.","timestamp":1790258780957,"segment":1,"confidence":20.440000000000047,"asi":{"candidate_generated":"None from the map - which is itself the measured answer to the question the harvest was run for. The only phase that moved materially is prep+lut, and it moved in the predicted direction; proj2bit, attn-stage (a parent that overlaps proj2bit by construction - run #344's rule, never subtract them) and the elementwise phases sit where their measured floors put them. So the honest state is: the ranking map now agrees with the acceptance stack, and the remaining above-bar items are the owner decisions already in the packet (assertion-level RAM for phi residency; the 120 MHz clock, vendor-blocked).","hypothesis":"Read the re-derived request-path phase map at the acceptance stack and look for a phase whose cost now exceeds its own measured per-op floor - that is where a new candidate must live, since dispatch/scheduling is priced out (#463) and every other family has a measured floor.","measurement":"Request-path table at the stack: whole block 190.5 ms, proj2bit 105.2 (55.7 %), attn-stage 122.8 (parent, overlaps proj2bit by construction), prep+lut 2.2 ms, sample 6.8 ms (3.6 %). The one attribution change worth recording: prep+lut fell from 3.6 ms to 2.2 ms (-39 %) against the 5.3033-era map, which is the radix-4 fusion removing a whole transform pass plus asmemo removing 130,560 norm reads/token from the calling core - two levers, one phase, attribution consistent with the mechanism rather than asserted.","artifact_flagged":"sample 6.8 ms is the known cumulative-total artefact, not new work: run #433 measured the same bracket at 0.14 ms/token for the projection and 0.3-1.0 ms for the sampler's arithmetic while the table printed 6.5 ms, because prof_dump divides a cumulative nd_prof total by the CURRENT request's token count (run #344's rule). I did not treat it as an anomaly, and I did not spend a board splitting it again.","gate":"board 2's 20-case session had no device_output_exact and no LANE_RC line when read, so it is still running (or ended without the gate group); no acceptance claimed and the pin stays 5.3033.","next":"The queue is now short and honest: (1) the gate reading; (2) on a pass, integrate + re-pin ~5.561 + make capture; (3) the owner packet for the wedge and the two owner-gated levers. Do not re-screen a phase without naming the changed premise - the map just re-derived is the thing that has to go stale first."}}
