{"run":676,"commit":"4599dac","metric":5.6383,"metrics":{"boot_bench_tps":5.733,"device_output_exact":6,"device_token_delta":0,"ext_decode_tps":0,"gen_tokens":99,"host_output_exact":0,"internal_free":4991,"logit_max_delta":0,"logit_top1_match":0,"min_case_tps":5.44,"prefill_tps":5.9033,"psram_free":2052252,"think_tps":0},"status":"keep","description":"Wide-load kron1 factor row KEPT (E55, b1 shippable+notif+widePV base): the kron1 4x2 pass reads four CONTIGUOUS factor floats per i step through a pointer (4 lsi); one ee.ldf.128.ip replaces them, and unlike the kron2 half this loop fits the register file - 8 accumulators + one 4-float factor row + two src values = 14 of 16. Device selftest 64/64 bit-exact with an OOB canary row. decode 5.6383 vs the same board's wide-PV pin 5.6183 = +0.36%, boot 5.733 vs 5.712, min_case 5.44. IMPORTANT: the first run of this exact candidate read 5.6183 = EXACTLY the baseline and was a masked null - the factor pool was still 4-aligned from the reverted kron2 experiment, so the kernel's alignment guard never fired. Making the pool heap_caps_aligned_alloc(16) (per-tensor offsets are multiples of four floats) plus the KRON1W pool_align diagnostic turned the same kernel into a +0.36% win: a wide-load candidate whose guard silently fails measures as a perfect null, so every lane in this family must print its guard verdict.","timestamp":1790321801099,"segment":1,"confidence":12.574460300036597}
{"run":677,"commit":"4599dac","metric":5.8967,"metrics":{"boot_bench_tps":6.002,"device_output_exact":6,"device_token_delta":0,"ext_decode_tps":0,"gen_tokens":99,"host_output_exact":0,"internal_free":2671,"logit_max_delta":0,"logit_top1_match":0,"min_case_tps":5.68,"prefill_tps":6.215,"psram_free":2052252,"think_tps":0},"status":"keep","description":"Wide-load kron1 factor row CONFIRMED cross-board and cross-base (E55 on b2, seed-era+widephi+widePV base): decode 5.8967 vs that board's wide-PV restricted pin 5.8767 = +0.34%, and +0.31% against its own full-gate 5.8783 - reproducing b1's +0.36% from a different base, different quant/asm stack and different board. Both selftests green (PV 128/128, kron1 64/64), pool_align=0 kron1=1 so the guard really fired, 6/6 device exact, token_delta 0, prefill 6.215, min_case 5.68, boot 6.002. New campaign-best device reading 5.8967 = +11.19% over the owner's 5.3033 acceptance pin. The two wide-load levers that pay share the same three properties: redundant row traffic the compiler cannot remove, independent FMAs, and a row that fits alongside the accumulators.","timestamp":1790322311171,"segment":1,"confidence":12.641785583607763}
{"run":678,"commit":"4599dac","metric":5.6383,"metrics":{"boot_bench_tps":5.732,"device_output_exact":18,"device_token_delta":52,"ext_decode_tps":5.5738,"gen_tokens":99,"host_output_exact":0,"internal_free":4191,"logit_max_delta":0,"logit_top1_match":0,"min_case_tps":5.44,"prefill_tps":5.925,"psram_free":2062492,"think_tps":4.4},"status":"keep","description":"FULL GATE of the shippable line with wide P.V + wide kron1 (b1, engine 24d6ce2ce19b): decode 5.6383, ext 5.5738 (vs the wide-PV-only 5.5554 = +0.33%), think 4.4, prefill 5.925, min_case 5.44, boot 5.732, heap 4191; device 18/20 with token_delta 52 = exactly the two #647 demo-timer goldens, no new failure. The restricted screen's 5.6383 reproduced to the last digit on the full suite, and board 3 carrying the SAME engine (transplanted after its tree was lost) read 5.6383 restricted with the same selftest verdicts - the number is board-independent, and b3 is now a validated known-base board again. Shippable line: 5.6383 = +6.31% over the owner's 5.3033 acceptance pin.","timestamp":1790322503369,"segment":1,"confidence":12.641785583607763}
{"run":679,"commit":"4599dac","metric":5.8967,"metrics":{"boot_bench_tps":6.002,"device_output_exact":18,"device_token_delta":52,"ext_decode_tps":5.8292,"gen_tokens":99,"host_output_exact":0,"internal_free":2671,"logit_max_delta":0,"logit_top1_match":0,"min_case_tps":5.68,"prefill_tps":6.215,"psram_free":2062492,"think_tps":4.56},"status":"keep","description":"FULL GATE of the campaign-best line (b2 seed-era composition + composed attention + wide phi + wide P.V + wide kron1): decode 5.8967, ext 5.8292, think 4.56, prefill 6.215, min_case 5.68, boot 6.002, heap 2671; device 18/20 with token_delta 52 = the two #647 demo-timer goldens only. The restricted screen reproduced exactly (5.8967), and against the same board's wide-PV-only full gate (5.8783) the kron1 lever is +0.31% on breadth (ext +0.28%), matching the +0.36% screen on the shippable line. 5.8967 = +11.19% over the owner's 5.3033 acceptance pin, fully breadth-gated.","timestamp":1790323252572,"segment":1,"confidence":12.641785583607763}
{"run":680,"commit":"4599dac","metric":5.6283,"metrics":{"boot_bench_tps":5.712,"device_output_exact":6,"device_token_delta":0,"ext_decode_tps":0,"gen_tokens":99,"host_output_exact":0,"internal_free":4191,"logit_max_delta":0,"logit_top1_match":0,"min_case_tps":5.44,"prefill_tps":5.925,"psram_free":2062492,"think_tps":0},"status":"discard","description":"Kron2 SPLIT INTO REGISTERS, not into passes: wide factor rows with the shipped EIGHT accumulators and a single j walk (f8-f11 hold br[0..3], are reused for br[4..7] and then for cr, live set 14 of 16) DISCARDED at -0.18% (decode 5.6283 vs this board's 5.6383 pin, 6/6 device exact, selftest 64/64 bit-exact so the kernel really ran). Together with #674 (-0.30%, four accumulators, two j walks) this closes the kron2 half of the load-form program with a measured decomposition: about 0.12% of that loss was the second j walk, and the remaining ~0.18% is the wide form itself - holding four registers on a row chunk costs the scheduler more than the six loads it removes in a loop whose 16 madds per j step already dominate. kron1 keeps its +0.36% because there the factor row is four floats, not eight, and the wide load replaces four of only six loads.","timestamp":1790323273727,"segment":1,"confidence":12.641785583607763}
{"run":681,"commit":"4599dac","metric":5.6183,"metrics":{"boot_bench_tps":5.711,"device_output_exact":6,"device_token_delta":0,"ext_decode_tps":0,"gen_tokens":99,"host_output_exact":0,"internal_free":4191,"logit_max_delta":0,"logit_top1_match":0,"min_case_tps":5.42,"prefill_tps":5.925,"psram_free":2062492,"think_tps":0},"status":"discard","description":"Wide-load P.V rescale sweep (E56, b1 shippable+PV+kron1 base) DISCARDED at -0.36%: decode 5.6183 vs the base 5.6383, boot 5.711. The kernel itself is bit-exact (selftest 256/256 with cells, zeros, ones, -1 and a canary row) and performance-neutral: the previous run of the same image had the selftest FAILING (my canary buffer overlapped the reference array) so the guard dispatched to the C path, and it read 5.6167 - i.e. the guarded-if scaffolding in pv_pair2 alone costs ~0.35% while the kernel adds nothing. The reason is frequency, not transport: SELRES measured the sweep firing on only 13.2% of pair iterations (2.36% both rows, 5.8%/5.2% single), so a per-call alignment branch evaluated 9216 times per token cannot be paid for by a rare path. Rule: guard cost is paid per call, so a kernel behind a rare branch needs the branch hoisted to the caller or the candidate is dead on arrival.","timestamp":1790323789169,"segment":1,"confidence":12.641785583607763}
{"run":682,"commit":"075e4a6","metric":5.8967,"metrics":{"boot_bench_tps":6.002,"device_output_exact":18,"device_token_delta":52,"ext_decode_tps":5.8292,"gen_tokens":99,"host_output_exact":19,"internal_free":2671,"logit_max_delta":0.00005341,"logit_top1_match":10,"min_case_tps":5.68,"prefill_tps":6.215,"psram_free":2062492,"think_tps":4.56},"status":"keep","description":"Host quality gates on both parked lines, closing the acceptance evidence for today's two kept levers: b2 (seed-era + composed attention + wide phi + P.V + kron1, engine 58bee4d1cde9) and b1 (shippable + notif + P.V + kron1, engine 24d6ce2ce19b) each read host_output_exact 19/19, host_token_delta 0, logit_max_delta 5.341e-05 (identical to the accepted pin), logit_top1_match 10/10, fidelity top1 10/10. Combined with each line's full 20-case device gate (18/20, token_delta 52, exactly the two #647 demo-timer goldens) both lines now carry complete breadth evidence: 5.8967 seed (+11.19% over the 5.3033 pin) and 5.6383 shippable (+6.31%). The only outstanding item on either line remains the owner's disposition of those two ring-proven cases.","timestamp":1790324024098,"segment":1,"confidence":12.641785583607763}
{"run":683,"commit":"e9c5a74","metric":5.6483,"metrics":{"boot_bench_tps":5.743,"device_output_exact":18,"device_token_delta":52,"ext_decode_tps":5.5815,"gen_tokens":99,"host_output_exact":0,"internal_free":4191,"logit_max_delta":0,"logit_top1_match":0,"min_case_tps":5.45,"prefill_tps":5.9517,"psram_free":2062492,"think_tps":4.4},"status":"keep","description":"Live FWHT delivery, breadth gate (E59 on B1, shippable+notif+PV+kron1): fused len=1+len=2 radix-4 first pass with 128-bit loads inside the ACTIVE nd_fwht3s three-group walk - per 4-cell block 3 loads + 24 fp ops + 3 stores for three groups against 12+24+12 in scalar form, every output the same t1+t3/t2+t4 expression. Device selftest 64/64 bit-exact, and the boot line proves the candidate actually ran in the field: `FWHT4R xh_align=0` and `FWHT4R live=1 n=128 align=0` (m->xh is now a FAST16 allocation; the earlier screen could not show this, which is exactly the masked-null trap from E55). FULL 20-case gate: decode 5.6483 vs the 5.6383 pin = +0.18%, ext 5.5815, think 4.4, min_case 5.45, boot 5.743, 18/20 = the two #647 demo-timer goldens only. The restricted screen had read 5.6600 (+0.385%), so the lever is real but smaller on breadth; it is the first delivery change that pays in the live transform, and it is why the earlier E58 attempt on main could not have measured it.","timestamp":1790328504850,"segment":1,"confidence":12.641785583607763}
{"run":684,"commit":"4599dac","metric":5.5983,"metrics":{"boot_bench_tps":5.69,"device_output_exact":6,"device_token_delta":0,"ext_decode_tps":0,"gen_tokens":99,"host_output_exact":0,"internal_free":4191,"logit_max_delta":0,"logit_top1_match":0,"min_case_tps":5.42,"prefill_tps":5.925,"psram_free":2062492,"think_tps":0},"status":"discard","description":"QK rescheduled wide body (E60 on B3): the mentor's five-load order - k0, qa (increment 0), qb into qa's registers, k1, qa again with increment 16, no rewind anywhere - with f12/f13 and f14/f15 as separate head temporaries so each score's two products are computed in parallel and the qa score adds retire while the qb muls start. Device selftest 256/256 bit-exact. The in-image price is the result: the compiled C body 49 cycles/chunk, this body 56 - against E52's serial body's 80. The reschedule recovered 24 of the 31-cycle defect, and the residual 7 cycles/chunk plus dispatch still loses end-to-end: decode 5.5983 vs the 5.6383 pin = -0.71%, 6/6 exact, boot 5.69. This closes hand-written assembly for the DOT8W QK dot with a measured reason rather than a single negative: even a correctly interleaved wide body (56) does not reach GCC's schedule (49) on this four-accumulator, multi-statement reduction, so no further rescheduling of this loop is worth a board.","timestamp":1790328522692,"segment":1,"confidence":12.641785583607763}
{"run":685,"commit":"4599dac","metric":5.9033,"metrics":{"boot_bench_tps":6.007,"device_output_exact":6,"device_token_delta":0,"ext_decode_tps":0,"gen_tokens":99,"host_output_exact":0,"internal_free":2671,"logit_max_delta":0,"logit_top1_match":0,"min_case_tps":5.69,"prefill_tps":6.215,"psram_free":2062492,"think_tps":0},"status":"keep","description":"P.V eligibility hoisted out of the position loop (E61 on B2, base restored byte-exactly to 58bee4d1cde9 by replaying the two recorded quant-file edits on the exp80/nf16v donor): the kernel's alignment/size verdict is now decided ONCE per attn_heads group - frame rows and head rows are invariant across the position loop - and passed to pv_pair2, so the four pointer tests and the selftest load leave the 100%-frequency path. Restricted screen on the campaign-best seed line: decode 5.9033 vs the restored 5.8967 = +0.11%, boot 6.007 vs 5.982, min_case 5.69, 6/6 device exact, PV and kron1 selftests green. Below the campaign's 0.2% bar on its own, but kept because it is a refund of a cost the E53 kernel introduced rather than a new lever, all three primary-adjacent monitors moved the same way, the change is byte-exact, and #681 measured the un-hoisted form of exactly this scaffolding at ~0.35% on a rarer path.","timestamp":1790329098461,"segment":1,"confidence":12.665934870106115}
{"run":686,"commit":"4599dac","metric":5.8433,"metrics":{"boot_bench_tps":5.945,"device_output_exact":6,"device_token_delta":0,"ext_decode_tps":0,"gen_tokens":99,"host_output_exact":0,"internal_free":2671,"logit_max_delta":0,"logit_top1_match":0,"min_case_tps":5.63,"prefill_tps":6.1517,"psram_free":2062492,"think_tps":0},"status":"discard","description":"Transferring the live FWHT radix-4 delivery to the seed line FAILED on its own base (E62 on B2, restored to 58bee4d1cde9 + the E61 hoist = 5.9033): B2's live transform is nd_fwht4s, whose FIRST fused pass (len=1) has the same contiguous four-cell shape the B1 kernel exploits, so the same kernel was wired in with the walk resuming at len=4 (the later fused passes 4,8 and 16,32 still run there). Device output is byte-exact 6/6 and the dispatch is proven (FWHT4R live=1 n=128 align=0), but decode 5.8433 = -1.02% (boot 5.945 vs 6.007). Two integration attempts were needed before the arithmetic was right - skipping the remaining fused passes made every output wrong (0/6) and the kernel's own selftest stayed green, because it cannot see call-site bookkeeping; the device gate caught it. Conclusion for the family: the same delivery change is worth +0.18% inside B1's nd_fwht3s and -1.02% inside B2's nd_fwht4s, so the win is a property of the surrounding C walk, not of the kernel - nd_fwht4s already fuses its stages and pays for the strided passes, and B2's tree has been restored byte-exactly to its 5.9033 base.","timestamp":1790330931337,"segment":1,"confidence":12.665934870106115}
{"run":687,"commit":"4599dac","metric":5.65,"metrics":{"boot_bench_tps":5.748,"device_output_exact":6,"device_token_delta":0,"ext_decode_tps":0,"gen_tokens":99,"host_output_exact":0,"internal_free":4191,"logit_max_delta":0,"logit_top1_match":0,"min_case_tps":5.45,"prefill_tps":5.9517,"psram_free":2062492,"think_tps":0},"status":"discard","description":"Guard hoists on the shippable line (E63, B1): the same two eligibility hoists that paid on the seed line - P.V verdict computed once per attn_heads group instead of per call (E61's +0.11% there), and kron1's factor/pool verdict lifted out of the j loop to one decision per kron1_blocks call - measure NULL on this base: 5.6500 against the same image's FULL-gate 5.6483 (+0.03%) and against the same-mode restricted screen 5.6600 (-0.18%). Selftests green, 6/6 device exact, dispatch unchanged. METHOD FINDING, and the reason this is a discard rather than a keep: the same FWHT tree read 5.6600 restricted and 5.6483 full - a 0.18% gap, 4.5x the quoted 0.04% quantum - so a restricted screen and a full gate are NOT interchangeable baselines; comparisons must stay within one mode, and every screen/discard decision in this campaign that crossed modes should be read with that in mind. B1 restored byte-exactly to 986dc8d5f2e8.","timestamp":1790331935958,"segment":1,"confidence":12.665934870106115}
{"run":688,"commit":"2a04f6e","metric":5.9033,"metrics":{"boot_bench_tps":6.007,"device_output_exact":6,"device_token_delta":0,"ext_decode_tps":0,"gen_tokens":99,"host_output_exact":19,"internal_free":2671,"logit_max_delta":0.00005341,"logit_top1_match":10,"min_case_tps":5.69,"prefill_tps":6.215,"psram_free":2062492,"think_tps":0},"status":"keep","description":"Host quality gates on the restored+hoisted seed line (B2, engine b28de5ea79ce, 5.9033): host_output_exact 19/19, host_token_delta 0, logit_max_delta 5.341e-05 (identical to the accepted pin), logit_top1_match 10/10, fidelity 10/10. This closes the host half of the acceptance evidence for the E61 hoist tree; its device half is the 6/6 restricted screen, and the full 20-case gate on this exact image is still owed before any owner submission (the 5.8967 full gate predates the hoist). Both discovery lines now have host gates green on their current trees: shippable 5.6483 / seed 5.9033.","timestamp":1790331953316,"segment":1,"confidence":12.665934870106115}
{"run":689,"commit":"75a8259","metric":5.9033,"metrics":{"boot_bench_tps":6.007,"device_output_exact":18,"device_token_delta":52,"ext_decode_tps":5.8338,"gen_tokens":99,"host_output_exact":19,"internal_free":2671,"logit_max_delta":0.00005341,"logit_top1_match":10,"min_case_tps":5.69,"prefill_tps":6.2167,"psram_free":2062492,"think_tps":4.56},"status":"keep","description":"FULL GATE of the campaign-best line with the E61 P.V eligibility hoist (B2, engine b28de5ea79ce): decode 5.9033, ext 5.8338, think 4.56, prefill 6.2167, min_case 5.69, boot 6.007, heap 2671; device 18/20 with token_delta 52 = exactly the two #647 demo-timer goldens, no new failure. The restricted screen value reproduced to the last digit on the full suite - the two modes agreed here, unlike B1's FWHT image (5.6600 restricted vs 5.6483 full), so the mode gap is not a constant offset and only same-mode comparisons are safe. Against the same board's pre-hoist full gate (5.8967) the hoist is +0.11% on breadth, and the line now stands at 5.9033 = +11.31% over the owner's 5.3033 acceptance pin with host gates green (19/19, delta 0, logit delta 5.341e-05, top1 10/10). Only the owner's disposition of the two ring-proven cases stands between this line and acceptance.","timestamp":1790332334467,"segment":1,"confidence":12.665934870106115}
{"run":690,"commit":"6760cb2","metric":5.9033,"metrics":{"boot_bench_tps":6.007,"device_output_exact":18,"device_token_delta":52,"ext_decode_tps":5.8338,"gen_tokens":99,"host_output_exact":19,"internal_free":2671,"logit_max_delta":0.00005341,"logit_top1_match":10,"min_case_tps":5.69,"prefill_tps":6.2167,"psram_free":2062492,"think_tps":4.56},"status":"keep","description":"CROSS-BOARD CONFIRMATION of the campaign-best line: B3 ran the seed-era stack transplanted byte-exactly from B2 (same engine b28de5ea79ce, same main.c) and read decode 5.9033, ext 5.8338, think 4.56, prefill 6.2167, min_case 5.69, boot 6.007, 18/20 with token_delta 52 - every primary and secondary number identical to B2's full gate to the last digit, including the two #647 demo-timer goldens. The stack whose entire content is (seed-era composition + composed attention + wide phi + wide P.V + wide kron1 + P.V eligibility hoist) is therefore board-independent as well as base-independent, and both boards' host gates are green (19/19, delta 0, logit delta 5.341e-05, top1 10/10). 5.9033 = +11.31% over the owner's 5.3033 pin. This is the strongest evidence packet the campaign has had: two boards, one image, identical readings, complete breadth and host gates, with the owner's two-case disposition as the only open item.","timestamp":1790332960013,"segment":1,"confidence":12.665934870106115}
{"run":691,"commit":"4599dac","metric":5.6483,"metrics":{"boot_bench_tps":5.743,"device_output_exact":18,"device_token_delta":52,"ext_decode_tps":5.5815,"gen_tokens":99,"host_output_exact":19,"internal_free":4191,"logit_max_delta":0.00005341,"logit_top1_match":10,"min_case_tps":5.45,"prefill_tps":5.9517,"psram_free":2062492,"think_tps":4.4},"status":"keep","description":"Host quality gates on the FWHT-delivery tree (B1, engine 986dc8d5f2e8, 5.6483 full gate): host_output_exact 19/19, host_token_delta 0, logit_max_delta 5.341e-05 (identical to the accepted pin), logit_top1_match 10/10, fidelity 10/10. The FWHT radix-4 delivery therefore carries both halves of the quality evidence on the shippable line: full 20-case device gate 18/20 with only the two #647 goldens, and a green host gate on the same tree. Both discovery lines are now fully evidenced on their current trees - shippable 5.6483, seed 5.9033 - and the phase map recorded with this iteration (see the queue) shows the next real target is engram at 15.8 ms of ~137 ms measured, a phase that no lever of this campaign has ever touched.","timestamp":1790332999097,"segment":1,"confidence":12.665934870106115}
