{"run":21,"commit":"b81fa48","metric":3.2917,"metrics":{"boot_bench_tps":3.354,"device_output_exact":12,"device_token_delta":0,"ext_decode_tps":3.238,"gen_tokens":99,"host_output_exact":11,"internal_free":26623,"logit_max_delta":0.00005341,"logit_top1_match":10,"min_case_tps":3.12,"prefill_tps":3.53,"psram_free":14635168,"think_tps":2.78},"status":"keep","description":"Pair the j columns in the first Kronecker half so each strided a-row load feeds two src values (4 rows x 2 columns = 8 accumulators). Device decode 3.1817 -> 3.2917 tok/s (+3.46%), prefill +3.7%, extended +3.5%, think +2.6%, boot bench 309 -> 298 ms/tok. Byte-exact host 11/11 and device 12/12; logit fidelity 5.341e-05. Same batch: board1 control 3.1817, board2's blocked attention-gate sigmoid 3.1817 (no effect, dropped).","timestamp":1789780782140,"segment":1,"confidence":6.711409395973159,"asi":{"changed":"kron first half: for each 4-row k block, walk j in pairs so one column-major a-row load is used against two src values (4k x 2j = 8 accumulators)","control":"board1 3.1817 (= committed tree); board2 attention-gate sigmoid blocked by 4: 3.1817 exactly, zero effect (gate is 768 elements once per layer, too small to matter) - not taken","hypothesis":"the first half's strided (column-major) a-row loads are issued once per FMA; pairing the j columns reuses each a-row load against two src values while keeping accumulators at the measured 4-wide optimum","kept":"b81fa48","next_action_hint":"kron_apply is now 4k x 2j on the first half and 8 columns on the second. Natural follow-up: 4k x 4j on the first half (16 accumulators - probably spills, since 8 rows spilled), and the same j-pairing idea applied to the SECOND half's inner loop. After kron saturates, the device profile says proj2bit (41%) and attention (19%) are the remaining big phases, and both have resisted instruction-level changes.","numbers":"decode 3.1817 -> 3.2917 (+3.46%); prefill +3.7%; extended +3.5%; think +2.6%; boot bench 309 -> 298 ms/tok","quality":"byte-exact host 11/11, device 12/12; probe 5.341e-05 unchanged; prefix-isolation green; heap unchanged","win_pattern_note":"the ILP lever in the MLP is about *shared operand loads* as much as accumulator count: the two changes that landed on the first half both kept 4 accumulators and increased per-load reuse (4 rows: +6.1%, 4k x 2j: +3.5%). The 8-row attempt failed because it increased accumulators without adding load reuse."}}
{"run":22,"commit":"a66af3d","metric":3.3017,"metrics":{"boot_bench_tps":3.365,"device_output_exact":12,"device_token_delta":0,"ext_decode_tps":3.248,"gen_tokens":99,"host_output_exact":11,"internal_free":26623,"logit_max_delta":0.00005087,"logit_top1_match":10,"min_case_tps":3.13,"prefill_tps":3.5433,"psram_free":14635168,"think_tps":2.79},"status":"keep","description":"Pair the b rows in the second Kronecker half so each crow entry is loaded once and used against two b rows. Device decode 3.2917 -> 3.3017 tok/s (+0.30%), prefill +0.4%, extended +0.3%, think +0.36%, boot bench 298 -> 297 ms/tok. Byte-exact host 11/11 and device 12/12; logit fidelity improved to 5.087e-05. Same batch: board1 control 3.2917, board2's 4k x 4j first-half block 3.2517 (-1.2%, spills, dropped).","timestamp":1789781488631,"segment":1,"confidence":6.291148500365772,"asi":{"accuracy_note":"this reorder re-associates one add inside each accumulator (two products swap places). Goldens are byte-identical on host and device and the fidelity probe went DOWN (5.341e-05 -> 5.087e-05), so the change is documented in the code comment rather than hidden. No golden or prompt was touched.","changed":"second half inner loop walks j in pairs, using each crow entry against two b rows","control":"board1 3.2917 (= committed tree); board2 4k x 4j first-half block 3.2517 (-1.2%, spills) - not taken","hypothesis":"the second half's 8-column block still loads crow[j] once per FMA; pairing b rows halves those strided c-row reads the same way j-pairing helped the first half","kept":"a66af3d","numbers":"decode 3.2917 -> 3.3017 (+0.30%); prefill +0.38%; extended +0.31%; think +0.36%; boot bench 298 -> 297 ms/tok","next_action_hint":"kron is now saturated on both halves (4k x 2j / 8 cols with paired b rows; wider variants regress). Next: the profile says proj2bit 41% + attention 19% + engram 7% + phi 6% = 73% outside the MLP, and all three have resisted instruction-level work. The one untried structural lever there is dual-core coverage: only GEMV rows and attention heads split, so the whole MLP, rope, sinkhorn, tap convs and the elementwise tails run single-core.","probe":"logit_max_delta improved to 5.087e-05"}}
{"run":23,"commit":"2ad2dc8","metric":3.49,"metrics":{"boot_bench_tps":3.599,"device_output_exact":12,"device_token_delta":0,"ext_decode_tps":3.442,"gen_tokens":99,"host_output_exact":11,"internal_free":26367,"logit_max_delta":0.00005341,"logit_top1_match":10,"min_case_tps":3.35,"prefill_tps":3.7317,"psram_free":14635168,"think_tps":2.92},"status":"keep","description":"Read the int8 V block four bytes per 32-bit load in the paired attention softmax update (v_head_dim=64, aligned; per-element product order preserved exactly). Device decode 3.3017 -> 3.4900 tok/s (+5.70%), prefill +5.3%, extended +6.0%, think +4.7%, boot bench 297 -> 278 ms/tok. Byte-exact host 11/11 and device 12/12; logit fidelity unchanged at 5.341e-05. Same batch: board1 control 3.3017, board2's 4-way rms_unit reduction 3.3067 (+0.15% for a real re-association, not taken).","timestamp":1789782349284,"segment":1,"confidence":6.017795637198627,"asi":{"alignment_note":"v_head_dim=64 and the v_cache row pitch are multiples of 4, so the word loads are aligned and the loop covers v_hd exactly. An earlier 4-at-a-time variant that also re-associated the wv0/wv1 pair per element was WRONG (probe 5.46, host 8/11) and was never flashed; the version kept here preserves the exact product order and is bit-identical.","changed":"for (i = 0; i < v_hd; i += 4) { a = word(vp0), b = word(vp1); oh[i+k] += wv0*byte(a,k); oh[i+k] += wv1*byte(b,k); }","control":"board1 3.3017 (= committed tree); board2 rms_unit 4-accumulator sum-of-squares: 3.3067 (+0.15%, within board noise; it also costs a real re-association, probe 8.39e-05, so not taken)","dead_end_note":"rms_unit 4-way reduction: +0.15% for a real numerical change - not worth it. V-word load, by contrast, is +5.7% for zero numerical change.","hypothesis":"attention: read the int8 V block four bytes at a time in the paired softmax update","kept":"2ad2dc8","next_action_hint":"the same packed-word read applies to the K dot product (qk_hd=48, also 4-aligned) and to the odd-tail path. V-word loads gave +5.7% with zero numerical change: do K the same way (careful: the K loop accumulates into a single scalar, so the product order per accumulator must be preserved exactly). Then re-profile: attention was 19% before this.","numbers":"decode 3.3017 -> 3.4900 (+5.70%); prefill +5.3%; extended +6.0%; think +4.7%; boot bench 297 -> 278 ms/tok","quality":"byte-exact host 11/11 device 12/12; probe 5.341e-05 unchanged; prefix-isolation green; internal_free 26623 -> 26367 (code size only)"}}
{"run":24,"commit":"d4ccd2e","metric":3.5017,"metrics":{"boot_bench_tps":3.613,"device_output_exact":12,"device_token_delta":0,"ext_decode_tps":3.454,"gen_tokens":99,"host_output_exact":11,"internal_free":26367,"logit_max_delta":0.00005341,"logit_top1_match":10,"min_case_tps":3.37,"prefill_tps":3.7417,"psram_free":14635168,"think_tps":2.93},"status":"keep","description":"Read the int8 K block four bytes per 32-bit load in the paired attention score dot (products added in the same pairs, same order). Device decode 3.4900 -> 3.5017 tok/s (+0.34%), prefill +0.27%, extended +0.35%, think +0.34%, boot bench 278 -> 277 ms/tok. Byte-exact host 11/11 and device 12/12; logit fidelity unchanged. Same batch also showed board3's packed-word 2-bit LUT row read producing garbage on host (never flashed) - that kernel's table is pair-major and the shifts do not line up.","timestamp":1789782811623,"segment":1,"confidence":5.007085498346718,"asi":{"changed":"paired score dot loads K four bytes per word; products added to each score in the same pairs and index order as before","dead_ends_found_while_building_this_batch":"board3's 2-bit LUT row packed-word read produced garbage (probe 2.5e3, host 0/11, prefix isolation FAILED) - the packed LUT index is per-pair and the shifts did not line up with the table's pair-major layout. Never flashed. Re-confirms the earlier note that the 2-bit row walker is not a safe packed-word candidate.","hypothesis":"the same packed-word read that won +5.7% on V applies to the K score dot (qk_hd=48, 4-aligned)","kept":"d4ccd2e","next_action_hint":"the odd-tail path in attn_heads still reads bytes one at a time but runs at most once per head per run - not worth it. Attention is now heavily optimised; re-profile to see the new phase split before picking the next target. Remaining structural idea: dual-core coverage of the MLP tail, and the engram tap matmul / phi GEMV which are 4-bit.","numbers":"decode 3.4900 -> 3.5017 (+0.34%); prefill +0.27%; extended +0.35%; think +0.34%; boot bench 278 -> 277 ms/tok","quality":"device 12/12, host 11/11 byte-exact; probe 5.341e-05 unchanged; prefix-isolation green","verification":"host probe 5.341e-05 = unchanged (the first draft of this change added products one-at-a-time instead of in pairs and moved the probe to 6.3e-05; corrected before flashing)"}}
{"run":25,"commit":"524c14e","metric":3.5033,"metrics":{"boot_bench_tps":3.616,"device_output_exact":12,"device_token_delta":0,"ext_decode_tps":3.46,"gen_tokens":99,"host_output_exact":11,"internal_free":26367,"logit_max_delta":0.00005341,"logit_top1_match":10,"min_case_tps":3.37,"prefill_tps":3.7467,"psram_free":14635168,"think_tps":2.93},"status":"keep","description":"Fuse the Monarch MLP's d4 output scale into block()'s residual add (the kernel now leaves its unscaled result in hada_b instead of round-tripping through n2). Device decode 3.5017 -> 3.5033 tok/s (+0.05%, essentially neutral), prefill +0.13%, extended +0.17%, think unchanged. Byte-exact host 11/11 and device 12/12; probe unchanged. Device profile taken this cycle: proj2bit 47.1%, attention 13.8%, hadamard 13.3%, engram 8.4%, mhc_phi4 6.4%.","timestamp":1789783679654,"segment":1,"confidence":4.566021505376345,"asi":{"changed":"hadamard_mlp_unscaled leaves the result in hada_b; block() applies d4 while adding into u","control":"previous main-board measurement 3.5017; this run 3.5033 (+0.05%)","dead_end_note":"profile says proj2bit (the 2-bit LUT GEMV) is now 47% of the device forward pass and everything else is under 14%. The two phases I have been optimising - MLP (13%) and attention (14%) - are now the SMALL ones. Instruction-level work there is capped at single-digit percents. The remaining big fish needs a bandwidth/cache answer, not a scheduling one.","hypothesis":"fuse the MLP's d4 output scale into the caller's residual add, saving one 768-element write+read round trip per layer","kept":"524c14e","measurement_note":"+0.05% is below this harness's historical case-resolution noise; kept because it is strictly less work per layer, byte-exact everywhere, and removes an intermediate buffer pass. If a future change needs internal RAM back, this one is a safe place to look for a small code/data win.","next_action_hint":"attack proj2bit: the LUT for in_pad=1024 is 1024/2*16*4 = 32 KB, larger than the S3's 32 KB data cache, and it is re-walked for every output row. Ideas: (a) process the rows in an order that keeps a slice of the table hot; (b) split the table by group so each group's table fits in a cache line set and stream the row bytes for that group across many rows; (c) check the current sdkconfig cache line/size settings.","numbers":"decode 3.5017 -> 3.5033 (+0.05%); prefill +0.13%; extended +0.17%; think +0%; boot bench 277 ms/tok unchanged","quality":"device 12/12, host 11/11 byte-exact; probe 5.341e-05; prefix-isolation green","profile_after_this":"proj2bit 47.1%, attention 13.8%, hadamard 13.3%, engram 8.4%, mhc_phi4 6.4%, prep+lut 1.9%, confpool/logits 0%"}}
{"run":26,"commit":"6544bd7","metric":3.7367,"metrics":{"boot_bench_tps":3.866,"device_output_exact":12,"device_token_delta":0,"ext_decode_tps":3.686,"gen_tokens":99,"host_output_exact":11,"internal_free":26367,"logit_max_delta":0.00005341,"logit_top1_match":10,"min_case_tps":3.58,"prefill_tps":4.015,"psram_free":14635168,"think_tps":3.09},"status":"keep","description":"Read two packed 2-bit row bytes per 32-bit load in the 2-bit LUT GEMV (the dominant 47% phase). Device decode 3.5033 -> 3.7367 tok/s (+6.72%), prefill +7.2%, extended +6.5%, think +5.5%, boot bench 277 -> 259 ms/tok. Byte-exact host 11/11 and device 12/12; logit fidelity unchanged at 5.341e-05. This is the largest single win since the fp32 staging.","timestamp":1789784160714,"segment":1,"confidence":5.112514804579552,"asi":{"changed":"lut2_rows inner loop: for (j = 0; j < g; j += 16) { uint32_t w = word(qq); 4 lookups from w low half; T += 64; 4 lookups from w high half; T += 64; }","dead_end_note":"the row-blocked-by-4 version of this kernel (4 rows sharing a table slice) produced garbage on host (probe 2.6e3, host 0/11) - my index arithmetic for the per-row norms was wrong, and it also would have exceeded the table stride; never flashed. The packed-word read that WAS kept is a pure load-count change.","hypothesis":"the 2-bit LUT GEMV row walker issues one byte load per pair; the rows are group-aligned so two bytes can share one 32-bit load","kept":"6544bd7","next_action_hint":"THIS WAS THE BIG ONE - proj2bit is 47% of the pass and packed-word reads just took 6.7% of total decode. Repeat the trick: (1) dot_group's 2-bit branch in the 4-bit/generic path (same byte-pair pattern at cb[3u] granularity - only 4 codes per byte so two bytes still pack into a word); (2) the 4-bit generic dot_group; (3) nd_cq_gemv_gather. Also re-profile: with the GEMV 6.7% faster the phase split has moved again.","numbers":"decode 3.5033 -> 3.7367 (+6.72%); prefill +7.2%; extended +6.5%; think +5.5%; boot bench 277 -> 259 ms/tok","quality":"device 12/12, host 11/11 byte-exact; probe 5.341e-05 unchanged; prefix-isolation green; heap unchanged"}}
{"run":27,"commit":"69fd2f7","metric":3.7367,"metrics":{"boot_bench_tps":3.866,"device_output_exact":12,"device_token_delta":0,"ext_decode_tps":3.686,"gen_tokens":99,"host_output_exact":11,"internal_free":26367,"logit_max_delta":0.00005341,"logit_top1_match":10,"min_case_tps":3.58,"prefill_tps":4.015,"psram_free":14635168,"think_tps":3.09},"status":"keep","description":"Packed-word read (16 weights per 32-bit load) in the 2-bit branch of the generic dot_group. Device decode unchanged at 3.7367 tok/s with every secondary identical to 4 decimals - the branch is not on the hot path (2-bit GEMVs use the LUT kernel). Byte-exact everywhere; kept as a free instruction-count reduction for the dequant path.","timestamp":1789784513388,"segment":1,"confidence":5.112514804579552,"asi":{"changed":"dot_group bits==2 branch: 16 weights per word load instead of 8 per two byte loads","control":"every metric identical to 4 decimals (3.7367 / 4.0150 / 3.6860 / 3.0900 / boot 259 ms)","hypothesis":"the same packed-word read applies to the 2-bit branch of dot_group (the generic 4-bit/engram path)","kept":"69fd2f7","measurement_note":"exactly zero change in every reported metric. That means the bits==2 branch of dot_group is not on the decode path for this workload - the 2-bit GEMVs all go through the LUT kernel (lut2_rows), which was just optimised. The generic 2-bit branch serves nd_cq_dequant_row (engram table lookups + embedding row), which apparently is not instruction-issue bound either.","next_action_hint":"try the 4-bit branch of dot_group (it DOES serve mhc_phi 6.4% and the engram 8.4% and logits4), and re-profile to see where the remaining time sits now that proj2bit is 6.7% cheaper. If the 4-bit branch is also neutral, the GEMVs are done and only a structural change (dual-core MLP coverage) can move the number further.","numbers":"decode 3.7367 -> 3.7367 (0.00%); every secondary identical to 4 decimals","quality":"device 12/12 host 11/11 byte-exact; probe 5.341e-05; prefix-isolation green"}}
{"run":28,"commit":"6448da2","metric":3.7567,"metrics":{"boot_bench_tps":3.878,"device_output_exact":12,"device_token_delta":0,"ext_decode_tps":3.706,"gen_tokens":99,"host_output_exact":11,"internal_free":26111,"logit_max_delta":0.00005341,"logit_top1_match":10,"min_case_tps":3.6,"prefill_tps":4.0317,"psram_free":14635168,"think_tps":3.15},"status":"keep","description":"Eight weights per 32-bit load in the 4-bit branch of dot_group (serves mHC phi, engram and the think-path logits). Device decode 3.7367 -> 3.7567 tok/s (+0.53%), prefill +0.4%, extended +0.5%, think +1.9%, boot bench 259 -> 258 ms/tok. Byte-exact host 11/11 and device 12/12; probe unchanged.","timestamp":1789785353019,"segment":1,"confidence":5.191472562179237,"asi":{"changed":"dot_group bits==4 branch: 8 weights per word load instead of 4 per two byte loads","control":"previous run 3.7367 -> 3.7567","hypothesis":"the 4-bit branch of dot_group serves mhc_phi (6.8%), engram (8.1%) and logits4, so the same packed-word read should help","kept":"6448da2","next_action_hint":"proj2bit 44%, attention 15%, MLP 14%, engram 8%, phi 7%. Everything is now within 3x of each other and instruction-level work is played out in each. The one untried structural lever is the second core: only GEMV rows and attention heads use it, so the MLP (36.8ms/token measured at ND_P_MLP), rope, sinkhorn, tap convs and the elementwise tails run single-core. Cheapest experiment in that family: overlap the MLP of layer li with nothing is impossible (serial dependency), but the mHC phi GEMV (7%) + lane mixing is a discrete stage whose output only feeds the first lane mix - worth measuring a split there. Alternatively accept 3.75 and bank the run.","numbers":"decode 3.7367 -> 3.7567 (+0.53%); prefill +0.42%; extended +0.54%; think +1.94% (the unconstrained 4-bit-heavy path gains most, as expected)","quality":"device 12/12 host 11/11 byte-exact; probe 5.341e-05; prefix-isolation green; internal_free 26367 -> 26111 (code size)"}}
{"run":29,"commit":"f4fdc29","metric":3.7567,"metrics":{"boot_bench_tps":3.878,"device_output_exact":12,"device_token_delta":0,"ext_decode_tps":3.706,"gen_tokens":99,"host_output_exact":11,"internal_free":26111,"logit_max_delta":0.00005341,"logit_top1_match":10,"min_case_tps":3.6,"prefill_tps":4.0317,"psram_free":14635168,"think_tps":3.15},"status":"keep","description":"restrict-qualify rms_unit/zcrms pointers. Device decode unchanged at 3.7567 tok/s with every metric identical to 4 decimals - the compiler already proved non-aliasing. Kept as a zero-cost statement of the disjoint-scratch invariant. Note: this run also corrects the record - the prior parallel batch's control was a stale checkout (3.7367), so its candidate deltas were not vs HEAD; all candidate results in it were within noise anyway.","timestamp":1789786753400,"segment":1,"confidence":4.287577437235083,"asi":{"changed":"rms_unit + zcrms signatures take restrict pointers (no body change)","control_note":"IMPORTANT: the previous parallel batch's board1 control read 3.7367 while HEAD (6448da2, 4-bit packed dot_group) measures 3.7567 on the main board. Root cause: the board checkouts were left on an older commit by a manual cp-based reset, so that batch's control was NOT HEAD. All boards are now hard-reset to HEAD and verified by file hash. Treat that batch's deltas as untrusted (its candidates - FWHT unroll, straight-line sinkhorn, kv_slot hoist, gate sigmoid blocking, LUT builder 2-wide - measured 0.0 to +0.04%, all within noise anyway).","hypothesis":"restrict-qualify the norm kernels' disjoint in/out pointers so the compiler can vectorise the sum-of-squares","kept":"f4fdc29","measurement_note":"every metric identical to 4 decimals vs the 6448da2 measurement (3.7567 / 4.0317 / 3.7060 / 3.1500 / boot 258). GCC -O3 on LX7 evidently already proved non-aliasing here, or these loops are not vectoriser-friendly. Kept as a documentation-grade refactor: it states the disjointness invariant the scratch buffers rely on.","next_action_hint":"the parallel boards have produced null results on 5 candidates in a row (FWHT unroll, straight-line sinkhorn, kv_slot hoist, gate sigmoid block, LUT builder 2x, restrict). Instruction-level work is exhausted at every phase the profile can see. The remaining real lever is dual-core coverage: only GEMV rows and attention heads use core 1. Cheapest real version: split the elementwise/lane-mixing work of the mHC stage (rms_unit over 3072 + phi + lane mix) across cores with the existing rows_dual_core handshake on a row-splittable decomposition.","numbers":"decode 3.7567 -> 3.7567 (0.00%); prefill/extended/think identical","quality":"device 12/12 host 11/11 byte-exact; probe 5.341e-05; prefix-isolation green"}}
