{"run":527,"commit":"9c4f1b2","metric":5.3033,"metrics":{"boot_bench_tps":5.621,"device_output_exact":18,"device_token_delta":52,"ext_decode_tps":5.2269,"gen_tokens":99,"host_output_exact":19,"internal_free":8415,"logit_max_delta":0.00005341,"logit_top1_match":10,"min_case_tps":5.31,"prefill_tps":5.59,"psram_free":2052252,"think_tps":4.2},"status":"keep","description":"The acceptance tree's identity is corrected against the artifact, and two earlier claims are retracted. Grepping line by line: board 2's esp32/main/main.c contains the RXQ diagnostic printf at line 597, the saved snapshot .auto/exp84/main.c.lean-ring contains the same statement at the same line 597, and board 2's built libmain.a carries the RXQ format string (count 1). So the merged tree that measured decode 5.575 with device_output_exact 18/20 on board 2 still printed the per-request #494 trace, which retracts #516's 'trace removed' and #518's premise that the ring's cost was isolated by removing the diagnostic. The speed conclusion survives with a weaker label: merged+trace 5.575 against the lean tree without the ring at 5.580/5.5817 is -0.09 %, one quantum, which upper-bounds the ring's cost rather than measuring it separately. The 18/20 verdict also gets a disclosed caveat rather than a clean pass: those extra RXQ lines go into the same console stream the harness byte-compares, and only the two demo-timer cases diverged, so the reader evidently tolerated them - but acceptance should not depend on that tolerance. Next: strip RXQ by deleting the printf's own lines with grep -n verified before and after, confirm zero RXQ strings in the rebuilt ELF, and rerun one full session; annotate or rename the snapshot so nobody reuses it believing it trace-free. Accepted pin unchanged at 5.3033.","timestamp":1790270187388,"segment":1,"confidence":18.02457142857145,"asi":{"correction_518":"Invalid as written: 'the ring costs one quantum once its diagnostic print is removed' - nothing was removed. Valid conclusion by a different comparison: merged tree 5.575 versus the lean tree without the ring at 5.580/5.5817 is -0.09 %, one quantum, but that delta includes the trace's cost, so the ring's own cost is <= one quantum rather than measured separately.","correction_516":"'trace removed' is wrong. The merge script's trace-strip reported success but board 2's main.c still carries the printf at line 597, and so does the file it produced, so the merged acceptance tree that measured 5.575 with 18/20 byte-exact still emitted the #494 RXQ line on every request.","hypothesis":"Settle which tree actually produced the acceptance numbers by grepping the source and the built artifact of the board that holds the verdict, line by line, rather than trusting any earlier claim about the merge.","result":"Decisive and unwelcome: board 2's current esp32/main/main.c contains the RXQ printf at line 597, the snapshot .auto/exp84/main.c.lean-ring contains the identical line 597, and board 2's built libmain.a contains the RXQ string (count 1). The acceptance reading 5.575 / 18/20 was therefore taken on the merged tree WITH the per-request diagnostic still present, not without it.","second_order":"The trace prints into the same console stream bench.py byte-compares, so an extra 'RXQ recv=8' line per request is a live risk to the comparison. It did not corrupt the verdict in practice - 18 of 20 cases matched byte for byte and only the two demo-timer cases diverged - which is evidence the reader tolerates it, but the acceptance run should not depend on that tolerance. Stated as a caveat on the 18/20, not as a clean pass.","next":"Redo the merge honestly: strip RXQ by deleting the printf statement's own lines verified by grep -n before and after, confirm the rebuilt ELF has zero RXQ strings, then rerun one full session on that tree. Until then the acceptance numbers are labelled 'merged tree + trace', and the snapshot file must be renamed or annotated so nobody reuses it believing it trace-free."}}
{"run":528,"commit":"a7e4c9f","metric":5.3033,"metrics":{"boot_bench_tps":5.621,"device_output_exact":18,"device_token_delta":52,"ext_decode_tps":5.2269,"gen_tokens":99,"host_output_exact":19,"internal_free":8415,"logit_max_delta":0.00005341,"logit_top1_match":10,"min_case_tps":5.31,"prefill_tps":5.59,"psram_free":2052252,"think_tps":4.2},"status":"keep","description":"The acceptance tree is now genuinely trace-free, verified in the artifact, and a clean 20-case session is running. #527 found the merged tree still emitted the per-request RXQ line; deleting just the format-string line broke the build (main.c:597 'expected ; before )') because the printf spans multiple lines, leaving its argument orphaned - found by a local build with zero board time, the second consecutive iteration where building in the checkout beat flashing. Removed the entire #494 block by verified line numbers (start line 593 through the closing brace after fflush, 7 lines), and the rebuilt main component now contains zero RXQ strings (elf=0) while retaining the handshake conversion (sem=0 xSemaphore, 2 ulTaskNotifyTake) - i.e. lean notifications + sequence predicate + late lossless RX ring, diagnostic actually gone. Provenance recomputed from the verified tree as 4d3094578050 and written into the worker's .auto/expect_engine_md5 so the runner asserts exactly this tree; it is a new signature, so no anti-repeat override was used. Accepted pin unchanged at 5.3033; the previous merged+trace reading (5.575, 18/20) stands as recorded with #527's caveat until this run reports.","timestamp":1790270312678,"segment":1,"confidence":18.02457142857145,"asi":{"discovery":"The trace is a multi-line printf inside a braced block, so a naive line delete left the argument line orphaned and the build failed with 'main.c:597: expected ; before )' - caught by a local build, not by a board. Removed the whole block (7 lines, from the '#494 input trace' comment through the brace following fflush) and the rebuilt artifact contains zero RXQ strings.","hypothesis":"Fix #527 properly: delete the #494 RXQ input-trace block from the merged acceptance tree by verified line numbers, prove the rebuilt artifact is trace-free, then run one full 20-case session on that tree.","next":"Read the compare block: the expectation is device_output_exact 18/20 failing exactly heldout_interval_one and heldout_long_tools_note_only (#513's pass condition), with decode near 5.575 - a byte-exactness verdict that no longer depends on the reader tolerating my diagnostic lines, which was the caveat #527 put on it. Also rename or annotate .auto/exp84/main.c.lean-ring so its label matches what it actually contains.","why_local_build_matters":"Second time in two iterations that idf.py build in the checkout caught a defect that a lane would have reported 15 minutes and one flash later: #526's non-clean snapshot and now the orphaned printf argument. Building locally before computing the expectation is the cheapest provenance check available."}}
{"run":529,"commit":"a7e4c9f","metric":5.3033,"metrics":{"boot_bench_tps":5.621,"device_output_exact":18,"device_token_delta":52,"ext_decode_tps":5.2269,"gen_tokens":99,"host_output_exact":19,"internal_free":8415,"logit_max_delta":0.00005341,"logit_top1_match":10,"min_case_tps":5.31,"prefill_tps":5.59,"psram_free":2052252,"think_tps":4.2},"status":"keep","description":"The clean trace-free acceptance session launched correctly but its provenance is ambiguous, so no claim is taken from it. The fresh log's first PROVENANCE line asserts engine_md5=4d3094578050c8d5ea10d512c31e4ac6, exactly the hash computed from the verified trace-free tree and written into the worker, which confirms the launch itself. However the same log then carries a second provenance line with a different hash, 2453a82df3c7, meaning either a second measure.sh invocation appended to that file or the tree changed mid-session - the exact failure class #525 identified, where a provenance line and the flashed artifact belong to different launches. Consequence applied immediately: this session's eventual verdict is unusable until the log is separated per launch, so the acceptance position is unchanged (merged+trace 5.575 with 18/20 byte-exact, carrying #527's disclosed caveat that the compared console stream also contained diagnostic lines). Next: print each PROVENANCE line with its line number and following flash step, re-verify the built libmain.a is RXQ-free and which tree hash it matches, and make the launcher write one log per launch and refuse a second run into the same file, since two provenance lines in one log is unresolvable after the fact.","timestamp":1790270473093,"segment":1,"confidence":18.02457142857145,"asi":{"hypothesis":"Confirm the clean trace-free acceptance session asserted the provenance it was launched with (4d3094578050 = lean notifications + predicate + late RX ring, RXQ block removed, elf verified clean).","observation":"grep of the fresh log M-clean-b2.log returns engine_md5=4d3094578050c8d5... first, then a SECOND provenance line engine_md5=2453a82df3c7... . Two PROVENANCE lines in one log mean either the runner ran twice, or the tree changed between them - which is precisely the class of defect #525 found (a provenance line and an on-disk build belonging to different launches).","next":"Determine which image was actually flashed: count PROVENANCE/flash lines with their line numbers and timestamps in the log, and grep the CURRENT built libmain.a for RXQ (expect 0) plus compare the on-disk tree's hash to both values. Use the reading only from the launch whose flash line follows its provenance line; discard the other. If a stray second invocation exists in the pane command, fix the launcher to write a per-launch log and refuse a second run per file.","risk_to_claim":"Until this is resolved, no acceptance claim comes from this session either: the log's provenance is ambiguous, which is the same reason #524/#525 withdrew board 3's reading. Board 2's earlier merged+trace 5.575 / 18-of-20 stays on the record with #527's caveat.","status":"The first line matches, so the launch was correct. But the log is one file and the second hash means a second measurement or a mutated tree went into it."}}
{"run":530,"commit":"f1b0d5e","metric":5.3033,"metrics":{"boot_bench_tps":5.621,"device_output_exact":18,"device_token_delta":52,"ext_decode_tps":5.2269,"gen_tokens":99,"host_output_exact":19,"internal_free":8415,"logit_max_delta":0.00005341,"logit_top1_match":10,"min_case_tps":5.31,"prefill_tps":5.59,"psram_free":2052252,"think_tps":4.2},"status":"keep","description":"#529's provenance alarm was mine, not the harness's, and the clean acceptance session is sound. With line numbers the log shows exactly one PROVENANCE line (line 1, tree=/root/board-pool/board2, head=5c2abfb) and the tree currently on disk hashes to 4d3094578050 - identical to what that line asserts - so there was one launch and the flashed tree still matches its provenance. The 2453a82df3c7 value I read as a second launch sits on line 3 as a bare field with no PROVENANCE prefix, i.e. a different hash the runner also prints, not a second measurement; my token-only grep without line numbers manufactured the ambiguity. Recorded as another instance of the campaign's recurring lesson that a count without context is not a measurement, and that a grep collecting one token across a file needs its positive control. Applied consequence: the clean trace-free session (ELF verified RXQ-free at #528, provenance verified now) is the acceptance reading to wait for - 219 lines so far, no LANE_RC or DEVICE_OUTPUT line yet, so it is still inside the suite and no verdict exists. Acceptance position unchanged meanwhile: merged+trace 5.575 with 18/20 byte-exact carrying #527's caveat; accepted pin 5.3033.","timestamp":1790270526309,"segment":1,"confidence":18.02457142857145,"asi":{"correction":"Withdrew #529's concern without fully labelling the second value. #529's alarm came from a grep that collected every engine_md5= token with no line numbers or field context, so two unrelated fields read as two launches. Line numbers plus a positive control - the current tree's own hash, which equals line 1's value - resolved it in three greps, and the correct habit is to print the match plus its line before inferring anything from a count.","finding":"Only ONE PROVENANCE line exists in the log (line 1, tree=/root/board-pool/board2, head=5c2abfb), and the CURRENT tree hash recomputed on disk is 4d3094578050, exactly what that line asserts. So #529's 'second launch or mutated tree' worry is wrong: there was one launch and the tree still matches its provenance.","hypothesis":"Resolve #529's double-provenance alarm by line numbers rather than by a count of matching tokens: how many PROVENANCE lines does the clean session's log actually contain, and does the on-disk tree still match the asserted hash?","next":"One look labels the stray value (read lines 1-3 in full), then this session's compare block is the acceptance reading: 18/20 with exactly heldout_interval_one and heldout_long_tools_note_only failing is the pass condition (#513), on a tree whose ELF is verified RXQ-free so the byte comparison is no longer contaminated by diagnostic lines. The launcher improvement still stands on its merits - one log per launch - but it is hygiene, not a response to a defect.","second_value":"Line 3 holds a bare 'engine_md5=2453a82df3c7' with no PROVENANCE prefix - a different field of the same launch (the runner prints several hashes), not a second measurement. Mis-labeling it was my error, and the honest status is: provenance sound, reading pending."}}
{"run":531,"commit":"f1b0d5e","metric":5.3033,"metrics":{"boot_bench_tps":5.621,"device_output_exact":18,"device_token_delta":52,"ext_decode_tps":5.2269,"gen_tokens":99,"host_output_exact":19,"internal_free":8415,"logit_max_delta":0.00005341,"logit_top1_match":10,"min_case_tps":5.31,"prefill_tps":5.59,"psram_free":2052252,"think_tps":4.2},"status":"keep","description":"The clean trace-free acceptance tree reads decode 5.5767 with zero divergence lines so far, and no verdict yet. Speed is unchanged by removing the diagnostic (5.5767 trace-free vs 5.575 with trace, vs 5.580/5.5817 for the lean tree without the console ring), so the lossless RX ring's cost is within one quantisation tick - the conclusion #527 had to downgrade to an upper bound because the trace was still present, now restored on a clean measurement. On quality the log has printed no DIVERGE line at all, where every 20-case session of this era printed two (heldout_interval_one, heldout_long_tools_note_only); that is encouraging but is not a pass, because bench.py emits device_output_exact only after all cases and neither that line nor LANE_RC exists yet in this 219-plus-line log. Consequence if it completes 20/20: the byte-exactness gate is then satisfied on a tree whose console stream carries no diagnostic traffic, which removes #527's caveat and leaves only the owner's disposition of the two demo-timer goldens as the reason the pin has not moved. Accepted pin deliberately unchanged at 5.3033 until LANE_RC=0 and device_output_exact=20/20 are in the log.","timestamp":1790270559749,"segment":1,"confidence":18.02457142857145,"asi":{"hypothesis":"Read the clean trace-free acceptance session: what does it read for decode, and has it emitted any divergence yet?","next":"Wait for LANE_RC plus the compare block. If it lands 20/20, the acceptance reading is on a tree with no diagnostic traffic in the compared stream, which retires #527's caveat and makes the owner's remaining decision only the two state-dependent goldens' status rather than a blocker. If it lands 18/20 on the same pair, the trace is exonerated as a cause and #513's pass condition holds on a clean stream, which is the stronger form of the same result. Either way the speed number is now trace-free.","result_speed":"decode_tps 5.5767 on the trace-free merged tree, against 5.575 for the same tree with the trace and 5.580/5.5817 for the lean tree without the ring: the lossless console RX ring costs within one quantum of nothing, which is the same conclusion #527 had to weaken, now restored on a clean measurement.","result_quality":"Zero DIVERGE lines so far in a log that already carries decode_tps=5.5767, i.e. the primary group matched byte for byte and no case has diverged yet - unlike every 20-case run of this era, which reached 18/20 with two divergences printed. Not a verdict: no device_output_exact, no LANE_RC, so the suite is still running and bench.py prints its compare block only at the end (#513's lesson)."}}
{"run":532,"commit":"f1b0d5e","metric":5.3033,"metrics":{"boot_bench_tps":5.621,"device_output_exact":18,"device_token_delta":52,"ext_decode_tps":5.2269,"gen_tokens":99,"host_output_exact":19,"internal_free":8415,"logit_max_delta":0.00005341,"logit_top1_match":10,"min_case_tps":5.31,"prefill_tps":5.59,"psram_free":2052252,"think_tps":4.2},"status":"keep","description":"The clean trace-free acceptance session is still inside the suite, so no verdict and no re-pin. The log contains no device_output_exact, no DEVICE_OUTPUT_DIVERGED and no LANE_RC line, and still zero DIVERGE lines - where every 20-case session of this era printed two divergences for heldout_interval_one and heldout_long_tools_note_only. Absence is not evidence here: #513 established that bench.py emits its compare block only after all twenty cases, so reading the mid-suite silence as a pass would repeat the exact error I retracted that run. Speed evidence from this session stands (decode 5.5767 trace-free, one quantum from the traced 5.575 and from the no-ring 5.580/5.5817, so the lossless console RX ring costs within one metric tick), but speed alone has never been the acceptance condition. Accepted pin deliberately unchanged at 5.3033 until LANE_RC=0 plus device_output_exact appear in the log; the two possible outcomes are both decisions rather than measurements, which is why no new candidate was manufactured this iteration.","timestamp":1790270590094,"segment":1,"confidence":18.02457142857145,"asi":{"discipline":"Held off on the re-pin deliberately. The campaign's own rule is that byte-exactness is decided by the compare block, and #513 proved that inferring from partial logs is how I have twice written a wrong conclusion in this ledger. Nothing is claimed while the verdict is absent.","hypothesis":"Is the clean trace-free acceptance session finished, and does it carry device_output_exact 20/20 with LANE_RC=0?","next":"Two outcomes and both are decisions: LANE_RC=0 with 20/20 means the acceptance tree is complete and the pin moves 5.3033 -> ~5.577 on a stream with no diagnostic traffic; LANE_RC=1 with 18/20 on the two demo-timer cases means #513's pass condition holds cleanly and the owner's golden decision is the last step. Either way the ring's cost is measured as within one quantum at decode 5.5767.","state":"Not finished. No device_output_exact, no DEVICE_OUTPUT_DIVERGED, no LANE_RC line in the log, and still zero DIVERGE lines anywhere - the session is inside the suite (bench.py prints its compare block only after all twenty cases, the #513 lesson)."}}
