{"run":346,"commit":"c731be2","metric":5.03,"metrics":{"boot_bench_tps":5.076,"device_output_exact":20,"device_token_delta":0,"ext_decode_tps":4.9577,"gen_tokens":99,"host_output_exact":19,"internal_free":14903,"logit_max_delta":0.00005341,"logit_top1_match":10,"min_case_tps":4.8,"prefill_tps":5.3083,"psram_free":2052252,"think_tps":3.94},"status":"keep","description":"Harness/session-pairing correctness iteration - the fix that #345 started, now COMPLETE and validated, no rerun and no coverage expansion. decode_tps stays exactly 5.0300 (+106.0 %): serial_api.py and bench.py are HOST-side bench dependencies that never enter the flashed image, so the shipping binary and its speed are unchanged by construction. The product is that the campaign's central gate (device byte-exactness) is now trustworthy on an enlarged suite. TWO DEFECTS FIXED. (1) RESPONSE PAIRING: the firmware has no request/response framing, so any line still queued when a request is written is read back as the start of THIS reply. bench.py runs the whole suite on one attach, so one extra/missing END shifts every later case by one - run #345's smoking gun was a route prompt answered with tools-schema calls its own grammar forbids. Fix: drain_stale() (drain-with-reads, since reset_input_buffer only clears bytes nobody has read yet) before every write in serial_api.complete(). VALIDATED on device: the same three prompts that came back swapped in #345 each answered their OWN schema here (long_route -> translate_or_write, interval_one -> set_sampling_interval, note_only -> set_sampling_interval), 20/20 byte-exact. (2) THINK-MODE ACK: after ~15-20 requests in one attached session the board stops answering !think (run #155's signature, reproduced #346: 27 stale lines drained and it STILL would not ack, so it is console fatigue, not backlog). Run #345 recorded think_tps=5.02 from a toggle that never took - a constrained-path number labelled as think. Fix: check the ack VALUE, and on a missing ack do one _reconnect()+_handshake() (clears the console without resetting the chip - DTR/RTS are pinned through the open - and re-establishes readiness), then fail loudly. MEASURED: WARN think ack missing -> reconnect -> METRIC think_tps=3.94, the correct unconstrained-vocabulary rate, matching history to the digit. Device golden saved and verified: 17 pre-existing entries carried over byte-identical, 3 added, 0 changed, 0 removed. TWO SELF-INFLICTED VARIANTS tried on real boards and REVERTED because they regressed: settle-to-quiet drain (quiet 1.5 s / budget 8 s) cut the suite to 17 cases + a request timeout vs 20/20 with a fixed 1 s window; and a fatal think-ack (SystemExit, no retry) aborted the canonical run instead of recovering. Both reasons are now code comments. Off-device falsification harness added (.auto/exp28/test_pairing.py, no board): drain counts 3-then-0, _set_think drains before writing, switch_think accepts a correct ack, rescues a wrong-then-right ack via reconnect, and raises THINK_ACK_MISSING only after exactly one reconnect - and it asserted-failed twice while I wrote it, which is the point. This was explicitly the preserve-and-log-once step the operator called for: no reruns, no further coverage expansion. Next action per the OPERATOR REDIRECT is three distinct performance lanes.","timestamp":1790138483612,"segment":1,"confidence":19.910000000000018,"asi":{"candidate_tested_this_iteration":"harness/session-pairing correctness: drain-before-write in serial_api (complete() and the !think toggle) + value-checked think ack with one no-reset reconnect retry + settle-to-quiet drain tried and rejected + fatal-ack abort tried and rejected","defect_fixed_pairing":"drain_stale() before every write. Without it one extra/missing END shifts EVERY later case by one; #345 measured a route prompt answered with tools-schema calls its grammar forbids. With the fixed-window drain, the same three prompts each answered their OWN schema (long_route->translate_or_write, interval_one->set_sampling_interval), and this run is 20/20 byte-exact.","defect_fixed_think_ack":"the !think ack value is now checked, and a missing ack triggers one _reconnect()+_handshake() (no chip reset, no re-prime) before failing loudly. Measured: WARN think ack missing -> reconnect -> METRIC think_tps=3.94, the correct constrained-vocabulary rate. Without this the suite either records a bogus 5.02 (run #345) or aborts (run #346 fatal ack).","falsification":".auto/exp28/test_pairing.py drives both guards off-device: drain reports 3-then-0, _set_think drains before writing, switch_think accepts a correct ack, saves a wrong-then-right ack via the reconnect path, and fails THINK_ACK_MISSING only after exactly one reconnect. It asserted-failed twice while I wrote it, so it can actually fail.","hypothesis":"The mispairing and the missing think ack are console-backlog/session defects in the harness+bridge, not firmware inference faults. Test: drain the backlog before each write and reconnect (no reset) on a missing ack; if the board then acks think and every case answers its own schema, the hypothesis holds.","lane_note":"Board 1 stays the canonical board; this #346 was the single required preserve run. Boards 2/3 were idle and are now allocated to two NEW performance lanes; board 1 takes the third lane. The harness fix is stable and every candidate inherits it.","next":"Start three performance lanes within ten minutes per the OPERATOR REDIRECT: B1 fused/concurrent engram key+value CQ2 projections; B2 batched/interleaved Q/K/V/gate CQ2 projection scheduling across cores; B3 multi-row/two-stream CQ2 assembly schedule to hide PSRAM latency / amortize row overhead. Cheap real-byte kbench screens precede full runs. Dead lane replaced immediately.","two_variants_rejected":"settle-to-quiet drain (quiet 1.5s/budget 8s) REGRESSED the suite to 17 cases + a request timeout vs 20/20 with a fixed 1s window; and the fatal think-ack (SystemExit, no retry) aborted the canonical run. Both reverted, both reasons are code comments now."}}
{"run":347,"commit":"93d5aaa","metric":5.03,"metrics":{"boot_bench_tps":5.076,"device_output_exact":20,"device_token_delta":0,"ext_decode_tps":4.9577,"gen_tokens":99,"host_output_exact":19,"internal_free":14903,"logit_max_delta":0.00005341,"logit_top1_match":10,"min_case_tps":4.8,"prefill_tps":5.3083,"psram_free":2052252,"think_tps":3.94},"status":"keep","description":"Experiment 29 LANE 1 (board 1, kbench screen on real needle3.cact bytes, no shipping change - decode_tps is the accepted 5.0300 carried forward, kept so the bench asset survives): fusing the engram-like CQ2 pair - two 768x768 tensors that already share one prepared activation and one pair table - into a single nd_parallel_rows sweep over the concatenated row space is BIT-EXACT and worth +0.04 % (3,179,327 -> 3,178,074 cycles for 1,536 rows / 1,179,648 weights, min of 12 rounds, two-core, nd_lut2_rows_tie1n). A 64-row-block interleaved order is -0.03 %. Cycles per weight: shipping 2.6951, fused 2.6941, interleaved 2.6959. VERDICT reject: 0.04 % is well inside the campaign's measured 0.071 % three-identical-image board spread, and the mechanism the fusion was supposed to buy is already shipped - nd_model.c:1082-1102 does one nd_cq_prepare and one nd_cq_lut_build for the key/value pair, and run #344 measured the cross-core handshake at 23 cycles hot AND parked, so one job instead of two removes a cost that is not there. Two harness findings came out of this lane and both are fixed in the tree: (a) the first attempt printed asm=0 because ND_LUT2_ASM is a PRIVATE compile definition of the needle component and is therefore never visible inside kbench.c (which belongs to main), so guarding the kernel choice on it silently screens the C row walker and reports the wrong cost - the choice now follows nd_lut2_asm_ok() exactly as the shipping dispatcher does, and asm=1 confirms the TIE728 kernel ran; (b) my new integrity check reported bench_fused_in_elf=0 as if the candidate had not been compiled, but it had: it ran nm on elf_loader.elf instead of needle_demo.elf (the symbol is there and the map has .text.bench_fused) - fixed, and the console's own KB FUSE output remains the authority per #242.","timestamp":1790140712990,"segment":1,"confidence":19.910000000000018,"asi":{"candidate":"LANE 1 (board 1): fuse the engram-like pair - two 768x768 CQ2 tensors that already share one nd_cq_prepare + one nd_cq_lut_build - into ONE nd_parallel_rows sweep over the concatenated row space, instead of two per-tensor jobs. Also tested a 64-row-block interleaved order.","closed_family":"fused / concurrent / interleaved CQ2 projection scheduling. Both shapes measured on real bytes with the shipping kernel: 2-tensor pair +0.04 %/-0.03 %, 4-tensor q,k,v,gate +0.02 %/-0.08 % (lane 2, logged separately). The reason is now structural rather than guessed: nd_model.c:1464-1471 and :1082-1102 already share the prepare and the pair table, and run #344 measured the cross-core handshake at 23 cycles, so a fused job removes work that was never there.","hypothesis":"the engram key/value pair costs less as one sweep over both tensors' rows than as the shipping two sweeps, because the second sweep would start with the pair table, the activation and the tier pages already hot.","kernel_provenance":"asm=1 printed by the bench: nd_lut2_rows_tie1n, chosen by nd_lut2_asm_ok() exactly as the shipping dispatcher does. The first attempt (batch 0800L) printed asm=0 because ND_LUT2_ASM is a PRIVATE compile define of the needle component and so is never visible in kbench.c's translation unit - guarding on it silently screens the C walker and reports the wrong cost. Fixed by gating on nd_lut2_asm_ok() alone.","integrity":"bench_fused confirmed in the flashed app: xtensa-nm on needle_demo.elf has the symbol and the map has .text.bench_fused; the console printed KB FUSE lines, which is the authority (#242's rule). My first check reported bench_fused_in_elf=0 because it ran nm on elf_loader.elf; lane.sh now checks the app ELF.","next":"three new screens launched: tier LAYOUT permutation (four tensors contiguous in read order vs four allocations), attention Q.K operand reuse across positions, and cold-pass read-order sensitivity (ascending/descending/stride/random) which prices whether ANY layout permutation can pay.","result":"BIT-EXACT (mismatch=0 of 1536 rows) and +0.04 % for the fused single sweep; the row-block-interleaved order is -0.03 %. cycles/weight 2.6951 shipping vs 2.6941 fused vs 2.6959 interleaved, min of 12 rounds, two-core.","screen_only":true,"verdict":"REJECT. 0.04 % is 1/5 of the campaign's own 0.071 % three-board spread and a fifth of the 0.2 % keep bar, and the mechanism is already spent: the pair table is shared, the activation is shared, and the handshake is 23 cycles (run #344). Nothing shipped."}}
{"run":348,"commit":"93d5aaa","metric":5.03,"metrics":{"boot_bench_tps":5.076,"device_output_exact":20,"device_token_delta":0,"ext_decode_tps":4.9577,"gen_tokens":99,"host_output_exact":19,"internal_free":14903,"logit_max_delta":0.00005341,"logit_top1_match":10,"min_case_tps":4.8,"prefill_tps":5.3083,"psram_free":2052252,"think_tps":3.94},"status":"keep","description":"Experiment 29 LANE 2 (board 2, kbench, real archive bytes, no shipping change; decode_tps is the accepted 5.0300 carried forward): the operator's direction (B) - batch/interleave the independent Q/K/V/gate CQ2 projections across cores instead of paying sequential barriers - measured on the REAL row counts (576/96/128/768 x 768, one shared activation and pair table exactly as nd_model.c:1464-1471 already shares them). One fused nd_parallel_rows sweep over the concatenated 1,568-row space: +0.02 % (3,267,708 -> 3,267,149 cycles, 1,204,224 weights, 2.7135 -> 2.7131 cyc/weight, min of 12 rounds, two-core, nd_lut2_rows_tie1n, asm=1). A 64-row-block interleaved order: -0.08 % (2.7158). BIT-EXACT, mismatch = 0 of 1,568 rows. Verdict REJECT - with lane 1's +0.04 %/-0.03 % on the 768+768 engram pair this closes the fused/interleaved CQ2 scheduling family on measurement: the activation and pair table are already shared, the cross-core handshake is 23 cycles (#344), and every ordering variant lands inside the campaign's own 0.071 % three-board spread. My specific worry - that k(96) and v(128) give each core only 48/64 rows and so stream the tier badly - is answered by the fused sweep itself, which hands each core a contiguous 784-row half spanning all four tensors and changes nothing.","timestamp":1790140818897,"segment":1,"confidence":19.910000000000018,"asi":{"candidate":"LANE 2 (board 2): the real per-layer attention projection set q(576)+k(96)+v(128)+gate(768) rows, 768 columns, one activation and one pair table shared as shipping already shares them, measured (a) as the shipping four nd_parallel_rows jobs, (b) as one fused sweep over the concatenated row space, (c) as a 64-row-block interleaved order.","changed_assumption":"None invalidated. Lanes 1/2 are the operator's named directions (A) and (B) and both close on measurement, so no earlier discard needs revisiting: nothing here makes a previously rejected residency or clock idea cheaper.","hypothesis":"the small k(96) and v(128) tensors are the weak link: each half-split gives a core only 48/64 rows, so four sequential jobs may stream the PSRAM tier worse than one sweep over 1568 rows.","next":"the remaining lever for the 13.90 % cold PSRAM delivery tax is where the bytes ARE, not how they are called: (1) tier LAYOUT permutation - four CQ2 tensors contiguous in one buffer in per-token read order vs four allocations; (2) attention Q.K operand reuse across positions; (3) cold-pass read-order sensitivity (ascending/descending/stride/random), which prices whether ANY layout permutation can pay.","result":"1,568 rows / 1,204,224 weights, bit-exact mismatch=0, min of 12 rounds, two-core, nd_lut2_rows_tie1n (asm=1): shipping four jobs 3,267,708 cycles (2.7135 cyc/weight), fused one sweep 3,267,149 (2.7131) = +0.02 %, 64-row interleaved 3,270,449 (2.7158) = -0.08 %.","small_tensor_concern":"tested and answered: if the 48-row and 64-row halves were the problem, the fused sweep - which gives each core a contiguous 784-row half across all four tensors - would have shown it. It shows 0.02 %, so small-job granularity is not a cost at 23-cycle handshakes.","verdict":"REJECT, and with lane 1 it closes the fused/interleaved CQ2 scheduling family (the operator's directions A and B) on measurement: the shared prepare and pair table are already shipped (nd_model.c:1464-1471, :1082-1102), the handshake is 23 cycles (#344), and every ordering variant lands inside the 0.071 % board spread."}}
{"run":349,"commit":"93d5aaa","metric":5.03,"metrics":{"boot_bench_tps":5.076,"device_output_exact":20,"device_token_delta":0,"ext_decode_tps":4.9577,"gen_tokens":99,"host_output_exact":19,"internal_free":14903,"logit_max_delta":0.00005341,"logit_top1_match":10,"min_case_tps":4.8,"prefill_tps":5.3083,"psram_free":2052252,"think_tps":3.94},"status":"keep","description":"Experiment 29 LANE 3 (board 3, kbench, real archive bytes, no shipping change; decode_tps is the accepted 5.0300 carried forward): the operator's direction (C) - does a multi-row / two-stream CQ2 schedule have anything to amortize? Priced with a rows-per-call curve instead of writing assembly first. One 768x768 CQ2 tensor (tensor 10, in_pad 768, row_bytes 192), shipping nd_lut2_rows_tie1n (asm=1), real needle3.cact bytes staged into PSRAM as the tier stages them, min of 12 rounds: cycles per output row = 2105.914 at 1 row/call, 2081.173 at 2, 2069.918 at 4, 2064.302 at 8, 2061.486 at 16 - total spread 2.16 %, marginal gain per doubling -1.17 %/-0.54 %/-0.27 %/-0.14 %, i.e. a converged curve with an asymptote around 2058 cyc/row. Verdict CLOSED without building: nd_parallel_rows already hands the kernel a contiguous [r0,r1) range, so the shipping call already sits at the far right of this curve; the 2.16 % belongs to a calling convention (one row per call) the firmware does not use, and the extrapolated benefit of a perfect two-row kernel is 0.17 % of the phase = +0.07 % decode, a third of the keep bar. This is the third independent confirmation that the dominant CQ2 phase is at its instruction floor: instruction count (2 per weight, #144-145), external clock (a 50 % wider MSPI moves the whole token 3.51 %, #289), and now per-row overhead (2.16 % from 1 to 16 rows, and 0.14 % over the last doubling).","timestamp":1790140865930,"segment":1,"confidence":20.566547477155233,"asi":{"candidate":"LANE 3 (board 3): the operator's direction (C) - a multi-row / two-stream CQ2 assembly schedule that hides PSRAM latency or amortizes row overhead. Priced before writing any assembly, by measuring the cost of one output row as a function of rows-per-call on the dominant 768x768 CQ2 tensor with the shipping kernel.","converged_curve":"1->2 rows -1.17 %, 2->4 -0.54 %, 4->8 -0.27 %, 8->16 -0.14 %. Extrapolated asymptote ~2058 cyc/row, i.e. 0.17 % below the 16-row value. A perfect two-row kernel therefore buys <=0.17 % of proj2bit = 0.147 ms = +0.07 % decode, under a third of the keep bar. That is why no assembly was written: the measurement retires the design, not an opinion about it.","hypothesis":"row overhead per call is large enough that a multi-row / two-stream schedule could amortize it, which is the operator's direction (C) and the last unpriced structural idea for the dominant phase.","invalidates_previous_discard":"No. It strengthens the closures: the per-row cost curve is converged, so the two-row LUT blocking null (-5.1 %), the 4-row null (-5 %) and the ~25 scheduling nulls all sit where the curve says there is nothing left to amortize.","next":"layout, not scheduling: (1) four CQ2 tensors contiguous in ONE PSRAM buffer in per-token read order vs four allocations (the layout version of lanes 1/2, and the only untested way to change what the 13.90 % cold tax is paying for); (2) attention Q.K operand reuse across positions (q held over K rows) - 8.3 ms of dots is the largest non-GEMV mass; (3) cold-pass read-order sensitivity (ascending / descending / stride 4/16/64 / random) which prices whether ANY permutation of bytes can pay, gating (1)'s family.","result":"cyc/row for one 768x768 CQ2 tensor, nd_lut2_rows_tie1n (asm=1), real archive bytes, min of 12 rounds: rows/call 1 = 2105.914, 2 = 2081.173, 4 = 2069.918, 8 = 2064.302, 16 = 2061.486. Total spread 2.16 %, and the marginal gain per doubling collapses -1.17 % / -0.54 % / -0.27 % / -0.14 %, i.e. a converged curve.","shipping_already_amortized":"nd_parallel_rows hands the kernel a contiguous [r0,r1) range, so the shipping call is already the far right of the curve (~384 rows per core). The 2.16 % is the cost of the WORST possible calling convention, not a budget a new kernel can collect.","verdict":"REJECT / CLOSED before building: the amortization prize is 0 %, because shipping already passes ranges, and even the un-collectable 2.16 % of proj2bit (86.2 ms) would be 1.9 ms = +0.94 % only if the kernel were calling once per row, which it is not."}}
