{"run":477,"commit":"b7c1f2d","metric":5.3033,"metrics":{"boot_bench_tps":5.343,"device_output_exact":20,"device_token_delta":0,"ext_decode_tps":5.2269,"gen_tokens":99,"host_output_exact":19,"internal_free":13367,"logit_max_delta":0.00005341,"logit_top1_match":10,"min_case_tps":5.07,"prefill_tps":5.59,"psram_free":2052252,"think_tps":4.2},"status":"keep","description":"Prepared the experiment that unblocks acceptance rather than repeating a closed one: .auto/exp86/README.md contains a diagnostic-only discriminator for the console stall that has blocked the 20-case byte-exactness gate for nine sessions (16,16,16,17,17,17,17 with zero divergences). A 200 ms counter task plus one extra emit line answers the only question that separates the two surviving mechanisms - console TX stuck (per-event fflush on UART0-backed stdout, #475 suspect) versus RX/reader stuck (#418 measured the app emit counters frozen at chars=816 lines=17 while the host kept reading) - with an unambiguous decision rule, and records the harvest constraints the campaign already paid for (run as a lane so priming happens, drive via serial_api.Device with DTR asserted, use the wrapper's per-board port variables, reset with the console closed). No device run this window and no measurement claimed: gate retries are a scheduler error (#442, #474), the accepted image is refused by its own anti-repeat guard by design, and every performance family has a measured closure. Accepted runtime unchanged at 5.3033.","timestamp":1790260769580,"segment":1,"confidence":18.45598194130924,"asi":{"changed_assumption":"None; preparation, not measurement.","hypothesis":"The stall is either console TX refusing bytes or RX refusing input, and the two imply different fixes. A 200 ms counter task printed with the per-request emit count separates them: if it keeps advancing after the last EVT done the reader is the suspect, if it stops with the emission the write path is stuck.","measurement":"None this window - no device run, so nothing is claimed and the pin stays 5.3033. Discriminator committed at .auto/exp86/README.md with code, decision rule, and the harvest facts it must respect (run as a lane for priming, drive via serial_api Device with DTR asserted, use wrapper port variables, reset with console closed).","next":"Run exp86 as one lane with a driver sending at least 20 requests, read tbeat against the last EVT done, then fix either the reader or bound the console emit. After that the 20-case gate, the coverage save and the re-pin to roughly 5.56 all become reachable.","why_not_a_run":"Every other route is closed or forbidden: gate retries are a scheduler error per 442 and 474, the accepted image is refused by its own anti-repeat guard by design, dispatch is priced out at 275 splits per token, the phase map matches its floors, norm conversion is exhausted in both kernels, and the transcendental, call-surface, tap, attention and memory families all carry measured closures."}}
{"run":478,"commit":"daa073d","metric":5.3033,"metrics":{"boot_bench_tps":5.343,"device_output_exact":20,"device_token_delta":0,"ext_decode_tps":5.2269,"gen_tokens":99,"host_output_exact":19,"internal_free":13367,"logit_max_delta":0.00005341,"logit_top1_match":10,"min_case_tps":5.07,"prefill_tps":5.59,"psram_free":2052252,"think_tps":4.2},"status":"keep","description":"exp86 console-stall discriminator built and launched on board 2 as a diagnostic image (runner-asserted engine_md5=daa073d02cce; new signature, so no anti-repeat override was required): a core-1 heartbeat task bumping a counter every 200 ms plus one \"EVT tbeat <n>\" emit per request, so the last counter value can be dated against the last EVT done when a session stalls at 16-17 cases. Four loud, assertion-backed failures while generating the patch, all of them the generator refusing rather than the tree being silently wrong: a regex that assumed app_main was static, a Python % format collision with the printf format string, a sed that matched nothing, and a real ordering bug where the declarations landed after both use sites (caught from line numbers before launch, would have been a device compile error) - fixed by inserting after the last #include and verifying decl@42 precedes uses@164,323. Disclosed design gap: the tbeat print is per-request, not periodic from the task, so a first harvest can show whether requests keep completing but cannot alone prove the task survived the stall; the periodic form follows if the result is ambiguous. No measurement read yet and no speed claim (diagnostic image), accepted runtime unchanged at 5.3033.","timestamp":1790260915901,"segment":1,"confidence":17.523576240048943,"asi":{"changed_assumption":"None; diagnostic run in flight, no speed claim (a diagnostic image is never measured for tok/s, run 410).","design_gap_disclosed":"As built, the tbeat line is emitted once per request from the request loop, not periodically from the heartbeat task, so the harvest shows whether the app is still completing requests but cannot by itself prove the heartbeat task kept running during the stall. The README design (print from the task) is the stronger form; I launched the weaker form to validate the toolchain path and will add the periodic emit if the first harvest is ambiguous rather than over-reading a weak signal.","hypothesis":"exp86 discriminator: after the mid-suite console stall, is the app stopped in its own emission (TX suspect, main.c per-event fflush on UART0-backed stdout) or is the request/read path at fault? A core-1 heartbeat counter bumped every 200 ms is printed with each request so the last visible counter value is dated against the last EVT done.","measurement":"Nothing read yet: the lane was launched minutes ago (runner-asserted engine_md5 daa073d02cce, a new image so no anti-repeat override was needed) and build plus two-prefix priming runs about seven minutes before the first case. Accepted runtime unchanged at 5.3033.","toolchain_friction":"Getting the patch applied took four attempts, and every failure was loud rather than silent, which is the point of a generator with assertions: an app_main regex that assumed a static qualifier, a Python percent-format collision with the printf format string, a wrong-line sed that matched nothing, and then a real ordering bug caught by inspecting line numbers - the declarations first landed after both use sites, which the device compiler would have rejected. Fixed by inserting after the last include and verifying declaration line 42 precedes use lines 164 and 323 before launching.","next":"Read M-tbeat-b2.log next window: the sequence of EVT tbeat values against the case count and the stall point. If tbeat advances per request right up to the stall and then stops with the last EVT done, the app is not completing requests, which points at the request path rather than TX; ambiguous result means moving the print into the heartbeat task for a genuinely periodic signal."}}
{"run":479,"commit":"daa073d","metric":5.3033,"metrics":{"boot_bench_tps":5.343,"device_output_exact":20,"device_token_delta":0,"ext_decode_tps":5.2269,"gen_tokens":99,"host_output_exact":19,"internal_free":13367,"logit_max_delta":0.00005341,"logit_top1_match":10,"min_case_tps":5.07,"prefill_tps":5.59,"psram_free":2052252,"think_tps":4.2},"status":"keep","description":"Diagnostic lane is in its priming window, so no measurement is claimed - but reading the applied patch surfaced two facts about my own instrument that are disclosed rather than discovered later: the \"EVT tbeat\" line landed inside the per-token echo loop, so it fires once per emitted token (finer resolution than the designed per-request print) and it injects roughly a dozen bytes per token into the same stdout stream the harness byte-compares. Consequences: this image cannot produce byte-exact text (fine for a diagnostic, bench.py will exit 1 at the end), and the extra console traffic could itself move the stall earlier if the true mechanism is TX saturation - in which case the experiment is confounded and must be reported as such, not as a clean result. Lane state: build 15 s, flash 6 s, engine_md5 daa073d02cce asserted by the runner, app md5 9863a5c96d1b, zero cases and zero heartbeat lines at read time. Accepted runtime unchanged at 5.3033.","timestamp":1790260962177,"segment":1,"confidence":17.523576240048943,"asi":{"changed_assumption":"None; diagnostic in flight, no speed or quality claim.","hypothesis":"Read the heartbeat sequence at the stall - does the app stop emitting mid-request (TX suspect) or stop completing requests (request-path suspect)?","instrument_placement_found":"The inserted line landed inside the per-token echo loop, so it prints once per emitted token rather than once per request. That is higher resolution than designed - the last visible counter before the stall is dated to a single token - but it has two consequences I must not hide: the extra bytes enter the same stdout stream the harness compares, so this image cannot produce byte-exact text (harmless for a diagnostic, but bench.py will report divergences and exit 1 at the end), and it inflates console traffic by roughly a dozen bytes per token, which can itself move the stall earlier if the mechanism is TX saturation. Both are read from the source, not inferred from a number.","measurement":"Nothing yet: the lane finished build (15 s) and flash (6 s) and is inside the roughly five-minute two-prefix priming window, with zero heartbeat lines and zero cases emitted when read. The engine identity the runner asserted is daa073d02cce and the flashed app md5 is 9863a5c96d1b.","next":"Next window read the tail of M-tbeat-b2.log around the stall: if heartbeat values keep advancing between tokens right up to the last line and then stop together with the token stream, that is the emission-path picture; if the app is still answering later requests it is the request path. If the added bytes make the stall arrive notably earlier than the 16-17 request baseline, that is itself evidence for the TX-saturation hypothesis and must be reported as confounded rather than clean."}}
{"run":480,"commit":"daa073d","metric":5.3033,"metrics":{"boot_bench_tps":5.343,"device_output_exact":20,"device_token_delta":0,"ext_decode_tps":5.2269,"gen_tokens":99,"host_output_exact":19,"internal_free":13367,"logit_max_delta":0.00005341,"logit_top1_match":10,"min_case_tps":5.07,"prefill_tps":5.59,"psram_free":2052252,"think_tps":4.2},"status":"keep","description":"The exp86 heartbeat instrument is VACUOUS and the honest finding beats the hoped-for one: zero \"EVT tbeat\" lines and zero \"TOK\" lines in a log with 19 completed cases, because the per-token echo block I patched is the think/debug path and the suite runs with think off - my own positive control (TOK had to appear alongside tbeat) proved it in one grep. Second finding, deliberately not over-read: this boot reached 19 of 20 cases with no stall, against the 16-17 ceiling observed seven times on the accepted image; the only functional difference is a core-1 task waking every 200 ms at priority 3, and the ceiling's boot-to-boot spread has never been measured, so one reading on a different image cannot separate a scheduling effect from ordinary variance. Fix queued: emit from the heartbeat task itself (periodic, and the stronger discriminator) or beside the per-request EVT done line. No speed claim (diagnostic image); accepted runtime unchanged at 5.3033.","timestamp":1790261240497,"segment":1,"confidence":17.523576240048943,"asi":{"changed_assumption":"None; this is the instrument failing, not the model.","hypothesis":"Does the heartbeat counter discriminate TX-stuck from request-path-stuck at the stall?","measurement_two_findings":"First, the instrument is vacuous: zero tbeat lines AND zero TOK lines in a log that has 19 completed cases, so the code block I inserted into is not executed in this configuration (it is the think/debug echo path, and the suite runs with think off). Sixth vacuous-probe instance in this campaign, caught by the positive control TOK which had to appear alongside tbeat if the path ran. Second, and not to be over-read: this boot completed 19 of 20 cases with no stall, against the 16-17 ceiling seen seven times on the accepted image - but the only functional difference is a core-1 task waking every 200 ms at priority 3, and the ceiling has never been characterised as boot-to-boot variance, so one differing-image reading cannot separate a scheduling effect from ordinary spread.","next":"Move the heartbeat emit to a path that definitely runs - print from the heartbeat task itself every N ticks, or beside the per-request EVT done line - and re-harvest; that gives a periodic signal that is also the stronger discriminator. Record the 19-case reading as a reason to run the accepted image's own ceiling distribution only if it is ever permitted, never as a speed claim: a diagnostic image is never measured for tok/s.","note":"The diagnostic image is still running its remaining cases; the byte-exactness gate will fail for it by design and that is expected, not a regression."}}
{"run":481,"commit":"d07855b","metric":5.3033,"metrics":{"boot_bench_tps":5.343,"device_output_exact":20,"device_token_delta":0,"ext_decode_tps":5.2269,"gen_tokens":99,"host_output_exact":19,"internal_free":13367,"logit_max_delta":0.00005341,"logit_top1_match":10,"min_case_tps":5.07,"prefill_tps":5.59,"psram_free":2052252,"think_tps":4.2},"status":"keep","description":"Fixed the vacuous instrument and relaunched: the heartbeat now prints EVT hb from the core-1 task itself every 2 s (every tenth 200 ms tick) instead of from a think-guarded per-token echo block, so it emits regardless of the request path - which is what makes it a real discriminator between console-TX stuck and request/reader stuck. Verified by counts before building (one hb emit, zero tbeat emits), runner-asserted provenance d07855bef575, build_s=14, lane alive. Also diagnosed my own launch flake honestly: the first new-session + send-keys produced no session and no log, my stale-lock theory was wrong (pgrep showed zero board processes and a synchronous needle-board run 2 -- true returned clean, tmux server healthy), and the fix is to pass the command inline to new-session -d -s. No measurement read yet; accepted runtime unchanged at 5.3033.","timestamp":1790261374994,"segment":1,"confidence":17.523576240048943,"asi":{"changed_assumption":"The instrument's emit site moved from a think-guarded per-token block to the heartbeat task itself, which runs unconditionally - that is the changed premise the previous window's vacuous result demanded.","hypothesis":"A periodic heartbeat printed from a core-1 task every 2 s discriminates the two surviving stall mechanisms where the per-request form could not: if hb lines keep advancing after the last EVT done the app is alive and the request or reader path is at fault; if they stop with the emission the console write path is stuck.","instrument_fix":"Replaced the task body so it prints every tenth tick, deleted the per-token line, and asserted the resulting counts (one hb emit, zero tbeat emits) before building. Provenance is runner-asserted as d07855bef575 and build_s=14 in the lane's own log.","launch_flake_diagnosed":"The first launch produced no session and no log file. I checked the stale-lock theory first and it was wrong: pgrep showed no needle-board, measure.sh, bench.py or serial_api process, and a synchronous needle-board run 2 -- true returned cleanly, and tmux ls plus a probe session showed the server healthy. The real cause was the new-session then send-keys race losing the command line, so the retry passes the command inline to new-session -d -s, which started correctly. Recorded because the previous lesson in this ledger about vanished lanes was kill-server, and this is a different failure with a different fix.","next":"Read M-hb-b2.log next window: the hb sequence across the stall point, plus whether this image again reaches 19 or 20 cases (a core-1 task waking every 200 ms is the only functional difference from the accepted image, so a repeated long session would be a hint about the stall's mechanism - sensitivity to a periodic core-1 wake points at scheduling or console buffering, not at the inference path). No speed claim from a diagnostic image."}}
{"run":482,"commit":"d07855b","metric":5.3033,"metrics":{"boot_bench_tps":5.343,"device_output_exact":20,"device_token_delta":0,"ext_decode_tps":5.2269,"gen_tokens":99,"host_output_exact":19,"internal_free":13367,"logit_max_delta":0.00005341,"logit_top1_match":10,"min_case_tps":5.07,"prefill_tps":5.59,"psram_free":2052252,"think_tps":4.2},"status":"keep","description":"The fixed heartbeat instrument WORKS, verified before any interpretation: 82 periodic heartbeat lines from the core-1 task are interleaved with harness output and advancing while cases complete (7 of 20 reached, last case calls_ok=1), where #480's per-token form printed nothing at all. Disclosed reading detail: the printed number is the raw 200 ms tick count (EVT hb 340 = 68 s of task uptime), and the task starts at splitter-worker creation, so its zero point is not boot - quoting the cadence matters or the next window will mis-date the stall. No stall reached yet, so the discriminating observation (does EVT hb keep advancing after the last completed request?) is still pending. No speed claim: this is a diagnostic image and the 5.93 visible in its log is not a measurement. Accepted runtime unchanged at 5.3033.","timestamp":1790261607194,"segment":1,"confidence":17.523576240048943,"asi":{"changed_assumption":"The emit site moved to the unconditional core-1 task, so the instrument now runs; that is the changed premise that justified re-running the experiment (#480's vacuous form printed from a think-guarded block).","hypothesis":"Does the periodic core-1 heartbeat keep reaching the console after the app stops completing requests? If yes the console TX path and the scheduler are fine and the request/reader path is at fault; if the heartbeat stops with the last EVT done, the write path is stuck.","measurement":"The instrument is live and honest this time: 82 heartbeat lines are interleaved with the harness output and advancing while cases complete (7 cases reached, the last printing calls_ok=1 for set_sampling_interval). Note the printed value is the raw tick count, so EVT hb 340 is 68 s of task uptime, not 340 s - the task starts where the splitter worker is created, which is after model open, so the counter's zero point is not boot. No stall reached yet, so the discriminating observation is still pending.","next":"Wait for the stall (historically 16-17 cases, so roughly another ten to twenty minutes with the slow extended cases) and read the tail: if EVT hb lines continue past the last completed case, the finding is that TX and core 1 are alive and the reader or request path is the suspect, which points the owner at the line reader and its DTR/EOF handling rather than at the emit path; if hb stops with the emission the write path is the suspect. Either way the counter's zero point and the 2 s cadence must be quoted so the timing is read correctly, and no tok/s is claimed from this diagnostic image.","note":"The decode value visible in the log (5.93) belongs to a diagnostic image carrying an extra core-1 task and is not a speed claim - run 410's rule."}}
{"run":483,"commit":"d07855b","metric":5.3033,"metrics":{"boot_bench_tps":5.343,"device_output_exact":20,"device_token_delta":0,"ext_decode_tps":5.2269,"gen_tokens":99,"host_output_exact":19,"internal_free":13367,"logit_max_delta":0.00005341,"logit_top1_match":10,"min_case_tps":5.07,"prefill_tps":5.59,"psram_free":2052252,"think_tps":4.2},"status":"keep","description":"The heartbeat discriminator produced a real result at the stall: session stopped at 17/20 cases with LANE_RC=1, and ZERO heartbeat lines appear after the last completed case while the harness kept reading and eventually timed out. That refutes the strong reader-only theory - the device's ability to emit stops entirely, core-1 task included, matching run #418's frozen emit counters (chars=816, lines=17) rather than a host-side line-reader fault. But it does not close: a competing explanation implicates a shipped lever, since the spin handshake (#453) makes the core-1 splitter worker poll at priority above this priority-3 heartbeat, so a worker stuck spinning would both starve the heartbeat and stop requests. Next discriminator: pin the heartbeat to core 0. No speed claim; diagnostic image; accepted runtime unchanged at 5.3033.","timestamp":1790262305466,"segment":1,"confidence":17.523576240048943,"asi":{"alternative_still_open":"TX stuck versus core-1 starved is not separated, and the alternative implicates a shipped lever: the spin handshake of run 453 makes the core-1 worker poll at priority above this priority-3 heartbeat, so a worker stuck spinning would both starve the heartbeat and stop requests. Next discriminator: pin the heartbeat to core 0, which the splitter cannot starve.","decisive_datum":"last heartbeat line 404, last case line 411, log 436 lines; last heartbeat value 620 ticks = 124 s of task uptime.","hypothesis":"Does the periodic core-1 heartbeat keep reaching the console after the app stops completing requests?","measurement":"Stall reproduced at 17 of 20 cases, LANE_RC=1, and the heartbeat does not survive it: zero heartbeat lines after the last completed case while the harness kept reading and finally timed out. The strong reader-only theory is therefore refuted - the device stops being able to emit at all, matching run 418's frozen emit counters.","next":"Rebuild with the heartbeat pinned to core 0. If it also stops, the write path is the sole suspect and the fix is a bounded or deferred console emit rather than per-event fflush. Diagnostic image, no speed claim, pin unchanged at 5.3033."}}
