{"run":330,"commit":"de9d992","metric":5.0117,"metrics":{"boot_bench_tps":5.057,"device_output_exact":17,"device_token_delta":0,"ext_decode_tps":4.939,"gen_tokens":99,"host_output_exact":16,"internal_free":15215,"logit_max_delta":0.00005341,"logit_top1_match":10,"min_case_tps":4.79,"prefill_tps":5.2867,"psram_free":2052252,"think_tps":3.93},"status":"keep","description":"Experiment 20 (CQ2 residency under assertion-reclaimed RAM): MEASURED and CLOSED, no candidate, shipping image untouched at 5.0117 - the metric here is the carried-forward accepted runtime, NOT a measurement (no board ran the shipping image; the redirect and the exit-42 guard both forbid it, and there was no candidate to batch a control against). Step 1 retired the premise: run #204 is the NEEDLE_LUT2_ASM=OFF ablation (4.3117 vs 4.8917), no +3.8 %/10.4 KiB residency variant exists in any commit, and the 24,576 B pair table has always been internal RAM (nd_model.c:642 + ND_ALLOC_FAST = MALLOC_CAP_INTERNAL). Rebuilt the residency construction that does exist (kbench blob_int), made it buildable (GDMA half behind ND_KBENCH_GDMA=0; removed the bare -lesp_hw_support link line that made NEEDLE_KBENCH=ON unbuildable - a shipping configure never enters that branch) and made it honest: cold modes plus row-for-row equality, both boards bit-exact (96/96, 128/128 blob_int for all five kernels incl. shipping tie1n; 768/768, 576/576, 128/128 for the table-in-PSRAM copy), and the real-capture host fixture still replays 256/256 bit-exact. Cold kbench, boards 2+3, min of 25 rounds, real archive bytes: every cold PSRAM pass costs 42.93-42.94 cyc/word whatever its shape, internal-RAM operands 37.69-37.70 whatever its shape => a flat 13.90 % PSRAM delivery tax on every 2-bit pass = +6.0 % decode ceiling (not +3.8 %), and the warm isolated/blob_int agreement (173,713 both) was cache warmth, exactly #295's phi trap. Taking the pair table OUT of internal RAM costs +14.3 % (768 rows) to +31.9 % (96 rows) - the first number ever put on the residency the build already ships. Uncollectable: 3.59 MB/token of 2-bit weights vs 6,200 B (level 1) / 8,248 B (level 0), and the per-token-copy form is #287's measured -17.9 % (shared octal bus, 1.42 M-cycle invalidate). Two ordering bugs in the new bench code were caught by its own differential check before any number was used.","timestamp":1790095762749,"segment":1,"confidence":19.769230769230788,"asi":{"bitexact":"blob_int rows bit-exact for all 5 kernels (96/96, 128/128) on boards 2 and 3; pair_table_in_psram bit-exact 768/768, 576/576, 128/128; host real-capture fixture 256/256 bit-exact (re-ran .auto/exp14_screen.c against .auto/exp14/decode.bin.gz).","harness_facts":["ESP-IDF images are NOT byte-comparable across checkouts: assert __FILE__ strings carry the checkout path, and /workspace/esp32-needle-3 vs /root/board-pool/boardN differ in length => header segment sizes at 48-121 differ; plus a 32-byte build id at offset 176 and the MD5 footer. Two same-length checkouts differ by exactly 65 bytes (build id + footer). Hash-compare within one checkout only.","NEEDLE_KBENCH=ON builds again: kbench.c's esp_cache.h/esp_async_memcpy.h users are behind ND_KBENCH_GDMA (default 0) and the bogus target_link_libraries(esp_hw_support) is deleted. A shipping configure never enters the if(NEEDLE_KBENCH) branch.",".auto/kbench_build.sh now logs to /tmp/kb-<variant>-<board>.log so two boards can build concurrently (shared /tmp/kb-asm.log was a collision).","measure.sh's shipping signature includes esp32/main/kbench.c, so a bench-only edit changes the signature even though the shipping image cannot change. Known loophole in the anti-repeat guard; deliberately not exercised."],"hypothesis":"Assertion-level-1's reclaimed 6,200 B makes the '4-row CQ2 LUT residency (+3.8 % kbench, 10.4 KiB, run #204)' collectable. Tested by recovering the construction, not by trusting the summary.","measured_cyx_per_word":"cold PSRAM 42.93/42.94 (all shapes, == warm for blobs > cache); internal RAM 37.69/37.70 (all shapes); table-in-PSRAM 49.06 (768) / 56.64 (96). Cold blob_int bought +13.87 % (128 rows) / +13.90 % (96 rows); table-out-of-internal cost +14.3 %/+14.6 %/+24.0 %/+31.9 %.","next_action_hint":"Experiment 21: make the 120 MHz result reliability-testable, do NOT re-measure its +3.51 %. Build the safest supported 120 MHz variant (IDF_EXPERIMENTAL_FEATURES + SPIRAM_TIMING_TUNING_POINT_VIA_TEMPERATURE_SENSOR, which cost 1,184 B of the 15,215 B internal heap - the reason assertion level 1/0 matters here too), then memory-integrity + hot/cold thermal-soak on two boards. Keep 80 MHz as the default unless the stability campaign passes.","open_idea_banked":"The CQ2 delivery tax (13.90 % of the phase, ~6 % of decode: 42.94 vs 37.70 cyc/word) is now the largest single measured prize, with its two failed collection mechanisms named (#287 copy-into-internal -17.9 %, tier/L1-residency already closed). Remaining routes are external bandwidth (owner's 120 MHz decision) or fewer bytes (frozen quantisation). Do not re-open kbench residency variants; they are measured.","verdict":"PREMISE RETIRED + real ceiling measured. Run #204 is a different experiment (LUT2 asm ablation). The pair table is already internal RAM. The measured residency prize is 13.90 % of EVERY 2-bit pass = +6.0 % decode, needing 3.59 MB resident (172x the level-1 reclaim) or a per-token copy that #287 measured at -17.9 %. No candidate exists to measure."}}
{"run":331,"commit":"e3f6bba","metric":5.0117,"metrics":{"boot_bench_tps":5.057,"device_output_exact":17,"device_token_delta":0,"ext_decode_tps":4.939,"gen_tokens":99,"host_output_exact":16,"internal_free":15215,"logit_max_delta":0.00005341,"logit_top1_match":10,"min_case_tps":4.79,"prefill_tps":5.2867,"psram_free":2052252,"think_tps":3.93},"status":"keep","description":"Experiment 21 - make the measured 120 MHz result reliability-testable: MEASURED and CLOSED as BLOCKED BY VENDOR SUPPORT, no shipping inference change. decode_tps is NOT a new speed result: it is 5.0117 re-measured twice this cycle (boards 1 and 3) on a tree that already carried the Experiment-21 diagnostic with its option OFF - 17/17 device + 16/16 host byte-exact, golden_missing=0, token_delta 0, fidelity 5.341e-05, top1 10/10, internal_free 15,215, psram_free 2,052,252, boot bench 5.057, min_case 4.79. That invariance is the proof the kept instrumentation is free, and the reason this line is kept at zero speed rather than discarded (it would otherwise revert the instrument).\n\nKEPT, DEFAULT OFF so no shipping image can move: esp32/main/thermal_diag.c + CMake option NEEDLE_THERMAL_DIAG + a 6-line hook in app_main before nd_model_open. Every 5 s it prints die temperature (IDF temperature_sensor install/enable/get_celsius), a CRC32 (esp_rom_crc32_le, no new dependency) over a live 256 KiB PSRAM buffer and both heaps - PSRAM corruption and the temperature axis in one line. Verified live on device: TDIAG celsius=24.3..31.0 psram_crc stable psram_crc_bad=0. Drivers kept in .auto/exp21/ (boot_capture, heat, soak, soak_only, flash_boot_soak) plus three sdkconfig fragments.\n\nTHE BLOCKER, measured on two boards rather than quoted. Fresh configure with SPIRAM_SPEED_120M + ESPTOOLPY_FLASHFREQ_120M + FLASHMODE_QDO + IDF_EXPERIMENTAL_FEATURES plus IDF's documented mitigation SPIRAM_TIMING_TUNING_POINT_VIA_TEMPERATURE_SENSOR (+MEASURE_A_REALISTIC_POINT): PSRAM comes up normally (Found 16MB, Speed: 120MHz, SPI SRAM memory test OK, 16384K pool) and then the app aborts in secondary init - \"E MSPI Timing: The flash model has not been verified support this feature, please contact espressif business support\", \"E cpu_start: init function 0x4037e958 has failed (0x106), aborting\", abort() at PC 0x42002620, then Rebooting forever. 0x106 = ESP_ERR_NOT_SUPPORTED and addr2line names the function: __esp_system_init_fn_psram_adjust_timing_point_via_temperature at esp_hw_support/mspi_timing_tuning/port/esp32s3/mspi_timing_by_mspi_delay.c:882, called from do_system_init_fn (esp_system/startup.c:135). Reproduced on board 2 (build_r120, backtrace captured) and board 1 (build_safe, md5 a4b713ca: never reached EVT READY, 16 corrupt/rebooting lines in 120 s, zero bytes over a 10-minute load attempt). IDF itself refuses the temperature retune for this flash model and a refused init is fatal, so there is no bootable safe-120-MHz image to soak.\n\nECC, the other safety lever, does not fit either: SPIRAM_ECC_ENABLE on octal PSRAM leaves psram_free 697,476 where the same diagnostic build without ECC reported 1,789,984 at the same boot stage (~1.09 MB of parity) and with ECC the firmware printed ERR prefix_cache_allocation after priming. No room for ECC at this model/context size.\n\nAnd a self-heating soak could not have covered the risk even if it booted: the die swings ~5 C under the ~40 s prefix priming (24.3 -> 31.0 C) while IDF's stated failure axis is a ~20 C swing from the power-on temperature in either direction - four times what this workload does to itself. Disposition: 80 MHz stays the production default on measured grounds; the +3.51 % stays a forbidden diagnostic; reopening needs a verified flash timing model from Espressif, which is exactly what the error text names as the gate.\n\nFOUR HARNESS FACTS, each bought with board time: (1) idf.py -DCONFIG_X=y does NOT change a Kconfig value while esp32/sdkconfig exists - this cycle's first \"ECC\" and first \"120 MHz\" builds were silently still 80 MHz with ECC off, telltale \"Boot SPI Speed : 80MHz\"; the supported route is sdkconfig.defaults + delete sdkconfig + fresh -B, then verify in the generated sdkconfig. (2) /dev/ttyACM0 and /dev/ttyACM1 are BOARD 1's aliases: three concurrent \"board\" runs using them all drove one chip while two reported port busy; the pool gives per-board nodes only via $FLASH_PORT/$SERIAL_PORT, and the exp21 scripts now refuse to run unless those name the requested board. (3) Reset with the console CLOSED or the strap is sampled wrong and the chip sits in boot:0x0 DOWNLOAD(USB/UART0) forever. (4) A board that booted minutes earlier delivers NOTHING to a console attached later unless DTR is asserted, and serial_api.Device's !think-ack attach is the only reliable driver - a hand-rolled !status gate never got an answer. Pool restored: worker sdkconfig.defaults clean, esp32/main at HEAD, board 1 rebuilt at the shipping config (assertions default, no 120M) and reflashed (2a9c7d05), board 2 clean at HEAD.","timestamp":1790105257823,"segment":1,"confidence":19.769230769230788,"asi":{"abort_message":"E MSPI Timing: The flash model has not been verified support this feature, please contact espressif business support","boards_affected":2,"ecc_psram_cost_bytes":1092508,"ecc_verdict":"does not fit: psram_free 697476 with ECC vs 1789984 without at the same boot stage, and the firmware then reports ERR prefix_cache_allocation","failing_function":"__esp_system_init_fn_psram_adjust_timing_point_via_temperature at esp_hw_support/mspi_timing_tuning/port/esp32s3/mspi_timing_by_mspi_delay.c:882, called from do_system_init_fn (esp_system/startup.c:135); abort() PC 0x42002620","harness_fact_attach":"a warm board delivers nothing to a console attached later unless DTR is asserted; use serial_api.Device's !think-ack attach, not a hand-rolled !status gate","harness_fact_kconfig":"idf.py -DCONFIG_X=y is IGNORED when esp32/sdkconfig exists; use sdkconfig.defaults + delete sdkconfig + fresh -B and verify in the generated sdkconfig","harness_fact_ports":"/dev/ttyACM0 and /dev/ttyACM1 are board 1's aliases; per-board nodes come only from the wrapper's $FLASH_PORT/$SERIAL_PORT. Three runs that used the aliases all drove one chip.","harness_fact_reset":"reset with the console port closed, else the chip lands in boot:0x0 DOWNLOAD(USB/UART0) and stays there","hypothesis":"Experiment 21: the +3.51 % at octal 120 MHz can be made shippable by building IDF's safest supported variant (temperature-based MSPI timing retune) and proving integrity under a hot/cold soak.","idf_risk_axis_c":20,"kept_instrument":"esp32/main/thermal_diag.c behind NEEDLE_THERMAL_DIAG (default OFF); two canonical runs with it OFF read exactly 5.0117 and 17/17 + 16/16 byte-exact, so it is free","next_action_hint":"Experiment 22 next: phi (4-bit) kernel screen. Prerequisite built this cycle - a real 4-bit phi fixture from the host engine plus a bit-exact replay harness (.auto/exp22/capture-hook.patch, phi4-prefill.bin, phi4-decode.bin, replay.c). Screen an isolated kernel against the shipping nd_cq_gemv_rows in kbench BEFORE writing assembly, and reject fast: #295 measured the residency ceiling at 9-10 % of the phase, so the end-to-end prize is +0.2-0.45 %.","pool_state":"board1 restored to the shipping config and reflashed (2a9c7d05); board2 clean at HEAD; board3 tree at HEAD, still runs its diag build until the next flash","result":"BLOCKED BY VENDOR SUPPORT, not by effort. IDF's temperature-retune init returns ESP_ERR_NOT_SUPPORTED (0x106) because this board's flash model is not verified for the scheme, and a failed init function aborts boot - reproduced on two boards, never reaches EVT READY. There is no bootable safe-120-MHz image to soak.","self_heating_measured_c":5,"shipping_config":"80 MHz octal stays the production default, now on measured grounds","soak_would_measure_wrong_axis":true,"time_cost_note":"one iteration, ~2 h wall clock, mostly harness discovery in the three-board pool"}}
{"run":332,"commit":"35a704b","metric":5.0117,"metrics":{"boot_bench_tps":5.057,"device_output_exact":17,"device_token_delta":0,"ext_decode_tps":4.939,"gen_tokens":99,"host_output_exact":16,"internal_free":15215,"logit_max_delta":0.00005341,"logit_top1_match":10,"min_case_tps":4.79,"prefill_tps":5.2867,"psram_free":2052252,"think_tps":3.93},"status":"keep","description":"Experiment 22 - handwritten 4-bit phi kernel, SCREENED on device: the campaign's first above-bar speed candidate since #291. No shipping inference change yet, so decode_tps is the accepted 5.0117 carried forward (no board ran the shipping image this cycle; the exit-42 guard forbids a control-only run and there was no shipping candidate to batch). RESULT: a handwritten CQ 4-bit row walker that changes only STRUCTURE (one function per row instead of a call per group) and uses ordinary lsi loads is BIT-EXACT against the shipping nd_cq_gemv_rows on real needle3.cact bytes (0 mismatched rows of 128; known-answer probe exact 64.000000) and 11.6 % faster: 5.647 vs 6.338 cycles/weight, min of 25 rounds, CCOUNT calibrated 24000, board 2, on all three real phi tensors 223/224/225 (+11.58/+10.93/+10.9 %). phi's GEMVs are 9.2 ms of a ~200 ms token, so ~1.07 ms/token = +0.53 % decode - above the 0.2 % keep bar and above run #141's analytic +0.5 % ceiling. WHY IT WINS: in the shipping build dot_group is a real function call per group (symbol 0x4037bba8, not inlined), so the C path pays call overhead plus a per-group fp16 norm conversion across the boundary 24 times per row, while the asm keeps all 24 groups in registers inside one loop instruction. That retires run #295's \"do not write the phi assembly\" closure: its 9.3-10 % operand-DELIVERY ceiling and #141's instruction counts are both real, and neither is where this win comes from - call/inline structure is a third category, bigger than the two the closure considered. A ceiling measured inside one category is not a ceiling on the phase. THE TIE WIDE-FLOAT LOADS ARE NOT THE WIN AND THEIR NUMBERS ARE INVALID: ee.ldf.128.ip measured 4.774 cyc/weight (+25 %) and ee.ldf.64.ip 5.023 (+21 %), but both FAIL the known-answer probe (63.0 where the answer is exactly 64.0) - one of the eight floats per index word is not the value asked for, so those kernels are fast because they drop a term. Do not use either until the fill order of the instruction's register list is determined; the 63/64 signature says exactly one contribution per word, i.e. register order or a stale register, not the load itself. TWO ABI FACTS, paid with four boot-looping harvests: (1) a C float return value arrives in the INTEGER return register - GCC's own float epilogue is ssi f0,a1,0 / l32i.n a2,a1,0 - so an asm kernel ending in mov.s f0,f13; retw hands the caller a stale float, symptom: ONE IDENTICAL WRONG VALUE FROM THREE DIFFERENT KERNELS independent of inputs (fix: ssi f0,a1,16 + l32i a2,a1,16); (2) addx4 ar,as,at means ar=(as<<2)+at with the DESTINATION FIRST, as lut2_tie728.S already writes it - addx4 idx,base,idx silently computes (base<<2)+idx, which on device was LoadProhibited at EXCVADDR 0xf40c03d4 = (0x3d0300f4<<2)+4, and that arithmetic confirmed the semantics. Method finding worth more than either fact: the real-fixture diff only said \"all rows differ\", while a known-answer probe on hand-computable inputs (cb[i]=i, row 0x10 bytes, xh=1.0, norm 0x3C00, one group -> exactly 64.0) localised which stage was wrong in ONE build. Rule for this repo's asm screens: ship a known-answer probe in the same kbench run as the differential, not instead of it. SHIPPING IMPACT SO FAR NONE, AND PROVEN NONE: the screen lives in esp32/main/dot4_tie728.S plus the if(NEEDLE_KBENCH) branch of esp32/main/CMakeLists.txt; same-checkout A/B (fresh build_s1 with the change, fresh build_s2 without) both 281,072 bytes with 68 differing bytes in 4 regions = header stamps 0x74-0x77, the 32-byte build id 0xb0-0xcf, MD5 footer 0x449cf-0x449ef - nothing but build identity, the run #330 pattern. Pool/tree: board 2 restored to HEAD (kbench.c/CMakeLists restored, dot4 file removed from the worker), board 1 at the shipping config from #331. Kept rather than discarded so the kbench-gated screen and its CMake gate survive; the accepted image is unchanged.","timestamp":1790108488364,"segment":1,"confidence":19.769230769230788,"asi":{"abi_fact_addx4":"addx4 ar, as, at -> ar = (as<<2)+at, DESTINATION FIRST. addx4 idx,base,idx computes (base<<2)+idx: LoadProhibited at EXCVADDR 0xf40c03d4 = (0x3d0300f4<<2)+4.","abi_fact_float_return":"a C float return arrives in the INTEGER return register (GCC epilogue: ssi f0,a1,0 / l32i.n a2,a1,0). Leaving the result in f0 gave three different asm kernels ONE identical input-independent wrong value.","candidate_next":"integrate the tie0-shaped 4-bit row kernel behind an nd_lut2_asm_ok()-style gate (g==128, ordinary fp16 norms, 4-byte alignment only), differential-test on the real 4-bit fixture in .auto/exp22/, then a three-board batch. ~200 B of IRAM, so watch internal_free.","ceiling_perspective":"run #295's 9.3-10 % operand-delivery ceiling and #141's -12 % instruction count are both real and neither is where this win comes from: dot_group is a per-group CALL in the shipping build (0x4037bba8, not inlined). Call/inline structure is a third category.","delta_vs_c_pct":11.6,"hypothesis":"Experiment 22 as queued: a handwritten 4-bit phi TIE728 kernel using paired/wide float loads on the contiguous xh operand should beat the shipping C loop; #141 priced -12 % and #295 capped the phase at ~10 % delivery, so screen isolated and reject fast.","measured":"board 2, real needle3.cact phi tensors 223/224/225, min of 25 rounds, CCOUNT 24000: c_ship 6.338 cyc/weight; tie0 handwritten plain-lsi 5.647 (+11.58/+10.93/+10.9 %, bit-exact 0/128 rows, unit probe 64.000000); tie1 ee.ldf.128.ip 4.774 (+25 %) and tie2 ee.ldf.64.ip 5.023 (+21 %) both FAIL the known-answer probe (63.0 vs 64.0) so their speed is a dropped term and is invalid.","predicted_decode_pct":0.53,"prize_ms_per_token":1.07,"shipping_image_evidence":"same-checkout A/B with/without the kbench-gated files: 281,072 B both, 68 diff bytes in 4 regions = header stamps + 32 B build id + MD5 footer (the run #330 pattern).","tie_ldf_open_question":"ee.ldf.64/128.ip register fill order: the 63/64 signature is exactly one missing contribution per 8-float word, so fix the order and re-measure; another ~10 % may sit above the plain form.","unit_probe_rule":"a known-answer probe on hand-computable inputs (cb[i]=i, row 0x10, xh=1.0, norm 0x3C00 -> exactly 64.0) localised the bug in one build where the real-fixture diff only said 'all rows differ'. Ship it in the same kbench run as the differential.","why_above_bar":"phi GEMVs are 9.2 ms of ~200 ms; 11.6 % is ~1.07 ms/token = +0.53 % decode, above the 0.2 % keep bar and above #141's +0.5 % analytic ceiling."}}
