{"run":158,"commit":"HEAD","metric":4.8817,"metrics":{"prefill_tps":5.2183,"ext_decode_tps":4.7986,"think_tps":3.87,"boot_bench_tps":4.983,"min_case_tps":4.66,"gen_tokens":99,"internal_free":17039,"psram_free":2052252,"device_output_exact":14,"device_token_delta":0,"logit_max_delta":0.00005341,"logit_top1_match":10,"host_output_exact":13},"status":"keep","description":"Diagnostic-attempt cycle, no runtime change. Tried to harvest a per-request EVT prof table on the current tree (the last one was pre-sampler, #145) to check the one assumption behind closing the sampler family - that nd_model_logits_subset costs ~7 ms. Three failure layers found and fixed in the notes instead of the code: -DNEEDLE_PROFILE=ON does not define ND_PROFILE in a fresh build dir (confirmed: define token absent, and the request path printed no table); my verification grep looked for -DND_PROFILE=1 when a bare define appears as -DND_PROFILE; Device.complete() swallows raw console lines and prof_dump prints after EVT done, so breaking on EVT done hides the table. Stopped when I realised the answer cannot change any decision. Canonical run green: 4.8817 decode, 4.7986 extended, 14/14 byte-exact, fidelity 5.341e-05 top1 10/10.","timestamp":1789983814832,"segment":1,"confidence":488.00000000001046,"asi":{"hypothesis":"Measure rather than infer the subset-logits cost; if it were much larger than 7 ms the sampler family might reopen.","why_stopped":"Its two possible fixes are a smaller candidate set (changes what the model may emit - forbidden) or a faster 2-bit GEMV (at its measured floor). A measurement that cannot change the next action is not worth 14 minutes of board time per flash here, priming included. Recipe for a future session is in .auto/ideas.md.","self_caught":"Two of the three failures were my own verification being wrong rather than the build being wrong: grepping compile_commands.json for '-DND_PROFILE=1' instead of '-DND_PROFILE' (the same class of mistake as grepping the option name NEEDLE_LUT2_ASM instead of the define ND_LUT2_ASM, already recorded in this campaign). Verify the exact token, and better, verify by runtime behaviour - the absence of the request-path table was the real evidence.","next":"A live premise I found while re-reading the phi disposition: mHC phi's 9.2 ms is ~7x above BOTH its issue floor (302K instructions ~1.3 ms) and its bandwidth floor (36 KB/token ~0.6 ms), which means it is latency-bound - yet the recorded 'asm ceiling is -12%' analysis assumed it was issue-bound, and row blocking (which does not add load-pipelining depth) measured null exactly as a latency-bound kernel would. The 2-bit kernel's +33% came from batching eight independent gathers, the standard cure for latency-bound code, and it was never tried on the 4-bit path. Cheapest first probe: a C-level 2-word batching of the 4-bit inner loop with bit-exact accumulation order; if null, phi closes for real.","state":"Best 4.8817 decode (+99.9%), extended 4.7986, think 3.87, prefill 5.22; 14 device + 13 host byte-exact; make capture green; tree clean."}}
{"run":159,"commit":"fd0a833","metric":4.89,"metrics":{"prefill_tps":5.2117,"ext_decode_tps":4.8086,"think_tps":3.97,"boot_bench_tps":4.98,"min_case_tps":4.67,"gen_tokens":99,"internal_free":8335,"psram_free":2052252,"device_output_exact":14,"device_token_delta":0,"logit_max_delta":0.00005341,"logit_top1_match":10,"host_output_exact":13},"status":"keep","description":"Folded codebook for the 4-bit (mHC phi) GEMV. nd_cact_codebook keys only on archive + bit width, so cb[k]*xh[j] is the same number for every output row - the trick the 2-bit pair table already uses. gemv_rows_folded builds 128 positions x 16 levels (8 kB internal) once per group per worker, reused by all rows that worker owns, with a group-outer / row-inner order and the same four partials as dot_group, so every y[r] is bit-identical. Host 13/13 byte-exact with fidelity 5.341e-05 unchanged; device 14/14 byte-exact, token_delta 0. decode_tps 4.8817 -> 4.89 (+0.17%, ~5x the measured 0.07% cross-image spread), extended 4.7986 -> 4.8086 (+0.21%), min_case 4.66 -> 4.67, and think 3.87 -> 3.97 (+2.6%) - think has not moved at all in ~150 runs, and it is the other consumer of the 4-bit path.","timestamp":1789984430448,"segment":1,"confidence":489.6599999999669,"asi":{"hypothesis":"phi sits ~7x above both its issue floor (302K instructions ~1.3 ms) and its bandwidth floor (36 KB/token ~0.6 ms), i.e. latency-bound - and the standard cure for latency-bound code is fewer dependent loads, which is exactly how the 2-bit kernel won +33%. Row blocking (which does not add load parallelism) measured null, as a latency-bound kernel would. So give the 4-bit path the folded table the 2-bit path already has: one gather per weight instead of two.","why_this_was_legitimately_open":"The ideas backlog listed '4-bit pair-LUT for the mHC phi GEMVs' with the note 'table is ~48 KB, probably too big; test whether a half-width table beats the multiply path anyway' - untried. The per-group slice is 8 kB, not 48 kB, because 16 levels x 128 positions covers a group and the group is reused by all 24 rows. The earlier -12% 'asm ceiling' analysis assumed the kernel was issue-bound, which its own numbers contradict.","actual_size_of_the_win":"Small on decode (+0.17% = ~0.35 ms/token, not the ~1.7 ms a pure instruction-count argument predicted) and large on think (+2.6%). So the fold removed work but phi remains dominated by something other than instruction count - consistent with the latency diagnosis, and a reminder that this board punishes predictions built from op counts. think is a single case, but the same session reproduces to 0.00%, so +2.6% is real.","cost":"internal_free fell 17039 -> 8335: the 8 kB static table. Boot and all 14 device cases are fine at 8.3 kB free, but if a future change needs internal RAM this is the first suspect. Halving it to 4 kB is available without touching numerics - process each group in two position halves while carrying s0..s3 across the halves, so the (s0+s1)+(s2+s3) fold is unchanged.","next":"Confirm on the three-board batch (control = pre-fold tree) since +0.17% is a small primary delta; the extended/think corroboration plus byte-exactness already argues it is real. Then consider re-trying a real TIE728 kernel for the 4-bit path now that the operand is a single 8 kB resident table: the -12% ceiling was measured against the two-gather shape, not this one.","state":"Best 4.89 decode (+100.4% over the 2.44 baseline), 4.8086 extended, 3.97 think, 5.21 prefill; 14 device + 13 host byte-exact."}}
{"run":160,"commit":"0148e0e","metric":4.8917,"metrics":{"prefill_tps":5.2117,"ext_decode_tps":4.8114,"think_tps":3.97,"boot_bench_tps":4.979,"min_case_tps":4.67,"gen_tokens":99,"internal_free":8335,"psram_free":2052252,"device_output_exact":14,"device_token_delta":0,"logit_max_delta":0.00005341,"logit_top1_match":10,"host_output_exact":13},"status":"keep","description":"Three-board confirmation of the folded 4-bit codebook (no new code this cycle). Control board rebuilt from the pre-fold nd_quant.c read 4.8817 - exactly the previously accepted value, so the batch is trustworthy - while two independent candidate boards read 4.89 and 4.8917, extended 4.8086/4.8114 (control 4.7986), think 3.97 on both (control 3.87), min_case 4.67 (control 4.66), byte-exact 14/14 on all three. Canonical run reproduces the best reading, 4.8917 decode (+100.5% over the 2.44 baseline), with fidelity 5.341e-05 and top1 10/10.","timestamp":1789986384576,"segment":1,"confidence":489.99999999992343,"asi":{"hypothesis":"A +0.17% primary delta needs the batch protocol, not one run: one control image plus two identical candidate images, control validated against the last logged value, board roles swapped relative to the earlier batch.","result":"Both candidate boards beat the control on every speed monitor and the control reproduced the old value to four digits. The win is small but consistent: decode +0.17%/+0.21%, extended +0.21%/+0.27%, think +2.6% on both boards, worst case +0.2%. Byte-exactness held on all three boards.","batch_integrity":"control image 279264 B (the pre-fold size, source from git show HEAD~1:engine/src/nd_quant.c), candidates 279712 B each and identical to each other; all three build dirs freshly configured, so board3's earlier NEEDLE_PROFILE cache entry could not leak.","insight_think":"think gained 15x more than decode from the same change, which localises where the 4-bit path actually dominates: the full-vocabulary logits projection is 4-bit (the phase is literally named logits4), and think runs 8192 rows of it while constrained decode runs a few hundred. A monitor moving that much is a map, not just a number - worth reading the phase name before dismissing a secondary.","next":"Check the archive directory for every 4-bit tensor's group: the fold fast-path requires group == 128, so any 4-bit tensor with another group still uses the two-gather loop. If one exists, widening the guard (g <= 128, table sized 16*g) is free and bit-exact. Only after that, consider a TIE728 kernel over the folded table - the old -12% ceiling was computed for the two-gather shape, and the lsi immediate cap (1020 B) means a 64 B-per-position table needs a base advance roughly every 15 positions.","state":"Best 4.8917 decode (+100.5% over 2.44), extended 4.8114, think 3.97, prefill 5.21; 14 device + 13 host byte-exact on three boards; internal_free 8335 after the 8 kB table."}}
{"run":161,"commit":"0148e0e","metric":4.89,"metrics":{"prefill_tps":5.2117,"ext_decode_tps":4.8071,"think_tps":3.97,"boot_bench_tps":4.978,"min_case_tps":4.67,"gen_tokens":99,"internal_free":8335,"psram_free":2052252,"device_output_exact":14,"device_token_delta":0,"logit_max_delta":0.00005341,"logit_top1_match":10,"host_output_exact":13},"status":"discard","description":"Gate the folded 4-bit path on row count (out >= 32) so tensors right at the build/amortise break-even - the 32-row phi tensors 223/224 - keep the direct loop. Bit-exact (host 13/13, fidelity 5.341e-05) and the arithmetic predicted the result: decode 4.89 vs the ungated fold's 4.89/4.8917, extended 4.8071 vs 4.8114/4.8086, think 3.97 unchanged - i.e. exactly within the ~0.04% cross-run spread, neither helping nor hurting. Reverted; the simpler ungated guard stays. Also learned the honest resolution of my determinism claim: repeated cases inside one session agree to 0.00%, but across flashes/sessions the canonical reading varies ~0.04%, so deltas below that need a batch, not a repeat.","timestamp":1789986806724,"segment":1,"confidence":489.99999999992343,"asi":{"hypothesis":"The fold's per-group table costs g*16 = 2048 multiplies and saves one gather per weight, so it breaks even at 16 rows per worker (~32 rows overall). The 8192-row logits projection and the ~1300-row candidate subset are far above that (think gained 2.6%); the 32-row phi tensors sit on the line, so excluding them should be neutral-to-positive.","result":"Neutral within noise, exactly as the break-even arithmetic predicted. Kept-code simplicity wins: the ungated guard covers 100% of the archive's 4-bit tensors (all 7 are group=128, verified from the directory) and is one condition shorter.","calibration":"This is the third time in this campaign that a first-principles op-count model predicted a *null* correctly (after row blocking and the piece[0] cache). The model is trustworthy for ruling out; it has only ever over-promised on wins.","noise_floor_updated":"Same-session repeats: 0.00%. Same code measured across separate flash sessions: 4.89 and 4.8917, ~0.035%. So: within-session is deterministic, cross-session is not, and anything under ~0.05% needs the three-board batch. The 0.2% keep bar stays, but 'is this even a real delta' is now answerable at 0.1% with a batch.","next":"Check whether the constrained candidate projection (nd_model_logits_subset) actually routes through nd_cq_gemv_prepared - the fold lives in that path's row worker, and think's +2.6% proves the full 8192-row call does. If the subset variant uses its own gather loop it never got the fold, and that is ~7 ms of every constrained token with a known fix.","state":"Best 4.8917 decode (+100.5%), extended 4.8114, think 3.97, prefill 5.21; tree back to the accepted ungated fold; all gates green."}}
{"run":162,"commit":"9fc2e91","metric":4.8817,"metrics":{"prefill_tps":5.2217,"ext_decode_tps":4.7986,"think_tps":3.87,"boot_bench_tps":4.985,"min_case_tps":4.66,"gen_tokens":99,"internal_free":17039,"psram_free":2052252,"device_output_exact":14,"device_token_delta":0,"logit_max_delta":0.00005341,"logit_top1_match":10,"host_output_exact":13},"status":"keep","description":"Correctness revert: the folded 4-bit codebook kept in #159 (+0.17%) is withdrawn, returning to the accepted 4.8817. Reason found while extending it: gemv_rows_folded wrote ONE static 8 kB table from BOTH cores - rows_dual_core starts the two halves concurrently with no barrier between them, so a scheduler tick landing mid-build mixes two groups' values into one operand. It measured byte-exact on three boards and the host purely by timing luck; the host cannot catch it at all (nd_parallel_rows is rows_serial there). I then built the race-free version (table built by the caller outside the split, per-group nd_parallel_rows) and extended the fold to the candidate-gather path, which is the ~7 ms the constrained sampler actually pays: it measured 4.87 decode / 4.7857 extended / 3.95 think, i.e. worse on every monitor, so the safe form does not pay for itself. Fold family closed as unsafe-at-this-memory-budget. Safe state re-verified: 4.8817, extended 4.7986, think 3.87, 14/14 byte-exact, internal_free back to 17039.","timestamp":1789987795165,"segment":1,"confidence":489.99999999992343,"asi":{"what_i_should_have_checked_before_keeping_159":"Whether the kernel touched any shared mutable state, not just whether its numbers matched. gemv_rows_folded accumulated into a file-scope array from a function that nd_parallel_rows runs on two cores simultaneously. Byte-exact goldens are a strong gate for arithmetic, and a weak one for concurrency: the two halves are equal-sized and start together, so they stayed in phase often enough to look clean across four boards and ~10 runs. Every other GEMV variant in this campaign was pure-per-row by construction, so this is the first time the question even arose.","why_it_cannot_be_fixed_here":"Three shapes, all blocked: (a) caller-side build with the group loop outside the split - measured worse (4.87 vs 4.89), because it trades one handshake per projection for one per group (6 for the 768-wide logits, 24 for phi) plus a read-modify-write of y per group; (b) per-core tables inside the worker - 2 x 8 kB against 8.3 kB of free internal RAM; (c) one build per token covering all groups, caller-side, read-only - needs 16 x in_pad floats, 48 kB for the 768-wide logits and 192 kB for phi, and moving it to PSRAM defeats the point, because the operand it replaces (xh) is already internal SRAM.","the_real_lesson":"The fold only swaps one internal-SRAM operand (xh) for another (the folded table); it never touches the 4-bit weight stream in PSRAM that dominates the phase. That is why the win was only 0.17% on decode no matter how clean the code was, and why my '7x above both floors' framing was misleading: the phase is not limited by the operand I could cheapen. Worth remembering that a micro-optimisation of a non-dominant operand cannot exceed its share.","memory_budget_note":"internal_free is now back to 17039. The campaign's hot buffers live in PSRAM (12 MB tier) precisely because internal RAM is the scarce resource here; 8 kB is a real fraction of what is left, so any future static buffer needs the same arithmetic.","harness_note_on_revert":"log_experiment auto-reverts code on 'discard', so withdrawing an already-kept change has to be logged as 'keep' on the reverted tree - otherwise the tool would have restored the racy code it was meant to remove. Kept deliberately, and measured after the revert rather than before.","next":"Accepted runtime is the pre-fold 4.8817 (+99.9%), which is what ~150 runs validated. If the fold is ever revisited it needs in_pad-sized caller-side memory, i.e. a smaller fold (4 levels, or fp16 storage - both change numerics, so not here) or an archive with narrower 4-bit tensors. Otherwise: verification cycles, and make capture every ~10 kept changes.","state":"Best (safe) 4.8817 decode, 4.7986 extended, 3.87 think, 5.22 prefill; 14 device + 13 host byte-exact; tree clean at the pre-fold engine; fidelity 5.341e-05 top1 10/10."}}
{"run":163,"commit":"9fc2e91","metric":4.8817,"metrics":{"prefill_tps":5.2183,"ext_decode_tps":4.7986,"think_tps":3.87,"boot_bench_tps":4.983,"min_case_tps":4.66,"gen_tokens":99,"internal_free":17039,"psram_free":2052252,"device_output_exact":14,"device_token_delta":0,"logit_max_delta":0.00005341,"logit_top1_match":10,"host_output_exact":13},"status":"keep","description":"Verification cycle on the safe (pre-fold) runtime. Fresh-configured identical images on all three boards (279264 B each, s_fold absent from all sources) measured in one batch gave the same numbers everywhere: decode_tps 4.8817, min_case 4.66, extended 4.7986, think 3.87, byte-exact 14/14, internal_free 17039. Canonical run reproduces the same values. Completed the shared-state audit triggered by the fold race: every kernel handed to nd_parallel_rows was re-read (TIE728 row walker, attn_heads, gather_rows, gemv_rows_generic/offset) and all are clean - stack-local staging and disjoint outputs; the audit table is in .auto/ideas.md.","timestamp":1789989666103,"segment":1,"confidence":418.80341880337755,"asi":{"hypothesis":"After withdrawing the fold, the accepted runtime should be revalidated on the boards that had stale fold images, and the audit it triggered should be finished rather than asserted.","noise_tally":"Cross-session readings of this exact runtime: 4.8817 every time on the canonical port, and 4.8817 on all three boards in one batch. The only variation I have seen is the fold tree's 4.89 vs 4.8917 (0.035%), so quoting a ~0.05% cross-session floor stands up; within a session it is 0.00%.","next":"Add the concurrency rule as a comment where it can actually be seen - above nd_parallel_rows' declaration in engine/include/nd_quant.h and in rows_dual_core - so the next person to hand a kernel with shared scratch to the splitter is stopped at the point of writing it. Documentation only, no speed claim.","state":"Accepted 4.8817 decode (+99.9%), extended 4.7986, think 3.87, prefill 5.22; 14 device + 13 host byte-exact on three boards; fidelity 5.341e-05 top1 10/10; internal_free 17039."}}
{"run":164,"commit":"61630e4","metric":4.8817,"metrics":{"prefill_tps":5.2183,"ext_decode_tps":4.7986,"think_tps":3.87,"boot_bench_tps":4.983,"min_case_tps":4.66,"gen_tokens":99,"internal_free":17039,"psram_free":2052252,"device_output_exact":14,"device_token_delta":0,"logit_max_delta":0.00005341,"logit_top1_match":10,"host_output_exact":13},"status":"keep","description":"Documentation-only change, no speed claim: added the nd_parallel_rows concurrency CONTRACT above the fn-pointer typedef in engine/include/nd_quant.h - a kernel handed to the splitter runs on two cores with no barrier between the halves, so scratch must be stack or ctx, a static buffer is a data race, and byte-exact goldens will not reliably catch one because the equal-sized halves usually stay in phase. That is the exact trap the withdrawn fold fell into, and the header is where the next person writing such a kernel will be. Binary size unchanged at 279264 B; metric, goldens and fidelity identical by construction. Device 14/14 byte-exact, host 13/13, 4.8817 decode / 4.7986 extended / 3.87 think.","timestamp":1789990049207,"segment":1,"confidence":365.67164179102446,"asi":{"hypothesis":"Turn the fold race into a guard the next contributor actually sees, rather than a line in a log file.","build_integrity_correction":"My recorded rule was 'two builds with different flags that produce the same md5 means one of them is not what you think it is'. The converse is now known false: the same code with only a comment added produced a different md5 (4f1ca1d8 -> cbf520ee) at the same 279264-byte size, so ESP-IDF stamps something time-dependent into the image. md5 equality is therefore not an invariant to test - use compile_commands.json for flags and binary size for shape, which is what I actually rely on now.","pre_existing_warnings":"The ESP32 build warns 'dot_group_lut2 defined but not used' (nd_quant.c:313, dead since the asm kernel took the 2-bit path) and 'unused variable vb' (nd_model.c:1042, in the engram, untouched by this campaign). Left alone: not mine, and removing the first would delete the C fallback's helper that sits next to the retained C path.","state":"Accepted 4.8817 decode (+99.9%), extended 4.7986, think 3.87, prefill 5.22, boot bench 201 ms/token; 14 device + 13 host byte-exact; fidelity 5.341e-05 top1 10/10; internal_free 17039."}}
