{"run":410,"commit":"731396a","metric":5.1167,"metrics":{"boot_bench_tps":5.162,"device_output_exact":20,"device_token_delta":0,"ext_decode_tps":5.0423,"gen_tokens":99,"host_output_exact":19,"internal_free":12855,"logit_max_delta":0.00005341,"logit_top1_match":10,"min_case_tps":4.88,"prefill_tps":5.4,"psram_free":2052252,"think_tps":3.99},"status":"keep","description":"Attribution screens MEASURED on two boards (identical tables, zero spread) + Sinkhorn priced exactly off-device and refused + two stale map numbers corrected; accepted runtime unchanged at 5.1167 (secondaries are the accepted fw3foldnb run's; the 5.1367 shown is the PROFILED image and is explicitly not a speed claim - see asi.warning). THE SCREEN: six additive sub-phase timers splitting the two map entries whose per-element costs looked 5-10x off, boards 2 and 3, provenance asserted (a59990aa84e2), full suites running. RESULT (1) `mhc-mix` is 2.5 ms, not the ledger's 4.7 ms (stale), and it is now fully attributed: lane_rms 1.2 + lanew 0.6 + bias 0.2 + sub 0.2 = 2.2 of 2.5 ms. Its dominant term is a SINGLE-accumulator reduction over the whole lane buffer, so the only ILP that preserves bits would reassociate it - the lever the byte-exact gate refuses. So the anomaly was arithmetic built on the stale 4.7 ms: recomputed, the loop sits at the latency-bound floor of a serial sum. No candidate. (2) `engram`'s slot-row dequant is 0.6 ms/token, 30x the ~0.02 ms it was priced at - real work, still only 0.3 % of the token, and it raises a specific new question (does dequant_row materialise 768 weights to consume sub=128?), which is the next experiment. (3) OFF-DEVICE, no board: Sinkhorn exp-pairing priced with counters on the real engine - 8 sinkhorn calls/token, 5,120 gross exp terms, 1,334 already skipped by #291, 3,786 reaching nd_expf, 1,280 logf, 2,560 adjacent pair slots, 0.6131 pairable -> 1,570 x 49.4 cycles = 0.323 ms minus 0.043 ms of eligibility tests = +0.145 % at full realisation, i.e. sub-bar after the family's measured 25-70 % band. Not built. This also reconciles the two ledger figures that looked contradictory (1,280 vs 5,120 exps - different scopes, both right) and re-confirms the logf(1.0f) skip is closed on measured counts, not arithmetic in a comment. (4) Harness: the provenance assertion covered only nd_quant.c + asm, so no nd_model.c-only candidate was ever checked - now hashes the whole engine plus app; and `needle-board run N --` executes with a cwd that is not the checkout, which is how my relative-path candidate copies patched the wrong tree while agreeing with their own relative md5sum. Instrumentation reverted from the engine tree.","timestamp":1790215409746,"segment":1,"confidence":19.34201012292117,"asi":{"attribution_board_spread":"0.000 ms: boards 2 and 3 produced byte-identical phase tables (hadamard 24.3, phi 10.0, engram 16.2, prep+lut 2.2, sinkhorn 3.8, mhc-mix 2.5, attn-stage 99.1, taps 3.3, kv 0.9) and identical decode 5.1367, so the split is reproducible and the two boards agree to the printed digit.","closed_this_iteration":"Sinkhorn exp-pairing: priced at +0.145 % full realisation (1,570 pairable x 49.4 cycles = 0.323 ms, minus ~0.043 ms of eligibility tests, on a 193 ms token) against a measured 25-70 % realisation band -> sub-bar, not built. Row-adjacent pairing is worse (0.546 vs 0.613 pairable). logf(1.0f) skip re-confirmed sub-bar with the measured 1,280 logf/token.","figure_reconciliation":"the phase map's ~1,280 and the kernel comment's ~5,120 are BOTH right at different scopes: 5,120 gross exp terms, 1,334/token removed by #291's skip, 3,786 actually reaching nd_expf today. Sinkhorn's 3.8 ms is fully explained by measured per-call costs, so it carries no anomaly.","lanes":"board2 + board3 = the six-timer attribution image, full suites, provenance engine_md5=a59990aa84e2, primary group completed on both (decode 5.1367 each). The split itself (engine + header + main.c) is REVERTED in main; only harness changes remain.","next1":"engram slot_row is 0.6 ms/token, 30x the ledger's ~0.02 ms estimate, and the tables use sub=128 columns while nd_cq_dequant_row materialises a full row. Read whether it dequantises 768 weights to consume 128 - if so that is a 6x over-dequant and a bit-exact 'dequant only the sub columns' candidate worth up to +0.3 %. Host-side code read first, cheap.","next2":"attn-stage is 99.1 ms while its named children (heads 35.2 + taps 3.3 + norms 0.5 + rope 0.2 + kv 0.9) sum to 40.1; the ~59 ms remainder is ASSUMED to be the q/k/v/gate GEMVs (also counted by proj2bit). Verify with a two-snapshot request-path diff instead of trusting overlapping cumulative timers (#344's rule).","next3":"phi is 10.0 ms (5.2 %); its only measured headroom is the 9.3 % delivery ceiling (= +0.47 %) gated on internal RAM (#293 owner decision). Before asking the owner again, check whether the same delivery share is collectable another way: phi rows are read once per token, so any residency needs a mechanism that avoids the read it must perform (#407's closure) - i.e. only a smaller per-token footprint counts, which is a quantisation change (frozen).","stale_numbers_corrected":"mhc-mix 4.7 -> 2.5 ms; engram slot-row dequant 0.02 -> 0.6 ms; Sinkhorn exp count 1,280 -> 3,786 reaching nd_expf (5,120 gross).","warning":"the profiled image reads 5.1367 = +0.39 % over the accepted 5.1167 on two boards. That is a codegen side-effect of the timer insertions, NOT a speed claim, and it disproves the implicit assumption that ND_PROFILE images always read slower. Never read a profiled decode as a delta in either direction."}}
{"run":411,"commit":"a6e7454","metric":5.1167,"metrics":{"boot_bench_tps":5.162,"device_output_exact":20,"device_token_delta":0,"ext_decode_tps":5.0423,"gen_tokens":99,"host_output_exact":19,"internal_free":12855,"logit_max_delta":0.00005341,"logit_top1_match":10,"min_case_tps":4.88,"prefill_tps":5.4,"psram_free":2052252,"think_tps":3.99},"status":"keep","description":"Third screen (off-device, zero board time): the engram slot-row dequant measured at 0.6 ms/token is geometry-CONFIRMED and closed without a candidate; accepted runtime unchanged at 5.1167 (secondaries are the accepted fw3foldnb run's - this iteration ran no shipping image, only host diagnostics while the two diagnostic lanes finish). HYPOTHESIS: run #410's split put the engram's per-slot row dequant at 0.6 ms, 30x the ~0.02 ms it had been priced at, and if the kernel dequantised 768 weights to consume sub=128 that would be a 6x over-dequant worth ~+0.26%. TESTED, three ways, all off-device: (1) the engram tables are [slots][128], so sub=128 IS the whole row - no over-dequant, hypothesis dead from the tensor shape; (2) counted the real call rate with -DND_ENG_STATS on the host engine over a real frozen primary prompt: 2,154 dequant calls over 181 forward steps = 11.9 ~ 12 rows per step, exactly the ledger's 12 rows x 128 weights, so the geometry the phase map rests on is now measured, not derived; (3) checked the obvious residency lever - m->row and m->tmp2 are already ND_ALLOC_FAST (internal SRAM), so the 'FWHT thrashes a PSRAM scratch row' explanation does not exist. RESIDUAL, stated as a residual: 12k cycles per 128-element row (~94 cycles/element) against a modelled 2.5-5k, so 2-5x remains unexplained - but the whole phase is 0.3 % of the token, and the one bit-exact lever I can name (the nibble loop's `if (sh + bits > 8)`, a ~50 % mispredicting branch on 64 of 128 nibbles) prices at +0.017-0.034 %. Below the bar, so not built; the phase is left measured with an honest gap rather than priced on a guess. Combined with #410's engram GEMV arithmetic (13.3 ms of the phase at the measured 2.695 cyc/weight + 0.6 ms slot rows = 13.9 vs 16.2 measured), the engram family is closed: no board should go there. Diagnostic instrumentation reverted from the engine tree (git diff over engine now covers only the harness-side header, and the accepted code paths are byte-identical to a6e7454). LANES: boards 2 and 3 each completed 6/6 primary cases on the timer image (route_translate 4.900, heldout_timer45 5.190) with extended in flight; the timer image is diagnostic-only and cannot ship, so its device gate is not an acceptance path - the attribution payload was already delivered and was identical on both boards.","timestamp":1790215720310,"segment":1,"confidence":19.34201012292117,"asi":{"branchless_nibble_priced":"the mixed-byte-boundary branch costs a 50% mispredict on ~64 of the row's nibbles = ~640-1280 cycles/row; removing it entirely = 7.7-15.6k cycles/token = +0.017-0.034%, sub-bar. So even though it is the textbook fix, it cannot clear 0.2% here.","geometry_confirmed":"ENGSTATS dequant_row_calls=2154 over 181 forward steps (158 prefill + 23 decode, real primary prompt 'Sample telemetry every 5 seconds') = 11.9 ~ 12 rows per step, exactly the ledger's 12 rows x 128 weights = 1,536 weights/token. The phase map's engram geometry entry is validated, not assumed.","lanes":"boards 2+3 on the diagnostic image: 6/6 primary cases each (route_translate 4.900, heldout_timer45 5.190), extended in flight. The timer image is diagnostic-only and cannot ship, so its 20-case device gate is not the acceptance path for anything; the attribution payload was already delivered from the boot-bench table, identical on both boards.","measured_residual":"0.6 ms/token / 12 rows = ~12k cycles per 128-element row = ~94 cycles/element, against a modelled ~2.5-5k (bit-extract + FWHT(128)=448 butterflies + scale + 128-float copy). 2-5x still unexplained. Whole phase is 0.3% of the token, so even deleting it pays +0.31% and no mechanism for that is identifiable.","next1":"attn-stage is 99.1 ms while its named children (heads 35.2, taps 3.3, norms 0.5, rope 0.2, kv 0.9) sum to 40.1; the ~59 ms remainder is ASSUMED to be the q/k/v/gate GEMVs which proj2bit also counts. This is the largest unexamined number in the token. Measure it by differencing two prof_dump snapshots on a real request (#344's rule against cumulative timers) rather than by subtraction of overlapping phases.","next2":"qkv taps: 3.3 ms (1.7%) is now the largest non-GEMV phase with no internal split, after mhc-mix (2.5 ms, fully attributed this session) and sinkhorn (3.8 ms, priced to the transcendental and closed). 9 taps x 768 columns x 32 B = 221 KB/token read. Screen its internals before theorising: taps-vs-write vs gather, one profiled build.","next3":"engram's remaining 15.6 ms checks out arithmetically against the measured 2.695 cyc/weight: 2 sites x 2 x 589,824 = 2.36 M weights, two-core = 3.18 M cycles = 13.3 ms, plus the 0.6 ms slot rows = 13.9 vs 16.2 measured; residual 2.3 ms is prepare and pointer math inside the same bracket. So the phase is essentially closed and no board should go there.","owner_only":"phi row residency (10.0 ms, 9.3% delivery ceiling = +0.47%, needs ~18 KB/core vs 12,855 B free, gated on #293's assertion-level RAM) and 120 MHz (vendor-blocked #331). Nothing else above the bar is in-rule.","residency_dead_on_inspection":"m->row and m->tmp2 are already ND_ALLOC_FAST (internal SRAM, nd_model.c:675 and :654), so the 'FWHT thrashes a PSRAM scratch row' explanation is false and a residency candidate does not exist. This is the cheap kind of negative result: one grep, zero board time."}}
{"run":412,"commit":"dd53379","metric":5.1167,"metrics":{"boot_bench_tps":5.162,"device_output_exact":20,"device_token_delta":0,"ext_decode_tps":5.0423,"gen_tokens":99,"host_output_exact":19,"internal_free":12855,"logit_max_delta":0.00005341,"logit_top1_match":10,"min_case_tps":4.88,"prefill_tps":5.4,"psram_free":2052252,"think_tps":3.99},"status":"keep","description":"Lane diagnosis + three distinct screens put on three boards + a near-duplicate avoided; accepted runtime unchanged at 5.1167 (secondaries are the accepted fw3foldnb run's; none of this iteration's images can ship - two are timer-instrumented diagnostics and one is a kbench screen - so no speed claim is made). LANE DIAGNOSIS (within locks, from the logs themselves): the two split-timer lanes were not frozen-polling - each ended rc=1 with 'TimeoutError: board did not answer after one reconnect; case was not skipped, and no chip reset attempted', after b2 completed 16 device cases and b3 17, with ZERO divergences in every case reached; the failing raise is the #346 STATE/ack gate path, not the per-case request loop, which is why my WARN stalled_device_identity line never printed. IDENTITY TEST REFUTES MY OWN THEORY: b2 died at rdev 166.3 and b3 at rdev 166.5, path==real, both nodes unchanged since 00:22 - so the console leg did NOT re-enumerate on the healthy boards, and the wall is a per-boot request ceiling of 16-20 requests, engine-independent, exactly as #392/#401 measured. Board 1's node re-creations (00:23/01:00/01:34) are a separate rig fault, not this phenomenon. NEAR-DUPLICATE AVOIDED: Experiment 31's lanes still sat in .auto/ideas.md marked ACTIVE and 31B (attention P.V accumulate order) had a single stray log mention, so I nearly flashed it - run #354 had already measured it (position-major 9.587 cyc/update vs dim-major 17.164 = 44.1 % WORSE, bit-exact reorder verified first). The stale list is pruned with dispositions inline. SCREENS NOW RUNNING: board 1 = KB LOG, a kbench microbenchmark that prices libm logf on field-shaped operands (1,280 calls/token, 13.58 % exactly 1.0f, min over 12 rounds, operands built as the kernel builds its sums, mixed/non-one/mul-floor modes) - this settles the banked logf(1.0f) skip against a measured cost instead of the assumed 150-420 cycles that run #294's 787-cycle break-even used, and it is shippable iff logf >= ~560 cycles. Board 2 = request-path attribution harvest on the profiled image (attn-stage is a 99.1 ms parent against 40.1 ms of named children - the largest unexamined number in the token). Board 3 = ND_P_TAPS split three ways (of-taps:q/k/v), the last unsplit phase at 3.3 ms (1.7 %), full 20-case suite running with provenance verified from the applied tree (ad56ea43a34d). OWN BUGS CAUGHT: (1) my pre-launch check on the kbench candidate was vacuous - it asserted the macro name appeared before the first occurrence of the function name, which matched my own comment while the macro was undefined at the use site, so the build failed at line 915; the fix uses __attribute__((noinline)) directly, and the positive control is that the build had to fail, which it did. (2) my first hand-computed EXPECT omitted a second header in engine/include and would have false-aborted a correct tree, so provenance values are now computed from the applied worker tree with measure.sh's own glob. RETRY CONSIDERED, NOT TAKEN: condT's veto looked stale after #393/#394, but #392 records that condT's lane completed all 20 cases in canonical order, so its single divergence was not a stall or ordering artefact - rejection stands, no board spent.","timestamp":1790216468287,"segment":1,"confidence":19.34201012292117,"asi":{"board_screens":"b1=KB LOG bench (build launched); b2=profiled image + .auto/lane_prof.sh request-path harvest (flashed, PROFILED_FLASH_OK bin=d92d3ccf7e8f, priming); b3=taps 3-way split profiled image, full suite, PROVENANCE engine_md5=ad56ea43a34d verified from the applied tree. Logs non-empty and growing (70/36/245 B).","duplication_avoided":"Experiment 31's lane list still sat in .auto/ideas.md as ACTIVE, and 31B (attention P.V accumulate order) had only one stray log mention - I nearly flashed it. Run #354 HAD measured it: shipped position-major 9.587 cyc/update vs dim-major 17.164, i.e. 44.1% WORSE, bit-exact reorder verified first. The stale ACTIVE list is now pruned with the dispositions inline, so the next reader cannot be misled by it either.","identity_refutation":"REFUTED my own rig theory for the healthy boards: b2 stalled at 16 cases with rdev 166.3, b3 at 17 cases with rdev 166.5, path==real and unchanged since 00:22, so the console node never re-enumerated. The wall is a per-boot request ceiling on healthy nodes, engine-independent, as #392/#401 measured. Board 1's node re-creations (00:23/01:00/01:34) are a separate rig fault, not the same phenomenon. The identity lines earned their keep by refuting, not by confirming.","lane_diagnosis":"Both split-timer lanes were NOT frozen-polling as they looked: each ended with rc=1 after 'TimeoutError: board did not answer after one reconnect; case was not skipped, and no chip reset attempted'. b2 completed 16 device cases, b3 17, with ZERO divergences in every case reached, then died at a STATE/ack request (the raise is the #346 ack gate path, not the per-case request loop, which is why my WARN stalled_device_identity line never printed). Attribution payload was already delivered from the boot-bench table, identical on both boards.","next1":"Harvest KB LOG on board 1 and settle the logf(1.0f) skip on a measured cost instead of an assumed one: shipping 1,280 logf/token, 13.58% exactly 1.0f, so the skip is bit-exact and pays 174 x (L-4) cycles; it clears the 0.2% bar iff L >= ~560 cycles. Printed break-even is in the KB LOG OPERANDS line.","next2":"Read the two attribution harvests: board 2's real-request table gives attn-stage by differencing two prof_dump snapshots (the 99.1 ms parent vs 40.1 ms of named children is the largest unexamined number in the token, and #344 forbids subtracting overlapping cumulative timers); board 3's of-taps:q/k/v names which of the three tap_projection calls owns 3.3 ms.","next3":"Owner-side, and now the top blocker for value already measured: the radix-4 fusion is +0.58% with seven agreeing readings, zero divergences, zero RAM cost, and cannot be accepted because the 20-case single-session device gate is unreachable under the 16-20 request per-boot ceiling. Also phi row residency (needs ~18 KB/core vs 12,855 B, gated on #293) and the bar itself.","own_bug_caught":"my own pre-launch check on the kbench candidate was vacuous: I tested that 'ND_KB_NOINLINE' appeared before the first occurrence of 'kb_log_sweep' in the file text, which matched my own inserted comment while the macro was not defined at the point of use - the build then failed at line 915. Fix uses __attribute__((noinline)) directly. Fifth-plus instance of a check of mine passing while verifying nothing; the positive control here is a compile that must FAIL, which it did.","provenance_practice":"board 3's EXPECT value is now computed from the APPLIED worker tree with the same glob measure.sh uses, not hand-assembled: my first hand-computed composite omitted a second header in engine/include and would have false-aborted a correct tree. Also restored board 3's kbench.c to the accepted version so the diagnostic benches cannot affect a measured image.","retry_considered_not_taken":"condT (+0.294% twice on board 2, vetoed 19/20) was the discard whose rollback reason looked stale after #393/#394 showed the accepted image diverging in the same tail region. Reading #392 settles it: condT's lane COMPLETED all 20 cases in canonical order, so its single divergence was not a stall or ordering artefact. Rejection stands; no board spent."}}
