{"run":633,"commit":"76de498","metric":5.365,"metrics":{"boot_bench_tps":5.427,"device_output_exact":18,"device_token_delta":52,"ext_decode_tps":5.2915,"gen_tokens":99,"host_output_exact":19,"internal_free":6191,"logit_max_delta":0.00005341,"logit_top1_match":10,"min_case_tps":5.15,"prefill_tps":5.645,"psram_free":2052252,"think_tps":4.23},"status":"keep","description":"B1 full gate: accepted bundle5 + B4W + late-installed lossless RX ring (engine 803f6fe390e3; ring = UART driver + esp_vfs_dev_uart_use_driver installed LATE per #495, CMake esp_driver_uart; no other change). ALL 20 device cases COMPLETED - the 17-case console stall is GONE, the transport blocker is resolved by the lossless ring exactly as diagnosed (case 17 is the first >128-byte request). Primary decode 5.365 = +1.163% over the bundle5 pin; extended 5.2915 (+1.235%), think 4.23 (+0.71%), boot 5.427, heap 6191. Device 18/20 rc=1, token_delta 52: the SAME two frozen heldout failures now reproduce on the accepted 20/20 ancestor carrying ONLY the B4W attention diff - the failures are not exclusive to the unaccepted quant/asm/scheduler stack. Speed gain is real on the shippable base; shipping still blocked by the unchanged quality gate.","timestamp":1790292482700,"segment":1,"confidence":11.334019204389579,"asi":{"attribution":"the two frozen failures REPRODUCE on the accepted 20/20 ancestor when only the B4W attention diff is present (quant/asm/scheduler intact, delta 52 identical to the seed's) - so the failure trigger is NOT unique to the unaccepted stack; it is either B4W's image layout or a speed/timer interaction in the two tool-timing cases. Open question for mentor, no causation claimed.","hypothesis":"accepted bundle5 + B4W + late-installed lossless RX ring (transport-only fix; ring after model/prefix alloc, before boot loop): does the ring clear the 17-case console stall and what is the frozen-gate truth of the shippable-base B4W?","board":"1, bundle5 pin 5.3033, engine 803f6fe390e3","result":"all 20 cases COMPLETED (stall gone - ring resolves the blocker), primary +1.163 pct, ext +1.235 pct, think +0.71 pct, boot 5.427 (vs no-ring era), heap 6191 (ring costs ~1.4 kB internal vs no-ring transplant's 8415-class)","next":"mentor's attribution call; discovery lanes continue on B4W-family composition meanwhile (b2 gate running)","caveat":"NOT shipping: 18/20 fails the frozen gate even on the quality-passing ancestor"}}
{"run":634,"commit":"76de498","metric":5.6883,"metrics":{"boot_bench_tps":5.747,"device_output_exact":6,"device_token_delta":0,"ext_decode_tps":5.6485,"gen_tokens":99,"host_output_exact":19,"internal_free":5343,"logit_max_delta":0.00005341,"logit_top1_match":10,"min_case_tps":5.44,"prefill_tps":6.0067,"psram_free":2052252,"think_tps":4.46},"status":"discard","description":"Counted-QKTILE2 (two-column QK walk with decreasing pair count and advancing pointers; probe object proved the hardware loop contains the exact 4 mul + 4 madd + 4 add target graph) reads 5.6883 on board 3 = -0.18% BELOW B4W's 5.6983 despite getting the hardware loop: the loop body reloads 12 stack operands per iteration. The bnez form measured null (QKTILE2 #628), the counted hardware-loop form measures negative - only DOT8W's extended-LEND form converts the QK-loop restructuring into a gain. Loop-form axis CLOSED at -0.18/0.00/+0.53. 6/6, delta 0, heap 5343.","timestamp":1790292502409,"segment":1,"confidence":11.334019204389579,"asi":{"hypothesis":"Counted QKTILE2: decreasing pair-count + independent pointers so xtensa hwloop_optimize accepts the two-column QK body (probe object: hardware loop at +0x11e1 containing exactly 4 mul.s + 4 madd.s + 4 add.s, but 12 lsi operand reloads per iteration).","board":"3, B4W base (ref 5.6983), engine 89af9fb83345","verdict":"hardware LOOP is real but SLOWER than the bnez form it replaces (-0.18 pct) and far below DOT8W (+0.53 pct): the loop wins the scheduling battle and loses the memory battle - 12 reloads/iter from stack vs B4W's 8 staged uses. QK loop-form axis CLOSED: bnez null (QKTILE2), counted hardware loop negative, DOT8W extended-LEND is the only positive form.","next":"b2 composition gate still running; b3 free - next substitute per queue is the parked odd-head outlining ONLY if someone repairs the generator cheaply, else hold for mentor's fresh ideas","closed_for_sure":"no 16-wide, no counted sweeps, no asm barriers while chasing hwloop (mentor rule held)"}}
{"run":635,"commit":"76de498","metric":5.7467,"metrics":{"boot_bench_tps":5.819,"device_output_exact":18,"device_token_delta":52,"ext_decode_tps":5.6631,"gen_tokens":99,"host_output_exact":19,"internal_free":4823,"logit_max_delta":0.00005341,"logit_top1_match":10,"min_case_tps":5.51,"prefill_tps":6.06,"psram_free":2052252,"think_tps":4.46},"status":"keep","description":"DOT8W+SELRES composed gate cross-board CONFIRMED on board 2: decode 5.7467 - identical to board 3's screen (first composed winner reproduced on second silicon); EXTENDED 5.6631 best measured of the campaign (+0.87% over B4W, +0.22% over DOT8W), THINK 4.46, min_case 5.51, boot 5.819, heap 4823. Device 18/20 rc=1, token_delta 52 - the SAME two frozen heldout cases as every gate since the seed, no new failures. The B4W-family composition is now two-board confirmed with full breadth: +2.41% over both boards' seed pins.","timestamp":1790292645916,"segment":1,"confidence":11.334019204389579,"asi":{"breadth":"ext 5.6631 (best measured: +0.22 pct over DOT8W's 5.6508, +0.87 pct over B4W), think 4.46, min_case 5.51, boot 5.819","confirmed":"decode 5.7467 on b2 == 5.7467 on b3 screen: byte-identical source, byte-identical metric on two boards; +2.41 pct over b2 seed pin 5.6117, +2.37 pct over b3 pin","failure_set":"same two frozen heldout cases (heldout_interval_one, heldout_long_tools_note_only), token_delta 52 - identical to every gate since #589; reported not waived, oracle untouched","hypothesis":"DOT8W+SELRES composition cross-board FULL 20-case gate on board 2 (fresh signature, no allowance): confirm the campaign-best composed image with its own breadth","next":"the family (B4W pairing base, DOT8W QK width, SELRES selective rescale) is the acceptance proposal pending the owner's disposition of the frozen-gate pair and the mentor's attribution note from #633 (failures reproduce even on bundle5+B4W)"}}
{"run":636,"commit":"76de498","metric":5.725,"metrics":{"boot_bench_tps":5.792,"device_output_exact":6,"device_token_delta":0,"ext_decode_tps":5.6631,"gen_tokens":99,"host_output_exact":19,"internal_free":5087,"logit_max_delta":0.00005341,"logit_top1_match":10,"min_case_tps":5.48,"prefill_tps":6.0383,"psram_free":2052252,"think_tps":4.46},"status":"discard","description":"PV-COUNT (counted pointer-walk P.V update body on the DOT8W+SELRES composition; host-proven chain-identical, 6/6 device, delta 0) reads 5.725 on board 3 = -0.38% BELOW the composition's 5.7467 on the same board. The counted hardware-loop form that looked promising on the QK side is confirmed harmful on the update loop too: loop-form axis fully closed (-0.18 QK / 0.00 bnez tile / +0.53 only via DOT8W's extended-LEND four-column body). Composition remains the acceptance proposal at 5.7467 both boards.","timestamp":1790292752890,"segment":1,"confidence":11.334019204389579,"asi":{"hypothesis":"PV-COUNT: convert the paired four-cell P.V update loop to the counted pointer-walk form that captured the hardware loop on the QK side, on top of the composed DOT8W+SELRES image","board":"3, composition ref 5.7467, engine bc092db383cd","verdict":"counted pointer-walk hurts BOTH hot loops now (QK -0.18 pct, PV -0.38 pct) - the hardware-loop form is not the source of DOT8W's win; DOT8W wins as an extended-LEND four-column body. Loop-form family fully closed.","next":"all boards idle clean: b1 late-ring accepted stack (803f6fe390e3), b2+b3 carry the confirmed composition (10c74c756ee5); next step is mentor's fresh-ideas block + owner disposition of the frozen pair, or a new composition axis if one is proposed","detail":"boot 5.792 vs 5.819, prefill 6.038 vs 6.06, min 5.48 vs 5.51, heap 5087 vs 4823 - uniform small decline, not a trade"}}
{"run":637,"commit":"76de498","metric":5.7467,"metrics":{"boot_bench_tps":5.819,"device_output_exact":18,"device_token_delta":52,"ext_decode_tps":5.6631,"gen_tokens":99,"host_output_exact":19,"internal_free":4823,"logit_max_delta":0.00005341,"logit_top1_match":10,"min_case_tps":5.51,"prefill_tps":6.06,"psram_free":2052252,"think_tps":4.46},"status":"keep","description":"Behavioural capture GREEN on the confirmed composition: board 2 running DOT8W+SELRES-on-B4W (engine 10c74c756ee5, tree f9771a74b256) completed CAP_RC=0 with all seven recorded scenarios matching route and tools (external-selection cases routed correctly; sampling/timer/batch executed locally by Needle), API torn down with no console handle left held. That was the last acceptance evidence the composition lacked: it now holds two-board identical decode 5.7467 (+2.41% over both seed pins), best-ever extended 5.6631, think 4.46, min_case 5.51, host 19/19 byte-exact, fidelity 5.341e-05, and the only outstanding item is the owner's disposition of the two boot-state-dependent demo goldens (18/20, delta 52 - which #633 showed reproduce even when only B4W's attention diff is present on the accepted 20/20 ancestor).","timestamp":1790293021826,"segment":1,"confidence":11.334019204389579,"asi":{"hypothesis":"behavioural capture (repo's own end-to-end integrity check) on the confirmed composition image on board 2 - the acceptance packet's last missing evidence","coverage":"7 recorded scenarios all route_match/tools_match true (translation, coding, architecture external-selected; sampling, timer, batch and one more executed locally by Needle); lane_capture.sh ran the API on b2's console with the worker's own tree (f9771a74b256/57a0fa8af900)","packet":"composition acceptance evidence now COMPLETE: two-board speed 5.7467/5.7467, full gates with ext 5.6631 best-ever, 18/20 = same frozen pair, capture green, host 19/19, fidelity 5.341e-05","next":"all boards idle clean; what gates acceptance is the owner's disposition of heldout_interval_one + heldout_long_tools_note_only (delta 52, reproduces even on bundle5+B4W per #633) - no further engineer measurement changes that decision","cleanup":"serial_api child verified dead, no console handle held"}}
{"run":638,"commit":"8f4d052","metric":5.4067,"metrics":{"boot_bench_tps":5.485,"device_output_exact":6,"device_token_delta":0,"ext_decode_tps":5.2915,"gen_tokens":99,"host_output_exact":19,"internal_free":5679,"logit_max_delta":0.00005341,"logit_top1_match":10,"min_case_tps":5.22,"prefill_tps":5.7,"psram_free":2052252,"think_tps":4.29},"status":"keep","description":"SHIPPABLE-BASE COMPOSITION on board 1: accepted bundle5 + composed attention family (B4W+DOT8W+SELRES) + lossless RX ring reads decode 5.4067 = +1.952% over the bundle5 pin (5.3033), 6/6 primary byte-exact, token_delta 0, rc=0, heap 5679. The full attention family transfers even better to the accepted base (+1.95%) than B4W alone did (+1.16%), narrowing the owner's decision to one commit on accepted quant/asm/scheduler code pending only the two demo-timer goldens.","timestamp":1790293255648,"segment":1,"confidence":11.334019204389579,"asi":{"hypothesis":"accepted bundle5 base + FULL attention family (B4W pairing + DOT8W QK8 + SELRES = the composed 10c74c756ee5 model diff) + lossless RX ring: does the composed attention win transfer to the shippable base, and what does the owner's single-decision tree read?","board":"1, bundle5 pin 5.3033, engine 177bd44997fa, AUTO_GROUPS=primary","result":"+1.952 pct on the ACCEPTED base vs +1.52 pct on the seed-era base - the family transfers BETTER to bundle5 than the parts did (B4W alone +1.163); heap 5679, boot bench 5.485","meaning":"if the owner disposes the two demo-timer goldens, ONE commit (bundle5 + nd_model.c.cmp-d8sr + ring main.c/CMake) ships +1.95 pct on accepted quant/asm/scheduler code with no unaccepted stack - the minimal-risk path to the discovery","next":"all boards idle: b1 this tree, b2+b3 the seed-era composition at 5.7467; full-gate this b1 tree only if the owner engages (18/20 expected by #633's pattern)","gate":"DEVICE_GATE_OK_RESTRICTED 6/6, token_delta 0, rc=0; full 20-case not run on this exact tree (expected 18/20 delta52 by the B4W-alone precedent)"}}
{"run":639,"commit":"8f4d052","metric":5.4083,"metrics":{"boot_bench_tps":5.476,"device_output_exact":18,"device_token_delta":52,"ext_decode_tps":5.3377,"gen_tokens":99,"host_output_exact":19,"internal_free":5679,"logit_max_delta":0.00005341,"logit_top1_match":10,"min_case_tps":5.2,"prefill_tps":5.6867,"psram_free":2052252,"think_tps":4.26},"status":"keep","description":"Shippable-base composition FULL gate on board 1: bundle5 + B4W/DOT8W/SELRES composed attention + lossless RX ring reads decode 5.4083 (+1.973% over the 5.3033 accepted pin), EXTENDED 5.3377 (+2.12% over bundle5's 5.2269 - best on the accepted base), think 4.26, min_case 5.20, boot 5.476, heap 5679. All 20 device cases COMPLETED (the ring holds across the whole suite); 18/20 with token_delta 52 - exactly the two boot-state demo-timer goldens, which pass byte-exact on host for every image. The one-commit owner-decision path is now fully evidenced: +1.97% on accepted code, transport defect fixed, only the frozen-pair disposition outstanding.","timestamp":1790293692979,"segment":1,"confidence":11.334019204389579,"asi":{"breadth":"ext 5.3377 (best measured on the accepted base: +2.12 pct vs bundle5's 5.2269, +0.88 pct over B4W-alone's 5.2915), think 4.26, min_case 5.20, boot 5.476","correction":"supersedes #638's carried ext/think values - those came from the B4W-alone tree; the composed-tree breadth is THIS entry","failure_set":"same two demo-timer goldens, token_delta 52, identical to every gate since the seed - and both pass on host 19/19, i.e. device-only state dependence","hypothesis":"FULL 20-case breadth gate of the shippable-base composition (bundle5 + composed attention family + lossless RX ring) - the tree the owner can ship in ONE commit without any unaccepted quant/asm/scheduler change","board":"1, engine 177bd44997fa, bundle5 pin 5.3033, documented repeat allowance used with reason","result":"all 20 device cases COMPLETED (ring holds on the full suite), decode 5.4083 = +1.973 pct, 18/20 delta 52 with only the two boot-state demo-timer goldens failing (identical to the seed-era gates, passes host 19/19)","packet":"the owner's single-decision tree is now fully measured: speed two-context (+1.97 accepted base / +2.41 seed base), breadth complete, transport defect fixed, capture green on the seed-era twin"}}
{"run":640,"commit":"8f4d052","metric":5.7467,"metrics":{"boot_bench_tps":5.82,"device_output_exact":18,"device_token_delta":52,"ext_decode_tps":5.6646,"gen_tokens":99,"host_output_exact":19,"internal_free":4823,"logit_max_delta":0.00005341,"logit_top1_match":10,"min_case_tps":5.51,"prefill_tps":6.06,"psram_free":2052252,"think_tps":4.47},"status":"keep","description":"Composition third-board FULL gate (board 3, seed-era base, documented allowance): decode 5.7467 - byte-identical primary on the third independent board (b2 gate, b3 gate, both screens all 5.7467); EXTENDED 5.6646 new campaign best, THINK 4.47, min_case 5.51, boot 5.820, heap 4823. Device 18/20 rc=1, token_delta 52 - the same two demo-timer goldens, no new failures, all 20 cases completed. The composed attention family (pairing + 8-column QK + selective rescale) is now three-board screen-confirmed and two-board full-gate-confirmed with capture green: +2.37..2.41% over both seed pins, and +1.97% on the shippable bundle5 base (#639).","timestamp":1790294084019,"segment":1,"confidence":11.334019204389579,"asi":{"breadth":"ext 5.6646 (new campaign best, edges b2's 5.6631), think 4.47, min_case 5.51, boot 5.820, heap 4823","confirmed":"decode 5.7467 on a THIRD board - primary mean byte-identical on b3 screen, b2 gate, b3 gate; +2.37 pct over b3's 5.6133 pin","failure_set":"same two demo-timer goldens only, delta 52; all 20 cases completed","hypothesis":"third-board FULL 20-case gate of the composed DOT8W+SELRES-on-B4W image (b3, documented repeat allowance with reason) to complete the acceptance breadth pattern","packet":"composition fully evidenced on all three boards: screens b2/b3, full gates b2+b3, capture green, host 19/19, fidelity 5.341e-05; shippable-base twin (+1.97 pct) gated on b1 #639","next":"engineer-side evidence is complete for both proposals; waiting states are owner disposition of the two timer goldens and mentor's next-hour ideas"}}
{"run":641,"commit":"8f4d052","metric":5.4083,"metrics":{"boot_bench_tps":5.476,"device_output_exact":18,"device_token_delta":52,"ext_decode_tps":5.3377,"gen_tokens":99,"host_output_exact":19,"internal_free":5679,"logit_max_delta":0.00005341,"logit_top1_match":10,"min_case_tps":5.2,"prefill_tps":5.6867,"psram_free":2052252,"think_tps":4.26},"status":"keep","description":"Capture GREEN on the shippable-base ring tree (bundle5 + composed attention + RX ring, board 1, CAP_RC=0, 7/7 scenarios). This tested the one real risk of the transport fix - the ring replaces the polled console FIFO and capture drives the board through needle-api on that same console - and it passes end to end. Both acceptance proposals are now fully evidenced: seed-era composition 5.7467 (three-board, two full gates, capture green) and shippable-base 5.4083 (+1.973% on accepted code, full gate, capture green, console-wedge defect fixed). Only the owner's disposition of the two boot-state demo-timer goldens stands between either commit and shipping.","timestamp":1790294334875,"segment":1,"confidence":11.334019204389579,"asi":{"hypothesis":"behavioural capture of the SHIPPABLE-BASE tree (bundle5 + composed attention + lossless RX ring) on board 1: the ring changes console INPUT handling and capture.py drives the model through needle-api on that console - this is the transport fix's real risk test","result":"CAP_RC=0, all 7 recorded scenarios route_match/tools_match true, API attach/teardown clean, no console handle left held","meaning":"the RX ring is compatible with the production API path (attach, prompt, END-marker streaming, think toggle) - the transport fix carries no behavioural regression on the tree that would actually ship","next":"evidence for both proposals complete; b1 shippable tree, b2+b3 seed-era tree, all idle; owner disposition of the two timer goldens is the single blocker to either commit landing","packet":"shippable-base evidence now: +1.973 pct speed, ext +2.12 pct, 18/20 delta52 host-clean pair, capture green, all-20 sessions work (stall defect fixed)"}}
{"run":642,"commit":"8f4d052","metric":5.4083,"metrics":{"boot_bench_tps":5.476,"device_output_exact":18,"device_token_delta":52,"ext_decode_tps":5.3377,"gen_tokens":99,"host_output_exact":19,"internal_free":5679,"logit_max_delta":0.00005341,"logit_top1_match":10,"min_case_tps":5.2,"prefill_tps":5.6867,"psram_free":2052252,"think_tps":4.26},"status":"keep","description":"Host-evidence gap closed for the shippable-base tree: board 1's own checks.sh on the bundle5+composed-attention+ring tree (engine 177bd44997fa) reports host 19/19 byte-exact including both frozen demo-timer cases, fidelity 5.341e-05, top1 10/10, CHECK_RC=0. b1's measure.sh prints no host metrics, so this half had been inherited from the seed-era workers whose engine files differ - now measured on the shipping tree itself. Evidence for both acceptance proposals is complete with zero assumed values.","timestamp":1790294516736,"segment":1,"confidence":11.334019204389579,"asi":{"hypothesis":"run the host quality half (checks.sh: host build, 19-case byte-exact goldens incl. the two frozen ones, fidelity probe) ON BOARD 1'S OWN shippable-base tree - b1's measure.sh prints no host metrics, so the host byte-exact evidence for the bundle5+composed+ring tree had been ASSUMED from b2/b3 (different engine files) rather than measured there","found":"assumption closed honestly: host_lines_same=19, max_delta 5.341e-05, top1 10/10, CHECK_RC=0 on the exact b1 tree - the host-side evidence is now measured on the shipping tree itself, both frozen cases pass byte-exact on host","harness":"b1's bundle5-era measure.sh does not emit METRIC host_* lines; checks.sh is the host authority and must be run per-tree where it matters","next":"no evidence gap remains on either proposal; pool idle; awaiting owner disposition of the frozen pair and mentor's next refresh","board":"none used - host build inside checks.sh only"}}
