{"run":404,"commit":"787fea9","metric":5.1167,"metrics":{"boot_bench_tps":5.194,"device_output_exact":20,"device_token_delta":0,"ext_decode_tps":5.0423,"gen_tokens":99,"host_output_exact":19,"internal_free":12855,"logit_max_delta":0.00005341,"logit_top1_match":10,"min_case_tps":4.91,"prefill_tps":5.4367,"psram_free":2052252,"think_tps":4.01},"status":"keep","description":"Cold-path IRAM refund: the fusion candidate's cost objection is RETIRED. The field-dead transform fallbacks (fw_scale, nd_fwht2, nd_fwht3s - the pair/single tails that run zero times per token because every nd_cq_prepare site has ngroup 6 or 24, run #396) were both ND_HOT *and* inlined at -O2, so they occupied internal heap twice; dropping ND_HOT and adding noinline moves ~1.1 KB of text to flash, which run #385 measured as a zero-cost crossing for a path that never executes. The helpers stay present (deleting an unused tail is run #333's silent-drop class) and the oracle still proves bit-exactness over 1,472,640 comparisons plus host 19/19 and odd-split 0/30. Device: decode 5.1467 (+0.58 % over the accepted 5.1167, fusion speed fully preserved), think 4.01, boot_bench 5.194 (193 ms/token), prefill 5.4367, min_case 4.91, gen_tokens 99, token_delta 0, device byte-exact 7/7 with golden_missing 0, psram unchanged - and internal_free 12,855, i.e. EXACTLY the accepted figure, so the fusion's 1,024 B price is now zero. Accepted runtime stays 5.1167 because the 20-case single-session device gate is still unreachable (engine-independent console wedge at case 17-18).","timestamp":1790206966780,"segment":1,"confidence":19.34201012292117,"asi":{"finding":"Fusion + noinline-cold-fallbacks measured: decode 5.1467 (+0.58 %), think 4.01 (+0.50 %), boot_bench 5.194 = 193 ms/token (+0.62 %), prefill 5.4367, min_case 4.91, gen_tokens 99, token_delta 0, device byte-exact 7/7 golden_missing 0, psram unchanged, and internal_free 12,855 - the accepted value to the digit. So the fusion now ships at ZERO internal-RAM and ZERO PSRAM cost, and every measured monitor is up. The off-device prediction (.iram0.text -1,116 B) over-shoot the observed 1,024 B refund slightly (alignment/other sections), which is worth remembering when pricing RAM from size(1).","mechanism":"The cold-path class is general, not transform-specific: any ND_HOT static single-call-site helper whose path the field never takes is paying internal heap twice over - first because GCC inlines it into the hot caller whatever its section attribute says, second because the surviving out-of-line body still lands in IRAM. The fix is the attribute pair (drop ND_HOT, add noinline), and run #385 already proved the resulting IRAM-to-flash crossing costs zero cycles, which is free here anyway since the path is never executed.","off_device_first":"The refund was measured before any board: .iram0.text 73,551 -> 72,435 (-1,116 B) and .flash.text 148,612 -> 149,612 (+1,000 B, i.e. the bodies moved rather than vanished) from two builds and size(1). That is a 4-minute build and zero board time to establish a candidate's cost axis, and it is the cheapest decisive measurement of this window.","next_three":"(1) One full-suite sole-board acceptance attempt on THIS tree (pool idle, no other emitters, no diag switches), which is the only remaining route to the formal device_output_exact=20 gate; the candidate has never been this close to shippable. If it stops at 16-17 again, it goes to the owner with the firmware defect report and the full measured record. (2) If the gate lands, run make capture on the accepted image and re-derive the phase map (boot bench is now 193 ms/token, so every per-phase share in the ledger is stale by ~2 %). (3) Apply the cold-path refund lever to the other ND_HOT helpers the field never reaches (nd_fwht itself is now only used by nd_cq_dequant_row, i.e. cold) - a heap-positive change that could re-price the phi residency idea, though it cannot be kept on the decode metric alone.","safety":"The fallbacks were kept PRESENT and merely de-optimised; deleting them would have been the smaller diff and is exactly run #333's silent-drop failure class. The equivalence oracle still passes over 1,472,640 comparisons spanning n=2..1024, and the odd-split guard over the 3+3 device split is unaffected (arithmetic unchanged).","status":"GATE STILL PENDING: device_output_exact_min is 20 and this session ran 7 cases, so the device byte-exact gate was skipped by design and the accepted runtime stays 5.1167. What changed is that the last non-speed objection to the fusion is gone: it is now +0.58 % at zero RAM cost."}}
{"run":405,"commit":"59ba937","metric":5.1167,"metrics":{"boot_bench_tps":5.194,"device_output_exact":20,"device_token_delta":0,"ext_decode_tps":5.0423,"gen_tokens":99,"host_output_exact":19,"internal_free":12855,"logit_max_delta":0.00005341,"logit_top1_match":10,"min_case_tps":4.91,"prefill_tps":5.435,"psram_free":2052252,"think_tps":4.01},"status":"keep","description":"Acceptance attempt #5 on the fusion+cold-refund candidate, pool idle and no diagnostic switches: 17 of 20 device cases with ZERO divergences, decode 5.1467 (seventh agreeing reading, +0.58 %), prefill 5.435, min_case 4.91, gen_tokens 99 - then the engine-independent console wedge again (TimeoutError after one reconnect, no chip reset attempted, no case skipped, rc=1). The formal 20-case device gate is therefore still unreachable and the accepted runtime stays 5.1167; the candidate's record is now complete for an owner decision (five attempts, two engines, three boards, never below 16 cases, never a divergence, zero RAM cost). The real finding of this iteration is a harness bug in my own anti-repeat guard: the documented .auto/diag_repeat_ok override could never fire because the guard reads $AUTO_LOG_DIR (= .auto/runs/local), so the marker had never once executed its purpose across three uses. Fixed to accept either location and to require a non-empty reason, and proven by the in-situ positive control - this run printed EXPLICIT_REPEAT_ALLOWED and proceeded past a signature it had already recorded. Also began an IRAM-text census off the #404 refund lever and found lut2_tie728.S holding 5,871 B of IRAM across five kernels, one per pair-LUT variant, which is the cheapest known route to the heap the phi residency idea needs.","timestamp":1790207774380,"segment":1,"confidence":19.34201012292117,"asi":{"candidate_state":"fw3foldnb+cold-refund (engine a800d1ea1896): decode 5.1467 = +0.58 % over the accepted 5.1167, seventh agreeing reading; think 4.01, boot_bench 5.194 (193 ms/token), prefill 5.435, min_case 4.91, gen_tokens 99, internal_free 12,855 (zero RAM cost after the #404 refund), psram unchanged, and 17 device cases with ZERO divergences. Five single-session attempts on two engines and three boards have now reached 16, 16, 17, 17, 17 of 20 and never fewer than 16 with zero divergences. The accepted runtime stays 5.1167 because the rule is device_output_exact over the full 20-case set in one session and the board will not answer past case ~17 - an engine-independent firmware/console defect (the accepted image reproduces it at the same position, #400/#401). This is now an owner decision with a complete measured record, not an unresolved measurement.","defect_report_for_owner":"Console/RX wedge: after roughly 6-17 requests per boot (6 with three boards emitting, 16-17 with the pool idle - so traffic accelerates but does not cause it), the board stops answering both requests and a non-mutating !status with DTR/RTS pinned, while TX boot output continued normally earlier in the session. A fresh attach does not recover it; only a chip reset does, and a reset re-arms the firmware's demo timer and sampling counters, which is why AUTO_HARD_RESET is off by default (#391: mixing two boot contexts into one byte-exactness verdict is worse than failing). Five gated attempts, three boards, three engines: 16/16/17/17/17.","harness_fix":"FIXED AND PROVEN: the documented file-form repeat override (.auto/diag_repeat_ok) could never have fired, because the guard looks under AUTO_LOG_DIR, which is $PWD/.auto/runs/local, not .auto. I had written that marker three times and every refusal was that bug plus a genuinely new signature. measure.sh now accepts the marker in either location and requires a NON-EMPTY reason (-s, not -f). Positive control in situ, not inference: this run printed EXPLICIT_REPEAT_ALLOWED and proceeded past signature f5cdf24c, which it had already recorded in run #404 - the exact code path that had never once executed before. Sixth instance this campaign of a check that reported success while verifying nothing, and the first one I got to execute its own purpose on the same day it was found.","next_three":"(1) Census the IRAM text properly and refund it: lut2_tie728.S owns 5,871 B of IRAM across FIVE kernels (lut2_tie2 1,888 + lut2_tie1p/tie1n/tie1m/tie1 at 958 each) while the ledger names tie1n as the shipping row walker; if the archive's geometry can only ever dispatch to a subset, the rest is dead IRAM, and IRAM text is internal heap. Quantify with nd_lut2_asm_ok's dispatch rules plus reachability, then refund by moving unreachable variants out of IRAM (keeping them present, #333's rule) and re-measure internal_free. This is the cheapest route to the phi 4-bit row residency (+0.39 % ceiling), which needs ~18 KB/core against 12,855 B. (2) Owner report: fw3foldnb is +0.58 % at zero RAM cost with 17/17 case comparisons and zero divergences, plus the wedge defect. (3) Re-derive the phase map on the candidate (boot bench is 193 ms/token now, so every share in the ledger is stale by ~2 %).","self_inflicted":"Two consecutive vacuous parses of the linker map: first I grepped for .iram0.text.* input sections (Xtensa spells them .iram1.*), then my fallback regex matched nothing and printed sum=0 against a known 72,435-byte section. Both were caught only because I printed coverage against the known total - which is the positive-control discipline this ledger keeps demanding. Current parse reaches 13.4 % coverage, so the per-object numbers below are a floor on lut2_tie728.S and NOT yet a complete census; the census is incomplete and is stated as incomplete, not as a result."}}
{"run":406,"commit":"406","metric":5.1167,"metrics":{"boot_bench_tps":5.196,"device_output_exact":20,"device_token_delta":0,"ext_decode_tps":5.0423,"gen_tokens":99,"host_output_exact":19,"internal_free":13111,"logit_max_delta":0.00005341,"logit_top1_match":10,"min_case_tps":4.91,"prefill_tps":5.44,"psram_free":2052252,"think_tps":4.01},"status":"discard","description":"Call-structure screen on the fused walk (noinline nd_fwht4s) + the dead-asm census refuted. Speed: decode 5.1467 - identical to the inlined bundle, eighth agreeing reading - boot_bench 5.196 (192 ms/token), prefill 5.44, think 4.01, min_case 4.91, token_delta 0, device byte-exact 7/7, oracle 0/1,472,640, and internal_free 13,111 (+256 B). So the call/inline axis is NEUTRAL for this loop, which brackets the lever in both directions against run #375's -0.166 % for inlining; a heap-only gain cannot be kept on a decode metric, and run #382 is the precedent for not trading provenance for a few hundred bytes, so it is recorded as a free owner option. Separately, the queued \"dead IRAM asm to refund\" hypothesis is dead: nm shows only nd_lut2_rows_tie1n in IRAM and --gc-sections already collects tie1/tie2/tie1p/lut2_probe - my 5,871 B figure came from the map's DISCARDED input sections block, and the 13.4 % coverage I printed was the tell. With that refuted, the only heap lever left in-tree is the assertion level (#293, owner-gated), so phi residency stays out of reach and the in-rule speed queue is empty: the transform family is now closed on width, stage fusion, pass count, rescale placement, stage order AND call structure.","timestamp":1790208238501,"segment":1,"confidence":19.34201012292117,"asi":{"census_refutation":"The dead-IRAM-asm idea is REFUTED off-device for zero board cost: nm on both the main and the rebuilt worker ELFs shows only nd_lut2_rows_tie1n present in IRAM (0x4037e70b); tie1/tie2/tie1p/lut2_probe are collected by --gc-sections, so there was never 3.9 KB of unreachable IRAM to refund. My 5,871 B 'lut2_tie728.S owns IRAM' figure came from the map file's DISCARDED input sections block, and the tell was already printed: the parse covered only 13.4 % of the section. RULE: a linker-map census must be scoped to the output-section region and cross-checked against nm addresses (0x4037xxxx = IRAM, 0x42xxxxxx = flash) - nm is the oracle, the map is a hint. Seventh vacuous-parse instance this campaign, and each time the fix was the same: print a coverage or control number.","finding":"noinline on the hot fused walk nd_fwht4s: decode 5.1467 (identical to the inlined bundle, eighth agreeing reading of this speed), boot_bench 5.196 = 192 ms/token, prefill 5.44, think 4.01, min_case 4.91, gen_tokens 99, token_delta 0, device byte-exact 7/7 golden_missing 0, and internal_free 13,111 vs 12,855, i.e. +256 B back. So call structure is a NEUTRAL axis for this loop - unlike run #375, where inlining nd_fwht into fwht_rows cost -0.166 %. Useful because it brackets the lever in both directions rather than assuming the #333 sign generalises.","heap_axis_status":"With the dead-asm refund refuted, the only remaining internal-heap lever inside the tree is the assertion level (#293: +8,248 B at level 0, +6,200 B at level 1, speed neutral), which is an owner decision because it removes failure diagnostics. Until then phi 4-bit row residency (+0.39 % ceiling, ~18 KB/core) stays out of reach at 12,855 B, and the campaign's speed queue inside the rules is empty: the transform family is closed on width, stage fusion, pass count, rescale placement, stage order and now call structure.","not_kept_reason":"Primary metric unchanged, so the rule says discard, and run #382 is the exact precedent (a tied reading trading byte-exact provenance for 74 B was not swapped). The 256 B is recorded as a free option the owner can take at any time; it is not worth re-opening the candidate's provenance chain for, because the acceptance blocker is the 20-case gate, not 256 bytes.","next_three":"(1) ext_decode_tps for the fusion+cold-refund bundle in its own extended-only session (13 requests, pool idle) - the one monitor the candidate record still lacks, and the restricted session cannot serve as the gate, only as a speed reading. (2) Owner report: the fusion bundle is +0.58 % decode / +0.50 % think / +0.62 % boot bench at ZERO internal and PSRAM cost, bit-exact by construction and by 1.47 M-comparison oracle plus 19/19 host goldens, with five gated attempts reaching 16/16/17/17/17 device cases and never one divergence - acceptance needs either the owner to accept that evidence or the console wedge (firmware defect, engine-independent, accepted image reproduces it) to be fixed. (3) Re-derive the phase map on the candidate image: boot bench is 192-193 ms/token now against the ledger's 197, so every per-phase share quoted in .auto/prompt.md is stale by ~2 % and any future ranking should start from a fresh AUTO_PROFILE=1 harvest.","provenance_gap_found":"Worth noting for the next window: the PROVENANCE line measure.sh prints hashes engine/src/nd_quant.c only, so an assembly-only candidate would not be caught by that assertion (the anti-repeat shipping_signature() does cover it, since it hashes all of engine/ esp32/ host/ tools/ model/). Narrow gap, cheap fix: extend the engine_md5 to the two .S files."}}
