{"run":435,"commit":"956b50a","metric":5.3033,"metrics":{"boot_bench_tps":5.343,"device_output_exact":20,"device_token_delta":0,"ext_decode_tps":5.2269,"gen_tokens":99,"host_output_exact":19,"internal_free":13367,"logit_max_delta":0.00005341,"logit_top1_match":10,"min_case_tps":5.07,"prefill_tps":5.59,"psram_free":2052252,"think_tps":4.2},"status":"keep","description":"Kroncker transpose-staging candidate closed off-device; fresh attribution harvest launched; accepted runtime stays 5.3033. (1) Off-device, zero board time: the last layout-restructuring idea - transpose-stage the Kroncker first half's `src`, which is re-swept 8 times per call with a 32-float stride (11.1 ms phase, the same lever class that shipped as condT) - is dead on the allocation site rather than on argument. hada_a/hada_b/hada_c are all ND_ALLOC_FAST (internal SRAM), and run #374 established this part does not route internal SRAM through the data cache, so a strided read there costs the same LSU op as a contiguous one; the Kroncker operand that IS PSRAM-backed (the factor tables) is already read as contiguous 4-float rows. Rule extracted: layout levers pay only on PSRAM-backed operands - that is why condT measured 26.6 % cold and this class is otherwise empty. (2) Launched a fresh profiled request-path attribution harvest on board 2: the phase map is now eight levers stale and head4 changed the full-vocabulary logits path, so a re-attribution is the honest way to notice a hotspot created by the accepted changes; it is a diagnostic image, so no speed claim is made from it.","timestamp":1790246111231,"segment":1,"confidence":20.691250903832238,"asi":{"discard_invalidation_check":"Nothing revived. condT is not 'retried' by this - it SHIPPED in bundle5. The rule derived here explains why condT was the only member of the class that paid: it is the only hot operand that was both PSRAM-backed and column-swept. cond_u was already channel-major (#391), the qkv/engram tap tables are closed by two field runs (#414, #416), and the embedding candidate gather has n=6.7 rows.","hypothesis":"The Kroncker first half (11.1 ms of the 24.5 ms Hadamard phase) re-sweeps its `src` operand eight times - once per 4-row block - and each sweep touches one float per 128 B stride, i.e. one cache line per element for a 4 KB operand. Staging a transposed copy per call should convert eight strided sweeps into eight contiguous ones, the same layout lever that shipped as condT (+0.196 %).","next_action_hint":"Board 2 is running a fresh profiled request-path harvest at the new runtime (no candidate, no speed claim): the phase map is eight levers stale and head4 changed the full-vocabulary logits path, so a fresh attribution is the honest way to notice any hotspot the accepted changes created. Read it next iteration; if proj2bit / attention / hadamard shares moved unexpectedly, that is where a new premise - and so a new candidate - would come from. Otherwise the campaign has no unattributed mass left and the remaining items are the three owner-facing ones in .auto/OWNER_ACCEPTANCE_PACKET.md.","payload":{"hadamard_phase_ms":24.5,"kron_phase_ms":11.1,"kron_src_bytes":4096,"kron_src_sweeps_per_call":8,"kron_src_sweeps_saved":0},"premise_that_would_have_been_wrong":"Reading `kron1_blocks` alone suggested a large win: 8 sweeps x 1,024 strided single-float reads per sweep per call, three calls per layer, eight layers. The candidate is wrong because of one fact that only the allocation site tells: that operand is internal SRAM, and per run #374 this part does not route internal SRAM through the data cache - so there is no line amplification to remove, and transposing it changes the number of LSU operations by zero.","research_payload":"Off-device again, zero board time consumed by it: the last layout-restructuring idea on the board (transpose-stage the Kroncker first half's `src`, which re-sweeps a 4 KB operand eight times per call with a 32-float stride) is dead on the allocation site, not on argument. `hada_a`/`hada_b`/`hada_c` are all ND_ALLOC_FAST = MALLOC_CAP_INTERNAL|8BIT (nd_model.c:674-676), i.e. internal SRAM, which #374 established this part does NOT route through the data cache - so a strided read there costs the same LSU op as a contiguous one and a transposed copy changes nothing. The Kroncker operand that *is* PSRAM-backed (the factor tables fp[19..24]) is already read contiguously as 4-float rows.","rule_worth_keeping":"Layout/transposition levers pay only on PSRAM-backed operands, because only there does a strided access cost a line fetch. That is why condT (cond_v in the PSRAM fp32 staging pool) measured 26.6 % cold and shipped, and why the same class applied to internal-SRAM operands is a null by mechanism. State it before screening the next 'transpose this table' idea."}}
{"run":436,"commit":"7cf8a6f","metric":5.3033,"metrics":{"boot_bench_tps":5.343,"device_output_exact":20,"device_token_delta":0,"ext_decode_tps":5.2269,"gen_tokens":99,"host_output_exact":19,"internal_free":13367,"logit_max_delta":0.00005341,"logit_top1_match":10,"min_case_tps":5.07,"prefill_tps":5.59,"psram_free":2052252,"think_tps":4.2},"status":"keep","description":"Fusion rebased MEASURED +0.660 % (5.3383), Q96 tap partition MEASURED -0.094 % and retired, per-tensor assembly-verdict memo launched with an actual-source guard. Accepted runtime stays 5.3033 until the fusion reproduces cross-board and passes its own 20-case gate. (1) fusion-r5: composed from the real source as five hunks (fused radix-4 walk, peeled rescaled final stage, cold-path noinline refund) onto the accepted nd_quant.c - 9 agreeing readings on the old 5.1167 base, never shipped behind the console wedge, and now +0.660 % on bundle5 with prefill 5.6217 and min_case 5.10, 99 tokens, zero divergences so far. (2) tap96: giving dim=576 six 96-column units so rows_dual_core's `half < 2` guard stops running the Q tap projection single-core measured 5.2983 = -0.094 %, retired at turnover; the negative is consistent with the (still unmeasured) real cross-core wake cost. (3) asmemo: the single-entry lut2_asm_usable cache re-walks 130,560 immutable norms per token because a token visits 44 blobs; now a 64-slot open-addressed memo, key blob+rows+ngroup+g, cleared from nd_model_close because pointer stability within one open is not lifetime correctness. Guard includes the ACTUAL candidate nd_quant.c with ND_LUT2_ASM=1, gc-sections dropping the Xtensa walkers, 16/16 green.","timestamp":1790247338014,"segment":1,"confidence":20.691250903832238,"asi":{"asmemo":"Per-tensor memoisation of nd_lut2_asm_ok's verdict: the wrapper kept ONE (blob,rows) entry while a token visits 44 distinct blobs, so 130,560 immutable PSRAM norm reads ran per token on the calling core before any row dispatch; a kbench screen could never see it because it selected the function pointer outside the timing loop. 64 slots, open-addressed, key = blob+rows+ngroup+g (stronger than the accepted key), full-table probe recomputes rather than guessing, and nd_model_close() now clears it. Guard .auto/exp77/test_asmemo.c includes the ACTUAL candidate nd_quant.c with ND_LUT2_ASM=1 and calls the static predicate directly, linked -ffunction-sections -Wl,--gc-sections so the Xtensa walkers drop out: 16/16 including cached accept, cached reject at exponent 0 AND exponent 31, reset-then-reused-address giving the fresh verdict, geometry-key recompute, and 96 genuinely distinct keys over 64 slots. Host checks rc=0, fidelity identical.","host_gate_failure_caught":"The first host run of the candidate failed at LINK (checks.sh rc=1, ld error), because I placed the memo and its resetter inside the existing `#if ND_LUT2_ASM` block while nd_model_close calls the resetter and the host build compiles the asm off. Moved the table and nd_cq_asmemo_reset outside the guard, kept lut2_asm_usable inside, and corrected a stale comment at the same time that claimed the walk was 'once per token' - the accepted code's own comment was the artefact this candidate exists to fix. The failure was useful: it proved the host build really does compile ND_LUT2_ASM off, which is exactly why the operator refused to accept host goldens as coverage for this candidate.","hypothesis":"Three independent directions at once, per the mentor queue: (B1) rebase the never-shipped radix-4 stage fusion + cold-path IRAM refund onto bundle5; (B2) give the Q tap projection a 96-column partition, because a 256-column unit hands nd_parallel_rows three units for dim=576 and rows_dual_core's `half < 2` guard then runs the largest tap projection single-core; (B3/prep) memoise the immutable 2-bit assembly verdict per tensor instead of per call.","invalid_measurement_rechecked":"Two of my own errors were caught BEFORE a board: (1) my first fusion candidate installed `git show 787fea9:engine/src/nd_quant.c` whole, and that file predates head4, whose dispatch lives in the SAME file - the operator's diff showed the last hunk deleting `ctx.base = 0` + `gemv4_asm_usable` and restoring generic full-head dispatch, i.e. a silent -0.35 % hidden inside a transform candidate. The shipped candidate is the accepted file plus exactly five hunks, head4's block excluded, with the apply script refusing unless head4's markers survive. (2) My claim that a wrong memo verdict 'only costs speed' was false: the C and asm walkers are bit-equivalent only WHEN nd_lut2_asm_ok is true, so a stale false positive on a zero/subnormal/Inf/NaN norm changes arithmetic. Retracted in the docstring and covered by the guard.","next_action_hint":"1) Cross-board confirmation + 20-case gate for the fusion on the next free board (b1 at tap96 tail end); if it holds at ~5.338 it is +0.66 % and the acceptance candidate. 2) Read asmemo's primary on b2 - the prize is ~0.5 ms at 2 cycles/read and up to ~2 ms at cold-read cost. 3) The scheduler closure remains INVALID (#344's 23 cycles priced a serial indirect call because kbench never assigns nd_parallel_rows), and tap96's negative is now consistent with a real, unmeasured wake cost: the corrected two-core screen is the next focused measurement, because it decides whether any fine-grained split candidate can pay. 4) gemv4_asm_usable already has four entries - leave it alone.","payload":{"decode_fusion_r5":5.3383,"decode_tap96":5.2983,"fusion_delta_pct":0.66,"guard_passes":16,"host_checks_rc":0,"tap96_delta_pct":-0.094},"scheduler_finding":"The mentor's source-proven finding stands and is load-bearing: main.c:388 calls kbench_run then loops forever, so worker_start - which assigns nd_parallel_rows - never runs in a kbench image, and kbench creates its own split_rows without ever installing it. #344's '23 cycles hot or parked' therefore priced an indirect SERIAL call, and its parked probe's pdMS_TO_TICKS(3) is zero ticks at 100 Hz. The shipped assembly numbers are unaffected, but every conclusion drawn from that number about splitting small jobs is void."}}
{"run":437,"commit":"5ee1d62","metric":5.3033,"metrics":{"boot_bench_tps":5.343,"device_output_exact":20,"device_token_delta":0,"ext_decode_tps":5.2269,"gen_tokens":99,"host_output_exact":19,"internal_free":13367,"logit_max_delta":0.00005341,"logit_top1_match":10,"min_case_tps":5.07,"prefill_tps":5.59,"psram_free":2052252,"think_tps":4.2},"status":"keep","description":"asmemo MEASURED +2.200 % - the largest single lever since expbc. Per-tensor memoisation of the 2-bit assembly-eligibility verdict: the accepted wrapper kept ONE (blob,rows) entry while a decode token visits 44 distinct blobs, so nd_lut2_asm_ok re-walked 130,560 immutable PSRAM norm halfwords per token on the calling core before any row dispatch. Board 2: decode 5.4200 vs accepted 5.3033, prefill 5.7167 (+2.27 %), min_case 5.17 (best worst case in 437 runs), gen_tokens 99, internal_free 12,103 (-1,264 B). Cross-board reading running on board 1 with the identical tree md5; then its own 20-case gate. Also this window: fusion-r5 confirmed at +0.660 % (5.3383, prefill 5.6217, min_case 5.10) but its lane tail-stalled before the gate; tap96 measured -0.094 % and is retired - the Q tap projection does run single-core at dim=576, and splitting it six ways made the token slower, which is what a real (still unmeasured) cross-core wake costs. Guard for asmemo is .auto/exp77/test_asmemo.c, which includes the ACTUAL candidate nd_quant.c with ND_LUT2_ASM=1 and gc-sections dropping the Xtensa walkers: 16/16 covering accept, cached reject at exponent 0 and 31, reset-then-reused-address recompute, geometry-key recompute, 96 distinct keys over 64 slots.","timestamp":1790247694571,"segment":1,"confidence":20.691250903832238,"asi":{"asmemo_result":"board 2 primary decode 5.4200 vs accepted 5.3033 = +2.200 %, prefill 5.7167 (+2.27 %), min_case 5.17, gen_tokens 99, internal_free 12,103 (-1,264 B: the 960 B memo table plus dispatch code, the largest RAM price since the fusion). The mentor found this by READING the wrapper (one cache entry vs 44 field blobs) and had to correct my census, which had looked at call relocations and concluded the call surface was exhausted: the cost was not a call per token, it was a per-call WALK, and the kbench screens selected their function pointer outside the timing loop so no isolated number ever contained it.","candidate_status":"NOT accepted. Cross-board reading is running on board 1 with the identical tree md5 (d167096a1ba8, engine_md5 d167096a1ba8dbbf347f5b04f52e729d); after that it needs its own 20-case device gate. If both hold, asmemo alone (+2.20 %) dominates everything since run #424, and it composes with fusion-r5 (+0.660 %, independent mechanism: memo of a predicate vs the transform walk) - the bundle is the next measurement, not a second opinion on this one.","fusion_status":"fusion-r5 stayed at 5.3383 (+0.660 %) through its primary group with prefill 5.6217 and min_case 5.10; its lane then hit the known engine-independent tail stall (LANE_RC=1), so like asmemo it needs a clean session for the device gate. tap96 finished at 5.2983 (-0.094 %) with its tail stall too, and is retired.","hypothesis":"The 2-bit projection wrapper remembered ONE (blob, rows) assembly-eligibility verdict while a decode token visits 44 distinct blobs, so nd_lut2_asm_ok's norm walk ran before nearly every projection - 130,560 immutable PSRAM halfword reads per token on the calling core, before any row is dispatched. Memoise it per tensor (64 open-addressed slots, key blob+rows+ngroup+g, cleared on model close).","next_action_hint":"1) Read the board-1 cross-board asmemo number; if ~5.42, integrate into main and run the 20-case gate on the canonical board - this is the acceptance path for +2.2 %. 2) Then measure asmemo+fusion-r5 as ONE bundle (independent mechanisms, and #431 proved sub-bar halves compose above their sum). 3) Then re-derive the phase map: prep/dispatch shares moved twice since the last map. 4) The corrected two-core wake screen is still open and now has a reason: decide whether any fine-grained split can pay, given tap96 measured negative.","payload":{"decode_asmemo_b2":5.42,"delta_pct":2.2,"fusion_delta_pct":0.66,"internal_free_asmemo":12103,"min_case_asmemo":5.17,"prefill_asmemo":5.7167},"rejections_this_window":"tap96 is the honest negative and it is informative rather than empty: the Q tap projection really does run single-core at dim=576 (three 256-column units fail rows_dual_core's half<2 test), splitting it into six 96-column units made the token 0.094 % SLOWER, which is what a real cross-core wake cost looks like - and the wake cost is exactly the number the campaign believes it measured (#344's 23 cycles) but never did, because kbench never installs nd_parallel_rows."}}
{"run":438,"commit":"5ee1d62","metric":5.3033,"metrics":{"boot_bench_tps":5.343,"device_output_exact":20,"device_token_delta":0,"ext_decode_tps":5.2269,"gen_tokens":99,"host_output_exact":19,"internal_free":13367,"logit_max_delta":0.00005341,"logit_top1_match":10,"min_case_tps":5.07,"prefill_tps":5.59,"psram_free":2052252,"think_tps":4.2},"status":"crash","description":"bundle78 (asmemo + fusion-r5) composed, marker-checked and guarded; its canonical pipeline attempt CRASHED on board readiness, not on code (all secondaries carried from the accepted run - nothing measured). The bundle is produced by running the two already-verified candidate scripts in sequence (.auto/exp78/make_bundle.py) and installed by .auto/exp78/apply_bundle.py, which refuses a non-accepted tree and asserts both halves' markers plus head4's gemv4_asm_usable/ctx.base; the actual-source memo guard still passes 16/16 against the composed nd_quant.c (52ec54e74174). measure.sh then built and flashed it on board 1 and the board never reached EVT READY (TimeoutError in serial_api._handshake, 1569 s) - board 1's USB console leg is the documented rig fault. Two earlier non-results same iteration: my own stale baked-in provenance pin refusing the run (the gate correctly rejecting a wrong expectation) and 'Board 1 is busy' from finished lanes still holding tmux sessions. Accepted runtime stays 5.3033; asmemo (5.4200 on two boards, identical to the digit) remains the acceptance candidate awaiting its 20-case device gate on a healthy board.","timestamp":1790250064178,"segment":1,"confidence":20.691250903832238,"asi":{"carried_not_measured":"ALL secondary metrics in this record are the accepted run #431's own values, carried because nothing completed on this image: the board never reached EVT READY, so there are no prefill/extended/think/boot-bench/RAM/device-gate readings for bundle78. Only the crash itself and the off-device composition are readings of this iteration.","crash_detail":"measure.sh exit 1 after 1568 s: build and flash of the bundle image on board 1 succeeded, then `serial_api.Device.__init__ -> _handshake` raised TimeoutError 'ESP32 did not become ready'. Not a code failure: board 1's USB console leg is the documented rig fault (nodes re-enumerate mid-session, no STATE answered). Two earlier non-results in the same iteration: the provenance gate refusing my stale baked-in pin (want=0190834e3488, have=109a1619daee - the gate working, my expectation stale), then 'Board 1 is busy' from two finished lanes whose tmux sessions still held the lock.","hypothesis":"Compose the two independently measured above-bar levers - asmemo (+2.200 %, 5.4200 on two boards) and fusion-r5 (+0.660 %, 5.3383) - as ONE change. Independent mechanisms (a memoised per-tensor eligibility predicate in the 2-bit projection wrapper vs a fused butterfly walk with the field-dead fallbacks moved out of IRAM), but they meet in nd_quant.c and pull on internal heap from opposite directions, and #431 measured a bundle exceeding the sum of its parts, so the composed value is genuinely unknown.","revert_note":"This 'crash' reverts main's working tree back to the accepted state, which is the intended outcome: bundle78 was never measured, so it must not sit in main. It is preserved as data under .auto/exp78 and applied by a one-line script.","next_action_hint":"1) Re-measure bundle78 on a HEALTHY board (2 or 3 - stable console legs) via .auto/gen_lane.sh with .auto/exp78/apply_bundle.py engine/src/nd_quant.c, provenance pinned to the applied tree; do not drive it through main while board 1's console leg is flaky. 2) asmemo alone still wants its 20-case device gate (board 3's gate session had reached 6 cases when last read). 3) The corrected two-core wake screen is still open; tap96's -0.094 % is field evidence that the real wake cost is not the 23 cycles #344 recorded. 4) Board 1 needs an operator reseat before it carries a canonical acceptance.","payload":{"bundle_nd_quant_md5":"52ec54e74174","guard_passes":16,"lane_runtime_s":1569}}}
