{"run":368,"commit":"HEAD","metric":5.0467,"metrics":{"prefill_tps":5.325,"ext_decode_tps":4.975,"think_tps":3.95,"boot_bench_tps":5.091,"min_case_tps":4.82,"gen_tokens":99,"internal_free":14391,"psram_free":2052252,"device_output_exact":17,"device_token_delta":0,"logit_max_delta":0.00005341,"logit_top1_match":10,"host_output_exact":19},"status":"discard","description":"Experiment 36 lane 1 - kv_store_int8 per-element clamp+convert loop unrolled by 4: MEASURED, EXACTLY NEUTRAL (decode 5.0467 = the accepted value to the digit), costs 256 B, not kept (batch 20260923T1000L, nd_model.c md5 2ca9f38dad06). Premise corrected before building: the ELF calls flash-mapped lrintf per element but this part has NO rounding instruction at all (frint.nf/z.f/xf/mf/pf, itrunc.s, quou.s all rejected by the shipped assembler), so call removal is unavailable and this lane tested the unroll only. Verified the unroll really was in the measured image before believing the null (app_md5 74c7a00fa71c; 5 lrintf refs inside the function = 4 instances + tail). NOT MEASURED ON THIS IMAGE, carried forward from the accepted run: ext/think/boot-bench/psram/device-exact/token-delta/fidelity/top1 - the lane hit the known console-fatigue defect (drained 26 stale lines, then a think-toggle timeout, #345/#346) AFTER the primary group completed with gen_tokens=99 identical to the accepted value, so decode/prefill/min_case/internal_free are measured and the rest are not. Unrolling around a per-element library call cannot help because the call is the loop; with lanes 2/3 (-0.13 %, +0.03 %) and the Hadamard nulls the elementwise-unroll family closes at one win (#362). Repo tree unchanged.","timestamp":1790156147739,"segment":1,"confidence":21.708333333333318,"asi":{"candidate":"E36 lane 1 (board 1, batch 20260923T1000L): kv_store_int8's clamp-then-convert loop unrolled by 4, non-finite fallback replicated per lane so no value changes path. Generated from the shipped loop text by .auto/exp36/make_kvvariant.py, which ASSERTS the four unrolled expressions are the shipped text with i, i+1, i+2, i+3 substituted (the generator's first version failed: the store is (int8_t)lrintf(q), not (int8_t)q) - a generated patch whose arithmetic is a hand transcription is the #363 failure class, so the assertion is the check. nd_model.c md5 2ca9f38dad06.","hypothesis":"Run #362's win came from independent work inside a per-element loop, and the KV store is per-element with a conversion in it. Premise corrected BEFORE the build: the accepted ELF calls flash-mapped lrintf (0x42013f48) per element, and this part implements NO rounding instruction at all (frint.nf / frint.z.f / frint.xf / frint.mf / frint.pf / itrunc.s / quou.s all rejected by the shipped assembler), so removing the call is not available and this lane tested the unroll alone.","result":"decode 5.0467 = +0.000 % against the accepted 5.0467; internal_free 14,391 (-256 B). Verified the unroll was really in the measured image before believing the null: app_md5 74c7a00fa71c (distinct from every other lane), kv_store_int8 present, objdump shows 5 lrintf references inside it (4 unrolled + tail). Code changed, speed did not.","carry_forward_disclosure":"MEASURE rc=1 and it is NOT the candidate: the lane died in the think group with 'WARN drained 26 stale line(s) before the think toggle' then TimeoutError - the #345/#346 console-fatigue signature. The primary group had completed first (decode 5.0467, prefill 5.325, gen_tokens 99 identical to the accepted run, min_case 4.82), so the decode reading and internal_free are MEASURED here. ext_decode_tps, think_tps, boot_bench_tps, psram_free, device_output_exact, device_token_delta, logit_max_delta and logit_top1_match were NEVER MEASURED for this image and are carried forward from the accepted 5.0467 image so the scoreboard stays populated - read them as 'not measured', not as passing gates. The variant is bit-exact by construction and was host-verified 19/19 with token_delta 0 before any flash.","verdict":"REJECTED, not kept: neutral speed for 256 B of a 14,647 B heap. Repo tree verified unchanged at the accepted image (engine/src/nd_quant.c md5 b914e2703852, engine/ clean).","conclusion":"Unrolling around a per-element library call cannot help: the four lrintf invocations were already independent, so the scheduler had nothing to regroup - the call IS the loop. With lane 2 (-0.13 %), lane 3 (+0.03 %) and the Hadamard nulls, the elementwise-unroll family is closed at exactly one win (run #362's FWHT rescale, +0.332 %), and the residual lrintf cost is closed by an ISA fact rather than by opinion, since the float/int-transfer alternative was measured expensive twice (#230, #292).","next":"Three lanes live: board 2 = the combined sub-bar bundle (sigmoidf_pair into IRAM, +0.18 % mean over three readings, plus fwht_rows pointer hoisting, +0.065 %) - never measured as ONE change, predicted ~+0.25 %, which would clear the bar; board 1 = canonical confirmation of the shipping image on the campaign's standard board (#362 measured it on board 3 only); board 3 = the make capture owed since #362, now that the dead TIE helper is gone. Harness bug found and fixed while relaunching: the lane launcher sent the accepted nd_quant.c into nd_model.c for the 'accepted' variant, producing a build failure that could have been read as a bad measurement - target now follows the variant explicitly."}}
{"run":369,"commit":"HEAD","metric":5.04,"metrics":{"boot_bench_tps":5.089,"device_output_exact":17,"device_token_delta":0,"ext_decode_tps":4.968,"gen_tokens":99,"host_output_exact":19,"internal_free":14647,"logit_max_delta":0.00005341,"logit_top1_match":10,"min_case_tps":4.81,"prefill_tps":5.3217,"psram_free":2052252,"think_tps":3.95},"status":"discard","description":"Experiment 37 lane 2 - Hadamard MLP permutation gather (hada_b[p1[i]], 8,192 elements/token) unrolled by 4: MEASURED, -0.133 %, REJECTED (decode 5.0400 vs accepted 5.0467, batch 20260923T1030L, board 3). Bit-exact and gate-clean (DEVICE_GATE_OK 17/17, golden_missing=0, token_delta=0, fidelity 5.341e-05, top1 10/10), extended 4.968, think 3.95, prefill 5.3217, boot bench 5.089, min_case 4.81. Type trap caught pre-build: p1 is a float array whose values are truncation-cast to indices, so the unrolled form casts floats exactly as the shipped line does instead of reinterpreting the buffer as uint32_t (which would have been a fast wrong kernel). Random-index loads were already back-to-back, so grouping four added register pressure and a tail loop. With lane 1 the two remaining independent MLP loops are closed; the elementwise-unroll family now stands at one win (#362, +0.332 %) and five non-wins across three phases. Repo tree unchanged.","timestamp":1790156174307,"segment":1,"confidence":21.708333333333318,"asi":{"candidate":"E37 lane 2 (board 3, batch 20260923T1030L): the Hadamard MLP's permutation gather `for (i=0;i<n;i++) m->hada_a[i] = m->hada_b[(uint32_t)p1[i]]` unrolled by 4, 1024 elements per layer = 8,192 per token, inside the 24.4 ms MLP phase. Bit-exact by construction (one output per iteration, no accumulation). A type trap was caught before the build: p1 is a float array whose values are truncation-cast to indices, so the unrolled form reads floats and casts exactly as the shipped line does - reinterpreting the buffer as uint32_t* would have read different numbers and produced a fast wrong kernel, the campaign's fourth failure class.","hypothesis":"unrolling a per-element dependent-load gather lets the scheduler keep several loads outstanding, which is the only cure this core has for load latency since it has no prefetch instruction (#300 measured __builtin_prefetch emitting nothing and pref/dpref not assembling).","result":"decode 5.0400 = -0.133 % against the accepted 5.0467. Gate-clean and bit-exact: DEVICE_GATE_OK 17/17, golden_missing=0, token_delta=0, fidelity 5.341e-05, top1 10/10, extended 4.968, think 3.95, prefill 5.3217, boot bench 5.089, min_case 4.81 - a pure speed verdict, and it is slower.","verdict":"REJECTED. Lived only in board 3's worker tree; repo tree verified unchanged at the accepted image.","conclusion":"Random-index loads through a 1024-entry permutation do not benefit from four-deep grouping on this core - the loads were already issued back to back, and the unroll added register pressure plus a tail loop. Together with lane 1 (hadascale, exactly 0.00 %) the two remaining independent loops of the MLP are closed, which with runs #365/#366/#368 closes the elementwise-unroll family on six measurements: one win (run #362's FWHT rescale, +0.332 %) and five non-wins spanning three phases.","family_state":"Elementwise unroll: FWHT rescale +0.332 % KEPT / zcsplit -0.133 % / zchead +0.032 % / kvstore 0.000 % / hadascale 0.000 % / hadagather -0.133 %. Do not re-run at other unroll factors: the two ZCRMS emits bracket the result and the two MLP loops are both null, so there is no exposed latency left of this shape to buy."}}
{"run":370,"commit":"HEAD","metric":5.0467,"metrics":{"boot_bench_tps":5.091,"device_output_exact":17,"device_token_delta":0,"ext_decode_tps":4.975,"gen_tokens":99,"host_output_exact":19,"internal_free":14647,"logit_max_delta":0.00005341,"logit_top1_match":10,"min_case_tps":4.82,"prefill_tps":5.3233,"psram_free":2052252,"think_tps":3.95},"status":"discard","description":"Experiment 37 lane 1 - Hadamard MLP conditioning scale loop (d1[i]*x[i], 6,144 elements/token) unrolled by 4: MEASURED, EXACTLY NEUTRAL, decode 5.0467 = the accepted value, not kept (batch 20260923T1030L, board 2). Bit-exact and gate-clean (DEVICE_GATE_OK 17/17, golden_missing=0, token_delta=0, fidelity 5.341e-05, top1 10/10), extended 4.975, think 3.95, prefill 5.3233, boot bench 5.091, min_case 4.82, internal_free unchanged. Accumulating loops in the same function left untouched. Fifth non-win for this lever: the FWHT rescale paid because it follows a long dependency chain with nothing to overlap, not because its elements were independent - so the shape of run #362's win is now recorded narrowly. Repo tree unchanged.","timestamp":1790156197753,"segment":1,"confidence":21.708333333333318,"asi":{"candidate":"E37 lane 1 (board 2, batch 20260923T1030L): the Hadamard MLP's conditioning scale loop `for (i=0;i<dm;i++) m->hada_a[i] = d1[i]*x[i]` unrolled by 4, 768 elements per layer = 6,144 per token, inside the 24.4 ms MLP phase. Bit-exact by construction: one independent multiply per element, no accumulation, no order to move. The 8-way conditioning reductions and the softmax sums in the same function were deliberately left untouched because they are accumulations.","hypothesis":"last un-unrolled independent-multiply loop of the shape that paid in run #362, in a phase big enough (24.4 ms of 197 ms) to notice if it moved.","result":"decode 5.0467 = **+0.000 %**, exactly the accepted value. Gate-clean: DEVICE_GATE_OK 17/17, golden_missing=0, token_delta=0, fidelity 5.341e-05, top1 10/10, extended 4.975, think 3.95, prefill 5.3233, boot bench 5.091, min_case 4.82, internal_free unchanged.","verdict":"REJECTED as a null. Variant lived only in board 2's worker tree.","conclusion":"Sixth measurement of the elementwise-unroll lever, fifth non-win: FWHT rescale +0.332 % / zcsplit -0.133 % / zchead +0.032 % / kvstore 0.000 % / hadascale 0.000 % / hadagather -0.133 %. The lever is not 'unroll independent loops' - it is 'give the scheduler work at the one place where a loop follows a long dependency chain with nothing else to overlap', which is why the loop right after the FWHT transform paid and six others in three different phases did not. Recorded so the shape of the one win is not generalised again.","next":"Three lanes live: board 2 = combined sub-bar bundle (sigmoidf_pair into IRAM +0.18 % plus fwht_rows pointer hoist +0.065 %, never measured together, predicted ~+0.25 %); board 1 = canonical confirmation of the shipping image on the standard board; board 3 = the make capture owed since #362."}}
{"run":371,"commit":"21ca57d","metric":5.0567,"metrics":{"boot_bench_tps":5.103,"device_output_exact":17,"device_token_delta":0,"ext_decode_tps":4.985,"gen_tokens":99,"host_output_exact":19,"internal_free":13879,"logit_max_delta":0.00005341,"logit_top1_match":10,"min_case_tps":4.83,"prefill_tps":5.3367,"psram_free":2052252,"think_tps":3.96},"status":"keep","description":"Experiment 37 bundle - two measured sub-bar levers as ONE change: MEASURED, KEPT, +0.198 % decode (5.0467 -> 5.0567, now +107.2 % over the 2.44 baseline). sigmoidf_pair into IRAM via ND_HOT (+0.18 % mean over three readings, -768 B) plus fwht_rows loop-invariant load hoisting (+0.065 %, free) - each individually under the 0.2 % bar, never previously combined. Reading: 5.0567 on all three boards from three independent fresh builds, per-variant board spread exactly ZERO. Monitors agree: extended 4.985 (+0.20 %), prefill 5.3367 (+0.25 %), think 3.96 (+0.25 %), boot bench 5.103 (+0.24 % - the mechanism check, SiLU and prepare are inside the bench), min_case 4.83 (best worst case in 370 runs), gen_tokens 99. Quality never rested on luck: full-suite rc=0, DEVICE_GATE_OK 17/17, golden_missing=0, token_delta=0, fidelity 5.341e-05 identical to control, top1 10/10, re-verified on the main tree (host 19/19 byte-exact, make test green). Cost 768 B of a 14,647 B heap; psram unchanged. DISCLOSED MARGINAL CALL: +0.198 % is 0.002 pp under the nominal bar, inside the metric's own 0.034 % quantum, so it is the same reading as the bar value; kept on zero board spread plus three agreeing secondaries and disclosed rather than rounded up. Accepted runtime now 5.0567; make capture owed again on this image.","timestamp":1790159262981,"segment":1,"confidence":21.79166666666665,"asi":{"candidate":"Experiment 37 bundle: the two measured sub-bar elementwise levers applied as ONE change - (a) sigmoidf_pair moved into IRAM with ND_HOT (+0.18 % mean over three readings, -768 B, #336/#342) and (b) fwht_rows loop-invariant c->g / c->scale / c->xh hoisted out of both loops (+0.065 %, free, #365). Neither cleared the 0.2 % bar alone; never previously combined. Reference copies preserved as .auto/exp37/nd_model_bundle_ref.c and nd_quant_bundle_ref.c.","hypothesis":"The levers are mechanistically independent - (a) removes an IRAM-to-flash callee crossing for ~3,600 sigmoid pairs per token, (b) removes redundant per-element loads in the transform's rescale - so their deltas should be roughly additive, and the sum (~+0.25 %) crosses the bar even though each component alone does not. The campaign had been discarding both on the bar while holding evidence that each is real.","result":"decode 5.0567 on ALL THREE boards from three independent fresh builds (board 2 in 20260923T1100L; boards 1 and 3 in 20260923T1140L) against the accepted 5.0467 = +0.198 %, per-variant board spread exactly ZERO. Realisation 81 % of the additive prediction. Monitors move together and upward: extended 4.985 (+0.20 %), prefill 5.3367 (+0.25 %), think 3.96 (+0.25 %), boot bench 5.103 from 5.091 (+0.24 %, the mechanism check - SiLU and prepare are both inside the bench), min_case 4.83 (best worst case in 370 runs), gen_tokens 99 unchanged.","quality":"Full-suite rc=0 with DEVICE_GATE_OK 17/17, device_golden_missing=0, device_token_delta=0, fidelity 5.341e-05 identical to control, top1 10/10; re-verified on the main tree after applying (host 19/19 byte-exact, golden_missing=0, token_delta=0, same fidelity, make test green). Bit-exact by construction: an IRAM attribute moves a function and changes no operation; hoisting loop-invariant loads changes no value and no order.","cost":"internal_free 14,647 -> 13,879 (-768 B, exactly run #336's figure for the IRAM copy; the fwathoist half is free). psram_free unchanged at 2,052,252.","bar_call":"DISCLOSED MARGINAL CALL, made explicitly rather than silently: +0.198 % is nominally 0.002 pp under the 0.2 % bar, and the metric's own granularity is ~0.0017 tok/s = 0.034 %, so 5.0567 and the bar value are the same reading at this resolution. Kept because the reading is exactly reproducible on three boards (zero spread, not a coin flip), three independent secondaries agree in sign and magnitude, and both components were separately measured real effects. Run #290 was kept at +0.200 % on weaker evidence; rejecting this while keeping that would make the bar a rounding artifact rather than a threshold.","next":"Three lanes live: board 1 = Experiment 38, the cold-vs-warm x backing-store calibration of the shipped nd_fwht, which tests whether run #364's data-warmth diagnosis is even right (fwht_rows transforms c->xh = ND_ALLOC_FAST internal SRAM, which this part does not route through the data cache, so a PSRAM eviction sweep cannot make the field operand cold). Boards 2 and 3 = Experiment 39, the engine's own optimization level: -O3 on the needle component (every engine file has always compiled at -O2, verified in compile_commands.json, and bit-exact by definition since GCC cannot reassociate FP without -ffast-math) - isolated on the accepted engine on board 2, stacked on this bundle on board 3. Guard bug fixed the honest way: bench_e38 is static with one call site so -O2 inlines it and the nm symbol probe refused a good image; the proof is now the string only the E38 body prints, which is the correct artifact for a macro-gated candidate (#359's rule). Also: idf.py must run from the project directory, and board 3's exp38_on_compile_line=0 was the guard working correctly (that worker's CMakeLists had never been synced)."}}
{"run":372,"commit":"HEAD","metric":5.0483,"metrics":{"boot_bench_tps":5.087,"device_output_exact":17,"device_token_delta":0,"ext_decode_tps":4.976,"gen_tokens":99,"host_output_exact":19,"internal_free":13879,"logit_max_delta":0.00005341,"logit_top1_match":10,"min_case_tps":4.82,"prefill_tps":5.3217,"psram_free":2052252,"think_tps":3.95},"status":"discard","description":"Experiment 39 lane 1 - -O3 on the engine component, accepted engine: MEASURED, +0.032 %, NULL, not kept (decode 5.0483 vs 5.0467, batch 20260923T1240L, board 2, engine_md5 aed23f3458bd). Flag applied via the component's CMakeLists (not -DCMAKE_C_FLAGS, which silently relinks the same binary) and proven on nd_model.c's own compile line with -O2 at 3622 / -O3 at 3825 so the later flag wins. Bit-exact by definition (GCC cannot reassociate FP without -ffast-math) and gate-clean: DEVICE_GATE_OK 17/17, golden_missing=0, token_delta=0, prefill 5.3217, extended 4.976, think 3.95, boot bench 5.087, min_case 4.82. -O2 is already the local optimum for this engine: what -O3 could not buy with whole-program unrolling is what the campaign had to hand-write per loop. This exhausts the last untested axis of the build-configuration family, which had been the most productive cheap family (#238 +11.9 %, #240 +0.34 %).","timestamp":1790160764821,"segment":1,"confidence":21.79166666666665,"asi":{"candidate":"Experiment 39 lane 1 (board 2, batch 20260923T1240L): -O3 on the needle component, accepted (pre-bundle) engine, engine_md5 aed23f3458bd. The flag is applied through esp32/components/needle/CMakeLists.txt with target_compile_options, NOT -DCMAKE_C_FLAGS, because a flag already in CMakeCache makes ninja relink the same binary - the trap that produced several 'identical md5 for every variant' results early in this campaign. Verified before flashing: -O2 at offset 3622 and -O3 at 3825 on nd_model.c's own compile_commands.json line, so the later flag wins.","hypothesis":"Every engine file has always compiled at -O2 (verified in compile_commands.json rather than assumed), and the campaign's most productive cheap family has been build configuration - 64 B data cache line (+11.9 %, #238), 100 Hz tick (+0.34 %, #240). -O3 is exactly the mechanism class that produced the last kept win (#362's manual unroll): more independent work in flight per loop. It is bit-exact by definition because GCC cannot reassociate floating point without -ffast-math.","result":"decode 5.0483 = +0.032 % over the then-accepted 5.0467 - a null, one and a half quantisation ticks. Monitors: prefill 5.3217, extended 4.976, think 3.95, boot bench 5.087, min_case 4.82, gen_tokens 99, DEVICE_GATE_OK 17/17, golden_missing=0, token_delta=0.","verdict":"REJECTED. Nothing entered the repo tree from this lane.","conclusion":"-O2 is already at the local optimum for this engine's codegen. What -O3 could not buy with whole-program unrolling and inlining is what the campaign had to write by hand per loop (and the two manual cases it did ship, the FWHT rescale and the phi row walker, beat the compiler's own attempt). Worth having measured: the build-configuration family is now exhausted on its last untested axis, so no config screen is owed.","next":"Experiment 40 running on three boards, all bit-exact and all in the prepare family, one lever each: fw2 (butterfly inner loop unrolled by 2, isolated +17.95 % in #360), fw4 (the curve point - unroll-8 lost -28 % in the rescale so the register-file ceiling is a known risk), fwinline (nd_fwht's body inlined into fwht_rows through ONE static-inline definition shared with the exported symbol, removing a call per group - ~96 calls per token - which is the third category run #333 proved is bigger than delivery and scheduling combined). All three host-verified 19/19 byte-exact with identical fidelity before any flash, which is what catches the #363 transcription class without a board: the host compiles this same C."}}
