{"run":709,"commit":"4599dac","metric":5.7767,"metrics":{"boot_bench_tps":5.877,"device_output_exact":18,"device_token_delta":52,"ext_decode_tps":5.7115,"gen_tokens":99,"host_output_exact":19,"internal_free":14171,"logit_max_delta":0.00005341,"logit_top1_match":10,"min_case_tps":5.57,"prefill_tps":5.9517,"psram_free":2062492,"think_tps":4.49},"status":"keep","description":"Host gates on the shippable line's lane-block composition tree (B1, engine bae5184f9ca7, 5.7767 full gate): host_output_exact 19/19, host_token_delta 0, logit_max_delta 5.341e-05 (identical to the accepted pin), logit_top1_match 10/10. Both lines' packets are now complete again on their newest trees. Fresh phase map taken on the seed stack in the same window (profiled restricted run; its absolute decode is diagnostic only, never a speed claim): attn-stage 82.5 (proj2bit 80.8, attention 24.1), hadamard 21.2, engram 15.2, mhc_phi4 8.1, sinkhorn 3.0, mhc-mix 2.0, prep+lut 1.7, step-tail 0.6 - the headline is mhc-mix falling from 4.5 to 2.0 ms, which is the lane-block sweep showing up in the attribution and matching the +0.99% it measured. Everything still above ~8 ms is a phase this campaign has already closed on measurement: proj2bit is dual-issue saturated on the 2-bit LUT path, engram is the same LUT GEMV, phi is the wide 4-bit kernel, kron2 lost twice, and the QK dot loses to GCC's own schedule.","timestamp":1790342154973,"segment":1,"confidence":13.074643249176734}
{"run":710,"commit":"4599dac","metric":5.7767,"metrics":{"boot_bench_tps":5.877,"device_output_exact":18,"device_token_delta":52,"ext_decode_tps":5.7115,"gen_tokens":99,"host_output_exact":0,"internal_free":14171,"logit_max_delta":0,"logit_top1_match":0,"min_case_tps":5.57,"prefill_tps":5.9517,"psram_free":2062492,"think_tps":4.49},"status":"discard","description":"Frozen-pair per-step diagnostic on B1: the probe is INVALID and produces no model-vs-sampler signal. `nd_sample_hidden(&s_model, &smp, lg)` hands back a logits pointer that is the constrained sampler's FILTERED subset, not the full-vocab array, so an argmax over the first `s_model.vocab` entries reads past it: every step of every case, including the passing control, reports the same bogus top1=989 with value 1.9e37 and chosenval near zero. The harness lesson is the campaign's oldest one in a new place - a probe must be validated against a case whose answer is known before its output is interpreted, and the control case did exactly that here. What IS valid from the harvest: the per-step chosen token ids are real (the sampler's own decisions), the three cases' texts reproduce the known behaviour (heldout_interval_one answers seconds=300 where the golden says 1; heldout_long_tools_note_only degenerates into a repeating \"heap high water mark -> seconds 300\" chain; the sampling5 control is correct), and the two failing cases share their first three chosen ids (6, 38, 8121) with the control before diverging - so the input path is identical up to the prompt, which matches the earlier qlen/qhash/token-id record. Next attempt at this diagnostic must read the sampler's own candidate list or the existing logits4 hook rather than indexing the subset pointer.","timestamp":1790343284330,"segment":1,"confidence":13.074643249176734}
{"run":711,"commit":"2b5f5f3","metric":5.7767,"metrics":{"boot_bench_tps":5.877,"device_output_exact":18,"device_token_delta":52,"ext_decode_tps":5.7115,"gen_tokens":99,"host_output_exact":0,"internal_free":14171,"logit_max_delta":0,"logit_top1_match":0,"min_case_tps":5.57,"prefill_tps":5.9517,"psram_free":2062492,"think_tps":4.49},"status":"keep","description":"Frozen-pair diagnostic, second attempt and VALID this time: the probe now reads the constrained sampler's own legal candidate set and scores (nd_sample.c, behind ND_REQ_DIAG) instead of indexing the subset pointer, and prints the choice, how many tokens the grammar left legal, and the margin to the runner-up among them. Findings: (1) the choices are NOT razor-thin - the median margin over the runner-up legal token is ~12.8 logits (a probability ratio near 3.6e5) on both the failing case and the passing control, and the wrong picks are confident ones (the failing case picks seconds=300 with margin ~16); (2) the failing case and the passing control emit the SAME first six chosen tokens (507, 379, 300, 722, 8122, 8100) and separate only at the decision point, where the control concludes a single set_timer call and the long-tools case degenerates into a repeating \"heap high water mark -> seconds 300\" chain for 55 steps; (3) the grammar's legal set is small (3-14 tokens per step) so the sampler is choosing from a handful, but with wide margins. Together with the earlier input record (qlen/qhash/prefix identity all intact) this points at the model's own arithmetic/state on the longer prompt rather than at sampler tie-breaking - the shape to test next is the device's int8 KV cache accumulating more error over the longer prompt. One metric bug to note for reuse: margin=0 at legal=1 steps is not a razor-thin decision, and the script's razor_thin counter counted those.","timestamp":1790343916944,"segment":1,"confidence":13.074643249176734}
{"run":712,"commit":"cf16e17","metric":5.7767,"metrics":{"boot_bench_tps":5.877,"device_output_exact":18,"device_token_delta":52,"ext_decode_tps":5.7115,"gen_tokens":99,"host_output_exact":0,"internal_free":14171,"logit_max_delta":0,"logit_top1_match":0,"min_case_tps":5.57,"prefill_tps":5.9517,"psram_free":2062492,"think_tps":4.49},"status":"keep","description":"Frozen-pair repeatability probe (B1, same diag image, both failing cases run twice in one process): every chosen token id and the full generated text are IDENTICAL between the two runs of each case - interval_one is 18 steps ending in the wrong `seconds=300` both times, long_tools is 55 steps of the same repeating chain both times, `first_diff_step=None` for both. So the wrong answers are deterministic arithmetic/state outcomes, not per-run nondeterminism. Combined with the previous window's evidence (inputs identical: qlen/qhash/encoded suffix ids/restored prefix identity; sampler choices confident with median margin ~12.8 logits; the failing case and the passing control share their first six chosen ids), the picture is now bounded on three sides: the divergence is downstream of the prompt, upstream of the sampler's tie-breaking, and reproducible within an image. That also bounds #647: since one image is deterministic here, the ring's flip must be a PERSISTENT state difference the ring establishes before or at the request (what got primed/restored), not per-step timing jitter. The remaining decisive step is a device-vs-host per-step logits comparison on these two cases, which needs the host logits captured at the same steps rather than another device-only probe.","timestamp":1790344775419,"segment":1,"confidence":13.074643249176734}
{"run":713,"commit":"1de79e8","metric":6.0217,"metrics":{"boot_bench_tps":6.129,"device_output_exact":18,"device_token_delta":52,"ext_decode_tps":5.95,"gen_tokens":99,"host_output_exact":0,"internal_free":14991,"logit_max_delta":0,"logit_top1_match":0,"min_case_tps":5.8,"prefill_tps":6.3433,"psram_free":2062492,"think_tps":4.63},"status":"keep","description":"FULL GATE of the campaign-best seed line with the E70 elementwise cluster (B2, engine e9d8ede39d76): decode 6.0217, ext 5.95, think 4.63, min_case 5.8, boot 6.129, internal_free 14,991, 18/20 with the two #647 demo-timer goldens only. The screen value reproduced exactly on breadth, so E70's +0.14% increment is real and the seed line is now gated at 6.0217 = +13.54% over the owner's 5.3033 acceptance pin - the campaign's best fully-gated reading. Host gates on this exact tree are the only item left in its packet.","timestamp":1790345307913,"segment":1,"confidence":13.099158433955367}
{"run":714,"commit":"46d763f","metric":6.045,"metrics":{"boot_bench_tps":6.155,"device_output_exact":6,"device_token_delta":0,"ext_decode_tps":0,"gen_tokens":99,"host_output_exact":0,"internal_free":14991,"logit_max_delta":0,"logit_top1_match":0,"min_case_tps":5.82,"prefill_tps":6.3433,"psram_free":2062492,"think_tps":0},"status":"keep","description":"Conditioning-accumulation wide delivery (E71 on the campaign-best seed line): the hadamard MLP builds its scale row with an initializer plus SEVEN scalar `sc[i] += cj*row[i]` passes over the padded width - 7*n = 7,168 independent FMAs per layer, 57,344 per token, confirmed present as a scalar update in the e9d8ede39d76 ELF. Those seven passes now go through nd_lanemix4w (the accumulate shape already validated) with the initializer untouched, one madd per cell, j ascending, four cells per load/store pair; scale_row moved to FAST16 so the guard can fire, with a four-byte alignment test per row against a pass that touches thousands of cells. Device: 6/6 exact, decode 6.0450 vs this line's gated 6.0217 = +0.39%, boot 6.155 vs 6.129, min_case 5.82 vs 5.80. New campaign best 6.0450 = +13.98% over the owner's 5.3033 pin. The boot-time dispatch verdict for scale_row/cu-row alignment is owed at the next normal build (the run and sources were kept untouched, per instruction).","timestamp":1790346148508,"segment":1,"confidence":13.18441273326016}
{"run":715,"commit":"8b7958e","metric":6.045,"metrics":{"boot_bench_tps":6.155,"device_output_exact":18,"device_token_delta":52,"ext_decode_tps":5.9754,"gen_tokens":99,"host_output_exact":0,"internal_free":14991,"logit_max_delta":0,"logit_top1_match":0,"min_case_tps":5.82,"prefill_tps":6.3433,"psram_free":2062492,"think_tps":4.64},"status":"keep","description":"FULL GATE of the campaign-best seed line with the E71 conditioning-accumulation delivery (B2, engine a9b5505a760f): decode 6.0450, ext 5.9754, think 4.64, min_case 5.82, boot 6.155, 18/20 with the two #647 demo-timer goldens only. The screen value reproduced exactly on breadth, so E71's +0.39% is real and the seed line is gated at 6.0450 = +13.98% over the owner's 5.3033 acceptance pin - the campaign's best fully-gated reading, with host gates the only item left in the packet.","timestamp":1790346808265,"segment":1,"confidence":13.18441273326016}
{"run":716,"commit":"4599dac","metric":5.41,"metrics":{"boot_bench_tps":5.894,"device_output_exact":6,"device_token_delta":0,"ext_decode_tps":0,"gen_tokens":99,"host_output_exact":0,"internal_free":14171,"logit_max_delta":0,"logit_top1_match":0,"min_case_tps":5.23,"prefill_tps":5.9517,"psram_free":2062492,"think_tps":0},"status":"discard","description":"Attention-input in-place prepare (E72 on B1) DISCARDED at -6.3%: the same lifetime shape that paid three times (nx/xh, dequant row, and the MLP conditioning) LOSES here. The change redirected the attention's input RMS to emit into xh and passed xh to attention() - whose only use of its input is the projection prepare, which already skips a self-copy - so a 768-float copy per layer should have disappeared with identical arithmetic. Device output is 6/6 byte-exact, so the arithmetic is right, yet decode reads 5.4100 against this board's 5.7767 base while the boot bench is UNCHANGED (5.894 vs 5.877). That split is the interesting part: the short-context boot bench does not see it, the primed-prefix decode does, which is not what a copy removal should look like - the likely mechanism is cache/buffer interaction (xh is the same buffer the FWHT/LUT prepare and the mHC phi path transform in place, so the attention's transform now runs on a buffer that has just been written by a different producer, and the prefix path touches that pattern far more often than the 6-token cold bench). Recorded as an unexplained but unambiguous regression; B1 was restored byte-exactly to 78c435fec440 and rebuilds. Anyone re-attempting in-place attention should measure the PREFIX path specifically and instrument cache behaviour, not just the boot bench.","timestamp":1790346831623,"segment":1,"confidence":13.18441273326016}
{"run":717,"commit":"4599dac","metric":3.125,"metrics":{"boot_bench_tps":4.441,"device_output_exact":0,"device_token_delta":0,"ext_decode_tps":0,"gen_tokens":99,"host_output_exact":0,"internal_free":12315,"logit_max_delta":0,"logit_top1_match":0,"min_case_tps":3.12,"prefill_tps":5.9517,"psram_free":2062492,"think_tps":0},"status":"crash","description":"Elementwise-product family (E73 on B1) FAILED HARD: device_output_exact 0/6 and decode 3.125, boot bench 4.441 - a correctness failure, not a slow result. The candidate widened four shapes at once: dst = a*b for the conditioned input (new nd_mul2w kernel), dst += scalar*src for the engram injection and the attention residual (existing nd_lanemix4w), and dst += a*b for the MLP residual fold (new nd_mac2w kernel). The campaign's own rule is that every new kernel gets its own differential oracle before it is trusted - the four mix-family kernels each have one - and these two new kernels were wired in with none, so a 0/6 device gate is exactly what a missing oracle looks like. The most likely single defect is in one of the two new kernels rather than in the two reuse sites (whose shapes are already proven). Recorded as the failure mode, not as a closed family: the four shapes are legitimately widenable (each is one mul or one madd per cell over contiguous rows), and the correct next attempt is one shape at a time, each with an oracle of the form the mix family uses. B1 was restored byte-exactly to 78c435fec440 and rebuilds. Cost: one board run plus the analysis; no gate was weakened and nothing was kept.","timestamp":1790347854760,"segment":1,"confidence":13.18441273326016}
{"run":718,"commit":"fd62cbe","metric":6.045,"metrics":{"boot_bench_tps":6.155,"device_output_exact":18,"device_token_delta":52,"ext_decode_tps":5.9754,"gen_tokens":99,"host_output_exact":19,"internal_free":14991,"logit_max_delta":0.00005341,"logit_top1_match":10,"min_case_tps":5.82,"prefill_tps":6.3433,"psram_free":2062492,"think_tps":4.64},"status":"keep","description":"Device-vs-host comparison for the frozen pair, using the host generator that does exist (nd_dump genp, nothink, exactly as bench.py invokes it) - and it reframes the two failures as MODEL behaviour rather than engine defects. Host results: `Sample telemetry every second` -> a single set_sampling_interval seconds=120 in 23 tokens; `Sample telemetry every 5 seconds` -> set_sampling_interval seconds=5 in 22 tokens; the long multi-tool prompt -> set_sampling_interval 45 then set_timer 300 THREE TIMES then get_status, 67 tokens. That repetition is the same tendency the device shows, so the device's long-tools answer is not a device arithmetic defect - the host, running the same engine and archive, repeats the same call. Two further facts fall out: the host's interval_one answer (120 alone) matches what the device produced in the frozen think=0 mode, and the host's CONTROL answer picks a different tool (set_sampling_interval) than the device does (set_timer) for the same phrasing - while the device passes that case against its golden. So the goldens are device-derived artefacts of a particular run state, not host-derived truth, and the two failures sit on prompts where the model itself is unstable between two plausible answers. This is the owner-decision evidence the two-case blocker has been missing: it is not an arithmetic bug to find, it is a stability/re-baseline question. NOTE for the ledger: earlier 'device degenerates on long_tools' readings came from think=1 harvests; the frozen mode is think=0 and must be used for any further comparison.","timestamp":1790348044241,"segment":1,"confidence":13.18441273326016}
{"run":719,"commit":"637062e","metric":5.7767,"metrics":{"boot_bench_tps":5.877,"device_output_exact":18,"device_token_delta":52,"ext_decode_tps":5.7115,"gen_tokens":99,"host_output_exact":19,"internal_free":14171,"logit_max_delta":0.00005341,"logit_top1_match":10,"min_case_tps":5.57,"prefill_tps":5.9517,"psram_free":2062492,"think_tps":4.49},"status":"keep","description":"Frozen-pair STATE sensitivity test (B1, frozen think=0 mode, same image): both failing cases were run FIRST (immediately after priming) and LAST (after three other requests had run) and produce byte-identical answers in both positions - interval_one `set_sampling_interval seconds=120` and the long-tools case the same 45-then-timer chain - so the answers are stable under request ordering and accumulated state. Together with the repeatability result (identical across repeated runs) the device is fully deterministic AND order-independent on this image, which removes within-image state accumulation from the mechanism list. Since every lever landed in these images is bit-exact on the other 18 cases, and the host (same engine, fresh prefill) now produces the SAME interval_one answer the device does, the remaining explanation is the one #647 already isolated: the accept/reject difference is tied to what the RING carries into the request path (it flips exactly this pair when added to an otherwise unchanged engine), i.e. it is a re-baseline decision - keep the ring and re-baseline/replace these two cases, or drop the ring and lose the >128-byte request fix and the 20-case suite. That is an owner choice, not something a further probe or engine change can resolve without one of those two acts.","timestamp":1790348548969,"segment":1,"confidence":13.22554597173793}
{"run":720,"commit":"e0ef3d8","metric":5.41,"metrics":{"boot_bench_tps":5.893,"device_output_exact":6,"device_token_delta":0,"ext_decode_tps":0,"gen_tokens":99,"host_output_exact":0,"internal_free":14171,"logit_max_delta":0,"logit_top1_match":0,"min_case_tps":5.23,"prefill_tps":5.9517,"psram_free":2062492,"think_tps":0},"status":"keep","description":"Dead code is not free, and it invalidated two of this window's results. B1's tree with the inert DIAGPICK/DIAGREQ hook (78c435fec440, every added line behind #ifdef, plus a stdio include in nd_sample.c) reads 5.4100 with boot 5.893, against 5.7767 with boot 5.877 for the same stack without the hook (bae5184f9ca7) - a 6.3% decode regression from scaffolding that compiles to nothing, with the boot bench unmoved. A contemporaneous control on the other board (B2, untouched tree, allowed repeat with a recorded reason) still reads 6.0450 / boot 6.155 / 18-of-20, so the boards and the environment did not drift and the loss is real and reproducible. Consequences: (1) E72's -6.3% and E74's -6.4% were measured against the WRONG baseline - both are neutral, and E72's buffer-interaction story is retracted; (2) any lane that measures a candidate on a tree carrying diagnostic scaffolding gets a wrong baseline, so scaffolding must be stripped (or the tree's own baseline measured) before a candidate is priced; (3) the split itself is a clue - the short cold boot bench is blind to it while the primed-prefix decode is not, which is the same split E72 showed us and I mis-attributed. The mechanism is almost certainly sampler-path codegen: nd_sample.c is walked once per token and its inlining decisions move with an added include, so a hook there is not inert in the compiled image.","timestamp":1790350036686,"segment":1,"confidence":13.266936671575833}
{"run":721,"commit":"4599dac","metric":5.775,"metrics":{"boot_bench_tps":5.873,"device_output_exact":6,"device_token_delta":0,"ext_decode_tps":0,"gen_tokens":99,"host_output_exact":0,"internal_free":14171,"logit_max_delta":0,"logit_top1_match":0,"min_case_tps":5.57,"prefill_tps":5.9517,"psram_free":2062492,"think_tps":0},"status":"discard","description":"E74 re-measured properly on the clean tree: NULL, not the -6.4% the contaminated baseline reported. The `dst += a*b` MLP residual fold widened with nd_mac2w (three 128-bit loads, four madds and one store per four cells against twelve loads, four madds and four stores) reads decode 5.7750 against the clean same-mode baseline 5.7767 = -0.03%, i.e. within the metric's quantum; boot 5.873 vs 5.877, min_case 5.57, 6/6 device exact, and both the kernel's own oracle (MAC2W selftest 64/64) and the dispatch verdict (mac2=1) pass, so the widening really ran and simply does not matter at this size - the fold touches dm cells per layer, about 6k cells per token, and a server-side ~2.4x instruction reduction on 6k cells cannot move a 170 ms token. This closes the retraction cleanly: E74 is measured, neutral, and discarded; the earlier -6.4% belonged entirely to the inert-scaffolding artifact of run #720. B1 restored byte-exactly to bae5184f9ca7 and rebuilds. Remaining from the same family: E72 (attention in-place prepare) has still never been measured against a clean baseline, and E73's other shapes are the same ~6k-cell size as E74, so none of them promise more than a tenth of a percent.","timestamp":1790350629617,"segment":1,"confidence":13.390189520624308}
