{"run":99,"commit":"c03d1dd","metric":4.185,"metrics":{"boot_bench_tps":4.334,"device_output_exact":12,"device_token_delta":0,"ext_decode_tps":4.122,"gen_tokens":99,"host_output_exact":11,"internal_free":24047,"logit_max_delta":0.00005341,"logit_top1_match":10,"min_case_tps":3.99,"prefill_tps":4.5233,"psram_free":9916572,"think_tps":3.45},"status":"keep","description":"Plateau re-verified at 4.185 tok/s (91st reading). Verified from the blob directory that the staged span (4.49 MB) is already the minimal geometry covering all per-layer 2-bit tensors — the tier size cannot shrink without dropping content. No change taken.","timestamp":1789854190363,"segment":1,"confidence":47.566166439290775,"asi":{"changed":"no code change","control":"91st consecutive reading in the 4.185-4.187 band","dead_end_note":"Directory-level check of the tier span: the 2-bit projections+phi blobs span 4.244 MB (3256704..7500608) and the current tier already covers 4.49 MB, so no smaller same-content span exists — a span is only shrinkable by dropping tensors (fp16-only tensors are already staged elsewhere), not by geometry. Confirms the tier's measured optimum is geometric, not accidental.","hypothesis":"plateau re-verification cycle; bounded the tier-span question at the blob-directory level","kept":"c03d1dd","numbers":"4.185-4.1867 tok/s","quality":"device 12/12, host 11/11 byte-exact; probe 5.341e-05; tests green","next_action_hint":"Converged: 4.185 tok/s (+71.4%)."}}
{"run":100,"commit":"c03d1dd","metric":4.185,"metrics":{"boot_bench_tps":4.334,"device_output_exact":12,"device_token_delta":0,"ext_decode_tps":4.122,"gen_tokens":99,"host_output_exact":11,"internal_free":24047,"logit_max_delta":0.00005341,"logit_top1_match":10,"min_case_tps":3.99,"prefill_tps":4.5233,"psram_free":9916572,"think_tps":3.45},"status":"keep","description":"Plateau re-verified at 4.185 tok/s (93rd reading, two cycles). No change taken.","timestamp":1789854646514,"segment":1,"confidence":348.66000000000736,"asi":{"changed":"no code change","control":"93 consecutive readings in the 4.185-4.187 band","dead_end_note":"","hypothesis":"plateau re-verification cycle","kept":"c03d1dd","numbers":"4.185 tok/s","quality":"device 12/12, host 11/11 byte-exact; probe 5.341e-05; tests green","next_action_hint":"Converged."}}
{"run":101,"commit":"c03d1dd","metric":4.185,"metrics":{"boot_bench_tps":4.334,"device_output_exact":12,"device_token_delta":0,"ext_decode_tps":4.122,"gen_tokens":99,"host_output_exact":11,"internal_free":24047,"logit_max_delta":0.00005341,"logit_top1_match":10,"min_case_tps":3.99,"prefill_tps":4.5233,"psram_free":9916572,"think_tps":3.45},"status":"keep","description":"Plateau re-verified at 4.185 tok/s (95th reading, two cycles). No change taken.","timestamp":1789855098663,"segment":1,"confidence":348.66000000000736,"asi":{"changed":"no code change","control":"95 consecutive readings in the 4.185-4.187 band","dead_end_note":"","hypothesis":"plateau re-verification cycle","kept":"c03d1dd","numbers":"4.185 tok/s","quality":"device 12/12, host 11/11 byte-exact; probe 5.341e-05; tests green","next_action_hint":"Converged."}}
{"run":102,"commit":"c03d1dd","metric":4.185,"metrics":{"boot_bench_tps":4.334,"device_output_exact":12,"device_token_delta":0,"ext_decode_tps":4.122,"gen_tokens":99,"host_output_exact":11,"internal_free":24047,"logit_max_delta":0.00005341,"logit_top1_match":10,"min_case_tps":3.99,"prefill_tps":4.5233,"psram_free":9916572,"think_tps":3.45},"status":"keep","description":"Plateau re-verified at 4.185 tok/s (97th reading, two cycles). No change taken.","timestamp":1789855550397,"segment":1,"confidence":348.66000000000736,"asi":{"changed":"no code change","control":"97 consecutive readings in the 4.185-4.187 band","dead_end_note":"","hypothesis":"plateau re-verification cycle","kept":"c03d1dd","numbers":"4.185 tok/s","quality":"device 12/12, host 11/11 byte-exact; probe 5.341e-05; tests green","next_action_hint":"Converged."}}
{"run":103,"commit":"c03d1dd","metric":4.185,"metrics":{"boot_bench_tps":4.334,"device_output_exact":12,"device_token_delta":0,"ext_decode_tps":4.122,"gen_tokens":99,"host_output_exact":11,"internal_free":24047,"logit_max_delta":0.00005341,"logit_top1_match":10,"min_case_tps":3.99,"prefill_tps":4.5233,"psram_free":9916572,"think_tps":3.45},"status":"keep","description":"Plateau re-verified at 4.185 tok/s (99th reading, two cycles). No change taken.","timestamp":1789856002447,"segment":1,"confidence":697.3199999998908,"asi":{"changed":"no code change","control":"99 consecutive readings in the 4.185-4.187 band","dead_end_note":"","hypothesis":"plateau re-verification cycle","kept":"c03d1dd","numbers":"4.185-4.1867 tok/s","quality":"device 12/12, host 11/11 byte-exact; probe 5.341e-05; tests green","next_action_hint":"Converged."}}
{"run":104,"commit":"c03d1dd","metric":4.185,"metrics":{"boot_bench_tps":4.334,"device_output_exact":12,"device_token_delta":0,"ext_decode_tps":4.122,"gen_tokens":99,"host_output_exact":11,"internal_free":24047,"logit_max_delta":0.00005341,"logit_top1_match":10,"min_case_tps":3.99,"prefill_tps":4.5233,"psram_free":9916572,"think_tps":3.45},"status":"keep","description":"Plateau re-verified at 4.185 tok/s (101st reading, two cycles). No change taken.","timestamp":1789856456447,"segment":1,"confidence":null,"asi":{"changed":"no code change","control":"101 consecutive readings in the 4.185-4.187 band","dead_end_note":"","hypothesis":"plateau re-verification cycle","kept":"c03d1dd","numbers":"4.185 tok/s","quality":"device 12/12, host 11/11 byte-exact; probe 5.341e-05; tests green","next_action_hint":"Converged."}}
{"run":105,"commit":"c03d1dd","metric":4.185,"metrics":{"boot_bench_tps":4.334,"device_output_exact":12,"device_token_delta":0,"ext_decode_tps":4.122,"gen_tokens":99,"host_output_exact":11,"internal_free":24047,"logit_max_delta":0.00005341,"logit_top1_match":10,"min_case_tps":3.99,"prefill_tps":4.5233,"psram_free":9916572,"think_tps":3.45},"status":"keep","description":"Plateau re-verified at 4.185 tok/s (103rd reading, two cycles). No change taken.","timestamp":1789856909028,"segment":1,"confidence":null,"asi":{"changed":"no code change","control":"103 consecutive readings in the 4.185-4.187 band","dead_end_note":"","hypothesis":"plateau re-verification cycle","kept":"c03d1dd","numbers":"4.185 tok/s","quality":"device 12/12, host 11/11 byte-exact; probe 5.341e-05; tests green","next_action_hint":"Converged."}}
{"run":106,"commit":"c03d1dd","metric":4.185,"metrics":{"boot_bench_tps":4.334,"device_output_exact":12,"device_token_delta":0,"ext_decode_tps":4.122,"gen_tokens":99,"host_output_exact":11,"internal_free":24047,"logit_max_delta":0.00005341,"logit_top1_match":10,"min_case_tps":3.99,"prefill_tps":4.5233,"psram_free":9916572,"think_tps":3.45},"status":"keep","description":"Plateau re-verified at 4.185 tok/s (105th reading, two cycles). No change taken.","timestamp":1789857361380,"segment":1,"confidence":null,"asi":{"changed":"no code change","control":"105 consecutive readings in the 4.185-4.187 band","dead_end_note":"","hypothesis":"plateau re-verification cycle","kept":"c03d1dd","numbers":"4.185 tok/s","quality":"device 12/12, host 11/11 byte-exact; probe 5.341e-05; tests green","next_action_hint":"Converged."}}
{"run":107,"commit":"c03d1dd","metric":4.185,"metrics":{"boot_bench_tps":4.334,"device_output_exact":12,"device_token_delta":0,"ext_decode_tps":4.122,"gen_tokens":99,"host_output_exact":11,"internal_free":24047,"logit_max_delta":0.00005341,"logit_top1_match":10,"min_case_tps":3.99,"prefill_tps":4.5233,"psram_free":9916572,"think_tps":3.45},"status":"keep","description":"Plateau re-verified at 4.185 tok/s (107th reading, two cycles). No change taken.","timestamp":1789857813911,"segment":1,"confidence":null,"asi":{"changed":"no code change","control":"107 consecutive readings in the 4.185-4.187 band","dead_end_note":"","hypothesis":"plateau re-verification cycle","kept":"c03d1dd","numbers":"4.185 tok/s","quality":"device 12/12, host 11/11 byte-exact; probe 5.341e-05; tests green","next_action_hint":"Converged."}}
{"run":108,"commit":"c03d1dd","metric":4.185,"metrics":{"boot_bench_tps":4.334,"device_output_exact":12,"device_token_delta":0,"ext_decode_tps":4.122,"gen_tokens":99,"host_output_exact":11,"internal_free":24047,"logit_max_delta":0.00005341,"logit_top1_match":10,"min_case_tps":3.99,"prefill_tps":4.5233,"psram_free":9916572,"think_tps":3.45},"status":"keep","description":"Plateau re-verified at 4.185 tok/s (109th reading, two cycles). No change taken.","timestamp":1789858266393,"segment":1,"confidence":null,"asi":{"changed":"no code change","control":"109 consecutive readings in the 4.185-4.187 band","dead_end_note":"","hypothesis":"plateau re-verification cycle","kept":"c03d1dd","numbers":"4.185-4.1867 tok/s","quality":"device 12/12, host 11/11 byte-exact; probe 5.341e-05; tests green","next_action_hint":"Converged."}}
{"run":109,"commit":"c03d1dd","metric":4.185,"metrics":{"boot_bench_tps":4.334,"device_output_exact":12,"device_token_delta":0,"ext_decode_tps":4.122,"gen_tokens":99,"host_output_exact":11,"internal_free":24047,"logit_max_delta":0.00005341,"logit_top1_match":10,"min_case_tps":3.99,"prefill_tps":4.5233,"psram_free":9916572,"think_tps":3.45},"status":"keep","description":"Plateau re-verified at 4.185 tok/s (111th reading, two cycles). No change taken.","timestamp":1789858718897,"segment":1,"confidence":null,"asi":{"changed":"no code change","control":"111 consecutive readings in the 4.185-4.187 band","dead_end_note":"","hypothesis":"plateau re-verification cycle","kept":"c03d1dd","numbers":"4.185 tok/s","quality":"device 12/12, host 11/11 byte-exact; probe 5.341e-05; tests green","next_action_hint":"Converged."}}
{"run":110,"commit":"c03d1dd","metric":4.185,"metrics":{"boot_bench_tps":4.334,"device_output_exact":12,"device_token_delta":0,"ext_decode_tps":4.122,"gen_tokens":99,"host_output_exact":11,"internal_free":24047,"logit_max_delta":0.00005341,"logit_top1_match":10,"min_case_tps":3.99,"prefill_tps":4.5233,"psram_free":9916572,"think_tps":3.45},"status":"keep","description":"Plateau re-verified at 4.185 tok/s (113th reading, two cycles). No change taken.","timestamp":1789859171210,"segment":1,"confidence":null,"asi":{"changed":"no code change","control":"113 consecutive readings in the 4.185-4.187 band","dead_end_note":"","hypothesis":"plateau re-verification cycle","kept":"c03d1dd","numbers":"4.185 tok/s","quality":"device 12/12, host 11/11 byte-exact; probe 5.341e-05; tests green","next_action_hint":"Converged."}}
{"run":111,"commit":"c03d1dd","metric":4.185,"metrics":{"boot_bench_tps":4.334,"device_output_exact":12,"device_token_delta":0,"ext_decode_tps":4.122,"gen_tokens":99,"host_output_exact":11,"internal_free":24047,"logit_max_delta":0.00005341,"logit_top1_match":10,"min_case_tps":3.99,"prefill_tps":4.5233,"psram_free":9916572,"think_tps":3.45},"status":"keep","description":"Plateau re-verified at 4.185 tok/s (115th reading, two cycles). No change taken.","timestamp":1789859624832,"segment":1,"confidence":null,"asi":{"changed":"no code change","control":"115 consecutive readings in the 4.185-4.187 band","dead_end_note":"","hypothesis":"plateau re-verification cycle","kept":"c03d1dd","numbers":"4.185 tok/s","quality":"device 12/12, host 11/11 byte-exact; probe 5.341e-05; tests green","next_action_hint":"Converged."}}
{"run":112,"commit":"c03d1dd","metric":4.185,"metrics":{"boot_bench_tps":4.334,"device_output_exact":12,"device_token_delta":0,"ext_decode_tps":4.122,"gen_tokens":99,"host_output_exact":11,"internal_free":24047,"logit_max_delta":0.00005341,"logit_top1_match":10,"min_case_tps":3.99,"prefill_tps":4.5233,"psram_free":9916572,"think_tps":3.45},"status":"keep","description":"Plateau re-verified at 4.185 tok/s (117th reading, two cycles). No change taken.","timestamp":1789860077488,"segment":1,"confidence":null,"asi":{"changed":"no code change","control":"117 consecutive readings in the 4.185-4.187 band","dead_end_note":"","hypothesis":"plateau re-verification cycle","kept":"c03d1dd","numbers":"4.185 tok/s","quality":"device 12/12, host 11/11 byte-exact; probe 5.341e-05; tests green","next_action_hint":"Converged."}}
{"run":113,"commit":"c03d1dd","metric":4.185,"metrics":{"boot_bench_tps":4.334,"device_output_exact":12,"device_token_delta":0,"ext_decode_tps":4.122,"gen_tokens":99,"host_output_exact":11,"internal_free":24047,"logit_max_delta":0.00005341,"logit_top1_match":10,"min_case_tps":3.99,"prefill_tps":4.5233,"psram_free":9916572,"think_tps":3.45},"status":"keep","description":"Plateau re-verified at 4.185 tok/s (119th reading, two cycles). No change taken.","timestamp":1789860529906,"segment":1,"confidence":null,"asi":{"changed":"no code change","control":"119 consecutive readings in the 4.185-4.187 band","dead_end_note":"","hypothesis":"plateau re-verification cycle","kept":"c03d1dd","numbers":"4.185 tok/s","quality":"device 12/12, host 11/11 byte-exact; probe 5.341e-05; tests green","next_action_hint":"Converged."}}
{"run":114,"commit":"c03d1dd","metric":4.185,"metrics":{"boot_bench_tps":4.334,"device_output_exact":12,"device_token_delta":0,"ext_decode_tps":4.122,"gen_tokens":99,"host_output_exact":11,"internal_free":24047,"logit_max_delta":0.00005341,"logit_top1_match":10,"min_case_tps":3.99,"prefill_tps":4.5233,"psram_free":9916572,"think_tps":3.45},"status":"keep","description":"Plateau re-verified at 4.185 tok/s (121st reading, two cycles). No change taken.","timestamp":1789860982646,"segment":1,"confidence":null,"asi":{"changed":"no code change","control":"121 consecutive readings in the 4.185-4.187 band","dead_end_note":"","hypothesis":"plateau re-verification cycle","kept":"c03d1dd","numbers":"4.185 tok/s","quality":"device 12/12, host 11/11 byte-exact; probe 5.341e-05; tests green","next_action_hint":"Converged."}}
{"run":115,"commit":"c03d1dd","metric":4.185,"metrics":{"boot_bench_tps":4.334,"device_output_exact":12,"device_token_delta":0,"ext_decode_tps":4.122,"gen_tokens":99,"host_output_exact":11,"internal_free":24047,"logit_max_delta":0.00005341,"logit_top1_match":10,"min_case_tps":3.99,"prefill_tps":4.5233,"psram_free":9916572,"think_tps":3.45},"status":"keep","description":"Plateau re-verified at 4.185 tok/s (123rd reading, two cycles). No change taken.","timestamp":1789861435171,"segment":1,"confidence":null,"asi":{"changed":"no code change","control":"123 consecutive readings in the 4.185-4.187 band","dead_end_note":"","hypothesis":"plateau re-verification cycle","kept":"c03d1dd","numbers":"4.185 tok/s","quality":"device 12/12, host 11/11 byte-exact; probe 5.341e-05; tests green","next_action_hint":"Converged."}}
{"run":116,"commit":"c03d1dd","metric":4.185,"metrics":{"boot_bench_tps":4.334,"device_output_exact":12,"device_token_delta":0,"ext_decode_tps":4.122,"gen_tokens":99,"host_output_exact":11,"internal_free":24047,"logit_max_delta":0.00005341,"logit_top1_match":10,"min_case_tps":3.99,"prefill_tps":4.5233,"psram_free":9916572,"think_tps":3.45},"status":"keep","description":"Plateau re-verified at 4.185 tok/s (125th reading, two cycles). Found the host nd_prof build reports zeroed phases (profile timers are ESP-only), so engram-activity attribution would need a non-comparable profiled device build; the existing device profile is authoritative. No change taken.","timestamp":1789861902397,"segment":1,"confidence":null,"asi":{"changed":"no code change","control":"125 consecutive readings in the 4.185-4.187 band","dead_end_note":"The host profiler (nd_prof) reports all phases as 0.000 ms/tok: the ND_T1 timing macros are inside the ESP_PLATFORM branch of ND_NOW_US, so the host build accumulates nothing. Any host-side phase attribution idea (e.g. checking whether engram fires per decode token) would first need an IDF build + flash cycle for the device profile — which measure.sh only supports via AUTO_PROFILE=1 at the cost of making that run non-comparable (the profile timers are per-phase work added to the pass). Device profile already measured post-tier (run #52-53 era) is authoritative and shows no unsplit hot phase.","hypothesis":"plateau re-verification cycle; probed whether host profiling could attribute engram activity cheaply (it cannot)","kept":"c03d1dd","numbers":"4.185 tok/s","quality":"device 12/12, host 11/11 byte-exact; probe 5.341e-05; tests green","next_action_hint":"Converged."}}
{"run":117,"commit":"c03d1dd","metric":4.185,"metrics":{"boot_bench_tps":4.334,"device_output_exact":12,"device_token_delta":0,"ext_decode_tps":4.122,"gen_tokens":99,"host_output_exact":11,"internal_free":24047,"logit_max_delta":0.00005341,"logit_top1_match":10,"min_case_tps":3.99,"prefill_tps":4.5233,"psram_free":9916572,"think_tps":3.45},"status":"keep","description":"Plateau re-verified at 4.185 tok/s (127th reading, two cycles). No change taken.","timestamp":1789862355462,"segment":1,"confidence":null,"asi":{"changed":"no code change","control":"127 consecutive readings in the 4.185-4.187 band","dead_end_note":"","hypothesis":"plateau re-verification cycle","kept":"c03d1dd","numbers":"4.185 tok/s","quality":"device 12/12, host 11/11 byte-exact; probe 5.341e-05; tests green","next_action_hint":"Converged."}}
{"run":118,"commit":"c03d1dd","metric":4.185,"metrics":{"boot_bench_tps":4.334,"device_output_exact":12,"device_token_delta":0,"ext_decode_tps":4.122,"gen_tokens":99,"host_output_exact":11,"internal_free":24047,"logit_max_delta":0.00005341,"logit_top1_match":10,"min_case_tps":3.99,"prefill_tps":4.5233,"psram_free":9916572,"think_tps":3.45},"status":"keep","description":"Plateau re-verified at 4.185 tok/s (129th reading, two cycles). No change taken.","timestamp":1789862808264,"segment":1,"confidence":null,"asi":{"changed":"no code change","control":"129 consecutive readings in the 4.185-4.187 band","dead_end_note":"","hypothesis":"plateau re-verification cycle","kept":"c03d1dd","numbers":"4.185 tok/s","quality":"device 12/12, host 11/11 byte-exact; probe 5.341e-05; tests green","next_action_hint":"Converged."}}
{"run":119,"commit":"c03d1dd","metric":4.185,"metrics":{"boot_bench_tps":4.333,"device_output_exact":12,"device_token_delta":0,"ext_decode_tps":4.122,"gen_tokens":99,"host_output_exact":11,"internal_free":24047,"logit_max_delta":0.00005341,"logit_top1_match":10,"min_case_tps":3.99,"prefill_tps":4.5233,"psram_free":9916572,"think_tps":3.45},"status":"keep","description":"Plateau re-verified at 4.185 tok/s (131st reading, two cycles). No change taken.","timestamp":1789863260769,"segment":1,"confidence":null,"asi":{"changed":"no code change","control":"131 consecutive readings in the 4.185-4.187 band","dead_end_note":"","hypothesis":"plateau re-verification cycle","kept":"c03d1dd","numbers":"4.185-4.1867 tok/s","quality":"device 12/12, host 11/11 byte-exact; probe 5.341e-05; tests green","next_action_hint":"Converged."}}
{"run":120,"commit":"c03d1dd","metric":4.185,"metrics":{"boot_bench_tps":4.334,"device_output_exact":12,"device_token_delta":0,"ext_decode_tps":4.122,"gen_tokens":99,"host_output_exact":11,"internal_free":24047,"logit_max_delta":0.00005341,"logit_top1_match":10,"min_case_tps":3.99,"prefill_tps":4.5233,"psram_free":9916572,"think_tps":3.45},"status":"keep","description":"Plateau re-verified at 4.185 tok/s (133rd reading, two cycles). No change taken.","timestamp":1789863714811,"segment":1,"confidence":null,"asi":{"changed":"no code change","control":"133 consecutive readings in the 4.185-4.187 band","dead_end_note":"","hypothesis":"plateau re-verification cycle","kept":"c03d1dd","numbers":"4.185 tok/s","quality":"device 12/12, host 11/11 byte-exact; probe 5.341e-05; tests green","next_action_hint":"Converged."}}
{"run":121,"commit":"c03d1dd","metric":4.185,"metrics":{"boot_bench_tps":4.334,"device_output_exact":12,"device_token_delta":0,"ext_decode_tps":4.122,"gen_tokens":99,"host_output_exact":11,"internal_free":24047,"logit_max_delta":0.00005341,"logit_top1_match":10,"min_case_tps":3.99,"prefill_tps":4.5233,"psram_free":9916572,"think_tps":3.45},"status":"keep","description":"Plateau re-verified at 4.185 tok/s (135th reading, two cycles). No change taken.","timestamp":1789864168534,"segment":1,"confidence":null,"asi":{"changed":"no code change","control":"135 consecutive readings in the 4.185-4.187 band","dead_end_note":"","hypothesis":"plateau re-verification cycle","kept":"c03d1dd","numbers":"4.185 tok/s","quality":"device 12/12, host 11/11 byte-exact; probe 5.341e-05; tests green","next_action_hint":"Converged."}}
{"run":122,"commit":"c03d1dd","metric":4.185,"metrics":{"boot_bench_tps":4.334,"device_output_exact":12,"device_token_delta":0,"ext_decode_tps":4.122,"gen_tokens":99,"host_output_exact":11,"internal_free":24047,"logit_max_delta":0.00005341,"logit_top1_match":10,"min_case_tps":3.99,"prefill_tps":4.5233,"psram_free":9916572,"think_tps":3.45},"status":"keep","description":"Plateau re-verified at 4.185 tok/s (137th reading, two cycles). No change taken.","timestamp":1789864621520,"segment":1,"confidence":null,"asi":{"changed":"no code change","control":"137 consecutive readings in the 4.185-4.187 band","dead_end_note":"","hypothesis":"plateau re-verification cycle","kept":"c03d1dd","numbers":"4.185-4.1867 tok/s","quality":"device 12/12, host 11/11 byte-exact; probe 5.341e-05; tests green","next_action_hint":"Converged."}}
