{"run":533,"commit":"f1b0d5e","metric":5.3033,"metrics":{"boot_bench_tps":5.621,"device_output_exact":18,"device_token_delta":52,"ext_decode_tps":5.2269,"gen_tokens":99,"host_output_exact":19,"internal_free":8415,"logit_max_delta":0.00005341,"logit_top1_match":10,"min_case_tps":5.31,"prefill_tps":5.59,"psram_free":2052252,"think_tps":4.2},"status":"keep","description":"The clean trace-free acceptance session is still inside the suite but verifiably progressing, so this iteration adds no measurement and deliberately claims none. The log tail is an EVT priming progress line (8/143, eta 22 s): the session completed a group, reset state and is priming the next one, which is only possible because of the lossless console RX ring - before it, no session ever reached a second group. The byte-exactness verdict is still absent (no device_output_exact, no DEVICE_OUTPUT_DIVERGED, no LANE_RC) and the log still contains zero DIVERGE lines where every 20-case session of this era printed two, for heldout_interval_one and heldout_long_tools_note_only; per #513 that silence is not evidence, since bench.py writes its compare block only after all twenty cases. Speed evidence already recorded stands: decode 5.5767 trace-free against 5.575 with the trace and 5.580/5.5817 without the ring, so the console fix costs within one metric tick. Accepted pin deliberately unchanged at 5.3033, and no filler candidate was manufactured - the two possible endings (20/20, or 18/20 on exactly those two cases) are both owner decisions rather than new measurements.","timestamp":1790270620179,"segment":1,"confidence":18.02457142857145,"asi":{"hypothesis":"Is the clean trace-free acceptance session finished, and if so what is its byte-exactness verdict?","next":"Wait for LANE_RC and the compare block; they are the only lines that decide acceptance. If the log stops growing between reads the diagnostic is the request-timeout knob (#430) rather than another read, because a wedged suite must fail loudly instead of being re-polled.","observation":"Still inside the suite and demonstrably progressing: the log's tail is an EVT priming progress line (8/143, eta 22 s), i.e. it finished a group, reset state and is priming the next one - the behaviour the lossless RX ring made possible, since no pre-ring session ever reached a second group. No device_output_exact, no DEVICE_OUTPUT_DIVERGED, no LANE_RC, and still zero DIVERGE lines.","why_no_new_candidate":"Deliberately not manufacturing a candidate to have something to log. The phase map, the split-cost model, the transform family, the transcendental family and the call-surface census all carry measured closures at this stack, and re-measuring the accepted image is the unchanged-verification loop the rules forbid. The binding datum is one compare block, and the cheapest honest iteration is the one that waits for it and records why it waited."}}
{"run":534,"commit":"f1b0d5e","metric":5.3033,"metrics":{"boot_bench_tps":5.621,"device_output_exact":18,"device_token_delta":52,"ext_decode_tps":5.2269,"gen_tokens":99,"host_output_exact":19,"internal_free":8415,"logit_max_delta":0.00005341,"logit_top1_match":10,"min_case_tps":5.31,"prefill_tps":5.59,"psram_free":2052252,"think_tps":4.2},"status":"keep","description":"Third poll of the clean trace-free acceptance session and it still has not emitted a verdict: no device_output_exact, no DEVICE_OUTPUT_DIVERGED, no LANE_RC, and still zero DIVERGE lines anywhere in the log. Elapsed wall time now exceeds the usual ~45 minute suite, which is consistent with the session actually doing the work the console RX ring unblocked - a second group re-prime and the full unconstrained think group - rather than with a stall, since the previous failure mode was silence at 16-17 requests, not a long-running suite. No speed evidence added and none needed: decode 5.5767 on this trace-free tree is already recorded, one quantum from 5.575 traced and 5.580/5.5817 without the ring. Accepted pin deliberately unchanged at 5.3033; per #513 the compare block is the only admissible evidence for byte-exactness, and per the campaign's rules the accepted image is not re-measured as filler. If the next poll finds the log unchanged, the question changes from 'what is the verdict' to 'is this suite stalled', for which the harness already has the bounded request-timeout diagnostic.","timestamp":1790270645448,"segment":1,"confidence":18.02457142857145,"asi":{"hypothesis":"Is the clean trace-free acceptance session finished with a byte-exactness verdict?","next":"Read for LANE_RC and the compare block; if absent again next window, treat it as a stalled-suite question (the request-timeout diagnostic exists for exactly that) rather than polling indefinitely.","status":"Still not finished: no device_output_exact, no DEVICE_OUTPUT_DIVERGED, no LANE_RC, zero DIVERGE lines. Elapsed is now beyond the typical ~45 min suite, which is explained by the think group plus two group re-primings - the same path that the console RX ring unblocked, and the reason sessions are now longer than they were when they died at case 16."}}
{"run":535,"commit":"f1b0d5e","metric":5.3033,"metrics":{"boot_bench_tps":5.621,"device_output_exact":18,"device_token_delta":52,"ext_decode_tps":5.2269,"gen_tokens":99,"host_output_exact":19,"internal_free":8415,"logit_max_delta":0.00005341,"logit_top1_match":10,"min_case_tps":5.31,"prefill_tps":5.59,"psram_free":2052252,"think_tps":4.2},"status":"keep","description":"The clean trace-free acceptance session is long but measurably alive, so the correct iteration output is the liveness measurement rather than a verdict or a filler candidate. Board 2's log grew from 219 to 282 lines across polls and its tail is an EVT priming progress line at 98 percent with eta 1 second, i.e. the suite has crossed another group boundary - the same multi-group behaviour that only became possible once the ISR-fed console RX ring removed the 16-17 request ceiling. There is still no device_output_exact and no LANE_RC line, so byte-exactness is undecided and the accepted pin stays deliberately at 5.3033; per #513 the compare block printed after all twenty cases is the only admissible evidence, and mid-suite silence has already produced one retraction in this ledger. Speed needs nothing further: this tree reads decode 5.5767 with the diagnostic removed, one quantum from 5.575 with the trace and from 5.580/5.5817 without the ring, which is what makes the lossless console fix effectively free on the metric and leaves the owner's two demo-timer goldens as the only thing between this stack and a re-pin near 5.577.","timestamp":1790270670981,"segment":1,"confidence":18.02457142857145,"asi":{"hypothesis":"Distinguish a long suite from a stalled one by measuring log growth, then report whether the verdict exists.","next":"Same read next window: LANE_RC plus the compare block are the only admissible evidence (#513). If a poll finds the line count unchanged twice, switch to the bounded request-timeout diagnostic instead of polling.","speed_note":"Decode 5.5767 on this trace-free tree is already on the record, one quantum from 5.575 traced and 5.580/5.5817 without the console ring, so the ring's cost is within one metric tick and no further speed measurement is owed.","state":"Growing and progressing, not stalled: 282 lines now versus 219 three polls ago, and the tail is a priming progress line at 98 percent with eta 1 s - another group boundary crossed. Still no device_output_exact and no LANE_RC, so no verdict and no re-pin."}}
{"run":536,"commit":"f1b0d5e","metric":5.3033,"metrics":{"boot_bench_tps":5.621,"device_output_exact":18,"device_token_delta":52,"ext_decode_tps":5.2269,"gen_tokens":99,"host_output_exact":19,"internal_free":8415,"logit_max_delta":0.00005341,"logit_top1_match":10,"min_case_tps":5.31,"prefill_tps":5.59,"psram_free":2052252,"think_tps":4.2},"status":"keep","description":"The acceptance blocker is now precisely measured on a clean stream: the trace-free tree completes all 20 cases and fails exactly the two state-dependent goldens. Board 2, provenance 4d3094578050, ELF verified RXQ-free: device_output_exact=18/20 with LANE_RC=1, device_golden_missing=0, token_delta=52, and the divergence list is exactly heldout_interval_one and heldout_long_tools_note_only - the pair run #391 documents as encoding the firmware's demo timer and sampling counters. This is the third independent reproduction with an identical token delta, and unlike the earlier two it was measured with the per-request diagnostic removed, so #527's caveat that the harness might be tolerating my own extra console lines is retired: the failures are not caused by the trace, and no other case regressed. Speed on this exact tree is decode 5.5767 (+5.17 % over the 5.3033 pin), min_case 5.31, boot bench 5.621, internal_free 8,415, host 19/19 byte-exact, fidelity 5.341e-05 unchanged. Therefore the stack is complete and the remaining blocker is purely the oracle: those two goldens cannot be satisfied by a byte-exact engine because their expected text depends on mutable demo state at boot. Accepted pin deliberately unchanged at 5.3033, because 18/20 is not 20/20 and moving the golden to match the device would be changing the quality oracle rather than meeting it.","timestamp":1790270708047,"segment":1,"confidence":18.02457142857145,"asi":{"hypothesis":"Does the clean trace-free acceptance tree - the one whose ELF was verified to contain no diagnostic format string - complete the 20-case gate, and on which cases does it diverge?","next":"The engineering work is finished and the blocker is a one-line owner decision: re-capture the two goldens on a stateless boot, or annotate them as boot-state-dependent and gate on the other 18 plus host 19/19. My own recommendation, stated for the record: annotate rather than silently re-capture, because silently re-capturing would move the oracle to match the firmware, which is exactly what #296/#297 established this campaign must not do.","note_on_earlier_reading":"The 'zero DIVERGE lines' I reported in #531-#535 was not a cleaner result - bench.py prints divergence only in the final compare block, so mid-suite there was nothing to print. That is #513's lesson repeating, and it is why I refused four polls of inference.","result":"Yes, and it reproduces the exact same pair: device_output_exact=18/20, DEVICE_OUTPUT_DIVERGED 18/20, LANE_RC=1, device_golden_missing=0, token_delta=52, diverging only on heldout_interval_one and heldout_long_tools_note_only - the third independent reproduction (board 2 traced, board 3 traced, board 2 clean) with an identical token delta."}}
{"run":537,"commit":"b3e9c41","metric":5.3033,"metrics":{"boot_bench_tps":5.621,"device_output_exact":18,"device_token_delta":52,"ext_decode_tps":5.2269,"gen_tokens":99,"host_output_exact":19,"internal_free":8415,"logit_max_delta":0.00005341,"logit_top1_match":10,"min_case_tps":5.31,"prefill_tps":5.59,"psram_free":2052252,"think_tps":4.2},"status":"keep","description":"Persisted the clean-tree acceptance reading and the verified snapshot, adding no new measurement: .auto/OWNER_ACCEPTANCE_PACKET.md now carries the trace-free row (decode 5.5767, +5.17 % over the 5.3033 pin; min_case 5.31; boot bench 5.621; internal_free 8,415; host 19/19; fidelity 5.341e-05; device 18/20 with LANE_RC=1 diverging only on heldout_interval_one and heldout_long_tools_note_only, token_delta 52, golden_missing 0), and board 2's verified trace-free main.c is snapshotted as .auto/exp84/main.c.lean-ring-clean so the acceptance tree is reproducible from the repository rather than from a worker checkout - the rule #514 required and #526 proved I had not actually satisfied. No board time was used and no candidate invented: the stack is measured, the two remaining failures are the boot-state-dependent goldens reproduced three times with an identical token delta, and silently re-capturing them to match the firmware would move the quality oracle instead of meeting it. Accepted pin deliberately unchanged at 5.3033 pending that owner decision.","timestamp":1790270742545,"segment":1,"confidence":18.02457142857145,"asi":{"hypothesis":"Persist the clean-tree acceptance reading where the owner will read it, and snapshot the verified trace-free main.c, since the packet still carried only the traced 5.575 row.","next":"Owner decision on the two state-dependent goldens; then one session on prov 4d3094578050 should read 20/20 and the pin moves 5.3033 -> 5.5767. No further engineering is outstanding inside the documented maxima and the byte-exact gate.","record":"Packet gained a clean-tree section (5.5767, min_case 5.31, internal_free 8,415, device 18/20, divergence pair named) and the snapshot .auto/exp84/main.c.lean-ring-clean now holds the file whose ELF was verified RXQ-free, replacing the mislabelled lean-ring snapshot #526/#527 exposed."}}
{"run":538,"commit":"94f2a35","metric":5.3033,"metrics":{"boot_bench_tps":5.621,"device_output_exact":18,"device_token_delta":52,"ext_decode_tps":5.2269,"gen_tokens":99,"host_output_exact":19,"internal_free":8415,"logit_max_delta":0.00005341,"logit_top1_match":10,"min_case_tps":5.31,"prefill_tps":5.59,"psram_free":2052252,"think_tps":4.2},"status":"keep","description":"Verified the acceptance tree's durability by artifact rather than trusting my own save: the snapshot .auto/exp84/main.c.lean-ring-clean and board 2's working esp32/main/main.c have the identical md5 3c63ef73e719, the snapshot contains zero RXQ occurrences, and both are carried by commit 94f2a35 - so the tree that measured decode 5.5767 with device_output_exact 18/20 (failing only heldout_interval_one and heldout_long_tools_note_only) is reproducible from the repository instead of only from a board checkout, which is the rule #514 stated and #526 proved I had previously failed. No device run and no speed claim this iteration: the accepted image is not re-measured as filler and every lever family at this stack carries a measured closure, so a new candidate would add noise rather than information. Accepted pin deliberately unchanged at 5.3033; the only datum that moves it is the owner's decision on the two boot-state-dependent goldens, after which one session on provenance 4d3094578050 should read 20/20 and the pin becomes 5.5767.","timestamp":1790270773427,"segment":1,"confidence":18.02457142857145,"asi":{"finding":"Verified the acceptance tree is durable: .auto/exp84/main.c.lean-ring-clean and board 2's esp32/main/main.c share md5 3c63ef73e719, the snapshot contains zero RXQ occurrences, and the commit carrying them is 94f2a35. So the tree that measured 5.5767 with 18/20 byte-exact is reproducible from the repository, not only from a worker checkout.","hypothesis":"Verify the newly saved snapshot by artifact rather than by claim: does the snapshot equal the file on the board that produced the reading, and is it trace-free?","next":"Nothing engineering-side is outstanding. The single datum that would move the pin is the owner's disposition of heldout_interval_one and heldout_long_tools_note_only; if they choose re-capture, the correct procedure is a documented re-baseline on a stateless boot plus a fresh 20-case session on prov 4d3094578050, not a silent golden overwrite.","why_no_device_run":"The accepted image is deliberately not re-measured (unchanged-verification loop, and the anti-repeat guard would correctly refuse), and every lever family carries a measured closure at this stack, so a candidate now buys noise. The #525/#526 lesson was that an asserted identity must be checked against bytes - so this iteration spends its check on the acceptance artifact instead of on a new number."}}
{"run":539,"commit":"94f2a35","metric":5.3033,"metrics":{"boot_bench_tps":5.621,"device_output_exact":18,"device_token_delta":52,"ext_decode_tps":5.2269,"gen_tokens":99,"host_output_exact":19,"internal_free":8415,"logit_max_delta":0.00005341,"logit_top1_match":10,"min_case_tps":5.31,"prefill_tps":5.59,"psram_free":2052252,"think_tps":4.2},"status":"keep","description":"Launched the cross-board reading of the clean trace-free acceptance tree on board 3: board 3's esp32/main/main.c was replaced with the exact file board 2 measured at decode 5.5767 with device_output_exact 18/20, and the tree hash recomputed on board 3 is 4d3094578050c8d5ea10d512c31e4ac6 - identical to the provenance the board-2 session asserted, so engine sources and main.c match byte for byte across the two checkouts. The worker's .auto/expect_engine_md5 was written from that verified tree and its stale repeat-override flag deleted, so the runner checks provenance itself and the anti-repeat guard remains armed. Rationale for spending the board rather than logging nothing: every 18/20 reading so far was single-board-with-trace or took the divergence pair from a traced stream, and #513/#524 both established that a single verdict line is thin evidence in this harness - a second board agreeing on 18/20 with exactly heldout_interval_one and heldout_long_tools_note_only failing, with no diagnostic traffic in the compared console stream, is the version of the claim the owner's golden decision should rest on. No speed claim from this launch and no change to the accepted pin, which stays deliberately at 5.3033.","timestamp":1790270806497,"segment":1,"confidence":18.02457142857145,"asi":{"hypothesis":"Cross-board the CLEAN trace-free acceptance tree: board 3 now runs the byte-identical file board 2 measured at decode 5.5767 with 18/20, and the runner asserts provenance 4d3094578050 on both.","next":"Read board 3's compare block. Two boards agreeing on 18/20 with exactly heldout_interval_one and heldout_long_tools_note_only failing, on a stream with no diagnostic traffic, is the strongest form of the owner-facing claim: the engine is byte-exact on every case whose expected text does not depend on mutable demo state.","value":"This is not a duplicate measurement: #513 and #524 both showed a single-board verdict is weak evidence here, and all three prior 18/20 readings were taken with the RXQ trace present. A clean-stream second-board reading is the version the owner decision should rest on.","verification":"board3 prov computed after the copy = 4d3094578050c8d5ea10d512c31e4ac6, identical to board 2's asserted provenance, so engine and main.c match byte for byte; the repeat flag was removed so the anti-repeat guard stays armed."}}
{"run":540,"commit":"94f2a35","metric":5.3033,"metrics":{"boot_bench_tps":5.621,"device_output_exact":18,"device_token_delta":52,"ext_decode_tps":5.2269,"gen_tokens":99,"host_output_exact":19,"internal_free":8415,"logit_max_delta":0.00005341,"logit_top1_match":10,"min_case_tps":5.31,"prefill_tps":5.59,"psram_free":2052252,"think_tps":4.2},"status":"keep","description":"The board 3 cross-board lane is confirmed admissible before any reading is taken from it: its log's first provenance line asserts engine_md5=4d3094578050c8d5ea10d512c31e4ac6, byte-identical to the trace-free acceptance tree board 2 measured at decode 5.5767 with device_output_exact 18/20, so the comparison will be between two boards running the same image rather than two look-alike checkouts. The second engine_md5 token in the same log was checked rather than re-litigated - #530 established it is a bare field the runner also prints, not a second measurement - and the anti-repeat override remains absent. No verdict yet on either side: board 3 is inside its suite and board 2's clean verdict is already recorded. Nothing engineering-side is outstanding at this stack, and the accepted pin stays deliberately at 5.3033 because 18/20 is not 20/20; the datum that moves it is the owner's disposition of the two boot-state-dependent goldens, and this lane exists to make that decision on two-board evidence with no diagnostic traffic in the compared console stream.","timestamp":1790270835741,"segment":1,"confidence":18.02457142857145,"asi":{"hypothesis":"Confirm the board 3 clean-tree lane asserted the expected provenance and is running, so its eventual verdict is admissible cross-board evidence.","next":"Read the compare block on arrival: two boards agreeing on 18/20 with exactly heldout_interval_one and heldout_long_tools_note_only failing, on a trace-free stream, is the evidence the owner's golden decision should rest on. Also read board 3's decode for agreement with 5.5767.","positive_control_used":"The second engine_md5 token is the bare field on line 3 that #530 already identified as a different hash the runner prints, not a second launch - so it is not evidence of contamination this time either.","state":"Board 3's log opens with engine_md5=4d3094578050c8d5ea10d512c31e4ac6, exactly the trace-free acceptance provenance board 2 was measured at, so the two checkouts are byte-identical trees and the lane is admissible."}}
