{"run":381,"commit":"HEAD","metric":5.0583,"metrics":{"boot_bench_tps":5.105,"device_output_exact":17,"device_token_delta":0,"ext_decode_tps":4.985,"gen_tokens":99,"host_output_exact":19,"internal_free":13879,"logit_max_delta":0.00005341,"logit_top1_match":10,"min_case_tps":4.83,"prefill_tps":5.3383,"psram_free":2052252,"think_tps":3.96},"status":"discard","description":"Experiment 41 lane - cond4, four channels' conditioning reductions interleaved: MEASURED, -0.427 %, REJECTED (decode 5.0583 vs accepted 5.0800, batch 20260923T1530L, board 2). Bit-exact and gate-clean (DEVICE_GATE_OK 17/17, golden_missing=0, token_delta=0, host 19/19 pre-flash), so a pure speed verdict; boot bench 5.105 moved the wrong way (-0.89 %), which is the mechanism check because the MLP is inside the bench; extended 4.985, think 3.96, prefill 5.3383, min_case 4.83, internal_free unchanged at 13,879. The curve point is the informative part: cond2 -0.394 %, cond4 -0.427 % is monotonically downward, which rules out a different interleave factor rather than merely failing to find one. With the transform wins (fw2 +0.461 %, fw2pair +0.492 %) this brackets the family: interleaving chains pays only where operands are already resident and the work is pure arithmetic.","timestamp":1790165996195,"segment":1,"confidence":22.19416666666665,"asi":{"candidate":"cond4 - the same cond_rows interleave at four channels per iteration, the curve point for the mechanism (the transform's own curve was flat between 2 and 4 and fell off at 8, so the shape of this one was an open question).","hypothesis":"If the Hadamard MLP's conditioning reductions are latency-bound on a serial 768-term chain, more chains in flight should help at least as much as two did - and if four is worse than two, the binding constraint is registers or operand delivery rather than latency.","result":"decode 5.0583 = -0.427 % against the accepted 5.0800 (batch 20260923T1530L, board 2). Monitors: extended 4.985 (-0.52 %), prefill 5.3383, think 3.96, boot bench 5.105 (-0.89 % - the bench moved the wrong way, and the MLP is inside the bench, which is the mechanism check), min_case 4.83, gen_tokens 99, internal_free 13,879 (unchanged). Bit-exact and gate-clean (DEVICE_GATE_OK 17/17, golden_missing=0, token_delta=0, host 19/19 before the flash), so a pure speed verdict.","verdict":"REJECTED, and it is the informative half of the pair: cond2 -0.394 %, cond4 -0.427 %, so the curve is monotonically downward, which rules out 'try a different interleave factor' rather than merely failing to find one. Together with the transform measurements (fw2 +0.461 %, fw2pair +0.492 %) the family's shape is now bracketed on both sides.","conclusion":"Interleaving chains pays only when the loop's operands are already resident and its work is pure arithmetic; on a strided-load reduction it costs, and adding more chains costs slightly more. That refines fw2's lesson rather than contradicting it, and it is the rule to apply before spending a board on any future 'more ILP' candidate: ask what the loop is bound by first.","next":"fw3pair (three groups = the exact per-core group count) and fw2single (paired groups without the within-stage unroll, the attribution run) are measuring now; the rescale-pair candidate follows the refined rule, since its operand is the block the transform just produced and is therefore already hot."}}
{"run":382,"commit":"HEAD","metric":5.1067,"metrics":{"boot_bench_tps":5.153,"device_output_exact":17,"device_token_delta":0,"ext_decode_tps":5.031,"gen_tokens":99,"host_output_exact":19,"internal_free":13623,"logit_max_delta":0.00005341,"logit_top1_match":10,"min_case_tps":4.87,"prefill_tps":5.39,"psram_free":2052252,"think_tps":3.98},"status":"discard","description":"Experiment 41 attribution lane - fw2single, two FWHT groups paired with one butterfly per stage (pairing WITHOUT #378's within-stage unroll): MEASURED 5.1067, i.e. +0.328 % over its own fw2-only base and a TIE with the accepted 5.1050 that has both mechanisms (batch 20260923T1630L, board 2; extended 5.031, think 3.98, prefill 5.39, boot bench 5.153, min_case 4.87, DEVICE_GATE_OK, host 19/19 pre-flash). So cross-group pairing and within-stage unrolling are one mechanism, not two: the unroll adds nothing once pairing exists, although alone it was worth +0.461 %. Tree unchanged (swapping would trade byte-exact provenance for 74 B with no speed change); fw3pair and fwres2 logged separately.","timestamp":1790166274890,"segment":1,"confidence":22.19416666666665,"asi":{"candidate":"fw2single - two FWHT groups walked together with ONE butterfly per stage per group (inner=1), i.e. pairing without the within-stage 2-way unroll that #378 shipped. Built on the same measured base as fw2pair (the fw2-only engine, md5 c416d6559a8f, pinned and asserted in .auto/exp41/make_variants.py so a stale base cannot fake a candidate), so the two are a clean A/B on one lever. Bit-exact: per-group stage order preserved, remainder path covered, verified by .auto/exp41/test_odd_split.c (6 tensors x 5 splits, 0 mismatches) and host 19/19 before flashing.","hypothesis":"This is the attribution run for a +0.461 % and a +0.492 % win in the same loop. If cross-group pairing and within-stage unrolling are the same mechanism (independent butterflies in flight) then removing the unroll costs nothing once pairing exists; if they are different mechanisms the two should differ.","result":"decode 5.1067 (batch 20260923T1630L, board 2). Against its own base (fw2-only, 5.0800) that is +0.328 %; against the current accepted 5.1050 (which has BOTH mechanisms) it is +0.033 %, i.e. one metric tick - a tie. Monitors all within a tick of the accepted image: extended 5.031, think 3.98, prefill 5.39, boot bench 5.153, min_case 4.87, gen_tokens 99, DEVICE_GATE_OK.","finding":"The two levers are ONE mechanism, not two: with pairing present the within-stage unroll contributes nothing measurable, even though alone it was worth +0.461 %. Consequence for the tree: the shipped fw2 unroll is now redundant for the two-thirds of groups that take the paired path (per-core group count 3 means the paired path handles 2 and the single-group tail handles 1, so the unroll still covers a third). Not worth a swap on speed, and swapping would also invalidate the byte-exact provenance of the accepted image, so the tree stays as measured.","method_note":"The generator nearly shipped a fake: its paired-call text was written against names (blk1) that the accepted file does not use (blk2), and an md5-guarded pinned base plus 'assert the swap happened' are what turned that into a build-time failure instead of a board that silently re-measures the accepted path. Related geometry trap found the same way: a paired loop guarded by `gi + ng < g1` with ng=4 would never execute on this geometry at all.","next":"fw3pair (three groups per walk = exactly the per-core count, so the paired path covers everything and the tail never runs) read 5.1100 - +0.098 % over accepted, sub-bar but the best absolute reading so far, logged separately. fwres2 (one rescale pass over both paired groups) is measuring now. If both are independently positive but sub-bar, the legitimate move is the combination fw3res (three groups + one rescale over 3g), which is the same precedent as run #371's bundle."}}
{"run":383,"commit":"HEAD","metric":5.1,"metrics":{"boot_bench_tps":5.15,"device_output_exact":17,"device_token_delta":0,"ext_decode_tps":5.03,"gen_tokens":99,"host_output_exact":19,"internal_free":13623,"logit_max_delta":0.00005341,"logit_top1_match":10,"min_case_tps":4.87,"prefill_tps":5.3867,"psram_free":2052252,"think_tps":3.98},"status":"discard","description":"Experiment 42 lane - fwdif, both FWHT walks with stages walked in DESCENDING len (last stage contiguous instead of first): MEASURED -0.098 %, REJECTED (decode 5.1000 vs accepted 5.1050, batch 20260923T1730L, board 2). Bit-exact and gate-clean (DEVICE_GATE_OK, rc=0, golden_missing=0, token_delta=0, host 19/19 + odd-split guard pre-flash), extended 5.030, think 3.98, prefill 5.3867, boot bench 5.150, min_case 4.87, internal_free 13,623 - so a pure speed verdict: ascending, which the firmware already does, is the better order, closing the transform's stage-ORDER axis (off-device by-product: descending really is the same function, proven on the model's own data).","timestamp":1790167601324,"segment":1,"confidence":22.19416666666665,"asi":{"candidate":"fwdif - both transform walks (nd_fwht and the generated nd_fwht2) run their stages in DESCENDING len instead of ascending, so the final stage's butterflies are contiguous (stride 1) instead of the shortest run being the widest. Generator initially matched only one of the two spellings of the loop (`len = 1;` vs `len = 1u;`) and thereby changed 2 of 3 groups; now it matches both and asserts both are rewritten.","hypothesis":"Ascending row order beat shuffled reads by 6 % on the dominant phase (#352), and the winning transform levers came from operand delivery plus independent work, so making the last walked stage contiguous should reduce the stride cost of the butterfly loads.","result":"decode 5.1000 vs accepted 5.1050 = -0.098 %. prefill 5.3867, extended 5.030, think 3.98, boot bench 5.150, min_case 4.87, internal_free 13,623 (free), DEVICE_GATE_OK, rc=0, gen_tokens 99. Bit-exact on the host (19/19, token_delta 0, odd-split guard 6 tensors x 5 splits 0 mismatches) BEFORE flashing, so descending/ascending equivalence of the Walsh transform (H_n = H_2 tensor H_(n/2)) is now measured on the model's real data, not assumed.","finding":"Descending is 0.1 % WORSE, so ascending - what the firmware already does - is the better order here too, and the contiguous-last-stage intuition does not transfer to this loop. Same direction as #352's within-tensor result, from the opposite side. The transform's stage ORDER axis is therefore closed; only the amount of independent work inside it has ever paid.","revisits_run":352,"next":"Log fw3pair (+0.098 %, three groups per walk, reproducible on two boards, DEVICE_GATE_OK, costs 256 B) as the family's last sub-bar option. Bundle rule: run #371's precedent needs two independently POSITIVE sub-bar halves, and fwres2 measured exactly 0.000 %, so fw3res is not justified - the combination is skipped by the rule rather than by instinct."}}
{"run":384,"commit":"HEAD","metric":5.11,"metrics":{"boot_bench_tps":5.157,"device_output_exact":17,"device_token_delta":0,"ext_decode_tps":5.036,"gen_tokens":99,"host_output_exact":19,"internal_free":13367,"logit_max_delta":0.00005341,"logit_top1_match":10,"min_case_tps":4.88,"prefill_tps":5.395,"psram_free":2052252,"think_tps":3.99},"status":"discard","description":"Experiment 41 lane - fw3pair, three FWHT groups transformed in one stage walk (ng=3 = exactly the per-core group count, so the paired path covers everything and the single-group walk never runs): MEASURED +0.098 %, BELOW THE 0.2 % BAR, not kept (decode 5.1100 vs accepted 5.1050; 5.1100 in two independent batches on board 3, the second rc=0 with DEVICE_GATE_OK, golden_missing=0, token_delta=0, host 19/19 pre-flash, fidelity 5.341e-05, top1 10/10). Monitors all up: extended 5.036, think 3.99, prefill 5.395, boot bench 5.157 (+0.12 % mechanism check), min_case 4.88; cost internal_free 13,367 (-256 B). Banked as the family's best sub-bar option - sign established on three readings, magnitude is the only thing missing.","timestamp":1790167630113,"segment":1,"confidence":22.19416666666665,"asi":{"candidate":"fw3pair - three FWHT groups transformed in one stage walk (nd_fwht3), i.e. ng=3 instead of the shipped ng=2, on the same measured base (fw2-only engine, md5 c416d6559a8f, pinned+asserted). ngroup=6 split 3+3 gives each core exactly three groups, so with ng=3 the paired path covers every group and the single-group walk never runs on device - which is why ng=3 is the geometry's real curve point and ng=4 is not a curve point at all (a `gi + ng-1 < g1` guard would never fire). Bit-exact by construction (each group's stages complete in its own order) and covered by .auto/exp41/test_odd_split.c (3+3, 1+5, 5+1, 2+4, single-group splits).","hypothesis":"The accepted win is two chains in flight; the per-core work is exactly three groups, so walking all three together should give the same benefit over a larger share of the transform and remove the mixed paired+single code path per call.","result":"decode 5.1100 (+0.098 % over the accepted 5.1050), reproduced EXACTLY in two independent batches (board 3 in 20260923T1630L and board 3 again in 20260923T1730L; the first lane died in the extended group with rc=1 before the device gate, so the second run is the one with full evidence: rc=0, DEVICE_GATE_OK, golden_missing=0, token_delta=0, host 19/19 pre-flash, fidelity 5.341e-05, top1 10/10). Every monitor up: extended 5.036 (+0.10 %), think 3.99, prefill 5.395, boot bench 5.157 (+0.12 %, the mechanism check), min_case 4.88, gen_tokens 99. Cost internal_free 13,367 (-256 B vs accepted).","finding":"Real, reproducible, and half the keep bar. The sign is not in question (three readings, all 5.1100, two boards, one metric tick = 0.034 % so +0.098 % is ~3 ticks); what is missing is magnitude. Recorded as the family's best remaining sub-bar option alongside sigmoidf_pair IRAM (+0.18 %), both waiting on the bar rather than on evidence.","next":"Last curve point of the family: ng=3 with the within-stage butterfly unrolled by 2 (six chains in flight, ~20 live FP registers against LX7's 32, so it is not obviously past the register-file ceiling that killed the rescale unroll-8 and the attention quad block). If it is null or negative the transform closes at ng=2/inner=2 and the only above-bar items left are owner decisions."}}
{"run":385,"commit":"2bdf2b8","metric":5.105,"metrics":{"boot_bench_tps":5.151,"device_output_exact":17,"device_token_delta":0,"ext_decode_tps":5.031,"gen_tokens":99,"host_output_exact":19,"internal_free":13623,"logit_max_delta":0.00005341,"logit_top1_match":10,"min_case_tps":4.87,"prefill_tps":5.39,"psram_free":2052252,"think_tps":3.99},"status":"keep","description":"Experiment 43, two callee-cost screens on two boards, no shipping change (decode_tps is the accepted 5.1050 carried forward; only kbench images ran, which never execute the request path): E37 (board 3) times the shipped KV store against the magic-add+trunc.s form with the field's call structure - 7.04 vs 4.08 cycles/element, +72.55 %, byte_mismatch=0 on device - which is worth only +0.011 % in isolation against the +0.196 % the same change measured end to end, so isolation UNDER-prices this lever ~18x (mirror of the campaign's warmth trap, caused by my own bench operands being integers and .5 ties, the inputs a software rounder shortcuts) and it also corrects a 20-year-old-style arithmetic error in the ledger: kv_store is 7 cycles/element, not the 147 implied by ND_P_KVST/1,792, so that phase timer brackets more than the store. E36 (board 2) prices one IRAM-to-flash callee crossing with both symbol addresses printed: flash 86 vs IRAM 93 cycles per call, identity floor 22, so the crossing penalty is ZERO and run #336's recorded 'the cost was the flash crossing' mechanism is refuted (the win is real, the explanation is not) - and the separate-I/D-cache fact also kills my own eviction theory for the E37 gap. Both boards' lanes verified macro-on-compile-line.","timestamp":1790169724446,"segment":1,"confidence":22.038063715349548,"asi":{"e36_crossing":"board 2, KB E36: two 9-FMA noinline chains, one linker-placed (0x42009218 = flash) and one IRAM_ATTR (0x4037a7f4), an IRAM identity function as the call floor (0x4037bb00, 22 cycles), 21 rounds min of 9 individual calls. steady: flash 86, iram 93, nop 22 -> CROSSING PENALTY = 0 cycles (the IRAM copy is 7 cycles SLOWER, i.e. scheduling/alignment noise), body = 64 cycles. The addresses were printed and differ, so ICF did not fold them - the guard that makes this readable at all.","e36_consequence":"Two load-bearing statements in this ledger are measured false by this number. (1) Run #336's recorded mechanism - 'for this phase the cost was the flash crossing (instruction fetch across the memory boundary), not the call-and-return itself' - cannot be a per-call crossing tax: warm, a flash callee costs nothing extra. #336's +0.18 % is real (three readings, zero board spread) but its explanation needs a replacement, most plausibly that sigmoidf_pair is a large callee and the field's 3,600 calls are not the warm-loop condition this bench creates. (2) My own candidate explanation for the E37 gap below (that the model's flash traffic evicts libc text between calls) is also dead on arrival: the S3 has separate 32 KB I-cache and 64 KB D-cache, and the archive is read as DATA, so weight traffic cannot evict instruction cache lines.","e37_kv_loop":"board 3, KB E37, field call structure (one call per 48-element row, result consumed before the next row, 15 rounds, 480 rows = 23,040 elements): shipped lrintf loop 162,264 cycles = 7.04 cycles/element; magic-add + trunc.s loop 94,034 = 4.08 cycles/element; gain +72.55 % with byte_mismatch = 0 on device, which independently confirms the host differential (.auto/rint/test_rint.c, 242,863 values, 0 mismatches) on the target.","the_gap_that_is_the_finding":"Read the columns together: the isolated saving is 2.96 cycles/element x ~1,792 elements = 5.3k cycles = 0.022 ms = +0.011 % of the token, while the SAME change measured +0.196 % end to end (5.1150 vs 5.1050, board 2, gate-clean). Isolation UNDER-prices this lever by ~18x - the mirror image of the warmth trap this campaign has documented three times, and it has a different cause: my bench's operands are integers and .5 ties (src[i] = (i%257)-128 + 0.5*k), which are exactly the inputs a software rounding routine can shortcut, so the reference loop is optimistic. Second, independent, and more useful correction: the ledger's '1.1 ms kv_store phase / 1,792 elements = 147 cycles per element' is wrong by 20x - the shipped loop costs 7.04 cycles per element when timed as a loop, so ND_P_KVST brackets more than the store (kbuf/vbuf staging, rope writes) and every phase-derived pricing built on 147 cyc/elem needs re-deriving.","hypothesis":"Price the last flash-libc-per-element loop (kv_store_int8's lrintf, ~1,792 calls/token) in isolation, and separately price one IRAM-to-flash callee crossing, since the whole remaining callee-placement family (logf in Sinkhorn is the last unpriced mass, ~1,280 calls/token) was sized from run #336's implied ~30 cycles per crossing.","next":"Named before any board is spent: (1) re-run E37 with field-realistic operands - mantissas with generic fractional parts, not integers and .5 ties - because if the reference loop rises while the magic loop does not, the isolated number stops contradicting the field and the family's size becomes knowable; (2) if the crossing is free and the operand realism does not close the gap, the +0.196 % stands on the FIELD measurement alone and the right conclusion is that per-element library calls are worth removing for reasons this campaign cannot isolate, so the logf candidate is judged by its own end-to-end run rather than by a bench; (3) the decision-critical measurement of the live candidate is its canonical confirmation on board 1, which is queued behind the capture.","screen_integrity":"Two of my own instrumentation bugs were caught before they could mislead: kb_run.sh's harvest filter was hardcoded to 'KB E37' so board 2's E36 lines were silently dropped (harvest_lines=1 looked like 'the bench did not run' - recovered for the price of a reset with .auto/exp37/reharvest.sh, no rebuild), and both lanes wrote the same /tmp build log, so one lane's error text was overwritten by the other mid-run. Both are parameterised now. And my 'first_call' cold-number came out identical to steady state because the function is already hot from the previous round - a cold-isolation probe that is not cold, the same family as #300's gcc-level prefetch null reading as a result rather than an unavailability."}}
