{"run":427,"commit":"97f8d43","metric":5.1167,"metrics":{"boot_bench_tps":5.162,"device_output_exact":20,"device_token_delta":0,"ext_decode_tps":5.0423,"gen_tokens":99,"host_output_exact":19,"internal_free":12855,"logit_max_delta":0.00005341,"logit_top1_match":10,"min_case_tps":4.88,"prefill_tps":5.4,"psram_free":2052252,"think_tps":3.99},"status":"keep","description":"taphoist MEASURED: resolving the qkv tap history rows once per call instead of recomputing (pos-j)%taps per output column gives decode 5.2717 on the accepted+expbc+head4 base (5.235) = +0.70 % on top of it, +3.03 % over the accepted 5.1167 - prefill 5.5517, extended 5.1992, think 4.18, boot_bench 5.31, min_case 5.03 (best worst case in 427 runs), gen_tokens 99, device_cases=20 with golden_missing=0 and token_delta=0. Bit-exact by proof before the board: .auto/exp57/test_tap_equiv.c, 87,836 comparisons over dims 96/128/576/768/33, taps 1-4, every startup position and 1-3 column blocks, mismatches=0. One caveat kept in front: that session printed device_output_exact=19/20 - heldout_long_tools_note_only differs at an identical token count, the same single case f16bc hit in #425, while every token count and the tool-call prefix match; a repeat on board 3 and then a cross-board reading are in flight/queued. Accepted runtime stays 5.1167 until a 20/20 gate.","timestamp":1790236317441,"segment":1,"confidence":19.34201012292117,"asi":{"golden_doubt":"heldout_long_tools_note_only now diverges for TWO unrelated candidates (f16bc #425, taphoist #427), each host-byte-exact and each bit-exact by its own proof, with device_token_delta=0 and identical token counts, while no base session has ever reached that group again since the wedge. Two independent candidates hitting the same single tail prose case is the order-dependent-golden class (#395), not a code defect - but the honest state is 'unexplained, second occurrence', and the candidate that wants the gate has to reach 20/20 anyway.","next_action_hint":"1) Cross-board reading for taphoist (b3 repeat live; put it on board 2 as soon as its gate lane ends). 2) If it agrees at ~5.27, integrate taphoist into main so the shipping candidate is accepted+expbc+head4+taphoist and push a 20-case session on a healthy board. 3) If taphoist wins, the follow-up in the same family is holding 2-4 neighbouring column sums across the ascending tap loop (mentor reserve 3) - the modulo hoist proves the tap loop has slack.","tap_result":"taphoist on the expbc+head4 base (tree 0190834e3488): decode 5.2717 vs base 5.235 = +0.70 % (and +3.03 % over the accepted 5.1167), prefill 5.5517, ext 5.1992, think 4.18 (accepted 3.99), boot_bench 5.31, min_case 5.03 - best worst case in 427 runs - gen_tokens 99, device_cases=20, golden_missing=0, token_delta=0. Above the bar by 3.5x the bar with the worst case also improving, which is the combination the campaign has never had on a single lever.","mechanism":"Removing ~55K per-token redundant remainder+address computations ((pos-j)%taps recomputed per output column) from a loop the campaign had assumed was memory-bound. It is not closed by tap16/condv16: those changed the operand's PRECISION, this changes the address arithmetic. The tap family was mis-closed by precision evidence."}}
{"run":428,"commit":"00d698b","metric":5.1167,"metrics":{"boot_bench_tps":5.162,"device_output_exact":20,"device_token_delta":0,"ext_decode_tps":5.0423,"gen_tokens":99,"host_output_exact":19,"internal_free":12855,"logit_max_delta":0.00005341,"logit_top1_match":10,"min_case_tps":4.88,"prefill_tps":5.4,"psram_free":2052252,"think_tps":3.99},"status":"keep","description":"taphoist CONFIRMED cross-board and integrated: board 2 primary 5.2717 (min_case 5.03) matches board 3's 5.2717 to the digit, b3 repeat 5.2733/5.04 - one quantum - so accepted+expbc+head4+taphoist reads ~5.272 on two independent boards = +3.03 % over the accepted 5.1167 with prefill 5.5517, extended 5.1992, think 4.18, boot_bench 5.31, gen_tokens 99, host 19/19 byte-exact, fidelity 5.341e-05 identical, top1 10/10, checks rc=0 on main (tree 0190834e3488 now committed). Gate finding, stated plainly: the 19/20 veto on heldout_long_tools_note_only is a changed tool ARGUMENT (golden seconds=300 vs answered seconds=120) hiding under an identical 19-token count, calls_ok=1 only because the case's expect is null - and it is not this session's work, because run #390 recorded this same case diverging on condT before expbc existed while the canonical accepted run #395 passed 20/20. So the case is session-order-sensitive, the strict gate is kept, nothing is reverted on shared ancestry, and no board is spent re-proving it. Accepted runtime stays 5.1167 pending a 20/20 session. Next three lanes per the mentor queue: b1 sigpair (mixed-sign gate pairs currently fall back to two scalar exp chains for no reason), b2 two-column tap tile, b3 current-input forwarding for tap j=0.","timestamp":1790237310854,"segment":1,"confidence":19.34201012292117,"asi":{"gate_finding":"The 19/20 veto is NOT this session's candidates. The frozen device golden for heldout_long_tools_note_only expects set_sampling_interval(seconds=300) and both new sessions answered seconds=120 - a changed argument hidden under an identical 19-token count, and calls_ok=1 because the case's expect is null, so the pass-through is a harness weakness worth naming. It is also not expbc: run #390 recorded THIS case diverging on condT, before expbc existed (condT-b2-full.log shows the same DIVERGE line and 19/20), while the canonical accepted run #395 passed 20/20. Conclusion: the case is session-order-sensitive in the tool-argument the model emits, the strict gate stays, and no extra run is spent on it - expbc stays in the tree, nothing is reverted on shared ancestry alone.","next_lanes":"b1 = sigpair (existing sigmoidf_pair throws away the interleaved exp pair whenever the two gate values have opposite signs, even though the pair only needs matching sign-normalized magnitudes and the divisions stay scalar); b2 = two-column tap tile (share the hoisted row pointers across 2 output columns, each column keeping its own accumulator and ascending-tap order); b3 = current-input forwarding (tap j=0 reads the row the call just memcpy'd into the history slot, so read the source projection instead of re-reading PSRAM - same value, same order). Tap repeats are retired: 5.2717/5.2717/5.2733 on two boards is the answer.","tap_confirmed":"taphoist cross-board: board 2 primary 5.2717 with min_case 5.03, matching board 3's first reading 5.2717 exactly, and the b3 repeat 5.2733 / min_case 5.04 (one quantum). So the stack accepted+expbc+head4+taphoist reads 5.2717/5.2733 on two independent boards = +3.03 %/+3.06 % over the accepted 5.1167, with prefill 5.5517, extended 5.1992, think 4.18, boot_bench 5.31, min_case 5.03 - every secondary better than the accepted run's own - and host 19/19 byte-exact + fidelity 5.341e-05 identical + top1 10/10 on the same tree (checks rc=0).","hypothesis":"Three independent mechanisms now compose: (1) expbc - stop paying a ROM memcpy call for a 4-bit-field bitcast under -fno-builtin-memcpy (+1.95 %); (2) head4 - route the full-vocabulary head through the already-guarded 4-bit assembly row walker instead of gemv_rows_generic (+0.35 %); (3) taphoist - resolve the tap history row pointers once per call instead of a remainder per output column (+0.70 %). Two of them (head4, taphoist) are pure address/call-structure wins in code the campaign had closed on precision evidence, which is the lesson to carry: 'this loop is memory-bound' was measured by changing the data, never by changing the addressing.","risk":"The accepted runtime stays 5.1167 because no session in this session's run reached 20/20 device exactness - the console wedge plus the order-sensitive case above. That gap is the owner's decision (see OWNER_ACCEPTANCE_PACKET.md), not a reason to soften the gate."}}
{"run":429,"commit":"ec657b5","metric":5.1167,"metrics":{"boot_bench_tps":5.162,"device_output_exact":20,"device_token_delta":0,"ext_decode_tps":5.0423,"gen_tokens":99,"host_output_exact":19,"internal_free":12855,"logit_max_delta":0.00005341,"logit_top1_match":10,"min_case_tps":4.88,"prefill_tps":5.4,"psram_free":2052252,"think_tps":3.99},"status":"keep","description":"DEVICE GATE PASSED 20/20 for the first time in the wedge era, and a bar-clearing bundle found. The wfr tree (accepted+expbc+head4+taphoist+wfr) completed a full session on board 1: device_output_exact=20/20 with golden_missing=0 and token_delta=0, decode 5.2750 (+3.09 % over the accepted 5.1167), prefill 5.5550, extended 5.2000, think 4.18, boot_bench 5.314, min_case 5.04, gen_tokens 99, internal_free 13,623 - and because those are the frozen goldens, the expbc byte-exactness argument is now settled by measurement rather than by reasoning: this tree contains expbc and is exact on all twenty cases, including the tool-argument case that tripped #390 and #425. Four levers measured on this base are individually sub-bar - sigpair +0.125 % (5.2783), tap2col +0.094 % (5.2767), tapfwd +0.062 % (5.2750), wfr +0.062 % (5.2750, ext 5.2000) - but as ONE change (bundle4, tree f452cd35d945) they read 5.2883 on board 3 = +0.315 % over the 5.2717 base, i.e. above the bar while no half is; measured sum of parts +0.343 % vs bundle +0.315 % says they compose with a small overlap. Cross-board primary and a 20/20 session for the bundle are live on board 1. Prepared and guarded for the next lane: eghoist, which turns the engram tap kernel's per-tap read-modify-write sweep into a register accumulation with one store, bit-exact over 44,196,192 host comparisons, running on board 2. Accepted runtime stays 5.1167 until the bundle reproduces on a second board and passes its own gate.","timestamp":1790239191097,"segment":1,"confidence":19.34201012292117,"asi":{"banked_subbar":"sigpair +0.125 % (5.2783, b1), tap2col +0.094 % (5.2767, b2), tapfwd +0.062 % (5.2750, b3), wfr +0.062 % (5.2750, b1 with ext 5.2000). None clears the 0.2 % bar alone, so none is repeated on its own; they are banked as components of the bundle (#371 precedent).","bundle_mechanisms":"wfr = exponent scale reaches the FP register by register transfer instead of the s32i/lsi round trip the 4-byte copy lowers to (222 -> 239 wfr in nd_model.c.obj, lsi 248 -> 235); sigpair = a mixed-sign gate pair keeps its interleaved exp pair (the sign only selects which shipped scalar division runs) instead of two scalar chains; tap2col/tapfwd = two tap columns per iteration and tap j=0 reads the current input instead of the history slot the caller just copied. Four independent mechanisms, measured additive sum +0.343 %, bundle +0.315 % - so they compose with a small overlap, which is itself the interesting number.","eghoist_next":"The engram tap kernel egtap_rows is tap-OUTER: it zeroes the output then sweeps it once PER TAP with a dependent load/store, which is the pattern the tap family warns about. .auto/exp64/apply_eghoist.py resolves the participating rows per call and accumulates in a register with one store, preserving ascending-tap order, the back>pos skips and the +0.0f seed; .auto/exp64/test_eg_equiv.c proves it over 44,196,192 comparisons (dims 96/576/768/33, taps 1-8, dilations 1-4, every position/site/block combination, mismatches=0). Live on board 2 (tree 0c993ca1a94c) against the 5.2717 base. taps<=10 always satisfies the row-pointer bound and an explicit shipped-loop fallback covers any geometry that does not.","gate_passed":"First 20/20 device session of the wedge era: the wfr tree (accepted+expbc+head4+taphoist+wfr) completed the full suite on board 1 with device_output_exact=20, device_cases_total=20, golden_missing=0, token_delta=0 and LANE_RC=0. That also settles the expbc bit-exactness question by measurement rather than argument: with the frozen goldens, including the tool-argument case that tripped #390 and #425, the tree is byte-exact on all twenty cases.","hypothesis":"Three sub-bar levers of independent mechanism compose to a bar-clearing bundle (+0.315 %), and the campaign's earlier 'combination lever is spent' conclusion (#371) was drawn on a base that did not yet contain the call-structure and address-structure levers - the space of combinable halves is larger than it looked.","next_action_hint":"1) bundle4 (wfr+sigpair+tap2col+tapfwd, tree f452cd35d945) needs the cross-board primary on board 1 and a 20/20 session; if both land it becomes the acceptance candidate at ~+3.4 % over the accepted 5.1167, and main should carry it with its own canonical secondaries. 2) eghoist reading on board 2. 3) Host checks for the wfr tree are still owed (the host uses the portable copy, so equality is inherited from the stack's rc=0, but say it with a run). 4) make capture remains owed on the shipping image.","wfr_tree_full_metrics":"decode 5.2750 (+3.09 % over the accepted 5.1167), prefill 5.5550, extended 5.2000, think 4.18, boot_bench 5.314, min_case 5.04, gen_tokens 99, internal_free 13,623, psram_free 2,052,252, device 20/20 byte-exact."}}
{"run":430,"commit":"2c91e2c","metric":5.1167,"metrics":{"boot_bench_tps":5.162,"device_output_exact":20,"device_token_delta":0,"ext_decode_tps":5.0423,"gen_tokens":99,"host_output_exact":19,"internal_free":12855,"logit_max_delta":0.00005341,"logit_top1_match":10,"min_case_tps":4.88,"prefill_tps":5.4,"psram_free":2052252,"think_tps":3.99},"status":"keep","description":"bundle4 CONFIRMED cross-board, eghoist REJECTED, bundle5 host-proven. Accepted runtime stays 5.1167 (this iteration's readings are candidates on the 5.2717 base; secondaries shown are the accepted run's carried forward). (1) bundle4 = wfr+sigpair+tap2col+tapfwd read 5.2883 on board 1, identical to board 3's 5.2883, so the +0.315 % bundle is reproduced on two independent boards from one tree md5 - it is now the strongest bar-clearing candidate and still needs a 20/20 device session of its own. (2) eghoist = the engram tap kernel's per-tap read-modify-write sweep converted to register accumulation with one store: MEASURED -0.16 % (5.2633 vs the 5.2717 base), REJECTED despite being bit-exact over 44,196,192 host comparisons, which extends the campaign's row/tap-blocking rule to the engram tap convolution. (3) bundle5 = bundle4 + condT (cond_v staged channel-major in place) prepared and host-proven: checks.sh rc=0, host 19/19 byte-exact, fidelity 5.341e-05 identical, top1 10/10. condT is not a discarded idea - it is a single +0.196 % reading that was never accepted for lack of a repeat - so bundling it is the changed premise, not a revival. My first transcription of its fill was wrong (I transposed the staged fp32 destination instead of converting the fp16 source during the transpose) and the host goldens caught all 19 cases diverging before any board was touched.","timestamp":1790239789186,"segment":1,"confidence":19.34201012292117,"asi":{"bundle4_cross_board":"5.2883 on board 1 - identical to board 3's reading to the digit, so the +0.315 % bundle is reproduced on two independent boards with the same tree md5 f452cd35d945. Components: wfr +0.062 %, sigpair +0.125 %, tap2col +0.094 %, tapfwd +0.062 %; sum +0.343 %, bundle +0.315 %.","eghoist":"engram tap kernel converted from tap-outer read-modify-write to per-column register accumulation with one store; bit-exact by proof over 44,196,192 host comparisons (dims 96/576/768/33, taps 1-8, dilations 1-4, every position/site/block, mismatches=0, including the fallback branch). Device: 5.2633 vs the 5.2717 base = -0.16 %. Rejected. Consistent with the whole tap/row-structure family: the tap-outer form's per-tap output sweep was already being absorbed (small tables, warm cache), so removing the redundant passes buys nothing while the tap-inner form lengthens the per-column dependency chain. The campaign's 'row/tap blocking is a loss' rule extends to the engram tap conv.","hypothesis":"The bundle precedent generalises: bundle5 = bundle4 + condT, and condT was never a null (it was one +0.196 % reading with no repeat), so bundling is the legitimate way to bank it.","invalidation_check":"Scanned every discard with a POSITIVE sub-bar delta (#335, #336, #342, #367, #372, #373, #384, #387) for whether the bundle finding revives it. None: #335/#336/#342 (sigmoidf_pair inline / ND_HOT) are already inside the accepted tree via #371; #384/#387 (fw3pair, fw3res) are subsumed by the shipped fw3foldnb; #367/#372 are 0.032 % nulls, and a null does not become a lever by bundling. So the only unshipped positive sub-bar candidate left is condT, and it is not a discard - it is an unaccepted measurement, which is why bundle5 includes it.","next_action_hint":"1) Launch bundle5 on the first free board; if it lands ~5.31 (bundle4 + condT additively) it is the acceptance candidate and main should carry it. 2) bundle4 still wants its own 20/20 device session - board 1's attempt is in its tail now. 3) Host checks for the wfr tree remain formally owed even though the device gate passed. 4) make capture remains owed on the shipping image.","retranscription_lesson":"My first bundle5 transcription of condT was WRONG and the host caught it: I wrote the transpose as p[(size_t)k * dm + i2] = p[i2*8+k], reading the DESTINATION pointer as if it were the source halfword array - the fill loop converts fp16 to fp32 as it stages, so the source is h (uint16_t *) and the destination is p (float *). All 19 host cases diverged, golden_missing stayed 0, and the failure was loud rather than silent. Correct form converts during the transpose: p[(k & 7u) * dm + (k >> 3)] = nd_f16(h[k]). Cost zero board time, and the reason the host check runs before any flash.","notes":"/tmp/ht6_checks.log, /tmp/ht6/.auto/runs/local/auto_cq.log","payload":{"bundle5_host_proof":"checks.sh rc=0, host 19/19 byte-exact, golden_missing=0, fidelity 5.341e-05 identical, top1 10/10","bundle5_md5":"nd_model.c 0d639424f636 (wfr header 57a0fa8af900), generator .auto/exp67/apply_bundle5.py","eghoist_verdict":"rejected, -0.16 %"}}}
