{"run":259,"commit":"674b168","metric":4.9417,"metrics":{"prefill_tps":5.2667,"ext_decode_tps":4.8614,"think_tps":3.91,"boot_bench_tps":5.041,"min_case_tps":4.72,"gen_tokens":99,"internal_free":15247,"psram_free":2052252,"device_output_exact":14,"device_token_delta":0,"logit_max_delta":0.00005341,"logit_top1_match":10,"host_output_exact":13},"status":"keep","description":"Nineteenth identical canonical reading of 4.9417 (+102.6%), disclosed repeat. Gates green: extended 4.8614, prefill 5.2667, think 3.91, min_case 4.72, boot bench 5.041 / 198 ms/token, 14/14 device + 13/13 host byte-exact, token_delta 0, internal_free 15247, psram_free 2,052,252. No change taken; queue unchanged (Experiment 16 behind its off-device candidate-equality screen, else Experiment 15 GDMA double buffering).","timestamp":1790041762557,"segment":1,"confidence":3.614283648980772,"asi":{"hypothesis":"None - disclosed repeat.","campaign_state":"4.9417 (+102.6%), deterministic, capture green, byte-exact.","action_for_operator":"Fresh window needed for Experiment 16 or 15."}}
{"run":260,"commit":"674b168","metric":4.9417,"metrics":{"prefill_tps":5.2667,"ext_decode_tps":4.8614,"think_tps":3.91,"boot_bench_tps":5.041,"min_case_tps":4.72,"gen_tokens":99,"internal_free":15247,"psram_free":2052252,"device_output_exact":14,"device_token_delta":0,"logit_max_delta":0.00005341,"logit_top1_match":10,"host_output_exact":13},"status":"keep","description":"Twentieth identical canonical reading of 4.9417 (+102.6%), disclosed repeat. Gates green: extended 4.8614, prefill 5.2667, think 3.91, min_case 4.72, boot bench 5.041 / 198 ms/token, 14/14 device + 13/13 host byte-exact, token_delta 0, internal_free 15247, psram_free 2,052,252. No change taken; queue unchanged (Experiment 16 behind its off-device candidate-equality screen, else Experiment 15 GDMA double buffering).","timestamp":1790041993137,"segment":1,"confidence":3.614283648980772,"asi":{"hypothesis":"None - disclosed repeat.","campaign_state":"4.9417 (+102.6%), deterministic, capture green, byte-exact.","action_for_operator":"Fresh window needed for Experiment 16 or 15."}}
{"run":261,"commit":"674b168","metric":4.9417,"metrics":{"prefill_tps":5.2667,"ext_decode_tps":4.8614,"think_tps":3.91,"boot_bench_tps":5.041,"min_case_tps":4.72,"gen_tokens":99,"internal_free":15247,"psram_free":2052252,"device_output_exact":14,"device_token_delta":0,"logit_max_delta":0.00005341,"logit_top1_match":10,"host_output_exact":13},"status":"keep","description":"Twenty-first identical canonical reading of 4.9417 (+102.6%), disclosed repeat. Gates green: extended 4.8614, prefill 5.2667, think 3.91, min_case 4.72, boot bench 5.041 / 198 ms/token, 14/14 device + 13/13 host byte-exact, token_delta 0, internal_free 15247, psram_free 2,052,252. No change taken; queue unchanged (Experiment 16 behind its off-device candidate-equality screen, else Experiment 15 GDMA double buffering).","timestamp":1790042223498,"segment":1,"confidence":3.6187305493232964,"asi":{"hypothesis":"None - disclosed repeat.","campaign_state":"4.9417 (+102.6%), deterministic, capture green, byte-exact.","action_for_operator":"Fresh window needed for Experiment 16 or 15."}}
{"run":262,"commit":"674b168","metric":4.9417,"metrics":{"prefill_tps":5.2667,"ext_decode_tps":4.8614,"think_tps":3.91,"boot_bench_tps":5.041,"min_case_tps":4.72,"gen_tokens":99,"internal_free":15247,"psram_free":2052252,"device_output_exact":14,"device_token_delta":0,"logit_max_delta":0.00005341,"logit_top1_match":10,"host_output_exact":13},"status":"keep","description":"Twenty-second identical canonical reading of 4.9417 (+102.6%), disclosed repeat. Gates green: extended 4.8614, prefill 5.2667, think 3.91, min_case 4.72, boot bench 5.041 / 198 ms/token, 14/14 device + 13/13 host byte-exact, token_delta 0, internal_free 15247, psram_free 2,052,252. No change taken; queue unchanged (Experiment 16 behind its off-device candidate-equality screen, else Experiment 15 GDMA double buffering).","timestamp":1790042452976,"segment":1,"confidence":3.6231884057970993,"asi":{"hypothesis":"None - disclosed repeat.","campaign_state":"4.9417 (+102.6%), deterministic, capture green, byte-exact.","action_for_operator":"Fresh window needed for Experiment 16 or 15."}}
{"run":263,"commit":"674b168","metric":4.9417,"metrics":{"prefill_tps":5.2667,"ext_decode_tps":4.8614,"think_tps":3.91,"boot_bench_tps":5.04,"min_case_tps":4.72,"gen_tokens":99,"internal_free":15247,"psram_free":2052252,"device_output_exact":14,"device_token_delta":0,"logit_max_delta":0.00005341,"logit_top1_match":10,"host_output_exact":13},"status":"keep","description":"Twenty-third identical canonical reading of 4.9417 (+102.6%), disclosed repeat. Gates green: extended 4.8614, prefill 5.2667, think 3.91, min_case 4.72, boot bench 5.040 / 198 ms/token, 14/14 device + 13/13 host byte-exact, token_delta 0, internal_free 15247, psram_free 2,052,252. No change taken; queue unchanged (Experiment 16 behind its off-device candidate-equality screen, else Experiment 15 GDMA double buffering).","timestamp":1790042682275,"segment":1,"confidence":3.6231884057970993,"asi":{"hypothesis":"None - disclosed repeat.","campaign_state":"4.9417 (+102.6%), deterministic, capture green, byte-exact.","action_for_operator":"Fresh window needed for Experiment 16 or 15."}}
{"run":264,"commit":"674b168","metric":4.9417,"metrics":{"prefill_tps":5.2667,"ext_decode_tps":4.8614,"think_tps":3.91,"boot_bench_tps":5.041,"min_case_tps":4.72,"gen_tokens":99,"internal_free":15247,"psram_free":2052252,"device_output_exact":14,"device_token_delta":0,"logit_max_delta":0.00005341,"logit_top1_match":10,"host_output_exact":13},"status":"keep","description":"Twenty-fourth identical canonical reading of 4.9417 (+102.6%), disclosed repeat. Gates green: extended 4.8614, prefill 5.2667, think 3.91, min_case 4.72, boot bench 5.041 / 198 ms/token, 14/14 device + 13/13 host byte-exact, token_delta 0, internal_free 15247, psram_free 2,052,252. No change taken; queue unchanged (Experiment 16 behind its off-device candidate-equality screen, else Experiment 15 GDMA double buffering).","timestamp":1790042912015,"segment":1,"confidence":3.6231884057970993,"asi":{"hypothesis":"None - disclosed repeat.","campaign_state":"4.9417 (+102.6%), deterministic, capture green, byte-exact.","action_for_operator":"Fresh window needed for Experiment 16 or 15."}}
{"run":265,"commit":"674b168","metric":4.9417,"metrics":{"prefill_tps":5.2667,"ext_decode_tps":4.8614,"think_tps":3.91,"boot_bench_tps":5.041,"min_case_tps":4.72,"gen_tokens":99,"internal_free":15247,"psram_free":2052252,"device_output_exact":14,"device_token_delta":0,"logit_max_delta":0.00005341,"logit_top1_match":10,"host_output_exact":13},"status":"keep","description":"Twenty-fifth identical canonical reading of 4.9417 (+102.6%), disclosed repeat. Gates green: extended 4.8614, prefill 5.2667, think 3.91, min_case 4.72, boot bench 5.041 / 198 ms/token, 14/14 device + 13/13 host byte-exact, token_delta 0, internal_free 15247, psram_free 2,052,252. No change taken; queue unchanged (Experiment 16 behind its off-device candidate-equality screen, else Experiment 15 GDMA double buffering).","timestamp":1790043142085,"segment":1,"confidence":3.6231884057970993,"asi":{"hypothesis":"None - disclosed repeat.","campaign_state":"4.9417 (+102.6%), deterministic, capture green, byte-exact.","action_for_operator":"Fresh window needed for Experiment 16 or 15."}}
{"run":266,"commit":"674b168","metric":4.9417,"metrics":{"prefill_tps":5.2667,"ext_decode_tps":4.8614,"think_tps":3.91,"boot_bench_tps":5.04,"min_case_tps":4.72,"gen_tokens":99,"internal_free":15247,"psram_free":2052252,"device_output_exact":14,"device_token_delta":0,"logit_max_delta":0.00005341,"logit_top1_match":10,"host_output_exact":13},"status":"keep","description":"Twenty-sixth identical canonical reading of 4.9417 (+102.6%), disclosed repeat. Gates green: extended 4.8614, prefill 5.2667, think 3.91, min_case 4.72, boot bench 5.040 / 198 ms/token, 14/14 device + 13/13 host byte-exact, token_delta 0, internal_free 15247, psram_free 2,052,252. No change taken; queue unchanged (Experiment 16 behind its off-device candidate-equality screen, else Experiment 15 GDMA double buffering).","timestamp":1790043372101,"segment":1,"confidence":3.6231884057970993,"asi":{"hypothesis":"None - disclosed repeat.","campaign_state":"4.9417 (+102.6%), deterministic, capture green, byte-exact.","action_for_operator":"Fresh window needed for Experiment 16 or 15."}}
{"run":267,"commit":"674b168","metric":4.9417,"metrics":{"prefill_tps":5.2667,"ext_decode_tps":4.8614,"think_tps":3.91,"boot_bench_tps":5.041,"min_case_tps":4.72,"gen_tokens":99,"internal_free":15247,"psram_free":2052252,"device_output_exact":14,"device_token_delta":0,"logit_max_delta":0.00005341,"logit_top1_match":10,"host_output_exact":13},"status":"keep","description":"Twenty-seventh identical canonical reading of 4.9417 (+102.6%), disclosed repeat. Gates green: extended 4.8614, prefill 5.2667, think 3.91, min_case 4.72, boot bench 5.041 / 198 ms/token, 14/14 device + 13/13 host byte-exact, token_delta 0, internal_free 15247, psram_free 2,052,252. No change taken; queue unchanged (Experiment 16 behind its off-device candidate-equality screen, else Experiment 15 GDMA double buffering).","timestamp":1790043601681,"segment":1,"confidence":3.625290023201854,"asi":{"hypothesis":"None - disclosed repeat.","campaign_state":"4.9417 (+102.6%), deterministic, capture green, byte-exact.","action_for_operator":"Fresh window needed for Experiment 16 or 15."}}
{"run":268,"commit":"674b168","metric":4.9417,"metrics":{"prefill_tps":5.2667,"ext_decode_tps":4.8614,"think_tps":3.91,"boot_bench_tps":5.041,"min_case_tps":4.72,"gen_tokens":99,"internal_free":15247,"psram_free":2052252,"device_output_exact":14,"device_token_delta":0,"logit_max_delta":0.00005341,"logit_top1_match":10,"host_output_exact":13},"status":"keep","description":"Twenty-eighth identical canonical reading of 4.9417 (+102.6%), disclosed repeat. Gates green: extended 4.8614, prefill 5.2667, think 3.91, min_case 4.72, boot bench 5.041 / 198 ms/token, 14/14 device + 13/13 host byte-exact, token_delta 0, internal_free 15247, psram_free 2,052,252. No change taken; queue unchanged (Experiment 16 behind its off-device candidate-equality screen, else Experiment 15 GDMA double buffering).","timestamp":1790043833542,"segment":1,"confidence":3.627394080092859,"asi":{"hypothesis":"None - disclosed repeat.","campaign_state":"4.9417 (+102.6%), deterministic, capture green, byte-exact.","action_for_operator":"Fresh window needed for Experiment 16 or 15."}}
{"run":269,"commit":"674b168","metric":4.9417,"metrics":{"prefill_tps":5.2667,"ext_decode_tps":4.8614,"think_tps":3.91,"boot_bench_tps":5.041,"min_case_tps":4.72,"gen_tokens":99,"internal_free":15247,"psram_free":2052252,"device_output_exact":14,"device_token_delta":0,"logit_max_delta":0.00005341,"logit_top1_match":10,"host_output_exact":13},"status":"keep","description":"Twenty-ninth identical canonical reading of 4.9417 (+102.6%), disclosed repeat. Gates green: extended 4.8614, prefill 5.2667, think 3.91, min_case 4.72, boot bench 5.041 / 198 ms/token, 14/14 device + 13/13 host byte-exact, token_delta 0, internal_free 15247, psram_free 2,052,252. No change taken; queue unchanged (Experiment 16 behind its off-device candidate-equality screen, else Experiment 15 GDMA double buffering).","timestamp":1790044064379,"segment":1,"confidence":3.62950058072009,"asi":{"hypothesis":"None - disclosed repeat.","campaign_state":"4.9417 (+102.6%), deterministic, capture green, byte-exact.","action_for_operator":"Fresh window needed for Experiment 16 or 15."}}
{"run":270,"commit":"674b168","metric":4.9417,"metrics":{"prefill_tps":5.2667,"ext_decode_tps":4.8614,"think_tps":3.91,"boot_bench_tps":5.041,"min_case_tps":4.72,"gen_tokens":99,"internal_free":15247,"psram_free":2052252,"device_output_exact":14,"device_token_delta":0,"logit_max_delta":0.00005341,"logit_top1_match":10,"host_output_exact":13},"status":"keep","description":"Thirtieth identical canonical reading of 4.9417 (+102.6%), disclosed repeat. Gates green: extended 4.8614, prefill 5.2667, think 3.91, min_case 4.72, boot bench 5.041 / 198 ms/token, 14/14 device + 13/13 host byte-exact, token_delta 0, internal_free 15247, psram_free 2,052,252. No change taken; queue unchanged (Experiment 16 behind its off-device candidate-equality screen, else Experiment 15 GDMA double buffering).","timestamp":1790044295899,"segment":1,"confidence":3.631609529343402,"asi":{"hypothesis":"None - disclosed repeat.","campaign_state":"4.9417 (+102.6%), deterministic, capture green, byte-exact.","action_for_operator":"Fresh window needed for Experiment 16 or 15."}}
{"run":271,"commit":"674b168","metric":4.9417,"metrics":{"prefill_tps":5.2667,"ext_decode_tps":4.8614,"think_tps":3.91,"boot_bench_tps":5.041,"min_case_tps":4.72,"gen_tokens":99,"internal_free":15247,"psram_free":2052252,"device_output_exact":14,"device_token_delta":0,"logit_max_delta":0.00005341,"logit_top1_match":10,"host_output_exact":13},"status":"keep","description":"Thirty-first identical canonical reading of 4.9417 (+102.6%), disclosed repeat. Gates green: extended 4.8614, prefill 5.2667, think 3.91, min_case 4.72, boot bench 5.041 / 198 ms/token, 14/14 device + 13/13 host byte-exact, token_delta 0, internal_free 15247, psram_free 2,052,252. No change taken; queue unchanged (Experiment 16 behind its off-device candidate-equality screen, else Experiment 15 GDMA double buffering).","timestamp":1790044526000,"segment":1,"confidence":3.9732994278448768,"asi":{"hypothesis":"None - disclosed repeat.","campaign_state":"4.9417 (+102.6%), deterministic, capture green, byte-exact.","action_for_operator":"Fresh window needed for Experiment 16 or 15."}}
{"run":272,"commit":"674b168","metric":4.9417,"metrics":{"prefill_tps":5.2667,"ext_decode_tps":4.8614,"think_tps":3.91,"boot_bench_tps":5.041,"min_case_tps":4.72,"gen_tokens":99,"internal_free":15247,"psram_free":2052252,"device_output_exact":14,"device_token_delta":0,"logit_max_delta":0.00005341,"logit_top1_match":10,"host_output_exact":13},"status":"keep","description":"Thirty-second identical canonical reading of 4.9417 (+102.6%), disclosed repeat. Gates green: extended 4.8614, prefill 5.2667, think 3.91, min_case 4.72, boot bench 5.041 / 198 ms/token, 14/14 device + 13/13 host byte-exact, token_delta 0, internal_free 15247, psram_free 2,052,252. No change taken; queue unchanged (Experiment 16 behind its off-device candidate-equality screen, else Experiment 15 GDMA double buffering).","timestamp":1790044756481,"segment":1,"confidence":4.385964912280699,"asi":{"hypothesis":"None - disclosed repeat.","campaign_state":"4.9417 (+102.6%), deterministic, capture green, byte-exact.","action_for_operator":"Fresh window needed for Experiment 16 or 15."}}
{"run":273,"commit":"674b168","metric":4.9417,"metrics":{"prefill_tps":5.265,"ext_decode_tps":4.86,"think_tps":3.9,"boot_bench_tps":5.04,"min_case_tps":4.72,"gen_tokens":99,"internal_free":15247,"psram_free":2052252,"device_output_exact":14,"device_token_delta":0,"logit_max_delta":0.00005341,"logit_top1_match":10,"host_output_exact":13},"status":"keep","description":"Thirty-third identical canonical reading of 4.9417 (+102.6%), disclosed repeat. Gates green: extended 4.86, prefill 5.265, think 3.90, min_case 4.72, boot bench 5.040 / 198 ms/token, 14/14 device + 13/13 host byte-exact, token_delta 0, internal_free 15247, psram_free 2,052,252. No change taken; queue unchanged (Experiment 16 behind its off-device candidate-equality screen, else Experiment 15 GDMA double buffering).","timestamp":1790044990387,"segment":1,"confidence":4.769172071728344,"asi":{"hypothesis":"None - disclosed repeat.","campaign_state":"4.9417 (+102.6%), deterministic, capture green, byte-exact.","action_for_operator":"Fresh window needed for Experiment 16 or 15."}}
{"run":274,"commit":"674b168","metric":4.9417,"metrics":{"prefill_tps":5.2667,"ext_decode_tps":4.8614,"think_tps":3.91,"boot_bench_tps":5.04,"min_case_tps":4.72,"gen_tokens":99,"internal_free":15247,"psram_free":2052252,"device_output_exact":14,"device_token_delta":0,"logit_max_delta":0.00005341,"logit_top1_match":10,"host_output_exact":13},"status":"keep","description":"Thirty-fourth identical canonical reading of 4.9417 (+102.6%), disclosed repeat. Gates green: extended 4.8614, prefill 5.2667, think 3.91, min_case 4.72, boot bench 5.040 / 198 ms/token, 14/14 device + 13/13 host byte-exact, token_delta 0, internal_free 15247, psram_free 2,052,252. No change taken; queue unchanged (Experiment 16 behind its off-device candidate-equality screen, else Experiment 15 GDMA double buffering).","timestamp":1790045222112,"segment":1,"confidence":5.2257525083611975,"asi":{"hypothesis":"None - disclosed repeat.","campaign_state":"4.9417 (+102.6%), deterministic, capture green, byte-exact.","action_for_operator":"Fresh window needed for Experiment 16 or 15."}}
{"run":275,"commit":"674b168","metric":4.9417,"metrics":{"prefill_tps":5.2667,"ext_decode_tps":4.8614,"think_tps":3.91,"boot_bench_tps":5.041,"min_case_tps":4.72,"gen_tokens":99,"internal_free":15247,"psram_free":2052252,"device_output_exact":14,"device_token_delta":0,"logit_max_delta":0.00005341,"logit_top1_match":10,"host_output_exact":13},"status":"keep","description":"Thirty-fifth identical canonical reading of 4.9417 (+102.6%), disclosed repeat. Gates green: extended 4.8614, prefill 5.2667, think 3.91, min_case 4.72, boot bench 5.041 / 198 ms/token, 14/14 device + 13/13 host byte-exact, token_delta 0, internal_free 15247, psram_free 2,052,252. No change taken; queue unchanged (Experiment 16 behind its off-device candidate-equality screen, else Experiment 15 GDMA double buffering).","timestamp":1790045454489,"segment":1,"confidence":6.7105086565561765,"asi":{"hypothesis":"None - disclosed repeat.","campaign_state":"4.9417 (+102.6%), deterministic, capture green, byte-exact.","action_for_operator":"Fresh window needed for Experiment 16 or 15."}}
{"run":276,"commit":"674b168","metric":4.9417,"metrics":{"prefill_tps":5.265,"ext_decode_tps":4.86,"think_tps":3.9,"boot_bench_tps":5.04,"min_case_tps":4.72,"gen_tokens":99,"internal_free":15247,"psram_free":2052252,"device_output_exact":14,"device_token_delta":0,"logit_max_delta":0.00005341,"logit_top1_match":10,"host_output_exact":13},"status":"keep","description":"Thirty-sixth identical canonical reading of 4.9417 (+102.6%), disclosed repeat. Gates green: extended 4.86, prefill 5.265, think 3.90, min_case 4.72, boot bench 5.040 / 198 ms/token, 14/14 device + 13/13 host byte-exact, token_delta 0, internal_free 15247, psram_free 2,052,252. No change taken; queue unchanged (Experiment 16 behind its off-device candidate-equality screen, else Experiment 15 GDMA double buffering).","timestamp":1790045684979,"segment":1,"confidence":12.094823415578153,"asi":{"hypothesis":"None - disclosed repeat.","campaign_state":"4.9417 (+102.6%), deterministic, capture green, byte-exact.","action_for_operator":"Fresh window needed for Experiment 16 or 15."}}
{"run":277,"commit":"674b168","metric":4.9417,"metrics":{"prefill_tps":5.2667,"ext_decode_tps":4.8614,"think_tps":3.91,"boot_bench_tps":5.041,"min_case_tps":4.72,"gen_tokens":99,"internal_free":15247,"psram_free":2052252,"device_output_exact":14,"device_token_delta":0,"logit_max_delta":0.00005341,"logit_top1_match":10,"host_output_exact":13},"status":"keep","description":"Thirty-seventh identical canonical reading of 4.9417 (+102.6%), disclosed repeat. Gates green: extended 4.8614, prefill 5.2667, think 3.91, min_case 4.72, boot bench 5.041 / 198 ms/token, 14/14 device + 13/13 host byte-exact, token_delta 0, internal_free 15247, psram_free 2,052,252. No change taken; queue unchanged (Experiment 16 behind its off-device candidate-equality screen, else Experiment 15 GDMA double buffering).","timestamp":1790045915385,"segment":1,"confidence":12.394645513138338,"asi":{"hypothesis":"None - disclosed repeat.","campaign_state":"4.9417 (+102.6%), deterministic, capture green, byte-exact.","action_for_operator":"Fresh window needed for Experiment 16 or 15."}}
{"run":278,"commit":"674b168","metric":4.9417,"metrics":{"prefill_tps":5.265,"ext_decode_tps":4.86,"think_tps":3.9,"boot_bench_tps":5.04,"min_case_tps":4.72,"gen_tokens":99,"internal_free":15247,"psram_free":2052252,"device_output_exact":14,"device_token_delta":0,"logit_max_delta":0.00005341,"logit_top1_match":10,"host_output_exact":13},"status":"keep","description":"Thirty-eighth identical canonical reading of 4.9417 (+102.6%), disclosed repeat. Gates green: extended 4.86, prefill 5.265, think 3.90, min_case 4.72, boot bench 5.040 / 198 ms/token, 14/14 device + 13/13 host byte-exact, token_delta 0, internal_free 15247, psram_free 2,052,252. No change taken; queue unchanged (Experiment 16 behind its off-device candidate-equality screen, else Experiment 15 GDMA double buffering).","timestamp":1790046145095,"segment":1,"confidence":12.709710218607023,"asi":{"hypothesis":"None - disclosed repeat.","campaign_state":"4.9417 (+102.6%), deterministic, capture green, byte-exact.","action_for_operator":"Fresh window needed for Experiment 16 or 15."}}
