{"run":453,"commit":"0a7273c","metric":5.3033,"metrics":{"boot_bench_tps":5.343,"device_output_exact":20,"device_token_delta":0,"ext_decode_tps":5.2269,"gen_tokens":99,"host_output_exact":19,"internal_free":13367,"logit_max_delta":0.00005341,"logit_top1_match":10,"min_case_tps":5.07,"prefill_tps":5.59,"psram_free":2052252,"think_tps":4.2},"status":"keep","description":"SPIN-ASSISTED HANDSHAKE MEASURED +1.31 % (board 2): decode 5.560 vs the 5.4883 base established by three identical readings, prefill 5.8667, boot_bench 5.601, min_case 5.30 (best on record), gen_tokens 99, device_output_exact=6/6 with golden_missing=0 and token_delta 0, internal_free 12,095 (-8 B). Mechanism: the ~16.6 us nd_parallel_rows toll of run #451 was mostly FreeRTOS wake machinery, so the common path no longer wakes the peer - the worker polls a published sequence number before blocking, the caller polls a completion number before taking s_done, with the semaphore retained for the sleeping case, stale tokens drained on both sides, and a sequence guard so a spurious wake cannot re-run a single-slot descriptor whose stack ctx is gone. Composed stack accepted+asmemo+radix-4 fusion+nf16v+spin = +4.84 % over the accepted 5.3033. Cross-board reading launched on board 3 (its tree differs only by the exactly-null hoist revert, disclosed). Accepted runtime unchanged at 5.3033 pending cross-board plus the 20-case gate.","timestamp":1790257768202,"segment":1,"confidence":18.86976590834157,"asi":{"caveat":"device_output_exact=6/6 is a real byte-exact comparison but only of the primary group (AUTO_GROUPS=primary reaches bench.py's compare); the unchanged 20-case session is still the shipping gate and is still blocked by the engine-independent console-wedge defect. internal_free -8 B. A race in this handshake would show as device divergence, and none appeared, but the cross-board reading plus a full session are what would license acceptance.","cross_board":"launched on board 3 with main's tree after the hoist revert, so its tree differs from board 2's ONLY by the three-instruction hoist that measured exactly null - disclosed rather than hidden by an md5 comparison (b2 673795c43d37, b3 b1daae10df90), both runner-asserted.","mechanism":"rows_dual_core still publishes fn/ctx/r0/r1 then a sequence number (compiler barrier between), but the peer no longer has to be woken for it: worker_task polls s_seq for a bounded budget (20,000 empty iterations) before it ever blocks on s_go, and the caller polls s_done_seq for 600 iterations after its own half before it takes s_done. The semaphore is retained for the genuinely sleeping case; the worker still gives s_done after every job so the blocking path stays correct; the caller drains any stale token (xSemaphoreTake(s_done,0)) before publishing so a binary semaphore can never be pre-accounted; and after a spin-path job the worker drains s_go, because the caller always posts it and a leftover token would make the next blocking Take return immediately - the sequence guard then stops that spurious wake from re-running a single-slot descriptor whose ctx is a returned caller's stack (that would have been a write through a dead pointer).","measurement":"SPIN-ASSISTED HANDSHAKE, board 2, on bundle78+nf16v: decode 5.560 vs the 5.4883 that three earlier readings established for that base = +1.31 %. prefill 5.8667 (base 5.795, +1.24 %), boot_bench 5.601 (5.531, +1.27 %), min_case 5.30 (best worst case on record, base 5.23), gen_tokens 99, device_output_exact=6/6 with golden_missing=0 and token_delta 0, internal_free 12,095 (base 12,103, so -8 B), psram unchanged. Against the accepted 5.3033 the composed stack (asmemo + radix-4 fusion + nf16v + spin) is +4.84 %.","meaning":"the 4,000-cycle toll of run #451 was mostly FreeRTOS wake-up machinery, not cross-core data movement, because removing the wake from the common path bought exactly the shape the toll arithmetic predicted. This is the campaign's largest single lever since asmemo (+2.2 %) and it is a scheduling lever, in the family the ledger closed twice on the strength of #344's void 23-cycle measurement.","next":"Three things, in order. (1) Cross-board plus a 20-case session (the wedge permitting); acceptance would move the pin from 5.3033 to ~5.56. (2) Re-tune the two spin budgets (20,000 worker / 600 caller iterations are first guesses) - the worker budget controls how long core 1 burns idle after the last split of a token, the caller budget controls how often the semaphore is still used; both are measurable by decode alone. (3) Re-check the de-split candidates (.auto/exp82/nd_model.c.desplit1 is prepared, zcsplit's n>=512 -> n>=1536) because they were priced against the OLD toll: with a cheaper handshake, splitting small jobs may pay again, and .auto/ideas.md's 'fewer, larger splits' rule needs re-deriving against the new number rather than assumed.","spin_budget_note":"the numbers 20,000 / 600 are first guesses, not tuned; a longer worker spin covers more of the token and a shorter one falls back to the semaphore more often, so there is likely more to take here, at the cost of a little idle power on core 1 (which runs nothing else)."}}
{"run":454,"commit":"29f4915","metric":5.3033,"metrics":{"boot_bench_tps":5.343,"device_output_exact":20,"device_token_delta":0,"ext_decode_tps":5.2269,"gen_tokens":99,"host_output_exact":19,"internal_free":13367,"logit_max_delta":0.00005341,"logit_top1_match":10,"min_case_tps":5.07,"prefill_tps":5.59,"psram_free":2052252,"think_tps":4.2},"status":"keep","description":"Two acceptance/extension lanes running; no measurement completed this window, so the accepted runtime stays 5.3033 and no candidate is claimed. (1) Board 3 is confirming the spin-assisted handshake cross-board against board 2's 5.560 (runner-asserted engine_md5=b1daae10df90; log shows flash done, attach done, cases not yet emitted - reading next window, nothing inferred from the absence). (2) Board 2 tests the one-line follow-up the mechanism implies: the spin budgets were first guesses (worker 20,000 polls, caller 600), so raising them to 120,000/3,000 asks whether the worker is currently giving up its spin window between tokens and repaying the very wake the handshake avoids; the price is idle polling on core 1, which runs nothing else (engine_md5=b642fbcb3a04). Base for that comparison is 5.560 on the same board.","timestamp":1790257879430,"segment":1,"confidence":18.46193548387094,"asi":{"disclosure":"board 2's tree is its own previous spin tree (git head 7701635 + the nf16v files + this main.c), which still carries the three-instruction hoist that measured EXACTLY null, so its budget-tuning number is comparable to 5.560 but not md5-equal to board 3's spin tree (b642fbcb3a04 vs b1daae10df90). Stated rather than hidden, per run #421's base-integrity class.","hypothesis":"Spin-budget tuning on top of the +1.31 % handshake (board 2, expect b642fbcb3a04, log M-spin2-b2.log): the two budgets added in #453 were first guesses (worker 20,000 empty polls before blocking, caller 600 before taking s_done). A worker that stops spinning between the last split of one token and the first of the next repays the wake the spin exists to avoid, so raising it to 120,000 with the caller at 3,000 should convert some remaining semaphore round trips into polls; the cost is idle power on core 1, which runs nothing else.","in_flight":["board 3: spin cross-board confirmation (expect b1daae10df90) - reading 5.560 or not, and its own primary byte-exact compare. It is past flash and attaching; result next window.","board 2: spin-budget variant, worker 120,000 / caller 3,000 (expect b642fbcb3a04, log M-spin2-b2.log). Base is 5.560 measured on this same board with 20,000/600."],"next":"Read both. If the cross-board agrees at ~5.56, integrate asmemo+fusion (.auto/exp78/apply_bundle.py) plus nf16v plus spin into main, re-pin the accepted base in gen_lane.sh/lane_one.sh, run make capture, and attempt the 20-case gate (the console wedge caps a boot at 16-17 requests, so acceptance may still need the owner). If the budget variant wins, keep tuning that axis before integration since it is one-line; if null, close the budget axis at 20,000/600. Only after the toll is cheaper should the de-split candidates (.auto/exp82/nd_model.c.desplit1, zcsplit emit) be priced - their premise was the OLD toll.","no_fabrication":"board 3's log had 4,904 bytes and no METRIC line when read - priming was still running - so no number is claimed for it this iteration."}}
{"run":455,"commit":"cc207de","metric":5.3033,"metrics":{"boot_bench_tps":5.343,"device_output_exact":20,"device_token_delta":0,"ext_decode_tps":5.2269,"gen_tokens":99,"host_output_exact":19,"internal_free":13367,"logit_max_delta":0.00005341,"logit_top1_match":10,"min_case_tps":5.07,"prefill_tps":5.59,"psram_free":2052252,"think_tps":4.2},"status":"keep","description":"Spin handshake confirmed cross-board and the anti-repeat guard found disarmed. (1) Board 3 read primary decode 5.5617 on the spin tree (engine_md5=b1daae10df90) against board 2's 5.560 - one quantum apart, with device_output_exact=6/6, golden_missing=0, token_delta 0, min_case 5.30 and internal_free 12,095 identical on both boards - so the +1.31 % over the 5.4883 base is board-independent and the composed stack (asmemo + radix-4 fusion + nf16v + spin) sits at +4.85 % over the accepted 5.3033. (2) The full-suite gate attempt that followed exposed a self-inflicted hole: .auto/diag_repeat_ok was still present from a much older candidate, so measure.sh's anti-repeat guard printed EXPLICIT_REPEAT_ALLOWED with that older candidate's reason - correct for this run (same image, new purpose: 20 cases instead of 6) but the marker was silently disarming the guard for every image, including stale ones. Deleted, contents archived to .auto/exp84_stale_repeat_marker.txt, so future repeats must earn their own explicit reason. Accepted runtime unchanged at 5.3033; a 20-case session is required before any re-pin.","timestamp":1790257981188,"segment":1,"confidence":18.46193548387094,"asi":{"finding_anti_repeat_guard_disarmed":"The gate attempt printed EXPLICIT_REPEAT_ALLOWED with a reason string describing a DIFFERENT, much older candidate, because .auto/diag_repeat_ok was still sitting in main from that era. The signature match itself was correct (this gate run is the same image as board 3's primary-only spin run, so the guard recognised it and the marker let it proceed for a different purpose - full suite instead of six cases). But while the marker exists, the anti-repeat guard is disarmed for EVERY image, including genuinely stale ones, which is this campaign's recurring failure shape (a check that reports success while verifying nothing). Fixed: marker deleted, contents archived to .auto/exp84_stale_repeat_marker.txt, so a future stale image now has to earn its own explicit reason. Fifth instance of that family, and the first one that suppressed a guard the campaign added to stop itself.","hypothesis":"Spin handshake cross-board: board 2 read 5.560 on the same mechanism; if board 3 agrees, the +1.31 % is board-independent and the composed stack (asmemo + radix-4 fusion + nf16v + spin) is the acceptance candidate.","measurement":"spin handshake CROSS-BOARD CONFIRMED: board 3 primary decode 5.5617 (runner-asserted engine_md5=b1daae10df90) against board 2's 5.560 - one metric quantum apart, 0.03 % - with device_output_exact=6/6 (primary group), golden_missing=0, token_delta 0, min_case 5.30 and internal_free 12,095, the last two identical on both boards. Composed stack = +4.85 % over the accepted 5.3033.","next_action_hint":"Acceptance still needs device_output_exact over all 20 cases, so the pin stays at 5.3033; a full-suite gate attempt is running on board 3 with the same tree md5 (M-gate-b3.log) while board 2 finishes the spin-budget variant (worker 120,000 / caller 3,000, M-spin2-b2.log, base 5.560). Read both next window; do not integrate into main or re-pin until a 20-case session passes, since the console wedge has capped boots at 16-17 requests.","note_on_concurrency":"Disclosed: the gate attempt on board 3 runs while board 2's lane is active, and run #402 measured that concurrent console traffic moves the wedge earlier, so this attempt is more likely than usual to stall at the tail. It is cheap to attempt and the alternative is not attempting the gate at all."}}
{"run":456,"commit":"cc207de","metric":5.3033,"metrics":{"boot_bench_tps":5.343,"device_output_exact":20,"device_token_delta":0,"ext_decode_tps":5.2269,"gen_tokens":99,"host_output_exact":19,"internal_free":13367,"logit_max_delta":0.00005341,"logit_top1_match":10,"min_case_tps":5.07,"prefill_tps":5.59,"psram_free":2052252,"think_tps":4.2},"status":"keep","description":"Spin-budget tuning MEASURED NULL and the wake-side axis closed. Raising the two budgets from 20,000 (worker polls before blocking) / 600 (caller polls before taking s_done) to 120,000 / 3,000 moved board 2's primary decode from 5.560 to 5.5617 - one quantisation tick, with device_output_exact=6/6 and token_delta 0 - so the shipped first-guess budgets already capture the whole +1.31 % and there is no idle-power price to weigh. Because insensitivity in both directions localises the win to deleting the two semaphore syscalls from the common path (the worker is nearly always already polling when a split lands, and nearly always finished before the caller looks), further wake-side tuning cannot be where the next token comes from: the residue is descriptor publication plus cross-core visibility. Accepted runtime unchanged at 5.3033; board 3's 20-case gate on the spin tree was still priming (zero cases emitted) so no acceptance claim, and the pin stays put until device_output_exact=20.","timestamp":1790258026773,"segment":1,"confidence":18.46193548387094,"asi":{"hypothesis":"Spin budgets 20,000 (worker, before blocking) / 600 (caller, before taking s_done) were first guesses, so raising them 6x/5x to 120,000/3,000 tests whether the worker surrenders its spin window between tokens and repays the wake the handshake exists to avoid.","measurement":"NULL. board 2 read decode 5.5617 with budgets 120,000/3,000 against 5.560 with 20,000/600 - one metric quantum (0.03 %), device_output_exact=6/6, token_delta 0. Budget axis CLOSED at the shipped 20,000/600; no idle-power price was paid either.","mechanism_narrowed":"insensitivity in BOTH budgets localises the +1.31 % to removing the two semaphore syscalls from the common path, not to keeping the worker unparked: if the worker were still parking between tokens, the 6x longer window would have bought something, and if the caller often reached its poll before the peer finished, the 5x longer caller window would have. So splits are dense enough inside a token that the worker is nearly always already polling, and it nearly always finishes before the caller looks. That also means the remaining toll is the descriptor publish + cross-core visibility, not scheduler machinery, so further wake-side tuning is not where the next token comes from.","next":"Board 3's 20-case gate on the spin tree (M-gate-b3.log) had emitted zero CASE lines when read - still priming - so no gate claim. Read it next window; acceptance and the re-pin stay blocked on device_output_exact=20, not on evidence about the candidate. With the budget axis closed, the queue after a gate pass is: integrate asmemo+fusion+nf16v+spin into main, re-pin ~5.561, make capture, then re-price the de-split candidates against the cheaper handshake (.auto/exp82/nd_model.c.desplit1) rather than against run #451's old toll.","unrelated":"the gate lane also confirmed the anti-repeat guard still recognises this image (same tree, new purpose) now that the stale override marker is gone."}}
{"run":457,"commit":"c828e8c","metric":5.3033,"metrics":{"boot_bench_tps":5.343,"device_output_exact":20,"device_token_delta":0,"ext_decode_tps":5.2269,"gen_tokens":99,"host_output_exact":19,"internal_free":13367,"logit_max_delta":0.00005341,"logit_top1_match":10,"min_case_tps":5.07,"prefill_tps":5.59,"psram_free":2052252,"think_tps":4.2},"status":"keep","description":"Splitter floor lowered on a changed premise and launched. rows_dual_core has always run jobs with fewer than four units serially on the calling core (\"below this the handshake costs more than the work it saves\"), a floor priced on run #344's void 23-cycle handshake and then on run #451's honest 16.6 us toll - and the spin handshake has since removed that toll from the common path (cross-board confirmed, budget-insensitive, so the cost was the two semaphore syscalls). With a split now costing one descriptor publish plus one counter poll, the floor excludes exactly the jobs that still run single-core: the dim=576 Q tap projection at 3 units, small gathered row sets, a 3-group FWHT half. Patch (half < 2 -> half < 1) is bit-exact by construction because a split only chooses which core computes which disjoint row range. Running on board 2 with runner-asserted provenance (engine_md5=d1536edc1ae5) against the spin base 5.560/5.5617; board 3's 20-case gate on the spin tree was still in its extended group, so no acceptance claim and the accepted runtime stays 5.3033.","timestamp":1790258143784,"segment":1,"confidence":18.46193548387094,"asi":{"changed_assumption":"The floor was justified by a handshake cost that no longer exists: run #344's '23 cycles' measured a serial indirect call (a kbench image never installs rows_dual_core, because worker_start() runs in app_main which kbench never reaches), and run #451's honest 3,973-cycle / 16.6 us toll has since been removed from the common path by the spin handshake (+1.31 %, cross-board confirmed, budget-insensitive, so the cost really was the two semaphore syscalls). What remains per split is one descriptor publish plus one counter poll. That flips the predicted sign of exactly the jobs this floor excluded.","hypothesis":"Revive the 'jobs too small to split' rule with a changed premise: the splitter's floor (half < 2, so any job under four units ran serially on one core) was priced on run #451's 16.6 us toll and run #344's void 23 cycles; the spin handshake removed that toll, so lowering the floor to half < 1 should convert the remaining single-core jobs - the dim=576 Q tap projection at 3 units, small gathered row sets, a 3-group FWHT half - into real two-core work. Bit-exact by construction (the split only chooses which core computes which disjoint range; per-row accumulation order never moves).","in_flight":"board 2, AUTO_GROUPS=primary, runner-asserted engine_md5=d1536edc1ae5 (log M-splitlow-b2.log). Delta base is the spin tree's 5.560/5.5617 on this same board lineage. Honest priors both ways: positive if the remaining cost really is only publication+poll, negative if a small split's imbalance dominates when a job is a few microseconds - tap96's -0.094 % was measured against the old toll, so it is evidence about that regime, not this one.","gate_status":"board 3's 20-case gate on the spin tree reached the extended group (6 primary cases, decode 5.5617, then into extended with its timer case running) when read, so no device_output_exact line yet and no acceptance claim. The pin stays at 5.3033.","next":"Read both lanes. If splitlow wins even sub-bar it belongs in the acceptance bundle (runs #431/#439: sub-bar halves of one phase compose, above-bar halves compose sub-additively); if it loses, the floor is right for a reason the toll arithmetic does not capture and that is itself the finding to record before anyone lowers it again."}}
{"run":458,"commit":"c828e8c","metric":5.3033,"metrics":{"boot_bench_tps":5.343,"device_output_exact":20,"device_token_delta":0,"ext_decode_tps":5.2269,"gen_tokens":99,"host_output_exact":19,"internal_free":13367,"logit_max_delta":0.00005341,"logit_top1_match":10,"min_case_tps":5.07,"prefill_tps":5.59,"psram_free":2052252,"think_tps":4.2},"status":"keep","description":"Two lanes in flight, nothing claimed. The lowered splitter floor (half<2 -> half<1, reviving 'jobs too small to split' now that the spin handshake removed the measured 16.6 us toll) was still building/priming on board 2, and board 3's 20-case device gate on the spin tree had reached its extended group with decode 5.5617 and min_case 5.30 but no device_output_exact line yet, so no acceptance is asserted and the accepted runtime stays 5.3033 with its own secondaries.","timestamp":1790258185811,"segment":1,"confidence":18.46193548387094,"asi":{"hypotheses_in_flight":["splitlow (board 2, engine_md5=d1536edc1ae5): does lowering the splitter's floor from half<2 to half<1 pay now that the spin handshake removed the ~16.6 us toll? Base for the delta is the spin tree's 5.560/5.5617 on the same board lineage. Positive even if sub-bar belongs in the acceptance bundle (runs #431/#439 compose sub-bar halves of one phase); a loss is also informative - it would mean a small split's imbalance, not the wake, is what the floor was really protecting.","20-case device gate on the spin tree (board 3): the only event that licenses integrating asmemo+fusion+nf16v+spin into main and re-pinning from 5.3033 to ~5.56 (+4.85 %)."],"no_claim":"board 2's lane had not emitted a METRIC line and board 3's gate was still inside its extended group (6 primary cases read decode 5.5617, no device_output_exact yet), so this iteration claims no measurement and no acceptance. The accepted runtime stays 5.3033 with its own secondaries.","next_action_hint":"Next window: grep decode_tps and device_output_exact from M-splitlow-b2.log and M-gate-b3.log. If the gate reached 20/20, integrate .auto/exp78/apply_bundle.py plus .auto/exp80/nd_quant.c.nf16v plus main's nf16v .S and spin main.c into main, re-pin 5.56 in gen_lane.sh/lane_one.sh, and re-run make capture. If splitlow also won, include it in the same integration rather than measuring it twice."}}
