{"run":232,"commit":"0423bc4","metric":4.9183,"metrics":{"prefill_tps":5.2433,"ext_decode_tps":4.8414,"think_tps":3.88,"boot_bench_tps":5.018,"min_case_tps":4.7,"gen_tokens":99,"internal_free":15247,"psram_free":2052252,"device_output_exact":14,"device_token_delta":0,"logit_max_delta":0.00005341,"logit_top1_match":10,"host_output_exact":13},"status":"discard","description":"Experiment 17, first measured candidate: IRAM placement of the constrained sampler's driver. The symbol-table audit (not a guess) showed the hot compute is already resident - attn_heads, kron1_blocks/kron2_rows and nd_lut2_rows_c/tie1n all sit at 0x4037xxxx (IRAM) - while the flash-mapped (0x42xxxxxx) functions are nd_gstate_byte (1971 B, but run #149 measured its aggregate at only 0.06 ms so it is worthless), pool_cell, kron_apply (62 B wrapper over IRAM loops), nd_model_logits_subset (58 B), nd_cq_prepare (107 B), nd_tok_piece (37 B) and nd_sample_hidden (312 B). Chose nd_sample_hidden as the flash-resident function with real aggregate time (~8 ms of a request token, the phase the boot bench cannot run) and already-IRAM split kernel next to it. ND_HOT moved it 0x420114d8 -> 0x4037c3c0, verified through nm. Result: decode 4.9183 vs the 4.9150 control = +0.067%, extended 4.8414 (+0.12%), everything else identical to the tick (prefill 5.2433, think 3.88, min_case 4.70, boot bench 5.018, fidelity 5.341e-05, top1 10/10, 14/14 device + 13/13 host byte-exact, token_delta 0), internal_free 15247 (-256 B). Rejected: one quantisation tick is below the 0.2% keep bar and within the 0.071% spread measured across three byte-identical images, so no batch time was spent confirming it, and keeping it would spend 256 bytes of the campaign's scarcest resource on a win that cannot be resolved. Reverted.","timestamp":1790031976352,"segment":1,"confidence":4.168717343670992,"asi":{"hypothesis":"The constrained sampler's per-token driver executes from flash-mapped .text, so its instruction fetches miss on every generated token; ND_HOT placement of that 312-byte function should recover part of its ~8 ms without touching arithmetic.","measured":"+0.067% decode (one metric tick), +0.12% extended, all other monitors identical to the tick, byte-exact everywhere, -256 B internal RAM. Below the keep bar and within the measured identical-image spread (0.071%), so not confirmable and not worth the RAM.","exp17_disposition_so_far":"Code placement is not a lever on this firmware: every loop that owns real time is already in IRAM, and the flash-resident remainder is either a small wrapper (kron_apply, logits_subset), cold in aggregate (nd_gstate_byte 0.06 ms, pool_cell ~0), or a 37-107 B helper whose fetch cost is amortised by an L1 instruction cache that already holds it. The remaining single-function candidates are each <= 0.1% by this measurement, i.e. under the bar by construction; do not spend a build on each of them separately.","ram_note":"internal_free is now the binding constraint for placement-style ideas: 15503 B accepted, 15247 with this change. A future candidate must pay for its own IRAM.","next":"Experiment 14's numeric screen (host, cheap, and its byte-exactness gate is the honest disposition), or Experiment 16 (compact first-byte grammar index) which is the remaining queue item that can ship bit-exact with a prize above the bar."}}
{"run":233,"commit":"1d1b2a8","metric":4.925,"metrics":{"prefill_tps":5.25,"ext_decode_tps":4.8429,"think_tps":3.89,"boot_bench_tps":5.022,"min_case_tps":4.71,"gen_tokens":99,"internal_free":15247,"psram_free":2052252,"device_output_exact":14,"device_token_delta":0,"logit_max_delta":0.00005341,"logit_top1_match":10,"host_output_exact":13},"status":"keep","description":"Experiment 18 - exact KV reciprocal (Markstein residual form): KEPT, +0.204% decode (4.9150 -> 4.9250). kv_store_int8 did `src[i] / scale` per element - 48 elements x two tensors x two KV heads x eight layers = 1,536 divides per decode token, the whole 1.1 ms phase. Since the divisor is invariant across the row, this is division-by-invariant: one correctly-rounded reciprocal per call (one real divide) plus, per element, y0 = RN(x*r); e = fmaf(-scale, y0, x) (the exact residual); q = fmaf(e, r, y0) - Markstein's form, which is provably the correctly-rounded quotient for round-to-nearest, so every stored int8 byte is identical to the divide it replaces. That is materially different from the naive x * (1/scale), which double-rounds and was rejected in run #2e for changing the model's memory. Verified as a numeric primitive, not by goldens alone: 8,000,006 comparisons against the previous implementation with 0 mismatches, covering arbitrary bit patterns, values placed exactly on .5 rounding boundaries after scaling, the +/-127 clamp edge, exactly-representable quotients, tiny and huge scales, and +inf/-inf/NaN (kept on the divide path by a two-compare guard, so non-finite semantics are unchanged too). Device: decode 4.9250, extended 4.8429 (+0.15%), think 3.89 (+0.26%), prefill 5.2500 (+0.13%), min_case 4.71, boot bench 5.022/199 ms, byte-exact 14/14 device + 13/13 host, token_delta 0, fidelity 5.341e-05 top1 10/10, internal_free 15247 (-256 B). 4.9250 = +101.8% over the 2.44 baseline. Kept on a single canonical run at ~3x the measured identical-image noise floor, following the #176 -> #177 precedent; the swapped-assignment three-board batch is scheduled as the immediate next step and this is reverted if the batch contradicts it.","timestamp":1790032648581,"segment":1,"confidence":4.185572223158603,"asi":{"hypothesis":"kv_store_int8's 1,536 per-token divides dominate the 1.1 ms KV-store phase; replacing them with one reciprocal per call plus a two-FMA Markstein fixup keeps the quotient correctly rounded (so every int8 KV byte is unchanged) and removes the phase's real cost.","premise_check":"The codegen shows quou.s, i.e. the S3's TIE FP does have a divide instruction, so the ledger's '~340 cycles of __divsf3 per element' was an inference from the phase time, not a measurement. The run settles it empirically: removing the divides moved the whole token +0.204%, so the divide was genuinely the bottleneck even as a TIE instruction.","bitexactness":"Proved as a primitive over 8,000,006 differential comparisons with 0 mismatches (adversarial boundaries and non-finite included), not inferred from goldens - the rule banked at #231 after a real off-by-one slipped past the byte-exact suite.","why_not_naive":"x * (1/scale) double-rounds and can store a different int8 within an ulp of a .5 boundary; that is the model's memory, and #2e refused it for exactly that reason. The residual fixup is what makes the same speedup admissible.","risk_note":"Kept on one canonical run (delta ~3x the 0.071% identical-image spread). Confirmation with swapped board assignments is the next action; revert if it contradicts.","next":"Three-board batch: board 1 control (pre-change), boards 2/3 candidate, then swap; then make capture (shipping code changed). After that Experiment 16, or re-examine other divide-heavy hot spots with the same invariant-divisor reasoning."}}
{"run":234,"commit":"1d1b2a8","metric":4.925,"metrics":{"prefill_tps":5.25,"ext_decode_tps":4.8429,"think_tps":3.89,"boot_bench_tps":5.022,"min_case_tps":4.71,"gen_tokens":99,"internal_free":15247,"psram_free":2052252,"device_output_exact":14,"device_token_delta":0,"logit_max_delta":0.00005341,"logit_top1_match":10,"host_output_exact":13},"status":"keep","description":"Confirmation batch for run #233 (exact KV reciprocal), plus a canonical repeat - the change stands. Three-board batch 20260921T231859.542050Z with the PRE-change tree (0423bc4) as board 1's control and the candidate on boards 2/3, all freshly configured with distinct image sizes (279744 control / 279712 / 279712 candidate) and -DND_LUT2_ASM present in all 7 compile commands: control read decode 4.9150, exactly the previously accepted value, so the batch is trustworthy; candidates read 4.9217 and 4.9250. Extended decode 4.8357 control vs 4.8429 on both candidates, think 3.88 vs 3.89 on both, prefill 5.2433 vs 5.2483/5.25, min_case 4.70 vs 4.70/4.71, byte-exact 14/14 on all three boards, internal_free 15503 vs 15247 (-256 B) as predicted. The swapped half of the confirmation came from #233 itself (candidate on the canonical board 1: 4.9250), and this session's canonical re-measure reproduced 4.9250 with every gate green (14/14 device + 13/13 host byte-exact, token_delta 0, fidelity 5.341e-05, top1 10/10, boot bench 5.022 / 199 ms/token). Pool of candidate readings {4.9250, 4.9217, 4.9250} against control readings {4.9150, 4.9150}: direction positive in every comparison, mean delta +0.17%, min +0.14%, max +0.20% - the mean sits marginally under the nominal 0.2% keep bar, but the metric's measured identical-image spread is 0.071% peak-to-peak (sigma ~0.03%), three independent boards agree, and the change is bit-identical by proof rather than by sampling, so the effect is resolved rather than marginal: kept. Accepted runtime stays 4.9250 = +101.8% over the 2.44 baseline. make capture is now overdue (shipping code changed at #233) and is the next action, followed by Experiment 16.","timestamp":1790034456711,"segment":1,"confidence":4.185572223158603,"asi":{"hypothesis":"Confirm #233's +0.204% with a real control-plus-candidate batch including the swapped board assignment, rather than accepting a single canonical run.","verdict":"Confirmed. Control reproduced the accepted value digit-for-digit; candidates beat it on all three measurements; every secondary monitor moved the same direction; quality gates green throughout.","bar_accounting":"mean +0.17% vs the 0.2% bar. Kept because the bar exists to separate signal from churn risk: the effect is 5x the measured sigma, reproduced on three boards, and carries no numerical risk (byte-identical int8 KV proven over 8M differential comparisons). Recording the mean honestly instead of quoting only the best reading.","next":"make capture on the new shipping code (overdue since #233), then Experiment 16 (compact first-byte grammar index, the remaining queue item that can ship bit-exact), then Experiments 14/15/19 in order."}}
{"run":235,"commit":"3749e67","metric":4.9233,"metrics":{"prefill_tps":5.2517,"ext_decode_tps":4.8429,"think_tps":3.89,"boot_bench_tps":5.022,"min_case_tps":4.71,"gen_tokens":99,"internal_free":15247,"psram_free":2052252,"device_output_exact":14,"device_token_delta":0,"logit_max_delta":0.00005341,"logit_top1_match":10,"host_output_exact":13},"status":"keep","description":"Documentation correction on the kept #233 change, plus the behavioural-capture attempt and a gate run on the final tree. (1) Lead closed without a device candidate: #233's own follow-up hint was to look for other per-element divisions by an invariant divisor, and the obvious one - the online-softmax output normalization - already hoists its reciprocal (engine/src/nd_model.c:1359, `float inv = 1.0f / denom[t]`), so there are no divides left to remove there; its double-rounded result is also frozen by the byte-exact goldens, so making it correctly rounded would be a model change and is out of scope. (2) Corrected an inaccurate comment I had shipped in kv_store_int8: it claimed the ESP32-S3 has no FP divider and pays a ~150-cycle __divsf3 per element, which #233's own disassembly contradicts (quou.s is present, including inside that function). The comment now states the measured fact instead of the inference - removing those divides was worth +0.204% of the token over 1,536 divides, about 65 cycles each. Comment-only: the linked image is byte-for-byte the same size (279712 B), so no measurement validity question arises. (3) make capture was attempted and is BLOCKED, not skipped: it fails with URLError Connection refused because needle-api is not serving 127.0.0.1:8081 in this container session (it must be started in a tmux window first, per AGENTS.md), and capture is still owed for the shipping changes at #233. Note also a self-inflicted failure worth remembering: `pkill -f serial_api.py` matches its own command line and killed the shell mid-chain. (4) Gate run on the tree as it now stands: decode 4.9233, extended 4.8429, think 3.89, prefill 5.2517, min_case 4.71, boot bench 5.022 (199 ms/token), 14/14 device + 13/13 host byte-exact, token_delta 0, fidelity 5.341e-05, top1 10/10, internal_free 15247. 4.9233 vs the accepted 4.9250 is one quantisation tick, inside the 0.071% identical-image spread, so the accepted runtime and its +0.17% mean confirmation at #234 stand.","timestamp":1790034853006,"segment":1,"confidence":4.185572223158603,"asi":{"hypothesis":"Follow #233's hint and apply invariant-divisor reasoning to other hot per-element divisions, starting with the attention output normalization.","result":"Nothing to do: the site already uses one reciprocal per head (line 1359), and its rounding is frozen by the goldens, so no bit-exact win exists there. Closes the 'other divide sites' lead as far as attention is concerned.","capture_blocker":"make capture requires needle-api on 127.0.0.1:8081; not running in this session. Start it in tmux, confirm /health, then run capture before further shipping changes. Still owed for #233.","harness_trap":"pkill -f serial_api.py matches the pkill command line itself and kills the calling shell - kill by pid from pgrep output instead.","next":"Start needle-api in tmux and run make capture (owed since #233). Then Experiment 16 (compact first-byte grammar index): the remaining queue item that can ship bit-exact, prize bounded by the ~1.6 ms two-core candidate filter, so screen it against the 0.2% bar before committing device time."}}
{"run":236,"commit":"89514f8","metric":4.925,"metrics":{"prefill_tps":5.25,"ext_decode_tps":4.8429,"think_tps":3.89,"boot_bench_tps":5.022,"min_case_tps":4.71,"gen_tokens":99,"internal_free":15247,"psram_free":2052252,"device_output_exact":14,"device_token_delta":0,"logit_max_delta":0.00005341,"logit_top1_match":10,"host_output_exact":13},"status":"keep","description":"Behavioural-integrity cycle on the shipping path, and the capture owed by #233 is now discharged. The #235 blocker was that make capture talks to needle-api on 127.0.0.1:8081 and the API was not running; resolved with `tmux new-window -t pi -n api 'make serve'` (health reported ready in 5 s: ready=true, esp32-s3, schema agent-watch-v2, layers 8, 16,155,796 model bytes), then `make capture` (demo/capture.py) ran all seven end-to-end scenarios with routing, local two-pass tool execution, telemetry, sampling interval and timer expiry exercised, and returned rc=0 with ALL NINE verification flags true: routes_match, tools_match, requests_succeeded, no_external_calls, local_has_two_passes, external_stops_at_selection, telemetry_progressed, sampling_interval_applied, timer_expired. So the accepted runtime is now proven behaviourally, not just byte-exactly: the board still routes correctly, still executes tools locally in two passes, and still makes no external calls, on the image that contains #233's exact-KV reciprocal. API then stopped (tmux window killed, serial_api child killed by pid - the bracketed pgrep pattern avoids the self-match trap from #235) so the console was free for the measurement. Full rebuild + flash + 14-case suite afterwards: decode 4.9250, extended 4.8429, think 3.89, prefill 5.25, min_case 4.71, boot bench 5.022 (199 ms/token), 14/14 device + 13/13 host byte-exact, token_delta 0, fidelity 5.341e-05, top1 10/10, internal_free 15247, psram_free 2,052,252 - i.e. the accepted value reproduced exactly after capture had left the board with a running timer and an altered sampling period, reproducing the #188 robustness result on the new code. No change taken; the capture cadence resets to next-due-after-the-next-shipping-change.","timestamp":1790035320142,"segment":1,"confidence":4.185572223158603,"asi":{"hypothesis":"The campaign's own cadence rule says run make capture when shipping code changes; it changed at #233 and was blocked on the API service, so clearing that blocker is the highest-value integrity action available this cycle.","result":"Capture green on the shipping image: 7 scenarios, 9/9 flags true. The 4.9250 runtime is now validated behaviourally (routing, two-pass local tool execution, no external calls, telemetry, sampling, timer) in addition to byte-exactness and the fidelity probe.","reusable_harness_recipe":"make capture needs the API: `tmux new-window -t pi -n api 'make serve'`, poll http://127.0.0.1:8081/health (~5 s), run capture, then kill the tmux window AND any tools/serial_api.py child (bracketed pattern: pgrep -f '[s]erial_api') before touching /dev/ttyACM1 or flashing.","harness_rule":"run_experiment refuses any command that wraps .auto/measure.sh - service teardown must happen in a separate bash call, not concatenated with the benchmark.","next":"Experiment 16 (compact first-byte grammar index) is the remaining queue item that can ship bit-exact; its prize is bounded by the ~1.6 ms two-core candidate filter, so screen the candidate-list equality and per-token cost on captured grammar states before spending device time. Alternatives in queue order: 14 (integer path, host screen - byte-exactness gate makes it a documented no-ship), 15 (GDMA double buffering), 19 (120 MHz diagnostic)."}}
{"run":237,"commit":"89514f8","metric":4.9217,"metrics":{"prefill_tps":5.2483,"ext_decode_tps":4.8429,"think_tps":3.89,"boot_bench_tps":5.023,"min_case_tps":4.7,"gen_tokens":99,"internal_free":15247,"psram_free":2052252,"device_output_exact":14,"device_token_delta":0,"logit_max_delta":0.00005341,"logit_top1_match":10,"host_output_exact":13},"status":"keep","description":"Repeat reading of the accepted runtime (4.9250 lineage from #233/#234) - explicitly a repeat, not a candidate, and logged as such because the per-iteration mandate requires a measurement while the remaining context cannot fit implementing Experiment 16. Campaign rule 1 forbids unchanged-HEAD verification loops; this is a deliberate, disclosed exception rather than a drift back into them, and the cycle produced one genuinely useful datum: the noise pool for the current runtime. Readings of the accepted code are now {4.9250, 4.9217, 4.9250, 4.9233, 4.9250, 4.9217} across five sessions and two boards, spread 0.067% peak-to-peak, mean 4.9237 - which independently reproduces the 0.071% peak-to-peak / ~0.03% sigma figure measured in run #144 on byte-identical images, so the metric's noise model has not changed under the new code. That matters for the next candidate decision: #233's +0.204% is the top of this distribution and its batch mean delta over control was +0.17%, so any future candidate must clear roughly 0.2% of the whole token to be distinguishable at all, which is exactly why Experiment 16 (bounded by the ~1.6 ms already-two-core candidate filter, ceiling ~0.2-0.3%) must be screened off-device for candidate-list equality and per-token cost before any board time is spent on it. Full gates green: 14/14 device + 13/13 host byte-exact, token_delta 0, fidelity 5.341e-05, top1 10/10, extended 4.8429, think 3.89, prefill 5.2483, min_case 4.70, boot bench 5.023 (199 ms/token), internal_free 15247, psram_free 2,052,252. No change taken; accepted value stays 4.9250 (+101.8%).","timestamp":1790035616141,"segment":1,"confidence":4.185572223158603,"asi":{"hypothesis":"No new hypothesis tested this cycle: the remaining working context could not fit Experiment 16's implementation, so the honest options were a disclosed repeat or an empty cycle.","datum":"Sixth reading of the accepted runtime; spread 0.067% and mean 4.9237 reproduce run #144's noise model on the new code, so keep/discard thresholds calibrated before #233 are still valid.","rule_deviation":"Rule 1 (no unchanged-HEAD verification) was overridden by the operator's explicit per-iteration measurement mandate and is disclosed here rather than hidden behind a 'verification' label.","next":"Experiment 16 with a mandatory off-device screen first: build the first-byte bucketed vocabulary index in the host build, assert the candidate set is identical to the shipped enumeration on captured real grammar states and in globally ascending token-id order, and only take it to a board if the predicted saving over the already-two-core 1.6 ms filter exceeds ~0.4 ms (about 0.2% of the token). If it cannot, record that and move to Experiment 15 (GDMA double buffering), which is the last idea that attacks the dominant 2-bit GEMV's byte delivery rather than its schedule."}}
