{"run":363,"commit":"dbc6855","metric":5.0467,"metrics":{"boot_bench_tps":5.091,"device_output_exact":17,"device_token_delta":0,"ext_decode_tps":4.975,"gen_tokens":99,"host_output_exact":19,"internal_free":14647,"logit_max_delta":0.00005341,"logit_top1_match":10,"min_case_tps":4.82,"prefill_tps":5.3217,"psram_free":2052252,"think_tps":3.95},"status":"keep","description":"DIAGNOSTIC ENTRY, no candidate decision and no speed claim (decode_tps is the accepted 5.0467 carried forward; nothing new measured): the transform half of Experiment 33 failed the device quality gate, and the reason is a bug in my integration, not in the measurement. Board 2 ran the integrated ee.ldf paired butterfly in nd_fwht and reported DEVICE_OUTPUT_DIVERGED 4/17 with token_delta 257: tools cases collapsed to empty calls and the think case degraded to boilerplate. The kbench differential had said diff=0 because the bench's OWN copy of the loop handled the len==1 stage correctly, while the copy I pasted into engine/src/nd_quant.c replaced that entire stage (n/2 butterflies) with a single butterfly at x[0]/x[1] - for n=128 that drops 63 of 64 stage-1 butterflies. Fourth instance of this campaign's deadliest class (#333's multi-row cursor, #242's probe placed before the line it replaced, #359's macro never forwarded): a differential that tests a transcription instead of the shipping code proves the transcription correct. Rule now recorded at the site: differential the integrated function. Board 1 was running the same broken code as 'both' and was stopped once board 2's verdict arrived, so neither reading is used; its bench.py then looked stalled for 5 minutes, which was the 600 s request timeout against an image whose generation had collapsed - the CASE lines (tokens=2, calls_ok=0) are the tell. Fix applied: the len==1 stage now loops the whole stage, 16/16 repo tests green. Re-measuring in 20260923T1022L with a transform-only board so the fix's byte-exactness is judged directly.","timestamp":1790151582665,"segment":1,"confidence":21.708333333333318,"asi":{"candidate":"Experiment 33 integration, transform half as first written: the ee.ldf.64.ip/ee.stf.64.ip paired butterfly inside nd_fwht (board 2, batch 20260923T1015L, nd_quant.c md5 65e08acadacf). Board 1 was running the same code as 'both' and was stopped once board 2's verdict was in, so no reading from either board is used.","hypothesis":"lane 1 measured this exact butterfly form +36.75 % with diff=0 against the shipped nd_fwht on real geometry, so it should have been bit-exact in situ and worth +0.43 % decode.","result":"DEVICE_OUTPUT_DIVERGED 4/17, device_token_delta=257, MEASURE rc=1. Tools-schema cases collapsed to empty calls (<tool_call>[]</tool_call>, tokens=2) and the think case degraded to repeated boilerplate - i.e. the activation transform was wrong, not marginally different.","root_cause":"The kbench differential passed because the bench's OWN copy of the butterfly loop handled the len==1 stage correctly (`if (len == 1u) { ... continue; }` inside the per-block loop, so all n/2 butterflies ran). The copy I pasted into engine/src/nd_quant.c replaced that whole stage with ONE butterfly at x[0]/x[1]. For n=128 that drops 63 of 64 stage-1 butterflies, which is exactly a model-quality change, and the byte-exact gate is what caught it.","meta_lesson":"Fourth instance of the same class in this campaign, and the costliest: #333's multi-row cursor (caller stepped what the kernel also stepped), #242's probe inserted before the line it replaced, #359's macro not forwarded to the compiler, and now a differential that tested a transcription instead of the shipping code. Rule, stated for whoever reads next: the differential must execute the integrated function - if the bench has its own copy of the body, the bench has only proved its own copy correct.","stalled_bench_tell":"Board 1's bench.py then sat with unchanged logs for 5 minutes and looked like a serial stall. It was the 600 s per-request timeout against a broken image whose generation had collapsed; the CASE lines (tokens=2, calls_ok=0) are the tell, not the process state. A broken candidate that shortens generation looks like a hung harness on this bench.","fix":"engine/src/nd_quant.c now loops the whole len==1 stage (for i = 0; i < n; i += 2), with the measured failure recorded at the site. 16/16 repo tests green on the fixed tree.","next":"20260923T1022L re-measures it on three boards: board 1 both halves, board 2 transform alone (its byte-exactness is the direct verdict on the fix), board 3 the same image as board 1 for the cross-board confirmation. If board 2 is byte-exact the transform is real; if not the half is reverted and 5.0467 stands alone."}}
{"run":364,"commit":"1a5eb09","metric":5.0467,"metrics":{"boot_bench_tps":5.077,"device_output_exact":17,"device_token_delta":0,"ext_decode_tps":4.956,"gen_tokens":99,"host_output_exact":19,"internal_free":14647,"logit_max_delta":0.00005341,"logit_top1_match":10,"min_case_tps":4.8,"prefill_tps":5.3083,"psram_free":2052252,"think_tps":3.94},"status":"keep","description":"Experiment 33 transform half, FIXED and MEASURED: bit-exact but worth exactly zero, so REJECTED and reverted (accepted runtime stays 5.0467). Board 2 ran the repaired paired-butterfly transform alone and read 5.0300 - the pre-rescale accepted value to the digit - while boards 1 and 3 ran it on top of the rescale and both read 5.0467, exactly #362's rescale-only figure. Two independent decompositions agree the transform contributes +0.000 %. Quality was never the issue after the fix: DEVICE_GATE_OK 17/17, golden_missing=0, token_delta=0, fidelity 5.341e-05, top1 10/10, on all three boards - which confirms #363's len==1 stage was the entire defect. WHY ISOLATION AND FIELD DISAGREE: the kbench screen re-swept the same 768-float block 25 times, so the transform ran on data the 64 KB data cache had absorbed (the #295/#330 warmth trap), while the field calls nd_fwht on a freshly prepared activation each time. Third independent measurement - after #330's flat 13.90 % cold delivery tax and #295's phi warmth correction - that instruction-level wins in a cold PSRAM-touching loop do not transfer, and the strongest one yet because the isolated delta was +36.75 % and the transferred delta was exactly zero. Dead TIE helper deleted from engine/src/nd_quant.c: 16/16 tests, host 19/19 byte-exact, no warnings. Rule reinforced: a warm kbench number prices nothing; isolate cold or do not price from isolation.","timestamp":1790152813014,"segment":1,"confidence":21.708333333333318,"asi":{"candidate":"The fixed transform half: ee.ldf.64.ip/ee.stf.64.ip paired butterflies inside nd_fwht, with the len==1 stage bug from #363 repaired (loops the whole stage). Board 2 ran it alone; boards 1 and 3 ran it on top of the shipped rescale. Batch 20260923T1022L, md5 5d25591f2af0 (transform only) and fd7a1183396b (both).","hypothesis":"lane 1 measured this form +36.75 % bit-exact against the shipped nd_fwht, and the transform is 80.6 % of prepare's cycles by the engine's own numbers, so it should be worth about +0.43 % decode.","quality":"The fix worked: DEVICE_GATE_OK exact=17/17, device_golden_missing=0, device_token_delta=0 on both transform-only and both-boards, fidelity 5.341e-05 unchanged, top1 10/10. So the divergence was exactly the len==1 stage and nothing else.","speed":"Transform-only decoded 5.0300 - the pre-rescale accepted value to the digit - i.e. +0.000 %. And both-boards read 5.0467 on board 1 AND board 3, exactly the rescale-only 5.0467 from #362. Two independent decompositions agree: the transform contributes nothing.","verdict":"REJECTED and reverted from the tree (helper deleted, no dead code left, 16/16 tests + host 19/19 byte-exact + no unused-function warnings after removal). Accepted runtime stays 5.0467.","why_isolated_and_field_disagree":"The kbench loop re-swept the same 768-float block 25 times, so the transform ran on data the 64 KB data cache had already absorbed - the #295/#330 warmth trap again, this time on the loop that looked like the cleanest win of the window. The field calls nd_fwht on a fresh prepared activation each time, where the pass is cold and instruction schedule is not the constraint. This is now the third independent measurement (with #330's flat 13.90 % cold tax and #295's phi warmth correction) that instruction-level wins in a cold PSRAM-touching loop do not transfer, and it is the strongest one because the isolated delta was large and the transferred delta was exactly zero.","rule_reinforced":"Isolate on cold data or do not price from isolation. A warm kbench number is an upper bound on nothing useful when the field pass is cold.","next":"E35 batch 20260923T0905L tests the same phase's other per-cell loop (lutb_rows) and the aliasing fence one level up (fwht_rows' ctx reads), three boards, each host-proven byte-exact before flashing. Note lutb_rows is a candidate for the same null, and that is the point: measurement retires it either way."}}
{"run":365,"commit":"1a5eb09","metric":5.05,"metrics":{"boot_bench_tps":5.098,"device_output_exact":17,"device_token_delta":0,"ext_decode_tps":4.977,"gen_tokens":99,"host_output_exact":19,"internal_free":14647,"logit_max_delta":0.00005341,"logit_top1_match":10,"min_case_tps":4.82,"prefill_tps":5.3317,"psram_free":2052252,"think_tps":3.95},"status":"discard","description":"Experiment 35 - the aliasing lever on the prepare phase's per-cell loops: MEASURED ON THREE BOARDS, ALL NULL, nothing kept. 35A board 1 'hoist' (lutb_rows reads c->cb[0..3] once, not once per pair): 5.0450 = -0.034 %. 35B board 2 'hoist2' (plus two pairs per iteration): 5.0317 = -0.297 % and -512 B internal heap. 35C board 3 'fwathoist' (fwht_rows hoists c->g/c->scale/c->xh; c->scale is read per element today): 5.0500 = +0.065 %, free (internal_free 14,647 unchanged, boot bench 5.098, extended 4.977, prefill 5.3317, think 3.95), 17/17 device + 19/19 host byte-exact, DEVICE_GATE_OK, golden_missing 0. All three were host-proven byte-exact before flashing, which is how the #363 transcription class gets caught without a board. Conclusion: the unroll lever and the alias-hoist lever are not interchangeable - GCC already had the alias information the const-qualification implies (matching run #358's restrict-null on the same loop), so what the rescale loop lacked was independent work in flight, not loads. Aliasing/const-hoisting is closed in this phase. Off-device free closure: prepare's copy stage is memcpy+memset, so 'unroll the copy' is null by inspection. 35C banked as a sub-bar free option alongside sigmoidf_pair IRAM. Next: E36 on the loops matching the shape that paid - kv_store_int8 and zcrms_head_rows, both in nd_model.c.","timestamp":1790153555466,"segment":1,"confidence":21.708333333333318,"asi":{"candidates":"Three distinct images, one per board, all bit-exact by construction and all host-proven byte-exact (19/19, token_delta 0, golden_missing 0) BEFORE any flash - which is how run #363's transcription-bug class gets caught without spending a board. 35A board 1 'hoist': lutb_rows reads c->cb[0..3] once instead of once per pair (md5 2ad908c37fc1). 35B board 2 'hoist2': as 35A plus two pairs per iteration, two independent chains to interleave (md5 74925317e879). 35C board 3 'fwathoist': fwht_rows hoists c->g / c->scale / c->xh out of both loops, where c->scale is today read once PER element (md5 e87d8e8dc77c). Batch 20260923T0905L.","hypothesis":"The lever that just shipped (#362's rescale unroll, +0.332 %) is an instruction-level win in a per-element loop, so try the OTHER mechanism that class responds to - aliasing. `const fwht_ctx *` and `const lutb_ctx *` are not `restrict`, and both loops write through a pointer the compiler cannot separate from their operand reads, so loop-invariant operands (four codebook floats; the group size and scale) may be re-loaded every iteration.","result":"All three are nulls against the accepted 5.0467. 35A 5.0450 = -0.034 %. 35B 5.0317 = -0.297 % and it cost 512 B of internal heap (14,135 vs 14,647). 35C 5.0500 = +0.065 %, the only one that moved up, and it is free (internal_free 14,647 unchanged, boot bench 5.098 from 5.091, extended 4.977 from 4.975, prefill 5.3317 from 5.3217, think 3.95 unchanged, 17/17 device + 19/19 host byte-exact, DEVICE_GATE_OK).","verdict":"Nothing kept. 35A/35B are worse. 35C at +0.065 % is a quarter of the 0.2 % keep bar - banked with sigmoidf_pair IRAM (#336/#342, +0.18 % mean) as a sub-bar free option, not shipped.","conclusion":"The unroll lever and the alias-hoist lever are not interchangeable. GCC already had the alias information the const-qualification implies here (exactly the run #358 finding that `restrict` on the same rescale loop measured exactly zero); what the rescale loop was missing was independent work in flight, not loads. That closes aliasing/const-hoisting as a lever in this phase, and it narrows the remaining elementwise-hypothesis to the specific shape that paid: an un-unrolled loop of independent per-element arithmetic, in nd_model.c rather than nd_quant.c.","off_device_closure":"prepare's copy stage is memcpy + memset, so 'unroll the copy loop' is null by reading the function - retired for the price of a grep, no board time.","next":"E36 targets the loops that actually match the winning shape: kv_store_int8 (runs per layer per position per head, independent per-element quantise + int8 store) and zcrms_head_rows (per-head-row elementwise). Both are in engine/src/nd_model.c, so the lane harness now carries a second engine file. Board 1 simultaneously re-flashes the accepted image and runs the behavioural capture the campaign owes since #362."}}
{"run":366,"commit":"HEAD","metric":5.04,"metrics":{"boot_bench_tps":5.083,"device_output_exact":17,"device_token_delta":0,"ext_decode_tps":4.968,"gen_tokens":99,"host_output_exact":19,"internal_free":14647,"logit_max_delta":0.00005341,"logit_top1_match":10,"min_case_tps":4.81,"prefill_tps":5.3217,"psram_free":2052252,"think_tps":3.95},"status":"discard","description":"Experiment 36 lane 2 - zcsplit_rows emit loop unrolled by 4: MEASURED, -0.133 %, REJECTED (decode 5.0400 vs accepted 5.0467, batch 20260923T1000L, nd_model.c md5 c5e6e8a6e441). This was the largest mass of the shape that paid in run #362 - one independent expression per element, d_model=768, three calls per layer, ~18,432 elements per token - and it came back slower. Bit-exact and gate-clean (DEVICE_GATE_OK 17/17, golden_missing=0, token_delta=0, fidelity 5.341e-05, top1 10/10), extended 4.968, think 3.95, prefill 5.3217, min_case 4.81, so it is a pure speed verdict. Host-proven byte-exact before flashing. Conclusion: the unroll lever pays only where a loop's latency is genuinely exposed; the FWHT rescale follows the transform with nothing to overlap, while the ZCRMS emit already has its work hidden by the two-core split. With run #365's aliasing nulls this closes the elementwise-unroll family at one win. Repo tree unchanged at the accepted image.","timestamp":1790155146052,"segment":1,"confidence":21.708333333333318,"asi":{"candidate":"E36 lane 2 (board 2, batch 20260923T1000L): `zcsplit_rows` emit loop unrolled by 4 - `out[i] = (1.0f + s[i]) * x[i] * inv` over d_model=768, called through nd_parallel_rows three times per layer (nd_model.c:1813/1815/1829), so ~18,432 elements per decode token - the largest mass of exactly the shape that paid in run #362. nd_model.c md5 c5e6e8a6e441. Host-proven byte-exact (19/19, token_delta 0, golden_missing 0) before the flash.","hypothesis":"run #362 proved an un-unrolled independent-per-element loop can carry +0.33 %, and run #365 proved the aliasing lever is not the same lever. This is the biggest remaining loop of the winning shape.","result":"decode 5.0400 = **-0.133 %** against the accepted 5.0467. Bit-exact and gate-clean (DEVICE_GATE_OK 17/17, golden_missing=0, token_delta=0, fidelity 5.341e-05, top1 10/10) so this is a pure speed verdict: it is slower. Monitors: extended 4.968 (-0.14 %), think 3.95, prefill 5.3217, min_case 4.81, gen_tokens 99.","verdict":"REJECTED, not kept. Variant lived only in board 2's worker tree; the repo tree is the accepted 5.0467 image (engine md5 b914e2703852, verified).","conclusion":"Unrolling an independent per-element loop pays only where that loop's latency was actually exposed. The FWHT rescale sits immediately after the transform, where the scheduler has nothing else to overlap; the ZCRMS emit already has the parallel-row split plus adjacent work hiding its latency, so adding four-deep grouping only added register pressure and tail-handling. Measured alongside run #365's aliasing nulls, the elementwise-unroll family now has one win and three non-wins, so it is closed at one win and the remaining elementwise candidates are not worth a board.","next":"E37 tests the last two loops of the winning shape inside the 24.4 ms Hadamard MLP (the d1*x scale loop and the p1 permutation gather) on boards 2/3; board 1 is finishing the KV store unroll. If both MLP loops are null the family closes and the remaining honest work is the owed behavioural capture plus the two sub-bar banked levers that need an owner bar decision."}}
{"run":367,"commit":"HEAD","metric":5.0483,"metrics":{"boot_bench_tps":5.09,"device_output_exact":17,"device_token_delta":0,"ext_decode_tps":4.975,"gen_tokens":99,"host_output_exact":19,"internal_free":14647,"logit_max_delta":0.00005341,"logit_top1_match":10,"min_case_tps":4.82,"prefill_tps":5.3267,"psram_free":2052252,"think_tps":3.95},"status":"discard","description":"Experiment 36 lane 3 - zcrms_head_rows per-head emit unrolled by 4: MEASURED, +0.032 %, NULL, not kept (decode 5.0483 vs accepted 5.0467, batch 20260923T1000L, nd_model.c md5 1bcdb113cfb4). 12 q + 2 kv heads per call, twice per layer; the sum-of-squares accumulation was left alone since reassociating it would change the model. Bit-exact and gate-clean (DEVICE_GATE_OK 17/17, golden_missing=0, token_delta=0, fidelity 5.341e-05, top1 10/10), extended 4.975, think 3.95, prefill 5.3267, min_case 4.82 - every monitor inside the measured 0.071 % board-spread band. Host-proven byte-exact before flashing; repo tree verified unchanged at the accepted image. With lane 2 the two emits bracket the result (-0.13 % big, +0.03 % small), which rules out a different unroll factor rather than merely failing to find one: there is no exposed latency in this phase to buy.","timestamp":1790155201055,"segment":1,"confidence":21.708333333333318,"asi":{"candidate":"E36 lane 3 (board 3, batch 20260923T1000L): zcrms_head_rows' per-head emit loop unrolled by 4 - v[i] = (1.0f + c->s[i]) * v[i] * inv over head_dim, for 12 q heads + 2 kv heads, twice per layer. The sum-of-squares accumulation in the same function was deliberately untouched, because reassociating it would change the norm and therefore the model. nd_model.c md5 1bcdb113cfb4. Host-proven byte-exact before the flash.","hypothesis":"Same as lane 2 but the smaller per-head version, where the row count per nd_parallel_rows call (14 heads) is small enough that the loop might genuinely be latency-exposed rather than hidden.","result":"decode 5.0483 = +0.032 % against the accepted 5.0467 - a null, one quantisation tick up. Bit-exact and gate-clean: DEVICE_GATE_OK 17/17, golden_missing=0, token_delta=0, fidelity 5.341e-05, top1 10/10. Monitors extended 4.975, think 3.95, prefill 5.3267, min_case 4.82, gen_tokens 99 - every one inside the campaign's measured 0.071 % board-spread band.","verdict":"REJECTED, not kept. Nothing entered the repo tree (verified: engine/src/nd_quant.c md5 b914e2703852, engine/ clean).","together_with_lane_2":"The two ZCRMS emits bracket the answer: the big one -0.13 %, the small one +0.03 %. Neither the element mass nor the row count made the difference, which is what rules out 'try a different unroll factor' - there is no exposed latency in this phase to buy. Recorded so nobody re-runs it at unroll 2 or 8.","next":"E37 on the Hadamard MLP's two remaining independent loops (d1*x scale over 768, p1 permutation gather over 1024), boards 2/3, host-verified byte-exact, live now. Board 1 is finishing the KV store unroll, the most likely of the family to pay because it removes a flash-mapped libc call (lrintf at 0x42013f48) per element."}}
