{"run":431,"commit":"2c79104","metric":5.3033,"metrics":{"boot_bench_tps":5.343,"device_output_exact":20,"device_token_delta":0,"ext_decode_tps":5.2269,"gen_tokens":99,"host_output_exact":19,"internal_free":13367,"logit_max_delta":0.00005341,"logit_top1_match":10,"min_case_tps":5.07,"prefill_tps":5.59,"psram_free":2052252,"think_tps":4.2},"status":"keep","description":"ACCEPTED: bundle5 = accepted+expbc+head4+taphoist+wfr+sigpair+tap2col+tapfwd+condT. New accepted runtime 5.3033 decode tok/s, +0.599 % over the previous accepted 5.1167 and +117.4 % over the 2.44 baseline. The device byte-exact gate PASSED: a full 20-case session on the canonical board gave device_output_exact=20, golden_missing=0, token_delta=0, LANE_RC=0, with prefill 5.59, extended 5.2269 (+3.66 % over the accepted 5.0423), think 4.20 (+5.3 %), boot_bench 5.343 (192 ms/token), min_case 5.07 (best worst case in 431 runs), gen_tokens 99, internal_free 13,367, psram_free 2,052,252. Cross-board: board 3 read 5.3033 and board 2 5.3017 on the same tree, so three boards agree within one quantisation tick. Host side on main after integration: checks.sh rc=0, 19/19 byte-exact, golden_missing=0, fidelity 5.341e-05 identical, top1 10/10. Components, each measured individually on this base and each below the 0.2 % bar alone - wfr +0.062 %, sigpair +0.125 %, tap2col +0.094 %, tapfwd +0.062 %, condT +0.196 % - and the bundle delivered +0.599 %, slightly MORE than the sum of its parts, which retires #371's 'the combination lever is spent' as base-dependent rather than general. Two invalid measurements refused this window, both mine: bundle6/sinkpair read +4.1 % and was discarded after reading my generator against its own guard (the guard tested the last-column bound, the candidate did not, so the pair read the next Sinkhorn row), and f16wfr was withdrawn before measurement.","timestamp":1790242274283,"segment":1,"confidence":20.691250903832238,"asi":{"accepted_evidence":"primary 5.3033 on board 1 (the gate session) AND board 3 (5.3033, identical), with board 2 at 5.3017 - three boards, one quantum apart, on three independent builds of one tree (engine hash 0c1a6272cd01). Full session: prefill 5.59, extended 5.2269, think 4.20, boot_bench 5.343, min_case 5.07, gen_tokens 99, device_output_exact=20 with golden_missing=0 and token_delta=0, internal_free 13,367, psram_free 2,052,252. Host side: 19/19 byte-exact, golden_missing 0, fidelity 5.341e-05 identical to the control, top1 10/10, checks.sh rc=0 on main after integration.","bundle5_components":"wfr (+0.062 %) exponent-scale bitcasts by register transfer; sigpair (+0.125 %) mixed-sign gate pairs keep the interleaved exp pair; tap2col (+0.094 %) two qkv-tap columns per iteration; tapfwd (+0.062 %) tap j=0 reads the current input instead of the history slot just copied; condT (+0.196 %) cond_v staged channel-major in place, 26.6 % cheaper cold. Sum of parts +0.539 %, bundle +0.599 % - the components slightly OVER-compose, which is what you expect when the bottlenecks are different stalls in the same loop.","composition_note":"Measured sum of the parts (+0.539 %) versus the bundle (+0.599 %): over-composition by +0.06 %, i.e. removing one stall makes another component's saving more visible rather than less. #371's conclusion that the combination lever was spent is now clearly base-dependent: it held once the phase-level ILP levers were exhausted, but the call/address/layout levers discovered since (#424 expbc, #427 taphoist, this run) each re-opened combinable mass.","invalid_measurement_caught":"The sinkpair lane read 5.5217 (+4.1 %), which is 25x anything the mechanism can buy (3,840 exps x ~20 cycles = +0.17 %). Cause found by reading my own generator against its guard: the standalone guard's paired branch tested `j + 1u < n` but the generator's did not, so at the last column of each Sinkhorn row the pair read the NEXT row, double-counted a term and skipped one - wrong, and fast because Sinkhorn's iteration count is unchanged while its work is not. The guard passed because the guard tested the correct shape. This is the #363/#398 class again (guard and candidate disagree), the reading is discarded rather than kept, and the lesson is to generate the candidate FROM the guarded text rather than transcribe it.","mechanism":"Five independent bit-exact mechanisms as one accepted change: register-transfer float bitcasts, mixed-sign gate pair coverage, two-column tap tiles, tap j=0 read forwarding, and a channel-major conditioning table.","next_action_hint":"1) Fix #exp70/#exp71's missing `j + 1u < n` guard, re-run the equivalence test and the HOST goldens on the actual bundle6 tree before any board, then re-measure. 2) make capture is owed on the new shipping image. 3) The console wedge is still real (bundle5 stalled at 16 and 17 cases on boards 3 and 2) but a clean full session is achievable, so keep the 20-case gate as the acceptance bar. 4) New pins: accepted engine hash 0c1a6272cd01, base decode 5.3033; gen_lane.sh/lane_one.sh defaults updated.","refused_or_rejected_this_window":"eghoist (engram tap-outer to register accumulation) -0.16 %; f16wfr (wfr at nd_f16's own bitcast) withdrawn before measurement because it needs the helper moved above nd_f16, which changes the measured wfr header hash, and it is worth +0.06..0.19 % alone.","payload":{"board2_decode":5.3017,"board3_decode":5.3033,"delta_over_accepted_pct":0.599}}}
{"run":432,"commit":"7b76365","metric":5.3033,"metrics":{"boot_bench_tps":5.343,"device_output_exact":20,"device_token_delta":0,"ext_decode_tps":5.2269,"gen_tokens":99,"host_output_exact":19,"internal_free":13367,"logit_max_delta":0.00005341,"logit_top1_match":10,"min_case_tps":5.07,"prefill_tps":5.59,"psram_free":2052252,"think_tps":4.2},"status":"keep","description":"sinkpair REJECTED and the library-call surface closed; make capture GREEN on the accepted image. Accepted runtime stays 5.3033 (the 5.3000 shown for the candidate is not kept; secondaries listed are the accepted run's own). (1) sinkpair - Sinkhorn's row/column log-sum-exp computing two adjacent exponentials through nd_expf_pair with the partials added sequentially - measured 5.3000 vs 5.3033 = -0.062 %, host 19/19 byte-exact with identical fidelity, so a clean speed verdict. Third independent confirmation of run #292's rule that a branch around nd_expf_pair costs more than the Horner latency it recovers; the exp-pairing family is finished. (2) The bounds bug that made the first version read a bogus +4.1 % is fixed and the fix is host-proven on the real tree before any board - the first version was validated only by a guard whose loop shape differed from the candidate's, which is the #363/#398 class. (3) Post-acceptance census of the accepted ELF (nm -u): the remaining per-token library calls are sinf/cosf (RoPE, once per token), logf (Sinkhorn, not substitutable), sqrtf/__divsf3 (measured at the floor) and 118 bulk memcpy sites - so the call-surface that produced expbc and wfr is exhausted. (4) make capture rc=0 with all nine behavioural flags on the accepted image, on board 2.","timestamp":1790243366939,"segment":1,"confidence":20.691250903832238,"asi":{"capture":"make capture is GREEN on the accepted image: CAPTURE_RC=0 on board 2 with all nine behavioural flags true (routes_match, tools_match, requests_succeeded, no_external_calls, local_has_two_passes, external_stops_at_selection, telemetry_progressed, sampling_interval_applied, timer_expired). The lane needed a script (.auto/lane_capture.sh) because `needle-board run N -- bash -c \"...$SERIAL_PORT...\"` expands the variable in the PANE's shell, which does not have it yet - the wrapper exports it for the command it execs - so the API received `--serial ''` and capture.py reported a connection refused that looked like a dead board.","census":"nm -u on the accepted engine objects, taken because expbc came from exactly this census. Remaining external references in nd_model.c.obj: __divsf3, cosf, expf, logf, lrintf, memcpy, memmove, memset, powf, sinf, sqrtf. Each traced to its site rather than assumed: sinf/cosf are RoPE once per token for the whole model (24 calls), powf is open-time only, logf is Sinkhorn's 1,280 and not bit-exactly substitutable (the exact-1 skip is +0.032 %), sqrtf/__divsf3 are at the measured floor (#338 ROM divide 7.95 cycles; inline TIE reciprocal refused), and the 118 memcpy/memmove sites are bulk after expbc. The per-token library-call surface that produced two shipped wins is measured exhausted - the next lever has to be loop structure or delivery, not a removed call.","discard_invalidation_check":"The acceptance does not revive any discard: the positive sub-bar levers rejected earlier are either now inside the accepted tree (sigmoidf_pair inline/ND_HOT via #371, fw3pair/fw3res subsumed by the shipped fw3foldnb, wfr/sigpair/tap2col/tapfwd/condT via this run) or measured nulls (+0.032 % unrolls), and a null does not become a lever by bundling. sinkpair itself is now a -0.062 % rejection, so it is not a bundle partner either.","hypothesis":"Sinkhorn's row and column log-sum-exp sweeps could overlap two nd_expf Horner chains per iteration the way the attention softmax does; the campaign's exp-pairing family said this should be worth something.","invalid_measurement_rechecked":"The corrected candidate was host-verified on the ACTUAL tree (checks.sh rc=0, host 19/19 byte-exact, golden_missing=0, fidelity 5.341e-05, top1 10/10) before the board, which is the discipline the first version skipped: it was validated by a standalone guard whose loop shape differed from the candidate's.","next_action_hint":"1) f16wfr is now cheap to prepare properly: the helper already exists in the accepted header, so the follow-up is to move it above nd_f16 and use it there - expected sub-bar (+0.06..0.19 %), and per this run's composition finding it is worth banking for the next bundle rather than discarding on a single reading. 2) The transform/exp/libm/tap/attention families are each closed with numbers; the remaining large phase masses (2-bit GEMV at 2.695 cyc/weight, attention head split, Hadamard MLP) have measured floors. 3) Accepted base for new lanes: engine hash 0c1a6272cd01, primary 5.3033, and lane_one.sh/gen_lane.sh defaults already carry it.","payload":{"board3_decode":5.3,"capture_rc":0,"delta_pct":-0.062}}}
{"run":433,"commit":"3da368d","metric":5.3033,"metrics":{"boot_bench_tps":5.343,"device_output_exact":20,"device_token_delta":0,"ext_decode_tps":5.2269,"gen_tokens":99,"host_output_exact":19,"internal_free":13367,"logit_max_delta":0.00005341,"logit_top1_match":10,"min_case_tps":5.07,"prefill_tps":5.59,"psram_free":2052252,"think_tps":4.2},"status":"keep","description":"Three nulls that close three standing questions; accepted runtime stays 5.3033 (+117.2 % over the 2.44 baseline). (1) f16wfr - nd_f16's own bitcast through the accepted nd_f32_from_bits helper, with the helper moved above nd_f16 - reads 5.3050 primary (+0.032 %, one quantum), extended 5.2315 (+0.09 %), think 4.20, boot_bench 5.345, internal_free 13,367 unchanged, device 19/20 with only the known order-dependent tail case. Codegen proves the mechanism happened (+50 wfr, 32 fewer ROM memcpy call sites, 118 -> 86) while the metric barely moved, which retires the conversion family at both ends: the remaining nd_f16 call sites are cold because head4 took the hot one. Banked as a zero-cost bundle partner, not kept. (2) silu4 - four-wide batching in silu_rows and agate_rows, host 19/19 byte-exact with identical fidelity - reads 5.3033, i.e. EXACTLY the accepted value: null. The mentor's premise (amortise a scale multiply) does not hold because sc is indexed per element, so four-wide removes loop control only. (3) The last unattributed block in the request path, the sampler's nd_model_logits_subset, is measured and dissolved: prep 0.092 ms + gather 0.027-0.075 ms per constrained sample = ~0.14 ms/token = 0.07 % of the token, while the same image's phase table still prints the old inflated 'logits4 6.5 ms 3.3 %' - run #344's cumulative-total-over-current-token artefact reproducing live. There was never 3.4 ms of hidden work there.","timestamp":1790245521528,"segment":1,"confidence":20.691250903832238,"asi":{"f16wfr":"decode 5.3050 vs 5.3033 = +0.032 % (one quantum), extended 5.2315 (+0.09 %), think 4.20 (equal), boot_bench 5.345 (+0.04 %), internal_free 13,367 (UNCHANGED - the header change costs no RAM), device 19/20 with the single divergence being the known order-dependent tail case. Codegen proof: +50 wfr and 32 fewer ROM memcpy call sites in nd_model.c.obj (118 -> 86). A consistent sign across four monitors but three quanta below the bar, so it is banked, not kept, and it is the cheapest bundle partner available if any future lever needs one.","hypothesis":"Silu and the attention gate were the last 2-way-batched elementwise loops; the mentor's reserve #2 argued four-wide batching would amortise the scale multiply, and the campaign's own #290 pairing win said the same family still had mass.","lg4_resolution":"Per-call split on the accepted code: prep 0.092 ms (65 % of the call - the embedding's nd_cq_prepare, i.e. the FWHT and scale, not the projection) and gather 0.027-0.075 ms, one constrained sample per decode token, so ~0.14 ms/token = 0.07 % of the token. The phase table on the SAME image still printed `logits4 6.5 ms 3.3 %`, which is run #344's cumulative-total-over-current-token-count artefact, live and reproducing. The block is therefore not unattributed and not 3.4 ms of hidden work: it was never there.","next_action_hint":"Phase-by-phase screening is complete at this base: every one of proj2bit, attention, Hadamard MLP, engram, phi, prepare/LUT, sampler (now including the subset projection), tap convolutions, Sinkhorn and the call surface has a measured floor and a number. What remains honest for this loop: (1) coverage/generalisation checks on unseen prompts, which is verification not a lever; (2) the owner packet for the new runtime; (3) f16wfr stays banked as a free-of-charge bundle partner. Do not re-screen a phase without naming which premise changed.","payload":{"boot_bench_candidate":5.345,"decode_f16wfr":5.305,"decode_silu4":5.3033,"ext_f16wfr":5.2315,"gather_ms_per_call":0.05,"prep_ms_per_call":0.092},"silu4":"decode 5.3033 - the accepted value to the digit, i.e. EXACTLY null, with prefill 5.59 and min_case 5.07 also unchanged. Bit-exact by construction (the same adjacent pairs go through the same sigmoidf_pair twice per iteration), host 19/19 and fidelity identical before the board. The mentor's premise for reserve #2 - that a scale multiply could be amortised - does not hold on this code shape: sc is indexed per element (c->sc[i]), so four-wide batching removes loop control only, and the loop control was not the cost. Reserve #2 closed by measurement rather than by argument.","two_negatives_worth_more_than_a_positive":"Both of this iteration's candidates were honest nulls and both retire a standing premise: the conversion family is now closed at both ends (expbc shipped, wfr shipped, f16wfr null), and the campaign's last large unattributed request-path number dissolved into a known timer artefact plus a measured 0.14 ms. The 5.3033 runtime now has every phase attributed to a measured floor."}}
{"run":434,"commit":"fbccf84","metric":5.3033,"metrics":{"boot_bench_tps":5.343,"device_output_exact":20,"device_token_delta":0,"ext_decode_tps":5.2269,"gen_tokens":99,"host_output_exact":19,"internal_free":13367,"logit_max_delta":0.00005341,"logit_top1_match":10,"min_case_tps":5.07,"prefill_tps":5.59,"psram_free":2052252,"think_tps":4.2},"status":"keep","description":"Call-surface census completed across every engine object; owner packet refreshed for the new runtime; accepted runtime stays 5.3033. (1) Off-device, no board: objdump call-relocation census of the accepted build. nd_model.c carries 114 memcpy / 64 __divsf3 / 28 nd_f16_slow / 22 sqrtf sites, nd_quant.c 16 memcpy + 10 nd_f16_slow, and sample/grammar/tokenizer/cact only bulk copies. Combined with f16wfr's measured price for removing that exact site class (32 sites removed = +0.032 %), the remaining sites cannot reach the bar by the campaign's own number rather than by argument - the library-call family is censused and priced, not assumed closed. (2) My first census printed zero everywhere because this build spells its relocations R_XTENSA_32, not R_XTENSA_IN32_PCREL/CALL16: a control value I knew had to be non-zero (nd_quant.c's 16 memcpy sites) is what proved the probe vacuous. (3) .auto/OWNER_ACCEPTANCE_PACKET.md rewritten - it still described the 5.1167 candidate A/B pair; it now states 5.3033 with its measured evidence, the six-lever table (five individually sub-bar), the families closed since, and the three owner-facing items. (4) silu4's device lane stalled in the tail with the known engine-independent console wedge after printing decode 5.3033, so its exactly-null verdict rests on the primary group, which is where it decided.","timestamp":1790245879465,"segment":1,"confidence":20.691250903832238,"asi":{"census_all_objects":"xtensa objdump R_XTENSA_* call relocations per accepted engine object: nd_model.c {memset 26, memcpy 114, __divsf3 64, sqrtf 22, nd_f16_slow 28, expf 10, lrintf 2, logf 4, powf 2, sinf 2, cosf 2, memmove 2}; nd_quant.c {memcpy 16, nd_f16_slow 10, sqrtf 4, __divsf3 4, memset 2}; nd_sample.c {memcpy 10, memset 6, memmove 2}; nd_grammar.c {memset 8}; nd_tokenizer.c {memcpy 8, memset 2, memmove 2}; nd_cact.c {memset 4, memcpy 4}. First attempt printed ZERO for all four because my regex only matched R_XTENSA_IN32_PCREL/CALL16 while this build emits R_XTENSA_32 - a sixth vacuous-probe instance this session, caught because a control value that must be non-zero (nd_quant.c's memcpy sites, previously counted at 16) came back empty.","discard_invalidation_check":"Nothing to retry. #425/#426's f16bc rejection (-0.190 % head4 absorbed it) is NOT revived by this census, because f16wfr measured the same site class just now at +0.032 %: the price-per-site is established, and 16 nd_quant.c sites at that price cannot reach the bar. sinkpair, eghoist, silu4 and condv16 all lost on measured speed, not on premises that changed.","hypothesis":"The library-call surface that produced two shipped wins (expbc, wfr) was censused only on nd_model.c.obj. If a per-element loop in nd_quant.c - dequant_row is 0.6 ms/token, 1,536 elements - still pays a ROM call per element, the same class might still have mass there.","next_action_hint":"With every phase floor and the call surface measured, the honest remaining work is (1) keep an occasional 20-case gate/soak on the accepted image only if a candidate needs it, (2) the three owner-facing items in the packet, (3) if a new archive or geometry lands, re-derive the phase map rather than reusing these numbers. Do not re-screen a closed phase without naming the changed premise.","payload":{"f16wfr_price_per_removed_site_pct":0.001,"nd_model_memcpy_sites":114,"nd_quant_memcpy_sites":16},"price_per_site_datum":"The census is now worth something because f16wfr put a measured price on removing that site class: 32 ROM call sites removed from nd_model.c.obj moved decode +0.032 %. So the remaining 16 nd_quant.c nd_f16 sites (the generic/dequant paths, ~1,536 elements/token through dequant_row) are worth at most ~0.02-0.09 % by the campaign's own measurement, not by arithmetic - below the bar, and it is why f16bc was correctly dropped at #426 rather than left as an open question.","research_payload":"Off-device this iteration, no board consumed by it: (1) full call-relocation census of every engine object in the ACCEPTED build (see census); (2) the owner acceptance packet rewritten for the new runtime - it had been describing the 5.1167 candidates A/B and would have misled the next window; it now states 5.3033 with its measured evidence, the six-lever table, the families closed since, and the three owner-facing items (console/command-path wedge narrowed to an outbound emission stall and reproduced on the accepted image, session-order-dependent tail goldens, and the two product defects). silu4's lane then died in the tail with the known engine-independent TimeoutError at the reconnect, so its verdict rests on the primary group, which is where it decided: exactly the accepted value."}}
