{"run":343,"commit":"8853ba2","metric":5.03,"metrics":{"prefill_tps":5.3067,"ext_decode_tps":4.956,"think_tps":3.94,"boot_bench_tps":5.076,"min_case_tps":4.8,"gen_tokens":99,"internal_free":14903,"psram_free":2052252,"device_output_exact":17,"device_token_delta":0,"logit_max_delta":0.00005341,"logit_top1_match":10,"host_output_exact":16},"status":"keep","description":"Experiment 26 - request-path phase harvest with the candidate count measured on the same image: MEASURED, no shipping change (decode_tps is the accepted 5.0300 carried forward from run #333, secondaries carried forward from that canonical run on an identical shipping tree; the only image built was the ND_PROFILE diagnostic on board 3, whose timers cost ~0.2 %, so its 5.02 is labelled and is not a speed result). This is the harvest run #341's own `next:` asked for: \"the request-path-only time (~2 %) is now unattributed ... harvest prof_dump on the CURRENT image for a tools request and a route request before writing another sampler or projection optimisation.\"\n\nMETHOD (two harness facts made this its own scripts, kept as .auto/prof_request.py + .auto/lane_prof.sh + .auto/prof_harvest.sh): measure.sh's log contains ONLY the boot-bench table, because serial_api.Device's complete() reads with _line_quiet() while the per-request EVT prof block is printed after EVT done - the request tables were being swallowed, not absent. The harvester attaches to an already-booted, already-primed board (no reflash, ~40 s), patches the reader to echo, and drives one tools and one route request through the real API call path. A candidate-count counter (kept as .auto/exp26/nstat.patch) went into the same image so n and the phase come from one boot.\n\nTABLE (board 3, batch 20260923T0200L; ms per token, one dump per request):\n  boot bench : whole block 158.7 (80.4 %), proj2bit 86.2, attn-stage 99.9, sample 0.0, logits4 0.0\n  tools (27 tok, 5.08 tps): whole block 176.0 (89.4 %), proj2bit 99.0, attn-stage 108.4, prep+lut 4.1, sample 4.5, logits4 3.8 | cands steps=26 rows=174 mean_n=6.7 max_n=68\n  route (14 tok, 4.79 tps): whole block 208.2 (99.8 %), proj2bit 110.8, attn-stage 132.5, prep+lut 4.6, sample 7.6, logits4 7.1 | cands steps=13 rows=45 mean_n=3.5 max_n=68\n\nWHAT IT SETTLES. (1) The device agrees with the host: mean_n = 6.7 (tools) / 3.5 (route), max 68, so run #341's host counting IS the device distribution and the sampler's n-scaled work stays closed. (2) The projection cannot be worth 3.8 ms: at the cycles/row this campaign measured for that same tensor and kernel in kbench (2,885,800 cycles / 512 rows two-core = 5,636 wall cycles/row), 6.7 rows is 37.8k cycles = 0.16 ms, and one nd_cq_prepare is ~0.22 ms (this table's own prep+lut 3.6 ms over ~16 calls). So ~3.4 ms of a 3.8 ms bracket - 1.7 % of a request token - is inside nd_model_logits_subset and is neither the rows nor the prepare by this table's own numbers. That is now the largest unattributed block in the token and the only lead above the bar; .auto/exp26/split_lg4.py (written this cycle) prints prepare and gather separately per call to localise it, and either answer is actionable: if the gather owns it, the once-per-token nd_parallel_rows wake (tiny work, worker possibly blocked, 100 Hz tick) is the suspect and running <=N rows serially on one core is bit-exact by construction because per-row order does not move; if the prepare owns it, the 4-bit pad/FWHT path is. (3) Sampler work that is NOT the projection = sample - logits4 = 0.7 ms (tools) / 0.5 ms (route), independently reproducing run #149's ~0.4 ms for piece lookups and byte walks.\n\nSECOND, INDEPENDENT CLOSURE FOUND WHILE CHECKING THE ABOVE - it kills a banked +1.4 % candidate for the price of two geometry facts: run #339's screen (put the subset gather on the TIE728 pair-LUT kernel: +97.68 % in isolation, \"worth ~+1.4 % if bit-exact\") compared the gather against a kernel that CANNOT compute the same function on this tensor. The embedding is 4-bit (run #340's differential probe: dims 8192x768 bits=4 group=128) and the pair table stores 16 entries per pair slot, which is exactly the combination count of a 2-bit pair; a 4-bit pair has 16x16 = 256 combinations, so no pair-LUT of this shape represents a 4-bit row. #339's 417/512 one-ULP \"mismatches\" were therefore a wrong-function comparison, and the 4-bit gather's only kernel lever is the plain-load row walker that already shipped for phi (#333) - at n=6.7 rows/token that prices at ~0.02 ms = +0.01 %, under the bar twice over (by n and by the 11 % kernel delta). Gather delivery is now closed four independent ways: residency (#340), tier pointer (#341), n (#341), kernel bit-width (this run).\n\nTree after: engine/ esp32/ host/ tools/ model/ = 0 lines different from the accepted runtime (diagnostics reverted; two patches + three harvester scripts kept under .auto). Pool: board 3 free after its lane's cooldown; boards 1/2 untouched.","timestamp":1790121801577,"segment":1,"confidence":19.910000000000018,"asi":{"hypothesis":"The ~2 % bench-to-request gap is unattributed now that the subset projection is measured at n~6.7 rows; harvest the per-request ND_PROFILE table on the current image for a tools and a route request and price what is left.","measured":"tools token: whole block 176.0 ms, sample 4.5 ms (logits4 3.8), proj2bit 99.0, attn-stage 108.4, mean_n 6.7; route token: whole block 208.2, sample 7.6 (logits4 7.1), mean_n 3.5","lead":"3.4 ms/token (1.7 %) inside the ND_P_LOGITS bracket that is neither the rows (0.16 ms) nor the prepare (~0.22 ms) by this table's own numbers; localise with .auto/exp26/split_lg4.py","closed_this_run":"run #339's +1.4 % gather-on-pair-LUT candidate is invalid: the embedding is 4-bit and a 16-entry pair table only encodes 2-bit pairs (4-bit needs 256 combinations), so that screen compared different functions","harness_fact_1":"measure.sh's log shows only the boot-bench table because serial_api complete() reads with _line_quiet() and swallows the per-request EVT prof block printed after EVT done - the tables were never missing, they were discarded","harness_fact_2":"PROF_FLAGS must carry each -D verbatim: a template that prefixes one -D to the whole string yields CMAKE_C_FLAGS=-DND_PROFILE=1 ND_SAMPLE_NSTAT=1 and the compile dies with linker input file not found; and a poisoned CMakeCache cannot be reconfigured around, so rm -rf the profiled build dir","harness_fact_3":"a lane that dies in ~10 s with a zero-byte log was not the measure.sh pipefail trap this time: idf.py is absent from PATH inside needle-board run N unless export.sh is sourced (instant 127 under set -e), so the lane script sources it","next":"apply .auto/exp26/split_lg4.py then .auto/lane_prof.sh on board 3 to split prepare vs gather per call; if the gather owns the 3.4 ms, test a serial (unsplit) small-n gather, which is bit-exact by construction","shipping_change":"none"}}
{"run":344,"commit":"dbc77fe","metric":5.03,"metrics":{"boot_bench_tps":5.076,"device_output_exact":17,"device_token_delta":0,"ext_decode_tps":4.956,"gen_tokens":99,"host_output_exact":16,"internal_free":14903,"logit_max_delta":0.00005341,"logit_top1_match":10,"min_case_tps":4.8,"prefill_tps":5.3067,"psram_free":2052252,"think_tps":3.94},"status":"keep","description":"Experiment 27 - two screens whose absence had already cost board time, both run in one kbench image on board 3, and both come back saying \"nothing here\" with numbers: MEASURED, no shipping change (decode_tps is the accepted 5.0300 carried forward; only a NEEDLE_KBENCH image ran, which by design never executes the request path - labelled, not a speed result).\n\nSCREEN 1, WAKE LATENCY, retires a candidate before it costs a board. `rows_dual_core()`'s comment in main.c has always said \"~15 us handshake\", and that number is what has kept small-split ideas off the table while also keeping them alive: `nd_cq_prepare` hands the splitter only ngroup = 8 groups of a 128-point FWHT, run #343 measured one prepare at 0.156 ms, and there are ~12-20 prepares per token, so if waking a *parked* worker cost a tick (this is a 100 Hz-tick build, 2.4 M cycles) then tens of small splits per token would be worth percent-scale. Measured directly, min of 15 rounds, trivial pure function, worker parked via vTaskDelay(3 ms) before the timed split: serial = 10 cycles, split (hot) = 33, split (parked) = 33, so **the wake is 23 cycles = 0.10 us and is identical hot and parked**, for units = 2, 4, 8, 16 and 64 alike. The ledger's 15 us was the cost of the work in the job it was measured on, not of the handshake. Consequence, stated so it cannot come back: the upper bound on \"run small jobs serially\" is 23 cycles x ~30 small splits = 690 cycles = 0.003 ms/token = **+0.001 %**, and the reverse play (lowering the threshold to split nrows = 2-3, which is the sampler gather at n <= 3) is bounded by +0.03 %. Neither is buildable against a 0.2 % bar, and the shipping `half < 2` is already generous. The candidate applicator is kept at .auto/exp27/apply_serial_threshold.py with that arithmetic in its docstring, and was deliberately never flashed.\n\nSCREEN 2, the banked multi-row differential, delivered and PASSING. Run #333's first integrated build of the 4-bit row walker diverged (device_output_exact 5/17, token_delta 175) while measuring *faster*, because `nd_gemv4_rows_tie1()`'s row epilogue re-stepped `packed`/`norms` that its word loop had already advanced a whole row, and the isolation screen called the kernel once per row where the *caller* does that stepping - so no single-row test could see it. `bench_rowrange()` now compares the range form against R single-row calls, row for row, on real archive bytes, both built through the same nd_gemv4_ctx layout the shipping dispatcher uses: **mismatch = 0 of 24 rows at chunk = 1, 12 and 24** (one row, a half split, a whole one-core sweep). By-product worth recording: `find_row4_tensor` resolves to the 4-bit *embedding* (out 8192, in_pad 768, ngroup 6, rowbytes 384), so the shipped 4-bit kernel is eligible for the sampler gather too - worth ~0.01 % at mean_n 6.7, which is why it stays unshipped.\n\nFLOOR RE-CHECK done on the same image's own numbers, closing the last two unpriced per-call costs: `nd_cq_lut_build` = 32,598 cycles = **13.6 us per call** (0.014 ms, an order below the 0.135 ms this ledger has been quoting) for 8 multiplies + 16 adds + 16 contiguous 64 B-line stores per pair, already split by pair range, i.e. ~2.1 cycles/op; and `nd_cq_prepare`'s 0.156 ms = 37.4k cycles against ~20k ops of copy + memset + FWHT(6 groups x 7 stages x 64 butterflies) + scale pass = ~2 cycles per op, with FWHT unroll already a measured null. Both are at the scalar floor, so `prep+lut` (3.6 ms/token of a 197 ms token) contains nothing collectable.\n\nTOGETHER WITH RUN #343 THIS MAKES THE TOKEN FULLY ATTRIBUTED: every phase has a measured mechanism behind it, and the ~1 % bench-to-request residue reconciles against per-call numbers (projection 0.23 ms + emit 0.10 ms + piece/argmax ~0.7 ms + longer context) instead of the retired 3.8/5.7 ms projection figures, which were timer-normalisation artefacts. Asset kept in the tree: bench_wake() + bench_rowrange() in esp32/main/kbench.c (kbench-gated, so a shipping configure never evaluates the branch; also saved as .auto/exp27/kbench-exp27.patch after an uncommitted-bench loss taught the rule that research code gets a patch file before any bulk `git checkout`).","timestamp":1790123695631,"segment":1,"confidence":19.910000000000018,"asi":{"hypothesis":"Two screens whose absence cost real board time: (1) what does a cross-core split actually cost when the worker is PARKED - rows_dual_core's comment says ~15 us and nd_cq_prepare splits only 8 FWHT groups, so if a parked wake were a tick, ~30 small splits per token would be worth a percent; (2) the multi-row differential for nd_gemv4_rows_tie1 whose absence cost run #333 its first build.","measured_wake":"KB WAKE: serial=10, split_hot=33, split_parked=33, wake=23 cycles for units=2,4,8,16,64. The handshake is 23 cycles (0.10 us), identical hot and parked, so the ledger's ~15 us comment is off by ~65x and is the hot-loop cost of the WORK, not the wake.","candidate_retired_off_device":"serial-for-small-jobs (ND_SPLIT_SERIAL_HALF): upper bound 23 cycles x ~30 small splits = 690 cycles = 0.003 ms/token = +0.001 %. Never build it. The shipping half<2 threshold is already generous, and LOWERING it (splitting nrows=2-3) is bounded by the sampler gather at n<=3, i.e. +0.03 %, also below bar. Patch kept as .auto/exp27/apply_serial_threshold.py with this arithmetic in its docstring so the idea cannot come back.","measured_rowrange":"KB ROWRANGE out=8192 in_pad=768 ngroup=6 rowbytes=384 chunk=1/12/24 mismatch=0/24 in every chunk size: the row-range kernel equals R single-row calls on real archive bytes. The banked test now exists and passes; note find_row4_tensor found the 4-bit EMBEDDING (out=8192, rowbytes=384 = 768 4-bit weights), so the shipping 4-bit kernel is also eligible for the sampler gather - still worth only ~0.01 % at mean_n 6.7.","floor_recheck":"lut build = 32,598 cycles = 13.6 us per call (0.014 ms, not 0.136 ms) at 2.1 cycles/op for 8 muls + 16 adds + 16 contiguous 64B-line stores per pair, already split by pair range; prepare's 0.156 ms = 37.4k cycles against ~20k ops of copy+memset+FWHT(6 groups x 7 stages x 64 butterflies)+scale pass = ~2 cycles/op. Both are at the scalar floor, and FWHT unroll is already a measured null, so the last two unpriced per-call costs in prep+lut are closed.","state":"every phase of the token now has a measured mechanism behind it; the request path reconciles at the 1 % level against per-call measurements (projection 0.23 ms, emit 0.10 ms), so the campaign's ~1 % bench-to-request residue is accounted and there is no unattributed budget left above the 0.2 % bar.","next":"attribute ND_P_ENGRAM (16.4 ms/token, 8.3 %, the largest phase not yet split per call) into gather vs its own 2-bit GEMVs vs conv, with the same per-call printf technique; the gather share is the only delivery-shaped mass in the map that the four gather closures (#340 tier, #341 n, #287 GDMA, #343 bit-width) did not directly measure.","shipping_change":"none - kbench.c is compiled only when NEEDLE_KBENCH is set, which no shipping configure does (run #330 verified the option branch is never evaluated); engine/ esp32/main/main.c unchanged"}}
{"run":345,"commit":"ccc61d3","metric":5.03,"metrics":{"prefill_tps":5.3083,"ext_decode_tps":4.9515,"think_tps":3.94,"boot_bench_tps":5.076,"min_case_tps":4.8,"gen_tokens":99,"internal_free":14903,"psram_free":2052252,"device_output_exact":19,"device_token_delta":0,"logit_max_delta":0.00005341,"logit_top1_match":10,"host_output_exact":19},"status":"keep","description":"Benchmark-integrity + product-correctness iteration: widened held-out coverage found a real firmware defect, and two harness defects. Metric UNCHANGED at exactly 5.0300 - kept for correctness, not speed, stated plainly. ADDED three extended prompts the suite never measured (252-byte tools prompt whose answer is 132 tokens, 224-byte route prompt, schema's interval lower bound); host goldens re-saved with 16/16 pre-existing entries byte-identical. My first comparison reported all 16 as changed - that was my own json.dumps forgetting sort_keys on one side (key order, not content), same check-integrity family as #296/#300. DEFECT 1 FIRMWARE, FIXED: the device silently truncated every answer at 128 generated tokens - MAX_NEW was the only limit - so the 132-token answer came back as JSON cut mid-key (...\"set_timer\",\"arguments\":{\"seconds\":300}},{\"n ) and bench.py parsed calls=[] / BAD incomplete_call, while the same prompt on the host engine produced a valid 132-token list. A truncated tool call is worse than a slow one because nothing says it happened. Fix: MAX_NEW is now a 256 backstop, the real bound is the model's own remaining context (max_seq_len - pos, which also stops a long primed prefix walking pos past the trained context), and either stop now prints ERR generation_truncated produced= bytes= reason=. VERIFIED on device: the same case returns three well-formed calls, 51 tokens, 5.030 tps. All pre-existing goldens are <= 99 tokens, which is why 300+ runs never touched this. DEFECT 2 HARNESS, FIXED: bench.py formatted r['decode_tps'] with :.3f while aggregates used 'or 0.0', so the first case ever to see no EVT done killed the suite with a TypeError mid-run, costing a golden save and every case after it. DEFECT 3 OPEN: at 22 cases the last answers come back mis-paired (a route prompt answered with tools-schema calls, which the route grammar forbids) then WARN think ack missing + TimeoutError - run #155's abandoned-extended-set signature reproduced at a larger suite, so it is a session-lifetime defect, not my quoting. The device golden was NOT saved (bench.py saves at the end and the crash preceded it), so the three new cases still compare against nothing on device: the pairing fix must land first.","timestamp":1790126321127,"segment":1,"confidence":19.910000000000018,"asi":{"candidate_tested_this_iteration":"widened held-out coverage (3 new extended prompt shapes) - and the defect it immediately found: a hard 128-token generation cap in main.c silently truncating long tool calls into invalid JSON","coverage_result":"no overfitting signature needed - the new shapes found three defects instead. Model behaviour notes: 'Sample telemetry every second' resolves to seconds=120 (the same default the free-text and ambiguous cases produce, so the schema's lower bound is never selected by natural language); 40000 -> 400 is a clamp; both now recorded in prompts.json notes as behaviour, and my invented expect for the 1-second case was wrong and was removed rather than left to fail","defect1_firmware":"MAX_NEW=128 was the only generation limit -> 132-token answer truncated mid-JSON, parsed as calls=[] / BAD incomplete_call on device while host produced a valid list. Fixed: backstop 256, real bound max_seq_len - pos, explicit ERR generation_truncated. Device now returns 3 valid calls for that case, 51 tokens, tps 5.030.","defect2_harness":"bench.py f-string formatted None decode_tps -> TypeError killed the whole suite mid-run (the aggregate lines already used `or 0.0`)","defect3_open":"the last device answers are mis-paired with their prompts (a route prompt answered with tools-schema calls, which the route grammar forbids) then 'WARN think ack missing' + serial_api TimeoutError = run #155's signature reproduced at a larger suite. Note the 252-byte prompt is UNDER the firmware's 271-byte silent-truncation limit, so that is not the cause. Next: reproduce with primary,extended only and check whether serial_api.complete() can consume a stale END from a previous long response, and whether phase is applied before the write.","hypothesis":"extended had been watched for 200+ runs and is no longer held out; adding genuinely unseen shapes (long prefill, long route, interval lower bound) either shows an overfitting signature or finds behaviour the suite cannot see","internal_heap_note":"internal_free 14903 and psram_free 2052252 read from the EVT ready line of this very run, so the main.c fix costs no memory","metric_meaning":"5.0300 is the unchanged accepted runtime: kept for a correctness fix with a metric-neutral measurement, not for a speed win","next":"fix the request/response pairing (likely an END drained from a previous response, or a phase applied after the write), then re-run AUTO_SAVE=1 to actually store the three device goldens, and re-read think_tps/boot bench which this crashed run never reached","primary_metric_unaffected_by":"the changed case is outside primary and no frozen generation exceeds 99 tokens; prefill moved 5.3067 -> 5.3083 (+0.03 % = one tick) and the boot bench was not re-measured because the run died in the think group","secondary_provenance":"prefill 5.3083, ext 4.9515 (13 cases), min_case 4.80, gen_tokens 99, internal_free 14903 and psram_free 2052252 (from this run's EVT ready line), host_output_exact 19/19 and device_output_exact 19/19 with zero DIVERGE/BAD lines are MEASURED this run; think_tps 3.94 and boot_bench 5.076 are carried from run #333 because the crashed run never reached the think group; fidelity 5.341e-05 / top1 10/10 come from the checks.sh that measure.sh ran and passed inside this run"}}
