{"run":59,"commit":"1bb71ca","metric":4.185,"metrics":{"boot_bench_tps":4.334,"device_output_exact":12,"device_token_delta":0,"ext_decode_tps":4.122,"gen_tokens":99,"host_output_exact":11,"internal_free":24047,"logit_max_delta":0.00005341,"logit_top1_match":10,"min_case_tps":3.99,"prefill_tps":4.5233,"psram_free":9916572,"think_tps":3.45},"status":"keep","description":"Plateau 4.185 tok/s. Measured and reverted the last GEMV-blocking idea: 2-row blocking of the generic 4-bit path (shared sweep of the prepared activation) is bit-exact but exactly neutral on every metric — xh already lives in L1, so the extra accumulator set buys nothing. Reverted to keep the tree minimal.","timestamp":1789833040089,"segment":1,"confidence":5.101843722563653,"asi":{"changed":"no code change kept (reverted to 1bb71ca)","control":"main-board 4.185 vs main-board 4.185 for the candidate; every secondary (prefill 4.5233, extended 4.122, think 3.45, boot bench 231 ms/tok) identical to four decimals","dead_end_note":"Blocking the GENERIC (4-bit) GEMV two rows per pass over the prepared activation is bit-exact (probe 5.341e-05, host 11/11, device 12/12) and exactly NEUTRAL on every metric including the boot bench. Combined with the LUT-path blocking (-5.1%) and the earlier 4-bit norm hoist (neutral), all row-blocking work in both GEMV flavours is closed: the 2-bit LUT path is hurt by extra live accumulators, the 4-bit path is indifferent because xh stays L1-resident. Reverted to keep the tree minimal.","hypothesis":"block the generic 4-bit GEMV two rows per pass so one sweep of the 3 KB prepared activation serves two output rows (bit-exact: dot_group calls and their order per row are untouched)","kept":"1bb71ca (revert of a5b46fc)","numbers":"plateau 4.185 tok/s on both control and candidate","quality":"device 12/12, host 11/11 byte-exact; probe 5.341e-05; prefix-isolation green","next_action_hint":"GEMV blocking in both flavours is measured out. Plateau is 4.185 tok/s and reproducible to 4 decimals; next cycles should be verification or genuinely different mechanisms (there are none left that do not touch quality)."}}
{"run":60,"commit":"1bb71ca","metric":4.185,"metrics":{"boot_bench_tps":4.334,"device_output_exact":12,"device_token_delta":0,"ext_decode_tps":4.122,"gen_tokens":99,"host_output_exact":11,"internal_free":24047,"logit_max_delta":0.00005341,"logit_top1_match":10,"min_case_tps":3.99,"prefill_tps":4.5233,"psram_free":9916572,"think_tps":3.45},"status":"keep","description":"Plateau re-verified at 4.185 tok/s. Three more candidates were rejected on the host before spending a flash: 128-bit group-slice loads (probe 41 — slices aren't 16-aligned), MALLOC_CAP_FAST for the tier (doesn't compile), and a 4-row blocked LUT walk (probe 32). The tree is minimal and every lever family is measured out.","timestamp":1789834928388,"segment":1,"confidence":5.419023935343496,"asi":{"changed":"no code change kept across these cycles (tree = 1bb71ca plateau)","control":"16+ consecutive readings at 4.185-4.187 tok/s; every secondary identical to four decimals","dead_end_note":"Three more host-rejected-before-flash candidates: (1) 128-bit block load of a row's group slice in the LUT GEMV -> probe max_delta 4.1 (group slices are NOT 16-byte aligned; the 4-byte aligned load is the widest legal read); (2) MALLOC_CAP_FAST for the tier -> does not even compile on IDF 5.5 (no such cap); (3) 4-row blocked LUT GEMV with byte-assembled words for rows 1..3 -> probe 32 (word assembly for the second row must re-read the aligned word, not shift). The fidelity probe keeps rejecting these for free.","hypothesis":"plateau re-verification cycle while probing the remaining untried micro-mechanisms (wider row loads, tier allocation class)","kept":"1bb71ca","numbers":"4.185 tok/s plateau; prefill 4.5233, extended 4.122, think 3.45, boot bench 231 ms/tok","quality":"device 12/12, host 11/11 byte-exact; probe 5.341e-05; python + prefix-isolation tests green","next_action_hint":"Nothing in the profile, the splitter, the GEMVs, the tier, or the load widths is left unmeasured. Treat 4.185 tok/s (+71.4%) as the converged result; use further cycles only for verification."}}
{"run":61,"commit":"d96a638","metric":4.185,"metrics":{"boot_bench_tps":4.334,"device_output_exact":12,"device_token_delta":0,"ext_decode_tps":4.122,"gen_tokens":99,"host_output_exact":11,"internal_free":24047,"logit_max_delta":0.00005341,"logit_top1_match":10,"min_case_tps":3.99,"prefill_tps":4.5233,"psram_free":9916572,"think_tps":3.45},"status":"keep","description":"Measured and reverted 64-bit row loads in the 2-bit LUT GEMV: bit-exact (probe unchanged) but 4.6% SLOWER (3.9933 vs 4.185 control) — the group start is 4 mod 8, so each 64-bit fetch splits into two word transactions on the LX7. The 32-bit packed load from run #26 is the measured optimum for this kernel. Plateau restored at 4.185.","timestamp":1789835571701,"segment":1,"confidence":5.892513097853646,"asi":{"changed":"reverted (d96a638) — plateau tree restored","control":"main-board control 4.185 immediately after the revert; candidate read 3.9933 on the same board","dead_end_note":"Wider row loads in the 2-bit LUT GEMV are measured dead: the 32-bit packed-word load (4 weights-pairs/word, kept since run #26) is the optimum. 64-bit loads are 4.6% slower (group start is 4 mod 8, so each 64-bit fetch splits into two word transactions and the LX7 pays for the split), and 128-bit block reads are illegal (slices are not 16-aligned). Also: my first two attempts at this kernel edit were broken by a C PRECEDENCE bug (T[128 + v & 15u] parses as T[(128+v)&15]); the host probe caught it both times before any flash was spent.","hypothesis":"halve the row stream's load count in the LUT GEMV with one 64-bit load per 32 weights (the 4-bit load path is the only traffic the kernel cannot avoid; accumulator assignment preserved so the result stays bit-exact)","kept":"d96a638 (revert)","numbers":"candidate 3.9933 tok/s (-4.6%) vs control 4.185; boot bench 242 vs 231 ms/tok; byte-exact 12/12 and 11/11, probe 5.341e-05 unchanged (so the loss is purely the load width, not numerics)","quality":"device 12/12, host 11/11 byte-exact; probe unchanged","next_action_hint":"The LUT GEMV's inner loop is now measured optimal in load width (32-bit), row blocking (1 row), row order (forward), table residency (already cache resident), and memory tier (PSRAM). Next cycles: verification only unless a structurally different mechanism appears."}}
{"run":62,"commit":"d96a638","metric":4.185,"metrics":{"boot_bench_tps":4.334,"device_output_exact":12,"device_token_delta":0,"ext_decode_tps":4.122,"gen_tokens":99,"host_output_exact":11,"internal_free":24047,"logit_max_delta":0.00005341,"logit_top1_match":10,"min_case_tps":3.99,"prefill_tps":4.5233,"psram_free":9916572,"think_tps":3.45},"status":"keep","description":"Plateau re-verified: 4.185 tok/s, all secondaries identical to four decimals. Reviewed the last two serial helpers (sinkhorn budget, engram slot dequant) — both already measured dead. No change taken.","timestamp":1789836476931,"segment":1,"confidence":6.456666666666676,"asi":{"changed":"no code change (tree = d96a638 plateau)","control":"20+ consecutive identical readings; the primary metric has not moved by more than 0.002 tok/s since the PSRAM tier","dead_end_note":"","hypothesis":"plateau re-verification cycle; also inspected the two remaining serial helpers (sinkhorn, engram slot dequant) and confirmed both are already measured dead (sinkhorn budget change vetoed on the fidelity probe; slot gather races on m->row/m->xh aliasing with only 24 KB internal RAM free)","kept":"d96a638","numbers":"4.185 tok/s, prefill 4.5233, extended 4.122, think 3.45, boot bench 231 ms/tok, internal_free 24047, psram_free 9.92 MB","quality":"device 12/12 byte-exact, host 11/11, probe 5.341e-05, prefix isolation + 10 python tests green (checks.sh runs them every cycle)","next_action_hint":"Treat 4.185 tok/s (+71.4% over the 2.44 baseline) as the converged result. Only forbidden (quality-changing) levers remain."}}
{"run":63,"commit":"d96a638","metric":4.185,"metrics":{"boot_bench_tps":4.334,"device_output_exact":12,"device_token_delta":0,"ext_decode_tps":4.122,"gen_tokens":99,"host_output_exact":11,"internal_free":24047,"logit_max_delta":0.00005341,"logit_top1_match":10,"min_case_tps":3.99,"prefill_tps":4.5233,"psram_free":9916572,"think_tps":3.45},"status":"keep","description":"Plateau re-verified at 4.185 tok/s (22nd consecutive identical reading). Tree clean, all quality gates green.","timestamp":1789837691561,"segment":1,"confidence":6.927478640969607,"asi":{"changed":"no code change (tree = d96a638, working tree clean and verified)","control":"22 consecutive readings of 4.185 tok/s with every secondary identical to four decimals","dead_end_note":"","hypothesis":"plateau re-verification cycle","kept":"d96a638","numbers":"4.185 tok/s; prefill 4.5233, extended 4.122, think 3.45, boot bench 231 ms/tok","quality":"device 12/12, host 11/11 byte-exact; probe 5.341e-05; python + prefix-isolation tests green","next_action_hint":"Converged. Only quality-changing (forbidden) levers remain; use further cycles for verification."}}
{"run":64,"commit":"d96a638","metric":4.185,"metrics":{"boot_bench_tps":4.334,"device_output_exact":12,"device_token_delta":0,"ext_decode_tps":4.122,"gen_tokens":99,"host_output_exact":11,"internal_free":24047,"logit_max_delta":0.00005341,"logit_top1_match":10,"min_case_tps":3.99,"prefill_tps":4.5233,"psram_free":9916572,"think_tps":3.45},"status":"keep","description":"Plateau re-verified at 4.185 tok/s. Reviewed prior discards for any whose assumptions the PSRAM tier changed (fold+SiLU combined worker was the candidate) — folding is inherently sequential FMA work, so no retry is warranted. No change taken.","timestamp":1789838161091,"segment":1,"confidence":7.4723531933133485,"asi":{"changed":"no code change (tree = d96a638)","control":"23 consecutive identical readings; noise floor ~0.002 tok/s","dead_end_note":"Checked the one discard whose assumption might have changed — the combined fold+SiLU gate worker (-0.4% pre-tier). Its failure mode was the serial cost of folding the conditioning scale row, and folding is per-element sequential FMA work with no independent split axis, so the PSRAM tier does not change its assumptions. Not retried.","hypothesis":"plateau re-verification; reviewed the split-lever history (runs 30-45) for any candidate whose rollback assumption the PSRAM tier invalidated — none found","kept":"d96a638","numbers":"4.185 tok/s plateau","quality":"device 12/12, host 11/11 byte-exact; probe 5.341e-05; tests green","next_action_hint":"Converged at 4.185 tok/s (+71.4%). Keep verifying; do not re-open measured-out levers."}}
{"run":65,"commit":"d96a638","metric":4.185,"metrics":{"boot_bench_tps":4.333,"device_output_exact":12,"device_token_delta":0,"ext_decode_tps":4.122,"gen_tokens":99,"host_output_exact":11,"internal_free":24047,"logit_max_delta":0.00005341,"logit_top1_match":10,"min_case_tps":3.99,"prefill_tps":4.5233,"psram_free":9916572,"think_tps":3.45},"status":"keep","description":"Plateau re-verified at 4.185 tok/s (25th identical reading). Closed the last open prepare-phase sub-idea by inspection: the copy/pad prologue is a <=3 KB memcpy per call and the FWHT body is already split by group. No change taken.","timestamp":1789838842335,"segment":1,"confidence":7.4723531933133485,"asi":{"changed":"no code change (tree = d96a638)","control":"25 consecutive identical readings of the plateau","dead_end_note":"Confirmed nd_cq_prepare's copy/pad prologue is genuinely tiny (memcpy of <=3 KB + one memset per call, 5 calls/token) and that its FWHT body is already split by group — the last open sub-idea in the prepare phase is closed without spending a flash.","hypothesis":"plateau re-verification cycle; closed the last open sub-idea in the prepare phase by inspection","kept":"d96a638","numbers":"4.185 tok/s; every secondary to four decimals","quality":"device 12/12, host 11/11 byte-exact; probe 5.341e-05; all repo tests green in checks.sh","next_action_hint":"Converged. Continue verification only."}}
{"run":66,"commit":"d96a638","metric":4.185,"metrics":{"boot_bench_tps":4.334,"device_output_exact":12,"device_token_delta":0,"ext_decode_tps":4.122,"gen_tokens":99,"host_output_exact":11,"internal_free":24047,"logit_max_delta":0.00005341,"logit_top1_match":10,"min_case_tps":3.99,"prefill_tps":4.5233,"psram_free":9916572,"think_tps":3.45},"status":"keep","description":"Plateau re-verified at 4.185 tok/s (27th identical reading). Also confirmed the prefix snapshot/restore memcpys run once per request, not per token — no per-token state churn to optimise.","timestamp":1789839301889,"segment":1,"confidence":7.4723531933133485,"asi":{"changed":"no code change (tree = d96a638)","control":"27 consecutive identical readings","dead_end_note":"Verified no per-decode-token snapshot/restore happens in the request loop (the prefix snap/restore memcpys run once per request at prefix restore, not per token). Closes the 'snapshot churn' idea raised while reading nd_model.c.","hypothesis":"plateau re-verification cycle","kept":"d96a638","numbers":"4.185 tok/s plateau; prefill 4.5233, extended 4.122, think 3.45, boot bench 231 ms/tok","quality":"device 12/12, host 11/11 byte-exact; probe 5.341e-05; tests green","next_action_hint":"Converged result: 4.185 tok/s (+71.4%). Verification only."}}
{"run":67,"commit":"d96a638","metric":4.185,"metrics":{"boot_bench_tps":4.334,"device_output_exact":12,"device_token_delta":0,"ext_decode_tps":4.122,"gen_tokens":99,"host_output_exact":11,"internal_free":24047,"logit_max_delta":0.00005341,"logit_top1_match":10,"min_case_tps":3.99,"prefill_tps":4.5233,"psram_free":9916572,"think_tps":3.45},"status":"keep","description":"Plateau re-verified at 4.185 tok/s (29th identical reading). Checked the transcendental helpers: sigmoidf_ is already the two-branch custom-exp form and every large call site is split. No change taken.","timestamp":1789839758801,"segment":1,"confidence":7.662857142857155,"asi":{"changed":"no code change (tree = d96a638)","control":"29 consecutive identical readings","dead_end_note":"Confirmed sigmoidf_ is already the two-branch nd_expf form (no libm call), and its three big call sites (SiLU 1024/layer, attention gate 768/layer, lane gates) are all two-core split. The transcendental path has no remaining cheap win that keeps bit-exactness.","hypothesis":"plateau re-verification cycle; last look at the transcendental helpers","kept":"d96a638","numbers":"4.185 tok/s plateau","quality":"device 12/12, host 11/11 byte-exact; probe 5.341e-05; tests green","next_action_hint":"Converged: 4.185 tok/s (+71.4%)."}}
{"run":68,"commit":"d96a638","metric":4.185,"metrics":{"boot_bench_tps":4.334,"device_output_exact":12,"device_token_delta":0,"ext_decode_tps":4.122,"gen_tokens":99,"host_output_exact":11,"internal_free":24047,"logit_max_delta":0.00005341,"logit_top1_match":10,"min_case_tps":3.99,"prefill_tps":4.5233,"psram_free":9916572,"think_tps":3.45},"status":"keep","description":"Plateau re-verified at 4.185 tok/s (31st identical reading). Confidence-pool weights already fp32-staged; phase measured ~0. No change taken.","timestamp":1789840214770,"segment":1,"confidence":7.863328822733429,"asi":{"changed":"no code change (tree = d96a638)","control":"31 consecutive identical readings","dead_end_note":"Checked the confidence-pool weights: probes are already staged fp32 at open (114K conversions/token avoided), and ND_P_CONF measured ~0 in the device profile. Nothing left there.","hypothesis":"plateau re-verification cycle","kept":"d96a638","numbers":"4.185 tok/s plateau; all secondaries to four decimals","quality":"device 12/12, host 11/11 byte-exact; probe 5.341e-05; tests green","next_action_hint":"Converged."}}
{"run":69,"commit":"d96a638","metric":4.185,"metrics":{"boot_bench_tps":4.334,"device_output_exact":12,"device_token_delta":0,"ext_decode_tps":4.122,"gen_tokens":99,"host_output_exact":11,"internal_free":24047,"logit_max_delta":0.00005341,"logit_top1_match":10,"min_case_tps":3.99,"prefill_tps":4.5233,"psram_free":9916572,"think_tps":3.45},"status":"keep","description":"Plateau re-verified at 4.185 tok/s (33rd identical reading). Gather kernel inspected — norm hoist and core split already in place. No change taken.","timestamp":1789840671249,"segment":1,"confidence":9.337439742903047,"asi":{"changed":"no code change (tree = d96a638)","control":"33 consecutive identical readings","dead_end_note":"Inspected the embedding gather kernel: the norm conversion is already hoisted per group and the ids loop is split across cores. No remaining non-blocked idea in it.","hypothesis":"plateau re-verification cycle","kept":"d96a638","numbers":"4.185 tok/s plateau","quality":"device 12/12, host 11/11 byte-exact; probe 5.341e-05; tests green","next_action_hint":"Converged."}}
{"run":70,"commit":"d96a638","metric":4.185,"metrics":{"boot_bench_tps":4.334,"device_output_exact":12,"device_token_delta":0,"ext_decode_tps":4.122,"gen_tokens":99,"host_output_exact":11,"internal_free":24047,"logit_max_delta":0.00005341,"logit_top1_match":10,"min_case_tps":3.99,"prefill_tps":4.5233,"psram_free":9916572,"think_tps":3.45},"status":"keep","description":"Plateau re-verified at 4.185 tok/s (35th identical reading). Confirmed cond_v and the qkv tap weights are already fp32-staged at open — the last fp16-staging suspicion is cleared. No change taken.","timestamp":1789841129846,"segment":1,"confidence":11.491760052735664,"asi":{"changed":"no code change (tree = d96a638)","control":"35 consecutive identical readings","dead_end_note":"Confirmed cond_v and the qkv tap weights are already fp32-staged in the open-time pool (SLOT list covers 4,5,6,14,25) — the last un-staged fp16 tensor suspicion is cleared.","hypothesis":"plateau re-verification cycle","kept":"d96a638","numbers":"4.185 tok/s plateau; all secondaries to four decimals","quality":"device 12/12, host 11/11 byte-exact; probe 5.341e-05; tests green","next_action_hint":"Converged: 4.185 tok/s (+71.4%)"}}
{"run":71,"commit":"703135b","metric":4.185,"metrics":{"boot_bench_tps":4.334,"device_output_exact":12,"device_token_delta":0,"ext_decode_tps":4.122,"gen_tokens":99,"host_output_exact":11,"internal_free":24047,"logit_max_delta":0.00005341,"logit_top1_match":10,"min_case_tps":3.99,"prefill_tps":4.5233,"psram_free":9916572,"think_tps":3.45},"status":"keep","description":"Plateau re-verified at 4.185 tok/s. Consolidated the duplicated ideas backlog into a single closed-ledger of every measured lever family (docs-only change).","timestamp":1789841622220,"segment":1,"confidence":11.952691121014718,"asi":{"changed":"docs only (.auto/ideas.md consolidated into a closed-ledger; no engine change)","control":"36 consecutive identical readings","dead_end_note":"","hypothesis":"plateau re-verification + housekeeping: collapsed the heavily duplicated ideas backlog into one closed-ledger of measured lever families","kept":"703135b","numbers":"4.185 tok/s plateau","quality":"device 12/12, host 11/11 byte-exact; probe 5.341e-05; tests green","next_action_hint":"Converged."}}
{"run":72,"commit":"703135b","metric":4.185,"metrics":{"boot_bench_tps":4.334,"device_output_exact":12,"device_token_delta":0,"ext_decode_tps":4.122,"gen_tokens":99,"host_output_exact":11,"internal_free":24047,"logit_max_delta":0.00005341,"logit_top1_match":10,"min_case_tps":3.99,"prefill_tps":4.5233,"psram_free":9916572,"think_tps":3.45},"status":"keep","description":"Plateau re-verified at 4.185 tok/s (38th identical reading). No change taken.","timestamp":1789842075065,"segment":1,"confidence":12.452142857142883,"asi":{"changed":"no code change (tree = 703135b)","control":"38 consecutive identical readings","dead_end_note":"","hypothesis":"plateau re-verification cycle","kept":"703135b","numbers":"4.185 tok/s plateau; all secondaries to four decimals","quality":"device 12/12, host 11/11 byte-exact; probe 5.341e-05; tests green","next_action_hint":"Converged: 4.185 tok/s (+71.4%)."}}
{"run":73,"commit":"703135b","metric":4.185,"metrics":{"boot_bench_tps":4.334,"device_output_exact":12,"device_token_delta":0,"ext_decode_tps":4.122,"gen_tokens":99,"host_output_exact":11,"internal_free":24047,"logit_max_delta":0.00005341,"logit_top1_match":10,"min_case_tps":3.99,"prefill_tps":4.5233,"psram_free":9916572,"think_tps":3.45},"status":"keep","description":"Plateau re-verified at 4.185 tok/s across two more cycles (40th reading). No change taken.","timestamp":1789842527443,"segment":1,"confidence":14.330456226880413,"asi":{"changed":"no code change","control":"40 consecutive readings in the 4.185-4.187 band","dead_end_note":"","hypothesis":"plateau re-verification cycle","kept":"703135b","numbers":"4.185-4.1867 tok/s; secondaries unchanged","quality":"device 12/12, host 11/11 byte-exact; probe 5.341e-05; tests green","next_action_hint":"Converged."}}
{"run":74,"commit":"703135b","metric":4.185,"metrics":{"boot_bench_tps":4.334,"device_output_exact":12,"device_token_delta":0,"ext_decode_tps":4.122,"gen_tokens":99,"host_output_exact":11,"internal_free":24047,"logit_max_delta":0.00005341,"logit_top1_match":10,"min_case_tps":3.99,"prefill_tps":4.5233,"psram_free":9916572,"think_tps":3.45},"status":"keep","description":"Plateau re-verified at 4.185 tok/s (42nd reading). No change taken.","timestamp":1789842981604,"segment":1,"confidence":16.87608906098742,"asi":{"changed":"no code change","control":"42 consecutive identical readings","dead_end_note":"","hypothesis":"plateau re-verification cycle","kept":"703135b","numbers":"4.185 tok/s plateau","quality":"device 12/12, host 11/11 byte-exact; probe 5.341e-05; tests green","next_action_hint":"Converged. Sampling path and every engine phase have been inspected or measured; no untried non-forbidden lever remains."}}
