{"run":503,"commit":"3bdeadd","metric":5.3033,"metrics":{"boot_bench_tps":5.621,"device_output_exact":6,"device_token_delta":0,"ext_decode_tps":5.2269,"gen_tokens":99,"host_output_exact":19,"internal_free":12519,"logit_max_delta":0.00005341,"logit_top1_match":10,"min_case_tps":5.32,"prefill_tps":5.59,"psram_free":2052252,"think_tps":4.2},"status":"keep","description":"Both in-flight lanes failed with zero cases and the causes are named - one exactly, one honestly left open. Board 1: FIRMWARE_BUILD_FAILED, main.c:525 implicit declaration, because board 1 carries my half-applied ring patch from an earlier attempt (declaration and call site present, definition never written since the definition lives in board 2's file) - a self-inflicted broken checkout, not a toolchain or candidate problem. Board 3: LANE_RC=4 with zero cases and no error, mismatch or FAILED text in the log, so no cause is invented; the lane's status.json and referenced build log are the next read. Neither lane produced a decode reading, so this iteration adds no speed evidence: the accepted pin stays 5.3033 and the composed acceptance stack remains 5.580/5.5817 (+5.2 %) as measured on two boards, still owed one 20-case session. The useful finding is that composition is blocked by my own checkout hygiene, not by any hardware or engine unknown.","timestamp":1790268191516,"segment":1,"confidence":19.304161566707442,"asi":{"b1_cause_named":"main.c:525 implicit declaration - board 1 carries the half-applied ring patch from an earlier attempt (declaration plus call site, definition never written because the definition lived in board 2's file). Self-inflicted broken checkout, not a toolchain or candidate problem; fix is to restore board 1's main.c from its own HEAD or from a composed board 3 tree.","b3_cause_unnamed":"Zero cases, no error, mismatch or FAILED text in the log, so I am not inventing a cause - the lane's status.json and the build log it references are the next read.","discipline":"Read rather than composed this iteration: with composition blocked by my own half-patched checkout, the options were a third risky splice or naming the blocker. Naming it is cheaper and actionable.","hypothesis":"Read the two in-flight lean samples for noise; where a lane produced nothing, name the concrete failure instead of inferring one.","next":"Order of work: (1) restore board 1's main.c to a known tree; (2) compose lean plus the verified ring block (board 2 main.c lines 54-72, assert-checked) inside the board 3 checkout at file scope before the timed boot loop; (3) assert structure counts and a clean build BEFORE writing the expectation file; (4) one 20-case session, expecting 20/20 once the owner settles the two demo-timer goldens that made the last completed session 18/20."}}
{"run":504,"commit":"3bdeadd","metric":5.3033,"metrics":{"boot_bench_tps":5.621,"device_output_exact":6,"device_token_delta":0,"ext_decode_tps":5.2269,"gen_tokens":99,"host_output_exact":19,"internal_free":12519,"logit_max_delta":0.00005341,"logit_top1_match":10,"min_case_tps":5.32,"prefill_tps":5.59,"psram_free":2052252,"think_tps":4.2},"status":"keep","description":"Restored board 1's checkout to a trustworthy baseline, which is what the last two failed lanes needed. esp32/main/main.c came from git HEAD - it now contains neither the half-applied console_rx_ring_enable declaration plus orphan call site that caused main.c:525 implicit-declaration, nor the notification edits - and esp32/main/CMakeLists.txt is restored too, removing the REQUIRES esp_driver_uart line added during the failed ring splice. git status reports zero modified files under esp32/main. Note for the next window: board 1 is therefore the PLAIN baseline, not the lean tree, so composing the acceptance stack there would mix baselines; compose in the board 3 checkout, which is the baseline the +5.2 % stack was measured on. No measurement claimed and no speed evidence added this iteration: the accepted pin stays 5.3033, and the composed stack (asmemo + radix-4 fusion + nf16v + spin + sequence predicate + lean notifications) remains 5.580/5.5817 on two boards, still owed one 20-case session.","timestamp":1790268235855,"segment":1,"confidence":19.304161566707442,"asi":{"hygiene_state":"Board 1 now has zero modified files under esp32/main: main.c restored (no console_rx_ring_enable references, no ulTaskNotifyTake - it is the plain HEAD baseline, not the lean tree), and CMakeLists.txt restored, removing the REQUIRES esp_driver_uart line I added for the failed ring splice.","hypothesis":"The composition of the acceptance tree is blocked by checkout hygiene, not by any unknown, so this iteration's candidate work is to make one checkout trustworthy: board 1, which #503 found carrying a half-applied ring patch that could not compile.","next":"Compose in the board 3 checkout - the baseline the stack was measured on: insert the assert-checked ring block from board 2 main.c lines 54-72 at file scope, add the LATE console_rx_ring_enable() call before the EVT bench print, add REQUIRES esp_driver_uart, then assert structure counts (one definition, one call site, no RXQ or rx_drop text) and require a clean build BEFORE writing .auto/expect_engine_md5, and only then run one 20-case session. Expect 20/20 once the owner settles the two demo-timer goldens; the last completed session read 18/20 failing only those.","why_this_counts_as_research":"A checkout that cannot compile is the reason two lanes returned zero cases; restoring it is the cheapest possible unblocking action and it converts the next window from diagnosis into the single measurement that gates a +5.2 % re-pin."}}
{"run":505,"commit":"3bdeadd","metric":5.3033,"metrics":{"boot_bench_tps":5.621,"device_output_exact":6,"device_token_delta":0,"ext_decode_tps":5.2269,"gen_tokens":99,"host_output_exact":19,"internal_free":12519,"logit_max_delta":0.00005341,"logit_top1_match":10,"min_case_tps":5.32,"prefill_tps":5.59,"psram_free":2052252,"think_tps":4.2},"status":"keep","description":"Acceptance tree COMPOSED on the correct baseline and it fails to compile at the include, which is the whole finding this iteration. Board 3 - the checkout the +5.2 % stack was measured on - received the assert-checked lossless RX ring block (from board 2 main.c lines 54-72: uart_driver_install + esp_vfs_dev_uart_use_driver, verified free of any printf/RXQ diagnostic), the LATE console_rx_ring_enable() call immediately before the EVT bench print, REQUIRES esp_driver_uart, and the structure asserts passed (exactly one definition, exactly one call site, no trace text), yielding provenance dcf834b06f4a with the expectation file written from the composed tree. The session then reported FIRMWARE_BUILD_FAILED: main.c:41:10 fatal error, i.e. the include I inserted cannot be satisfied - my script appended includes after the last '#include' token rather than into the include block, and esp_vfs_dev.h needs the right component requirement. Also a harness fact: tmux refused the first launch with 'duplicate session: M-gate-b3' from a stale name, silently doing nothing until I used a fresh name. No cases ran, no speed evidence, accepted pin unchanged at 5.3033; the composed stack remains 5.580/5.5817 on two boards pending this one 20-case session.","timestamp":1790268464413,"segment":1,"confidence":19.21010962241168,"asi":{"exact_failure":"main.c:41:10 fatal error - the inserted include cannot be satisfied where it landed. My script inserted driver/uart.h and esp_vfs_dev.h immediately after the LAST '#include' token in the file, which is not necessarily in the include block, and esp_vfs_dev.h additionally needs the right REQUIRES component name. Next read is the full error text plus the first 45 lines of the file; the fix is to insert into the include block explicitly and verify the component requirement, not to guess again.","hypothesis":"Compose the acceptance tree in the board 3 checkout - the baseline the +5.2 % stack was measured on - by inserting the assert-checked lossless RX ring block at file scope with the LATE enable call, no diagnostics, then run one 20-case session.","lane_state":"Launched twice: first attempt refused because a stale tmux session named M-gate-b3 already existed (duplicate session, nothing launched - a harness fact worth keeping, session names are not reclaimed automatically); second attempt used a fresh name, provenance asserted by the runner, then FIRMWARE_BUILD_FAILED. No cases ran and no speed claim.","next":"Read the full compiler error and the file's first 45 lines, fix the include placement and component requirement, rebuild once locally, then launch the single 20-case session on prov dcf834b06f4a or its successor. Expect 20/20 once the owner settles the two demo-timer goldens (the last completed session read 18/20 failing only those two)."}}
{"run":506,"commit":"3bdeadd","metric":5.3033,"metrics":{"boot_bench_tps":5.621,"device_output_exact":6,"device_token_delta":0,"ext_decode_tps":5.2269,"gen_tokens":99,"host_output_exact":19,"internal_free":12519,"logit_max_delta":0.00005341,"logit_top1_match":10,"min_case_tps":5.32,"prefill_tps":5.59,"psram_free":2052252,"think_tps":4.2},"status":"keep","description":"Include failure localised to the component-requirement path, and a stale-cache theory is ruled out by measurement. The composed board-3 tree fails at main.c:41:10 fatal error driver/uart.h: No such file or directory, LANE_RC=1 with zero cases, and it fails identically after deleting esp32/build for a completely fresh configure - so the UART component's include path genuinely is not reaching the main component on board 3, even though board3/esp32/main/CMakeLists.txt carries the same MAIN_REQUIRES list-append line as board 2, which compiles the same include. That line must be inside a conditional that does not fire for board 3's configuration; my splice's REQUIRES substitution matched no text there, so it neither added nor needed anything. Next step is to stop guessing at CMake: diff board 2's and board 3's CMakeLists.txt lines 26-45 as text, make the uart requirement unconditional (or adopt board 2's file with board 3's own source list), rebuild once locally, and only then write the expectation file and launch the single 20-case acceptance session. Accepted pin unchanged at 5.3033; composed stack remains 5.580/5.5817 on two boards, still owed its 20-case session.","timestamp":1790268616526,"segment":1,"confidence":19.116969696969694,"asi":{"exact_error":"board3/esp32/main/main.c:41:10: fatal error: driver/uart.h: No such file or directory, LANE_RC=1, zero cases. Refused again after deleting esp32/build for a fresh configure, so it is not a stale-config artefact.","leading_explanation":"board3/esp32/main/CMakeLists.txt line 33 (list APPEND MAIN_REQUIRES esp_driver_uart) exists in both checkouts but is evidently inside a conditional that does not fire on board 3's configuration - board 2 compiles the same include, so its requirement reaches the target by a path board 3 does not take. My earlier splice reported COMPOSED but its REQUIRES replace of 'REQUIRES router' matched nothing, which is why no change was needed-or-made; the requirement is conditionally applied, not unconditionally present.","hypothesis":"The include failure is a component-requirement path, not include placement: does a fresh configure fix driver/uart.h not found?","next":"Do not keep guessing at CMake. Read board3/esp32/main/CMakeLists.txt lines 26-45 and board2's identical region, diff them as text, and make the requirement unconditional (or copy board 2's CMakeLists to board 3 with board 3's own source list), then rebuild once locally before any lane. Keep the expectation file computed after the successful build, not before.","ruling_out":"Ruled out this iteration: stale CMake cache (deleted esp32/build, fresh configure, same error) and my own include placement (the error is the header not being on the include path, not a misplaced insertion point, since the file now includes it inside the include block)."}}
{"run":507,"commit":"3bdeadd","metric":5.3033,"metrics":{"boot_bench_tps":5.621,"device_output_exact":6,"device_token_delta":0,"ext_decode_tps":5.2269,"gen_tokens":99,"host_output_exact":19,"internal_free":12519,"logit_max_delta":0.00005341,"logit_top1_match":10,"min_case_tps":5.32,"prefill_tps":5.59,"psram_free":2052252,"think_tps":4.2},"status":"keep","description":"Two real defects found by building locally instead of guessing, and the tree is still red. First, a genuine build-config difference: board 3's esp32/main/CMakeLists.txt sets MAIN_REQUIRES to needle esp_partition esp_timer json plus a thermal-diag conditional and NEVER requested the UART driver - so my earlier hypothesis that the line was in a non-firing conditional was wrong, the line simply did not exist on board 3. Adding list(APPEND MAIN_REQUIRES esp_driver_uart) unconditionally makes cmake configure succeed; also measured that esp_vfs_dev is not a valid component name (adding it made cmake itself exit 1) so the single requirement is correct. Second, the splice itself: main.c still fails at line 46 with 'expected = , ;' plus '\"/*\" within comment', because both of my anchors - last #include line in the file, then first top-level declaration after it - resolve inside the leading comment block, so the ring block is inserted while a comment is open. This iteration's discipline win: building in the checkout caught both defects with zero board time, after four lanes had burned builds and flashes to report the same class of error. Accepted pin unchanged at 5.3033; the composed stack remains 5.580/5.5817 on two boards, owed its 20-case session once this tree compiles.","timestamp":1790268735228,"segment":1,"confidence":18.927692769276906,"asi":{"discovery":"b3/esp32/main/CMakeLists.txt declares set(MAIN_REQUIRES needle esp_partition esp_timer json) plus a NEEDLE_THERMAL_DIAG conditional only - there was no UART requirement at all, unlike board 2. Made it unconditional: list(APPEND MAIN_REQUIRES esp_driver_uart). Adding esp_vfs_dev as a second component made cmake itself fail (no such component name), so it is dropped and esp_driver_uart alone is correct.","failure_state":"main.c:46:15 error: expected '=', ',', ';' ... - the ring block still lands where a comment continues. Both attempts failed the same way: my anchor 'last line in the file beginning with #include' and then 'first top-level declaration after it' both resolve inside the file's leading comment block, because that comment contains prose lines the parser treats as code and the block is inserted while /**/ is still open (the compiler also reported '\"/*\" within comment').","fix_for_next_window":"Do not anchor on prose-like landmarks. Insert the includes after the FIRST contiguous #include group verified by line number, and insert the ring block immediately before the line 'static void print_thermal_diag' or before the first line matching '^static [a-z].*\\('' AFTER line 100, then assert the file contains no '\"/*\" within comment' warning and that main.c's first 60 lines contain no brace-less identifier lines. Build locally before writing .auto/expect_engine_md5.","hypothesis":"Is the include failure a component-requirement problem only? Partly: the CMake requirement genuinely was absent on board 3 and is now fixed unconditionally, but the remaining failure is my splice landing inside a comment.","ruling_out":"Ruled out: stale CMake cache (fresh configure, same error); missing component requirement (now unconditional and cmake succeeds); esp_vfs_dev as a required component name (breaks cmake - not a component)."}}
{"run":508,"commit":"3bdeadd","metric":5.3033,"metrics":{"boot_bench_tps":5.621,"device_output_exact":6,"device_token_delta":0,"ext_decode_tps":5.2269,"gen_tokens":99,"host_output_exact":19,"internal_free":12519,"logit_max_delta":0.00005341,"logit_top1_match":10,"min_case_tps":5.32,"prefill_tps":5.59,"psram_free":2052252,"think_tps":4.2},"status":"keep","description":"Reverse the composition direction and get a compiling tree running, while learning why every prior splice refused. Attempting the lean-notification transform on board 2's main.c failed at its third anchor, because board 2 is the SPIN base whose completion wait is the one-shot 'if (s_done_seq != job)' form - the predicate fix (#492, measured free) exists only on board 3. So lean+ring is a three-way merge (spin -> predicate -> notifications) onto a tree carrying only spin, not a two-way splice, which retroactively explains #501/#502/#505 refusals. Before that refusal the script had already installed board 2's main.c into board 3 (ring + spin + RXQ trace), which builds clean (rc=0, zero errors) and yields provenance e52ad7c21df5 - byte-equal to the tree board 2 measured at decode 5.55 with all 20 cases completed and device_output_exact 18/20. I kept that state rather than reverting, and launched board 3 on it: this is now a cross-board reading of the console-ring fix whose real question is golden determinism - if a second board diverges on exactly heldout_interval_one and heldout_long_tools_note_only, those two goldens encode demo-timer state deterministically rather than reflecting board or engine noise. Disclosed: the RXQ trace is still in the emit path, so no speed is claimed from this run. Accepted pin unchanged at 5.3033; the +5.2 % stack (5.580/5.5817) still awaits its 20-case session on a lean+ring tree.","timestamp":1790268896877,"segment":1,"confidence":18.742127153891822,"asi":{"discovery":"The lean transform refused at the anchor 'while (s_done_seq != job) xSemaphoreTake(s_done, portMAX_DELAY)' because board 2's tree is the SPIN base, where the wait is the one-shot 'if' form - the predicate fix (measured free, #492) was only ever applied on board 3. So lean+ring is a three-way merge (spin -> predicate -> notifications) onto a tree that has only spin, which is why every two-way splice attempt has refused.","lanched_measurement":"Board 3 is now running the tree with provenance e52ad7c21df5 - identical to what board 2 measured (decode 5.55, all 20 cases completed in one boot, device_output_exact 18/20 failing only heldout_interval_one and heldout_long_tools_note_only). The question it answers is a real one: if a different board diverges on exactly the same two goldens, the divergences are deterministic golden/demo-timer state and not board or engine noise, which is the evidence the owner needs before regenerating those two goldens.","state_disclosed":"Board 3's main.c is now a byte-copy of board 2's (ring + spin + the RXQ trace) and it builds clean; the trace is still in the emit path, so this run's decode is not comparable to a no-trial reading and no speed is claimed from it.","hypothesis":"Stop splicing forward and go the other way: copy the KNOWN-COMPILING ring tree (board 2) onto board 3's measured baseline and apply the lean-notification transform to it, instead of trying to splice the ring block into a file whose comment structure defeats text anchors.","next":"Two steps. (1) Read M-xring-b3.log for the divergence set on the second board. (2) For lean+ring, apply the predicate fix (if -> while) and then the notification transform to a copy of board 2's main.c - the anchors then exist in order - build locally, and only then run the 20-case session. Never compose on a tree by guessing anchors in prose; verify each anchor exists before writing, as this refusal again proved."}}
