{"run":612,"commit":"307aadc","metric":5.6117,"metrics":{"boot_bench_tps":5.658,"device_output_exact":6,"device_token_delta":0,"ext_decode_tps":5.5177,"gen_tokens":99,"host_output_exact":19,"internal_free":8415,"logit_max_delta":0.00005341,"logit_top1_match":10,"min_case_tps":5.35,"prefill_tps":5.925,"psram_free":2052252,"think_tps":4.39},"status":"keep","description":"Corrected recipe A is now verified as a real successor rather than a repeat of #608's mistake. Independent objdump of the live B2 image at provenance 9e658137ba25 (fresh build 20:50:12) shows four separate old_oh*rescale mul.s at 4037c0e2/e8/f1/fd followed by two ordered madd.s per cell, a four-wide hardware loop and no stack spills in the loop body - i.e. the shipped rounding graph with the two output-memory passes merged, which is exactly what recipe A set out to do. The explicit __builtin_fmaf form achieved that with no inline asm, so the host build compiles the same expression and its 19/19 byte-exact golden is real arithmetic evidence. Its benchmark is still running on board 2 and is left alone; no decode value is claimed yet. Board 3's tree hash is re-verified at 61861dd9886c because my attempt to apply recipe C died on an unterminated here-document before writing anything - trusting a patch script that failed mid-write is the same provenance error as #597, so the hash is the claim. Next launches: recipe B on board 1 (one V load reused across two query heads with per-head order preserved and a scalar fallback for an odd head range) and recipe C on board 3 with the two recorded extraction fixes. Pin unchanged at 5.3033.","timestamp":1790283109539,"segment":1,"confidence":10.876543209876548,"asi":{"hypothesis":"Independent target-graph verification of the corrected recipe A before its number is read.","graph_verified":"Mentor's objdump of the fresh B2 ELF at provenance 9e658137ba25 (built 20:50:12) shows four separate old_oh*rescale mul.s at 4037c0e2/e8/f1/fd, then two ordered madd.s per cell, a four-wide hardware loop, and no stack spills in the loop body. That is the shipped rounding graph with the two memory passes merged - the defect that killed #608 (a mul.s folded into a different contraction) is gone, and the explicit __builtin_fmaf form is what fixed it without any asm.","lane_status":"A3's benchmark on board 2 is live and untouched (no decode line yet). Boards 1 and 3 are idle and clean at 61861dd9886c.","own_error_recorded":"My attempt to write recipe C's patch died on an unterminated here-document, so the python never ran and board 3's tree is unchanged - verified by hash rather than assumed. Truncating a patch script mid-write and believing the tree is patched is the same provenance class as #597; the hash check is what keeps it from becoming a false claim.","queued":"B1 gets recipe B (one V load reused across two query heads, per-head QK/max/exp order preserved, scalar fallback for an odd head range). B3 gets recipe C with the two known extraction fixes: declare the head-owned helper AFTER tap_ctx/tap_cols, and drop the leftover 'const tap_ctx *c = (const tap_ctx *)vc;' from the extracted tap_cols, calling tap_cols once over [h0*hd, h1*hd). No further A barrier work and no unchanged control.","pin":"5.3033 owner's; A3 not yet read, so no speed claim."}}
{"run":613,"commit":"8640bb5","metric":5.6467,"metrics":{"boot_bench_tps":5.691,"device_output_exact":6,"device_token_delta":0,"ext_decode_tps":5.5177,"gen_tokens":99,"host_output_exact":19,"internal_free":8415,"logit_max_delta":0.00005341,"logit_top1_match":10,"min_case_tps":5.38,"prefill_tps":5.9583,"psram_free":2052252,"think_tps":4.39},"status":"keep","description":"Harvest of the finished A3 lane (no re-run): board 2 read decode 5.6467 tok/s against its own 5.6117 seed pin = +0.624%, device 6/6 restricted-exact, token delta 0, missing 0, LANE_RC=0, provenance 9e658137ba25, log /root/board-pool/batches/M-a3-b2.log. Mentor's objdump of that exact image already proved the arithmetic graph (separate rescale mul.s then two ordered madd.s per cell, four-wide hardware loop, no loop-body spills) - measured single-board speed candidate on the merged output pass, NOT the accepted shipping image (stays 5.3033 / bundle5 2c79104). Source snapshotted to /root/board-pool/preserved/a3-9e658137ba25/ (md5 529cd651dd10 + diff) before any worker edit. ext_decode_tps/think_tps are PROVENANCE=seed-only values (5.5177/4.39 from seed gate #589), NOT A3 measurements - A3's extended/think are owed by the full-breadth run now queued. Host evidence for A3 itself: 19/19 byte-exact, fidelity 5.341e-05, top1 10/10.","timestamp":1790288682438,"segment":1,"confidence":10.991083676268866,"asi":{"hypothesis":"A3 = defer the online-softmax rescale into the P.V loop with explicit __builtin_fmaf per V term, four-wide, preserving the shipped mul.s-then-two-madd.s rounding graph; merges two oh[] memory passes into one.","board":"2, own seed pin 5.6117, provenance 9e658137ba25","status_now":"single-board measured win, unaccepted; ext/think listed here are seed values not A3 readings; quality breadth + cross-board confirmation outstanding","next_action_hint":"board2 full-group gate under the one documented repeat allowance (AUTO_ALLOW_REPEAT=1 + reason; signature 6307a0127014 already in measured_shipping_signatures); expect 18/20 rc=1 on the two frozen heldout cases - report, do not move the oracle","source_snapshot":"/root/board-pool/preserved/a3-9e658137ba25/","lanes_now":"B1=recipe B head-shared V loads, B3=recipe C fused Q tap+norm+RoPE, both prechecking"}}
{"run":614,"commit":"8640bb5","metric":5.6417,"metrics":{"boot_bench_tps":5.696,"device_output_exact":6,"device_token_delta":0,"ext_decode_tps":5.5177,"gen_tokens":99,"host_output_exact":19,"internal_free":5343,"logit_max_delta":0.00005341,"logit_top1_match":10,"min_case_tps":5.38,"prefill_tps":5.9583,"psram_free":2052252,"think_tps":4.39},"status":"keep","description":"Recipe B (board 1): two HEADS share each staged V load inside one position pair. The QK/max/denom/exp substep runs per head in shipped order; then one dimension loop loads vf0/vf1 once and updates both disjoint oh[] arrays, each head keeping its own rescale sweep (independent do_rs flags; a non-rescaling head sweeps with 1.0f, which is exact) and its own term0-then-term1 order per cell. Two cells wide, not a duplicated four-wide body, per mentor's register-pressure warning. Host checks rc=0 with host_lines_same=19 byte-exact BEFORE any flash. Device: 5.6417 vs this board's 5.6117 seed pin = +0.533%, device 6/6, token delta 0, missing 0, LANE_RC=0, provenance e403eed2e822. CAUTION: internal_free fell 8415 -> 5343 (-3072 B) from the duplicated odd-head fallback + pair code; the full gate on this tree and a cross-board screen on board 2 are running now. Not accepted; shipping stays 5.3033.","timestamp":1790289149615,"segment":1,"confidence":10.991083676268866,"asi":{"hypothesis":"B: pair query heads so each staged V value is read once for two heads; per-head rounding order untouched.","board":"1, own seed pin 5.6117, provenance e403eed2e822","heap_warning":"internal_free 5343 vs 8415 seed; B1 full gate running to check breadth + heap floor","next":"board2 cross-board screen of the same source; if both positive and heap holds, A3+B composition becomes the measured complementary pair to test","seed_ext_think_note":"ext 5.5177 / think 4.39 are seed provenance values until B's gate finishes"}}
{"run":615,"commit":"8640bb5","metric":5.6183,"metrics":{"boot_bench_tps":5.659,"device_output_exact":6,"device_token_delta":0,"ext_decode_tps":5.5177,"gen_tokens":99,"host_output_exact":19,"internal_free":8415,"logit_max_delta":0.00005341,"logit_top1_match":10,"min_case_tps":5.35,"prefill_tps":5.9333,"psram_free":2052252,"think_tps":4.39},"status":"discard","description":"Recipe C (board 3): full Q tap/norm/RoPE ownership in one head-range callback. tap_cols factored out of tap_rows with explicit [lo,hi) and FULL dim (never a fake dim=48); qhead_rows = tap slice -> zcrms_head_range -> rope_heads_range; both documented extraction fixes applied (helpers defined after tap_ctx/tap_cols; no leftover tap_ctx cast inside tap_cols); K/V paths untouched. Host checks rc=0, host_lines_same=19 byte-exact before flash. Device: 5.6183 vs this board's own seed pin 5.6133 = +0.089%, device 6/6, token delta 0, rc=0, provenance 9f3b8411f95c. Below the acceptance bar (single reading, sub-quantum-plus-a-hair; #608's norm+RoPE-only slice read -0.029%). DISCARDED: joining Q's serial RoPE and its tap dispatch onto both cores buys nothing measurable. This is the C measurement mentor asked for - the earlier small run never tested Q taps; now it has been.","timestamp":1790289167023,"segment":1,"confidence":10.991083676268866,"asi":{"hypothesis":"C: one nd_parallel_rows callback owns a Q-head range through tap (real dim=576 context, tap_cols over [h0*48,h1*48)), then norm, then RoPE - replacing two dispatches plus serial RoPE; history copy hoisted to a single full-row memcpy.","board":"3, own seed pin 5.6133, provenance 9f3b8411f95c","verdict":"below acceptance bar; RoPE/tap dispatch joining has no measurable payoff on the spin handshake","next":"board 3 freed for the A3 cross-board confirmation (exact preserved A3 source, md5 529cd651dd10); C source recipe is documented in this entry so it can be recreated without re-deriving","closure":"per-head tap+norm+rope join = closed at +0.089%; do not retry with different unit counts - the mechanism measured is the dispatch saving itself"}}
{"run":616,"commit":"8640bb5","metric":5.6467,"metrics":{"boot_bench_tps":5.691,"device_output_exact":18,"device_token_delta":52,"ext_decode_tps":5.5538,"gen_tokens":99,"host_output_exact":19,"internal_free":8415,"logit_max_delta":0.00005341,"logit_top1_match":10,"min_case_tps":5.38,"prefill_tps":5.9583,"psram_free":2052252,"think_tps":4.41},"status":"keep","description":"A3's mentor-authorized full 20-case quality-breadth gate (board 2, one documented repeat allowance, signature 6307a0127014, reason recorded by the runner): decode 5.6467 reproduced exactly, EXTENDED 5.5538 (seed 5.5177, +0.65%), THINK 4.41 (seed 4.39, +0.46%), primary 6/6, boot 5.691, heap 8415 unchanged, missing 0. Device 18/20 rc=1: the SAME two frozen heldout cases as the seed gate #589 (heldout_interval_one, heldout_long_tools_note_only) with the SAME token_delta=52. Reported, not waived, oracle untouched, no AUTO_SAVE. A3's quality profile is therefore indistinguishable from the seed's except the known pair - i.e. it inherits the unresolved failure, adds no new one, and improves ext/think.","timestamp":1790289183508,"segment":1,"confidence":10.991083676268866,"asi":{"failure_set":"heldout_interval_one (27->19 tok) and heldout_long_tools_note_only (19->63 tok) - identical case names and identical token_delta=52 as seed gate #589","hypothesis":"A3 full breadth: does the merged output pass change quality beyond the seed's known 18/20?","mentor_rule":"known two fail -> report, do not move the oracle, no AUTO_SAVE, no waiver","oracle_delta":"A3 ext +0.0205 abs vs seed, think +0.02 abs - improvements, not regressions; failures are the pre-existing frozen pair, not new","next":"cross-board confirmation on board 3 running now (M-a3x-b3); board 2 now holds recipe B for its cross-board screen"}}
{"run":617,"commit":"a3e1f5b","metric":5.6433,"metrics":{"boot_bench_tps":5.697,"device_output_exact":18,"device_token_delta":52,"ext_decode_tps":5.5554,"gen_tokens":99,"host_output_exact":19,"internal_free":5343,"logit_max_delta":0.00005341,"logit_top1_match":10,"min_case_tps":5.39,"prefill_tps":5.9583,"psram_free":2052252,"think_tps":4.41},"status":"keep","description":"Recipe B full 20-case quality-breadth gate on board 1 (one documented repeat allowance, reason recorded by the runner): decode 5.6433 (primary screen 5.6417 reproduced within one quantum), EXTENDED 5.5554 (seed 5.5177 = +0.68%; also above A3's 5.5538), THINK 4.41 (seed 4.39), device 18/20 rc=1 with the SAME two frozen heldout failures and identical token_delta=52 as the seed gate #589 and A3's gate - reported, not waived. Heap 5343 held through the whole run incl. think mode: the -3072 B code-size cost is real but did not destabilise anything. min_case 5.39, boot 5.697. B is now measured on two boards (+0.53%) with full breadth equal to the seed's quality profile; only the composed A3+B screen and its confirmation stand between B and an acceptance proposal.","timestamp":1790289667056,"segment":1,"confidence":10.991083676268866,"asi":{"breadth":"ext 5.5554 now the best measured extended reading (beats A3's 5.5538); think 4.41 matches A3","failure_set":"same two frozen heldout cases as seed #589 / A3 gate; token_delta 52 identical","heap_risk":"internal_free stable at 5343 through full run incl. think mode; -3072 B vs seed is a code-size cost of pair+fallback, no runtime failure seen","hypothesis":"B full 20-case quality-breadth gate (used the one documented repeat allowance after the primary screen burned the signature)","next":"composed A3+B screen running on b1 (engine 01daf46c7982); b3 running B full gate for cross-board breadth; if composed positive, b3 becomes the composed confirmation board"}}
{"run":618,"commit":"a3e1f5b","metric":5.62,"metrics":{"boot_bench_tps":5.664,"device_output_exact":6,"device_token_delta":0,"ext_decode_tps":5.5554,"gen_tokens":99,"host_output_exact":19,"internal_free":5087,"logit_max_delta":0.00005341,"logit_top1_match":10,"min_case_tps":5.35,"prefill_tps":5.9333,"psram_free":2052252,"think_tps":4.41},"status":"discard","description":"Composed A3+B (pv_pair2_a3: two heads share V loads AND each head's rescale fuses into the same loop with explicit fma, four-wide, host 19/19 byte-exact before flash) measures 5.62 on board 1 = +0.147% vs its 5.6117 pin, i.e. -0.38% BELOW recipe B alone on the SAME board (5.6417) and far below A3 alone. Composition destroys the win. objdump of the live image: zero loop-body FP stack traffic (spill theory wrong) but 142 branch insns - the per-cell doA?/doB? selects became in-loop branches, unlike A3's hoisted single branch or B's hoisted sweep; per-cell branching on the rescale flag is the poison. REJECTED as a form. Both parts stay individually strong; a future composition must hoist the flag test OUT of the cell loop (4 loop variants or 2 with a safe pair-never-rescale fallback). Heap fell again (5087) consistent with the larger inlined function.","timestamp":1790289882252,"segment":1,"confidence":10.991083676268866,"asi":{"hypothesis":"Composed A3+B: pair heads (B) AND fuse each head's rescale into the shared loop with explicit fma (A3) in one four-wide pv_pair2_a3 body.","board":"1 (own pin 5.6117). B alone on this board = 5.6417; A3 alone = 5.6467-class on b2/b3.","mechanism_evidence":"objdump of the live b1 image: attn_heads has ZERO si.f/li.f stack traffic but 142 branch insns and only 43 madd.s - the per-cell doA?/doB? selects became branches inside the unrolled body, unlike A3's standalone hoisted branch and B's hoisted sweep. Spill theory ruled out.","mentor_rule_proven":"measure separate candidates before composing; composition here destroyed a complementary-looking win - additive percentage estimates would have been wrong by ~4x","next_action_hint":"b2 running B4W (paired body at 4-cell width, engine 51ea5246142e, host green); b3 finishing B full gate; b1 revert to seed next window","rollback_reason":"-0.38% vs B alone on the same board; the two fusions contend for the same 16 FP registers/branch structure, they are not composable in this form"}}
{"run":619,"commit":"9f8c2d1","metric":5.6433,"metrics":{"boot_bench_tps":5.696,"device_output_exact":18,"device_token_delta":52,"ext_decode_tps":5.5554,"gen_tokens":99,"host_output_exact":19,"internal_free":5343,"logit_max_delta":0.00005341,"logit_top1_match":10,"min_case_tps":5.39,"prefill_tps":5.9583,"psram_free":2052252,"think_tps":4.41},"status":"keep","description":"Recipe B full 20-case gate on board 3 (fresh signature; no repeat allowance spent): decode 5.6433 = +0.534% vs b3's own 5.6133 pin, matching its b1 gate reading 5.6433 exactly. EXTENDED 5.5554, THINK 4.41, device 18/20 rc=1 with the SAME two frozen heldout failures and token_delta 52 on BOTH boards - B's quality profile is now cross-board-identical to the seed's (minus the known pair), on hardware whose seed pin is different. min_case 5.39, boot 5.696, heap 5343 again stable through think. B is fully characterized: two boards, screens 5.6417/5.6417, gates 5.6433/5.6433, ext +0.68%, think +0.46%, byte-exact host 19/19, no new failures. Same disposition as A3: measured candidate pending the owner's acceptance decision (seed's own 18/20 still blocks shipping either way).","timestamp":1790289951660,"segment":1,"confidence":10.991083676268866,"asi":{"breadth":"ext/think identical to b1's gate to the 4th digit (5.5554/4.41) - B's breadth reproduces exactly across boards","failure_set":"same two frozen heldout cases, token_delta 52 - identical failure fingerprint on both boards","hypothesis":"Recipe B full 20-case gate on board 3 (fresh signature, no allowance needed) as cross-board quality confirmation","next":"b2 B4W screen running; b1 gets composed-v2 (hoisted flag dispatch, retry of #618 with the named poison fixed); b3 restore to seed 61861dd9886c as the confirmation board","why_kept":"cross-board breadth confirmation of the B candidate line, not a new primary claim (5.6433 == b1 gate reading)"}}
{"run":620,"commit":"9f8c2d1","metric":5.6967,"metrics":{"boot_bench_tps":5.739,"device_output_exact":6,"device_token_delta":0,"ext_decode_tps":5.5554,"gen_tokens":99,"host_output_exact":19,"internal_free":5343,"logit_max_delta":0.00005341,"logit_top1_match":10,"min_case_tps":5.45,"prefill_tps":6.0167,"psram_free":2052252,"think_tps":4.41},"status":"keep","description":"B4W - recipe B's paired-head V-sharing body at the shipped four-cell width instead of the two-cell width chosen from the register-pressure warning - reads 5.6967 on board 2 vs its 5.6117 pin = +1.516 %, the session's largest candidate gain, device 6/6 token delta 0 missing 0 rc=0, every primary case up (min_case 5.45 vs 5.38, prefill 6.0167 vs 5.9583, boot 5.697+). Host checks 19/19 byte-exact before flash. The mentor's narrow-start assumption ('two cells to limit register pressure') was wrong: four-wide pairing beats two-wide by +0.98 % on the same board and beats A3 (5.6467) by +0.88 %. Now confirmed on b3 (screen) and gated on b2 (full 20-case, allowance used) in parallel.","timestamp":1790290139218,"segment":1,"confidence":11.162551440329223,"asi":{"hypothesis":"B4W: recipe B's paired-head shared-V body at the shipped FOUR-cell width. The 2-cell width was mentor's register-pressure guess and had never been measured; objdump-checked concern about spills did not materialise (heap identical 5343, rc=0).","board":"2, own pin 5.6117, provenance 51ea5246142e","margin":"+1.516% vs pin; +0.88% over A3 on the same board - largest single-candidate gain of the session","next":"b3 screen + b2 full gate running now; if confirmed, B4W displaces A3/B as the acceptance proposal; composed-v2 (pair+rescale fusion at 4-wide, hoisted flags) is queued on b1 (engine 114c679790d8)","caveat":"single screen so far; cross-board + gate pending before any acceptance language","source":"/root/board-pool/preserved/b1-recipeB/nd_model.c.b4w md5 12e36b116902"}}
{"run":621,"commit":"9f8c2d1","metric":5.6983,"metrics":{"boot_bench_tps":5.744,"device_output_exact":6,"device_token_delta":0,"ext_decode_tps":5.5554,"gen_tokens":99,"host_output_exact":19,"internal_free":5343,"logit_max_delta":0.00005341,"logit_top1_match":10,"min_case_tps":5.45,"prefill_tps":6.0167,"psram_free":2052252,"think_tps":4.41},"status":"keep","description":"B4W cross-board confirmation on board 3: 5.6983 vs its own 5.6133 pin = +1.516 %, byte-identical source (engine 51ea5246142e) to board 2's 5.6967 (+1.516 %) - the margin reproduces exactly on different silicon. Device 6/6, token delta 0, missing 0, rc=0, min_case 5.45-class again. B4W is now a two-board confirmed +1.5 % candidate, ~2.4x A3's margin and ~2.8x B's, still at heap 5343 with host 19/19 byte-exact. Awaiting the b2 full-breadth gate (ext/think/20-case) and composed-v2 before proposing it for acceptance.","timestamp":1790290287655,"segment":1,"confidence":11.168038408779154,"asi":{"hypothesis":"B4W cross-board screen: does the four-wide paired-head V-sharing win reproduce on different silicon with a different pin (5.6133)?","board":"3, engine 51ea5246142e, source md5 12e36b116902 (identical to b2's run)","margin_reproduction":"b2 +1.5162% vs b3 +1.5163% - the margin reproduces to within 1 quantum; readings 5.6967/5.6983 are the tightest cross-board pair of the session","next":"b2 full gate finishing (allowance used); b1 composed-v2 screen finishing; b3 next runs B8W (eight-cell paired body, v_hd=64 = 8x8 exact, no tail) to test whether the width effect continues","caveat":"gate breadth (ext/think/device 20) still pending before acceptance proposal"}}
