{"run":601,"commit":"3a91185","metric":5.6117,"metrics":{"boot_bench_tps":5.658,"device_output_exact":18,"device_token_delta":52,"ext_decode_tps":5.5177,"gen_tokens":99,"host_output_exact":19,"internal_free":8415,"logit_max_delta":0.00005341,"logit_top1_match":10,"min_case_tps":5.35,"prefill_tps":5.925,"psram_free":2052252,"think_tps":4.39},"status":"keep","description":"Propagated the hardened harness to every worker and verified it executes there. All three boards now carry the hardened .auto/measure.sh (restricted-run device byte-exact gate, DEVICE_OUTPUT_DIVERGED_RESTRICTED) - confirmed by finding the new label in all three files - plus .auto/checks.sh with the seed-equivalence stage and .auto/exp87/test_seed_equiv.c. The verification that matters: ran checks.sh inside board 2's own checkout and it came back green through the new stage (host_lines_same=19, FIDELITY steps=10 vocab=8192 max_delta=5.341e-05 top1=10/10), so the guard builds and passes on a worker rather than only in main. This is the difference between a check existing and a check running: lanes execute in worker checkouts, so main-only fixes are the same illusion as #597's wrong-cwd candidate patch. No board time used (host build inside checks.sh only). Pin unchanged at 5.3033; the seed stack stays fully evidenced and owner-gated, and no known candidate at this stack clears the 0.2 pct bar.","timestamp":1790279936985,"segment":1,"confidence":10.871056241426617,"asi":{"hypothesis":"Propagate the hardened harness to the workers, because each worker runs its OWN .auto/measure.sh and .auto/checks.sh - main carrying the fix means nothing to a lane that executes in a worker checkout (the exact provenance trap this ledger recorded at #597).","propagated":"Hardened measure.sh (restricted-run device gate) to all three boards, verified present in each; .auto/checks.sh plus .auto/exp87/test_seed_equiv.c to all three, then actually ran checks.sh inside board 2's checkout: green, host_lines_same=19 and fidelity 5.341e-05 / top1=10/10, so the new guard builds and passes on a worker, not just in main.","why_this_matters_more_than_it_looks":"Without this, a lane on a worker would still be report-only on byte-exactness and blind to the seed-equivalence class, i.e. the two things the last three iterations exist to fix. Running the guard in the worker's tree is the positive control - installing a check and never executing it is how #359 and #530 happened.","next":"Boards free and harness-uniform. Owner-gated acceptance remains the blocker for the seed stack; no performance candidate above the 0.2 pct bar is known at this stack.","cost":"No board time, no build of the firmware; host build inside checks.sh only."}}
{"run":602,"commit":"746a27f","metric":5.6117,"metrics":{"boot_bench_tps":5.658,"device_output_exact":18,"device_token_delta":52,"ext_decode_tps":5.5177,"gen_tokens":99,"host_output_exact":19,"internal_free":8415,"logit_max_delta":0.00005341,"logit_top1_match":10,"min_case_tps":5.35,"prefill_tps":5.925,"psram_free":2052252,"think_tps":4.39},"status":"keep","description":"Recorded the campaign's state and this window's closures in .auto/ideas.md and committed, rather than manufacture another sub-bar screen. Content: the measured stack (acceptance tree 4d3094578050 at 5.5767/5.5783/5.5800 on three boards, plus the first-W8D seed = provenance 61861dd9886c at 5.6117 on two boards, +0.627 % and +0.599 % against each board's own clean control, 18/20 with only the two boot-state demo goldens failing on all three boards, extended 5.5177, think 4.39, prefill 5.925, min_case 5.35, capture green, host 19/19, fidelity 5.341e-05) with the pin deliberately still the owner's 5.3033; the re-derived phase map (proj2bit 80.7 ms = 45.6 % of a ~177 ms profiled block, attention 33.4, hadamard 21.7, engram 15.2, sinkhorn 3.0) and the observation that the dominant phase's share rose while its absolute cost fell; five measured closures added this window (split granularity, caller spin budget, fused prepare+LUT joins, lutb_rows live ranges both directions, cold-path fw_scale) plus two off-device pricings (+0.005 % and +0.05 %); the explicit reopen condition for each closed family; and the gate state including the rule that an add from +0.0 is not a move for -0.0 or signaling NaNs. No board time used.","timestamp":1790280019836,"segment":1,"confidence":10.871056241426617,"asi":{"does_anything_get_revived":"No. Nothing this window invalidates a prior rollback: the four revivals the spin handshake made legitimate (split granularity, caller spin budget, fused prepare+LUT joins, LUT live ranges) were all actually run and measured at zero or slightly negative on the new base, so their assumptions were re-tested and their conclusions survived. The two unrun candidates with a changed assumption - the de-split variant and the condv16 retry - remain unrun for stated reasons: the first has the opposite predicted sign post-spin, the second's premise depends on a conversion cost the f16bc line of work already changed and would be measured against the wrong base.","hypothesis":"Persist the campaign's state at 5.6117 - the newly closed axes, the reopen condition for each closed family, and the gate state - so a future window does not re-derive them or mistake a closed family for an untested one.","why_no_board":"Every cheap candidate is priced under the 0.2 pct bar and every family with mass has a measured closure or an owner gate, so the alternative to recording state is manufacturing a screen, which this ledger has already identified as the failure mode (#246-#285, #302-#304).","closures_recorded":"split granularity neutral, caller spin budget zero, fused prepare+LUT zero, lutb_rows live ranges -0.090/-0.060, cold-path fw_scale zero-by-construction, 4-bit per-group seeding +0.005, tie1n per-row reseed +0.05. Plus the reopen conditions: 2-bit delivery, attention algorithm, kron saturation, and the observation that four independent scheduling levers now measuring zero is itself the evidence.","key_rule_preserved":"An add from +0.0 is not a move: it differs for -0.0 and for every signaling NaN. That is the durable content of the seed proof and it is enforced by checks.sh on every lane.","next":"Coverage recipe (#467) is the next substantial non-narration item: four pre-validated held-out shapes already exist and the extended set has been watched for 200+ runs, so it is in danger of being in-distribution. It must run as one atomic sequence because prompts plus host goldens plus a device AUTO_SAVE session have to land in a single commit - committing the prompt addition alone would leave device_golden_missing non-zero and make measure.sh refuse every subsequent lane. That is why it was not started inside this iteration."}}
{"run":603,"commit":"746a27f","metric":5.6117,"metrics":{"boot_bench_tps":5.658,"device_output_exact":18,"device_token_delta":52,"ext_decode_tps":5.5177,"gen_tokens":99,"host_output_exact":19,"internal_free":8415,"logit_max_delta":0.00005341,"logit_top1_match":10,"min_case_tps":5.35,"prefill_tps":5.925,"psram_free":2052252,"think_tps":4.39},"status":"keep","description":"Launched the third independent board reading of the proposed image: board 3 now carries the exact seed stack (.S md5 3a2e522e3f38, tree hash recomputing to provenance 61861dd9886c - byte-identical to what boards 1 and 2 measured at 5.6117) and is screening its primary group against that board's own clean 5.58 acceptance reading. This completes the speed evidence shape for the proposal rather than adding a duplicate: two boards gave +0.627 % and +0.599 % against their own controls, and a third board at the identical provenance turns 'reproduced on two boards' into 'reproduced on all three', while also putting board 3 on the image the owner would ship. Deliberately chose this over starting the coverage recipe (#467) in this window because that recipe must be atomic - prompts, host goldens and a device AUTO_SAVE session in one commit, since a prompt addition alone leaves device_golden_missing non-zero and measure.sh would then refuse every following lane - and a half-finished version of it is exactly how a harness gets left broken. Clean .S preserved at /tmp/b3-s.S. Pin unchanged at 5.3033.","timestamp":1790280071990,"segment":1,"confidence":10.871056241426617,"asi":{"hypothesis":"Give the proposed image a third independent board reading: install the exact seed stack on board 3 (it currently holds only the clean base) and screen its primary group against that board's own clean 5.58 reading.","why_this_and_not_the_coverage_recipe":"The #467 coverage recipe is the bigger prize but it is atomic by necessity: prompt addition, host golden regeneration and a device AUTO_SAVE session must land in one commit, because a prompt addition alone leaves device_golden_missing non-zero and measure.sh then refuses every subsequent lane. Starting it inside an iteration I cannot finish is how a harness gets left broken, so it waits for a window that can run it as one script end to end.","state":"Seed snapshot md5 3a2e522e3f38 installed, tree hash recomputes to exactly 61861dd9886c - the same provenance as boards 1 and 2 - so this is a third board on the identical proposed image, not a variant. Clean .S saved at /tmp/b3-s.S for restore.","expected":"roughly 5.61 against that board's 5.58, i.e. the same +0.5 to +0.6 pct the other two boards gave, with 6/6 byte-exact; anything else is information worth reading","next":"If the third board agrees, the stack is a three-board, byte-exact, capture-green, monitor-improved proposal and the only remaining step is the owner's disposition of the two boot-state goldens."}}
{"run":604,"commit":"746a27f","metric":5.6133,"metrics":{"boot_bench_tps":5.657,"device_output_exact":6,"device_token_delta":0,"ext_decode_tps":5.5177,"gen_tokens":99,"host_output_exact":19,"internal_free":8415,"logit_max_delta":0.00005341,"logit_top1_match":10,"min_case_tps":5.35,"prefill_tps":5.925,"psram_free":2052252,"think_tps":4.39},"status":"keep","description":"Third board confirms the proposed image. Board 3 running the exact seed stack at provenance 61861dd9886c reads decode 5.6133 against that board's own clean acceptance reading of 5.5800, i.e. +0.597 %, with device_output_exact 6/6, token_delta 0, boot bench 5.657 and LANE_RC=0. The proposed image is therefore confirmed on all three boards at identical provenance: 5.6117 / 5.6117 / 5.6133 versus each board's own clean 5.5783 / 5.5767 / 5.5800, giving +0.599 %, +0.627 % and +0.597 % - a spread of 0.03 pct across boards on the delta itself, which is the cleanest possible statement that the gain is the kernel change rather than a board. Second finding of the same read: this is the first positive-path use of the restricted-run device gate - DEVICE_GATE_OK_RESTRICTED exact=6/6 with exit 0 - so that check now has both halves demonstrated, a red deliberate mis-seed (#598) and a green clean image. This lane was primary-group only, so board 3's extended/think/prefill/worst-case are not claimed here; those come from board 1's full 20-case session. Pin deliberately unchanged at the owner's 5.3033; the stack is three-board confirmed, capture-green, 18/20 with only the two boot-state-dependent goldens, and awaits admission.","timestamp":1790280719805,"segment":1,"confidence":10.876543209876548,"asi":{"hypothesis":"Give the proposed image a third independent board reading at identical provenance.","result":"THREE-BOARD CONFIRMATION of the proposed image, all at provenance 61861dd9886c: board 1 5.6117, board 2 5.6117, board 3 5.6133. Against each board's own clean control (5.5783 / 5.5767 / 5.5800) that is +0.599 %, +0.627 %, +0.597 % - the same gain on every board, spread 0.03 pct of the delta, so the effect is the kernel change and not a board. Board 3 also printed DEVICE_GATE_OK_RESTRICTED exact=6/6 and LANE_RC=0, the first positive-path use of the restricted-run device gate added after #595.","gate_positive_path":"The new restricted gate now has both halves demonstrated: it fired with DEVICE_OUTPUT_DIVERGED_RESTRICTED 0/6 and exit 1 on the deliberate mis-seed (#598), and it now passes a clean image with exit 0. A check proven only in the failing direction is as untested as one that never fails.","monitor_note":"This was a primary-group screen, so extended/think/prefill/worst-case for board 3 remain those measured on board 1's full session (#589); no values are carried across groups here.","next":"The proposal is now three-board speed, two-board full-suite byte-exactness (18/20, only the two boot-state goldens), capture green on the exact image, and a host-side bit-exactness guard. Nothing further to measure before the owner decides; the next engineering item is the atomic coverage recipe.","pin":"5.3033, unchanged - admission is the owner's call."}}
{"run":605,"commit":"22c715d","metric":5.6133,"metrics":{"boot_bench_tps":5.657,"device_output_exact":6,"device_token_delta":0,"ext_decode_tps":5.5177,"gen_tokens":99,"host_output_exact":23,"internal_free":8415,"logit_max_delta":0.00005341,"logit_top1_match":10,"min_case_tps":5.35,"prefill_tps":5.925,"psram_free":2052252,"think_tps":4.39},"status":"keep","description":"Ran the coverage recipe's host half and launched its device half. Four pre-validated held-out shapes are now in extended with the documented blank expectation (bench.py: 'any grammar-legal, successfully executed call'), so the host widened to 23 cases and checks.sh came back green with host_lines_same=23, FIDELITY steps=10 vocab=8192 max_delta=5.341e-05 top1=10/10 unchanged, and the per-case LCP line showing all 23 cases at 2/2 prefix matches including the new free-text, German-translation, probe-reading and open-status shapes. The reason this recipe was never just run before is a real trap the naive version walks into: bench.py device --save-golden replaces the whole golden, so a coverage save would silently re-capture heldout_interval_one and heldout_long_tools_note_only - the two boot-state-dependent demo-timer goldens that diverge on all three boards - which the mentor queue forbids because it moves the quality oracle instead of meeting it. Wrote .auto/exp88/merge_additions_only.py to restore every pre-existing entry from backup, keep only new ids, and refuse to merge if any pre-existing case was not covered, then started the full-group AUTO_SAVE=1 device session on board 1 in canonical order. Two bugs in my own script were caught by running it before it could touch state: a relative-path cd that landed in .auto, and a prompt-append that invented a schema instead of reading the real id/phase/input/expect shape. Pin unchanged at 5.3033; no speed claim in this entry.","timestamp":1790280967990,"segment":1,"confidence":10.876543209876548,"asi":{"hypothesis":"Run the #467 coverage recipe as one atomic sequence, because the extended set has been watched for 200+ runs and is drifting back into distribution - the same failure #296 caught at 5.0117.","design_that_makes_it_safe":"bench.py device --save-golden overwrites the WHOLE golden, so a naive coverage save would also re-capture heldout_interval_one and heldout_long_tools_note_only - the two boot-state-dependent demo-timer goldens that diverge on all three boards. Regenerating those is explicitly forbidden (it moves the oracle instead of meeting it), so .auto/exp88/merge_additions_only.py restores every pre-existing entry from the backup, keeps only the new ids, and REFUSES to merge if the session did not cover all pre-existing cases. The script also refuses to start if the guarded files are dirty.","host_half_measured":"Four pre-validated held-out shapes appended with expect: [] (bench.py's documented blank expectation = any grammar-legal successfully executed call), then host golden regenerated and checks.sh green: host_lines_same=23 (was 19), FIDELITY max_delta 5.341e-05, top1 10/10 unchanged, and the per-case LCP line shows all 23 cases producing 2/2 prefix matches including the four new ones.","script_bugs_found_by_running_it":"Two, both mine, both fixed before any state was touched: the recipe's cd used dirname-of-dirname and landed in .auto (relative-path invocation), and my first prompt-append invented a schema instead of reading it - the real entry shape is id/phase/input/expect and `ph and None or None` would have died with NameError. Reading the actual JSON shape is what made the addition correct.","state_and_next":"Device save session running on board 1 at the seed stack with AUTO_SAVE=1, full groups, canonical order; board 1's prompts.json and host golden updated to the widened set. IMPORTANT: the session saves the device golden in board 1's checkout, so after it finishes the merge must run there and the merged device.json copied back to main, then main's pre-existing 20 cases re-verified at 22/24 (the two boot-state cases) with device_golden_missing=0, and prompts plus both goldens committed together.","not_speed":"No speed claim; this widens the held-out monitor. decode for the running image is the seed stack's, measured separately."}}
{"run":606,"commit":"404ffc0","metric":5.6133,"metrics":{"boot_bench_tps":5.657,"device_output_exact":6,"device_token_delta":0,"ext_decode_tps":5.5177,"gen_tokens":99,"host_output_exact":19,"internal_free":8415,"logit_max_delta":0.00005341,"logit_top1_match":10,"min_case_tps":5.35,"prefill_tps":5.925,"psram_free":2052252,"think_tps":4.39},"status":"keep","description":"Corrected my own stale wait and cleared the coverage half-state without weakening a guard, then resumed performance work on a board. The coverage save lane never ran: the anti-repeat guard refused it with UNCHANGED_SHIPPING_IMAGE_REFUSED and LANE_RC=42 because board 1 already carries the seed image signature, so my 1,140-second sleep was waiting on nothing - retracted, and the guard was not bypassed. Half-state fixed by restoring board 1's own complete prompts/goldens from backup and main's from git, with the widened versions preserved as artifacts at .auto/exp88/prompts-widened.json and .auto/exp88/host-widened.json plus the committed additions-only merge tool, so no incomplete input sits on top of a complete fixture and the coverage work is not lost. Then launched the one fully specified post-spin sign-flip candidate: nd_model.c's caller threshold n>=512 lowered to n>=256 together with main.c's rows_dual_core guard half<2 lowered to half<1, so 256..511-unit jobs actually split into two one-unit halves. This is deliberately the PAIR, because run #558 lowered only the guard and read neutral for exactly the reason that no caller ever produced a 2-unit job - each half alone is a null, only the pair changes execution, and #456 predicted this class could flip positive once the spin handshake removed the wake toll. Board 2 at provenance 6b3f7a50e2c6, primary group, against its own 5.6117 seed reading, bit-exact by construction. Pin unchanged at 5.3033.","timestamp":1790282029738,"segment":1,"confidence":10.876543209876548,"asi":{"mentor_correction_accepted":"The 1,140-second wait was on a lane that never ran: M-cov-b1.log ended at 299 bytes with UNCHANGED_SHIPPING_IMAGE_REFUSED and LANE_RC=42, because board 1 already carries the seed image signature in the history. The anti-repeat guard was right and I did not bypass it; my sleep was the error, and it is retracted rather than explained away.","coverage_half_state_resolved":"Restored board 1's own complete prompts/goldens from /tmp/b1-prompts-old.json and restored main's prompts.json plus host golden from git, after copying the widened versions to .auto/exp88/prompts-widened.json and .auto/exp88/host-widened.json. Nothing is lost and nothing incomplete is layered on a complete fixture - the additions are preserved as artifacts for whoever runs the atomic device save, and the merge tool for that run (.auto/exp88/merge_additions_only.py) is committed.","hypothesis":"The Q-head-owned tap/norm/RoPE lane is being sharpened by the mentor; meanwhile the paired split change is the one fully specified post-spin sign-flip test: nd_model.c's caller threshold n>=512 becomes n>=256 AND main.c's rows_dual_core guard half<2 becomes half<1 together, so jobs of 256..511 units actually split into two halves of one unit each.","why_pairing_matters":"Run #558 lowered only the guard and read neutral (5.5817 vs 5.58) for exactly this reason: no caller ever handed it a 2-unit job, because every caller below 512 units stayed serial. Lowering the guard alone and lowering the caller threshold alone are both nulls; only the pair changes execution. After spin plus lean notifications removed most of the wake toll, #456 predicted this class could flip positive.","state":"Board 2 at provenance 6b3f7a50e2c6 (seed base plus these two one-line changes), primary group, against that board's own seed reading 5.6117. Bit-exact by construction: the split kernel is pure per-row and the odd-total path is unchanged, and the device byte-exact gate now enforces on restricted runs (proven both directions in #598/#604).","boards":"1 idle with complete fixtures, 2 running the paired split, 3 idle on the seed base. No sleep in this iteration; verified by live process plus a growing log carrying its own PROVENANCE line."}}
