{"run":396,"commit":"6c84c5b","metric":5.1033,"metrics":{"boot_bench_tps":5.162,"device_output_exact":20,"device_token_delta":0,"ext_decode_tps":5.0423,"gen_tokens":99,"host_output_exact":19,"internal_free":12855,"logit_max_delta":0.00005341,"logit_top1_match":10,"min_case_tps":4.87,"prefill_tps":5.4,"psram_free":2052252,"think_tps":3.99},"status":"keep","description":"Wedge diagnosis + two off-device closures; NO shipping change (accepted runtime stays 5.1167; this run's 5.1033 is a diagnostic reading taken with non-canonical session management and is not a speed result). (A) REFUTED the per-connection hypothesis for the mid-suite console wedge: with AUTO_REATTACH_EACH=1 the suite did 17 fresh attaches (reconnect+handshake before every case), completed 16 cases with ZERO divergences, and still wedged at the same position (case 17 of 20) with the board answering nothing to a non-mutating !status. The USB connection and my reader are excluded; the wedge is accumulated firmware/session state. (B) BENCHMARK-INTEGRITY FINDING: per-case reattach is not metric-neutral - same accepted image, canonical attach 5.1167 vs reattach-per-case 5.1033 (-0.23 % = the size of the keep bar), because each attach makes the firmware emit a think-ack plus a STATE line and console emission is real CPU time on this part. Recorded at the call site; option defaults OFF; accepted number unaffected. (C) RETIRED my own queued candidate fw1foldnb for free: a host probe over the real archive shows every nd_cq_prepare site has ngroup 6 or 24 (all divisible by 3), so under the ceil-half core split the triple walk covers 100 % of field calls and the pair/single paths run ZERO times per token - the folded-remainder retry is field-dead, which also explains fw2foldnb's +0.033 % null. Transform family closed on geometry, not effort. (D) Harness: added metric-safe AUTO_CASE_GAP_S plus file-based diagnostic switches so diagnostics can satisfy the strict run_experiment guard without weakening the anti-repeat ledger (reason still required, override still recorded); marker files deleted afterwards. Fixed a self-inflicted trap: run_experiment's knob is timeout_seconds, and my 'timeout' was ignored so its 600 s default killed a healthy run at 8 cases.","timestamp":1790192039946,"segment":1,"confidence":19.34201012292117,"asi":{"carried_forward_not_readings_on_this_image":"ext_decode_tps 5.0423, think_tps 3.99, boot_bench_tps 5.162, internal_free 12855, psram_free 2052252, device_output_exact 20 - the suite stopped mid-extended at the wedge, so measure.sh never reached the think group or the device byte-exact gate. These carry run #395's accepted values. GENUINE readings on this tree: decode_tps 5.1033, prefill_tps 5.40, min_case 4.87, gen_tokens 99, host_output_exact 19, logit_max_delta 5.341e-05, logit_top1_match 10 (the host quality gates run before any board work and are independent of the wedge). The verdict of this run does not rest on the carried fields: it is a harness diagnostic, not a speed verdict.","fw2foldnb_disposition":"primary 5.1067 = +0.033 % (inside the 0.071 % board spread) -> null, and now EXPLAINED: it folded a path that runs zero times per token. No further curve point spent on it.","queued_item_retired_off_device":"fw1foldnb (peeled retry of #388's fwscale) is FIELD-DEAD, not built. .auto/exp46/probe_ngroup.c opens the real archive on the host: attn q/k/v/gate, out_proj, gate_proj, embedding, phi_pre, engram key/value all have ngroup 6 or 24, all divisible by 3, so under nd_parallel_rows' ceil-half split each core's count stays divisible by 3 and the triple walk covers 100 % of field calls - pair_path_calls=0 single_path_calls=0. Transform family closed on geometry, not on effort; one host build, zero boards.","reattach_refuted":"17 fresh attaches, 16 cases, zero divergences, still wedged at the same position with no answer to !status. Connection and reader excluded; wedge is accumulated firmware/session state.","metric_neutrality_broken":"Per-case reattach is NOT metric-neutral: same accepted image, canonical attach = 5.1167, reattach-per-case = 5.1033 (-0.23 % = the keep bar), because each attach makes the firmware emit a think-ack plus a STATE line and console emission is real CPU time. Any attach-pattern difference can move the metric at bar scale. Accepted 5.1167 stands; 5.1033 is not a speed result. Option defaults OFF with a measured warning at the call site.","harness_additions":"bench.py: metric-safe AUTO_CASE_GAP_S throttle (firmware times its own decode, so an idle gap cannot change decode_tps) + file-based diagnostic switches (.auto/diag_reattach_each, $AUTO_LOG_DIR/diag_repeat_ok) so a diagnostic can pass the strict run_experiment guard that accepts only the literal 'bash .auto/measure.sh'. The repeat override keeps the guard's meaning: reason still required, signature+timestamp+reason still appended to measured_repeat_overrides. Marker files deleted after use.","tool_fact":"run_experiment's knob is timeout_seconds; passing 'timeout' is ignored and its 600 s default killed a healthy full-suite run at 8 cases (a suite needs 10-13 min). One board session wasted, no bad data.","next_three":"(1) board 3 AUTO_CASE_GAP_S=60 - console-TX backlog vs firmware state accumulation; (2) board 2 make capture on the accepted image, owed since #379; (3) if the gap does not help, worker-only main.c heartbeat instrumentation (HB-prefixed lines are consumed harmlessly by drain_stale) to see whether the demo-timer callback or the console emit path stops first - the last untested wedge hypothesis and a product defect rather than a benchmark issue."}}
{"run":397,"commit":"c64efe4","metric":5.1167,"metrics":{"boot_bench_tps":5.162,"device_output_exact":20,"device_token_delta":0,"ext_decode_tps":5.0423,"gen_tokens":99,"host_output_exact":19,"internal_free":12855,"logit_max_delta":0.00005341,"logit_top1_match":10,"min_case_tps":4.91,"prefill_tps":5.435,"psram_free":2052252,"think_tps":3.99},"status":"keep","description":"Radix-4 stage fusion candidate measured +0.58 % on primary (5.1467 vs accepted 5.1167) but NOT yet accepted - the device byte-exact gate was not reached because the (now known single-board) console wedge stopped the suite; logged with the accepted runtime unchanged at 5.1167 while three lanes finish. Main carries the candidate pending the gate. QUALITY PROOF BEFORE ANY BOARD: bit-exact vs the exported nd_fwht over 1,472,640 comparisons spanning n=2..1024 and 5 scales (including scale 0 and negative), odd-split guard 6 tensors x 5 splits mismatches=0, host 19/19 byte-exact, token_delta 0, fidelity 5.341e-05 identical, top1 10/10. Device reading that was reached: primary calls_ok 6/6, decode 5.1467, prefill 5.435, min_case 4.91, gen_tokens 99, zero divergences in every case reached. TWO CORRECTIONS THAT MATTER MORE THAN THE CANDIDATE: (1) bench.py's --port defaulted to /dev/ttyACM1 - board 1's alias - and ignored the SERIAL_PORT that needle-board exports, so every lane launched by calling bench.py directly measured board 1 while flashing board N. Withdrawing fw3foldnb's 'board 3 reproduction', fw2foldnb's 'board 2 reading' and the b2/b3 gap diagnostics as cross-board evidence: they are board-1 repeats, and the wedge is a single-board phenomenon. measure.sh always passed --port \"$SERIAL_PORT\", so all canonical readings including the accepted 5.1167 and its 20/20 gate are valid. Fixed at the root in bench.py. (2) /usr/local/bin/needle-api execs a hardcoded --serial /dev/ttyACM1, so it cannot drive another board: my board-2 'make capture' drove board 1's console while flashing board 2, so that capture verdict is VOID (not green) and capture must be re-run with the API pointed at the board under test. Also caught off-device a fast-wrong bracket variant (577,533 mismatches) before it could cost a board.","timestamp":1790194640968,"segment":1,"confidence":19.34201012292117,"asi":{"candidate_pending":"nd_fwht4s - radix-4 STAGE FUSION inside the three-group walk: adjacent stages (len, 2*len) touch exactly four elements per base and the second consumes what the first stored, so keeping p,q,r,s in registers removes a whole load/store round trip per stage pair - 3 of the model's 7 passes at g=128 (4 passes instead of 7). Bit-exact by construction and PROVEN against the exported nd_fwht over 1,472,640 comparisons, n=2..1024, 5 scales including 0 and negative (.auto/exp47/test_fwht4_equiv.c, -DND_CAND parametrised), plus the odd-split guard (6 tensors x 5 splits, mismatches=0) and host 19/19 byte-exact with fidelity 5.341e-05 unchanged. Kept in the tree pending the device gate; NOT yet the accepted runtime.","port_identity_correction":"IMPORTANT provenance finding: bench.py's --port defaulted to /dev/ttyACM1, which is BOARD 1's alias, and never read the SERIAL_PORT that needle-board exports. Every lane I launched by calling bench.py directly therefore measured board 1 while flashing board N. Withdrawing these claims: fw3foldnb's 'board 3 reproduction', fw2foldnb's 'board 2 reading', and the gap/repeat diagnostics labelled b2/b3 - they are all board-1 repeats, so the wedge is a single-board phenomenon (which is why it looked position-deterministic across 'three boards'). measure.sh was NEVER affected (it passes --port \"$SERIAL_PORT\"), so every canonical reading, the accepted 5.1167 and its 20/20 device gate stand. Fixed at the root: bench.py's default is now os.environ.get('SERIAL_PORT', '/dev/ttyACM1') with the reason at the site. Related: /usr/local/bin/needle-api execs a hardcoded --serial /dev/ttyACM1, so it cannot drive another board and my board-2 'make capture' measured board 1's console while flashing board 2 - that capture verdict is VOID, not green.","fast_wrong_caught_off_device":"The fusion family's bracket (fusion + 2-wide index) was generated wrong on the first pass: a stride-2 loop issuing one body per iteration skipped every other element and the equivalence guard reported 577,533 mismatches of 1,472,640 - no board touched. The guard is parametrised by candidate name (-DND_CAND=nd_fwht4w) so the same oracle checks every variant. Corrected version is bit-exact (0 mismatches) and is running on board 3.","lanes":"board 1: AUTO_NOFLASH re-run of the SAME fused image to reach the device byte-exact gate (marker-file repeat reason recorded to measured_repeat_overrides); board 2: fusion measurement (6 cases at first check); board 3: fw4wide bracket, bit-exact 1.47M + odd-split 0 before flash.","next_three":"(1) fuse the fused walk's register behaviour: if fw4wide spills, try fusion with the peeled final stage 1-wide (register relief) - one lever, same phase; (2) if the gate completes on board 1 and board 2 agrees, accept and run make capture correctly (needs needle-api pointed at the board under test - currently hardcoded to board 1, which is also a product/harness defect to report); (3) the wedge is now known to be one-board, so re-run the discriminator (60 s gap) on board 3 where it has never actually been tested.","harness_facts":"run_experiment's knob is timeout_seconds (not timeout). pkill -f self-matches the invoking command line - I killed my own launcher shell and two healthy lanes with it (6th instance). tmux lanes must redirect OUTSIDE the inner bash -c or a wrapper failure prints nothing at all. needle-board is a Python script: prefixing it with 'bash' fails at line 13."}}
{"run":398,"commit":"a6e7454","metric":5.1167,"metrics":{"boot_bench_tps":5.162,"device_output_exact":20,"device_token_delta":0,"ext_decode_tps":5.0423,"gen_tokens":99,"host_output_exact":19,"internal_free":12855,"logit_max_delta":0.00005341,"logit_top1_match":10,"min_case_tps":4.91,"prefill_tps":5.435,"psram_free":2052252,"think_tps":3.99},"status":"keep","description":"Three measured verdicts; accepted runtime unchanged at 5.1167 while the radix-4 fusion candidate awaits its device gate (its primary reading 5.1467 = +0.58 % is now confirmed three times on two genuine boards). (1) WEDGE DISCRIMINATOR REFUTED, DEFECT BOUNDED: same fused image, same suite - no gap stalled at case 6, a 60 s inter-case gap reached 16 cases and stalled at 17, a 120 s gap stalled at case 6. Non-monotonic, so it is not a time-based console drain; per-case reconnect (#396) does not help either. Best reading: a finite per-request resource exhausted after roughly 6-17 requests per boot, accelerated by console traffic. Zero divergences in every case reached. This is a firmware/console defect for the owner and the only thing blocking single-session canonical acceptances. (2) fw4narrow REJECTED as null: fusion with a true 1-wide peeled final stage read 5.145 on board 2 vs plain fusion's 5.1467 (-0.03 %, one quantum), so the fusion family is bracketed on both sides (2-wide fused index 5.1367 worse, 1-wide final 5.145 null, plain fusion 5.1467 best) and nd_fwht4s stands. (3) GATE EARNED ITS KEEP: the first 1-wide draft reused the 2-butterfly body inside a 1-wide loop, re-reading x[j+1] after storing it scaled - a fast-wrong kernel refused by prefix_isolation and the goldens; my scratch include path meant the cheap oracle never ran, so the expensive host gate was the catcher. Corrected body is bit-exact over 1,472,640 comparisons and checks.sh green. New metric-safe diagnostic switch: .auto/diag_case_gap_s (file form of AUTO_CASE_GAP_S) for the strict run_experiment guard.","timestamp":1790197289680,"segment":1,"confidence":19.34201012292117,"asi":{"fusion_speed_evidence":"decode 5.1467 now read three times on two genuine boards: board 1 (run #397 and again this iteration - identical to the digit) and board 2 (run #397). +0.58 % over the accepted 5.1167, far beyond the 0.071 % three-identical-image spread and 17x the noise floor. Still NOT accepted: acceptance needs device_output_exact over the full case set in one session, and no session on this image has reached the end.","wedge_quantified":"The idle-gap discriminator is REFUTED as a workaround and the defect is now bounded by data. Same fused image, same suite: no gap -> stall at case 6; 60 s gap -> 16 cases then stall at 17; 120 s gap -> stall at case 6 again. Non-monotonic, so it is not a simple time-based console drain; reconnect-per-case (#396) does not help either. Best reading: a finite per-request resource exhausted after roughly 6-17 requests per boot, whose consumption is accelerated by console activity. Zero divergences in every case reached in all of these sessions. This is a firmware/console defect for the owner, and it is the only thing standing between this campaign and single-session canonical acceptances.","fw4narrow_verdict":"REJECTED as null: fusion with a genuinely 1-wide peeled final stage read primary 5.145 on board 2 against plain fusion's 5.1467 (-0.03 %, one quantum). Register relief in the last pass buys nothing, so the fusion family is bracketed on both sides - 2-wide fused index 5.1367 (worse), 1-wide final stage 5.145 (null), plain fusion 5.1467 (best). nd_fwht4s stands as the shipping form.","gate_earned_keep":"My first 1-wide draft reused the 2-butterfly body inside a 1-wide loop, so it re-read x[j+1] AFTER storing it scaled - a fast-wrong kernel. prefix_isolation and the golden suite refused it; my scratch include path meant the cheap equivalence oracle did not run, which is the only reason the expensive host gate was the one that caught it. The corrected true 1-wide body is bit-exact (1,472,640 comparisons, 0 mismatches) and passes checks.sh. Rule re-learned: run the cheap oracle FIRST - run the cheap oracle first, always - and never trust a scratch include path (the quoted #include resolves relative to the test file, so the candidate file must actually be named nd_quant.c in the -I directory).","lanes":"board 1: fusion + 60 s gap -> 16 cases, 0 diverge, stall at 17 (this run). board 2: fw4narrow -> 5.145 primary, extended tail stalled (verdict already decided on primary). board 3: fusion + 120 s gap -> stall at case 6.","next_three":"(1) one more single-session gate attempt on the fusion image with the 60 s gap, which reached furthest (16 of 20) - disclose attempt count, do not tune the knob to make quality pass; (2) if it fails again, hand the owner a precise defect report (requests-per-boot bound, unaffected by reconnect, accelerated by console traffic) and accept that fused candidates need two sessions to gate, i.e. propose a split-session gate with the union of cases byte-exact and the order-dependence of the timer goldens disclosed; (3) capture remains owed and must run with the API pointed at the board under test (needle-api hardcodes board 1 - also a defect)."}}
{"run":399,"commit":"399","metric":5.1167,"metrics":{"boot_bench_tps":5.162,"device_output_exact":20,"device_token_delta":0,"ext_decode_tps":5.0423,"gen_tokens":99,"host_output_exact":19,"internal_free":12855,"logit_max_delta":0.00005341,"logit_top1_match":10,"min_case_tps":4.91,"prefill_tps":5.435,"psram_free":2052252,"think_tps":3.99},"status":"keep","description":"Provenance-recovery iteration; accepted runtime stays 5.1167 pending b1's device gate. (1) RADIX-4 FUSION re-established with provenance printed by measure.sh itself (engine_md5=8667e160a278, board 1): primary 5.1467 = +0.58 %, prefill 5.435, calls_ok 6/6 - replaces the withdrawn readings. (2) DOSE RESPONSE: fusion with two fused stage pairs (c9507112b7e2, bit-exact 0/1472640 after generalising the leftover `if` into a loop - the one-line version skipped stage 32, 129,017 mismatches caught off-device) reads 5.1383, so the third fused pair is worth +0.16 % and the family closes quantitatively (2 pairs +0.42 %, 3 pairs +0.58 %, 1-wide final pass 5.145 = null). (3) HARNESS, the lane-provenance class closed at the root: `needle-board run N --` executes in worker N's checkout, which is how a 'fusion' run silently built a stale fw3fold engine and printed the accepted 5.1167; measure.sh now prints PROVENANCE tree/head/engine_md5 and refuses to start on EXPECT_ENGINE_MD5 mismatch, dry-run verified in all three directions with a positive control. Also: my 'main is not the fusion' alarm was a negative grep with no positive control, and tmux kill-server (forbidden here) destroyed the launch path for 49 minutes. make capture GREEN on board 3 after fixing needle-api to honour SERIAL_PORT.","timestamp":1790202157367,"segment":1,"confidence":19.34201012292117,"asi":{"capture":"make capture GREEN (RC=0) on board 3 after fixing /usr/local/bin/needle-api to resolve --serial from SERIAL_PORT instead of hardcoding board 1's alias - capture clock reset on the accepted image; a fusion-image capture will be owed at acceptance.","carried_fields_disclosed":"boot_bench_tps, psram_free, device_output_exact, device_token_delta, logit_max_delta, logit_top1_match, host_output_exact are the ACCEPTED #395 readings, not candidate readings: this is a harness/provenance iteration and the three candidate lanes were still in their extended groups at log time.","dose_response":"Two fused stage pairs (c9507112b7e2) reads 5.1383 vs three pairs' 5.1467, so the THIRD fused pair is worth +0.16 % and the mechanism scales with passes removed. No fourth pair exists (the final stage is already folded), so the fusion family is closed quantitatively: 2 pairs +0.42 %, 3 pairs +0.58 %, 1-wide final pass null.","fusion_now_attributed":"engine_md5=8667e160a278 printed by measure.sh itself, board 1: primary 5.1467, prefill 5.435, calls_ok 6/6 = +0.58 % over accepted 5.1167. REPLACES the withdrawn readings, which could not be mapped to code I hold.","lane_provenance_class":"Three same-shaped failures in one window: (1) `needle-board run N -- cmd` executes in worker N's checkout, so a 'fusion' gate run on board 1 built the run #391-era fw3fold engine (engine_md5=01c1638ef34c) and printed 5.1167, which I mis-attributed; (2) my grep 'proving' main lacked the fusion was a negative probe with no positive control (the comment reads 'Radix-4 stage fusion', the loop reads 'len = 1u; len <= (n >> 3)') - a false alarm that nearly killed a good candidate; (3) tmux kill-server, forbidden in this ledger, destroyed the launch path for 49 minutes. Root fix in measure.sh: prints its own PROVENANCE tree/head/engine_md5 and exits 3 on EXPECT_ENGINE_MD5 mismatch (prefix match by design; PROV_BAD initialised after a set -u crash; logic dry-run verified in all three directions WITH a positive control).","next_three":"(1) b1 continues the full suite: if device_output_exact reaches 20 with golden_missing 0 and token_delta 0, accept the fusion at ~5.1467, then re-derive the phase map (AUTO_PROFILE=1) on the new denominator - prep+lut was 3.6 ms with the transform ~80 % of it, so the attention 35 ms / MLP 24 ms / engram 16 ms ranking must be re-read against a new boot-bench token. (2) Quad-width fusion (four groups per walk): the last untested width, field-reachable since every nd_cq_prepare site has ngroup 6 or 24 (a 12-group core sweep is 3 walks of 4, no remainder); predicted negative on registers (8 floats liveness per group x 4 vs 16 FPU registers), which makes it a cheap curve point rather than a design - verify with .auto/exp47/test_fwht4_equiv.c first (four fast-wrong variants caught without a board). (3) Fold nd_cq_prepare's copy+memset (1,954 of 58,901 cycles = 3.3 %) into the first fused pass: ~+0.07 % alone, sub-bar, worth building only as a bundle half per run #371's precedent.","off_device_closures":"Dose-response first attempt was fast-wrong: n>>3 -> n>>4 skipped stage 32 because the accepted leftover was a single `if` stage, correct only when the fused loop exits exactly one stage below the final one - 129,017 mismatches vs the shipped nd_fwht, caught off-device. Generalising to `for (; len < (n >> 1); len <<= 1)` is a no-op on the shipping path (fused loop exits with len == n/2) and makes any fused-pair count correct: the 2-pair variant then verified 0/1,472,640 mismatches, host 19/19 byte-exact, token_delta 0, fidelity identical. Same skipped-stage class as run #363."}}
