{"type":"config","name":"Needle 3 decode tokens/second on ESP32-S3 (N32R16), 8-layer model, quality frozen","metricName":"decode_tps","metricUnit":"tok/s","bestDirection":"higher"}
{"run":1,"commit":"3dcd1de","metric":1.2217,"metrics":{"prefill_tps":1.2533,"gen_tokens":99,"min_case_tps":1.19,"ext_decode_tps":1.212,"think_tps":1.14,"device_output_exact":12,"device_cases":12,"device_token_delta":0,"boot_bench_tps":1.225,"psram_free":15642796,"internal_free":38487,"host_tps_x86":85.83,"host_output_exact":11},"status":"keep","description":"Baseline: unmodified 8-layer Needle 3 on the attached ESP32-S3, measured through the real request path (flash, boot, both schema prefixes primed, 12 greedy grammar-constrained requests). decode_tps 1.2217 = mean of 6 primary cases; per-case spread only 1.19-1.23 tok/s. Device goldens and host goldens frozen here.","timestamp":1789719102601,"segment":0,"confidence":null,"asi":{"hypothesis":"establish baseline before any kernel change","timing_is_deterministic":"identical decode_ms (11415 twice, 11752 twice) across separate runs on the same binary - measurement noise is ~0, so tiny wins are real; only risk is the 0.01 tps tps-field quantisation","budget_per_token":"816 ms/token at 240MHz = ~196M cycles/token; theoretical weight-streaming floor at 2-bit is ~300-400ms/token, so ~2x headroom","observed_structure":"8 layers, d_model 768, 12 heads/2 KV heads, 4 mHC lanes, hada_n 1024, engram sites at layers 4 and 7, vocab 8192, window 384","internal_heap":"only 38KB internal SRAM free - any new internal-RAM buffer must fit that; PSRAM has 15.6MB free","phase_breakdown":"not yet collected - next run should use AUTO_PROFILE=1 to see proj2bit/attention/hadamard/mhc_phi4/engram/logits4/prep+lut/confpool shares","prime_cost":"boot priming costs 110s (143 tok) + 167s (213 tok); a full measure.sh iteration is ~11 min","think_path":"1.14 tok/s with reasoning enabled (unconstrained full-vocab argmax) vs 1.22 constrained - different code path, both monitored","golden_note":"heldout_status ('Is a timer running right now?') is genuinely ambiguous: model answers set_timer(60). Expectation left blank; exactness vs golden still enforced - if a speed change flips that case the gate fires and it gets discarded."}}
{"type":"config","name":"Needle 3 decode tokens/second on ESP32-S3 (N32R16), 8-layer model, quality frozen","metricName":"decode_tps","metricUnit":"tok/s","bestDirection":"higher"}
{"run":2,"commit":"34a8ba3","metric":2.4417,"metrics":{"prefill_tps":2.575,"ext_decode_tps":2.402,"think_tps":2.15,"boot_bench_tps":2.463,"min_case_tps":2.33,"gen_tokens":99,"internal_free":34895,"psram_free":15315112,"device_output_exact":12,"device_token_delta":0,"logit_max_delta":0,"logit_top1_match":10,"host_output_exact":11},"status":"keep","description":"Stage the multiply-read fp16 MLP weights as float32 at model open: the six Monarch Kronecker factors (w1a..w3b) plus d2/b2/d3/d4. kron_apply re-read each factor na times per application (1.57M nd_f16 calls/token across the model vs 49K distinct elements). Device decode 1.2217 -> 2.4417 tok/s (+99.9%), prefill +105%, think +88%, extended +98%, boot bench 816 -> 406 ms/tok. All 12 device cases byte-identical, host 11/11 exact, logit fidelity 9.5e-07 vs a 2e-3 budget. Cost: 320 KB PSRAM for the copies, internal heap 38487 -> 34895.","timestamp":1789732870041,"segment":1,"confidence":null,"asi":{"hypothesis":"ideas backlog: hoist the fp16->fp32 conversions out of kron_apply by staging each factor as float32 once at open","measured_effect":"device decode 816->406 ms/tok (2.01x); host 1.934->1.550 s (1.24x)","why_bigger_on_device":"on x86 the 2KB factors sit in L1 so the win is only the F2F instruction; on the S3 each kron pass re-reads the factor while the fp32 activation streams, so the fp16 loads and the conversion compete with it. Do not predict device gains from host ratios.","verification":"flashed both binaries back-to-back and read the firmware's own boot bench: BASE 816 ms/tok, CAND 406 ms/tok, cpu_hz=240000000 reported by esp_clk_cpu_freq() in both. Byte-exact text on all 12 device cases.","accuracy_note":"accumulation order is unchanged by design (same loop nests, same sum order), so the fp32 values are exactly representable and fidelity stays at 9.5e-07","next_action_hint":"look for the same pattern elsewhere: any per-element nd_f16() inside a loop that re-reads a weight vector dim times. tap_projection (q/k/v taps) is the next candidate but its fp32 copy is ~1.8 MB - check PSRAM headroom (15.3 MB free) rather than internal heap.","process_note":"the earlier 1.22 readings in this session were a stale/baseline tree, not a real measurement; this is the first honest candidate number"}}
{"run":3,"commit":"ee72112","metric":2.54,"metrics":{"boot_bench_tps":2.562,"device_output_exact":12,"device_token_delta":0,"ext_decode_tps":2.498,"gen_tokens":99,"host_output_exact":11,"internal_free":34895,"logit_max_delta":0,"logit_top1_match":10,"min_case_tps":2.42,"prefill_tps":2.6817,"psram_free":15052968,"think_tps":2.23},"status":"keep","description":"Extend run #2's staging to the remaining multiply-read fp16 MLP weights: cond_u (8 x n, read 8 times per element for the conditioning blend) alongside cond_v and d1. Same slot-indexed fp32 pool, zero numerical change. Device decode 2.4417 -> 2.5400 tok/s (+4.0%), prefill +4.2%, think +3.7%, extended +4.0%, boot bench 406 -> 390 ms/tok. 12/12 device cases and 11/11 host prompts byte-identical; logit probe 9.537e-07.","timestamp":1789742436531,"segment":1,"confidence":null,"asi":{"accuracy_note":"bit-exact: logit probe max_delta 9.537e-07 (same as the accepted baseline drift), host text 11/11 byte-exact, device text 12/12 byte-exact","cost":"+260 KB PSRAM for the copies (psram_free 15.32M -> 15.05M); internal heap unchanged at 34895","hypothesis":"extend the run #2 pattern: stage the remaining multiply-read fp16 MLP weights (cond_u, read 8x per element per layer) as float32 at open","measured_effect":"decode 2.4417 -> 2.5400 (+4.0%), boot bench 406 -> 390 ms/tok, prefill +4.2%, think +3.7%, extended +4.0% -- every path moved, consistent with a per-layer constant cost","next_action_hint":"the same pattern is exhausted inside hadamard_mlp: cond_v, cond_u, d1, d2..d4 and w1a..w3b are all fp32 now. What is left in fp16 is read exactly once per token. Next biggest fish per the device profile are proj2bit (the 2-bit LUT GEMV) and attention, not the MLP.","process_note":"measured with two back-to-back full runs plus an A/B flash of the two images (baseline 816 ms/tok vs candidate 390 ms/tok boot bench); app_md5 logged per run","slot_bug":"a slot index of 27 silently resolved to a different tensor and produced max_delta 0.000e+00 with top1 0/10; cond_u is canonical slot 26. The slot table is now a lookup by name, and fidelity catches the mistake."}}
{"run":4,"commit":"042e605","metric":2.54,"metrics":{"boot_bench_tps":2.563,"device_output_exact":12,"device_token_delta":0,"ext_decode_tps":2.498,"gen_tokens":99,"host_output_exact":11,"internal_free":34895,"logit_max_delta":0,"logit_top1_match":10,"min_case_tps":2.42,"prefill_tps":2.6833,"psram_free":15052968,"think_tps":2.23},"status":"keep","description":"Hoist the per-group fp16 norm conversion out of the 2-bit LUT GEMV inner loop (inlining dot_group_lut2 so the norm scalar multiplies once per group). Byte-identical and same speed as run #3 (2.5400 tok/s, boot bench 390 ms/tok): the phase is bandwidth/table bound, not conversion bound. Kept as a free refactor; recorded as a measured null result for arithmetic work in that kernel.","timestamp":1789744075907,"segment":1,"confidence":null,"asi":{"hypothesis":"hoist the per-group nd_f16(norm) out of the 2-bit LUT GEMV inner loop, which is the largest device phase","measured_effect":"IDENTICAL to run #3: boot bench 390 ms/tok both, both images, back to back. The hoist changes nothing measurable.","explanation":"the hoist is a true refactor (same value, same order) but the compiler already sank that conversion; the phase is bound by the table lookups (16-entry float LUT read per weight pair) and by the flash-streamed packed rows, not by the conversion. That makes it consistent with the model: MLP (compute-bound) responded enormously to fp32 staging, the GEMV (bandwidth-bound) does not.","next_action_hint":"stop optimising arithmetic in the 2-bit GEMV. If the biggest phase is to move, it has to move as bytes: fewer bytes streamed per token, or better cache residency for the LUT/packed rows. Also verify what the dual-core splitter actually covers.","process_note":"candidate and baseline images built from the same tree, hash-verified, flashed back-to-back; run #4 kept only because the tree is identical to run #3 in output and the hoist is free - if a later change needs that inner loop simple, the plain form is one line","quality":"bit-exact: logit probe 9.537e-07, host 11/11 and device 12/12 byte-identical"}}
{"run":5,"commit":"042e605","metric":2.54,"metrics":{"boot_bench_tps":2.563,"device_output_exact":12,"device_token_delta":0,"ext_decode_tps":2.498,"gen_tokens":99,"host_output_exact":11,"internal_free":34895,"logit_max_delta":0,"logit_top1_match":10,"min_case_tps":2.42,"prefill_tps":2.6833,"psram_free":15052968,"think_tps":2.23},"status":"keep","description":"Verification rerun of the run #4 tree (no code change): decode_tps 2.5400 again, every secondary identical to four decimals (prefill 2.6833, ext 2.4980, think 2.2300, boot bench 390 ms/tok, identical heap figures). Establishes that this harness's noise floor is ~0, so future small deltas are real. Kept.","timestamp":1789744984114,"segment":1,"confidence":null,"asi":{"changed_files":"none vs run #4","hypothesis":"re-run the identical tree to test the measurement floor","levers_left":"attention int8 KV dot product (attention=70ms), the 4-bit phi GEMV (18ms) and engram (25ms) are untouched; the 2-bit GEMV needs fewer streamed bytes or better LUT/row cache residency, not less arithmetic","method_note":"per-kernel attribution came from building one image per variant (git show of the file, ninja rebuild, hash, flash, read the firmware boot bench) - the only trustworthy way here, and it took ~10 min per data point","next_action_hint":"next candidate: attention. 70 ms/token of 390 with only ~10 MB of traffic means it is not bandwidth bound; look at the int8->float conversion in the KV dot and at per-head exp() work","noise_floor":"boot bench is exactly repeatable (2341/2342 ms for 6 tokens = 0.04%); primary decode_tps repeats to the same 4 decimals across runs, so per-case tps is reported at 2 decimals only","result":"identical to run #4 to the reported precision: decode_tps 2.5400, prefill 2.6833, ext 2.4980, think 2.2300, boot bench 390 ms/tok, internal_free 34895, psram_free 15052968","significance":"the measurement floor is effectively zero for this harness, so the +-1% differences seen between candidates are real, not noise"}}
{"run":6,"commit":"83e2a99","metric":2.5717,"metrics":{"boot_bench_tps":2.595,"device_output_exact":12,"device_token_delta":0,"ext_decode_tps":2.532,"gen_tokens":99,"host_output_exact":11,"internal_free":34895,"logit_max_delta":0,"logit_top1_match":10,"min_case_tps":2.45,"prefill_tps":2.72,"psram_free":14971048,"think_tps":2.25},"status":"keep","description":"Stage the q/k/v tap convolutions as float32 at open (slots 4/5/6 in the same slot table): each tap weight is read once per element per tap, so the loop converted 3x(dim) fp16 values per projection per layer. Device decode 2.5400 -> 2.5717 tok/s (+1.25%), prefill +1.4%, extended +1.4%, think +0.9%, boot bench 390 -> 385 ms/tok. Byte-exact everywhere; +82 KB PSRAM.","timestamp":1789748254668,"segment":1,"confidence":null,"asi":{"commit_note":"tree committed as 83e2a99 before logging, so a log-time revert cannot lose it","cost":"+82 KB PSRAM (psram_free 15.05M -> 14.97M); internal heap unchanged","hypothesis":"same pattern, next place it applies: stage the q/k/v tap convolutions (fp16, read taps*dim times per projection) as float32","measured_effect":"decode 2.5400 -> 2.5717 (+1.25%); boot bench 390 -> 385 ms/tok; prefill 2.6833 -> 2.7200 (+1.4%), ext +1.4%, think +0.9%","next_action_hint":"remaining fp16 in the per-token path: the per-head ZC-RMS norms and d1/cond_v (each read once per token, so staging them is a wash), the Sinkhorn exp/log (~10K nd_expf/token), and the attention online-softmax int8 dot. Profile phase split again before picking.","process_note":"A/B built from the same tree with only this change swapped, hash-verified, flashed back-to-back: 817 -> 385 ms/tok on the boot bench","quality":"bit-exact: host 11/11 and device 12/12 byte-identical, logit probe unchanged at 9.537e-07, prefix-isolation test green"}}
{"run":7,"commit":"83e2a99","metric":2.5717,"metrics":{"boot_bench_tps":2.595,"device_output_exact":12,"device_token_delta":0,"ext_decode_tps":2.532,"gen_tokens":99,"host_output_exact":11,"internal_free":34895,"logit_max_delta":0,"logit_top1_match":10,"min_case_tps":2.45,"prefill_tps":2.72,"psram_free":14971048,"think_tps":2.25},"status":"keep","description":"Stability rerun of the run #6 tree: decode_tps 2.5717 again with every secondary identical to four decimals. Confirms the fp32-tap gain is reproducible. Kept.","timestamp":1789749064527,"segment":1,"confidence":8.20189274447953,"asi":{"changed":"nothing vs run #6","hypothesis":"re-run the identical tree as a stability check on the new +1.25% win","result":"identical to run #6 to four decimals: decode 2.5717, prefill 2.7200, ext 2.5320, think 2.2500, boot bench 385 ms/tok, psram_free 14971048","significance":"confirms the tap-staging gain is not a one-off; the harness reproduces the same numbers exactly","next_action_hint":"pursue the attention phase next (per-head exp() count and the int8 KV dot), and re-profile to see the phase split after six changes - the 390->385 numbers say proj2bit is now a bigger share than before","process_note":"A/B image pair re-verified before the run: BASE 817 ms/tok, CAND 385 ms/tok"}}
{"run":8,"commit":"d2e2235","metric":2.6667,"metrics":{"boot_bench_tps":2.693,"device_output_exact":12,"device_token_delta":0,"ext_decode_tps":2.622,"gen_tokens":99,"host_output_exact":11,"internal_free":34895,"logit_max_delta":0,"logit_top1_match":10,"min_case_tps":2.53,"prefill_tps":2.8267,"psram_free":14741672,"think_tps":2.33},"status":"keep","description":"Stage d1 (MLP diagonal) and cond_v (conditioning matrix) as float32 at open - the last two fp16 per-layer tensors the MLP touches. Boot bench 385 -> 371 ms/tok; device decode 2.5717 -> 2.6667 tok/s (+3.7%), prefill +3.9%, extended +3.6%, think +3.6%. Byte-exact everywhere.","timestamp":1789750733897,"segment":1,"confidence":7.097791798107294,"asi":{"hypothesis":"stage the last two per-layer fp16 tensors the MLP touches (d1 diagonal, cond_v conditioning matrix) as float32 too - they were previously left in the blob because each is read once per token","measured_effect":"decode 2.5717 -> 2.6667 (+3.7%), prefill +3.9%, extended +3.6%, think +3.6%, boot bench 385 -> 371 ms/tok","surprise":"the ideas backlog predicted read-once tensors would be a wash; they are worth 3.7%. The fp16 loads are not free even when touched once - alignment/unpacking on the LX7 costs more than the extra 232 KB of PSRAM streaming.","next_action_hint":"every per-layer fp16 tensor now goes through the float pool except the ZC-RMS norm vectors (read once per token) - try them for completeness, then move to attention (70ms) and Sinkhorn","cost":"+229 KB PSRAM (psram_free 14.97M -> 14.74M); internal heap unchanged","quality":"bit-exact: host 11/11, device 12/12, logit probe 9.537e-07"}}
{"run":9,"commit":"d2e2235","metric":2.6667,"metrics":{"boot_bench_tps":2.693,"device_output_exact":12,"device_token_delta":0,"ext_decode_tps":2.622,"gen_tokens":99,"host_output_exact":11,"internal_free":34895,"logit_max_delta":0,"logit_top1_match":10,"min_case_tps":2.53,"prefill_tps":2.8267,"psram_free":14741672,"think_tps":2.33},"status":"keep","description":"Confirmation rerun of the run #8 tree: decode_tps 2.6667 again, all secondaries identical to four decimals. Kept.","timestamp":1789751616501,"segment":1,"confidence":14.195583596214588,"asi":{"changed":"nothing vs run #8","hypothesis":"confirm the d1/cond_v gain on the committed tree","next_action_hint":"next: the ZC-RMS norm scale vectors (norm_in, post_norm, pre_hada, q_norm, k_norm, final_norm) are the only fp16 weights left in the per-token path; stage them too. Then Sinkhorn and attention.","result":"identical to run #8: decode 2.6667, prefill 2.8267, ext 2.6220, think 2.3300, boot bench 371 ms/tok"}}
{"run":10,"commit":"fb364a1","metric":2.6667,"metrics":{"boot_bench_tps":2.693,"device_output_exact":12,"device_token_delta":0,"ext_decode_tps":2.622,"gen_tokens":99,"host_output_exact":11,"internal_free":31819,"logit_max_delta":0,"logit_top1_match":10,"min_case_tps":2.53,"prefill_tps":2.8267,"psram_free":14741672,"think_tps":2.33},"status":"keep","description":"Stage the ZC-RMS norm scale vectors into a float32 scratch before the multiply loop (norm_in, post_norm, pre_hada, q_norm, k_norm, final_norm). Byte-exact; boot bench 371 ms/tok unchanged, decode_tps 2.6667 unchanged - the conversions were not on the critical path here. Costs 3 KB internal heap. Kept as a neutral refactor because it removes the last per-element fp16 unpack in the elementwise path.","timestamp":1789754899223,"segment":1,"confidence":7.097791798107294,"asi":{"changed":"nothing vs run #10","cost":"-3 KB internal heap (34895 -> 31819) for the staged scale scratch","hypothesis":"stage the ZC-RMS norm scale vectors (norm_in/post_norm/pre_hada/q_norm/k_norm) as float32","internal_heap_note":"internal_free 34895 -> 31819: the staged scratch costs 3 KB of the tight internal heap - worth watching, still 31 KB headroom","next_action_hint":"fp32 staging is exhausted: every per-layer fp16 tensor is now staged. Next phase targets: attention (70ms/token), the engram tap matmul at nd_model.c:769 (per-site fp16 taps, worth staging), and Sinkhorn's 20 exp/log iterations","note":"staged the norm scale vectors into a per-call scratch buffer; identical boot bench to the untimed A/B (371 vs 371 ms/tok), so this is a numeric-preserving refactor that costs 3 KB of internal RAM for no measured gain","result":"identical to run #8/#9: decode 2.6667, boot bench 371 ms/tok","verdict":"discard candidate on the primary metric (no gain); kept as a commit only because the tree is otherwise the run #8 state"}}
{"run":11,"commit":"5f72770","metric":2.6767,"metrics":{"boot_bench_tps":2.703,"device_output_exact":12,"device_token_delta":0,"ext_decode_tps":2.632,"gen_tokens":99,"host_output_exact":11,"internal_free":31755,"logit_max_delta":0,"logit_top1_match":10,"min_case_tps":2.54,"prefill_tps":2.8383,"psram_free":14717088,"think_tps":2.33},"status":"keep","description":"Stage the engram tap matrices as float32 at open: read `taps` times per site per token. Device decode 2.6667 -> 2.6767 tok/s (+0.4%), boot bench 371 -> 370 ms/tok; byte-exact everywhere; +25 KB PSRAM.","timestamp":1789758859693,"segment":1,"confidence":3.7095501183898945,"asi":{"commit":"5f72770 committed before logging so a log-time revert cannot lose the change","cost":"+25 KB PSRAM; internal heap -64 B (scratch index change)","hypothesis":"stage the engram tap matrices as float32 at open (read `taps` times per site per token, 3 taps x 768 elements x 2 sites)","measured_effect":"decode 2.6667 -> 2.6767 (+0.4%), prefill +0.4%, extended +0.4%, boot bench 371 -> 370 ms/tok","next_action_hint":"fp16 staging is now complete for every per-token weight in the path. Remaining ideas are structural: dual-core coverage of the MLP/Sinkhorn, the attention online-softmax, or an int8 KV dot product.","quality":"byte-exact host 11/11, device 12/12, logit probe 9.537e-07, prefix-isolation green","sinkhorn_veto_note":"tested 20 -> 6 Sinkhorn iterations in the same session: boot bench 371 -> 368 ms/tok (+0.8%) but the logit probe moved to max_delta 7.77 and top1 6/10, so it is a quality change and was vetoed, not kept"}}
{"run":12,"commit":"5f72770","metric":2.6767,"metrics":{"boot_bench_tps":2.703,"device_output_exact":12,"device_token_delta":0,"ext_decode_tps":2.632,"gen_tokens":99,"host_output_exact":11,"internal_free":31755,"logit_max_delta":0,"logit_top1_match":10,"min_case_tps":2.54,"prefill_tps":2.8383,"psram_free":14717088,"think_tps":2.33},"status":"keep","description":"Verification rerun of the run #11 tree (2.6767 tok/s, all secondaries identical). In the same cycle the 4-bit-row norm hoist was measured against it and came out exactly neutral (370 vs 370 ms/tok boot bench, back-to-back flashes), so it was reverted rather than kept.","timestamp":1789763283334,"segment":1,"confidence":2.4736842105263093,"asi":{"candidate_note":"the intended candidate this cycle (4-bit norm hoist in nd_cq_gemv_rows / gemv_rows_generic) measured EXACTLY neutral against run #11: boot bench 370 ms/tok on both images, flashed back to back. Reverted, not kept.","changed":"nothing vs run #11 (5f72770)","hypothesis":"verification rerun of the run #11 tree, plus a null-result measurement of the 4-bit norm hoist","interpretation":"fp16 norm conversion is off the critical path in both GEMV flavours now; the remaining cost in that phase is the flash-streamed packed rows and the 16-entry table lookups, not arithmetic","next_action_hint":"arithmetic micro-optimisation in the GEMVs is exhausted (three nulls in a row: 2-bit hoist neutral, 4-bit hoist neutral, packed-word row read broken-and-reverted). Next real lever is structural: attention online-softmax (70ms) or dual-core coverage of the MLP. Otherwise the win is done: 1.2217 -> 2.6767.","result":"decode 2.6767, prefill 2.8383, ext 2.6320, think 2.3300, boot bench 370 ms/tok, identical heap figures to run #11"}}
