{"run":589,"commit":"e44fd08","metric":5.6117,"metrics":{"boot_bench_tps":5.658,"device_output_exact":18,"device_token_delta":52,"ext_decode_tps":5.5177,"gen_tokens":99,"host_output_exact":19,"internal_free":8415,"logit_max_delta":0.00005341,"logit_top1_match":10,"min_case_tps":5.35,"prefill_tps":5.925,"psram_free":2052252,"think_tps":4.39},"status":"keep","description":"Seed stack full-group breadth measured on board 1 at provenance 61861dd9886c: decode 5.6117, extended 5.5177, prefill 5.925, think 4.39, min_case 5.35, boot bench 5.658, internal_free 8,415, device_output_exact 18/20 with device_golden_missing 0 and token_delta 52, LANE_RC=1 exactly as the known goldens predict. The two divergences are the same boot-state-dependent pair heldout_interval_one and heldout_long_tools_note_only that reproduced on all three boards of the acceptance tree, and no third case diverged, so the seeded 2-bit kernel changed no output on 18 frozen cases including all six primary prompts. Against this board's own acceptance reading (5.5783 / 5.585 / 5.4838 / 4.37 / 5.31) every monitor moved the right way: decode +0.60 %, held-out extended +0.62 %, think +0.46 % so the unconstrained 4-bit/vocabulary path is unharmed, worst case better, and prefill +6.1 %, which is the expected larger effect because prefill pushes more rows through the same kernel. These extended/think/prefill/worst-case numbers are now this image's own measurements rather than carried values. Pin unchanged at 5.3033: the seed stack has two-board speed, 6/6 primary byte-exactness, a clean 18/20 full-suite profile and improved monitors, and what still gates admission is the owner's disposition of the two demo-timer goldens plus a behavioural capture on this image.","timestamp":1790275751847,"segment":1,"confidence":10.871056241426617,"asi":{"divergence":"18/20 with device_golden_missing 0 and token_delta 52, and the two named cases in this log are exactly heldout_interval_one and heldout_long_tools_note_only - the boot-state-dependent demo-timer goldens that failed identically on three boards of the acceptance tree. No third case diverged, so the seeded kernel introduced no quality regression.","hypothesis":"Measure the seed stack's own full-group quality and monitor breadth on the proposed image, which primary-only lanes never produced.","monitor_readings":"Same-board comparison against board 1's acceptance reading (decode 5.5783, prefill 5.585, ext 5.4838, think 4.37, min_case 5.31): seed stack decode 5.6117 (+0.60 %), extended 5.5177 (+0.62 % on held-out prompts), think 4.39 (+0.46 %, the unconstrained 8192-row path, so the 4-bit path is unharmed), min_case 5.35 (better worst case), prefill 5.925 (+6.1 %). The larger prefill gain is mechanistically expected: prefill runs far more rows per unit time through the same 2-bit kernel, so removing four instructions per group shows up bigger there.","previously_carried_now_measured":"ext_decode_tps, think_tps, prefill_tps and min_case_tps for the seed stack are now this image's own readings instead of inherited from the acceptance tree.","override_defense":"This ran under AUTO_ALLOW_REPEAT=1 with a stated reason (#588); the guard refused first, which is the correct order, and the value returned for that override is measured full-group evidence for the proposed image rather than a duplicated control.","next":"Admission evidence for the seed stack is now: two boards at 5.6117, 6/6 primary byte-exact, 18/20 full-suite with only the two known goldens, extended/think/prefill/worst-case all improved, capture-class behaviour still owed. Remaining above-bar levers are owner-gated."}}
{"run":590,"commit":"b9b54f2","metric":5.6117,"metrics":{"boot_bench_tps":5.658,"device_output_exact":18,"device_token_delta":52,"ext_decode_tps":5.5177,"gen_tokens":99,"host_output_exact":19,"internal_free":8415,"logit_max_delta":0.00005341,"logit_top1_match":10,"min_case_tps":5.35,"prefill_tps":5.925,"psram_free":2052252,"think_tps":4.39},"status":"keep","description":"Behavioural capture is GREEN on the seed stack: board 1 running provenance 61861dd9886c (the acceptance tree plus the first-W8D seed .S, installed deliberately so the single-board console path reaches the image under test) completed `make capture` with CAP_RC=0 and 23 verification flags true, zero false - covering routes, tools, two-pass local execution, external-stops-at-selection, no external calls, telemetry, sampling interval and timer expiry. That was the last piece of acceptance evidence the seed stack lacked, and it now holds alongside two boards reading decode 5.6117, 6/6 primary byte-exactness, an 18/20 full-suite profile whose only failures are the two boot-state-dependent demo-timer goldens reproduced on three boards, and improved extended (5.5177), think (4.39), prefill (5.925) and worst-case (5.35) monitors. I also corrected my own flag-counting method: the earlier 'nine flags' figure counted matching lines, and this log has 8 such lines but 23 true flag occurrences with zero false, so the verdict is reported on the false count. Teardown verified by pid with no console-holding child remaining, so all three boards are free. Pin unchanged at 5.3033 pending the owner's disposition of those two goldens.","timestamp":1790276833081,"segment":1,"confidence":10.871056241426617,"asi":{"capture":"make capture on board 1 running the seed stack (provenance 61861dd9886c, installed as a deliberate baseline change and the API was sole console owner): CAP_RC=0, 23 verification flag occurrences all true and zero false - routes, tools, two-pass local execution, external stops at selection, no external calls, telemetry, sampling interval, timer expiry.","honesty_note":"My earlier 'nine flags' phrasing came from counting LINES matching ': true', not occurrences; here the line count was 8 while the occurrence count is 23, so this time I report both and the zero-false count, which is what the verdict depends on.","hypothesis":"Run the repo's own behavioural capture against the seed stack image, the last acceptance evidence it lacked.","method_note":"API started on the board-1 console alias, gated on /health reporting ready:true (the correct predicate, per #568), then torn down by pid from bracketed pgrep patterns - no needle-api or serial-api child retains the console (remain=0) and both tmux panes are closed, so the board is free for the next lane.","next":"Seed-stack admission evidence is now complete short of the owner's decision on the two boot-state-dependent goldens: two boards at 5.6117, 6/6 primary byte-exact, 18/20 full-suite failing only those two, extended/think/prefill/worst-case all improved, and behavioural capture green on this exact image. Pin stays 5.3033 until the owner moves it.","state":"All three boards free; no candidate in flight."}}
{"run":591,"commit":"b9b54f2","metric":5.6117,"metrics":{"boot_bench_tps":5.658,"device_output_exact":18,"device_token_delta":52,"ext_decode_tps":5.5177,"gen_tokens":99,"host_output_exact":19,"internal_free":8415,"logit_max_delta":0.00005341,"logit_top1_match":10,"min_case_tps":5.35,"prefill_tps":5.925,"psram_free":2052252,"think_tps":4.39},"status":"keep","description":"Consolidated the seed stack's admission case into .auto/OWNER_ACCEPTANCE_PACKET.md and committed it, using a heredoc after a printf format-string failure (`%` before `)` - the shell's own error, no harm, and a reminder to quote-heavy text goes in a heredoc, not a printf format). The packet section states provenance 61861dd9886c, the snapshot path and .S md5, the mechanism, both boards' decode 5.6117 against each board's own clean control (+0.627 % and +0.599 %), 6/6 primary byte-exactness with token_delta 0, the full 20-case result 18/20 with missing 0 and only the two demo-timer goldens diverging, this image's own extended 5.5177 / think 4.39 / prefill 5.925 / min_case 5.35 against the same board's acceptance values, boot bench 5.658 and internal_free 8,415, CAP_RC=0 with zero false verification flags, fidelity 5.341e-05 and host 19/19 - and explicitly lists what was rejected on this base (fused prepare+LUT 0.000 %, two lutb_rows live-range edits at -0.090 %/-0.060 %, split granularity and spin budgets neutral) plus the off-device closures (+0.005 % and +0.05 % and the cold fw_scale path) so nobody spends a board re-testing them. No board time used, because no remaining priced idea carries mass above the 0.2 % bar. Pin unchanged at 5.3033; the seed stack is fully evidenced and awaits the owner's disposition of the two boot-state-dependent goldens.","timestamp":1790276947240,"segment":1,"confidence":10.871056241426617,"asi":{"hypothesis":"With the seed stack's evidence complete, the highest-value no-board action is to hand the owner a single reproducible table rather than leave the case scattered across lane logs and run entries.","next":"New candidates need real mass: instruction-count levers are spent (per-group seed shipped, per-row and 4-bit variants priced at +0.05 pct and +0.005 pct), synchronisation levers are spent after spin plus lean notifications made joins free, and delivery is bounded by the measured 13.90 pct PSRAM tax which needs megabytes, not kilobytes. The next thing worth a build therefore has to change what is computed or where bytes live - both owner-gated - or find a per-group-mass instruction I have not priced yet.","packet_now_covers":"Provenance and snapshot path with the .S md5, the mechanism in one sentence, both boards' decode readings against each board's own clean control, 6/6 primary byte-exact, the 18/20 full-suite result naming the two divergent goldens, the seed image's own extended/think/prefill/min_case versus that board's acceptance values, boot bench and heap, capture verdict, fidelity and host goldens - plus the list of things rejected on this base so nobody re-runs them.","why_no_board":"All three boards were idle with no candidate carrying measured mass above the 0.2 pct bar: the remaining priced ideas were +0.05 pct (tie1n per-row reseed), +0.005 pct (4-bit per-group seeding) and cold-path work, so a build would have measured noise rather than a hypothesis."}}
{"run":592,"commit":"b9b54f2","metric":5.6117,"metrics":{"boot_bench_tps":5.658,"device_output_exact":18,"device_token_delta":52,"ext_decode_tps":5.5177,"gen_tokens":99,"host_output_exact":19,"internal_free":8415,"logit_max_delta":0.00005341,"logit_top1_match":10,"min_case_tps":5.35,"prefill_tps":5.925,"psram_free":2052252,"think_tps":4.39},"status":"keep","description":"Started a phase re-map on the seed image: a profiled (AUTO_PROFILE=1, primary group) build on board 2 whose purpose is the ND_P_* attribution, not a speed number. The campaign's phase map predates two changes that matter for ranking - the spin/lean-notification handshake that made synchronisation free and the seed win that removed four instructions from 130,560 groups per token - and everything I can currently price by hand is sub-bar (+0.05 pct tie1n per-row reseed, +0.005 pct 4-bit per-group seeding, plus the cold fw_scale path), so the useful board time is measurement that can change which phase is worth attacking rather than another known-small edit. Profiled builds differ in codegen from shipping ones, so per run #410 no delta is claimed from its decode line; only phase fractions are read. The expectation file was removed because the profiled image has a new signature, so the anti-repeat guard was not overridden. Metrics rows are the seed stack's own previously measured values, not this profiled lane's. Pin unchanged at 5.3033.","timestamp":1790277012881,"segment":1,"confidence":10.871056241426617,"asi":{"hypothesis":"The phase map every ranking in this campaign uses was measured on a tree ~5 pct slower and before the instruction-count win; re-derive ND_P_* attributions on the seed image so the next candidate is ranked against where the time actually is now rather than where it was at 5.30.","diagnostic_not_a_speed_claim":"Profiled images differ in codegen from shipping ones - run #410 measured a profiled build reading +0.39 pct faster - so this lane's decode value is not a delta and will not be logged as one; only the phase fractions are the product.","next":"Read the ND_P_* table and re-rank: if a phase other than the 2-bit GEMV now owns enough of the token to matter, that is where the next build goes; if the 2-bit GEMV still dominates and is at its instruction floor, the honest conclusion is that nothing above the bar remains outside the owner-gated items.","why_this_and_not_another_micro_screen":"Every cheap candidate I can price now is under the 0.2 pct bar (tie1n per-row reseed +0.05 pct, 4-bit per-group seeding +0.005 pct, cold fw_scale), and the shipped instruction-floor analysis says the 2-bit kernel is at 2 instructions per weight after the seed win. Spending a board on a known sub-bar edit would be manufacturing work; spending one on measurement that can change the ranking is the alternative.","expect_engine_md5_removed":"Yes - this is a new profiled build with a different signature, so no anti-repeat override was used and the guard stays armed for future lanes."}}
{"run":593,"commit":"b9b54f2","metric":5.6117,"metrics":{"boot_bench_tps":5.658,"device_output_exact":18,"device_token_delta":52,"ext_decode_tps":5.5177,"gen_tokens":99,"host_output_exact":19,"internal_free":8415,"logit_max_delta":0.00005341,"logit_top1_match":10,"min_case_tps":5.35,"prefill_tps":5.925,"psram_free":2052252,"think_tps":4.39},"status":"keep","description":"Phase re-map on the seed image says the ranking is unchanged and no phase offers untried above-bar headroom. Boot-bench attribution: proj2bit 80.7 ms at 45.6 pct of a ~177 ms block, attention 33.4 ms, hadamard 21.7, engram 15.2, sinkhorn 3.0, rope 0.2, confpool and sample 0.0. Versus the old 197 ms map the 2-bit phase fell 86.2 -> 80.7 ms, exactly the direction and magnitude the seed win predicts, while attention, hadamard and engram each shed a similar fraction from the handshake and transform work since accepted; its share nevertheless rose to 45.6 pct because everything else got cheaper faster. That is the strongest form of the closure argument: the dominant phase is at 2 instructions per weight (8 extui + 8 addx4 + 8 lsi + 8 add.s per 32-bit index word, 16 weights), the second phase is at its measured floor across four tried schedules, the third is kron-saturated and its transform measured on width, fusion, pass count, rescale placement and stage order, and the fourth is the same 2-bit kernel. Diagnostic scope, so its decode line is not claimed as a delta per run #410. The remaining above-bar routes stay owner-gated (row residency against internal heap, vendor-blocked 120 MHz); engineer-side value now is admission follow-through and the open product defects. Pin unchanged at 5.3033 with the seed stack fully evidenced.","timestamp":1790277836607,"segment":1,"confidence":10.871056241426617,"asi":{"honest_next":"The map itself says the remaining above-bar items are the ones the owner holds: phi/4-bit and CQ2 row residency against internal heap, and the vendor-blocked memory clock. Engineer-side, the useful work now is admission follow-through and harness/product defects (the two boot-state goldens, the 271-byte silent request truncation, the schema's missing no-op escape), not another scheduling screen.","phase_comparison_to_old_map":"proj2bit 86.2 -> 80.7 ms (-6.4 pct), attention 35.3 -> 33.4, hadamard 24.4 -> 21.7, engram 16.4 -> 15.2, sinkhorn ~3.0, rope 0.2, confpool 0.0. The 2-bit share rose to 45.6 pct precisely because everything else also got cheaper, and it remains at its measured instruction floor.","read":"Boot-bench ND_P_* on the profiled seed image: proj2bit 80.7 ms = 45.6 pct of the block (so the block is ~177 ms), attention 33.4 ms, hadamard 21.7, engram 15.2, sinkhorn 3.0, rope 0.2, confpool 0.0, sample 0.0 (the bench never samples).","hypothesis":"Re-derive the phase map on the seed image to see whether any non-2-bit phase now owns enough of the token to be worth a build.","diagnostic_scope":"Profiled codegen differs from shipping, so this lane's decode line is not a speed claim (run #410); only the attribution is read.","conclusion":"No. The ranking is unchanged in kind: the 2-bit GEMV still owns 45.6 pct and is at 2 instructions per weight after the seed win, attention 19 pct is at its measured floor across four schedules, hadamard 12 pct is kron-saturated and transform-measured on every axis, engram 8.6 pct is its own CQ2 GEMVs at the same floor, and everything else is under 2 ms. Every candidate I could price from this map is either sub-bar or already closed on measurement."}}
{"run":594,"commit":"b9b54f2","metric":5.6117,"metrics":{"boot_bench_tps":5.658,"device_output_exact":18,"device_token_delta":52,"ext_decode_tps":5.5177,"gen_tokens":99,"host_output_exact":19,"internal_free":8415,"logit_max_delta":0.00005341,"logit_top1_match":10,"min_case_tps":5.35,"prefill_tps":5.925,"psram_free":2052252,"think_tps":4.39},"status":"keep","description":"Launched a gate-falsification experiment against the assembly path, because that is the one place the campaign's quality story has never been proven able to fail. Host goldens compile the C fallback, so hand-written Xtensa defects are invisible to the host pre-check; the device byte-exact gate is the only thing standing between a wrong tie1n and a kept 'win', and every earlier falsification mutation (#296-#298: golden text, reference logit, primary prompt, Sinkhorn budget) was visible to the host. The mutation is deliberate and scoped: inside nd_lut2_rows_tie1n, at line 670 of the label-to-label scope, the group-partial reset reads f5 (the row total) instead of f6 (+0.0), which must corrupt every group after the first and change generated text. The pass condition is a RED run - DEVICE_OUTPUT_DIVERGED, fewer than 6/6 byte-exact, non-zero exit. My first attempt edited the first matching line in the file, which turned out to be inside the unused tie1 kernel; restoring from /tmp/b3-s.S and re-scoping between the tie1n label and the next kernel is what kept this from measuring dead code and misreporting a weak gate. Provenance f9eaf8660d96, expectation asserted, anti-repeat armed. No speed claim in either direction; pin unchanged at 5.3033.","timestamp":1790277933532,"segment":1,"confidence":10.871056241426617,"asi":{"gate_falsification":"The campaign's central licence is that a fast-but-wrong change cannot pass, and six gates were proven falsifiable in runs #296-#298 - but none of those mutations were in the hand-written 2-bit assembly, which the host cannot see at all. If the device byte-exact gate cannot fail for a tie1n defect, then every asm claim in this campaign (the seed winner included) rests on an untested gate.","hypothesis":"Falsify the device byte-exact gate on the hand-written assembly path, where the host goldens are structurally blind: deliberately seed tie1n's group partials from the row total f5 instead of the +0.0 register f6 and require the device gate to refuse the run.","mutation_placement_rule":"The first attempt edited the first `mov.s f0, f6` in the file, which is in the UNUSED tie1 kernel - a dead-code mutation that would have measured the base and produced a false 'gate is weak' conclusion. Restored and re-applied inside the exact nd_lut2_rows_tie1n label-to-label scope (line 670), which is the shipped kernel; my own earlier lesson about scoping edits to tie1n is what caught this before launching.","expected":"device_output_exact below 6/6 with DEVICE_OUTPUT_DIVERGED and a non-zero exit. That is the pass condition for this experiment: a red run proves the gate works.","revert_plan":"The clean .S is saved at /tmp/b3-s.S and board 3's tree hash returns to 4d3094578050 afterwards; nothing here touches the seed snapshot or any board's acceptance base.","diagnostic_scope":"This is gate evidence, not a speed measurement: no decode value from this lane is a claim in either direction."}}
