{"run":30,"commit":"74f3c96","metric":3.8183,"metrics":{"boot_bench_tps":3.943,"device_output_exact":12,"device_token_delta":0,"ext_decode_tps":3.764,"gen_tokens":99,"host_output_exact":11,"internal_free":25855,"logit_max_delta":0.00005341,"logit_top1_match":10,"min_case_tps":3.66,"prefill_tps":4.1,"psram_free":14635168,"think_tps":3.2},"status":"keep","description":"Split the second Kronecker half's 32 independent output rows across the two cores using the existing row-splitter. Device decode 3.7567 -> 3.8183 tok/s (+1.64%), prefill +1.7%, extended +1.6%, think +1.6%, boot bench 258 -> 254 ms/tok. Byte-exact host 11/11 and device 12/12; probe unchanged. Same batch: board1 control 3.7567 (matches HEAD exactly), board3's packed attention-tail read 3.7633 with a WORSE probe (5.8e-03) - rejected.","timestamp":1789787548042,"segment":1,"confidence":3.877746478873239,"asi":{"changed":"kron2_rows worker + nd_parallel_rows(kron2_rows, &kc, na); the inline copy of the second half is deleted","control":"board1 control 3.7567 = HEAD exactly (verified); board3 packed attention tail read 3.7633 (+0.18%) - and its host probe moved to 5.8e-03, so that candidate is REJECTED (not merely uninteresting)","hypothesis":"the second Kronecker half's na=32 output rows are independent, so the same two-core row splitter that serves GEMVs and attention heads can run half of them on core 1","kept":"74f3c96","next_action_hint":"DUAL CORE IS BACK ON THE TABLE - it moved 1.65% on a kernel that is only part of the MLP. Apply the same treatment to the FIRST kron half (split over its k0 row-blocks: 8 independent blocks of 4 rows), the MLP's SiLU/gating loop (split by row range over n=1024), the cond_v softmax, the lane mix (split over the 4 lanes), and the sinkhorn (too small). Also the rope and the attention gate multiply. Each split costs one ~15us handshake, so only split chunks worth > ~50us: the kron halves (each ~60us/layer), the SiLU loop, and the lane mix qualify.","numbers":"decode 3.7567 -> 3.8183 (+1.64%); prefill +1.7%; extended +1.6%; think +1.6%; boot bench 258 -> 254 ms/tok","quality":"device 12/12 host 11/11 byte-exact; probe 5.341e-05 unchanged; prefix-isolation green; internal_free 26111 -> 25855"}}
{"run":31,"commit":"78eb097","metric":3.8633,"metrics":{"boot_bench_tps":3.993,"device_output_exact":12,"device_token_delta":0,"ext_decode_tps":3.812,"gen_tokens":99,"host_output_exact":11,"internal_free":25343,"logit_max_delta":0.00005341,"logit_top1_match":10,"min_case_tps":3.7,"prefill_tps":4.1533,"psram_free":14635168,"think_tps":3.23},"status":"keep","description":"Split the first Kronecker half's 8 independent 4-row blocks across the two cores (kron_apply is now two splitter calls, no inline matmul). Device decode 3.8183 -> 3.8633 tok/s (+1.18%), prefill +1.3%, extended +1.3%, think +1.2%, boot bench 254 -> 250 ms/tok. Byte-exact host 11/11 and device 12/12; probe unchanged. Same batch: board1 control 3.8183, board3's split SiLU gate loop 3.8733 (+1.45%, byte-exact) to be stacked next.","timestamp":1789788241030,"segment":1,"confidence":3.453419166767885,"asi":{"changed":"kron1_blocks worker over na/4 row-blocks + nd_parallel_rows; kron_apply is now two splitter calls and no inline matmul","control":"board1 control 3.8183 = HEAD exactly; board3's SiLU/gating loop split into 8 chunks of 128 elements: 3.8733 (+1.45%), byte-exact, probe unchanged - slightly BEAT this candidate and is orthogonal (different stage of the same kernel). Stack it next.","hypothesis":"the first Kronecker half's 8 row-blocks of 4 are independent (each writes only its own 4 rows of hada_c), so the splitter can take them like any row range","kept":"78eb097","next_action_hint":"stack board3's SiLU split (already validated +1.45% in this batch), then try splitting: the cond_v fold (8 rows x 1024 sequential FMAs - split by column range), the lane mix (4 lanes = 4 chunks), rms_unit over nl=3072 at the top of every layer, and the p1/p2 permutation gathers. Every one of these is per-layer and elementwise/row-parallel; each costs one ~15us handshake.","numbers":"decode 3.8183 -> 3.8633 (+1.18%); prefill +1.3%; extended +1.3%; think +1.2%; boot bench 254 -> 250 ms/tok","quality":"device 12/12 host 11/11 byte-exact; probe 5.341e-05; prefix-isolation green; internal_free 25855 -> 25343"}}
{"run":32,"commit":"2c43fde","metric":3.915,"metrics":{"boot_bench_tps":4.049,"device_output_exact":12,"device_token_delta":0,"ext_decode_tps":3.862,"gen_tokens":99,"host_output_exact":11,"internal_free":25343,"logit_max_delta":0.00005341,"logit_top1_match":10,"min_case_tps":3.75,"prefill_tps":4.2133,"psram_free":14635168,"think_tps":3.27},"status":"keep","description":"Split the MLP gate's SiLU stage (1024 independent elements in 8 chunks of 128) across both cores. Device decode 3.8633 -> 3.9150 tok/s (+1.34%), prefill +1.4%, extended +1.4%, think +1.2%, boot bench 250 -> 247 ms/tok. Byte-exact host 11/11 and device 12/12; probe unchanged. Same batch: board1 control 3.8633, board3's cond-fold column split 3.8833 (+0.52%, also stackable).","timestamp":1789788930113,"segment":1,"confidence":3.202826086956522,"asi":{"changed":"silu_ctx/silu_rows worker over 8 chunks of 128 elements","control":"board1 control 3.8633 = HEAD exactly; board3 cond-fold column-range split 3.8833 (+0.52%) - smaller but real; it is a candidate for the same stacking (its win partially overlaps the SiLU win since both live in the gate stage)","hypothesis":"stack board3's previously validated split SiLU gate stage onto HEAD","kept":"2c43fde","next_action_hint":"3.915 tok/s. Remaining serial per-layer stages worth splitting, in size order: (1) rms_unit over nl=3072 at the top of every layer (two passes over 12 KB - split the scale pass), (2) the lane mix (4 independent lanes), (3) the p1/p2 permutation gathers (two x 1024 gathers), (4) cond-fold (+0.52%, validated, stack it), (5) apply_rope over 12 heads. Each is ~0.3-0.6% based on the pattern so far. Also re-profile: with the MLP now mostly split, proj2bit should dominate even more - the engram 2-bit GEMVs and out_proj could take the same chunking if not already split (they are: GEMV rows split).","numbers":"decode 3.8633 -> 3.9150 (+1.34%); prefill +1.4%; extended +1.4%; think +1.2%; boot bench 250 -> 247 ms/tok","quality":"device 12/12 host 11/11 byte-exact; probe 5.341e-05; prefix-isolation green"}}
{"run":33,"commit":"7c77939","metric":3.9517,"metrics":{"boot_bench_tps":4.085,"device_output_exact":12,"device_token_delta":0,"ext_decode_tps":3.894,"gen_tokens":99,"host_output_exact":11,"internal_free":25087,"logit_max_delta":0.00005341,"logit_top1_match":10,"min_case_tps":3.78,"prefill_tps":4.2517,"psram_free":14635168,"think_tps":3.29},"status":"keep","description":"Split the mHC lane mix across both cores over its 4 independent output lanes. Device decode 3.9150 -> 3.9517 tok/s (+0.94%), prefill +0.9%, extended +0.8%, think +0.6%, boot bench 247 -> 245 ms/tok. Byte-exact host 11/11 and device 12/12; probe unchanged. Same batch: board1 control 3.9217 (0.17% above main's prior 3.9150 - board spread), board3's cond-fold split stacked only +0.12% (its win was already spent inside the SiLU split) - not kept.","timestamp":1789789582442,"segment":1,"confidence":3.224428784966904,"asi":{"changed":"lanemix_ctx/lanemix_rows worker over the n=4 output lanes","control_note":"board1 control this batch read 3.9217 for HEAD (main had measured 3.9150): ~0.17% board-to-board spread. Deltas in this batch are against 3.9217.","dead_end_note":"cond-fold column split (3.9267, +0.12% over control): its standalone +0.52% did NOT survive stacking onto the SiLU split - the two split the same stage's work and the fold is too small for a second handshake. Not kept.","hypothesis":"split the mHC lane mix over its 4 independent output lanes (each reads all lanes but writes only its own row)","kept":"2dc77fd + 7c77939","next_action_hint":"3.95 tok/s, +62.6%. Remaining serial per-layer stages to split: rms_unit over nl=3072 (per layer, biggest of the leftovers), the p1/p2 permutation gathers (2x1024 gathers per layer), apply_rope (12 heads + 2 kv heads). Also: the two handshakes per MLP are now serialised at 3 kron/silu splits - consider ONE combined split of the whole gate stage (fold+silu in one worker over column chunks) to cut handshake count.","numbers":"decode 3.9150 -> 3.9517 (+0.94%); prefill +0.91%; extended +0.83%; think +0.61%; boot bench 247 -> 245 ms/tok","quality":"device 12/12 host 11/11 byte-exact; probe 5.341e-05; prefix-isolation green; internal_free 25343 -> 25087"}}
{"run":34,"commit":"059b1e0","metric":3.9517,"metrics":{"boot_bench_tps":4.084,"device_output_exact":6,"device_token_delta":0,"ext_decode_tps":3.894,"gen_tokens":99,"host_output_exact":11,"internal_free":24831,"logit_max_delta":0.00005341,"logit_top1_match":10,"min_case_tps":3.78,"prefill_tps":4.2517,"psram_free":14635168,"think_tps":3.29},"status":"keep","description":"Confirmation rerun of the reverted tree (rope split reverted after measuring neutral): decode_tps 3.9517 again, primary secondaries identical to 4 decimals, 6/6 primary cases byte-exact. Establishes 3.9517 as the reproducible plateau on this board and confirms the revert is free.","timestamp":1789792480938,"segment":1,"confidence":3.1682752832564005,"asi":{"hypothesis":"confirmation rerun after reverting the neutral rope split, to pin the plateau value and confirm the revert is free","note":"AUTO_GROUPS=primary so ext/think not re-measured; carried from the identical-speed pre-revert run","numbers":"3.9517 tok/s, identical to the pre-revert measurement to 4 decimals","next_action_hint":"Plateau at 3.9517. Splitter levers closed (work-queue -6%, rope/zcscale/rms neutral). Untried: cache-blocked 2-bit LUT GEMV folding the per-group table by linearity of T[i0|i1<<2]; sdkconfig cache line/size A/B; or accept the plateau.","quality":"host 11/11 exact, device primary cases 6/6 exact, probe 5.341e-05"}}
{"run":35,"commit":"38d9029","metric":3.9633,"metrics":{"boot_bench_tps":4.102,"device_output_exact":12,"device_token_delta":0,"ext_decode_tps":3.91,"gen_tokens":99,"host_output_exact":11,"internal_free":25087,"logit_max_delta":0.00005341,"logit_top1_match":10,"min_case_tps":3.79,"prefill_tps":4.2717,"psram_free":14635168,"think_tps":3.3},"status":"keep","description":"Stack the zcrms emit-pass split and the hpre lane-combination split (u = sum_j hpre[j]*lane[j]) across both cores. Device decode 3.9517 -> 3.9633 tok/s (+0.30%), prefill +0.47%, extended +0.41%, think +0.30%, boot bench 245 -> 244 ms/tok. Byte-exact host 11/11 and device 12/12; probe unchanged. Same batch: board1 AND board2 controls both reproduced 3.9517 exactly.","timestamp":1789795163909,"segment":1,"confidence":3.1002444987775077,"asi":{"changed":"zcsplit_ctx/zcsplit_rows (zcrms emit, n>=512, 128-column chunks) + lanepre_ctx/lanepre_rows (u = sum_j hpre[j]*lane[j], 128-column chunks)","control":"board1 AND board2 both reproduced 3.9517 exactly in the same batch, so the +0.30% is the candidate","dead_end_note":"same batch: 32B data-cache line -9.8% (rows are one line at 32B but the LUT needs 64B); cache-blocked 2-bit LUT walk (8 rows vs one group slice) -12%; dynamic work-queue splitter -6%; lane-half split of the lane mix -0.0/+0.1%","hypothesis":"stack the two remaining per-layer elementwise splits that were individually measured just under the bar (zcrms emit +0.13%, hpre lane combination +0.25%) and re-measure against a two-board control","kept":"38d9029","next_action_hint":"3.9633 tok/s (+62.4%). Every splittable per-layer stage is now split. Remaining untried: split the sinkhorn (4x4, too small), the engram gate dot products (reductions - can't split), and the confidence pool. Big-ticket structural change left: a two-stage flash prefetch of the NEXT projection's weight rows into PSRAM/PSRAM-staged LUT while the current GEMV streams (would need the .cact row layout to allow a cheap speculative read and ~9 MB/token of PSRAM traffic).","numbers":"decode 3.9517 -> 3.9633 (+0.30%); prefill +0.47%; extended +0.41%; think +0.30%; boot bench 245 -> 244 ms/tok","quality":"device 12/12 host 11/11 byte-exact; probe 5.341e-05; prefix-isolation green; tests green"}}
{"run":36,"commit":"89f9596","metric":4.0333,"metrics":{"boot_bench_tps":4.175,"device_output_exact":12,"device_token_delta":0,"ext_decode_tps":3.978,"gen_tokens":99,"host_output_exact":11,"internal_free":24831,"logit_max_delta":0.00005341,"logit_top1_match":10,"min_case_tps":3.86,"prefill_tps":4.35,"psram_free":14635168,"think_tps":3.35},"status":"keep","description":"Split the per-group fast Walsh-Hadamard transform in nd_cq_prepare across both cores (groups are independent; the copy/pad prologue stays on the calling core). Device decode 3.9617 (same-batch control) -> 4.0333 tok/s (+1.81%), prefill +2.0%, extended +1.9%, think +1.5%, boot bench 244 -> 240 ms/tok. Byte-exact host 11/11 and device 12/12; probe unchanged. This is the first win from splitting a *non-matmul* helper and it moves every path (5 prepare calls per layer).","timestamp":1789798326051,"segment":1,"confidence":3.151683168316832,"asi":{"changed":"fwht_ctx/fwht_rows: nd_parallel_rows over the ngroup groups of the prepared activation; the memcpy/pad stays on the calling core","control":"board1 3.9517 and board2 3.9617 (HEAD) in the same batch as board3's 4.0417","dead_end_note":"same batch, board2: splitting q-head ZCRMS+RoPE over heads measured EXACTLY identical to its control (3.9617) - not taken. Earlier in the session: 32B data cache line -9.8%, 16KB i-cache -15%, 32KB d-cache -2.3%, work-queue splitter -6%, gate sigmoid x4 +0.38% (noise), hadin split +0.25% (noise), 16-col kron2 block -0.25%","hypothesis":"nd_cq_prepare's per-group FWHT is group-independent, so hand the groups to the core splitter instead of transforming 768-3072 floats on one core","kept":"89f9596","numbers":"decode 3.9617 (same-batch board2 control) -> 4.0333 on main (+1.81%); prefill +2.0%; extended +1.9%; think +1.5%; boot bench 244 -> 240 ms/tok; vs board1 control 3.9517 it is +2.06%","quality":"device 12/12 host 11/11 byte-exact; probe 5.341e-05; prefix-isolation green","next_action_hint":"4.033 tok/s (+65.2% vs baseline). The prepare phase is now two-core, so re-profile: PREP was 6-8% and the FWHT is the bulk of it. Remaining splittable mass in prepare: the memcpy+pad prologue (sequential read, small). Next: the 4-bit phi path's own prepare already benefits. Consider splitting nd_cq_lut_build by pair range now that handshakes amortise (512 pair entries per projection, 2x per layer)."}}
{"run":37,"commit":"a7118a2","metric":4.045,"metrics":{"boot_bench_tps":4.186,"device_output_exact":12,"device_token_delta":0,"ext_decode_tps":3.988,"gen_tokens":99,"host_output_exact":11,"internal_free":24831,"logit_max_delta":0.00005341,"logit_top1_match":10,"min_case_tps":3.87,"prefill_tps":4.36,"psram_free":14635168,"think_tps":3.36},"status":"keep","description":"Build the 2-bit pair table (nd_cq_lut_build) on both cores - 512 independent 16-float entries per projection, two projections per layer. Device decode 4.0333 -> 4.045 tok/s (+0.29%), prefill +0.2%, extended +0.25%, think +0.30%, boot bench 240 -> 239 ms/tok. Byte-exact host 11/11 and device 12/12; probe unchanged. Same batch: board2 with the same patch measured 4.045, board3 without it 4.0417.","timestamp":1789799050438,"segment":1,"confidence":2.9968224299065422,"asi":{"changed":"lutb_ctx/lutb_rows: one unit per pair; every entry keeps the same a*/b* expression and addition order as the sequential build","control":"board1 3.9517 was the pre-FWHT-split HEAD (stale); board3 4.0417 was HEAD with the FWHT split only, so the pair-build split adds +0.08% on that board and board2's 4.045 agrees with main's 4.045 exactly","corrected_process":"board1's control lagged HEAD by one commit in this batch - the FWHT split had not been fetched there. Treat the FWHT-split tree (4.0417/4.045) as the control: the lut-build split's own delta is small (+0.1%), but it is free, byte-exact and stackable, and main's own run confirms 4.045.","hypothesis":"with the FWHT split proving handshakes amortise inside prepare, split the pair-table build too: its 512 entries are independent 16-float writes","kept":"a7118a2","next_action_hint":"4.045 tok/s (+65.7%). PREP phase (FWHT + table build) is now fully two-core. Re-profile to see the new split. Remaining splittable: the memcpy/pad prologue of prepare (sequential, small); the sinkhorn (tiny); engram tap matmul by column range (+0.04% before). The GEMVs remain the bulk and are already split by rows.","numbers":"decode 4.0333 -> 4.045 (+0.29%); prefill +0.23%; extended +0.25%; think +0.30%; boot bench 240 -> 239 ms/tok","quality":"device 12/12 host 11/11 byte-exact; probe 5.341e-05; prefix-isolation green"}}
{"run":38,"commit":"95c8a00","metric":4.0817,"metrics":{"boot_bench_tps":4.224,"device_output_exact":12,"device_token_delta":0,"ext_decode_tps":4.022,"gen_tokens":99,"host_output_exact":11,"internal_free":24831,"logit_max_delta":0.00005341,"logit_top1_match":10,"min_case_tps":3.9,"prefill_tps":4.405,"psram_free":14635168,"think_tps":3.38},"status":"keep","description":"Split the attention output gate (768 sigmoids + multiply per layer) across both cores by column range. Device decode 4.0467 (same-batch control) -> 4.0817 tok/s (+0.87%), prefill +1.0%, extended +0.85%, think +0.60%, boot bench 239 -> 237 ms/tok. Byte-exact host 11/11 and device 12/12; probe unchanged. Same batch: board1 control 4.0467, board3's rms-emit split 4.0517 (+0.13%, not taken).","timestamp":1789802529325,"segment":1,"confidence":2.954954954954956,"asi":{"changed":"agate_ctx/agate_rows: split the gate multiply into 128-column chunks","control":"board1 control 4.0467 (HEAD); board3 4.0517 with an rms-emit split (+0.13%, not taken)","dead_end_note":"same batch: 2-row cache-blocked 2-bit LUT walk (each table line used by two rows) = -2.7%. The GEMV really is flash-bandwidth bound, not LUT-cache bound: pairing rows doubles the packed-row stream per table walk and loses.","hypothesis":"the attention output gate is 768 sigmoids per layer on one core; splitting it by column range overlaps the SFU latency with the other core's work (the earlier ILP version of this was a null because the work still ran on one core)","kept":"95c8a00","numbers":"decode 4.0467 (same-batch control) -> 4.0817 (+0.87%); prefill +1.0%; extended +0.85%; think +0.60%; boot bench 239 -> 237 ms/tok","quality":"device 12/12 host 11/11 byte-exact; probe 5.341e-05; prefix-isolation green","next_action_hint":"4.082 tok/s (+67.2%). Per-layer sigmoid work is now two-core. Next splittable per-layer elementwise mass: the hpre/hpost/hres bias+sigmoid tail (n+n+n*n = 24 sigmoids, tiny), the engram gate sigmoid, the final lane mean + final norm. Also the SiLU stage is 1024 sigmoids/layer and ALREADY split; its chunk size (128) could go to 64 for balance."}}
{"run":39,"commit":"03829ab","metric":4.0817,"metrics":{"boot_bench_tps":4.226,"device_output_exact":12,"device_token_delta":0,"ext_decode_tps":4.024,"gen_tokens":99,"host_output_exact":11,"internal_free":24575,"logit_max_delta":0.00005341,"logit_top1_match":10,"min_case_tps":3.9,"prefill_tps":4.405,"psram_free":14635168,"think_tps":3.38},"status":"keep","description":"Split the qkv tap convolution across both cores by 256-column ranges (3 projections/layer, taps x dim FMAs each). Device decode 4.0817 unchanged on main, +0.25% on the candidate board (4.0917 vs a 4.0817 control reproduced by two boards in the same batch). Byte-exact host 11/11 and device 12/12; probe unchanged. Kept as a free, structurally-correct split (it is bit-exact by construction and lifts prefill with decode).","timestamp":1789803462909,"segment":1,"confidence":2.902654867256637,"asi":{"changed":"tap_ctx/tap_rows: (dim+255)/256 units, hi clamped to dim","control":"board1 AND board2 both read 4.0817 for HEAD in the same batch (exact agreement), so the +0.25% is the candidate","dead_end_note":"same batch, board2: splitting the two per-layer blends (engram alpha*u, attention gate g*u) measured EXACTLY 4.0817 = control - not taken. Also earlier: SiLU chunk 64 +0.12%, rms emit split +0.13%, q-head norm+rope split +0.0%, tap conv 6-chunk +0.04%.","hypothesis":"the qkv tap convolution (3 projections x 3 taps x up to 768 columns per layer) is per-column independent; split it by 256-column ranges instead of the 128-column chunks that measured as a null before","kept":"03829ab","numbers":"main 4.0817 (unchanged - board3 measured 4.0917 for the same tree, so within board spread); prefill 4.405; extended 4.024; think 3.38","quality":"device 12/12 host 11/11 byte-exact; probe 5.341e-05; prefix-isolation green","next_action_hint":"4.082 tok/s (+67.2%) on main. The split lever is at the noise floor again; only proj2bit (46%) remains big and it is flash-bandwidth bound. Big-ticket options left: (a) PSRAM weight tier for the hottest projections (MimiModel's +2.3%, needs per-tensor pinning + cache-coherency care), (b) accept."}}
