{"run":196,"commit":"1323a38","metric":4.8917,"metrics":{"prefill_tps":5.2167,"ext_decode_tps":4.81,"think_tps":3.87,"boot_bench_tps":4.984,"min_case_tps":4.67,"gen_tokens":99,"internal_free":15759,"psram_free":2052252,"device_output_exact":14,"device_token_delta":0,"logit_max_delta":0.00005341,"logit_top1_match":10,"host_output_exact":13},"status":"keep","description":"Build-integrity check plus verification run. Confirmed the TIE728 kernel is really in the shipping image rather than silently falling back to C: -DND_LUT2_ASM=1 appears in the compile commands, and nm on the linked ELF shows nd_lut2_rows_tie1n at IRAM 0x4037dd5b next to the retained nd_lut2_rows_c fallback - the cheap substitute for a NEEDLE_LUT2_ASM=OFF ablation, which would cost a build and a flash to reconfirm a 13% number already measured. Run: 4.8917 decode / 4.81 extended / 3.87 think / 4.67 min case, 14/14 device byte-exact. boot-only metrics carried (this session skipped boot).","timestamp":1790009225070,"segment":1,"confidence":23.717328170377556,"asi":{"hypothesis":"Verify the asm path is linked rather than re-deriving its speed, since a silent C fallback would look like a 13% regression that is really a build defect.","state":"Accepted 4.8917 (+100.5%); 14+13 byte-exact; capture green #188.","next":"Verification cycles."}}
{"run":197,"commit":"1323a38","metric":4.8917,"metrics":{"prefill_tps":5.2167,"ext_decode_tps":4.81,"think_tps":3.87,"boot_bench_tps":4.984,"min_case_tps":4.67,"gen_tokens":99,"internal_free":15759,"psram_free":2052252,"device_output_exact":14,"device_token_delta":0,"logit_max_delta":0.00005341,"logit_top1_match":10,"host_output_exact":13},"status":"keep","description":"Verification cycle: 4.8917 decode / 4.81 extended / 3.87 think / 4.67 min case, 14/14 device + 13/13 host byte-exact. No change taken. boot-only metrics carried (session skipped boot).","timestamp":1790009382100,"segment":1,"confidence":23.717328170377556,"asi":{"hypothesis":"Verification of the accepted runtime.","state":"Accepted 4.8917 (+100.5%).","next":"Verification."}}
{"run":198,"commit":"1323a38","metric":4.8917,"metrics":{"prefill_tps":5.2167,"ext_decode_tps":4.81,"think_tps":3.87,"boot_bench_tps":4.984,"min_case_tps":4.67,"gen_tokens":99,"internal_free":15759,"psram_free":2052252,"device_output_exact":14,"device_token_delta":0,"logit_max_delta":0.00005341,"logit_top1_match":10,"host_output_exact":13},"status":"keep","description":"Full rebuild + flash + 14-case verification, all metrics measured this session: 4.8917 decode / 4.81 extended / 3.87 think / 5.2167 prefill / 4.67 min case, 14/14 device + 13/13 host byte-exact, fidelity 5.341e-05 top1 10/10, boot bench 4.984 (201 ms/token), internal_free 15759, psram_free 2,052,252. No change taken.","timestamp":1790009611264,"segment":1,"confidence":23.717328170377556,"asi":{"hypothesis":"Full-session quality gate on the accepted runtime.","state":"Accepted 4.8917 (+100.5%); capture green #188, next ~#198+.","next":"Verification; capture and batch coming up."}}
{"run":199,"commit":"1323a38","metric":4.8917,"metrics":{"prefill_tps":5.2167,"ext_decode_tps":4.81,"think_tps":3.87,"boot_bench_tps":4.984,"min_case_tps":4.67,"gen_tokens":99,"internal_free":15759,"psram_free":2052252,"device_output_exact":14,"device_token_delta":0,"logit_max_delta":0.00005341,"logit_top1_match":10,"host_output_exact":13},"status":"keep","description":"Verification cycle: 4.8917 decode / 4.81 extended / 3.87 think / 4.67 min case, 14/14 device + 13/13 host byte-exact. No change taken. Deliberately deferred make capture: it has been green four times (runs #157, #169, #179, #188) and the shipping code has not changed since #176, so re-running it would add cost and no information - it goes back on the schedule for the next code change.","timestamp":1790009772026,"segment":1,"confidence":20.139745170571345,"asi":{"hypothesis":"Verification of the accepted runtime; boot-only metrics carried (session skipped boot).","state":"Accepted 4.8917 (+100.5%); capture green at the current code (#188).","next":"Verification; capture only on the next code change; batch every ~5 cycles."}}
{"run":200,"commit":"1323a38","metric":4.8917,"metrics":{"prefill_tps":5.2167,"ext_decode_tps":4.81,"think_tps":3.87,"boot_bench_tps":4.985,"min_case_tps":4.67,"gen_tokens":99,"internal_free":15759,"psram_free":2052252,"device_output_exact":14,"device_token_delta":0,"logit_max_delta":0.00005341,"logit_top1_match":10,"host_output_exact":13},"status":"keep","description":"Verification repeat (board rebooted at session start, so boot metrics measured): 4.8917 decode, 6/6 primary byte-exact, boot bench 4.985 (201 ms/token), internal_free 15759, psram_free 2,052,252. No change taken.","timestamp":1790009932538,"segment":1,"confidence":17.500000000000043,"asi":{"hypothesis":"Verification repeat of the accepted runtime.","state":"Accepted 4.8917 (+100.5%).","next":"Batch next cycle."}}
{"run":201,"commit":"1323a38","metric":4.8917,"metrics":{"prefill_tps":5.2167,"ext_decode_tps":4.81,"think_tps":3.87,"boot_bench_tps":4.985,"min_case_tps":4.67,"gen_tokens":99,"internal_free":15759,"psram_free":2052252,"device_output_exact":14,"device_token_delta":0,"logit_max_delta":0.00005341,"logit_top1_match":10,"host_output_exact":13},"status":"keep","description":"Verification cycle plus the seventh three-board batch: all three boards 4.8917 / 4.81 / 4.67 byte-exact 14/14; canonical primary repeat identical. No change taken.","timestamp":1790011462946,"segment":1,"confidence":16.79808021940352,"asi":{"hypothesis":"Drift tracking, seventh batch of 4.8917.","state":"Accepted 4.8917 (+100.5%); 200+ logged runs; zero drift across 7 batches.","next":"Verification."}}
{"run":202,"commit":"1323a38","metric":4.8917,"metrics":{"prefill_tps":5.2167,"ext_decode_tps":4.81,"think_tps":3.87,"boot_bench_tps":4.984,"min_case_tps":4.67,"gen_tokens":99,"internal_free":15759,"psram_free":2052252,"device_output_exact":14,"device_token_delta":0,"logit_max_delta":0.00005341,"logit_top1_match":10,"host_output_exact":13},"status":"keep","description":"Full rebuild + flash + 14-case verification, all metrics measured: 4.8917 decode / 4.81 extended / 3.87 think / 5.2167 prefill / 4.67 min case, 14/14 device + 13/13 host byte-exact, fidelity 5.341e-05 top1 10/10, boot 4.984 (201 ms/token), internal_free 15759. Docs: current-state block added to .auto/prompt.md so the accepted value and cadence rules survive context compaction. No change taken.","timestamp":1790011733006,"segment":1,"confidence":16.150296638101523,"asi":{"hypothesis":"Full-session gate on the accepted runtime.","state":"Accepted 4.8917 (+100.5%).","next":"Verification cycles."}}
{"run":203,"commit":"1323a38","metric":4.8917,"metrics":{"prefill_tps":5.2167,"ext_decode_tps":4.81,"think_tps":3.87,"boot_bench_tps":4.984,"min_case_tps":4.67,"gen_tokens":99,"internal_free":15759,"psram_free":2052252,"device_output_exact":14,"device_token_delta":0,"logit_max_delta":0.00005341,"logit_top1_match":10,"host_output_exact":13},"status":"keep","description":"Verification repeat: 4.8917, 6/6 primary byte-exact. No change taken; ext/think/boot-only metrics carried from #202's full session.","timestamp":1790011824610,"segment":1,"confidence":13.122656668452073,"asi":{"hypothesis":"Verification repeat.","state":"Accepted 4.8917 (+100.5%).","next":"Verification."}}
{"run":204,"commit":"1323a38","metric":4.3117,"metrics":{"prefill_tps":4.5633,"ext_decode_tps":4.2471,"think_tps":3.5,"boot_bench_tps":4.384,"min_case_tps":4.14,"gen_tokens":99,"internal_free":16791,"psram_free":2052252,"device_output_exact":14,"device_token_delta":0,"logit_max_delta":0.00005341,"logit_top1_match":10,"host_output_exact":13},"status":"discard","description":"Ablation (deliberately slower, run for information, not a candidate): rebuilt the current tree with -DNEEDLE_LUT2_ASM=OFF so the 2-bit GEMV takes the retained C row walker. decode 4.3117 vs 4.8917 - the TIE728 kernel is worth +13.45% at today's operating point, against the +13.0% measured at #137 when the tree was 4.19 tok/s, so its contribution has survived 60+ later changes. Also prefill 4.5633 (vs 5.2167), think 3.50 (vs 3.87), boot bench 228 ms/token (vs 201), internal_free 16791 (vs 15759, the ~1 kB IRAM kernel). Most valuable secondary: the C build is byte-exact 14/14 as well, which independently confirms the handwritten kernel and the C kernel agree on device rather than merely agreeing with the goldens. Nothing to keep; the CMake cache option is restored to ON next cycle.","timestamp":1790012227040,"segment":1,"confidence":16.150296638101523,"asi":{"hypothesis":"Re-measure a large kept lever at the current operating point instead of trusting a 65-run-old number, and check whether the asm path is still load-bearing.","note_on_revert":"log_experiment's auto-revert only touches tracked files; NEEDLE_LUT2_ASM lives in the gitignored esp32/sdkconfig/CMakeCache, so the flag has to be reset by hand - doing that immediately and re-verifying through compile_commands.json plus a run.","value":"Two things a verification repeat could not give: the asm kernel's margin is stable at ~13% across two very different firmware states, and the C fallback is byte-exact on the same 14 goldens, so agreement between the two kernels holds on device, not just against the goldens.","state":"Accepted runtime unchanged at 4.8917 (+100.5%).","next":"Restore -DNEEDLE_LUT2_ASM=ON, re-verify the define and the ELF symbol, and re-measure 4.8917."}}
{"run":205,"commit":"1323a38","metric":4.8917,"metrics":{"prefill_tps":5.2167,"ext_decode_tps":4.81,"think_tps":3.87,"boot_bench_tps":4.984,"min_case_tps":4.67,"gen_tokens":99,"internal_free":15759,"psram_free":2052252,"device_output_exact":14,"device_token_delta":0,"logit_max_delta":0.00005341,"logit_top1_match":10,"host_output_exact":13},"status":"keep","description":"Post-ablation restore: NEEDLE_LUT2_ASM back to ON (cache verified, -DND_LUT2_ASM back in 7 compile commands) and the accepted runtime re-measured through a full rebuild + flash + 14 cases: 4.8917 decode / 4.81 extended / 3.87 think / 5.2167 prefill / 4.67 min case, 14/14 device + 13/13 host byte-exact, boot bench 4.984 (201 ms/token), internal_free back down to 15759 (the IRAM kernel is linked again). Build configuration is now identical to the accepted one, verified rather than assumed.","timestamp":1790012486715,"segment":1,"confidence":13.122656668452073,"asi":{"hypothesis":"Restore the accepted build configuration after the ablation and prove it by measurement rather than by having typed the flag.","state":"Accepted 4.8917 (+100.5%) re-established with verified build flags.","next":"Verification cycles; ablations like #204 are the informative non-repeat experiment, one every few cycles."}}
{"run":206,"commit":"1323a38","metric":4.8917,"metrics":{"prefill_tps":5.2167,"ext_decode_tps":4.81,"think_tps":3.87,"boot_bench_tps":4.982,"min_case_tps":4.67,"gen_tokens":99,"internal_free":15759,"psram_free":2052252,"device_output_exact":14,"device_token_delta":0,"logit_max_delta":0.00005341,"logit_top1_match":10,"host_output_exact":13},"status":"discard","description":"Pull the PSRAM weight tier's low end down to include the logits embedding, then discard as a verified null. ND_TIER_TRACE (a knob already in the tree) showed emb=11136..3255168 with in_span=0: the output-projection rows and candidate gather rows, read on every token, sat entirely below the staged span while 8 MB of the 12 MB allocation was dead padding. Because hi_p = lo_p + ND_TIER_SPAN_BYTES, including it costs zero extra copy bytes - the padding above the blob simply shrinks - and nd_cact_tier()'s translation is relative to lo_p, so coverage follows for free. Three lines of code. Result: decode 4.8917, bit-for-bit the accepted value, extended 4.81, think 3.87 (which matters most, because think reads all 3.14 MB of the embedding every token), byte-exact 14/14. Re-ran with the trace to prove the change was live rather than a silent fallback - the exact failure mode that has burned this campaign before - and it reports in_span=1 with content 7848512 (was 4602944). So the staging is real and worth nothing: the tier's measured value belongs to the streaming per-layer projections, not to scattered logits rows.","timestamp":1790013570442,"segment":1,"confidence":11.050969778980615,"asi":{"hypothesis":"The embedding is read every token, was outside the tier, and could be included for free (dead padding -> coverage), so its flash-mmap reads were a lever the code's own comment called 'the biggest remaining tier candidate'.","why_it_is_worth_nothing":"The tier is not a cache, it is a copy into PSRAM, and its measured benefit came from converting large sequential flash reads (14.3 M weights, ~4.4 MB/token of per-layer projections) into PSRAM reads. The subset logits path touches ~1500 scattered rows inside 3.14 MB; the access pattern, not the address space, is what was costing the 5.7 ms, and staging changes the address space only. think reading the whole embedding and still coming back at 3.87 is the cleanest evidence for that.","method_win":"This is the first candidate in the campaign that a diagnostic knob answered before it was built: the two-line trace that was already in the tree turned 'is the embedding resident?' from an assumption into a measurement, and the same trace then proved the null was a null instead of a build defect. Cheap knobs that print the state you are reasoning about are worth more than clever models of it.","state":"Accepted runtime unchanged at 4.8917 (+100.5%); tier family closed again with better evidence - span, stride, order, ceiling and now low-end coverage all measured.","next":"Restore CMAKE_C_FLAGS to empty (trace off), re-verify the accepted build config, continue verification."}}
{"run":207,"commit":"1323a38","metric":4.8917,"metrics":{"prefill_tps":5.2167,"ext_decode_tps":4.81,"think_tps":3.87,"boot_bench_tps":4.984,"min_case_tps":4.67,"gen_tokens":99,"internal_free":15759,"psram_free":2052252,"device_output_exact":14,"device_token_delta":0,"logit_max_delta":0.00005341,"logit_top1_match":10,"host_output_exact":13},"status":"keep","description":"Post-experiment restore and gate: build config verified clean (trace off, NEEDLE_LUT2_ASM on, working tree clean, embedding-tier change reverted) and the accepted runtime measured: 4.8917 decode / 4.81 extended / 3.87 think / 5.2167 prefill / 4.67 min case, 14/14 device + 13/13 host byte-exact, fidelity 5.341e-05 top1 10/10, boot bench 4.984 (201 ms/token), internal_free 15759.","timestamp":1790013839801,"segment":1,"confidence":10.76923076923079,"asi":{"hypothesis":"Restore and prove the accepted build/runtime after the tier experiment.","state":"Accepted 4.8917 (+100.5%); tier family now closed on span, stride, order, ceiling and low-end coverage.","next":"Verification cycles; ablation/diagnostic experiments remain the informative option between them."}}
{"run":208,"commit":"1323a38","metric":4.8917,"metrics":{"prefill_tps":5.2167,"ext_decode_tps":4.81,"think_tps":3.87,"boot_bench_tps":4.984,"min_case_tps":4.67,"gen_tokens":99,"internal_free":15759,"psram_free":2052252,"device_output_exact":14,"device_token_delta":0,"logit_max_delta":0.00005341,"logit_top1_match":10,"host_output_exact":13},"status":"keep","description":"Verification repeat after the tier experiment: 4.8917, 6/6 primary byte-exact, boot bench 4.984, internal_free 15759 (accepted config confirmed again). Notes updated with the tier closure and the ND_TIER_TRACE method lesson. No change taken.","timestamp":1790014039035,"segment":1,"confidence":10.501500214316358,"asi":{"hypothesis":"Verification of the accepted runtime.","state":"Accepted 4.8917 (+100.5%).","next":"Verification; batch every ~5 cycles."}}
{"run":209,"commit":"1323a38","metric":4.8917,"metrics":{"prefill_tps":5.2167,"ext_decode_tps":4.81,"think_tps":3.87,"boot_bench_tps":4.984,"min_case_tps":4.67,"gen_tokens":99,"internal_free":15759,"psram_free":2052252,"device_output_exact":14,"device_token_delta":0,"logit_max_delta":0.00005341,"logit_top1_match":10,"host_output_exact":13},"status":"keep","description":"Verification cycle plus the eighth three-board batch: all three boards 4.8917 / 4.81 byte-exact 14/14; canonical primary repeat identical. No change taken.","timestamp":1790015562193,"segment":1,"confidence":10.501500214316358,"asi":{"hypothesis":"Drift tracking, eighth batch.","state":"Accepted 4.8917 (+100.5%).","next":"Verification."}}
{"run":210,"commit":"1323a38","metric":4.8917,"metrics":{"prefill_tps":5.2167,"ext_decode_tps":4.81,"think_tps":3.87,"boot_bench_tps":4.984,"min_case_tps":4.67,"gen_tokens":99,"internal_free":15759,"psram_free":2052252,"device_output_exact":14,"device_token_delta":0,"logit_max_delta":0.00005341,"logit_top1_match":10,"host_output_exact":13},"status":"keep","description":"Verification repeat: 4.8917, 6/6 byte-exact, boot 4.984, internal_free 15759. No change taken.","timestamp":1790015724151,"segment":1,"confidence":10.501500214316358,"asi":{"hypothesis":"Verification repeat.","state":"Accepted 4.8917 (+100.5%).","next":"Verification."}}
{"run":211,"commit":"1323a38","metric":4.8917,"metrics":{"prefill_tps":5.2167,"ext_decode_tps":4.81,"think_tps":3.87,"boot_bench_tps":4.984,"min_case_tps":4.67,"gen_tokens":99,"internal_free":15759,"psram_free":2052252,"device_output_exact":14,"device_token_delta":0,"logit_max_delta":0.00005341,"logit_top1_match":10,"host_output_exact":13},"status":"keep","description":"Verification repeat: 4.8917, 6/6 byte-exact. No change taken; ext/think/boot-only metrics carried from the last full session.","timestamp":1790015814344,"segment":1,"confidence":9.735744089012538,"asi":{"hypothesis":"Verification repeat.","state":"Accepted 4.8917 (+100.5%).","next":"Verification."}}
{"run":212,"commit":"1323a38","metric":4.8917,"metrics":{"prefill_tps":5.2167,"ext_decode_tps":4.81,"think_tps":3.87,"boot_bench_tps":4.983,"min_case_tps":4.67,"gen_tokens":99,"internal_free":15759,"psram_free":2052252,"device_output_exact":14,"device_token_delta":0,"logit_max_delta":0.00005341,"logit_top1_match":10,"host_output_exact":13},"status":"keep","description":"Full rebuild + flash + 14-case verification, all metrics measured this session: 4.8917 decode / 4.81 extended / 3.87 think / 5.2167 prefill / 4.67 min case, 14/14 device + 13/13 host byte-exact, fidelity 5.341e-05 top1 10/10, boot bench 4.983 (201 ms/token), internal_free 15759, psram_free 2,052,252. No change taken.","timestamp":1790016043589,"segment":1,"confidence":9.074074074074089,"asi":{"hypothesis":"Full-session gate on the accepted runtime.","state":"Accepted 4.8917 (+100.5%).","next":"Verification; batch next cycle."}}
{"run":213,"commit":"1323a38","metric":4.8917,"metrics":{"prefill_tps":5.2167,"ext_decode_tps":4.81,"think_tps":3.87,"boot_bench_tps":4.985,"min_case_tps":4.67,"gen_tokens":99,"internal_free":15759,"psram_free":2052252,"device_output_exact":14,"device_token_delta":0,"logit_max_delta":0.00005341,"logit_top1_match":10,"host_output_exact":13},"status":"keep","description":"Verification cycle plus the ninth three-board batch: all three 4.8917 byte-exact 14/14; canonical repeat identical (boot 4.985, internal_free 15759). No change taken.","timestamp":1790017634512,"segment":1,"confidence":8.281223593037026,"asi":{"hypothesis":"Drift tracking, ninth batch.","state":"Accepted 4.8917 (+100.5%).","next":"Verification."}}
{"run":214,"commit":"1323a38","metric":4.8917,"metrics":{"prefill_tps":5.2167,"ext_decode_tps":4.81,"think_tps":3.87,"boot_bench_tps":4.985,"min_case_tps":4.67,"gen_tokens":99,"internal_free":15759,"psram_free":2052252,"device_output_exact":14,"device_token_delta":0,"logit_max_delta":0.00005341,"logit_top1_match":10,"host_output_exact":13},"status":"keep","description":"Verification repeat: 4.8917, 6/6 byte-exact. No change taken; ext/think/boot-only carried.","timestamp":1790017723013,"segment":1,"confidence":7.615791109729575,"asi":{"hypothesis":"Verification repeat.","state":"Accepted 4.8917 (+100.5%).","next":"Verification."}}
{"run":215,"commit":"1323a38","metric":4.8917,"metrics":{"prefill_tps":5.2167,"ext_decode_tps":4.81,"think_tps":3.87,"boot_bench_tps":4.984,"min_case_tps":4.67,"gen_tokens":99,"internal_free":15759,"psram_free":2052252,"device_output_exact":14,"device_token_delta":0,"logit_max_delta":0.00005341,"logit_top1_match":10,"host_output_exact":13},"status":"keep","description":"Verification repeat: 4.8917, 6/6 byte-exact, boot 4.984, internal_free 15759. No change taken.","timestamp":1790017880505,"segment":1,"confidence":7.117954677513082,"asi":{"hypothesis":"Verification repeat.","state":"Accepted 4.8917 (+100.5%).","next":"Verification."}}
{"run":216,"commit":"1323a38","metric":4.8917,"metrics":{"prefill_tps":5.2167,"ext_decode_tps":4.81,"think_tps":3.87,"boot_bench_tps":4.984,"min_case_tps":4.67,"gen_tokens":99,"internal_free":15759,"psram_free":2052252,"device_output_exact":14,"device_token_delta":0,"logit_max_delta":0.00005341,"logit_top1_match":10,"host_output_exact":13},"status":"keep","description":"Full rebuild + flash + 14-case verification, all metrics measured: 4.8917 decode / 4.81 extended / 3.87 think / 5.2167 prefill / 4.67 min case, 14/14 device + 13/13 host byte-exact, fidelity 5.341e-05 top1 10/10, boot 4.984, internal_free 15759. No change taken.","timestamp":1790018109285,"segment":1,"confidence":6.681210799018275,"asi":{"hypothesis":"Full-session gate.","state":"Accepted 4.8917 (+100.5%).","next":"Verification; batch next."}}
