{"run":400,"commit":"e0d8683","metric":5.1167,"metrics":{"boot_bench_tps":5.162,"device_output_exact":20,"device_token_delta":0,"ext_decode_tps":5.0423,"gen_tokens":99,"host_output_exact":19,"internal_free":12855,"logit_max_delta":0.00005341,"logit_top1_match":10,"min_case_tps":4.91,"prefill_tps":5.435,"psram_free":2052252,"think_tps":3.99},"status":"keep","description":"Stall-attribution iteration: the console wedge is NOT candidate-attributable, and the fusion candidate is exonerated. Three same-window full-suite runs with runner-asserted provenance: ACCEPTED engine cc174624959b (board 2) 16 cases / 0 divergences / RC=1; FUSION engine 8667e160a278 (board 3) 16 cases / 0 divergences / RC=1; FUSION on board 1 (this run) 17 cases / 0 divergences, decode 5.1467 (+0.58 %, fourth reading, prefill 5.435, min_case 4.91, gen_tokens 99). The accepted image reproduces the tail stall at the same position, so the blocker is a firmware/console defect, not my kernel - and the fusion is still NOT accepted because the device byte-exact gate needs all 20 cases in one session. New synthesis: stall position tracks concurrent console traffic (20/20 was reached by run #395 with board 1 alone; the pathological 6-case stalls happened with three lanes plus the capture API on one USB hub; 60 s and 120 s inter-case gaps were both measured and neither helped, so the knob is concurrent emitters, not idle time). Added metric-safe .auto/diag_request_timeout_s so a wedged session reports in 27 min instead of 2 h (a timed-out case fails the run, so it can never create a false pass). Off-device closure: folding prepare's copy into the first fused pass is dead - stage 1 must read zeros over the padded tail, so removing the copy puts a bounds test in the hottest loop, the trade #292/#231 measured as a loss.","timestamp":1790204188876,"segment":1,"confidence":19.34201012292117,"asi":{"candidate_exoneration":"Same window, same suite, same fail-fast setting, provenance asserted by measure.sh: ACCEPTED engine cc174624959b on board 2 reached 16 cases with ZERO divergences then RC=1 (TimeoutError); FUSION engine 8667e160a278 on board 3 reached 16 cases, zero divergences, RC=1; the FUSION on board 1 reached 17 cases, zero divergences. The tail stall is therefore NOT candidate-attributable - the accepted image reproduces it at the same position - and the fused kernel reaches exactly as far as the accepted one.","stall_traffic_hypothesis":"Stall position tracks total console traffic across the pool, not the image: 20/20 was achieved by run #395 when board 1 was the ONLY active board; the pathological 6-case stalls happened while three lanes plus the needle-api capture held the same USB hub; a 60 s inter-case gap did not help and a 120 s gap did not help (both measured) because the knob is not per-case idle time but concurrent emitters. Next test (queued first): kill every other lane and API, then run one sole-board full suite - if it reaches 20/20 the defect is USB/console contention and the campaign can accept candidates again.","fusion_reading":"Fourth independent reading of radix-4 fusion engine 8667e160a278: decode 5.1467, prefill 5.435, min_case 4.91, gen_tokens 99, calls_ok 6/6, ZERO divergences in all 17 cases reached. Spread across four sessions/two boards is one tick. +0.58 % over the accepted 5.1167. Still not accepted: the device byte-exact gate needs all 20 cases in one session.","fail_fast":"Added .auto/diag_request_timeout_s (file form of AUTO_REQUEST_TIMEOUT_S, applied after parse_args so it reaches serial_api.Device). It only shortens how long a stalled request is waited for, and a timed-out case FAILS the run, so it cannot turn a failure into a pass: a wedged 20-case session now reports in ~27 min instead of ~2 h. Verified by this run: 1621 s.","off_device_closure":"Folding nd_cq_prepare's copy into the first fused pass is dead on code reading: stage 1 must read zeros over the padded tail, and once the copy is gone those reads would have to become a bounds test inside the hottest straight-line loop - exactly the trade runs #292/#231 measured as a loss (a data-independent branch in that loop costs more than the work it removes). Not built.","next_three":"(1) SOLE-BOARD full-suite attempt on the fusion image with all other lanes and the API stopped - tests the console-contention theory and is the only route to the 20/20 device gate. (2) If it reaches 20/20: accept the fusion (+0.58 %), run make capture on the accepted image, then re-derive the phase map with AUTO_PROFILE=1 on the new denominator. (3) If it still dies at ~17, report the firmware defect (deterministic ~17-request budget per boot, engine-independent, zero divergences before it) and ask the owner whether 17-of-17 byte-exact on three sessions/two boards plus host 19/19 is an acceptable gate for a bit-exact +0.58 % change; radix-8 fusion is NOT queued as a board candidate because the measured marginal value of one more removed pass (+0.16 %) is under the 0.2 % bar and it needs ~32 live floats against 16 FPU registers.","pool_state":"boards 2/3 lanes finished (both RC=1 at 16 cases, 0 diverge); board 1 free. Workers hold asserted trees: b2 accepted cc174624959b, b3 fusion 8667e160a278, main fusion 8667e160a278."}}
{"run":401,"commit":"9f09d47","metric":5.1167,"metrics":{"boot_bench_tps":5.162,"device_output_exact":20,"device_token_delta":0,"ext_decode_tps":5.0423,"gen_tokens":99,"host_output_exact":19,"internal_free":12855,"logit_max_delta":0.00005341,"logit_top1_match":10,"min_case_tps":4.91,"prefill_tps":5.435,"psram_free":2052252,"think_tps":3.99},"status":"keep","description":"Console-contention theory REFUTED by the sole-board test. With every other lane stopped, the capture API killed, and no process holding any needle-pi handle, the radix-4 fusion image answered 16 requests in a 530 s run (all fast - the earlier 1621 s sessions were simply 200 s timeouts on the already-dead tail) and then stopped answering at case 17, exactly as it did with three lanes and an API running. Pool traffic is not the wedge mechanism. Reading reproduced again: decode 5.1467 (+0.58 % over the accepted 5.1167), prefill 5.435, min_case 4.91, gen_tokens 99, zero divergences in every case reached. Case map now pinned: 20 cases (6 primary, 13 extended, 1 think) and four attempts died at case 17 or 18 - heldout_long_route / heldout_interval_one - deterministic within one case across engines, gaps and traffic levels; run #395 once reached 20/20, so the per-boot budget is 16-20 requests and the campaign cannot count on 20. Next experiment is a dependency-compressed tail session: #393's tail-only divergence had NO arming predecessors, so carrying sampling5/timer60/heldout_sampling15/heldout_interval_over_max plus the tail cases (~7 requests) may reproduce the canonical generations and let the device gate be satisfied as a disclosed union of a prefix session and a tail session. If it still diverges, the fusion goes to the owner as gate-blocked plus a firmware defect report.","timestamp":1790204875396,"segment":1,"confidence":19.34201012292117,"asi":{"case_map":"The suite is 20 cases: 6 primary, 13 extended, 1 think. Four attempts completed exactly 16 (dying on #17 heldout_long_route) or 17 (dying on #18 heldout_interval_one): the wall is in the tail region 17-18, deterministic within one case, and independent of engine, inter-case gap, and pool traffic. #395 once completed all 20, so the budget is 16-20 requests per boot and the campaign cannot rely on reaching 20.","next_experiment":"Dependency-compressed tail session. #393's tail-only probe returned 19 tokens against a 27-token golden for heldout_interval_one - but that probe ran the tail cases with NO predecessors, and the tail's timer/sampling cases are armed by earlier ones (sampling5, timer60, heldout_sampling15, heldout_interval_over_max). Hypothesis: a session carrying the arming predecessors + the tail (6-7 requests, well inside the budget) reproduces the canonical generations, in which case the device byte-exact gate can be satisfied as the UNION of a prefix session (cases 1-16) and a dependency-compressed tail session, disclosed as such. Falsifiable immediately with bench.py --cases on the already-built image. If it still diverges, the tail is unreachable and the fusion (+0.58 %, bit-exact everywhere it can be measured) goes to the owner as gate-blocked with a defect report.","refuted":"SOLE-BOARD refutes the console-contention theory: with every other lane, the capture API, and all console handles closed, the same fusion image answered 16 requests in a 530 s run (everything fast - the earlier 1621 s runs were just 200 s timeouts on the dead tail) and then stopped answering at case 17, exactly as it did with three lanes running. Concurrent pool traffic is not the mechanism.","state":"Accepted runtime unchanged at 5.1167. The radix-4 fusion (engine 8667e160a278) is at +0.58 % with four agreeing primary readings on two boards, host 19/19 byte-exact, zero device divergences in 49 case-comparisons across four sessions, and is now exonerated from the stall; it remains NOT accepted solely because the device gate needs 20 cases in one session.","honesty":"The traffic hypothesis was mine, it was plausible, it explained the 6-case stalls and #395's 20/20 - and one cheap sole-board run killed it. Worth recording because the run cost 9 minutes and settled a question that had already consumed several hours of interpretation."}}
{"run":402,"commit":"4437f83","metric":5.1167,"metrics":{"boot_bench_tps":5.194,"device_output_exact":20,"device_token_delta":0,"ext_decode_tps":5.0423,"gen_tokens":99,"host_output_exact":19,"internal_free":11831,"logit_max_delta":0.00005341,"logit_top1_match":10,"min_case_tps":4.91,"prefill_tps":5.435,"psram_free":2052252,"think_tps":4.01},"status":"keep","description":"Fusion candidate's own monitor set measured at last (7-request primary,think session fits the measured 16-20 request per-boot budget, so it completes): decode 5.1467 (+0.58 % over the accepted 5.1167), think_tps 4.01 (+0.50 % - the monitor that guards the 4-bit/vocabulary path, so the win is not paid for there), boot_bench 5.194 = 193 ms/token (+0.62 %, the mechanism check), prefill 5.435, min_case 4.91, gen_tokens 99, token_delta 0, device byte-exact 7/7 with golden_missing 0, psram unchanged - AND A NEW COST: internal_free 11,831 vs the accepted 12,855, i.e. the fused kernel costs 1,024 B of internal heap, the largest RAM price of any live candidate, invisible until now because every earlier fusion session died in the extended tail and carried the accepted RAM figure. Also settled: the wedge's position is a function of both accumulated requests and concurrent console traffic (three lanes -> case 6, sole board -> 16-17), so runs #400 and #401 were each half right and full-suite attempts must run with the pool idle. Transform family CLOSED on every axis: width 4 = exactly null (its guard is false for the dominant ngroup=6 tensors), radix-8 x3 groups = exactly null (4->3 passes absorbed by registers), radix-8 x2 groups = -0.19 % rejected. Accepted runtime unchanged at 5.1167: the fusion is still NOT accepted because device_output_exact_min is 20 and four full-suite attempts on two engines reached 16-17 cases with zero divergences, the accepted image reproducing the same tail.","timestamp":1790206065434,"segment":1,"confidence":19.34201012292117,"asi":{"cost_decision":"The 1 KiB is affordable but not free: 11,831 B is the lowest internal heap in the campaign, and the RAM-blocked family (phi row residency wants ~18 KB/core) is priced against exactly this pool, so the fusion makes that idea strictly further away. If the owner ever takes #293's assertion-level option (+8,248 B) the trade is trivially worth it; without it, this is a real -8 percent reduction in the remaining RAM headroom that buys +0.58 percent speed.","gate_status":"STILL NOT ACCEPTED. device_output_exact_min is 20 and this session ran 7 cases by design, so measure.sh correctly skipped the device gate. Four full-suite attempts on two engines reached 16/16/17/17 cases with zero divergences; the accepted image reproduces the same tail stall, so this is an engine-independent firmware/console defect, not a candidate property. Acceptance needs either one lucky 20-case session or an owner decision to accept 7/7 + 19/19 host + 49 device case-comparisons with zero divergences as the quality evidence for a bit-exact change.","finding_cost":"MEASURED COST, new fact: internal_free 11,831 against the accepted 12,855, i.e. the fused kernel costs 1,024 B of internal heap - the largest internal-RAM price of any candidate still under consideration, and internal heap is the campaign's scarcest resource (#292's IRAM-text/heap coupling). psram_free unchanged. Every prior fusion reading carried the accepted RAM figure because those sessions died in the extended tail; the cost was invisible until now.","finding_secondaries":"MEASURED on the fusion image itself (previously carried): think_tps 4.01 vs 3.99 (+0.50 %, so the 4-bit/vocabulary path is not harmed - the monitor that exists to catch exactly that), boot_bench 5.194 vs 5.162 (+0.62 %, 197 -> 193 ms/token, the mechanism check since prepare is inside the bench), prefill 5.435, min_case 4.91, gen_tokens 99, token_delta 0, device byte-exact 7/7 with golden_missing 0.","method":"A 7-request session (primary,think) fits inside the measured 16-20-request per-boot budget, so it completes reliably and yields decode, prefill, min_case, think, boot bench and both heaps - the whole monitor set except ext_decode_tps. Added .auto/diag_groups (file form of AUTO_GROUPS, consulted only when the env var is unset, and measure.sh skips the device gate for restricted runs, which is why this must never be used for acceptance). Runtime 216 s instead of 27+ min.","stall_synthesis":"Position of the wedge is a function of concurrent console traffic AND accumulated requests: three lanes running -> stall at case 6; sole board -> 16-17. So run #400 ('accelerated by traffic') and run #401 ('traffic is not the mechanism') were each half right: traffic is not the cause but it is an accelerator. Consequence for the campaign: full-suite attempts should be run with the pool otherwise idle, and three-lane batches can only be trusted for primary-group speed verdicts.","next_three":"(1) One more sole-board full-suite acceptance attempt on the fusion, pool idle, no other emitters - the only remaining route to the formal 20/20, and if it lands 16-17 again the candidate goes to the owner as gate-blocked with the defect report rather than being re-attempted further. (2) ext_decode_tps for the fusion via diag_groups=extended in its own session (13 requests, from a fresh boot) - speed-valid even though restricted sessions cannot serve as the byte-exact gate. (3) The transform family is closed on every axis (width 1/2/3/4, stage fusion 2/3/radix-8, passes 4 vs 3, rescale placement, stage order), so the remaining above-bar items are owner decisions: phi residency vs 11,831 B, 120 MHz vendor-blocked, and the 0.2 % bar.","transform_closure":"Three screens logged this window, all bit-exact before any board: width-4 quad = 5.1467 (exactly null; its guard is false for the dominant ngroup=6 tensors so it never executes there), radix-8 x3 groups = 5.1467 (exactly null: the 4->3 pass removal bought nothing, registers absorbed it), radix-8 x2 groups = 5.1367 (-0.19 %, rejected). The run #399 dose-response (+0.16 % per removed pass) correctly predicted the SIGN of the lever and over-predicted its size at the third pass - the measured +0.16 % stops paying once the loop is register-bound."}}
{"run":403,"commit":"403","metric":5.1167,"metrics":{"boot_bench_tps":5.186,"device_output_exact":20,"device_token_delta":0,"ext_decode_tps":5.0423,"gen_tokens":99,"host_output_exact":19,"internal_free":11831,"logit_max_delta":0.00005341,"logit_top1_match":10,"min_case_tps":4.9,"prefill_tps":5.4283,"psram_free":2052252,"think_tps":4},"status":"discard","description":"Cost-axis retry of the 2-pair fusion (c9507112b7e2) - REFUTED, and the refutation is the useful part. Rejected by run #399 on speed alone, it was reopened because run #402 introduced a new scarce dimension (the 3-pair fusion costs 1,024 B of internal heap) that could have inverted the ranking if less fusion meant less code. Measured on its own session: decode 5.1383 (+0.42 %, reproducing #399 to the digit), think 4.00, boot bench 5.186, min_case 4.90, token_delta 0, device byte-exact 7/7 golden_missing 0 - and internal_free 11,831, EXACTLY the 3-pair fusion's figure. So the 1 KiB is not per-fused-pair: nm on the ELF shows no separate symbols for the walk variants (all inlined into fwht_rows, 0x837 = 2,103 B), i.e. it is the fixed cost of the fused kernel existing. The 3-pair form therefore dominates outright and the assumed speed-for-RAM trade does not exist. This also points at the real lever: fwht_rows carries inlined fallbacks the field never runs (the g<8 branch, and the pair/single tails that run zero times per token per run #396), so making those cold paths noinline should refund part of the 1,024 B at neutral speed - keeping the fallbacks present, since deleting an unused tail is exactly run #333's silent-drop class.","timestamp":1790206455391,"segment":1,"confidence":19.34201012292117,"asi":{"finding":"internal_free 11,831 for the 2-pair form = EXACTLY the 3-pair fusion's 11,831. So the 1,024 B is not proportional to the number of fused pairs; it is the fixed cost of the fused kernel existing (nm on the current ELF shows no separate symbols for nd_fwht4s/nd_fwht3s/nd_fwht3p - they are all inlined into fwht_rows, which is 0x837 = 2,103 bytes). My 'fewer fused pairs costs less RAM' premise for the retry is REFUTED, cheaply, by one 218 s session.","invalidation_check":"This is the answer to 'does #402 invalidate a previous discard?' - it reopened the 2-pair fusion on a changed assumption (cost axis) and the answer is no: strictly dominated, same RAM, slower. Rejected on both axes now, and the retry took one restricted-group session rather than a full suite.","next_three":"(1) Refund the RAM: nm shows the transform family is inlined into fwht_rows (2,103 B) including fallbacks the field never runs - the g<8 branch and the pair/single tails, which run ZERO times per token (measured in run #396: every nd_cq_prepare site has ngroup 6 or 24, so the 3-wide walk covers 100 percent of field calls under the ceil-half split). Marking those cold fallbacks noinline - or routing g<8 through the fused kernel, which the oracle already proves exact for n=2..1024 - should give back part of the 1,024 B at neutral speed, and run #375 independently measured NOT inlining as slightly better. That converts the fusion's cost from -1,024 B toward neutral without touching arithmetic; off-device proof first with nm -S, then one session. Keep the fallbacks present (do not delete them): deleting a tail for an ngroup the field does not produce is exactly run #333's silent-drop class. (2) Sole-board full-suite acceptance attempt with the pool idle - the only route to the formal 20-case device gate. (3) ext_decode_tps for the fusion in its own 13-request session (speed-valid, never a gate).","reproducibility":"The 2-pair form reproduced run #399's 5.1383 to the digit on a different session and a different board, so the transform readings are as deterministic as the rest of the campaign's numbers.","verdict":"2-pair fusion REJECTED on the cost axis too: decode 5.1383 (+0.42 %), think 4.00, boot bench 5.186, and it buys no RAM advantage over the 3-pair's 5.1467 - so the 3-pair fusion dominates it outright. The assumed trade (less code for less speed) does not exist.","why_retry_was_right":"Worth stating why this retry was legitimate rather than a revival: run #399 rejected it on speed while the RAM cost of BOTH forms was unknown/carried, and run #402 introduced a measured cost that could have inverted the ranking. The changed assumption was named before running, which is the rule."}}
