{"run":393,"commit":"5603358","metric":5.105,"metrics":{"boot_bench_tps":5.151,"device_output_exact":17,"device_token_delta":0,"ext_decode_tps":5.031,"gen_tokens":99,"host_output_exact":19,"internal_free":13623,"logit_max_delta":0.00005341,"logit_top1_match":10,"min_case_tps":4.87,"prefill_tps":5.39,"psram_free":2052252,"think_tps":3.99},"status":"keep","description":"Three-lane iteration attacking the tail-blocker from three sides; no shipping change (accepted 5.1050 carried while three device measurements are in flight). LANES (all three verified streaming CASE lines, all distinct): board 1 = full suite on the already-flashed fw3fold image with request_timeout 1200 s, to separate \"board dead\" from \"slower than my timeout\"; board 2 = NEW candidate fw2foldnb (2-group walk + rescale folded into a separate final-stage loop, i.e. run #388's fold without its per-butterfly branch) - host 19/19 byte-exact and odd-split-guard clean before any flash, primary complete and extended in flight with zero divergences; board 3 = fw3fold, the +0.23 % five-reading never-gated candidate, rebuilt from its own tree and run with the long timeout so a completed tail cannot be board-specific. FOUR OFF-DEVICE CLOSURES at zero board cost, one of which prevented a wasted run: no duplicate nd_cq_prepare; the unpaired two-sigmoid mHC loop is n=4 (64 sigmoids/token, +0.007 %) so the pairing class cannot apply; condT's device-only divergence is not the tier (fp16_slot[25] is a staged pointer, nd_tier_ptr remaps archive offsets only) so condT stays rejected as unexplained; and sinkpair was retired before flashing because nd_expf_pair already interleaves both chains, making its only non-trivial variant exactly run #292 (-0.43 %). BENCHMARK-INTEGRITY MEASUREMENT: on a freshly built and flashed ACCEPTED image, heldout_interval_one returns 19 tokens against a device golden of 27 - identical to the candidate's isolated reading - and arming the timer cases first does not restore it, so the tail divergences recorded in #391/#392 are not candidate-attributable; host and device goldens disagree in call count on both tail cases (host 23/67 tok vs device 27/19) and get_status embeds a live snapshot() while #345 bounded generation by remaining context, i.e. those goldens encode session/truncation state. Disclosed, not patched: no golden was edited. Harness: --cases added to both bench.py modes plus line-buffered lane logging after a healthy run looked frozen for 20 minutes.","timestamp":1790184339407,"segment":1,"confidence":19.257411424439614,"asi":{"board1":"tail probe on flashed fw3fold image, request_timeout=1200; log grep was not line-buffered so a healthy run looked frozen - liveness proven by /proc/<pid>/fd holding the console, not by the log","board2":"fw2foldnb via measure.sh - primary complete, extended in flight, ZERO DIVERGE lines, case tps 5.17-5.18","board3":"fw3fold built from its own tree, flashed 17:22:11Z, gated run with request_timeout=1200, primary streaming","candidate_fw2foldnb":"two-group FWHT walk with the group rescale folded into a SEPARATE final-stage loop - no per-butterfly branch, which is what cost run #388 its -0.13 %. Host 19/19 byte-exact, token_delta 0, golden_missing 0; odd-split guard .auto/exp41/test_odd_split.c = 6 tensors x 5 splits mismatches=0 so the device 3+3 split is covered; worker tree md5 e94307172b46 = main's verified md5.","closures_off_device_4_no_board_cost":"(a) no duplicate nd_cq_prepare - 5 call sites are 5 different activations and phi's 3 tensors already share one, so deleting a redundant prepare is null by inspection; (b) the unpaired two-sigmoid loop at nd_model.c:1923-1925 is n=4 mHC lanes = 64 sigmoids/token = +0.007 %, so the proven pairing class cannot apply; (c) condT's device-only divergence is NOT the tier - fp16_slot[25] is assigned at nd_model.c:387 as a staged pointer and nd_tier_ptr remaps archive offsets only, so the tier theory is excluded by reading and condT stays rejected as unexplained; (d) sinkpair retired before any board: nd_expf_pair already interleaves both chains, so its only non-trivial variant (skip the exactly-zero argument) IS run #292 at -0.43 %.","control_on_accepted_image":"heldout_interval_one returns 19 tokens vs a device golden of 27 (token_delta 8) on a freshly built+flashed ACCEPTED image in a short session - identical to the candidate's isolated reading; arming timer60+heldout_timer45 first does not restore it, so the timer-arming hypothesis is falsified and #391/#392 tail divergences are not candidate-attributable.","benchmark_integrity":"host engine is byte-exact on both tail cases against the HOST golden while host and device goldens disagree in CALL COUNT (host 23/67 tok vs device 27/19 tok) and the device today emits 63 tok where its golden says 19. Mechanism candidates read in code: get_status embeds a live snapshot() (uptime_ms, timer_remaining_ms, free_*_bytes) into RESULT, and run #345 bounded generation by remaining context. So those two goldens encode session/truncation state and the device gate can veto a correct candidate. Disclosed, NOT patched - no golden edited.","harness":"--cases added to bench.py for BOTH device and host modes (a filter working in only one mode is the vacuous-control class) with a loud partial-run NOTE; lanes now use grep --line-buffered and PYTHONUNBUFFERED=1.","self_inflicted_caught_before_use":"generator ran against MAIN instead of the worker (relative path/wrong cwd) - main reverted, dirty=0; board 3 picked up the wrong patch (fw3res, a measured null) and its lane started on an accepted tree - killed within 60 s so no forbidden control-only measurement happened; /tmp/sinkpair.patch had been cleaned so the candidate was regenerated from source; pkill -f 'needle-board run 3' killed my own shell (the ledger's bracketed-pattern trap, hit anyway).","next":"(1) board 3's gated 20-case fw3fold reading - if byte-exact it is a keep at ~+0.23 % and the tail blocker is a timeout artifact not a quality veto; (2) board 2's foldnb bar + gate, then cross-board the winner; (3) if 1200 s still stalls at case ~18, measure the priming hypothesis directly (write-to-first-TOK latency on the wedging case) instead of guessing budgets; (4) fw3foldnb = 3-wide walk + branch-free folded stage, the union of the two fold designs.","metric_note":"decode carried at the accepted 5.1050 - three device measurements in flight, none complete; host_output_exact=19 IS a fresh reading on the foldnb tree."}}
{"run":394,"commit":"6aa9b02","metric":5.105,"metrics":{"boot_bench_tps":5.151,"device_output_exact":17,"device_token_delta":0,"ext_decode_tps":5.031,"gen_tokens":99,"host_output_exact":19,"internal_free":13623,"logit_max_delta":0.00005341,"logit_top1_match":10,"min_case_tps":4.88,"prefill_tps":5.3967,"psram_free":2052252,"think_tps":3.99},"status":"keep","description":"Gate-blocker diagnosis plus an honest downward revision of the campaign's best candidate; no shipping change (accepted 5.1050 carried). fw3fold got two more gated readings on two boards with the continuous-drain harness and a 1200 s budget: primary 5.1100 (board 3) and 5.1183 (board 1), prefill 5.3967/5.40, min_case 4.88 both, gen_tokens 99, calls_ok 6/6, and ZERO divergences in every case reached - but its seven-reading mean is now 5.1152 = +0.1999 %, i.e. exactly the 0.2 % keep bar with a +0.098 %..+0.260 % spread, so it is reported as NOT keepable rather than quoting the best board. THE WEDGE IS NOW LOCALISED BY SUBTRACTION: deterministic at case 18 across four attempts, three boards and three images; not the request budget (1200 s moved nothing), not console flow control (the new continuous-drain pump did not prevent it, so it is kept as hardening and explicitly not as the fix), not the case itself (it completes in a fresh short session), and the board answers 0 bytes to a non-mutating !status with DTR/RTS pinned. Best reachable state today is 17 of 20 cases with 0 divergences, which is the binding constraint on shipping anything. THREE OF MY OWN OBSERVABILITY BUGS FOUND AND FIXED, all failing in the direction that looks like health: grep without -a classified generated text as binary and suppressed every matched line, destroying two healthy full-suite logs including fw2foldnb's only primary reading; TAIL_RC=$? captured grep's exit not bench.py's and printed a false green; and grep block-buffering made a live lane look frozen for 20 minutes. Also caught a mislabeled provenance line of my own (printing main's md5 while bench.py measures the flashed image) and fixed it by building/flashing from board 1's pinned tree. condT's rejection is now known to rest on weaker evidence - the accepted image reproduces the same tail divergence - but its own veto case is only decidable in a full session, so it is deferred, not revived.","timestamp":1790186143278,"segment":1,"confidence":19.257411424439614,"asi":{"fw3fold_7_readings":"5.115/5.115/5.115/5.1167/5.1167 earlier + 5.1100 (board 3, drained harness) + 5.1183 (board 1, 1200 s budget) = mean 5.1152 = +0.1999 % over the accepted 5.1050, i.e. EXACTLY the 0.2 % bar with today's spread +0.098 % to +0.260 %. Stated this way on purpose: the earlier 5-reading mean was +0.209 % and looked safely above; two more readings pulled it onto the bar. Combined with the unreachable device gate, fw3fold is not keepable.","wedge_localised_further":"position-deterministic at case 18 (heldout_interval_one) across 4 attempts, 3 boards, 2-3 images. NOT the request budget (1200 s did not move it one case), NOT console flow control (continuous-drain pump did not prevent it), NOT the case (it completes in a fresh short session), NOT timer-arming order yet (pair test running on board 2). The rescue path behaved exactly as designed: reconnect, no case skipped, BENCH_RC=1.","drain_pump_kept_but_not_a_fix":"continuous reader added to serial_api.Device because the wedged board answered 0 bytes to !status with DTR/RTS pinned - but the wedge still reproduced with it, so it is kept as hardening against TX-blocking on large bursts, NOT as the fix. Claiming otherwise would be exactly what #385/#386 taught me not to do.","my_three_observability_bugs":"(1) grep without -a treated the generated text as binary and SUPPRESSED all matched lines - this destroyed the logs of two healthy full-suite runs, including fw2foldnb's only primary reading; (2) TAIL_RC=$? captured grep's status not bench.py's, producing a false green (TAIL_RC=0 on a run that had actually died); (3) piping through grep block-buffered, so a healthy lane looked frozen for 20 minutes. All three are in MY harness layer, all failed in the direction that looks like health/success, which is this campaign's recurring family (#296/#298/#300/#389). Lanes now write full unfiltered output to a file and a pane is never a log.","provenance_bug_caught":"my first relaunched board-1 script printed main's nd_quant md5 while bench.py measures whatever is FLASHED - a mislabeled provenance line of exactly the class the ledger says is the evidence. Fixed by building and flashing from board 1's own pinned tree and printing that tree's md5 next to the flash timestamp.","condT_retry_adjudication":"its rollback reason is now known to be weaker than recorded (the sole veto case is non-reproducible in isolation, and the ACCEPTED image reproduces the same 19-vs-27 divergence), but condT's own divergent case was note_only, which accepted answers correctly in full sessions - and full sessions are exactly what the wedge makes unreachable. So it cannot be fairly re-adjudicated until the tail is reachable; deferred, not revived.","gate_status":"device byte-exact gate cannot be satisfied at 20 cases on any board today: best reached is 17 cases with 0 divergences. That is the binding constraint on shipping ANY candidate, and it is a harness/firmware console defect, not a model issue.","next":"(1) read board 2's arm-then-wedge pair test (does a 300 s sampling timer + countdown kill the next request in a fresh session?); (2) re-measure fw2foldnb's bar with an unfiltered log (its number was lost to my grep bug); (3) fw3foldnb (3-wide + branch-free fold) remains queued but is only worth a board if it can be gated, so the tail blocker comes first; (4) make capture is still owed on the accepted image.","fresh_readings":"host_output_exact=19 on the foldnb tree; fw3fold primary 5.1100 (b3) and 5.1183 (b1), prefill 5.3967/5.40, min_case 4.88 both, gen_tokens 99, calls_ok 6/6 both, zero DIVERGE lines in every case reached."}}
{"run":395,"commit":"018427c","metric":5.1167,"metrics":{"boot_bench_tps":5.162,"device_output_exact":20,"device_token_delta":0,"ext_decode_tps":5.0423,"gen_tokens":99,"host_output_exact":19,"internal_free":12855,"logit_max_delta":0.00005341,"logit_top1_match":10,"min_case_tps":4.88,"prefill_tps":5.4,"psram_free":2052252,"think_tps":3.99},"status":"keep","description":"fw3foldnb MEASURED AND KEPT: three FWHT groups per stage walk with the rescale folded into a peeled (branch-free) final stage. +0.229 % decode (5.1050 -> 5.1167, +110.1 % over the 2.44 baseline), reproduced to the digit on two independent boards with the identical tree md5 (board 1 twice, board 3), primary calls_ok 6/6. The device byte-exact gate is satisfied on this exact tree: a full 20-case run on board 1 gave device_output_exact=20, device_golden_missing=0, device_token_delta=0 with zero DIVERGE lines. Secondaries all agree upward: extended 5.0423 (+0.225 %), prefill 5.40, think 3.99, boot bench 5.162 (the mechanism check - prepare is inside the bench), min_case 4.88, gen_tokens 99. Cost internal_free 12,855 (-768 B), psram unchanged. Quality independent of speed: host 19/19 byte-exact, fidelity 5.341e-05 identical, top1 10/10, odd-split and equivalence guards mismatches=0. PROVENANCE SAVED: I assumed the gate reading belonged to fw3fold and had already applied that patch, but diffing showed board 1's file is the peeled-fold variant - a different kernel (7031dbbda197 vs cc174624959b) - so main was reset to the measured file byte-for-byte before the canonical run. TWO HARNESS FIXES: (a) make test has been red since run #389 - the stalled-request rescue called _reconnect() which needs self.port, raising AttributeError out of the rescue and hiding the TimeoutError a framing test asserts on; one guard in complete() and the suite is 16 python + 2 native green again, which matters because keeps were being logged over a red suite for six runs. (b) the continuous-drain pump is REVERTED, not kept: it did not prevent the wedge and it broke the attach contract (the pump consumed the probe instead of the handshake, so boot-log lines leaked into the caller's stream - exactly what tests/test_serial_api.py guards). Benchmark-integrity correction, disclosed not patched: the tail goldens are order-dependent, not broken - in canonical order on a healthy board both return their golden token counts, so the --cases probe is valid only for relative comparisons (as the accepted-image control used it). The console wedge itself remains open and is now the only thing standing between this campaign and single-run canonical acceptances.","timestamp":1790188303396,"segment":1,"confidence":19.34201012292117,"asi":{"candidate":"fw3foldnb - three FWHT groups per stage walk PLUS the group rescale folded into a peeled final stage (no `last` flag, no fw_scale pass on the triple path). ngroup=6 splits 3+3 so a three-wide step is one core's entire call, and the fold removes the rescale pass rather than shortening it (#388's folded version lost -0.13 % because it put the multiply behind a per-butterfly branch; peeling the stage removes the branch, which is why this one pays).","provenance_rescued":"the 20/20 gated reading was taken on board 1's tree, whose comment says rescale folded into the (peeled) final stage - i.e. the candidate is fw3foldnb, NOT fw3fold as I first assumed from the patch name. I diffed rather than assumed, brought main to that exact file (md5 cc174624959b byte-identical to the tested tree), and only then ran the canonical. Had I applied .auto/exp44/fw3pair_fw3res.patch I would have shipped a different kernel than the one measured (7031dbbda197 vs cc174624959b).","harness_win":"make test has been RED since run #389 and I inherited it as green: the stalled-request rescue called _reconnect(), which needs self.port, so on a bare Device it raised AttributeError out of the rescue and hid the TimeoutError a framing test asserts on. One guard in complete() (never-attached device -> propagate the timeout) and the suite is 16 python + 2 native green again. That is a gate that could not fail quietly - it simply did not run clean for six runs while keeps were being logged.","drain_pump_reverted":"the continuous-drain reader is removed, not kept: it did not prevent the wedge (board 3 reproduced it with the pump running), AND it broke the attach contract - the pump consumed the probe instead of the handshake, so boot-log lines like EVT bench ... ms_per_tok leaked into the caller's stream, which is exactly what tests/test_serial_api.py guards. Restored tools/serial_api.py from eecf9cb and added the port guard on top.","wedge_state":"still open, still position-deterministic (case 16-18 depending on run), unaffected by 1200 s budget or continuous draining, board- and image-independent, and the case itself completes in a fresh short session. The gate has now been satisfied ONCE (board 1, 20/20, token_delta 0) so it is reachable; getting a single measure.sh run to complete end to end remains a harness/product task.","goldens_corrected":"my earlier 'tail goldens encode session state' worry is resolved benignly: in the canonical order on a healthy board heldout_interval_one returns its golden's 27 tokens and heldout_long_tools_note_only returns its 19. They are ORDER-dependent, not broken. The --cases probe is therefore only valid for relative comparisons - which is how the accepted-image control was used, so that control stands.","next_three":"(1) fw2foldnb verdict (board 2, 17 cases 0 diverge in flight) - the pair path still runs in the field for ngroup=8 tensors split 4+4, so folding there is a real second lever; (2) fw3foldnb cross-board reproduction (board 3, already 5.1167) then make capture, which is owed on the new accepted image; (3) the wedge itself - the one measurement that would explain it is a fresh-boot full suite with the timer-arming cases moved last, which tests whether an armed demo timer firing mid-request is what kills the console.","quality":"host 19/19 byte-exact, token_delta 0, golden_missing 0; fidelity logit_max_delta 5.341e-05 identical to control, top1 10/10; odd-split guard 6 tensors x 5 splits mismatches=0; generated-loop equivalence guard 200 cases mismatches=0; make test 16 python + 2 native OK."}}
