{"run":288,"commit":"a17484f","metric":4.9917,"metrics":{"boot_bench_tps":5.039,"device_output_exact":14,"device_token_delta":0,"ext_decode_tps":4.9129,"gen_tokens":99,"host_output_exact":13,"internal_free":15215,"logit_max_delta":0.00005341,"logit_top1_match":10,"min_case_tps":4.77,"prefill_tps":5.265,"psram_free":2052252,"think_tps":3.92},"status":"keep","description":"Experiment 16 - compact first-byte grammar index: MEASURED and KEPT, +1.01 % decode (4.9417 -> 4.9917, now +104.6 % over the 2.44 baseline). The constrained sampler decided which pieces the grammar can spell by examining all 8,176 vocabulary ids every decode token (a nd_tok_piece call plus a first-byte table test each). Index the vocabulary by first byte once (uint16 ids grouped per byte by counting sort, which needs no comparison and leaves each group in id order, plus 257 offsets and the list of the 94 byte values that actually start a piece) and per token walk only the groups whose byte the state accepts. Legality is untouched: every visited id still takes the same token_ok byte walk, bits still go into the same one-bit-per-id bitmap, and the caller still reads it in ascending id order, so the candidate list, the argmax and its tie-breaking are the shipped ones. Screened off-device first (.auto/exp16/, host build behind -DND_SAMPLE_STATS, verified live by its own output per the run #242 lesson): across all six primary prompts and 93 real decode steps the grammar admits a median of ONE first byte per step, the bucket walk touches a median of 51 ids against 8,176, 1.62 % of the shipped walk in aggregate, and it reproduced the shipped candidate list element for element and in ascending order on every step. Three-board batch with a pristine board-1 control: candidate +0.98 % and +1.05 % at identical configuration, both 14/14 byte-exact (that batch exposed a harness fact worth keeping - each worker's esp32/sdkconfig is gitignored, so git reset --hard does not apply a config-changing commit and all three ran at 1000 Hz; the control reading exactly 4.9250, the pre-tick accepted value, proved both the drift and the control's health). Canonical run on the original board at the shipping configuration (tick 100 Hz, 64 B data cache line, sdkconfig regenerated, 280,320 B image dcce6a62): decode 4.9917, extended 4.9129 (+1.06 %), think 3.92, prefill 5.265 unchanged, min_case 4.77 which is better than the previous best 4.72 so the worst case improved with the mean, boot bench 5.039 / 198 ms/token unchanged - the same request-path-only internal control run #147 produced, because the bench never samples. 14/14 device and 13/13 host byte-exact, token_delta 0, fidelity 5.341e-05 against a 2e-3 gate, top1 10/10, make test green including prefix isolation, and make capture rc=0 with all nine behavioural flags true. Memory: internal_free 15,247 -> 15,215, i.e. 32 B for the index handle; the ~17 KB index itself is ND_ALLOCed in PSRAM and allocation failure falls back to the original full walk, so it is an optimisation and not a dependency. Delivered roughly 2.05 ms of the ~202 ms token where the screen priced ~1.5 ms, because removing the need for the nd_parallel_rows split also removes its handshake and the duplicated per-core 256-step grammar probe - removing the need for a split can be worth more than removing work. This is deliberately not the rejected run #149: that kept all 8,176 iterations and shortened each one (-0.17 %); here 98 % of the iterations disappear, which is the changed assumption that justified revisiting the sampler enumeration.","timestamp":1790056131305,"segment":1,"confidence":15.605875152998754,"asi":{"batch_off_config":"three-board batch 20260922T052753Z ran at 1000 Hz because each worker's gitignored esp32/sdkconfig survives git reset --hard, so a config-changing commit needs `rm esp32/sdkconfig` in every worker before a batch; the control read 4.9250 = exactly the pre-tick accepted value, which both proves the drift and proves the control is otherwise healthy","candidate":"Experiment 16: PSRAM first-byte bucket index over the vocabulary (uint16 ids grouped per first byte by counting sort + 257 offsets + the 94 byte values that actually start a piece), replacing the 8,176-id per-token walk; legality predicate unchanged, same one-bit-per-id bitmap, same ascending extraction, two-core split dropped","delivered_vs_predicted":"screen priced ~1.5 ms of piece lookups, delivered ~2.05 ms: the saving also includes the per-token nd_parallel_rows handshake and the duplicated per-core 256-step grammar probe (two walks per token, one per core, replaced by one 94-byte walk). Lesson: a phase built as nd_parallel_rows carries a fixed handshake plus duplicated per-core setup, so removing the need for the split can be worth more than removing the work.","evidence":".auto/exp16/{SCREEN.md,screen.patch,nd_sample.c.with_screen}; batch /root/board-pool/batches/20260922T052753.408423Z","followup_owed":"swapped-assignment batch (candidate on board 1, controls on 2/3) is formality-only given two candidate boards agreeing at +0.98/+1.05% plus a canonical run; capture cadence resets to next-due-after-the-next-shipping-change","images":{"batch_candidate_boards2_3":"84276dd4… / 7564bb66… at 1000 Hz","batch_control_board1":"2a54c156… at 1000 Hz","shipping":"280320 B, md5 dcce6a62ca16d65cdb1eeaa31eede86b, tick 100 Hz, 64 B data cache line, lex_index_build at 0x42011234"},"mechanism":"grammar admits a median of ONE first byte per decode step (max 11) and only 94 of 256 byte values ever start a piece, so 98.4% of the shipped walk was spent rejecting ids that could never be legal: median 51 ids touched vs 8,176 examined","next":"Experiment 19 - the 120 MHz octal flash/PSRAM diagnostic, isolated and non-shipping by default (ESP-IDF labels 120 MHz DDR experimental; needs two 80 MHz controls, swapped assignments, and a thermal/integrity soak before anyone calls it shipping)","offdevice_screen":"all six primary prompts, 93 real decode steps (host build behind -DND_SAMPLE_STATS, verified live by its own output per the run #242 lesson): touched_by_buckets median 51 vs 8,176 examined, sum(touched)/sum(walk) = 1.62%, zero steps above half the walk, and the bucket enumeration reproduced the shipped candidate list element-for-element and in ascending id order on all 93 steps","not_the_rejected_149":"#149 kept all 8,176 iterations and only shortened each one (-0.17%); here 98% of the iterations disappear, which is the changed assumption that justified revisiting the sampler's enumeration","numbers":{"batch_at_identical_config":"control 4.9250 vs candidate 4.9733 (+0.98%) and 4.9767 (+1.05%), both 14/14 byte-exact with token_delta 0","canonical_shipping_config":"decode 4.9917 (+1.01%), extended 4.9129 (+1.06%), think 3.92, prefill 5.265 unchanged, min_case 4.77 (best seen, was 4.72), boot bench 5.039/198 ms unchanged, 14/14 device + 13/13 host byte-exact, token_delta 0, fidelity 5.341e-05, top1 10/10, internal_free 15215, psram_free 2052252","primary_delta_vs_accepted":"+1.01% (4.9417 -> 4.9917), +104.6% over the 2.44 baseline"},"request_path_signature":"boot bench unchanged (198 ms/token) while decode and extended improve - the bench calls nd_model_step_hidden and never samples, so like run #147 the invariance of the bench is the internal control proving where the win lives","safety":"allocation failure falls back to the original full walk (index is an optimisation, not a dependency); index keyed on (tokenizer, vocab) and rebuilt if either changes; used only while vocab fits one bitmap pass (<= 8,192 ids), chunked walk retained above that","sampling_phase_state":"the enumeration is no longer a lever; the sampler's remaining cost is nd_model_logits_subset (5.7 ms at the 2-bit GEMV floor over a legitimate row count) plus token_ok's byte walk over the ~50 visited ids","three_board_batch_note":"formality swapped-assignment batch not run: two candidate boards agree at +0.98/+1.05% and the canonical run at the shipping config reproduced the gain"}}
{"run":289,"commit":"a17484f","metric":4.9917,"metrics":{"prefill_tps":5.265,"ext_decode_tps":4.9129,"think_tps":3.92,"boot_bench_tps":5.039,"min_case_tps":4.77,"gen_tokens":99,"internal_free":15215,"psram_free":2052252,"device_output_exact":14,"device_token_delta":0,"logit_max_delta":0.00005341,"logit_top1_match":10,"host_output_exact":13},"status":"discard","description":"Experiment 19 - 120 MHz octal flash+PSRAM, measured as an ISOLATED DIAGNOSTIC and closed unshipped. Two sub-variants: (a) PSRAM 120 MHz with flash held at 80 MHz is a BUILD BLOCKER, recorded exactly - \"static assertion failed: FLASH and PSRAM Mode configuration are not supported\" (esp_psram config-time assert), because on ESP32-S3 flash and PSRAM share the MSPI clock tree, so only the combined step exists. (b) Both at 120 MHz octal DDR with IDF_EXPERIMENTAL_FEATURES=y: measured twice with board assignments swapped, each against controls in the same concurrent batch. Candidate 5.1667 on board 3, then 5.1667 on board 1 (two different boards, identical to the last digit); controls read exactly 4.9917 - the accepted runtime - on both remaining boards. Candidate deltas: prefill 5.4517, extended 5.0814, think 4.05, min_case 4.93, boot bench 5.213 (192 ms/token), internal_free 14,031 (-1,184 B), 14/14 device byte-exact with token_delta 0. The metrics logged on this line are the CONTROL's, because nothing shipped: the primary and every secondary below are the unchanged accepted runtime, re-measured on two boards in these batches. NOT KEPT for two independent reasons: the campaign's benchmark-integrity rule permits only the documented 240 MHz CPU / 80 MHz octal flash+PSRAM, and IDF's own Kconfig help for SPIRAM_SPEED_120M in octal mode says it \"works when the temperature is stable\" and that a ~20 Celsius swing either way makes PSRAM accesses \"crash randomly\" - an axis a single-room soak cannot cover (cold-then-warm and warm-then-cold are not warm-then-warm), so a soak would buy false confidence, not safety. What a real stability campaign needs is named in ideas.md: SPIRAM_TIMING_TUNING_POINT_VIA_TEMPERATURE_SENSOR plus thermal-cycling integrity tests, paid for out of 15,215 B of internal RAM. Diagnostic value: a 50 % wider MSPI clock moves the whole token by only 3.5 % while the 2-bit GEMV phase is 43 % of it, so that phase waits on its 2-instructions-per-weight floor, not on bytes - a third independent confirmation of that floor after the row-blocking, load-width and schedule nulls. All three named follow-on experiments (15, 16, 19) are now measured and the named queue is complete; nothing was integrated for 19.","timestamp":1790058747065,"segment":1,"confidence":15.605875152998754,"asi":{"hypothesis":"Experiment 19: is the remaining CQ2 token limited by the external-memory clock? 120 MHz octal flash+PSRAM candidate vs 80 MHz controls","measured_delta_pct":3.51,"candidate_decode_tps":5.1667,"control_decode_tps":4.9917,"two_boards_agree":true,"internal_free_cost_bytes":1184,"psram_only_variant_blocker":"static assertion failed: FLASH and PSRAM Mode configuration are not supported (shared MSPI clock tree on ESP32-S3)","integrity":"14/14 byte-exact, token_delta 0 on both 120 MHz boards - one thermal condition only","not_shipped_reason":"campaign allows only documented 240 MHz / 80 MHz; IDF calls octal 120 MHz DDR experimental with random PSRAM crashes after ~20 C drift","stability_campaign_would_need":"SPIRAM_TIMING_TUNING_POINT_VIA_TEMPERATURE_SENSOR + thermal-cycling integrity tests, costing 1184 B of 15215 B internal free","diagnostic_use":"bounds the memory-clock share of the token at ~3.5 pct, confirming the 43 pct 2-bit GEMV phase is instruction-floor-bound not bandwidth-bound","queue_state":"experiments 15/16/19 all measured; named queue complete","next_action_hint":"new candidate banked and measured this cycle: paired nd_expf in the elementwise sigmoid loops (SiLU + attention gate, ~14,400 nd_expf calls/token) -> +0.200 pct on two boards, bit-exact over 1.6M comparisons"}}
{"run":290,"commit":"e6f2e0d","metric":5.0017,"metrics":{"prefill_tps":5.2733,"ext_decode_tps":4.9186,"think_tps":3.92,"boot_bench_tps":5.046,"min_case_tps":4.78,"gen_tokens":99,"internal_free":15215,"psram_free":2052252,"device_output_exact":14,"device_token_delta":0,"logit_max_delta":0.00005341,"logit_top1_match":10,"host_output_exact":13},"status":"keep","description":"Paired sigmoid in the two elementwise exp loops (SiLU gate + attention output gate): KEPT, +0.200 % decode (4.9917 -> 5.0017, now +105.0 % over the 2.44 baseline). Derived from Experiment 19's diagnostic rather than from the old queue: the phase map says the model spends ~14,400 nd_expf calls per token in loops that were never paired, because Experiment 12 only paired the *attention* softmax. sigmoidf_ is built on nd_expf (degree-5 Horner chain), so the MLP's SiLU (1024 elements x 8 layers) and the attention gate (768 x 8) are 7,200 independent long-latency exponentials per token on each core, and silu_rows / agate_rows walk them one element at a time. Interleave each adjacent pair through the shipped nd_expf_pair. Bit-exactness is by construction, not tolerance: the pair is used only when both elements take the SAME branch of sigmoidf_, so each element's exponential argument is the one the scalar path would have passed (-x for x >= 0, x otherwise), the two divisions keep their scalar form, mixed signs fall back to two scalar calls, and nd_expf_pair itself falls back to scalar outside its exact range. Chunks are 128 wide, so a pair never straddles the two cores. In silu_rows both operands are loaded before either output is written because `a` is read-modify-written. Evidence, in the campaign's order: (1) the rule-#1 differential test against the shipped sigmoidf_ copied verbatim - 1,600,202 comparisons, 0 bit mismatches, max_abs 0.000e+00, over a +-400 dense sweep plus branch boundary, +-0, subnormals, clamp edges and +-1e30 (the first attempt at this test silently compiled against a stale /tmp/nd_quant.h that shadowed the real header and merely failed to link - a harness fact, not a result); (2) host gates for the identical patch: 13/13 byte-exact, token_delta 0, fidelity 5.341e-05 - identical to the control - top1 10/10; (3) three-board batch: control board 1 read exactly 4.9917 while both candidate boards read 5.0017; (4) canonical confirmation on the original board at the shipping configuration (sdkconfig regenerated, 100 Hz tick, 64 B cache line): 5.0017, byte-exact 14/14, token_delta 0, checks green. Cost is +1,200 B of flash and ZERO internal RAM (internal_free 15,215 unchanged). Secondary monitors: extended 4.9186 (+0.12 %), prefill 5.2733 (+0.16 %), min_case 4.78 which is the best worst-case seen, boot bench 5.046 (198 ms/token) - the bench moving is the mechanism check, since unlike the sampler work this phase is inside the bench; think_tps 3.92 unchanged, so the 4-bit/vocabulary path is not harmed. The delivered +0.20 % is a fraction of the ~+0.8 % the arithmetic predicted (7,200 pairs x 49 saved cycles), the same partial-realisation Experiment 12 measured: some of that exp latency was already hidden by neighbouring work. Note this candidate is exactly at the 0.2 % keep bar, not above it: it is kept because it is reproducible to the digit on four boards on a metric with zero measured spread, and because it costs no RAM. make capture is due again (shipping code changed) - next cycle.","timestamp":1790059064119,"segment":1,"confidence":15.667074663402671,"asi":{"hypothesis":"sigmoidf_ is built on nd_expf, so the SiLU and attention-gate loops run ~7,200 independent long-latency exponentials per core per token; interleaving adjacent elements through the existing bit-exact nd_expf_pair should recover part of Experiment 12's +19.96 % pair win","measured_delta_pct":0.2,"predicted_pct":0.8,"realisation":"25 pct of the arithmetic prediction, same partial-realisation pattern as Experiment 12 (some latency already hidden)","bit_exact_test":"1,600,202 comparisons, 0 mismatches, max_abs 0.000e+00 vs sigmoidf_ copied verbatim","boards":"control 4.9917 (board1) vs candidate 5.0017 on boards 2,3 and 5.0017 on the canonical board","cost":"+1200 B flash, 0 B internal RAM","harness_fact":"a stale /tmp/nd_quant.h shadowed the real header when a test file lived in /tmp - quote-includes search the including file's directory first; keep test sources inside the repo tree","next_action_hint":"make capture is due (shipping code changed); remaining unpaired-exp mass is the 4x4 Sinkhorn (1280 exp + 1280 logf per token, sum-accumulation keeps order only if added one at a time)"}}
{"run":291,"commit":"4aeb436","metric":5.0117,"metrics":{"boot_bench_tps":5.057,"device_output_exact":14,"device_token_delta":0,"ext_decode_tps":4.9286,"gen_tokens":99,"host_output_exact":13,"internal_free":15215,"logit_max_delta":0.00005341,"logit_top1_match":10,"min_case_tps":4.79,"prefill_tps":5.2867,"psram_free":2052252,"think_tps":3.93},"status":"keep","description":"Skip the exponential of the row/column maximum in Sinkhorn's log-sum-exp: KEPT, +0.200 % decode (5.0017 -> 5.0117, now +105.4 % over the 2.44 baseline). This is the second candidate derived from the phase map rather than the old named queue, and it targets the phase that was previously only probed by changing its iteration count (vetoed by fidelity) or straight-lining it (null). sinkhorn() runs 20 iterations x (4 rows + 4 columns) x 8 layers = 5,120 nd_expf calls per decode token, and in every one of those 160 passes the maximum element is a member of the sum being accumulated, so its argument is exactly zero: a quarter of the phase, ~1,280 calls per token, was evaluating exp(0) with the same degree-5 Horner chain (~99 cycles) as an arbitrary argument. Contributing the literal 1.0f for a difference that is exactly zero removes them. Bit-exactness is by construction and was tested as a primitive, not only by goldens (rule #1): nd_expf(+0.0f) and nd_expf(-0.0f) are both exactly 1.0f (asserted as a precondition), the guard tests the SUBTRACTED DIFFERENCE rather than the index so it can only fire when two equal finite operands cancel - NaN and inf-inf yield NaN, which is not equal to 0.0f and therefore still falls through to nd_expf exactly as the shipped code did - and the partial is added in the shipped position, so the accumulation order cannot move. Differential test against sinkhorn copied verbatim: 200,000 random 4x4 runs across five distribution families (typical log-res, wide/clamped, all-equal, near-tied maximum, one dominant element) = 3.2 M elements, plus 964 exact-zero argument probes: 0 bit mismatches (kept in .auto/sinkzero/test.c, -ffp-contract=off). Evidence in the campaign's order: (1) that test; (2) host gates on the patched tree - 13/13 byte-exact, token_delta 0, fidelity 5.341e-05 identical to the control, top1 10/10, repo tests green; (3) three-board batch: control (board 1) exactly 5.0017 while both candidate boards read exactly 5.0117; (4) canonical confirmation on the original board at the shipping configuration (sdkconfig regenerated, 100 Hz tick, 64 B cache line): 5.0117 with checks green, 14/14 device byte-exact, token_delta 0. Cost is inside the existing code - no RAM (internal_free 15,215 unchanged), no new memory, no IRAM. Monitors all moved with the primary or stayed flat: extended 4.9286 (+0.20 %), prefill 5.2867 (+0.22 %), think 3.93 (+0.26 %), min_case 4.79 which is the best worst-case seen so the mean did not improve by hurting the tail, boot bench 5.057 (198 ms/token) - and the bench moving is the mechanism check here, because unlike the sampler work Sinkhorn is inside the bench. Delivered +0.200 % against an arithmetic prediction of +0.26-0.33 % (1,280 exps x ~99 cycles), i.e. ~70 % realisation - the best realisation of the three pairing/skip candidates (#12 half, #288 above prediction, #290 a quarter), which fits the mechanism: a skipped call removes work the scheduler could not have hidden behind anything, whereas pairing only re-exposes latency. make capture is due again because shipping code changed - next cycle.","timestamp":1790061128867,"segment":2,"confidence":null,"asi":{"hypothesis":"sinkhorn() computes 5,120 nd_expf per token in 20-iteration row/col log-sum-exp passes, and the row/column maximum's argument is exactly zero, so ~1,280 calls per token evaluate exp(0); contributing the literal 1.0f removes them bit-exactly","measured_delta_pct":0.2,"predicted_pct":"0.26-0.33","realisation":"~70 pct, the best of the three exp-lever candidates - skipping a call removes work the scheduler could not hide, unlike pairing which only re-exposes latency","bit_exact_test":"precondition nd_expf(+/-0)==1.0f asserted; 200,000 random 4x4 Sinkhorn runs (5 distribution families) = 3.2M elements + 964 zero-arg probes, 0 bit mismatches","guard_rationale":"tests the subtracted difference, not the index, so it fires only when equal finite operands cancel; NaN and inf-inf yield NaN and still fall through to nd_expf","boards":"control 5.0017 (board1) vs candidate 5.0117 on boards 2,3 and 5.0117 canonical","cost":"no RAM, no IRAM, no new memory","next_action_hint":"make capture due (shipping code changed); remaining Sinkhorn mass is the 1,280 logf per token, which libm owns and cannot be replaced bit-exactly"}}
