{"run":423,"commit":"169f9d1","metric":5.1167,"metrics":{"boot_bench_tps":5.162,"device_output_exact":20,"device_token_delta":0,"ext_decode_tps":5.0423,"gen_tokens":99,"host_output_exact":19,"internal_free":12855,"logit_max_delta":0.00005341,"logit_top1_match":10,"min_case_tps":4.88,"prefill_tps":5.4,"psram_free":2052252,"think_tps":3.99},"status":"keep","description":"condT measured cleanly on the RESTORED accepted base: decode 5.1267 = +0.196 % over 5.1167, with prefill 5.4133 (+0.25 %), min_case 4.89, gen_tokens 99, 6/6 primary cases and ZERO divergences; accepted runtime stays 5.1167 and its secondaries are carried (this candidate is not accepted - one bar-marginal reading is not a keep, and a repeat is queued). Board 2, BASE_ACCEPTED md5=cc046f59204e asserted by the guard added after the base error, candidate applied byte-exact (src_md5 28fb8a904541), host-proven before any flash (19/19 byte-exact, token_delta 0, golden_missing 0, fidelity 5.341e-05 identical, top1 10/10, checks rc=0), zero memory cost because the transpose fills slot 25 in place. This is the lever's first trustworthy number: run #390's +0.294 % sat on a base I can no longer vouch for, while the fusion-base reading (+0.19 % over 5.1467) and this one (+0.196 % over 5.1167) now agree to 0.006 pp from two independent bases - the cross-check the base error made necessary. Cold pricing predicted +0.53 % at full realisation, so +0.196 % is a 37 % realisation, inside the campaign's measured 25-70 % band; +0.196 % is 0.004 pp under the nominal bar, which is inside the metric's own 0.034 % quantum, so it is the bar's value rather than below it. Its real significance is composition: it is additive with the fusion's +0.58 %, and the bundle measured 5.1567 on two boards with zero spread. Bundle attempt #13 reached 17 cases with zero divergences before the engine-independent console stall, so the defect remains the constraint, not the code. Also launched, on board 3's healthy console: the logits4 sub-split (split_lg4.py on a main-synced accepted tree, marker asserted, ND_PROFILE build verified live) - the largest unattributed block in the token, 3.8 ms tools / 7.0 ms route against a 0.16-0.23 ms projection, i.e. ~3.5 ms never split since it was noticed; diagnostic image, so no speed claim, and per run #410 a profiled image's decode is non-comparable to the baseline in either direction.","timestamp":1790227795427,"segment":1,"confidence":19.34201012292117,"asi":{"condt_clean_on_accepted_base":"Restored accepted tree cc046f59204e + condT (in-place channel-major cond_v), board 2, BASE_ACCEPTED asserted by the new guard, host-proven before flash: decode 5.1267 = +0.196 % over the accepted 5.1167, prefill 5.4133 = +0.25 %, min_case 4.89, 6/6 primary cases, ZERO divergences, gen_tokens 99. This is the first clean number for the lever: run #390's +0.294 % was on a base I can no longer vouch for, and the fusion-base reading (+0.19 % over 5.1467) now agrees with this one to 0.006 pp - two independent bases, the same delta, which is exactly the cross-check the base error made necessary. Cold pricing predicted +0.53 % at full realisation; +0.196 % is a 37 % realisation, inside the campaign's measured 25-70 % band. It sits 0.004 pp under the nominal 0.2 % bar, which is inside the metric's own 0.034 % quantum, so it is the bar's own value, not below it - but one reading is not enough to keep it, hence the repeat in flight.","decision_framing":"condT alone is bar-marginal; its real value is that it composes with the fusion (+0.58 %) into a +0.78 % bundle, measured 5.1567 on two boards with zero cross-board spread. Both halves are bit-exact by independent proofs and both cost nothing at the heap. So the decision is not 'is +0.196 % keepable' but 'accept the bundle, or unblock the gate'. Board 3's bundle attempt #13 reached 17 cases with zero divergences and stalled - the defect, not the code, is the constraint.","lanes":"board 2 = continues its tail (extended/think), carrying the primary verdict. board 3 = new screen, the logits4 sub-split: split_lg4.py applied to a main-synced accepted tree (BASE_ACCEPTED asserted, marker present, marker_lines=1), building -DND_PROFILE=1 (idf.py -B build-prof live, PID verified). This is the largest unattributed block anywhere: logits4 reads 3.8 ms/token on a tools request and 7.0 ms on a route request while the candidate-row projection at the measured mean_n=6.7 costs 0.16-0.23 ms, so ~3.5 ms - 1.7 % of a tools token, up to 3.5 % of a route token - sits inside nd_model_logits_subset and has never been split. Diagnostic image, so no speed claim and no acceptance path. board 1 = idle on the named rig fault (console leg re-enumerates, answers no STATE); its substitute if reseated is the same profiled harvest.","warning":"A profiled (ND_PROFILE=ON) image's decode number is not comparable to the pinned baseline in either direction - run #410 measured a profiled image reading +0.39 % over accepted as a codegen side-effect of the inserted timers. The harvest is read for phase shares only.","next_three":"1 harvest board 2's tail and board 3's per-call logits4 split; the split decides whether a candidate exists in the sampler path at all, which is the only remaining place in the token with an unexplained 1.7-3.5 %. 2 second reading of accepted+condT to settle the bar-marginal +0.196 % (two bases already agree; a same-base repeat is what the keep rule wants). 3 accepted-base re-anchor: one canonical run of the restored cc046f59204e tree, since after the base error that number is load-bearing for every future delta; needs an explicit repeat override with a stated reason, not a silent bypass."}}
{"run":424,"commit":"fac65f5","metric":5.1167,"metrics":{"boot_bench_tps":5.162,"device_output_exact":20,"device_token_delta":0,"ext_decode_tps":5.0423,"gen_tokens":99,"host_output_exact":19,"internal_free":12855,"logit_max_delta":0.00005341,"logit_top1_match":10,"min_case_tps":4.88,"prefill_tps":5.4,"psram_free":2052252,"think_tps":3.99},"status":"keep","description":"expbc MEASURED +1.95 % on TWO independent boards, host-proven byte-exact, mechanism proven in the disassembly: the three exponent-scale bitcasts become explicit builtin calls, which are exempt from this target's -fno-builtin-memcpy, so the ROM library call disappears. Candidate now in main (nd_quant.h md5 45a6b2e9836e); accepted runtime stays 5.1167 and its secondaries are carried until the same-tree measure.sh confirmation runs. PRIMARY: board 2 decode 5.2167 and board 1 decode 5.2167 - identical to the digit from two boards and two builds, zero spread - 6/6 primary cases, zero divergences, prefill 5.51, min_case 4.98, gen_tokens 99 on both. QUALITY before any keep: host 19/19 byte-exact, token_delta 0, golden_missing 0, fidelity 5.341e-05 identical, top1 10/10, checks rc=0 on the worker tree AND on main. MECHANISM PROOF: nd_model.c.obj memcpy sites 148 -> 114 (control = accepted header shadow-included ahead of the worker's -I flags, same command line, same build tree) = 34 inlined expansions de-called. SCREEN (board 1 kbench over JTAG): the conversion costs 77.15 cyc shipped vs 50.22 builtin on real PSRAM operands (-34.9 %) and 76.22 vs 47.33 over the whole 65,536-encoding space (-37.9 %), mismatch=0 across every encoding incl. signed zero, subnormals, NaN. SECOND VERDICT: condT2 (condT + two independent conditioning accumulators, the changed-premise retry of #380/#381) measured 5.1267 on board 3 at 17 cases - the same number as condT alone in #423 - so the interleave adds nothing even with resident operands, and the reduction-interleave family closes.","timestamp":1790231013613,"segment":1,"confidence":19.34201012292117,"asi":{"condt2_null":"condT+two accumulators on the staged channel-major layout = 5.1267 on board 3, the SAME number as condT alone in #423. The changed premise (resident operands make the interleave pay, per the fw2/fw3 mechanism) is REFUTED for reductions: interleaving reductions costs on this loop whether the operand is strided (#380 -0.394 %, #381 -0.427 %) or staged (#424 0.000 % vs condT). Family closed on both sides.","elf_proof":"engine/src/nd_model.c.obj, xtensa-esp32s3-elf-objdump -dr, grep -c memcpy: CONTROL (accepted nd_quant.h shadow-included ahead of the worker's -I flags, compiled by the SAME command from the SAME build tree) = 148 sites; CANDIDATE = 114. 34 inlined exp/exp-pair expansions stopped calling ROM memcpy. Harness fact: appending the shadow -I at the END of the command re-compiles the candidate as its own control (both read 114) - the shadow include must be prepended, and grep '<memcpy>' matches nothing in a relocatable object (needs -dr + a bare memcpy match).","harness_fix":"gen_lane.sh now (a) asserts the accepted BASE tree md5 before applying (exit 6 BASE_NOT_ACCEPTED, the #421 class), (b) deletes tracked .auto/diag_* markers that a reset restores into the worker and that change harness behaviour, (c) asserts the candidate changed the whole-tree md5 and writes .auto/expect_engine_md5 so measure.sh's provenance assertion is machine-enforced.","lane_loss":"Board 1's uncommitted tracked edits (a6e7454-era kbench.c copy, nd_quant.c, bench.py, measure.sh) were destroyed by my reset --hard: my `git stash push -- <paths>` aborted on a pathspec board1's HEAD does not track (.auto/diag_request_timeout_s), so nothing was stashed and the reset went through. Both kbench.c versions (169f9d1 and a6e7454) are in git and the screen itself is reproduced by .auto/exp52/apply_kb_f16bc.py, so nothing unique is gone. Standing rule: read `git status --porcelain` first and stash only listed paths (or no pathspec) before any worker reset.","mechanism":"-fno-builtin-memcpy is an ESP-IDF default, so every plain small memcpy in the engine is a ROM call with argument setup + FP spills; the accepted image made 34 such calls per token in nd_model.c alone. Run #415's '~64-cycle store-to-load forwarding floor' was measuring the call, not forwarding.","next_action_hint":"Confirm expbc on the main tree with run_experiment(bash .auto/measure.sh) when a board frees (main measure.sh needs board 1), push the gate as deep as the wedge allows, then price the same mechanism on the remaining sites: nd_f16's own bitcast (screen: 26.9 cyc saved per conversion on >100K calls/token, the biggest remaining prize), nd_f16_slow, then struct-copy memcpy in the per-token path.","prepared_next":".auto/exp53/apply_head4.py routes the full-vocabulary head (nd_cq_gemv_prepared) through gemv4_asm_usable ? gemv_rows_offset_asm : gemv_rows_generic with ctx.base explicitly 0 (uninitialized there today), generic fallback preserved; base pinned cc174624959b, host syntax green.","screen_detail":"KB F16BC NUM enc=65536 mismatch=0 slow_path=4096 (all 65,536 half encodings bit-compared against the engine's own nd_f16); mode=dq (real PSRAM blob bytes, conversion feeding a dependent FMA) 77.15 -> 50.22 cyc; mode=enc_all 76.22 -> 47.33 cyc. The residual ~50 cyc is the LX7 int->FP register transfer, not a call, so a cheaper conversion still exists but not by removing this call twice.","wedge_update":"Attempts #14 (b2 expbc, 19 cases) and #15 (b3 condT2, 17 cases) both ended in the same outbound console stall with zero divergences. The wedge caps a single-session suite at 6-19 cases on all three boards and is the only thing between a +1.95 % candidate and a 20-case gate."}}
{"run":425,"commit":"18f1bc5","metric":5.1167,"metrics":{"boot_bench_tps":5.162,"device_output_exact":20,"device_token_delta":0,"ext_decode_tps":5.0423,"gen_tokens":99,"host_output_exact":19,"internal_free":12855,"logit_max_delta":0.00005341,"logit_top1_match":10,"min_case_tps":4.88,"prefill_tps":5.4,"psram_free":2052252,"think_tps":3.99},"status":"keep","description":"Two more measured levers on the expbc base (5.2167), both cross-board, plus the divergence question opened. head4 (the mentor's direction C: route the full-vocabulary head through the already-guarded 4-bit assembly walker in nd_cq_gemv_prepared, ctx.base explicitly zeroed, generic fallback preserved) = 5.235 on board 3 and 5.235 on board 2, +0.350 % over 5.2167, above the bar on two boards, min_case 5.00 (best worst case in 425 runs), gen_tokens 99 with every case's token count identical. f16bc (nd_f16's own bitcast, the same -fno-builtin-memcpy mechanism, memcpy sites in nd_model.c.obj 114 -> 86 and in nd_quant.c 16 -> 6) = 5.2267 on board 3 and 5.2267 on board 1, +0.190 % over 5.2167 - two boards to the digit but bar-marginal; it also returns 768 B of internal heap (13,623 vs 12,855) and lifts think_tps 3.99 -> 4.10 and boot_bench 5.162 -> 5.274. f16bc is the first candidate this session to complete the 20-case device group: device_cases=20, golden_missing=0, token_delta=0, and device_output_exact=19/20 - one tail prose case (heldout_long_tools_note_only) differs from its golden at an identical 19-token count with an identical tool-call prefix, which is run #395's order-dependent-tail-golden class. A control lane (same board, same session order, NO generator) and a host 19-case run of the same tree are in flight to decide whether that veto is pre-existing or candidate-caused; until then nothing is accepted and the accepted runtime stays 5.1167 with its secondaries carried.","timestamp":1790233925852,"segment":1,"confidence":19.34201012292117,"asi":{"divergence_control_in_flight":"One tail prose case (heldout_long_tools_note_only) differs from its golden at the SAME 19-token count with an identical tool-call prefix, the class run #395 established as order-dependent. A CONTROL lane on the same board with the same session order - the base tree, no generator - is running now: if it also prints device_output_exact=19/20 the veto is pre-existing and not caused by f16bc; if it prints 20/20 the candidate changed a rounding point and must be re-worked. Host byte-exactness for the same tree is running in parallel (/tmp/h55).","head4_result":"Full-vocabulary head routed through the guarded 4-bit assembly walker (nd_cq_gemv_prepared, ctx.base pinned to 0, generic fallback preserved): 5.235 on board 3 AND 5.235 on board 2 on the same base, +0.350 % over the expbc base 5.2167 (+2.288 % over the accepted 5.1167). prefill 5.51, min_case 5.00 - the best worst-case in 425 runs - gen_tokens 99 with every case's token count identical. First reading of the mentor's direction C and it is above the bar on two boards.","expbc_f16bc_split":"expbc (three exponent-scale bitcasts, 148 -> 114 memcpy sites in nd_model.c.obj) = +1.950 %; f16bc (nd_f16's own bitcast, 114 -> 86, and 16 -> 6 in nd_quant.c) = +0.190 % on top. The two are NOT one lever: the exp sites are ~14K calls/token in arithmetic-dense loops, nd_f16's >100K calls are mostly in staging where the per-call delta is diluted. f16bc also buys 768 B of internal heap back (13,623 vs 12,855) because the ROM-call prologues/epilogues shrink.","main_tree_state":"main carries accepted+expbc (engine tree md5 fc2a8e21f210, nd_quant.h 45a6b2e9836e). .auto/expect_engine_md5 was still pinned cdaf284ecce2 - a fusion-era value - which made measure.sh exit 3 on the correct tree; updated to the tree it must expect, and gen_lane.sh now takes an optional second (generator,target) pair for bundles whose halves are each measured.","board1_console":"main's own measure.sh flashed board 1 fine (build 21 s, flash 6 s) then timed out waiting for EVT READY for the whole boot window: board 1's console leg is the named rig fault, and it is intermittent - the same board served a KB screen and a 17-case lane earlier in this session. Field confirmations are therefore running in workers on healthy boards, not in main on board 1.","next_action_hint":"1) Read the control's device_output_exact; if 20/20, f16bc's 19/20 is a real numeric difference -> diff the case's text and re-check FP contraction at the nd_f16 use sites. 2) Bundle head4+f16bc (gen_lane.sh now supports the second pair) and price it on the expbc base. 3) Keep trying the 20-case gate on expbc itself - it has four agreeing readings at 5.2167 but its longest session was 16 cases.","harness":"measure.sh reads .auto/expect_engine_md5 from the WORKER after a reset, so a stale value committed in main fails every lane with exit 3 - the file is part of the base contract, not a scratch value."}}
{"run":426,"commit":"97f8d43","metric":5.1167,"metrics":{"boot_bench_tps":5.162,"device_output_exact":20,"device_token_delta":0,"ext_decode_tps":5.0423,"gen_tokens":99,"host_output_exact":19,"internal_free":12855,"logit_max_delta":0.00005341,"logit_top1_match":10,"min_case_tps":4.88,"prefill_tps":5.4,"psram_free":2052252,"think_tps":3.99},"status":"keep","description":"Composition decided the candidate: the f16bc+head4 BUNDLE read 5.235 on board 1 and 5.235 on board 2 - exactly head4 alone (5.235), not the sum - so the two are ONE mechanism (routing the full-vocabulary head through the 4-bit assembly walker removes the per-row nd_f16 conversions that f16bc was making cheaper) and f16bc is dropped. The shipping candidate is now accepted+expbc+head4: decode 5.235 on two independent boards = +2.288 % over the accepted 5.1167, prefill 5.51, min_case 5.00 (best worst case in 425 runs), gen_tokens 99 with every case's token count identical, host 19/19 byte-exact on the expbc base, and main now carries it (tree 33ab30304257). Three corrections recorded rather than quietly absorbed: (1) internal_free 13,623 belongs to the base/expbc tree, not to f16bc - the no-generator control prints it at boot; (2) that control reproduced base decode 5.2167 on a third board but never reached the device exactness group, so #425's 19/20 tail-prose veto stays unexplained and is now moot because f16bc is out; (3) the .auto/exp50/census.sh memcpy census shows everything still calling ROM memcpy is a bulk history/array copy where the call is correct, so the bitcast family is exhausted - expbc was the whole prize. A new mechanism is live on board 3: taphoist resolves the tap history rows once per call instead of recomputing (pos-j)%taps per output column (~55K redundant remainder+multiply per token), bit-exact over 87,836 host comparisons, priced against the 5.235 base.","timestamp":1790235470803,"segment":1,"confidence":19.34201012292117,"asi":{"composition_result":"Bundle f16bc+head4 = 5.235 on board 1 AND board 2, i.e. EXACTLY head4 alone (5.235) and NOT 5.235+0.19 %. They are one mechanism: head4 routes the 8192x768 4-bit head through the assembly walker, which removes the per-row-per-group nd_f16 conversions that f16bc was making cheaper. So f16bc is dropped (shortest diff wins) and the shipping candidate is accepted+expbc+head4 = 5.235 = +2.288 % over the accepted 5.1167, measured on two boards with min_case 5.00 (best worst case in 425 runs).","heap_correction":"Correcting #425: internal_free 13,623 is the BASE (accepted+expbc) tree's own boot value - the control lane's EVT ready line prints it on the tree with no generator - so the +768 B I credited to f16bc belongs to expbc, not to f16bc. Accepted's canonical 12,855 predates the base restore.","control_result":"The no-generator control on board 3 reproduced the base decode exactly (5.2167) - the base tree is reproducible on a third board - and, like every other session, never reached the device exactness group (it stalled in the tail), so the 19/20 tail-prose question from #425 is still unanswered by a control. It also no longer matters for the shipping candidate: f16bc is out, and expbc/head4 lanes have shown zero divergences in every case reached.","census_closure":".auto/exp50/census.sh lists what still calls ROM memcpy after the bitcast family: nd_model.c is prefix_copy, nd_model_step_hidden, nd_model_snapshot/rewind, nd_model_open - all bulk history/array copies where a library call is correct - plus one site in nd_f16_slow (cold path). The 4-byte-bitcast prize is therefore exhausted; expbc was the whole prize.","tap_candidate":".auto/exp57/apply_taphoist.py resolves the tap history rows once per call instead of computing (pos-j)%taps per output column (~55K redundant remainder+multiply per token); MAC order, the j<=pos startup guard and every non-3-tap geometry are preserved, and .auto/exp57/test_tap_equiv.c proves it over 87,836 comparisons (dims 96/128/576/768/33, taps 1-4, pos 0..2*taps+1, 1-3 column blocks, mismatches=0). Live on board 3 as accepted+expbc+head4+taphoist (tree 0190834e3488) against the 5.235 base. The guard found its own bug first: the first version compared the untouched tail beyond hi and reported 32,256 false mismatches at i=256.","harness_lesson":"A worker lane syncs with `git fetch <main> <branch>` + reset --hard, i.e. COMMITTED state only: an uncommitted edit in main is invisible to every lane, and the base assertion then refuses the lane (BASE_NOT_ACCEPTED tree_md5=fc2a8e21f210 expected=33ab30304257). Price a stacked candidate by passing its lower half as the lane's first (generator,target) pair - gen_lane.sh now takes an optional second pair.","next_action_hint":"1) Harvest the tap reading on board 3. 2) expbc+head4 still needs the 20-case device gate - longest session so far 17 cases; keep one lane aimed at it. 3) Remaining unexplored mechanism from the mentor queue: multi-column register tiling in the tap loop if taphoist is null, and the nd_f16_slow site as a cheap rider.","board1_console":"Board 1 served a KB screen, a 17-case lane and a 6-case primary in this session but failed main's own boot handshake once - its console leg is intermittent, so main-tree field confirmations are best run as worker lanes on a healthy board with the base stated explicitly."}}
