{"run":654,"commit":"7b54903","metric":5.7917,"metrics":{"boot_bench_tps":5.869,"device_output_exact":6,"device_token_delta":0,"ext_decode_tps":0,"gen_tokens":99,"host_output_exact":19,"internal_free":5087,"logit_max_delta":0.00005341,"logit_top1_match":10,"min_case_tps":5.56,"prefill_tps":6.1067,"psram_free":2052252,"think_tps":0},"status":"discard","description":"DOT12W (QK dot 12-column body on the 5.8083 composed+staging pin) reads 5.7917 = -0.286% — the width curve on the QK side turns negative past 8 columns, exactly mirroring the P.V saturation at 4. 6/6, delta 0, heap unchanged. DISCARDED; width/iteration-shape axis now closed on all four attention loops with measured curve points on both sides of both peaks.","timestamp":1790302644688,"segment":1,"confidence":11.54526748971194,"asi":{"curve":"width axis fully read: P.V update saturated at 4 cells (#624 0.00), QK dot 4->8 = +0.53 (DOT8W), 8->12 = -0.29 (this), staging/sweeps null - the QK curve peaked at 8 as predicted by the register budget (4 accumulators + 8 operands ~= 16 FPU regs)","hypothesis":"DOT12W on the composed pin: QK dot body 12 columns per iteration (48 = 4x12 exact; each accumulator's ascending two-product grouping continued unchanged so partials are bit-identical; scalar tail kept for other shapes)","result":"-0.286 pct vs the 5.8083 pin - the 12-column body exceeds the register budget and the curve turns negative exactly as the P.V width curve did past its peak","board":"2, engine 8346a375aaf4, host 19/19 pre-flash","next":"no further width points anywhere; remaining levers are work-sharing (pairing class) which is measured on QK+P.V+staging, and the delivery/instruction floors closed long ago"}}
{"run":655,"commit":"7b54903","metric":5.8017,"metrics":{"boot_bench_tps":5.882,"device_output_exact":6,"device_token_delta":0,"ext_decode_tps":0,"gen_tokens":99,"host_output_exact":19,"internal_free":5087,"logit_max_delta":0.00005341,"logit_top1_match":10,"min_case_tps":5.57,"prefill_tps":6.1117,"psram_free":2052252,"think_tps":0},"status":"discard","description":"selsweep4 (SELRES rescale sweeps 4 cells/iter on the 5.8083 pin, b3) reads 5.8017 = -0.114%, 6/6, delta 0. Fourth consecutive width-form null/negative — iteration-shape levers closed on all four attention loops with curve points on both sides of both peaks (P.V peak 4, QK peak 8, staging/sweeps flat at 1). DISCARDED.","timestamp":1790302659734,"segment":1,"confidence":11.54526748971194,"asi":{"hypothesis":"#B3 reserve: unroll the three SELRES selective rescale sweeps (both-array and two single-array variants) four cells per iteration; every oh cell is a self-contained read-modify-write so grouping cannot change any value; v_hd 64 divides by 4","result":"-0.114 pct vs the 5.8083 pin (6/6, delta 0, heap unchanged) - fourth width null/negative on this stack","note":"tree-hygiene rule re-confirmed: b2 was md5-verified clean BEFORE this patch was written onto it (the #652 confound is not repeatable here); b3 restored to 31395c672ab8 snapshot after discard","next":"three boards free; next window: pairing-class candidates for the un-paired Q-side scalar masses, or acceptance-packet consolidation if the owner engages"}}
{"run":656,"commit":"9880811","metric":5.465,"metrics":{"boot_bench_tps":5.551,"device_output_exact":18,"device_token_delta":52,"ext_decode_tps":5.3969,"gen_tokens":99,"host_output_exact":19,"internal_free":6191,"logit_max_delta":0.00005341,"logit_top1_match":10,"min_case_tps":5.26,"prefill_tps":5.7533,"psram_free":2052252,"think_tps":4.3},"status":"keep","description":"Acceptance-evidence completion run: (1) kvstage4 FULL gate confirms the width null on breadth (decode 5.4650 identical, ext 5.3969 vs 5.3992, think 4.30); (2) behavioural capture GREEN on the SHIPPABLE+helper+ring tree (CAP_RC=0, 7/7) and on the seed-era helper tree — both acceptance lines now fully evidenced; (3) raw full-19-phase request table at the new pins (route: block 189.4 ms = attn-stage 117.4 + hadamard 29.4 + phi 13.8 + sinkhorn 3.7 + mix 6.1 + sampler-arithmetic 0.4 + ~10 ms scaffold residual) — no hidden phase, no new target above the measured floors.","timestamp":1790303576617,"segment":1,"confidence":11.54526748971194,"asi":{"breadth_gate":"kvstage4 full gate on shippable tree: decode 5.4650 identical, ext 5.3969 vs 5.3992 (-0.04 pct), think 4.30 identical -> width-4 staging confirmed NULL on breadth, not just primary","capture":"two captures green this cycle: seed-era helper tree (CAP-kvst-b3 rc=0) and SHIPPABLE+helper+ring tree (CAP-shp-b3 rc=0, 7/7 scenarios) - both acceptance lines now have capture evidence on their own trees","full_table_route":"whole 189.4 ms: attn-stage 117.4 (head-split 36.7, proj2bit 111.1 overlapping, taps 2.3, norms 0.6, rope 0.2, kv 1.1), hadamard 29.4 (kron 14.2), phi 13.8, sinkhorn 3.7, mix 6.1, step 0.7, sampler-arithmetic 0.4, ~10 ms scaffold residual","hypothesis":"complete the acceptance evidence for both lines: breadth gate of the width-4 staging variant, behavioural captures of both helper trees, and a full 19-phase request-path table at the new stack to look for any phase the 5-phase filtered harvest was hiding","no_new_target":"the full table shows no unattributed compute above the floors - the residual is lane-init/tier-pointer/timer scaffolding; every named phase (hadamard non-kron 15.2, phi 13.8, mix 6.1, sinkhorn 3.7) has a measured closure behind it","board":"b1 (gate+prof, shippable tree), b3 (capture), both lines on their own trees"}}
{"run":657,"commit":"0b0050b","metric":5.8067,"metrics":{"boot_bench_tps":5.883,"device_output_exact":6,"device_token_delta":0,"ext_decode_tps":0,"gen_tokens":99,"host_output_exact":19,"internal_free":5087,"logit_max_delta":0.00005341,"logit_top1_match":10,"min_case_tps":5.58,"prefill_tps":6.1183,"psram_free":2052252,"think_tps":0},"status":"discard","description":"Worker-spin budget 20000→60000 on the 5.8083 pin reads 5.8067 = -0.028% (exactly zero at the quantum), 6/6, delta 0. Worker budget bracket completed (was never swept); with #564's caller bracket, both WAIT knobs are now closed at this stack. DISCARDED as neutral. b1 meanwhile runs the ported spin handshake on the SHIPPABLE line, which never had spin at all.","timestamp":1790303877245,"segment":1,"confidence":11.54526748971194,"asi":{"hypothesis":"ND_WORKER_SPIN 20000 -> 60000 on the 5.8083 pin: the worker budget was never swept at any stack (only the caller's, #564); a longer spin keeps the peer hot through caller-side stretches the earlier stack did not have (staging frame). Bit-exact by construction - correctness never depends on the spin","result":"-0.028 pct = zero at the metric quantum (6/6, delta 0, heap unchanged)","closure":"both ends of both spin budgets are now bracketed at this stack (caller 600->2000 null #564, worker 20k->60k null here): the scheduling WAIT knobs are permanently closed; residual handshake cost is the notification path itself, which the ported spin merge (b1 lane) attacks from the other side","board":"2, pin 5.8083, engine b1919810c64c","next":"b1 measures the spin handshake PORTED to the shippable line (bundle5+attention+helper+ring+spin) - spin was only ever measured on the seed-era stack and the shippable line currently lacks it entirely, so its +~1 pct is still on the table there"}}
{"run":658,"commit":"0b0050b","metric":5.545,"metrics":{"boot_bench_tps":5.632,"device_output_exact":6,"device_token_delta":0,"ext_decode_tps":0,"gen_tokens":99,"host_output_exact":19,"internal_free":6183,"logit_max_delta":0.00005341,"logit_top1_match":10,"min_case_tps":5.34,"prefill_tps":5.8333,"psram_free":2052252,"think_tps":0},"status":"keep","description":"Spin handshake PORTED to the shippable line (bundle5 + composed attention + staging helper + RX ring + spin, applied as bcdf070's two hunks onto the ring main): decode 5.5450 vs the 5.4650 shippable pin = +1.464%, prefill 5.8333 (+1.5%), min_case 5.34 (+1.5%), boot bench 5.632, 6/6, token_delta 0, heap -8 B. That now puts the shippable path at +4.56% over the accepted 5.3033 pin with zero unaccepted engine code. b1 full 20-case gate + b3 cross-board screen running.","timestamp":1790304021743,"segment":1,"confidence":11.54526748971194,"asi":{"hypothesis":"port the spin-assisted handshake (bcdf070 hunks, applies clean onto the ring main with +30 line offset) onto the SHIPPABLE line: bundle5 + composed attention + KV staging helper + RX ring + spin. The shippable line never had spin - it was measured only on the seed-era stack - so its known ~+1 pct was still unclaimed there","result":"+1.464 pct primary, and prefill/min_case/boot-bench all move by the same ~+1.5 pct - the signature of a handshake-cost removal, not a benchmark artefact","board":"1, engine e6d55f29e286, host checks green pre-flash, heap -8 B","next":"b1 FULL 20-case gate + b3 cross-board screen are both running on this tree right now; if both reproduce, the shippable acceptance number moves from +3.048 to ~+4.5 pct over the accepted pin, and the owner decision stays exactly the same two-golden question","stack_note":"both lines carry the RX ring and both flip the same two demo-timer goldens; the ONLY image without the ring is the accepted bundle5 at 20/20 - the ring/ISR input path is now positively the sole carrier of the frozen-pair class (#647 + this window's grep confirmation)"}}
{"run":659,"commit":"4b9c370","metric":5.5483,"metrics":{"boot_bench_tps":5.633,"device_output_exact":6,"device_token_delta":0,"ext_decode_tps":0,"gen_tokens":99,"host_output_exact":19,"internal_free":6183,"logit_max_delta":0.00005341,"logit_top1_match":10,"min_case_tps":5.33,"prefill_tps":5.84,"psram_free":2052252,"think_tps":0},"status":"keep","description":"Spin-port cross-board screen (b3, identical e6d55f29e286 tree): decode 5.5483 = +1.501% over b3's own 5.4650 shippable reading, matching b1's +1.464% within one quantum. 6/6, delta 0, rc=0. Shippable line now stands at +4.6% over the accepted 5.3033 on two boards, pending the b1 full 20-case gate (relaunched with allowance after the guard correctly refused a same-signature repeat).","timestamp":1790304266857,"segment":1,"confidence":11.54526748971194,"asi":{"hypothesis":"cross-board screen of the spin-handshake port on the shippable line (identical engine e6d55f29e286 on a different board and different prior tree): does the +1.464 pct reproduce","result":"+1.501 pct on b3 vs +1.464 pct on b1 against each board's own 5.4650 shippable pin - reproduced within one quantum; b1 full 20-case gate relaunching under the documented allowance (its first attempt correctly hit rc=42 because the screen consumed the signature)","detail":"prefill/min_case/boot move together again on b3 (screen values in log), confirming the handshake-cost mechanism on both boards","board":"3, engine e6d55f29e286","next":"b3 now screens CALLER_SPIN 600->1800 ON TOP of the spin port on the shippable base - a new dose point on a new base, because the ring (ISR-fed stdin) changes the caller-side wait structure that the spin budget was originally tuned against"}}
{"run":660,"commit":"dab4d3f","metric":5.55,"metrics":{"boot_bench_tps":5.638,"device_output_exact":18,"device_token_delta":52,"ext_decode_tps":5.4808,"gen_tokens":99,"host_output_exact":19,"internal_free":6183,"logit_max_delta":0.00005341,"logit_top1_match":10,"min_case_tps":5.34,"prefill_tps":5.8367,"psram_free":2052252,"think_tps":4.34},"status":"keep","description":"SHIPPABLE+SPIN FULL GATE (bundle5 + composed attention + staging helper + RX ring + spin handshake): decode 5.5500 = +4.65% over the accepted 5.3033 pin, EXTENDED 5.4808 (+4.86% over bundle5's 5.2269 - best ever on accepted engine code), think 4.34, min_case 5.34, boot 178 ms/token, heap 6183, all 20 cases complete, 18/20 with ONLY the two ring-proven demo-timer goldens. The recommended shippable line is fully gated at +4.65%. Cross-board: b1 5.5450/b3 5.5483 screens, both reproduced here. Caller-spin 1800 dose on the same base was +0.09% (sub-bar, discarded).","timestamp":1790304688658,"segment":1,"confidence":11.54526748971194,"asi":{"breadth":"ext 5.4808 = +4.86 pct over bundle5's own 5.2269 (best on accepted engine code), think 4.34, min_case 5.34, boot 178 ms/token, heap 6183, all 20 cases complete","failure_set":"18/20 delta 52 - ONLY the two demo-timer goldens, the same pair that #647 proved flips under a pure RX-ring transport change on the byte-pure accepted engine","final_numbers":"the shippable line lands at 5.5500 (+4.65 pct over the owner's 5.3033 pin) with capture owed on the spin form (green pre-spin, spin is main.c-only); the seed-era line stands at 5.8083/5.8050 two-board full gates (+9.5 pct)","hypothesis":"FULL 20-case breadth gate of the shippable+spin tree on b1 (allowance: the two-board screens consumed the signature) - the last speed evidence item for the recommended acceptance line","board":"1, engine e6d55f29e286, host 19/19","owner_packet":"both acceptance lines are now measured end to end with capture and full gates; the ONLY thing between either commit and shipping is the disposition of the two ring-sensitive goldens (re-baseline / replace with state-independent cases / keep as blockers)","board_note":"b3 caller-spin 1800 on the same base: +0.09 pct (sub-bar, prefill/min unmoved) -> dose point recorded, knob stays at 600"}}
{"run":661,"commit":"dab4d3f","metric":5.5533,"metrics":{"boot_bench_tps":5.633,"device_output_exact":6,"device_token_delta":0,"ext_decode_tps":0,"gen_tokens":99,"host_output_exact":19,"internal_free":6183,"logit_max_delta":0.00005341,"logit_top1_match":10,"min_case_tps":5.34,"prefill_tps":5.8367,"psram_free":2052252,"think_tps":0},"status":"discard","description":"Caller-spin 1800 on shippable+spin (b3) reads 5.5533 = +0.09% over the same tree's 5.5483 — sub-bar, prefill/min unmoved. DISCARDED; caller-budget dose flat on both bases. Shippable+spin recommended line stays at spin-default budgets, full-gated 5.5500 (+4.65%).","timestamp":1790304706494,"segment":1,"confidence":11.54526748971194,"asi":{"hypothesis":"CALLER_SPIN 600->1800 on top of the spin port on the SHIPPABLE base (new base + the ring's ISR-fed stdin changes the caller-side wait structure the budget was tuned against) - dose point beyond the old stack's bracket","result":"+0.090 pct primary (5.5533 vs the same tree's 5.5483 on this board), prefill and min_case unmoved - positive-leaning but sub-bar and mechanistically un-signalled, so not confirmable and not kept","dose_curve":"caller budget: 600->2000 null at 5.58-era (no ring), 600->1800 +0.09 here; worker 20k->60k null - the knobs are flat within +-0.1 pct everywhere they have been touched","board":"3, engine 83f6f8e50cd3","next":"capture of the shippable+spin tree on b1 closes the recommended line's last evidence gap"}}
{"run":662,"commit":"dab4d3f","metric":5.55,"metrics":{"boot_bench_tps":5.638,"device_output_exact":18,"device_token_delta":52,"ext_decode_tps":5.4808,"gen_tokens":99,"host_output_exact":19,"internal_free":6183,"logit_max_delta":0.00005341,"logit_top1_match":10,"min_case_tps":5.34,"prefill_tps":5.8367,"psram_free":2052252,"think_tps":4.34},"status":"keep","description":"Capture GREEN on the recommended shippable+spin tree (CAP_RC=0, all 9 behavioural flags) — closing the acceptance packet: full gate 5.5500 = +4.65% over the accepted pin on accepted engine code, ext 5.4808, capture green, host 19/19, all 20 cases run, sole blocker the two ring-proven demo-timer goldens (#647). Alternative seed-era line 5.8083/5.8050 also fully captured/gated. Pool parked cleanly; owner decision requested on the golden pair (re-baseline / replace / block).","timestamp":1790305018326,"segment":1,"confidence":11.54526748971194,"asi":{"hypothesis":"behavioural capture of the RECOMMENDED acceptance tree (bundle5 + composed attention + staging helper + RX ring + spin) on b1 - the spin merge is main.c-only but it changes the cross-core wait path, and capture is the repo's own end-to-end integrity check","result":"CAP_RC=0 with all nine behavioural flags true (routes/tools correct, two-pass local execution, no external calls, telemetry, sampling interval, timer expiry)","final_packet":"RECOMMENDED: engine 5a9b75f4c948 (bundle5 quant untouched) + composed attention + KV staging helper + RX ring + spin = b1 main d51719ecfbce => e6d55f29e286. decode 5.5500 full gate (+4.65 pct over accepted 5.3033), ext 5.4808 (+4.86 pct), think 4.34, min 5.34, boot 178 ms, heap 6183, host 19/19, fidelity 5.341e-05, capture green, 20/20 cases complete, 18/20 goldens. ALTERNATIVE: seed-era stack 5.8083/5.8050 (+9.5 pct) incl. unaccepted quant/asm changes.","sole_blocker":"heldout_interval_one + heldout_long_tools_note_only flip under the RX ring ALONE on the byte-pure accepted engine (#647) - demo-timer state sensitivity; owner options: re-baseline the two, replace with state-independent cases (the #467 recipe's four shapes are already validated), or keep as blockers","board":"1","pool_state":"b1 and b3 = shippable+spin e6d55f29e286, b2 = seed pin 91e79eeeb304; captures current on both lines; no lanes running"}}
{"run":663,"commit":"c37277e","metric":5.8067,"metrics":{"boot_bench_tps":5.883,"device_output_exact":6,"device_token_delta":0,"ext_decode_tps":0,"gen_tokens":99,"host_output_exact":19,"internal_free":5087,"logit_max_delta":0.00005341,"logit_top1_match":10,"min_case_tps":5.57,"prefill_tps":6.1183,"psram_free":2052252,"think_tps":0},"status":"discard","description":"SELRES both-sweep A/B + co-occurrence stats (mentor's open question): splitting the merged both-array rescale sweep into two single-array sweeps reads 5.8067 vs the 5.8083 pin = exactly zero (bit-identical by construction, 6/6). Host-instrumented counters over three primary prompts: pair-loop iterations are 86.7% no-rescale, 5.8%/5.2% single-head rescale, 2.36% BOTH - so any both-flag specialization is bounded by ~2 pct of the sweep, and the measured null matches that bound. SELRES family now closed with data on both branches.","timestamp":1790305376826,"segment":1,"confidence":11.54526748971194,"asi":{"cooccurrence_stats":"host instrumented run (same engine, byte-exact goldens path), three primary prompts: pair-iterations neither 86.69 pct, A-only 5.76, B-only 5.20, BOTH 2.36 pct - both-flag co-occurrence is genuinely rare (17.7 pct of rescale events), which the mentor noted had never been established for #645's explanation","ceiling_arithmetic":"any both-flag-only specialization is bounded by 2.36 pct of the sweep time - directly measured here as the merged-vs-split A/B - so the SELRES-family design space is now measured AND bounded","hypothesis":"SELRES both-branch A/B: the shipped form interleaves both arrays' rescale sweeps in ONE loop; the alternative runs two single-array sweeps. Cells are independent RMWs so both forms are byte-identical - this A/B's answer also prices how much the merged form was worth","result":"split reads 5.8067 vs 5.8083 = exactly zero: the merged sweep was worth nothing measurable, consistent with the 2.36 pct co-occurrence bound","board":"2 (device A/B, seed pin), host stats via atexit counters in a host-only ND_SELRES_STATS build (never in a device image, b1 file restored and md5-verified after)","next":"SELRES family closed with data: shipped selective dispatch stays (it carries +0.55 pct), its both-branch form is interchangeable, co-occurrence is quantified"}}
{"run":664,"commit":"8f1a2c3","metric":5.5467,"metrics":{"boot_bench_tps":5.632,"device_output_exact":6,"device_token_delta":0,"ext_decode_tps":0,"gen_tokens":99,"host_output_exact":19,"internal_free":5927,"logit_max_delta":0.00005341,"logit_top1_match":10,"min_case_tps":5.34,"prefill_tps":5.8333,"psram_free":2052252,"think_tps":0},"status":"discard","description":"Row-owned single-dispatch Kron halves (B1): fusing the two kron_apply nd_parallel_rows dispatches into one row-owned callback (each core does its half-1 blocks then half-2 over its own rows) reads 5.5467 vs this board's 5.5450/5.5500 shippable+spin pins = NULL (-0.03%). 6/6 device byte-exact, token_delta 0, host 19/19 byte-exact pre-flash. With spin already collapsing the join cost, removing 24 joins per token has nothing to remove; retirement per form, do not expand to arbitrary MLP fusion.","timestamp":1790310490564,"segment":1,"confidence":11.54526748971194,"asi":{"form":"row-owned single dispatch: kron_owned callback runs kron1_blocks [b0,b1) then kron2_rows [4b0,4b1) so each core consumes only its own hada_c rows; removes 24 inter-half joins/token","hypothesis":"kron halves are row-owned (second half row k reads only hada_c row k), so one dispatch can carry both halves and drop the between-halves join","next":"B1 removed this hunk, ports the proven B3 scheduler and runs ONE deliberate cross-board full gate","result":"5.5467 vs the 5.5450/5.5500 pins = null; 6/6 exact, delta 0, host 19/19 bit-exact BEFORE flash, checks rc 0. Removing 24 joins/token buys nothing at the spin stack - the join is already ~free, so the win would have had to come from rebalancing, and the halves were already balanced.","variant":"kron-fusion"}}
