{"run":736,"commit":"4599dac","metric":5.8283,"metrics":{"boot_bench_tps":5.924,"device_output_exact":18,"device_token_delta":52,"ext_decode_tps":5.7638,"gen_tokens":99,"host_output_exact":19,"internal_free":14171,"logit_max_delta":0.00005341,"logit_top1_match":10,"min_case_tps":5.62,"prefill_tps":6.1283,"psram_free":2062492,"think_tps":4.52},"status":"crash","description":"The behavioural capture is blocked by container-wide serial degradation, not by code or by the candidate image. Board 1 (the last healthy lane, which ran a full gate + host checks twenty minutes earlier) was flashed successfully with the 5.8283 shippable tree (make flash-app, flash_rc=0, hash line present, engine 787a58302f52) and its console then returned ZERO bytes - no ROM banner, nothing - on the scripted 600 s wait and on a further 30 s manual read with the documented DTR/RTS discipline. A single check of all three device nodes shows every console silent and the node mtimes refreshing (board 1 console 17:56:49, flash 18:00:00; board 3 flash 18:06:42), i.e. the USB path is re-enumerating and not delivering data for any board. No further probes were spent and nothing was reflashed. Interpretation: this is a host/container serial state, the same class as board 2's silence in #733 - which means my earlier reading of board 2's silence as that board's fault was too narrow, and the two-board hardware story is really one host-path story. All measured numbers stand untouched (seed 6.0617 + host 19/19, shippable 5.8283 + host 19/19). The capture debt remains: it needs a healthy serial path, and the runner shape is recorded at /root/board-pool/capture_b1_candidate.sh.","timestamp":1790359663749,"segment":1,"confidence":14.107560405300093}
{"run":737,"commit":"7113fdf","metric":6.0617,"metrics":{"boot_bench_tps":6.152,"device_output_exact":6,"device_token_delta":0,"ext_decode_tps":0,"gen_tokens":99,"host_output_exact":0,"internal_free":13967,"logit_max_delta":0,"logit_top1_match":0,"min_case_tps":5.83,"prefill_tps":6.3967,"psram_free":2062492,"think_tps":0},"status":"keep","description":"Board 3 recovered AND cross-board confirmation of the campaign's best line: the transplant of B2's seed-line tree (engine d91fd5f048ca) onto board 3 reads decode 6.0617, prefill 6.3967, min_case 5.83, 6/6 device exact, internal_free 13967 - identical to board 2's numbers to the digit, so the 6.0617 packet is now confirmed on a second board, not just a second run. The recovery is the finding: board 3 was NOT hardware-blocked. Its previous image (the old E67-only tree) booted, printed EVT ready, then watchdog-reset during priming with internal_free=1311 - an SRAM-starved build looping on RTCWDT/TG1WDT - and each reset re-enumerated its USB, which is what produced the \"cycling flash node\" that had been read as a failing port. Flashing a known-good image cleared it on the first retry and the board has since run a full screen with no resets. Lesson for the pool: a reset loop looks exactly like a broken USB path from the host side, so triage order should be (1) read the console for reset lines, (2) if it is looping, reflash a known-good image, (3) only then suspect the port. Boards 1 and 2 remain console-silent and still need host-side triage.","timestamp":1790360891541,"segment":1,"confidence":14.107560405300093}
{"run":738,"commit":"4599dac","metric":6.0617,"metrics":{"boot_bench_tps":6.152,"device_output_exact":6,"device_token_delta":0,"ext_decode_tps":0,"gen_tokens":99,"host_output_exact":19,"internal_free":13967,"logit_max_delta":0.00005341,"logit_top1_match":10,"min_case_tps":5.83,"prefill_tps":6.3967,"psram_free":2062492,"think_tps":0},"status":"crash","description":"Second capture attempt, this time on the one board whose console had been working (board 3, healthy at 18:2x, screen 6.0617), also ended BOARD_NOT_READY: flash_rc=0 with the hash line present, then ready=0 after the full 600 s window and a further 25 s single read returning zero bytes. The serial path has now gone silent for all three boards while every node mtime keeps refreshing (b3 console 18:23:24 / flash 18:30:08), i.e. the pattern is host-side re-enumeration without delivery - the same class as #733/#736, and the container's view of /dev/needle-pi is a mount so node presence proves nothing. One bounded read per board, no loops, nothing reflashed beyond the capture's own flash, trees untouched. Both packets stand unchanged: seed d91fd5f048ca 6.0617 + host 19/19 (now also cross-board confirmed on board 3, #737) and shippable 787a58302f52 5.8283 + host 19/19. The capture debt stays open and is now clearly gated on host USB triage rather than on any runner detail - the runner shape is preserved at /root/board-pool/capture_b3_candidate.sh and should be retried only after a console answers.","timestamp":1790361885661,"segment":1,"confidence":14.107560405300093}
{"run":739,"commit":"c1f0be9","metric":6.0617,"metrics":{"boot_bench_tps":6.152,"device_output_exact":18,"device_token_delta":52,"ext_decode_tps":5.9877,"gen_tokens":99,"host_output_exact":19,"internal_free":14991,"logit_max_delta":0.00005341,"logit_top1_match":10,"min_case_tps":5.83,"prefill_tps":6.3967,"psram_free":2062492,"think_tps":4.65},"status":"keep","description":"Host-side audit of the in-window-printing class that paid twice this campaign (eW78 +0.35% by deferring the per-token TOK echo out of the decode clock; eW79 by removing the per-token prefill progress line from the prefill clock). Result: the class is EXHAUSTED on the measured path. Every printf in main.c's request path now sits outside both timed windows - the decode loop contains only the sampler, the detokenizer, the segment bookkeeping, the text copy and the model step; the prefill loop contains only the model step; the summaries, CONF and EVT done lines print after each clock stops. The only prints still inside a window are two terminal error paths (no_legal_token, and the truncation notice, which fires only when the answer hit MAX_NEW and is therefore invalid anyway). The engine side has no hot-path printing at all: every printf in nd_model.c is an open-time selftest verdict or a tier/dir diagnostic, and nd_quant.c, nd_sample.c and nd_grammar.c contain none. Hardware in the same window: one bounded read per board returned zero bytes for all three consoles (no loops, nothing reflashed), so the pool remains offline pending host USB recovery and the two measured packets stand unchanged (seed d91fd5f048ca 6.0617 + host 19/19, cross-board confirmed; shippable 787a58302f52 5.8283 + host 19/19).","timestamp":1790362035010,"segment":1,"confidence":14.107560405300093}
{"run":740,"commit":"b22a1ee","metric":6.0617,"metrics":{"boot_bench_tps":6.152,"device_output_exact":18,"device_token_delta":52,"ext_decode_tps":5.9877,"gen_tokens":99,"host_output_exact":19,"internal_free":14991,"logit_max_delta":0.00005341,"logit_top1_match":10,"min_case_tps":5.83,"prefill_tps":6.3967,"psram_free":2062492,"think_tps":4.65},"status":"keep","description":"Host-side audit of the per-token bookkeeping path, the same lens that found eW78 and the E68/E69/E71/E72b work. Result: nothing in it is above the metric's bar, and the arithmetic says so rather than an intuition. The step's per-token items are (1) the rotary tables - qk_head_dim/2 = 24 positions, each a cosf and a sinf, about 17k cycles, i.e. ~0.07 ms or 0.04% of a 170 ms token; (2) the embedding dequant plus its scale (already nd_mul4w) and the four-lane broadcast of the embedded row, ~3k cells, ~0.01 ms; (3) the engram step, which the phase map prices at 15.2 ms and whose mass is the two 2-bit LUT GEMVs, already closed; (4) the per-layer body, which is the model's real work and is where every kept lever lives. The rope recurrence that would remove (1) is a rounding change - cos/sin by incremental rotation accumulates error - so it is forbidden by the byte-exact goldens and the fidelity veto even though it might have stayed under the 2e-3 probe threshold; it is not worth pricing at 0.04% against a quality rule. Net: the per-token overhead class is closed by inspection with numbers attached, the way the in-window-printing class closed in #739. Hardware unchanged: all three consoles silent on one bounded read each, no loops, nothing reflashed; both packets stand (seed d91fd5f048ca 6.0617 + host 19/19 cross-board confirmed; shippable 787a58302f52 5.8283 + host 19/19).","timestamp":1790362163453,"segment":1,"confidence":14.107560405300093}
{"run":741,"commit":"f97b5ad","metric":6.0617,"metrics":{"boot_bench_tps":6.152,"device_output_exact":18,"device_token_delta":52,"ext_decode_tps":5.9877,"gen_tokens":99,"host_output_exact":19,"internal_free":14991,"logit_max_delta":0.00005341,"logit_top1_match":10,"min_case_tps":5.83,"prefill_tps":6.3967,"psram_free":2062492,"think_tps":4.65},"status":"keep","description":"Owner acceptance packet refreshed with the current candidates (host-side work while the pool is offline; no device time spent). The packet now leads with a two-line comparison - seed d91fd5f048ca 6.0617 (+14.29%, ext 5.9877, think 4.65, min 5.83, device 18/20 with token_delta 52, host 19/19 fidelity unchanged, cross-board confirmed on board 3) and shippable 787a58302f52 5.8283 (+9.90%, ext 5.7638, think 4.52, min 5.62, same gate structure) - and states the single decision the owner faces: keep the lossless RX ring and re-baseline or replace the two demo-timer goldens, or drop the ring and give up the lossless-input fix plus the 20-case suite. It carries the evidence assembled for that decision (deterministic and order-independent within an image, identical inputs, confident sampler margins, host/device disagreement on a case the device passes), the full list of levers each line is made of with their measured values, the closed families with the reason each closed, and the current blockers (capture owed and gated on a live console; the pool's three consoles silent in a host-side USB re-enumeration state).","timestamp":1790362287349,"segment":1,"confidence":14.151681000781872}
{"run":742,"commit":"eacb5be","metric":6.0617,"metrics":{"boot_bench_tps":6.152,"device_output_exact":18,"device_token_delta":52,"ext_decode_tps":5.9877,"gen_tokens":99,"host_output_exact":19,"internal_free":14991,"logit_max_delta":0.00005341,"logit_top1_match":10,"min_case_tps":5.83,"prefill_tps":6.3967,"psram_free":2062492,"think_tps":4.65},"status":"keep","description":"Dominant-path closure, derived from the source rather than from memory. The live 2-bit walker's hot body is the W8D macro, whose per-word accounting is exactly 8 lsi (LUT lookups) + 8 extui (index extraction) + 8 addx4 (address formation) + 8 add.s (accumulation) = 32 instructions, plus one 32-bit word load per word - 33 instructions for 16 weights, i.e. 2.06 per weight. Every one of them is irreducible on this ISA: the pair table is the largest granularity that still fits a cache line (the quad-table variant measured 38% slower), each lookup needs its own extract + scaled-index form + load because the ISA has no base+scaled-index load, 16 weights need 8 lookups because each table entry folds two codebook products, and 8 adds are the accumulation itself. The field cost is ~16.4 cycles per word, i.e. ~2 instructions per cycle, which is dual-issue saturation - so the phase that is 59% of the token (proj2bit, 80.8 ms) sits at the ISA floor with the measured IPC pinned against its instruction budget. This is why every load-form, scheduling, register and layout attempt in that phase has come back neutral or negative: there is no instruction to remove. The same argument covers the engram's GEMVs (same walker; I also verified in the same pass that nd_cq_gemv_lut2 already splits across both cores, so there is no idle-core lever hidden there either). Hardware: all three consoles silent on one bounded probe each, no loops, nothing reflashed; both packets stand unchanged.","timestamp":1790362853049,"segment":1,"confidence":14.196078431372555}
{"run":743,"commit":"7cf15aa","metric":5.8283,"metrics":{"boot_bench_tps":5.924,"device_output_exact":18,"device_token_delta":52,"ext_decode_tps":5.7638,"gen_tokens":99,"host_output_exact":19,"internal_free":14171,"logit_max_delta":0.00005341,"logit_top1_match":10,"min_case_tps":5.62,"prefill_tps":6.1283,"psram_free":2062492,"think_tps":4.52},"status":"keep","description":"Owed behavioural capture COMPLETE on the shippable candidate image, and the pool-offline story of the last several windows is RETRACTED. Capture: engine 787a58302f52 (the 5.8283 tree), already flashed, no reflash, API via the repo's own serial_api, `make capture` rc=0 with all nine flags true (routes_match, tools_match, requests_succeeded, no_external_calls, local_has_two_passes, external_stops_at_selection, telemetry_progressed, sampling_interval_applied, timer_expired) - the shippable packet now has device breadth, host gates AND the behavioural suite on the same tree. The retraction is the important half: one bounded `!status` transaction per board through serial_api answered on ALL THREE boards in 1.1 s / 56.5 s / 1.1 s, with uptimes of 3821 s / 55 s / 2074 s. My earlier \"all three consoles silent\" readings came from my own runners - the capture script waited for 'EVT READY' (one space) while the firmware emits 'EVT  READY' (two), printed only 0/1 so 'ready=0' was never a byte count, and the hand-written raw reads used a different open discipline than the proven handshake. The mentor's bug report is what exposed it; the host kernel shows no USB events since 18:21:53, so node mtimes never proved cycling either. Net: boards were healthy throughout, two packets stand (seed 6.0617, shippable 5.8283), and the shippable now exceeds the accepted 5.3033 pin by +9.90% with every piece of evidence the packet format asks for.","timestamp":1790363338150,"segment":1,"confidence":14.196078431372555}
{"run":744,"commit":"4599dac","metric":5.8233,"metrics":{"boot_bench_tps":5.919,"device_output_exact":6,"device_token_delta":0,"ext_decode_tps":0,"gen_tokens":99,"host_output_exact":0,"internal_free":14171,"logit_max_delta":0,"logit_top1_match":0,"min_case_tps":5.61,"prefill_tps":5.9517,"psram_free":2062492,"think_tps":0},"status":"discard","description":"Two results in one window. (1) LSX IS IMPLEMENTED on this silicon - #732's capability closure is RETRACTED. The first probe passed indices 0,1,2 to `lsx`, but LSX takes a BYTE offset (Espressif's own FIR kernels multiply by 4 first), so 1 and 2 were misaligned addresses. The corrected probe with byte offsets 0,4,8,60,64 on an aligned table prints `LSX2 mask=1f vals=11.000,22.000,33.000,55.000,66.000` - all five offsets load the right float, including one past a cache line - so the uint16 offset-stream mechanism (l16ui -> lsx -> add.s instead of extui -> addx4 -> lsi -> add.s) is CAPABLE here and its remaining question is cost, not existence. (2) The four-accumulator register-resident scale fold (nd_scrow4 on B1) is bit-exact and live - SCROW selftest 64/64 bad=0, scrow=1, 6/6 device exact - and it LOSES at -0.09% (5.8233 vs the 5.8283 base). Two self-inflicted bugs were caught by the selftest before any number was believed: `movi a7,1; wfr f0,a7` loads the float bits 0x00000001 (a denormal), not 1.0f, and the row pointer never rewound per tile so tile 2 started eight strides in; the first run's oracle therefore read bad=1024 and its speed was the fallback. With both fixed the oracle is clean and the kernel is still slightly negative: keeping four cells resident replaces independent whole-row passes (E72b's, which the parallel split can overlap) with one serial eight-madd chain per tile, so the removed loads do not pay for the exposed latency. Banked as a negative; B1's tree restored to the 5.8283 state.","timestamp":1790365487740,"segment":1,"confidence":14.196078431372555}
{"run":745,"commit":"fe26e2b","metric":6.055,"metrics":{"boot_bench_tps":6.152,"device_output_exact":6,"device_token_delta":0,"ext_decode_tps":0,"gen_tokens":99,"host_output_exact":0,"internal_free":14991,"logit_max_delta":0,"logit_top1_match":0,"min_case_tps":5.83,"prefill_tps":6.3967,"psram_free":2062492,"think_tps":0},"status":"keep","description":"CV3W cost measured on device, and it is a real lever: with an identical work loop (eight lookups plus eight adds per 32-bit weight word, four partials, two adds each - the shipped W8D structure) and only the addressing changed, the shipped form (extui + addx4 + lsi) costs 34 cycles per word and the proposed form (l16ui of a predecoded uint16 byte offset + lsx) costs 25, i.e. 27% cheaper on the addressing itself, with the LSX capability probe still green (mask=1f). Fixture integrity is asserted: 64 words of 8 distinct 4-bit indices, a 16-entry float LUT, and the predecoded offsets checked against the nibbles (fixture_bad=0), so a fast wrong mapping cannot masquerade as a win. Both loops fold their partials into a sink that is mixed into the returned cycle count. This turns the LSX reopen from a capability question into a measured cost win, and it makes the capacity question the gating one: the offset stream is 4x the packed indices (442,368 B for a 576x768 Q projection) while post-prime PSRAM is only 50,088 B - which is exactly what B3's engram relocation into the tier buffer's unused tail is for (~791 KB reclaimable). Two-step program, both halves measured or specified: free the tier tail (B3), then integrate the offset stream (B2, one projection at a time, exact mapping/row/group checks).","timestamp":1790366494918,"segment":1,"confidence":14.196078431372555}
{"run":746,"commit":"4599dac","metric":6.0617,"metrics":{"boot_bench_tps":6.152,"device_output_exact":6,"device_token_delta":0,"ext_decode_tps":5.9877,"gen_tokens":99,"host_output_exact":19,"internal_free":14991,"logit_max_delta":0.00005341,"logit_top1_match":10,"min_case_tps":5.83,"prefill_tps":6.3967,"psram_free":2062492,"think_tps":4.65},"status":"crash","description":"B3's engram-relocation draft attempt FAILED on its own editing, and the board tree was recovered rather than hand-patched. Sequence: the header-field insertion landed, the nd_tier_ptr dispatch landed, and then the block replacement that was meant to install the mentor's fixed relative slots cut into the function structure (its end-anchor matched a later occurrence of the same text), leaving a stray return and an unterminated function - twelve compile errors, nothing flashed, no board time spent. Recovery: B3's tree is byte-identical to B2's by construction (it was transplanted from it), so the engine and main.c were re-copied from B2 and the tree now builds and hashes 59fabc46c29b on both boards. The relocation recipe itself is sound and stays recorded in the queue with its exact coordinates (key +8,684,608, value +8,841,280, end +8,997,952 inside the 12,582,912-byte allocation, disjointness guard against the highest contained tier consumer, byte-compared copies, no shift or extension of the original mapping) - the lesson is the editing discipline this campaign has paid for twice already: anchor a block replacement on its own unique text, never on an end pattern that occurs elsewhere, and build before believing a patch landed.","timestamp":1790366867884,"segment":1,"confidence":14.196078431372555}
{"run":747,"commit":"4599dac","metric":6.055,"metrics":{"boot_bench_tps":6.152,"device_output_exact":6,"device_token_delta":0,"ext_decode_tps":0,"gen_tokens":99,"host_output_exact":0,"internal_free":14991,"logit_max_delta":0,"logit_top1_match":0,"min_case_tps":5.83,"prefill_tps":6.39,"psram_free":2062492,"think_tps":0},"status":"discard","description":"B3's engram relocation ran and was correctly REFUSED by its own disjointness guard - a guarded null that answers a capacity question with numbers. Print: `EGRELOC ok=0 need=8997952 span=12582912 staged_rel=12450880`. Reading: the value slot's end needs 8,997,952 bytes and the span is 12,582,912 (both match the plan exactly), but the highest byte any CONTAINED tensor stages is 12,450,880 relative to eg_region_lo - higher than the specified key slot 8,684,608 and higher than the \"last actual tier consumer\" figure the plan was built on. The guard compares against tensor CONTAINMENT, which is the safe criterion: a contained tensor's bytes are physically copied into the span, so overlapping them would corrupt whatever does read them. Two consequences, both measured: (1) the span's genuinely unused tail is 12,582,912 - 12,450,880 = 132,032 bytes, which is smaller than the 313,344-byte key/value pair, so this route cannot host the relocation as specified; (2) the CV3W offset stream's capacity must therefore come from the reserve - compact-prefix, which reclaims ~791 KB (the mentor's fallback) - not from the tier tail. Decode 6.0550 with the dispatch off is the base (the candidate did nothing). Nothing was flashed twice, no gate was weakened, and the code is kept in B3's tree behind its guard so a corrected slot derivation is a one-line change if a future window establishes the true consumer set.","timestamp":1790367729771,"segment":1,"confidence":14.196078431372555}
