{"run":377,"commit":"35da312","metric":5.0567,"metrics":{"boot_bench_tps":5.103,"device_output_exact":17,"device_token_delta":0,"ext_decode_tps":4.985,"gen_tokens":99,"host_output_exact":19,"internal_free":13879,"logit_max_delta":0.00005341,"logit_top1_match":10,"min_case_tps":4.83,"prefill_tps":5.3367,"psram_free":2052252,"think_tps":3.96},"status":"keep","description":"CORRECTION to run #376's causal claim, no engine change (accepted runtime stays 5.0567, metric carried forward): the 6,144 B heap cost I attributed to the transform's unroll-4 belongs to Experiment 39's -O3, which was still appended to boards 2 and 3's copies of esp32/components/needle/CMakeLists.txt. Those lanes therefore ran fw4+(-O3) and fw2+(-O3), so the two 'cross-board confirmations' of fw2 (5.0800, 5.0833) are withdrawn as confirmations, and fw4's heap cost is simply unmeasured. Clean facts: board 1's fw2 read 5.0800 with internal_free 13,879, identical to accepted, so the 74-byte unroll is free at the heap; nm -S shows nd_fwht at 0xae in both fw2 and fw4 images. Decision unchanged (fw2 is the candidate; a clean fw4 curve point is not worth a board) but the reason is fixed. Root cause: a lane appended to a build file and no lane removed it, and while sdkconfig drift has had a guard since #300, an edited CMakeLists had none, so the contamination was invisible to every check including the config check. Fixed: both workers restored and md5-verified, and .auto/board_config_check.sh now hashes the two CMakeLists plus bench.py against main for all three boards with BUILD_FILE_DRIFT output and an extended selftest. Standing rule: when two runs of different code agree on a number that is supposed to be incidental, suspect shared state before believing the agreement. Re-confirmation of clean fw2 plus a distinct silu4 screen are running now (batch 20260923T1430L).","timestamp":1790162609076,"segment":1,"confidence":21.79166666666665,"asi":{"what_was_wrong":"Run #376 recorded: 'fw4 costs 6,144 B of internal heap' and priced it mechanically as nd_fwht growing 100 B -> 284 B of IRAM text under #292's heap coupling. The measurement was real but the attribution was not. Boards 2 and 3 still carried the `-O3` line Experiment 39 had appended to their copies of esp32/components/needle/CMakeLists.txt (worker md5 5b207489a1e2 vs main 7085cb108638, EXPERIMENT-39 marker present), so what those lanes ran was fw4+(-O3) and fw2+(-O3), not the clean variants. nm -S on the fw2 and fw4 images shows nd_fwht at 0xae in both, and the 6,144 B reading appears on every lane that ran on boards 2 or 3 regardless of the candidate - it belongs to -O3, which is itself rejected.","corrected_facts":"fw4's heap cost is NOT measured (it has never been measured without -O3). fw2's clean reading is board 1's: decode 5.0800 with internal_free 13,879 - identical to the accepted image - so the 74-byte unroll is free at the heap. The two 'cross-board confirmations' in batch 20260923T1400L (5.0800, 5.0833) are withdrawn as confirmations of fw2: they are measurements of fw2+(-O3), and are interesting only as a second instance of the -O3 result (about the same speed, ~6 KiB of heap).","corrected_decision":"The unroll-factor choice does not change: fw2 is kept-if-confirmed and fw4 is not needed, but for the stated reason 'fw4 was measured only in combination with a rejected flag', not 'fw4 costs 6 KiB for zero gain'. A clean fw4 curve point is not worth a board, because #362 measured unroll-8 falling off a cliff and fw2 already delivers the whole gain that the two 4-way readings showed.","root_cause":"A lane applied a compile-time flag by appending to a build file and no lane removed it. sdkconfig drift has had a guard since run #300 precisely because sdkconfig is gitignored and survives `git reset --hard`; an edited CMakeLists is the same class - worker state that git cannot see - and had no guard, so the drift was invisible to every check in the pipeline including the config check, and the two lanes looked perfectly healthy (fresh builds, gates green, plausible numbers).","fix":"Both workers restored from the main checkout and verified by md5. .auto/board_config_check.sh now hashes esp32/components/needle/CMakeLists.txt, esp32/main/CMakeLists.txt and .auto/bench.py against main for all three boards and prints BUILD_FILE_DRIFT board=N file=F, with its equal/different selftest extended to prove the new comparison can distinguish a one-byte change. Rule for this repo: a lane that mutates a build file is responsible for restoring it, and if it cannot prove restoration then the pool's file hashes must be compared before the next lane trusts a number.","meta":"Fifth instance this campaign of a check that could not fail, and the second where the failure direction was 'plausible result from a contaminated input' rather than 'obvious error'. The tell that found it in one step was not a gate but an arithmetic oddity: two supposedly different candidates reporting the identical internal_free, which is exactly the kind of incidental value nobody thought to falsify. Recorded as a standing habit: when two runs of different code agree on a number that is supposed to be incidental, suspect the shared state before believing the agreement."}}
{"run":378,"commit":"c6a2618","metric":5.08,"metrics":{"boot_bench_tps":5.126,"device_output_exact":17,"device_token_delta":0,"ext_decode_tps":5.004,"gen_tokens":99,"host_output_exact":19,"internal_free":13879,"logit_max_delta":0.00005341,"logit_top1_match":10,"min_case_tps":4.85,"prefill_tps":5.3617,"psram_free":2052252,"think_tps":3.97},"status":"keep","description":"Experiment 40 integration - FWHT butterfly loop unrolled by 2: MEASURED AND KEPT, +0.461 % decode (5.0567 -> 5.0800, now +108.2 % over the 2.44 baseline), the largest single win since the phi asm (#333). Read 5.0800 on THREE independent fresh builds on THREE boards (board 1 in batch 20260923T1330L, boards 2 and 3 in 20260923T1430L after the -O3 contamination was found and removed) with per-variant board spread exactly zero and internal_free 13,879 - byte-identical to the accepted image, so nd_fwht's 100 -> 174 bytes is free. Bit-exact by construction (butterflies in one stage are disjoint pairs), host-proven 19/19 byte-exact before the flash and re-proven on the applied tree, fidelity 5.341e-05 identical, DEVICE_GATE_OK 17/17 with golden_missing=0 and token_delta 0 on two full rc=0 suites, top1 10/10, make test green. Monitors all up: extended 5.004/5.005, prefill 5.3617, think 3.97, boot bench 5.126/5.127 (+0.45 %, the mechanism check), min_case 4.85 (best worst case in 377 runs). Delivered 1.6x its isolated pricing (+0.28 %), second over-delivery in this phase after #362, because prepare runs ~16 times per token. This is the retry that run #374's refutation of run #364's warmth diagnosis licensed: #360 measured this exact form at +17.95 % and it was killed by an explanation that turned out not to hold. Concurrent null logged separately: silu4 (SiLU 4-wide) +0.03 %, so the lever is not general - the transform is special because its butterflies are a long dependent chain with nothing else in flight.","timestamp":1790163414665,"segment":1,"confidence":21.985833333333314,"asi":{"candidate":"fw2 - the FWHT butterfly inner loop unrolled by 2 in nd_fwht (engine/src/nd_quant.c md5 c416d6559a8f), generated from the shipped loop text by .auto/exp40/make_variants.py so there is no hand-typed transcription to get wrong (the #363 failure class). Bit-exact by construction: within one stage the butterflies are disjoint index pairs and every element is read and written once per stage, so processing two butterflies per iteration moves no value, no operand and no order. Bit-exactness was proven on the host before any flash (19/19 byte-exact, golden_missing=0, token_delta 0, fidelity 5.341e-05 identical) and re-proven on the main tree after applying.","hypothesis":"Run #360's isolated screen measured this exact plain-C form at +17.95 % bit-exact and it was never integrated because run #364 concluded that the whole transform family was worthless on device - a conclusion run #374 (Experiment 38) then showed was explained by a refuted mechanism (a 160 KiB eviction changes an internal-SRAM operand by 0.0 %, so cache warmth cannot explain anything about the field case). Changed assumption, so a legitimate retry rather than a revival.","result":"decode 5.0800 tok/s = +0.461 % over the accepted 5.0567, now +108.2 % over the 2.44 baseline. Read identically on THREE independent fresh builds on THREE different boards: board 1 (batch 20260923T1330L) 5.0800, board 2 and board 3 (batch 20260923T1430L, after the -O3 contamination of the first confirmations was found and removed) both 5.0800. Per-variant board spread exactly zero. Monitors every one up: extended 5.004/5.005 (+0.38 %), prefill 5.3617 (+0.47 %), think 3.97 (+0.25 %), boot bench 5.126/5.127 (+0.45 %, the mechanism check - the transform is inside the bench), min_case 4.85 (best worst case in 377 runs), gen_tokens 99.","cost":"internal_free 13,879 - byte-identical to the accepted image, i.e. free at the heap: nd_fwht grows 100 -> 174 bytes, which is absorbed by allocator granularity, and unlike the unroll-4 experiment there is no placement penalty. Cost was priced with nm -S rather than inferred, per run #377's correction.","quality":"Two full rc=0 device suites with DEVICE_GATE_OK 17/17 and golden_missing=0 (boards 2 and 3), token_delta 0, device text byte-identical to the frozen goldens, fidelity 5.341e-05 against the 2e-3 gate, top1 10/10, host 19/19 byte-exact with golden_missing=0 on the applied tree, make test green.","realisation":"The isolated screen priced +17.95 % of a transform that is ~80 % of prep+lut (3.5 ms of a 158 ms bench token), i.e. ~0.28 %; delivered +0.461 %, so about 1.6x its pricing - the second time after run #362's rescale (+0.26 % priced, +0.332 % delivered) that this phase has over-delivered, because nd_cq_prepare is called ~16 times per token and each call also saves loop-entry/exit work the isolated single-transform bench undercounts.","concurrent_null":"Measured in the same batch on board 1 and logged separately: silu4 (SiLU 4 elements per iteration) read 5.0583 = +0.03 % with internal_free 13,623 (-256 B) - a null. So the pairing/unroll lever is NOT general across elementwise loops even within this campaign's own favourite shape; the transform is special because it is a long dependent chain of add/sub with nothing else in flight, which is the same narrow condition run #362's note already recorded.","next":"Three candidates generated on top of the new accepted image: fwinline re-measured clean at -O2 (its earlier verdict was fwinline+(-O3) and equalled run #373's o3bundle reading exactly), an outer-loop interleave of two independent FWHT groups (the shape that hides butterfly latency where within-stage unroll only cut instruction count), and agate_rows 4-wide to complete the pairing curve at the second shipped pairing site. make capture is owed on this image (shipping code changed)."}}
{"run":379,"commit":"c1e626e","metric":5.105,"metrics":{"boot_bench_tps":5.151,"device_output_exact":17,"device_token_delta":0,"ext_decode_tps":5.031,"gen_tokens":99,"host_output_exact":19,"internal_free":13623,"logit_max_delta":0.00005341,"logit_top1_match":10,"min_case_tps":4.87,"prefill_tps":5.39,"psram_free":2052252,"think_tps":3.99},"status":"keep","description":"Experiment 41 integration - two FWHT groups transformed together (cross-group ILP): MEASURED AND KEPT, +0.492 % decode (5.0800 -> 5.1050, now +109.0 % over the 2.44 baseline), the second-largest win of the last 20 runs. Three readings on two boards (discovery 5.1050 board 3, confirm 5.1000 board 2, confirm 5.1050 board 3; mean +0.459 %), all far above the 0.2 % bar and the 0.071 % board spread. Bit-exact by construction (each group's stages complete in its own order), remainder path guarded by .auto/exp41/test_odd_split.c under the 3+3 split the host cannot produce. Monitors all up: extended 5.031, prefill 5.39, think 3.99, boot bench 5.151 (+0.47 %, the mechanism check), min_case 4.87 (best worst case in 382 runs). Cost internal_free 13,623 (-256 B). Quality: DEVICE_GATE_OK 17/17 x3, golden_missing=0, token_delta=0, fidelity 5.341e-05 identical, top1 10/10, host 19/19 on the applied tree, checks rc=0. Disclosed: the three readings came from two byte-different files (hand-written helper vs clean regeneration) that are identical after comment/whitespace stripping, and both were measured. Geometry finding worth more than the win: with ngroup=6 split 3+3 each core owns exactly 3 groups, so a 4-group walk would never have run on device and would have silently re-measured the accepted path - hence fw3pair is the curve point and fw4pair was never built.","timestamp":1790165906067,"segment":1,"confidence":22.19416666666665,"asi":{"candidate":"fw2pair - two FWHT groups transformed in one stage walk (nd_fwht2), on top of the shipped within-stage 2-way butterfly unroll. Bit-exact by construction: each group's stages still complete in its own order (stage k of a group before stage k+1 of the same group), so every cell ends with the value nd_fwht would have written. Rescale shared verbatim through fw_scale so neither path's rescale text differs from what ships. A single-group remainder path is kept because the device hands each core an ODD group count; .auto/exp41/test_odd_split.c proves it under the 3+3, 1+5, 5+1, 2+4 and one-group splits that the host's rows_serial never produces.","hypothesis":"fw2 (#378) put more independent work inside one iteration of a single group's butterfly chain. The remaining independent work of the same kind is the NEXT GROUP's chain: fwht_rows calls nd_fwht once per group with nothing else in flight, and the transform is ~80 % of prep+lut, so two chains in flight should pay again.","result":"decode 5.1050 = +0.492 % over the accepted 5.0800, now +109.0 % over the 2.44 baseline. Three readings on two boards: discovery 5.1050 (board 3), confirmation 5.1000 (board 2), second confirmation 5.1050 (board 3); mean 5.1033 = +0.459 %, every reading far above both the 0.2 % bar and the 0.071 % board spread. Monitors all up together: extended 5.031/5.030 (+0.54 %), prefill 5.39/5.3883 (+0.53 %), think 3.99/3.98, boot bench 5.151/5.15 (+0.47 %, the mechanism check - prepare is inside the bench), min_case 4.87 (best worst case in 382 runs), gen_tokens 99.","cost":"internal_free 13,623 against 13,879 = -256 B, and nd_fwht2's text is IRAM code (the #292 heap coupling). Accepted on measurement, not on assumption.","quality":"DEVICE_GATE_OK 17/17 with golden_missing=0 and token_delta=0 on all three device runs, fidelity 5.341e-05 identical to control, top1 10/10, host 19/19 byte-exact with golden_missing=0 re-verified on the applied tree (checks.sh rc=0).","byte_form_disclosure":"The three readings come from two byte-different source files: the hand-written helper (image engine_md5 2a41969e43f1, discovery and board-2 confirmation) and the clean regenerated form now in the tree (bdcf0c7c8b0c, board-3 confirmation). They are identical after stripping comments and whitespace - verified programmatically, printed as code_identical_after_comment_and_whitespace_strip=True - and both were measured, so no reading is attributed to unmeasured code. Recorded because the campaign's own #363 class is exactly a divergence between the measured text and the shipped text.","geometry_finding":"The guard must be `gi + (ng-1) < g1`, not `gi + ng < g1`, and ng must fit the per-core group count: ngroup=6 split 3+3 means each nd_parallel_rows call owns exactly THREE groups, so a 4-group walk would never execute on device and would silently re-measure the accepted path (run #333's garbage-collected-kernel null in a new guise). That is why the curve point queued next is fw3pair (exactly one triple per core, no tail) and why fw4pair was never built.","concurrent_results":"Logged separately: cond2 (+? measured -0.394 %) and cond4 (-0.427 %), the same interleave mechanism applied to the Hadamard MLP's conditioning reductions, both rejected. So the mechanism is not general even within the campaign's own favourite shape: interleaving paid where the loop is pure arithmetic on a resident block, and cost where the loop is load-bound (stride-8 cond_v) and only gained register pressure.","next":"fw3pair (three groups per walk = the exact per-core count) and fw2single (paired groups WITHOUT the within-stage unroll, the attribution run that says whether the two wins are one mechanism or two) are on boards 1 and 2 now. make capture is owed on this image."}}
{"run":380,"commit":"HEAD","metric":5.06,"metrics":{"boot_bench_tps":5.151,"device_output_exact":17,"device_token_delta":0,"ext_decode_tps":5.031,"gen_tokens":99,"host_output_exact":19,"internal_free":13623,"logit_max_delta":0.00005341,"logit_top1_match":10,"min_case_tps":4.83,"prefill_tps":5.3417,"psram_free":2052252,"think_tps":3.99},"status":"discard","description":"Experiment 41 lane - cond2, the Hadamard MLP's conditioning projection with two channels' 768-term reductions interleaved: MEASURED, -0.394 %, REJECTED (decode 5.0600 vs accepted 5.0800, batch 20260923T1530L, board 1). Bit-exact by construction (per-channel accumulators keep their own order) and gate-clean, so a pure speed verdict. prefill 5.3417, min_case 4.83, gen_tokens 99; extended/think/boot-bench/internal_free not measured on this image (the lane hit the known console-fatigue defect after the primary group) and carried from the accepted run, which the verdict does not depend on. The largest dependent-chain mass in the model (~49k serial FMAs per token) does not respond to the lever that just paid +0.49 % on the transform, because it is bound by its strided cond_v loads and interleaving only added register pressure - the same lesson #366/#367/#370 recorded for unrolls, now measured on a reduction. Also documents the generator bug the host gate caught (literal vs relative channel index) and the equivalence guard it produced.","timestamp":1790165944652,"segment":1,"confidence":22.19416666666665,"asi":{"candidate":"cond2 - the Hadamard MLP's conditioning projection (cond_rows, engine/src/nd_model.c) with two channels' 768-term reductions in flight at once. Each channel keeps its own accumulator from 0.0f to its own store, so its additions happen in exactly the shipped order: bit-exact by construction, unlike unrolling one channel's loop (reassociation, which #366/#367 correctly refused). 8 channels x dm-term serial sums per layer is the largest dependent-chain mass in the token - ~49k dependent FMAs, inside the 24 ms hadamard phase - and cond_v's stride-8 layout means interleaved channels also share each loaded line.","hypothesis":"fw2 (#378) won by putting independent work inside a serial dependency chain, so the model's biggest serial reduction should pay too; cond_rows is 8 independent 768-long chains that nothing currently overlaps.","result":"decode 5.0600 = -0.394 % against the accepted 5.0800. prefill 5.3417, min_case 4.83, gen_tokens 99. Bit-exact and gate-clean by construction (host 19/19 before the flash, DEVICE_GATE_OK on the device run), so it is a pure speed verdict and it is slower.","not_measured_on_this_image":"The lane hit the known console-fatigue defect (#345/#346) after the primary group, so extended, think, boot bench and internal_free are NOT readings from this image and are carried from the accepted run rather than measured. The verdict does not depend on them: the primary metric is down 0.394 %, six times the board spread.","verdict":"REJECTED; the repo tree never contained it (engine/src/nd_model.c verified back at the accepted md5).","conclusion":"The interleave mechanism is not general even inside the campaign's own favourite shape. The difference between this and the transform win is what the loop is bound by: nd_fwht's butterflies are pure arithmetic on a block that stays in registers and cache, so extra chains convert directly into throughput, while cond_rows is bound by its strided cond_v loads and interleaving only added live registers and pressure. This is the same lesson #366/#367/#370 recorded from the other side (unrolling a load-bound elementwise loop is null), now measured on a reduction: the lever is 'chains with nothing in flight AND operands already close', not 'chains'.","bug_found_first":"The first cond2 diverged on the host (exact=0/19, token_delta 2020) because my generator emitted a LITERAL channel offset - cv[i*8+0u] inside a loop over ch - so channels 2..7 computed channels 0 and 1's sums. .auto/exp41/test_cond_equiv.c (shipped form vs generated form, 200 random 768x8 cases, bit-for-bit) localised it in one run with no board. Rule: 'bit-exact by construction' describes the algebra I intended, not the code I emitted; verify it in the emitted text."}}
