{"run":622,"commit":"7e5b0c2","metric":5.615,"metrics":{"boot_bench_tps":5.662,"device_output_exact":6,"device_token_delta":0,"ext_decode_tps":5.5554,"gen_tokens":99,"host_output_exact":19,"internal_free":4831,"logit_max_delta":0.00005341,"logit_top1_match":10,"min_case_tps":5.35,"prefill_tps":5.9333,"psram_free":2052252,"think_tps":4.41},"status":"discard","description":"Composed v2 (B4W pairing + A3 rescale fusion via hoisted four-way flag dispatch, macro body, host 19/19 byte-exact before flash) reads 5.615 on board 1 = +0.059% vs its pin - i.e. ~1.4% BELOW B4W's confirmed +1.516% on two boards and even below plain two-wide B. Fixing v1's in-loop branching did NOT rescue the fusion: folding the rescale multiply into the paired four-wide body is harmful regardless of form (per-cell branches in v1, four dispatch copies/code bloat in v2). Composition of A3 x pairing is CLOSED as a direction - the two wins are mutually exclusive layouts, not complementary. B4W alone is the session's candidate.","timestamp":1790290410722,"segment":1,"confidence":11.168038408779154,"asi":{"hypothesis":"Composed v2: keep B4W's four-wide pairing and add A3's rescale-fusion, with the flag test hoisted into a 4-way macro dispatch so no in-loop branches (the measured poison of v1).","board":"1 (pin 5.6117); B4W read +1.52% on b2/b3 with byte-identical source","verdict":"rescale-fusion x head-pairing interaction is real and negative in BOTH forms (per-cell branches v1, 4x code bloat v2). A3's win needs single-head layout; B4W's win needs the simple sweep+update. Axis closed: do not try a third fusion form.","next":"b1 now gets B4W itself for a second full gate (fresh signature); b3 prechecks B8W (8-cell paired body)","rollback_reason":"hoisting fixed the branches but not the composition - fusion is the problem, not its scheduling","code_size_note":"4 dispatch copies of the four-wide body inflate attn_heads; heap cost consistent"}}
{"run":623,"commit":"7e5b0c2","metric":5.6967,"metrics":{"boot_bench_tps":5.768,"device_output_exact":18,"device_token_delta":52,"ext_decode_tps":5.6146,"gen_tokens":99,"host_output_exact":19,"internal_free":5343,"logit_max_delta":0.00005341,"logit_top1_match":10,"min_case_tps":5.45,"prefill_tps":6.0167,"psram_free":2052252,"think_tps":4.44},"status":"keep","description":"B4W full 20-case quality-breadth gate on board 2 (one documented repeat allowance): decode 5.6967 reproduced exactly, EXTENDED 5.6146 (best ever measured, +1.75% vs seed's 5.5177, above B's 5.5554 and A3's 5.5538), THINK 4.44 (best, +1.14%), min_case 5.45, boot 5.768, heap 5343 stable, missing 0. Device 18/20 rc=1: the SAME two frozen heldout cases with the SAME token_delta=52 as every gate since #589 - reported, not waived, oracle untouched. B4W now holds two-board screens (+1.516% both pins) and a full gate whose quality profile is the seed's exactly minus the known pair. b1 is running the second full gate; B8W screens on b3.","timestamp":1790290527714,"segment":1,"confidence":11.168038408779154,"asi":{"breadth":"ext 5.6146 = best extended ever measured on any tree (+1.75 pct vs seed 5.5177, beats B 5.5554 and A3 5.5538); think 4.44 best too (+1.14 pct)","failure_set":"heldout_interval_one + heldout_long_tools_note_only, token_delta 52 - the identical frozen fingerprint of seed #589/A3/B gates; B4W adds no new failure","hypothesis":"B4W full 20-case breadth gate on board 2 (documented allowance; screen had burned the signature)","next":"b1 gate finishing (2nd board breadth); b3 B8W screen deciding whether width axis continues; if both land, B4W is the acceptance proposal for the owner","why_kept":"full-breadth profile of the session-best candidate: primary +1.52 pct, ext +1.75 pct, think +1.14 pct, quality identical to seed"}}
{"run":624,"commit":"7e5b0c2","metric":5.6967,"metrics":{"boot_bench_tps":5.76,"device_output_exact":6,"device_token_delta":0,"ext_decode_tps":5.6146,"gen_tokens":99,"host_output_exact":19,"internal_free":5087,"logit_max_delta":0.00005341,"logit_top1_match":10,"min_case_tps":5.45,"prefill_tps":6.0083,"psram_free":2052252,"think_tps":4.44},"status":"discard","description":"B8W (paired P.V body at eight cells per iteration, host 19/19 byte-exact, device 6/6 delta 0 rc=0) reads 5.6967 on board 3 vs the SAME board's B4W 5.6983 = -0.03 % (within one quantum, so no gain) at 256 B more heap (5087 vs 5343). Doubling the pairing body width from four to eight buys nothing: the four-wide pairing already saturates the instruction-scheduling benefit; V reuse per cell is unchanged by width (as expected). Width axis CLOSED at four - B4W stands as the form. B4W's b1 gate meanwhile reproduced primary 5.6967 exactly.","timestamp":1790290679927,"segment":1,"confidence":11.168038408779154,"asi":{"hypothesis":"B8W: eight-cell paired body (v_hd 64 = 8x8 exact). Tests whether the 2->4 width gain (+0.98 pct) continues.","board":"3, pin 5.6133, engine baeda26700d6, host 19/19 byte-exact","verdict":"width axis SATURATES at four: +8 cells buys nothing over four (delta is noise-level) and costs 256 B heap. B4W is the form; do not test 16-wide.","next":"b3 -> DOT8W (eight-column QK dot body, the remaining un-widened hot loop); b2 -> FINPAIR screen after host precheck (engine 622ca49c5edd); b1 gate finishing ext/think.","caveat":"screens are single readings but the B4W-on-b3 reference (5.6983) is same-board same-silicon, so the comparison is tight"}}
{"run":625,"commit":"7e5b0c2","metric":5.6967,"metrics":{"boot_bench_tps":5.768,"device_output_exact":18,"device_token_delta":52,"ext_decode_tps":5.6138,"gen_tokens":99,"host_output_exact":19,"internal_free":5343,"logit_max_delta":0.00005341,"logit_top1_match":10,"min_case_tps":5.45,"prefill_tps":6.0183,"psram_free":2052252,"think_tps":4.44},"status":"keep","description":"B4W full gate on board 1 (second board, fresh signature, no allowance spent): decode 5.6967 - the same value as b2's screen and b2's gate on a third board; EXTENDED 5.6138 (b2: 5.6146), THINK 4.44 (identical), min_case 5.45, boot 5.768, heap 5343, device 18/20 with the SAME two frozen heldout failures and identical token_delta 52. B4W's entire quality-and-speed profile is now reproduced digit-for-digit on two independent boards at two different pins: primary +1.52 %, ext +1.75 %, think +1.1 %, zero new failures. This is the session's acceptance proposal pending the owner's call on the seed's unresolved 18/20 pair.","timestamp":1790290799309,"segment":1,"confidence":11.168038408779154,"asi":{"breadth":"ext 5.6138 (b2: 5.6146, delta 1 quantum), think 4.44 identical, min_case 5.45 identical - the full B4W profile is board-independent","failure_set":"same two frozen heldout cases and token_delta 52 on b1 as on b2/seed/A3/B - B4W inherits, never adds","hypothesis":"B4W second full 20-case gate on board 1 (fresh signature) for two-board breadth confirmation ahead of an acceptance proposal","next":"DOT8W screens on b3, FINPAIR screens on b2; if both sub-bar, B4W is final acceptance proposal (pending owner's decision on the seed's frozen 18/20)","why_kept":"digit-level cross-board reproduction of the acceptance candidate's whole profile (4th identical 5.6967-class primary reading)"}}
{"run":626,"commit":"7e5b0c2","metric":5.6967,"metrics":{"boot_bench_tps":5.768,"device_output_exact":6,"device_token_delta":0,"ext_decode_tps":5.6138,"gen_tokens":99,"host_output_exact":19,"internal_free":5087,"logit_max_delta":0.00005341,"logit_top1_match":10,"min_case_tps":5.45,"prefill_tps":6.0167,"psram_free":2052252,"think_tps":4.44},"status":"discard","description":"FINPAIR (B4W plus paired-head final 1/denom normalization; per-cell rounding unchanged, host 19/19 byte-exact) reads 5.6967 on board 2 - byte-identical to B4W's two prior readings on that board (5.6967 screen, 5.6967 gate): zero primary-speed effect, once again -256 B heap (5087 vs 5343) and 6/6 device rc=0. The final per-head scaling sweep is cold; pairing it buys nothing. DISCARDED. B4W remains the form: width saturates at 4, pairing helps the hot P.V loop only, tail sweeps are unmeasurable.","timestamp":1790290906794,"segment":1,"confidence":11.168038408779154,"asi":{"hypothesis":"FINPAIR on B4W: pair heads in the final 1/denom scaling sweep - last unpaired pass over the oh[] lines.","board":"2 on B4W base; comparison = B4W's b2 readings (5.6967 screen and gate)","verdict":"the final normalize is 24 cache-warm lines/head once per token - too cold for any pairing effect. Axis closed; keep B4W's simpler code.","next":"DOT8W reading now on b3; if also flat, attention-stage micro-axes are exhausted: width=4 saturates, fusion dies, tail sweeps dead. B4W is the deliverable; next distinct ideas live outside attn_heads.","caveat":"byte-identical primary is itself information: the measurement pipeline is quantum-stable, not that nothing changed - heap moved, proving the code differed"}}
{"run":627,"commit":"f36f2c9","metric":5.7283,"metrics":{"boot_bench_tps":5.803,"device_output_exact":6,"device_token_delta":0,"ext_decode_tps":5.6138,"gen_tokens":99,"host_output_exact":19,"internal_free":5343,"logit_max_delta":0.00005341,"logit_top1_match":10,"min_case_tps":5.49,"prefill_tps":6.05,"psram_free":2052252,"think_tps":4.44},"status":"keep","description":"DOT8W (eight-column QK dot body inside the paired-head loop, ascending per-accumulator chain preserved, host 19/19 byte-exact) reads 5.7283 on board 3 vs the SAME board's B4W 5.6983 = +0.526 % on top of B4W's +1.516 %, i.e. +2.048 % over the board's seed pin - the best measured device reading of the campaign. 6/6, token delta 0, rc=0, every primary case up, min_case 5.45 -> 5.49, prefill 6.05. The width lever that saturated on the P.V side still has room on the QK dot side, and mentor's objdump explains why further work there is real: B4W's dot loop spills f13 to a1+0x460 every iteration; the eight-column body starts to relieve it. Cross-board full gate queued on b2; a live-range-shortening two-column tile goes to b3.","timestamp":1790291113340,"segment":1,"confidence":11.270919067215369,"asi":{"hypothesis":"DOT8W on B4W: eight-column QK dot body (6x8=48 exact), per-accumulator chain order preserved; the width lever applied to the OTHER hot loop inside the pair body.","board":"3 on B4W base (engine 5065619b0867); same-board reference B4W 5.6983 (screen) / 5.6967-class gates","margin":"+0.526 pct over B4W same-board; total vs board pin now +2.05 pct; every case up incl min_case 5.49 (best worst-case ever)","mechanism":"mentor found a real QK-loop spill in B4W's ELF (f13 via a1+0x460 per iteration) - the 8-wide body shortens operand live ranges enough to start winning despite 16-FP-register pressure","next":"b2 full gate of DOT8W (cross-board, fresh signature); b3 writes a two-column QK tile with short live ranges to chase the residual spill; b1 runs the B4W transplant on accepted bundle5 2c79104 (engine 0bd9021c6136, fresh signature)","source":"md5 aa092bd0f16c at /root/board-pool/preserved/b1-recipeB/nd_model.c.dot8w2 (engine 5065619b0867 = b3 tree state)"}}
{"run":628,"commit":"b41e9d0","metric":5.6983,"metrics":{"boot_bench_tps":5.744,"device_output_exact":6,"device_token_delta":0,"ext_decode_tps":5.6146,"gen_tokens":99,"host_output_exact":19,"internal_free":5343,"logit_max_delta":0.00005341,"logit_top1_match":10,"min_case_tps":5.45,"prefill_tps":6.0167,"psram_free":2052252,"think_tps":4.44},"status":"discard","description":"QKTILE2 (two-column QK operand tile on B4W; host 19/19 byte-exact; mentor's artifact check: ZERO inner-loop spills, 8 shared loads, four mul/madd/add chains preserved) reads 5.6983 on board 3 - byte-identical to B4W's same-board screen. The per-iteration f13 spill it removed costs nothing in practice; speed for this loop tracks DOT8W's hardware-loop form instead. DISCARDED: QK tile width/operand ordering at 2 or 4 columns is null, spills are free. Same-board reference ladder remains B4W 5.6983 / DOT8W 5.7283.","timestamp":1790291430974,"segment":1,"confidence":11.270919067215369,"asi":{"hypothesis":"QKTILE2 on B4W: two-column QK tile with eight immediately-consumed operands to eliminate mentor's f13/a1+0x460 per-iteration spill while keeping each sum's two-product grouping and ascending order.","board":"3 on B4W base (ref B4W 5.6983, DOT8W 5.7283 same board)","verdict":"spill is real but FREE on this core - removing it changes nothing. DOT8W's +0.526 pct therefore comes from loop-form/hardware-loop effects, not spill removal (mentor's caution confirmed by my null). QK width axis stays closed; do not attribute #627 to spills.","next":"selective A-only/B-only rescale sweeps on B4W screening next on b3 (engine f708f8e782f7); B1 bundle5 transplant and B2 DOT8W gates still running","artifact_note":"fresh ELF verified zero inner-loop spills with B4W-identical arithmetic chains; bnez remains (no hardware loop)"}}
{"run":629,"commit":"91e39c6","metric":5.7283,"metrics":{"boot_bench_tps":5.809,"device_output_exact":18,"device_token_delta":52,"ext_decode_tps":5.6508,"gen_tokens":99,"host_output_exact":19,"internal_free":4823,"logit_max_delta":0.00005341,"logit_top1_match":10,"min_case_tps":5.49,"prefill_tps":6.05,"psram_free":2052252,"think_tps":4.46},"status":"keep","description":"DOT8W full 20-case gate on board 2 (fresh signature): decode 5.7283 - byte-identical to both prior screens on two boards; EXTENDED 5.6508 (best ever: +0.62% over B4W's own 5.6146, +2.41% over seed), THINK 4.46, min_case 5.49, boot 5.809, heap 4823. Device 18/20 rc=1: same two frozen heldout cases, token_delta 52 - inherits, never adds. DOT8W is now two-board confirmed (+0.526/+0.555% on B4W on the respective boards, +2.05-2.08% over seed pins) with full breadth: the campaign's best device candidate.","timestamp":1790291553694,"segment":1,"confidence":11.270919067215369,"asi":{"breadth":"ext 5.6508 new record (B4W 5.6146, seed 5.5177 = +2.41 pct); think 4.46 also best; boot 5.809","failure_set":"same two frozen heldout cases + token_delta 52 on b2 - DOT8W inherits the seed's failure fingerprint, adds none","hypothesis":"DOT8W cross-board full gate on board 2 (fresh signature): confirm B3's +0.526 pct-on-B4W winner incl. its own ext/think/20-case breadth","margin":"+0.555 pct over B4W on b2 (5.7283 vs 5.6967), +2.077 pct vs the board's seed pin; margins on the two boards agree (+0.526/+0.555)","next":"b1 bundle5+B4W gate finishing; selres screening on b3; then odd-head-fallback outlining (heap recovery) on the B4W-or-selres winner; DOT8W-on-bundle5 transplant only after B4W's attribution result is understood (mentor)","why_kept":"cross-board full-breadth confirmation of the current best device candidate"}}
{"run":630,"commit":"5e6603d","metric":5.73,"metrics":{"boot_bench_tps":5.776,"device_output_exact":6,"device_token_delta":0,"ext_decode_tps":5.6146,"gen_tokens":99,"host_output_exact":19,"internal_free":5343,"logit_max_delta":0.00005341,"logit_top1_match":10,"min_case_tps":5.49,"prefill_tps":6.0433,"psram_free":2052252,"think_tps":4.44},"status":"keep","description":"SELRES (selective A-only/B-only rescale sweeps on B4W, dispatch outside the dimension loop, per-cell rounding identical, host 19/19 byte-exact) reads 5.7300 on board 3 = +0.556 % over the same board's B4W 5.6983, device 6/6, token delta 0, rc=0, heap 5343. Mixed rescale masks are common enough that removing the 1.0f no-op multiply-store pays a real half-percent. Third independent B4W-family winner (QK width +0.53%, rescale selectivity +0.56%, pairing +1.52%). Composition (DOT8W + SELRES, different loops) now screens on b3; cross-board gate queued behind b2's outline lane.","timestamp":1790291736358,"segment":1,"confidence":11.276748971193422,"asi":{"hypothesis":"SELRES on B4W: hoist the rescale flag dispatch OUTSIDE the dimension loop - both-rescale keeps the paired sweep, A-only/B-only get single-array sweeps, neither skips; mixed masks no longer multiply the untouched head by 1.0f. Four-wide P.V update untouched (mentor spec).","board":"3 on B4W base (ref B4W 5.6983, DOT8W 5.7283 same board)","margin":"+0.556 pct on B4W same-board; mixed-mask frequency was high enough to matter (#292's zero-exp frequency really doesn't predict this)","heap":"5343 unchanged - the change is smaller code in the sweep, not more","next":"b3 screens ONE composition DOT8W+SELRES (different loops, both measured positive); b2 finishes outline then SELRES cross-board gate; b1 bundle5 transplant lane still live","composition_note":"DOT8W lives in the QK dot loop, SELRES in the rescale sweep - separate loops, composition test is justified per measure-then-compose rule"}}
{"run":631,"commit":"5ff68fc","metric":5.7467,"metrics":{"boot_bench_tps":5.82,"device_output_exact":6,"device_token_delta":0,"ext_decode_tps":5.6508,"gen_tokens":99,"host_output_exact":19,"internal_free":4823,"logit_max_delta":0.00005341,"logit_top1_match":10,"min_case_tps":5.51,"prefill_tps":6.06,"psram_free":2052252,"think_tps":4.46},"status":"keep","description":"DOT8W+SELRES composition (QK 8-column body + selective rescale sweeps, both on B4W; host 19/19 byte-exact, 6/6 device, token delta 0, rc=0, heap 4823) reads 5.7467 on board 3 - ABOVE both separate winners (DOT8W 5.7283, SELRES 5.7300) and +0.856% over B4W on that board, i.e. +2.37% over the board's seed pin: the best device reading of the campaign. Sub-additive (+0.86 vs +1.09 promised additively) but genuinely constructive, unlike the A3-fusion compositions. Preserved as the leading discovery form; its own full-breadth gate is the next justified step.","timestamp":1790292119325,"segment":1,"confidence":11.334019204389579,"asi":{"composition":"measured +0.856 pct on B4W vs ~+1.09 pct additive promise - sub-additive but net positive and beats BOTH parts; the only composition that has ever worked (A3 fusion x pairing remains dead)","hypothesis":"DOT8W (8-column QK dot body) + SELRES (selective rescale sweeps) composed on B4W - different loops, each independently positive on the same board","board":"3, own B4W 5.6983 / DOT8W 5.7283 / SELRES 5.7300 ladder; engine 10c74c756ee5","next":"per mentor: preserve source, schedule its own breadth (full gate) on a later turnover - b2 after its SELRES gate; meanwhile counted-loop QKTILE2 artifact check on b3 before spending a board","source":"/root/board-pool/preserved/b1-recipeB/nd_model.c.cmp-d8sr md5 from b3 tree"}}
{"run":632,"commit":"76de498","metric":5.73,"metrics":{"boot_bench_tps":5.801,"device_output_exact":18,"device_token_delta":52,"ext_decode_tps":5.6485,"gen_tokens":99,"host_output_exact":19,"internal_free":5343,"logit_max_delta":0.00005341,"logit_top1_match":10,"min_case_tps":5.49,"prefill_tps":6.0433,"psram_free":2052252,"think_tps":4.46},"status":"keep","description":"SELRES full 20-case gate on board 2 (cross-board, fresh signature): decode 5.7300 - byte-identical to board 3's screen AND screen-reading on b2, confirming the +0.55x% on B4W on both boards; EXTENDED 5.6485 (vs B4W's 5.6146, +0.60%), THINK 4.46, min_case 5.49, boot 5.801, heap 5343. Device 18/20 rc=1 with the same two frozen heldout failures and token_delta 52. Second fully-gated member of the B4W family; composition gate now running on b2.","timestamp":1790292269579,"segment":1,"confidence":11.334019204389579,"asi":{"breadth":"ext 5.6485 (b3-side ext not measured for SELRES; above B4W 5.6146 and DOT8W 5.6508 is 5.6508 vs this 5.6485 basically tied), think 4.46, boot 5.801, min_case 5.49","failure_set":"same two frozen heldout cases, token_delta 52 - inherits, adds none","hypothesis":"SELRES cross-board FULL gate on board 2: confirm B3's +0.556 pct-on-B4W winner with its own breadth (fresh signature on b2, no allowance spent)","margin":"5.7300 on b2 == 5.7300 on b3 (byte-identical source, both exactly +0.55x pct over each board's B4W); +2.107 pct over b2's seed pin","next":"composition (DOT8W+SELRES) cross-board FULL gate launched on b2 (fresh signature); b3 screening counted-QKTILE2 loop form; b1 late-ring transplant gate running (primary 5.365 in flight)"}}
