{"run":337,"commit":"5477149","metric":5.03,"metrics":{"boot_bench_tps":5.076,"device_output_exact":17,"device_token_delta":0,"ext_decode_tps":4.956,"gen_tokens":99,"host_output_exact":16,"internal_free":14903,"logit_max_delta":0.00005341,"logit_top1_match":10,"min_case_tps":4.8,"prefill_tps":5.3067,"psram_free":2052252,"think_tps":3.94},"status":"keep","description":"Diagnostic iteration: phase map re-derived after the phi asm landed (board 3, profiled image) + a callee/divide audit of the accepted ELF that found the campaign's biggest remaining lever, and it is not a kernel. decode_tps here is the ACCEPTED 5.0300 CARRIED FORWARD (no shipping change; the only image built was the ND_PROFILE diagnostic on board 3, which reads 5.0200 because the timers cost ~0.2 % - labelled, not passed off as a speed result). PHASE MAP (ms/token, boot bench 197 ms/token, board 3, batch 20260922T2250L): attn-stage 99.9, proj2bit 86.2, attention heads 35.3, hadamard 24.4, engram 16.4, mhc_phi4 12.6, mhc-mix 4.7, sinkhorn 3.8, prep+lut 3.6, step-tail 0.5, rope 0.2, logits4/confpool/sample 0.0 (bench never samples). Against the pre-#333 map, mhc_phi4 fell 13.5 -> 12.6 ms, i.e. its GEMV share fell 9.2 -> ~8.3 ms, which is exactly what run #333's +1.07 ms/token prediction said, and everything else is unchanged to 0.1 ms - so the ranking of what is left is confirmed rather than assumed: 2-bit GEMV at its instruction floor, attention stage, MLP, engram. THE AUDIT, which is the finding. I asked the question #232 did not: #232 audited which hot CALLERS sit in flash and found the loops already resident (+0.067 %, rejected); run #335/#336 showed CALLEE placement is a different and larger thing (+0.15-0.20 % per site). Resolving every indirect call in the accepted image against IDF's own esp_rom/esp32s3 symbol maps gives the answer: attn_heads' nine callx8 sites are ROM memcpy x7, memset x1 and __divsf3 x1 - and `div.s` occurs ZERO times in the entire image. This core has NO hardware single-precision divide: every '/' in the model is a call to the ROM software divider. Counting the sites against the C source: sigmoidf_pair carries TWO divisions per pair (nd_model.c:72-76, 1/(1+e) and e/(1+e)) at ~3,600 pairs/token = ~7,200 divides, plus rms_unit/zcrms_head_rows at three in-loop sites each (line 132/159/184, 1/sqrtf(ss/n+eps), and sqrtf itself calls __divsf3), plus pool (826), prepare, kv_store. Order 8-10k software divides per token. At even 150 cycles each that is ~1.3 M cycles = 5.4 ms = 2.7 % of the token, and unlike every other remaining idea, replacing it is bit-exact BY DEFINITION: IEEE correctly-rounded division has exactly one correct answer, so a faster divider that is correctly rounded produces identical bits everywhere, and the byte-exact gate is satisfied by the algorithm rather than by luck. Design that keeps the risk near zero: fast path = TIE recip0.s approximation + two Newton refinements (each doubles precision) + one Markstein correction step to recover correct rounding, all in hardware mul.s/fma.s, guarded to ordinary normal operands; anything else (subnormal in/out, exponent extremes, zero/inf/NaN) falls to a plain exact shift-subtract implementation ~30 lines of C. Verifiable exhaustively on the host, where the hardware divider IS correctly rounded: the candidate written in C with __builtin_fmaf can be diffed bit-for-bit against the host's own division over tens of millions of random pairs drawn from the model's REAL operand distributions (captured the way Experiment 12 captured its pairs) plus every edge class. NEXT: implement + host-verify, then kbench ROM divide vs candidate on real captured operands, then a three-lane batch. This is the first candidate since the phi asm that is priced above 1 % rather than above 0.2 %.","timestamp":1790114799937,"segment":1,"confidence":19.910000000000018,"asi":{"divide_audit":"div.s appears 0 times in the accepted image; all fp division goes to ROM __divsf3 (0x40002274). Call sites by function: sigmoidf_pair 4 (2 per pair x ~3,600 pairs/token), zcrms_head_rows 3 in-loop, rms_unit 3 in-loop, kv_store_int8 2, attn_heads 1, nd_cq_prepare 1, pool_cell 1, sqrtf 1. Estimated 8-10k divides/token.","method_note":"resolve indirect calls by reading the l32r literal objdump already annotates, then map the target with $IDF_PATH/components/esp_rom/esp32s3/*.pro - memcpy=0x400011e8, memcpy=0x400011f4, __divsf3=0x40002274. Cheap, no device time.","phase_map_after_333":"attn-stage 99.9 | proj2bit 86.2 | attention heads 35.3 | hadamard 24.4 | engram 16.4 | mhc_phi4 12.6 (was 13.5; GEMV share 9.2 -> ~8.3, matching #333's prediction) | mhc-mix 4.7 | sinkhorn 3.8 | prep+lut 3.6 | step-tail 0.5 | rope 0.2. Profiled image reads 5.0200 because timers cost ~0.2 %.","next":"implement a correctly-rounded fp32 divide (recip0.s + 2 Newton + Markstein correction, exact shift-subtract fallback for edge classes), verify bit-for-bit on the host against the host's own correctly-rounded division over the model's real captured operands plus edge classes, then kbench vs ROM __divsf3, then three lanes.","rom_call_sites":"attn_heads indirect calls = ROM memcpy x7, memset x1, __divsf3 x1 - i.e. the staging copies are ROM calls, which is a separate (much smaller) class: ~112 memcpys/token, sub-0.05 %.","hypothesis":"Nothing speed-side was testable on the accepted tree; instead re-measure the phase map after the phi asm and audit which flash/ROM callees the hot IRAM loops still call. The audit found NO remaining callee-placement win (22D was the last of its class) but found a much larger one: the core has no hardware fp divide."}}
{"run":338,"commit":"5477149","metric":5.0017,"metrics":{"boot_bench_tps":5.045,"device_output_exact":17,"device_token_delta":0,"ext_decode_tps":4.929,"gen_tokens":99,"host_output_exact":16,"internal_free":14391,"logit_max_delta":0.00005341,"logit_top1_match":10,"min_case_tps":4.78,"prefill_tps":5.2733,"psram_free":2052252,"think_tps":3.92},"status":"discard","description":"Experiment 23 - correctly-rounded reciprocal-refinement division replacing the ROM software divider: MEASURED, REJECTED, and the premise is retired with numbers. Triggered by run #337's audit fact that the accepted image contains ZERO div.s instructions, so ~8-10k divisions per decode token (two per sigmoid pair alone) call the ROM __divsf3 at 0x40002274 - which looked like several percent of the token, and looked admissible because IEEE-754 division is *specified* correctly rounded, so a faster correctly-rounded divider returns identical bits. Implementation: engine/include/nd_div.h (kept in .auto/divf3/) - magic-subtract inverse, three Newton refinements via hardware fma, one quotient multiply, exact residual, Markstein correction, behind an integer-only guard (both operands normal, quotient exponent inside the normal range); everything else falls through to `a / b`, i.e. the division the build already does, so subnormals/zeros/infinities/NaN payloads keep their current implementation bit-for-bit. QUALITY WAS NEVER IN DOUBT and was proven twice over before any board time: (1) .auto/divf3/test_div.c now INCLUDES THE SHIPPING HEADER (not a copy of it) and compared bit-for-bit against the host's correctly-rounded hardware divider - 1,572,864 pairs over six classes (model-shaped sigmoid 1/(1+e) and e/(1+e), RMS 1/(ss/n+eps), uniform exponents, small integers, exponent extremes, and a special-value class of +-0/inf/NaN/subnormal/denormal-limit pairs) with 0 mismatches; the guard is what made the two hard classes pass: without it the fast path returned -NaN where the answer is -inf on an overflow pair; (2) the real pipeline on the host with all 15 engine division sites converted: host_output_exact=16/16, host_golden_missing=0, token_delta 0, fidelity 5.341e-05 IDENTICAL to the control, top1 10/10, and on device 17/17 byte-exact with DEVICE_GATE_OK and token_delta 0. So this is a pure speed verdict. DEVICE: decode 5.0017 against the accepted 5.0300 = -0.56 %, with every monitor moving together (extended 4.929, prefill 5.2733, think 3.92, boot bench 5.045 down from 5.076 - the bench moving is the mechanism check, and it moved the wrong way), internal_free 14,391 (-512 B from inlined expansions in IRAM-resident callers). THE KBOOTCH THAT KILLED IT (board 2, kbench, min of 25 rounds over 256 rotated real-shaped operand pairs, results consumed through a float register barrier, both variants reached through a noinline function so call overhead cancels): rom_divsf3 = 7.95 cycles per divide, newton_markstein = 30.92, a bare multiply as the loop floor = 2.92, and bit_mismatch = 0 over all 256 pairs - so the algorithm is exactly as correct on the target as on the host, and 3.9x slower. PREDICTION AND RESULT AGREE: 10k divisions x (30.92 - 7.95) = 230k cycles = 0.96 ms of a 198 ms token = -0.49 % predicted against -0.56 % measured. THE FINDING IS ABOUT ROM, not about my code: Espressif's ROM __divsf3 costs about 5 cycles net of call and loop overhead, which a shift-subtract divider cannot do and a hand-written TIE reciprocal-refinement can - the ROM authors almost certainly did exactly what I wrote, in assembly, without the float-to-integer round trips that `nd_f2u`/`nd_u2f` need on this core (runs #230/#292's measured fact that float/int transfers go through memory, which is also why the C version paid 31 cycles for ~12 FP ops). Ceiling on any future handwritten divider: 7.95 - 2.92(mul floor) = ~5 cycles per divide, across ~10k divides = 0.2 ms = +0.1 % of the token, i.e. below the keep bar before any risk is even considered. Division is therefore NOT a lever on this target and the observation \"there is no div.s\" is harmless: the software divider is already at the FMA-chain floor. Engine changes reverted; the bench (bench_div in esp32/main/kbench.c, kbench-gated so it cannot affect a shipping image, kept in .auto/divf3/kbench.c.with_div_bench) and the verified header stay in .auto so nobody re-derives this.","timestamp":1790116584246,"segment":1,"confidence":19.910000000000018,"asi":{"ceiling":"any handwritten divide can save at most ~5 cycles/divide (7.95 - 2.92 loop floor) x ~10k divides = 0.2 ms = +0.1 % of the token -> below the keep bar. Division family CLOSED on measurement.","correctness":"bit-exact proven twice: host test over 1,572,864 pairs in 6 classes with 0 mismatches (compiling the SHIPPING header), device kbench bit_mismatch=0 on 256 real-shaped pairs, and full byte-exact goldens on host (16/16) and device (17/17) with fidelity 5.341e-05 unchanged. This was never a quality question.","kbench_numbers":"rom_divsf3 7.95 cyc/div, newton_markstein 30.92 cyc/div, mul_floor 2.92 cyc/div (min of 25 rounds, 256 rotated pairs, float-register barrier).","mechanism":"ROM __divsf3 (0x40002274) costs ~5 cycles net, which is FMA-chain territory: Espressif's ROM divider is almost certainly hand-written TIE reciprocal-refinement. My C version pays for float<->integer transfers (nd_f2u/nd_u2f = memory round trips, the #230/#292 measured fact) and 12 dependent FP ops.","method_note":"kb_capture.py takes <port> <seconds> <outfile> and a warm kbench board must be RESET for the bench's own output to appear: capture open, then `python3 -m esptool --chip esp32s3 -p $FLASH_PORT run` gave 95 KB of console including the KB lines, where attach-only gave 0 bytes. Board ports come from the wrapper: /dev/needle-pi/boardN-{flash,console}.","prediction_vs_result":"-0.49 % predicted from the measured per-divide delta x 10k divides, -0.56 % measured. The pricing method works when the primitive cost is measured rather than assumed.","premise_retired":"run #337's audit fact (no div.s, ~10k ROM divides/token) was correct but harmless: the ROM divider is already ~8 cycles including call overhead, not the 150-400 cycles a software divider was assumed to cost. Cheapest possible closure: one host test + one kbench image."}}
{"run":339,"commit":"31bd41b","metric":5.03,"metrics":{"boot_bench_tps":5.076,"device_output_exact":17,"device_token_delta":0,"ext_decode_tps":4.956,"gen_tokens":99,"host_output_exact":16,"internal_free":14903,"logit_max_delta":0.00005341,"logit_top1_match":10,"min_case_tps":4.8,"prefill_tps":5.3067,"psram_free":2052252,"think_tps":3.94},"status":"keep","description":"Experiment 24 screen - put the subset-logits gather on the shipped TIE728 2-bit kernel: MEASURED IN ISOLATION at +97.7 %, and BLOCKED on a named exactness question, so nothing shipped (decode_tps is the ACCEPTED 5.0300 CARRIED FORWARD; the only image built was a kbench diagnostic on board 3, which by design never runs the request path - labelled, not a speed result). HYPOTHESIS, from the phase map rather than the backlog: the constrained sampler's dominant cost is nd_model_logits_subset, 5.7 ms of a real request token (2.8 %, measured in run #166 and invisible to the boot bench). It prepares the activation once and projects ~1.3k grammar-legal embedding rows through nd_cq_gemv_gather -> gather_rows, which walks each row in C with a dot_group CALL PER GROUP - the exact structural cost run #333 just proved is worth +0.365 % on the 4-bit phi path. The dense 2-bit projections never pay it: they use nd_lut2_rows_tie1n, worth +13.45 % end to end over the C walker (run #204). The gather path missed the kernel only because the kernel walks a consecutive row range and a gather needs an id indirection - and the lazy integration needs NO assembly: call the existing kernel once per gathered row with r0=ids[i], r1=ids[i]+1 into a full-size scratch indexed by row id, then compact. DESIGN IS NOW WRITTEN (kept in the kbench bench_gather): the per-row calls go through nd_parallel_rows via a 4-line row function, so the two-core split is unchanged, and the only new per-token cost is one nd_cq_lut_build, measured at 32,345 cycles = 0.135 ms against a 5.7 ms phase. SCREEN (board 3, real archive bytes, real prepared activation, 512 spread ids of the size the real grammar admits, min of 5 rounds): C gather with dot_group-per-group = 5,089.50 cycles/row; lut2 asm one-call-per-row + compaction = 2,574.61 cycles/row = **+97.68 %**. Applied to 5.7 ms that is ~2.8 ms = **+1.4 % of the request token**, which would be the largest single candidate since the phi asm - if it is bit-exact. IT IS NOT, on synthetic data: the same bench compared the two paths row-for-row and got **mismatch = 417 of 512**, first at i=1 with ref=-87.5963516 against got=-87.596344, i.e. one-ULP-class differences in 81 % of rows, not garbage. That is the signature of a different accumulation ORDER, not a wrong operand: the pair-LUT kernel sums precomputed cb*xh table entries, the gather walk sums cb[k]*xh[j] products in dot_group's order, and the two orders are not identical. WHY THE CAMPAIGN COULD STILL THINK THEY WERE EQUAL, stated precisely because it changes what to test next: the dense 2-bit path has used the pair-LUT since before this campaign's first baseline, so its byte-exact goldens prove 'the model's outputs equal the LUT path', never 'the LUT path equals the dot_group walk'. Nothing in the tree ever compared those two on the SAME data, which is exactly what a gather needs. THE DECISIVE CHEAP TEST, banked as the next step: capture a real fixture from the host engine (which runs the same code) - the embedding's prepared activation, the ids list, and the shipped gather's outputs from a real decode step - then replay it on the host, where the C pair-LUT walker (nd_lut2_rows_c) is compilable without any assembly, and diff it row-for-row against nd_cq_gemv_gather. If they agree on real data (and the reason they disagree on mine is that my synthetic activation has a dynamic range the model's FWHT-prepared activations do not), the candidate is worth ~+1.4 % and gets a three-lane batch. If they disagree, this whole idea closes for the price of one host replay, and the campaign keeps a newly-verified fact: pair-LUT and dot_group are NOT interchangeable primitives. BENCH ASSET KEPT: bench_div (run #338's divide screen) and bench_gather both live in esp32/main/kbench.c behind NEEDLE_KBENCH, which cannot appear in a shipping configure; raw device output in /root/board-pool/batches/20260922T2358L/board3.kbgather.txt.","timestamp":1790117191292,"segment":1,"confidence":19.910000000000018,"asi":{"banked_next":"host fixture + nd_lut2_rows_c replay vs nd_cq_gemv_gather on real captured data; then a three-lane batch only if bit-exact.","candidate_priced":"+97.68 % on the gather walk applied to 5.7 ms of a ~198 ms request token = ~+1.4 % decode - the largest candidate since the phi asm, gated entirely on bit-exactness.","exactness_blocker":"417 of 512 rows differ by ~1 ULP between nd_cq_gemv_gather (dot_group per group) and nd_lut2_rows_tie1n + compaction on a synthetic activation: first i=1 ref=-87.5963516 got=-87.596344. Different accumulation order, not a wrong operand.","history_insight":"the pair-LUT path predates this campaign's baseline, so all byte-exact evidence in the tree compares the model to the LUT path; nobody ever compared the LUT path to the dot_group walk that the gather still uses. Two primitives that look interchangeable are not known to be.","integration_shape_no_asm":"nd_cq_gemv_gather gains a lut2 variant: nd_cq_lut_build once, nd_lut2_fill into a vocab-sized PSRAM y scratch, nd_parallel_rows over a 4-line row function calling nd_lut2_rows_tie1n(vc, ids[i], ids[i]+1), then compact out[i]=yfull[ids[i]]. New per-token cost: one lut_build = 32,345 cycles = 0.135 ms. Zero internal RAM; fallback to the C walk if the gate or the scratch allocation fails (the #288 pattern).","kbench_numbers":"c_gather_dot_group 5,089.50 cyc/row | lut2_asm_per_row 2,574.61 cyc/row (+97.68 %) | lut_build 32,345 cyc/token, board 3, 512 rows, min of 5 rounds.","hypothesis":"The one phase the boot bench cannot see and the campaign has not optimised since run #147 is nd_model_logits_subset (5.7 ms/token), and it still uses the per-group dot_group CALL walk that run #333 showed is worth real time on the dense path."}}
