{"run":497,"commit":"e52ad7c","metric":5.3033,"metrics":{"boot_bench_tps":5.343,"device_output_exact":20,"device_token_delta":0,"ext_decode_tps":5.2269,"gen_tokens":99,"host_output_exact":19,"internal_free":13367,"logit_max_delta":0.00005341,"logit_top1_match":10,"min_case_tps":5.07,"prefill_tps":5.59,"psram_free":2052252,"think_tps":4.2},"status":"keep","description":"Zero-case lane failure traced to my own broken host edit, and #494's diagnosis is retracted. The RXTRACE tee I added in #494 anchored on a non-unique occurrence of the _log_open gate and landed inside _looks_like_probe_answer, between an if condition and its body, so tools/serial_api.py raised IndentationError at import - which failed the late-placement RX session with LANE_RC=1 and zero cases, and is also the REAL reason bench.py failed in #494 (I had blamed a missing positional mode and PYTHONPATH, and written that down as the blocker). Fixed by removing the misplaced block, py_compile verifying, then inserting the tee at the true read site in def _line immediately after readline() and before the _log_open test, verified again with py_compile, and the identical tree (provenance e52ad7c21df5, build_s=2) relaunched for the full 20-case session with the input trace. Lean-notification lane on board 3 is still in build/priming - no claim, base is the predicate-only 5.5617. Lesson recorded: anchor host-file patches on unique multi-line constructs and compile-check before launching, and read the traceback tail before naming a blocker. Accepted runtime unchanged at 5.3033.","timestamp":1790265802047,"segment":1,"confidence":19.304161566707442,"asi":{"cause":"My own host-side edit. The RXTRACE tee was inserted at a match for the wrong occurrence of the _log_open gate - inside _looks_like_probe_answer, between an if condition and its body - so serial_api.py raised IndentationError at import time on line 226.","retraction":"#494's named harness blocker is withdrawn: bench.py did not fail because of a missing positional mode or PYTHONPATH, it failed because my broken serial_api.py could not be imported. Same root cause, one edit, two misdiagnoses - and the second one was written down as a blocker.","fixed_by":"removing the misplaced block, verifying with py_compile, then inserting it at the true read site (def _line, right after readline and before the _log_open test), and verifying py_compile again. Relaunched the full 20-case session on the same tree, provenance e52ad7c21df5 unchanged, build_s=2 from cache.","hypothesis":"Why did the late-placement RX session exit 1 with zero cases, when the image built and flashed cleanly?","lesson":"Patch a host file by anchoring on a unique multi-line construct and compile-check it before launching a lane; a broken host module looks exactly like a harness argument problem, and I recorded the wrong blocker instead of reading the traceback tail - which is where the answer was waiting.","lean_b3_state":"Still inside build/priming, no METRIC lines yet, so no claim; base for it is the predicate-only 5.5617."}}
{"run":498,"commit":"ae452f7","metric":5.3033,"metrics":{"boot_bench_tps":5.621,"device_output_exact":6,"device_token_delta":0,"ext_decode_tps":5.2269,"gen_tokens":99,"host_output_exact":19,"internal_free":12519,"logit_max_delta":0.00005341,"logit_top1_match":10,"min_case_tps":5.32,"prefill_tps":5.59,"psram_free":2052252,"think_tps":4.2},"status":"keep","description":"LEAN-NOTIFICATIONS MEASURED AND CROSS-BOARD CONFIRMED: +0.33..0.36 % over the predicate-only base, on two boards, byte-exact. Board 3 read decode 5.5817 and board 1 read 5.5800 against 5.5617 (board 3's predicate-only reading of the same mechanism), with device_output_exact=6/6, golden_missing=0 and token_delta=0 on both, min_case 5.32 (best on record), boot_bench 5.621, and internal_free 12,519 (+424 B from deleting both semaphore objects). This resolves #489's sign contradiction: that run bundled notifications WITH the predicate and kept the three stale-token drains, reading -0.180 %; the predicate alone measured exactly the spin base, so the drains - no-op xSemaphore calls with cross-core critical sections, 275 splits per token - were the cost, worth roughly 0.5 % here. Composed stack (asmemo + radix-4 fusion + nf16v + spin + predicate + lean notifications) now reads 5.58-5.5817 = +5.22 % over the accepted 5.3033, which stays the pin because a 20-case byte-exact session has still never completed. Disclosed errors: my lean+late-RX composition wrote nothing (wrong symbol assumption), and the mandated main-checkout measure.sh run - the only command form the strict guard allows - collided with board 1's port after that lane had completed, failing at the boot handshake with no reading. Static semantics check passed first: every completion publish notifies, the predicate is the authority, zero leftover semaphore calls.","timestamp":1790267747486,"segment":1,"confidence":19.304161566707442,"asi":{"acceptance_still_owed":"A 20-case byte-exact session on this stack has still never completed: the console/RX ceiling stops sessions at 16-17 without the lossless RX ring, and the late-placement RX ring is the fix that has completed all twenty once. Lean-notifications plus the late RX ring is the tree to run as the acceptance gate next.","board1_note":"board 1's own session finished cleanly (LANE_RC=0) before my main-checkout run reflashed it; the collision cost me the mandated harness run, not a board result.","candidate_secondaries":"internal_free 12,519 (+424 B, both boards), min_case 5.32 (best on record), boot_bench 5.621, device_output_exact 6/6 with golden_missing 0 and token_delta 0 on both boards, host gates green. ext_decode_tps and think_tps are NOT measured by a primary-restricted run, so the two values passed above are the last accepted full-suite figures, not this candidate's.","composed_stack":"asmemo + radix-4 fusion + nf16v + spin handshake + sequence predicate + lean notifications = 5.58-5.5817 against the accepted pin 5.3033, i.e. +5.22 %.","finding":"The regression in #489 belonged to the stale-token drains, not to notifications. #489 kept the caller's per-job drain and the worker's two drains and measured -0.180 %; the predicate alone measured exactly the spin base, so the drains - no-op xSemaphore calls with cross-core critical sections, 275 splits per token - were the cost, worth roughly 0.5 % here.","hypothesis":"Lean notifications on the predicate-correct base: are task notifications worth keeping once the sequence predicate - not the wait - decides completion?","next":"Compose lean-notifications with the late-placement lossless RX ring and run that tree as the 20-case acceptance gate; my composition attempt failed on a wrong symbol assumption (s_rx_ring_idx does not exist in the RX patch) and wrote nothing, so b3 is still prov e8844d68a969. The mandated main-checkout measure.sh run - the only form the strict guard allows - collided with board 1's port after that lane had finished, failed at the boot handshake, and produced no reading; main needs its own free board.","verification":"Static semantics check passed first: two completion publishes, two notify sites (every publish notifies), the predicate loop present, zero leftover semaphore calls on the hot path."}}
{"run":499,"commit":"ae452f7","metric":5.3033,"metrics":{"boot_bench_tps":5.594,"device_output_exact":18,"device_token_delta":52,"ext_decode_tps":5.2269,"gen_tokens":99,"host_output_exact":19,"internal_free":8247,"logit_max_delta":0.00005341,"logit_top1_match":10,"min_case_tps":5.29,"prefill_tps":5.59,"psram_free":2052252,"think_tps":4.2},"status":"keep","description":"The 20-case acceptance gate now COMPLETES: the late-placement lossless RX ring ran all twenty frozen cases in one boot on board 2 (provenance e52ad7c21df5, #494 input trace active) and reported device_output_exact=18/20 with zero stalls. Decoded: the two failures are exactly the known state-dependent pair - heldout_interval_one (golden 27 tokens, now 19) and heldout_long_tools_note_only (golden 19, now 63) - whose goldens encode the firmware's demo timer and sampling counters (run #391), the same pair #490 diverged on, so this is a golden-hygiene blocker, not engine divergence or corruption. The input trace settles the RX question: every RXQ line reports drop=0, so no character was ever dropped for a full line buffer - the polled-FIFO loss theory is measured absent on this image, and length-dependent loss cannot explain a diverging short case. Cost of the fix measured: decode 5.55 on the spin stack against 5.560/5.5617 (-0.18 %, with diagnostic RXQ prints still in the emit path), boot_bench 5.594 against 5.601 no-driver, internal_free 8,247 vs 12,519 (-4,271 B for the ISR ring). Composed-stack acceptance still owed: lean-notifications + late RX ring with the trace removed, expecting 20/20 once the two timer-dependent goldens are regenerated or annotated by the owner. Accepted pin unchanged at 5.3033; no candidate built this iteration because reading this session was the binding measurement.","timestamp":1790267818799,"segment":1,"confidence":19.304161566707442,"asi":{"action_taken":"No candidate was built this iteration - deliberately. The RX-ring tree reached twenty cases for the first time in the spin era, so the highest-value act was to read that session and settle which of its failures is real, which is what this entry does.","candidate_verdict":"The late-placement lossless RX ring, with the #494 input trace still printing, reads 5.55 on the spin stack against 5.560/5.5617, and its boot bench reads 5.594 against 5.601 with no driver. So the fix costs about 0.1-0.2 % of request time and one boot-bench quantum, plus 4.2 KB of internal heap - cheap enough to ship as the defect fix, with the caveat that the RXQ trace line itself is diagnostic traffic that should be removed before any speed claim.","decoded_divergences":"heldout_interval_one: golden 27 tokens, now 19. heldout_long_tools_note_only: golden 19 tokens, now 63. Both are the known state-dependent pair from run #391 - their goldens encode the firmware's demo timer and sampling counters, which a mid-suite state change moves. Same set as #490.","hypothesis":"Can the 20-case acceptance gate complete at all, and if it does, which cases fail and why?","input_trace_result":"Every RXQ line shows drop=0 - zero characters dropped for a full line buffer - so the polled-FIFO RX loss theory is now measured as absent on this image, and the remaining divergence explanation is reply state, not lost characters.","next":"Two-step, in order. (1) Owner-visible hygiene, no candidate: regenerate or annotate the two state-dependent goldens so the gate measures the engine rather than the demo timer - the documented way to make a 20-case session meaningful, not a waiver. (2) Then run the acceptance gate on lean-notifications plus the late RX ring with the RXQ trace REMOVED, expecting 20/20. Do not re-run the ring fix itself; its ceiling-breaking effect is now measured twice."}}
{"run":500,"commit":"3bdeadd","metric":5.3033,"metrics":{"boot_bench_tps":5.621,"device_output_exact":6,"device_token_delta":0,"ext_decode_tps":5.2269,"gen_tokens":99,"host_output_exact":19,"internal_free":12519,"logit_max_delta":0.00005341,"logit_top1_match":10,"min_case_tps":5.32,"prefill_tps":5.59,"psram_free":2052252,"think_tps":4.2},"status":"keep","description":"Consolidated the acceptance position into .auto/OWNER_ACCEPTANCE_PACKET.md rather than build another candidate, because the binding uncertainty is no longer speed: the composed stack (asmemo +2.20 %, radix-4 fusion, nf16v, spin handshake +1.31 %, sequence predicate free, lean notifications +0.33-0.36 % on two boards) measures 5.580/5.5817 decode against the 5.3033 pin with min_case 5.32 and internal_free 12,519. The packet now states both blockers as measured, not suspected: (1) the per-boot request ceiling is fixed by an ISR-fed console RX ring installed AFTER model open and prefix allocations - placement is essentially the whole cost (boot bench 5.601 no driver / 5.546 early / 5.596 late), 4,271 B heap, ~0.1-0.2 % request time, and with it all twenty cases completed in one boot for the first time in this era; (2) two goldens (heldout_interval_one, heldout_long_tools_note_only) encode the firmware demo-timer/sampling counters (run #391) and are the only cases that failed the completed 18/20 session, with the input trace reporting drop=0 everywhere so lost characters are excluded. The ask to the owner is explicit: regenerate or annotate those two goldens, then one 20-case session on lean-notifications plus the late ring with diagnostics removed should read 20/20 and re-pin near 5.58. Accepted pin deliberately unchanged at 5.3033; run_experiment not called this iteration for the reason recorded in the ASI.","timestamp":1790267885546,"segment":1,"confidence":19.304161566707442,"asi":{"candidate_verdict":"Lean notifications + late RX ring is still unmeasured as one tree - deliberately not attempted this iteration, because writing that composition needed exact knowledge of the RX patch's symbol extent that I do not have, and a guessed splice on the acceptance tree is exactly the provenance class this ledger already paid for three times. The next window should extract the RX block by its verified anchors (esp_vfs_dev.h include, console_rx_ring_enable definition, the getchar override, REQUIRES esp_driver_uart) with asserts, then run one 20-case session without the RXQ diagnostic prints.","hypothesis":"The binding uncertainty is no longer speed - the stack measures 5.580/5.5817 on two boards - it is what the owner needs in order to accept: a stack statement, the cost of the console fix, and a disposition for the two state-dependent goldens. So this iteration consolidates that instead of building another candidate.","input_trace_note":"Read #499 before consolidating: drop=0 on every case excludes lost characters, so the two divergences are demo-timer state, and regenerating those goldens is the owner-level step that makes a 20-case gate meaningful rather than a waiver.","next":"Compose lean-notifications with the late RX ring on asserted anchors and run the 20-case gate with diagnostics removed; that is the single measurement standing between the stack and a re-pin near 5.58.","run_experiment_status":"Not called this iteration and why, stated rather than hidden: the strict guard accepts only 'bash .auto/measure.sh' in the MAIN checkout, whose tree is the accepted image (anti-repeat guard refuses it by design), and my one attempt at it in #498 collided with a board that was mid-session. A restricted group run with a run-specific reason is the legitimate form and belongs on a board I know is free."}}
{"run":501,"commit":"3bdeadd","metric":5.3033,"metrics":{"boot_bench_tps":5.621,"device_output_exact":6,"device_token_delta":0,"ext_decode_tps":5.2269,"gen_tokens":99,"host_output_exact":19,"internal_free":12519,"logit_max_delta":0.00005341,"logit_top1_match":10,"min_case_tps":5.32,"prefill_tps":5.59,"psram_free":2052252,"think_tps":4.2},"status":"keep","description":"Acceptance-tree composition refused by its own assert, and the refusal is the finding. Goal: lean notifications (b3, 5.5817) plus the late-placement lossless RX ring (b2, the fix that let all 20 cases complete), with the RXQ diagnostic prints excluded, for one 20-case acceptance session. The RX block extracted cleanly from board 2 - lines 54-72 of its main.c hold the whole ring (uart_driver_install + esp_vfs_dev_uart_use_driver) with asserts proving it contains the install and no printf/RXQ - but the insertion anchor 'static void process_request(' does not exist in the lean tree's main.c, so the script raised before writing and board 3 remains prov e8844d68a969, byte-identical to the measured lean tree. No half-composed image was flashed, which is the outcome the provenance rules exist to produce. The lane I then launched therefore runs the uncomposed lean tree and is worth a third same-board sample of +0.358 %, not the gate; left running rather than killed. Next: drop the process_request anchor entirely - the block needs only file scope before its single call site, so insert after the last #include and put the LATE call before the EVT bench print, verify by counts plus a clean build, then run the single 20-case session expected to read 20/20 on the lean+ring tree once the owner settles the two demo-timer goldens (18/20 without them). Accepted pin unchanged at 5.3033.","timestamp":1790268017080,"segment":1,"confidence":19.304161566707442,"asi":{"board3_lane":"The session I launched is running board 3's UNCOMPOSED lean tree (prov e8844d68a969), so its value is a third same-board sample of the +0.358 % lean reading rather than the acceptance gate. Left running rather than killed, per the rule that live board work finishes.","discovery":"The lean tree's main.c does not contain the function that the RX-patched tree names process_request, so the two checkouts have diverged in that region - which means the RX composition cannot anchor on it. The block itself was extracted cleanly: lines 54-72 of board 2's main.c are the whole RX ring (uart_driver_install + esp_vfs_dev_uart_use_driver), free of any diagnostic print, plus two includes (driver/uart.h, esp_vfs_dev.h) and the REQUIRES esp_driver_uart line.","hypothesis":"Compose the acceptance tree - lean notifications plus the late-placement lossless RX ring, with the RXQ diagnostic prints excluded - and run one 20-case session on it.","next":"Anchor the RX block insertion on something structural that exists in both trees: put it immediately after the last #include block plus the LATE install before the EVT bench print, and drop the process_request anchor entirely - the block only needs to be at file scope before its single call site. Then verify by count (one call site, call before the bench print, no RXQ or rx_drop text) and by a clean build before flashing.","outcome":"Nothing was written to the tree: the extraction asserts passed but the insertion anchor 'static void process_request(' is absent from the lean tree's main.c, so the script aborted before writing and board 3 still carries prov e8844d68a969 - the provenance discipline did its job and no half-composed image exists."}}
{"run":502,"commit":"3bdeadd","metric":5.3033,"metrics":{"boot_bench_tps":5.621,"device_output_exact":6,"device_token_delta":0,"ext_decode_tps":5.2269,"gen_tokens":99,"host_output_exact":19,"internal_free":12519,"logit_max_delta":0.00005341,"logit_top1_match":10,"min_case_tps":5.32,"prefill_tps":5.59,"psram_free":2052252,"think_tps":4.2},"status":"keep","description":"Second composition attempt also refused before writing, and it localised the real obstacle. Recipe applied to board 1 (idle): extract the verified RX ring block from board 2 (main.c lines 54-72, assert-checked for uart_driver_install + esp_vfs_dev_uart_use_driver and absence of any printf), insert it at file scope just before the timed boot loop so no function anchor is needed, add the LATE console_rx_ring_enable() call, add REQUIRES esp_driver_uart. The lean assertion passed on board 1 (ulTaskNotifyTake present, so it is a notification-based tree), but the structure assertion failed - exactly one ring definition, exactly one call site, no RXQ text - so nothing was written and board 1 keeps prov 1e3e04bb669e. Root cause of the differing behaviour between checkouts: board 1 sits at HEAD 7cf8a6f while board 3 sits at 5c2abfb, so their main.c and engine are not the same baseline; composing on a checkout that is not the measured baseline is not the acceptance tree even if the splice succeeds. The session launched on board 1 therefore measures an uncomposed notification tree and is worth noise only, same for board 3's running sample. Next window: compose inside the board 3 checkout (the measured baseline), assert BEFORE computing the expectation file, and print which assertion fails. Accepted pin unchanged at 5.3033.","timestamp":1790268106459,"segment":1,"confidence":19.304161566707442,"asi":{"diagnosis":"Board 1's main.c does pass the lean assertion (ulTaskNotifyTake present) so the tree is notification-based, but it fails the composed-structure assertion, and board 1's HEAD is 7cf8a6f while board 3's is 5c2abfb, so the two checkouts are not the same baseline and their main.c text differs in more than the handshake. That is why the same composition recipe behaves differently on the two boards.","hypothesis":"Retry the acceptance-tree composition (lean notifications + late-placement lossless RX ring, diagnostics excluded) on board 1, which is idle, inserting the ring block right before the timed boot loop so it needs no function-scope anchor.","lane_status":"Board 1 is now running prov 1e3e04bb669e - a notification-based tree WITHOUT the ring (nothing was written), so its reading is at best a further lean sample, not the 20-case gate, and its baseline differs from board 3's. Both that and board 3's uncomposed sample should be read for noise only.","next":"Do the composition in the board 3 checkout - which is the baseline the stack was measured on - inserting the ring at file scope immediately after the include block and the LATE call before the EVT bench print, then assert structure counts AND a clean build before flashing. Assert the expected structure BEFORE computing the expectation file, and print which assertion fails so the next window is not guessing.","outcome":"Nothing written again: the structure assert (exactly one ring definition, exactly one call site, no RXQ text) fired before the file write, so board 1 still carries prov 1e3e04bb669e - a notification-based tree WITHOUT the ring - and the session I launched there is measuring that, not the composed gate. Two consecutive composition refusals now, both by assert rather than by a silent half-edit."}}
