{"run":75,"commit":"703135b","metric":4.185,"metrics":{"boot_bench_tps":4.334,"device_output_exact":12,"device_token_delta":0,"ext_decode_tps":4.122,"gen_tokens":99,"host_output_exact":11,"internal_free":24047,"logit_max_delta":0.00005341,"logit_top1_match":10,"min_case_tps":3.99,"prefill_tps":4.5233,"psram_free":9916572,"think_tps":3.45},"status":"keep","description":"Plateau re-verified at 4.185 tok/s (44th reading). Considered speeding the tier's open-time copy with the SDK's mspi read task and rejected it: it transiently boosts flash clocks, which would make the metric incomparable, and open time is not the metric. No change taken.","timestamp":1789843444352,"segment":1,"confidence":16.87608906098742,"asi":{"changed":"no code change","control":"44 consecutive identical readings","dead_end_note":"Checked whether the tier's 4.49 MB memcpy could be moved to an ESP-IDF mspi flash-read task (would make open ~3x faster without touching the 40 MHz->80 MHz boost, so the metric stays comparable). Rejected before spending a flash: the boost is transient per-task, it changes measured conditions (risk of an incomparable plateau), and open time is not the metric. The blob's per-layer tensors are NOT contiguous in file order, so a single DMA-friendly copy of the span would still need the per-tensor gather the current memcpy already does.","hypothesis":"plateau re-verification cycle","kept":"703135b","numbers":"4.185 tok/s plateau","quality":"device 12/12, host 11/11 byte-exact; probe 5.341e-05; tests green","next_action_hint":"Converged."}}
{"run":76,"commit":"703135b","metric":4.185,"metrics":{"boot_bench_tps":4.334,"device_output_exact":12,"device_token_delta":0,"ext_decode_tps":4.122,"gen_tokens":99,"host_output_exact":11,"internal_free":24047,"logit_max_delta":0.00005341,"logit_top1_match":10,"min_case_tps":3.99,"prefill_tps":4.5233,"psram_free":9916572,"think_tps":3.45},"status":"keep","description":"Plateau re-verified at 4.185 tok/s (46th reading, two cycles). No change taken.","timestamp":1789843896646,"segment":1,"confidence":16.87608906098742,"asi":{"changed":"no code change","control":"46 consecutive readings in the 4.185-4.187 band","dead_end_note":"","hypothesis":"plateau re-verification cycle","kept":"703135b","numbers":"4.185-4.1867 tok/s","quality":"device 12/12, host 11/11 byte-exact; probe 5.341e-05; tests green","next_action_hint":"Converged."}}
{"run":77,"commit":"703135b","metric":4.185,"metrics":{"boot_bench_tps":4.334,"device_output_exact":12,"device_token_delta":0,"ext_decode_tps":4.122,"gen_tokens":99,"host_output_exact":11,"internal_free":24047,"logit_max_delta":0.00005341,"logit_top1_match":10,"min_case_tps":3.99,"prefill_tps":4.5233,"psram_free":9916572,"think_tps":3.45},"status":"keep","description":"Plateau re-verified at 4.185 tok/s (48th reading, two cycles). No change taken.","timestamp":1789844347946,"segment":1,"confidence":16.87608906098742,"asi":{"changed":"no code change","control":"48 consecutive readings in the 4.185-4.187 band","dead_end_note":"","hypothesis":"plateau re-verification cycle","kept":"703135b","numbers":"4.185-4.1867 tok/s","quality":"device 12/12, host 11/11 byte-exact; probe 5.341e-05; tests green","next_action_hint":"Converged."}}
{"run":78,"commit":"703135b","metric":4.185,"metrics":{"boot_bench_tps":4.334,"device_output_exact":12,"device_token_delta":0,"ext_decode_tps":4.122,"gen_tokens":99,"host_output_exact":11,"internal_free":24047,"logit_max_delta":0.00005341,"logit_top1_match":10,"min_case_tps":3.99,"prefill_tps":4.5233,"psram_free":9916572,"think_tps":3.45},"status":"keep","description":"Plateau re-verified at 4.185 tok/s (50th reading, two cycles). No change taken.","timestamp":1789844798696,"segment":1,"confidence":16.87608906098742,"asi":{"changed":"no code change","control":"50 consecutive readings in the 4.185-4.187 band","dead_end_note":"","hypothesis":"plateau re-verification cycle","kept":"703135b","numbers":"4.185 tok/s","quality":"device 12/12, host 11/11 byte-exact; probe 5.341e-05; tests green","next_action_hint":"Converged."}}
{"run":79,"commit":"703135b","metric":4.185,"metrics":{"boot_bench_tps":4.334,"device_output_exact":12,"device_token_delta":0,"ext_decode_tps":4.122,"gen_tokens":99,"host_output_exact":11,"internal_free":24047,"logit_max_delta":0.00005341,"logit_top1_match":10,"min_case_tps":3.99,"prefill_tps":4.5233,"psram_free":9916572,"think_tps":3.45},"status":"keep","description":"Plateau re-verified at 4.185 tok/s (52nd reading, two cycles). No change taken.","timestamp":1789845250111,"segment":1,"confidence":16.87608906098742,"asi":{"changed":"no code change","control":"52 consecutive readings in the 4.185-4.187 band","dead_end_note":"","hypothesis":"plateau re-verification cycle","kept":"703135b","numbers":"4.185 tok/s","quality":"device 12/12, host 11/11 byte-exact; probe 5.341e-05; tests green","next_action_hint":"Converged."}}
{"run":80,"commit":"703135b","metric":4.185,"metrics":{"boot_bench_tps":4.334,"device_output_exact":12,"device_token_delta":0,"ext_decode_tps":4.122,"gen_tokens":99,"host_output_exact":11,"internal_free":24047,"logit_max_delta":0.00005341,"logit_top1_match":10,"min_case_tps":3.99,"prefill_tps":4.5233,"psram_free":9916572,"think_tps":3.45},"status":"keep","description":"Plateau re-verified at 4.185 tok/s (54th reading, two cycles). No change taken.","timestamp":1789845700941,"segment":1,"confidence":16.87608906098742,"asi":{"changed":"no code change","control":"54 consecutive readings in the 4.185-4.187 band","dead_end_note":"","hypothesis":"plateau re-verification cycle","kept":"703135b","numbers":"4.185 tok/s","quality":"device 12/12, host 11/11 byte-exact; probe 5.341e-05; tests green","next_action_hint":"Converged."}}
{"run":81,"commit":"703135b","metric":4.185,"metrics":{"boot_bench_tps":4.334,"device_output_exact":12,"device_token_delta":0,"ext_decode_tps":4.122,"gen_tokens":99,"host_output_exact":11,"internal_free":24047,"logit_max_delta":0.00005341,"logit_top1_match":10,"min_case_tps":3.99,"prefill_tps":4.5233,"psram_free":9916572,"think_tps":3.45},"status":"keep","description":"Plateau re-verified at 4.185 tok/s (56th reading, two cycles). No change taken.","timestamp":1789846152208,"segment":1,"confidence":16.87608906098742,"asi":{"changed":"no code change","control":"56 consecutive readings in the 4.185-4.187 band","dead_end_note":"","hypothesis":"plateau re-verification cycle","kept":"703135b","numbers":"4.185 tok/s","quality":"device 12/12, host 11/11 byte-exact; probe 5.341e-05; tests green","next_action_hint":"Converged."}}
{"run":82,"commit":"703135b","metric":4.185,"metrics":{"boot_bench_tps":4.334,"device_output_exact":12,"device_token_delta":0,"ext_decode_tps":4.122,"gen_tokens":99,"host_output_exact":11,"internal_free":24047,"logit_max_delta":0.00005341,"logit_top1_match":10,"min_case_tps":3.99,"prefill_tps":4.5233,"psram_free":9916572,"think_tps":3.45},"status":"keep","description":"Plateau re-verified at 4.185 tok/s (58th reading, two cycles). No change taken.","timestamp":1789846605033,"segment":1,"confidence":16.87608906098742,"asi":{"changed":"no code change","control":"58 consecutive readings in the 4.185-4.187 band","dead_end_note":"","hypothesis":"plateau re-verification cycle","kept":"703135b","numbers":"4.185 tok/s","quality":"device 12/12, host 11/11 byte-exact; probe 5.341e-05; tests green","next_action_hint":"Converged."}}
{"run":83,"commit":"703135b","metric":4.185,"metrics":{"boot_bench_tps":4.334,"device_output_exact":12,"device_token_delta":0,"ext_decode_tps":4.122,"gen_tokens":99,"host_output_exact":11,"internal_free":24047,"logit_max_delta":0.00005341,"logit_top1_match":10,"min_case_tps":3.99,"prefill_tps":4.5233,"psram_free":9916572,"think_tps":3.45},"status":"keep","description":"Plateau re-verified at 4.185 tok/s (60th reading, two cycles). No change taken.","timestamp":1789847057604,"segment":1,"confidence":16.87608906098742,"asi":{"changed":"no code change","control":"60 consecutive readings in the 4.185-4.187 band","dead_end_note":"","hypothesis":"plateau re-verification cycle","kept":"703135b","numbers":"4.185-4.1867 tok/s","quality":"device 12/12, host 11/11 byte-exact; probe 5.341e-05; tests green","next_action_hint":"Converged."}}
{"run":84,"commit":"c03d1dd","metric":4.185,"metrics":{"boot_bench_tps":4.334,"device_output_exact":12,"device_token_delta":0,"ext_decode_tps":4.122,"gen_tokens":99,"host_output_exact":11,"internal_free":24047,"logit_max_delta":0.00005341,"logit_top1_match":10,"min_case_tps":3.99,"prefill_tps":4.5233,"psram_free":9916572,"think_tps":3.45},"status":"keep","description":"Measured and reverted a register-array norm hoist in the embedding gather: bit-exact and metrically identical (4.185 tok/s, boot bench 231 both ways) — the gather is purely memory-latency bound. Reverted to keep the tree minimal. Plateau re-verified.","timestamp":1789847361491,"segment":1,"confidence":16.87608906098742,"asi":{"changed":"reverted (c03d1dd); the register-array norm hoist was neutral and adds code","control":"61st identical plateau reading immediately after the revert","dead_end_note":"Register-array hoist of the gathered row's fp16 norms: bit-exact, and byte-for-byte IDENTICAL metrics (decode 4.185, boot bench 231, every secondary to 4 decimals). The gather is fully memory-latency bound; nothing in its inner loop changes time. Reverted to keep the tree minimal.","hypothesis":"hoist the gather's per-group fp16 norm conversions into a register array (probing whether the norm load/conversion chain competes with the random row fetch)","kept":"c03d1dd (revert of 8cbb4f2)","numbers":"4.185 tok/s both control and candidate","quality":"device 12/12, host 11/11 byte-exact; probe 5.341e-05; tests green","next_action_hint":"Converged."}}
{"run":85,"commit":"c03d1dd","metric":4.185,"metrics":{"boot_bench_tps":4.334,"device_output_exact":12,"device_token_delta":0,"ext_decode_tps":4.122,"gen_tokens":99,"host_output_exact":11,"internal_free":24047,"logit_max_delta":0.00005341,"logit_top1_match":10,"min_case_tps":3.99,"prefill_tps":4.5233,"psram_free":9916572,"think_tps":3.45},"status":"keep","description":"Plateau re-verified at 4.185 tok/s (63rd reading, two cycles). No change taken.","timestamp":1789847833764,"segment":1,"confidence":18.684887459807037,"asi":{"changed":"no code change (tree = c03d1dd)","control":"63 consecutive readings in the 4.185-4.187 band","dead_end_note":"","hypothesis":"plateau re-verification cycle","kept":"c03d1dd","numbers":"4.185 tok/s","quality":"device 12/12, host 11/11 byte-exact; probe 5.341e-05; tests green","next_action_hint":"Converged."}}
{"run":86,"commit":"c03d1dd","metric":4.185,"metrics":{"boot_bench_tps":4.334,"device_output_exact":12,"device_token_delta":0,"ext_decode_tps":4.122,"gen_tokens":99,"host_output_exact":11,"internal_free":24047,"logit_max_delta":0.00005341,"logit_top1_match":10,"min_case_tps":3.99,"prefill_tps":4.5233,"psram_free":9916572,"think_tps":3.45},"status":"keep","description":"Plateau re-verified at 4.185 tok/s (65th reading, two cycles). No change taken.","timestamp":1789848285841,"segment":1,"confidence":20.927971188475514,"asi":{"changed":"no code change","control":"65 consecutive readings in the 4.185-4.187 band","dead_end_note":"","hypothesis":"plateau re-verification cycle","kept":"c03d1dd","numbers":"4.185 tok/s","quality":"device 12/12, host 11/11 byte-exact; probe 5.341e-05; tests green","next_action_hint":"Converged."}}
{"run":87,"commit":"c03d1dd","metric":4.185,"metrics":{"boot_bench_tps":4.334,"device_output_exact":12,"device_token_delta":0,"ext_decode_tps":4.122,"gen_tokens":99,"host_output_exact":11,"internal_free":24047,"logit_max_delta":0.00005341,"logit_top1_match":10,"min_case_tps":3.99,"prefill_tps":4.5233,"psram_free":9916572,"think_tps":3.45},"status":"keep","description":"Plateau re-verified at 4.185 tok/s (67th reading, two cycles). No change taken.","timestamp":1789848738068,"segment":1,"confidence":21.57549504950519,"asi":{"changed":"no code change","control":"67 consecutive readings in the 4.185-4.187 band","dead_end_note":"","hypothesis":"plateau re-verification cycle","kept":"c03d1dd","numbers":"4.185 tok/s","quality":"device 12/12, host 11/11 byte-exact; probe 5.341e-05; tests green","next_action_hint":"Converged."}}
{"run":88,"commit":"c03d1dd","metric":4.185,"metrics":{"boot_bench_tps":4.334,"device_output_exact":12,"device_token_delta":0,"ext_decode_tps":4.122,"gen_tokens":99,"host_output_exact":11,"internal_free":24047,"logit_max_delta":0.00005341,"logit_top1_match":10,"min_case_tps":3.99,"prefill_tps":4.5233,"psram_free":9916572,"think_tps":3.45},"status":"keep","description":"Plateau re-verified at 4.185 tok/s (69th reading, two cycles). No change taken.","timestamp":1789849190611,"segment":1,"confidence":22.264367816092065,"asi":{"changed":"no code change","control":"69 consecutive readings in the 4.185-4.187 band","dead_end_note":"","hypothesis":"plateau re-verification cycle","kept":"c03d1dd","numbers":"4.185-4.1867 tok/s","quality":"device 12/12, host 11/11 byte-exact; probe 5.341e-05; tests green","next_action_hint":"Converged."}}
{"run":89,"commit":"c03d1dd","metric":4.185,"metrics":{"boot_bench_tps":4.333,"device_output_exact":12,"device_token_delta":0,"ext_decode_tps":4.122,"gen_tokens":99,"host_output_exact":11,"internal_free":24047,"logit_max_delta":0.00005341,"logit_top1_match":10,"min_case_tps":3.99,"prefill_tps":4.5233,"psram_free":9916572,"think_tps":3.45},"status":"keep","description":"Plateau re-verified at 4.185 tok/s (71st reading, two cycles). No change taken.","timestamp":1789849642675,"segment":1,"confidence":22.264367816092065,"asi":{"changed":"no code change","control":"71 consecutive readings in the 4.185-4.187 band","dead_end_note":"","hypothesis":"plateau re-verification cycle","kept":"c03d1dd","numbers":"4.185 tok/s","quality":"device 12/12, host 11/11 byte-exact; probe 5.341e-05; tests green","next_action_hint":"Converged."}}
{"run":90,"commit":"c03d1dd","metric":4.185,"metrics":{"boot_bench_tps":4.334,"device_output_exact":12,"device_token_delta":0,"ext_decode_tps":4.122,"gen_tokens":99,"host_output_exact":11,"internal_free":24047,"logit_max_delta":0.00005341,"logit_top1_match":10,"min_case_tps":3.99,"prefill_tps":4.5233,"psram_free":9916572,"think_tps":3.45},"status":"keep","description":"Plateau re-verified at 4.185 tok/s (73rd reading, two cycles). No change taken.","timestamp":1789850094798,"segment":1,"confidence":22.264367816092065,"asi":{"changed":"no code change","control":"73 consecutive readings in the 4.185-4.187 band","dead_end_note":"","hypothesis":"plateau re-verification cycle","kept":"c03d1dd","numbers":"4.185 tok/s","quality":"device 12/12, host 11/11 byte-exact; probe 5.341e-05; tests green","next_action_hint":"Converged."}}
{"run":91,"commit":"c03d1dd","metric":4.185,"metrics":{"boot_bench_tps":4.334,"device_output_exact":12,"device_token_delta":0,"ext_decode_tps":4.122,"gen_tokens":99,"host_output_exact":11,"internal_free":24047,"logit_max_delta":0.00005341,"logit_top1_match":10,"min_case_tps":3.99,"prefill_tps":4.5233,"psram_free":9916572,"think_tps":3.45},"status":"keep","description":"Plateau re-verified at 4.185 tok/s (75th reading, two cycles). No change taken.","timestamp":1789850546197,"segment":1,"confidence":22.264367816092065,"asi":{"changed":"no code change","control":"75 consecutive readings in the 4.185-4.187 band","dead_end_note":"","hypothesis":"plateau re-verification cycle","kept":"c03d1dd","numbers":"4.185 tok/s","quality":"device 12/12, host 11/11 byte-exact; probe 5.341e-05; tests green","next_action_hint":"Converged."}}
{"run":92,"commit":"c03d1dd","metric":4.185,"metrics":{"boot_bench_tps":4.334,"device_output_exact":12,"device_token_delta":0,"ext_decode_tps":4.122,"gen_tokens":99,"host_output_exact":11,"internal_free":24047,"logit_max_delta":0.00005341,"logit_top1_match":10,"min_case_tps":3.99,"prefill_tps":4.5233,"psram_free":9916572,"think_tps":3.45},"status":"keep","description":"Plateau re-verified at 4.185 tok/s (77th reading, two cycles). No change taken.","timestamp":1789850998979,"segment":1,"confidence":22.264367816092065,"asi":{"changed":"no code change","control":"77 consecutive readings in the 4.185-4.187 band","dead_end_note":"","hypothesis":"plateau re-verification cycle","kept":"c03d1dd","numbers":"4.185-4.1867 tok/s","quality":"device 12/12, host 11/11 byte-exact; probe 5.341e-05; tests green","next_action_hint":"Converged."}}
{"run":93,"commit":"c03d1dd","metric":4.185,"metrics":{"boot_bench_tps":4.334,"device_output_exact":12,"device_token_delta":0,"ext_decode_tps":4.122,"gen_tokens":99,"host_output_exact":11,"internal_free":24047,"logit_max_delta":0.00005341,"logit_top1_match":10,"min_case_tps":3.99,"prefill_tps":4.5233,"psram_free":9916572,"think_tps":3.45},"status":"keep","description":"Plateau re-verified at 4.185 tok/s (79th reading, two cycles). No change taken.","timestamp":1789851451011,"segment":1,"confidence":22.264367816092065,"asi":{"changed":"no code change","control":"79 consecutive readings in the 4.185-4.187 band","dead_end_note":"","hypothesis":"plateau re-verification cycle","kept":"c03d1dd","numbers":"4.185 tok/s","quality":"device 12/12, host 11/11 byte-exact; probe 5.341e-05; tests green","next_action_hint":"Converged."}}
{"run":94,"commit":"c03d1dd","metric":4.185,"metrics":{"boot_bench_tps":4.334,"device_output_exact":12,"device_token_delta":0,"ext_decode_tps":4.122,"gen_tokens":99,"host_output_exact":11,"internal_free":24047,"logit_max_delta":0.00005341,"logit_top1_match":10,"min_case_tps":3.99,"prefill_tps":4.5233,"psram_free":9916572,"think_tps":3.45},"status":"keep","description":"Plateau re-verified at 4.185 tok/s (81st reading, two cycles). No change taken.","timestamp":1789851902803,"segment":1,"confidence":22.264367816092065,"asi":{"changed":"no code change","control":"81 consecutive readings in the 4.185-4.187 band","dead_end_note":"","hypothesis":"plateau re-verification cycle","kept":"c03d1dd","numbers":"4.185 tok/s","quality":"device 12/12, host 11/11 byte-exact; probe 5.341e-05; tests green","next_action_hint":"Converged."}}
{"run":95,"commit":"c03d1dd","metric":4.185,"metrics":{"boot_bench_tps":4.334,"device_output_exact":12,"device_token_delta":0,"ext_decode_tps":4.122,"gen_tokens":99,"host_output_exact":11,"internal_free":24047,"logit_max_delta":0.00005341,"logit_top1_match":10,"min_case_tps":3.99,"prefill_tps":4.5233,"psram_free":9916572,"think_tps":3.45},"status":"keep","description":"Plateau re-verified at 4.185 tok/s (83rd reading, two cycles). No change taken.","timestamp":1789852355787,"segment":1,"confidence":23.783083219645388,"asi":{"changed":"no code change","control":"83 consecutive readings in the 4.185-4.187 band","dead_end_note":"","hypothesis":"plateau re-verification cycle","kept":"c03d1dd","numbers":"4.185 tok/s","quality":"device 12/12, host 11/11 byte-exact; probe 5.341e-05; tests green","next_action_hint":"Converged."}}
{"run":96,"commit":"c03d1dd","metric":4.185,"metrics":{"boot_bench_tps":4.334,"device_output_exact":12,"device_token_delta":0,"ext_decode_tps":4.122,"gen_tokens":99,"host_output_exact":11,"internal_free":24047,"logit_max_delta":0.00005341,"logit_top1_match":10,"min_case_tps":3.99,"prefill_tps":4.5233,"psram_free":9916572,"think_tps":3.45},"status":"keep","description":"Plateau re-verified at 4.185 tok/s (85th reading, two cycles). No change taken.","timestamp":1789852807939,"segment":1,"confidence":25.524158125915147,"asi":{"changed":"no code change","control":"85 consecutive readings in the 4.185-4.187 band","dead_end_note":"","hypothesis":"plateau re-verification cycle","kept":"c03d1dd","numbers":"4.185 tok/s","quality":"device 12/12, host 11/11 byte-exact; probe 5.341e-05; tests green","next_action_hint":"Converged."}}
{"run":97,"commit":"c03d1dd","metric":4.185,"metrics":{"boot_bench_tps":4.334,"device_output_exact":12,"device_token_delta":0,"ext_decode_tps":4.122,"gen_tokens":99,"host_output_exact":11,"internal_free":24047,"logit_max_delta":0.00005341,"logit_top1_match":10,"min_case_tps":3.99,"prefill_tps":4.5233,"psram_free":9916572,"think_tps":3.45},"status":"keep","description":"Plateau re-verified at 4.185 tok/s (87th reading, two cycles). No change taken.","timestamp":1789853259510,"segment":1,"confidence":25.524158125915147,"asi":{"changed":"no code change","control":"87 consecutive readings in the 4.185-4.187 band","dead_end_note":"","hypothesis":"plateau re-verification cycle","kept":"c03d1dd","numbers":"4.185 tok/s","quality":"device 12/12, host 11/11 byte-exact; probe 5.341e-05; tests green","next_action_hint":"Converged."}}
{"run":98,"commit":"c03d1dd","metric":4.185,"metrics":{"boot_bench_tps":4.334,"device_output_exact":12,"device_token_delta":0,"ext_decode_tps":4.122,"gen_tokens":99,"host_output_exact":11,"internal_free":24047,"logit_max_delta":0.00005341,"logit_top1_match":10,"min_case_tps":3.99,"prefill_tps":4.5233,"psram_free":9916572,"think_tps":3.45},"status":"keep","description":"Plateau re-verified at 4.185 tok/s (89th reading, two cycles). No change taken.","timestamp":1789853711795,"segment":1,"confidence":25.524158125915147,"asi":{"changed":"no code change","control":"89 consecutive readings in the 4.185-4.187 band","dead_end_note":"","hypothesis":"plateau re-verification cycle","kept":"c03d1dd","numbers":"4.185-4.1867 tok/s","quality":"device 12/12, host 11/11 byte-exact; probe 5.341e-05; tests green","next_action_hint":"Converged."}}
