{"run":413,"commit":"a6e7454","metric":5.1167,"metrics":{"boot_bench_tps":5.162,"device_output_exact":20,"device_token_delta":0,"ext_decode_tps":5.0423,"gen_tokens":99,"host_output_exact":19,"internal_free":12855,"logit_max_delta":0.00005341,"logit_top1_match":10,"min_case_tps":4.88,"prefill_tps":5.4,"psram_free":2052252,"think_tps":3.99},"status":"keep","description":"Three screens landed; accepted runtime unchanged at 5.1167 (secondaries are the accepted run's - all three images were diagnostic: two profiled, one kbench, so no speed claim). BOARD 1, KB LOG (device microbenchmark, and first its own control: it reproduced KB EXP 246.02/198.03 = +19.51% against #229's 247.42/198.04, KB DOT 138/403/213 exactly as #230, KB DIV 7.95/30.92 exactly as #338, cycles/us 23999). RESULT: libm logf costs 23.13 cycles/call in the field-mixed set and 22.63 excluding exact ones, against a 1.09-cycle multiply floor - i.e. ~22 net, not the 150-420 the ledger assumed when it banked the logf(1.0f) skip. With the host-measured 1,280 logf/token and a 0.1361 exactly-one share (my own counter, confirming the inherited 13.58%), the skip buys 174 x (22.6-4) = 3,236 cycles = +0.007%. CLOSED on measurement, and run #294's conclusion stands even though its cost figure did not. THE GENERAL FINDING is the third in a row and it retires a whole family: measured per-call costs here are ~8 cycles (__divsf3, #338), ~22 (logf, now), 0 for an IRAM-to-flash callee crossing (#385) - so no call-removal lever in this model can exceed ~0.03%, which closes the 'replace or hoist a libm call' line for good (#294, #336, #338, #368 all sized it from assumption). My own printed summary line on that bench was wrong twice over (a whole-run count used as a per-token divisor, and a threshold 4x too large: 0.2% of a 193 ms token is 92,640 cycles at 240 MHz, not 386,000); decisions were taken from the per-field cycle columns and the error is disclosed, not edited away. BOARD 3: ND_P_TAPS split three ways - of-taps:q 2.4 ms, k 0.4, v 0.5, so q is 73% of the phase, and q's 0.3 ms/layer over 9 taps x 288 columns is 27.8 cycles per MAC, which matches cold-line delivery almost exactly (10,368 B of staged tap table = 162 lines x ~300 cycles = 48,600 of 72,000 cycles); the tables are 221 KB/token against a 64 KB cache so they cannot be made resident - #302's 'scattered-read floor' claim now has a number on it, and the next step is a resident-tap-table control to prove the diagnosis rather than argue it. BOARD 2: request-path harvest rc=0, whole block 157.1 (bench) / 174.1 (tools) / 206.0 (route) ms with attn-stage 99.1/107.5/131.5 and proj2bit 86.3/99.0/110.9 - this kills my own queued '59 ms unexplained inside attn-stage' worry, because attn-stage contains the q/k/v/gate GEMVs that proj2bit also counts, so the phases overlap and subtracting them is meaningless (#344's rule); route's extra attention is the longer context (#145). Also recorded: the sampler's request-path logits4 is 3.8/7.0 ms against a 0.23 ms projection, the largest remaining unattributed per-request block.","timestamp":1790216997649,"segment":1,"confidence":19.34201012292117,"asi":{"board1_reproduced_published_numbers":"before trusting its new number: KB EXP pair 246.02/198.03 = +19.51% (vs #229's 247.42/198.04, +19.96%), KB DOT 138/403/213 = #230 exactly, KB DIV 7.95/30.92 = #338 exactly, cycles_per_us 23999. A bench that reproduces three published numbers to the digit is a bench whose new number can be believed.","finding_library_call_cost":"GENERALISABLE: measured per-call library costs in this build are ~8 cycles (ROM __divsf3, #338), ~22 cycles (libm logf, here), 0 cycles for an IRAM-to-flash callee crossing (#385). With 1,280 logf and ~10k divides per token, NO call-removal lever in this model can exceed ~0.03% at any realisation rate. This quantitatively closes the whole 'replace or hoist a libm call' family, which the ledger has kept re-opening (#294's logf break-even, #336's callee placement, #338's divider, #368's lrintf ceiling).","logf_measured":"KB LOG cyc_per_logf: field_mixed 23.13, non_one_only 22.63, mul_floor 1.09 (so ~22 net). Operands: 18/128 exact ones (share 0.1406, matching the host's 0.1361). Skip gain = 174 x (22.6-4) = 3,236 cycles = 0.0135 ms = +0.007% - dead on measurement, not on assumption.","own_unit_bug":"my KB LOG OPERANDS line printed 'skip_gain_cyc=3997 (need >386000 to ship)' where 3997 divided the whole-run count into the threshold instead of the per-token count, and 386,000 was 4x the correct 0.2%-of-token figure (92,640 cycles at 240 MHz over 193 ms). Decision made from the per-field cyc/logf columns, which are the authority in this harness; the wrong summary line is the campaign's sixth instance of a misleading printed summary and is left disclosed, not silently edited.","next1":"q-taps is the biggest remaining delivery number: 2.4 of the 3.3 ms taps phase (73%), 0.3 ms/layer = 72,000 cycles for 9 taps x 288 columns = 2,592 MACs = 27.8 cycles per MAC. That is exactly cold-line delivery: 10,368 B of staged tap table per layer = 162 64-byte lines x ~300 cycles = 48,600 cycles, i.e. 68% of the phase, and the tap tables are 221 KB/token against a 64 KB cache, so they cannot be made resident. Confirm the arithmetic on device with a tap-table-resident control (copy one layer's 10 KB into internal SRAM and re-measure, the #330/#350 method) - if it returns ~40% the delivery diagnosis is proven and the family closes with a number instead of an argument.","next2":"Owner decision list is unchanged and is now the only route above the bar: the radix-4 fusion (+0.58%, seven agreeing readings, zero divergences, zero RAM cost) is blocked purely because the 20-case single-session device gate is unreachable under the measured 16-20 request per-boot ceiling; phi row residency needs ~18 KB/core vs 12,855 B (#293's assertion-level RAM); 120 MHz is vendor-blocked (#331).","next3":"If a board and a clean session are ever available, the cheapest untried bit-exact idea left in the sampler is the request-path `logits4` phase: real requests measure 3.8 ms (tools) and 7.0 ms (route) where the projection itself is 0.23 ms at mean_n 6.7, so ~3.5-6.8 ms/token sits in what surrounds the call (prepare, pointer math, per-request state), and unlike the bench it is a real per-request cost with a 2-3.5% share.","request_table":"board 2 request-path harvest, same profiled image, rc=0: bench 157.1 / tools 174.1 / route 206.0 ms whole block; attn-stage 99.1 / 107.5 / 131.5; proj2bit 86.3 / 99.0 / 110.9; sample 0 / 4.4 / 7.5; logits4 0 / 3.8 / 7.0. The '59 ms unexplained inside attn-stage' worry is resolved by the tables: attn-stage contains the q/k/v/gate GEMVs that proj2bit also counts, so the phases overlap and subtraction is meaningless (#344's rule). Route's extra ~24 ms of attn-stage over tools is the longer context (#145), not a defect.","taps_split":"board 3: of-taps:q 2.4 ms (1.2%), of-taps:k 0.4, of-taps:v 0.5 - q is 73% of the phase. So ND_P_TAPS is fully attributed and the q table is where any gain would live.","harness":"Lane scripts as files instead of nested quotes fixed the third quoting death; provenance expectations now computed from the applied worker tree with measure.sh's own glob (a hand-computed composite omitted a second header and would have false-aborted). Board 1's console leg stays suspect (node re-creations) so the kbench harvest read the JTAG leg via the wrapper's own FLASH_PORT, and bench code remains behind ND_KB_EXP38 (default 0), which cannot affect a shipping image (#330 precedent)."}}
{"run":414,"commit":"a6e7454","metric":5.02,"metrics":{"boot_bench_tps":5.162,"device_output_exact":20,"device_token_delta":0,"ext_decode_tps":5.0423,"gen_tokens":99,"host_output_exact":19,"internal_free":12855,"logit_max_delta":0.00005341,"logit_top1_match":10,"min_case_tps":4.79,"prefill_tps":5.2933,"psram_free":2052252,"think_tps":3.99},"status":"discard","description":"tap16 - qkv tap tables un-staged from fp32 to fp16, converted at use: MEASURED, -1.89 %, REJECTED (decode 5.0200 vs accepted 5.1167; prefill 5.2933 = -1.97 %; min_case 4.79 vs 4.88; gen_tokens 99 and every case's token count identical, so a pure speed verdict, not a quality one). Premise came from the phase split I measured one iteration earlier: of-taps:q is 2.4 ms/token and works out at 27.8 cycles per MAC, which a line-count model attributed to 162 cold 64 B lines per layer (68 % of the phase), so storing the three tap slots as the halfwords the archive already holds should have halved the delivery cost while feeding the MAC the identical float (host: 19/19 byte-exact, token_delta 0, fidelity 5.341e-05 identical, top1 10/10, checks rc=0, before any flash; also frees ~110 KB PSRAM). The candidate refutes its own diagnosis: the tap tables are NOT cold - 10 KB per projection fits the 64 KB data cache and stays warm across the 9-tap sweep - so the phase's cost is the history write and strided history read, not weight delivery, and the conversion cost is all downside. This is now a two-sided bracket on run #2's fp32-staging insight (+99.9 %): even a loop measured at 27.8 cycles per MAC is not worth un-staging. Reverted; engine verified byte-identical to a6e7454 (md5 5c646468b78f). Carried (not readings on this image): ext/think/boot-bench/internal_free/psram/device-exact/fidelity/top1 - the lane's tail groups were still running when the verdict became certain on the primary group, and the accepted values are stated as carried. Also this iteration: condv16 (same class, cond_v as fp16) host-proven 19/19 byte-exact and launched on board 3 - kept distinct because cond_rows is a single-accumulator reduction that cannot be vectorised without reassociating, so it has no vector form to lose, its reads are stride-8 (2 useful floats per line), and runs #380/#381 measured it as load-bound independently. Off-device closure at zero board cost: the engram's eg_taps_f tables are ~9 KB/token against the qkv taps' 221 KB, so the same lever there is ~+0.02 % and was never built. Harness: .auto/lane_cand.sh added (absolute-path apply, provenance computed from the applied tree, diagnostic switches cleared, kbench.c restored from the accepted commit); I re-introduced run #331's exact set -e bug while fixing the signature read and caught it by testing both branches instead of shipping it; and harness fixes in main's .auto/measure.sh do not affect lanes until workers sync.","timestamp":1790218212152,"segment":1,"confidence":19.34201012292117,"asi":{"candidate":"tap16: the three qkv tap tables in the staged fp32 pool kept as the fp16 halfwords the archive already holds (slots 4/5/6), converted at use by nd_f16 in tap_rows. Bit-exact by construction and host-proven before any flash: 19/19 byte-exact, token_delta 0, fidelity 5.341e-05 identical, top1 10/10, checks.sh rc=0. Also frees ~110 KB of PSRAM.","diagnosis_refuted":"My cold-line diagnosis for the taps phase is REFUTED by the candidate itself. The model said 162 cold 64 B lines per layer ~= 48,600 of the phase's 72,000 cycles (68%), so halving those bytes should have paid. It took -1.9%. So the tap tables were NOT cold - 10 KB of table per projection fits the 64 KB data cache and stays warm across the 9-tap sweep - and the phase's 27.8 cycles per MAC is dominated by something else (the history write and the strided history read), not by delivering the weights. Second delivery diagnosis today to die to a real candidate rather than to argument.","general_bracket":"Now measured on BOTH sides: run #2 (fp32 staging, +99.9%) said converting per element costs more than the bytes saved; this says the same thing for a loop that measured at 27.8 cycles per MAC, i.e. even a nominally delivery-bound staged table is not worth un-staging on this core. Do not propose fp16-ification of a staged table again without naming why the reader cannot keep it warm.","loop_shape_keeps_condv16_distinct":"tap_rows is a column loop whose inner dimension is 9 independent products - vectorisable with 32-bit loads, and a uint16 load plus conversion destroys that. cond_rows is a single-accumulator 768-term reduction that CANNOT be vectorised without reassociating (which the byte-exact gate refuses), so there is no vector form to lose, and its reads are stride-8-float (2 useful floats per 64 B line, 4 as fp16). Runs #380/#381 measured cond_rows as bound by these strided loads independently of my inference. Priors are worse after tap16, which is why it is one board and not a batch.","next1":"Read condv16 on board 3 (engine_md5 15bcbfde0e14, src_md5 7e7989a788b8, host-proven 19/19 byte-exact). If it also loses, the whole 'un-stage a table to fp16' family closes at zero wins and run #2's staging decision is confirmed from the only direction it had never been tested.","next2":"Owner decisions, unchanged and still the only above-bar routes: radix-4 fusion (+0.58%, seven agreeing readings, zero divergences, zero RAM cost) blocked only by the unreachable 20-case single-session device gate under the 16-20 request per-boot ceiling; phi row residency (~18 KB/core vs 12,855 B, #293's assertion-level RAM); 120 MHz vendor-blocked (#331).","next3":"Off-device closures earned this window, keep doing these: eg_taps_f (the engram tap tables) is ~9 KB/token against the qkv taps' 221 KB, so the same fp16 lever there prices at ~+0.02% and was never built. The remaining staged tables are cond_u (read channel-major already), d1/d2/b2/d3/d4 and the norm scales (all small or read once per element with the element loop already at the arithmetic floor).","harness":"Three harness items: (1) .auto/lane_cand.sh added - applies a candidate by absolute path, computes EXPECT_ENGINE_MD5 from the APPLIED worker tree, deletes leftover diagnostic switches before measuring, and restores kbench.c from the accepted commit so bench edits cannot ride along. (2) I re-introduced run #331's exact bug while fixing the signature - a `[ -f f ] && cmd` list under set -euo pipefail kills the run silently - caught by testing both branches rather than by shipping it; the replacement uses plain if statements and is proven absent-then-present. (3) Harness fixes land in main's .auto/measure.sh but the workers run THEIR OWN copy at head=a6e7454, so a fix does not apply to a lane until the worker syncs; that is why the diag_build_cfg warning still prints in lane logs. Not a correctness problem for these two candidates (both non-diagnostic, value empty either way), but it means worker sync is part of deploying a harness fix.","in_flight":"board 3 = condv16 (building). board 2 = tap16's suite still finishing its extended/think groups; its primary-group verdict is final (-1.9% on every monitor, identical token counts) and main was already reverted to a6e7454 (md5 5c646468b78f verified), so the lane measures a rejected candidate to completion and adds only secondaries."}}
