{"run":692,"commit":"47d0d54","metric":5.9617,"metrics":{"boot_bench_tps":6.069,"device_output_exact":18,"device_token_delta":52,"ext_decode_tps":5.8915,"gen_tokens":99,"host_output_exact":0,"internal_free":2087,"logit_max_delta":0,"logit_top1_match":0,"min_case_tps":5.74,"prefill_tps":6.2833,"psram_free":2062492,"think_tps":4.6},"status":"keep","description":"Wide delivery for the mHC lane mix (E64 on B2) - the campaign's biggest single lever since P.V, and the first one found in a phase that was never asked to be widened. The shipped body is five read-modify-write passes per output lane over d_model floats (init dst[i] = hpost[k]*u[i], then four passes of dst[i] += w*src[i] over the four input lane rows): contiguous rows, one madd per cell, no accumulator chain, and the compiler cannot keep dst in registers across the passes. Two kernels - nd_mul4w for the initialiser and nd_lanemix4w for each accumulation pass - move four cells per 128-bit load/store pair with the same single madd per cell and the same pass order, so the values are bit-identical (device selftest 64/64). FULL 20-case gate: decode 5.9617 vs the 5.9033 full-gate base = +0.99%, ext 5.8915 (+0.99%), think 4.6, prefill 6.2833, min_case 5.74, boot 6.069, 18/20 with token_delta 52 = the two #647 goldens only. New campaign best, 5.9617 = +12.41% over the owner's 5.3033 pin. Two integration defects were caught by the campaign's own discipline before any number was believed: the kernels first used the 3-argument P.V call convention (w and the loop count read from the wrong registers - the board wedged during priming), and the acceptance test first ran lazily inside the worker so BOTH cores could execute it at once and corrupt its shared buffers (two different bad counts in one boot); moving the verdict to nd_model_open, which is single-threaded, fixed it and the same kernels then read bad=0.","timestamp":1790335500350,"segment":1,"confidence":12.879619465788519}
{"run":693,"commit":"4599dac","metric":5.7017,"metrics":{"boot_bench_tps":5.801,"device_output_exact":6,"device_token_delta":0,"ext_decode_tps":0,"gen_tokens":99,"host_output_exact":0,"internal_free":4191,"logit_max_delta":0,"logit_top1_match":0,"min_case_tps":5.45,"prefill_tps":5.9517,"psram_free":2062492,"think_tps":0},"status":"keep","description":"Cross-base confirmation of the mHC lane-mix wide delivery (E64 ported to the shippable line, B1): decode 5.7017 on a restricted screen against this board's same-mode screen base 5.6600 = +0.74%, boot 5.801, 6/6 device exact, LANEMIX selftest 64/64 and the boot line proves the dispatch is live (kron1=1 fwht4r=1 lanemix=1). The same lever therefore pays on both stacks (+0.99% on the seed line's full gate, +0.74% here), which is the signature of a real delivery win rather than a base artifact. B1's tree is now shippable + notif + wide P.V + wide kron1 + FWHT radix-4 + lane mix; its FULL 20-case gate and host gates are owed before this line can claim the number, and the next lane on B1 should be that promotion.","timestamp":1790335512370,"segment":1,"confidence":12.879619465788519}
{"run":694,"commit":"9e12fab","metric":5.7,"metrics":{"boot_bench_tps":5.801,"device_output_exact":18,"device_token_delta":52,"ext_decode_tps":5.64,"gen_tokens":99,"host_output_exact":0,"internal_free":4191,"logit_max_delta":0,"logit_top1_match":0,"min_case_tps":5.5,"prefill_tps":5.9967,"psram_free":2062492,"think_tps":4.44},"status":"keep","description":"FULL GATE of the shippable line with the lane-mix wide delivery (B1, engine 6589b899ced3): decode 5.7000, ext 5.6400, think 4.44, min_case 5.50, boot 5.801, 18/20 with the two #647 demo-timer goldens only. Against this line's own 5.6483 pin the lane mix is +0.92% on breadth (the restricted screen had read 5.7017 = +0.74% against its same-mode screen base, so the two modes agree here within a fifth of a percent). The shippable line now carries wide P.V + wide kron1 + FWHT radix-4 + lane mix and stands at 5.7000 = +7.48% over the owner's 5.3033 pin, with the seed line at 5.9617 (+12.41%). The same mix lever pays on both stacks (+0.99% seed full gate, +0.92% shippable full gate), which is the strongest cross-base agreement any lever in this campaign has shown.","timestamp":1790336216561,"segment":1,"confidence":12.879619465788519}
{"run":695,"commit":"4599dac","metric":5.71,"metrics":{"boot_bench_tps":5.808,"device_output_exact":6,"device_token_delta":0,"ext_decode_tps":0,"gen_tokens":99,"host_output_exact":0,"internal_free":4191,"logit_max_delta":0,"logit_top1_match":0,"min_case_tps":5.51,"prefill_tps":5.9517,"psram_free":2062492,"think_tps":0},"status":"discard","description":"Wide lanepre reduction (E67 on B1) - VALID but BELOW THE SOLO BAR, banked. The mHC lane pre-mix is one serial chain per column (acc = 0; acc += hpre[j]*lane[j*dm+i] for four lanes), so four columns walk together with four row pointers advancing 16 bytes per tile: 4 loads + 16 madds + 1 store per four columns against 16 loads + 16 madds + 4 stores scalar, same per-column j order and one madd per term. Device: LANEPRE selftest 64/64 (multi-tile N=16 with a canary row past the four rows, which is what covers the row-pointer scheme), dispatch live (lanepre=1), 6/6 exact, delta 0, decode 5.7100 vs this board's same-mode 5.7017 = +0.146%. Below the 0.2% bar, so it is banked rather than claimed: no standalone repeat and no full gate. Two draft defects were caught before flashing - the kernel advanced ONE row pointer across four dm strides per tile (walking off row 3 after tile 1: fixed with four independent row pointers) and it 128-bit-loaded hpre, which is a stack array (fixed with scalar weight loads) - both found by review and by the multi-tile selftest, not by the board.","timestamp":1790337292978,"segment":1,"confidence":12.879619465788519}
{"run":696,"commit":"de2a987","metric":5.7583,"metrics":{"boot_bench_tps":5.859,"device_output_exact":6,"device_token_delta":0,"ext_decode_tps":0,"gen_tokens":99,"host_output_exact":0,"internal_free":14167,"logit_max_delta":0,"logit_top1_match":0,"min_case_tps":5.55,"prefill_tps":5.9517,"psram_free":2062492,"think_tps":0},"status":"keep","description":"nx/xh lifetime (E68 on B1): the lane RMS now emits straight into xh - the phi prepare's own output buffer - and nd_cq_prepare skips the copy when its input and output are the same pointer, so the 12,288 B per-layer memcpy (8 per token, ~98 KB) disappears with identical arithmetic: the same rms_unit writes the same values to a different address, and the pad plus FWHT that follow are untouched. nx is retired consistently (allocation, null check, free), which returns 12,288 B of internal SRAM. Measured on B1: decode 5.7583 vs this board's same-mode 5.7100 screen = +0.85%, boot 5.859 vs 5.808, min_case 5.55, 6/6 device exact, and internal_free 4191 -> 14167 = +9,976 B. The boot line also proves the two things the source audit predicted: lane_align=0 xh_align=0, so the RMS emit's wide path is now live - E66 measured a null earlier precisely because the destination nx was never 16-byte aligned and the guard silently kept the C loop. This is a composition of the memcpy removal and the emit becoming live, judged as one measured change.","timestamp":1790337810254,"segment":1,"confidence":12.879619465788519}
{"run":697,"commit":"70e4392","metric":5.9917,"metrics":{"boot_bench_tps":6.099,"device_output_exact":6,"device_token_delta":0,"ext_decode_tps":0,"gen_tokens":99,"host_output_exact":0,"internal_free":12531,"logit_max_delta":0,"logit_top1_match":0,"min_case_tps":5.77,"prefill_tps":6.215,"psram_free":2062492,"think_tps":0},"status":"keep","description":"nx/xh lifetime on the seed line (E68 ported to B2, the unmeasured E65 tile disabled so the delta is clean against the 5.9617 pin): the lane RMS emits into xh and the phi prepare skips its self-copy, nx retired. decode 5.9917 = +0.50% (boot 6.099 vs 6.069, min_case 5.77, 6/6 exact), internal_free 2087 -> 12531 = +10,444 B. Together with B1's +0.85% the lifetime change is now confirmed on both stacks with a ~10 KB internal-SRAM refund on each; the seed line stands at 5.9917 = +12.96% over the owner's 5.3033 pin on a restricted screen (full gate owed). E65's tiled mix remains UNMEASURED - its lane never completed a handshake - and is compiled but disabled on this tree, so this number contains no unmeasured lever.","timestamp":1790338365352,"segment":1,"confidence":12.989388949871941}
{"run":698,"commit":"6ef9592","metric":5.9917,"metrics":{"boot_bench_tps":6.1,"device_output_exact":18,"device_token_delta":52,"ext_decode_tps":5.9215,"gen_tokens":99,"host_output_exact":0,"internal_free":15607,"logit_max_delta":0,"logit_top1_match":0,"min_case_tps":5.77,"prefill_tps":6.215,"psram_free":2062492,"think_tps":4.61},"status":"keep","description":"FULL GATE of the campaign-best seed line, carrying the nx/xh lifetime change plus the dequant row-copy elimination (B2, engine 31e8d04c8120): decode 5.9917, ext 5.9215, think 4.61, min_case 5.77, boot 6.10, 18/20 with token_delta 52 = the two #647 demo-timer goldens only. Against this line's pre-E68 full gate (5.9617) the lifetime change is +0.50% on breadth, matching its restricted screen exactly, and the line is now +12.96% over the owner's 5.3033 pin with device breadth evidence; its host gates are still owed on this tree. The image also contains E69, which is a NULL on speed (5.9917 identically, as predicted - the copy it removes is ~19 KB/token) but a real resource win: dequant now writes straight into its destination and `m->row` is retired, taking internal_free from 12,531 to 15,607 B (+3,076 B, one more 768-float scratch row gone). Two lifetime defects have now been removed by asking one question - who owns this buffer, and does anything need the copy? - and the second one was found by auditing the same pattern in nd_cq_dequant_row.","timestamp":1790339003430,"segment":1,"confidence":12.989388949871941}
{"run":699,"commit":"e9c7c11","metric":5.7583,"metrics":{"boot_bench_tps":5.859,"device_output_exact":18,"device_token_delta":52,"ext_decode_tps":5.6946,"gen_tokens":99,"host_output_exact":0,"internal_free":14167,"logit_max_delta":0,"logit_top1_match":0,"min_case_tps":5.55,"prefill_tps":5.9517,"psram_free":2062492,"think_tps":4.47},"status":"keep","description":"FULL GATE of the shippable line with the nx/xh lifetime change (B1, engine 0f0d3668d71f): decode 5.7583, ext 5.6946, think 4.47, min_case 5.55, internal_free 14167, 18/20 with the two #647 demo-timer goldens only. Against this line's 5.7000 pre-E68 full gate the lifetime change is +0.85% on breadth - the restricted screen read the same 5.7583 - and it reproduces the +0.50% the same change gave on the seed line, so the family is confirmed on both stacks with breadth evidence on each. The shippable line now stands at 5.7583 = +8.58% over the owner's 5.3033 pin (device breadth complete; host gates owed on this tree).","timestamp":1790339518949,"segment":1,"confidence":12.989388949871941}
{"run":700,"commit":"4599dac","metric":6.0017,"metrics":{"boot_bench_tps":6.109,"device_output_exact":6,"device_token_delta":0,"ext_decode_tps":0,"gen_tokens":99,"host_output_exact":0,"internal_free":15607,"logit_max_delta":0,"logit_top1_match":0,"min_case_tps":5.78,"prefill_tps":6.215,"psram_free":2062492,"think_tps":0},"status":"discard","description":"Tiled mix (E65) finally priced on B2 with its REPAIRED oracle: +0.17%, valid but sub-bar, banked. The kernel keeps the four-cell tile of dst in registers across all four input lane rows - one u load, four weight madds, four src loads and ONE store per tile instead of E64's five read-modify-write passes - with the same per-cell statement order (dst = hpost*u, then += w_j*src_j for j ascending), so it is bit-exact. Device: LANEMIXROW selftest 64/64 (four ordered FMAs over four DISTINCT strided rows - the first draft pre-summed the weights into (w+w+w+w), a different expression, and the test caught it), dispatch live (lanemix_row=1), 6/6 exact, decode 6.0017 vs the 5.9917 base, boot 6.109 vs 6.10, min_case 5.78. This is the campaign's first reading above 6.0 tok/s. Below the 0.2% bar on its own, so it is banked like E67 rather than claimed with a repeat or a full gate.","timestamp":1790339536407,"segment":1,"confidence":12.989388949871941}
{"run":701,"commit":"6745a5c","metric":6.015,"metrics":{"boot_bench_tps":6.121,"device_output_exact":6,"device_token_delta":0,"ext_decode_tps":0,"gen_tokens":99,"host_output_exact":0,"internal_free":14991,"logit_max_delta":0,"logit_top1_match":0,"min_case_tps":5.79,"prefill_tps":6.215,"psram_free":2062492,"think_tps":0},"status":"keep","description":"Composition of the two banked sub-bar halves of the mHC lane phase (E65 tiled mix + E67 wide lanepre, B2): decode 6.0150 against the E65-only 6.0017 = +0.22% increment, and +0.39% against this line's E64-only 5.9917 pin - so the pair clears the 0.2% bar together although each half was sub-bar alone (E67 +0.146% on B1, E65 +0.17% here), the same pattern that shipped run #371's bundle. Both acceptance tests pass on device (LANEMIXROW 64/64 with four ordered FMAs over four distinct strided rows, LANEPRE 64/64 multi-tile with a canary row) and both dispatches are proven live (lanemix_row=1 lanepre=1); 6/6 device exact, boot 6.121 vs 6.109, min_case 5.79, internal_free 14,991 (the lanepre test's small slabs cost ~600 B of the 15,607 the seed line had). New campaign best 6.0150 tok/s.","timestamp":1790339992619,"segment":1,"confidence":13.074643249176734}
{"run":702,"commit":"4599dac","metric":5.7583,"metrics":{"boot_bench_tps":5.859,"device_output_exact":18,"device_token_delta":52,"ext_decode_tps":5.6946,"gen_tokens":99,"host_output_exact":19,"internal_free":14167,"logit_max_delta":0.00005341,"logit_top1_match":10,"min_case_tps":5.55,"prefill_tps":5.9517,"psram_free":2062492,"think_tps":4.47},"status":"keep","description":"Host quality gates on the shippable line's lifetime tree (B1, engine 0f0d3668d71f, 5.7583 full gate): host_output_exact 19/19, host_token_delta 0, logit_max_delta 5.341e-05 (identical to the accepted pin), logit_top1_match 10/10, fidelity 10/10. The shippable line therefore carries device breadth (18/20, the two #647 goldens only) and a green host gate on the same tree. Both discovery lines are now fully evidenced except for the seed line's host gates on its newest E65+E67 composition: seed 5.9917 (gated) -> 6.0150 (screen, composition), shippable 5.7583 (gated), each plus host gates on the trees that carry them.","timestamp":1790340053346,"segment":1,"confidence":13.074643249176734}
{"run":703,"commit":"b132b5e","metric":6.0133,"metrics":{"boot_bench_tps":6.121,"device_output_exact":18,"device_token_delta":52,"ext_decode_tps":5.9454,"gen_tokens":99,"host_output_exact":0,"internal_free":14991,"logit_max_delta":0,"logit_top1_match":0,"min_case_tps":5.79,"prefill_tps":6.3433,"psram_free":2062492,"think_tps":4.63},"status":"keep","description":"FULL GATE of the campaign-best line with the mHC lane-phase composition (E65 tiled mix + E67 wide lanepre, B2, engine a003340489c2): decode 6.0133, ext 5.9454, think 4.63, min_case 5.79, prefill 6.3433, boot 6.121, internal_free 14,991, 18/20 with token_delta 52 = the two #647 demo-timer goldens only. Against this line's pre-composition full gate (5.9917) the pair is +0.36% on breadth, matching its restricted screen (6.0150) within a tick, so the composition that each half could not clear alone (+0.146% and +0.17%) is now a kept, breadth-gated lever: 6.0133 = +13.38% over the owner's 5.3033 acceptance pin. The seed line is the campaign's first to hold >6 tok/s through a full 20-case gate.","timestamp":1790340524065,"segment":1,"confidence":13.074643249176734}
{"run":704,"commit":"51f4ee4","metric":6.0133,"metrics":{"boot_bench_tps":6.121,"device_output_exact":18,"device_token_delta":52,"ext_decode_tps":5.9454,"gen_tokens":99,"host_output_exact":19,"internal_free":14991,"logit_max_delta":0.00005341,"logit_top1_match":10,"min_case_tps":5.79,"prefill_tps":6.3433,"psram_free":2062492,"think_tps":4.63},"status":"keep","description":"Host quality gates on the campaign-best seed line (B2, engine a003340489c2, 6.0133 full gate): host_output_exact 19/19, host_token_delta 0, logit_max_delta 5.341e-05 (identical to the accepted pin), logit_top1_match 10/10, fidelity 10/10. With this the seed line's acceptance packet is complete on one tree: device 6.0133 across all 20 cases (18 exact, only the two #647 demo-timer goldens, delta 52), ext 5.9454, think 4.63, host 19/19, fidelity unchanged - 6.0133 = +13.38% over the owner's 5.3033 pin. The shippable line's packet was already complete at 5.7583 (+8.58%) with host 19/19. Both lines now carry the same single outstanding item: the owner's disposition of those two ring-proven cases.","timestamp":1790340996948,"segment":1,"confidence":13.074643249176734}
{"run":705,"commit":"4599dac","metric":5.765,"metrics":{"boot_bench_tps":5.866,"device_output_exact":6,"device_token_delta":0,"ext_decode_tps":0,"gen_tokens":99,"host_output_exact":0,"internal_free":14171,"logit_max_delta":0,"logit_top1_match":0,"min_case_tps":5.56,"prefill_tps":5.9517,"psram_free":2062492,"think_tps":0},"status":"discard","description":"Elementwise cluster (E70 on B1) - valid but sub-bar at +0.12%, banked. Four loops that reduce to the two shapes the mix kernels already implement, each behind the same licence-plus-alignment guard: (a) u -= ublk as dst += (-1)*src with nd_lanemix4w (an exact -1 multiply, so the rounding matches the C subtract), (b) the embedding scale tmp *= escale and (c) pool_cell's rescale ac *= rescale as nd_mul4w, and (d) pool_cell's weighted accumulate ac += w*cell as nd_lanemix4w - the same one-madd-per-cell form the shipped statements use. ublk, tmp and pool_acc were moved to FAST16 allocations so the guards can actually fire (the E66 lesson: an unaligned operand makes a guard silently inert). Device: 6/6 exact, decode 5.7650 vs this board's same-mode 5.7583 = +0.12%, boot 5.866, min_case 5.56, internal_free 14,171. Below the bar alone, so no repeat and no full gate; on the seed line these shapes may pair with something as E65 and E67 did. One assumption was corrected before it cost a board: the attention gate loop is a per-PAIR scale, not a constant, so nd_mul4w does not apply there.","timestamp":1790341010727,"segment":1,"confidence":13.074643249176734}
{"run":706,"commit":"2a459c3","metric":5.7767,"metrics":{"boot_bench_tps":5.877,"device_output_exact":6,"device_token_delta":0,"ext_decode_tps":0,"gen_tokens":99,"host_output_exact":0,"internal_free":14171,"logit_max_delta":0,"logit_top1_match":0,"min_case_tps":5.57,"prefill_tps":5.9517,"psram_free":2062492,"think_tps":0},"status":"keep","description":"mHC lane block composition on the shippable line (E64 + E65 tile + E67 lanepre + E70 elementwise, B1): decode 5.7767 against this board's E64+E67+E70 base 5.7650 = +0.20%, boot 5.877, min_case 5.57, 6/6 device exact, and every dispatch proven live in one boot line (lanemix=1 lanepre=1 row4=1 lane_align=0 xh_align=0). This is the cross-line confirmation of the pair that crossed the bar on the seed line (#701/#703): E65's tiled mix was +0.17% alone and E67's wide lanepre +0.146% alone, and together they are +0.20% here and +0.36% there. The port was done as separate anchored edits after the earlier single-slice attempt dragged an #endif across; one duplicate kernel body also had to be removed (the slice ran to end-of-file and re-copied lanepre4w) - the build caught both, not the board. Shippable line now reads 5.7767 = +8.93% over the owner's 5.3033 pin, with a full gate and host gates owed on this tree.","timestamp":1790341534738,"segment":1,"confidence":13.074643249176734}
{"run":707,"commit":"4599dac","metric":6.0217,"metrics":{"boot_bench_tps":6.129,"device_output_exact":6,"device_token_delta":0,"ext_decode_tps":0,"gen_tokens":99,"host_output_exact":0,"internal_free":14991,"logit_max_delta":0,"logit_top1_match":0,"min_case_tps":5.8,"prefill_tps":6.3433,"psram_free":2062492,"think_tps":0},"status":"discard","description":"Elementwise cluster on the seed line (E70 ported to B2, the campaign-best tree): decode 6.0217 vs the 6.0133 full-gate pin = +0.14%, boot 6.129 vs 6.121, min_case 5.8 vs 5.79, 6/6 exact - the four loops reduce to the mix kernels' two shapes (u -= ublk as dst += (-1)*src, the embedding scale and pool_cell's rescale as nd_mul4w, pool_cell's accumulate as nd_lanemix4w) with ublk/tmp/pool_acc moved to FAST16 so the guards can fire. Banked rather than claimed on its own (sub-bar, no repeat, no full gate), but it is a new best for the seed line at 6.0217 and it reproduces the +0.12% the same cluster gave on the shippable line, so the family is consistent across both stacks. Together with #706 this closes the elementwise/lane-block sweep: every loop in the mHC block that reduces to one of the four kernel shapes is now widened and measured.","timestamp":1790341547696,"segment":1,"confidence":13.074643249176734}
{"run":708,"commit":"803205c","metric":5.7767,"metrics":{"boot_bench_tps":5.877,"device_output_exact":18,"device_token_delta":52,"ext_decode_tps":5.7115,"gen_tokens":99,"host_output_exact":0,"internal_free":14171,"logit_max_delta":0,"logit_top1_match":0,"min_case_tps":5.57,"prefill_tps":5.9517,"psram_free":2062492,"think_tps":4.49},"status":"keep","description":"FULL GATE of the shippable line with the complete lane-block composition (B1, engine bae5184f9ca7): decode 5.7767, ext 5.7115, think 4.49, min_case 5.57, 18/20 with the two #647 demo-timer goldens only. Against this line's pre-composition full gate (5.7583) the E65+E67+E70 additions are +0.32% on breadth - larger than the +0.20% the screen suggested, and consistent with the +0.36% the same pair gave on the seed line. Shippable line now stands at 5.7767 = +8.93% over the owner's 5.3033 pin with device breadth complete; host gates are owed on this exact tree.","timestamp":1790341976772,"segment":1,"confidence":13.074643249176734}
