{"run":541,"commit":"94f2a35","metric":5.3033,"metrics":{"boot_bench_tps":5.621,"device_output_exact":18,"device_token_delta":52,"ext_decode_tps":5.2269,"gen_tokens":99,"host_output_exact":19,"internal_free":8415,"logit_max_delta":0.00005341,"logit_top1_match":10,"min_case_tps":5.31,"prefill_tps":5.59,"psram_free":2052252,"think_tps":4.2},"status":"keep","description":"Board 3's cross-board clean-tree lane is alive and inside its boot/priming phase, and the iteration's real product is a harness fact rather than a measurement: the log held only 5 lines while the tail showed build_s=15 and flash_s=6 with a live bench.py, i.e. the image was flashed and the suite had started, but bench.py's stdout is block-buffered when redirected to a file instead of a tty, so lane logs advance in chunks and a small line count is buffering rather than a stall. I did not read it as a dead lane, and did not restart anything. No reading is available yet - no decode_tps, no device_output_exact, no LANE_RC - so no cross-board claim is made and the acceptance position is unchanged: board 2's clean trace-free verdict at provenance 4d3094578050 reads decode 5.5767 with device_output_exact 18/20, diverging only on heldout_interval_one and heldout_long_tools_note_only, token_delta 52, golden_missing 0, host 19/19, fidelity 5.341e-05. Accepted pin deliberately unchanged at 5.3033; the owner's disposition of those two boot-state-dependent goldens remains the only datum that moves it, and this lane exists to make that decision on two boards with no diagnostic traffic in the compared stream. A cheap follow-up for a free window is to run bench.py unbuffered inside measure.sh so log growth stops being ambiguous.","timestamp":1790270881254,"segment":1,"confidence":18.02457142857145,"asi":{"finding":"Line count is a misleading liveness signal in this harness: board 3's log had 5 lines yet its tail showed build_s=15 and flash_s=6, meaning the image is flashed and bench.py is live. bench.py's stdout is block-buffered when redirected to a file rather than a tty, so its output arrives in chunks and a low line count near the start is buffering, not a stall - which is why #535's byte-growth test is the right check and why I did not conclude 'lane dead' from 5 lines.","hypothesis":"Is the board 3 cross-board clean-tree lane progressing, and is any reading available yet?","next":"Poll for the compare block and decode_tps. Board 2's clean verdict stands meanwhile: 18/20 failing only heldout_interval_one and heldout_long_tools_note_only, token_delta 52, golden_missing 0, at decode 5.5767.","improvement_note":"Cheap harness fix for a future window, deliberately not applied mid-run: run bench.py through stdbuf -oL (or PYTHONUNBUFFERED=1) in measure.sh so lane logs stream line by line and 'log not growing' stops being ambiguous during the five-minute priming."}}
{"run":542,"commit":"94f2a35","metric":5.3033,"metrics":{"boot_bench_tps":5.621,"device_output_exact":18,"device_token_delta":52,"ext_decode_tps":5.2269,"gen_tokens":99,"host_output_exact":19,"internal_free":8415,"logit_max_delta":0.00005341,"logit_top1_match":10,"min_case_tps":5.31,"prefill_tps":5.59,"psram_free":2052252,"think_tps":4.2},"status":"keep","description":"Board 3's cross-board clean-tree session is streaming but has produced no reading yet, so this iteration claims nothing. Its log grew to 7,373 bytes from the few-hundred-byte state at #541, confirming the byte-growth liveness test is the right one given bench.py block-buffers stdout when redirected, while the log still contains no decode_tps, no device_output_exact and no LANE_RC - i.e. the suite is mid-flight and bench.py's compare block, the only admissible byte-exactness evidence per #513, has not been written. Acceptance position therefore unchanged and rests on board 2's clean trace-free reading at provenance 4d3094578050: decode 5.5767 (+5.17 % over the pin), min_case 5.31, boot bench 5.621, internal_free 8,415, device_output_exact 18/20 with the divergence set exactly {heldout_interval_one, heldout_long_tools_note_only}, golden_missing 0, host 19/19 byte-exact, fidelity 5.341e-05. Accepted pin deliberately held at 5.3033: 18/20 is not 20/20, and re-capturing the two goldens to match the firmware would move the quality oracle instead of meeting it, which is the owner's call and not mine.","timestamp":1790270907795,"segment":1,"confidence":18.02457142857145,"asi":{"hypothesis":"Has the board 3 cross-board clean-tree lane produced a reading yet?","next":"Poll bytes again next window; the compare block plus decode_tps are the only admissible lines (#513). Board 2's clean verdict remains the acceptance evidence: 5.5767, 18/20, divergence only on the two boot-state goldens, golden_missing 0, host 19/19, fidelity 5.341e-05.","state":"Not yet - but measurably streaming: the log grew from a few hundred bytes to 7,373 bytes since #541's buffering observation, while still containing no decode_tps, device_output_exact or LANE_RC token. Byte growth is the correct liveness test here precisely because bench.py's stdout is block-buffered to a file (#541), so line counts lie and byte counts do not."}}
{"run":543,"commit":"94f2a35","metric":5.3033,"metrics":{"boot_bench_tps":5.621,"device_output_exact":18,"device_token_delta":52,"ext_decode_tps":5.2269,"gen_tokens":99,"host_output_exact":19,"internal_free":8415,"logit_max_delta":0.00005341,"logit_top1_match":10,"min_case_tps":5.31,"prefill_tps":5.59,"psram_free":2052252,"think_tps":4.2},"status":"keep","description":"Board 3's cross-board clean-tree session is healthy and mid-suite, and a wrong assumption of mine was corrected by measurement rather than left in the ledger. I treated the absence of a decode_tps line after roughly fifty minutes as a possible stall; the log's own tail shows an EVT priming progress line at 48/143 with eta 14 s - reachable only after finishing a group - plus a live bench.py and byte growth from 7,373 to 8,762, so decode_tps is simply emitted later in this harness's ordering than I had assumed. No verdict yet: still no device_output_exact, no DEVICE_OUTPUT_DIVERGED, no LANE_RC, so bench.py's compare block has not been written and no cross-board claim is made. Acceptance evidence remains board 2's clean trace-free reading at provenance 4d3094578050 - decode 5.5767, min_case 5.31, boot bench 5.621, internal_free 8,415, device_output_exact 18/20 with divergences exactly {heldout_interval_one, heldout_long_tools_note_only}, golden_missing 0, host 19/19, fidelity 5.341e-05 - and the accepted pin is deliberately held at 5.3033 pending the owner's disposition of those two boot-state-dependent goldens.","timestamp":1790270944473,"segment":1,"confidence":18.02457142857145,"asi":{"hypothesis":"Board 3's log contains no decode_tps line after ~50 minutes - is that a stall or ordinary progress?","next":"Poll the compare block; board 2's clean reading remains the acceptance evidence (5.5767, 18/20, divergence only on heldout_interval_one and heldout_long_tools_note_only, golden_missing 0, host 19/19, fidelity 5.341e-05). Note for whoever reads next: decode_tps appears late in this log format, so its absence is not a stall signal - the priming progress line is.","stall_test_applied":"Not a stall: the tail is an EVT priming progress line at 48/143 (34 %, eta 14 s), which is only possible after completing a group, and a bench.py process is live. Byte count also rose 7,373 -> 8,762 since #542. The absence of a decode_tps token simply means that line is emitted later in this harness's ordering than I assumed - corrected by looking rather than by inference."}}
{"run":544,"commit":"94f2a35","metric":5.3033,"metrics":{"boot_bench_tps":5.621,"device_output_exact":18,"device_token_delta":52,"ext_decode_tps":5.2269,"gen_tokens":99,"host_output_exact":19,"internal_free":8415,"logit_max_delta":0.00005341,"logit_top1_match":10,"min_case_tps":5.31,"prefill_tps":5.59,"psram_free":2052252,"think_tps":4.2},"status":"keep","description":"Board 3's cross-board clean-tree session delivered its speed reading: decode 5.58 against board 2's 5.5767 on byte-identical trees (provenance 4d3094578050 asserted by the runner on both), so the trace-free stack's +5.2 % over the 5.3033 pin is now a two-board measurement rather than a single-lane one, and the lossless console RX ring stays within one quantisation tick of the no-ring 5.580/5.5817. No byte-exactness verdict yet from this board: the log carries no device_output_exact, no DEVICE_OUTPUT_DIVERGED and no LANE_RC, so bench.py's compare block - the only admissible quality evidence per #513 - has not been written and I claim nothing about the divergence set from board 3. Acceptance position stands on board 2's clean reading (18/20 with divergences exactly {heldout_interval_one, heldout_long_tools_note_only}, token_delta 52, golden_missing 0, host 19/19, fidelity 5.341e-05), and the accepted pin is deliberately held at 5.3033 because 18/20 is not 20/20 and moving the goldens to match the device would change the quality oracle rather than meet it.","timestamp":1790270972933,"segment":1,"confidence":18.02457142857145,"asi":{"cross_board_speed":"Board 3 decode 5.58 vs board 2's 5.5767 - agreement to one quantum on byte-identical trees, so the trace-free stack's +5.2 % over the 5.3033 pin is now a two-board reading, and the console ring remains within one metric tick of the no-ring 5.580/5.5817.","hypothesis":"Has board 3's cross-board clean-tree session produced its decode reading and byte-exactness verdict?","next":"Poll for the compare block. If board 3 also fails only heldout_interval_one and heldout_long_tools_note_only, the owner's decision rests on two boards with no diagnostic traffic in the compared stream; if any other case fails, that is a genuine regression signal and gets investigated before anything else.","verdict_status":"Speed line present, verdict absent: no device_output_exact, no DEVICE_OUTPUT_DIVERGED, no LANE_RC, so bench.py has not written its compare block and no byte-exactness claim is made from board 3 yet."}}
{"run":545,"commit":"94f2a35","metric":5.3033,"metrics":{"boot_bench_tps":5.621,"device_output_exact":18,"device_token_delta":52,"ext_decode_tps":5.2269,"gen_tokens":99,"host_output_exact":19,"internal_free":8415,"logit_max_delta":0.00005341,"logit_top1_match":10,"min_case_tps":5.31,"prefill_tps":5.59,"psram_free":2052252,"think_tps":4.2},"status":"keep","description":"Board 3's compare block has not arrived yet, so this iteration adds no measurement and claims nothing new. The log still carries no device_output_exact, no DEVICE_OUTPUT_DIVERGED, no LANE_RC and no divergence lines, which per #513 is the only admissible byte-exactness evidence in this harness - bench.py writes that block after all twenty cases, so mid-suite absence is not a pass and re-polling it is not a result. The acceptance position is therefore unchanged and already complete on speed: decode 5.5767 (board 2) and 5.58 (board 3) on byte-identical trace-free trees at provenance 4d3094578050, +5.2 % over the 5.3033 pin, min_case 5.31, boot bench 5.621, internal_free 8,415, host 19/19 byte-exact, fidelity 5.341e-05 unchanged; quality rests on board 2's clean 18/20 with divergences exactly {heldout_interval_one, heldout_long_tools_note_only}. Accepted pin deliberately held at 5.3033: 18/20 is not 20/20, and re-capturing those two goldens to match the device would move the quality oracle rather than meet it, which is the owner's decision. No filler candidate was built, because every lever family at this stack carries a measured closure and the accepted image is never re-measured as make-work.","timestamp":1790271005575,"segment":1,"confidence":18.02457142857145,"asi":{"hypothesis":"Has board 3's compare block arrived?","no_new_number_rationale":"No candidate was manufactured for the sake of a number: the split-cost model, delivery bound, transform/transcendental/call-surface families all carry measured closures at this stack, and the accepted image is deliberately never re-measured as filler. The campaign's remaining uncertainty is the owner's oracle decision, not an unmeasured lever.","position":"Unchanged and complete on speed: two boards agree at 5.5767 and 5.58 on provenance 4d3094578050 (+5.2 % over the 5.3033 pin), with the console ring within one metric tick of the no-ring reading. Quality rests on board 2's clean 18/20 (divergences exactly the two boot-state goldens, token_delta 52, golden_missing 0, host 19/19, fidelity 5.341e-05)."}}
{"run":546,"commit":"94f2a35","metric":5.3033,"metrics":{"boot_bench_tps":5.621,"device_output_exact":18,"device_token_delta":52,"ext_decode_tps":5.2269,"gen_tokens":99,"host_output_exact":19,"internal_free":8415,"logit_max_delta":0.00005341,"logit_top1_match":10,"min_case_tps":5.31,"prefill_tps":5.59,"psram_free":2052252,"think_tps":4.2},"status":"keep","description":"Board 3's cross-board clean-tree session is alive and in its final group, so the cross-board verdict is close but does not exist yet and nothing is claimed. Evidence rather than inference: log bytes rose 8,762 -> 11,492, a bench.py process is live, and the tail is the 'EVT think=0' toggle line - the unconstrained-vocabulary group that runs last, which is why this lane overruns board 2's shorter session. There is still no device_output_exact, no DEVICE_OUTPUT_DIVERGED and no LANE_RC, so per #513 no byte-exactness statement is possible from this board. Acceptance position unchanged and complete on speed: decode 5.5767 (board 2) and 5.58 (board 3) on byte-identical trace-free trees at provenance 4d3094578050 - +5.2 % over the 5.3033 pin - with min_case 5.31, boot bench 5.621, internal_free 8,415, host 19/19 byte-exact and fidelity 5.341e-05 unchanged; quality rests on board 2's clean 18/20 failing exactly heldout_interval_one and heldout_long_tools_note_only. Accepted pin deliberately held at 5.3033 and no filler candidate built, because every lever family at this stack carries a measured closure.","timestamp":1790271036375,"segment":1,"confidence":18.02457142857145,"asi":{"hypothesis":"Is board 3's cross-board session still alive, and where is it in the suite?","next":"Board 3's compare block should be the last thing written. If it lists exactly the same two cases, the owner's decision rests on two clean-stream boards; if any other case appears, that is a real regression signal and takes priority over everything else.","where_it_is":"Tail is 'EVT think=0', i.e. the unconstrained-vocabulary toggle - the final group, which is why this session overruns board 2's duration; a live bench.py and bytes 8,762 -> 11,492 confirm it is working, not wedged."}}
{"run":547,"commit":"35c045c","metric":5.3033,"metrics":{"boot_bench_tps":5.621,"device_output_exact":18,"device_token_delta":52,"ext_decode_tps":5.2269,"gen_tokens":99,"host_output_exact":19,"internal_free":8415,"logit_max_delta":0.00005341,"logit_top1_match":10,"min_case_tps":5.31,"prefill_tps":5.59,"psram_free":2052252,"think_tps":4.2},"status":"keep","description":"Applied the cheap harness fix #541 identified rather than poll a verdict that does not exist yet: .auto/measure.sh now exports PYTHONUNBUFFERED=1 right after set -euo pipefail (verified inserted, bash -n clean), so bench.py line-buffers into a redirected log and 'the log is not growing' stops being ambiguous - the failure mode that made a flashed-and-running lane look dead at #541 and cost three polls of liveness checks on board 3. This changes no measurement: decode_tps remains the device's own reported number, and live sessions are untouched because measure.sh is read at launch, so both already-measured sessions keep their provenance. Measurement status unchanged: board 3's compare block is still absent (no device_output_exact, no DEVICE_OUTPUT_DIVERGED, no LANE_RC), so byte-exactness remains board 2's clean 18/20 with divergences exactly {heldout_interval_one, heldout_long_tools_note_only}, token_delta 52, golden_missing 0, host 19/19, fidelity 5.341e-05; speed is complete on two boards (decode 5.5767 and 5.58 at provenance 4d3094578050, +5.2 % over the pin). Accepted pin deliberately held at 5.3033.","timestamp":1790271086272,"segment":1,"confidence":18.02457142857145,"asi":{"fix":"export PYTHONUNBUFFERED=1 inserted at line 14 of .auto/measure.sh, immediately after 'set -euo pipefail'; bash -n passes and no other file changed. It is measurement-neutral: it changes only the host process's stdout buffering, not the firmware, the timing source, or what bench.py parses - decode_tps is the device's own reported value.","hypothesis":"Apply the cheap harness improvement #541 identified instead of another poll: make bench.py stream line-by-line so lane-log growth is an honest liveness signal during the five-minute priming.","next":"Read board 3's compare block. If it fails exactly heldout_interval_one and heldout_long_tools_note_only, the owner's decision rests on two clean-stream boards; if anything else fails, that is a real regression and takes priority.","note":"Deliberately NOT applied to any running lane - measure.sh is read at launch, so live sessions are unaffected and the two sessions already measured keep their exact provenance.","state":"Board 3's verdict still has not been written: no device_output_exact, no DEVICE_OUTPUT_DIVERGED, no LANE_RC."}}
{"run":548,"commit":"35c045c","metric":5.3033,"metrics":{"boot_bench_tps":5.621,"device_output_exact":18,"device_token_delta":52,"ext_decode_tps":5.2269,"gen_tokens":99,"host_output_exact":19,"internal_free":8415,"logit_max_delta":0.00005341,"logit_top1_match":10,"min_case_tps":5.31,"prefill_tps":5.59,"psram_free":2052252,"think_tps":4.2},"status":"keep","description":"Board 3's cross-board clean-tree session looks stalled rather than long-running, and I am reporting it as unresolved instead of reading a verdict out of it. Its log byte count is unchanged at 11,492 since #546 with an identical tail line ('EVT think=0') while a bench.py process remains alive - and since #541 established that byte growth, not line count, is the honest liveness signal here, zero growth across a poll interval means no output in that window. There is therefore no device_output_exact, no DEVICE_OUTPUT_DIVERGED and no LANE_RC from board 3, so the cross-board byte-exactness claim does not exist and acceptance rests solely on board 2's clean trace-free reading: decode 5.5767 with 18/20 byte-exact, divergences exactly {heldout_interval_one, heldout_long_tools_note_only}, token_delta 52, golden_missing 0, host 19/19, fidelity 5.341e-05; speed is already two-board (5.5767 and 5.58 at provenance 4d3094578050, +5.2 %). Note the scope limit of the console fix as measured so far: the ISR-fed RX ring demonstrably removed the 16-17 request ceiling and let board 2 finish all twenty cases twice, but a stall after the think toggle in a later session is a second, distinct failure mode that the ring is not shown to fix. Accepted pin deliberately held at 5.3033; next poll decides whether to record the stall and re-run board 3.","timestamp":1790271132801,"segment":1,"confidence":18.02457142857145,"asi":{"discipline":"No claim and no waiver. Board 2's clean verdict stands; a stalled second lane is neither a pass nor a reason to weaken the two-board requirement - it is a second measurement of the firmware defect the ring reduced but did not eliminate.","evidence":"Byte count UNCHANGED at 11,492 between this poll and #546's, tail identical ('...timer_fired_count:0}|EVT think=0'), while a bench.py process is still alive. Bytes-not-lines is the honest test since #541, so an unchanged byte count over a full poll interval means no output in that window.","hypothesis":"Is board 3's cross-board session still progressing, or has it stalled without producing its compare block?","next":"One more poll decides it. If still unchanged, treat as stalled: record the failure mode (a session that emits nothing after the think toggle while its reader lives), and re-run board 3 once - a second stall at the same point, with the ring installed, would be a measured firmware/serial defect worth reporting separately from the 128-byte FIFO cause the ring fixed.","signature":"That is the stall signature this harness has shown before, not progress."}}
