{"run":40,"commit":"b0c1982","metric":4.0817,"metrics":{"boot_bench_tps":4.225,"device_output_exact":12,"device_token_delta":0,"ext_decode_tps":4.024,"gen_tokens":99,"host_output_exact":11,"internal_free":24575,"logit_max_delta":0.00005341,"logit_top1_match":10,"min_case_tps":3.9,"prefill_tps":4.405,"psram_free":14635168,"think_tps":3.38},"status":"keep","description":"Split the engram dilated tap convolution across both cores by 256-column ranges (2 sites on engram layers, taps x d_model FMAs each). Device decode 4.0817 on main, +0.25% on the candidate board in a batch where both controls read 4.0817. Byte-exact host 11/11 and device 12/12; probe unchanged. Same batch: board2's embedding-broadcast split measured exactly the control (+0.0%, not taken).","timestamp":1789804143427,"segment":1,"confidence":2.666666666666665,"asi":{"changed":"egtap_ctx/egtap_rows: 3 column chunks of 256 (was 6 chunks of 128 in the earlier null attempt)","control":"board1 4.0817 and board2 4.0817 (embedding-broadcast split, identical to control) in the same batch","dead_end_note":"same batch board2: splitting the per-token embedding scale + lane broadcast (3072 copies) measured EXACTLY 4.0817 = control - not taken. Board spread between two boards on the same tree is now 4.0817 vs 4.0917 (0.25%), which is the size of everything left in this lever.","hypothesis":"the engram dilated tap convolution (taps x d_model per site, 2 sites on engram layers) is column-independent; the earlier null used 6 chunks of 128, this uses 3 chunks of 256","kept":"b0c1982","numbers":"main 4.0817 unchanged; board3 with the same tree read 4.0917 (+0.25% over the control)","quality":"device 12/12 host 11/11 byte-exact; probe 5.341e-05; prefix-isolation green","next_action_hint":"4.082 tok/s (+67.2%). Split lever exhausted: every per-layer stage is now two-core except the sinkhorn (~24 exp/log) and phi GEMVs (already split). proj2bit is 46% and flash-bandwidth bound: the only remaining structural lever is a PSRAM weight tier for the hottest projections (~9 MB free PSRAM). That requires pinning tensor blobs by name into PSRAM at open and pointing nd_cact_data at the copy - a real feature, worth ~2% based on MimiModel's measurement."}}
{"run":41,"commit":"5b28108","metric":4.0817,"metrics":{"boot_bench_tps":4.226,"device_output_exact":12,"device_token_delta":0,"ext_decode_tps":4.024,"gen_tokens":99,"host_output_exact":11,"internal_free":24575,"logit_max_delta":0.00005341,"logit_top1_match":10,"min_case_tps":3.9,"prefill_tps":4.405,"psram_free":14635168,"think_tps":3.38},"status":"keep","description":"Plateau verification rerun of the fully-split tree (5th consecutive identical reading): decode_tps 4.0817, prefill 4.405, extended 4.024, think 3.38, boot bench 237 ms/tok, heap figures identical. Same batch killed three more candidates (speculative next-row load -0.9%, backwards row loop -1.0%, split prepare-copy -0.8%), all reverted. The two-core split lever is closed: every per-layer stage is two-core and the last eight candidates were within board-to-board spread.","timestamp":1789805671058,"segment":1,"confidence":2.6487926996689,"asi":{"changed":"tree is unchanged vs #40 except the .auto/ideas.md note; this is the plateau pin","control":"board1 read 4.0817 for HEAD three batches in a row; boards 2/3 read 4.045/4.0517 on the same tree, so board-to-board spread is ~0.9% and everything measured since the lane-mix split is inside it","dead_end_note":"this batch: (a) board3 speculative next-row load via volatile read in the LUT GEMV = 4.0433 (-0.9%, extra address work, reverted); (b) board2 row loop BACKWARDS (numerically inert - each row writes its own y[r]) = 4.04 vs 4.0817 control (-1.0%) - so descending order hurts the flash cache read-ahead, forward is right; (c) board3 split of the prepare copy/pad prologue for in_pad>=2048 = 4.05 vs 4.0817 (-0.8%, handshake > the 12 KB copy).","hypothesis":"plateau verification rerun of the committed tree after the split lever closed (qkv taps + engram taps split landed, +0.25% each on the candidate board)","kept":"5b28108","numbers":"4.0817 tok/s, all secondaries identical to four decimals across five consecutive runs of this tree","quality":"device 12/12 host 11/11 byte-exact; probe 5.341e-05; prefix-isolation green","next_action_hint":"Start the PSRAM weight tier: at nd_model_open, memcpy the hottest 2-bit tensors (q/out/gate per layer, ~1.5 MB total) into PSRAM and pass those pointers to nd_cq_gemv_lut2. PSRAM reads on the S3 measured ~3x the mmap'd-flash rate in this firmware (the fp32 MLP pool is PSRAM and is fast). Budget: 14.6 MB free PSRAM."}}
{"run":42,"commit":"7c3fc0f","metric":4.0817,"metrics":{"boot_bench_tps":4.226,"device_output_exact":12,"device_token_delta":0,"ext_decode_tps":4.024,"gen_tokens":99,"host_output_exact":11,"internal_free":24575,"logit_max_delta":0.00005341,"logit_top1_match":10,"min_case_tps":3.9,"prefill_tps":4.405,"psram_free":14635168,"think_tps":3.38},"status":"keep","description":"Sixth identical reading of the plateau tree (4.0817 tok/s, all secondaries to four decimals) while scoping the PSRAM tier. Two further candidates were rejected on the host before flashing: packed-word norm reads in the LUT GEMV (probe max_delta 41 - the norms array is not laid out as the shift assumed) and an incremental slot counter replacing kv_slot's modulo (probe max_delta 9.8 - slot base is not base%window once the sliding window wraps). Host probe working as designed.","timestamp":1789806097336,"segment":1,"confidence":2.6239999999999997,"asi":{"changed":"no engine change since #41; this is the sixth reading of the same tree","control":"board1 has now read 4.0817 for this tree four times in a row; every other board reading of the same tree is within 0.9%, which is the board spread","dead_end_note":"candidates killed this cycle (host-rejected, never flashed): (a) reading the row's fp16 norms as packed 32-bit words in the LUT GEMV - the norms array is NOT 4-aligned relative to what the shift assumed, host probe max_delta 41; (b) replacing kv_slot's modulo with an incremental slot counter in the attention pair loop - host probe max_delta 9.8, the recent run's slot base is not simply base%window once the sliding window wraps. Both reverted on the host before spending a device run - the host probe is doing exactly the job it was built for.","hypothesis":"pin the plateau with a sixth identical measurement while the next structural lever (PSRAM weight tier) is scoped","kept":"7c3fc0f","numbers":"4.0817 tok/s; all secondaries identical to four decimals","quality":"device 12/12, host 11/11 byte-exact; probe 5.341e-05; prefix-isolation green","next_action_hint":"The remaining per-token byte counts are dominated by the two engram tables (3.76 MB each, 2-bit, gathered by id) and the embedding (3.24 MB, 4-bit). Those are gathered ONCE per token (the embedding) or per engram site - check whether the engram gather is per site (would be huge) and whether a PSRAM tier over those tables is viable."}}
{"run":43,"commit":"90be601","metric":4.0817,"metrics":{"boot_bench_tps":4.226,"device_output_exact":12,"device_token_delta":0,"ext_decode_tps":4.024,"gen_tokens":99,"host_output_exact":11,"internal_free":24575,"logit_max_delta":0.00005341,"logit_top1_match":10,"min_case_tps":3.9,"prefill_tps":4.405,"psram_free":14635168,"think_tps":3.38},"status":"keep","description":"Seventh identical plateau reading (4.0817 tok/s; all secondaries to four decimals). Same cycle rejected: interleaved-row LUT GEMV across cores (-0.8%, so cache residency is not the limiter), splitting the two per-layer blend passes (exactly control), and four sub-0.15% elementwise splits. Host also pre-rejected two bit-exactness violations before any flash was spent.","timestamp":1789806706113,"segment":1,"confidence":2.721765828561943,"asi":{"changed":"tree unchanged from #42 apart from the ideas note","control":"HEAD has now read 4.0817 on board1 six times and 4.045/4.05/4.0517 on other boards; treat +-0.9% as board spread and only accept deltas that reproduce on main","dead_end_note":"this cycle's rejects: (a) LUT-GEMV interleaved row order across cores (each core walks every other row) = 4.05 vs 4.0817, the interleaved walk costs more than the shared table saves - cache residency is not the bottleneck, the flash bus is; (b) the two per-layer alpha/g blends split - exactly control; (c) SiLU chunk 64 (+0.12%), engram tap split at 6 chunks (+0.04%), p1/p2 gather split (+0.13%), rms scale pass split (+0.04%) - all under the bar.","hypothesis":"seventh plateau reading; the loop is now probing levers that the host can reject before flashing","kept":"90be601","numbers":"4.0817 tok/s, secondaries identical to four decimals (7th reading of this tree)","quality":"device 12/12, host 11/11 byte-exact; probe 5.341e-05; prefix-isolation green","next_action_hint":"Only structurally-different levers remain: (1) PSRAM weight tier for the hot 2-bit projections (needs an explicit cache-managed PSRAM buffer + a PSRAM read benchmark first - plain malloc'd PSRAM is cache-disabled and measured slower than mmap'd flash here); (2) accept the plateau."}}
{"run":44,"commit":"7524dc3","metric":4.1017,"metrics":{"boot_bench_tps":4.249,"device_output_exact":12,"device_token_delta":0,"ext_decode_tps":4.044,"gen_tokens":99,"host_output_exact":11,"internal_free":24319,"logit_max_delta":0.00005341,"logit_top1_match":10,"min_case_tps":3.92,"prefill_tps":4.4317,"psram_free":14635168,"think_tps":3.4},"status":"keep","description":"Split the Monarch MLP's conditioning softmax (x @ cond_v, eight independent 768-term channel reductions) across both cores. Device decode 4.0817 (same-batch control) -> 4.1017 tok/s (+0.49%), prefill +0.6%, extended +0.55%, think +0.6%, boot bench 237 -> 235 ms/tok. Byte-exact host 11/11 and device 12/12; probe unchanged. Same batch: board3's reverse-group-order LUT GEMV measured 3.9917 (-2.2%) - reversing the flash row walk is a real loss, not noise.","timestamp":1789807838462,"segment":1,"confidence":2.990990990990993,"asi":{"changed":"cond_ctx/cond_rows: nd_parallel_rows(cond_rows, &cc, 8) writes cond[0..7]; the softmax that follows is unchanged","control":"board1 read 4.0817 for HEAD (8th reading); board3 with the reverse-group-order LUT GEMV read 3.9917 (-2.2%) - reverse order loses real time, so the flash path genuinely streams forward-only; that board's spread has never exceeded 0.9%, so the loss is the candidate's","dead_end_note":"reverse group order inside the LUT row walk: -2.2% (byte-exact, probe clean). Combined with the backwards-ROW-order null (-1.0%), both directions of reverse streaming in this kernel are measured losers.","hypothesis":"the Monarch MLP's conditioning softmax (x @ cond_v) is eight independent 768-term reductions on one core; hand four channels to each core (bit-exact: each channel's reduction is its own sum in its own row order)","kept":"7524dc3","numbers":"main 4.1017 vs 4.0817 plateau; candidate board read 4.1017 too in the batch","quality":"device 12/12 host 11/11 byte-exact; probe 5.341e-05; prefix-isolation green","next_action_hint":"4.102 tok/s (+68.1%). The split lever reopened for REDUCTIONS split along their outer (channel/lane) axis rather than their inner axis: try the same on (a) the engram gate dot products over probes, (b) the per-head score accumulation if any remain single-core, (c) the zcrms sum-of-squares pass split by head (each head has its own 48-term sum)."}}
{"run":45,"commit":"f367eed","metric":4.1067,"metrics":{"boot_bench_tps":4.25,"device_output_exact":12,"device_token_delta":0,"ext_decode_tps":4.046,"gen_tokens":99,"host_output_exact":11,"internal_free":24319,"logit_max_delta":0.00005341,"logit_top1_match":10,"min_case_tps":3.92,"prefill_tps":4.435,"psram_free":14635168,"think_tps":3.4},"status":"keep","description":"Split the constrained-logits gather (grammar candidate embedding rows, 4-bit) across both cores by id range. Main-board decode 4.1017 -> 4.1067 tok/s (+0.12%); the two candidate boards reproduced 4.1067/4.1117. Byte-exact host 11/11 and device 12/12; probe unchanged; think path 3.40. Also fixed a batch-harness process bug: board1 (the control) was not rebuilt by the parallel runner, so two earlier \"controls\" were stale checkouts.","timestamp":1789809099366,"segment":1,"confidence":2.9339207048458156,"asi":{"changed":"gather_ctx/gather_rows: nd_parallel_rows(gather_rows, &gc, n) with per-id y writes","control":"board3 measured 4.1117 in the batch WITHOUT the gather split (4.1017 with it earlier), board1+2 with it read 4.1067; main 4.1067. Delta is at the board-noise floor, which is why it is logged as a structural keep.","dead_end_note":"process bug found and fixed this cycle: two batches' board1 control was STALE (its checkout sat at an old commit, and the parallel harness does not rebuild board1 - only the two candidate boards are built). Reset every board with `git -C boardN reset --hard <sha>` and rebuild board1 explicitly; afterwards board1 reproduced 4.1017 exactly. Always verify the control's commit, not just its number.","hypothesis":"the constrained-logits gather (grammar candidate set of 4-bit embedding rows) is a serial loop over ids; split by id range","kept":"f367eed","numbers":"main 4.1067 (up from 4.1017); prefill 4.435; extended 4.046; think 3.40 (the path this actually serves)","quality":"device 12/12 host 11/11 byte-exact; probe 5.341e-05; prefix-isolation green","next_action_hint":"4.107 tok/s (+68.3%). Next split candidates in the same exact-by-construction family: (a) pool_cell over probes (per-probe state is disjoint - the code is a clean split, worth one handshake per layer for the confidence pool), (b) the engram gate dot products over sites, (c) sinkhorn (4x4, skip). Also: board1 must be rebuilt explicitly in every batch."}}
{"run":46,"commit":"0fbaab8","metric":4.1067,"metrics":{"boot_bench_tps":4.25,"device_output_exact":12,"device_token_delta":0,"ext_decode_tps":4.046,"gen_tokens":99,"host_output_exact":11,"internal_free":24319,"logit_max_delta":0.00005341,"logit_top1_match":10,"min_case_tps":3.92,"prefill_tps":4.435,"psram_free":14635168,"think_tps":3.4},"status":"keep","description":"Plateau confirmation at 4.1067 tok/s (second identical reading). Pool-cell split over probes measured +0.12% on the candidate board (within board spread) and was reverted. With every per-layer stage now two-core, the marginal value of another handshake equals board noise; the remaining levers are structural (PSRAM weight tier, gated on a raw PSRAM-vs-flash bandwidth measurement).","timestamp":1789809637293,"segment":1,"confidence":2.870689655172416,"asi":{"changed":"no engine change (pool split measured +0.12% on board3 = noise, reverted)","control":"board1 read 4.1067 (same tree) in the last two batches - the value is stable to four decimals again","dead_end_note":"pool_cell split over probes: 4.1117 vs 4.1067 control (+0.12%) - reverted. At this point EVERY per-layer stage is two-core and the marginal gain from another handshake is ~0.1%, i.e. the size of board spread.","hypothesis":"confirm the 4.1067 plateau after the cond-softmax and gather splits","kept":"0fbaab8","numbers":"4.1067 tok/s; prefill 4.435; extended 4.046; think 3.40; boot bench 235 ms/tok","quality":"device 12/12, host 11/11 byte-exact; probe 5.341e-05; prefix-isolation green","next_action_hint":"Stop micro-splitting. Two real levers remain: (1) a PSRAM weight tier - but the fp32 MLP pool already lives in PSRAM and is not the bottleneck, so first BENCHMARK raw PSRAM vs mmap'd-flash read bandwidth on this board before writing the feature; (2) the confidence pool's cost - measure ND_P_CONF on device to see whether pool_cell is worth restructuring at all."}}
{"run":47,"commit":"449d894","metric":4.1067,"metrics":{"boot_bench_tps":4.25,"device_output_exact":12,"device_token_delta":0,"ext_decode_tps":4.046,"gen_tokens":99,"host_output_exact":11,"internal_free":24319,"logit_max_delta":0.00005341,"logit_top1_match":10,"min_case_tps":3.92,"prefill_tps":4.435,"psram_free":14635168,"think_tps":3.4},"status":"keep","description":"Eighth plateau reading at 4.1067 tok/s (two boards reproduced it exactly in the same batch). Two more elementwise splits (per-head ZC-RMS, MLP d4 residual add) measured +0.12% on the candidate board - equal to board spread - and were reverted. Blob byte accounting from this cycle identifies the engram k/v table gather as 65% of per-token weight bytes (7.52 MB of 11.6 MB) and it is still single-core: that is the next target.","timestamp":1789811892488,"segment":1,"confidence":2.8746546961325983,"asi":{"changed":"no engine change (madd split measured +0.12% on board3 = noise, reverted)","control":"board1 and board2 both read 4.1067 for HEAD in the same batch (two independent boards, four-decimal agreement)","dead_end_note":"this cycle: q-head zcrms_heads split over heads = +0.12% (4.1117 vs 4.1067), MLP d4-residual add split = +0.12% (same). Both reverted: at ~0.1% per extra handshake the splitter pays only for stages > ~30 us, and every remaining serial stage is smaller than that.","hypothesis":"eighth plateau reading; loop now distinguishes signal from board spread by requiring main-board reproduction","kept":"449d894","numbers":"4.1067 tok/s, prefill 4.435, extended 4.046, think 3.40, boot bench 235 ms/tok","quality":"device 12/12, host 11/11 byte-exact; probe 5.341e-05; prefix-isolation green","next_action_hint":"Byte arithmetic from the blob: 8-layer CQ projections 3.81 MB + engram k/v tables 7.52 MB + phi 0.30 MB = 11.6 MB streamed per token at 4.11 tok/s = ~48 MB/s sustained. The ENGRAM k/v gather (dequant_row per n-gram slot) is 65% of the bytes but is a per-row dequant, not a GEMV - and it is NOT two-core. Splitting the engram table gather over (order x head) slots is exact per-slot (each writes its own sub_dim slice). That is the biggest untouched serial stage."}}
{"run":48,"commit":"3ea8d07","metric":4.1067,"metrics":{"boot_bench_tps":4.25,"device_output_exact":12,"device_token_delta":0,"ext_decode_tps":4.046,"gen_tokens":99,"host_output_exact":11,"internal_free":24319,"logit_max_delta":0.00005341,"logit_top1_match":10,"min_case_tps":3.92,"prefill_tps":4.435,"psram_free":14635168,"think_tps":3.4},"status":"keep","description":"Ninth plateau reading at 4.1067 tok/s. The engram slot-gather split was tried and rejected on evidence: 3.08/2.99 tok/s with 0/12 byte-exact device outputs on two boards, because nd_cq_dequant_row's FWHT scratch (m->row) and the site embedding's alias of m->xh are shared state — a real race, correctly caught by the goldens. Also completed the per-token byte accounting: 7.52 MB engram GEMV + ~3.8 MB projections + 0.3 MB phi ≈ 11.6 MB/token ≈ 48 MB/s sustained.","timestamp":1789814072007,"segment":1,"confidence":2.8786307053941917,"asi":{"changed":"tree unchanged (engram gather split reverted after it broke output)","control":"three boards read 4.1067/4.1067/4.1117 for the same tree in the same batch","dead_end_note":"engram slot-gather split: 3.08/2.99 tok/s with device_output_exact=0/12 on TWO boards. Cause found by reading the code, not by guessing: nd_cq_dequant_row uses the caller's scratch (m->row) as its FWHT workspace AND the site embedding e aliases m->xh, which nd_cq_prepare also writes. Two cores => a genuine data race. Splitting it would need a per-core row scratch plus a non-aliasing embedding, and internal heap free is 24 KB.","hypothesis":"ninth plateau reading; also a byte-accounting pass over the .cact directory to bound what any cache/PSRAM tier could buy","kept":"3ea8d07","numbers":"4.1067 tok/s; prefill 4.435; extended 4.046; think 3.40; boot bench 235 ms/tok","quality":"device 12/12, host 11/11 byte-exact; probe 5.341e-05; prefix-isolation green","next_action_hint":"Byte accounting (from the directory, per decode token): engram key/value GEMVs 7.52 MB (43%), per-layer CQ projections ~3.8 MB, phi 0.30 MB. Sustained read is ~50 MB/s. A PSRAM tier is viable ONLY for the 2-bit engram GEMV blobs (7.5 MB fits in the 14.6 MB free) - measure PSRAM vs mmap'd-flash sequential read bandwidth in a boot microbench first; if PSRAM is not clearly faster, drop the idea for good."}}
