{"run":417,"commit":"a6e7454","metric":5.1167,"metrics":{"boot_bench_tps":5.162,"device_output_exact":20,"device_token_delta":0,"ext_decode_tps":5.0423,"gen_tokens":99,"host_output_exact":19,"internal_free":12855,"logit_max_delta":0.00005341,"logit_top1_match":10,"min_case_tps":4.88,"prefill_tps":5.4,"psram_free":2052252,"think_tps":3.99},"status":"keep","description":"Fusion gate attempt #8 - reconstructed deterministically from git and re-verified, then blocked again by the engine-independent console wedge; accepted runtime unchanged at 5.1167 (this iteration's 5.1467 is an unaccepted candidate, and secondaries shown are the accepted run's, with internal_free 12,855 carried from #404's measurement of this same tree because the attempt died before measure.sh emitted its own RAM line). Candidate: radix-4 stage fusion + run #404's cold-path refund (fused kernel from c64efe4, ND_HOT dropped and noinline added on fw_scale/nd_fwht2/nd_fwht3s so the field-dead fallbacks stop occupying internal heap twice; nd_quant.c only, engine_md5 c461a8be9486 asserted from the applied tree, TYPECHECK_OK, host 19/19 byte-exact, token_delta 0, fidelity 5.341e-05 identical, top1 10/10, checks rc=0). Reading on board 2 with the pool otherwise idle: decode 5.1467 = +0.58 % over the accepted 5.1167, reproducing the earlier seven readings to the digit; prefill 5.4367, min_case 4.91, gen_tokens 99; 17 of 20 device cases with ZERO divergences and every case at its golden token count, then TimeoutError at case 18 - the same position as all previous attempts. Policy decided from the observed distribution rather than hope: nine attempts have produced 16,16,16,17,17,17,17,17,20, so P(a full session) is about 1 in 9 and gate retries belong on an otherwise-idle board occasionally, not every iteration. Acceptance routes checked off-device: the union-of-sessions idea (prefix 1-17 plus a no-flash tail 18-20) is NOT valid, because run #395 established the tail goldens are order-dependent and only reproduce in canonical order, so a tail-only session cannot satisfy a byte-exactness gate - that leaves a lucky full session or removing the firmware wedge. Which is now sanctioned work rather than scope creep: the operator's rule excludes correctness expansion 'unless a concrete performance candidate cannot be measured without a fix', and a measured +0.58 % with eight zero-divergence attempts is exactly that; cheapest next diagnostic is a per-request liveness counter in the console reader on board 2 (whose console leg is healthy), with NEEDLE_THERMAL_DIAG already in-tree to show both heaps and a PSRAM CRC at the failing moment (#408 used it to exclude heap exhaustion, PSRAM corruption and thermal). Also launched this iteration: the condT device-side differential on board 1 as a kbench image harvested over JTAG - it bisects condT's device-only 19/20 divergence into fill / read / two-core 4+4 split (the shape the host's rows_serial cannot produce, the same guard class whose absence cost run #333 its first build) and prices strided vs channel-major in the same pass; condT is +0.294 % on two readings and is the largest in-rule unshipped candidate left. Board 2 and board 3 otherwise free.","timestamp":1790221199918,"segment":1,"confidence":19.34201012292117,"asi":{"gate_attempt_8":"Reconstructed run #404 state (fused kernel from c64efe4 + the cold-path refund on fw_scale/nd_fwht2/nd_fwht3s, nd_quant.c only, engine_md5 c461a8be9486 asserted from the applied tree, TYPECHECK_OK, host 19/19 byte-exact, fidelity 5.341e-05 identical) measured on board 2 with the pool otherwise idle: primary decode 5.1467 - reproducing the earlier seven readings to the digit - prefill 5.4367, min_case 4.91, gen_tokens 99, 17 device cases with ZERO divergences and every case at its golden token count (heldout_batch_three_field 67, heldout_interval_over_max 19, heldout_long_route 14), then TimeoutError at case 18 as on every previous attempt.","acceptance_paths_checked_off_device":"The union-of-sessions acceptance route (cases 1-17 in one session, 18-20 in a no-flash tail session) is NOT available and was closed off-device: run #395 established that the tail goldens are order-dependent and return their golden counts in canonical order on a healthy board, so a tail-only session is only valid for relative comparisons. That leaves exactly two routes - a lucky 20-case session, or removing the firmware wedge. Observed P(20) across nine attempts is 1/9, so gate retries are an occasional use of an otherwise-idle board, not a per-iteration expense; that is a policy decision recorded so the next window does not burn nine more.","wedge_now_sanctioned_work":"Fixing the wedge used to be out of scope under the 'correctness is not the objective' directive, but that directive carries the exception 'unless a concrete performance candidate cannot be measured without a fix' - and this is precisely that case: a measured +0.58 % with eight zero-divergence attempts cannot be accepted. Cheapest next diagnostic, one build on board 2 (whose console leg is the healthy one): a per-request liveness counter in the console reader, which distinguishes 'app alive but not reading' from 'app blocked', with NEEDLE_THERMAL_DIAG already available to show both heaps and PSRAM CRC at the failing moment (#408 used it to exclude heap exhaustion, PSRAM corruption and thermal).","condt_differential":"Built and running on board 1 as a kbench image harvested over the JTAG leg, because board 1's UART console leg is the unreliable one (nodes re-created 01:36/02:22, no STATE answered). It bisects condT's device-only 19/20 divergence into fill / read / two-core 4+4 split - the shape the host's rows_serial structurally cannot produce, which is the same guard whose absence cost run #333 its first build - and prices the layout change in the same pass (strided vs channel-major cycles, min of 9 rounds). condT measured +0.294 % twice on board 2, so it is the largest in-rule unshipped candidate the campaign has; KB CV independently shows the operand is worth 52 % when cold, so its mechanism is real if its bits hold.","policy":"Two boards: board 1 = KB CT (building, ninja alive, log growing). Board 2 = free after this gate attempt. Board 3 = free. No speed claim is made this iteration: the 5.1467 reading is a candidate that remains unaccepted, and the accepted runtime stays 5.1167 with the accepted run's secondaries carried, including internal_free 12,855 which #404 measured on this exact tree (this attempt died before measure.sh emitted its own RAM line).","own_bugs":"Two small self-inflicted issues caught, neither affecting a verdict: the bracketed pgrep pattern I quoted to fix the self-kill was itself mis-escaped in one call (regex error, so liveness had to be proven a second way - ninja alive plus a 75 KB growing build log), and the host syntax probe cannot cover kbench.c at all because IDF headers are absent on the host, which is fine for an engine-only gate but means device builds remain the only check for bench code."}}
{"run":418,"commit":"d02c3c2","metric":5.1167,"metrics":{"boot_bench_tps":5.162,"device_output_exact":20,"device_token_delta":0,"ext_decode_tps":5.0423,"gen_tokens":99,"host_output_exact":19,"internal_free":12855,"logit_max_delta":0.00005341,"logit_top1_match":10,"min_case_tps":4.88,"prefill_tps":5.4,"psram_free":2052252,"think_tps":3.99},"status":"keep","description":"condT's mechanism located (cold-only, +26.6 %) + the wedge re-diagnosed as an outbound emission stall + six of my own lane defects fixed; accepted runtime unchanged at 5.1167 (secondaries are the accepted fw3foldnb run's carried forward - this iteration's device images were two kbench screens, which never execute the request path, plus a gate attempt still in flight). SCREEN 1 (board 1, KB CT, kbench over JTAG because board 1's UART leg is the unreliable one): a device-side differential for condT - the channel-major cond_v layout that measured +0.294 % twice on board 2 and was vetoed by an unexplained device-only 19/20 divergence. Result: fill_mismatch=0 read_mismatch=0 split_mismatch=0, including the 4+4 two-core split in both call orders - the shape the host's rows_serial cannot produce - so the candidate's arithmetic is proven exact on device and its veto is not a math defect. Pricing came back with the campaign's most instructive pair: warm, strided 55,400 vs channel-major 55,423 cycles = 0.0 % (9.016 vs 9.020 per element, independently reproducing KB CV's 9.090); COLD behind a 96 KiB eviction, strided 116,534 vs channel-major 85,499 = 18.967 vs 13.914 cycles/element = 26.6 % for channel-major. One tensor's cond_v is touched once per token, so the field is cold and a warm bench cannot see the lever at all: the +0.294 % field readings and the zero warm reading are now consistent rather than contradictory, and condT becomes a justified retry (changed assumptions: proven-exact device differential, measured cold mechanism, and run #395's finding that its veto case is one of the order-dependent tail cases). My printed gain_pct field was garbage (a varargs/%.2f misalignment) while the cycle columns are sound - seventh wrong-summary-line instance, disclosed not edited away. SCREEN 2 (board 2, instrumented console reader): the wedge discriminator. The app's own counters froze at chars=816/lines=17 while eof climbed, and clearerr(stdin) every 25 EOFs did NOT restore service (session still ended at 16 cases), so my stdin-EOF-latch theory is REFUTED - but the full lane reading gives a better diagnosis: 16 cases were answered and reached the harness while the app's emitted EVT lines stopped arriving, i.e. an OUTBOUND emission stall rather than an input latch, which is also why host-side reconnects and fresh attaches do nothing and only a chip reset recovers. free_ps=24,192 was already steady at case 7, so PSRAM is not leaking across requests (correcting my first reading) - it is the model's steady state, which independently explains why ECC never fit and why the 14 MB tier span never booted. LANE 3 (board 3, KB TP): the tap-table residency control - same arithmetic, table in PSRAM vs internal RAM, mismatch-checked - to decide whether the taps phase's 27.8 cycles/MAC is line delivery (residency wins) or the history write (residency wins nothing); this is the measurement run #413 argued for instead of measuring.","timestamp":1790224150803,"segment":1,"confidence":19.34201012292117,"asi":{"kb_ct_cold":"condT device differential + pricing, board 1 kbench over JTAG, min of 9 rounds: KB CT DIFFERENTIAL fill_mismatch=0 read_mismatch=0 split_mismatch=0 cause=none (the 4+4 two-core split, both call orders, plus a fill re-check - the shape the host's rows_serial structurally cannot produce). PRICING warm: strided 55,400 vs channel-major 55,423 cycles = 0.0 %, 9.016 vs 9.020 cycles/element, which independently reproduces KB CV's fp32-warm 9.090. PRICING COLD (96 KiB eviction in front of each pass): strided 116,534 vs channel-major 85,499 cycles = 18.967 vs 13.914 cycles/element = CHANNEL-MAJOR 26.6 % FASTER. So condT's mechanism is real and exists only cold, which is exactly what the field would see (each tensor's cond_v is touched once per token, so it is cold) and exactly what a warm bench cannot see. This is the discriminator the lever needed: the +0.294 % field readings and the zero warm reading are now consistent instead of contradictory.","condt_retry_justification":"Retry with a changed assumption, not a revival: (a) the isolated shape is now proven bit-exact on device including the two-core split, so the math is not the problem; (b) run #395 established the tail goldens are order-dependent and only reproduce in canonical order on a healthy board, and condT's single veto case was a tail case; (c) the cold mechanism is now measured at 26.6 %. So a field re-measure is warranted and its prior 19/20 veto is suspect rather than damning. Requires reconstructing the patch properly: condT grew the per-layer fp16_slot array (there is no cvs field in this tree - my first assumption about its shape was wrong), i.e. a transposed table in an extra slot plus the channel-major read.","wedge_rediagnosed":"The instrumented reader refuted my stdin-EOF-latch theory and produced a better one. At the wedge the app's own counters were frozen (chars=816, lines=17) while eof climbed, and clearerr(stdin) every 25 EOFs did not restore service - the session still ended at 16 cases. But reading the whole lane: the app ANSWERED 16 cases (their CASE lines reached the harness) while its emitted EVT lines stopped appearing. So bytes and service continued on the app side while the outbound emission stopped being delivered to the host - an emission/TX-side stall, which also explains why host-side reconnects and fresh attaches change nothing and why only a chip reset recovers. PSRAM free 24,192 was steady from case 7, so it is the model's steady state, not a leak across requests (my first reading, corrected) - and it independently explains why ECC never fit and why the 14 MB tier span never booted.","harness_own_bugs_fixed":"Six of my own defects this iteration, each caught before it could corrupt a verdict: (1) a sed rename written with the same string as pattern and replacement, i.e. a no-op, caught by my own assertion; (2) the same slip repeated in a python re.sub, caught by the same assertion style - 'invented variable name' is now the third recurrence, so bench edits must rename to a token I type differently and assert the old token is gone; (3) uint32_t is long unsigned int on xtensa, so %u needs (unsigned) casts - a real compile failure, not a warning; (4) a python 'if (...):' written inside a non-block, syntax error; (5) needle-board run N -- does not execute in the checkout, so a relative path to the lane script silently failed - the fact I recorded in #410 and re-tripped; (6) lane_one.sh's first version gated the host type check on a marker file that does not exist, so the && chain short-circuited into TYPECHECK_FAIL without invoking the compiler - a lane-killing false negative, now unconditional with an explicit no-cc skip. Also idf.py again had to run from esp32/, and .board.json has no 'checkout' key. New asset: .auto/lane_one.sh (one file, one target, one board, absolute paths, provenance from the applied tree).","lanes_now":"board 1 = done (KB CT, harvested). board 2 = fusion+cold-refund gate attempt #10, engine applied byte-exact (src_md5 = tree_md5 = a800d1ea1896), provenance asserted, typecheck green, deterministic reconstruction from git commit c64efe4 reproducing #415's md5 exactly. board 3 = KB TP, the tap-table residency control (PSRAM vs internal RAM, same arithmetic, mismatch-checked) which decides whether the taps phase's 27.8 cycles/MAC is delivery or the history write - the measurement #413 argued for. Accepted runtime stays 5.1167 with the accepted run's secondaries carried; no speed claim is made for the gate attempt in flight."}}
{"run":419,"commit":"d02c3c2","metric":5.1167,"metrics":{"boot_bench_tps":5.162,"device_output_exact":20,"device_token_delta":0,"ext_decode_tps":5.0423,"gen_tokens":99,"host_output_exact":19,"internal_free":12855,"logit_max_delta":0.00005341,"logit_top1_match":10,"min_case_tps":4.88,"prefill_tps":5.4,"psram_free":2052252,"think_tps":3.99},"status":"keep","description":"condT rebuilt correctly and host-proven at zero memory cost + two more of my own harness bugs fixed; accepted runtime unchanged at 5.1167 (secondaries carried from the accepted run; nothing flashed from main, engine tree verified byte-identical to a6e7454 twice - md5 5c646468b78f against git show). CANDIDATE: condT = stage cond_v channel-major, the layout change that measured +0.294 % twice on board 2 and was vetoed by an unexplained device-only 19/20 divergence. My first patch this iteration was wrong in a way only a device run would have caught: it built a SECOND table in the free slot 27 (+196 KB PSRAM) against a steady-state psram_free of 24,192 bytes - it would have failed nd_model_open at -11 while building cleanly on the host. Run #390's condT cost zero memory because it filled slot 25 transposed IN PLACE, which is what I rebuilt: two edits (transposed open-time fill into the same buffer; accumulate reads c->cv[ch * c->dm + i] from the context rather than a literal, per the #380 generator lesson). Verified on the applied tree before any board: checks.sh rc=0, host 19/19 byte-exact, token_delta 0, golden_missing 0, fidelity 5.341e-05 identical, top1 10/10, pool size unchanged. This is now the campaign's best in-rule unshipped candidate: the KB CT differential proved its arithmetic bit-exact on device including the 4+4 two-core split that the host cannot produce, and KB CT priced the mechanism at 26.6 % cold / 0.0 % warm, which makes +0.294 % credible and moves suspicion from the code onto the veto case (a tail case, order-dependent per run #395). HARNESS: board 3's KB TP capture had raised OSError EINVAL because I derived the JTAG path with os.readlink('/dev/needle-pi/flash') inside the board session instead of using the $FLASH_PORT that needle-board exports - it worked on board 1 only because the symlink resolved differently there; fixed to the exported variable, and my own assertion on the absence of readlink caught a second occurrence so a half-fixed script could not be relaunched a third time.","timestamp":1790224529437,"segment":1,"confidence":19.34201012292117,"asi":{"condt_candidate_rebuilt":"My first patch was wrong in a way that would have cost a device slot: it built a SECOND cond_v table in the free slot 27, +196 KB PSRAM, against a steady-state psram_free of 24,192 bytes - it would have failed nd_model_open's allocation (-11) on device while building and running fine on the host, which has unlimited RAM. Run #390's condT cost zero memory because it filled slot 25 transposed IN PLACE, and that is what I rebuilt: two edits, one open-time fill that writes the same converted values to transposed offsets in the same buffer, and the accumulate c->cv[ch * c->dm + i] using the context's dm rather than a literal (the #380 generator lesson). Verified on the tree before any board: checks.sh rc=0, host 19/19 byte-exact, token_delta 0, golden_missing 0, fidelity 5.341e-05 identical, top1 10/10, and the pool size is unchanged. Engine tree then restored byte-identical to the accepted commit (md5 5c646468b78f verified against git show).","priced_now":"KB CT gave both halves of the picture on one image: bit-exact device differential (fill/read/split, 0 mismatches, including the 4+4 two-core split in both call orders) and pricing of 0.0 % warm / 26.6 % for channel-major cold. condT's two field readings were +0.294 % each on its discovery board; the cold measurement makes that magnitude credible (26.6 % of a per-token-cold 24 KB sweep inside the 2.5 ms mhc-mix + 24 ms hadamard neighbourhood), so this is the campaign's best in-rule unshipped candidate and its earlier 19/20 veto - a tail case, which run #395 showed is order-dependent - is now the thing under suspicion rather than the code.","own_bugs":"Two more, both harness-side, both caught before a verdict: (1) board 3's KB TP capture raised OSError EINVAL because I built the JTAG device path with os.readlink('/dev/needle-pi/flash') inside the board session, even though needle-board exports $FLASH_PORT and my own script header says so - the same script worked on board 1 only because the symlink resolved differently there. Now uses the exported variable, with my assertion on 'readlink not in s' catching a second occurrence so I did not relaunch a half-fixed script a third time. (2) The lane_one.sh TYPECHECK_FAIL from the previous iteration was a false negative from a && chain gated on a non-existent marker file; made unconditional with an explicit no-cc skip. Standing pattern: every one of these failed in a direction that either killed a lane loudly or - worse, in the marker-file case - looked like a real result.","lanes":"board 1 = idle (its UART leg is the unreliable one, so request-driven work is a poor fit; next job is the logits4 sub-split harvest, which needs only ~4 requests and board 1 has demonstrated 5-17 in a session). board 2 = fusion+cold-refund gate attempt (provenance a800d1ea1896 applied byte-exact, typecheck green, still priming/measuring). board 3 = KB TP tap-residency control, relaunched with the port fix. Accepted runtime stays 5.1167 with the accepted run's secondaries; nothing flashed from main this iteration and no speed claim is made.","next3":"1 condT field re-measure on board 3 (or 2) as soon as its screen lands - it is host-proven, zero-cost and cold-priced. 2 KB TP verdict: if tap residency wins big, the taps diagnosis (27.8 cycles/MAC = cold delivery) is confirmed and a resident-tap-table candidate opens; if it wins nothing, the phase is compute and the family closes with a number. 3 the logits4 sub-split on board 1 - the largest unattributed request-path block (3.8 ms tool / 7.0 ms route against a 0.23 ms projection), for which .auto/exp26/split_lg4.py exists and has never been run."}}
