{"run":549,"commit":"35c045c","metric":5.3033,"metrics":{"boot_bench_tps":5.621,"device_output_exact":18,"device_token_delta":52,"ext_decode_tps":5.2269,"gen_tokens":99,"host_output_exact":19,"internal_free":8415,"logit_max_delta":0.00005341,"logit_top1_match":10,"min_case_tps":5.31,"prefill_tps":5.59,"psram_free":2052252,"think_tps":4.2},"status":"keep","description":"Retracting #548's stall reading: board 3's cross-board clean-tree session is running normally. Its log grew from 11,492 to 15,255 bytes and the tail is now an elapsed/eta progress line, whereas #548 saw zero growth across one poll interval and concluded a stall. That was an under-evidenced reading of exactly the class this ledger has repeatedly retracted (#512 read a mid-suite absence of divergence lines as non-reproduction), and the correct rule is two consecutive flat polls or the bounded request-timeout diagnostic, not one interval of quiet - which is cheap here because the session's own progress lines carry eta. Still no verdict from board 3: no DEVICE_OUTPUT_DIVERGED, no LANE_RC, so no cross-board byte-exactness claim exists and acceptance continues to rest on board 2's clean trace-free reading (decode 5.5767, 18/20 byte-exact with divergences exactly heldout_interval_one and heldout_long_tools_note_only, token_delta 52, golden_missing 0, host 19/19, fidelity 5.341e-05), while speed is already two-board at 5.5767 and 5.58 on provenance 4d3094578050. Accepted pin deliberately held at 5.3033.","timestamp":1790271164369,"segment":1,"confidence":18.02457142857145,"asi":{"correction":"#548's stall reading is withdrawn. Bytes jumped 11,492 -> 15,255 and the tail is now an elapsed/eta progress line, so the session was emitting again; a single interval of zero growth was not sufficient evidence of a stall, and the honest rule is two consecutive flat polls or a timeout diagnostic, not one.","hypothesis":"Decide whether board 3's cross-board session is stalled, as #548 suspected, or still running.","next":"Read the compare block for the two-board byte-exactness claim. Meanwhile the acceptance position and pin are unchanged; and the correct standing rule for a flat lane log is to re-poll once before calling it stalled, which is exactly what this iteration bought by not acting on #548's reading.","note":"This is the same failure direction as #512 - a partial-state reading that looked like a result. Nothing was claimed from it, which is why retracting costs one line."}}
{"run":550,"commit":"35c045c","metric":5.3033,"metrics":{"boot_bench_tps":5.621,"device_output_exact":18,"device_token_delta":52,"ext_decode_tps":5.2269,"gen_tokens":99,"host_output_exact":19,"internal_free":8415,"logit_max_delta":0.00005341,"logit_top1_match":10,"min_case_tps":5.31,"prefill_tps":5.59,"psram_free":2052252,"think_tps":4.2},"status":"keep","description":"Board 3's cross-board clean-tree session still has not produced a byte-exactness verdict, so no cross-board quality claim exists and the acceptance position is unchanged. There is no device_output_exact, no DEVICE_OUTPUT_DIVERGED and no LANE_RC in its log, and elapsed wall time now exceeds board 2's ~55 minute clean session by a wide margin, which leaves two readings - the long unconstrained think group genuinely takes that long, or a case is wedged inside a 600 s request timeout because this lane predates the bounded diag_request_timeout_s knob. I am not choosing between them without evidence, and specifically not treating silence as either a pass or a stall: #549's correction showed one quiet poll interval is not a stall, and #513 showed mid-suite absence is not a pass. Two consecutive flat byte counts decides it, after which board 3 gets one relaunch since a second board's byte-exactness is required before re-pinning. Meanwhile speed is complete on two boards at provenance 4d3094578050 (5.5767 and 5.58, +5.2 % over the 5.3033 pin) and byte-exactness rests on board 2's clean 18/20 failing exactly heldout_interval_one and heldout_long_tools_note_only. Accepted pin deliberately held at 5.3033.","timestamp":1790271198738,"segment":1,"confidence":18.02457142857145,"asi":{"hypothesis":"Does board 3's cross-board clean-tree session have a verdict yet?","plan":"Standing rule from #549: two consecutive flat byte counts, or the request-timeout diagnostic, decide a stall - one flat interval is not enough. On the next poll either the compare block exists or this is recorded as a stall and board 3 is relaunched once, because a second board's byte-exactness is required before the stack can be re-pinned.","position":"Unchanged. Two-board speed at provenance 4d3094578050 (5.5767 / 5.58, +5.2 % over the 5.3033 pin); byte-exactness single-board on board 2's clean 18/20 failing exactly the two boot-state goldens (token_delta 52, golden_missing 0, host 19/19, fidelity 5.341e-05). Pin deliberately held at 5.3033.","state":"No verdict: still no device_output_exact, DEVICE_OUTPUT_DIVERGED or LANE_RC. Elapsed is now well beyond board 2's ~55 minute clean session, so board 3 is either in the long unconstrained think group or wedged inside a 600 s request timeout - the lane predates the bounded diag_request_timeout_s knob, so a wedged case simply waits."}}
{"run":551,"commit":"35c045c","metric":5.3033,"metrics":{"boot_bench_tps":5.621,"device_output_exact":18,"device_token_delta":52,"ext_decode_tps":5.2269,"gen_tokens":99,"host_output_exact":19,"internal_free":8415,"logit_max_delta":0.00005341,"logit_top1_match":10,"min_case_tps":5.31,"prefill_tps":5.59,"psram_free":2052252,"think_tps":4.2},"status":"keep","description":"Cross-board byte-exactness is now established on the clean trace-free acceptance tree: board 3 completes all 20 cases and reports DEVICE_OUTPUT_DIVERGED 18/20 with LANE_RC=1, diverging on exactly heldout_interval_one and heldout_long_tools_note_only - the identical pair and identical verdict shape board 2 produced on the byte-identical tree (provenance 4d3094578050 asserted by the runner on both). Speed agrees across the same pair of boards (5.5767 and 5.58, +5.2 % over the 5.3033 pin), so neither the divergence nor the speed reading is board-specific, and with the diagnostic removed there is no diagnostic traffic in the compared console stream. #550's unresolved question resolves in favour of the benign reading: the session was long, not wedged, and #548's single-flat-poll stall call was correctly left unrelied-upon. Accepted pin deliberately unchanged at 5.3033 because 18/20 is not 20/20: the two failing goldens encode the firmware's demo timer and sampling counters (run #391), so satisfying them byte-exactly requires the owner to re-capture them on a documented stateless boot or annotate them - silently re-capturing them to match the device would move the quality oracle rather than meet it.","timestamp":1790271234567,"segment":1,"confidence":18.02457142857145,"asi":{"claim_now_available":"Two boards, byte-identical trees at provenance 4d3094578050, trace-free console stream, agree on 18/20 with the SAME divergence pair and LANE_RC=1 on both. Speed agrees too (5.5767 / 5.58). This is the strongest acceptance evidence the campaign can produce without changing the oracle.","hypothesis":"Decide board 3's state by bytes and read its compare block - does the second clean-stream board reproduce board 2's verdict?","next":"Owner decision on the two goldens is the last step; then one session reads 20/20 and the pin moves 5.3033 -> ~5.577. #548's stall suspicion is also closed by this: the session was simply long, not wedged.","result":"Verdict present: DEVICE_OUTPUT_DIVERGED 18/20, LANE_RC=1, diverging on heldout_interval_one and heldout_long_tools_note_only - exactly board 2's pair. #550's open question (long think group vs wedged case) resolves as 'long'."}}
{"run":552,"commit":"35c045c","metric":5.3033,"metrics":{"prefill_tps":5.59,"ext_decode_tps":5.2269,"think_tps":4.2,"boot_bench_tps":5.621,"min_case_tps":5.31,"gen_tokens":99,"internal_free":8415,"psram_free":2052252,"device_output_exact":18,"device_token_delta":52,"logit_max_delta":0.00005341,"logit_top1_match":10,"host_output_exact":19},"status":"keep","description":"Recorded the cross-board acceptance evidence in .auto/OWNER_ACCEPTANCE_PACKET.md (5.5767 and 5.58, both 18/20 with the same divergence pair, provenance 4d3094578050, snapshot md5 3c63ef73e719 ELF-verified trace-free) and disposed of the mentor queue at this lane turnover. No board time, no new measurement, pin deliberately held at 5.3033: the blocker is the owner's decision on the two demo-timer goldens.","timestamp":1790271292105,"segment":1,"confidence":18.02457142857145,"asi":{"hypothesis":"Persist the cross-board acceptance evidence and dispose of the mentor queue at this lane turnover.","mentor_disposition":"Items B1-B3 carry pre-merge numbers (5.5067 / 5.5517 / fusion -0.31 %) and are superseded by prov 4d3094578050; the queue's durable item 3 (frozen host/device tails already disagree) is corroborated by both boards failing the same two cases.","next":"Owner decision on the two demo-timer goldens, then one session expecting 20/20 and a re-pin near 5.577. No engineering candidate is outstanding at this stack."}}
{"run":553,"commit":"35c045c","metric":5.3033,"metrics":{"prefill_tps":5.59,"ext_decode_tps":5.2269,"think_tps":4.2,"boot_bench_tps":5.621,"min_case_tps":5.31,"gen_tokens":99,"internal_free":8415,"psram_free":2052252,"device_output_exact":18,"device_token_delta":52,"logit_max_delta":0.00005341,"logit_top1_match":10,"host_output_exact":19},"status":"keep","description":"Screened the one granularity knob the spin handshake made newly meaningful: main.c's rows_dual_core guard 'half < 2' becomes 'half < 1', so a 2-unit job now splits instead of running serially on the caller. Rationale is measured, not stylistic: #451 priced the split at ~3,973-4,603 cycles on the old semaphore handshake and tap96 lost 0.094 % adding splits, but #453/#456 removed most of that toll and explicitly warned that every sign priced against the old toll may flip. A grep of engine/*.c found exactly one split threshold (nd_model.c:156 'n >= 512', which already splits the n=768 emit), so this main.c guard is the remaining untested one; the prepared de-split candidate was deliberately NOT run because #456 states its predicted sign is now negative. Bit-exact by construction - rows are independent and the odd-total path is unchanged, the case test_odd_split.c exists to cover. Launched on board 3 with AUTO_GROUPS=primary against this board's own acceptance reading (5.58), provenance 85a6ec1342cd asserted by the runner, acceptance tree itself untouched (snapshotted md5 3c63ef73e719). Pin unchanged at 5.3033.","timestamp":1790271389137,"segment":1,"confidence":18.02457142857145,"asi":{"hypothesis":"With the spin handshake having removed most of the ~16.6 us wake toll, the split-granularity guard half < 2 in rows_dual_core is now the thing blocking 2-3 unit jobs (exactly the class that measured negative as tap96 under the old toll). Lower it to half < 1 so 2-unit jobs split, one line, bit-exact because rows are independent and the same odd-total code path is used (test_odd_split.c covers 1+5/5+1/3+3).","board":"3, AUTO_GROUPS=primary screen against the acceptance tree's own reading (5.58 on this board), provenance 85a6ec1342cd asserted by the runner; acceptance tree untouched and snapshotted.","mentor_disposition":"Mentor B1-B3 predate this stack (superseded); its B3 direction (notification/redundancy work) is already measured and shipped as lean notifications, so no queue item was dropped unaddressed.","next":"If primary improves and host goldens stay 19/19, cross-board and gate; if it regresses, that measures the residual toll's shape at small jobs and closes the granularity axis at the new base.","why_not_desplit1":"#456 is explicit that .auto/exp82/nd_model.c.desplit1 (zcsplit serial for n<1536) has the OPPOSITE predicted sign post-spin, so it stays unrun; and a grep shows nd_model.c has exactly one split threshold (n >= 512, which already splits the n=768 emit), so the only untried granularity knob left is the half < 2 guard in main.c."}}
{"run":554,"commit":"35c045c","metric":5.3033,"metrics":{"prefill_tps":5.59,"ext_decode_tps":5.2269,"think_tps":4.2,"boot_bench_tps":5.621,"min_case_tps":5.31,"gen_tokens":99,"internal_free":8415,"psram_free":2052252,"device_output_exact":18,"device_token_delta":52,"logit_max_delta":0.00005341,"logit_top1_match":10,"host_output_exact":19},"status":"keep","description":"No reading yet from the half<1 granularity screen on board 3: the lane log's tail is flash_s=6, i.e. flashed and inside the five-minute priming window, so no decode_tps, no device_output_exact and no host golden verdict exist. Nothing claimed; the acceptance tree and its cross-board 18/20 verdict are untouched, and the pin stays deliberately at 5.3033.","timestamp":1790271415301,"segment":1,"confidence":18.02457142857145,"asi":{"hypothesis":"Read the half<1 split-granularity screen on board 3.","next":"Compare primary decode against this board's acceptance reading 5.58 on the byte-identical base; a reading within one quantum means the granularity guard is not binding post-spin and the axis closes at the new base. Host goldens are checked by the same lane's pre-check.","state":"No reading yet - log tail is flash_s=6, so the image is flashed and the board is in its priming window. The candidate (main.c half<1, prov 85a6ec1342cd) is bit-exact by construction; rows are independent and the odd-total path is unchanged."}}
{"run":555,"commit":"35c045c","metric":5.3033,"metrics":{"prefill_tps":5.59,"ext_decode_tps":5.2269,"think_tps":4.2,"boot_bench_tps":5.621,"min_case_tps":5.31,"gen_tokens":99,"internal_free":8415,"psram_free":2052252,"device_output_exact":18,"device_token_delta":52,"logit_max_delta":0.00005341,"logit_top1_match":10,"host_output_exact":19},"status":"keep","description":"The half<1 split-granularity screen on board 3 has not emitted its decode line yet, so this iteration claims nothing. Timing explains it: the lane flashed at flash_s=6 and a primary-group reading needs the five-minute prefix priming, the boot bench and six requests, roughly 15-20 minutes - the same lesson #549 and #551 taught about not reading silence as either a stall or a result. No side task was invented to fill the iteration: the split-granularity, delivery, transform, transcendental and call-surface families all carry measured closures at this stack, the acceptance tree's cross-board 18/20 verdict is recorded, and the blocker is the owner's disposition of the two demo-timer goldens. Pin deliberately unchanged at 5.3033; the candidate's provenance (85a6ec1342cd) is asserted by the runner and the acceptance snapshot (md5 3c63ef73e719) is untouched.","timestamp":1790271445590,"segment":1,"confidence":18.02457142857145,"asi":{"hypothesis":"Read the half<1 split-granularity screen result on board 3.","next":"Primary decode vs this board's 5.58 acceptance reading on the byte-identical base, plus the lane's own host 19/19 pre-check. Within one quantum means the guard is not binding post-spin and the split-granularity axis closes at the new base; a real gain means small jobs now pay and I cross-board it.","timing_note":"Expected decode line lands roughly 15-20 min after flash (five-minute priming, boot bench, then six primary cases), so absence at this poll is ordinary rather than a stall - the lesson #549 and #551 both paid for.","why_no_side_task":"No filler candidate and no accepted-image re-measure: every lever family carries a measured closure at this stack and the acceptance blocker is the owner's two goldens."}}
{"run":556,"commit":"35c045c","metric":5.3033,"metrics":{"prefill_tps":5.59,"ext_decode_tps":5.2269,"think_tps":4.2,"boot_bench_tps":5.621,"min_case_tps":5.31,"gen_tokens":99,"internal_free":8415,"psram_free":2052252,"device_output_exact":18,"device_token_delta":52,"logit_max_delta":0.00005341,"logit_top1_match":10,"host_output_exact":19},"status":"keep","description":"The half<1 split-granularity screen on board 3 is alive and answering requests (log bytes up to 4,865, tail is a device console line 'EVT think=0', bench.py live) but has written no decode_tps, no device_output_exact and no LANE_RC, so this iteration claims nothing. Notable harness detail recorded rather than guessed at: with AUTO_GROUPS=primary the summary metric lines appear at the end of the run, so a mid-log absence of decode_tps is expected and is not the stall signal #548 wrongly inferred elsewhere. Acceptance position unchanged - cross-board 18/20 with the identical divergence pair on provenance 4d3094578050, speed 5.5767/5.58 - and the pin is deliberately held at 5.3033 pending the owner's decision on the two demo-timer goldens; the candidate tree is separate (provenance 85a6ec1342cd) and the acceptance snapshot md5 3c63ef73e719 remains intact.","timestamp":1790271478129,"segment":1,"confidence":18.02457142857145,"asi":{"hypothesis":"Is the half<1 screen producing output, and is any reading available?","next":"Poll for the final metric lines; with AUTO_GROUPS=primary the decode metric is written at the end of the run, so the absence of a decode_tps token mid-log is expected rather than alarming - the same lesson as #541/#549, now with the added detail that the group-restricted runner prints its summary only after the cases finish.","state":"Alive and advancing: log bytes grew to 4,865 and the tail is a device console line ('EVT think=0'), i.e. the board is answering requests, with a live bench.py. No decode_tps, no device_output_exact and no LANE_RC yet, so no claim."}}
{"run":557,"commit":"35c045c","metric":5.3033,"metrics":{"prefill_tps":5.59,"ext_decode_tps":5.2269,"think_tps":4.2,"boot_bench_tps":5.624,"min_case_tps":5.31,"gen_tokens":99,"internal_free":8415,"psram_free":2052252,"device_output_exact":18,"device_token_delta":52,"logit_max_delta":0.00005341,"logit_top1_match":10,"host_output_exact":19},"status":"keep","description":"The half<1 split-granularity candidate has emitted only its boot-bench line so far: 5.624 against this board's acceptance-tree boot bench of 5.621, i.e. +0.05 %, one quantisation tick - so allowing 2-unit jobs to split does not change the timed-token arithmetic in the bench path. That is a secondary monitor, not the primary metric, and the primary decode line plus device byte-exactness for the primary group are still pending, so no keep/discard decision is taken from this reading. Context for the decision: #451 measured the old semaphore split toll at 3,973-4,603 cycles, #453's spin handshake removed most of it, and #456 warned that any granularity sign priced against the old toll may flip - this candidate tests exactly that at the new base, on board 3 (provenance 85a6ec1342cd) against the same board's 5.58 acceptance reading, with the acceptance snapshot md5 3c63ef73e719 intact. Accepted pin deliberately unchanged at 5.3033, where the cross-board 18/20 verdict on provenance 4d3094578050 still awaits the owner's decision on the two demo-timer goldens.","timestamp":1790271513228,"segment":1,"confidence":18.02457142857145,"asi":{"caveat":"The boot bench is a secondary monitor, not the metric, and it is insensitive to request-path-only effects; no keep/discard decision follows from it. The candidate is bit-exact by construction and its own device byte-exactness check runs with the primary group.","hypothesis":"Extract whatever timing evidence the half<1 screen has emitted so far.","next":"Poll for the primary-group decode line and compare with this board's 5.58 acceptance reading on the otherwise byte-identical tree; that is the keep/discard datum. If within one quantum, the split-granularity axis closes at the new base, which is itself the disposition #456 asked for.","reading":"One tps= line exists so far - 5.624, which is the boot bench (per-case EVT done lines have not appeared yet). Against the acceptance tree's own boot bench 5.621 on this same board that is +0.05 %, i.e. one quantisation tick, so the granularity change is not moving the timed-token arithmetic in the bench path."}}
