{"run":340,"commit":"c789943","metric":5.0317,"metrics":{"boot_bench_tps":5.079,"device_output_exact":17,"device_token_delta":0,"ext_decode_tps":4.961,"gen_tokens":99,"host_output_exact":16,"internal_free":14903,"logit_max_delta":0.00005341,"logit_top1_match":10,"min_case_tps":4.81,"prefill_tps":5.3117,"psram_free":2052252,"think_tps":3.94},"status":"discard","description":"Experiment 25B - embedding reads through the PSRAM tier instead of mmap'd flash: MEASURED, EXACTLY NEUTRAL, reverted - and it converts run #206's inference into measured fact. FOUND BY run #340: nd_model_logits_subset, nd_model_logits_all and the per-token nd_cq_dequant_row passed nd_cact_data(&m->c,&m->embedding) = the mmap'd FLASH pointer, while every dense projection passes nd_tier_ptr(m,t) = the 12 MB staged PSRAM copy that run #206 measured to cover the embedding (in_span=1, content 7,848,512 B). So ~512 scattered 4-bit rows per constrained token, and all 8192 (6.29 MB) per think token, came from flash while an identical copy sat in PSRAM. CHANGE: one line per site, bit-exact by construction (identical bytes; host build has no tier so the host path is literally unchanged - 16/16 byte-exact, fidelity 5.341e-05 unchanged). VERDICT: decode 5.0317 = +0.034 %, the same single tick as run #340, all 17 per-case values identical between the two runs, image md5 different so both really built and flashed (the campaign's known determinism, not a stale image). The decisive monitor is think_tps, which reads the whole embedding every token: 3.94 -> 3.94, literally zero movement; prefill 5.3117, extended 4.961, boot bench 5.079, min_case 4.81 all unchanged to the tick; 17/17 device + 16/16 host byte-exact, golden_missing=0, token_delta 0, top1 10/10, internal_free 14,903, psram_free 2,052,252. WHY IT MATTERS: run #206 widened the tier to cover the embedding, measured think unchanged, and concluded scattered rows are access-pattern-limited rather than address-space-limited - but that run could not have moved because the code never asked for the tier. This run did ask and got zero, so the conclusion is now measured rather than inferred: on ESP32-S3 a scattered cache-line fill costs the same from mmap'd flash as from PSRAM, and the tier's documented +1.5 % belongs to big sequential streams only. Sampler-gather delivery is therefore unbuyable three ways: residency (this run, +0.03 %), DMA prefetch (#287, -17.9 %), external clock (#289, forbidden by the documented maxima). NEXT is structural, not memory-side: measure the real per-step candidate count n and take the singleton case for free - when the grammar admits exactly one legal candidate, return it without preparing or projecting anything, bit-exact because the argmax of a singleton is its own element.","timestamp":1790119590158,"segment":1,"confidence":19.910000000000018,"asi":{"candidate":"Experiment 25B: route every embedding read (logits_subset's candidate gather, logits_all's full-vocabulary projection, the per-token input-row nd_cq_dequant_row) through nd_tier_ptr() - the staged 12 MB PSRAM copy - instead of nd_cact_data()'s mmap'd flash pointer. Same bytes, different backing store, bit-exact by construction: 17/17 device + 16/16 host byte-exact, golden_missing=0, token_delta 0, fidelity 5.341e-05, top1 10/10, memory unchanged.","found_by":"run #340's null: the gather passed nd_cact_data() while every dense projection passed nd_tier_ptr().","hypothesis":"Run #340's null exposed that the sampler's embedding reads are the ONLY weight reads in the model that bypass nd_tier_ptr(), even though run #206's in-tree tier trace measured the embedding inside the staged span (in_span=1, content 7,848,512 B). Identical bytes already resident in PSRAM - 6.29 MB/token for think, ~0.2 MB/token for the constrained gather - so one line per site.","metric_read":"decode 5.0317 vs accepted 5.0300 - the same single quantisation tick run #340 produced, and all 17 per-case tps values identical between the two runs (route_translate 4.810 in both, one tick above the accepted worst case). Image md5 6a3544ff -> e52e1eaf, so the change was really built and flashed; the equality is the campaign's determinism, not a stale image.","next_action_hint":"Price the gather at the ACTUAL per-step candidate count n (a counter over the six frozen prompts), and take the singleton for free: when the grammar admits exactly one legal token, return it without preparing or projecting anything - bit-exact because the argmax of a singleton is its own element.","not_this":"Not evidence the tier is worthless for the dense sequential streams it was built for (+1.5 %, run #206 family, unchanged). It says PSRAM residency cannot buy scattered row reads.","reinterpretation":"Run #206 widened the tier span to cover the embedding, measured think_tps unchanged, and inferred 'scattered rows are limited by the access pattern, not the address space'. That run structurally could not have moved, because the code never asked for the tier. This run did ask and got exactly zero, so the inference is now a measured fact: a scattered cache-line fill costs the same from mmap'd flash as from PSRAM on this part.","result":"think_tps 3.94 -> 3.94 - EXACTLY ZERO on the path that reads the entire embedding every token. prefill 5.3117 -> 5.3117, extended 4.961 -> 4.961, boot bench 5.079 -> 5.079. Below the 0.2 % bar -> discarded and reverted.","why_340_underdelivered":"the same arithmetic also explains run #340: if the real per-step n is well below the 512 cap, the gather is a couple of ms rather than 5.7, and a +7.68 % schedule win on it is ~+0.1 %.","why_it_matters":"delivery for the sampler's gather cannot be bought by residency (this run), DMA (#287, -17.9 %) or clock (#289, forbidden): three independent attempts, three nulls."}}
{"run":341,"commit":"HEAD","metric":5.03,"metrics":{"boot_bench_tps":5.076,"device_output_exact":17,"device_token_delta":0,"ext_decode_tps":4.956,"gen_tokens":99,"host_output_exact":16,"internal_free":14903,"logit_max_delta":0.00005341,"logit_top1_match":10,"min_case_tps":4.8,"prefill_tps":5.3067,"psram_free":2052252,"think_tps":3.94},"status":"keep","description":"Measurement-authority iteration - the free variable behind two nulls, measured on the host for the price of one build (no board time; decode_tps is the accepted 5.0300 carried forward from run #333 because the shipping tree is byte-identical to it). WHAT WAS MEASURED: the real candidate-set size n that nd_model_logits_subset projects per decode step, counted inside nd_sample_hidden under a define, over three real prompts through the host engine (which runs the same code and reproduces the goldens byte-exact, so its distribution is the device's). Result: mean_n = 6.8 rows per token. Distribution over 25 sampled steps of two prompts: n==1 in 3, 2..3 in 11, 4..7 in 8, 8..15 in 2, one step in 64..512 (the first constrained step, max_n=68), and never above the 512 cap that would take the full-vocabulary path. WHY THAT MATTERS: run #166's request-path map attributed 5.7 ms/token to this projection, and runs #340 (handwritten 4-bit kernel per gathered row, +7.68 % measured in isolation) and #341 (PSRAM tier for the embedding reads) were both priced from that figure and both measured +0.03 %. At n~7 the projection is ~20k cycles two-core = 0.08 ms, so +7.68 % of it is +0.003 % - the two nulls are now explained quantitatively rather than suspiciously, and run #166's 5.7 ms must be read as overhead bracketed by ND_P_LOGITS (the once-per-token prepare, timer placement), not as a projection budget. The sampler family is therefore closed at an order of magnitude smaller scale than the ledger believed: everything that scales with n - the candidate projection, the per-candidate token_ok byte walk, the piece lookups - is bounded by n~7, while what scales with the vocabulary was already reduced by run #288's first-byte index to a median of ~51 visited ids. CANDIDATE KILLED WITHOUT BUILDING IT: the singleton shortcut (when the grammar admits exactly one legal id, return it without preparing or projecting anything - bit-exact because the argmax of a singleton is its own element) would have been 3 lines and is worth ~one row, ~0.01 ms, even at its 12 % hit rate. The distribution killed it for one host build instead of one device run. HARNESS FACT for the campaign's own tooling, and it belongs to the vacuous-pass family this session keeps finding: both counters I wrote printed on a 250-step cadence while a real nd_dump generation is 23-35 steps, so 'no output' looked like 'the instrumented code never runs' when it was a threshold no real process ever reaches (this is what made run #340's differential probe look dead before the unconditional print showed the embedding is 4-bit); and .auto/bench.py captures the generator's stdout, so engine-side printf diagnostics never appear in its log - run host/build/nd_dump directly to see them. Tree is back to the accepted runtime: engine/src/nd_sample.c reverted, host build reconfigured with no extra flags, host_output_exact=16 with token_delta 0 re-verified afterwards.","timestamp":1790119898436,"segment":1,"confidence":19.910000000000018,"asi":{"candidate_tested_this_iteration":"None on device - deliberately. The singleton shortcut I was about to build (return cand[0] when the grammar admits exactly one legal token, bit-exact because the argmax of a singleton is its own element) was killed off-device by the measured n distribution: at a 12 % hit rate and n=1 it saves ONE projected row = ~0.01 ms, i.e. +0.005 %. Building it would have spent a board on noise.","hypothesis":"Runs #340 and #341 both measured +0.03 % against a screen that priced +7.68 % of a 5.7 ms phase. The arithmetic only fits one unmeasured variable: the real candidate count n per decode step, which the sampler caps at 512 and which run #166's phase budget implicitly assumed was near the cap.","metric_provenance":"No device run this iteration: the accepted runtime's tree is unchanged (engine/ esp32/ host/ tools/ diff = 0 lines against run #333's accepted image), so decode_tps is 5.0300 by construction and the secondaries are #333's canonical values carried forward and labelled (#299/#300 convention). The measurement this iteration is host-side: the engine runs the same code and produced byte-identical generations (host_output_exact=16, token_delta=0) with the counter build, so its n distribution is the device's.","method":"Measure the free variable before pricing the lever. Two consecutive nulls were priced off a phase estimate inherited from a profile that structurally could not separate the once-per-token prepare from the n-proportional rows.","next_action_hint":"The request-path-only time (bench 5.076 vs primary 5.0300, ~2 %) is now unattributed: with the projection at 0.08 ms it is not the sampler's arithmetic either (#288 left a median of ~51 visited ids). Harvest prof_dump on the CURRENT image for a tools request and a route request to find where the bench-invisible milliseconds actually are before writing another sampler or projection optimisation.","not_this":"Not a criticism of run #166, which measured 5.7 ms honestly: ND_P_LOGITS brackets nd_cq_prepare plus the gather, and at n~7 whatever it measured is overhead around the call, not a projection budget.","result":"mean_n = 6.8 rows per token (buckets: n==1 in 3/25 steps, 2..3 in 11, 4..7 in 8, 8..15 in 2, one step at 68, none above 512). Seven 4-bit rows two-core is ~20k cycles = 0.08 ms, so +7.68 % of the gather is +0.003 % of the token - which is exactly the +0.03 % that #340 and #341 measured, once you add a tick of noise.","risk_found":"both of my counters printed on a 250-step cadence and a real nd_dump run is 23-35 steps, so 'no output' read as 'the code never runs' when it was a threshold no real process reaches; and bench.py captures the generator's stdout, so engine printfs never surface in its log."}}
{"run":342,"commit":"8fbb1a1","metric":5.0383,"metrics":{"boot_bench_tps":5.086,"device_output_exact":17,"device_token_delta":0,"ext_decode_tps":4.966,"gen_tokens":99,"host_output_exact":16,"internal_free":14135,"logit_max_delta":0.00005341,"logit_top1_match":10,"min_case_tps":4.81,"prefill_tps":5.3167,"psram_free":2052252,"think_tps":3.94},"status":"discard","description":"Experiment 22D-D2, third independent reading (board 2, batch 20260923T0030L) - ND_HOT on sigmoidf_pair at the NEW accepted runtime: MEASURED +0.199 % on board 2, still below the keep bar on the canonical board, not kept. This is a distinct candidate measured on a discovery board against that board's pinned accepted reading (5.0283 from run #334), logged separately per the campaign's rules rather than folded into the main line. Result: decode 5.0383, extended 4.966 (+0.20 %), prefill 5.3167 (+0.19 %), boot bench 5.086 from 5.075 - the bench moving is the mechanism check, because the Monarch MLP's SiLU gate is inside the bench, unlike the sampler work in runs #340/#341; think 3.94, min_case 4.81, 17/17 device byte-exact, DEVICE_GATE_OK, token_delta 0, fidelity 5.341e-05 identical to the control, top1 10/10, and the expected cost: internal_free 14,135 against 14,903, i.e. -768 B, exactly the figure run #336 recorded for the same one-word change. WHY IT IS NOT KEPT: the canonical board's reading of this candidate is +0.165 % (run #336), and three readings across two boards - #336 board 1 +0.165 %, #336 board 2 +0.20 %, this one board 2 +0.199 % - average +0.188 %, under the 0.2 % bar the campaign keeps its rule at. The evidence quality is the unusual part: the candidate image read exactly 5.0383 on BOTH boards in BOTH batches, so per-variant board spread is zero and this is a measurement rather than a coin flip; what blocks it is the bar, not the noise. It stays banked as the campaign's best sub-bar candidate and as an explicit owner decision (keep it if the bar moves to 0.15 %, or if +0.19 % is worth 768 B of a 14,903 B heap). Tree for the accepted runtime is unchanged: the change lived only in board 2's worker checkout.","timestamp":1790119940743,"segment":1,"confidence":19.910000000000018,"asi":{"candidate":"D2 (re-measurement of run #336's banked candidate): ND_HOT on static-inline sigmoidf_pair - keep the call, move the callee from flash into IRAM. One-word change at engine/src/nd_model.c:64. The mechanism is run #337's callee audit: silu_rows and agate_rows live in IRAM and pay ~3,600 IRAM-to-flash calls per token.","hypothesis":"Re-price run #336's best-sub-bar candidate against the new accepted runtime (5.0300 after the phi asm), on a board where it had already been measured once, to see whether the phi change moved its delta.","kept_where":"exact one-line change is a single sed (documented in run #336's entry and .auto/ideas.md); nothing in the tree.","next_action_hint":"The campaign now has a 2x2x2 record on this lever and a measured +0.18 % mean. It needs a bar decision from the owner (0.2 % vs 0.15 %), not another measurement. Everything else left is the request-path map harvest.","note_on_evidence":"board 2's accepted reading for this runtime is 5.0283 (run #334), so the delta is +0.199 %. Across three independent readings - #336 board 1 (+0.165 %), #336 board 2 (+0.20 %), this one board 2 (+0.199 %) - the mean is +0.188 %. The candidate image read 5.0383 on both boards in both batches, i.e. per-variant board spread is zero and the effect is a measurement, not a coin flip.","rollback_reason":"Not a code rollback - the tree never contained it locally; the board's copy is the worker's own working tree, reset at the next sync. Logged as discard so it cannot be mistaken for a kept change.","result":"decode 5.0383 (+0.199 % on that board), extended 4.966 (+0.20 %), prefill 5.3167 (+0.19 %), boot bench 5.086 (from 5.075 - the bench moved, the mechanism check, since SiLU is inside it), think 3.94, min_case 4.81, 17/17 device byte-exact with DEVICE_GATE_OK and token_delta 0, fidelity 5.341e-05 identical, top1 10/10. Costs 768 B of internal heap: internal_free 14,135 against the accepted 14,903.","verdict":"NOT KEPT - the canonical board's reading of this candidate is +0.165 % (#336), below the 0.2 % keep bar, and it costs 768 B of a 14,903 B heap. Stays banked as the campaign's best sub-bar candidate and an explicit owner decision: keep it if the bar is ever set at 0.15 % or if +0.19 % for 768 B is wanted."}}
