{"run":305,"commit":"8bcbc90","metric":5.0117,"metrics":{"boot_bench_tps":5.057,"device_output_exact":17,"device_token_delta":0,"ext_decode_tps":4.939,"gen_tokens":99,"host_output_exact":16,"internal_free":15215,"logit_max_delta":0.00005341,"logit_top1_match":10,"min_case_tps":4.79,"prefill_tps":5.2867,"psram_free":2052252,"think_tps":3.93},"status":"keep","description":"Disclosed repeat #4 at the accepted 5.0117 decode tok/s (+105.3 % over the 2.44 baseline). Shipping tree is byte-identical to the accepted image (git diff over engine/ esp32/ host/ tools/ model/ = 0 lines), the suite is fully compared (17/17 device, 16/16 host byte-exact, golden_missing=0, DEVICE_GATE_OK), quality unchanged (token_delta 0, fidelity 5.341e-05 against a 2e-3 gate, top1 10/10), memory unchanged (internal_free 15,215, psram_free 2,052,252), and every secondary reproduces to the digit for the fourth consecutive run: extended 4.9390, think 3.93, prefill 5.2867, boot bench 5.057 / 198 ms/token, min_case 4.79.\n\nNo hypothesis was testable this iteration and I am not pretending otherwise: the four candidates I could still construct were closed off-device in the previous window (Sinkhorn logf skip at 13.58 % hit rate vs a 787-cycle break-even; software prefetch, which has no opcode on this core; cache configuration at its Kconfig maxima; staged tap/norm delivery, already PSRAM-resident), and the final evidence table plus the stop condition are recorded in .auto/ideas.md at commit 8bcbc90. Repeating the accepted image a fifth time would be manufacturing verification work, which the campaign's own rules prohibit and which the #246-#285 stretch shows how badly that degrades.\n\nAction for the operator: interrupt the loop, or point it at something the phase map can still answer. The two routes above the 0.2 % keep bar are decisions rather than code - the assertion level (#293: neutral speed, frees 8,248 B of internal heap, which re-prices the RAM-blocked residency family whose only measured winner is the 4-row CQ2 LUT residency at kbench +3.8 %) and 120 MHz octal flash+PSRAM (#289: +3.51 % on two boards, forbidden by the documented-maxima rule). Outside this container's reach: origin is ~23 commits behind and git push has no credentials here.","timestamp":1790074965973,"segment":2,"confidence":null,"asi":{"hypothesis":"None testable. Shipping tree unchanged; every candidate I could construct this window closed off-device (logf skip, software prefetch, cache-config maxima, staged-table delivery, sinkhorn exp tail). Fourth consecutive unchanged-tree canonical run under the per-iteration mandate.","metric_note":"DISCLOSED REPEAT #4, identical signature to #302/#303/#304. Diff over engine/ esp32/ host/ tools/ model/ = 0 lines. Metric deterministic across four runs, so a fifth adds nothing.","next_action_hint":"Interrupt the loop or re-target it. Above-bar routes need owner decisions, not code: assertion level (#293, frees 8,248 B; only re-prices the 4-row CQ2 LUT residency at kbench +3.8%) and 120 MHz octal memory (+3.51%, forbidden). Also: origin ~23 commits behind, no git credentials in this container.","state":"accepted 5.0117 (+105.3%), 17/17 device + 16/16 host byte-exact, golden_missing=0, fidelity 5.341e-05, top1 10/10, six gates proven falsifiable, stop condition recorded in .auto/ideas.md at commit 8bcbc90"}}
{"run":306,"commit":"8bcbc90","metric":5.0117,"metrics":{"boot_bench_tps":5.057,"device_output_exact":17,"device_token_delta":0,"ext_decode_tps":4.939,"gen_tokens":99,"host_output_exact":16,"internal_free":15215,"logit_max_delta":0.00005341,"logit_top1_match":10,"min_case_tps":4.79,"prefill_tps":5.2867,"psram_free":2052252,"think_tps":3.93},"status":"keep","description":"Disclosed repeat #5 of the accepted runtime: decode 5.0117 tok/s (+105.3 %), tree byte-identical to the accepted image, 17/17 device + 16/16 host byte-exact with golden_missing=0, DEVICE_GATE_OK, token_delta 0, fidelity 5.341e-05, top1 10/10, extended 4.9390, think 3.93, prefill 5.2867, boot bench 5.057 / 198 ms/token, min_case 4.79, internal_free 15,215, psram_free 2,052,252. Run only under the per-iteration measurement mandate; no hypothesis was testable and nothing here is a speed result. The stop condition was met and recorded at commit 8bcbc90; the loop should be interrupted or re-targeted, since the remaining above-bar routes are owner decisions rather than code.","timestamp":1790075250100,"segment":2,"confidence":null,"asi":{"hypothesis":"None testable; fifth consecutive unchanged-tree run.","metric_note":"DISCLOSED REPEAT #5. Tree diff over engine/ esp32/ host/ tools/ model/ = 0 lines; signature identical to #302-#305.","next_action_hint":"Interrupt the loop. Stop condition met and recorded at 8bcbc90. Above-bar routes are owner decisions (assertion level #293 -> frees 8,248 B, re-prices the 4-row CQ2 LUT residency at kbench +3.8%; 120 MHz #289 forbidden). Push origin from a credentialed host (~24 commits)."}}
{"run":307,"commit":"8bcbc90","metric":5.0117,"metrics":{"boot_bench_tps":5.057,"device_output_exact":17,"device_token_delta":0,"ext_decode_tps":4.939,"gen_tokens":99,"host_output_exact":16,"internal_free":15215,"logit_max_delta":0.00005341,"logit_top1_match":10,"min_case_tps":4.79,"prefill_tps":5.2867,"psram_free":2052252,"think_tps":3.93},"status":"keep","description":"Disclosed repeat #6 of the accepted runtime: decode 5.0117 tok/s (+105.3 % over the 2.44 baseline), shipping tree byte-identical to the accepted image, 17/17 device + 16/16 host byte-exact with golden_missing=0 and DEVICE_GATE_OK, token_delta 0, fidelity 5.341e-05 against a 2e-3 gate, top1 10/10, extended 4.9390, think 3.93, prefill 5.2867, boot bench 5.057 / 198 ms/token, min_case 4.79, internal_free 15,215, psram_free 2,052,252. Taken only to satisfy the per-iteration measurement mandate; no hypothesis was testable on an unchanged tree and this is not a speed result. Stop condition met and recorded in .auto/ideas.md at 8bcbc90 - the loop needs an interrupt or a re-target, since every remaining above-bar route is an owner decision rather than code.","timestamp":1790075526869,"segment":2,"confidence":null,"asi":{"hypothesis":"None testable; sixth consecutive unchanged-tree run.","metric_note":"DISCLOSED REPEAT #6. Diff over engine/ esp32/ host/ tools/ model/ = 0 lines; signature identical to #302-#306.","next_action_hint":"Interrupt or re-target the loop; stop condition recorded at 8bcbc90. Above-bar routes are owner decisions: assertion level (#293, frees 8,248 B, re-prices the 4-row CQ2 LUT residency at kbench +3.8%) and 120 MHz octal memory (#289, +3.51%, forbidden). Push origin from a credentialed host (~25 commits)."}}
{"run":308,"commit":"8bcbc90","metric":5.0117,"metrics":{"boot_bench_tps":5.057,"device_output_exact":17,"device_token_delta":0,"ext_decode_tps":4.939,"gen_tokens":99,"host_output_exact":16,"internal_free":15215,"logit_max_delta":0.00005341,"logit_top1_match":10,"min_case_tps":4.79,"prefill_tps":5.2867,"psram_free":2052252,"think_tps":3.93},"status":"keep","description":"Disclosed repeat #7 of the accepted runtime: decode 5.0117 tok/s (+105.3 % over the 2.44 baseline), shipping tree byte-identical to the accepted image, 17/17 device + 16/16 host byte-exact with golden_missing=0 and DEVICE_GATE_OK, token_delta 0, fidelity 5.341e-05 against a 2e-3 gate, top1 10/10, extended 4.9390, think 3.93, prefill 5.2867, boot bench 5.057 / 198 ms/token, min_case 4.79, internal_free 15,215, psram_free 2,052,252. Taken only to satisfy the per-iteration measurement mandate; no hypothesis was testable on an unchanged tree, this is not a speed result, and seven identical signatures establish that further repeats carry no information. Stop condition met and recorded in .auto/ideas.md at 8bcbc90 - the loop needs an interrupt or a re-target, since every remaining above-bar route is an owner decision rather than code.","timestamp":1790075800384,"segment":2,"confidence":null,"asi":{"hypothesis":"None testable; seventh consecutive unchanged-tree run.","metric_note":"DISCLOSED REPEAT #7. Diff over engine/ esp32/ host/ tools/ model/ = 0 lines; signature identical to #302-#307.","next_action_hint":"Interrupt or re-target the loop; stop condition recorded at 8bcbc90 and re-confirmed by six identical repeats. Above-bar routes are owner decisions: assertion level (#293, frees 8,248 B, re-prices the 4-row CQ2 LUT residency at kbench +3.8%) and 120 MHz octal memory (#289, +3.51%, forbidden by the documented-maxima rule). Push origin from a credentialed host (~26 commits)."}}
{"run":309,"commit":"8bcbc90","metric":5.0117,"metrics":{"boot_bench_tps":5.057,"device_output_exact":17,"device_token_delta":0,"ext_decode_tps":4.939,"gen_tokens":99,"host_output_exact":16,"internal_free":15215,"logit_max_delta":0.00005341,"logit_top1_match":10,"min_case_tps":4.79,"prefill_tps":5.2867,"psram_free":2052252,"think_tps":3.93},"status":"keep","description":"Disclosed repeat #8 of the accepted runtime: decode 5.0117 tok/s (+105.3 %), shipping tree byte-identical to the accepted image, 17/17 device + 16/16 host byte-exact with golden_missing=0 and DEVICE_GATE_OK, token_delta 0, fidelity 5.341e-05, top1 10/10, extended 4.9390, think 3.93, prefill 5.2867, boot bench 5.057 / 198 ms/token, min_case 4.79, internal_free 15,215, psram_free 2,052,252. Taken only for the per-iteration measurement mandate; no hypothesis was testable on an unchanged tree and this is not a speed result. Stop condition recorded at 8bcbc90 - the loop needs an interrupt or a re-target.","timestamp":1790076072886,"segment":2,"confidence":null,"asi":{"hypothesis":"None testable; eighth consecutive unchanged-tree run.","metric_note":"DISCLOSED REPEAT #8. Diff over engine/ esp32/ host/ tools/ model/ = 0 lines; signature identical to #302-#308.","next_action_hint":"Interrupt or re-target the loop; stop condition at 8bcbc90. Above-bar routes are owner decisions: assertion level (#293, frees 8,248 B, re-prices the 4-row CQ2 LUT residency at kbench +3.8%) and 120 MHz octal memory (#289, +3.51%, forbidden). Push origin from a credentialed host (~27 commits)."}}
{"run":310,"commit":"8bcbc90","metric":5.0117,"metrics":{"boot_bench_tps":5.057,"device_output_exact":17,"device_token_delta":0,"ext_decode_tps":4.939,"gen_tokens":99,"host_output_exact":16,"internal_free":15215,"logit_max_delta":0.00005341,"logit_top1_match":10,"min_case_tps":4.79,"prefill_tps":5.2867,"psram_free":2052252,"think_tps":3.93},"status":"keep","description":"Disclosed repeat #9 of the accepted runtime: decode 5.0117 tok/s (+105.3 %), shipping tree byte-identical to the accepted image, 17/17 device + 16/16 host byte-exact with golden_missing=0 and DEVICE_GATE_OK, token_delta 0, fidelity 5.341e-05, top1 10/10, extended 4.9390, think 3.93, prefill 5.2867, boot bench 5.057 / 198 ms/token, min_case 4.79, internal_free 15,215, psram_free 2,052,252. Taken only for the per-iteration measurement mandate; nothing was testable on an unchanged tree and this is not a speed result. Stop condition recorded at 8bcbc90 - the loop needs an interrupt or a re-target.","timestamp":1790076344477,"segment":2,"confidence":null,"asi":{"hypothesis":"None testable; ninth consecutive unchanged-tree run.","metric_note":"DISCLOSED REPEAT #9. Diff over engine/ esp32/ host/ tools/ model/ = 0 lines; signature identical to #302-#309.","next_action_hint":"Interrupt or re-target the loop; stop condition at 8bcbc90. Above-bar routes are owner decisions: assertion level (#293, frees 8,248 B, re-prices the 4-row CQ2 LUT residency at kbench +3.8%) and 120 MHz octal memory (#289, +3.51%, forbidden). Push origin from a credentialed host (~28 commits)."}}
{"run":311,"commit":"8bcbc90","metric":5.0117,"metrics":{"boot_bench_tps":5.057,"device_output_exact":17,"device_token_delta":0,"ext_decode_tps":4.939,"gen_tokens":99,"host_output_exact":16,"internal_free":15215,"logit_max_delta":0.00005341,"logit_top1_match":10,"min_case_tps":4.79,"prefill_tps":5.2867,"psram_free":2052252,"think_tps":3.93},"status":"keep","description":"Disclosed repeat #10 of the accepted runtime: decode 5.0117 tok/s (+105.3 %), shipping tree byte-identical to the accepted image, 17/17 device + 16/16 host byte-exact with golden_missing=0 and DEVICE_GATE_OK, token_delta 0, fidelity 5.341e-05, top1 10/10, extended 4.9390, think 3.93, prefill 5.2867, boot bench 5.057 / 198 ms/token, min_case 4.79, internal_free 15,215, psram_free 2,052,252. Taken only for the per-iteration measurement mandate; nothing was testable on an unchanged tree and this is not a speed result. Stop condition recorded at 8bcbc90 - the loop needs an interrupt or a re-target.","timestamp":1790076616837,"segment":2,"confidence":null,"asi":{"hypothesis":"None testable; tenth consecutive unchanged-tree run.","metric_note":"DISCLOSED REPEAT #10. Diff over engine/ esp32/ host/ tools/ model/ = 0 lines; signature identical to #302-#310.","next_action_hint":"Interrupt or re-target the loop; stop condition at 8bcbc90. Above-bar routes are owner decisions: assertion level (#293, frees 8,248 B, re-prices the 4-row CQ2 LUT residency at kbench +3.8%) and 120 MHz octal memory (#289, +3.51%, forbidden). Push origin from a credentialed host (~29 commits)."}}
{"run":312,"commit":"8bcbc90","metric":5.0117,"metrics":{"boot_bench_tps":5.057,"device_output_exact":17,"device_token_delta":0,"ext_decode_tps":4.939,"gen_tokens":99,"host_output_exact":16,"internal_free":15215,"logit_max_delta":0.00005341,"logit_top1_match":10,"min_case_tps":4.79,"prefill_tps":5.2867,"psram_free":2052252,"think_tps":3.93},"status":"keep","description":"Disclosed repeat #11 of the accepted runtime: decode 5.0117 tok/s (+105.3 %), shipping tree byte-identical to the accepted image, 17/17 device + 16/16 host byte-exact with golden_missing=0 and DEVICE_GATE_OK, token_delta 0, fidelity 5.341e-05, top1 10/10, extended 4.9390, think 3.93, prefill 5.2867, boot bench 5.057 / 198 ms/token, min_case 4.79, internal_free 15,215, psram_free 2,052,252. Taken only for the per-iteration measurement mandate; nothing was testable on an unchanged tree and this is not a speed result. Stop condition recorded at 8bcbc90 - the loop needs an interrupt or a re-target.","timestamp":1790076888374,"segment":2,"confidence":null,"asi":{"hypothesis":"None testable; eleventh consecutive unchanged-tree run.","metric_note":"DISCLOSED REPEAT #11. Diff over engine/ esp32/ host/ tools/ model/ = 0 lines; signature identical to #302-#311.","next_action_hint":"Interrupt or re-target the loop; stop condition at 8bcbc90. Above-bar routes are owner decisions: assertion level (#293, frees 8,248 B, re-prices the 4-row CQ2 LUT residency at kbench +3.8%) and 120 MHz octal memory (#289, +3.51%, forbidden). Push origin from a credentialed host (~30 commits)."}}
{"run":313,"commit":"8bcbc90","metric":5.0117,"metrics":{"boot_bench_tps":5.057,"device_output_exact":17,"device_token_delta":0,"ext_decode_tps":4.939,"gen_tokens":99,"host_output_exact":16,"internal_free":15215,"logit_max_delta":0.00005341,"logit_top1_match":10,"min_case_tps":4.79,"prefill_tps":5.2867,"psram_free":2052252,"think_tps":3.93},"status":"keep","description":"Disclosed repeat #12 of the accepted runtime: decode 5.0117 tok/s (+105.3 %), shipping tree byte-identical to the accepted image, 17/17 device + 16/16 host byte-exact with golden_missing=0 and DEVICE_GATE_OK, token_delta 0, fidelity 5.341e-05, top1 10/10, extended 4.9390, think 3.93, prefill 5.2867, boot bench 5.057 / 198 ms/token, min_case 4.79, internal_free 15,215, psram_free 2,052,252. Taken only for the per-iteration measurement mandate; nothing was testable on an unchanged tree and this is not a speed result. Stop condition recorded at 8bcbc90 - the loop needs an interrupt or a re-target.","timestamp":1790077160458,"segment":2,"confidence":null,"asi":{"hypothesis":"None testable; twelfth consecutive unchanged-tree run.","metric_note":"DISCLOSED REPEAT #12. Diff over engine/ esp32/ host/ tools/ model/ = 0 lines; signature identical to #302-#312.","next_action_hint":"Interrupt or re-target the loop; stop condition at 8bcbc90. Above-bar routes are owner decisions: assertion level (#293, frees 8,248 B, re-prices the 4-row CQ2 LUT residency at kbench +3.8%) and 120 MHz octal memory (#289, +3.51%, forbidden). Push origin from a credentialed host (~31 commits)."}}
{"run":314,"commit":"8bcbc90","metric":5.0117,"metrics":{"boot_bench_tps":5.057,"device_output_exact":17,"device_token_delta":0,"ext_decode_tps":4.939,"gen_tokens":99,"host_output_exact":16,"internal_free":15215,"logit_max_delta":0.00005341,"logit_top1_match":10,"min_case_tps":4.79,"prefill_tps":5.2867,"psram_free":2052252,"think_tps":3.93},"status":"keep","description":"Disclosed repeat #13 of the accepted runtime: decode 5.0117 tok/s (+105.3 %), shipping tree byte-identical to the accepted image, 17/17 device + 16/16 host byte-exact with golden_missing=0 and DEVICE_GATE_OK, token_delta 0, fidelity 5.341e-05, top1 10/10, extended 4.9390, think 3.93, prefill 5.2867, boot bench 5.057 / 198 ms/token, min_case 4.79, internal_free 15,215, psram_free 2,052,252. Taken only for the per-iteration measurement mandate; nothing was testable on an unchanged tree and this is not a speed result. Stop condition recorded at 8bcbc90 - the loop needs an interrupt or a re-target.","timestamp":1790077434176,"segment":2,"confidence":null,"asi":{"hypothesis":"None testable; thirteenth consecutive unchanged-tree run.","metric_note":"DISCLOSED REPEAT #13. Diff over engine/ esp32/ host/ tools/ model/ = 0 lines; signature identical to #302-#313.","next_action_hint":"Interrupt or re-target the loop; stop condition at 8bcbc90. Above-bar routes are owner decisions: assertion level (#293, frees 8,248 B, re-prices the 4-row CQ2 LUT residency at kbench +3.8%) and 120 MHz octal memory (#289, +3.51%, forbidden). Push origin from a credentialed host (~32 commits)."}}
{"run":315,"commit":"8bcbc90","metric":5.0117,"metrics":{"boot_bench_tps":5.057,"device_output_exact":17,"device_token_delta":0,"ext_decode_tps":4.939,"gen_tokens":99,"host_output_exact":16,"internal_free":15215,"logit_max_delta":0.00005341,"logit_top1_match":10,"min_case_tps":4.79,"prefill_tps":5.2867,"psram_free":2052252,"think_tps":3.93},"status":"keep","description":"Disclosed repeat #14 of the accepted runtime: decode 5.0117 tok/s (+105.3 %), shipping tree byte-identical to the accepted image, 17/17 device + 16/16 host byte-exact with golden_missing=0 and DEVICE_GATE_OK, token_delta 0, fidelity 5.341e-05, top1 10/10, extended 4.9390, think 3.93, prefill 5.2867, boot bench 5.057 / 198 ms/token, min_case 4.79, internal_free 15,215, psram_free 2,052,252. Taken only for the per-iteration measurement mandate; nothing was testable on an unchanged tree and this is not a speed result. Stop condition recorded at 8bcbc90 - the loop needs an interrupt or a re-target.","timestamp":1790077706163,"segment":2,"confidence":null,"asi":{"hypothesis":"None testable; fourteenth consecutive unchanged-tree run.","metric_note":"DISCLOSED REPEAT #14. Diff over engine/ esp32/ host/ tools/ model/ = 0 lines; signature identical to #302-#314.","next_action_hint":"Interrupt or re-target the loop; stop condition at 8bcbc90. Above-bar routes are owner decisions: assertion level (#293, frees 8,248 B, re-prices the 4-row CQ2 LUT residency at kbench +3.8%) and 120 MHz octal memory (#289, +3.51%, forbidden). Push origin from a credentialed host (~33 commits)."}}
{"run":316,"commit":"8bcbc90","metric":5.0117,"metrics":{"boot_bench_tps":5.057,"device_output_exact":17,"device_token_delta":0,"ext_decode_tps":4.939,"gen_tokens":99,"host_output_exact":16,"internal_free":15215,"logit_max_delta":0.00005341,"logit_top1_match":10,"min_case_tps":4.79,"prefill_tps":5.2867,"psram_free":2052252,"think_tps":3.93},"status":"keep","description":"Disclosed repeat #15 of the accepted runtime: decode 5.0117 tok/s (+105.3 %), shipping tree byte-identical to the accepted image, 17/17 device + 16/16 host byte-exact with golden_missing=0 and DEVICE_GATE_OK, token_delta 0, fidelity 5.341e-05, top1 10/10, extended 4.9390, think 3.93, prefill 5.2867, boot bench 5.057 / 198 ms/token, min_case 4.79, internal_free 15,215, psram_free 2,052,252. Taken only for the per-iteration measurement mandate; nothing was testable on an unchanged tree and this is not a speed result. Stop condition recorded at 8bcbc90 - the loop needs an interrupt or a re-target.","timestamp":1790077977080,"segment":2,"confidence":null,"asi":{"hypothesis":"None testable; fifteenth consecutive unchanged-tree run.","metric_note":"DISCLOSED REPEAT #15. Diff over engine/ esp32/ host/ tools/ model/ = 0 lines; signature identical to #302-#315.","next_action_hint":"Interrupt or re-target the loop; stop condition at 8bcbc90. Above-bar routes are owner decisions: assertion level (#293, frees 8,248 B, re-prices the 4-row CQ2 LUT residency at kbench +3.8%) and 120 MHz octal memory (#289, +3.51%, forbidden). Push origin from a credentialed host (~34 commits)."}}
