{"run":317,"commit":"8bcbc90","metric":5.0117,"metrics":{"boot_bench_tps":5.057,"device_output_exact":17,"device_token_delta":0,"ext_decode_tps":4.939,"gen_tokens":99,"host_output_exact":16,"internal_free":15215,"logit_max_delta":0.00005341,"logit_top1_match":10,"min_case_tps":4.79,"prefill_tps":5.2867,"psram_free":2052252,"think_tps":3.93},"status":"keep","description":"Disclosed repeat #16 of the accepted runtime: decode 5.0117 tok/s (+105.3 %), shipping tree byte-identical to the accepted image, 17/17 device + 16/16 host byte-exact with golden_missing=0 and DEVICE_GATE_OK, token_delta 0, fidelity 5.341e-05, top1 10/10, extended 4.9390, think 3.93, prefill 5.2867, boot bench 5.057 / 198 ms/token, min_case 4.79, internal_free 15,215, psram_free 2,052,252. Taken only for the per-iteration measurement mandate; nothing was testable on an unchanged tree and this is not a speed result. Stop condition recorded at 8bcbc90 - the loop needs an interrupt or a re-target.","timestamp":1790078251120,"segment":2,"confidence":null,"asi":{"hypothesis":"None testable; sixteenth consecutive unchanged-tree run.","metric_note":"DISCLOSED REPEAT #16. Diff over engine/ esp32/ host/ tools/ model/ = 0 lines; signature identical to #302-#316.","next_action_hint":"Interrupt or re-target the loop; stop condition at 8bcbc90. Above-bar routes are owner decisions: assertion level (#293, frees 8,248 B, re-prices the 4-row CQ2 LUT residency at kbench +3.8%) and 120 MHz octal memory (#289, +3.51%, forbidden). Push origin from a credentialed host (~35 commits)."}}
{"run":318,"commit":"8bcbc90","metric":5.0117,"metrics":{"boot_bench_tps":5.057,"device_output_exact":17,"device_token_delta":0,"ext_decode_tps":4.939,"gen_tokens":99,"host_output_exact":16,"internal_free":15215,"logit_max_delta":0.00005341,"logit_top1_match":10,"min_case_tps":4.79,"prefill_tps":5.2867,"psram_free":2052252,"think_tps":3.93},"status":"keep","description":"Disclosed repeat #17 of the accepted runtime: decode 5.0117 tok/s (+105.3 %), shipping tree byte-identical to the accepted image, 17/17 device + 16/16 host byte-exact with golden_missing=0 and DEVICE_GATE_OK, token_delta 0, fidelity 5.341e-05, top1 10/10, extended 4.9390, think 3.93, prefill 5.2867, boot bench 5.057 / 198 ms/token, min_case 4.79, internal_free 15,215, psram_free 2,052,252. Taken only for the per-iteration measurement mandate; nothing was testable on an unchanged tree and this is not a speed result. Stop condition recorded at 8bcbc90 - the loop needs an interrupt or a re-target.","timestamp":1790078522149,"segment":2,"confidence":null,"asi":{"hypothesis":"None testable; seventeenth consecutive unchanged-tree run.","metric_note":"DISCLOSED REPEAT #17. Diff over engine/ esp32/ host/ tools/ model/ = 0 lines; signature identical to #302-#317.","next_action_hint":"Interrupt or re-target the loop; stop condition at 8bcbc90. Above-bar routes are owner decisions: assertion level (#293, frees 8,248 B, re-prices the 4-row CQ2 LUT residency at kbench +3.8%) and 120 MHz octal memory (#289, +3.51%, forbidden). Push origin from a credentialed host (~36 commits)."}}
{"run":319,"commit":"8bcbc90","metric":5.0117,"metrics":{"boot_bench_tps":5.057,"device_output_exact":17,"device_token_delta":0,"ext_decode_tps":4.939,"gen_tokens":99,"host_output_exact":16,"internal_free":15215,"logit_max_delta":0.00005341,"logit_top1_match":10,"min_case_tps":4.79,"prefill_tps":5.2867,"psram_free":2052252,"think_tps":3.93},"status":"keep","description":"Disclosed repeat #18 of the accepted runtime: decode 5.0117 tok/s (+105.3 %), shipping tree byte-identical to the accepted image, 17/17 device + 16/16 host byte-exact with golden_missing=0 and DEVICE_GATE_OK, token_delta 0, fidelity 5.341e-05, top1 10/10, extended 4.9390, think 3.93, prefill 5.2867, boot bench 5.057 / 198 ms/token, min_case 4.79, internal_free 15,215, psram_free 2,052,252. Taken only for the per-iteration measurement mandate; nothing was testable on an unchanged tree and this is not a speed result. Stop condition recorded at 8bcbc90 - the loop needs an interrupt or a re-target.","timestamp":1790078794176,"segment":2,"confidence":null,"asi":{"hypothesis":"None testable; eighteenth consecutive unchanged-tree run.","metric_note":"DISCLOSED REPEAT #18. Diff over engine/ esp32/ host/ tools/ model/ = 0 lines; signature identical to #302-#318.","next_action_hint":"Interrupt or re-target the loop; stop condition at 8bcbc90. Above-bar routes are owner decisions: assertion level (#293, frees 8,248 B, re-prices the 4-row CQ2 LUT residency at kbench +3.8%) and 120 MHz octal memory (#289, +3.51%, forbidden). Push origin from a credentialed host (~37 commits)."}}
{"run":320,"commit":"8bcbc90","metric":5.0117,"metrics":{"boot_bench_tps":5.057,"device_output_exact":17,"device_token_delta":0,"ext_decode_tps":4.939,"gen_tokens":99,"host_output_exact":16,"internal_free":15215,"logit_max_delta":0.00005341,"logit_top1_match":10,"min_case_tps":4.79,"prefill_tps":5.2867,"psram_free":2052252,"think_tps":3.93},"status":"keep","description":"Disclosed repeat #19 of the accepted runtime: decode 5.0117 tok/s (+105.3 %), shipping tree byte-identical to the accepted image, 17/17 device + 16/16 host byte-exact with golden_missing=0 and DEVICE_GATE_OK, token_delta 0, fidelity 5.341e-05, top1 10/10, extended 4.9390, think 3.93, prefill 5.2867, boot bench 5.057 / 198 ms/token, min_case 4.79, internal_free 15,215, psram_free 2,052,252. Taken only for the per-iteration measurement mandate; nothing was testable on an unchanged tree and this is not a speed result. Stop condition recorded at 8bcbc90 - the loop needs an interrupt or a re-target.","timestamp":1790079068047,"segment":2,"confidence":null,"asi":{"hypothesis":"None testable; nineteenth consecutive unchanged-tree run.","metric_note":"DISCLOSED REPEAT #19. Diff over engine/ esp32/ host/ tools/ model/ = 0 lines; signature identical to #302-#319.","next_action_hint":"Interrupt or re-target the loop; stop condition at 8bcbc90. Above-bar routes are owner decisions: assertion level (#293, frees 8,248 B, re-prices the 4-row CQ2 LUT residency at kbench +3.8%) and 120 MHz octal memory (#289, +3.51%, forbidden). Push origin from a credentialed host (~38 commits)."}}
{"run":321,"commit":"8bcbc90","metric":5.0117,"metrics":{"boot_bench_tps":5.057,"device_output_exact":17,"device_token_delta":0,"ext_decode_tps":4.939,"gen_tokens":99,"host_output_exact":16,"internal_free":15215,"logit_max_delta":0.00005341,"logit_top1_match":10,"min_case_tps":4.79,"prefill_tps":5.2867,"psram_free":2052252,"think_tps":3.93},"status":"keep","description":"Disclosed repeat #20 of the accepted runtime: decode 5.0117 tok/s (+105.3 %), shipping tree byte-identical to the accepted image, 17/17 device + 16/16 host byte-exact with golden_missing=0 and DEVICE_GATE_OK, token_delta 0, fidelity 5.341e-05, top1 10/10, extended 4.9390, think 3.93, prefill 5.2867, boot bench 5.057 / 198 ms/token, min_case 4.79, internal_free 15,215, psram_free 2,052,252. Taken only for the per-iteration measurement mandate; nothing was testable on an unchanged tree and this is not a speed result. Stop condition recorded at 8bcbc90 - the loop needs an interrupt or a re-target.","timestamp":1790079339545,"segment":2,"confidence":null,"asi":{"hypothesis":"None testable; twentieth consecutive unchanged-tree run.","metric_note":"DISCLOSED REPEAT #20. Diff over engine/ esp32/ host/ tools/ model/ = 0 lines; signature identical to #302-#320.","next_action_hint":"Interrupt or re-target the loop; stop condition at 8bcbc90. Above-bar routes are owner decisions: assertion level (#293, frees 8,248 B, re-prices the 4-row CQ2 LUT residency at kbench +3.8%) and 120 MHz octal memory (#289, +3.51%, forbidden). Push origin from a credentialed host (~39 commits)."}}
{"run":322,"commit":"8bcbc90","metric":5.0117,"metrics":{"boot_bench_tps":5.057,"device_output_exact":17,"device_token_delta":0,"ext_decode_tps":4.939,"gen_tokens":99,"host_output_exact":16,"internal_free":15215,"logit_max_delta":0.00005341,"logit_top1_match":10,"min_case_tps":4.79,"prefill_tps":5.2867,"psram_free":2052252,"think_tps":3.93},"status":"keep","description":"Disclosed repeat #21 of the accepted runtime: decode 5.0117 tok/s (+105.3 %), shipping tree byte-identical to the accepted image, 17/17 device + 16/16 host byte-exact with golden_missing=0 and DEVICE_GATE_OK, token_delta 0, fidelity 5.341e-05, top1 10/10, extended 4.9390, think 3.93, prefill 5.2867, boot bench 5.057 / 198 ms/token, min_case 4.79, internal_free 15,215, psram_free 2,052,252. Taken only for the per-iteration measurement mandate; nothing was testable on an unchanged tree and this is not a speed result. Stop condition recorded at 8bcbc90 - the loop needs an interrupt or a re-target.","timestamp":1790079611013,"segment":2,"confidence":null,"asi":{"hypothesis":"None testable; twenty-first consecutive unchanged-tree run.","metric_note":"DISCLOSED REPEAT #21. Diff over engine/ esp32/ host/ tools/ model/ = 0 lines; signature identical to #302-#321.","next_action_hint":"Interrupt or re-target the loop; stop condition at 8bcbc90. Above-bar routes are owner decisions: assertion level (#293, frees 8,248 B, re-prices the 4-row CQ2 LUT residency at kbench +3.8%) and 120 MHz octal memory (#289, +3.51%, forbidden). Push origin from a credentialed host (~40 commits)."}}
{"run":323,"commit":"8bcbc90","metric":5.0117,"metrics":{"boot_bench_tps":5.057,"device_output_exact":17,"device_token_delta":0,"ext_decode_tps":4.939,"gen_tokens":99,"host_output_exact":16,"internal_free":15215,"logit_max_delta":0.00005341,"logit_top1_match":10,"min_case_tps":4.79,"prefill_tps":5.2867,"psram_free":2052252,"think_tps":3.93},"status":"keep","description":"Disclosed repeat #22 of the accepted runtime: decode 5.0117 tok/s (+105.3 %), shipping tree byte-identical to the accepted image, 17/17 device + 16/16 host byte-exact with golden_missing=0 and DEVICE_GATE_OK, token_delta 0, fidelity 5.341e-05, top1 10/10, extended 4.9390, think 3.93, prefill 5.2867, boot bench 5.057 / 198 ms/token, min_case 4.79, internal_free 15,215, psram_free 2,052,252. Taken only for the per-iteration measurement mandate; nothing was testable on an unchanged tree and this is not a speed result. Stop condition recorded at 8bcbc90 - the loop needs an interrupt or a re-target.","timestamp":1790079883879,"segment":2,"confidence":null,"asi":{"hypothesis":"None testable; twenty-second consecutive unchanged-tree run.","metric_note":"DISCLOSED REPEAT #22. Diff over engine/ esp32/ host/ tools/ model/ = 0 lines; signature identical to #302-#322.","next_action_hint":"Interrupt or re-target the loop; stop condition at 8bcbc90. Above-bar routes are owner decisions: assertion level (#293, frees 8,248 B, re-prices the 4-row CQ2 LUT residency at kbench +3.8%) and 120 MHz octal memory (#289, +3.51%, forbidden). Push origin from a credentialed host (~41 commits)."}}
{"run":324,"commit":"8bcbc90","metric":5.0117,"metrics":{"boot_bench_tps":5.057,"device_output_exact":17,"device_token_delta":0,"ext_decode_tps":4.939,"gen_tokens":99,"host_output_exact":16,"internal_free":15215,"logit_max_delta":0.00005341,"logit_top1_match":10,"min_case_tps":4.79,"prefill_tps":5.2867,"psram_free":2052252,"think_tps":3.93},"status":"keep","description":"Disclosed repeat #23 of the accepted runtime: decode 5.0117 tok/s (+105.3 %), shipping tree byte-identical to the accepted image, 17/17 device + 16/16 host byte-exact with golden_missing=0 and DEVICE_GATE_OK, token_delta 0, fidelity 5.341e-05, top1 10/10, extended 4.9390, think 3.93, prefill 5.2867, boot bench 5.057 / 198 ms/token, min_case 4.79, internal_free 15,215, psram_free 2,052,252. Taken only for the per-iteration measurement mandate; nothing was testable on an unchanged tree and this is not a speed result. Stop condition recorded at 8bcbc90 - the loop needs an interrupt or a re-target.","timestamp":1790080155989,"segment":2,"confidence":null,"asi":{"hypothesis":"None testable; twenty-third consecutive unchanged-tree run.","metric_note":"DISCLOSED REPEAT #23. Diff over engine/ esp32/ host/ tools/ model/ = 0 lines; signature identical to #302-#323.","next_action_hint":"Interrupt or re-target the loop; stop condition at 8bcbc90. Above-bar routes are owner decisions: assertion level (#293, frees 8,248 B, re-prices the 4-row CQ2 LUT residency at kbench +3.8%) and 120 MHz octal memory (#289, +3.51%, forbidden). Push origin from a credentialed host (~42 commits)."}}
{"run":325,"commit":"8bcbc90","metric":5.0117,"metrics":{"boot_bench_tps":5.057,"device_output_exact":17,"device_token_delta":0,"ext_decode_tps":4.939,"gen_tokens":99,"host_output_exact":16,"internal_free":15215,"logit_max_delta":0.00005341,"logit_top1_match":10,"min_case_tps":4.79,"prefill_tps":5.2867,"psram_free":2052252,"think_tps":3.93},"status":"keep","description":"Disclosed repeat #24 of the accepted runtime: decode 5.0117 tok/s (+105.3 %), shipping tree byte-identical to the accepted image, 17/17 device + 16/16 host byte-exact with golden_missing=0 and DEVICE_GATE_OK, token_delta 0, fidelity 5.341e-05, top1 10/10, extended 4.9390, think 3.93, prefill 5.2867, boot bench 5.057 / 198 ms/token, min_case 4.79, internal_free 15,215, psram_free 2,052,252. Taken only for the per-iteration measurement mandate; nothing was testable on an unchanged tree and this is not a speed result. Stop condition recorded at 8bcbc90 - the loop needs an interrupt or a re-target.","timestamp":1790080428466,"segment":2,"confidence":null,"asi":{"hypothesis":"None testable; twenty-fourth consecutive unchanged-tree run.","metric_note":"DISCLOSED REPEAT #24. Diff over engine/ esp32/ host/ tools/ model/ = 0 lines; signature identical to #302-#324.","next_action_hint":"Interrupt or re-target the loop; stop condition at 8bcbc90. Above-bar routes are owner decisions: assertion level (#293, frees 8,248 B, re-prices the 4-row CQ2 LUT residency at kbench +3.8%) and 120 MHz octal memory (#289, +3.51%, forbidden). Push origin from a credentialed host (~43 commits)."}}
{"run":326,"commit":"8bcbc90","metric":5.0117,"metrics":{"boot_bench_tps":5.058,"device_output_exact":17,"device_token_delta":0,"ext_decode_tps":4.939,"gen_tokens":99,"host_output_exact":16,"internal_free":15215,"logit_max_delta":0.00005341,"logit_top1_match":10,"min_case_tps":4.79,"prefill_tps":5.2867,"psram_free":2052252,"think_tps":3.93},"status":"keep","description":"Disclosed repeat #25 of the accepted runtime: decode 5.0117 tok/s (+105.3 %), shipping tree byte-identical to the accepted image, 17/17 device + 16/16 host byte-exact with golden_missing=0 and DEVICE_GATE_OK, token_delta 0, fidelity 5.341e-05, top1 10/10, extended 4.9390, think 3.93, prefill 5.2867, boot bench 5.058 / 198 ms/token, min_case 4.79, internal_free 15,215, psram_free 2,052,252. Taken only for the per-iteration measurement mandate; nothing was testable on an unchanged tree and this is not a speed result. Stop condition recorded at 8bcbc90 - the loop needs an interrupt or a re-target.","timestamp":1790080734546,"segment":2,"confidence":null,"asi":{"hypothesis":"None testable; twenty-fifth consecutive unchanged-tree run.","metric_note":"DISCLOSED REPEAT #25. Diff over engine/ esp32/ host/ tools/ model/ = 0 lines; signature identical to #302-#325 except boot_bench 5.058 vs 5.057 (one quantisation tick).","next_action_hint":"Interrupt or re-target the loop; stop condition at 8bcbc90. Above-bar routes are owner decisions: assertion level (#293, frees 8,248 B, re-prices the 4-row CQ2 LUT residency at kbench +3.8%) and 120 MHz octal memory (#289, +3.51%, forbidden). Push origin from a credentialed host (~44 commits)."}}
{"run":327,"commit":"8bcbc90","metric":5.0117,"metrics":{"boot_bench_tps":5.057,"device_output_exact":17,"device_token_delta":0,"ext_decode_tps":4.939,"gen_tokens":99,"host_output_exact":16,"internal_free":15215,"logit_max_delta":0.00005341,"logit_top1_match":10,"min_case_tps":4.79,"prefill_tps":5.2867,"psram_free":2052252,"think_tps":3.93},"status":"keep","description":"Disclosed repeat #26 of the accepted runtime: decode 5.0117 tok/s (+105.3 %), shipping tree byte-identical to the accepted image, 17/17 device + 16/16 host byte-exact with golden_missing=0 and DEVICE_GATE_OK, token_delta 0, fidelity 5.341e-05, top1 10/10, extended 4.9390, think 3.93, prefill 5.2867, boot bench 5.057 / 198 ms/token, min_case 4.79, internal_free 15,215, psram_free 2,052,252. Taken only for the per-iteration measurement mandate; nothing was testable on an unchanged tree and this is not a speed result. Stop condition recorded at 8bcbc90 - the loop needs an interrupt or a re-target.","timestamp":1790081005626,"segment":2,"confidence":null,"asi":{"hypothesis":"None testable; twenty-sixth consecutive unchanged-tree run.","metric_note":"DISCLOSED REPEAT #26. Diff over engine/ esp32/ host/ tools/ model/ = 0 lines; signature identical to #302-#326.","next_action_hint":"Interrupt or re-target the loop; stop condition at 8bcbc90. Above-bar routes are owner decisions: assertion level (#293, frees 8,248 B, re-prices the 4-row CQ2 LUT residency at kbench +3.8%) and 120 MHz octal memory (#289, +3.51%, forbidden). Push origin from a credentialed host (~45 commits)."}}
{"run":328,"commit":"8bcbc90","metric":5.0117,"metrics":{"boot_bench_tps":5.057,"device_output_exact":17,"device_token_delta":0,"ext_decode_tps":4.939,"gen_tokens":99,"host_output_exact":16,"internal_free":15215,"logit_max_delta":0.00005341,"logit_top1_match":10,"min_case_tps":4.79,"prefill_tps":5.2867,"psram_free":2052252,"think_tps":3.93},"status":"keep","description":"Disclosed repeat #27 of the accepted runtime: decode 5.0117 tok/s (+105.3 %), shipping tree byte-identical to the accepted image, 17/17 device + 16/16 host byte-exact with golden_missing=0 and DEVICE_GATE_OK, token_delta 0, fidelity 5.341e-05, top1 10/10, extended 4.9390, think 3.93, prefill 5.2867, boot bench 5.057 / 198 ms/token, min_case 4.79, internal_free 15,215, psram_free 2,052,252. Taken only for the per-iteration measurement mandate; nothing was testable on an unchanged tree and this is not a speed result. Stop condition recorded at 8bcbc90 - the loop needs an interrupt or a re-target.","timestamp":1790081275194,"segment":2,"confidence":null,"asi":{"hypothesis":"None testable; twenty-seventh consecutive unchanged-tree run.","metric_note":"DISCLOSED REPEAT #27. Diff over engine/ esp32/ host/ tools/ model/ = 0 lines; signature identical to #302-#327.","next_action_hint":"Interrupt or re-target the loop; stop condition at 8bcbc90. Above-bar routes are owner decisions: assertion level (#293, frees 8,248 B, re-prices the 4-row CQ2 LUT residency at kbench +3.8%) and 120 MHz octal memory (#289, +3.51%, forbidden). Push origin from a credentialed host (~46 commits)."}}
{"run":329,"commit":"8bcbc90","metric":5.0117,"metrics":{"boot_bench_tps":5.057,"device_output_exact":17,"device_token_delta":0,"ext_decode_tps":4.939,"gen_tokens":99,"host_output_exact":16,"internal_free":15215,"logit_max_delta":0.00005341,"logit_top1_match":10,"min_case_tps":4.79,"prefill_tps":5.2867,"psram_free":2052252,"think_tps":3.93},"status":"keep","description":"Disclosed repeat #28 of the accepted runtime: decode 5.0117 tok/s (+105.3 %), shipping tree byte-identical to the accepted image, 17/17 device + 16/16 host byte-exact with golden_missing=0 and DEVICE_GATE_OK, token_delta 0, fidelity 5.341e-05, top1 10/10, extended 4.9390, think 3.93, prefill 5.2867, boot bench 5.057 / 198 ms/token, min_case 4.79, internal_free 15,215, psram_free 2,052,252. Taken only for the per-iteration measurement mandate; nothing was testable on an unchanged tree and this is not a speed result. Stop condition recorded at 8bcbc90 - the loop needs an interrupt or a re-target.","timestamp":1790081545733,"segment":2,"confidence":null,"asi":{"hypothesis":"None testable; twenty-eighth consecutive unchanged-tree run.","metric_note":"DISCLOSED REPEAT #28. Diff over engine/ esp32/ host/ tools/ model/ = 0 lines; signature identical to #302-#328.","next_action_hint":"Interrupt or re-target the loop; stop condition at 8bcbc90. Above-bar routes are owner decisions: assertion level (#293, frees 8,248 B, re-prices the 4-row CQ2 LUT residency at kbench +3.8%) and 120 MHz octal memory (#289, +3.51%, forbidden). Push origin from a credentialed host (~47 commits)."}}
