{"run":165,"commit":"61630e4","metric":4.8817,"metrics":{"prefill_tps":5.2183,"ext_decode_tps":4.7986,"think_tps":3.87,"boot_bench_tps":4.983,"min_case_tps":4.66,"gen_tokens":99,"internal_free":17039,"psram_free":2052252,"device_output_exact":14,"device_token_delta":0,"logit_max_delta":0.00005341,"logit_top1_match":10,"host_output_exact":13},"status":"keep","description":"Verification cycle, no change taken. HEAD reproduces the accepted runtime exactly: 4.8817 decode, 4.7986 extended, 4.66 min case, 3.87 think, 5.2183 prefill, boot bench 201 ms/token, byte-exact 14/14 device + 13/13 host, fidelity 5.341e-05 with top1 10/10. Confirmed the frozen inputs are untouched: working tree clean and an empty diff against HEAD for .auto/prompts.json, .auto/golden/, model/, tools/demo-tools.json and esp32/partitions.csv.","timestamp":1789990356632,"segment":1,"confidence":365.67164179102446,"asi":{"hypothesis":"Verification cycle on the accepted 4.8817 runtime; also prove the frozen benchmark inputs are unmodified rather than asserting it.","superseded_note":"The old ledger line 'cache-blocking the LUT GEMV remains the only big-ticket idea left' is dead: the #144-#145 floor analysis shows the 2-bit kernel is throughput-bound at IPC ~1.33 with the pair table already cache-resident, and row blocking was measured -5%. Anyone reading that line should stop at the Instruction floor section instead.","next":"Nothing actionable remains that does not change what is computed. Continue verification; make capture is next due around run ~172 (last green #157).","state":"Accepted 4.8817 decode (+99.9%), extended 4.7986, think 3.87, prefill 5.22; 14 device + 13 host byte-exact; fidelity 5.341e-05 top1 10/10."}}
{"run":166,"commit":"61630e4","metric":4.8817,"metrics":{"prefill_tps":5.2183,"ext_decode_tps":4.7986,"think_tps":3.87,"boot_bench_tps":4.983,"min_case_tps":4.66,"gen_tokens":99,"internal_free":17039,"psram_free":2052252,"device_output_exact":14,"device_token_delta":0,"logit_max_delta":0.00005341,"logit_top1_match":10,"host_output_exact":13},"status":"keep","description":"Diagnostic cycle: harvested the first up-to-date REQUEST-path phase map (the only previous one, #145, predates the sampler fix). On the shipping tree with AUTO_PROFILE=1 plus a direct serial_api drive (DTR/RTS pinned low, two requests so one can be differenced, and !think 0 - Device defaults to think mode ON, which silently measures the 8192-row full-vocabulary path instead of the constrained one): sample = 8.9 ms of a ~202 ms token (4.4%), of which logits4 - the subset projection - is 5.7 ms. That confirms the accounting I had only inferred (~7.2 ms) within 20%, and it is the measurement that makes the sampler-family closure and #162's failure to speed the gather path consistent evidence rather than a guess. Canonical (non-profiled) run reproduces 4.8817 / 4.7986 / 3.87, 14/14 device + 13/13 host byte-exact.","timestamp":1789991239649,"segment":1,"confidence":365.67164179102446,"asi":{"hypothesis":"The one unmeasured territory left is the request path the boot bench cannot see; if some phase there were bigger than the model says, a lever would exist there.","request_phase_map":"Real constrained decode token, tools case sampling5: whole block 187.2 ms (92.4%) + sample 8.9 ms (4.4%) ~= 202 ms, proj2bit 105.7 (52.2%), attention 35.5, hadamard 24.5, engram 20.1, mhc_phi4 13.5, sample 8.9 (contains logits4 5.7), sinkhorn 4.3, mhc-mix 4.7, prep+lut 4.2, qkv taps 3.3, head norms 0.5, rope 0.2, kv store 1.1. Identical to two decimals across two identical requests.","attribution_curiosity":"proj2bit reads 86.5 ms on the boot bench and 105.7 ms on a real request while the whole block is 188 ms in both, so ~19 ms of the block is attributed to the 2-bit GEMV in the request and to something unnamed in the bench. It is a timer-attribution difference (the engram's GEMVs are counted in both phases, per the documented overlap), not a speed effect: totals agree and the metric is identical. Do not chase it as a decode cost - 105.7 ms is already ~66% of the octal-PSRAM byte peak, and 105.7 + 19 more would exceed it.","why_this_closes_things":"logits4 at 5.7 ms rules out the last 'maybe the subset projection is actually huge' theory, which was the only reading under which a faster gather path could pay. Combined with #162 measuring the folded gather slower, the subset-logits and sampler family is closed on measurement, not on arithmetic.","recipe_note":"AUTO_PROFILE=1 works through measure.sh (the #158 conclusion that NEEDLE_PROFILE=ON does not take applied to a fresh -B dir with CMAKE_C_FLAGS, not to measure.sh's -DNEEDLE_PROFILE=ON path). Device(port,...,think) sets think mode; pass False or send !think 0 before measuring the constrained path. prof_dump's table is per-request and reproducible, so consecutive dumps can be compared directly.","state":"Accepted 4.8817 decode (+99.9%), extended 4.7986, think 3.87, prefill 5.22, boot 201 ms/token; 14 device + 13 host byte-exact; fidelity 5.341e-05 top1 10/10."}}
{"run":167,"commit":"61630e4","metric":4.8817,"metrics":{"prefill_tps":5.2183,"ext_decode_tps":4.7986,"think_tps":3.87,"boot_bench_tps":4.983,"min_case_tps":4.66,"gen_tokens":99,"internal_free":17039,"psram_free":2052252,"device_output_exact":14,"device_token_delta":0,"logit_max_delta":0.00005341,"logit_top1_match":10,"host_output_exact":13},"status":"keep","description":"Verification cycle, no change. Eleventh consecutive identical reading of the accepted runtime on the canonical port: 4.8817 decode, 4.7986 extended, 4.66 min case, 3.87 think, 5.2183 prefill, boot 201 ms/token, 14/14 device + 13/13 host byte-exact, fidelity 5.341e-05 top1 10/10.","timestamp":1789991540090,"segment":1,"confidence":365.67164179102446,"asi":{"hypothesis":"Verification of the accepted 4.8817 runtime.","next":"Three-board batch again in a few cycles for board-drift tracking; make capture due around #172. No open speed hypothesis: every phase in the measured request map is at a named floor.","state":"4.8817 decode (+99.9%) accepted; extended 4.7986, think 3.87, prefill 5.22; 14 device + 13 host byte-exact."}}
{"run":168,"commit":"61630e4","metric":4.8817,"metrics":{"prefill_tps":5.2183,"ext_decode_tps":4.7986,"think_tps":3.87,"boot_bench_tps":4.983,"min_case_tps":4.66,"gen_tokens":99,"internal_free":17039,"psram_free":2052252,"device_output_exact":14,"device_token_delta":0,"logit_max_delta":0.00005341,"logit_top1_match":10,"host_output_exact":13},"status":"keep","description":"Verification cycle plus a second consecutive three-board batch: three fresh-configured identical images (279264 B, no fold symbols) read decode_tps 4.8817, min_case 4.66, extended 4.7986, think 3.87, byte-exact 14/14 on all three boards - so no board drift and the cross-image spread is still under the 0.07% floor measured at #144. Canonical run matches exactly. No change taken.","timestamp":1789993392402,"segment":1,"confidence":365.67164179102446,"asi":{"hypothesis":"Board-drift tracking: a second independent three-board batch of the accepted runtime.","considered_and_skipped":"Engram gather split. Its earlier attempt failed on correctness (0/12, shared m->row scratch aliasing xh), and my audit rule now supplies the fix (per-core scratch, disjoint e + table*sub outputs), so the speed of that split really is unmeasured - but the measured ceiling on splitting anything smaller than a kron half is ~0.05% (#130-era batch: rms scale +0.04%, engram tap matmul +0.04%, p1/p2 +0.13%, combined fold+SiLU -0.4%), and dynamic self-scheduling was -6%. A run would most likely reconfirm the ceiling, so it stays in the backlog rather than taking a build.","state":"4.8817 decode (+99.9%) accepted; extended 4.7986, think 3.87, prefill 5.22; 14 device + 13 host byte-exact; fidelity 5.341e-05 top1 10/10. make capture next due ~#172.","next":"Continue verification; capture at ~#172."}}
{"run":169,"commit":"072deda","metric":4.8817,"metrics":{"prefill_tps":5.2183,"ext_decode_tps":4.7986,"think_tps":3.87,"boot_bench_tps":4.984,"min_case_tps":4.66,"gen_tokens":99,"internal_free":17039,"psram_free":2052252,"device_output_exact":14,"device_token_delta":0,"logit_max_delta":0.00005341,"logit_top1_match":10,"host_output_exact":13},"status":"keep","description":"Behavioural-integrity milestone (due ~#172, taken at #169 because the shipping tree changed under it when the fold was withdrawn): make capture is green on the accepted runtime - 7 real scenarios, correct routing on all of them (qwen / gpt_oss / opus / needle x4), correct tool calls, and all 9 verification flags true (routes_match, tools_match, requests_succeeded, no_external_calls, local_has_two_passes, external_stops_at_selection, telemetry_progressed, sampling_interval_applied, timer_expired). Latencies 6.5-17.5 s per scenario. No change taken; canonical run reproduces 4.8817 / 4.7986 / 3.87 with 14/14 device + 13/13 host byte-exact.","timestamp":1789993926482,"segment":1,"confidence":345.07042253519535,"asi":{"hypothesis":"The byte-exact suite covers arithmetic, not behaviour; after a kept-then-withdrawn change to a shipped kernel, prove routing, second-pass local tool execution, telemetry progress, sampling interval and timer expiry still work end to end.","harness_note":"AGENTS.md's needle-api does not exist in this checkout: the HTTP bridge capture.py needs is tools/serial_api.py (run .venv/bin/python tools/serial_api.py --serial /dev/ttyACM1, then make capture, then kill it before flashing). /health came ready in ~25 s because the board was already warm; next capture is due ~#179.","engram_gather_followup":"Quantified why I am still not splitting the engram gathers: ~384 gathered rows per token at ~one cache line each is order 0.4 ms, so the phase's 20 ms is the engram's own 2-bit GEMVs, which are already two-core. Per-core scratch would fix the old 0/12 race but there is no mass there to win.","state":"4.8817 decode (+99.9%) accepted; extended 4.7986, think 3.87, prefill 5.22, boot 201 ms/token; 14 device + 13 host byte-exact; fidelity 5.341e-05 top1 10/10; capture green; serial port released."}}
{"run":170,"commit":"072deda","metric":4.8817,"metrics":{"prefill_tps":5.2183,"ext_decode_tps":4.7986,"think_tps":3.87,"boot_bench_tps":4.983,"min_case_tps":4.66,"gen_tokens":99,"internal_free":17039,"psram_free":2052252,"device_output_exact":14,"device_token_delta":0,"logit_max_delta":0.00005341,"logit_top1_match":10,"host_output_exact":13},"status":"keep","description":"Verification cycle, no change. Accepted runtime reproduces exactly (4.8817 decode, 4.7986 extended, 4.66 min case, 3.87 think, 5.2183 prefill, boot 201 ms/token, 14/14 device + 13/13 host byte-exact, fidelity 5.341e-05 top1 10/10). Docs refreshed: capture milestone recorded at #169 and the measured request map (#166) recorded as the reference for the sampler closure, including the think-mode trap that makes logits4 look like a 30% phase.","timestamp":1789994202109,"segment":1,"confidence":326.6666666666543,"asi":{"hypothesis":"Verification of the accepted runtime after the capture milestone; no open speed hypothesis.","changed_premise_review":"Checked for any discard whose blocking assumption changed this cycle: the folded 4-bit codebook's safe form is still blocked by RAM (16x in_pad caller-side, 16 kB per-core) and by the fact it cheapens an SRAM operand while the phase is PSRAM-bound; the engram gather split is still capped by the measured ~0.05% splitable-mass ceiling plus a fresh estimate that the gathers are only ~0.4 ms of the phase; the sinkhorn budget is still vetoed by the fidelity probe. Nothing to retry.","state":"4.8817 decode (+99.9%) accepted; extended 4.7986, think 3.87, prefill 5.22; 14 device + 13 host byte-exact; capture green at #169; next capture ~#179.","next":"Verification continues; three-board batch every few cycles."}}
{"run":171,"commit":"072deda","metric":4.8817,"metrics":{"prefill_tps":5.2183,"ext_decode_tps":4.7986,"think_tps":3.87,"boot_bench_tps":4.985,"min_case_tps":4.66,"gen_tokens":99,"internal_free":17039,"psram_free":2052252,"device_output_exact":14,"device_token_delta":0,"logit_max_delta":0.00005341,"logit_top1_match":10,"host_output_exact":13},"status":"keep","description":"Verification cycle, no change; accepted runtime reproduces to the digit (4.8817 decode / 4.7986 extended / 3.87 think / 5.2183 prefill, boot 201 ms/token, 14/14 device + 13/13 host byte-exact, fidelity 5.341e-05 top1 10/10). Also re-derived the dominant phase's floor from the table geometry one more time (see asi) and it still binds, so the 2-bit GEMV family is closed for good.","timestamp":1789994461407,"segment":1,"confidence":310.12658227847163,"asi":{"hypothesis":"Verification run on the accepted runtime; plus one last check of whether any table layout can beat 2 instructions per weight.","why_the_floor_is_final":"A lookup can cover more than one weight only if the entry depends on all those weights. The pair table has 4 entries per position (4 codebook levels x one xh[j]) so a nibble costs one gather - that is the 2 instr/weight floor. Covering two nibbles needs entries indexed by both positions, 16x16 = 256 entries per position pair, i.e. the quad table, measured -38% because it stops fitting the 32 KB L2 (a 768-wide projection already spends 12 KB on the pair table). The ESP32-S3 TIE has packed integer SIMD but no packed-float SIMD, and the int16 PIE variant is independently recorded as slower in the MimiModel cross-check. There is no layout left that gets more than 2 weights per instruction, and fewer bytes means changing quantisation, which is frozen. Do not re-derive this a seventh time.","state":"4.8817 decode (+99.9%) accepted; extended 4.7986, think 3.87, prefill 5.22; 14 device + 13 host byte-exact; capture green #169.","next":"Three-board batch next cycle for drift tracking."}}
{"run":172,"commit":"072deda","metric":4.8817,"metrics":{"prefill_tps":5.2183,"ext_decode_tps":4.7986,"think_tps":3.87,"boot_bench_tps":4.983,"min_case_tps":4.66,"gen_tokens":99,"internal_free":17039,"psram_free":2052252,"device_output_exact":14,"device_token_delta":0,"logit_max_delta":0.00005341,"logit_top1_match":10,"host_output_exact":13},"status":"keep","description":"Verification cycle. Third consecutive three-board batch on freshly configured identical images: 4.8817 / 4.7986 / 3.87 / min_case 4.66 / 14-of-14 byte-exact on every board, boot bench 4.983-4.985. Canonical run identical. No change taken.","timestamp":1789996255990,"segment":1,"confidence":295.1807228915593,"asi":{"hypothesis":"Board-drift tracking, third batch on the accepted runtime.","state":"4.8817 decode (+99.9%) accepted; extended 4.7986, think 3.87, prefill 5.22; 14 device + 13 host byte-exact; capture green #169, next ~#179.","next":"Verification cycles; no open speed hypothesis."}}
{"run":173,"commit":"072deda","metric":4.8817,"metrics":{"prefill_tps":5.2183,"ext_decode_tps":4.7986,"think_tps":3.87,"boot_bench_tps":4.984,"min_case_tps":4.66,"gen_tokens":99,"internal_free":17039,"psram_free":2052252,"device_output_exact":14,"device_token_delta":0,"logit_max_delta":0.00005341,"logit_top1_match":10,"host_output_exact":13},"status":"keep","description":"Verification cycle, no change: 4.8817 decode / 4.7986 extended / 3.87 think / 5.2183 prefill / 4.66 min case, 14/14 device + 13/13 host byte-exact, fidelity 5.341e-05 top1 10/10.","timestamp":1789996500285,"segment":1,"confidence":63.96866840731071,"asi":{"hypothesis":"Verification of the accepted runtime. Deliberately not manufacturing a marginal candidate: the keep bar is 0.2% and every phase above 0.5% of the token is at a measured floor, so a new micro-optimisation would be churn with correctness risk - the fold (#159) is the cautionary example, where a +0.17% win turned out to be a cross-core race.","state":"4.8817 decode (+99.9%) accepted; extended 4.7986, think 3.87, prefill 5.22; 14 device + 13 host byte-exact.","next":"Verification cycles; capture due ~#179; three-board batch every ~4 cycles."}}
{"run":174,"commit":"072deda","metric":4.8817,"metrics":{"prefill_tps":5.2183,"ext_decode_tps":4.7986,"think_tps":3.87,"boot_bench_tps":4.983,"min_case_tps":4.66,"gen_tokens":99,"internal_free":17039,"psram_free":2052252,"device_output_exact":14,"device_token_delta":0,"logit_max_delta":0.00005341,"logit_top1_match":10,"host_output_exact":13},"status":"keep","description":"Soak/no-drift check: re-measured the already-flashed app (AUTO_NOFLASH=1, no rebuild, board already warm) and got 4.8817 decode / 4.7986 extended / 3.87 think / 4.66 min case / 14-of-14 byte-exact - identical to the freshly flashed session, so consecutive measurement sessions on one image do not drift thermally. No change taken.","timestamp":1789996733749,"segment":1,"confidence":35.871156661786344,"asi":{"hypothesis":"Does a second measurement session on the same flashed image drift (thermal or PSRAM/flash warm-state)? No: 4.8817 exactly, as do the extended and think monitors.","implication":"The 0.05% cross-session floor is not warm-state noise, so candidates below the 0.2% keep bar really are unresolvable rather than 'wait for a cooler run'.","state":"4.8817 decode (+99.9%) accepted; extended 4.7986, think 3.87, prefill 5.22; 14 device + 13 host byte-exact.","next":"Verification cycles; capture ~#179."}}
{"run":175,"commit":"072deda","metric":4.8817,"metrics":{"prefill_tps":5.2183,"ext_decode_tps":4.7986,"think_tps":3.87,"boot_bench_tps":4.983,"min_case_tps":4.66,"gen_tokens":99,"internal_free":17039,"psram_free":2052252,"device_output_exact":14,"device_token_delta":0,"logit_max_delta":0.00005341,"logit_top1_match":10,"host_output_exact":13},"status":"keep","description":"Verification cycle with a fresh build+flash (rebuild reproducibility check): 4.8817 decode / 4.7986 extended / 3.87 think / 5.2183 prefill / 4.66 min case, 14/14 device + 13/13 host byte-exact, fidelity 5.341e-05 top1 10/10, internal_free 17039, boot 201 ms/token. No change taken.","timestamp":1789996964421,"segment":1,"confidence":35.871156661786344,"asi":{"hypothesis":"Verification of the accepted runtime through the full rebuild+flash path.","state":"4.8817 decode (+99.9%) accepted; extended 4.7986, think 3.87, prefill 5.22; 14 device + 13 host byte-exact.","next":"Verification; capture ~#179."}}
{"run":176,"commit":"c4d4b6b","metric":4.8917,"metrics":{"prefill_tps":5.2167,"ext_decode_tps":4.81,"think_tps":3.87,"boot_bench_tps":4.983,"min_case_tps":4.67,"gen_tokens":99,"internal_free":15759,"psram_free":2052252,"device_output_exact":14,"device_token_delta":0,"logit_max_delta":0.00005341,"logit_top1_match":10,"host_output_exact":13},"status":"keep","description":"Split the constrained sampler's vocabulary-legality filter across both cores. The filter (piece lookup + first-byte veto + survivor byte walk over ~8176 ids) measured ~1.6 ms per decode token in #149, and it runs at a point where the second core is genuinely idle: the next token's projections depend on the token being sampled. Rows are whole 32-id words so each core writes only words in its own range and builds its own 256-entry first-byte table on its own stack - no shared scratch, no barrier (the contract added at #164 is why the shape is this way). The bitmap is then walked in ascending id order, so the candidate list, the argmax and its tie-break are identical; the count is complete rather than cut off at the cap, which is equivalent because both forms take the full-vocabulary path above the cap. decode_tps 4.8817 -> 4.8917 (+0.20%), extended 4.7986 -> 4.81 (+0.24%), min_case 4.66 -> 4.67, byte-exact 14/14 device + 13/13 host, token_delta 0, fidelity 5.341e-05 top1 10/10. Boot bench 4.983 and think 3.87 unchanged - neither runs the constrained filter, which is the internal control. internal_free 17039 -> 15759 (the 1 kB bitmap).","timestamp":1789997589225,"segment":1,"confidence":35.871156661786344,"asi":{"hypothesis":"The sampler is the one phase whose work happens while core 1 is idle, and #149 measured ~1.6 ms of it as a pure per-id map, so splitting it should return most of 0.8 ms (~0.4%) with the second core's capacity for free.","delivered_less_than_predicted":"+0.20% against a +0.39% estimate - the same direction of error as #147 (predicted 12.8 ms, delivered ~4.5). The 93-cycle nd_gstate_byte microbench overstates mid-string states; the filter is cheaper than the stand-alone number suggests, so halving it buys less.","self_audit_against_the_rule_i_just_wrote":"s_legal is static and written from a function that runs on both cores, which the contract permits only because rows are whole words: word index = c->w0 + w and the two halves get disjoint row ranges, so no word is ever written twice and no byte is shared (that is also why rows are words and not ids - an id-granular split would put both cores inside one word at the range boundary). cand/score are touched only by the calling core; lex_ctx is on the caller's stack and read-only to the worker, which has joined before the caller reuses the frame.","why_this_was_missed_for_150_runs":"Every earlier split decision was made from the GEMV/attention phase map, and this work is invisible to the boot bench, so it never appeared as a share of the token. #147 opened the same territory and #166's measured request map (sample 8.9 ms of 202) is what made the split worth asking about.","next":"Confirm under the batch protocol - a ~0.2% delta needs one control image (pre-change nd_sample.c) plus two identical candidate images on three boards, control validated against 4.8817.","state":"4.8917 decode (+100.5%), extended 4.81, think 3.87, prefill 5.2167, boot 201 ms/token; 14 device + 13 host byte-exact; internal_free 15759."}}
