{"run":576,"commit":"44f868b","metric":5.3033,"metrics":{"prefill_tps":5.585,"ext_decode_tps":5.4838,"think_tps":4.2,"boot_bench_tps":5.621,"min_case_tps":5.31,"gen_tokens":99,"internal_free":8415,"psram_free":2052252,"device_output_exact":18,"device_token_delta":52,"logit_max_delta":0.00005341,"logit_top1_match":10,"host_output_exact":19},"status":"discard","description":"Candidate prepared then withdrawn at launch on a provenance contradiction. The idea is sound and well-precedented: gemv4_asm_usable() is a 4-entry linear-scan memo (for i < 4) guarding the 4-bit asm path, phi sweeps three tensors per layer across 8 layers, so the cache plausibly thrashes and re-walks norms on eviction — the same defect shape that asmemo priced at +2.20 % on the 2-bit path. I grew it to 32 entries in board 2's engine/src/nd_quant.c. But the expectation I wrote came from the legacy nf16v regeneration file, whose script anchor (static ND_HOT void nd_f16_block) matches nothing in board 2's compiled engine: the helper is absent from both engine/src/nd_quant.c and engine/include. The resulting hash reproduced the previous stack's b1daae10df90 rather than a new value, i.e. the lane would have measured the old engine under a new label. I killed the session before it produced any reading, so no speed claim exists either way. Next window fixes the basis (which file CMake compiles, plus an artifact grep for nf16v per the #525 rule), then re-runs the memo candidate. Pin unchanged at 5.3033.","timestamp":1790273217681,"segment":1,"confidence":14.781162136832238,"asi":{"finding":"Provenance hole in my own lane tooling, caught before any claim: the nf16v helper named in the regeneration script (`static ND_HOT void nd_f16_block`) does NOT exist in board 2's compiled engine sources (grep: nd_quant.c 7 `nd_f16(` call sites, no block helper anywhere in engine/src or engine/include), so the script that derives `.auto/nf16v_src.c` cannot be describing the file the build compiles. My candidate edit (gemv4_asm_usable 4 -> 32 entries) went into the real `engine/src/nd_quant.c`, while the expectation I wrote into the worker came from the legacy nf16v_src basis and reproduced the OLD hash b1daae10df90 - so the launched lane would have re-measured the previous stack under a new label. Killed the session before it produced a reading.","next_order":"(1) grep esp32/components/needle/CMakeLists.txt to see exactly which source file the engine builds; (2) prove nf16v's presence or absence in board 2's built object by string/symbol grep, per #525's rule that only the artifact binds; (3) re-derive every lane expectation from the compiled source set, and only then re-run the gemv4 memo candidate, which is still the best-motivated open idea because gemv4_asm_usable holds FOUR entries for what is plausibly 24 distinct (blob,rows) keys per token and re-walks norms on eviction - the exact shape asmemo priced at +2.20 %.","hypothesis":"Enlarge the 4-bit eligibility memo: gemv4_asm_usable scans a 4-entry cache while phi sweeps three tensors per layer, so its 4-entry linear-scan cache can thrash and re-walk norms; grow it to 32 entries like the 2-bit memo."}}
{"run":577,"commit":"3a2e522","metric":5.6117,"metrics":{"ext_decode_tps":5.4838,"gen_tokens":99,"host_output_exact":19,"internal_free":8415,"logit_top1_match":10,"device_output_exact":6,"device_token_delta":0,"boot_bench_tps":5.659,"min_case_tps":5.35,"logit_max_delta":0.00005341,"psram_free":2052252,"prefill_tps":5.99,"think_tps":4.37},"status":"keep","description":"B1 FIRST-W8D SEED IS A MEASURED WIN: board 1 decode 5.6117 vs that board's 5.5783 acceptance reading = +0.599 %, device 6/6 byte-exact, token_delta 0, golden_missing 0, LANE_RC=0, boot bench 5.659, internal_free 8,415 unchanged, prefill 5.99 aggregate with min_case 5.35. Mechanism: specialize the first W8D of each group inside nd_lut2_rows_tie1n so its first four adds become add.s f0,f6,f8..f11 seeded from the existing +0.0 register, then delete the four per-group reset mov.s and the now-dead pre-row partial seeds - four instructions per group over 130,560 groups per token, with the add retained so signed-zero and rounding behaviour are literally unchanged, and the ELF verified to contain the intended form. Winner snapshotted as .auto/exp87/lut2_tie728.S.seed (md5 3a2e522e3f38) and committed before any restore. Pin stays at the owner's 5.3033; confirmation on a clean 4d3094578050 stack plus the independent LUT spill-removal lane (board 3, objdump-verified arithmetic-identical 4 mul.s + 16 madd.s with the three spills gone) are both live.","timestamp":1790273834774,"segment":1,"confidence":14.854732895970006,"asi":{"artifact_verified":"Mentor grepped the ELF: the group's first four adds are add.s f0,f6,f8..f11 and the second four retain the accumulators, i.e. the specialization landed where intended.","candidate":"B1 first-W8D accumulator seeding in nd_lut2_rows_tie1n: specialize the group's first W8D so its first four adds are add.s f0,f6,f8 .. f3,f6,f11 (seeded from the existing +0.0 register f6), delete the four per-group reset mov.s and the now-dead pre-row partial seeds; the add is retained so signed-zero and rounding are untouched.","hypothesis":"Per CQ2 group the kernel spends four mov.s resetting f0..f3 to +0.0; if the first W8D of the group instead seeds its first four adds from f6, four instructions per group disappear with no arithmetic change. 130,560 groups/token implies 522,240 fewer instructions.","metrics_note":"AUTO_GROUPS=primary, so extended/think/top1 were not measured in this session; the values carried here are this lane's own prefill/min_case/gen_tokens/heap plus the acceptance tree's unchanged fidelity and host verdict from the identical tree minus the .S change.","next":"Confirmation on a clean 4d3094578050 stack (board 2) is running-justified; board 3 continues the independent LUT spill-removal candidate, which objdump confirms is arithmetic-identical (4 mul.s + 16 madd.s both sides) and removed exactly the three spill stores.","snapshot":".auto/exp87/lut2_tie728.S.seed, md5 3a2e522e3f38, committed."}}
{"run":578,"commit":"3a2e522","metric":5.6117,"metrics":{"boot_bench_tps":5.659,"device_output_exact":6,"device_token_delta":0,"ext_decode_tps":5.4838,"gen_tokens":99,"host_output_exact":19,"internal_free":8415,"logit_max_delta":0.00005341,"logit_top1_match":10,"min_case_tps":5.35,"prefill_tps":5.9267,"psram_free":2052252,"think_tps":4.37},"status":"keep","description":"Launched the third independent lane: fw_scale's rescale now does an in-place read-modify-write (b4[j] = b4[j]*scale for all four elements) instead of staging four float temporaries, which is what made the object spill 5 values. The change is arithmetic-identical per element - one load, one mul.s, one store - and the rebuild keeps 5 mul.s / 5 ssi, so this is a pure live-range experiment. Provenance 328118911d23, layered on board 1's seed winner only, so the control is that board's own 5.6117 seed reading. Also anchoring a metric correction rather than leaving it wrong: run #577's real aggregate is METRIC prefill_tps=5.9267 (decode 5.6117 unchanged); my earlier 5.99 came from a non-anchored grep, the same anchored-vs-loose-grep failure this ledger has recorded repeatedly, and history is annotated not rewritten. Meanwhile board 2 is confirming the seed winner on a clean 4d3094578050 base and board 3 continues the arithmetic-identical LUT quartet-barrier spill removal. Pin still the owner's 5.3033; mentor's fused prepare+LUT recipe is the next independent build after these.","timestamp":1790273976445,"segment":1,"confidence":14.854732895970006,"asi":{"b2":"Cross-board confirmation of the seed winner on a CLEAN 4d3094578050 base (prov 61861dd9886c, .S-only delta) so it is compared against that board's own clean reading - a real second-board reading, not a layered stack.","control_for_this_candidate":"Board 1's seed-only reading 5.6117 on the same board, so this is like-for-like: the only delta is fw_scale's temporaries.","hypothesis":"fw_scale's four float temporaries make the compiler hold four values across four stores and the measured object spills 5 values doing it; in-place read-modify-write shortens each element's live range to one load/store pair while leaving per-element arithmetic exactly one lds, one mul.s, one sss.","metric_correction":"#577's prefill was carried from an unanchored grep again. The actual aggregate line in that log is 'METRIC prefill_tps=5.9267' (decode 5.6117 confirmed). Correcting by annotation here; the logged history is not rewritten.","next":"Mentor's B1-next recipe (lines 96-113: group-split callback calling the existing fwht_rows(ctx,g0,g1) then lutb_rows(ctx, g0*g/2, g1*g/2), join before the GEMV, radix-4 three-group body retained, no nested nd_parallel_rows, applied at the 18 paired CQ2 sites only) is the next independent build on a clean base, since the seed winner is already snapshotted and confirmed elsewhere.","b3":"Board 3 continues the LUT quartet-barrier candidate; objdump proved it arithmetic-identical (4 mul.s + 16 madd.s both sides) and removed exactly the three spill stores."}}
{"run":579,"commit":"3a2e522","metric":5.575,"metrics":{"boot_bench_tps":5.619,"device_output_exact":6,"device_token_delta":0,"ext_decode_tps":5.4838,"gen_tokens":99,"host_output_exact":19,"internal_free":8415,"logit_max_delta":0.00005341,"logit_top1_match":10,"min_case_tps":5.31,"prefill_tps":5.9267,"psram_free":2052252,"think_tps":4.37},"status":"discard","description":"LUT live-range/spill removal is measured and neutral-to-slightly-negative, so it is discarded. Quartet memory barriers in lutb_rows did exactly what was intended at the codegen level - spills fell from 19 to the 16 real LUT stores while the arithmetic graph stayed at 4 mul.s + 16 madd.s on both sides - and the device read decode 5.575 against this board's own acceptance-tree 5.58 at provenance 4d3094578050, i.e. -0.090 %, with min_case 5.31, boot bench 5.619, device 6/6 byte-exact, token_delta 0, internal_free 8,415. So the three spill stores were not on the critical path and removing them buys nothing; instruction-count and spill-count screens are not proxies for this metric even when the arithmetic is provably identical. Reverted with the tree hash verified back to exactly 4d3094578050, keeping board 3 clean for the mentor's fused prepare+LUT recipe. Live-range work continues only where a spill plausibly sits on the critical path - fw_scale's in-place RMW is running now on the seed base. Pin remains the owner's 5.3033 while the seed winner (+0.599 %) awaits its clean-base cross-board confirmation on board 2.","timestamp":1790274030546,"segment":1,"confidence":14.243990114580992,"asi":{"candidate":"Quartet store barriers inside lutb_rows: __asm__ __volatile__(\"\" ::: \"memory\") after every four LUT entries, source arithmetic byte-identical to shipped. objdump proved the intent was met - spills went 19 ssi -> 16 ssi (exactly the 16 LUT stores) with the arithmetic graph unchanged at 4 mul.s + 16 madd.s on both sides.","control":"Board 3's own acceptance-tree reading 5.58 at provenance 4d3094578050, so the only variable was the barrier edit.","correction":"The mentor's relay said 5.58 for this lane; the log's own anchored aggregate is METRIC decode_tps=5.575, so I use 5.575 and note the relay was rounded.","hypothesis":"The measured spills in lutb_rows cost time: force the scheduler to finish and store four LUT entries before producing the next four, without touching the madd arithmetic, via compiler-only memory barriers.","next":"Spill count is not the metric here - the three stores were free. Do not re-screen spill removal in lutb_rows; if live-range work continues, it must target a loop whose spills sit on the critical path (fw_scale is being measured now on the seed base).","rollback_reason":"decode 5.575 vs 5.58 on the same board is -0.090 %, inside the one-to-two-quantisation band and in the wrong direction; byte-exactness was 6/6 with token_delta 0, so it is rejected on speed alone. Removed the edit and verified board 3's tree hash returned to exactly the acceptance provenance 4d3094578050."}}
{"run":580,"commit":"e44fd08","metric":5.6117,"metrics":{"boot_bench_tps":5.658,"device_output_exact":6,"device_token_delta":0,"ext_decode_tps":5.4838,"gen_tokens":99,"host_output_exact":19,"internal_free":8415,"logit_max_delta":0.00005341,"logit_top1_match":10,"min_case_tps":5.35,"prefill_tps":5.925,"psram_free":2052252,"think_tps":4.37},"status":"keep","description":"B2 CONFIRMS THE SEED WINNER CROSS-BOARD on a clean acceptance base: board 2 at provenance 61861dd9886c - clean 4d3094578050 plus only the first-W8D seed .S - reads decode 5.6117 with prefill 5.925, boot bench 5.658, min_case 5.35, internal_free 8,415, device 6/6 byte-exact, token_delta 0, LANE_RC=0. Against board 2's own 5.5767 acceptance reading that is +0.627 %, matching board 1's +0.599 % to the digit, so the four-instructions-per-group removal in nd_lut2_rows_tie1n is a confirmed two-board win on byte-exact output rather than a board-specific artefact, and no third primary repeat is scheduled. Board 3's barrier result is also reinterpreted with the artifact's help: spills went away but the c->cb/xh/lut reloads moved inside the pair loop and the hardware loop became bnez, so #579 refutes that candidate's mechanism rather than proving spills are free - its successor (hoist the three context pointers plus four codebook floats before the pair loop, keep quartets) is now running on a clean board 3 base with objdump showing the restored 4 mul.s + 16 madd.s graph and the loop instruction back. Board 1's live fw_scale lane is disclosed as cold-path: #396/#404 show ngroup 6/24 use nd_fwht4s with the rescale folded, so fw_scale is not called in shipping and no speed claim can come from it; its successor is the fused prepare+LUT. Pin still the owner's 5.3033 pending admission of the confirmed seed stack.","timestamp":1790274204098,"segment":1,"confidence":13.681484678463528,"asi":{"confirmation":"Board 2 clean 4d3094578050 base + only the seed .S (prov 61861dd9886c) read decode_tps 5.6117 with prefill 5.925, boot bench 5.658, min_case 5.35, gen_tokens 99, internal_free 8,415, device_output_exact 6/6, token_delta 0, golden_missing 0, LANE_RC=0. Against board 2's own acceptance reading 5.5767 that is +0.627 %, and it lands on the same digit as board 1's +0.599 %, so the win is mechanism-driven, not board-specific, and no third primary repeat is wanted.","b3_mechanism_corrected":"Board 3's barrier was net negative because removing spills let the compiler sink the context-pointer and codebook reloads into the pair loop and turned the hardware loop into bnez - so the result refutes the candidate's mechanism, not the general value of spills. Successor now measured on a clean board 3 base: hoist the xh/cb/lut pointers and the four codebook values before the pair loop while retaining quartet emission; objdump confirms 4 mul.s + 16 madd.s and the loop instruction restored, no spills reintroduced.","hypothesis":"Cross-board confirmation of the first-W8D seed winner on a clean 4d3094578050 base, .S-only delta, so the comparison is against that board's own clean acceptance reading.","next_order":"Fused prepare+LUT (mentor recipe: one group-split callback calling existing fwht_rows then existing lutb_rows over the matching entry range, radix-4 three-group body preserved, no nested split, 18 paired CQ2 sites) is the next independent build; fw_scale stays cold-path-only and its lane finishes without being interpreted as hot-path evidence.","disclosure":"Board 1's live fw_scale lane is disclosed as cold-path work: runs #396/#404 show ngroup 6/24 use nd_fwht4s with the rescale folded, so fw_scale is not called on the shipping path and no speed claim can come from it."}}
{"run":581,"commit":"e44fd08","metric":5.6117,"metrics":{"boot_bench_tps":5.658,"device_output_exact":6,"device_token_delta":0,"ext_decode_tps":5.4838,"gen_tokens":99,"host_output_exact":19,"internal_free":8415,"logit_max_delta":0.00005341,"logit_top1_match":10,"min_case_tps":5.35,"prefill_tps":5.925,"psram_free":2052252,"think_tps":4.37},"status":"keep","description":"Built and launched the fused prepare+LUT candidate: a single group-split callback (prepair_rows) that calls the existing fwht_rows on its [g0,g1) and then the existing lutb_rows on [(g0*g)/2,(g1*g)/2), so each paired CQ2 site pays one nd_parallel_rows join instead of two, with the three-group radix-4 transform body preserved and the table build still parallel. Applied at the QKV/gate shared preparation, out_proj and the engram slot site; 4-bit prepare-only sites untouched. Fresh helper builds clean (BUILD_RC=0) and the lane runs on board 2 at provenance 25ab607692d2 over the confirmed seed base, so its control is that board's own seed reading 5.6117 and the fusion is the only variable. Host goldens are the pre-flash gate, so bit divergence stops before the board. No measurement claimed yet. Pin remains 5.3033 with the seed winner (+0.599 %/+0.627 %, two boards, byte-exact) still awaiting owner admission.","timestamp":1790274383897,"segment":1,"confidence":12.981162981162994,"asi":{"correctness_argument":"Each table entry T[i0|(i1<<2)] for pair p depends only on xh[2p], xh[2p+1], and pair p lies wholly inside group p/(g/2), so a worker that transforms [g0,g1) then builds [(g0*g)/2,(g1*g)/2) computes exactly the entries whose inputs it just wrote - no cross-group dependency, no ordering change, and xh's copy/pad still happens on the calling core before any split. Device splits of 3+3 (ngroup 6) and 12+12 (ngroup 24) both give disjoint, jointly complete pair ranges.","control":"Board 2's own seed-base reading 5.6117 (provenance 61861dd9886c), so this measures the fusion alone on top of the confirmed winner.","hypothesis":"Every paired CQ2 site pays two nd_parallel_rows joins - one to transform groups and one to build the pair table - although a group's transform and its table entries are independent of every other group. One group-split callback that calls the existing fwht_rows on [g0,g1) then the existing lutb_rows on that group range's pair slice removes one join per site across the 18 builds per decode token, while keeping the three-group radix-4 transform body and keeping the LUT build parallel.","patch":"prepair_ctx plus a static prepair_rows callback and nd_cq_prep_lut in engine/src/nd_quant.c, a declaration in nd_quant.h, and three call-site replacements in nd_model.c (QKV/gate shared prep, out_proj, engram slot). At the engram site nothing between the two original calls touched e or m->tmp2 - verified by reading the 20-line region - so moving the copy/pad to the build site is behaviour-identical.","next":"If it pays, cross-board it on a clean seed base; if it is null, the join count is not the bottleneck either and the remaining scheduling headroom is which loops are co-scheduled, not how many joins they pay. Board 3's pointer-hoist successor and board 1's cold-path fw_scale lane are separate readings already in flight or logged.","state":"Fused prepare+LUT implemented per the mentor recipe and building clean (BUILD_RC=0); launched on board 2 at provenance 25ab607692d2 on top of the confirmed seed base, measured by measure.sh's own host 19/19 pre-check before any flash, so a divergence cannot reach the board."}}
