{"run":390,"commit":"3f97869","metric":5.105,"metrics":{"boot_bench_tps":5.169,"device_output_exact":19,"device_token_delta":0,"ext_decode_tps":5.0492,"gen_tokens":99,"host_output_exact":19,"internal_free":13623,"logit_max_delta":0.00005341,"logit_top1_match":10,"min_case_tps":4.89,"prefill_tps":5.41,"psram_free":2052252,"think_tps":3.99},"status":"discard","description":"condT - stage cond_v channel-major: MEASURED, DIVERGES ON DEVICE (19/20 byte-exact), REJECTED and not integrated; accepted runtime stays 5.1050. Hypothesis came straight out of #380/#381's diagnosis: interleaving the eight conditioning reductions was monotonically worse, which said cond_rows is bound by its strided cond_v loads (one column at a time over a [d_model][8] table, 32 B stride, two useful floats per 64 B line). Transposing just that slot in the fp32 staging pool costs zero memory and turns eight strided 24 KB sweeps into eight contiguous 3 KB ones. It read +0.294% (5.1200) on board 2 twice - zero same-board spread, extended +0.36%, prefill +0.37%, min_case 4.89 - and was then refused by the device byte-exact gate: DEVICE_OUTPUT_DIVERGED 19/20. That gate verdict is the finding. (a) The host ran the same transposed fill AND the same channel-major read and produced 19/19 byte-identical output, so the defect is device-only - exactly the class run #333's multi-row cursor and #162's shared 8 kB table belong to, and the reason #298's device gate exists. (b) The 'another reader of slot 25 still assumed row-major' explanation was checked and excluded by grep, not assumed: fp[25] has exactly one consumer (nd_model.c:1727). (c) Mechanism unexplained is stated as unexplained: the fill is a single-core open-time pass, the read writes nothing shared, and the 4+4 channel split has disjoint outputs. Whatever the cause, a candidate that changes generated text on one of twenty cases is a quality change, and the campaign refuses it at any speed. (d) Generalisable rule: a host byte-exact run only prices the code the host actually executes - for a tier/staging-layout candidate that includes the two-core split and the device tier pointer, so 'host-proven byte-exact' must never be read as device-safety; #162's shared-state audit is part of pre-board validation, not a formality. Board 1 also came back mid-iteration (see asi.board1_availability), which reopens the canonical acceptance path; board 3's fw3fold lane stalled again on its own pre-rescue serial_api.py, so it has speed on two boards (+0.196%/+0.228%, four readings) but still no device gate - that gated canonical reading is the next measurement.","timestamp":1790178161161,"segment":1,"confidence":19.257411424439614,"asi":{"board1_availability":"RECOVERED during this iteration under the generic aliases: /dev/needle-pi/flash = char 166,2 (board2-flash is 166,0, board3-flash is 166,4), node mtime moved to 15:31 exactly when main's measure.sh flashed it, and it read the accepted 5.105. So the canonical main-tree path works again and CANNOT stomp boards 2/3 (distinct major/minor). My earlier 'canonical run blocked' reading was wrong and is corrected here.","candidate":"condT - cond_v slot 25 staged channel-major ([8][d_model] instead of [d_model][8]) so cond_rows' eight column sweeps become eight contiguous 3 KB rows. Host-proven 19/19 byte-exact, token_delta 0, fidelity 5.341e-05, checks.sh rc=0 before any flash.","divergence_detail":"heldout_long_tools_note_only, 19 tokens both, identical visible prefix - so a tail difference, not a collapse. Only ONE code reader of slot 25 exists (cv = fp[25] at nd_model.c:1727), so the 'second reader still assumes row-major' theory is excluded by grep, not by hope.","lesson_host_gate_scope":"a host byte-exact run prices alias/layout candidates only for the code the host actually executes; here it covered cond_rows but not the device tier/two-core interaction, so #162's shared-state audit must be read as PART of pre-board validation, never satisfied by goldens. Host 19/19 did not imply device safety.","mechanism_unexplained":"fill is a single-core open-time staging pass; the read is a per-channel contiguous sweep with no shared writes; the split is 4+4 channels with disjoint outputs. None of that explains a device-only single-case divergence, so the claim is unproven and the candidate is dead on measurement.","next_action_hint":"fw3fold is the live candidate: two boards agree (+0.196% board 1, +0.228% board 3, four readings 5.115/5.115/5.1167) but no suite ever reached the device byte-exact gate. Board 1 is back and main's tree now carries the console rescue, so apply the fw3fold patch to MAIN and run measure.sh there: a gated canonical reading, which is also the acceptance path.","note_control_run":"the mandated run_experiment this cycle was main's measure.sh on the restored board 1 and it read the accepted 5.105; that is a control and is NOT logged as a result (rule 1). It is recorded here because it is what proved board 1's recovery, and it timed out at my 600 s window mid-extended, not at a failure.","verdict":"REJECT. Device byte-exact gate fired: DEVICE_OUTPUT_DIVERGED 19/20 (one case differs, same token count, same visible prefix). Device-only: the host ran BOTH the transposed fill and the channel-major read and stayed byte-exact on 19 prompts, so this is the #333/#162 class - a defect the host goldens are structurally blind to. Speed is moot; not integrated."}}
{"run":391,"commit":"eecf9cb","metric":5.105,"metrics":{"boot_bench_tps":5.151,"device_output_exact":17,"device_token_delta":0,"ext_decode_tps":5.031,"gen_tokens":99,"host_output_exact":19,"internal_free":13623,"logit_max_delta":0.00005341,"logit_top1_match":10,"min_case_tps":4.87,"prefill_tps":5.39,"psram_free":2052252,"think_tps":3.99},"status":"keep","description":"Harness iteration + INVALIDATED canonical verdict, no engine change (accepted runtime stays 5.1050; metric carried forward, secondaries are the accepted run's). fw3fold got its first gated canonical run on the restored board 1 and the suite completed 20 cases: primary 5.117 (+0.23%, matching board 3's 5.1167 and board 1's two 5.115 readings) with ZERO divergences across the first 17 cases - then DEVICE_OUTPUT_DIVERGED 18/20. Reading the order rather than the tally is what mattered: the two divergent cases are exactly the two that ran AFTER the chip reset my new stage-2 rescue issued. That reset pulses EN through the USB-JTAG port and therefore restarts the firmware's demo timer and sampling counters, and both divergent cases are timer/sampling-dependent (heldout_interval_one 27tok->19tok, heldout_long_tools_note_only 19tok->63tok). So the divergences are boot-context, not the candidate: fw3fold is unresolved, not refuted, and is re-measuring on board 2 with the reset disabled. The fix is a policy one: the hard reset is now behind AUTO_HARD_RESET, unset by default, so a gated run fails loudly instead of mixing two boot contexts into one byte-exactness verdict - a gate that can be silently contaminated is worse than no gate, and this is the same class as #296/#298's silent-pass holes. Also fixed: my own inline patch of test_retry.py silently no-op'd because I did not assert the replace matched (the vacuous-write class I keep recording for engine candidates); the guard is now 7 cases and asserts the escalation order plus the must-fail paths, and it is wired into checks.sh. Off-device the layout class closed too: cond_u is already read channel-major, so condT was the only member - no further transpose candidates. The root blocker for the campaign is now named and measured rather than assumed: the board stops answering late in one attached session (case ~17-20) and even a fresh attach gets no STATE, with the firmware's own demo timer armed by earlier cases the leading suspect (STATE showed timer_status=running, ~35 s remaining, sample_period_s=10; run #155's original signature was the same). Board 3 started sinkpair, its first device reading.","timestamp":1790180708915,"segment":1,"confidence":19.257411424439614,"asi":{"fw3fold_canonical":"INVALIDATED, not refuted. Before the reset the suite ran 17 cases with ZERO divergences (primary mean 5.117, i.e. +0.23% agreeing with board 3's 5.1167 and board 1's two 5.115 readings); the only two divergences were the two cases AFTER my chip reset. So fw3fold's gate verdict is still open and is being re-measured on board 2 right now with the reset stage absent.","hard_reset_defect":"My stage-2 rescue pulsed EN through the USB-JTAG flash port to recover a board that stopped answering a fresh attach. It works mechanically, but it restarts the firmware's demo timer and sampling counters (the STATE line at the time showed timer_status=running, timer_remaining_ms=35619, sample_period_s=10). Both held-out cases that then diverged are timer/sampling-dependent: heldout_interval_one golden 27tok -> 19tok, heldout_long_tools_note_only golden 19tok -> 63tok. A mid-suite reset therefore invalidates those goldens' context, so mixing pre- and post-reset cases inside one gate verdict is meaningless. Now gated behind AUTO_HARD_RESET (unset by default): a gated run fails loudly instead of reporting a contaminated verdict. Opt-in is for speed-only/diagnostic runs.","board_state":"board1 present again via generic aliases (char 166,2; board2-flash 166,0, board3-flash 166,4 - so main's canonical path cannot stomp a pool board). Lanes started and verified this cycle: board2 = fw3fold gated re-run (engine_md5 01c1638ef34c, the same build board 1 and board 3 produced), board3 = sinkpair first device reading (engine_md5 34a9827c286d). Both sync from the committed branch, which carries the soft rescue and no reset.","host_gate_caveat":"fw3fold was host 19/19 byte-exact and its only two divergences are now attributed to boot context, so the earlier 'host byte-exact is not device safety' rule from #390 stands but was NOT the cause here. Keep the distinction: condT diverged in a clean session; fw3fold diverged only after a reset I caused.","next_action_hint":"Three ranked hypotheses after these lanes: (1) if fw3fold clears the gate at 20 cases it is a keep at about +0.23% and the transform family closes at three-wide; (2) sinkpair's verdict decides the exp-pairing family; (3) the firmware console wedge itself is now the top research blocker - five gated runs have died at ~case 17-20 in one session and the timer hypothesis (a timer armed by an earlier case firing during a later one) is testable by running the suite with the timer-arming cases moved last. Off-device audit already closed the layout class: cond_u is read channel-major already, so condT was the only instance.","root_blocker":"the board stops answering late in a single attached session (case ~17-20). Survives a soft reconnect (fresh attach gets no STATE). Suspect the firmware's own demo timer / sampling emitter, which earlier cases arm via set_timer and set_sampling_interval: STATE showed timer_status=running with ~35 s remaining and sample_period_s=10, and run #155's original signature was exactly 'console reads fine, writes block' after ~15 requests.","self_caught":"my inline patch of test_retry.py no-op'd because I did not assert the replace matched - the same vacuous-write class I have been logging in engine candidates. Fixed by asserting the anchor, and the guard now has 7 cases including the must-fail paths."}}
{"run":392,"commit":"eecf9cb","metric":5.1167,"metrics":{"boot_bench_tps":5.151,"device_output_exact":17,"device_token_delta":0,"ext_decode_tps":5.031,"gen_tokens":99,"host_output_exact":19,"internal_free":13623,"logit_max_delta":0.00005341,"logit_top1_match":10,"min_case_tps":4.88,"prefill_tps":5.4,"psram_free":2052252,"think_tps":3.99},"status":"discard","description":"fw3fold canonical acceptance attempt #2 with the chip-reset contamination removed: MEASURED +0.228% (primary 5.1167, calls_ok 6/6, 17 of 20 cases byte-exact with ZERO divergences) but NOT keepable, because acceptance requires device_output_exact over the full case set and the suite could not reach the end. Reverted from main; the candidate now has five agreeing speed readings across three boards (5.115 x3, 5.1167 x2, build md5 01c1638ef34c reproduced on all three) and still no gate. The real result is a diagnosis that changes what the campaign should do next: the stall is deterministic in the tail, not 'console fatigue'. This attempt and the previous canonical attempt both completed exactly 17 cases and stalled on the same case (immediately after heldout_long_route, on heldout_interval_one), board 2's fw3fold lane stalled at 16, board 3's sinkpair lane at 17 - three boards, two candidate images, same region, and each one failed honestly (TimeoutError, no case skipped, rc=1) with AUTO_HARD_RESET unset. Yet the condT lane completed all 20 cases from an equally fresh boot at 15:22Z on the same board 2, so it is neither one poisoned case nor cumulative uptime (every lane starts from its own flash and priming). The board answers neither a request nor a fresh-attach !status, which is distinct from the think-ack failure #346 fixed and from #155's original note: a firmware/bridge wedge in the tail, and it is now the binding constraint on accepting any winner - the immediate casualty is a measured +0.23% transform candidate. Secondaries for ext/think/boot-bench/RAM are carried forward from the accepted run because this lane never reached the think group; decode/prefill/min_case/gen_tokens are readings on this image.","timestamp":1790181959159,"segment":1,"confidence":19.257411424439614,"asi":{"candidate_reading":"fw3fold: 3-group FWHT stage walk + one merged rescale over 3g. Five speed readings on three boards now: 5.115, 5.115 (board 1), 5.1167 (board 3), 5.115 (board 2), 5.1167 (board 1 canonical) = +0.196% to +0.228% over accepted 5.1050. Host 19/19 byte-exact, token_delta 0, fidelity 5.341e-05, odd-split guard green, same build md5 01c1638ef34c reproduced on three boards.","gate_status":"STILL UNREACHABLE - second canonical attempt. 17 of 20 cases completed with ZERO divergences (so the only two divergences ever seen for this candidate were the two after my invalidated chip reset in run #391). Acceptance requires device_output_exact == device_cases over the full 20-case set, so +0.23% cannot be kept yet.","stall_localization":"board1 attempt1: 17 cases then stall; board1 attempt2: 17 cases then stall (same case, right after heldout_long_route, on heldout_interval_one); board2 fw3fold: 16 cases then stall; board3 sinkpair: 17 cases then stall. Three boards, two different candidate images, identical tail region, and every one refused to skip (TimeoutError, rc=1). Yet condT completed ALL 20 cases from an equally fresh boot at 15:22Z on board 2. So the stall is not one poisoned case and not cumulative uptime (each lane is a fresh flash+boot); it is session-state dependent in the tail region.","reframes_prior_note":"run #155 and #346 diagnosed 'console fatigue after ~15-20 requests' and #346's reconnect fixed the think-ack instance. Today's data shows a second, distinct failure: the board itself answers neither a request nor a fresh-attach !status. That is a firmware/bridge wedge, and it is now the campaign's binding constraint on accepting anything.","host_gate_caveat":"secondaries ext_decode_tps, think_tps, boot_bench_tps, internal_free, psram_free, device_token_delta, logit deltas and host_output_exact are carried forward from the accepted canonical run: this lane never reached the think group, so those are not readings on this image. decode/prefill/min_case/gen_tokens ARE readings on this image (primary group completed, calls_ok 6/6).","next_action_hint":"Make the tail reachable rather than hoping: add a --cases filter to bench.py (host-side only, cannot change the flashed image) and re-run just the last four cases with AUTO_NOFLASH=1 on board 1, which is already primed. If interval_one completes in a short session it is session-length/state dependent and gated runs need the tail executed first; if it never completes, the case itself wedges the firmware and that is a product defect to report to the owner. Either outcome unblocks acceptance or retires the candidate cleanly.","revisits_run":391}}
