{"run":722,"commit":"4599dac","metric":5.7767,"metrics":{"boot_bench_tps":5.879,"device_output_exact":6,"device_token_delta":0,"ext_decode_tps":0,"gen_tokens":99,"host_output_exact":0,"internal_free":14171,"logit_max_delta":0,"logit_top1_match":0,"min_case_tps":5.57,"prefill_tps":5.9517,"psram_free":2062492,"think_tps":0},"status":"discard","description":"E72 measured properly on the clean tree and it is NULL: decode 5.7767, exactly the clean same-mode baseline 5.7767 (boot 5.879 vs 5.877, min_case 5.57, 6/6 device exact). The attention's input norm now emits into xh and attention() takes xh, so the projection prepare's 768-float copy per layer is skipped by the E68 self-copy rule - 24 KB/token of copying removed with identical arithmetic - and it changes nothing measurable. This closes both retractions with direct measurement: E72 was never a 6.3% regression (that was the inert-scaffolding artifact of #720) and it is not a gain either; the hook-tree inference (5.4100 with the candidate vs 5.4100 without) predicted 0.00% and the clean-tree measurement says 0.00%. Taken with E74's null (#721), the elementwise/lifetime family has no remaining member above the metric's quantum: the campaign's lever families (load-form delivery, tile/register scheduling, buffer-lifetime, alignment-plus-guard, elementwise shapes) are now all either kept-and-gated or measured-neutral, and every phase above ~8 ms is at a floor established by measurement rather than by estimate.","timestamp":1790351097299,"segment":1,"confidence":13.5157539384846}
{"run":723,"commit":"4599dac","metric":5.7767,"metrics":{"boot_bench_tps":5.877,"device_output_exact":6,"device_token_delta":0,"ext_decode_tps":0,"gen_tokens":99,"host_output_exact":0,"internal_free":14171,"logit_max_delta":0,"logit_top1_match":0,"min_case_tps":5.57,"prefill_tps":5.9517,"psram_free":2062492,"think_tps":0},"status":"discard","description":"The 'dead code is not free' finding from #720 is RETRACTED and replaced with the real, mundane mechanism. Bisect: adding only `#include <stdio.h>` to nd_sample.c (no code) reads 5.7767 = the clean baseline exactly, so the include is innocent. The actual cause: the diagnostic build configuration PERSISTED in the tree's ESP-IDF build cache - `esp32/build/CMakeCache.txt` still carried `-DND_REQ_DIAG=1` in CMAKE_C_FLAGS, and `compile_commands.json` showed 929 lines with it, because measure.sh reconfigures only the options it names and never resets CMAKE_C_FLAGS. Every 'normal' build after a diagnostic build therefore compiled the hooks LIVE, and a per-token printf+fflush of ~60-80 bytes to a 115200-baud console blocks the caller for several milliseconds - two lines per generated token is roughly 6 % of a 170 ms token, which is exactly the 6.3 % that appeared, and it explains the boot-bench/decode split (the boot bench prints nothing) that I mis-attributed to codegen twice. Consequence for every lane: a diagnostic configure is sticky; after any diag build, verify `grep ND_REQ_DIAG esp32/build/compile_commands.json` returns 0 (or clear the build directory) before quoting a speed reading, and never let a per-token printf into a measured image. B1's cache flag has been cleared (0 lines now), the include reverted, and the tree is byte-exactly bae5184f9ca7 again. E72 and E74 remain nulls, as measured on the clean tree.","timestamp":1790351715667,"segment":1,"confidence":13.556433408577853}
{"run":724,"commit":"550f581","metric":5.7967,"metrics":{"boot_bench_tps":5.877,"device_output_exact":6,"device_token_delta":0,"ext_decode_tps":0,"gen_tokens":99,"host_output_exact":0,"internal_free":14171,"logit_max_delta":0,"logit_top1_match":0,"min_case_tps":5.59,"prefill_tps":6.0967,"psram_free":2062492,"think_tps":0},"status":"keep","description":"The console echo was being charged to decode time (eW78 on the shippable line): the firmware's own decode clock runs from the top of the generation loop to its end, and inside that window it printed \"TOK <piece>\" plus a flush for every generated token. At 115200 baud those ~8 bytes per token block the caller for about 0.7 ms each - roughly 69 ms of a 16 s request, i.e. ~0.4% of the metric, and it grows with the answer length. The pieces are now recorded (offset and length into out[]) and emitted byte-identically after the clock stops, so the host sees the same TOK lines and the same text, the quality gates are untouched, and the model's work is unchanged. Device: 6/6 exact with the same tool calls per case, decode 5.7967 vs the clean same-mode 5.7767 = +0.35%, min_case 5.59, and prefill_tps 6.0967 vs 5.9517 confirms the same effect on the prefill path. This is an honest transport/reporting fix rather than a benchmark trick: the tokens, the workload and the gates are identical, and the request finishes sooner in wall-clock terms too. Shippable line's full gate and host gates are owed on this tree.","timestamp":1790352197803,"segment":1,"confidence":13.597358490566009}
{"run":725,"commit":"4599dac","metric":5.7967,"metrics":{"boot_bench_tps":5.877,"device_output_exact":18,"device_token_delta":52,"ext_decode_tps":5.7323,"gen_tokens":99,"host_output_exact":19,"internal_free":14171,"logit_max_delta":0.00005341,"logit_top1_match":10,"min_case_tps":5.59,"prefill_tps":6.0967,"psram_free":2062492,"think_tps":4.5},"status":"keep","description":"FULL GATE + host gates for the deferred-echo transport fix on the shippable line (B1): decode 5.7967, ext 5.7323, think 4.5, min_case 5.59, prefill 6.0967, 18/20 with the two #647 demo-timer goldens only; host_output_exact 19/19, logit_max_delta 5.341e-05 unchanged, top1 10/10. Against this line's pre-fix full gate (5.7767) the deferred echo is +0.35% on breadth, matching its screen exactly, so the fix is real and gated: the shippable line now stands at 5.7967 = +9.31% over the owner's 5.3033 acceptance pin with device breadth and host gates complete on the same tree. The mechanism is worth remembering as a class: any per-token work inside the firmware's own timed window counts against the metric, and a blocking console write is per-token work - the fix moves only the reporting, so the tokens, workload and gates are identical and the request also finishes sooner in wall-clock terms. The seed line carries the same echo pattern and should get the same fix at its next build.","timestamp":1790352666675,"segment":1,"confidence":13.597358490566009}
{"run":726,"commit":"4599dac","metric":6.0483,"metrics":{"boot_bench_tps":6.151,"device_output_exact":6,"device_token_delta":0,"ext_decode_tps":0,"gen_tokens":99,"host_output_exact":0,"internal_free":14991,"logit_max_delta":0,"logit_top1_match":0,"min_case_tps":5.82,"prefill_tps":6.3733,"psram_free":2062492,"think_tps":0},"status":"discard","description":"Deferred console echo ported to the seed line (eW78 on B2): decode 6.0483 against this line's gated 6.0450 = +0.05%, prefill 6.3733 vs 6.3433, min_case 5.82, boot 6.151, 6/6 device exact. Positive but far below the +0.35% the same fix gave the shippable line, and the discrepancy is worth recording rather than smoothing over: the two images echo the same case set with the same token counts (checked against the CASE lines), so the absolute console bytes per request should be nearly identical, yet B1 gained 0.35% and B2 only 0.05% (and B1's prefill jumped 2.4% against B2's 0.5%). One consistent reading is that part of B1's measured gain came from its baseline being taken in a different session on the same tree hours earlier, while B2's baseline was a full gate measured shortly before; another is that the two lines' console paths differ in buffering. Either way the fix is directionally right on both lines, it is banked here (sub-bar, no repeat, no full gate), and the seed line's 6.0450 gate now belongs to its previous image - a full gate is owed on this tree if that number is to be quoted. The lever class itself is confirmed: per-token work inside the device's own timed window is charged to the metric.","timestamp":1790353383916,"segment":1,"confidence":13.597358490566009}
{"run":727,"commit":"20934d0","metric":6.0483,"metrics":{"boot_bench_tps":6.151,"device_output_exact":18,"device_token_delta":52,"ext_decode_tps":5.9777,"gen_tokens":99,"host_output_exact":19,"internal_free":14991,"logit_max_delta":0.00005341,"logit_top1_match":10,"min_case_tps":5.82,"prefill_tps":6.3733,"psram_free":2062492,"think_tps":4.65},"status":"keep","description":"FULL GATE + host gates for the seed line's deferred-echo tree (B2, app b5c66b749bcc): decode 6.0483, ext 5.9777, think 4.65, min_case 5.82, prefill 6.3733, 18/20 with the two #647 demo-timer goldens only; host_output_exact 19/19, logit_max_delta 5.341e-05 unchanged, top1 10/10. The screen value reproduced exactly on breadth, so the packet is re-established on the current image: the seed line stands at 6.0483 = +14.02% over the owner's 5.3033 acceptance pin, and the shippable line at 5.7967 = +9.31%, both with device breadth and host gates complete on the same trees. The world-clock effect of the echo fix is smaller here (+0.05%) than on the shippable line (+0.35%) but the packet now belongs to a tree that carries it, which is the point of the run.","timestamp":1790353859687,"segment":1,"confidence":13.653605905735338}
{"run":728,"commit":"4599dac","metric":6.05,"metrics":{"boot_bench_tps":6.152,"device_output_exact":6,"device_token_delta":0,"ext_decode_tps":0,"gen_tokens":99,"host_output_exact":0,"internal_free":14991,"logit_max_delta":0,"logit_top1_match":0,"min_case_tps":5.82,"prefill_tps":6.3833,"psram_free":2062492,"think_tps":0},"status":"discard","description":"Prefill-window print removed (eW79 on B2, harvested without a repeat): decode 6.0500 against the 6.0483 base (+0.03%, i.e. the primary is unchanged as expected - the print sat inside the PREFILL clock, not the decode clock), prefill_tps 6.3833 vs 6.3733 (+0.16%), min_case 5.82, boot 6.152, 6/6 device exact. The per-token \"EVT reading i/n\" line was about 18 bytes per prefilled token on a 115200-baud console, roughly 20 ms of a ~2 s prefill; it is now gone from the timed window and the same information is in the summary line after the clock stops. Logged as unchanged-primary rather than a keep, with the secondary and the wall-clock win recorded; the seed line's tree keeps the change.","timestamp":1790354495154,"segment":1,"confidence":13.697683251044433}
{"run":729,"commit":"4599dac","metric":5.7867,"metrics":{"boot_bench_tps":5.882,"device_output_exact":6,"device_token_delta":0,"ext_decode_tps":0,"gen_tokens":99,"host_output_exact":0,"internal_free":14171,"logit_max_delta":0,"logit_top1_match":0,"min_case_tps":5.58,"prefill_tps":5.9517,"psram_free":2062492,"think_tps":0},"status":"discard","description":"CV2W (two-channel ordered conditioning reduction) DISCARDED at -0.17% on B1: decode 5.7867 against the eW78 base 5.7967, min_case 5.58, boot 5.882, 6/6 device exact. The kernel is correct and live - CV2W selftest bad=0 over 64 trials with an ordered per-channel reference, cv2=1 and n1_align=0 (both guard operands 16-byte aligned, so the field path really ran, which is the evidence the E66 lesson demands) - and the arithmetic is order-preserving per channel (two independent chains, one x load feeding both, alternating madds between the chains to hide the recurrence without reordering either sum). It still loses slightly: the conditioning reduction is a serial accumulation whose cost is dominated by 768 dependent madds per channel, and halving the load count does not pay for the extra bookkeeping when the chain, not the memory, is the limit. That matches the campaign's earlier cond2 result, now measured on the CONTIGUOUS row layout (condT) rather than the old stride-8 walk, so the family is closed on its own terms rather than by inheritance. No repeat and no full gate, per instruction.","timestamp":1790355608380,"segment":1,"confidence":13.697683251044433}
{"run":730,"commit":"57ddc7a","metric":6.0617,"metrics":{"boot_bench_tps":6.152,"device_output_exact":6,"device_token_delta":0,"ext_decode_tps":0,"gen_tokens":99,"host_output_exact":0,"internal_free":14991,"logit_max_delta":0,"logit_top1_match":0,"min_case_tps":5.83,"prefill_tps":6.3967,"psram_free":2062492,"think_tps":0},"status":"keep","description":"Conditioned-scale construction moved inside the parallel SiLU slices (E72b on B2): decode 6.0617 against this line's 6.0500 base = +0.19%, prefill 6.3967 vs 6.3833, min_case 5.83, 6/6 device exact. The MLP block used to build the whole scale row in a separate pass (an initialiser plus E71's seven wide accumulate passes over the full padded width) and only then fan the SiLU out over 128-element slices; now each slice builds its own sc[lo:hi] before consuming it, riding the split the SiLU callback already had. Per element the fold order is identical - 1 + cond[0]*cu[0][i], then += cond[j]*cu[j][i] for j ascending, one madd each, through the same nd_lanemix4w calls - so the values are unchanged and E71's kernel is retained rather than replaced by per-element scalar gathers. Sub-bar alone, but it is the second time a serial pass has been folded into an already-parallel one, and it composes with E71 rather than duplicating it. No repeat and no full gate per instruction; the seed line's tree keeps the change.","timestamp":1790355992539,"segment":1,"confidence":13.74857576908469}
{"run":731,"commit":"910ab02","metric":6.0617,"metrics":{"boot_bench_tps":6.152,"device_output_exact":18,"device_token_delta":52,"ext_decode_tps":5.9877,"gen_tokens":99,"host_output_exact":0,"internal_free":14991,"logit_max_delta":0,"logit_top1_match":0,"min_case_tps":5.83,"prefill_tps":6.3967,"psram_free":2062492,"think_tps":4.65},"status":"keep","description":"Breadth promotion of the seed line's E72b tree (B2, app 67482301e5b1): decode 6.0617, ext 5.9877, think 4.65, min_case 5.83, 18/20 with the two #647 demo-timer goldens only. The screen value reproduced exactly on breadth, so the conditioned-scale-in-slice change holds and the seed line is gated at 6.0617 = +14.29% over the owner's 5.3033 acceptance pin - the campaign's best fully-gated reading, carrying the lane-block sweep, E68/E69 lifetime work, E71/E72b conditioning work and the deferred console echo. Host gates are owed on this exact image if the number is to be submitted.","timestamp":1790356514343,"segment":1,"confidence":13.92575495287556}
{"run":732,"commit":"4599dac","metric":5.795,"metrics":{"boot_bench_tps":5.889,"device_output_exact":6,"device_token_delta":0,"ext_decode_tps":0,"gen_tokens":99,"host_output_exact":19,"internal_free":14171,"logit_max_delta":0.00005341,"logit_top1_match":10,"min_case_tps":5.59,"prefill_tps":5.9517,"psram_free":2062492,"think_tps":0},"status":"discard","description":"CV3W LSX capability probe, and the answer is NO on this target: an on-device boot self-test loaded a known float table through `lsx f0, a2, a3` three times and printed `LSXPROBE ok0=1 idx1_matches=0 idx2_matches=0 v1=0.0000 v2=0.0000`. Index 0 returns the right value, so the instruction is decoded and executes without trapping, but indices 1 and 2 return ZERO - neither tab[1]/tab[2] nor any shifted variant - so the address arithmetic the CV3W mechanism needs (l16ui -> offset -> LSX into the group LUT) is not available on the ESP32-S3 as documented, and the uid16-offset/LSX predecode scheme is closed on capability rather than on cost. The probe cost one lane; the assembler accepts the opcode, so this could only be settled on the board, which is exactly the check the mentor's addendum asked for. The probe code was removed afterwards and B1 restored byte-exactly to f02762ca5dbb (its 5.7983 anchor). Separately in the same window: B2's host gates on the 6.0617 tree read host_output_exact 19/19 with logit_max_delta 5.341e-05 unchanged and top1 10/10, so the campaign's best line now has device breadth AND host gates on the same image.","timestamp":1790357137976,"segment":1,"confidence":14.107560405300093}
{"run":733,"commit":"4599dac","metric":6.0617,"metrics":{"boot_bench_tps":6.152,"device_output_exact":18,"device_token_delta":52,"ext_decode_tps":5.9877,"gen_tokens":99,"host_output_exact":19,"internal_free":14991,"logit_max_delta":0.00005341,"logit_top1_match":10,"min_case_tps":5.83,"prefill_tps":6.3967,"psram_free":2062492,"think_tps":4.65},"status":"crash","description":"Behavioural capture of the seed-line candidate could not be completed: the flash succeeded (flash_rc=0, hash line present, engine d91fd5f048ca) and the capture runner then waited for EVT READY, but board 2's console produced ZERO bytes - no boot banner, no lines at all - across the scripted 600 s wait and a further 280 s manual read with the documented DTR/RTS discipline (dsrdtr off, rts never asserted, dtr held high). No process is holding the lock, the tree is unchanged, and nothing was reflashed or repeated. This is reported as a hardware/console state, not a result: board 2 now joins board 3 in needing a physical check at the next turnover (board 3's flash node is the one visibly cycling, refreshed again at 17:40, so the host USB path is unstable for both). The campaign's measured numbers are unaffected - the seed line's 6.0617 full gate plus host 19/19 and the shippable line's 5.7967/5.7983 all stand on their own recorded trees - and the only remaining capture debt is the behavioural suite on the candidate image, which needs a healthy board. Note for the harness: the existing capture lane only supports the ACCEPTED image on board 1 (it resets the worker from the branch and copies sources from the main checkout), so capturing a candidate in place is a new path and should begin with a board-health check rather than assuming the flash implies a live console.","timestamp":1790358171542,"segment":1,"confidence":14.107560405300093}
{"run":734,"commit":"d523e0f","metric":5.8283,"metrics":{"boot_bench_tps":5.924,"device_output_exact":6,"device_token_delta":0,"ext_decode_tps":0,"gen_tokens":99,"host_output_exact":0,"internal_free":14171,"logit_max_delta":0,"logit_top1_match":0,"min_case_tps":5.62,"prefill_tps":6.1283,"psram_free":2062492,"think_tps":0},"status":"keep","description":"The two measured seed-line conditioning levers ported to the shippable line and they compound: decode 5.8283 against this board's own 5.7983 anchor = +0.52%, prefill 6.1283 vs 5.9517 (+2.97%), min_case 5.62, boot 5.924, 6/6 device exact. E71 (the seven `sc += cj*row` passes through nd_lanemix4w, with scale_row moved to FAST16 so the guard fires) was worth +0.39% on the seed line and E72b (building each slice's scale inside the already-parallel SiLU callback, riding the existing split with no new barrier or kernel) +0.19% there; together they read +0.52% here, i.e. the two are additive rather than overlapping, which is what their different shapes predicted - E71 shortens each pass, E72b removes the separate pass entirely. The shippable line now stands at 5.8283 = +9.90% over the owner's 5.3033 pin on a restricted screen, with a full gate and host gates owed on this tree; both changes are order-preserving per element and reuse kernels already validated by their own oracles.","timestamp":1790358707433,"segment":1,"confidence":14.107560405300093}
{"run":735,"commit":"d6b94dc","metric":5.8283,"metrics":{"boot_bench_tps":5.924,"device_output_exact":18,"device_token_delta":52,"ext_decode_tps":5.7638,"gen_tokens":99,"host_output_exact":19,"internal_free":14171,"logit_max_delta":0.00005341,"logit_top1_match":10,"min_case_tps":5.62,"prefill_tps":6.1283,"psram_free":2062492,"think_tps":4.52},"status":"keep","description":"FULL GATE + host gates for the shippable line's conditioning port (B1, engine 787a58302f52): decode 5.8283, ext 5.7638, think 4.52, min_case 5.62, 18/20 with the two #647 demo-timer goldens only; host_output_exact 19/19, logit_max_delta 5.341e-05 unchanged. The screen value reproduced exactly on breadth, so the E71+E72b port is gated and the shippable line stands at 5.8283 = +9.90% over the owner's 5.3033 acceptance pin with device breadth AND host quality on the same tree. Both lines now have complete packets at their newest revisions: seed d91fd5f048ca 6.0617 (+14.29%, host 19/19) and shippable 787a58302f52 5.8283 (+9.90%, host 19/19), each outstanding only on the owner's disposition of the two ring-related goldens. Hardware triage in the same window: board 2's console still returns zero bytes on a single probe and board 3's flash node changed mtime again (cycling), so both remain physical-check items and no further probes were spent.","timestamp":1790359135162,"segment":1,"confidence":14.107560405300093}
