{"run":350,"commit":"99cd29f","metric":5.03,"metrics":{"boot_bench_tps":5.076,"device_output_exact":20,"device_token_delta":0,"ext_decode_tps":4.9577,"gen_tokens":99,"host_output_exact":19,"internal_free":14903,"logit_max_delta":0.00005341,"logit_top1_match":10,"min_case_tps":4.8,"prefill_tps":5.3083,"psram_free":2052252,"think_tps":3.94},"status":"keep","description":"Experiment 30 LANE 1 (board 1, kbench, real archive bytes; decode_tps is the accepted 5.0300 carried forward - no shipping change): TIER LAYOUT, the lever left after Experiment 29 closed scheduling. Laying the four attention CQ2 tensors' bytes (576/96/128/768 x 768, 319,872 B) out contiguously in per-token read order instead of four separate allocations is BIT-EXACT (mismatch = 0 of 1,568 rows - same bytes, different addresses) and worth **+0.89 %** on the dominant two-core pass: 3,267,790 -> 3,238,852 cycles, 2.7136 -> 2.6896 cycles/weight, min of 12 rounds, shipping nd_lut2_rows_tie1n (asm=1). Against proj2bit = 86.2 ms of a 197 ms token that is 0.77 ms/token = **+0.39 % decode**, above the 0.2 % keep bar, and it is the strongest candidate since run #333. It is NOT integrated, because my baseline is not shipping's layout: nd_tier_ptr maps one contiguous archive span 1:1 into the 12 MB tier, so a layer's q/k/v/gate are already adjacent in PSRAM, and a packed tier needs a per-tensor offset map. The screen therefore measures 'scattered mallocs -> packed', an upper bound on 'archive-offset span -> packed'. Lane 3 independently confirms the mechanism is real: on a cold pass over one tensor, ascending (what the model does) is best at 2.7471 cyc/weight and shuffled is +6.35 % worse, with descending +1.10 % and stride-4 +3.08 % in between. Next measurement is the integration gate: packed vs a shipping-like archive-offset layout inside one buffer.","timestamp":1790142506680,"segment":1,"confidence":21.267871815940737,"asi":{"correct_next_measurement":"Before integrating anything: re-run the comparison against a SHIPPING-LIKE layout - one big buffer with each tensor memcpy'd at (archive_off - region_lo), which is what nd_tier_ptr's 1:1 mapping actually produces - vs the packed use-ordered buffer. That is the apples-to-apples test, and it is the first lane of the next batch. Recorded as a caveat rather than shipped because shipping's four attention tensors are adjacent in the archive, so the tier may already be effectively packed for them.","hypothesis":"the 12 MB tier copies a raw archive SPAN, so a token's CQ2 reads are spread over megabytes of address space; packing the same bytes contiguously in per-token read order should reduce the address space walked per token and cut part of the measured flat 13.90 % cold PSRAM delivery tax (#330).","invalidates_previous_discard":"Potentially run #340 (embedding reads through the tier, +0.03 %) - but no: #340 changed WHICH pointer a scattered gather used, not the layout of the bytes, so its null stands. It does reopen the TIER family, which the ledger had closed on span/stride/copy-order/coverage: those knobs all preserve the 1:1 archive-to-PSRAM mapping, and layout permutation is a different lever that was never in the family.","lane3_independent_confirmation":"order does matter on cold passes over one tensor: ascending 2.7471 cyc/weight, descending 2.7773 (+1.10 %), stride4 2.8316 (+3.08 %), stride16 2.7831, stride64 2.7516, shuffled 2.9214 (+6.35 %). Ascending - what the model already does per tensor - is the best of six, which both bounds the win (a token's real order is already near-best within a tensor) and proves address order is a real ~6 % lever on this phase, not noise.","next":"next batch: (A) packed vs shipping-like archive-offset layout in one buffer (the integration gate for this result); (B) attention P.V accumulate loop interchange - the biggest unmeasured sub-block of the 35.3 ms head split, bit-exact by construction because every oh cell accumulates independently; (C) TIE wide-load FWHT in nd_cq_prepare, where wide float loads on plain aligned floats are unaffected by #335's nibble-identity defect.","result":"1,568 rows / 1,204,224 weights, mismatch = 0 (bit-exact by construction: identical bytes at different addresses), min of 12 rounds, two-core, nd_lut2_rows_tie1n (asm=1). Four heap allocations spread over PSRAM: 3,267,790 cycles (2.7136 cyc/weight). Same bytes packed into one 319,872 B buffer in per-token read order: 3,238,852 cycles (2.6896) = +0.89 %.","screen":"kbench on board 1, real needle3.cact bytes staged into PSRAM as the tier stages them. decode_tps is the accepted 5.0300 carried forward - no shipping change, this is a screen.","strongest_candidate":"Since run #333's phi asm (+0.365 %). 0.89 % of proj2bit (86.2 ms) is 0.77 ms/token = +0.39 % decode at the campaign's measured 25-70 % realisation band.","verdict":"NOT integrated yet, deliberately, and the reason is a real mismatch in my own baseline: layout A in this screen was four separate heap_caps_malloc blobs, but shipping does NOT do that - nd_tier_ptr maps a single contiguous archive span 1:1 (return m->eg_vpsram + (t->offset - m->eg_region_lo)), so a layer's q/k/v/gate already sit adjacent in PSRAM at their archive offsets. The +0.89 % therefore measures 'scattered mallocs -> packed', which is an UPPER bound on 'archive-offset span -> packed'."}}
{"run":351,"commit":"99cd29f","metric":5.03,"metrics":{"boot_bench_tps":5.076,"device_output_exact":20,"device_token_delta":0,"ext_decode_tps":4.9577,"gen_tokens":99,"host_output_exact":19,"internal_free":14903,"logit_max_delta":0.00005341,"logit_top1_match":10,"min_case_tps":4.8,"prefill_tps":5.3083,"psram_free":2052252,"think_tps":3.94},"status":"keep","description":"Experiment 30 LANE 2 (board 2, kbench; decode_tps is the accepted 5.0300 carried forward, no shipping change): attention Q.K operand reuse. Measured the shipped two-term-group dot (dot_c4 schedule) on n=48 vectors, 256 dots/round, min of 25 rounds: both operands rotating (the shipping loop's shape) 229.93 cycles/dot, q fixed for the whole inner block 226.80 = +1.38 %. Taking +1.38 % as the ceiling for keeping q live across positions of a head, the prize is 1.38 % of 8.3 ms = 0.115 ms/token = +0.06 % decode, under a third of the keep bar, so the head loop is not restructured. Two honesty notes recorded in the bench output: my two-positions-per-q variant compared its accumulated total against a single pair's scalar sum (pair_vs_scalar_mismatch=3 of 4 - my comparison was wrong, not the schedule), and both variants are pure over global arrays, which is exactly run #230's recorded hoisting trap, so the absolute cycles are an upper bound rather than a clean schedule measurement. Closed on the bound because even the bound is below the bar.","timestamp":1790142539444,"segment":1,"confidence":21.267871815940737,"asi":{"candidate":"LANE 2 (board 2): attention Q.K operand reuse - the shipped loop hands the dot a fresh q and a fresh k each position, but q is invariant across the positions of one head, so keeping it live is operand reuse (#230 tested interleaving and extra accumulators, never reuse).","harness_defect_found":"kb_dot_q2 compared its accumulated total against one pair's scalar sum, so pair_vs_scalar_mismatch=3 of 4 is MY comparison being wrong, not the schedule; and both helper variants are pure over global arrays, which is #230's documented hoisting trap (a fixed-operand pure call gets lifted out of the timing loop). Both make lane 2's absolute numbers untrustworthy. Closed on the upper bound instead of re-running, because even the ceiling is under the bar; the pair form must be re-tested with rotated per-iteration operands and a per-iteration consume if it is ever revisited.","hypothesis":"~14,400 dots x 138 cycles = 8.3 ms of the attention stage; if a resident q made each dot cheaper, restructuring the head loop to hold q live across positions would pay.","next":"not this - the next batch is (A) the packed-vs-archive-offset layout gate for lane 1's +0.89 %, (B) the attention P.V accumulate loop interchange, which is the biggest unmeasured sub-block of the 35.3 ms head split and is bit-exact by construction because every oh cell accumulates independently, (C) TIE wide-load FWHT in nd_cq_prepare.","result":"both operands rotating (the shipping shape) 229.93 cycles/dot; q fixed for the inner block 226.80 = +1.38 %. Taking that as the CEILING for keeping q resident: 1.38 % of 8.3 ms = 0.115 ms/token = +0.06 % decode, under a third of the 0.2 % keep bar.","verdict":"REJECT on an upper bound. A +1.4 % operand-reuse win on an 8.3 ms phase is 0.06 % of the token, so no head-loop restructuring is warranted even if the schedule were perfect. The same arithmetic is why the campaign keeps landing on phases, not micro-schedules: at 197 ms/token, only phases above ~5 ms can pay a 0.2 % candidate."}}
{"run":352,"commit":"99cd29f","metric":5.03,"metrics":{"boot_bench_tps":5.076,"device_output_exact":20,"device_token_delta":0,"ext_decode_tps":4.9577,"gen_tokens":99,"host_output_exact":19,"internal_free":14903,"logit_max_delta":0.00005341,"logit_top1_match":10,"min_case_tps":4.8,"prefill_tps":5.3083,"psram_free":2052252,"think_tps":3.94},"status":"keep","description":"Experiment 30 LANE 3 (board 3, kbench, real archive bytes; decode_tps is the accepted 5.0300 carried forward, no shipping change): cold-pass read-order sensitivity, the cheap gate for the byte-layout family. One 768x768 CQ2 tensor (589,824 weights), shipping nd_lut2_rows_tie1n (asm=1), 160 KB PSRAM sweep before every timed pass to evict the 64 KB data cache, min of 10 rounds: cycles/weight 2.7471 ascending, 2.7773 descending (+1.10 %), 2.8316 stride-4 (+3.08 %), 2.7831 stride-16 (+1.31 %), 2.7516 stride-64 (+0.16 %), 2.9214 shuffled (+6.35 %). Two conclusions: the answer is NOT flat, so address order is a genuine ~6 % lever on the dominant phase - which is independent physical confirmation of the mechanism run #350 measured from the other side; and ascending, which is exactly what the model already does inside a tensor, is the best of the six, so no headroom remains within a tensor and the only remaining question is inter-tensor placement, i.e. what the tier's 1:1 archive-span mapping does. Recording also that my own summary line printed the spread with the wrong sign (-5.97 % where the reading is 'shuffled is 6.35 % worse'); the per-order lines are the authority.","timestamp":1790142571990,"segment":1,"confidence":21.267871815940737,"asi":{"candidate":"LANE 3 (board 3): cold-pass read-order sensitivity of the dominant CQ2 tensor - ascending, descending, stride 4/16/64, and Fisher-Yates shuffled visits over one 768x768 tensor, with a 160 KB PSRAM sweep evicting the data cache before each timed pass. This is the cheap gate that decides whether ANY byte-layout permutation can pay, which is the family run #350's +0.89 % belongs to.","hypothesis":"if cycles/weight were flat across visit orders, no layout permutation could pay and the whole tier-layout family would close off-device; if not flat, the spread is the budget a layout change can spend.","numbers":"asc 2.7471 / desc 2.7773 (+1.10 %) / stride4 2.8316 (+3.08 %) / stride16 2.7831 (+1.31 %) / stride64 2.7516 (+0.16 %) / shuffled 2.9214 (+6.35 %) cyc per weight; 589,824 weights per pass, min of 10 rounds, nd_lut2_rows_tie1n (asm=1), cold by construction.","note_on_printed_spread":"the bench's own order_spread line printed -5.97 % because it divided asc by shuffled and reported it as a signed spread; the magnitudes above are the correct reading (shuffled is 6.35 % WORSE than ascending). Fixed in the bench's follow-up so a future reader is not misled by the sign.","result":"NOT flat: ascending (which is what the model already does per tensor) is the BEST of six orders at 2.7471 cyc/weight; descending +1.10 %, stride-4 +3.08 %, stride-16 +1.31 %, stride-64 +0.16 %, shuffled +6.35 %. So address order is a real ~6 % lever on the dominant phase, and the model's within-tensor order is already at the optimum.","verdict":"Family stays OPEN but the budget is bounded and the shipping order is already best-in-class within a tensor: the only headroom left is BETWEEN tensors, i.e. how the tier places different tensors relative to each other, which is exactly run #350's measurement. Two independent results (#350's +0.89 % packed-vs-scattered, and this 6.35 % ascending-vs-shuffled) now say the delivery tax has a layout component; whether the shipping 1:1 span mapping already collects it is the next measurement."}}
{"run":353,"commit":"82fc836","metric":5.03,"metrics":{"boot_bench_tps":5.076,"device_output_exact":20,"device_token_delta":0,"ext_decode_tps":4.9577,"gen_tokens":99,"host_output_exact":19,"internal_free":14903,"logit_max_delta":0.00005341,"logit_top1_match":10,"min_case_tps":4.8,"prefill_tps":5.3083,"psram_free":2052252,"think_tps":3.94},"status":"keep","description":"Experiment 31 LANE 1 (board 1, kbench, real archive bytes; decode_tps is the accepted 5.0300 carried forward, no shipping change): the integration gate on the byte-layout lever, and it says do not build it. Comparing shipping's actual tier mapping (one buffer, each tensor at archive_off - region_lo, exactly what nd_tier_ptr computes) against the same bytes packed at 64 B-aligned offsets in per-token read order: shipping 3,270,319 cycles vs packed 3,299,493 for 1,204,224 weights = packing is **0.88 % WORSE** (2.7157 vs 2.7399 cyc/weight), bit-exact mismatch=0 of 1,568 rows, min of 14 rounds, nd_lut2_rows_tie1n. So run #350's +0.89 % was entirely 'four scattered heap allocations -> packed', a comparison against a baseline shipping does not have. The gap table explains why packing cannot win here: the archive puts 537 KB between q and k and 537 KB between k and v, and gate's offset sits 375 KB *before* v, so the read order is not an address order either. Byte-layout family CLOSED on three measurements (#350 packed-vs-scattered +0.89 %, this packed-vs-shipping-map -0.88 %, #351 within-tensor order ascending already best) and an integration that would have measured -0.9 % was avoided for the price of one screen.","timestamp":1790146038297,"segment":1,"confidence":21.41745966073647,"asi":{"candidate":"LANE 1 (board 1): the integration gate for run #350's +0.89 %. Layout A = one PSRAM buffer with each tensor at (archive_off - min_off), which is exactly the mapping nd_tier_ptr implements; layout B = the same bytes packed at 64 B-aligned offsets in per-token read order, in its own buffer. Bit-exact by construction, so any delta is placement.","hypothesis":"run #350's packed-vs-scattered-mallocs +0.89 % might transfer to the shipping tier. It does not, and the reason is visible in the gap table: the archive does NOT place q/k/v/gate contiguously (gap_before = 537,472 B twice), so the 1:1 span mapping already spreads them - and it still wins.","mechanism_note":"The archive gap table (537 KB between q and k, 537 KB between k and v, and a NEGATIVE -375,744 for gate, i.e. gate's bytes overlap the span between k and v in offset order) shows the four tensors are not in read order in the archive either. So neither packing nor reordering is available for free, and the shipping mapping is still the faster of the two measured.","next":"the FWHT. 31C found the transform owns 64.1 % of nd_cq_prepare = ~2.5 ms/token at 14 cycles/butterfly against a ~6-instruction body. Experiment 32 lane 1 screens scalar/unroll/block4/wide-load variants behind a known-answer probe. IMPORTANT finding already measured before that batch: FLOAT SIMD DOES NOT EXIST on this part - ee.add.64, ee.adds.64, ee.adds.sp, ee.addsp.64, ee.vadd.64, ee.sub*.64, ee.mul*.64 and ee.ldf.32 are all rejected by the shipped assembler ('unknown opcode or format name'), which independently confirms what engine/src/lut2_tie728.S:24 records. Only wide float LOADS assemble, and #335 showed they can return wrong values. So a vectorised FWHT is impossible; the remaining lever is fewer load/store instructions per butterfly.","result":"shipping 1:1 tier map 3,270,319 cycles (2.7157 cyc/weight); packed use-ordered 3,299,493 (2.7399) => packing is 0.88 % WORSE, bit-exact (mismatch=0 of 1,568), min of 14 rounds, nd_lut2_rows_tie1n (asm=1). Archive gap table: q id=2 off=3256704 nb=117504 gap=0; k id=30 off=3911680 nb=19584 gap=537472; v id=58 off=4468736 nb=26112 gap=537472; gate id=38 off=4119104 nb=156672 gap=-375744.","verdict":"LAYOUT FAMILY CLOSED, and an integration was avoided. The tier's 1:1 archive-span mapping is already the better of the two layouts, so there is no packed-tier candidate to build: run #350's +0.89 % was measuring 'scattered heap allocations -> packed', which shipping never does. This is exactly what the gate was for - the alternative was shipping a change that would have measured about -0.9 %."}}
{"run":354,"commit":"82fc836","metric":5.03,"metrics":{"boot_bench_tps":5.076,"device_output_exact":20,"device_token_delta":0,"ext_decode_tps":4.9577,"gen_tokens":99,"host_output_exact":19,"internal_free":14903,"logit_max_delta":0.00005341,"logit_top1_match":10,"min_case_tps":4.8,"prefill_tps":5.3083,"psram_free":2052252,"think_tps":3.94},"status":"keep","description":"Experiment 31 LANE 2 (board 2, kbench; decode_tps is the accepted 5.0300 carried forward, no shipping change): the attention P.V accumulate order. Shipped position-major read-modify-write 9.587 cycles per output update vs a dim-major chunked form 17.164 cycles/update => the chunked form is 44.1 % WORSE, and the reordering was verified bit-exact first (order_mismatch = 0 of 192 cells, 6,144 updates). REJECT/CLOSED: the shipped order is nowhere near the bad alternative, so there is no accumulate-order lever in the head split. The useful by-product is the first measured cost of the P.V update itself - 9.59 cycles per cell - which says the ~15 ms attributed to it is real scalar work, not slack, consistent with the ledger's kron_apply lesson that reuse has to come from the operand loaded per cell.","timestamp":1790146066182,"segment":1,"confidence":21.56916666666665,"asi":{"candidate":"LANE 2 (board 2): the attention P.V accumulate, dim-major (chunked) vs the shipped position-major read-modify-write of the output rows, verified cell-by-cell first.","hypothesis":"the P.V accumulate is the largest unmeasured sub-block of the 35.3 ms head split (~15 ms/token by subtraction of the measured dot and exp costs), and its shipped form walks the output row per position, re-reading and re-writing memory per cell. Chunking dim-major should reuse a weight across positions.","result":"shipped position-major 58,904 cycles for 6,144 updates = 9.587 cycles/update; dim-major chunked 105,455 cycles = 17.164 cycles/update => the chunked form is 44.1 % WORSE. Bit-exact: order_mismatch = 0 of 192 cells.","why":"in the shipped order a whole output row stays hot and the weight is a register; dim-major makes the inner stride 24 floats and re-walks the K-position weight vector per column. This is the same shape of result as the ledger's kron_apply finding - reuse must come from the operand that is actually loaded per cell, not from accumulator arrangement.","verdict":"REJECT and CLOSED: the shipped form is far from the worst alternative, so there is no accumulate-order lever. The by-product number is worth having - P.V costs 9.59 cycles per output update on this core, which means the 15 ms attributed to it is ~3.6M updates/token of real work at the scalar floor, not slack.","next":"E32 lane 1 screens the FWHT (64.1 % of prepare per 31C). E32 lane 2 prices the engine's own nd_cq_prepare at each real geometry so the FWHT prize has a real denominator. E32 lane 3 screens the scale pass, which 31C measured at 11.1 cycles per element - far off a multiply, so it may have a restrict/unroll lever worth 14.5 % of a 3.9 ms/token phase.","isa_finding":"float SIMD arithmetic does not exist on this part: ee.add.64 / ee.adds.64 / ee.adds.sp / ee.addsp.64 / ee.vadd.64 / ee.sub*.64 / ee.mul*.64 / ee.ldf.32 are all rejected by the shipped assembler as 'unknown opcode or format name'. Only wide float loads (ee.ldf.64.ip, ee.ldf.128.ip) assemble. So a vectorised FWHT or vectorised scale is impossible; E32 was rewritten around legal forms before it ever reached a board."}}
