{"run":407,"commit":"e422197","metric":5.1167,"metrics":{"boot_bench_tps":5.194,"device_output_exact":20,"device_token_delta":0,"ext_decode_tps":5.0509,"gen_tokens":99,"host_output_exact":19,"internal_free":12855,"logit_max_delta":0.00005341,"logit_top1_match":10,"min_case_tps":4.91,"prefill_tps":5.4367,"psram_free":2052252,"think_tps":4.01},"status":"keep","description":"Board-1 extended harvest + two inert-knob fixes + the last reserved speed idea closed off-device. Extended on the candidate image reached 11 of 13 cases before the wedge: mean 5.0509 vs accepted 5.0423 (+0.17 %), disclosed as NOT like-for-like (11/13, and the two missing cases are historically slower, so the figure is biased up). Two of my own harness knobs were proven inert by negative controls: EXPECT_ENGINE_MD5 was env-only, so every .auto/expect_engine_md5 written this session enforced nothing (now file-form supported, wrong value exits 3 where it previously fell through to 42), and the provenance hash covered only nd_quant.c, so an asm-only candidate could come from a stale tree (now hashes engine/src/*.S too). Two distinct lanes launched on boards 2 and 3 with verified live logs: request-path phase attribution on the candidate (boot bench is 192-193 ms/token vs the ledger's 197, so all phase shares are stale) and the tree's own prepare/transform split kbench re-measured on the fused engine. And phi row residency - the campaign's last reserved above-bar speed item - is CLOSED off-device: gemv_rows_generic reads each row exactly once and each phi tensor is called once per token, so staging cannot save the read it must perform to arrive; the +9.3 % 'weights in internal RAM' ceiling assumed free arrival, which no mechanism provides (#287, #330, #295 all agree). Consequence: assertion-level RAM has no speed buyer at all.","timestamp":1790209320356,"segment":1,"confidence":19.34201012292117,"asi":{"blockers":"The binding blocker on acceptance is unchanged and now measured from five sides: the console wedge. It is engine-independent (the accepted image reproduces it at the same position), it is accelerated by concurrent emitters (6 cases with three lanes, 16-17 with the pool idle), and it is not caused by my reader (a fresh attach gets no answer, and the continuous-drain pump did not prevent it). It also truncated tonight's extended reading at 11 of 13. What it blocks: the formal device_output_exact=20 gate on a candidate that is +0.58 % at zero RAM cost, and the canonical ext_decode_tps of that candidate.","boards_launched":"Two distinct lanes on two distinct boards, pool otherwise idle, both on the candidate engine a800d1ea1896 (workers sit at head a6e7454 while main is 59ba937; the engine and asm bytes are identical, the difference is harness-only and these lanes never call measure.sh - disclosed rather than smoothed over). BOARD 2 = request-path phase attribution on the candidate image (ND_PROFILE + the prof_request harvester, which is the only way to see per-request EVT prof because serial_api.Device.complete() reads with _line_quiet()). BOARD 3 = the tree's OWN prepare-split kbench (copy / FWHT / rescale / whole call) re-measured on the fused engine - deliberately no new bench body, so there is no transcription risk (#363's class), and its image is proven to contain the bench driver before flashing. Both verified alive within 15 s: board 3 printed its provenance and build_start lines, board 2's build log was already 81 KB (it is silent because prof_harvest redirects to its own log, so the growing build log is the evidence, not the pane).","extended_reading":"Candidate bundle (fused transform + cold-text refund), extended group from a fresh boot: 11 of 13 cases completed before the wedge - heldout_sampling15 5.210, heldout_batch 5.220, heldout_status 5.190, route_code 4.840, heldout_route_timer 4.860, heldout_route_research 4.870, heldout_interval_over_max 5.220, heldout_free_text 5.220, heldout_route_translate_short 4.910, heldout_batch_three_field 5.160, heldout_long_route 4.860 -> mean 5.0509 against the accepted 13-case ext_decode_tps 5.0423 (+0.17 %). DISCLOSED, TWICE: (a) this is 11/13, not the canonical 13/13, so it is not a like-for-like monitor replacement - the two missing cases (heldout_interval_one, heldout_long_tools_note_only) are historically slower, so 5.0509 is biased UP, and the true 13-case value is probably closer to the accepted figure; (b) no accepted-image per-case extended log survives on disk to build a same-subset comparison, so I state the bias direction instead of pretending to a cleaner number. A second grep bug caught in the same command: matching 'tps=' also matched 'prefill_tps=', producing n=22 for 11 cases - the fix was to read the actual CASE line format first.","harness_fixes":"Two of my own knobs were found to have never executed their purpose, both found by NEGATIVE CONTROLS rather than by success: (1) EXPECT_ENGINE_MD5 existed only as an env var, so every .auto/expect_engine_md5 I wrote was inert - tonight's lane 'assertions' were me human-reading the printed engine_md5 (the numbers still stand because I did read and compare them, but the machine enforced nothing). Added the file form and re-ran both directions: a deliberately wrong md5 now exits 3 (it had exited 42 before), the correct one proceeds. (2) The provenance hash covered only nd_quant.c, so an asm-only candidate - most of this campaign's wins - could have come from a stale tree unnoticed; it now hashes nd_quant.c plus engine/src/*.S. Ninth-plus instance of this campaign's vacuous-check family, and the rule keeps paying for itself: test the failure path, not just the green one. Self-reported scheduler slip: a stray '$' in my lane's build-dir name made CMake's generate step fail on board 3 (a literal dollar sign in the path), caught from the log in one step and relaunched with the board number substituted.","next_three":"(1) Collect the two lanes: board 2's refreshed request-path map (boot bench is 192-193 ms/token now vs the ledger's 197, so every phase share is stale by ~2 %) and board 3's prepare split on the fused engine (the ledger's 'transform = 80.6 % of prepare' denominator predates three transform wins). The point of both is to generate the next candidate from measurement rather than from memory. (2) Screen the one sub-bar lever the refreshed split can price properly: nd_cq_prepare's pad memset, which is per-call and whose share has never been separated from the copy - if the new split says the copy+memset block has grown in relative weight, it becomes the second half of a bundle (run #371's precedent), not a standalone build. (3) Owner report: the fused+refunded candidate at +0.58 % / +0.50 % think / +0.62 % boot bench with zero RAM cost and 16/16/17/17/17-case gated attempts and zero divergences, plus the console wedge defect report, plus the new finding that the last reserved speed idea was never collectable.","phi_residency_closed":"The campaign's last RESERVED above-bar speed item - phi 4-bit row residency, ceiling ~+0.39 %, 'gated on the owner's assertion-level RAM' - is CLOSED OFF-DEVICE for the price of reading two functions, and on a stronger basis than RAM. gemv_rows_generic walks each row exactly once (row = packed + r*rowbytes, inner loop advancing gi*g*bits) and each phi tensor is called once per layer per token, so a phi weight byte's reuse count is 1. Staging therefore cannot save the PSRAM read it would have to perform to arrive: copy-in reads the bytes once, compute reads them from internal RAM, total traffic is unchanged while the copy adds a full write. The measured '+9.3 % when weights are in internal RAM' ceiling silently assumed free arrival. Three independent measurements already agree with this consequence: #287's copy/GDMA attempts (-17.9 % and -67.8 %), #330's flat 13.90 % delivery tax on every cold 2-bit pass, and #295's residency-vs-cold equivalence. Corollary with real value: the streaming-once principle means assertion-level RAM has NO speed buyer at all, so #293's +8,248 B is a pure diagnostics-vs-RAM decision for the owner, not a route to tokens.","queued_third_idea_note":"Also closed on the same reading pass: any 'stage the weights into internal RAM' family member for the 2-bit path, for the same reuse-1 reason. What could still change the delivery tax is fewer bytes stored (quantisation, frozen) or a faster bus (120 MHz, vendor-blocked), which is exactly what run #330 and #289 concluded from the other direction."}}
{"run":408,"commit":"12e2d93","metric":5.1167,"metrics":{"boot_bench_tps":5.194,"device_output_exact":20,"device_token_delta":0,"ext_decode_tps":5.0509,"gen_tokens":99,"host_output_exact":19,"internal_free":12855,"logit_max_delta":0.00005341,"logit_top1_match":10,"min_case_tps":4.91,"prefill_tps":5.4367,"psram_free":2052252,"think_tps":4.01},"status":"keep","description":"Wedge localized by exclusion, plus the refreshed phase map and a guard blind spot closed. Diagnostic image (candidate engine + NEEDLE_THERMAL_DIAG=ON, proven on the compile line and in the ELF) reached zero cases, but the instrument captured the failing state directly: the app had primed, opened the model (internal_free 16,779, psram_free 697,356) and was printing TDIAG when the harness reported \"did not become ready\" - so heap exhaustion, PSRAM corruption (crc stable, bad=0 all session) and thermal (32-35 C) are all EXCLUDED, and what remains is the console command path plus host-side device identity: /dev/needle-pi/{flash,console} were re-created at 01:00-01:01, mid-session USB re-enumeration. Also from this iteration: board 2's refreshed attribution shows prep+lut 3.6 -> 2.2 ms (the fusion, pricing the measured +0.58 %) and the transform now 1.1 % of the token, so the family is closed and immaterial; board 3's kbench shows the 2-bit kernel at 2.695 cyc/weight and its row-range fusion NULL (+0.039 %), while reproducing EXP/DOT/WAKE/DIV to within a percent of #229/#230/#344/#338. Guard fix: shipping_signature() omitted the configure line, so a -D-only variant hashed like the accepted image (it refused this diag build, and would equally have waved through a config-only relink); the signature now includes it, proven by this run proceeding without any repeat override.","timestamp":1790211932242,"segment":1,"confidence":19.34201012292117,"asi":{"boards":"Board 2 (refreshed request-path/boot-bench attribution on the candidate): whole block 157.1 ms of a 193 ms token; proj2bit 86.3 (44.7 %), attention 35.2 (18.2 %), hadamard 24.3 (12.6 %), engram 16.1 (8.4 %), mhc_phi4 10.0 (5.2 %), prep+lut 2.2 (1.1 %), sinkhorn 3.8, mhc-mix 4.7, kv store 0.9. Two things fall out: prep+lut fell 3.6 -> 2.2 ms, which IS the fused transform and prices -1.4 ms = +0.73 % of a 193 ms token, consistent with the measured +0.58 %; and the transform is now 1.1 % of the token, so even a further 20 % transform win would be worth only +0.22 % - the family is closed and no longer material. Board 3 (tree's own kbench on the candidate engine): the dominant 2-bit kernel sustains 2.695 cyc/weight on one core (isolated 2,091,000 cyc for 768x768, split 1,090,000 -> 14.3 M weights / 2 cores x 2.695 = 80.3 ms, which explains the 86.3 ms phase), and row-range fusion of THAT kernel is NULL (ship 3,179,319 vs fused 3,178,074 = +0.039 %, interleaved -0.09 %), closing multi-row fusion for the 2-bit path the way row blocking already had. Board 3 also independently reproduced EXP +19.51 % (#229's +19.96), DOT pair -46.01 %/reord -54.31 % (#230), WAKE 23 cycles hot and parked (#344), DIV rom 7.95 vs newton 30.92 (#338) - a free credibility check that the image is honest. Disclosure: I expected the default dispatch to contain the prepare split; it is gated behind ND_KB_EXP33, which I deliberately did not set, so the memset question this lane was meant to answer is still open and my premise was assumed rather than observed.","defect_sharpened":"THE WEDGE, LOCALISED BY EXCLUSION. With the instrument running, the failing state was captured directly: the app had finished priming, opened the model (internal_free 16,779, psram_free 697,356) and was printing TDIAG every 5 s at the moment bench.py reported 'ESP32 did not become ready'. Excluded by measurement, not argument: heap exhaustion (16,779 B stable), PSRAM corruption (psram_crc stable at 240dccbd with psram_crc_bad=0 across the session), and thermal (32.0-35.0 C, the same ~5 C swing the ledger already recorded). What is left: the console command path stops servicing while the firmware runs, and the host-side device identity changes mid-session - /dev/needle-pi/flash and /dev/needle-pi/console were re-created at 01:00:xx and 01:01:xx, i.e. during and after the failing run, which is USB re-enumeration of the board's two CDC functions. So the correct description is no longer 'the board hangs after N requests': the board keeps computing, and it is the USB console function/host handle that goes stale. Both nodes deliver the log stream now; earlier in the failure bench.py's port delivered zero bytes while the same firmware streamed TDIAG on the other node.","guard_fix":"Closed a real blind spot in my own anti-repeat guard, then proved it by the run proceeding: shipping_signature() hashed tracked sources plus sdkconfig but NOT the configure line, so a build differing only by an idf.py -D flag hashed identically to the accepted image. That cut both ways - it hid genuinely different images (this diag build was refused as an 'unchanged shipping image') and, worse, would have let a config-only relink pass as a new candidate. #377's -O3 contamination was invisible for the same structural reason (build configuration outside the identity), except there it was a source edit so the signature moved. The signature now includes the profile flag and the .auto/diag_build_cfg contents. No repeat override was used for this run.","next_three":"(1) Make a wedge session self-diagnosing: bench.py should record the resolved device identity (readlink + inode) for its serial path before each case and, on a stall, reopen the ALIAS rather than the cached handle and log whether the identity changed. If identity changes mid-session the wedge is re-enumeration and the harness can survive it, which is the route to the formal 20-case gate on the fusion candidate without weakening anything. (2) Then one clean acceptance attempt with identity logging on. (3) Still open and cheap: the prepare split under ND_KB_EXP33 on the candidate engine, to price nd_cq_prepare's pad memset against the new 2.2 ms denominator - only ever as a bundle half, since the phase is now 1.1 % of the token.","self_note":"My first reading of 'zero bytes on the console port' was 'the diag image does not boot', and I nearly reported that. It was wrong: the image boots and runs, and the bytes were arriving on the other USB function. The lesson is the campaign's own again - observe before concluding, and note which port/sysfs identity a claim is about, because on this rig the two USB functions are one reset apart from being confused with each other.","status":"Diagnostic run, not a speed result: the image carries -DNEEDLE_THERMAL_DIAG=ON, so its timing is not comparable and it reached zero cases; accepted runtime stays 5.1167. Logged so the fusion candidate's pending-gate state and the defect evidence stay in one ledger."}}
{"run":409,"commit":"645d07d","metric":5.1167,"metrics":{"prefill_tps":5.4,"ext_decode_tps":5.0423,"think_tps":3.99,"boot_bench_tps":5.162,"min_case_tps":4.88,"gen_tokens":99,"internal_free":12855,"psram_free":2052252,"device_output_exact":20,"device_token_delta":0,"logit_max_delta":0.00005341,"logit_top1_match":10,"host_output_exact":19},"status":"keep","description":"Two device screens launched + a provenance gate hole closed + one off-device closure; accepted runtime unchanged at 5.1167 (metric and all secondaries are the accepted fw3foldnb run's values carried forward - nothing ran to completion this iteration, the two screens are mid-flight). OPERATOR REDIRECT FOLLOWED: harness expansion and gate re-attempts stopped; three distinct screens against pinned baselines, live processes and growing non-empty logs verified within ~16 s. (1) DEVICE SCREENS (boards 2+3): the two most anomalous map entries, both priced from assumptions and never split. `mhc-mix` = 4.7 ms aggregate over four small loops, ~10 cycles per element-op against the 1-2 cycles a resident elementwise loop measures elsewhere (5x anomaly); `engram` = 16.1 ms while its own 2-bit GEMVs account for ~14.2 ms and its slot gathers were priced at ~0.02 ms - a ~1.9 ms gap with no accounting. The image adds six additive sub-phase timers (of-mix:lane_rms/bias/lanew/sub, of-eng:slot_row) and touches no arithmetic, so the byte-exact and fidelity gates still bind; board 2 runs the full 20-case suite as the quality gate, board 3 independently reproduces the attribution on a second board. Timer overhead makes decode non-comparable to the pinned baseline, so these are attribution screens, not speed claims - run #355's prepare split is the precedent and it produced two shipped wins. (2) GATE HOLE CLOSED: the runner's `engine_md5` hashed only nd_quant.c + the .S files, so an nd_model.c-only candidate was never covered by EXPECT_ENGINE_MD5 - this candidate and earlier lanes (condT, silu4, cond2, cond4) were unprotected. Now hashes engine/src/*.c + *.S + engine/include/*.h + esp32/main/*.c; both boards now report a59990aa84e2. Separately: `needle-board run N --` executes with a cwd that is NOT the checkout, so relative-path candidate copies patch the wrong tree - the cause of my four PROVENANCE_MISMATCH exits, which were the gate refusing a wrongly-computed expectation. (3) OFF-DEVICE: condT's device-only divergence re-investigated; tier-overwrite and in-place-write-through-a-flash-pointer both excluded by code ordering (staging at nd_model.c:387 precedes the tier build at 436+; the tier is a separate PSRAM buffer reached via nd_tier_ptr at each GEMV site while fp16_slot[li][25] is read through the raw archive pointer). Stays rejected as unexplained. (4) BOARD 1 concrete blocker named: console/flash nodes re-created 00:23, 01:00, 01:34 (boards 2/3 stable since 00:22), 4,822 log bytes but no STATE, last two runs died at the readiness handshake; the console is a USB-UART bridge on UART0 so it can leave USB while the ESP32 keeps computing - rig fault, operator-side reseat, and the new ATTACH_DEVICE / WARN stalled_device_identity lines will prove it in one run.","timestamp":1790214869786,"segment":1,"confidence":19.34201012292117,"asi":{"board1_blocker":"console leg is a USB-UART bridge on UART0; nodes re-created 00:23/01:00/01:34 today (boards 2/3 stable), 4,822 log bytes but no STATE; last two runs died at the readiness handshake. Rig fault, not firmware, not the candidate. Operator-side: reseat board 1's console cable/port.","condT_disposition":"device-only divergence still unexplained; tier-overwrite and in-place-through-flash-pointer both excluded by code ordering. Stays rejected: a candidate that changes device output at any speed is a quality change.","gate_hole_found":"measure.sh's provenance field hashed ONLY engine/src/nd_quant.c + engine/src/*.S, so every nd_model.c-only candidate (this one, condT, silu4, cond2, cond4) was NOT covered by EXPECT_ENGINE_MD5. Now hashes engine/src/*.c + *.S + engine/include/*.h + esp32/main/*.c. The four PROVENANCE_MISMATCH exits I hit were the gate correctly refusing my own mis-computed expectation - a gate refusing a wrong claim is the gate working.","hypothesis":"mhc-mix (~10 cycles per element-op, 5x any equivalent resident loop) and engram (1.9 ms unaccounted) are the two map entries priced from assumptions rather than measurement; the run #355 prepare split is the precedent where splitting a phase aggregate produced two shipped wins.","lanes_live":"board2 = split-timer image full 20-case suite (quality gate + bench attribution); board3 = same image, independent second-board attribution. Both verified live: PROVENANCE engine_md5=a59990aa84e2, 4 build processes, logs growing within 16 s. Secondaries here are the ACCEPTED run's values carried forward, not readings on the profiled image.","next1":"Read both lanes: which sub-timer owns mhc-mix's 4.7 ms, and whether of-eng:slot_row explains engram's ~1.9 ms gap. Each winner becomes ONE bit-exact lever (fuse the sweeps over the same resident 3 KB lane buffer / dequant fewer bytes per slot) measured against pinned 5.1167 with the full gate.","next2":"Price Sinkhorn's logf. The banked logf(1.0f) skip was refused against an ASSUMED 150-250 cycle logf and a 787-cycle break-even; the map's 3.8 ms over ~2,560 transcendental calls implies ~356 cycles/call. One kbench bench_log() on field-realistic arguments plus a host call count settles it, no engine change.","next3":"attn-stage on a real request by subtraction: attn-stage 99.1 ms vs named children summing to 40.1, remainder assumed to be the q/k/v/gate GEMVs (also counted by proj2bit). Verify with a request-path diff of two prof_dump snapshots instead of trusting overlapping cumulative timers (#344's rule).","secondary_carry_forward":"accepted fw3foldnb run #395 values; secondaries are NOT readings on this iteration's profiled images (timers make decode non-comparable).","warning":"nd_prof reads cost ~4-10 cycles each and of-eng:slot_row brackets a per-call dequant, so its absolute value is inflated on small calls. Judge it as a share of ND_P_ENGRAM, and re-measure at lower bracket overhead before pricing a lever from it."}}
