{"run":145,"commit":"4d90d3b","metric":4.78,"metrics":{"prefill_tps":5.2183,"ext_decode_tps":4.706,"think_tps":3.84,"boot_bench_tps":4.985,"min_case_tps":4.56,"gen_tokens":99,"internal_free":17039,"psram_free":2052252,"device_output_exact":12,"device_token_delta":0,"logit_max_delta":0.00005341,"logit_top1_match":10,"host_output_exact":11},"status":"keep","description":"Diagnostic instrumentation + the finding it was for. Added prof_dump() to esp32/main/main.c: the per-phase table now also prints for a real request's decode window, not only after the boot bench (ND_PROFILE-only; shipping image is byte-size identical at 279184 B and the metric is unchanged at 4.78, byte-exact 12/12 device + 11/11 host, fidelity 5.341e-05). Reason it matters: the boot bench drives nd_model_step_hidden and therefore NEVER samples or walks the grammar, so my phase map's 'sample = 0.0 ms' was a provenance artefact - retracted in .auto/ideas.md. The bench also runs 4% faster than real requests (4.985 vs 4.780), which is ~8-9 ms/token of work the bench structurally cannot see, and the per-case data localises ~6% of it to the route phase.","timestamp":1789958808252,"segment":1,"confidence":null,"asi":{"hypothesis":"The 4% gap between the boot bench (4.985 tok/s) and real requests (4.780) is work the bench never runs - grammar/sampler/emit - and part of it is concentrated in the route phase, which is 1 of the 6 primary cases.","per_case_evidence":"one image on three boards: tools-phase cases decode at 4.77-4.85 with prefill 5.25-5.27; route-phase cases decode at 4.560/4.520/4.500 with prefill 4.95-4.97. primary = 5 tools + route_translate and its mean reproduces exactly (4.840+4.830+4.770+4.850+4.830+4.560)/6 = 4.780. Bringing route_translate to the tools rate is +0.94% on the metric - 5x the keep bar - with no arithmetic change at all.","ruled_out":["prefix re-priming: run_inference restores a cached prefix per phase from s_prefixes[phase]; both prefixes exist and restore is O(1)","attention context length: the tools path runs two passes and therefore has the LONGER context, yet is the faster one","attention pre-split stage, sampler-in-bench, per-layer glue: measured 5.1 ms and ~0.5 ms respectively"],"next":"Harvest prof_dump for one tools request and one '!route' request (board 3 is already flashed with -DNEEDLE_PROFILE=ON, 281328 B), then attack whatever phase carries the route gap - nd_sample.c's per-token candidate enumeration / subset-logit construction is the prime suspect. Harness warning for that harvest: a bare pyserial reader on the console returned zero bytes and hung in open() even for '!status'; drive it through tools/serial_api.py or the repo harness instead.","state":"Accepted runtime unchanged at 4.78 decode / 4.71 extended / 3.84 think, +95.9% over the 2.44 baseline, 12/12 and 11/11 byte-exact.","revival_check":"This does not revive any discard; it invalidates one of my own *notes* (sampler is free) rather than a measured rollback reason. The instruction-level and residency nulls all stand, and the noise floor (0.07% spread) still applies to them."}}
{"run":146,"commit":"2b7e904","metric":4.7783,"metrics":{"prefill_tps":5.2183,"ext_decode_tps":4.704,"think_tps":3.84,"boot_bench_tps":4.983,"min_case_tps":4.55,"gen_tokens":99,"internal_free":16991,"psram_free":2052252,"device_output_exact":12,"device_token_delta":0,"logit_max_delta":0.00005341,"logit_top1_match":10,"host_output_exact":11},"status":"discard","description":"Legality memo for the constrained sampler: cache the candidate list on the grammar state (the state carries the grammar pointer, so tools vs route samplers cannot collide; memcmp can only err toward a rebuild). Correct but worthless for speed - device decode_tps 4.7783, bit-for-bit the accepted value, byte-exact 12/12 device + 11/11 host, fidelity 5.341e-05. Either the state changes on essentially every accepted token (so the list is always rebuilt) or the 14.6 ms I attributed to enumeration is not where it goes; the metric says the memo path is not the cost. Reverted.","timestamp":1789961606092,"segment":1,"confidence":null,"asi":{"hypothesis":"ND_P_SAMPLE = 14.6 ms of a 207 ms real decode token (7%) was the per-token vocabulary legality walk (~25K nd_gbyte steps). Memoizing the list on the grammar state should skip it whenever the state repeats, which I expected inside JSON string values where accepting a token leaves the state unchanged.","result":"Zero change (4.7783 vs 4.7783, spread on this metric is 0.07%), while byte-exactness held everywhere. The memo therefore either never fires or the mass is elsewhere.","bit_exact_evidence":"host 11/11 byte-identical with token_delta 0, device 12/12, fidelity probe unchanged at 5.341e-05 / top1 10/10 - so the memo logic is right, it is just not the lever.","most_likely_why":"ND_P_SAMPLE wraps nd_sample_hidden, which is enumeration *plus* nd_model_logits_subset. `logits4` is timed separately for the full-vocabulary path only, so the subset projection is inside SAMPLE and was never separated from the walk. Estimating the walk at 25K calls x ~580 cycles/call made it look like the whole 14.6 ms, but that cycle count was inferred from the same aggregate - it is not independent evidence.","next":"Before writing another line for the sampler: split the SAMPLE timer in two (enumerate-only vs nd_model_logits_subset) in a profiled build and harvest one tools request. If the walk is small, 14.6 ms is the subset logits projection and the lever is that GEMV's row count/layout, not the grammar. If the walk is large, count memo hits/misses in the same build to see whether the state ever repeats.","state":"Accepted runtime stays 4.7783 decode / 4.704 extended / 3.84 think, +95.7%, all gates green. Tree reverted; sampler untouched.","revival_check":"Does not revive anything. It does weaken my own #145 claim that 'sample = 7% is the biggest remaining lever': that phase's composition is unverified, and I should not spend another candidate on it until the timer is split."}}
{"run":147,"commit":"fb3e080","metric":4.8817,"metrics":{"prefill_tps":5.2183,"ext_decode_tps":4.804,"think_tps":3.87,"boot_bench_tps":4.983,"min_case_tps":4.66,"gen_tokens":99,"internal_free":17039,"psram_free":2052252,"device_output_exact":12,"device_token_delta":0,"logit_max_delta":0.00005341,"logit_top1_match":10,"host_output_exact":11},"status":"keep","description":"First-byte legality table for the constrained sampler. Instead of asking the grammar about every byte of all ~8176 vocabulary pieces each decode step, resolve byte 0 once per byte value for the current state (256 grammar steps) and veto candidates by table lookup before any grammar call; survivors still take the full byte walk, so the candidate set is identical. decode_tps 4.7783 -> 4.8817 (+2.16%, ~70 sigma against the measured 0.03% spread), extended 4.704 -> 4.804 (+2.13%), min_case 4.55 -> 4.66, think 3.84 -> 3.87. Byte-exact 12/12 device + 11/11 host, token_delta 0, fidelity 5.341e-05 with top1 10/10. Boot bench (4.983) and prefill (5.2183) are unchanged to the digit - neither path samples - which is the control that says the win is exactly where it was aimed.","timestamp":1789961967618,"segment":1,"confidence":null,"asi":{"hypothesis":"ND_P_SAMPLE = 14.6 ms of a 207 ms real decode token is the per-step vocabulary legality walk, and almost every piece is rejected by its first byte - so a 256-entry first-byte table per state should replace ~8000 nd_gstate_byte calls with ~256 plus table lookups, with the survivor set unchanged.","result":"+2.16% decode, +2.13% extended, +2.4% on the worst case, and the two paths that never sample (boot bench, prefill) did not move at all. That invariance is the strongest evidence in the campaign: it is an internal control proving the delta came from the constrained sampler and not from build drift.","why_the_previous_attempt_failed":"#146 memoized the whole candidate list on the grammar state and measured nothing, which told me the state never repeats. This one does not care whether the state repeats: the table is rebuilt per step for 256 byte values, which is cheap, and it removes the expensive call from the ~8000 candidates that die immediately. Skipping work and repeating work cheaply are different levers.","bit_exactness":"A piece whose first byte cannot be consumed from the current state can never be legal, so the table only ever vetoes pieces the full walk would also have rejected; survivors take the identical walk, in the identical order, into the identical argmax. Verified on host (11/11 byte-identical, token_delta 0) and device (12/12, fidelity 5.341e-05, top1 10/10). One subtlety worth remembering: the old loop treated a zero-length surface at id>=16 as legal (empty byte walk), this one skips it - no such piece exists in this archive, and the goldens would have caught it.","remaining_sample_cost":"The survivors' full byte walk plus nd_tok_piece per candidate still costs something; if a later session wants more, the next split is table-build vs survivor-walk vs piece-lookup inside SAMPLE.","next":"Confirm on three boards (1 control + 2 candidates, swap assignments in the repeat) per the batch protocol, then re-harvest the per-request profile - the phase map's real-request numbers are now stale: sample should have collapsed from 14.6 ms toward ~2 ms, which re-ranks the remaining phases.","state":"Best 4.8817 decode (+97.6% over the 2.44 baseline), 4.804 extended, 3.87 think, 5.22 prefill, all quality gates green."}}
{"run":148,"commit":"5ff6cea","metric":4.8817,"metrics":{"prefill_tps":5.2183,"ext_decode_tps":4.804,"think_tps":3.87,"boot_bench_tps":4.983,"min_case_tps":4.66,"gen_tokens":99,"internal_free":17039,"psram_free":2052252,"device_output_exact":12,"device_token_delta":0,"logit_max_delta":0.00005341,"logit_top1_match":10,"host_output_exact":11},"status":"keep","description":"Three-board protocol confirmation of the first-byte legality table (no new code this cycle). Control board rebuilt from the pre-change nd_sample.c read 4.7783 - exactly the previously accepted value, so the batch is trustworthy - while two independent candidate boards both read 4.8817, min_case 4.66 (control 4.55) and extended 4.804 (control 4.704), byte-exact 12/12 on all three. Boot bench 4.983/4.983/4.985: unmoved on every board, as expected for a path that never samples. Canonical workspace run reproduces 4.8817 for the third consecutive measurement of this code.","timestamp":1789963150490,"segment":1,"confidence":null,"asi":{"hypothesis":"Confirm the kept +2.16% sampler win under the batch protocol (one control + two identical candidates, fresh-configured images, control validated against the last logged value) rather than trusting a single run.","batch":{"board1_control_pre_change_sampler":"4.7783 (equals the last logged accepted value exactly), min_case 4.55, extended 4.704, boot 4.983","board2_candidate":"4.8817, min_case 4.66, extended 4.804, boot 4.983","board3_candidate":"4.8817, min_case 4.66, extended 4.804, boot 4.985","build_integrity":"control image 279184 B (the recorded accepted size), both candidates 279264 B; control source came from git show HEAD~1:engine/src/nd_sample.c, not a hand copy","verdict":"+2.17% decode, +2.13% extended, +2.42% min_case, reproducible to the digit on two independent boards. New accepted control: 4.8817."},"method_note":"The control reading the old accepted value to four digits is what makes a batch readable; the earlier incident where a stale build dir made a control read 4.2217 is the counterexample, and fresh-configuring every board is what prevents it.","next":"Split ND_P_SAMPLE in a profiled build into table-build vs survivor byte walk vs nd_tok_piece, and harvest one tools request on the warm board-3 image (~10 min, drive it through tools/serial_api.py's Device with DTR/RTS pinned false). If the survivor walk or piece lookup still costs several ms, the piece table (surfaces and lengths hoisted per id, built once) is the next bit-exact target; the same 'hoist work over a small domain' pattern applied here is worth replaying on nd_gstate_byte itself.","state":"Best 4.8817 decode (+97.6% over the 2.44 baseline), 4.804 extended, 3.87 think, 5.22 prefill, all quality gates green on three boards."}}
{"run":149,"commit":"5ff6cea","metric":4.8733,"metrics":{"prefill_tps":5.2183,"ext_decode_tps":4.8,"think_tps":3.87,"boot_bench_tps":4.984,"min_case_tps":4.65,"gen_tokens":99,"internal_free":17039,"psram_free":2052252,"device_output_exact":12,"device_token_delta":0,"logit_max_delta":0.00005341,"logit_top1_match":10,"host_output_exact":11},"status":"discard","description":"First-byte-per-id cache for the sampler: 8 KB of internal RAM holding piece[0] for every vocabulary id, built once, with a fallback to the tokenizer call if the allocation fails. Bit-exact (host 11/11 byte-identical, token_delta 0, fidelity 5.341e-05, device 12/12) but device decode_tps 4.8733 vs the accepted 4.8817 = -0.17% (extended 4.800 vs 4.804, min_case 4.65 vs 4.66, boot bench unchanged). Replaced a measured 45-cycle call with a load plus a per-candidate branch and an 8 KB resident array, and that traded away what it saved. Reverted.","timestamp":1789964069988,"segment":1,"confidence":null,"asi":{"hypothesis":"nd_tok_piece measures 45 cycles/call on device, and the filter loop calls it for ~8176 ids per decode step = ~1.6 ms (0.8% of the token); caching byte 0 per id in 8 KB should recover most of it.","result":"-0.17%, i.e. slightly worse than the accepted runtime and outside the measured 0.07% spread. Correct, smaller-than-expected, not keepable.","calibration_failure_worth_keeping":"My model predicted the first-byte table (run #147) would save ~12.8 ms and it saved ~4.5 ms, so the microbenchmarked 93 cycles per nd_gstate_byte was ~3x too low for real mid-string states (that microbench copied the state struct and probed a freshly opened grammar, where bytes are rejected by the cheapest predicate). Same error made this candidate look 3x bigger than it was. Rule for this repo: a microbench of a predicate must be run on the states the real loop actually sees, or its savings are fiction.","why_it_was_a_wash":"The loop now loads a global pointer, branches on it, loads a byte from an 8 KB array, and indexes a 256-byte stack table - all dependent loads - where before it made one 45-cycle call that GCC could schedule ahead. The 45 cycles were partly hidden by the loop's own latency already.","sampler_family_status":"CLOSED. sample is now ~2 ms of a ~205 ms token: 0.1 ms table build, ~1.6 ms filter, ~0.06 ms survivor walks, plus the subset-logits projection that is timed separately as logits (7.2 ms, TIE728 kernel, at its instruction floor). Nothing left in this phase above the keep bar.","bonus_finding":"This also explains the last open anomaly: the boot bench ran ~4% faster than real requests only because requests paid the 12.8 ms grammar walk the bench never performs. Bench 4.983 vs request 4.88 is now a ~2% residual, which is ordinary cache/emit work.","next":"Back to the accepted 4.8817 control. Remaining named numbers are at floors (2-bit GEMV instruction floor, attention heads, kron, phi residency, sinkhorn vetoed). Next useful actions are verification cycles, the 3-board protocol re-check of HEAD, and a periodic make capture for behavioural integrity.","state":"Accepted runtime unchanged at 4.8817 decode / 4.804 extended / 3.87 think / 5.22 prefill, +99.9% over baseline, all gates green. Tree reverted."}}
{"run":150,"commit":"HEAD","metric":4.8817,"metrics":{"prefill_tps":5.2183,"ext_decode_tps":4.804,"think_tps":3.87,"boot_bench_tps":4.983,"min_case_tps":4.66,"gen_tokens":99,"internal_free":17039,"psram_free":2052252,"device_output_exact":12,"device_token_delta":0,"logit_max_delta":0.00005341,"logit_top1_match":10,"host_output_exact":11},"status":"keep","description":"Verification + notes cycle, no runtime change: HEAD reproduces 4.8817 decode / 4.804 extended / 4.66 min case / 3.87 think / 5.2183 prefill, byte-exact 12/12 device + 11/11 host, fidelity 5.341e-05 with top1 10/10 (fourth consecutive identical measurement of this code). Updated the authoritative NEXT block in .auto/prompt.md, which still named the 4.7783 control and ordered an already-shipped Experiment 2, and recorded the sampler family as closed with measured primitive costs (nd_tok_piece 45 cycles, nd_gstate_byte 93) plus the microbench-calibration lesson. Attempted the repo's behavioural check `make capture` on a candidate board: blocked by the harness, not the firmware (exact blocker in asi).","timestamp":1789965577213,"segment":1,"confidence":null,"asi":{"hypothesis":"Verification cycle on the accepted 4.8817 runtime after the sampler win, plus the documentation the rules require, plus the repo's own end-to-end behaviour check.","capture_blocker":"EXACT BLOCKER, recorded instead of silently switching: `make capture` calls demo/capture.py, which needs the HTTP API (urllib to 127.0.0.1:8081, /models first). Starting `needle-api --serial /dev/ttyACM0 --port 8081` inside board2's namespace reached `EVT ready` and then died in Device._set_think with serial.serialutil.SerialTimeoutException on the `!think 0` write. tools/serial_api.py pins dtr=False before the handshake (its no-reset attach), and this board's USB CDC bridge needs DTR asserted to accept writes - the same fact that made a raw pyserial capture come back empty in run #145. Firmware is fine (the measure harness drives the same console daily); the attach path needs DTR handling for pool boards. No tooling was modified: tools/serial_api.py is shared harness code and a change there would alter how every future measurement attaches, so it needs its own deliberate cycle.","coverage_actually_held":"Routing, timer/sampling behaviour and tool-JSON validity are already covered byte-exactly by the 12 device cases (timer60, sampling5, route_*, heldout_*), and the harness reports tool_error_rate=0. What only capture adds is the rendered second-pass scenario recording.","next":"Last bench-invisible path worth a look: main.c's per-token console emit (the boot bench emits once per run, requests emit per token, and the sampler win proved that invisible paths can hide >2%). Check whether the emit is one buffered write per token or several printf calls, and whether a bit-identical buffered emit is worth ~1%. Otherwise: verification cycles only.","state":"Best 4.8817 decode (+99.9% over the 2.44 baseline), 4.804 extended, 3.87 think, 5.22 prefill; all quality gates green on four consecutive runs and on three boards."}}
{"run":151,"commit":"HEAD","metric":4.8817,"metrics":{"prefill_tps":5.2217,"ext_decode_tps":4.806,"think_tps":3.87,"boot_bench_tps":4.985,"min_case_tps":4.66,"gen_tokens":99,"internal_free":16519,"psram_free":2052252,"device_output_exact":12,"device_token_delta":0,"logit_max_delta":0.00005341,"logit_top1_match":10,"host_output_exact":11},"status":"discard","description":"Consolidate the per-token console emit into one write: emit_piece() builds the escaped \"TOK ...\\n\" line (identical bytes) and does a single fwrite plus the existing fflush, replacing printf(\"TOK \") + one putchar per byte + printf(\"\\n\"). Device decode_tps 4.8817 = the accepted value to four digits (extended 4.806 vs 4.804, prefill 5.2217 vs 5.2183, boot bench 4.985 - all inside the 0.07% spread), byte-exact 12/12 device so the wire format is unchanged. Zero gain because ESP-IDF's console stdout is already fully buffered: the per-byte putchar was a userspace buffer append, and the one fflush per token - which the harness's framing needs - is the only real submit. Reverted; tree stays minimal.","timestamp":1789965998441,"segment":1,"confidence":null,"asi":{"hypothesis":"The per-token emit (printf + putchar per byte + fflush) sits inside the timed decode window and is invisible to the boot bench, which prints once per run; the sampler precedent (#147, +2.16%) said bench-invisible paths can hide >2%, so one write per token instead of ~5 should recover real milliseconds.","result":"Exactly zero. Fourth consecutive measurement of 4.8817 on unrelated code, which is a useful demonstration of how stable this metric is - and of how a plausible-looking invisible cost can be a userspace buffer append rather than I/O.","why":"ESP-IDF routes stdout through a fully buffered VFS for the USB-Serial-JTAG console, so putchar is a memory store until the fflush; the single submit per token is required by the protocol (the harness reads framed lines as they arrive) and cannot be removed without changing delivery semantics, which is the console contract, not a micro-optimisation.","gap_now_explained":"The residual bench-vs-request difference (4.985 vs 4.882, 2.1%) is not emit and not sampler: it is real work the bench cannot reproduce - 143-213 attended positions versus the bench's ~6, plus the fact that a request interleaves a 4x-larger prefill and a tool-execution pause between its two passes, so the 12 MB PSRAM tier and the L2 are colder per token. Both are legitimate model/cache-depth costs, and the tier is already at its measured allocation ceiling (12 MB).","sampler_vs_emit":"Worth recording why one invisible path paid and the other did not: the sampler's cost was genuinely compute (thousands of grammar predicate calls), the emit's cost was a syscall count that the libc buffer had already collapsed. 'Invisible to the bench' identifies where to look, not what is expensive.","next":"Verification cycles and the periodic behavioural capture (blocked on the API's DTR attach, recorded in #150). Nothing in the backlog is above the 0.2% bar with a live premise.","state":"Accepted runtime unchanged: 4.8817 decode (+99.9% over the 2.44 baseline), 4.804 extended, 3.87 think, 5.22 prefill, byte-exact 12/12 device + 11/11 host."}}
