{"run":558,"commit":"35c045c","metric":5.5817,"metrics":{"prefill_tps":5.59,"ext_decode_tps":5.2269,"think_tps":4.2,"boot_bench_tps":5.624,"min_case_tps":5.31,"gen_tokens":99,"internal_free":8415,"psram_free":2052252,"device_output_exact":6,"device_token_delta":0,"logit_max_delta":0.00005341,"logit_top1_match":10,"host_output_exact":19},"status":"discard","description":"Split granularity is now measured as neutral at the post-spin base and the candidate is discarded. Allowing 2-unit jobs to split (rows_dual_core guard half<2 -> half<1, provenance 85a6ec1342cd, board 3) read decode_tps 5.5817 against this same board's byte-identical acceptance tree at 5.58 - +0.003 %, i.e. far inside the one-quantisation-tick band - with boot bench 5.624 vs 5.621, device_output_exact 6/6 and LANE_RC=0. So the spin handshake did not flip this sign: the old verdict that jobs below two units per core are not worth splitting was wrong in its reasoning (#344's void 23-cycle figure, then #451's 3,973-4,603 cycle toll on the semaphore path) but its conclusion survives at the new base, because the jobs in that size class are simply too small to matter even with a nearly free wake. Reverted, and board 3's esp32/main/main.c restored from .auto/exp84/main.c.lean-ring-clean with md5 3c63ef73e719 verified, so the acceptance tree is the live tree there. Acceptance position unchanged: cross-board 18/20 with the identical divergence pair at provenance 4d3094578050, speed 5.5767/5.58, pin deliberately held at 5.3033 pending the owner's decision on the two demo-timer goldens.","timestamp":1790271556497,"segment":1,"confidence":18.02457142857145,"asi":{"hypothesis":"Lowering rows_dual_core's guard from half < 2 to half < 1 lets 2-unit jobs split; after the spin handshake removed most of the wake toll, #456 predicted small-job signs might flip positive. Tested on board 3 against the same board's byte-identical acceptance reading.","next":"Granularity axis closed at the new base in both directions: de-split (desplit1) has the wrong predicted sign and is unrun; split-more is neutral. Any remaining scheduling win must change WHICH work is co-scheduled, not the unit size. Board 3 restored to the acceptance snapshot (md5 3c63ef73e719 verified), so the acceptance tree remains the live tree there.","reading":"decode_tps 5.5817 vs 5.58 on this board's acceptance tree (+0.003 %, well inside the one-quantum band), boot bench 5.624 vs 5.621 (+0.05 %), device_output_exact 6/6 with LANE_RC=0 - correct, harmless, and not faster.","rollback_reason":"Neutral on the primary metric (one 0.034 % quantum at most) with byte-exactness intact, so there is nothing to keep; the guard change is reverted and board 3's main.c restored from .auto/exp84/main.c.lean-ring-clean (md5 verified).","next_action_hint":"Do not re-screen split granularity on this base; if scheduling is revisited, target which loops are co-scheduled across the two cores rather than the unit-size threshold."}}
{"run":559,"commit":"35c045c","metric":5.3033,"metrics":{"prefill_tps":5.59,"ext_decode_tps":5.2269,"think_tps":4.2,"boot_bench_tps":5.621,"min_case_tps":5.31,"gen_tokens":99,"internal_free":8415,"psram_free":2052252,"device_output_exact":18,"device_token_delta":52,"logit_max_delta":0.00005341,"logit_top1_match":10,"host_output_exact":19},"status":"keep","description":"Started measuring the one tuning knob the handshake campaign left as a first guess: the caller's spin budget. ND_CALLER_SPIN goes 600 -> 2000 iterations on the acceptance tree, so the caller busy-waits on the peer's completion sequence for longer before falling back to a blocking ulTaskNotifyTake syscall. The budgets were chosen at run #453 without a sweep, and while #456 found the handshake budget-insensitive on the semaphore path, the lean-notification stack removed those syscalls and changed what the fallback costs, so the premise genuinely changed - which is the only admissible reason to re-screen. Bit-exact by construction because completion is decided by the s_done_seq predicate rechecked after every wake, not by the wait. Screened on board 3 with AUTO_GROUPS=primary against that board's own 5.58 acceptance reading (provenance 0a93f47fb8b6 asserted), acceptance snapshot md5 3c63ef73e719 intact, pin deliberately held at 5.3033.","timestamp":1790271625894,"segment":1,"confidence":18.02457142857145,"asi":{"candidate":"ND_CALLER_SPIN 600 -> 2000 on the acceptance tree, board 3, provenance 0a93f47fb8b6 asserted by the runner, AUTO_GROUPS=primary screen against this board's own acceptance reading of 5.58. Acceptance snapshot untouched (md5 3c63ef73e719 in .auto/exp84).","hypothesis":"The two spin budgets in main.c (#define ND_WORKER_SPIN 20000u / ND_CALLER_SPIN 600u) were first guesses at run #453 and have never been swept at the final stack. After lean notifications, the caller's fallback path is a blocking ulTaskNotifyTake, i.e. a kernel syscall; raising its spin budget from 600 to 2000 iterations should convert some of those waits into busy waits on the peer's store, which is the same reasoning the handshake itself was built on.","why_bit_exact":"Pure scheduling: the completion authority is the s_done_seq predicate, which is rechecked after every wake, so no arithmetic or ordering changes.","next":"Compare primary decode with 5.58; within one quantum means the budgets are already past the point where the wait converts, and the axis closes with the same measurement rather than the #453 guess.","risk_priced":"Cost if neutral-to-worse is idle time on core 0 spinning instead of sleeping; no other work is scheduled there during a decode token, and the diagnostic heartbeat tasks are not in the shipping tree."}}
{"run":560,"commit":"35c045c","metric":5.3033,"metrics":{"prefill_tps":5.59,"ext_decode_tps":5.2269,"think_tps":4.2,"boot_bench_tps":5.621,"min_case_tps":5.31,"gen_tokens":99,"internal_free":8415,"psram_free":2052252,"device_output_exact":18,"device_token_delta":52,"logit_max_delta":0.00005341,"logit_top1_match":10,"host_output_exact":19},"status":"keep","description":"The ND_CALLER_SPIN 600 -> 2000 screen on board 3 has no timing line yet: the lane log's tail is flash_s=6, so the image is flashed and the board is inside its prefix-priming window, and per #556's timing note a primary-group decode line takes roughly another 15-20 minutes. Nothing is claimed. The candidate is bit-exact by construction because completion is decided by the s_done_seq predicate rechecked after every wake, and its decision rule is pre-stated: within one quantisation tick of this board's 5.58 acceptance reading means the caller-side budget is non-binding, in which case the remaining budget test is the worker side in the shortening direction rather than a symmetric sweep of a knob the model predicts to be flat. Acceptance position unchanged - cross-board 18/20 with the identical divergence pair at provenance 4d3094578050, speed 5.5767/5.58 - and the pin is deliberately held at 5.3033 pending the owner's decision on the two demo-timer goldens.","timestamp":1790271653389,"segment":1,"confidence":18.02457142857145,"asi":{"hypothesis":"Read the ND_CALLER_SPIN 2000 screen on board 3.","next":"Primary decode vs this board's 5.58 acceptance reading, plus its 6/6 device byte-exactness and the lane's host 19/19 pre-check. If it is within one quantum, the caller-side budget is measured as non-binding and the only untested budget left is ND_WORKER_SPIN - which should then be tested by shortening rather than lengthening, since a longer caller spin cannot help if a longer worker spin did not either. That ordering matters: measure the direction that could still pay rather than sweeping both ends of a knob the model says is flat.","state":"No timing line yet - log tail is flash_s=6, so the image is flashed and the board is in its ~5 minute priming window; a primary-group reading needs roughly 15-20 minutes after that per #556's timing note."}}
{"run":561,"commit":"35c045c","metric":5.3033,"metrics":{"prefill_tps":5.59,"ext_decode_tps":5.2269,"think_tps":4.2,"boot_bench_tps":5.621,"min_case_tps":5.31,"gen_tokens":99,"internal_free":8415,"psram_free":2052252,"device_output_exact":18,"device_token_delta":52,"logit_max_delta":0.00005341,"logit_top1_match":10,"host_output_exact":19},"status":"keep","description":"The ND_CALLER_SPIN 2000 lane has produced no output beyond its flash line - the whole log is 163 bytes - while its tmux session and runner processes are alive, so I am recording it as an unresolved second consecutive flat read rather than calling it either a stall or a long boot. The two candidate explanations are stated with their tests: benign, because measure.sh emits nothing between the flash line and bench.py's first line, so a tiny log is exactly what a priming-after-reset board looks like; unbenign, because if the image never reaches EVT READY then enlarging the caller spin budget is a boot-path suspect and the correct action is to restore board 3 from the acceptance snapshot (md5 3c63ef73e719) and re-screen at a milder budget to separate the two. I deliberately did not restart or revert on this read, since #549 established that acting on one flat interval produced a retraction earlier in this ledger. Acceptance position unchanged: cross-board 18/20 with the identical divergence pair at provenance 4d3094578050, speed 5.5767/5.58, and the pin deliberately held at 5.3033 pending the owner's decision on the two demo-timer goldens.","timestamp":1790271694278,"segment":1,"confidence":18.02457142857145,"asi":{"decision_rule":"Per #549's corrected rule I do not act on one flat read; this is the second, so the next poll decides. The benign explanation is specific and testable: measure.sh writes nothing between the flash line and bench.py's first output, so a 163-byte log is what a lane looks like while the board is still priming after a reset. The unbenign explanation is that the candidate image never reaches EVT READY, which would make a 2000-iteration caller spin a boot-path suspect and would be worth knowing.","hypothesis":"Decide whether the ND_CALLER_SPIN lane is stalled, using byte count and process liveness rather than the tail string.","evidence":"Log is 163 bytes total - it stops right after flash_s=6 - while the tmux session M-SPN2 exists and measure/related processes are live. So the runner is alive but bench.py has produced no output yet.","next":"If the next read is still 163 bytes with bench.py absent, record the boot stall, revert board 3 to the acceptance snapshot and re-screen at a milder budget (1200) to separate 'budget too large' from 'lane wedged for harness reasons'."}}
{"run":562,"commit":"35c045c","metric":5.3033,"metrics":{"prefill_tps":5.59,"ext_decode_tps":5.2269,"think_tps":4.2,"boot_bench_tps":5.621,"min_case_tps":5.31,"gen_tokens":99,"internal_free":8415,"psram_free":2052252,"device_output_exact":18,"device_token_delta":52,"logit_max_delta":0.00005341,"logit_top1_match":10,"host_output_exact":19},"status":"keep","description":"The ND_CALLER_SPIN 2000 lane is confirmed healthy, closing the stall question #561 left open: its log grew from 163 to 7,373 bytes, meaning the board reached READY and bench.py started streaming, so the candidate image boots normally and a larger caller spin budget is not a boot-path hazard. The screen's verdict is still pending - no decode_tps, no LANE_RC - so no speed claim is made. Durable harness rule extracted from three polls of this lane: a measure.sh log stays near-empty until bench.py starts, so liveness must be judged against the bench-start threshold rather than against the previous poll's byte count, which is what made 163 bytes look like a stall and 4,865 bytes look like progress in the same session. Acceptance position unchanged: cross-board 18/20 with the identical divergence pair at provenance 4d3094578050, speed 5.5767/5.58, pin deliberately held at 5.3033 pending the owner's decision on the two demo-timer goldens.","timestamp":1790271719252,"segment":1,"confidence":18.02457142857145,"asi":{"boot_suspect_excluded":"The candidate image boots and runs, so enlarging ND_CALLER_SPIN is not a boot-path hazard - the branch #561 flagged as unbenign is excluded by the log growing, not by argument.","hypothesis":"Third read of the ND_CALLER_SPIN 2000 lane: flat at 163 bytes in #560-#561, so decide stall versus late start.","next":"Read the primary decode when it lands and compare with this board's 5.58 acceptance reading plus 6/6 byte-exactness. Standing rule for what I just did wrong twice in this campaign: a lane log is only meaningful after bench.py starts, so the byte count must be compared against the bench-start threshold, not against the previous poll.","result":"Not a stall - the log grew from 163 to 7,373 bytes, i.e. the board reached READY and bench.py began streaming, exactly the benign branch #561 named. No decode_tps and no LANE_RC yet, so the screen's verdict is still pending."}}
{"run":563,"commit":"35c045c","metric":5.3033,"metrics":{"prefill_tps":5.59,"ext_decode_tps":5.2269,"think_tps":4.2,"boot_bench_tps":5.621,"min_case_tps":5.31,"gen_tokens":99,"internal_free":8415,"psram_free":2052252,"device_output_exact":18,"device_token_delta":52,"logit_max_delta":0.00005341,"logit_top1_match":10,"host_output_exact":19},"status":"keep","description":"The ND_CALLER_SPIN 2000 screen has not produced its primary reading yet, so nothing is claimed and no disposition is recorded beyond the pre-stated one: at least 0.2 % with byte-exactness means cross-board and then bundle into the acceptance stack, within one quantisation tick means revert board 3 to the acceptance snapshot and close the spin-budget axis on measurement instead of on run #453's untuned guess, and a regression means the caller's fallback notification take is simply not on the critical path. The lane is past the bench-start threshold established in #562 (7,373 bytes), so this is a suite still in flight and not a lane that failed to start - which is the same distinction that produced a retraction earlier in this ledger, so I am keeping the reads separate rather than interpolating. Acceptance position unchanged: cross-board 18/20 with the identical divergence pair at provenance 4d3094578050, speed 5.5767/5.58, pin deliberately held at 5.3033 pending the owner's decision on the two demo-timer goldens.","timestamp":1790271749316,"segment":1,"confidence":18.02457142857145,"asi":{"hypothesis":"Read the ND_CALLER_SPIN 2000 primary screen verdict.","next":"Decisive datum is the primary-group mean against this board's own 5.58 acceptance reading on an otherwise byte-identical tree, with 6/6 device byte-exactness and the lane's host 19/19 pre-check. If it lands within one quantum, the caller budget is measured non-binding and the only remaining budget direction worth a build is shortening ND_WORKER_SPIN, because #558's half<1 result already showed that near-free wakes do not rescue small work - which is the same physics: more spinning does not create work to overlap.","pre_stated_disposition":"Improvement of >= 0.2 % with byte-exactness -> cross-board then bundle into the acceptance stack; within one quantum -> revert board 3 to the acceptance snapshot and close the spin-budget axis with this measurement rather than #453's guess; regression -> revert and record that the caller's fallback take is not on the critical path.","state":"Still none - no decode_tps, no device_output_exact, no LANE_RC. Per #562's rule the lane is only judged against the bench-start threshold, and it passed that threshold at 7,373 bytes in #562, so this is a suite still running rather than a lane that never started."}}
{"run":564,"commit":"35c045c","metric":5.58,"metrics":{"prefill_tps":5.59,"ext_decode_tps":5.2269,"think_tps":4.2,"boot_bench_tps":5.621,"min_case_tps":5.31,"gen_tokens":99,"internal_free":8415,"psram_free":2052252,"device_output_exact":6,"device_token_delta":0,"logit_max_delta":0.00005341,"logit_top1_match":10,"host_output_exact":19},"status":"discard","description":"Spin budgets are now closed on measurement. Lengthening the caller's busy-wait from 600 to 2000 iterations (provenance 0a93f47fb8b6, board 3, AUTO_GROUPS=primary) read decode_tps 5.58 against this board's byte-identical acceptance tree at 5.58 - exactly zero difference - with device_output_exact 6/6 and LANE_RC=0, and it reverted per the disposition stated before the run. Together with #558, which made 2-unit jobs splittable and also read neutral (5.5817 vs 5.58), this measures the same thing from two sides: after the spin handshake plus lean notifications, neither the unit size at which work is split nor the number of iterations either side spins before parking changes the timed token, because the remaining handshake cost lives in the notification path itself and the work units in question are far too small to matter. Board 3's esp32/main/main.c was restored from .auto/exp84/main.c.lean-ring-clean with md5 3c63ef73e719 verified, so the live tree on that board is the acceptance tree again. Acceptance position unchanged: cross-board 18/20 with the identical divergence pair at provenance 4d3094578050, speed 5.5767/5.58, pin deliberately held at 5.3033 pending the owner's decision on the two demo-timer goldens.","timestamp":1790271787483,"segment":1,"confidence":18.02457142857145,"asi":{"candidate":"ND_CALLER_SPIN 600 -> 2000, board 3, provenance 0a93f47fb8b6, AUTO_GROUPS=primary.","hypothesis":"The caller's spin budget was a run #453 guess never swept at the final stack; lengthening it should convert some fallback ulTaskNotifyTake syscalls into busy waits on the peer's completion store.","next":"Spin-budget axis closed on measurement in both directions, matching #558 for granularity: the handshake's cost is now in the notification path, not in how long either side spins. Board 3 restored to the acceptance snapshot (md5 3c63ef73e719 verified) so the live tree there is the acceptance tree again.","reading":"decode_tps 5.58 - the same value as this board's byte-identical acceptance tree, i.e. exactly 0.000 % - with device_output_exact 6/6 and LANE_RC=0.","rollback_reason":"Neutral on the primary metric, so there is nothing to keep; the pre-stated disposition for 'within one quantisation tick' applied: revert and record the axis as closed rather than re-screen another value.","next_action_hint":"Do not sweep spin budgets further. Remaining scheduling headroom, if any, is in which work is co-scheduled across the cores, not in wait-loop parameters."}}
{"run":565,"commit":"35c045c","metric":5.3033,"metrics":{"prefill_tps":5.59,"ext_decode_tps":5.2269,"think_tps":4.2,"boot_bench_tps":5.621,"min_case_tps":5.31,"gen_tokens":99,"internal_free":8415,"psram_free":2052252,"device_output_exact":18,"device_token_delta":52,"logit_max_delta":0.00005341,"logit_top1_match":10,"host_output_exact":19},"status":"keep","description":"Persisted the two newly closed scheduling axes and the acceptance cadence debt to .auto/ideas.md rather than manufacture another sub-bar screen: split granularity (half<1 -> 5.5817 vs 5.58) and spin budgets (ND_CALLER_SPIN 2000 -> 5.58 vs 5.58) are both bracketed as neutral at the post-notification stack, nd_model.c is recorded as having exactly one split threshold with the de-split candidate deliberately unrun for a stated reason, and the capture constraint is written down - make capture drives the model through needle-api on the single-board aliases, so capturing the acceptance image requires installing that tree on board 1 as a deliberate baseline change instead of pointing the target at a worker. No board time used, no speed claim, and the pin deliberately held at 5.3033 where the cross-board 18/20 verdict on provenance 4d3094578050 still awaits the owner's disposition of the two demo-timer goldens.","timestamp":1790271854513,"segment":1,"confidence":18.02457142857145,"asi":{"constraint_found":"make capture runs demo/capture.py, which drives the model through needle-api on 127.0.0.1:8081 - the single-board /dev/ttyACM aliases, i.e. board 1. Capturing the acceptance image therefore means deliberately installing that tree on board 1 first, not pointing the make target at a worker; the #502 lesson is that mixing baselines across checkouts is how acceptance evidence gets corrupted.","hypothesis":"With the scheduling axes closed, the highest-value action was to persist the closures and the acceptance cadence debt rather than invent a sub-bar screen.","next":"Capture on board 1 with the acceptance tree installed as a deliberate baseline change, then the owner's decision on the two demo-timer goldens. Both are acceptance-evidence steps, not optimisations, and no candidate above the keep bar remains inside the documented maxima and the byte-exact gate.","written":"Added to .auto/ideas.md: the granularity and spin-budget closures with their exact readings, the fact that nd_model.c has exactly one split threshold and the de-split variant stays unrun for a stated reason, and the capture route constraint."}}
