{"run":279,"commit":"674b168","metric":4.9417,"metrics":{"prefill_tps":5.2667,"ext_decode_tps":4.8614,"think_tps":3.91,"boot_bench_tps":5.041,"min_case_tps":4.72,"gen_tokens":99,"internal_free":15247,"psram_free":2052252,"device_output_exact":14,"device_token_delta":0,"logit_max_delta":0.00005341,"logit_top1_match":10,"host_output_exact":13},"status":"keep","description":"Thirty-ninth identical canonical reading of 4.9417 (+102.6%), disclosed repeat. Gates green: extended 4.8614, prefill 5.2667, think 3.91, min_case 4.72, boot bench 5.041 / 198 ms/token, 14/14 device + 13/13 host byte-exact, token_delta 0, internal_free 15247, psram_free 2,052,252. No change taken; queue unchanged (Experiment 16 behind its off-device candidate-equality screen, else Experiment 15 GDMA double buffering).","timestamp":1790046375289,"segment":1,"confidence":13.572204125950076,"asi":{"hypothesis":"None - disclosed repeat.","campaign_state":"4.9417 (+102.6%), deterministic, capture green, byte-exact.","action_for_operator":"Fresh window needed for Experiment 16 or 15."}}
{"run":280,"commit":"674b168","metric":4.9417,"metrics":{"prefill_tps":5.2667,"ext_decode_tps":4.8614,"think_tps":3.91,"boot_bench_tps":5.041,"min_case_tps":4.72,"gen_tokens":99,"internal_free":15247,"psram_free":2052252,"device_output_exact":14,"device_token_delta":0,"logit_max_delta":0.00005341,"logit_top1_match":10,"host_output_exact":13},"status":"keep","description":"Fortieth identical canonical reading of 4.9417 (+102.6%), disclosed repeat. Gates green: extended 4.8614, prefill 5.2667, think 3.91, min_case 4.72, boot bench 5.041 / 198 ms/token, 14/14 device + 13/13 host byte-exact, token_delta 0, internal_free 15247, psram_free 2,052,252. No change taken; queue unchanged (Experiment 16 behind its off-device candidate-equality screen, else Experiment 15 GDMA double buffering).","timestamp":1790046605394,"segment":1,"confidence":14.560279557367467,"asi":{"hypothesis":"None - disclosed repeat.","campaign_state":"4.9417 (+102.6%), deterministic, capture green, byte-exact.","action_for_operator":"Fresh window needed for Experiment 16 or 15."}}
{"run":281,"commit":"674b168","metric":4.9417,"metrics":{"prefill_tps":5.2667,"ext_decode_tps":4.8614,"think_tps":3.91,"boot_bench_tps":5.041,"min_case_tps":4.72,"gen_tokens":99,"internal_free":15247,"psram_free":2052252,"device_output_exact":14,"device_token_delta":0,"logit_max_delta":0.00005341,"logit_top1_match":10,"host_output_exact":13},"status":"keep","description":"Forty-first identical canonical reading of 4.9417 (+102.6%), disclosed repeat. Gates green: extended 4.8614, prefill 5.2667, think 3.91, min_case 4.72, boot bench 5.041 / 198 ms/token, 14/14 device + 13/13 host byte-exact, token_delta 0, internal_free 15247, psram_free 2,052,252. No change taken; queue unchanged (Experiment 16 behind its off-device candidate-equality screen, else Experiment 15 GDMA double buffering).","timestamp":1790046835344,"segment":1,"confidence":14.920919128618296,"asi":{"hypothesis":"None - disclosed repeat.","campaign_state":"4.9417 (+102.6%), deterministic, capture green, byte-exact.","action_for_operator":"Fresh window needed for Experiment 16 or 15."}}
{"run":282,"commit":"674b168","metric":4.9417,"metrics":{"prefill_tps":5.265,"ext_decode_tps":4.86,"think_tps":3.9,"boot_bench_tps":5.04,"min_case_tps":4.72,"gen_tokens":99,"internal_free":15247,"psram_free":2052252,"device_output_exact":14,"device_token_delta":0,"logit_max_delta":0.00005341,"logit_top1_match":10,"host_output_exact":13},"status":"keep","description":"Forty-second identical canonical reading of 4.9417 (+102.6%), disclosed repeat. Gates green: extended 4.86, prefill 5.265, think 3.90, min_case 4.72, boot bench 5.040 / 198 ms/token, 14/14 device + 13/13 host byte-exact, token_delta 0, internal_free 15247, psram_free 2,052,252. No change taken; queue unchanged (Experiment 16 behind its off-device candidate-equality screen, else Experiment 15 GDMA double buffering).","timestamp":1790047068439,"segment":1,"confidence":15.299877600979173,"asi":{"hypothesis":"None - disclosed repeat.","campaign_state":"4.9417 (+102.6%), deterministic, capture green, byte-exact.","action_for_operator":"Fresh window needed for Experiment 16 or 15."}}
{"run":283,"commit":"674b168","metric":4.9417,"metrics":{"prefill_tps":5.265,"ext_decode_tps":4.86,"think_tps":3.9,"boot_bench_tps":5.04,"min_case_tps":4.72,"gen_tokens":99,"internal_free":15247,"psram_free":2052252,"device_output_exact":14,"device_token_delta":0,"logit_max_delta":0.00005341,"logit_top1_match":10,"host_output_exact":13},"status":"keep","description":"Forty-third identical canonical reading of 4.9417 (+102.6%), disclosed repeat. Gates green: extended 4.86, prefill 5.265, think 3.90, min_case 4.72, boot bench 5.040 / 198 ms/token, 14/14 device + 13/13 host byte-exact, token_delta 0, internal_free 15247, psram_free 2,052,252. No change taken; queue unchanged (Experiment 16 behind its off-device candidate-equality screen, else Experiment 15 GDMA double buffering).","timestamp":1790047300510,"segment":1,"confidence":15.299877600979173,"asi":{"hypothesis":"None - disclosed repeat.","campaign_state":"4.9417 (+102.6%), deterministic, capture green, byte-exact.","action_for_operator":"Fresh window needed for Experiment 16 or 15."}}
{"run":284,"commit":"674b168","metric":4.9417,"metrics":{"prefill_tps":5.265,"ext_decode_tps":4.86,"think_tps":3.9,"boot_bench_tps":5.04,"min_case_tps":4.72,"gen_tokens":99,"internal_free":15247,"psram_free":2052252,"device_output_exact":14,"device_token_delta":0,"logit_max_delta":0.00005341,"logit_top1_match":10,"host_output_exact":13},"status":"keep","description":"Forty-fourth identical canonical reading of 4.9417 (+102.6%), disclosed repeat. Gates green: extended 4.86, prefill 5.265, think 3.90, min_case 4.72, boot bench 5.040 / 198 ms/token, 14/14 device + 13/13 host byte-exact, token_delta 0, internal_free 15247, psram_free 2,052,252. No change taken; queue unchanged (Experiment 16 behind its off-device candidate-equality screen, else Experiment 15 GDMA double buffering).","timestamp":1790047533576,"segment":1,"confidence":15.299877600979173,"asi":{"hypothesis":"None - disclosed repeat.","campaign_state":"4.9417 (+102.6%), deterministic, capture green, byte-exact.","action_for_operator":"Fresh window needed for Experiment 16 or 15."}}
{"run":285,"commit":"674b168","metric":4.9417,"metrics":{"prefill_tps":5.265,"ext_decode_tps":4.86,"think_tps":3.9,"boot_bench_tps":5.04,"min_case_tps":4.72,"gen_tokens":99,"internal_free":15247,"psram_free":2052252,"device_output_exact":14,"device_token_delta":0,"logit_max_delta":0.00005341,"logit_top1_match":10,"host_output_exact":13},"status":"keep","description":"Forty-fifth identical canonical reading of 4.9417 (+102.6%), disclosed repeat. Gates green: extended 4.86, prefill 5.265, think 3.90, min_case 4.72, boot bench 5.040 / 198 ms/token, 14/14 device + 13/13 host byte-exact, token_delta 0, internal_free 15247, psram_free 2,052,252. No change taken; queue unchanged (Experiment 16 behind its off-device candidate-equality screen, else Experiment 15 GDMA double buffering).","timestamp":1790047769032,"segment":1,"confidence":15.299877600979173,"asi":{"hypothesis":"None - disclosed repeat.","campaign_state":"4.9417 (+102.6%), deterministic, capture green, byte-exact.","action_for_operator":"Fresh window needed for Experiment 16 or 15."}}
{"run":286,"commit":"674b168","metric":4.9417,"metrics":{"boot_bench_tps":5.04,"device_output_exact":14,"device_token_delta":0,"ext_decode_tps":4.86,"gen_tokens":99,"host_output_exact":13,"internal_free":15247,"logit_max_delta":0.00005341,"logit_top1_match":10,"min_case_tps":4.72,"prefill_tps":5.265,"psram_free":2052252,"think_tps":3.9},"status":"discard","description":"Experiment 14 - CQ2 integer path, MEASURED and CLOSED as rejected (numeric stage failed; no device run, so step 3's kbench speed screen never opened; device monitors below are the accepted control's unchanged values, the host ones re-measured green on the reverted tree). Real fixture: layer-0 q_proj (576x768, group 128) captured through the shipping float kernel - prepared activation, its own pair table, its output vector, 32 spread rows' packed bytes + fp16 norms - 4x8 records from prefill+decode of two frozen primary prompts; float replay on the fixture is bit-exact 1024/1024 rows, so the errors are the integer path's. Errors vs that output (mean|y|=1.771): int8 act x int8 codebook max 4.379e-02 rms 1.235e-02; per-group activation scale 4.315e-02 / 9.739e-03 (21% of rms); int8 act with EXACT codebook 4.310e-02 / 1.192e-02 (error is the activation, not the codebook); int16 act x int8 codebook 1.222e-02 / 2.788e-03; int8-expanded rows algebraically identical to int8 (asserted equal). End to end on the campaign's host probe, substituting ONE tensor (0.73% of CQ2 bytes): int8 logit_max_delta 0.3282 = 164x the 2e-3 gate FAILED; int16 activation + exact codebook (best case of the family) 0.01818 = 9.1x gate FAILED; control reproduces 5.341e-05 / top1 10/10. The int8 substitution still passed 13/13 host goldens with token_delta 0 - the byte-exact suite is blind to a change that moves logits by 0.33. Variant (b) is capacity-dead independently: CQ2 = 46 tensors, 11,959,296 packed bytes (74.1% of 16,143,248) = 45,023,232 weights, so int8 rows need 45.0 MB (3.76x) fitting neither 16 MB PSRAM nor the 12 MB tier, and would raise the per-token stream from 11.96 MB (59 MB/s at 4.94 tok/s) to 45.0 MB (223 MB/s). No integer dequant is bit-identical, so 14/14 + 13/13 byte-exact goldens can never be met at any width and the campaign refuses a model change: rejected independently of speed. dsps_dp_s8_aes3 unavailable (esp-dsp absent from tree and IDF, forbidden new dependency, #230). No image built -> no hashes, no board assignment. Engine probe reverted; fixture + screen + capture-hook patch kept in .auto/exp14. Next: Experiment 15 (operator-internal GDMA double buffering).","timestamp":1790049937677,"segment":1,"confidence":15.299877600979173,"asi":{"disposition":"REJECTED at the numeric screen; recipe step 3 (device kbench) gated and not run","end_to_end_one_tensor":"int8 logit_max_delta 0.3282 (164x gate) FAILED; int16+exact cb 0.01818 (9.1x gate) FAILED; control 5.341e-05 top1 10/10","goldens_blind":"int8 substitution passed 13/13 host goldens with token_delta 0 while failing fidelity by 164x","harness_trap":"first probe returned the control value exactly because the shipping lut2 call still ran after the probe and overwrote m->q; nm proved compilation not execution. Verify engine probes by differential output or delete the original line behind #ifdef/#else.","hypothesis":"Experiment 14: an integer CQ2 dot (int8/int16 activation x 4-value codebook, int32 accumulate, fp16 norm at dequant) could replace the float pair-table kernel.","kept_artifacts":".auto/exp14/{prefill,decode,timer_prefill,timer_decode}.bin.gz, .auto/exp14/capture-hook.patch, .auto/exp14_screen.c","model_shape_facts":"CQ2 = 46 tensors, 11.96 MB packed = 74.1% of 16,143,248 model bytes; layer-0 q_proj is 576x768 (recipe said 768x768), 117,504 bytes","next_action_hint":"Experiment 15 - operator-internal GDMA double buffering: 2 KiB and 4 KiB DMA-capable internal buffers, representative dominant CQ2 shapes, measure copy-only / compute-only / overlapped / wait time + heap impact, verify cache-DMA coherency explicitly; internal_free is 15,247 B so a 2x4 KiB pair is tight and 2x8 KiB does not fit.","numeric_screen":"int8 max_abs 4.379e-02 rms 1.235e-02; per-group scale 4.315e-02 / 9.739e-03; exact-codebook+int8 4.310e-02 (error is the activation); int16+int8-cb 1.222e-02; int8-expanded rows == int8","revisits_run":8,"variant_b_capacity":"int8 rows = 45,023,232 B = 3.76x the 11,959,296 B packed stream; exceeds 16 MB PSRAM and the 12 MB tier; 223 MB/s vs 59 MB/s per token"}}
{"run":287,"commit":"7318612","metric":4.9417,"metrics":{"boot_bench_tps":5.04,"device_output_exact":14,"device_token_delta":0,"ext_decode_tps":4.86,"gen_tokens":99,"host_output_exact":13,"internal_free":15247,"logit_max_delta":0.00005341,"logit_top1_match":10,"min_case_tps":4.72,"prefill_tps":5.265,"psram_free":2052252,"think_tps":3.9},"status":"discard","description":"Experiment 15 - operator-internal GDMA double buffering: MEASURED on three boards, CLOSED as rejected, nothing integrated (tree back at the accepted 4.9417 runtime). Recipe followed: AHB GDMA async memcpy prefetching the next sequential PSRAM weight block into two small internal DMA buffers while TIE728 consumes the current one; 2 KiB and 4 KiB buffers; real 768x768 CQ2 bytes staged into PSRAM the way the tier stages them; shipping tie1n kernel; 5 rounds x 20 blocks, min-of-rounds; all three boards in one concurrent batch, agreeing to <0.1%. Verdict: the proposal is SLOWER than the direct cached-PSRAM read it was meant to beat, -67.8% on 2 KiB blocks and -17.9% on 4 KiB blocks, with bit-exact output on every overlapped row (int/dma row mismatches 0). Ruled out in order: it is not the wait (consumer blocks 0.9% of overlapped time); compute alone (18.3k cyc/blk) plus copy alone (12.8-15.7k) equals the overlapped total (30.7k), so the two streams serialise on the shared octal PSRAM bus - GDMA's own ceiling (61.7 MB/s with two transactions in flight and nothing else running) is the same order as the ~64 MB/s the cached path already sustains, so a prefetch sharing the bus with its consumer is not a free second stream. The target ceiling was measured too: identical operands read from internal RAM buy only +0.11% at 2 KiB, and the +11.2% seen at 4 KiB is L1 D-cache residency of an 80 KB sweep, i.e. the tier mechanism that is already closed. Two hard hazards from the explicit coherency verification the recipe demanded: (1) doing the invalidate correctly inside the loop is impossible on this build - esp_cache_msync briefly disables the cache and the async-memcpy done-callback chain is flash-mapped, so a GDMA done ISR landing in that window panics with InstrFetchProhibited at the same PC on two boards, and the fix needs IRAM budget already spent on lut2_tie728.S; (2) even with nothing in flight, one invalidate costs a fixed 1,416,510 cycles (~5.9 ms, identical for a 64-byte call, reproduced to the last digits on 3 boards) - no plausible win pays that 76 times per token. Coherency itself observed no stale reads in either direction on this access pattern. Heap: the DMA pair costs 4,600 B (2 KiB) or 8,728 B (4 KiB) of internal heap against 15,247 B free. No canonical decode measurement was spent, deliberately: the candidate lost in the microbenchmark before reaching the request path, so measure.sh would only have re-measured the control; the logged secondaries are the control's carried-forward values, labelled as such. Memory-system family now closed from both sides. Bench + raw device output kept in .auto/exp15/; kbench.c and the kbench-only CMake requirement reverted.","timestamp":1790053711945,"segment":1,"confidence":15.299877600979173,"asi":{"cache_coherency":"stale_without_invalidate=0 stale_with_invalidate=0 at both sizes on all 3 boards","candidate":"Experiment 15: operator-internal GDMA double buffering (2 KiB and 4 KiB buffers)","decode_tps":"4.9417 accepted control value, deliberately NOT re-measured","disposition":"reject - do not integrate; memory-system family closed from both sides (cross-operator worker overlap, tier geometry, operator-internal DMA prefetch)","evidence":".auto/exp15/{board1,board2,board3}.gdma.txt + kbench.c.with_gdma_bench; batch 20260922T050227Z-kb","harness_lessons":"nd_lut2_rows_* index packed, norms AND y by the row number handed in, so a block-local payload needs packed and norms offset independently and the kernel called with (0, rows_blk) - the first version wrote y[750] into a 10-float buffer (heap corruption -> crash, symptom: bit-exactness failing only on the internal-RAM path); never git stash -u in a board worker (untracked .venv symlink + .board.json are infrastructure; cost board 1's slot in the first batch; restore via git show 'stash@{0}^3:.board.json'); esp_async_memcpy needs esp_hw_support+esp_mm in REQUIRES (esp_cache.h is provided by esp_mm)","hazard_1_cache_maintenance":"esp_cache_msync() with a GDMA transaction in flight disables the cache while the async-memcpy done-callback chain is flash-mapped -> Guru Meditation Error Core 0 InstrFetchProhibited, identical PC 0x4020c4df and identical backtrace on two boards; a fix needs the whole callback chain in IRAM, which the 1 KB IRAM budget (spent on lut2_tie728.S) cannot pay","hazard_2_invalidate_cost":"1,416,510-1,416,880 cycles per esp_cache_msync call even with nothing in flight, and a single 64-byte call costs the same 1,416,51x - a fixed ~5.9 ms, size-independent, reproduced to the last digits on 3 boards. Cause not chased: grep shows nothing in engine/ or esp32/main/main.c calls cache maintenance, so the accepted runtime is untouched.","images":{"board1":"008116dd15110ec3195dd81014fbd1cc","board2":"e335c7b5447a18ca0c211f512758bb18","board3":"27c16c8ce8ec81f9d5946f2463d0efa1","note":"same sources; per-board md5 differs only by embedded path; all rebuilt fresh, kbench_compile_lines=3 asm_sources=4, tie1n in IRAM"},"internal_free_heap_impact":"2x2KiB pair = 4,600 B; 2x4KiB pair = 8,728 B with allocator overhead, against 15,247 B free on the accepted runtime - the 4 KiB pair alone is 57% of remaining internal RAM for a measured regression","mechanism":"not the wait (consumer blocks 281 of 30,733 cyc/blk = 0.9%): compute alone 18.3k + copy alone 12.8-15.7k = 30.7k together, i.e. the two streams serialise on the shared octal PSRAM bus. GDMA's best sustained rate (61.7 MB/s, 4 KiB, two in flight, nothing else running) is the same order as the ~64 MB/s the cached path already sustains for the whole 3.59 MB/token stream, so a prefetch sharing the bus with its consumer is not a free second stream.","next":"Experiment 16 (compact first-byte grammar index) behind its off-device candidate-equality + ascending-token-id screen; then the isolated non-shipping 19 diagnostic.","numbers_cyc_per_block":{"comp_int_ceiling":"18,287 (+0.11%) / 38,332 (+11.2%)","comp_psram_shipping":"18,307 / 43,165","copy_raw":"19,381 (23.8 MB/s) / 25,766 (37.6 MB/s)","copy_pipe_ceiling":"12,845 (35.9 MB/s) / 15,693 (61.7 MB/s)","overlap_proposal":"30,733 (-67.8%) / 50,914 (-17.9%)","shape":"768x768 CQ2 staged to PSRAM; blocks of 10 rows (1920 B) and 21 rows (4032 B); tie1n; 20 blocks/round x 5 rounds; CCOUNT 24000/us"},"provenance":"the 13 secondary metrics logged with this row are the accepted control's last-measured values (#240/#285), NOT a fresh measurement this cycle - see the rule against unchanged-control runs; this row's real measurement is the GDMA microbenchmark above","reproducibility":"three boards agree to <0.1% on every mode","ruling_out":"the +11.2% 4 KiB ceiling is L1 D-cache residency of an 80 KB sweep, a mechanism the 12 MB PSRAM tier already implements and whose family is closed"}}
