{"run":449,"commit":"7e11de2","metric":5.3033,"metrics":{"boot_bench_tps":5.343,"device_output_exact":20,"device_token_delta":0,"ext_decode_tps":5.2269,"gen_tokens":99,"host_output_exact":19,"internal_free":13367,"logit_max_delta":0.00005341,"logit_top1_match":10,"min_case_tps":5.07,"prefill_tps":5.59,"psram_free":2052252,"think_tps":4.2},"status":"keep","description":"NF16V five-instruction norm rebias prepared, guarded, host-green, and launched on board 3. The shipping 2-bit kernel converts each row-group's fp16 norm with a ten-instruction macro (three extui to split sign/exponent/mantissa, shifts, two or); for a positive ordinary halfword the conversion is exactly (h<<13)+0x38000000 in five instructions. Eligibility is widened where it already lives - nd_lut2_asm_ok's per-tensor norm walk, which rejected exponent 0/31, now rejects a set sign bit too, because the fast form would otherwise push a negative halfword's sign into the exponent; ineligible tensors still take the C walker. Oracle calls the ACTUAL predicate (real-source include + gc-sections, .auto/exp77's pattern) over all 65,536 encodings: accepted=30720 rejected=34816 domain_mismatch=0 bits_mismatch=0, with sequenced controls (0x3c00 accepted -> 0x3f800000; negative/zero/inf rejected). Disassembly of the shipped object confirms movi/slli/slli/add.n/wfr inside the group loop. Host gates rc=0, 19/19 byte-exact, fidelity 5.341e-05 identical - labelled as covering only the predicate, since the host compiles the asm off. Composed on bundle78 (asmemo+fusion, the acceptance stack) and lane launched with runner-asserted provenance. Accepted runtime unchanged at 5.3033.","timestamp":1790256708355,"segment":1,"confidence":19.4006779661017,"asi":{"candidate":"nf16v - five-instruction FP16 norm rebias in the shipping 2-bit kernel. NF16V (lut2_tie728.S:79, used once per row per group = 130,560 conversions per decode token) spent ten instructions splitting sign/exponent/mantissa with three extui, shifting each, and rejoining with two or. For a POSITIVE ORDINARY halfword the whole conversion is (h<<13) + 0x38000000, i.e. movi/slli/slli/add/wfr = five, because moving exponent and mantissa together with one shift and adding the bias difference (127-15=112) in the exponent field gives ((e+112)<<23)|(m<<13) = the value 2^(e-15)*1.m, exactly, since m<<13 cannot carry into the exponent and e+112 stays in 113..142.","eligibility":"the fast form is wrong for a NEGATIVE halfword (its sign bit lands in the exponent), so nd_lut2_asm_ok's norm walk - which already rejects exponent 0 and 31 and is the single place that decides asm-vs-C - now also rejects (h & 0x8000). Ineligible tensors fall back to the C walker, so the guard is a real gate and not a comment. Mentor's read-only census: all 351,744 norms in 46 CQ2 tensors are positive normal; the 44 hot projections account for 130,560/token.","evidence":["disassembly of the shipped object (esp32/build/.../lut2_tie728.S.obj, nd_lut2_rows_tie1n): 36a movi a10,112 / 36d slli a10,a10,23 / 370 slli a8,a8,13 / 373 add.n a8,a8,a10 / 375 wfr f4,a8 - five instructions inside the group loop, was ten.",".auto/exp80/test_rebias2.c calls the ACTUAL nd_lut2_asm_ok (pattern borrowed from .auto/exp77: include the candidate nd_quant.c with ND_LUT2_ASM=1, -ffunction-sections + -Wl,--gc-sections so the Xtensa walkers drop at link) on a one-row/one-group aligned fixture, substituting every one of 65,536 halfwords: accepted=30720 rejected=34816 domain_mismatch=0 bits_mismatch=0. It also checks the assembled-conversion arithmetic (fast5 == old10 == the true IEEE value) on the accepted domain. Controls sequenced deliberately: pos 0x3c00 accepted -> 0x3f800000, negative 0xbc00 rejected, zero rejected, inf rejected.","HOST gates on the tree: checks.sh rc=0, host_output_exact=19, host_golden_missing=0, fidelity max_delta 5.341e-05 identical, top1 10/10. Labelled honestly: the host compiles ND_LUT2_ASM off, so these goldens exercise only the predicate change and prove nothing about the kernel - which is why the real oracle is the device.","xtensa build rc=0 for the macro swap; the composed bundle78+nf16v file needed a dedent of `return 1;` after my insertion (the outer for has no braces, so an 8-space return became a second statement of the inner loop body -> -Werror=misleading-indentation on the device build only; host cc accepted it)."],"lane":"board 3, AUTO_GROUPS=primary, PROVENANCE tree=/root/board-pool/board3 engine_md5=9e50e13e3c8cfbffe19a152ab97b0c65 asserted by the runner (the earlier attempt was refused: main's measure.sh cd's into main, so the lane must invoke the WORKER's script - #410's absolute-path lesson again). Base for the delta is bundle78's 5.4533/5.4533/5.4567, not the accepted 5.3033, because the candidate is composed on the acceptance stack that would ship.","evidence_label_rule":"Mentor correction recorded: bench.py calls compare(results, golden) only after ALL groups, so a suite that stalls before then has done NO byte-exact comparison - absent DIVERGE lines and calls_ok=1 prove nothing about output equality. Any prior 'N/20 cases with zero divergences' phrasing in the ledger is therefore NOT a byte-exactness claim. A bounded AUTO_GROUPS=primary run does compare, and its verdict must be labelled 6/6, never 20/20 and never acceptance; the full unchanged 20-case session remains the shipping gate.","next_action_hint":"Read /root/board-pool/batches/M-nf16v-b3.log next window: primary decode vs 5.4533 plus device_output_exact over the six primary cases. Mentor's own ceiling for this lever is ~1.36 ms/token (~0.7 %) if all five saved instructions were actually exposed, and this family's measured realisation band is 25-70 %, so expect +0.2 to +0.5 %. If it is null, the conversion is not on the critical path and NF16V closes at the instruction count. b1 (actual-split screen, needs idf.py -C esp32 and an explicit flash of the diagnostic before capture) and b2 (bounded UART RX-loss discriminator: default polled 128-byte RX FIFO + 20 ms EOF sleep at 115200 vs the 232-byte long-route request burst) are still idle and need their own launches.","not_a_retry":"This is not run #231 (exponent-field insertion instead of the bitcast, which lost to the slow-memcpy baseline) and not #433's f16wfr (that changed C nd_f16 call sites, which are cold since head4 took the hot one). Neither touched this macro, which is the only conversion left in the hot 2-bit path."}}
{"run":450,"commit":"a2e8def","metric":5.3033,"metrics":{"boot_bench_tps":5.343,"device_output_exact":20,"device_token_delta":0,"ext_decode_tps":5.2269,"gen_tokens":99,"host_output_exact":19,"internal_free":13367,"logit_max_delta":0.00005341,"logit_top1_match":10,"min_case_tps":5.07,"prefill_tps":5.59,"psram_free":2052252,"think_tps":4.2},"status":"keep","description":"nf16v MEASURED +0.642 % on top of bundle78 (board 3): decode 5.4883 vs bundle78's 5.4533/5.4533/5.4567, prefill 5.795, boot_bench 5.531, min_case 5.23 (best worst case on record), gen_tokens 99, internal_free 12,103 unchanged, and a REAL bounded byte-exact comparison device_output_exact=6/6 with golden_missing=0 and token_delta 0 (AUTO_GROUPS=primary reaches bench.py's compare()). Mechanism: the shipping 2-bit kernel's per-row-group fp16 norm conversion was a ten-instruction macro (three extui + shifts + two or); for a positive ordinary halfword it is exactly (h<<13)+0x38000000 in five, and nd_lut2_asm_ok's cached per-tensor walk now also rejects a set sign bit so the fast form can never see a negative norm. ~90 % realisation of the measured instruction ceiling, consistent with an issue-bound kernel. Cross-board reading running on board 2 with the same tree md5; if it agrees, the stack is accepted+asmemo+fusion+nf16v = +3.5 % over 5.3033 and only the 20-case session (console-wedge defect) stands between it and the accepted pin. Accepted runtime unchanged at 5.3033.","timestamp":1790256903116,"segment":1,"confidence":19.296021577882687,"asi":{"b1_status":"the corrected actual-split screen (.auto/exp79/main_screen2.c + screen_b1.sh) built after two of my own defects were fixed: printf %u vs uint32_t (which is 'long unsigned int' on this target, so -Werror=format refused it - host cc would have accepted it, #415's class), and the first version's three invalidation bugs (idf.py needs -C esp32; esptool `run` only resets, so the diagnostic had to be flashed explicitly or the capture describes the old boot log; cycles->us is /240.0 not /240000). It is now flashed (bin_md5 a84b75499271) and capturing the boot window on the USB-JTAG leg, which is the only leg board 1 has.","evidence_label":"device_output_exact=6/6 with device_golden_missing=0 and token_delta 0 is a REAL byte-exact comparison because AUTO_GROUPS=primary makes bench.py reach compare() - labelled 6/6, not acceptance. device_output_exact_min is still 20 and the full-session gate is still owed; per run #449's correction, the earlier 'N/20 cases, zero divergences' phrasing was never a byte-exactness claim at all.","measurement":"nf16v (five-instruction positive-normal fp16 norm rebias in the shipping 2-bit kernel + the sign-bit rejection in nd_lut2_asm_ok) MEASURED on board 3, composed on bundle78 (asmemo + radix-4 fusion): decode 5.4883, prefill 5.795, boot_bench 5.531, min_case 5.23, gen_tokens 99, internal_free 12,103 (identical to bundle78, so the shorter macro costs no RAM), psram 2,052,252 unchanged.","next":"Cross-board reading is live on board 2 with the identical tree md5 (expect 9e50e13e3c8c asserted by the runner); it decides whether the +0.64 % is board-independent before anything is integrated. If it agrees, the shipping stack becomes bundle78 + nf16v = +3.5 % over the accepted 5.3033 and the outstanding blocker remains only the 20-case session (console-wedge defect), plus make capture and the owner packet. If nf16v had been null, the conclusion would have been that the norm conversion is off the critical path and NF16V closes at the instruction count - that alternative is not needed.","per_case":"sampling5 5.550 / timer60 5.550 / status_heap 5.470 / batch 5.580 / heldout_timer45 5.550 / route_translate 5.230 - the same token counts as the goldens in every case, so a pure speed verdict.","ratios":"vs bundle78's 5.4533 (board 2) / 5.4533 / 5.4567 (board 3): +0.642 %. vs the accepted 5.3033: the composed stack is +3.51 %. Realisation against the mentor's ceiling: five saved instructions x 130,560 norms/token, fully exposed with perfect two-core balance, is ~1.36 ms of a ~190 ms token (~0.7 %), so +0.64 % is ~90 % realisation - the highest this campaign has seen, consistent with a reduction in a kernel that is issue-bound (the 2-bit GEMV at IPC ~1.33) rather than a latency hiding act.","risk_note":"bit-exactness of the fast conversion is proven over all 65,536 encodings against the actual predicate (.auto/exp80/test_rebias2.c: accepted=30720 rejected=34816, domain and bits mismatch both 0, controls 0x3c00 accepted -> 0x3f800000 and negative/zero/inf rejected), and ineligible blobs fall back to the C walker, so a future archive with negative or subnormal norms degrades in speed only."}}
{"run":451,"commit":"7701635","metric":5.3033,"metrics":{"boot_bench_tps":5.343,"device_output_exact":20,"device_token_delta":0,"ext_decode_tps":5.2269,"gen_tokens":99,"host_output_exact":19,"internal_free":13367,"logit_max_delta":0.00005341,"logit_top1_match":10,"min_case_tps":5.07,"prefill_tps":5.59,"psram_free":2052252,"think_tps":4.2},"status":"keep","description":"The cross-core toll measured at last, and nf16v confirmed cross-board. (1) SPLIT SCREEN (board 1, boot-only capture on the USB-JTAG leg, .auto/exp79): one nd_parallel_rows split costs 3,973-4,603 cycles (16.6-19.2 us) and is flat in job size - hot peer 3,973 vs parked 4,428, so wake-from-park is only ~450 cycles and #344's '23 cycles' is definitively dead (kbench never reaches worker_start(), so it timed a serial indirect call). That single number reconciles tap96 (-0.069 % predicted vs -0.094 % measured for +8 splits) and bundle86 (+0.92 ms predicted vs +0.65 ms measured for -18 splits against a 135.8 us build), closing #447's '5x gap' without any inference. Rule recorded in .auto/ideas.md: a split pays only if the serial job exceeds ~2x the toll, which makes 'fewer, larger splits' - not more - the live direction. (2) nf16v CONFIRMED on two boards at 5.4883 with a real bounded byte-exact compare (device_output_exact=6/6, golden_missing=0, token_delta 0, internal_free 12,103 unchanged) = +0.642 % over bundle78, composed stack +3.51 % over the accepted 5.3033. (3) Three-instruction hoisted-constant follow-up (bias constant in a9, verified a9 has no loop writes in the object) built and running on board 3. Accepted runtime unchanged at 5.3033.","timestamp":1790257266504,"segment":1,"confidence":19.296021577882687,"asi":{"evidence_label":"device_output_exact=6 with golden_missing=0 and token_delta 0 on both boards is a REAL byte-exact comparison (AUTO_GROUPS=primary reaches bench.py's compare()); labelled 6/6, never 20/20. The unchanged 20-case session remains the shipping gate and is still blocked by the engine-independent console-wedge defect, not by any evidence about the candidate.","hoist_followup_launched":"the same conversion with the bias constant parked in a9 for the whole kernel (movi/slli once in the prologue) is three instructions per norm instead of five: slli/add.n/wfr. Verified safe from the object: a9's only writes in nd_lut2_rows_tie1n are the prologue's (l32i/s32i/mull-source/movi/slli at offsets 9..2d) and its only loop appearance is the add.n source at 373; W8D touches a10..a15 and the frame holds the table base and ngroup, so hoisting costs no liveness. Composed on bundle78+nf16v and running on board 3 with runner-asserted provenance engine_md5=78447908a1a7; delta base is nf16v's own 5.4883, and the honest prior is +0.2..0.3 % (two more instructions of the same measured per-instruction price), with null meaning the conversion family closes at three.","next":"Take the de-split candidates in the order written in .auto/ideas.md - zcsplit_rows' emit split first (it is predicted to be a pure loss today), then the structural one: carry build-then-rows as a single job so the toll is paid once per stage instead of once per projection. Do not re-run the historical rope/zcrms/per-head-norm split candidates for sign: they were measured against a wrong toll model, so a like-for-like base is a precondition.","split_screen":"THE REAL COST OF ONE nd_parallel_rows SPLIT, measured where the helper is genuinely rows_dual_core (app_main right after worker_start(), board 1, boot-only capture over the USB-JTAG leg, per-core slot counters proving participation c0=62568/c1=37752): empty body, hot peer, 4 units = 3,973 cycles (16.55 us); 128 units = 4,112; parked peer = 4,428 at every size; busy body 3,969 hot / 4,486-4,603 parked against 133-421 cycles of serial work. So the toll is a flat ~4,000 cycles / 16.6 us, nearly state-independent, and wake-from-park is worth only ~450 cycles. #344's 23 cycles is definitively dead (kbench never reaches worker_start(), so it timed a serial indirect call) and main.c's own ~15 us comment is vindicated.","reconciliation":"three previously unexplained field numbers now agree arithmetically with a 16.6 us toll: (1) tap96's -0.094 % for +8 splits predicted -0.069 %; (2) bundle86's -0.336 % for -18 splits: serialising a 135.8 us build costs +68 us each (+1.22 ms) minus 18 tolls saved (-0.30 ms) = predicted +0.92 ms vs measured +0.65 ms - #447's 5x unexplained gap disappears entirely; (3) the direction asymmetry (build split earns the toll, the 96-column tap unit did not) is now arithmetic rather than narrative.","nf16v":"cross-board CONFIRMED: board 2 primary decode 5.4883 with device_output_exact=6/6 golden_missing=0 token_delta 0, identical to board 3's 5.4883 from the same tree md5 (9e50e13e3c8c) - zero board spread. Against bundle78's 5.4533/5.4533/5.4567 that is +0.642 % from halving a ten-instruction fp16 norm conversion to five, and the composed stack (accepted + asmemo + radix-4 fusion + nf16v) is +3.51 % over the accepted 5.3033."}}
{"run":452,"commit":"bcdf070","metric":5.3033,"metrics":{"boot_bench_tps":5.343,"device_output_exact":20,"device_token_delta":0,"ext_decode_tps":5.2269,"gen_tokens":99,"host_output_exact":19,"internal_free":13367,"logit_max_delta":0.00005341,"logit_top1_match":10,"min_case_tps":5.07,"prefill_tps":5.59,"psram_free":2052252,"think_tps":4.2},"status":"keep","description":"Norm-conversion family CLOSED at five instructions, and the spin-assisted handshake launched. (1) The three-instruction hoisted-constant variant (bias constant parked in a9, a9 proven write-free inside the loop) measured decode 5.4883 on board 3 - exactly the five-instruction form's 5.4883 from two boards, a third identical reading - so the two further instructions are worth nothing: the win was getting off the ten-instruction split-and-rejoin shape, and the conversion is no longer on the critical path. Hoist reverted out of main (self-contained NF16V kept, sign rejection kept, reason recorded in the macro comment). (2) New candidate built on the measured 16.6 us toll from run #451: replace the semaphore round trip on the common path with two volatile DRAM counters (worker polls for a new sequence before blocking, caller polls for the completion number before waiting), semaphore retained for the sleeping case, stale tokens drained, and a sequence guard so a spurious wake cannot re-run a descriptor whose stack ctx is gone. Builds clean, host checks rc=0 with fidelity 5.341e-05 identical, running on board 2 (engine_md5=673795c43d37); prediction +0.3..1.1 % from 150+ splits per token. Accepted runtime unchanged at 5.3033.","timestamp":1790257684003,"segment":1,"confidence":19.296021577882687,"asi":{"candidate_in_flight":"SPIN-ASSISTED HANDSHAKE on bundle78+nf16v, board 2, runner-asserted engine_md5=673795c43d37. Two plain volatile DRAM counters (s_seq published after the payload with a compiler barrier, s_done_seq set after the job) replace the semaphore on the common path: the worker polls for a new sequence number for a bounded budget before it ever blocks, and the caller polls for the completion number before it waits. The semaphore is retained for the sleeping case, the worker still gives s_done after every job, and the caller drains any stale token before publishing so a binary semaphore can never be pre-accounted. A spurious wake is made harmless by the sequence guard, which matters because the descriptor is a single slot: re-running a job would read a stack ctx the caller has already returned from. Host checks rc=0, fidelity 5.341e-05 identical; the device run is the real test because the host's nd_parallel_rows is rows_serial. Prediction from the measured toll: 150+ splits per token x up to ~3,500 saved cycles = 0.5-2.2 ms, so anything from +0.3 % to +1.1 %; null means the 4,000 cycles is not the wake but the cross-core cache/IPI traffic of the give itself, in which case the scheduling family is closed on mechanism.","hazard_fixed_before_launch":"a spin-path job leaves the caller's always-posted s_go token pending, which would make the next blocking Take return immediately and re-run a stale descriptor whose ctx is a returned caller's stack - i.e. writes through a dead pointer. Fixed by draining s_go after a spin-path job AND guarding the blocked path with the sequence number, so a spurious wake does no work at all.","hoist_reverted":"main's lut2_tie728.S is back to the five-instruction self-contained NF16V (md5 now 4fb791fcbcb4); NF16VH, the a9 prologue pair and the use site are deleted, and the reason is written into the macro comment so nobody spends an address register on the last two instructions again. main still keeps the sign-bit rejection in nd_lut2_asm_ok, which the fast form requires for correctness.","hoist_result":"the three-instruction hoisted-constant form (bias 0x38000000 parked in a9 across the kernel, a9 verified to have no writes inside the row/group loop) measured decode 5.4883 on board 3 - EXACTLY the five-instruction form's number, which is also what board 2 read. Three identical readings, so this is a true null, not noise: cutting five instructions from the ten-instruction original bought +0.642 % and cutting two more buys nothing, i.e. the norm conversion is off the critical path once it is five. Family closed at NF16V; the hoist is reverted out of main rather than kept as free code.","next":"Read the spin reading against 5.4883 (same board 2 lineage). If it wins, the de-split candidates in .auto/ideas.md change sign - a cheaper toll makes fine splits viable again - so re-check them after, not before. If it is null, close the scheduling family on mechanism and turn to the remaining instruction-shape levers in the same class that produced nf16v.","third_identical_reading":"decode 5.4883 has now been produced three times from two boards and two different trees (nf16v on b3, nf16v on b2, nf16v+hoist on b3), which is more determinism than the 0.071 % three-identical-image spread of run #144 - a useful confirmation that sub-quantum candidates cannot be resolved by repetition alone."}}
