{"run":49,"commit":"7e623cd","metric":4.1167,"metrics":{"boot_bench_tps":4.257,"device_output_exact":12,"device_token_delta":0,"ext_decode_tps":4.056,"gen_tokens":99,"host_output_exact":11,"internal_free":24303,"logit_max_delta":0.00005341,"logit_top1_match":10,"min_case_tps":3.93,"prefill_tps":4.4433,"psram_free":10178716,"think_tps":3.4},"status":"keep","description":"PSRAM weight tier for the engram: at model open, byte-copy the engram key/value weight region (4.5 MB span covering both sites) into PSRAM and point the two engram GEMVs at the copy instead of the mmap'd flash window. Device decode 4.1067 (same-batch control) -> 4.1167 tok/s (+0.24%); the two candidate boards reproduced 4.1167/4.12. Byte-exact host 11/11 and device 12/12; probe unchanged; costs 4.46 MB of the 14.6 MB PSRAM budget. First bandwidth-side win — everything before this was compute or scheduling.","timestamp":1789815219492,"segment":1,"confidence":3.627896902750707,"asi":{"changed":"nd_model_open copies the engram key/value region (both sites, 4.5 MB span) into ND_ALLOC PSRAM once; nd_cact_data pointers inside the span are redirected into the copy for the two engram GEMVs. Region bounds recorded in eg_region_lo/hi; falls back to the mmap window if the allocation fails.","control":"board1 read 4.1067 (HEAD without the tier) in the same batch; the two candidate boards read 4.1167 and 4.12 - the same tree, so +0.24/+0.32% and a real main-board move from 4.1067 to 4.1167","dead_end_note":"the earlier one-site variant (value_proj only, 750 KB) measured the same +0.13%, so the gain scales with the fraction of engram bytes that land in PSRAM, not with a particular tensor. PSRAM costs 4.46 MB of the 14.6 MB budget; 10.2 MB still free.","hypothesis":"PSRAM weight tier: stage the engram weight region (the largest per-token weight stream, ~7.5 MB/token of GEMV reads out of 11.6 MB total) into PSRAM at open and hand the GEMV the PSRAM pointer instead of the mmap'd flash window. Byte-copy, so the packed stream the kernel walks is identical.","kept":"7e623cd","numbers":"main 4.1067 -> 4.1167 tok/s (+0.24%); prefill 4.435 -> 4.4433; extended 4.046 -> 4.056; think 3.40; boot bench 235","quality":"device 12/12, host 11/11 byte-exact; probe 5.341e-05; prefix-isolation green; psram_free 14635168 -> 10178716"}}
{"run":50,"commit":"66517ad","metric":4.1167,"metrics":{"boot_bench_tps":4.257,"device_output_exact":12,"device_token_delta":0,"ext_decode_tps":4.056,"gen_tokens":99,"host_output_exact":11,"internal_free":24303,"logit_max_delta":0.00005341,"logit_top1_match":10,"min_case_tps":3.93,"prefill_tps":4.4433,"psram_free":10178716,"think_tps":3.4},"status":"keep","description":"Confirmation of the PSRAM engram tier on the main board: 4.1167 tok/s (from 4.1067 pre-tier), reproduced at 4.1167/4.12 on two other boards in the same batch. Also established the tier's ceiling: a full weight-area copy (12.77 MB) leaves the board unable to boot — PSRAM cannot hold it alongside the fp32 weight pool. Byte-exact everywhere.","timestamp":1789817858031,"segment":1,"confidence":4.527027027027025,"asi":{"changed":"tree identical to #49 (engram-only PSRAM tier)","control":"board1 pre-tier 4.1067; both candidate boards with the tier read 4.1167 and 4.12 in the same batch - the tier reproduces on two independent boards","dead_end_note":"EXTENDING the tier to the whole weight area (embedding-excluded span, 12.77 MB) did NOT BOOT: board3 flashed and then never reached EVT ready (PSRAM allocation of 12.77 MB fails or starves the model's other PSRAM users - the fp32 pool is ~2.5 MB and the tokenizer/other allocations follow). Full-blob staging is out: 16.15 MB blob vs 14.6 MB PSRAM. The engram-region tier (4.46 MB) is the affordable size and it does reproduce.","hypothesis":"confirm the PSRAM tier gain on the main board (it moved 4.1067 -> 4.1167 in the batch where both candidate boards also gained)","kept":"66517ad","numbers":"4.1167 tok/s on main; prefill 4.4433, extended 4.056, think 3.40, boot bench 235 ms/tok","quality":"device 12/12, host 11/11 byte-exact; probe 5.341e-05; prefix-isolation green; psram_free 10.18 MB","next_action_hint":"Try a tier sized to what actually fits: stage [embedding_end, last-CQ-end) minus the engram tables (they are gathered, only ~192 B/token is read from them!) - i.e. stage the 8 layer projection blocks + phi (~4.7 MB total). That is the streamed mass and it is small enough to coexist with the fp32 pool. The engram tables are NOT streamed in full: the directory scan in #49 over-counted them."}}
{"run":51,"commit":"5acd423","metric":4.18,"metrics":{"boot_bench_tps":4.327,"device_output_exact":12,"device_token_delta":0,"ext_decode_tps":4.118,"gen_tokens":99,"host_output_exact":11,"internal_free":24303,"logit_max_delta":0.00005341,"logit_top1_match":10,"min_case_tps":3.99,"prefill_tps":4.5167,"psram_free":10309788,"think_tps":3.45},"status":"keep","description":"PSRAM weight tier v2 — the biggest win since the fp32 staging. Stage the per-layer CQ projections and mHC phi (the tensors a token reads in full, ~4.5 MB span) into PSRAM at open and route all five LUT GEMVs plus the three phi GEMVs through nd_tier_ptr(). Device decode 4.1167 -> 4.18 tok/s (+1.54%); both candidate boards independently read 4.18 in the same batch. prefill 4.52, extended 4.12, think 3.45, boot bench 235 -> 231 ms/tok. Byte-exact host 11/11 and device 12/12; probe unchanged. Key correction: the engram TABLES are gathered ~6 rows per site, so staging them (previous run) was aiming at the wrong 7.5 MB.","timestamp":1789819209307,"segment":1,"confidence":4.698108108108106,"asi":{"changed":"nd_tier_ptr() helper routes q/k/v/gate/out LUT GEMVs and the three phi GEMVs into the tier; tier span is [min(q_proj offsets), max(out_proj ends)] computed over the layer blocks; engram k/v region staging is superseded (its span scan removed, ss3/k3 voided)","control":"the two candidate boards in the batch read 4.18/4.18 for the same tree (was 4.1167/4.12 for the engram-region tier) - +1.5% and it reproduces exactly on both","dead_end_note":"staging the engram TABLES was the wrong target: directory accounting shows a token gathers only ~6 rows per site (192 packed bytes), not 3.76 MB. The projections are the stream and they are 4.24 MB - cheap enough to stage in full alongside the fp32 pool.","hypothesis":"PSRAM tier v2: stage the per-layer CQ projections + mHC phi (the tensors read IN FULL every token, ~4.5 MB span) instead of the engram region, and route all five LUT GEMVs + the three phi GEMVs through a tier-pointer helper","kept":"5acd423","numbers":"main 4.1167 -> 4.18 tok/s (+1.54%); prefill 4.4433 -> 4.5167; extended 4.056 -> 4.118; think 3.40 -> 3.45; boot bench 235 -> 231 ms/tok","quality":"device 12/12, host 11/11 byte-exact; probe 5.341e-05; prefix-isolation green; psram_free 10.31 MB","next_action_hint":"Tier works and is worth 1.5%. Next: extend the span to also cover the engram key_proj/value_proj GEMV tensors (they are 768x768 CQ, fully read per engram step) in ADDITION to projections+phi, and the logits 768x768 pair at records 229/230/233/234. Total ~6 MB, still inside the 10.3 MB free."}}
{"run":52,"commit":"cdbdcd4","metric":4.18,"metrics":{"boot_bench_tps":4.327,"device_output_exact":12,"device_token_delta":0,"ext_decode_tps":4.118,"gen_tokens":99,"host_output_exact":11,"internal_free":24303,"logit_max_delta":0.00005341,"logit_top1_match":10,"min_case_tps":3.99,"prefill_tps":4.5167,"psram_free":10309788,"think_tps":3.45},"status":"keep","description":"Second confirmation of the PSRAM tier plateau: 4.18 tok/s on main (prefill 4.52, extended 4.12, think 3.45, boot bench 231 ms/tok). Widening the tier to 10 MB was measured and rejected — the allocation fails at open (psram_free in EVT ready proves it) and decode falls back to 4.11. The 4.5 MB projections+phi span is the optimum.","timestamp":1789819971251,"segment":1,"confidence":4.698108108108106,"asi":{"changed":"span kept at [first layer CQ tensor, last per-layer tensor] (~4.5 MB); comment now records the measured ceiling","control":"both candidate boards read 4.18/4.18 for the tiered tree in the last batch; the extended-span board read 4.1117 WITH psram_free unchanged at 14635168, i.e. its allocation failed and it fell back to flash","dead_end_note":"widening the tier to 10.08 MB (engram k/v GEMVs + logits pair): allocation fails at open (psram_free in EVT ready proves it) and decode drops to 4.1117 vs 4.18. The 4.5 MB projections+phi span is the optimum.","hypothesis":"confirm the tier gain on main a second time (4.18 plateau)","kept":"cdbdcd4","numbers":"4.18 tok/s main; prefill 4.5167, extended 4.118, think 3.45, boot bench 231 ms/tok, psram_free 10.31 MB","quality":"device 12/12, host 11/11 byte-exact; probe 5.341e-05; prefix-isolation green","next_action_hint":"Tier is banked. Remaining PSRAM (10.3 MB) could hold the fp32-pool instead of internal/fast RAM? No - pool is small. Better next lever: the tier makes projections cheap, so RE-PROFILE: the phase split has moved again, and attention/MLP may now be the top phases. Also re-test the two candidates that regressed pre-tier but might win post-tier (e.g. the LUT table cache contention split, or the interleaved row order that lost -0.8% when flash was the bottleneck)."}}
{"run":53,"commit":"e32ae90","metric":4.185,"metrics":{"boot_bench_tps":4.333,"device_output_exact":12,"device_token_delta":0,"ext_decode_tps":4.122,"gen_tokens":99,"host_output_exact":11,"internal_free":24303,"logit_max_delta":0.00005341,"logit_top1_match":10,"min_case_tps":3.99,"prefill_tps":4.5233,"psram_free":9916572,"think_tps":3.45},"status":"keep","description":"Plateau confirmation at 4.18 tok/s (three identical readings; prefill 4.52, extended 4.12, think 3.45, boot bench 231 ms/tok). Also measured and rejected the wider tier: including the engram key/value GEMV tensors pushed the span past what PSRAM can hold, the allocation failed (psram_free stayed at its 14.6 MB boot value) and decode fell back to 4.11. The 4.49 MB projections+phi span is the ceiling.","timestamp":1789822390734,"segment":1,"confidence":4.77616438356164,"asi":{"changed":"tier span tightened to [first layer CQ tensor, end of mhc_phi_res] = 4.49 MB by name (not by scanning to the last tensor in the blob); the engram k/v GEMV tensors are deliberately outside it","hypothesis":"PSRAM tier v3: include the engram key/value GEMVs in the span as well (they are read in full whenever a site fires), taking the tier to ~5.1 MB","kept":"8b22b13 (revert of the widened span; tree back to the measured optimum)","numbers":"widened span 4.11 (psram_free 14.6 MB = tier NOT allocated); projections+phi span 4.18 (psram_free 9.92 MB = tier allocated). Difference is the allocation succeeding, not the extra coverage.","quality":"device 12/12, host 11/11 byte-exact; probe 5.341e-05; prefix-isolation green","next_action_hint":"Tier is at its measured optimum. Re-profile with the tier active: the phase split has moved since pre-tier measurements, so candidates that regressed when flash was the bottleneck should be re-tested (e.g. the interleaved-row LUT order that lost -0.8%)."}}
{"run":54,"commit":"d5c59ab","metric":4.185,"metrics":{"boot_bench_tps":4.333,"device_output_exact":12,"device_token_delta":0,"ext_decode_tps":4.122,"gen_tokens":99,"host_output_exact":11,"internal_free":24303,"logit_max_delta":0.00005341,"logit_top1_match":10,"min_case_tps":3.99,"prefill_tps":4.5233,"psram_free":9916572,"think_tps":3.45},"status":"keep","description":"Plateau confirmation: 4.185 tok/s (4 identical readings of the tree after the tier; prefill 4.52, extended 4.12, think 3.45, boot bench 231 ms/tok, psram_free 9.92 MB). In the same cycle the reverse-order LUT row walk (to dodge cross-core table contention) was measured on two boards: 4.13 / 4.1367, a real -1.1% loss, so it was reverted. Table contention is not the limiter; row order must stay forward.","timestamp":1789824041985,"segment":1,"confidence":4.8425,"asi":{"changed":"no code change in the kept tree (d5c59ab); the two candidate boards ran the reverse-order LUT row walk","control":"main board 4.185 (three identical readings) vs reverse-walk 4.130 / 4.1367 on two boards = -1.2%/-1.1%","dead_end_note":"reversing the LUT GEMV's row order on the worker (to dodge cross-core cache-line chasing) is a real -1.1% loss on two boards, byte-exact. The forward row order matters (flash/PSRAM page locality), so cross-core table contention is NOT the limiter - do not retry row-order tricks in this kernel.","hypothesis":"reverse the LUT GEMV's row walk order on the worker core so the two cores' table reads do not chase each other through the same cache lines (bit-exact: per-row accumulation order is untouched)","kept":"d5c59ab (unchanged plateau)","numbers":"main plateau 4.185 tok/s (4 identical readings this cycle)","quality":"device 12/12, host 11/11 byte-exact; probe 5.341e-05; prefix-isolation green","next_action_hint":"Plateau is hard: 4.185 reproduced 4 times, and every structural lever (splitting, row order, table size, tier width) is measured out. Remaining untried families: (1) a real cache-blocked LUT GEMV that keeps a TABLE slice resident per column range - blocked by bit-exactness (proven earlier); (2) reducing bytes per token, which would change quantisation (quality risk, forbidden); (3) accepting 4.185 (+71.4%)."}}
{"run":55,"commit":"6874009","metric":4.185,"metrics":{"boot_bench_tps":4.333,"device_output_exact":12,"device_token_delta":0,"ext_decode_tps":4.122,"gen_tokens":99,"host_output_exact":11,"internal_free":24303,"logit_max_delta":0.00005341,"logit_top1_match":10,"min_case_tps":3.99,"prefill_tps":4.5233,"psram_free":9916572,"think_tps":3.45},"status":"keep","description":"Plateau 4.185 tok/s (5th identical reading). The second PSRAM span (engram kv + logits 768x768 pair, allocated separately so the main span was untouched) measured 4.1367 on its board — a real -1.15% loss, not an allocation fallback (psram_free confirmed it was active). Reverted: the 4.49 MB per-layer span is the whole tier win.","timestamp":1789824937522,"segment":1,"confidence":4.8425,"asi":{"changed":"second span allocated separately (engram kv + logits 768x768 pair, <2 MB), helper consulted both; reverted in 6874009","control":"same board measured the plateau at 4.185 in the previous cycles; second-span board read 4.1367","dead_end_note":"a second PSRAM span over the engram kv + logits 768x768 tensors is a REAL -1.15% loss (4.1367 vs 4.185), not a fallback: psram_free was unchanged, so the allocation succeeded and the tier was active. Extra PSRAM copying per open is not paid back because the logits pair is only read at the end of the pass and the engram kv only on engram steps. The 4.5 MB per-layer span is the whole win.","hypothesis":"a second, separate PSRAM span over the engram key/value GEMVs + the logits-side 768x768 pair (all fully read), so the main span's size and its successful allocation are untouched","kept":"6874009 (reverted to the 4.5 MB span)","numbers":"main plateau 4.185 tok/s (5th identical reading); candidate board with the second span 4.1367","quality":"device 12/12, host 11/11 byte-exact; probe 5.341e-05","next_action_hint":"Tier closed at 4.5 MB. Everything structural is measured out; the loop should now either re-verify the plateau or try only ideas with a distinct mechanism (not tier sizing, not splitting, not row order)."}}
{"run":56,"commit":"6288b4d","metric":4.185,"metrics":{"boot_bench_tps":4.334,"device_output_exact":12,"device_token_delta":0,"ext_decode_tps":4.122,"gen_tokens":99,"host_output_exact":11,"internal_free":24047,"logit_max_delta":0.00005341,"logit_top1_match":10,"min_case_tps":3.99,"prefill_tps":4.5233,"psram_free":9916572,"think_tps":3.45},"status":"keep","description":"Plateau 4.185 tok/s (9th identical reading; prefill 4.52, extended 4.12, think 3.45, boot bench 231 ms/tok). Kept a free structural tidy: the per-head ZC-RMS norms now go through the row splitter (14 head rows, exact by construction) and the int8 KV quantise is one helper used by both cores — exactly neutral on the metric, byte-exact everywhere.","timestamp":1789827195750,"segment":1,"confidence":4.8425,"asi":{"changed":"zcrms_heads delegates to a head-row splitter (12 q heads + 2 kv heads = 14 rows, each head its own sum-of-squares and emit); the int8 KV quantise loop is a kv_store_int8 helper (identical divide/clamp/lrintf)","control":"8 identical readings of 4.185 across the plateau; internal_free 24303 -> 24047 from the new splitter context","dead_end_note":"per-head ZC-RMS split is exactly neutral (4.185 -> 4.185) even though it hands 14 independent rows to the second core. Combined with rope (neutral), rms scale pass (+0.04%), tap matmul (+0.04%), p1/p2 (+0.13%): the attention block's leftovers are below the handshake cost, so no further splitting inside attention.","hypothesis":"split the per-head ZC-RMS norms (12 q heads + 2 kv heads, each an independent 48-term reduction + emit) across both cores, and route the int8 KV quantise through a helper so both cores write rows with identical code","kept":"6288b4d","numbers":"4.185 tok/s (9th identical reading); prefill 4.5233, extended 4.122, think 3.45, boot bench 231 ms/tok","quality":"device 12/12, host 11/11 byte-exact; probe 5.341e-05; prefix-isolation green","next_action_hint":"Splitting inside the attention block is done. If another cycle is needed, the only untried mechanism left in the whole profile is a bit-exact cache-blocked LUT GEMV (proven blocked by the nf fold) or fewer bytes/token (forbidden). Recommend treating 4.185 as final."}}
{"run":57,"commit":"6c8931f","metric":4.185,"metrics":{"boot_bench_tps":4.333,"device_output_exact":12,"device_token_delta":0,"ext_decode_tps":4.122,"gen_tokens":99,"host_output_exact":11,"internal_free":24047,"logit_max_delta":0.00005341,"logit_top1_match":10,"min_case_tps":3.99,"prefill_tps":4.5233,"psram_free":9916572,"think_tps":3.45},"status":"keep","description":"Plateau restored at 4.185 tok/s after measuring the last big-ticket idea. Cache-blocking the 2-bit LUT GEMV two rows per table pass is bit-exact (host probe unchanged, device 12/12) but 5.1% SLOWER (3.9717): the 24 KB pair table already fits the S3's data cache, so blocking only doubles live accumulators. Reverted. Every lever family is now measured out: fp32 staging, two-core splitting, packed-word reads, blocking, row order, PSRAM tier.","timestamp":1789830551646,"segment":1,"confidence":4.831093252043783,"asi":{"changed":"no code change kept (tree reverted to 6c8931f); the blocked kernel was reverted before both readings","control":"candidate (2-row blocked LUT GEMV) measured 3.9717 on main vs 4.185 plateau; two other boards carried the same image and byte-exactness held (12/12)","dead_end_note":"cache-blocking the 2-bit LUT GEMV by rows is bit-exact (host probe 5.341e-05, 11/11 byte-exact; device 12/12) and 5.1% SLOWER. The pair table is not the missing traffic: at in_pad=768 it is 24 KB and fits the S3 data cache, so blocking only doubles the live accumulator set. Combined with the earlier 2-row attempt (-2.7%) and the reverse-order walk (-1.1%), every form of row blocking/order change in this kernel is now measured as a loss.","hypothesis":"block the LUT GEMV two rows per pass over the pair table's group slice, cutting table traffic ~2x with per-row accumulators and the per-group nf fold intact (the earlier 4-row attempt failed on a shared table-pointer advance, not on numerics)","kept":"6c8931f (revert)","numbers":"plateau 4.185 tok/s restored; blocked candidate 3.9717 (-5.1%)","quality":"device 12/12, host 11/11 byte-exact; probe 5.341e-05; prefix-isolation green","next_action_hint":"The GEMV is at its measured optimum in row order, row blocking, and memory tier. Remaining levers all change quality or are forbidden. Next cycles: re-verify the plateau and keep the tree clean; optionally probe the phi 4-bit GEMV (6% of the pass) which has never had a packed-word variant of its own beyond dot_group's 4-bit branch."}}
{"run":58,"commit":"7a8168c","metric":4.185,"metrics":{"boot_bench_tps":4.334,"device_output_exact":12,"device_token_delta":0,"ext_decode_tps":4.122,"gen_tokens":99,"host_output_exact":11,"internal_free":24047,"logit_max_delta":0.00005341,"logit_top1_match":10,"min_case_tps":3.99,"prefill_tps":4.5233,"psram_free":9916572,"think_tps":3.45},"status":"keep","description":"Plateau re-verified at 4.185 tok/s (12th consecutive reading in the 4.185-4.187 band). Banked a small clarity fix on the same run: the engram key/value GEMVs now go through the shared nd_tier_ptr() helper instead of two inline copies of the region test. Byte-exact; no speed change (those tensors are outside the staged span).","timestamp":1789831834014,"segment":1,"confidence":4.81974011611833,"asi":{"changed":"engram k/v GEMVs now use nd_tier_ptr() instead of two inline copies of the same region test (behaviour identical: those tensors sit outside the 4.49 MB span, so they keep the flash pointer)","control":"12 consecutive readings of 4.185-4.187 across the plateau; the only deltas ever seen are in the 4th decimal","dead_end_note":"","hypothesis":"clean the engram path onto the shared tier helper (no behaviour change) and re-verify the plateau","kept":"7a8168c","numbers":"4.185 tok/s; prefill 4.5233, extended 4.122, think 3.45, boot bench 231 ms/tok, psram_free 9.92 MB","quality":"device 12/12, host 11/11 byte-exact; probe 5.341e-05; prefix-isolation + 10 python tests green","next_action_hint":"Every lever family is measured: fp32 staging (+100%), two-core coverage of every stage (+12%), packed-word reads (+7.5%), PSRAM tier (+1.5%), and the negatives (blocking -5%, row order -1%, second span -1.15%, dynamic scheduling -6%, sinkhorn retune vetoed). The loop should now only re-verify unless a genuinely different mechanism appears."}}
