{"run":484,"commit":"72586e7","metric":5.3033,"metrics":{"boot_bench_tps":5.343,"device_output_exact":20,"device_token_delta":0,"ext_decode_tps":5.2269,"gen_tokens":99,"host_output_exact":19,"internal_free":13367,"logit_max_delta":0.00005341,"logit_top1_match":10,"min_case_tps":5.07,"prefill_tps":5.59,"psram_free":2052252,"think_tps":4.2},"status":"keep","description":"Two-core heartbeat discriminator built and launched to separate the two surviving stall mechanisms that #483 left open: identical heartbeat tasks pinned to core 1 and core 0 at equal priority, each printing its own core id (EVT hb0/hb1). Rationale recorded: #483's single core-1 heartbeat could not distinguish a stuck console write path from core-1 starvation, because the shipped spin handshake (#453) lets the splitter worker outrank a priority-3 task on that core - so a dead hb1 with a living hb0 means core 1 is stuck (which would make the spin handshake itself the suspect), while both dying together means the stdout write path is stuck and the fix is a bounded or deferred emit rather than per-event fflush. Caveat disclosed before reading: the tasks share one counter, so the printed value is the sum of both tasks' ticks and is not a per-core uptime - which tag stops appearing is the evidence. Runner-asserted provenance 72586e7b014d, build 15 s. No measurement read; diagnostic image; accepted runtime unchanged at 5.3033.","timestamp":1790262392344,"segment":1,"confidence":17.523576240048943,"asi":{"changed_assumption":"One heartbeat on core 1 could not separate the write path from core-1 starvation because the shipped spin handshake of run 453 lets the splitter worker outrank it; two heartbeats on different cores can separate them in one boot.","hypothesis":"If the core-1 heartbeat dies while the core-0 heartbeat keeps printing, core 1 is starved or stuck and the console works; if both die together, the stdout write path itself is stuck.","measurement":"None yet - launched minutes ago, runner-asserted provenance 72586e7b014d, build 15 s, build then flash then the roughly five-minute priming precede the first case. The stall historically lands at 16-17 cases, roughly fifteen minutes after priming.","instrument_caveat":"Both tasks increment the one shared counter, so the printed number is the sum of both tasks' ticks and is not a per-core uptime - the value that matters is which tag stops appearing, not what the number reads.","next":"Read the tail around the stall for hb0 versus hb1. If hb0 survives and hb1 dies, the owner fix is in the splitter or its spin budget, and the spin handshake itself is suspect; if both stop with the last EVT done, the fix is a bounded or deferred console emit instead of per-event fflush. Diagnostic image - never a speed claim; pin unchanged at 5.3033."}}
{"run":485,"commit":"72586e7","metric":5.3033,"metrics":{"boot_bench_tps":5.343,"device_output_exact":20,"device_token_delta":0,"ext_decode_tps":5.2269,"gen_tokens":99,"host_output_exact":19,"internal_free":13367,"logit_max_delta":0.00005341,"logit_top1_match":10,"min_case_tps":5.07,"prefill_tps":5.59,"psram_free":2052252,"think_tps":4.2},"status":"keep","description":"The two-core heartbeat discriminator settled the mechanism question #483 left open: the session stalled at 16/20 cases (LANE_RC=1), and the LAST hb1 (core 1) line sits AFTER the last completed case while hb0 (core 0) had also gone quiet — i.e. both cores' heartbeats stop with the emission, so core-1 starvation by the spin handshake is excluded and the stdout write path is the sole remaining suspect. Counts: 40 hb0 and 52 hb1 lines, last hb0 at log line 224, last case at 234, last hb1 at 236, nothing after. That makes the owner-facing fix a bounded or deferred console emit (dedicated console task with a bounded queue, drop when full, or no per-event fflush), not the line reader and not the spin handshake. Diagnostic image — no speed claim; accepted runtime unchanged at 5.3033; the 20-case gate remains blocked by this firmware defect.","timestamp":1790263328083,"segment":1,"confidence":17.523576240048943,"asi":{"conclusion":"Both cores' heartbeats die with the emission, so core-1 starvation is excluded and the stdout write path is the sole remaining suspect. Owner-facing fix direction: bound or defer console emission (a dedicated console task with a bounded queue and drop-if-full, or no per-event fflush), not a change to the line reader and not a change to the spin handshake.","caveat":"Line positions are coarse timing: hb1 continued two lines past the last case and then all emission stopped, so the write path died essentially with the last request rather than the core-1 task dying first. hb0's lower count is expected starvation by inference on core 0, and it is the tag's continued appearance that matters, not the shared counter value.","hypothesis":"Do both heartbeats die together (write path) or only the core-1 one (core-1 starvation)?"}}
{"run":486,"commit":"e3f9a1c","metric":5.3033,"metrics":{"boot_bench_tps":5.343,"device_output_exact":20,"device_token_delta":0,"ext_decode_tps":5.2269,"gen_tokens":99,"host_output_exact":19,"internal_free":13367,"logit_max_delta":0.00005341,"logit_top1_match":10,"min_case_tps":5.07,"prefill_tps":5.59,"psram_free":2052252,"think_tps":4.2},"status":"keep","description":"Consolidated the stall investigation into the two durable places rather than leaving it in the log: .auto/OWNER_ACCEPTANCE_PACKET.md now states the localized mechanism (#483-#485: both cores' heartbeats stop with the last emission, so the reader/host theory and core-1 spin starvation are both excluded and the stdout write path is the remaining suspect), the limits of the evidence (a whole-app block cannot be separated from a console-local block without an out-of-band channel, because every observation route uses the same console), and the ask - fix the emit path then re-run the 20-case gate, because 20 requests do not fit in one boot and AUTO_HARD_RESET invalidates the two state-dependent cases (#474, run #391). Added exp87 to the backlog: print a heartbeat through the USB-Serial-JTAG secondary console with esp_rom_printf to get that out-of-band view, reusing run #451's working JTAG harvest. Also reverted the diagnostic main.c out of board 2's checkout (grep confirms zero heartbeat lines) so no later lane inherits the instrument. No measurement this window; accepted runtime unchanged at 5.3033.","timestamp":1790263415071,"segment":1,"confidence":17.523576240048943,"asi":{"changed_assumption":"None; consolidation plus the next discriminator, no measurement.","hypothesis":"Is the fault local to the primary console write path, or is the whole app blocked? An out-of-band console answers it: configure the USB-Serial-JTAG secondary console and print a heartbeat through esp_rom_printf, which bypasses the newlib/VFS stdout path the harness reads. If that leg keeps printing while the primary console is dead, the fix is a bounded or deferred emit; if both legs die together the whole app is blocked, which reopens the spin-handshake question with real evidence.","next":"Build exp87: secondary console in sdkconfig plus a rom-printf heartbeat, harvest the JTAG leg across the stall (the boot-only capture route from run 451 already works). Note the diagnostic main.c was reverted out of board 2 so no lane can inherit it.","what_was_recorded":"The owner packet now carries the localized mechanism and the concrete fix ask, and ideas.md carries exp87. Nothing was inferred beyond what the heartbeat lines show."}}
{"run":487,"commit":"9259d58","metric":5.3033,"metrics":{"boot_bench_tps":5.343,"device_output_exact":20,"device_token_delta":0,"ext_decode_tps":5.2269,"gen_tokens":99,"host_output_exact":19,"internal_free":13367,"logit_max_delta":0.00005341,"logit_top1_match":10,"min_case_tps":5.07,"prefill_tps":5.59,"psram_free":2052252,"think_tps":4.2},"status":"keep","description":"exp87 out-of-band console discriminator built and launched on board 2 (provenance 9259d580bc5b, build 20 s): two heartbeat tasks (cores 0 and 1) printing through esp_rom_printf on the newly enabled USB-Serial-JTAG secondary console, which bypasses the newlib/VFS stdout path that #483-#485 localized the stall to. The instrument is confirmed live — ROMB lines already appear interleaved with harness case output — so the pending measurement is whether ROMB survives the stall while the primary console emission is dead (console-local fault, fix = bounded/deferred emit) or dies with it (whole-app block, which would reopen the spin-handshake question with real evidence). Diagnostic-only changes confined to the worker: sdkconfig.defaults gained the secondary-console key and its generated sdkconfig was deleted to regenerate; that must not be merged into main. No speed claim from a diagnostic image; accepted runtime unchanged at 5.3033.","timestamp":1790263610965,"segment":1,"confidence":17.523576240048943,"asi":{"changed_assumption":"The out-of-band route now exists: esp_rom_printf on the USB-Serial-JTAG secondary console bypasses newlib/VFS stdout, and ROMB lines are already visible in the harvest, so the two paths can finally be compared during a stall.","hypothesis":"exp87: is the stall local to the primary console write path or is the whole app blocked? A rom-printf heartbeat on the secondary USB-Serial-JTAG console is independent of the newlib/VFS stdout path that died in 483-485. If ROMB keeps printing while the primary emission is dead, the console write path is the fault and the fix is a bounded or deferred emit; if ROMB stops too, the whole app is blocked, which reopens the spin-handshake question with evidence.","instrument_status":"Live: build 20 s, runner-asserted provenance 9259d580bc5b, and ROMB hb0 lines already interleaved with harness case output (hb0 460 at read time). Two tasks, cores 0 and 1, each with its own counter, tagged by core id.","next":"Read the tail at the stall (16-17 cases historically): whether ROMB lines continue past the last EVT done. Caveat to quote when reading: the ROMB cadence is every 10th 200 ms tick per task, and both tasks print, so count lines per tag rather than reading the number as uptime. Diagnostic image - never a speed claim.","sdkconfig_note":"board2's sdkconfig.defaults gained CONFIG_ESP_CONSOLE_SECONDARY_USB_SERIAL_JTAG=y and its generated sdkconfig was deleted to regenerate; that is diagnostic-only on the worker and must not be merged into main."}}
{"run":488,"commit":"0bb3edb","metric":5.3033,"metrics":{"boot_bench_tps":5.343,"device_output_exact":20,"device_token_delta":0,"ext_decode_tps":5.2269,"gen_tokens":99,"host_output_exact":19,"internal_free":13367,"logit_max_delta":0.00005341,"logit_top1_match":10,"min_case_tps":5.07,"prefill_tps":5.59,"psram_free":2052252,"think_tps":4.2},"status":"keep","description":"Retraction plus two real candidates launched. (1) The #483-#487 stdout conclusion is VOID: tools/serial_api.py reads every inference response with _line_quiet() (sets _log_open false, _line prints only when true), so heartbeat and ROMB lines are consumed unlogged DURING every request by design - their absence in a timed-out case proves nothing about the tasks, cannot exclude RX, and does not isolate the write path. Timeouts stand; the causal claim is withdrawn. (2) New leading hypothesis, arithmetic-backed: polled VFS RX is a 128-byte FIFO with a 20 ms EOF sleep (~230 B admitted), frozen cases 1-16 are all <= 89 B and case 17 is the FIRST request over 128 B (232) - exactly the 16-17 ceiling. Labelled a strong hypothesis pending received-byte evidence or a lossless-RX comparison. (3) Lanes: board 3 runs the task-notification + sequence-predicate handshake (provenance 210060e0ef2c, build 14 s) against the spin stack's 5.560/5.5617; board 2 runs a lossless RX ring (ISR-fed 1 KiB UART driver + esp_vfs_dev_uart_use_driver, MAIN_REQUIRES += esp_driver_uart, provenance 9b7a86c32e42, build 20 s) on the PRE-notification stack with the full 20-case suite, so it doubles as the gate. (4) Code review caught a real bug in my own candidate: pdMS_TO_TICKS(5) is zero ticks at 100 Hz, i.e. a busy-poll masquerading as a wait; now portMAX_DELAY with the predicate as the only release condition. b1's fused-projection screen remains unlaunched. Accepted runtime unchanged at 5.3033.","timestamp":1790264457273,"segment":1,"confidence":17.523576240048943,"asi":{"hypothesis":"The stall is RX-side, not TX-side: the polled console VFS keeps a 128-byte FIFO and getchar sleeps 20 ms on EOF, so at 115200 8N1 a request longer than the FIFO loses characters, no newline ever arrives, and the reader waits forever. Cases 1-16 of the frozen suite are all <= 89 bytes and case 17 is the FIRST over 128 (232), which is the observed 16-17 ceiling. Strong hypothesis, not yet proven: it needs received-byte evidence or a lossless-RX comparison.","two_lanes_launched":"b3 notifications plus sequence predicate, provenance 210060e0ef2c, compiled in 14 s, base for comparison is the spin stack's own 5.560/5.5617 readings. b2 lossless RX ring (ISR-fed 1 KiB UART driver plus esp_vfs_dev_uart_use_driver) on the pre-notification stack, provenance 9b7a86c32e42, compiled in 20 s after adding esp_driver_uart to MAIN_REQUIRES; it runs the full 20-case suite, so it doubles as the gate if the stall is gone. b1 is the remaining lane and is not launched yet.","retracted":"Mentor read the host reader and it voids my causal story: tools/serial_api.py reads every inference response with _line_quiet(), which sets _log_open false, so hb and ROMB lines are consumed without being logged DURING every request. The absence of heartbeat lines in a timed-out case therefore shows nothing about whether the tasks lived, and exp87's lane log has the same blind spot. The timeout observations themselves stand; the stdout-write-path conclusion is withdrawn, and no RX exclusion stands either.","review_caught":"My first predicate loop used ulTaskNotifyTake(pdTRUE, pdMS_TO_TICKS(5)), which is ZERO ticks at the resolved 100 Hz tick - a tight busy-poll dressed as a wait. Now portMAX_DELAY, which is safe because notifications retain a pending count and the predicate, not the wake, decides release.","next":"Read M-ntf-b3 primary versus the 5.560/5.5617 spin base and M-rx-b2 for case 17 and beyond. If b2 clears 20/20 the gate finally exists, the acceptance stack can be re-pinned, and the RX diagnosis is supported by a controlled lossless comparison; if it still stalls at 17, the hypothesis weakens and received-byte counting becomes the required next measurement."}}
{"run":489,"commit":"210060e","metric":5.5517,"metrics":{"boot_bench_tps":5.601,"device_output_exact":6,"device_token_delta":0,"ext_decode_tps":5.2269,"gen_tokens":99,"host_output_exact":19,"internal_free":12519,"logit_max_delta":0.00005341,"logit_top1_match":10,"min_case_tps":5.29,"prefill_tps":5.8667,"psram_free":2052252,"think_tps":4.2},"status":"discard","description":"Task-notification + sequence-predicate handshake (b3, board 3, provenance 210060e0ef2c) MEASURED -0.180 %: decode 5.5517 against the spin stack's 5.5617/5.560, 6/6 primary byte-exact, golden_missing 0, token_delta 0, LANE_RC=0, internal_free 12,519 (+424 B by deleting both semaphore objects). Not a speed keep; per the mentor's attribution rule the notification gain cannot be claimed from a combined candidate, so the predicate-only semaphore variant is queued next on b3 to separate the real correctness fix (completion = sequence predicate rechecked after every wake, killing the delayed-give-satisfies-j+1 race) from the signaling swap. Hygiene: archived b3's stale .auto/diag_repeat_ok so the anti-repeat guard is armed again, and restored board 1's worker main.c which still carried 47 uncommitted diagnostic lines - disclosed that b1's just-launched kbench image (engine_md5 3569f289b70a) was built with them present, which does not touch the kbench hook that runs before app_main but means the clean-tree reading is the next one. b2 (lossless RX ring) is past its primary group heading for case 17. Accepted runtime unchanged at 5.3033.","timestamp":1790264613081,"segment":1,"confidence":17.523576240048943,"asi":{"b1_b2_state":"b1 lane engine_md5 3569f289b70a was built from a worker main.c carrying 47 uncommitted diagnostic lines (a leftover heartbeat), which I have now restored to HEAD; the kbench hook runs before app_main so the heartbeat task never starts, but the clean tree is what the next b1 reading comes from. b2 passed its primary group, 6 cases, and continues toward case 17, the first request larger than the polled 128-byte FIFO. b3's stale diag_repeat_ok marker is archived out of the worker so the anti-repeat guard is armed for its next run.","changed_assumption":"Mentor showed the spin handshake still executes semaphore give/take on every job, so replacing them with notifications plus a completion predicate was a real candidate, not a null by construction.","combined_candidate_result":"5.5517 versus the spin base 5.5617 = -0.180 percent, 6 of 6 primary byte-exact, missing=0, token_delta 0, LANE_RC=0, internal_free 12,519 (+424 B from dropping two semaphore objects).","hypothesis":"Replace the spin handshake's per-job semaphore give/take with task notifications and make completion a sequence predicate rechecked after every wake, removing the late-completion race where a delayed give for job j satisfies job j+1 and releases a caller whose stack ctx is gone.","interpretation":"The combined candidate is not a speed win, and the mentor's attribution rule applies: the notification gain cannot be claimed from it. The sequence predicate is still a real correctness property - my own first version had a bug code review caught, pdMS_TO_TICKS(5) is zero ticks at the resolved 100 Hz tick and turned the fallback into a busy-poll - and the +424 B is a free tradeoff. Next lane on this board is a predicate-only change on the semaphore base, which separates the safety fix from the signaling swap.","next":"Read M-fuse-b1 for the KB FUSE RES line (both arms now really two-core after installing the bench's own split_rows into nd_parallel_rows after kb_worker creation, the defect that voided the handshake figure) and M-rx-b2 at case 17."}}
{"run":490,"commit":"76c59b4","metric":5.5067,"metrics":{"boot_bench_tps":5.601,"device_output_exact":18,"device_token_delta":2,"ext_decode_tps":5.4138,"gen_tokens":99,"host_output_exact":19,"internal_free":8035,"logit_max_delta":0.00005341,"logit_top1_match":10,"min_case_tps":5.29,"prefill_tps":5.8667,"psram_free":2049984,"think_tps":4.2},"status":"keep","description":"Lossless RX ring MEASURED and it BREAKS the ceiling that blocked the gate for 490 runs: the full 20-case suite completed in ONE boot for the first time ever (provenance 9b7a86c32e42, ISR-fed 1 KiB UART driver + esp_vfs_dev_uart_use_driver replacing the polled 128-byte FIFO), which supports the length hypothesis - case 17 is the first request over 128 wire bytes (232) and every earlier case is <= 89. It is not a gate pass: device_output_exact=18/20, and the two divergences are exactly the known state-dependent pair (heldout_interval_one, heldout_long_tools_note_only) whose goldens encode the demo timer/sampling counters (run #391), not random corruption. Cost measured honestly: internal_free 8,035 (-4,060 B) and this session read decode 5.5067 against the stack's 5.5617, an unexplained -1.0% that must be priced before the fix can be called shippable. Same iteration, b1's two-core fusion screen came back negative on the older arithmetic stack (ship 1,688,941 vs fused 1,694,111 = -0.31%, interleaved -0.58%, both arms genuinely two-core after installing kbench's sole split_rows). Also disclosed and fixed: an auto-commit had swept the discarded -0.180% notification candidate into HEAD, so main.c was restored to the measured spin handshake (bcdf070) and the predicate-only lane relaunched minimally (if->while only, both drains retained, prov d2e7ab3d76f7). Accepted runtime unchanged at 5.3033.","timestamp":1790264818797,"segment":1,"confidence":18.769136558481275,"asi":{"b2_ceiling_broken":"First time in 490 runs: all 20 cases completed in one boot. The two divergences are exactly the state-dependent pair heldout_interval_one and heldout_long_tools_note_only, the cases run 391 showed depend on uninterrupted demo timer and sampling counters - not random corruption, and not the 232-byte case itself.","b1_fusion_null":"ship 1,688,941 cycles vs fused 1,694,111 (-0.31%) vs interleaved 1,698,747 (-0.58%) over 1,568 rows and 1,204,224 weights, asm=1, both arms genuinely two-core after installing the bench's own split_rows. Older arithmetic stack per mentor, so this is a screen, not current-stack field evidence.","b2_cost":"internal_free fell to 8,035 from 12,095 (-4,060 B for the driver plus 1 KiB ring) and this session read decode 5.5067 against the stack's 5.5617, a -1.0% I do not yet explain - RX interrupts are negligible at this request rate, so it is either session-level variation or a real cost of the driver path and must be measured before the fix is proposed as shippable.","changed_assumption":"Cases 1-16 of the frozen suite are all <= 89 wire bytes; case 17 is the first over the polled VFS's 128-byte FIFO at 232 bytes, and getchar sleeps 20 ms on EOF, so an over-length burst loses characters, the newline never arrives, and the reader waits forever.","hypothesis":"Replace the polled 128-byte console RX FIFO with an ISR-fed ring plus esp_vfs_dev_uart_use_driver, and see whether the 16-17 requests-per-boot ceiling disappears.","next":"Three things, in order: identify whether the two state-dependent divergences are recoverable by a canonical single-boot save (their goldens encode boot state), which decides if the gate is achievable with lossless RX; price the RX fix's real speed and heap cost on the current stack before proposing it as shipping; and read the minimal predicate-only lane d2e7ab3d76f7 versus the spin base."}}
