{"run":359,"commit":"16d503c","metric":5.03,"metrics":{"boot_bench_tps":5.076,"device_output_exact":20,"device_token_delta":0,"ext_decode_tps":4.9577,"gen_tokens":99,"host_output_exact":19,"internal_free":14903,"logit_max_delta":0.00005341,"logit_top1_match":10,"min_case_tps":4.8,"prefill_tps":5.3083,"psram_free":2052252,"think_tps":3.94},"status":"keep","description":"Harness iteration (no measurement; decode_tps is the accepted 5.0300 carried forward): **why two full three-board Experiment-33 batches were worthless, and the hole that made them look healthy.** The flashed images contained bench_e32/bench_fused and none of the E33 code, yet build_rc=0, flash_rc=0, the board booted, ran a *complete* bench sequence and printed EVT KBENCH_DONE. Root cause: esp32/main/CMakeLists.txt forwarded ND_KB_EXP30/31/32 to the compiler but **not ND_KB_EXP33** (each experiment's two lines had been hand-copied), so `-DND_KB_EXP33=1` sat unused in the CMake cache, the macro compiled as 0 and the dispatch silently fell through to the old default body. Every check passed because none of them asked the one question that mattered: build rc can't fail (an uncalled static function never fails to link), the lane macro really was on the compile line, and the ELF probe printed the informative `0` under a label that still said `bench_fused_in_elf`, so it read as the known #347 nm false alarm. Found three more holes while fixing it: (2) lane.sh built the build-dir name from EXP30/31/32 only, so an EXP33 build reused the all-zero `build-e29-000-1` directory — the stale-CMakeCache trap the ledger already records twice; (3) a genuine memory-corruption bug in the untested wide-load variant: `kb_fwht_u2ld2` reused one C pointer as both the load and store cursor, and because `ee.ldf.64.ip` post-updates its base register, the stores wrote **16 bytes past** the butterflies just read — found by reading the asm, not by running it, and it would have corrupted exactly the two lanes that use it. Fixes kept: a `foreach(kb_exp 30..36)` forwarding list so adding an experiment is a data change that cannot be forgotten; build-dir names include the new digits; the lane harness now prints `exp_on_compile_line=` from compile_commands.json and every lane body prints `KB E33 ENTER lane=N` so 'never called' is distinguishable from 'faulted inside'; and pre-relaunch verification at build time — EXP33=1 on the compile line, `kb_fwht_u2ld2` present in the ELF, `bench_fused` absent, which is positive proof the dispatch took the E33 branch. Durable rule, the compile-time twin of #333's symbol check: **assert the candidate's -D flag in compile_commands.json and its body symbol in the ELF before believing any number from an image** — a macro candidate produces no symbol and no link error, so a green build proves nothing at all.","timestamp":1790148654338,"segment":1,"confidence":21.56916666666665,"asi":{"candidate":"None — a harness iteration. Two full three-board batches (20260923T0715L, 20260923T0725L) and one partial (0740L) were spent before this was found: the flashed image contained bench_e32/bench_fused and no E33 code at all, while build_rc=0, flash_rc=0, the device booted, ran a complete bench and printed EVT KBENCH_DONE.","root_cause":"esp32/main/CMakeLists.txt forwarded ND_KB_EXP30/31/32 to the compiler but not ND_KB_EXP33, because each experiment's two lines had been hand-copied. '-DND_KB_EXP33=1' therefore sat unused in the CMake cache, the macro compiled as 0, and the dispatch silently fell through to the previous default body (bench_fused).","why_every_check_missed_it":"build_rc=0 (an uncompiled static function that is never called cannot fail to link); flash_rc=0; the board booted and completed; lane_macro_on_compile_line=4 (the LANE macro really was on the compile line); and the ELF symbol check grepped ${SYM:-bench_fused}... which I had parameterised to bench_e33, and it printed 0 — but the label still said bench_fused_in_elf, so the informative zero looked like the #347 nm-path false alarm. The only field that would have caught it was 'which experiment macro reached the compiler', which did not exist.","second_hole":"lane.sh named the build dir from EXP30/31/32 only, so an EXP33 build reused the all-zero directory name build-e29-000-1 — the same stale-CMakeCache trap the ledger already records twice ('fresh-configure every board: a stale board1 build dir dropped the asm kernel and read 4.2217'). The dir name now includes EXP33/EXP34.","third_finding":"a real memory-corruption bug in the E33 wide-load variant, found by reading the asm rather than by running it: kb_fwht_u2ld2 passed the same C pointer variable as both the load cursor (_a) and the store cursor (_c). ee.ldf.64.ip POST-updates its base register, so the two loads advance it 16 bytes and the two stores then write 16 bytes past the butterflies they read. The single-pair variant is correct only because it happens to use distinct variables. Fixed with separate sa/sb cursors and a comment at the site. It would have produced silently wrong rows (or a fault) in exactly the two lanes that use it.","fixes":"1) CMakeLists: one foreach over 30..36 forwarding every ND_KB_EXPnn, so adding an experiment is a data change and cannot be forgotten (CMake comments must be '#' - my C-style block comment was itself a configure error, caught by the verification build). 2) lane.sh: build dir includes the new experiment digits, and it now prints 'exp_on_compile_line=' listing every DND_KB_EXPnn=1 found in compile_commands.json. 3) Each lane body prints 'KB E33 ENTER lane=N' first, so 'never called' is distinguishable from 'faulted inside'. 4) Pre-relaunch verification done at build time, not at harvest: EXP33=1 on the compile line, kb_fwht_u2ld2 present in needle_demo.elf, bench_fused absent (= the dispatch really took the E33 branch).","generalisation":"This is the compile-time-macro twin of run #333's 'an unreferenced new file is garbage-collected and the run silently re-measures the accepted runtime - nm the ELF for the candidate symbol'. For a macro candidate there is no symbol and no link error, so the rule has to be stronger: **assert the candidate's -D flag in compile_commands.json and its body symbol in the ELF before believing any number from the image.** That field is now printed by the lane harness itself.","next":"harvest 20260923T0820L (three boards, EXP33=1, fresh dirs): lane 1 diffs unroll2 / wide-load64 / both against the SHIPPED nd_fwht; lane 2 times the rescale forms at g=128; lane 3 times the whole two-core prepare body both ways and diffs against nd_cq_prepare's own output. Integration only if lane 3 clears ~13 % with zero mismatches.","board_state":"Boards 1-3 rebuilt from clean dirs at 08:20Z; the two invalidated batches left no board lock held (verified no serial_api/idf.py processes before relaunch)."}}
{"run":360,"commit":"8c02c73","metric":5.03,"metrics":{"boot_bench_tps":5.076,"device_output_exact":20,"device_token_delta":0,"ext_decode_tps":4.9577,"gen_tokens":99,"host_output_exact":19,"internal_free":14903,"logit_max_delta":0.00005341,"logit_top1_match":10,"min_case_tps":4.8,"prefill_tps":5.3083,"psram_free":2052252,"think_tps":3.94},"status":"keep","description":"Experiment 33 LANE 1 (board 1, kbench, EXP33 verified in the image; decode_tps is the accepted 5.0300 carried forward, no shipping change yet): the FWHT re-screened against the **shipped** `nd_fwht` rather than my reconstruction, and both the win and a trap came out of it. Shipped `nd_fwht` = 47,462 cycles for 2,688 butterflies (17.657 cyc/butterfly); C unroll-2 = **+17.95 % bit-exact**; the wide-load form (`ee.ldf.64.ip`/`ee.stf.64.ip` around the *same* scalar `add.s`/`sub.s`) = 34,706 cycles = **+36.75 % with diff=0 of 768 cells, bit-exact**; a 4-butterfly block form read **+87.30 %** and is **NOT bit-exact (diff=767)** because its loop condition `j+3 < i+len` never fires for `len==2`, so an entire stage is skipped — third \"fast because it is wrong\" caught by a differential in this campaign (#230's reorder, #335's lost nibble identity, this one a missing stage tail). Because the shipped transform is 47,462 of the engine's 58,902-cycle prepare, its share is **80.6 %**, not the 64.1 % my reconstruction implied — and with lane 2's rescale (18.3 %) and run #351's copy (3.3 %) the whole call is now attributed from the engine's own numbers. Recomputed prize: +36.75 % of 3.17 ms/token = 0.85 ms = **+0.43 % decode** on the transform alone, above the keep bar by itself. Integrated now (three boards: both / transform-only / rescale-only), gated on power-of-two n and 8-byte alignment with the generic loop as the fallback and the `len==1` stage left scalar because its `b` operand lives inside the same float pair as its `a`.","timestamp":1790150550669,"segment":1,"confidence":21.56916666666665,"asi":{"candidate":"LANE 1 (board 1, kbench): three variants of the FWHT butterfly loop, each diffed cell-by-cell against the SHIPPED nd_fwht symbol (not a transcription - run #338's rule), on the real geometry (6 groups x g=128 = 2,688 butterflies per round), min of 25 rounds.","hypothesis":"run #352 screened variants against MY reconstruction, which run #357 proved is not the engine's transform (762/768 cells differ). Re-screen against the shipped function so the delta is against what actually ships.","result":"shipped nd_fwht 47,462 cycles (17.657 cyc/butterfly); C unroll-2 40,238 (14.969) = +17.95 % bit-exact; wide-load pair form (ee.ldf.64.ip/ee.stf.64.ip around the same scalar add.s/sub.s) 34,706 (12.911) = **+36.75 % bit-exact (diff=0)**; 4-butterfly block 25,340 = +87.30 % but **diff=767 NOT_EXACT**.","not_exact_catch":"The +87.3 % block form has no small-stage tail: its loop condition is `j + 3 < i + len`, so for len==2 the body never runs and the whole stage is skipped - every downstream cell is then wrong. It is the third 'fast because it is wrong' this campaign has caught with a differential (#230's reorder, #335's wide-load nibble loss, this). Had it been bit-exact it would have been the largest kernel win of the campaign; it is instead the reason the shipped patch uses the pair form.","accounting_bonus":"The shipped FWHT costs 47,462 of the engine's 58,902-cycle prepare call = **80.6 %**, not the 64.1 % my reconstruction implied; with lane 2's rescale (10,789 = 18.3 %) and run #351's copy (1,954 = 3.3 %) the three sum to 60,205 vs 58,902 measured - so prepare is now fully attributed with the ENGINE's own numbers.","prize_recomputed":"transform = 80.6 % of a 0.2454 ms call x ~16 calls/token = 3.17 ms/token. +36.75 % on it = 0.85 ms/token = **+0.43 % decode**, on its own above the keep bar. The block form's fake +87 % would have printed +0.60 %, which is why the differential is the gate.","next":"integrated on three boards at 20260923T1015L: board 1 both changes, board 2 transform-only, board 3 rescale-only (an ablation batch - the combined reading cannot say which half carries it, nor whether nd_fwht's 8-byte-alignment gate ever fires on the real scratch buffer).","gate_note":"The integrated nd_fwht fast path is gated on n being a power of two and the block being 8-byte aligned, with the len==1 stage left scalar (its b operand lives inside the same float pair as its a operand) and the generic loop retained as the fallback for anything else. Alignment failure falls back silently, which is exactly why the rescale-only ablation is on its own board: if the combined delta equals the rescale-only delta, the gate never fired and the transform half is worth zero in situ."}}
{"run":361,"commit":"8c02c73","metric":5.03,"metrics":{"boot_bench_tps":5.076,"device_output_exact":20,"device_token_delta":0,"ext_decode_tps":4.9577,"gen_tokens":99,"host_output_exact":19,"internal_free":14903,"logit_max_delta":0.00005341,"logit_top1_match":10,"min_case_tps":4.8,"prefill_tps":5.3083,"psram_free":2052252,"think_tps":3.94},"status":"keep","description":"Experiment 33 LANE 2 (board 2, kbench, EXP33 verified in the image; decode_tps is the accepted 5.0300 carried forward): the per-group rescale in `fwht_rows`, measured at the engine's own geometry (scale = 1/sqrtf(g), g=128, 6 groups). Shipped scalar loop 10,789 cycles (14.048 cyc/element) → **unroll-4 2,968 cycles (3.865) = +263.51 %, bit-exact (scale_mismatch=0)**, while **unroll-8 is 28.44 % WORSE** (15,076) — the same LX7 register-file ceiling the ledger recorded for `kron_apply`, now measured on a second kernel. The rescale is **18.3 %** of the engine's 58,902-cycle prepare, which combined with lane 1's 80.6 % transform and run #351's 3.3 % copy finally attributes the whole call from the engine's own numbers. Saving 7,821 cycles/call over ~16 calls/token is 0.52 ms = **+0.26 % decode on this half alone**, so both halves clear the keep bar independently and the predicted combined win is **+0.70 %** — the largest since the phi asm. Host side agrees: 16/16 repo tests, host_output_exact=19, token_delta 0, golden_missing 0, fidelity 5.341e-05 unchanged, top1 10/10. Disclosed: the rescale-only ablation file keeps the transform helper's (unused) definition, so it builds with a 'defined but not used' warning while behaving as a pure rescale-only image.","timestamp":1790150584531,"segment":1,"confidence":21.56916666666665,"asi":{"candidate":"LANE 2 (board 2, kbench): the per-group rescale that fwht_rows runs after the transform, at the engine's own geometry (scale = 1/sqrtf(g), g=128, 6 groups = 768 elements per call), diffed bit-for-bit. Variants: shipped scalar loop, unroll-4, unroll-8.","hypothesis":"the rescale was 14.5 % of my reconstructed prepare and run #352's isolated screen said unroll-4 halves it; measured against the shipped geometry it has an unknown share, and that share is what decides whether it is worth shipping at all.","result":"shipped 10,789 cycles (14.048 cyc/element); **unroll-4 2,968 (3.865) = +263.51 %, bit-exact (scale_mismatch=0)**; unroll-8 15,076 (19.630) = **-28.44 %, worse**. So the sweet spot is 4, exactly as the ledger's kron_apply finding predicts (reuse from the operand loaded per cell, and the LX7 register file stops paying past that).","accounting":"10,789 of the engine's 58,902-cycle prepare = **18.3 %**, which closes the call's attribution with lane 1's 80.6 % transform and run #351's 3.3 % copy. Saving 7,821 cycles/call x ~16 calls/token = 0.52 ms/token = **+0.26 % decode** on this half alone - independently above the 0.2 % keep bar.","verdict":"KEEP as a candidate component. Combined with lane 1's bit-exact transform half (+0.43 %) the predicted total is **+0.70 %**, the largest single predicted win since the phi asm (#333, +0.365 %). Integration is measuring on three boards now; both halves are bit-exact by construction (an elementwise multiply has no accumulation order; the transform keeps the same scalar add/sub per cell) and the host agrees: 16/16 repo tests, host_output_exact=19, host_token_delta=0, host_golden_missing=0, fidelity 5.341e-05 unchanged, top1 10/10.","next":"harvest 20260923T1015L. If the combined candidate beats the bar and is byte-exact on device, keep both halves; the two ablation boards say whether the transform half is actually firing (its gate needs an 8-byte-aligned scratch block) or whether all of the delivered delta belongs to the rescale.","disclosure":"the rescale-only variant file still contains the transform helper's definition but not its use, so it compiles with a 'defined but not used' warning and behaves as pure rescale-only. Functionally correct, cosmetically noisy; noted so the warning is not mistaken for a real transform half."}}
{"run":362,"commit":"dbc6855","metric":5.0467,"metrics":{"boot_bench_tps":5.091,"device_output_exact":17,"device_token_delta":0,"ext_decode_tps":4.975,"gen_tokens":99,"host_output_exact":19,"internal_free":14647,"logit_max_delta":0.00005341,"logit_top1_match":10,"min_case_tps":4.82,"prefill_tps":5.3217,"psram_free":2052252,"think_tps":3.95},"status":"keep","description":"Experiment 33 integration, rescale half: MEASURED AND KEPT, +0.332 % decode (5.0300 → 5.0467, now +107.2 % over the 2.44 baseline). Board 3, batch 20260923T1015L, nd_quant.c md5 9d63064999cb: 17/17 device and 19/19 host byte-exact with golden_missing=0 and DEVICE_GATE_OK, token_delta 0, fidelity 5.341e-05 identical to the control, top1 10/10. Monitors: extended 4.975 (+0.35 %), think 3.95 (+0.26 %), prefill 5.3217, boot bench 5.091 from 5.076 (the bench moving is the mechanism check - prepare is inside it), min_case 4.82, gen_tokens 99, internal_free 14,647 (-256 B of IRAM text). Delivered slightly more than the isolated +0.26 % pricing because the request path calls prepare ~16 times per token while the kbench figure was one core's share of one call. Coverage caveat: this lane's device suite completed 17 cases, not the 20 of the accepted 5.0300 run - the gate is self-consistent (exact==cases, missing=0) but coverage on this reading is 17. The tree also carries the transform half with its len==1 bug fixed, measured separately in 20260923T1022L and not part of this number.","timestamp":1790151544545,"segment":1,"confidence":21.708333333333318,"asi":{"candidate":"Experiment 33 integration, rescale half: the per-group rescale in fwht_rows unrolled by 4 (board 3, batch 20260923T1015L, nd_quant.c md5 9d63064999cb). Bit-exact by construction - each element is its own multiply by c->scale, so there is no accumulation order to move.","hypothesis":"lane 2 measured the rescale at 18.3 % of the engine's 58,902-cycle prepare and +263.51 % in isolation, which priced out at +0.26 % decode; the question was whether that survives contact with the two-core request path.","result":"decode 5.0467 against the accepted 5.0300 = +0.332 %, slightly MORE than the isolated pricing implied, because the request path calls prepare ~16 times per token and the kbench figure was one core's share of one call. Gates: DEVICE_GATE_OK exact=17/17, device_golden_missing=0, device_token_delta=0, host 19/19 byte-exact golden_missing=0, fidelity 5.341e-05 identical to the accepted value, top1 10/10.","monitors":"extended 4.975 (+0.35 %), think 3.95 (+0.26 %), prefill 5.3217, boot bench 5.091 (from 5.076 - and the bench moving is the mechanism check, because prepare is inside the bench), min_case 4.82, gen_tokens 99, internal_free 14,647 (-256 B of IRAM text, the #292 coupling), psram unchanged.","coverage_caveat":"This lane's device suite completed 17 cases, not the 20 the accepted 5.0300 run measured (the batch's per-case timeouts bit the long extended cases). The gate is self-consistent (exact == cases, golden_missing = 0) so the byte-exactness verdict stands, but case coverage on this reading is 17 rather than 20; the 20260923T1022L boards are the fuller readings.","verdict":"KEEP. New accepted runtime 5.0467 decode tok/s (+107.2 % over the 2.44 baseline).","note_on_tree":"The repo also carries the transform half of the same experiment with its len==1 stage bug fixed; that half is measured on three boards in 20260923T1022L and is NOT part of this accepted number. If it fails again the transform half is reverted and 5.0467 stands alone."}}
