{"run":665,"commit":"4599dac","metric":5.5833,"metrics":{"boot_bench_tps":5.668,"device_output_exact":18,"device_token_delta":52,"ext_decode_tps":5.5162,"gen_tokens":99,"host_output_exact":19,"internal_free":6351,"logit_max_delta":0.00005341,"logit_top1_match":10,"min_case_tps":5.37,"prefill_tps":5.8733,"psram_free":2052252,"think_tps":4.37},"status":"keep","description":"Lean-notification scheduler transfer to the SHIPPABLE line (B3 screen + B1 deliberate cross-board FULL gate): replacing the s_go/s_done semaphore pair with per-job waiter publication + task notifications + the while-predicate recheck reads 5.5850 on b3 (+0.661% vs its 5.5483) and 5.5833 on b1's FULL 20-case gate (+0.60% vs that board's 5.5450/5.5500; ext 5.5162 +0.65%, think 4.37 +0.69%, min 5.37, heap 6351, boot 5.668). 18/20 with ONLY the two ring-proven demo-timer goldens, no new failures, host 19/19 byte-exact on-tree, fidelity unchanged. Two boards, identical md5, full breadth: shippable-code-only line now stands at +5.3% over the owner's 5.3033 pin pending the same golden-pair disposition.","timestamp":1790311631479,"segment":1,"confidence":11.54526748971194,"asi":{"hypothesis":"lean-notification scheduler transfer (b2-proven form: publish s_waiter per job, xTaskNotifyGive both ways, while-predicate recheck, no drains, s_go/s_done deleted) ported onto the SHIPPABLE ring+spin main","mechanism":"the semaphore pair still cost a syscall-grade round trip per join even with spin; notifications remove give/take object handling and the lost-wakeup class simultaneously (predicate recheck included, #492/#498)","boards":"b3 screen 5.5850 vs own 5.5483; b1 DELIBERATE cross-board FULL 20-case gate 5.5833 vs own 5.5450/5.5500 pins; identical tree md5 4a3aa059b8ed both boards","quality":"b1 full gate 18/20 token_delta 52 = exactly the two ring-proven demo-timer goldens (#647), no new failures, all 20 cases complete; host 19/19 byte-exact, fidelity 5.341e-05, top1 10/10 measured on-tree","shippable_line":"bundle5 + composed attention + KV staging helper + RX ring + spin + LEAN NOTIFICATIONS: engine stays ACCEPTED-code-only, now +5.3 pct over the 5.3033 pin (5.5833 cross-board-full)","next":"b1 next screens 2-bit tie1n wide loads (the 43 pct phase); b3 runs the phi widephi integration lane (E50 kernel, +16.3 pct warm on field shapes); b2 ports widephi to the seed-era base","snapshot":".auto/preserved/b3-notif/main.c"}}
{"run":666,"commit":"9d8f1b2","metric":5.8033,"metrics":{"boot_bench_tps":5.893,"device_output_exact":6,"device_token_delta":0,"ext_decode_tps":0,"gen_tokens":99,"host_output_exact":19,"internal_free":5087,"logit_max_delta":0.00005341,"logit_top1_match":10,"min_case_tps":5.58,"prefill_tps":6.1167,"psram_free":2052252,"think_tps":0},"status":"discard","description":"Load-ahead codebook schedule (B2, ACTUAL not rename): true software pipelining in the 4-bit row kernel - every cb load k+1 precedes consumption of k via alternating f12/f15+a15/a9, objdump-verified emitted order - reads 5.8033 vs the 5.8083 seed pin = -0.086% (null/negative). 6/6 device byte-exact, delta 0, prefill/min identical. The load-use-distance lever is closed for the scalar form: reordering xh-side loads buys nothing that the wide-load form (E50, +16.3% warm) does not buy far more directly. Discarded.","timestamp":1790311655604,"segment":1,"confidence":11.54526748971194,"asi":{"hypothesis":"ACTUAL load-ahead codebook schedule in gemv4_tie728.S: codebook value k+1 loaded into the other cb register (f12/f15, a15/a9) before value k is consumed, so no load-use distance is 1; per-partial FMA chains untouched","emitted_body":"objdump-verified sequence survived assembly verbatim (asm is not reordered): lsi f12, lsi f15, madd f0-f12, lsi f12, madd f1-f15, ... drain at end","rename_screen_precedent":"the earlier same-day rename-only screen (registers alternated, adjacency unchanged) measured 5.8067 = null, so this run is the mechanism test, not a duplicate","result":"5.8033 vs the 5.8083 pin = -0.086 pct (at/below quantum, prefill 6.1167 identical, min 5.58 identical): deeper load-ahead does not pay at phi call frequency - the PSRAM xh load latency is already hidden or dominated by other terms. DISCARDED.","context":"meanwhile the SAME board family measured the wide-load reopen (E50): field-shape phi kernel +16.3 pct warm with ee.ldf.128.ip in the correct fill order","next":"b2 turns to the widephi integration on the seed-era base; the scalar-schedule question is closed, delivery is the lever"}}
{"run":667,"commit":"0e5c1d3","metric":5.585,"metrics":{"boot_bench_tps":5.685,"device_output_exact":6,"device_token_delta":0,"ext_decode_tps":5.5175,"gen_tokens":99,"host_output_exact":19,"internal_free":6351,"logit_max_delta":0.00005341,"logit_top1_match":10,"min_case_tps":5.38,"prefill_tps":5.8717,"psram_free":2052252,"think_tps":4.36},"status":"keep","description":"Wide-load reopen VERIFIED (E50 kbench, b3): the fill-order probe resolves the last ambiguity (#333's wide kernel was lane-permuted by its register list - the probe that \"refuted\" wide loads was itself broken, never resetting its fixture and using the wrong list order). The corrected ee.ldf.128.ip phi kernel is bit-exact row-for-row (96/96 sampled rows, all three phi tensors, internal aligned xh) and +16.3% on the field-shape warm sweep (6.281 -> 5.400 cyc/weight). m->xh moved to a 16-byte aligned allocation; wrapper selects wide only when aligned. Integration lanes on two bases now running.","timestamp":1790312159080,"segment":1,"confidence":11.711949904331197,"asi":{"hypothesis":"ACTUAL fill-order probe + corrected-register wide-load kernel for the phi row walker, reopening #333's closure (mentor audit: the old probe never reset its A fixture inside the B loop and the register list order was never verified)","probe":"ldf list f7,f6,f5,f4 then stf FORWARD = identity output => rightmost register in the list receives the LOWEST address; #333's dot4 list (f4,f5,f6,f7) put f7=lo -> its madd multiplied xh[j+3] against wslot j - the old wide kernel WAS lane-permuted, exactly as audited","corrected_kernel":"kb_wide twin of shipped tie1 (list f7,f6,f5,f4 + f11,f10,f9,f8), INTERNAL 16-aligned xh, real phi bytes, 96 sampled rows across all three tensors incl last row: mismatch=0 bit-exact","timing_field_shape":"warm min-of-25, full 3-tensor x 8-layer sweep, same blobs and xh: scalar 3,705,208 cycles (6.281/weight) vs wide 3,185,158 (5.400/weight) = +16.3 pct on the kernel","alignment_fact":"internal fast-alloc alignment measured 0 and 4 mod 16 -> m->xh now allocated via ND_ALLOC_FAST16 (heap_caps_aligned_alloc); the wrapper picks the wide kernel only when (xh & 15)==0, else the shipped scalar path","shipping_status":"widephi integration lanes RUNNING on b3 (shippable+notif tree, expect 956a3ef78f1f) and b2 (seed-era pin, expect 6a389bad72e); host 19/19 byte-exact + fidelity unchanged on both trees before flash","scope_note":"this entry is kbench evidence on the b3 notif-pin tree (metric = that tree's screen reading; kbench.c is not in the shipping image); the E49 cold-refund null it builds on stands (delivery was never the phi term - instruction count was)","next":"if widephi reproduces on both bases, the same substitution in the attention QK body goes to b1 (e51 microkernel: DOT8W chunk shape, lsi x8 vs 2x ldf.128, bit-exact pair) - running now"}}
{"run":668,"commit":"1f6d8e4","metric":5.84,"metrics":{"boot_bench_tps":5.931,"device_output_exact":6,"device_token_delta":0,"ext_decode_tps":0,"gen_tokens":99,"host_output_exact":19,"internal_free":4823,"logit_max_delta":0.00005341,"logit_top1_match":10,"min_case_tps":5.61,"prefill_tps":6.1583,"psram_free":2052252,"think_tps":0},"status":"keep","description":"Wide-load phi kernel INTEGRATED (E50 kernel -> engine) and measured on both bases: b2 seed-era 5.8400 (+0.544% over the 5.8083 pin; prefill 6.1583, min_case 5.61, boot 5.931, heap 4823) and b3 shippable+notif 5.6033 (+0.328% over its 5.5850; prefill 5.895, min 5.39). Both 6/6 device byte-exact, token_delta 0, host 19/19, fidelity unchanged. The 4-bit row walker now loads xh four floats per instruction (ee.ldf.128.ip in the E50-proven register-list order) with the scalar path kept as the unaligned-xh fallback. Seed-era line: 5.8400 is the campaign's best measured decode; shippable line +5.66% over the owner's pin.","timestamp":1790313299260,"segment":1,"confidence":11.995411224849958,"asi":{"hypothesis":"port the E50-verified ee.ldf.128.ip phi kernel into the engine (nd_gemv4_rows_tie1W + wrapper pick on xh alignment + ND_ALLOC_FAST16 for m->xh), run on BOTH bases: shippable+notif (b3) and seed-era pin (b2)","result":"b3 (shippable+notif pin 5.5850): 5.6033 = +0.328 pct (prefill 5.895 +0.39, min 5.39); b2 (seed-era pin 5.8083): 5.8400 = +0.544 pct (prefill 6.1583 +0.68, min_case 5.61 +0.54, boot bench 5.931) - NEW campaign best device reading. Realisation of the +16.3 pct kernel win is 30-40 pct of its phi share, consistent with the phase's two-core split dilution.","quality":"both boards 6/6 device byte-exact, token_delta 0, missing 0; host 19/19 byte-exact on both trees; fidelity unchanged; heap -256 B (aligned alloc + one extra kernel body)","shippable_line_now":"bundle5 + composed attention + staging helper + RX ring + spin + notif + WIDEPHI = 5.6033 = +5.66 pct over the owner's 5.3033 pin (pending full gate)","fix_needed":"first integration attempt failed to compile because the pick fallback was typed as gemv_rows_generic (later-defined symbol) instead of the actual gemv_rows_offset - caught by the build, not the board","next":"full breadth gates on both lines (ext/think/20-case + capture); e51 attention-QK wide microkernel on b1 prints pair values now to resolve its diff=8 against the 96/96-exact field kernel - the two bodies differ only in chunk grouping so the printout localises the pairing model","campaign_note":"this reopens the load-form class: #333 closed wide float loads on a broken probe; the corrected form is bit-exact and pays on the 4-bit path; attention/lut2 candidates are now live questions"}}
{"run":669,"commit":"2a7e9f5","metric":5.5833,"metrics":{"boot_bench_tps":5.668,"device_output_exact":18,"device_token_delta":52,"ext_decode_tps":5.5162,"gen_tokens":99,"host_output_exact":19,"internal_free":6351,"logit_max_delta":0.00005341,"logit_top1_match":10,"min_case_tps":5.37,"prefill_tps":5.8733,"psram_free":2052252,"think_tps":4.37},"status":"keep","description":"Wide-load QK microkernel PROVEN (E51, b1 kbench): the attention DOT8W chunk shape with two ee.ldf.128.ip loads is bit-exact (diff=0 over 8 real-shaped pairs) and 38.2% faster than the eight-lsi scalar form - a bigger win than the phi kernel because both operand rows go wide. Two self-inflicted kernel bugs (post-increment double-advance; mul over madd) were caught by the bit-exact half of the screen while the timing half had already reported a fake +40% - the discipline that #333's closure lacked, now demonstrated to matter in the other direction too. wideQK integration queued on the seed-era base; b3 meanwhile runs the full breadth gate of the shippable+widephi line.","timestamp":1790314411170,"segment":1,"confidence":12.173741715923319,"asi":{"hypothesis":"e51 microkernel pair: the DOT8W attention chunk shape (two operand rows, 4-float chunks, four independent madd chains, ascending fold) with lsi x8 vs two ee.ldf.128.ip, aligned internal buffers, bit-exact pairing half + timing half","result":"diff=0 and wide = 79,427 vs scalar 128,580 cycles = kernel time -38.2 pct (gain 1.61x) - the corrected wide form pays even MORE than the phi kernel (+16.3 pct) because both operand rows are wide-loaded","two_self_inflicted_bugs_found_by_the_exactness_half":"run1/run2 reported diff=8 with an inflated +40 pct timing win: (1) .ip post-increment PLUS an explicit addi = stride 32 = half the row read; (2) bodies used mul.s where the chain needs madd.s (overwritten partials). Both caught by the bit-exact half before the timing half was believed - the exact discipline #333 lacked. HARNESS NOTE: my hand-written captures in this window died silently on serial_api.Device kwargs (echo/boot_wait do not exist in this repo's Device) - the raw-pyserial harvest script is the working route.","integration":"wideQK candidate next on the seed-era base (b2): DOT8W body loads become ee.ldf.128.ip; kf scratch needs aligned(16) (frame arrays are compiler-controlled, one attribute); per-accumulator order unchanged so bit-exact by the same construction as e51","campaign_note":"load-form family is now a PROGRAM not a one-off: phi kernel shipped (+0.33/+0.54), QK microkernel proven -38 pct, then P.V update/rescale sweeps, kron_apply rows, and the FWHT arrays are the ranked candidates by phase share (hadamard 14.2 ms, attn-stage dots, prep 3.0-3.6 ms)","metric_note":"kbench-only entry on the b1 shippable+notif tree; metric = that tree's full-gate values; kbench.c is not in the shipping image"}}
{"run":670,"commit":"4599dac","metric":5.715,"metrics":{"boot_bench_tps":5.779,"device_output_exact":6,"device_token_delta":0,"ext_decode_tps":0,"gen_tokens":99,"host_output_exact":0,"internal_free":4567,"logit_max_delta":0,"logit_top1_match":0,"min_case_tps":5.46,"prefill_tps":6.0283,"psram_free":2052252,"think_tps":0},"status":"discard","description":"Wide-load QK dot kernel (E52, b2 seed-era 5.8400 base): the DOT8W attention body's 16 lsi per 4-float chunk replaced by 6 ee.ldf.128.ip, four accumulators and every per-accumulator mul/madd/add statement order preserved. Device self-test PASSED (256/256 trials, bad=0) so the kernel IS bit-exact - and it is 2.1% SLOWER: decode 5.840 -> 5.715, prefill 6.158 -> 6.028, boot bench 5.931 -> 5.779 (uniform, far outside the 0.04% quantum). The E51 microbenchmark's 38% does not survive integration: E51 compared hand-written lsi against hand-written wide, both with the same fixed statement order, while the shipped C body is GCC-scheduled (loads hoisted, chains interleaved). 9216 calls/token at 12 chunks each, plus a fixed-order asm body whose madd follows its load with no filler, is a net loss. Restricted primary screen, 6/6 device exact, token_delta 0; b2 tree restored byte-exact to da7b6b1d1d58.","timestamp":1790319210357,"segment":1,"confidence":12.357454545454528}
{"run":671,"commit":"4599dac","metric":5.4983,"metrics":{"boot_bench_tps":5.556,"device_output_exact":6,"device_token_delta":0,"ext_decode_tps":0,"gen_tokens":99,"host_output_exact":0,"internal_free":5607,"logit_max_delta":0,"logit_top1_match":0,"min_case_tps":5.39,"prefill_tps":5.7917,"psram_free":2052252,"think_tps":0},"status":"discard","description":"Instrumented rerun of the E52 wide QK kernel (b3 shippable+widephi base) that PRICES the two forms in the same image, plus a cross-board confirmation of the negative. Device selftest 256/256 bit-exact. Price (boot-time microbenchmark, diagnostic only): the GCC-compiled C DOT8W body costs 49 cycles per 4-float chunk, the hand-written wide kernel 80 cycles/chunk (+63%), and the call boundary only 29 cycles per head-pair call. So the E51 microbenchmark's 38% never existed against the real baseline: E51 compared hand-written lsi with hand-written wide, both carrying the same fixed statement order, while GCC hoists loads and interleaves the four accumulator chains. End-to-end on b3: 5.4983 vs its own 5.6033 widephi pin = -1.87%, matching b2's -2.1% (uniform across decode/prefill/boot). The load-form program pays only where the compiler cannot already hide the scalar loads - which is exactly the P.V row transport that just measured +0.63% on b1 - and not where the loop is a serial FMA chain.","timestamp":1790319897770,"segment":1,"confidence":12.395768739740992}
{"run":672,"commit":"1a14e1c","metric":5.6183,"metrics":{"boot_bench_tps":5.712,"device_output_exact":18,"device_token_delta":52,"ext_decode_tps":5.5554,"gen_tokens":99,"host_output_exact":0,"internal_free":4991,"logit_max_delta":0,"logit_top1_match":0,"min_case_tps":5.42,"prefill_tps":5.9033,"psram_free":2052252,"think_tps":4.38},"status":"keep","description":"Wide-load P.V update kernel KEPT (E53, b1 shippable+notif base): the B4W paired-head P.V body's 32 memory operations per 4-float chunk (16 lsi to read both staged rows plus both output rows, 8 ssi to write them back, with the compiler re-reading the staged rows for the second head) become 6: two 128-bit reads for the staged rows, one 128-bit read and one 128-bit write per output row, rows resident across all 16 madds. Restricted screen 5.6183 (+0.63% over the board's 5.5833 pin) then the FULL 20-case gate on the same image: decode 5.6183, ext 5.5554 (vs 5.5162 = +0.71%), think 4.38, min_case 5.42, boot 5.712, heap 4991. Device 18/20 with token_delta 52 = exactly the two demo-timer goldens every ring-carrying image shows (#647); no new failure. Device selftest 128/128 bit-exact with the out-of-bounds canaries intact after the mentor's store-order/post-increment correction (the first version double-advanced both output pointers and its selftest crashed the board - caught before any number was believed).","timestamp":1790320358760,"segment":1,"confidence":12.434321258690089}
{"run":673,"commit":"4599dac","metric":5.8767,"metrics":{"boot_bench_tps":5.982,"device_output_exact":6,"device_token_delta":0,"ext_decode_tps":0,"gen_tokens":99,"host_output_exact":0,"internal_free":3727,"logit_max_delta":0,"logit_top1_match":0,"min_case_tps":5.66,"prefill_tps":6.1917,"psram_free":2052252,"think_tps":0},"status":"keep","description":"Wide-load P.V kernel CONFIRMED cross-board and cross-base (E53 on b2, seed-era 5.8400 pin): decode 5.8767 = +0.63% - the identical delta the shippable line showed on b1 (5.5833 -> 5.6183), on a different base, a different quant/asm stack and a different board. Device selftest 128/128 bit-exact with canaries intact, 6/6 device exact, token_delta 0, prefill 6.1917, min_case 5.66, boot 5.982, heap 3727. New campaign-best device reading 5.8767, and the first load-form lever in this family whose gain reproduces exactly on two bases: the P.V body's per-cell FMAs are independent, so the hand-written fixed order costs nothing and the whole 26-instruction-per-chunk row-transport saving lands, unlike the QK dot whose serial accumulator chains made the same substitution -2% (#670/#671).","timestamp":1790321040260,"segment":1,"confidence":12.568605927552145}
{"run":674,"commit":"4599dac","metric":5.6017,"metrics":{"boot_bench_tps":5.697,"device_output_exact":6,"device_token_delta":0,"ext_decode_tps":0,"gen_tokens":99,"host_output_exact":0,"internal_free":4991,"logit_max_delta":0,"logit_top1_match":0,"min_case_tps":5.42,"prefill_tps":5.9033,"psram_free":2052252,"think_tps":0},"status":"discard","description":"Wide-load kron2 factor rows (E54, b1 shippable+notif+PV base) DISCARDED at -0.30%: decode 5.6017 vs the same board's PV-only 5.6183, boot 5.697 vs 5.712. The kernel is bit-exact (device selftest 64/64, pool_align=0, kron2=1 so it really ran) and the mechanism is a register-file limit, not a load-form failure: the shipped kron2 body keeps EIGHT live accumulators and re-reads 16 factor floats per j step, which is exactly why it can spend registers on accumulators. Four wide loads want four registers per row, so the kernel must either keep four accumulators and walk j twice (what this candidate did: double the loop overhead, double the crow reads, halve the ILP) or reload - and both cost more than the 12 lsi it removes. Rule reinforced: a wide-load substitution needs both removable redundant traffic AND enough free registers to hold the row; eight accumulators plus two factor rows do not fit in f0-f15.","timestamp":1790321147219,"segment":1,"confidence":12.568605927552145}
{"run":675,"commit":"36f753d","metric":5.8783,"metrics":{"boot_bench_tps":5.982,"device_output_exact":18,"device_token_delta":52,"ext_decode_tps":5.8123,"gen_tokens":99,"host_output_exact":0,"internal_free":3727,"logit_max_delta":0,"logit_top1_match":0,"min_case_tps":5.66,"prefill_tps":6.1917,"psram_free":2052252,"think_tps":4.54},"status":"keep","description":"Full-gate promotion of the seed-era line with the confirmed wide-load P.V kernel (b2): decode 5.8783, ext 5.8123, think 4.54, prefill 6.1917, min_case 5.66, boot 5.982, heap 3727, 18/20 device with token_delta 52 = the two #647 demo-timer goldens only, no new failure. Matches the restricted screen (5.8767) to +0.02% = one quantum, so the +0.63% over the 5.8400 pin is breadth-stable. This is the campaign's best fully-breadth-gated line: 5.8783 = +10.84% over the owner's 5.3033 acceptance pin, carrying the seed-era composition + composed attention + wide phi + wide P.V.","timestamp":1790321653346,"segment":1,"confidence":12.574460300036597}
