{"run":465,"commit":"e4b8f61","metric":5.3033,"metrics":{"boot_bench_tps":5.343,"device_output_exact":20,"device_token_delta":0,"ext_decode_tps":5.2269,"gen_tokens":99,"host_output_exact":19,"internal_free":13367,"logit_max_delta":0.00005341,"logit_top1_match":10,"min_case_tps":5.07,"prefill_tps":5.59,"psram_free":2052252,"think_tps":4.2},"status":"keep","description":"Gate attempt #6 measured the blocker, not a speed candidate: board 2's full-suite session on the byte-identical confirmed spin tree (engine_md5=b1daae10df90) stopped at 16/20 cases with LANE_RC=1, zero divergences in the 16 cases reached, and no case skipped. The six-attempt record is now 16,16,16,17,17,17 across three engines with the accepted image stalling at the same position, so the console-emission firmware defect - not the candidate - blocks device_output_exact=20, and gate retries are retired per run #442's policy. Updated .auto/OWNER_ACCEPTANCE_PACKET.md with the current stack (asmemo + radix-4 fusion + nf16v + spin = 5.560/5.5617 on two boards, +4.85 % over the 5.3033 pin, prefill 5.8667, boot_bench 5.601, min_case 5.30, internal_free 12,095, 6/6 primary byte-exact, token_delta 0) and the three owner asks. Accepted runtime unchanged at 5.3033; no new candidate claimed and no board spent on a seventh retry.","timestamp":1790258861799,"segment":1,"confidence":20.440000000000047,"asi":{"changed_assumption_check":"No prior discard is revived by this datum: a gate stall is not a speed result, so it cannot flip any keep/discard decision. The one thing it does change is policy - gate retries are now formally retired (six attempts, never 20), so the loop stops spending boards on them and the acceptance decision moves to the owner packet, which I updated with the real distribution rather than with optimism.","datum":"Gate attempt #6: board 2's full-suite session on the byte-identical confirmed tree (engine_md5=b1daae10df90) reached 16 of 20 cases and ended LANE_RC=1 with 'case was not skipped, and no chip reset was attempted'. Zero divergences in the 16 cases it completed. Combining with the earlier attempts, the distribution is now 16,16,16,17,17,17 with the accepted image stalling at the same position, i.e. the per-boot request ceiling is 16-17 and the console-emission stall - a product defect - is what stands between the confirmed +4.85 % stack and a re-pin.","hypothesis":"Does a sixth 20-case gate attempt on a healthy board reach device_output_exact? Answer measured: no, it stops at 16/20 again, and every case it did reach matched its golden byte for byte.","next":"The loop's honest remaining agenda, in order: (1) read the packet; (2) coverage/anti-overfit work on newly added held-out cases if the owner wants more evidence than 16 cases; (3) a new candidate only if some premise changes - the map was re-derived this week (#464), dispatch is priced out (#463), and every phase has a measured floor, so re-screening anything else without naming a changed premise would be manufactured work.","no_overfit_note":"The 16 cases include the held-out extended prompts and all matched, which is the generalisation evidence the campaign cares about; the speed number itself comes from four primary readings on two boards (5.560/5.5617), not from this session.","packet":".auto/OWNER_ACCEPTANCE_PACKET.md has an addendum: the stack, its secondary evidence, the six-attempt distribution, board 1's dead console leg, and the three owner asks (accept on disclosed evidence or fix the stall; reseat board 1; the two owner-gated levers - assertion-RAM/phi residency +0.39 %, 120 MHz +3.51 % vendor-blocked)."}}
{"run":466,"commit":"e4b8f61","metric":5.3033,"metrics":{"boot_bench_tps":5.343,"device_output_exact":20,"device_token_delta":0,"ext_decode_tps":5.2269,"gen_tokens":99,"host_output_exact":19,"internal_free":13367,"logit_max_delta":0.00005341,"logit_top1_match":10,"min_case_tps":5.07,"prefill_tps":5.59,"psram_free":2052252,"think_tps":4.2},"status":"keep","description":"Generalisation probe on four unseen prompt shapes attempted on board 2 (which still carried the stack image after gate attempt #6) and it returned NO readings: prof_request.py attaches to an already-primed board and the raw invocation neither primed nor knew the board's per-boot request budget was nearly spent, so the 620 s window produced zero lines. No measurement, no claim - recorded as a concrete harness blocker rather than dressed up as a null. The right route next time is to add these shapes to `extended` (additions are sanctioned; primary is hash-pinned) and re-baseline with a full-groups AUTO_SAVE=1 run, which turns a one-off tps probe into permanent byte-exact coverage. Accepted runtime unchanged at 5.3033; the stack (5.560/5.5617 on two boards, +4.85 %) stays an owner decision blocked by the console-emission defect.","timestamp":1790259560713,"segment":1,"confidence":20.194777699364835,"asi":{"concrete_blocker":"The driver returned zero lines in 620 s. prof_request.py attaches to an ALREADY-PRIMED board (its header says so), and board 2's boot had just run 16 requests under the gate before LANE_RC=1, so it was neither freshly primed nor guaranteed un-wedged; the lane scripts do the prime, a raw invocation does not. Stated as a blocker rather than converted into a null result - I got no readings, which is not evidence about generalisation.","hypothesis":"Generalisation check of the +4.85 % stack on prompt shapes the frozen suite does not contain (free-text no-tool, a different language pair for the route, a numeric probe reading, an open-ended status question). The campaign's anti-overfit precedent is run #296, which measured unseen-prompt tps without goldens and showed the speed work was not prompt-specific. Only tps is claimable here - new cases have no goldens, so they can never be byte-exact-checked.","datum":"None usable. This iteration produced no measurement, so nothing is claimed and no number is carried forward as if it were.","next":"Two ways to do this properly, both cheap: (a) run it as a lane so needle-board primes the board first, or (b) add the four prompts to `extended` (additions are sanctioned; primary is hash-pinned) and re-baseline the device golden with a full-groups AUTO_SAVE=1 run, which also gives byte-exact coverage of the new shapes. Prefer (b) the next time a board has 30+ free minutes, because it converts a one-off tps probe into permanent coverage.","wedge_note":"The same per-boot 16-17 request ceiling is why a raw probe is unreliable right now: after the gate session the board had already consumed most of its per-boot budget."}}
{"run":467,"commit":"e4b8f61","metric":5.3033,"metrics":{"boot_bench_tps":5.343,"device_output_exact":20,"device_token_delta":0,"ext_decode_tps":5.2269,"gen_tokens":99,"host_output_exact":19,"internal_free":13367,"logit_max_delta":0.00005341,"logit_top1_match":10,"min_case_tps":5.07,"prefill_tps":5.59,"psram_free":2052252,"think_tps":4.2},"status":"keep","description":"Four held-out prompt shapes pre-validated off-device on the host engine before any board is spent, as run #466's failed raw probe required: all four are grammar-legal, deterministic, 34-47 bytes (well inside the firmware's silent 271-byte reader limit) and generate 14-23 tokens at a sane host rate - free-text description -> set_sampling_interval(60); German-to-French translation -> set_timer(1500), i.e. a different tool than the frozen route case; a decimal probe reading 21.5 -> set_sampling_interval(21), first decimal-input case; open-ended status question -> get_status. They are NOT added to prompts.json yet, deliberately: a case without a golden entry counts as byte-exact (run #296's silent-pass hole, now reported rather than hidden), so entries must arrive together with host AND device goldens from one canonical full-groups save - a ~35 minute board job that the 16-17 requests-per-boot console wedge turns into two parts. No speed claim; accepted runtime unchanged at 5.3033. Product observations surfaced only by wider coverage: the schema's missing no-op escape makes three of four unseen prompts emit a hallucinated-but-legal call, and 21.5 truncates to 21.","timestamp":1790259645471,"segment":1,"confidence":20.07435987372846,"asi":{"anti_overfit":"This is coverage work, not a speed lever, and it is the kind the rules invite: primary is hash-pinned and untouched, and extending `extended` is explicitly welcome. Note the product observations that only widening coverage surfaces: three of four unseen prompts make the model emit a hallucinated-but-grammar-legal call (set_sampling_interval for a description request, set_timer for a translation, seconds=21 for a 21.5 reading) because the schema has no no-op escape and no numeric rounding - the same gap run #296 reported, now reproduced on three more shapes.","changed_assumption":"No prior discard is affected: this is coverage, not a speed verdict.","datum":"Four held-out prompt shapes PRE-VALIDATED on the host engine (the campaign's quality authority), all grammar-legal, all well inside the 271-byte reader limit (34-47 bytes), token counts 14-23, host tps 141-143 sanity: (a) 'Describe the firmware build in one sentence' -> set_sampling_interval(60), 23 tokens, first free-text-description shape; (b) 'Translate guten Morgen into French' -> set_timer(1500), 19 tokens, a route-adjacent shape that picks a DIFFERENT tool than the frozen route case; (c) 'Log a temperature probe reading of 21.5 degrees' -> set_sampling_interval(21), 23 tokens, first decimal-input case and it truncates 21.5 to 21; (d) 'What changed since the last status report?' -> get_status, 14 tokens, an open-ended status phrasing.","disposition":"Not added to prompts.json this iteration, deliberately: a case with no golden entry is counted as byte-exact (run #296's finding, now guarded by device_golden_missing reporting), so adding entries without saving both host and device goldens would silently weaken the gate rather than strengthen it. Adding them requires ONE full-groups session that saves host and device goldens together (AUTO_SAVE=1, and #395 established the device tail goldens only reproduce in canonical order). That is a ~30-40 minute board job queued for the next free window, and the console-wedge ceiling of 16-17 requests per boot makes it a two-part operation - which is exactly the defect the owner packet asks to fix.","hypothesis":"Before spending a board on new held-out cases, pre-validate them off-device: do the four unseen shapes produce grammar-legal, deterministic, sane-length generations on the host engine, and does each exercise a path the frozen 20 cases do not? If a prompt produced an empty or runaway generation it would be a harness liability rather than coverage.","next":"Next free board window: add the four to `extended` (additions only), regenerate host goldens, then one full-groups device session in canonical order to save device goldens, re-running the existing 20 to prove nothing drifted. That converts a one-off tps probe into permanent byte-exact coverage of free-text, decimal-input and alternate-route shapes."}}
{"run":468,"commit":"e4b8f61","metric":5.3033,"metrics":{"boot_bench_tps":5.343,"device_output_exact":20,"device_token_delta":0,"ext_decode_tps":5.2269,"gen_tokens":99,"host_output_exact":19,"internal_free":13367,"logit_max_delta":0.00005341,"logit_top1_match":10,"min_case_tps":5.07,"prefill_tps":5.59,"psram_free":2052252,"think_tps":4.2},"status":"keep","description":"Coverage prerequisites measured off-device: all four candidate held-out prompts are byte-deterministic on the host engine (two independent generations each, comparing generated text only, non-empty required) - 4/4 DETERMINISTIC - which is the gate on admitting them as golden cases at all, since byte-exact goldens are the campaign's quality veto. Caught and disclosed my own vacuous first probe: the initial comparison included the 'EVT done ms= tps=' timing line, which differs between runs by construction, so it reported NONDET for every case and would have wrongly disqualified four good prompts (and implied engine non-determinism that does not exist). Also wrote the atomic coverage-run recipe into .auto/ideas.md and deliberately did NOT edit prompts.json this window: entries without goldens would weaken the device byte-exact gate while the host side looked greener (run #296's failure mode). No speed change; accepted runtime unchanged at 5.3033, the +4.85 % stack still owner-blocked by the console-emission defect.","timestamp":1790259731084,"segment":1,"confidence":19.955369595536872,"asi":{"changed_assumption":"None - coverage work, no speed verdict, no prior discard affected.","hypothesis":"Are the four pre-validated held-out shapes byte-deterministic on the host engine? A non-deterministic prompt cannot become a golden case at all (byte-exact goldens are the campaign's quality veto), so this is the gate on the coverage run - and it must be tested before a board is spent, not after a save produces a case that will not reproduce.","probe_bug_caught":"My first attempt reported NONDET for every prompt because my grep included the EVT done line, which carries ms= and tps= and therefore differs between runs by construction - a vacuous comparison that would have wrongly disqualified four good cases (and wrongly suggested the engine is non-deterministic, which would have been a far bigger finding than it is). Fixed by comparing only the generated-text lines and requiring them non-empty: fifth instance this campaign of a check that could not fail meaningfully, and the reason I now always ask what the negative control would look like.","measurement":"All four candidate held-out prompts are byte-deterministic on the host engine across two independent generations each, comparing the generated text only and requiring non-empty output: free-text description, German-to-French translation, decimal probe reading 21.5, and the open-ended status question - 4/4 DETERMINISTIC.","next":"The coverage run itself is the next board job and its atomic recipe is now in .auto/ideas.md (append to extended, regenerate host goldens, one canonical full-groups device session with AUTO_SAVE=1, then prove the original 20 cases did not drift, all in one commit - because a missing device golden makes measure.sh exit DEVICE_GOLDEN_INCOMPLETE and would break every lane). Speed-wise nothing changed: every family has a measured floor, dispatch is priced out at 275 splits/token (#463), and the +4.85 % stack is blocked on the console-emission defect, not on evidence.","safety_note":"Deliberate non-action: I did NOT edit prompts.json this window. Half-adding the cases (entries without goldens) would silently weaken the byte-exact gate on the device side while the host side looked greener, which is exactly run #296's failure mode."}}
{"run":469,"commit":"8b3f1a9","metric":5.3033,"metrics":{"boot_bench_tps":5.343,"device_output_exact":20,"device_token_delta":0,"ext_decode_tps":5.2269,"gen_tokens":99,"host_output_exact":19,"internal_free":13367,"logit_max_delta":0.00005341,"logit_top1_match":10,"min_case_tps":5.07,"prefill_tps":5.59,"psram_free":2052252,"think_tps":4.2},"status":"keep","description":"Acceptance stack integrated into main and verified off-device: installing .auto/exp80/nd_quant.c.nf16v (asmemo + radix-4 stage fusion + nf16v) onto main - which already carries the spin handshake and the nf16v assembly - makes main's tree provenance exactly b1daae10df90663dd2e2c4a8e4047dfc, i.e. character-identical to the engine_md5 the runner asserted on both boards when the stack measured 5.560/5.5617 (+4.85 % over the 5.3033 pin). checks.sh on main is green: host 19/19 byte-exact, host_golden_missing=0, host_token_delta 0, fidelity 5.341e-05 identical to the accepted control, top1 10/10. The pin is deliberately NOT moved: the 20-case device gate has still never completed (attempts 16,16,16,17,17,17 with zero divergences, engine-independent console-emission defect), so the accepted runtime stays 5.3033 and this commit is integration, not acceptance. Baseline before this step: main was host-green at 19/19 without asmemo/fusion/nf16v, so the integration is the only delta.","timestamp":1790259942924,"segment":1,"confidence":19.844660194174683,"asi":{"changed_assumption":"No prior discard is affected; this is the integration half of the acceptance path, executed early and without moving the pin, so the gate still decides.","harness_note":"Doing this in main is what makes the owner's decision executable at all: until now the stack lived only in worker checkouts plus three .auto payload files, which is how run #421's base contamination happened in the first place. The tree provenance - md5 over engine/src/*.c + *.S + engine/include/*.h + esp32/main/*.c, exactly what measure.sh reports as engine_md5 - is now a single number that matches what the runner asserted on both boards, so provenance is verifiable from the repo rather than from a lane log.","hypothesis":"Can main carry the cross-board-confirmed stack byte-exactly and stay host-green? This is the acceptance path's missing step, and it is checkable off-device: install .auto/exp80/nd_quant.c.nf16v (asmemo + radix-4 fusion + nf16v) over main's engine, given main already carries the spin handshake and the nf16v assembly, then require (a) the tree provenance to equal the value the runner asserted for the measured tree b1daae10df90 and (b) checks.sh green with fidelity unchanged.","measurement":"Both conditions met: main's tree provenance came out b1daae10df90663dd2e2c4a8e4047dfc - character-identical to the provenance both board runs asserted - and checks.sh rc=0 with host_output_exact=19/19, host_golden_missing=0, host_token_delta 0, fidelity logit_max_delta 5.341e-05 (identical to the accepted control) and top1 10/10.","next":"Remaining acceptance steps, in order: (1) a 20-case device session on this tree - the only thing that licenses re-pinning from 5.3033 to ~5.561, and the console wedge has never permitted one (16,16,16,17,17,17); (2) on a pass, re-pin gen_lane.sh/lane_one.sh and run make capture; (3) the atomic coverage save for the four deterministic held-out shapes (#467/#468). Do NOT re-pin on this commit: main carrying the code is a mechanical fact, not a byte-exactness verdict.","risk":"main now contains code that has not passed its own 20-case device gate. Mitigated deliberately: the pin, the lane defaults and the packet all still say 5.3033, and the commit message states that explicitly, so nobody can read this as acceptance."}}
{"run":470,"commit":"8b3f1a9","metric":5.3033,"metrics":{"boot_bench_tps":5.343,"device_output_exact":20,"device_token_delta":0,"ext_decode_tps":5.2269,"gen_tokens":99,"host_output_exact":19,"internal_free":13367,"logit_max_delta":0.00005341,"logit_top1_match":10,"min_case_tps":5.07,"prefill_tps":5.59,"psram_free":2052252,"think_tps":4.2},"status":"keep","description":"Anti-repeat guard caught my own gate re-run, then the run was relaunched correctly. Gate attempt #7 from main's tree exited rc=42 with zero CASE lines: measure.sh's anti-repeat guard recognised this image's signature (recorded by the two AUTO_GROUPS=primary runs) and refused it - behaviour that exists because run #455 deleted the stale override marker that had been silently disarming the guard for every image. This run's purpose is device_output_exact over all 20 frozen cases in canonical order, never achieved for this image, so it qualifies for the documented exception: attempt #8 was launched with a run-specific reason in the worker's .auto/diag_repeat_ok, and the runner re-asserted engine_md5=b1daae10df90 while printing EXPLICIT_REPEAT_ALLOWED with that reason. No gate result yet and no acceptance claim; accepted runtime unchanged at 5.3033.","timestamp":1790260046359,"segment":1,"confidence":19.73517241379304,"asi":{"changed_assumption":"None; no speed candidate, no discard affected.","guard_proven_able_to_fail":"Third observed proof a campaign guard can fire: run #455 deleted the stale override marker specifically so stale images get refused, and the first previously-measured image to come back around WAS refused. The failure mode it protects is the campaign's worst one: runs #302-#329 logged 28 consecutive canonical runs of an unchanged image.","hypothesis":"Does the acceptance gate run from main's own tree? Attempt #7 exited rc=42 with zero CASE lines before any board work: the anti-repeat guard recognised this image signature from the two AUTO_GROUPS=primary runs. The guard is correct that the image was measured; the purpose here (20 canonical cases, never achieved) is the documented exception and needs an explicit reason.","measurement":"Guard fired as designed. Relaunched as attempt #8 with a run-specific reason in the worker diag_repeat_ok file: gate completion over all 20 frozen cases in canonical order for the tree now resident in main (provenance b1daae10df90), explicitly not a speed repeat, touching no prompt, golden, gate, metric or build flag. Runner re-asserted engine_md5 and printed EXPLICIT_REPEAT_ALLOWED carrying that reason. Zero cases emitted so far, so no gate claim.","next":"Read M-gate8-b3.log for device_output_exact. On 20/20 with golden_missing=0 and token_delta 0: re-pin 5.561 in gen_lane.sh and lane_one.sh, run make capture - integration into main is already done (#469), so acceptance becomes two commands. Afterwards delete the worker marker again, or it sits there disarming the guard for later images."}}
