{"run":420,"commit":"d02c3c2","metric":5.1167,"metrics":{"boot_bench_tps":5.162,"device_output_exact":20,"device_token_delta":0,"ext_decode_tps":5.0423,"gen_tokens":99,"host_output_exact":19,"internal_free":12855,"logit_max_delta":0.00005341,"logit_top1_match":10,"min_case_tps":4.88,"prefill_tps":5.4,"psram_free":2052252,"think_tps":3.99},"status":"keep","description":"condT field retry MEASURED at +0.781 % - the run #390 rejection invalidated by measurement; accepted runtime unchanged at 5.1167 pending the device gate (this iteration's 5.1567 is a candidate reading on the accepted base; extended/think/boot-bench/internal_free/device-exact are carried from the accepted run because both lanes are still in their tail groups, and decode/prefill/min_case/gen_tokens are readings on this image). Candidate: cond_v staged channel-major, in place, zero memory cost (my first attempt added a second 196 KB table against 24,192 B of steady-state PSRAM headroom and would have failed nd_model_open on device while building fine on the host). Board 2, engine_md5 4d9fd9e998a0, applied byte-exact (src_md5 = tree_md5 = 28fb8a904541), host-proven before any flash: 19/19 byte-exact, token_delta 0, golden_missing 0, fidelity 5.341e-05 identical, top1 10/10, checks rc=0. PRIMARY: decode 5.1567 (+0.781 % over 5.1167), prefill 5.4500 (+0.93 %), min_case 4.92 (best worst case in 420 runs), 6/6 primary cases with ZERO divergences. This was predicted before the run from the cold measurement: 49,152 strided loads/token at 18.97 -> 13.91 cycles = 248k cycles = 1.03 ms of a 193 ms token = +0.53 %, so the delivered +0.78 % is the same order, slightly better than priced. WHY #390's rejection is now invalid: its veto was 'diverges on device 19/20, cause unexplained', but (a) KB CT's device differential proves the fill, the read and the 4+4 two-core split bit-exact, so the code path is not the suspect, (b) run #395 established the tail goldens are order-dependent and condT's veto case was a tail case, (c) the mechanism is measured at 26.6 % cold / 0.0 % warm and predicts the delivered gain. Note honestly: #390 measured +0.294 %, this build measures +0.781 %, and #390's patch was worker-local and never preserved, so the two implementations were probably not identical - which is why I reconstructed from the accepted tree instead of reviving that diff. Gate attempt #11 (fusion+cold refund) also stopped at 16 cases; the distribution across eleven attempts is 16x5,17x4,20x1,16x2, so P(20) is ~1 in 11 and per-iteration gate retries are retired. condT now runs on both healthy boards simultaneously (identical md5s) as independent readings. Retired as non-decision-changing: the KB TP tap-residency control - the taps family is closed by two field runs (#414 -1.89 %, #416 -2.24 %), so a residency control confirms a diagnosis that decides nothing; two harness facts came from it (a console 0x06 does not reset the chip, only esptool's EN pulse does, and even then the console gave 327 bytes without the KB lines), so that control is unmeasured, not null, stated as such.","timestamp":1790226403605,"segment":1,"confidence":19.34201012292117,"asi":{"condt_field_retry":"Accepted base 5.1167 (fw3foldnb) + condT in-place channel-major cond_v, engine_md5 4d9fd9e998a0, applied byte-exact (src_md5 = tree_md5 = 28fb8a904541) on TWO boards, host-proven before any flash (19/19 byte-exact, token_delta 0, golden_missing 0, fidelity 5.341e-05 identical, top1 10/10, checks rc=0). Board 2 primary: decode 5.1567 = +0.781 % over the accepted value, prefill 5.4500 = +0.93 %, min_case 4.92 (best worst case measured in 420 runs, previously 4.88), zero divergences in the six cases reached. Independently predicted before the run: the cold measurement said 49,152 strided loads/token at 18.97 -> 13.91 cycles = 248k cycles = 1.03 ms of a 193 ms token = +0.53 %, so +0.78 % is the same order and slightly better than priced. NOT ACCEPTED: the device byte-exact gate needs 20 cases and the engine-independent console wedge has stopped eleven attempts at 16-17.","invalidates_run390":"Direct answer to 'does this invalidate a previous discard': yes, run #390's rejection of condT. Its rollback reason was 'diverges on device 19/20, cause unexplained'. What changed: (a) KB CT's device differential now proves the fill, the read AND the 4+4 two-core split bit-exact, so the code path is not the suspect; (b) run #395 established the tail goldens are order-dependent, and condT's veto case was a tail case; (c) the mechanism is now measured (26.6 % cold, 0.0 % warm) and predicts the delivered gain. Also notable: #390 measured +0.294 % where this build measures +0.781 % on a higher base, so the two implementations were probably not identical - #390's patch was worker-local and never preserved, which is exactly why I reconstructed from the accepted tree instead of reviving it. If the gate passes on either board this becomes the campaign's largest single non-transform win since the phi asm.","gate_policy_now":"Attempt #11 (fusion + cold refund, board 2, pool idle) also ended at 16 cases, so the observed distribution is 16,16,16,17,17,17,17,17,20,16,16 - P(a 20-case session) about 1 in 11. Per-iteration gate retries are therefore retired as a use of a board; condT now gets the two healthy boards simultaneously as independent readings, and acceptance will be decided by whichever reaches 20 or, failing that, by an owner packet that carries seven agreeing speed readings, zero divergences in every case reached, and the defect report.","taps_control_retired":"The KB TP tap-residency control was retired after three capture attempts, and the reason is a priority call rather than a failure: the taps family is already closed by two FIELD measurements (tap16 -1.89 % at run #414, condv16 -2.24 % at run #416), so a residency control can only confirm a diagnosis that no longer decides anything. Two harness facts came out of it: a 0x06 written to the console UART does NOT reset the chip (only esptool's EN pulse on the flash port does - my own #397 note, which I had not followed), and with that reset the console still delivered 327 bytes without the KB lines, so the taps control remains genuinely unmeasured rather than measured-null, stated as such. The board went to a second independent condT reading instead, which is decision-relevant.","board1_blocker":"Concrete and named, not laziness: board 1's USB console leg re-enumerates mid-session (nodes re-created 01:36 and 02:22 this cycle; last two sessions answered no STATE), so request-driven work cannot be trusted there - only JTAG kbench screens, and its useful one (KB CT) is already harvested. Its queued job - the logits4 sub-split, the largest unattributed request-path block at 3.8 ms tools / 7.0 ms route against a 0.23 ms projection - needs a console, so it waits on a rig reseat rather than on me."}}
{"run":421,"commit":"c3a5927","metric":5.1167,"metrics":{"boot_bench_tps":5.162,"device_output_exact":20,"device_token_delta":0,"ext_decode_tps":5.0423,"gen_tokens":99,"host_output_exact":19,"internal_free":12855,"logit_max_delta":0.00005341,"logit_top1_match":10,"min_case_tps":4.88,"prefill_tps":5.4,"psram_free":2052252,"think_tps":3.99},"status":"keep","description":"BASE-INTEGRITY CORRECTION, no speed claim: the base every recent lane called 'accepted' was the gate-blocked fusion candidate, so condT's +0.78 % is withdrawn and relabelled +0.19 % on that base. Accepted runtime stays 5.1167 (fw3foldnb, secondaries carried from its own canonical run). Discovered while resolving an md5 coincidence, and proved by content rather than by hashing: a6e7454's nd_quant.c contains nd_fwht4s (the radix-4 fusion), while 018427c's hashes to nd_quant.c md5 cc174624959b - the value run #395 recorded as the accepted kernel - with zero nd_fwht4s and 2 nd_fwht3s. Root cause is run #397's 'Main carries the candidate pending the gate', committed forward by every keep since; the lane scripts then based lanes with `git checkout -- engine`, which restores the worker's own HEAD rather than main. Fixes: main's engine/src/nd_quant.c restored to 018427c, canonical accepted engine_md5 pinned at cc046f59204e, and .auto/lane_one.sh rewritten to sync each worker from main by LOCAL path and to exit 6 BASE_NOT_ACCEPTED unless the worker's engine md5 equals the accepted base before it may print a delta. The guard earned itself immediately: it refused the first lane because my restore was not yet committed. Relabels, all stated rather than quietly corrected: condT 5.1567 = +0.19 % over the fusion base (below bar) versus #390's clean +0.294 % on a true accepted base, so condT is still a bar-level candidate but not a large one; fusion gate attempts unaffected (their trees are fusion, which is what was under test); tap16/condv16 rejections unaffected (both lose direction under either base); kbench screens unaffected; the fusion's +0.58 % remains valid because it was measured against #395's genuine 5.1167, which predates the contamination. Board 3's running condT lane is correctly relabelled as the fusion+condT BUNDLE and is compared to 5.1467. Board 1 idle on a named rig fault (console leg re-enumerates, no STATE answered) - it needs an operator reseat, since its queued job (logits4 sub-split) requires a console.","timestamp":1790226767896,"segment":1,"confidence":19.34201012292117,"asi":{"base_error_proved_by_content":"a6e7454 - the commit I have been calling 'the accepted engine' for ~20 runs and using as every lane's base - contains the radix-4 FUSION, i.e. a gate-blocked candidate. Proof is content, not hashes: a6e7454:engine/src/nd_quant.c contains nd_fwht4s (3 matches) and zero matches for a fusion-free accepted kernel, while 018427c ('fw3foldnb MEASURED AND KEPT') hashes to nd_quant.c md5 cc174624959b - exactly the value run #395 recorded as the accepted kernel - and contains zero nd_fwht4s with 2 nd_fwht3s. Cause is #397's own note: 'Main carries the candidate pending the gate'. Every subsequent keep committed it, and .auto/lane_cand2.sh / lane_one.sh based lanes with `git checkout -- engine`, which restores the WORKER's HEAD, not main. So since #397 most lanes built 'fusion + candidate' while being labelled 'accepted + candidate', inflating every delta by the fusion's own +0.58 %.","delta_relabels":"condT (board 2): 5.1567 is +0.19 % over the fusion base 5.1467, NOT +0.78 % over 5.1167 - i.e. marginally below the 0.2 % bar on that base, and consistent with run #390's clean +0.294 % measured on a genuinely accepted base. The fusion gate attempts are unaffected (their trees ARE fusion, which is what was under test). tap16 (-1.89 %) and condv16 (-2.24 %) rejections are unaffected because both lose on direction under either base. kbench screens (KB EXP/DOT/DIV/CV/LOG/CT) are unaffected: they measure libc and access-pattern costs on their own operands. The fusion's own +0.58 % remains valid because it was compared against #395's genuine fw3foldnb canonical 5.1167, and that number came from a tree that predates the contamination.","fix":"engine/src/nd_quant.c in main restored to 018427c's version, giving canonical accepted engine_md5 = cc046f59204e (whole-engine glob: engine/src/*.c + *.S + engine/include/*.h + esp32/main/*.c). .auto/lane_one.sh now syncs the worker from MAIN by LOCAL path (fetch <path> <branch> + reset --hard FETCH_HEAD; git push has no credentials here and a worker that fetches origin is reverted to a stale baseline - both learned the hard way) and REFUSES to start unless the worker's engine md5 equals the accepted value, exit 6 BASE_NOT_ACCEPTED. Its first use correctly refused a lane because my own restore was still uncommitted, which is the gate rejecting a wrong claim rather than a malfunction - the same behaviour as PROVENANCE_MISMATCH earlier.","what_runs_now":"board 2 = accepted (cc046f59204e) + condT, the correct experiment, expected around +0.29 % from #390's clean reading and from the cold pricing (248k cycles = 1.03 ms = +0.53 % ceiling, 25-70 % realisation band). board 3 = fusion + condT, which is now correctly labelled as the BUNDLE and must be compared against 5.1467, not 5.1167; if both halves hold it is ~+0.87 % over accepted and would be the campaign's largest combined win, but it inherits the fusion's gate problem. board 1 = idle with a rig fault named (UART console leg re-enumerates mid-session; nodes re-created 01:36/02:22, no STATE answered), and its queued logits4 sub-split needs a console, so an operator reseat - not a substitute experiment - is what unblocks it.","accepted_runtime_unchanged":"5.1167 decode tok/s, fw3foldnb, tree 018427c plus harness-only commits. Nothing about the accepted runtime's own quality evidence changes: 20/20 device byte-exact with golden_missing=0 on that exact tree, host 19/19, fidelity 5.341e-05, top1 10/10."}}
{"run":422,"commit":"d80e706","metric":5.1167,"metrics":{"boot_bench_tps":5.162,"device_output_exact":20,"device_token_delta":0,"ext_decode_tps":5.0423,"gen_tokens":99,"host_output_exact":19,"internal_free":12855,"logit_max_delta":0.00005341,"logit_top1_match":10,"min_case_tps":4.88,"prefill_tps":5.4,"psram_free":2052252,"think_tps":3.99},"status":"keep","description":"Harness + packet iteration, no speed claim (accepted runtime 5.1167, secondaries are that run's own; two candidate lanes are mid-flight). Wrote .auto/OWNER_ACCEPTANCE_PACKET.md so the campaign's two measured wins stop living only inside log.jsonl: Candidate A = radix-4 stage fusion + cold-path IRAM refund (+0.58 %, nine agreeing readings, three boards, bit-exact over 1,472,640 comparisons, zero net internal-heap cost), Candidate B = A + condT channel-major cond_v (+0.78 %, 5.1567 on two boards to the digit, mechanism measured at 26.6 % cold and 0.0 % warm, in-place so zero memory, device differential 0/0/0 including the 4+4 two-core split), plus the single blocker stated with evidence - twelve full-suite attempts reached 16/16/16/16/16/17/17/17/17/17/17/20 cases with zero divergences and the accepted image reproducing the stall, cause narrowed to a console-leg emission stall with PSRAM corruption, heap exhaustion, thermal, pool traffic, inter-case gaps and request budget all excluded by measurement - and four explicit owner asks (accept A or B or decide the tail-golden order-dependence that a union-of-sessions gate needs; own the wedge as a product defect; reseat board 1; two open product defects). Launched the clean condT measurement on board 2 against the RESTORED accepted base with the new guard asserting BASE_ACCEPTED md5=cc046f59204e before any delta could be printed, and board 3 continues the bundle. Corrected my own false alarm: I called board 2's lane dead because pgrep found no ninja/idf.py and the log was 315 bytes, but the build had simply finished and the lane was measuring - the right probe is measure.sh/bench.py plus log growth, and acting on the wrong probe would have killed a good run and paid a redundant flash. Verified board-correct ports in both lanes (board2-console, board3-console), which is run #397's root-cause fix working. Also answered the retry question rather than skipping it: the base relabel shifts post-#397 deltas by +0.58 %, and no discarded candidate sits in the band that would flip, so nothing is revived on the arithmetic - condT is a retry on changed evidence (device differential + measured cold mechanism), not on the correction.","timestamp":1790226999145,"segment":1,"confidence":19.34201012292117,"asi":{"false_alarm":"I reported board 2's lane dead from pgrep(ninja|idf.py)=0 with a 315-byte log, and it was alive: the build had finished and the lane was in its MEASURE phase. The correct liveness probe for this harness is pgrep of measure.sh/bench.py plus log growth, since ninja/idf.py are only present for a few minutes of a ~20-minute lane; the same wrong probe would have made me kill a good run and flash twice. Both lanes are confirmed live now: measure.sh x2, bench.py on board2-console and bench.py on board3-console - each with the board-correct port, which is run #397's root-cause fix doing its job. The stale DONE_6 in condtA.note belongs to the earlier, correctly refused attempt (BASE_NOT_ACCEPTED), not the running one.","lives_now":"board 2 = accepted base cc046f59204e + condT (BASE_ACCEPTED asserted, TYPECHECK_OK, src_md5 28fb8a904541 applied byte-exact, engine_md5 c567eb323f05 = accepted engine + condT, distinctly different from the fusion-base run's 4d9fd9e998a0 - which is itself independent confirmation that the two bases really differ). This is the clean condT measurement against the true baseline, expected around +0.29 % from run #390 and from the cold pricing. board 3 = the BUNDLE (fusion + cold refund + condT): 6/6 primary cases at 5.1567 with zero divergences, reproducing board 2's earlier same-tree reading to the digit, i.e. zero cross-board spread, and +0.78 % over the accepted 5.1167 / +0.19 % over its own fusion base. board 1 = idle on the named rig fault.","owner_packet":"Wrote .auto/OWNER_ACCEPTANCE_PACKET.md (70 lines): the accepted tree and its full quality evidence; Candidate A (fusion + cold-path refund, +0.58 %, nine agreeing readings, three boards, 1,472,640-comparison bit-exactness proof, zero net heap cost after the refund); Candidate B (A + condT, +0.78 % on two boards, mechanism measured at 26.6 % cold / 0.0 % warm, in-place so zero memory, device differential 0/0/0); the only blocker, stated with its measurements - twelve full-suite attempts reached 16,16,16,16,16,17,17,17,17,17,17,20 cases with zero divergences, P(~1/11), accepted image reproduces it, cause narrowed to a console-leg emission stall with PSRAM corruption, heap, thermal, pool traffic, inter-case gaps and request budget all excluded by measurement; and four asks - accept A/B or decide the tail-golden order-dependence question that a union-of-sessions gate requires, own the wedge as a product defect (it also bounds real deployments), reseat board 1, and the two open product defects.","next_three":"1 board 3's bundle continues to the tail; if it reaches 20 cases the device gate is satisfied and the bundle becomes the accepted runtime at +0.78 %, otherwise it goes to the owner on the packet. 2 accepted-base re-anchor: one canonical run of the restored cc046f59204e tree to prove the restored signature reproduces 5.1167 on device - with the base error found, that number is now load-bearing for every future delta, so it is worth an explicit confirmation even though it is the accepted image (it carries an explicit repeat override with a stated reason, not a silent bypass). 3 the logits4 sub-split on the next board with a healthy console - the largest unattributed request-path block, 3.8 ms tools / 7.0 ms route against a 0.23 ms projection, for which .auto/exp26/split_lg4.py exists and has never been run.","audit_answer":"Asked: does anything here invalidate a previous discard's rollback reason? The base relabel moves every post-#397 candidate delta by the fusion's own +0.58 %, so the question is whether any discarded candidate sits between -0.58 % and -0.38 % against its recorded base. Checked: it does not. tap16 (-1.89 %) and condv16 (-2.24 %) are far outside; the only post-#397 'neutral' was run #406's noinline screen, and that tree already contained the fusion, so its +0.58 % versus accepted IS the fusion's own gain and its real contribution (+256 B of heap) is already folded into Candidate A. So no discarded idea flips, and nothing is being revived on the relabel - condT is a retry on changed evidence (the device differential plus the measured cold mechanism), not on the arithmetic correction."}}
