{"run":444,"commit":"25e6706","metric":5.3033,"metrics":{"boot_bench_tps":5.343,"device_output_exact":20,"device_token_delta":0,"ext_decode_tps":5.2269,"gen_tokens":99,"host_output_exact":19,"internal_free":13367,"logit_max_delta":0.00005341,"logit_top1_match":10,"min_case_tps":5.2,"prefill_tps":5.755,"psram_free":2052252,"think_tps":4.2},"status":"keep","description":"Real cross-core wake cost derived from field data, replacing the void #344 figure: tap96 added exactly 8 nd_parallel_rows splits per decode token (q tap projection, dim=576: 3 units of 256 fail rows_dual_core's half<2 guard and run serially; 6 units of 96 pass it) and cost 0.094 % = 181 us/token, i.e. 22.7 us / 5,442 cycles per added split, or 7.6 us / 1,814 cycles if all 24 tap units had split. So wake+dispatch+imbalance is ~1.8k-5.4k cycles, at least 80x the 23 cycles the invalidated kbench screen recorded (it never installs nd_parallel_rows, so it priced a serial indirect call). Consequence with a number attached: a job must be worth tens of microseconds to be worth splitting, which both resurrects the old 'no split smaller than a kron half' rule on measured grounds and prices a new one-line candidate - the pair-table build (13.6 us total, itself split 18 times per token) may be paying a >= 7.6 us wake to save <= 6.8 us, so running lutb_rows serially is predicted +0.03..0.07 % and banked for a bundle rather than run alone. Derived measurement, zero boards; caveats stated in the ASI (it bounds wake+imbalance together, from a single near-quantum reading).","timestamp":1790254296964,"segment":1,"confidence":19.519781718963245,"asi":{"caveats":"This is a derived quantity, not an isolated microbenchmark: it bounds (wake + dispatch + 96-vs-256 unit imbalance) together, from ONE tap96 reading (-0.094 %, single board) whose own magnitude is near the metric quantum, and from assuming the 193 ms token scale. Its honest form is therefore a range of 7.6-22.7 us, an upper bound on the wake itself. It replaces #344's figure only in ORDER OF MAGNITUDE, but that is what decides the family: 23 cycles meant splitting was free; 1,800-5,400 cycles means a job must be worth tens of microseconds to be worth splitting.","field_derived_measurement":"The real cross-core wake+dispatch cost, measured from field data instead of the invalidated kbench screen. tap96 (give dim=576 six 96-column units so rows_dual_core's half<2 guard stops running the Q tap projection single-core) changed exactly the q tap projection: tap_projection is called per layer for q/k/v, dim=576 gives (576+255)/256 = 3 units so half=1 and the guard runs it serially, while 96-column units give 6 units and half=3 so it splits. That is 8 EXTRA splits per decode token, and the token got 0.094 % slower = 181 us/token = 22.7 us (5,442 cycles) per added split. If instead all 24 tap units had split, the same reading implies 7.6 us (1,814 cycles). So wake+dispatch+imbalance is between ~1.8k and ~5.4k cycles, at least 80x the 23 cycles #344 recorded - and #344 was void anyway because kbench never installs nd_parallel_rows.","hypothesis":"#344's 'the cross-core handshake costs 23 cycles, hot or parked' is void (kbench never assigns nd_parallel_rows, so it priced a serial indirect call). Every 'small jobs are not worth splitting' and 'splitting is free' conclusion in the ledger rests on that number, and tap96's -0.094 % is field evidence that the real cost is not 23 cycles. Derive the real cost from data already measured rather than spending a board: tap96 changed a known number of nd_parallel_rows splits and a known time.","new_candidate_priced":"The lut build is 13.6 us TOTAL per call and is itself split via nd_parallel_rows(lutb_rows, in_pad/2). If one wake costs >= 7.6 us, then splitting 18 builds per token pays at most 6.8 us of parallelism against a >= 7.6 us wake - i.e. the pair-table build's split is plausibly net negative. One-line candidate: run lutb_rows serially (drop the split for that job) and predict +0.03..0.07 %, sub-bar alone, banked for a bundle per run #431's precedent. Same arithmetic now supports the old 'do not split anything smaller than a kron half' rule with a real number instead of the bogus one.","payload":{"derived_cycles_range":[1814,5442],"derived_us_range":[7.6,22.7],"extra_splits_per_token":8,"lutbuild_calls_per_token":18,"lutbuild_us":13.6,"tap96_delta_pct":-0.094}}}
{"run":445,"commit":"7b8c0db","metric":5.3033,"metrics":{"boot_bench_tps":5.343,"device_output_exact":20,"device_token_delta":0,"ext_decode_tps":5.2269,"gen_tokens":99,"host_output_exact":19,"internal_free":13367,"logit_max_delta":0.00005341,"logit_top1_match":10,"min_case_tps":5.2,"prefill_tps":5.755,"psram_free":2052252,"think_tps":4.2},"status":"keep","description":"bundle86 built and launched: bundle78 (asmemo + radix-4 stage fusion) plus the one candidate run #444's derived wake cost priced - nd_cq_lut_build's own cross-core split removed, calling lutb_rows serially, because the whole build is 13.6 us and a wake costs 7.6-22.7 us per split (18 builds per token), and bit-exactness is by construction since the split only chose which core computed which disjoint pair range. Host gates on the standalone edit green (checks.sh rc=0, fidelity 5.341e-05 identical, host_golden_missing 0). Worker tree verified by content rather than by the installer's label: 1 serial call, 0 parallel lutb calls, nd_quant.c md5 0a956c19d88d, runner PROVENANCE engine_md5 1b3d19b95757 distinct from bundle78's 81d89766c97e. No measurement yet: primary reading lands next window, to be compared against both the accepted 5.3033 and bundle78's 5.4533/5.4567 (predicted increment +0.03..0.07 %, honest prior that it may measure null, which would itself close the question #344's bogus 23-cycle figure kept open). Accepted runtime unchanged at 5.3033.","timestamp":1790254509085,"segment":1,"confidence":19.519781718963245,"asi":{"caveat":"No measurement yet - the lane was launched with its tree content verified and its primary reading will land in the next window. All secondaries are the accepted run's, carried. The prediction (+0.03..0.07 % over bundle78's 5.4533) is derived, not observed, and the honest prior is that it may measure as null: the derived wake cost has a 3x range and the wake may overlap other work, in which case the build's split was already free and lutserial is a no-op, which is still the answer to the question the retired #344 number prevented anyone from asking.","hypothesis":"The pair-table build is 13.6 us TOTAL and is split 18 times per token by nd_parallel_rows, so it pays a cross-core wake measured (from the tap96 field A/B, run #444) at 7.6-22.7 us per split to save at most half of 13.6 us. Running lutb_rows serially should therefore be a small net win, and because the split only chose which core computed which disjoint pair range, the per-slot arithmetic is unchanged, i.e. bit-exact by construction.","implementation_note":"First draft of the bundle file wrapped the change in #ifdef ND_LUT_SERIAL_LUTB - withdrawn before use: an unwired knob is exactly the config-surface trap this ledger records repeatedly. The shipped candidate changes the line unconditionally.","implementation_note_2":"Verified the flashed tree by content, not by the installer's own label: board 2's nd_quant.c contains 1 occurrence of the serial call and 0 occurrences of nd_parallel_rows(lutb_rows (md5 0a956c19d88d), while the runner's PROVENANCE reports engine_md5=1b3d19b95757, distinct from bundle78's 81d89766c97e. The apply script still prints the bundle78 label because it is a copy - disclosed rather than polished, since the content assertion, not the label, is what guards the tree.","payload":{"board2_engine_md5":"1b3d19b95757","board2_nd_quant_md5":"0a956c19d88d","checks_rc":0,"expected_delta_vs_bundle78_pct":"0.03..0.07","fidelity":"5.341e-05","lutserial_nd_quant_md5":"81a3bc2e18ae"},"next_action_hint":"Read /root/board-pool/batches/M-bundle86-b2.log for the primary decode. Compare against BOTH references: the accepted 5.3033 (total bundle effect, expect ~+2.9 %) and bundle78's 5.4533/5.4567 (the lutserial increment, expect +0.03..0.07 % i.e. ~5.4550-5.4570). If the increment is null, record that the wake overlaps other work and close the fine-grained-split question; if positive, keep it in the acceptance bundle. Acceptance of the whole stack is still blocked by the console-wedge defect, not by evidence: four gate attempts have reached 16,16,17,17 cases with zero divergences.","what_this_iteration_established":"Built and verified bundle86 = bundle78 (asmemo + radix-4 fusion) + serial pair-table build, and launched it on healthy board 2. The change is the one candidate that run #444's derived wake cost priced: nd_cq_lut_build's own nd_parallel_rows split removed, because 13.6 us of work split across a wake costing 7.6-22.7 us is a net loss. Host gates on the standalone edit were green (checks.sh rc=0, fidelity 5.341e-05 identical, golden_missing 0) and the worker's flashed tree was verified by CONTENT, not by the installer's label."}}
{"run":446,"commit":"7b8c0db","metric":5.435,"metrics":{"boot_bench_tps":5.343,"device_output_exact":20,"device_token_delta":0,"ext_decode_tps":5.2269,"gen_tokens":99,"host_output_exact":19,"internal_free":13367,"logit_max_delta":0.00005341,"logit_top1_match":10,"min_case_tps":5.19,"prefill_tps":5.7317,"psram_free":2052252,"think_tps":4.2},"status":"discard","description":"lutserial DISCARDED -0.335 %: making the pair-table build serial (removing 18 nd_parallel_rows splits per token) made the token SLOWER, not faster - bundle86 measured decode 5.4350 against bundle78's 5.4533/5.4533/5.4567, with prefill 5.7317 vs 5.755 (-0.41 %) and min_case 5.19 vs 5.20, same sign on all three so not noise. The build's split was genuinely earning its keep (~35 us/token of parallel build lost). The finding is the model it forces: tap96 showed splitting MORE costs 0.094 % when the peer core was otherwise parked, lutserial shows splitting LESS costs 0.335 % when the build sits right before the GEMV splits that keep the worker hot, so the cross-core wake is STATE-DEPENDENT - cheap against a hot peer, expensive against a parked one. That retires my own run #444 derived constant (7.6-22.7 us/split is wake+imbalance in one schedule state, not a wake cost) and shows #344's void 23-cycle figure was wrong in magnitude yet accidentally right in direction for the hot case only. Accepted runtime unchanged at 5.3033; bundle78 remains the acceptance candidate.","timestamp":1790255208479,"segment":1,"confidence":19.519781718963245,"asi":{"better_model_of_the_wake":"Two field A/Bs point in opposite directions, and that is the finding. Splitting MORE costs (tap96: 8 extra splits, -0.094 %) when the peer core was otherwise parked, and splitting LESS costs (lutserial: 18 fewer splits, -0.335 %) when the build sits immediately before the GEMV splits that keep the worker hot. So the wake is STATE-DEPENDENT: cheap against a hot peer, expensive against a parked one. That retires my own #444 derived constant - 7.6-22.7 us per split is not a wake cost, it is wake+imbalance in one specific schedule state - and it also means #344's void 23 cycles was wrong in magnitude but accidentally right in direction for the hot case only.","hypothesis":"nd_cq_lut_build's own nd_parallel_rows split pays a cross-core wake (derived at 7.6-22.7 us) to save at most half of its 13.6 us, 18 times per token, so calling lutb_rows serially should be a small net win. Bit-exact by construction.","measurement":"bundle86 = bundle78 + serial pair-table build measured decode 5.4350 against bundle78's 5.4533 / 5.4533 / 5.4567 - i.e. -0.335 %, with prefill 5.7317 vs 5.755 (-0.41 %) and min_case 5.19 vs 5.20. Same sign on all three, so this is not noise: making the build serial costs about 0.65 ms per token, roughly 35 us/token of lost parallel build. Rejected and not integrated; bundle78 (asmemo + radix-4 fusion) stays the acceptance candidate at 5.4533/5.4567.","next_action_hint":"Reverse direction is now the live question, and it is testable without new machinery: if a hot-peer wake is cheap, then jobs the campaign refused to split for lack of a cheap wake (rope over heads, the engram slot rows, per-head norms) may pay after all - but ONLY where the worker is already hot, and run #444's own #344 lesson says do not trust that either without measuring the split you mean. Cheapest honest next step is a cross-board repeat of bundle78's primary on a healthy board while its gate remains blocked by the console-wedge defect, or a fine-grained split of one of those phases measured directly.","payload":{"delta_vs_bundle78_pct":-0.335,"decode":5.435,"min_case":5.19,"prefill":5.7317,"splits_removed_per_token":18}}}
{"run":447,"commit":"7b8c0db","metric":5.3033,"metrics":{"boot_bench_tps":5.343,"device_output_exact":20,"device_token_delta":0,"ext_decode_tps":5.2269,"gen_tokens":99,"host_output_exact":19,"internal_free":13367,"logit_max_delta":0.00005341,"logit_top1_match":10,"min_case_tps":5.07,"prefill_tps":5.59,"psram_free":2052252,"think_tps":4.2},"status":"discard","description":"bundle86 (bundle78 + serial pair-table build) MEASURED -0.336 % and reverted, with causal attribution left OPEN rather than narrated: decode 5.4350 on board 2 (6/6 primary cases) versus bundle78's 5.4533 on the same board, while the directly removed parallel work is only 18 x 6.8 us = 122 us = 0.063 % of the token - a 5x gap this run does not explain. My first mechanism (serialising let core 1 park, repaying a wake on the following GEMV splits) is refuted as an inference, not data: worker_task blocks on s_go after every job anyway and only 18 builds/token changed, not the 44 GEMV barriers, so nothing here measures a cross-core wake. Kept: the measurement and the rejection. Next: the app-path actual-split screen (time a trivial one-unit split job after priming, where nd_parallel_rows is really two-core - unlike #344's kbench, which timed a serial indirect call because kbench never assigns nd_parallel_rows), plus the structural follow-ups it would license. Accepted runtime stays 5.3033; bundle78 (5.4533/5.4533/5.4567) remains the acceptance candidate, blocked only by the console-wedge gate defect.","timestamp":1790255437574,"segment":1,"confidence":19.513126491646815,"asi":{"attribution_status":"OPEN, and deliberately so. My first reading - that serialising the build let core 1 park and repaid a wake on the following GEMV splits - is REFUTED as an inference before it was ever data: worker_task already blocks on s_go after EVERY job, so the worker parks between jobs whether or not this build was split, and only 18 LUT builds/token changed, not the 44 GEMV barriers. Nothing in this run measures a wake. What is measured is only: removing this particular split costs 0.336 %, which is 5x the 0.063 % the halved build accounts for, so ~80 % of the loss is unexplained and stays unexplained until a real screen says otherwise.","hypothesis":"bundle86 = bundle78 + serial pair-table build: run lutb_rows on the calling core instead of splitting it, priced in #444 on the theory that a cross-core wake is not worth paying 18 times per token to halve a 13.6 us job.","kept":"the measured regression only","measurement":"decode 5.4350 on board 2, 6/6 primary cases, versus bundle78's 5.4533 measured on the SAME board = -0.336 %. Upper bound on the directly removed work: 18 x 6.8 us = 122 us = 0.063 % of a 193 ms token. So the regression is ~5x its own arithmetic and this iteration does not close the causal question - it just refuses the candidate.","next":"The mentor's corrected instruction is to run the actual-split screen rather than close the question analytically a third time, and it is a small job in the app path (where nd_parallel_rows is genuinely the two-core implementation, unlike kbench): after priming, time N iterations of a trivial one-unit split job and print min/median CCOUNT. Recorded in .auto/ideas.md as the next measurement for a free board, alongside the two structural follow-ups it would license - feeding core 1 build-and-rows as one job, and fusing the Q/K/V/gate projections that currently cost 4 barriers per layer. bundle86's serial-lutb change is reverted and not kept.","rule":"A regression that exceeds its own arithmetic is a question, not an explanation. Keep the number, refuse the candidate, and leave the mechanism open until a screen that actually exercises the two-core path measures it - #344 (a serial indirect call timed as a wake) and this run's park story are the same error in opposite directions."}}
{"run":448,"commit":"7c2b79f","metric":5.3033,"metrics":{"boot_bench_tps":5.343,"device_output_exact":20,"device_token_delta":0,"ext_decode_tps":5.2269,"gen_tokens":99,"host_output_exact":19,"internal_free":13367,"logit_max_delta":0.00005341,"logit_top1_match":10,"min_case_tps":5.07,"prefill_tps":5.59,"psram_free":2052252,"think_tps":4.2},"status":"keep","description":"Premise correction, no measurement: the 13.6 us pair-table build I have been citing since #443 is a factor-10 misreading of #344's raw kbench line (lut_build_cyc=32598 at cycles_per_us_x100=23999 = 135.8 us), and neither the 13.6 nor the 135.8 figure is a production build time because that bench allocated xh/lut with ND_ALLOC (PSRAM) while production m->lut is ND_ALLOC_FAST internal SRAM. This voids two published dispositions: #443's 'making all 18 LUT builds free buys 0.127 %, therefore the wrapper-cost class is closed sub-bar' (at 135.8 us x 18 it would be >1 % of the token - the class is open again, but must be priced on production-shaped operands, not on either inherited number), and #447's subtraction, which claimed bundle86's -0.336 % exceeded its arithmetic by 5x and left the residual unexplained - with the corrected figure the removed work is ~1.2 ms, so serialising explains the regression outright and the park/wake inference I had already flagged as untested is now unnecessary and is retracted. Accepted runtime unchanged at 5.3033; bundle78 remains the acceptance candidate. Lanes continue: b1 actual-split/fusion screen (its printf also mislabels cycles/240000 as microseconds), b3 five-instruction ASM norm rebias, b2 bounded RX-loss.","timestamp":1790255769751,"segment":1,"confidence":19.506475800954323,"asi":{"correction_1":"32,598 cycles at cycles_per_us_x100 = 23999 is 135.8 us, not 13.6 us - a factor-of-10 slip in my citation, and I carried it into two published numbers.","correction_2":"Neither figure is a production-shaped measurement anyway: that bench allocated xh and lut with ND_ALLOC (PSRAM) while production m->lut is ND_ALLOC_FAST (internal SRAM), so it prices a different memory system than the one that ships.","invalidated":["#443's 'making all 18 pair-table builds free buys 0.127 %' - the whole wrapper-cost census was priced with this number, so its DISPOSITION (closed, sub-bar) is void, not just its magnitude: at 135.8 us x 18 = 2.45 ms/token the build would be over 1 % of the token, and the class reopens.","#447's subtraction. I said bundle86's -0.336 % exceeded its own arithmetic (122 us of removed work) by 5x and treated the residual as an open question; with 135.8 us per build the removed work is ~1.2 ms, so the regression is fully explained by serialising a large job and there is NO gap to explain. The wake inference in #447 - which I had already flagged as untested - is now not merely untested but unnecessary, and is retracted."],"hypothesis":"Correcting two premises that I derived from a single inherited cycle count, both of which were load-bearing in published closures.","note":"The mentor also rejected a LUT dedupe I started drafting: q/k/v/gate already share ONE build (nd_model.c:1507) and the engram key/value share one too, so a memo there can never hit. It was abandoned before any file was installed - checked against the call sites rather than shipped, which is the cheaper form of the same lesson.","next_action_hint":"Keep the three lanes: b1 the corrected actual-split/fusion screen (also fix its printf: bsp/240000.0 mislabels cycles as us; cycles/240.0 is us), b3 the five-instruction ASM norm rebias, b2 the bounded RX-loss test. If the build's true cost matters, measure it with production-shaped operands (internal m->lut) rather than reusing either inherited number.","still_valid":"both numbers remain measured facts about what they measured - a PSRAM-shaped LUT build costs 32,598 cycles, and a hot-back-to-back one costs 816. Neither is the production build time, and no closure may cite either as such."}}
