{"run":595,"commit":"b9b54f2","metric":5.6117,"metrics":{"boot_bench_tps":5.658,"device_output_exact":18,"device_token_delta":52,"ext_decode_tps":5.5177,"gen_tokens":99,"host_output_exact":19,"internal_free":8415,"logit_max_delta":0.00005341,"logit_top1_match":10,"min_case_tps":5.35,"prefill_tps":5.925,"psram_free":2052252,"think_tps":4.39},"status":"keep","description":"Assembly-path gate falsification: detection confirmed, enforcement gap found. A deliberate wrong seed inside nd_lut2_rows_tie1n (group partials reset from the row total f5 instead of the +0.0 register f6, line 670 of the shipped kernel) produced device_output_exact=0/6 with device_token_delta=99 on the image that otherwise reads 6/6 - so the device byte-exact comparison genuinely sees hand-written assembly corruption that the host goldens are structurally blind to, which is exactly the property the campaign's 'no speed bought with quality' claim has rested on for every kept asm change including the seed winner. The finding is that LANE_RC stayed 0, because measure.sh's DEVICE_OUTPUT_DIVERGED exit is restricted to full-group runs per #298: a primary-only screen reports divergence without failing it. No prior verdict was wrong since the printed exact count was read on every lane, but exit status alone is not sufficient on restricted runs, so the next step is a metric-safe measure.sh hardening that fails a restricted run when device_output_exact does not equal device_cases. Board 3 is hash-verified back to exactly 4d3094578050 with the mutation gone; no speed claim is made from this image. Pin unchanged at 5.3033.","timestamp":1790278679250,"segment":1,"confidence":10.871056241426617,"asi":{"detection_verified":"The deliberate tie1n defect was detected: device_output_exact=0/6 with device_token_delta=99 on the same image that reads 6/6 when correct, so the device byte-exact comparison does see hand-written assembly corruption that the host pre-check cannot see (host goldens compile the C fallback). The gate is falsifiable on the asm path - the campaign's central licence now holds for assembly too.","enforcement_gap_found":"LANE_RC was 0. measure.sh's DEVICE_OUTPUT_DIVERGED exit is deliberately restricted to full-group runs (#298), so a primary-only lane REPORTS divergence without FAILING it. No past verdict was wrong, because I read the printed exact count every time, but the exit code alone is not sufficient evidence on a restricted lane.","fix_next":"Harden measure.sh so a restricted run also fails when device_output_exact != device_cases. This is metric-safe - it can only turn a green lane red - and it removes the trap where an assembly-breaking candidate could be flashed, measured, and left rc=0 for whoever reads only the exit status.","hypothesis":"Falsify the device byte-exact gate on the hand-written assembly path by seeding tie1n's group partials from the row total instead of +0.0.","rollback":"Board 3 restored from /tmp/b3-s.S and its tree hash verified back to exactly 4d3094578050 with the mutation string gone.","speed_scope":"No speed claim: the mutation is a correctness probe, and the 0/6 image's decode line is meaningless."}}
{"run":596,"commit":"ebbba30","metric":5.6117,"metrics":{"boot_bench_tps":5.658,"device_output_exact":18,"device_token_delta":52,"ext_decode_tps":5.5177,"gen_tokens":99,"host_output_exact":19,"internal_free":8415,"logit_max_delta":0.00005341,"logit_top1_match":10,"min_case_tps":5.35,"prefill_tps":5.925,"psram_free":2052252,"think_tps":4.39},"status":"keep","description":"Closed the enforcement gap #595 measured: a restricted AUTO_GROUPS lane used to report byte-exactness without failing on it, so a hand-written-assembly defect could print device_output_exact=0/6 and still exit 0 (which is precisely what the deliberate tie1n mis-seed did). .auto/measure.sh now has a second device gate for restricted runs - when AUTO_GROUPS is set and this is not an AUTO_SAVE run, it compares device_output_exact against device_cases from the bench log and exits 1 with DEVICE_OUTPUT_DIVERGED_RESTRICTED, or prints DEVICE_GATE_OK_RESTRICTED. It fires only when the run actually printed the value, so a build or flash failure with no compare block is unaffected, and the full-groups gate plus the documented re-baseline escape (SAVE=1) are untouched. bash -n clean. Metric-safe by construction: this can only turn a green lane red, never the reverse, and cannot move a measured tok/s. Honest limit recorded: the new clause has not been exercised on a live lane yet - the next restricted candidate lane exercises the positive path, and the negative path is already proven reachable by #595's mutation. Pin unchanged at 5.3033.","timestamp":1790278782709,"segment":1,"confidence":10.871056241426617,"asi":{"hypothesis":"Close the enforcement gap run #595 found: make a restricted AUTO_GROUPS lane fail when device_output_exact does not equal device_cases, so an assembly defect cannot print 0/6 and still exit 0.","implementation":"Added a block to .auto/measure.sh after the existing full-groups device gate: when AUTO_GROUPS is set and this is not an AUTO_SAVE run, read device_output_exact and device_cases from the bench log and exit 1 with DEVICE_OUTPUT_DIVERGED_RESTRICTED if they differ, else print DEVICE_GATE_OK_RESTRICTED. bash -n clean. The comparison runs only when the run actually printed the value, so a build or flash failure that produces no compare block is unaffected.","why_safe":"It can only convert a green lane into a red one; it never relaxes a check, cannot change a measured tok/s, and leaves the full-groups path and the documented re-baseline escape (SAVE=1) exactly as #296/#298 designed them.","not_yet_falsified":"Honest limit: the new clause has not yet been exercised on a live lane. The next restricted candidate lane exercises the positive path (it should print DEVICE_GATE_OK_RESTRICTED); the negative path is already known to be reachable because #595's mutation really did print 0/6, and any future falsification run can reuse that mutation to prove the exit now fires.","propagation":"Only main carries the fix so far; workers keep their own copies of measure.sh, so the clause reaches a worker when its tree is next synced. Lanes running before that keep the old report-only behaviour, which is why reading the printed exact count remains mandatory."}}
{"run":597,"commit":"ebbba30","metric":5.6117,"metrics":{"boot_bench_tps":5.658,"device_output_exact":18,"device_token_delta":52,"ext_decode_tps":5.5177,"gen_tokens":99,"host_output_exact":19,"internal_free":8415,"logit_max_delta":0.00005341,"logit_top1_match":10,"min_case_tps":5.35,"prefill_tps":5.925,"psram_free":2052252,"think_tps":4.39},"status":"keep","description":"Started the negative-path falsification of the gate I just added, because a check that has never been observed to fail is worth nothing (#296-#298 found four such checks in this campaign's own harness, all failing in the direction of reported success). Re-applied the same scoped deliberate defect - nd_lut2_rows_tie1n's group partials seeded from the row total f5 instead of the +0.0 register f6 - on board 3, this time under main's hardened measure.sh copied into the worker so the new clause is the one actually executing. Pass condition is a red lane: DEVICE_OUTPUT_DIVERGED_RESTRICTED with a non-zero exit. Run #595 established the detection half under the old script (device_output_exact 0/6, device_token_delta 99, LANE_RC 0), so a non-zero exit here closes the enforcement gap by measurement rather than by reading the diff. Provenance 88be02372810 asserted by the runner, anti-repeat override deleted so the guard stays armed, board 3's clean .S kept at /tmp/b3-s.S for immediate restore to 4d3094578050. No speed claim in either direction; pin unchanged at 5.3033.","timestamp":1790278815884,"segment":1,"confidence":10.871056241426617,"asi":{"hypothesis":"Prove the new clause can actually fire: re-run the same deliberate tie1n mis-seed under the hardened measure.sh and require DEVICE_OUTPUT_DIVERGED_RESTRICTED with a non-zero exit.","setup":"Copied main's hardened .auto/measure.sh into board 3's checkout (workers keep their own copies, so without this the old report-only behaviour would have run), re-applied the scoped mis-seed inside the nd_lut2_rows_tie1n label range - not the unused tie1 kernel, which was the trap in #594 - asserted the new provenance 88be02372810, and removed the repeat override so the anti-repeat guard stays armed.","pass_condition":"A red lane: log contains DEVICE_OUTPUT_DIVERGED_RESTRICTED 0/6 and LANE_RC is non-zero. #595 already showed the detection half (device_output_exact 0/6, token_delta 99) with LANE_RC 0 under the old script, so if this run exits non-zero the gap is closed by measurement rather than by reading the diff.","cost_and_risk":"One primary-group lane on an idle board, roughly 20 minutes, on a deliberately wrong image that is never a candidate. Board 3's clean .S stays at /tmp/b3-s.S and the tree is restored to 4d3094578050 immediately after.","speed_scope":"No speed claim in either direction; a broken kernel's decode line is meaningless."}}
{"run":598,"commit":"ebbba30","metric":5.6117,"metrics":{"boot_bench_tps":5.658,"device_output_exact":18,"device_token_delta":52,"ext_decode_tps":5.5177,"gen_tokens":99,"host_output_exact":19,"internal_free":8415,"logit_max_delta":0.00005341,"logit_top1_match":10,"min_case_tps":5.35,"prefill_tps":5.925,"psram_free":2052252,"think_tps":4.39},"status":"keep","description":"Gate falsification COMPLETE on the assembly path, both halves. Under the hardened measure.sh, the deliberate nd_lut2_rows_tie1n mis-seed (group partials seeded from the row total f5 instead of +0.0) printed DEVICE_OUTPUT_DIVERGED_RESTRICTED 0/6 and the lane exited LANE_RC=1 - so the byte-exact veto now actually stops a hand-written-assembly defect instead of merely reporting it, and the enforcement gap #595 measured is closed by measurement rather than by reading the diff. This matters more than another 0.1 pct screen: host goldens compile the C fallback and cannot see Xtensa defects at all, so the device comparison is the only thing standing between a fast-but-wrong asm change and a kept 'win', and it now has a demonstrated way to fail on both the full-suite path (#298) and the restricted primary-only path that every candidate screen uses. Board 3 is hash-verified back to exactly the clean acceptance base 4d3094578050 with the mutation gone, its expectation file removed and its session closed; boards 1 and 2 still hold the seed stack at 61861dd9886c. No speed claim - a deliberately broken kernel's decode line is meaningless. Pin unchanged at 5.3033; the seed stack stays fully evidenced and owner-gated.","timestamp":1790279571832,"segment":1,"confidence":10.871056241426617,"asi":{"detection_and_enforcement":"Detection was already proven in #595 (device_output_exact 0/6, token_delta 99, LANE_RC 0 under the old script). Enforcement is now proven: the hardened measure.sh printed DEVICE_OUTPUT_DIVERGED_RESTRICTED 0/6 and the lane exited LANE_RC=1 on the same deliberate nd_lut2_rows_tie1n mis-seed. That is the second half of the property, obtained by mutation rather than by reading the diff.","hypothesis":"Prove the new restricted-run device gate can actually fire, by re-running the deliberate tie1n mis-seed under the hardened measure.sh.","mutation":"group partials seeded from the row total f5 instead of the +0.0 register f6, inside the tie1n label scope","expected_and_measured":"expected DEVICE_OUTPUT_DIVERGED_RESTRICTED with non-zero exit; measured exactly that: DEVICE_OUTPUT_DIVERGED_RESTRICTED 0/6 and LANE_RC=1","board_state":"Board 3 restored from /tmp/b3-s.S, expectation file removed, tmux session closed; tree hash recomputes to exactly 4d3094578050, the clean acceptance base, with the mutation string gone. Board 1 holds the seed stack (prov 61861dd9886c) and board 2 the same seed base, so no board is left on a broken image.","campaign_rule_count":"Gates now proven falsifiable: host byte-exact, fidelity reference, primary-prompt hash, quality-trade veto, non-zero test count, device byte-exact on full runs, and device byte-exact on restricted runs including the hand-written assembly path. That last one is the one that guards every kept asm change in this campaign.","next":"The gate fix lives in main and must be copied to the workers when their trees are next synced; until then a worker lane is still report-only, so reading device_output_exact stays mandatory. No performance candidate carries measured mass above the 0.2 pct bar at this stack, so the honest next engineering work is owner-facing admission plus the open product defects."}}
{"run":599,"commit":"3a91185","metric":5.6117,"metrics":{"boot_bench_tps":5.658,"device_output_exact":18,"device_token_delta":52,"ext_decode_tps":5.5177,"gen_tokens":99,"host_output_exact":19,"internal_free":8415,"logit_max_delta":0.00005341,"logit_top1_match":10,"min_case_tps":5.35,"prefill_tps":5.925,"psram_free":2052252,"think_tps":4.39},"status":"keep","description":"Wrote and ran the host-side bit-exactness guard for the seed win (.auto/exp87/test_seed_equiv.c), and it corrected my own claim before it could become a load-bearing citation. The seed replaces four per-group mov.s resets with the first four adds reading add.s f0, f6, fN where f6 is +0.0, and I had recorded that as 'arithmetically unchanged'. The test sweeps 4,182,161 fp32 values (every special, every value with <=4 significant bits across all exponents, plus a dense stride over the whole pattern space) and compares the add form against a move: the differences are exactly two classes, -0.0 (sign of zero) and every SIGNALING NaN (an addition quiets its operand, so 0xffbffe12 becomes 0xfffffe12) - 3 negative zeros and 8,137 sNaNs, zero unexplained. My first version asserted only the -0.0 class and failed on its own sweep, printing the sNaN case; that is the campaign's recurring lesson that a guard is what finds the hole in the argument, not a way to confirm it. Both classes are unreachable for the operand the seed sees (a pair-LUT entry is a product of finite codebook and activation values, so finite, +0.0, or a QUIET NaN - hardware arithmetic never emits an sNaN - and a -0.0 partial needs every term -0.0), and the independent empirical half is 6/6 primary plus 18/20 full-suite byte-exact on two boards. The exit code requires the difference set to equal exactly {-0.0, sNaN} and both classes present, so it cannot pass vacuously. No board time. Pin unchanged at 5.3033.","timestamp":1790279736454,"segment":1,"confidence":10.871056241426617,"asi":{"durable_rule":"An add from +0.0 is NOT bit-identical to a move: it differs for -0.0 (sign of zero) and for every signaling NaN (addition quiets it, ffbffe12 -> fffffe12). Any future 'seed from a zero register instead of resetting' change must clear those two classes, not just 'is it IEEE'.","hypothesis":"Give the confirmed seed win the bit-exactness proof the host gate cannot provide: characterise, over the fp32 space, exactly when add.s f0, +0.0, x differs from a reset-and-move.","how_it_worked":"First version of the test asserted the only exception was -0.0 and FAILED on its own sweep: 8,140 differences, and the printed one was x=ffbffe12, a signaling NaN, which the addition quiets to fffffe12. So the transformation has TWO exception classes, not one, and I found that by running the test rather than by reasoning about IEEE-754 - the same pattern as every other guard in this repo that caught my own assumption.","reachability":"The seed's first-add operand is a pair-LUT entry: a product of finite codebook and activation values, so it is finite, +0.0, or a QUIET NaN - hardware arithmetic never emits a signaling NaN. A -0.0 partial would need every term of that partial to be -0.0. Neither class can occur, and the empirical half is independent: 6/6 primary and 18/20 full-suite byte-exact on two boards with this kernel.","why_host_matters":"The host cannot compile the asm path at all, so for every kept assembly change in this campaign the only automatic veto is the device compare. A C-level characterisation of the transformation is the only host-side evidence that can exist, and now it does.","test_exit":"cc -O2 -ffp-contract=off .auto/exp87/test_seed_equiv.c -lm; exit 0 requires the difference set to equal exactly {-0.0, sNaN} AND both classes to be present as positive controls, so the guard cannot pass vacuously.","next":"Seed stack remains fully evidenced and owner-gated. No board used for this."}}
{"run":600,"commit":"746a27f","metric":5.6117,"metrics":{"boot_bench_tps":5.658,"device_output_exact":18,"device_token_delta":52,"ext_decode_tps":5.5177,"gen_tokens":99,"host_output_exact":19,"internal_free":8415,"logit_max_delta":0.00005341,"logit_top1_match":10,"min_case_tps":5.35,"prefill_tps":5.925,"psram_free":2052252,"think_tps":4.39},"status":"keep","description":"Wired the seed-win bit-exactness guard into .auto/checks.sh so it runs on every lane: build .auto/exp87/test_seed_equiv.c with cc -O2 -ffp-contract=off into the log directory and fail the checks on a non-zero result, plus an explicit C_GUARD_NO_COMPILER failure when the compiler is missing (a guard that passes because its tool is absent is this campaign's most-repeated self-inflicted bug). Verified end to end rather than by reading the diff: bash -n clean and a full checks.sh run came back green with the new stage in place, reporting host_lines_same=19 and FIDELITY steps=10 vocab=8192 max_delta=5.341e-05 top1=10/10, so the guard passed inside the real pipeline. This is the only host-side evidence that exists for an assembly change, because the host build compiles the C fallback - so the practical effect is that a future seeding edit whose difference set grows beyond {-0.0, signaling NaN} stops at the host stage instead of twelve minutes later on a board. .auto/exp41/test_cond_equiv.c deliberately stays manual since its build flags differ and guessing them into a mandatory path is the #359 failure mode. No board time. Pin unchanged at 5.3033 with the seed stack fully evidenced and owner-gated.","timestamp":1790279854878,"segment":1,"confidence":10.871056241426617,"asi":{"hypothesis":"Wire the new bit-exactness guard into checks.sh so the seed win's host-side proof is enforced on every lane rather than living as a file someone might run.","wiring_detail":"checks.sh now: fails if cc is absent (C_GUARD_NO_COMPILER), builds .auto/exp87/test_seed_equiv.c with -ffp-contract=off into the log dir, and exits on a non-zero result. The compiler-missing branch is deliberate: a guard whose tool is absent must report failure, not pass - this campaign has found four of its own checks doing exactly that (#296 missing-golden-as-exact, the partial-save guard, the config check, and #530's /health token).","measured":"bash -n clean; a full checks.sh run completed green with the new guard in the pipeline: host_lines_same=19 (19/19 host byte-exact) and FIDELITY steps=10 vocab=8192 max_delta=5.341e-05 top1=10/10, i.e. the guard passed inside the real pipeline, not just standalone.","note":"test_cond_equiv.c stays manual - its build flags differ and I did not want to guess them into a mandatory path. Wiring a guard with the wrong flags is how #359's macro silently never reached the compiler.","next":"Acceptance stack is owner-gated; no board used. The gate/coverage surface is now: prompts pinned, host byte-exact, fidelity, seed equivalence (new), device byte-exact on full and restricted runs, and all of them demonstrated able to fail.","durability":"If someone later changes the seeding so the difference set grows beyond {-0.0, sNaN}, every lane now stops at the host stage instead of discovering it on a board twelve minutes later."}}
