{"run":509,"commit":"3bdeadd","metric":5.3033,"metrics":{"boot_bench_tps":5.621,"device_output_exact":6,"device_token_delta":0,"ext_decode_tps":5.2269,"gen_tokens":99,"host_output_exact":19,"internal_free":12519,"logit_max_delta":0.00005341,"logit_top1_match":10,"min_case_tps":5.32,"prefill_tps":5.59,"psram_free":2052252,"think_tps":4.2},"status":"keep","description":"Three-way merge refused on its own residue assert and nothing was written, which is the correct outcome. The plan was to build the acceptance tree by transforming board 2's ring-carrying main.c in order: strip the RXQ diagnostic, convert the spin one-shot if (s_done_seq != job) into the predicate while form (#492, measured free), then replace the semaphore handshake with notifications (#496). Every step's pattern matched something, but the final assert caught 3 remaining xSemaphore call sites beyond the ones my substitutions covered, so the file was left byte-identical to the measured ring+spin+trace tree and the local build stays clean (rc=0, zero errors). That assert matters more than usual here: a half-converted handshake compiles fine and merely deadlocks at runtime - caller waiting on a notification, worker giving a semaphore - so a green build would have proven nothing, while the residue count does. Root cause is textual variance across the handshake's call sites; the fix is to stop regexing a 620-line file and instead read the two handshake sites and rewrite them with precise edits, sequencing the three transformations, then build locally before computing .auto/expect_engine_md5. Board 3's cross-board session on the ring tree still showed zero cases at read time (priming), so no golden-determinism reading yet. Accepted pin unchanged at 5.3033; the +5.2 % stack (5.580/5.5817 on two boards) still awaits a 20-case session.","timestamp":1790268977972,"segment":1,"confidence":18.742127153891822,"asi":{"correct_approach_next":"Do this merge with the read and edit tools on the actual file - read the two handshake sites and rewrite them - not with regex over a 620-line file whose formatting varies per site. Sequence it explicitly: (1) strip the RXQ trace, (2) spin 'if' -> predicate 'while' (#492's one-line form), (3) semaphore -> notifications (#496's form, including the per-job waiter-handle publication I kept for deadlock safety), then build locally and only then compute .auto/expect_engine_md5 and launch the 20-case session.","hypothesis":"Build the acceptance tree as an explicit three-way merge in order - spin -> predicate -> notifications - on the tree that already carries the lossless console RX ring, with the RXQ diagnostic removed.","lane_state":"Board 3's session on the ring+spin+trace tree (prov e52ad7c21df5) had produced zero CASE lines at read time - still building/priming - and no LANE_RC yet, so no cross-board golden-determinism reading exists this iteration.","refusal_detail":"Board 3's main.c is again unchanged: my merged-handshake script asserted before writing, reporting xSemaphore residue of 3 after its substitutions. That is textual variance in the handshake sites (more give/take call sites than my patterns covered), not a codegen or hardware issue.","why_refusal_is_right":"A half-converted handshake would still compile - a caller waiting on a notification while the worker gives a semaphore simply blocks forever at runtime - so compiling is not evidence here; only the residue-count assert catches it. Fourth consecutive composition that refused instead of shipping a plausible-but-wrong tree, and each refusal was the gate doing its job."}}
{"run":510,"commit":"3bdeadd","metric":5.3033,"metrics":{"boot_bench_tps":5.621,"device_output_exact":6,"device_token_delta":0,"ext_decode_tps":5.2269,"gen_tokens":99,"host_output_exact":19,"internal_free":12519,"logit_max_delta":0.00005341,"logit_top1_match":10,"min_case_tps":5.32,"prefill_tps":5.59,"psram_free":2052252,"think_tps":4.2},"status":"keep","description":"Cross-board reading of the lossless console RX ring reproduces. Board 3 ran the byte-identical tree board 2 measured (provenance e52ad7c21df5: late-placement ISR ring + spin handshake + the RXQ input trace) and reads decode_tps 5.5517 against board 2's 5.55 - agreement to one quantum on a second board. Against the spin stack's 5.560/5.5617 that is -0.15 %, matching #499's -0.18 % on the same configuration, so the ring plus its per-request trace costs roughly 0.1-0.2 % of a request token; the trace is diagnostic traffic and must be removed before any acceptance run, which is already the plan. No device_output_exact line had printed when read (the session was still past its primary group), so the golden-determinism verdict - whether board 3 diverges on exactly heldout_interval_one and heldout_long_tools_note_only - is still pending and no acceptance is claimed. Accepted pin unchanged at 5.3033; the composed +5.2 % stack (5.580/5.5817 on two boards) still owes one 20-case session, and the acceptance tree still needs the hand-written handshake merge described in #509.","timestamp":1790269013419,"segment":1,"confidence":18.742127153891822,"asi":{"gate_still_owed":"No device_output_exact line yet, so no acceptance claim and the pin stays 5.3033. The composed +5.2 % stack (5.580/5.5817) still needs its own 20-case session, and the acceptance tree needs the hand-written handshake merge from #509.","hypothesis":"Cross-board reading of the lossless console RX ring at late placement, with the RXQ trace still active (prov e52ad7c21df5, byte-identical to what board 2 measured): does a second board reproduce both the cost and, once the suite finishes, the same two golden divergences?","next":"Read the DIVERGE set from this log in the next window - if it is exactly heldout_interval_one and heldout_long_tools_note_only on board 3 too, the golden/demo-timer explanation is established on two boards and becomes an owner action rather than an open question. Then do the handshake merge with precise edits (#509's plan) and run the lean+ring 20-case session.","result":"Board 3 reads decode_tps 5.5517 on the identical tree that board 2 measured at 5.55, so the ring tree's speed reproduces across boards to one quantum. Against the spin stack's 5.560/5.5617 that is -0.15 %, consistent with #499's -0.18 % on the same configuration: the ring plus its per-request trace costs on the order of 0.1-0.2 % of a request token, which is why the trace must come out before the acceptance run."}}
{"run":511,"commit":"71a3c1f","metric":5.3033,"metrics":{"boot_bench_tps":5.621,"device_output_exact":6,"device_token_delta":0,"ext_decode_tps":5.2269,"gen_tokens":99,"host_output_exact":19,"internal_free":12519,"logit_max_delta":0.00005341,"logit_top1_match":10,"min_case_tps":5.32,"prefill_tps":5.59,"psram_free":2052252,"think_tps":4.2},"status":"keep","description":"Persisted the acceptance-tree merge as an executable recipe instead of burning a board on an unreadable lane. .auto/ideas.md now carries the five-step procedure for turning board 2's ring-carrying main.c into the acceptance tree - strip the RXQ trace, apply the predicate if->while fix, then the semaphore-to-notification transform (including the per-job waiter-handle publication kept for deadlock safety and the !s_worker guard change), assert grep -c xSemaphore == 0, build locally, and only then compute .auto/expect_engine_md5 and run one 20-case session. The assert is stated as the load-bearing step because a half-converted handshake compiles and merely deadlocks at runtime; four prior splices refused precisely because textual variance left residue, and that refusal class is what kept bad trees off the boards. Lane state, disclosed rather than padded: board 3's session on the ring+spin+trace tree (provenance e52ad7c21df5, cross-board decode 5.5517 logged at #510) had printed no DIVERGE line and no LANE_RC at read time - still inside the extended group - so the question of whether both boards diverge on exactly heldout_interval_one and heldout_long_tools_note_only remains open. No device run this iteration: the accepted image was deliberately not re-measured. Pin unchanged at 5.3033; composed stack remains 5.580/5.5817 on two boards awaiting its 20-case session.","timestamp":1790269064550,"segment":1,"confidence":18.554705882352902,"asi":{"hypothesis":"While the acceptance-adjacent session is mid-suite and unreadable, convert the fragile composition knowledge into an executable recipe in .auto/ideas.md, so the next window performs the merge in one pass instead of rediscovering why four splices refused.","lane_state":"The board 3 session on the ring+spin+trace tree (prov e52ad7c21df5, cross-board decode 5.5517 from #510) had produced neither a DIVERGE line nor a LANE_RC line at read time - still inside the slow extended group - so the golden-determinism verdict stays open and no acceptance is claimed. Its primary reading is already logged; nothing new to report from it.","why_not_a_control_run":"No device run this iteration and the accepted image was not re-measured: the only measurable thing available was the running lane, and re-running the accepted tree would be the unchanged-verification loop the rules forbid.","next":"Execute the recipe: edits on board 2's main.c copy, assert xSemaphore == 0, build, write the expectation from the built tree, then the single 20-case acceptance session. Expected ~5.58 without the trace, and 20/20 once the owner settles the two demo-timer goldens."}}
{"run":512,"commit":"71a3c1f","metric":5.3033,"metrics":{"boot_bench_tps":5.621,"device_output_exact":6,"device_token_delta":0,"ext_decode_tps":5.2269,"gen_tokens":99,"host_output_exact":19,"internal_free":12519,"logit_max_delta":0.00005341,"logit_top1_match":10,"min_case_tps":5.32,"prefill_tps":5.59,"psram_free":2052252,"think_tps":4.2},"status":"keep","description":"The two golden divergences do NOT reproduce on board 3 so far, which repositions the acceptance blocker. Board 3's session on the ring+spin+trace tree (provenance e52ad7c21df5, decode 5.5517) has reached its tail groups - live bench.py, 9,334-byte log, tail showing the timer-state case, an RXQ line with drop=0, and the think toggle - and has emitted zero DIVERGE lines, whereas board 2's completed run of the byte-identical tree reported DEVICE_OUTPUT_DIVERGED 18/20 failing heldout_interval_one and heldout_long_tools_note_only. Read carefully, this is not a pass: bench.py's compare block prints device_output_exact only after all 20 cases, so no verdict line exists yet and nothing is waived. But combined with run #391's documentation that those two goldens depend on the firmware's demo timer and sampling counters - and this log's own timer_remaining_ms=297809, timer_fired_count=2 - non-reproduction on a second board points at boot/session state rather than board identity or the engine, which is exactly the distinction the owner needs to decide whether to re-capture or annotate those goldens. Also re-confirmed: RXQ drop=0 on this board too, so no characters are lost. No device run beyond this lane; accepted pin unchanged at 5.3033 and the +5.2 % stack (5.580/5.5817) still owes its 20-case session.","timestamp":1790269115716,"segment":1,"confidence":18.37099592312168,"asi":{"consequence":"Non-reproduction narrows the two-divergence finding to session state, not board identity - consistent with run #391's note that those goldens depend on the demo timer and sampling counters, which differ between boots (this log's own line carries timer_remaining_ms=297809 and timer_fired_count=2). It does NOT license waiving anything: the byte-exact verdict prints only after all 20 cases, so until device_output_exact=20/20 this is progress, not a gate pass.","hypothesis":"Do the two golden divergences reproduce on a second board - i.e. are they a property of the frozen goldens and the engine, or of the session's demo-timer state?","next":"Wait for the compare block: if board 3 prints device_output_exact=20/20 on the ring+trace tree, then the acceptance blocker is purely boot state and the owner's step is to re-capture or annotate the two timer-dependent goldens; then run the lean+ring merge (#511 recipe) for the ~5.58 acceptance reading. If instead the two diverge, the pair reproduces cross-board and is golden hygiene.","verification":"Session is live (one bench.py process), log 9,334 bytes, tail shows the timer-state case, an RXQ line with drop=0, and the think-mode toggle - so it has progressed into the tail groups without emitting a single divergence, unlike board 2's 18/20."}}
{"run":513,"commit":"71a3c1f","metric":5.3033,"metrics":{"boot_bench_tps":5.621,"device_output_exact":18,"device_token_delta":52,"ext_decode_tps":5.2269,"gen_tokens":99,"host_output_exact":19,"internal_free":12519,"logit_max_delta":0.00005341,"logit_top1_match":10,"min_case_tps":5.32,"prefill_tps":5.59,"psram_free":2052252,"think_tps":4.2},"status":"keep","description":"Board 3's session completed and it DOES reproduce board 2's byte-exactness verdict exactly: device_output_exact=18/20, device_golden_missing=0, device_token_delta=52, LANE_RC=1 on provenance e52ad7c21df5 - identical numbers to board 2's completed run, including the token delta of 52. This retracts #512, which read the mid-suite absence of DIVERGE lines as non-reproduction: bench.py emits its verdict at the end, so absence at minute 20 was not evidence - another instance of this ledger's recurring vacuous-negative failure mode, and the reason to re-read completed logs rather than argue from partial ones. The finding is now cross-board deterministic: on two boards the same two held-out cases fail with the same token delta while the other 18 match byte for byte, and every RXQ line reports drop=0, so the failures are a property of the frozen goldens plus firmware demo-timer/sampling-counter state (run #391), not of the engine, the board, or console RX loss. Consequence: the 20-case gate is meaningful only after those two goldens are re-captured or annotated by the owner; until then the correct expectation for any candidate is 18/20 with exactly those two failing, and any other case failing is a genuine regression signal. Accepted pin unchanged at 5.3033; the +5.2 % stack (5.580/5.5817 on two boards) still owes its session on the merged lean+ring tree.","timestamp":1790269186071,"segment":1,"confidence":18.196134987020468,"asi":{"consequence":"Deterministic cross-board reproduction is the strongest form of the golden-hygiene case: same tree, same two failures, same token delta, two boards. The engine is not diverging randomly; those two goldens encode firmware demo-timer and sampling-counter state (run #391), so the owner's step is to re-capture or annotate them, not to re-measure the engine.","correction":"#512 is wrong and is retracted: 'the two divergences do NOT reproduce on board 3 so far' rested on the mid-suite absence of DIVERGE lines. bench.py prints its verdict at the END, and when it did the numbers matched board 2 exactly - 18/20, token_delta 52. Treating the absence of an intermediate line as evidence was the same vacuous-negative error this ledger keeps recording; the signal is only emitted at a different time.","hypothesis":"Read the completed verdict of board 3's session on the ring+spin+trace tree (prov e52ad7c21df5): does it reproduce board 2's 18/20 byte-exactness and the same two divergences?","next":"Two actions, in order. (1) Owner ask, now evidence-backed on two boards: re-capture or annotate heldout_interval_one and heldout_long_tools_note_only. (2) Meanwhile run the acceptance tree from the #511 recipe (merge on board 2's ring main.c, assert xSemaphore==0, build locally) for the ~5.58 reading; on that tree expect the same 18/20 until the goldens are settled, with the two failures remaining exactly those two cases - any other case failing is a real regression signal, which is what keeps the gate meaningful."}}
{"run":514,"commit":"fd872ed","metric":5.3033,"metrics":{"boot_bench_tps":5.621,"device_output_exact":18,"device_token_delta":52,"ext_decode_tps":5.2269,"gen_tokens":99,"host_output_exact":19,"internal_free":12519,"logit_max_delta":0.00005341,"logit_top1_match":10,"min_case_tps":5.32,"prefill_tps":5.59,"psram_free":2052252,"think_tps":4.2},"status":"keep","description":"Durability audit of the measured trees, with one real loss disclosed. The tree that produced the cross-board verdicts (late lossless RX ring + spin handshake + RXQ trace, provenance e52ad7c21df5, decode 5.55 and 5.5517 on two boards, device_output_exact 18/20 twice) existed only as uncommitted files inside a board worker, so it is now snapshotted into the main checkout at .auto/exp84/main.c.ring-spin-trace.e52ad7c plus its CMakeLists.txt.ring - reproducible from the repository rather than from a checkout a reset could wipe. The disclosed loss: the lean-notifications main.c, the measured +0.36 % candidate of #496/#498 (5.580 board 1, 5.5817 board 3, 6/6 byte-exact, +424 B internal), is not saved as a file anywhere - it lived only in board 3's checkout, which I overwrote in #508 with board 2's ring main.c to obtain a compiling tree. Its measurements remain valid and #511 records the exact transformation, so it is reproducible, but the correct rule, now written down, is that any worker-tree candidate is copied into .auto the moment it is measured, before the checkout is repurposed. No device run and no speed claim this iteration; accepted pin unchanged at 5.3033.","timestamp":1790269263217,"segment":1,"confidence":18.02457142857145,"asi":{"durability_action":"Copied the measured ring+spin+trace tree into .auto/exp84/ (main.c.ring-spin-trace.e52ad7c and CMakeLists.txt.ring) so the tree that produced the cross-board 18/20 and 5.55/5.5517 readings is reproducible from the repository rather than from a worker that a reset could wipe.","hypothesis":"Are the measured trees actually persisted? A +5.2 % acceptance stack that exists only as uncommitted files in board workers is one git reset away from being unreproducible, so audit that before generating more numbers.","loss_disclosed":"The lean-notifications main.c - the measured +0.36 % candidate of #496/#498 (5.580 board 1, 5.5817 board 3, 6/6 byte-exact, +424 B internal) - is NOT saved as a file anywhere. It lived only in board 3's checkout, and in #508 I overwrote it with board 2's ring main.c to get a compiling tree. Its measurements stand and #511 recorded the transformation, so it is reproducible, but this was my process error: the file should have been snapshotted before repurposing the checkout. Rule now written down: any worker-tree candidate is copied into .auto the moment it is measured.","next":"Rebuild the lean tree from the #511 recipe onto board 2's ring main.c, snapshot it to .auto immediately, assert xSemaphore==0, build locally, then run the 20-case session where 18/20 with exactly heldout_interval_one and heldout_long_tools_note_only failing is the pass condition until the owner settles those goldens."}}
