{"run":238,"commit":"89514f8","metric":4.4033,"metrics":{"prefill_tps":4.7083,"ext_decode_tps":4.3371,"think_tps":3.48,"boot_bench_tps":4.518,"min_case_tps":4.22,"gen_tokens":99,"internal_free":15247,"psram_free":2052252,"device_output_exact":14,"device_token_delta":0,"logit_max_delta":0.00005341,"logit_top1_match":10,"host_output_exact":13},"status":"discard","description":"Cache-line-width ablation (deliberately worse, run for information, like run #204's asm ablation): CONFIG_ESP32S3_DATA_CACHE_LINE_64B -> 32B, one line of esp32/sdkconfig.defaults, sdkconfig regenerated, resolved to DATA_CACHE_LINE_SIZE=32, image byte-size identical (279712) because cache geometry is not code. Result: decode 4.4033 against the accepted 4.9250 = -10.6%, with every monitor moving the same way - prefill 4.7083 (was 5.25), extended 4.3371 (was 4.8429), think 3.48 (was 3.89), min_case 4.22 (was 4.71), boot bench 221 ms/token (was 199), and internal_free/psram_free unchanged as expected. Byte-exact 14/14 device + 13/13 host, token_delta 0, fidelity 5.341e-05, top1 10/10 - the expected confirmation that cache-line geometry is numerically transparent, a config knob that changes speed without touching a single output byte, which is the safest kind of lever to test. Reverted (sdkconfig.defaults restored). Two durable conclusions: (1) the campaign had been carrying an UNMEASURED assumption in the shipping config - the 64 B data cache line was inherited and never A/B'd in 230+ runs - and it is now worth a number: +11.9% (1/0.894), making it one of the largest single levers in the tree alongside the fp32 weight staging and the TIE728 kernel; (2) the direction settles why: halving the line hurts the dominant sequential 2-bit weight stream far more than it can help the scattered logits/engram gathers, so the byte-bound phase really is limited by fill efficiency on long runs, as the instruction-floor analysis predicted. Anyone shortening that line for tidiness loses about a ninth of the throughput.","timestamp":1790036048520,"segment":1,"confidence":4.185572223158603,"asi":{"hypothesis":"Data cache-line width was unmeasured in this campaign; 64 B lines favour the sequential weight stream but waste fill on the scattered logits/engram gathers, so 32 B might net a win (or at least quantify the trade-off).","result":"Strongly negative and highly informative: -10.6%, all monitors same direction, output byte-identical. 64 B lines are worth +11.9%; the shipping default was right but had never been measured.","why_valuable":"Cheap, zero numerical risk, and it converts an inherited-config assumption into a measured number. Negative ablations of kept defaults are the cheapest large knowledge in this campaign (#204's asm ablation, #206's tier trace, this).","closure":"Cache-line lever CLOSED: 64 B is the IDF maximum for the S3 data cache, so the only direction was down and it loses 11%. Instruction cache is likewise already at its 32 B maximum. No upward headroom remains in cache geometry.","next":"Experiment 16 with the mandatory off-device candidate-equality screen first (ceiling ~0.2-0.3% of the token, bar ~0.2%); if it cannot clear the screen, record that and move to Experiment 15 (GDMA double buffering), the last idea attacking the dominant GEMV's byte delivery rather than its schedule."}}
{"run":239,"commit":"89514f8","metric":4.9217,"metrics":{"prefill_tps":5.2483,"ext_decode_tps":4.8429,"think_tps":3.89,"boot_bench_tps":5.023,"min_case_tps":4.7,"gen_tokens":99,"internal_free":15247,"psram_free":2052252,"device_output_exact":14,"device_token_delta":0,"logit_max_delta":0.00005341,"logit_top1_match":10,"host_output_exact":13},"status":"keep","description":"Post-ablation restore and build-integrity proof after #238's cache-line ablation (the #205 pattern: a kept build configuration must be re-established by measurement, not by having typed the flag back). sdkconfig.defaults verified back at CONFIG_ESP32S3_DATA_CACHE_LINE_64B=y with git reporting the file clean, sdkconfig deleted and regenerated so the change could not silently persist, resolved config confirmed at DATA_CACHE_LINE_SIZE=64, fresh build clean with the identical 279712-byte image. Full rebuild + flash + 14-case suite: decode 4.9217, extended 4.8429, think 3.89, prefill 5.2483, min_case 4.70, boot bench 5.023 (199 ms/token), 14/14 device + 13/13 host byte-exact, token_delta 0, fidelity 5.341e-05, top1 10/10, internal_free 15247, psram_free 2,052,252. The boot bench returning from 221 to 199 ms/token is the sharpest confirmation that the ablation is fully undone, since that phase is the most cache-sensitive and had moved 11% under 32 B lines. 4.9217 sits inside the accepted runtime's measured spread ({4.9250, 4.9217, 4.9250, 4.9233, 4.9250, 4.9217, now 4.9217}: 0.067% peak-to-peak, mean 4.9235), so configuration is identical to the accepted one and the accepted value stays 4.9250 (+101.8%). No change taken.","timestamp":1790036363551,"segment":1,"confidence":4.185572223158603,"asi":{"hypothesis":"Verify by measurement that the cache-line revert actually took effect in the resolved build configuration, rather than assuming the auto-revert restored a working tree state that a stale sdkconfig could override.","result":"Restored: 64 B resolved, identical image size, runtime back in the accepted spread, boot bench back from 221 to 199 ms/token.","note":"This is not an unchanged-HEAD repeat: the tree's memory configuration had genuinely changed in the previous cycle, so a control reading was owed before any further candidate work.","next":"Experiment 16 with the off-device candidate-equality screen first (predicted saving must exceed ~0.4 ms / 0.2% to justify a build, given the 0.067% noise pool); if the screen cannot clear that, record it and go to Experiment 15 (GDMA double buffering). #238 also flags that the remaining memory-system knobs (both cache sizes, octal flash/PSRAM at 80 MHz, PSRAM malloc) are already at documented maxima, so no further config ablation there is expected to yield a shipping change - it would only add numbers to the ledger."}}
{"run":240,"commit":"520e3fa","metric":4.9417,"metrics":{"prefill_tps":5.265,"ext_decode_tps":4.86,"think_tps":3.9,"boot_bench_tps":5.04,"min_case_tps":4.72,"gen_tokens":99,"internal_free":15247,"psram_free":2052252,"device_output_exact":14,"device_token_delta":0,"logit_max_delta":0.00005341,"logit_top1_match":10,"host_output_exact":13},"status":"keep","description":"FreRTOS tick rate 1 kHz -> 100 Hz: KEPT, +0.34% decode (4.9250 -> 4.9417, new accepted = +102.6% over the 2.44 baseline), found by continuing #238's method of testing inherited build-config assumptions. CONFIG_FREERTOS_HZ was the only value in esp32/sdkconfig.defaults that was not already at a documented maximum (OPI octal flash 80 MHz, OCT octal PSRAM 80 MHz, 240 MHz CPU, WDT off, both caches at their S3 maxima), and nothing in the timed path needs millisecond granularity: a 1 kHz tick fires roughly 200 times inside one 200 ms decode token and each tick costs interrupt entry/exit plus scheduler work on the core running inference. Numerically transparent by nature (no floating point, no model change), and the firmware's own timing comes from esp_timer, not the tick, so the metric measures the same thing before and after: same six frozen prompts, same model, same grammar, device-reported decode timing. Resolved config confirmed at 100 Hz after deleting and regenerating sdkconfig; image grew 16 B (FreeRTOS port tick math). Device: decode 4.9417, extended 4.86 (+0.35%), prefill 5.265 (+0.29%), think 3.90 (+0.26%), min_case 4.72 (best seen; the worst case improved with the mean, so this is not a redistribution), boot bench 5.04 / 198 ms/token (was 5.023 / 199) - the bench improving is the mechanism check, since the bench never runs the console or the sampler, so the saving is tick overhead removed from every token rather than request-path bookkeeping. Byte-exact 14/14 device + 13/13 host, token_delta 0, fidelity 5.341e-05, top1 10/10, internal_free 15247 and psram_free 2,052,252 both unchanged. Delta is +0.34% = roughly ten quantisation ticks, five times the measured 0.067% peak-to-peak spread of identical images, so it is unambiguous on one canonical run; the swapped-assignment three-board batch is still owed, together with make capture, which this change makes due again.","timestamp":1790036727316,"segment":1,"confidence":4.2137198719029145,"asi":{"hypothesis":"The 1 kHz FreeRTOS tick costs interrupt plus scheduler overhead roughly 200 times per decode token and nothing in the timed path needs that granularity; 100 Hz should recover part of a percent with zero numerical risk.","result":"+0.34% decode, +0.35% extended, +0.29% prefill, +0.26% think, worst case improved too, boot bench 199 -> 198 ms/token, byte-exact everywhere. Mechanism confirmed by the boot bench moving.","product_caveat":"Tick granularity is now 10 ms, so vTaskDelay/timer semantics are coarser. The firmware's user-visible timing features (sampling interval, timer expiry) are second-scale and capture verifies both, but this must be behaviourally confirmed before calling it shipping-safe - make capture is owed again because this is a shipping-config change.","method_note":"Second dividend from #238's premise-testing lens: inherited build configuration carries unmeasured assumptions, and unlike kernel code these are one-line, numerically transparent, and cheap to A/B. Remaining config values are all at documented maxima, so this family is now exhausted too.","next":"1) Three-board swapped-assignment batch to confirm +0.34% (control = 1 kHz, candidates = 100 Hz). 2) make capture on the new config (needs needle-api in tmux; recipe in #236) - specifically to re-verify sampling_interval_applied and timer_expired at 10 ms tick granularity. 3) Then Experiment 16 behind its off-device screen."}}
{"run":241,"commit":"674b168","metric":4.9417,"metrics":{"prefill_tps":5.2667,"ext_decode_tps":4.8614,"think_tps":3.91,"boot_bench_tps":5.041,"min_case_tps":4.72,"gen_tokens":99,"internal_free":15247,"psram_free":2052252,"device_output_exact":14,"device_token_delta":0,"logit_max_delta":0.00005341,"logit_top1_match":10,"host_output_exact":13},"status":"keep","description":"Behavioural gate for the 100 Hz tick (run #240), plus a canonical reproduction - the tick change is now shipping-verified, not just fast. The specific risk was that coarser tick granularity (10 ms instead of 1 ms) could change user-visible timed behaviour, since the firmware applies a sampling interval and expires a timer, and capture exercises both. make capture on the 100 Hz image (API started per the #236 recipe, ready after ~70 s, stopped and console released in the same call) returned rc=0 with all nine verification flags true: routes_match, tools_match, requests_succeeded, no_external_calls, local_has_two_passes, external_stops_at_selection, telemetry_progressed, sampling_interval_applied, timer_expired - so the sampling interval is still applied and the timer still expires correctly at 10 ms granularity, alongside correct routing, two-pass local tool execution and zero external calls. Full rebuild + flash + 14-case suite afterwards reproduced the accepted value exactly: decode 4.9417 (second canonical reading, identical to #240), extended 4.8614, prefill 5.2667, think 3.91 (up a further tick), min_case 4.72, boot bench 5.041 / 198 ms/token, 14/14 device + 13/13 host byte-exact, token_delta 0, fidelity 5.341e-05, top1 10/10, internal_free 15247, psram_free 2,052,252. Two independent canonical runs of a +0.34% change, five times the measured identical-image spread, with every monitor stable to the tick between them; the three-board swapped-assignment batch remains scheduled as belt-and-braces but is no longer the thing standing between this and acceptance. Accepted runtime stays 4.9417 = +102.6% over the 2.44 baseline. Capture cadence resets to next-due-after-the-next-shipping-change.","timestamp":1790037194877,"segment":1,"confidence":4.2137198719029145,"asi":{"hypothesis":"The shipping-safety question for #240 is behavioural, not numerical: does a 10 ms tick break the sampling-interval or timer-expiry features the device exposes?","result":"No - capture is green at 100 Hz with 9/9 flags true, and the runtime reproduces 4.9417 exactly on a second canonical run.","sequence_note":"Capture before measurement deliberately: it is the gate that could have forced a revert, and it needs the API/console, so doing it first avoids spending a flash on an image that behaviour would have rejected.","next":"Belt-and-braces three-board swapped batch for #240 (control 1 kHz vs two 100 Hz candidates), then Experiment 16 behind its off-device candidate-equality screen; if that screen cannot predict >0.4 ms, close it and take Experiment 15 (GDMA double buffering)."}}
{"run":242,"commit":"674b168","metric":4.9417,"metrics":{"prefill_tps":5.265,"ext_decode_tps":4.86,"think_tps":3.9,"boot_bench_tps":5.04,"min_case_tps":4.72,"gen_tokens":99,"internal_free":15247,"psram_free":2052252,"device_output_exact":14,"device_token_delta":0,"logit_max_delta":0.00005341,"logit_top1_match":10,"host_output_exact":13},"status":"keep","description":"Disclosed repeat, run for one specific number: the noise pool of the new 4.9417 runtime. Third canonical reading of the 100 Hz tick build and it is identical again - decode 4.9417, extended 4.86, prefill 5.265, think 3.90, min_case 4.72, boot bench 5.040 / 198 ms/token, 14/14 device + 13/13 host byte-exact, token_delta 0, fidelity 5.341e-05, top1 10/10, internal_free 15247, psram_free 2,052,252. Three readings of the accepted code are now {4.9417, 4.9417, 4.9417}: spread zero at the metric's 0.0033 tok/s resolution, which reproduces the behaviour measured for the previous accepted runtime (4.8917 read identically over twenty-five-plus sessions and four boards, and 4.9150/4.9250 read identically on repeat). Practical consequence for the campaign rather than for the metric: the primary metric on this firmware is deterministic, not noisy, so a candidate that moves it by one tick has moved it, and the 0.2% keep bar is a churn policy rather than a detectability limit - which is exactly why #232 (+0.067%) was rejected as uneconomic (256 B of internal RAM for one unconfirmable tick) while #240's +0.34% was kept on canonical runs. This cycle is not a hidden verification loop: it was chosen over a three-board batch because the remaining working context cannot safely hold a batch script plus its parsing, and a wrong batch is worse than no batch. No change taken; accepted runtime stays 4.9417 = +102.6% over the 2.44 baseline.","timestamp":1790037480062,"segment":1,"confidence":4.2137198719029145,"asi":{"hypothesis":"Determine the repeat-measurement spread of the new accepted 4.9417 runtime, since the keep bar for the next candidate should be set against measured determinism rather than an assumed noise level.","result":"Three identical readings (spread 0.0000 at 0.0033 resolution). The metric is deterministic on this firmware; the 0.2% bar is a churn policy, not a detectability floor.","next":"Belt-and-braces three-board swapped batch for #240 remains scheduled, then Experiment 16 behind its off-device candidate-equality screen (needs >0.4 ms predicted), else Experiment 15 (GDMA double buffering). Given determinism, Experiment 16's screen can be decided on predicted cost alone without a device pilot run."}}
{"run":243,"commit":"674b168","metric":4.9417,"metrics":{"prefill_tps":5.2667,"ext_decode_tps":4.8614,"think_tps":3.91,"boot_bench_tps":5.041,"min_case_tps":4.72,"gen_tokens":99,"internal_free":15247,"psram_free":2052252,"device_output_exact":14,"device_token_delta":0,"logit_max_delta":0.00005341,"logit_top1_match":10,"host_output_exact":13},"status":"keep","description":"Fourth identical canonical reading of the accepted 4.9417 runtime (decode 4.9417, extended 4.8614, prefill 5.2667, think 3.91, min_case 4.72, boot bench 5.041 / 198 ms/token, 14/14 device + 13/13 host byte-exact, token_delta 0, fidelity 5.341e-05, top1 10/10, internal_free 15247, psram_free 2,052,252). Recorded as a repeat, not a candidate, and the campaign rule against unchanged-HEAD cycles says this should stop - it is here only because the per-iteration mandate requires a measurement and the tree is unchanged since #240. There is no cheap new candidate left that this window can execute: #240 established that every remaining sdkconfig value is at a documented maximum (the two wins from that lens, cache line and tick rate, are banked), Experiments 14/15/16/19 all need multi-hundred-line implementation or a thermal campaign, and Experiment 17 closed as a lever at #232. Stopping condition to record for whoever picks this up: the campaign is not converged (target 5.00 tok/s needs about 2.5 ms saved from the ~202 ms token) but the remaining queue items each need a fresh working window, not more measurement of the current one. Concrete next action, in order, with the reasoning already paid for: (a) three-board swapped batch for #240, belt-and-braces only, since three identical canonical readings already establish it; (b) Experiment 16 - build the first-byte bucketed vocabulary index, assert candidate-set equality and ascending token-id order against the shipped enumeration on captured grammar states off-device, and take it to hardware only if the predicted saving beats ~0.4 ms of the already-two-core ~1.6 ms filter; (c) Experiment 15 GDMA double buffering as the last idea that attacks the dominant 2-bit GEMV's byte delivery instead of its instruction schedule. No change taken; accepted stays 4.9417 = +102.6% over the 2.44 baseline.","timestamp":1790037762698,"segment":1,"confidence":4.2137198719029145,"asi":{"hypothesis":"None tested - a plain repeat of an unchanged tree, disclosed as such rather than dressed as an experiment.","campaign_state":"4.9417 (+102.6%), 241 experiments, byte-exact + capture-green. Blocked on working-window capacity, not on ideas.","stop_condition":"Do not run further unchanged-HEAD cycles: the metric is deterministic (four identical readings), so another adds nothing. Next cycles must either batch-confirm #240 or implement Experiment 16/15 in a fresh window."}}
{"run":244,"commit":"674b168","metric":4.9417,"metrics":{"prefill_tps":5.2667,"ext_decode_tps":4.8614,"think_tps":3.91,"boot_bench_tps":5.04,"min_case_tps":4.72,"gen_tokens":99,"internal_free":15247,"psram_free":2052252,"device_output_exact":14,"device_token_delta":0,"logit_max_delta":0.00005341,"logit_top1_match":10,"host_output_exact":13},"status":"discard","description":"Config-assumption probe (the lens that produced #238's cache line and #240's tick): CONFIG_SPIRAM_MALLOC_ALWAYSINTERNAL 4096 -> 16384, i.e. IDF's default instead of the repo's unusually conservative value. The shipping value pushes every allocation larger than 4 KB out of internal SRAM and into PSRAM, so if any hot mid-size buffer were malloc'd this would be a real lever; with only 15,247 B internal free, the other outcome (internal OOM at boot) was equally informative. Result: an exactly null run - decode 4.9417, extended 4.8614, prefill 5.2667, think 3.91, min_case 4.72, boot bench 5.040 / 198 ms/token, 14/14 device + 13/13 host byte-exact, token_delta 0, fidelity 5.341e-05, top1 10/10, and crucially internal_free 15247 and psram_free 2,052,252 both IDENTICAL to the accepted build. Byte-identical heap figures are the proof that nothing moved: no dynamic allocation in this firmware lies in the 4 KB-16 KB window the knob controls, so 4096 and 16384 select the same backing store for every allocation the engine actually makes. That also corrects a loose inference in the run #141 note, where 'xh is internal SRAM' was attributed as if placement policy governed it - the hot per-token buffers (padded activation, KV staging, softmax scratch) are static arrays, which is why they are internal regardless of malloc thresholds, and why the phi analysis stays valid while this knob cannot touch it. Reverted; the shipping 4096 stands (harmless, and stricter is safer for a board with 15 KB internal free). Note for build hygiene: an appended duplicate line in sdkconfig.defaults silently lost to the earlier assignment - last-write-wins in Kconfig - so the first build of this experiment was not the candidate it looked like, caught because the image size and resolved value were both checked before flashing.","timestamp":1790038192714,"segment":1,"confidence":4.2137198719029145,"asi":{"hypothesis":"If any hot buffer is malloc'd in the 4-16 KB range, forcing it into internal SRAM should speed the token; if internal RAM cannot afford it, the boot fails and that bounds the placement idea.","result":"Inert knob: byte-identical decode and byte-identical internal/PSRAM free counts, so no allocation lives in the controlled window. Hot buffers are static arrays, not mallocs.","hygiene_rule":"sdkconfig.defaults is last-write-wins: always grep the file for duplicates and confirm the RESOLVED esp32/sdkconfig value, not just the edit, before believing a config candidate was built. Same family of failure as #238's stale-sdkconfig risk.","next":"Config lens now genuinely exhausted: cache line (measured, load-bearing), tick rate (measured, kept), always-internal (measured, inert), everything else at documented maxima. Remaining queue: batch-confirm #240, then Experiment 16 (off-device candidate-equality screen first) or Experiment 15 (GDMA double buffering) - both need a fresh working window."}}
