{"run":748,"commit":"5516fee","metric":5.8283,"metrics":{"boot_bench_tps":5.924,"device_output_exact":6,"device_token_delta":0,"ext_decode_tps":0,"gen_tokens":99,"host_output_exact":19,"internal_free":14171,"logit_max_delta":0.00005341,"logit_top1_match":0,"min_case_tps":5.62,"prefill_tps":6.1283,"psram_free":2062492,"think_tps":0},"status":"keep","description":"Compact saved prefixes: the capacity enabler for the CV3W offset stream is IN PLACE and measured. prefix_copy used to save the whole 384-slot KV window for each of the two prefixes even though the prefixes are 143/213 slots; the four KV buffers now copy only the prefix's LIVE slots (a new strided prefix_kv helper; same layout, same order, same values for everything that is read - only the image is smaller), and the restore assigns the prefix's state BEFORE the copy so the live count is the prefix's own rather than the model's current position. Quality: the host prefix-isolation test PASSES (\"alternating prefixes reproduce identical logits\", rc=0), which is the strongest check for the schema-switch path this change touches. Device: decode 5.8283 = the base unchanged (expected - the restore sits outside the decode clock), 6/6 exact, and the direct capacity measurement through the status API reads free_psram_bytes 818,596 against the 50,088 baseline, i.e. 768,508 bytes reclaimed. That is more than the 442,368 B a 576x768 offset stream needs, so the measured 27%-cheaper addressing (34 -> 25 cycles/word, #745) now has room. One evidence-line bug is noted: the PREFIXKV print computed both its figures through the compacted path (saved=0), which the status-API number corrects - the print needs the full size derived independently.","timestamp":1790368722688,"segment":1,"confidence":14.196078431372555}
{"run":749,"commit":"5516fee","metric":0,"metrics":{"boot_bench_tps":5.924,"device_output_exact":6,"device_token_delta":0,"ext_decode_tps":5.7638,"gen_tokens":99,"host_output_exact":19,"internal_free":14171,"logit_max_delta":0.00005341,"logit_top1_match":10,"min_case_tps":5.62,"prefill_tps":6.1283,"psram_free":818596,"think_tps":4.52},"status":"crash","description":"The CV3W offset-stream screen faulted before its print (inline-asm register allocation in my own bench, not an engine result), so it produced no device data - and while restoring the tree I priced the plan on the campaign's OWN measured numbers, which close it: the dominant proj2bit phase reads 3.59 MB per token in 80.8 ms = 44 MB/s, i.e. 69% of the measured 64 MB/s octal bus peak, and the offset stream is 1 byte per weight = 4x the packed stream = 14.36 MB per token, which needs 224 ms even at an unattainable 100% bus utilisation - 2.8x SLOWER than the 80.8 ms it replaces. The addressing win it buys is 8 addx4 removed from 33 instructions per 32-bit word = 24% of the issue slots, worth at most 19.6 ms, so it cannot pay for a 143 ms byte increase. The isolated 34 -> 25 cycles/word result (#745) was measured on a 64-word fixture that lives in the 64 KB data cache, so its streaming cost never appeared - the same warm-screen artifact this campaign recorded twice (#295 phi, #364 transform). Consequence: the predecoded offset stream is closed on the byte budget, and the tier-tail capacity work (#746/#747) and the compact-prefix reclaim (#748, 768 KB, quality-safe) stand on their own as free PSRAM and a faster prefix restore rather than as enablers for it. B1's throwaway screen build was fully reverted and rebuilt.","timestamp":1790369892439,"segment":1,"confidence":14.196078431372555}
{"run":750,"commit":"5516fee","metric":6.0617,"metrics":{"boot_bench_tps":6.152,"device_output_exact":6,"device_token_delta":0,"ext_decode_tps":5.9777,"gen_tokens":99,"host_output_exact":19,"internal_free":14991,"logit_max_delta":0.00005341,"logit_top1_match":10,"min_case_tps":5.82,"prefill_tps":6.3967,"psram_free":2062492,"think_tps":4.65},"status":"discard","description":"Instruction-level peephole audit of the hottest code (the 2-bit walker, 49% of the token) on the campaign-best image - a closure with evidence rather than an estimate, at zero board cost. The live nd_lut2_rows_tie1n body from board 2's 6.0617 ELF contains exactly 316 instructions: add.s 67 (64 accumulate + 3 fold), extui 64, addx4 64, lsi 64, l32i.n 16, then the group bookkeeping (slli 4, add.n 4, addmi 4, addi.n 4, mull 2, wfr 2, j 3, mov.s 2, plus entry/bgeu/sub/beqz). Read as a sequence, the body is exactly the documented W8D floor - extui x4 / addx4 x4 / lsi x4, then add.s x8, repeating for the eight 32-bit words of a 128-weight group - with no redundant instruction, no spill, and no reload: the 16 l32i.n all sit in the PROLOGUE (argument-struct fields, the two slice loads, the group norm), i.e. per call rather than per group. Every one of the 64 addx4 is the nibble's x4 byte scaling, which the ISA requires for a base+immediate-only lsi; every lsi is a pair-LUT lookup; every add.s is the accumulation. So the walker is at its instruction floor by direct inspection, which is the same conclusion the campaign reached analytically (2 instructions per weight, IPC ~1.33) and now has instruction-level evidence for. No candidate came out of the audit and no code changed.","timestamp":1790370087102,"segment":1,"confidence":14.243556954554393}
{"run":751,"commit":"5516fee","metric":6.0617,"metrics":{"boot_bench_tps":6.152,"device_output_exact":6,"device_token_delta":0,"ext_decode_tps":5.9777,"gen_tokens":99,"host_output_exact":19,"internal_free":14991,"logit_max_delta":0.00005341,"logit_top1_match":10,"min_case_tps":5.82,"prefill_tps":6.3967,"psram_free":2062492,"think_tps":4.65},"status":"discard","description":"Second peephole pass, on the other shipped kernels of the campaign-best (6.0617) image, for the two failure modes the load-form program identified: register pressure (spills) and redundant loads. Results, all static bodies read from the live ELF: nd_gemv4_rows_tie1W (wide phi) 76 instructions, 2 wide loads, 0 stack references; nd_gemv4_rows_tie1 (plain phi) 85 instructions, 16 lsi, 0 stack refs; nd_kron1_w (the kept wide kron) 33 instructions with 8 wfr / 8 madd.s / 8 ssi - the deliberately wider form, still no frame traffic; fwht_rows 414 instructions (46 l32i.n, 39 ssi, 38 lsi), 0 stack refs; nd_fwht3s (the fused stage-pair transform) 230 instructions (36 lsi, 36 ssi, 20 addx4 for float-stride address arithmetic, 18 each add.s/sub.s/mul.s), 0 stack refs; lanepre_rows 67 instructions, 0 stack refs. So the spill class - the one that decided the kron2 versus kron1 outcomes - is verified ABSENT on every kernel the newest tree ships, by direct inspection rather than by inheritance from the older scan; and no kernel carries an obviously redundant memory operation in its body. No candidate emerged, no code changed. Consolidated kernel inventory for the next window: the hot path is attn_heads (6,486 B of C including its inlined kernels), nd_model_step_hidden (7,241 B), nd_lut2_rows_tie1n (918 B, audited last run at exactly the W8D floor), nd_gemv4_rows_tie1W, nd_kron1_w, fwht_rows and nd_fwht3s.","timestamp":1790370191141,"segment":1,"confidence":14.291354125542817}
{"run":752,"commit":"5516fee","metric":6.0617,"metrics":{"boot_bench_tps":6.152,"device_output_exact":6,"device_token_delta":0,"ext_decode_tps":5.9777,"gen_tokens":99,"host_output_exact":19,"internal_free":14991,"logit_max_delta":0.00005341,"logit_top1_match":10,"min_case_tps":5.82,"prefill_tps":6.3967,"psram_free":2062492,"think_tps":4.65},"status":"discard","description":"Instruction-level read of attn_heads (the 24.1 ms phase, never audited before) - explanatory rather than a candidate, and it reconciles three historical nulls. Parsed from the live 6.0617 ELF: 2,414 instructions, ZERO frame accesses (no spill), 33 backward branches forming the nested loops, and a striking composition - movi 252 + l32r 160 = 412 instructions (17%) are constant materialization. Mapped to loop spans, the share is the same inside the hot bodies: the outermost loop (2,255 instrs) carries 406 constants (18%), the 1,696-instruction loop 288 (17%), the 1,202-instruction loop 201 (17%), the 818-instruction loop 132 (16%). Since attn_heads has no frame traffic at all, those constants are not spill refills: GCC is choosing to REMATERIALIZE addresses and float constants rather than keep them live, which is exactly the trade it makes when the 16-entry float register file is the binding resource (the same pressure that decided kron2 versus kron1 in the load-form program). That is the explanation for a previously unexplained pattern in this ledger: the live-range/hoist family measured THREE nulls (#579 quartet barriers -0.090%, #582 pointer+codebook hoist -0.060%, E-live-range edits -0.06%) even though the constants are visibly there - forcing them live costs registers the loop does not have, so the instruction count does not move. It also bounds the two directions: hoisting is closed by those measurements, and reducing the constant COUNT (algebraic restructuring of the exp polynomial or the clamp bounds) would be a rounding change, which the byte-exact and fidelity gates refuse. So the attention phase's remaining instruction budget is register-limited rather than redundant, and no candidate came out of the audit. No code changed.","timestamp":1790370329359,"segment":1,"confidence":14.482896579315858}
{"run":753,"commit":"5516fee","metric":5.83,"metrics":{"boot_bench_tps":5.925,"device_output_exact":18,"device_token_delta":52,"ext_decode_tps":5.7623,"gen_tokens":99,"host_output_exact":19,"internal_free":11023,"logit_max_delta":0.00005341,"logit_top1_match":10,"min_case_tps":5.62,"prefill_tps":6.1283,"psram_free":2062492,"think_tps":4.52},"status":"discard","description":"Breadth promotion of the compact-prefix keep (B1, engine c69648d2784a, the tree that carries the +768 KB prefix reclaim): decode 5.83 reproduces the restricted screen 5.8283 exactly, ext_decode_tps 5.7623, think_tps 4.52, min_case_tps 5.62, prefill_tps 6.1283, boot_bench_tps 5.925, gen_tokens 99, device_output_exact 18/20 with device_token_delta 52 - i.e. exactly the pre-existing pair of ring-related demo-timer goldens that every tree on this line shows (#647), so the prefix compaction introduces no divergence of its own; the host prefix-isolation test is green on the same tree. One figure to note rather than smooth over: internal_free reads 11,023 here against the 14,171 the restricted run printed for the same tree - expected measurement-point difference rather than a regression, since the full suite runs 14 more requests (and the sampler's lazily allocated structures) before the value is sampled; the shipping signature of this tree is unchanged from the screen, which is why the runner required the documented AUTO_ALLOW_REPEAT allowance for a restricted-to-full promotion. Net: the compact-prefix keep now carries screen PLUS breadth evidence, and the packet for the shippable line stands at 5.8283 with host 19/19, device 18/20 (the two #647 cases only), ext 5.7623, think 4.52, min 5.62.","timestamp":1790370804427,"segment":1,"confidence":14.679643146796437}
{"run":754,"commit":"5516fee","metric":5.765,"metrics":{"boot_bench_tps":5.925,"device_output_exact":6,"device_token_delta":0,"ext_decode_tps":5.7623,"gen_tokens":99,"host_output_exact":19,"internal_free":11023,"logit_max_delta":0.00005341,"logit_top1_match":10,"min_case_tps":5.56,"prefill_tps":6.0567,"psram_free":2062492,"think_tps":4.52},"status":"discard","description":"Porting the seed line's NF16V lever to the shippable line INVERTS its sign: +0.642% there, -1.11% here (decode 5.765 against this board's own 5.83 tree) - a clean, measured verdict on a mathematically exact transformation. What was ported: the five-instruction fp16-to-fp32 rebias in lut2_tie728.S ((h<<13) + 0x38000000, which is exact for a positive ordinary halfword because m<<13 cannot carry into the exponent field and e+112 stays clear of 255) plus the load-bearing predicate extension in nd_lut2_asm_ok (reject sign-bit-set or exponent 0/31 norms, because a negative halfword's sign would land in the exponent; the census says every needle3.cact norm passes - 351,744 across 46 CQ2 tensors are positive normal). The port was verified before any board time: the host oracle over all 65,536 encodings printed REBIAS in_domain=30720 rejected=34816 mismatch=0 guard_miss=0 known_bad=0 and h=0x3c00 -> 3F800000, and the macro was byte-identical to the seed line's after the edit. Device: 6/6 exact, token_delta 0, boot bench unchanged, so the values are right and this is purely a speed verdict. The lesson is the campaign's composition rule with a new and stronger example - a lever's SIGN, not just its magnitude, depends on the tree it lands in (sub-additivity was known from bundle5; inversion is new), so the +0.642% measured on the seed stack was never a property of the transformation. Reverted byte-exactly: the worker's provenance hash is back to c69648d2784a6422139c201c1627a0ea, verified with the harness's own concatenation form after my first check used a path-dependent form and mismatched (the campaign's recorded path-string trap, third instance). One tree fact discovered while reverting and worth keeping: B1's baseline carries its own E59 fused-transform path (nd_fwht4r in nd_quant.c, 'FWHT4R live=1' at boot), so this board is not a pure shippable+compact-prefix tree.","timestamp":1790371610066,"segment":1,"confidence":14.679643146796437}
{"run":755,"commit":"87ac8c5","metric":5.8633,"metrics":{"boot_bench_tps":5.925,"device_output_exact":6,"device_token_delta":0,"ext_decode_tps":5.7623,"gen_tokens":99,"host_output_exact":19,"internal_free":10767,"logit_max_delta":0.00005341,"logit_top1_match":10,"min_case_tps":5.65,"prefill_tps":6.165,"psram_free":2062492,"think_tps":4.52},"status":"keep","description":"Wide phi (nd_gemv4_rows_tie1W) ported to the shippable line and KEPT on its own tree's measurement: decode 5.8633 against this board's 5.83 baseline = +0.57%, prefill 6.165 (+0.60%), min_case 5.65 (+0.53%), 6/6 device exact, token_delta 0, internal_free 10,767 (-256 B). This is the counter-example that makes run #754's lesson precise: NF16V inverted sign across the two lines (-1.11% where it was +0.642%), while the wide phi kernel keeps its sign (+0.57% here, in the same class as the load-form program's kept levers) - so the rule is not \"never port\", it is \"always measure on the receiving tree\", and both results came from the same discipline. What was ported, exactly: the nd_gemv4_rows_tie1W kernel (ee.ldf.128.ip xh loads with the register list written f7,f6,f5,f4 so f4 receives the LOWEST address - the extension's 128-bit forms are post-increment and the last named register takes the lowest address, TRM 1.8.25/1.8.65, which is what made the earlier -2.1% QK-screen result a bad-probe artifact), its declaration, the gemv_rows_offset_asmW wrapper and the alignment-aware selection at both pick sites (16-byte-aligned xh, which ND_ALLOC_FAST16 already provides in this tree - no allocation change was needed). Two mechanical traps cost builds and are recorded: appending from the kernel's comment to EOF dragged in lane-mix kernels the receiving file already had, and the kernel's local labels (.Llp/.Llp_end, .Llm, .Lmu, .Lpvchunk, .Lk1 and friends) collided with the receiving file's own - resolved by extracting the kernel to its next top-level directive (2,406 bytes) and renaming only the colliding labels to .LW*. Verified before the screen: the build links the new symbol (nm count 1). Owed on this tree: the full-group gate and the host gates.","timestamp":1790372236569,"segment":1,"confidence":14.679643146796437}
{"run":756,"commit":"277d5d6","metric":6.0883,"metrics":{"boot_bench_tps":6.155,"device_output_exact":6,"device_token_delta":0,"ext_decode_tps":5.9777,"gen_tokens":99,"host_output_exact":19,"internal_free":11795,"logit_max_delta":0.00005341,"logit_top1_match":10,"min_case_tps":5.86,"prefill_tps":6.4283,"psram_free":2062492,"think_tps":4.65},"status":"keep","description":"CQ2 group hardware loop on the seed line (B2): the live nd_lut2_rows_tie1n group body ended in addi.n a2,-1 / beqz / j (three instructions per group) and now uses `loop a2, .Ltn_gend`, with LBEG landing on the group start and LEND on the row epilogue - three control instructions removed per group, six groups per row on the dense CQ2 tensors, against one long-form loop setup per row. The assembler emitted the documented long-loop expansion (loop a2 / rsr.lend a2 / wsr.lbeg a2 / l32r a2,<end> / nop) and the expansion uses a2 only as its address scratch after `loop` has taken the count into LCOUNT, so no live register is clobbered: W8D, every partial, the NF16V norm conversion, FOLD, both cursors and the row order are untouched. Device: decode 6.0883 against this board's seed pin 6.0617 = +0.44%, prefill 6.4283, min_case 5.86 (pin 5.82), 6/6 byte-exact with token_delta 0, internal_free 11,795. This challenges the claimed control-flow floor of the dominant phase and it is the first above-bar result on the CQ2 walker since the seed itself. Owed before the tree is treated as gated: the specified bitwise row differential over the real 4-bit/2-bit fixtures and multi-row ranges (the 6-case golden gate is output evidence, not that differential), then a breadth promotion. Two mechanical notes: the .Lt1_* kernel in the same file at lines 270-320 is NOT dispatched (an edit there would have been a silent null - the live labels are .Ltn_row/.Ltn_group/.Ltn_gend), and the live kernel's .size-directive span means the previous static audits must be read as spans, not as the whole function.","timestamp":1790373766074,"segment":1,"confidence":14.787510137875106}
{"run":757,"commit":"5516fee","metric":6.075,"metrics":{"boot_bench_tps":6.155,"device_output_exact":6,"device_token_delta":0,"ext_decode_tps":5.9777,"gen_tokens":99,"host_output_exact":19,"internal_free":12035,"logit_max_delta":0.00005341,"logit_top1_match":10,"min_case_tps":5.85,"prefill_tps":6.41,"psram_free":2062492,"think_tps":4.65},"status":"keep","description":"QK dot outlined to a noinline helper on the seed line (B3): the shipped 8-column, four-accumulator QK dot body (sixteen statements per 8 columns, two heads interleaved inside attn_heads) is now its own ND_HOT noinline function qk_dot8, with the caller keeping the four scale multiplies exactly where they were. This targets a register-allocation boundary rather than a scheduling idea: the live ELF's QK hardware loop carries two store/reload pairs through a11 = a1 + 0x470 inside EVERY 8-column iteration (0x4037c77c/78b/793 loading and storing f0, 0x4037c7b3 reloading it, and the same slot again at 0x4037c803/847) - indirect frame accesses that a regex looking for literal a1 operands misses, which is why the earlier zero-spill statement in this log was wrong and is hereby corrected. Device: decode 6.0750 against this board's seed pin 6.0617 = +0.22%, prefill 6.41, min_case 5.85, 6/6 byte-exact with token_delta 0, internal_free 12,035. That is just over the 0.2% bar and inside the range the campaign's two earlier noinline experiments bracketed (the staging helper +1.07%, pv_pair2 -0.173%), so the honest reading is that outlining this body is mildly positive rather than a large win, and it is kept on the device gate plus the statement-for-statement arithmetic (each accumulator keeps its own ascending sequence and its own 0.0f seed, and every multiply is the shipped one). Owed: the same bitwise row differential the group-loop lane owes, and a breadth promotion; both lanes' 6-case screens are output evidence, not that differential.","timestamp":1790373790469,"segment":1,"confidence":14.787510137875106}
{"run":758,"commit":"9fdb703","metric":6.0883,"metrics":{"boot_bench_tps":6.155,"device_output_exact":6,"device_token_delta":0,"ext_decode_tps":5.9777,"gen_tokens":99,"host_output_exact":19,"internal_free":11795,"logit_max_delta":0.00005341,"logit_top1_match":10,"min_case_tps":5.86,"prefill_tps":6.4283,"psram_free":2062492,"think_tps":4.65},"status":"keep","description":"The bitwise row differential owed on the group-hardware-loop keep (B2) PASSES. kbench built on the same tree (ND_KBENCH, unmodified bench) and the live kernel was driven through the campaign's own row-range test at the real geometry - out=8192, in_pad=768, ngroup=6, rowbytes=384, rows=24 - for chunk sizes 1, 12 and 24 (i.e. single-row calls, half-row chunks and the whole 24-row range in one call): `KB ROWRANGE ... mismatch=0` on all three. So the hardware group loop reproduces the per-row reference bitwise across multi-row ranges, not merely on the six golden prompts - which is the check that cost run #333 its first build when it was absent. The same capture also printed the unchanged historical benches (EXP scalar 129.03 vs paired 112.04, mismatch 0; DOT c4 139 vs pair 404 / reord 214; DIV rom 7.95 cyc; GATHER c_gather_dot_group 5089.50 vs lut2_asm_per_row 2506.80 cyc/row; WAKE 23 cycles hot and parked), so the kbench path itself is intact under this tree. With the 6-case screen (6.0883, +0.44%, 6/6 exact, delta 0) and this differential, the group-loop keep now has both output evidence and kernel-level bitwise evidence; its breadth promotion is launched next. Harness note for the pool: inside `needle-board run N` the /dev/ttyACM* aliases are board 1's, so a bench that hardcodes them drives the wrong board - the lock's $FLASH_PORT/$SERIAL_PORT are the only correct handles.","timestamp":1790374264162,"segment":1,"confidence":14.835638730675345}
