{"run":295,"commit":"8a2aea0","metric":5.0117,"metrics":{"boot_bench_tps":5.057,"device_output_exact":14,"device_token_delta":0,"ext_decode_tps":4.9286,"gen_tokens":99,"host_output_exact":13,"internal_free":15215,"logit_max_delta":0.00005341,"logit_top1_match":10,"min_case_tps":4.79,"prefill_tps":5.2867,"psram_free":2052252,"think_tps":3.93},"status":"discard","description":"Tested my own prior conclusion about the phi phase and it failed, which is the useful outcome. Run #295 had recorded a 4.3x gap between the field attribution (9.2 ms of GEMVs for 73,728 weights = 30 cycles/weight) and a microbenchmark's 6.98, and inferred cold PSRAM line fill on a 37 KB working set, redirecting the last open candidate from assembly to residency. The decisive measurement was the real per-token phi work - all three phi tensors, the layer's 24 rows in the model's own row ranges, real archive bytes staged into PSRAM the way the tier stages them, a real nd_cq_prepare activation - timed warm and with the data cache deliberately evicted before every call. Cold costs only +9.2 % over warm, which cannot explain a 4.3x gap. The gap was mine, not the model's: nd_cq_gemv_rows dispatches through nd_parallel_rows, so the field number is two-core wall time, while the bench runs at the kbench hook before app_main creates the row-split worker and so measures one core doing all the rows. Normalised to core-cycles the field number is 7.5 cycles/weight against the bench's 6.41 warm and 7.00 cold - agreement to within 9 %, so there was never any gap and the phase map and the kernel cost have always agreed. The retraction is recorded in .auto/ideas.md alongside the data, and the accidental by-product is a stronger closure than the one I went looking for: eviction costs +9.2 % and perfect residency buys +9.3 % (run #295), two independent methods landing on the same number, so phi's only addressable share is operand delivery at under 10 % of the phase - and it cannot be paid anyway, since 12 rows per core x 1,536 B = 18 KB per core against 15,215 B of internal heap. Assembly, residency and row blocking are therefore all closed on measurement with mutually consistent numbers behind them. row_mismatch=0 on every mode, so the comparison measured the memory system rather than different computations. Nothing shipped; the canonical run restores the shipping image after the bench flash and reproduces the accepted signature to the digit, with internal_free 15,215 confirming the reverted assertion level is back at the shipping default.","timestamp":1790068741679,"segment":2,"confidence":null,"asi":{"closure":"phi is closed on measurement from three sides, all consistent: residency buys +9.3 pct (run #295), full-working-set cache eviction costs +9.2 pct (this run), and the instruction-count analysis matches the kernel's measured 6.41-7.00 core-cycles per weight. Assembly cannot move the weights, residency cannot be paid (12 rows per core x 1,536 B = 18 KB per core against 15,215 B of internal heap), and row blocking was already neutral.","corrected_number":"field 9.2 ms / 8 layers = 276,000 cycles wall per layer x 2 cores / 73,728 weights = 7.5 core-cycles per weight, against the bench's 6.41 warm and 7.00 cold. Agreement to within 9 pct: there was never a gap.","hypothesis":"run #295 recorded a 4.3x gap between the field's phi attribution (30 cycles/weight) and the microbenchmark's 6.98, and inferred cold PSRAM line fill on a 37 KB working set. The decisive test was the real 24-row 3-tensor phi sweep measured warm against cache-thrashed.","measured":"warm_sweep 472,385 cyc/layer = 6.41 cyc/weight = 1.968 ms/layer = 15.75 ms/token single-core; cold_sweep (160 KB sequential PSRAM sweep before each call) 516,013 = 7.00 = 2.150 = 17.20; row_mismatch=0 on every mode; geometry confirmed on device (tensors 223/224/225, pre 32/3072, post 32/3072, res 128/3072, group 128, 24 rows and 36,864 weight bytes per layer)","next_action_hint":"phi off the target list. The campaign's above-bar routes are both owner decisions rather than code: the assertion level (run #293, frees 8,248 B and would re-price the residency family) and 120 MHz octal memory (+3.51 pct, forbidden by the documented-maxima rule). A 4.3x anomaly in a firmware whose every other phase agrees to 9 pct is far more likely to be my arithmetic than the model.","retraction":"RETRACTED the run #295 conclusion. The 4.3x gap was my units error: nd_cq_gemv_rows dispatches through nd_parallel_rows, so the field's 9.2 ms is two-core wall time, while the kbench hook runs before app_main creates the row-split worker, so the bench measures one core doing every row. Normalising to core-cycles dissolves the discrepancy entirely.","recurring_lesson":"this is the campaign's fourth phantom anomaly resolved the same way - the 5x sampler cost, the 2x boot-bench gap, the route-phase gap, and now this one - each was a comparison between quantities with different scopes. Normalise units before believing an anomaly, especially since the phase map's timers are documented as overlapping and non-summable.","verification_repeat":"canonical run restored the shipping image after the bench flash and reproduced the accepted signature to the digit: 5.0117 decode / 4.9286 extended / 3.93 think / 5.2867 prefill / 4.79 min_case / 5.057 boot bench / internal_free 15,215 (proving the reverted assertion level is back to the shipping default) / 14-14 device + 13-13 host byte-exact / token_delta 0 / checks green. Tree verified byte-identical to the accepted runtime for engine and esp32; bench artifacts kept in .auto/exp21 including the git-HEAD copy of the Experiment-2 kbench.c that the bench cycle overwrote."}}
{"run":296,"commit":"4eb1813","metric":5.0117,"metrics":{"boot_bench_tps":5.057,"device_output_exact":17,"device_token_delta":0,"ext_decode_tps":4.939,"gen_tokens":99,"host_output_exact":16,"internal_free":15215,"logit_max_delta":0.00005341,"logit_top1_match":10,"min_case_tps":4.79,"prefill_tps":5.2867,"psram_free":2052252,"think_tps":3.93},"status":"keep","description":"Benchmark-authority iteration, not a speed candidate: the shipping tree is byte-identical to the accepted runtime (git diff over engine/ esp32/ host/ tools/ model/ = 0 lines), so decode_tps is 5.0117 by construction and stays the accepted value. `host_output_exact` 13->16 and `device_output_exact` 14->17 are suite widening, not speed or quality changes.\n\n(1) OVERFITTING CHECK, answered with genuinely unseen prompts. `extended` had been watched for 200+ runs, which is how a held-out set becomes in-distribution, so I added three shapes the suite never measured: no-tool free text, a short translation route, a three-field batch. All short, because the firmware request reader silently truncates at ND_LINE_MAX-1=271 bytes (run #155) and request_timeout is 600 s so #155's failure mode cannot recur. `primary`, `think` and `probe_ids` verified identical to git before and after; prompts.json diff is additions-only (18 insertions, 0 deletions). Device rates on the three unseen prompts: 5.080 / 5.020 / 4.790 tok/s - inside the frozen set's own band (primary 5.0117, min_case 4.79), so the +105 % is not prompt-specific: no overfitting signature. The route shape is again the slow one, consistent with the campaign's existing attribution (more sink positions -> more attention work). ext_decode_tps is now 4.9390 over 10 held-out cases (was 4.9286 over 7) - a monitor widening, not a regression. Behaviour noted for the owner: \"Tell me a joke about caching\" makes the model emit set_sampling_interval(seconds=120), a hallucinated call that is grammar-legal only because the schema has no no-op escape; the three-field batch (5 calls, 67 tokens) is the first multi-call coverage the suite has had.\n\n(2) FOUR GOLDEN-INTEGRITY HOLES closed in my own harness - the class of bug that can silently invalidate the campaign's quality gate: (a) compare() counts a case with no golden entry as byte-exact, so a renamed or typo'd case id passes forever; now reported as host_golden_missing/device_golden_missing, which caught the blind spot on first use (missing=3). (b) The partial-save guard only applied when the golden was EMPTY, so `AUTO_GROUPS=primary AUTO_SAVE=1` would have overwritten the 14-case baseline with 6 cases and the dropped 8 would have passed vacuously forever; the full-groups requirement now gates EVERY save. (c) That guard also called measured_groups_full() with no argument - a TypeError if it ever fired, unreachable only because of (d). (d) CASES was built with isinstance(v, list), which also swallowed probe_ids, so the full-groups predicate could never be true and every golden save was silently refused. Plus (e) AUTO_SAVE=1 was documented in measure.sh's own header but never read: the save was gated on log.jsonl having <=1 line, so the device golden could never be updated after iteration 1.\n\nGoalposts verified unmoved by the re-baseline: 13/13 host and 14/14 device pre-existing golden entries byte-identical, additions only, nothing removed. Final state 17/17 device and 16/16 host byte-exact with golden_missing=0, token_delta 0, checks green, fidelity 5.341e-05 / top1 10/10, internal_free 15,215 and psram_free 2,052,252 unchanged.\n\nAlso closed a config idea cheaply, before spending a build: the instruction cache cannot be widened - the ESP32-S3 Kconfig offers only 16 B (gated on a 16 KB cache) and 32 B instruction lines, with 32 KB as the I-cache maximum, and the data cache is already 64 KB / 8-way / 64 B line. So the cache-config family that produced #238's +11.9 % is closed by the Kconfig itself rather than by assumption; several closure notes were carrying a stale \"32 KB data cache\" claim, now corrected.","timestamp":1790070439444,"segment":2,"confidence":null,"asi":{"config_idea_closed_cheaply":"instruction cache cannot be widened: S3 Kconfig offers 16B (needs 16KB cache) and 32B I-lines only, I-cache max 32KB (current), data cache already 64KB/8-way/64B line. Cache-config family closed by the Kconfig itself.","evidence_goalposts_unmoved":"13/13 host + 14/14 device pre-existing golden entries byte-identical after re-baseline; prompts.json diff additions-only (18 insertions, 0 deletions); primary/think/probe_ids verified identical to git","final_gate_state":"device 17/17 byte-exact golden_missing=0 token_delta=0; host 16/16 golden_missing=0; checks green; internal_free 15215; psram_free 2052252","hypothesis":"Two hypotheses, both measured: (1) the accepted +105% generalises to prompts the campaign has never seen, i.e. the fixed `extended` set has not become an in-distribution overfit target; (2) the byte-exact golden gate is actually checking what it claims to check.","metric_note":"decode_tps unchanged BY CONSTRUCTION - git diff over engine/ esp32/ host/ tools/ model/ is 0 lines; host_output_exact 13->16 and device_output_exact 14->17 are suite widening, not a speed or quality change; ext_decode_tps 4.9286(7 cases) -> 4.9390(10 cases) is a monitor widening","new_coverage":"first multi-call/three-field case (5 calls, 67 tokens), first no-tool free-text case, first short route case","next_speed_candidates":"none above the 0.2% bar in the tree; the two routes above the bar remain owner decisions (assertion level: +8,248 B internal RAM, run #293; 120 MHz octal memory: +3.51%, forbidden by the documented-maxima rule, run #289)","product_finding_for_owner":"'Tell me a joke about caching' -> set_sampling_interval(seconds=120): hallucinated tool call, legal only because the schema has no no-op escape","result_gate":"four integrity holes closed: missing-golden counted as exact; partial-save guard skipped on non-empty golden (would have shrunk 14-case baseline to 6); measured_groups_full() called with no args (TypeError if reached); CASES swallowed probe_ids so every golden save was refused; AUTO_SAVE documented but never read by measure.sh","result_overfit":"unseen prompts 5.080/5.020/4.790 tps vs primary 5.0117 and min_case 4.79 - same band, no overfitting signature","revisits_run":155,"test_left_behind":".auto/test_bench_guards.py - asserts CASES groups, full-vs-partial predicate, missing_golden, and that primary is still the 6 frozen ids"}}
{"run":297,"commit":"6d3924c","metric":5.0117,"metrics":{"boot_bench_tps":5.057,"device_output_exact":17,"device_token_delta":0,"ext_decode_tps":4.939,"gen_tokens":99,"host_output_exact":16,"internal_free":15215,"logit_max_delta":0.00005341,"logit_top1_match":10,"min_case_tps":4.79,"prefill_tps":5.2867,"psram_free":2052252,"think_tps":3.93},"status":"keep","description":"Gate-falsification iteration (measurement authority, not speed): the shipping tree is unchanged, so decode_tps is the accepted 5.0117 and this run's real product is proof that the campaign's quality gates can actually turn red. Motivated directly by run #296, which found a gate that silently passed 3 of 17 cases - \"all gates green\" is only evidence if the gates can fail.\n\nBuilt `.auto/gate_falsify.sh`: deliberately break each guarded input, require checks.sh to exit non-zero naming the expected gate, restore with git checkout, then require the unmutated tree green. Result 5/5, gates_missed=0:\n* one-character change to a stored generation in golden/host.json -> HOST_OUTPUT_DIVERGED (the byte-exact gate works).\n* +0.5 on one reference logit in golden/logits.txt -> FIDELITY refusal (the numeric reference is load-bearing).\n* editing one primary prompt's text -> BENCH_GUARDS_FAILED. **This one was invisible before today**: checks.sh's frozen-input guard is a git diff over model/, tools/ and partitions.csv and does NOT include .auto/prompts.json, so the six prompts that *define the metric* were unprotected by any gate. Closed by pinning primary's prompt text, its id/phase list and probe_ids by sha256 inside .auto/test_bench_guards.py, which checks.sh now runs.\n* a real quality trade, Sinkhorn 20 -> 10 iterations, -> HOST_OUTPUT_DIVERGED. This is the gate's whole purpose: it refuses speed bought with model behaviour, and it is now proven to do so rather than assumed.\n* ctest reports 2 real tests (grammar, prefix_isolation), so the suite cannot silently collect zero tests.\n\nAlso added a second gate: the host byte-exact check required exact == cases, which run #296 showed is satisfiable while comparing against nothing, so it now additionally requires host_golden_missing == 0.\n\nBoth new gates were then verified inside the real pipeline by a canonical device run: checks green through the new code path, 17/17 device byte-exact with golden_missing = 0, decode 5.0117, extended 4.9390, think 3.93, prefill 5.2867, boot bench 5.057, internal_free 15,215, psram_free 2,052,252 - every value identical to run #296, as it must be with no engine change.\n\nOne false alarm in my own new script, fixed rather than waved through: its env guard keyed on IDF_PATH, and this environment sets IDF_PATH with cmake/ctest off PATH - the exact trap checks.sh documents. The test-count probe therefore saw no ctest output and reported \"zero tests\" (MISSED). Keying on the tool instead of the variable gave 5/5 CAUGHT. Worth recording as a rule: a check whose tool is missing must report failure, not pass - which is what it did, and is why this was caught in one run instead of never.","timestamp":1790071385064,"segment":2,"confidence":null,"asi":{"artifacts":".auto/gate_falsify.sh (mutation suite, 5/5 gates proven falsifiable, control green), .auto/test_bench_guards.py (now pins primary text/phases + probe_ids by sha256), .auto/checks.sh (2 new gates)","control":"unmutated tree green AFTER the new gates were added, and a canonical device run reproduces 5.0117 with 17/17 byte-exact golden_missing=0","hypothesis":"A gate that cannot fail is worthless - run #296 proved one silently passed 3 of 17 cases. Break each guarded input deliberately and require the gate to go red.","host_metrics_fresh":"host_output_exact 16/16, host_golden_missing 0, logit_max_delta 5.341e-05, top1 10/10 (re-measured by the falsify suite's control run)","m5_false_alarm":"my own script's env guard keyed on IDF_PATH, which this env sets with cmake/ctest OFF PATH - the exact trap checks.sh documents for cmake. It made the test-count probe see no output and report MISSED. Fixed to key on ctest; re-run gave 5/5 CAUGHT. A check that cannot run must report failure, which it did.","metric_note":"decode_tps unchanged by construction - no engine/esp32/host change; the engine tree diff is 0 lines. Device secondaries are freshly re-measured on this canonical run.","next_action_hint":"speed work remains at the measured floor; the productive lens right now is measurement authority. Remaining un-falsified gate: the DEVICE byte-exact compare (needs a flash to mutate) - covered instead by unit test bench.compare() failing on a changed case.","result":"4 of 4 substantive gates proven falsifiable: one-char change to a stored generation -> HOST_OUTPUT_DIVERGED; +0.5 on one reference logit -> FIDELITY refusal; editing one primary prompt -> BENCH_GUARDS_FAILED (new gate, was invisible before this run); real quality trade Sinkhorn 20->10 -> HOST_OUTPUT_DIVERGED. Plus ctest reports 2 real tests (grammar, prefix_isolation), so the suite cannot silently collect zero.","two_new_gates":"(1) checks.sh now runs test_bench_guards.py, which pins primary's prompt TEXT, id/phase list and probe_ids by sha256 - closing the hole that checks.sh's frozen-input git diff covers model/, tools/, partitions.csv but NOT .auto/prompts.json, i.e. the six prompts the metric is the mean of were unprotected. (2) host byte-exact gate now requires host_golden_missing=0, because exact==cases is satisfiable while comparing against nothing."}}
