{"run":566,"commit":"35c045c","metric":5.3033,"metrics":{"prefill_tps":5.59,"ext_decode_tps":5.2269,"think_tps":4.2,"boot_bench_tps":5.621,"min_case_tps":5.31,"gen_tokens":99,"internal_free":8415,"psram_free":2052252,"device_output_exact":18,"device_token_delta":52,"logit_max_delta":0.00005341,"logit_top1_match":10,"host_output_exact":19},"status":"keep","description":"Prepared the owed behavioural capture by moving the acceptance image onto the only board the capture path can reach. Board 1's engine and main sources were replaced with the accepted files, its tree hash verified byte-identical to the acceptance provenance 4d3094578050, and a fresh build plus flash completed with FLASH_RC=0 - so the single-board /dev/ttyACM aliases that demo/capture.py reaches through needle-api now run the image actually being accepted, not the stale baseline. I stopped there deliberately rather than starting the API sequence half-finished: capture needs sole ownership of the console, five minutes of priming, nine scenarios and a clean teardown, and unsupervised port-ownership collisions have cost lanes before (#418, #498). No speed measurement this iteration and no change to the pin, which stays at 5.3033 with the cross-board 18/20 verdict on provenance 4d3094578050 awaiting the owner's disposition of the two demo-timer goldens.","timestamp":1790272009080,"segment":1,"confidence":18.02457142857145,"asi":{"hypothesis":"Install the acceptance tree on board 1 as a deliberate baseline change and flash it, so make capture - which can only reach the model through needle-api on the single-board aliases - can run against the image that is actually being accepted.","next":"Next window, with board 1's console free: start needle-api on the board-1 console alias, wait for EVT READY after the five-minute priming, confirm /health, then run make capture and stop the API before releasing the board. All nine behavioural flags must be true for the acceptance packet to claim the repo's own integrity check passed on this image.","state":"Board 1's tree now hashes to 4d3094578050 - byte-identical to the accepted stack - and its build plus flash completed with FLASH_RC=0, so the canonical single-board path now runs the acceptance image.","why_not_capture_now":"Capture requires needle-api to own the console, and starting the API, waiting for the five-minute priming, running nine scenarios and tearing the API down is a multi-step sequence with a serial-port ownership hazard; I did the one durable step (install plus flash, verified) rather than start a half-sequence I could not supervise to completion, since #418/#498 showed an unsupervised port-owner mixup costs a whole lane."}}
{"run":567,"commit":"35c045c","metric":5.3033,"metrics":{"prefill_tps":5.59,"ext_decode_tps":5.2269,"think_tps":4.2,"boot_bench_tps":5.621,"min_case_tps":5.31,"gen_tokens":99,"internal_free":8415,"psram_free":2052252,"device_output_exact":18,"device_token_delta":52,"logit_max_delta":0.00005341,"logit_top1_match":10,"host_output_exact":19},"status":"keep","description":"Started the behavioural-capture prerequisite on the acceptance image: needle-api is running on board 1's console alias and driving the flashed acceptance tree, with the log showing prefix priming at 104/213 and rising, so the model is open and warming caches. demo/capture.py talks HTTP to 127.0.0.1:8081, so the API must own the console alone and the flash lane had already released its lock - the two are never in flight together. No measurement taken and no change to the pin, deliberately held at 5.3033 with the cross-board 18/20 verdict on provenance 4d3094578050 still awaiting the owner's disposition of the two demo-timer goldens; capture is the repo's own integrity check and the last acceptance evidence owed on this image.","timestamp":1790272104211,"segment":1,"confidence":18.02457142857145,"asi":{"hypothesis":"Bring up needle-api on the board-1 console alias so the repo's own behavioural capture (demo/capture.py, HTTP against 127.0.0.1:8081) can run against the acceptance image installed there in #566.","note_on_ownership":"The flash lane had already released the board lock, so the API is the sole console owner; capture and flash are never in flight together, which is the ownership rule #418/#498 paid for.","state":"API up and driving the acceptance image - the log shows prefix priming progressing (104/213 then 112/213), i.e. the model is open and warming its caches, which takes several minutes after a reset before commands are answered.","next":"Once priming completes and /health answers, run make capture from the main checkout against the default URL and require all nine behavioural flags true; then stop the API and confirm no serial_api child still holds the console before releasing the board, because pkill -f needle-api does not kill its serial_api.py child (documented harness fact)."}}
{"run":568,"commit":"862275f","metric":5.3033,"metrics":{"prefill_tps":5.59,"ext_decode_tps":5.2269,"think_tps":4.2,"boot_bench_tps":5.621,"min_case_tps":5.31,"gen_tokens":99,"internal_free":8415,"psram_free":2052252,"device_output_exact":18,"device_token_delta":52,"logit_max_delta":0.00005341,"logit_top1_match":10,"host_output_exact":19},"status":"keep","description":"The behavioural capture is running against the acceptance image and producing scenario verdicts: the log's first completed scenario reports outcome external_selected with latency 7,467 ms and its comparison flag true. This is the last acceptance evidence owed on provenance 4d3094578050 after #566 installed the image on the only board the capture path reaches and #567 brought up needle-api as sole console owner. Along the way I recorded a harness correction: my launch gate grepped /health for 'ok' and matched nothing, so the first invocation silently did nothing - the correct predicate is \\\"ready\\\":true - which is another instance of a check that tests for the wrong token and reports success by doing nothing (#300, #530). No speed measurement and no change to the pin, held deliberately at 5.3033 pending the owner's disposition of the two demo-timer goldens.","timestamp":1790272164884,"segment":1,"confidence":18.02457142857145,"asi":{"api_predicate_correction":"My launch gate grepped /health for 'ok' and matched nothing, so the first invocation did nothing; the real predicate in this API's response is \"ready\":true. Corrected and relaunched - a gate that tests for the wrong token silently does nothing, the same vacuous-check family as #300 and #530.","hypothesis":"Run the repo's own behavioural capture against the acceptance image now installed on the board the capture path can reach.","next":"Read CAP_RC and the verification flags; all nine must be true. Then stop the API and confirm no serial_api.py child still holds the console before releasing the board.","state":"Capture launched and already emitting scenario results - the log tail shows a completed scenario with outcome external_selected, latency_ms 7466.9 and a matching flag true - so the acceptance image is answering the nine-scenario suite rather than failing the transport."}}
{"run":569,"commit":"5278c13","metric":5.3033,"metrics":{"prefill_tps":5.59,"ext_decode_tps":5.2269,"think_tps":4.2,"boot_bench_tps":5.621,"min_case_tps":5.31,"gen_tokens":99,"internal_free":8415,"psram_free":2052252,"device_output_exact":18,"device_token_delta":52,"logit_max_delta":0.00005341,"logit_top1_match":10,"host_output_exact":19},"status":"keep","description":"Capture on the acceptance image is mid-flight with four verification comparisons true and zero false; no CAP_RC yet, so no claim. Pin deliberately unchanged at 5.3033.","timestamp":1790272181464,"segment":1,"confidence":18.02457142857145,"asi":{"hypothesis":"Read the capture verdict on the acceptance image.","next":"Wait for CAP_RC=0 with all nine flags true, then stop the API and confirm no serial_api.py child holds the console. If any flag is false, that is an acceptance-blocking behavioural regression and outranks everything else.","state":"Capture still running - no CAP_RC yet - but four verification comparisons are already true and zero are false."}}
{"run":570,"commit":"b80e6e0","metric":5.3033,"metrics":{"prefill_tps":5.59,"ext_decode_tps":5.2269,"think_tps":4.2,"boot_bench_tps":5.621,"min_case_tps":5.31,"gen_tokens":99,"internal_free":8415,"psram_free":2052252,"device_output_exact":18,"device_token_delta":52,"logit_max_delta":0.00005341,"logit_top1_match":10,"host_output_exact":19},"status":"keep","description":"Capture on the acceptance image is at six verification comparisons true and zero false, still running with no CAP_RC, so no claim yet. Pin deliberately unchanged at 5.3033.","timestamp":1790272201253,"segment":1,"confidence":18.02457142857145,"asi":{"hypothesis":"Read the capture verdict on the acceptance image.","next":"Three scenarios remain. On CAP_RC=0 with all nine flags true, record it in the acceptance packet as the repo's own integrity check green on provenance 4d3094578050, then stop the API and verify no serial_api.py child still holds the console - pkill -f needle-api does not kill that child, which has cost board access before.","state":"Six verification comparisons true, zero false, no CAP_RC - progressing normally, roughly two-thirds through the nine scenarios."}}
{"run":571,"commit":"74eafd8","metric":5.3033,"metrics":{"prefill_tps":5.59,"ext_decode_tps":5.2269,"think_tps":4.2,"boot_bench_tps":5.621,"min_case_tps":5.31,"gen_tokens":99,"internal_free":8415,"psram_free":2052252,"device_output_exact":18,"device_token_delta":52,"logit_max_delta":0.00005341,"logit_top1_match":10,"host_output_exact":19},"status":"keep","description":"Capture on the acceptance image is at seven verification comparisons true and zero false with no CAP_RC yet, so still no claim; the remaining scenarios include one that waits on a real firmware timer. Pin deliberately unchanged at 5.3033.","timestamp":1790272222315,"segment":1,"confidence":18.02457142857145,"asi":{"hypothesis":"Read the capture verdict on the acceptance image.","next":"Two scenarios remain, one of which waits on a real timer so it is slow by design. On completion: CAP_RC=0 plus all nine flags true goes into the acceptance packet as the repo's own integrity check green on provenance 4d3094578050; then stop the API and confirm no serial_api.py child holds the console.","state":"Seven verification comparisons true, zero false, no CAP_RC - still running."}}
{"run":572,"commit":"44f868b","metric":5.3033,"metrics":{"prefill_tps":5.59,"ext_decode_tps":5.2269,"think_tps":4.2,"boot_bench_tps":5.621,"min_case_tps":5.31,"gen_tokens":99,"internal_free":8415,"psram_free":2052252,"device_output_exact":18,"device_token_delta":52,"logit_max_delta":0.00005341,"logit_top1_match":10,"host_output_exact":19},"status":"keep","description":"Capture on the acceptance image is still running and still clean: no CAP_RC, seven comparison flags true, zero false, and the newest line is a completed scenario with outcome local_executed at 17.4 s, i.e. the suite has advanced into the local-execution scenarios. No verdict and therefore no acceptance claim from this read. Pin deliberately unchanged at 5.3033.","timestamp":1790272252231,"segment":1,"confidence":18.02457142857145,"asi":{"hypothesis":"Read the capture verdict; if complete, record it and tear down the API.","note":"Recording rather than concluding, per this ledger's repeated lesson (#512, #548, #549): two polls with an unchanged flag count and no exit code are not a stall verdict, and the scenario that waits on a real firmware timer legitimately takes minutes.","state":"Still running: no CAP_RC, seven comparison flags true, zero false, and the newest line is a completed scenario reporting outcome local_executed at 17,439 ms latency - so the suite advanced into the local-execution scenarios since the previous read."}}
{"run":573,"commit":"44f868b","metric":5.3033,"metrics":{"prefill_tps":5.59,"ext_decode_tps":5.2269,"think_tps":4.2,"boot_bench_tps":5.621,"min_case_tps":5.31,"gen_tokens":99,"internal_free":8415,"psram_free":2052252,"device_output_exact":18,"device_token_delta":52,"logit_max_delta":0.00005341,"logit_top1_match":10,"host_output_exact":19},"status":"keep","description":"The repo's behavioural capture is GREEN on the acceptance image: board 1 was reflashed to provenance 4d3094578050 (FLASH_RC=0), driven through its own API, and make capture finished with CAP_RC=0 and all nine verification comparisons true, zero false - routes, tools, two-pass local execution, no external calls, telemetry, sampling interval and timer expiry. That closes the last acceptance evidence owed on this stack alongside the two-board speed (5.5767/5.58), two-board byte-exactness (18/20 with the identical two demo-timer goldens), host 19/19 and fidelity 5.341e-05, and it is recorded in .auto/OWNER_ACCEPTANCE_PACKET.md and committed. Teardown was careful and is worth the note: an earlier call of mine produced no output at all because pkill -f matched my own shell - the command line contained the target string unbracketed in a later pgrep pattern - so the harness killed itself instead of the API, the classic self-match trap this ledger has recorded before (#538). Killing by pid from a bracketed pgrep fixed it: no API or serial-api child retains the console, and both tmux panes are closed. Pin deliberately unchanged at 5.3033 pending the owner's decision on the two boot-state-dependent goldens.","timestamp":1790272329191,"segment":1,"confidence":16.818448413756343,"asi":{"accident_explained":"My previous call produced no output because 'pkill -f [n]eedle-api' matched MY OWN shell: the same command line also contained the unbracketed literal in a later pgrep pattern, so pkill killed the invoking shell before the packet append or commit ran - the documented self-match trap (same family as #538), and the reason that call reported nothing at all rather than a failure.","capture":"CAP_RC=0 with all nine verification comparisons true and zero false on board 1 running provenance 4d3094578050 (FLASH_RC=0 first) - routes, tools, two-pass local execution, no external calls, telemetry, sampling interval, timer expiry. Recorded in .auto/OWNER_ACCEPTANCE_PACKET.md and committed.","hypothesis":"Read the capture verdict, record it if green, and release the console cleanly.","next":"Acceptance evidence is now complete on this tree: speed on two boards (5.5767 / 5.58), byte-exactness on two boards (18/20 with the identical two demo-timer goldens), host 19/19, fidelity unchanged, and the repo's own behavioural capture green. The only remaining step is the owner's disposition of those two goldens; after it, one session should read 20/20 and the pin moves 5.3033 -> ~5.577.","rule":"Kill board-tied helper processes by pid obtained from a bracketed pgrep, never with pkill -f in a command line that itself contains the target string - otherwise the harness kills itself and reports success by silence."}}
{"run":574,"commit":"44f868b","metric":5.3033,"metrics":{"prefill_tps":5.59,"ext_decode_tps":5.2269,"think_tps":4.2,"boot_bench_tps":5.621,"min_case_tps":5.31,"gen_tokens":99,"internal_free":8415,"psram_free":2052252,"device_output_exact":18,"device_token_delta":52,"logit_max_delta":0.00005341,"logit_top1_match":10,"host_output_exact":19},"status":"keep","description":"Launched the canonical-board acceptance reading: board 1 - the board every pinned value in this campaign was measured on - now runs the full 20-case suite on the acceptance tree, its on-disk sources recomputing to provenance 4d3094578050c8d5ea10d512c31e4ac6 with that value asserted by the runner and the anti-repeat override removed so the guard stays armed. This adds the one dimension the acceptance packet still lacks: the earlier 18/20 clean readings came from boards 2 and 3, so a canonical-board reading plus a third independent reproduction of the divergence pair - with the repo's own behavioural capture already green on this very image - is the strongest form of the owner-facing claim. No measurement claimed yet; the accepted pin stays deliberately at 5.3033 because 18/20 is not 20/20 and the two failing goldens encode the firmware's demo timer and sampling counters, which is the owner's call rather than an engineering unknown.","timestamp":1790272365023,"segment":1,"confidence":14.899858290033034,"asi":{"hypothesis":"Board 1 is the canonical board - the one every pinned value in this campaign was measured on - and #566 installed the acceptance image on it for the capture. Run the full 20-case suite there at provenance 4d3094578050, which yields both a third independent board reading and the canonical-board reading the acceptance packet currently lacks.","launch_verification":"Board 1's tree recomputed on disk hashes to 4d3094578050c8d5ea10d512c31e4ac6, exactly the acceptance provenance; written into the worker's .auto/expect_engine_md5 so the runner asserts it, and the stale repeat-override flag deleted so the anti-repeat guard stays armed.","next":"Read decode plus the compare block. Expected: decode near 5.577 and 18/20 failing exactly heldout_interval_one and heldout_long_tools_note_only per #513's pass condition; anything else is a genuine regression signal.","value":"Three independent boards agreeing on the same 18/20 divergence pair, with the capture already green on this same image, makes the owner's golden decision rest on the strongest evidence this harness can produce."}}
{"run":575,"commit":"44f868b","metric":5.5783,"metrics":{"prefill_tps":5.585,"ext_decode_tps":5.4838,"think_tps":4.2,"boot_bench_tps":5.621,"min_case_tps":5.31,"gen_tokens":99,"internal_free":8415,"psram_free":2052252,"device_output_exact":18,"device_token_delta":52,"logit_max_delta":0.00005341,"logit_top1_match":10,"host_output_exact":19},"status":"keep","description":"Canonical board 1 at prov 4d3094578050: decode 5.5783, device 18/20, token_delta 52, LANE_RC=1, prefill 5.585, extended 5.4838, min_case 5.31, boot bench 5.621, internal_free 8415. Third board agrees with b2 5.5767 and b3 5.58; divergence set identical on all three, so it is neither board-specific nor trace-related. Speed on the canonical board is +5.2 % over the 5.3033 pin. Pin unchanged per owner rule; acceptance polling stops now and the next work is three distinct performance hypotheses from the refreshed mentor queue.","timestamp":1790273045763,"segment":1,"confidence":14.840272876970108,"asi":{"finding":"Third independent board (canonical) reproduces 18/20 with the identical two goldens and token_delta 52 - not board-specific, not trace-related. Owner instruction accepted: goldens stay, no more acceptance polls or canonical rereads.","next":"Read .auto/mentor_queue.md and prepare three independent performance candidates on the current stack, preserving worker dirt and guards.","hypothesis":"Read the canonical-board (board 1) acceptance reading at provenance 4d3094578050."}}
