{"run":13,"commit":"9eaea6c","metric":2.7517,"metrics":{"boot_bench_tps":2.791,"device_output_exact":12,"device_token_delta":0,"ext_decode_tps":2.708,"gen_tokens":99,"host_output_exact":11,"internal_free":30731,"logit_max_delta":0.00007248,"logit_top1_match":10,"min_case_tps":2.63,"prefill_tps":2.9117,"psram_free":14717088,"think_tps":2.39},"status":"keep","description":"Attention online-softmax processes two KV positions per iteration. Device decode 2.6767 -> 2.7517 tok/s (+2.8%), prefill +2.6%, extended +3.0%, think +2.6%, boot bench 370 -> 358 ms/tok. 12/12 device cases and 11/11 host prompts byte-identical; logit fidelity 7.248e-05 vs a 2e-3 budget. First three-board parallel batch: board1 control reproduced the committed baseline exactly (2.6767), so the +2.8% is the candidate and not board variance.","timestamp":1789771418818,"segment":1,"confidence":5.39130434782612,"asi":{"changed":"attention online-softmax: 2 KV positions per iteration","confirmed_on":"original board 1 via run_experiment: 2.7517 tok/s, boot bench 358 ms/tok, 12/12 byte-exact, internal heap 30731","control_note":"the board1 control in the same batch was byte-identical source and reproduced 2.6767 tok/s exactly - the parallel harness is reproducible across boards","hypothesis":"ideas backlog: shorten the attention inner loop. Pair the KV positions so each online-softmax iteration handles two scores, halving the running-max branches and the per-iteration v-cache rescale work.","numbers":"board1 control 2.6767 / board3 norm-staging 2.7233 (+1.7%) / board2 paired-softmax 2.7517 (+2.8%)","numerics":"reassociation inside the QK dot: max_delta 7.248e-05 against a 2e-3 budget, top1 10/10, all 11 host + 12 device goldens byte-identical","parallel_note":"first three-board parallel batch worked after the serial_api attach fix (main 561957b). Baseline across 3 boards: decode_tps identical to 4 decimals on all three - the pool's three boards agree.","pairing_proof":"the 4 cases of {a>mx,b>mx} collapse to the same two rescales in slot order; 'a only' folds to exp(b-mx_new); 'neither' rescales by exp(m_old-m_new) once, which the loop's final 1/denom normalisation absorbs. Odd tail keeps the original path.","pool_infra_note":"main .auto/measure.sh + checks.sh hold pool-infrastructure changes (per-board lock, AUTO_LOG_DIR, SERIAL_PORT, explicit NEEDLE_PROFILE OFF). Not a speed change; do not read the fresh baseline vs historical 2.6767 as a kernel win.","profile_note":"AUTO_PROFILE=1 on main produced no PROF lines this session - the boot-log echo changes (main 561957b) may suppress the profile when the log is judged interleaved. Not investigated this cycle; the boot bench covers the same question.","serial_fix":"root cause: pyserial's DTR/RTS edge on open reset the board (rst:0x15 USB_UART_CHIP_RESET), restarting the ~2 min priming; the console then echoed handshake probes, and the firmware answered 'ERR incomplete_call' which the handshake treated as a boot error. Fixed in tools/serial_api.py (main 561957b, workers 2653dc8) + 6 new regression tests.","next_action_hint":"board3's norm-pool candidate is also real (+1.7%) and orthogonal to this one - integrate it next and re-measure. Then revisit the profile: the phase breakdown was suppressed on main after the serial_api handshake change (the WARN-boot-log path closes the log early), worth checking before more profile-driven choices."}}
{"run":14,"commit":"e23abfe","metric":2.7933,"metrics":{"boot_bench_tps":2.839,"device_output_exact":12,"device_token_delta":0,"ext_decode_tps":2.754,"gen_tokens":99,"host_output_exact":11,"internal_free":30731,"logit_max_delta":0.00007248,"logit_top1_match":10,"min_case_tps":2.67,"prefill_tps":2.9633,"psram_free":14635168,"think_tps":2.42},"status":"keep","description":"Stack the norm-pool candidate (board3, +1.7% alone) onto the paired-softmax tree. Device decode 2.6767 (same-batch control) -> 2.7933 tok/s (+4.2% total; +1.5% over the attention change alone), prefill +4.5%, extended +4.7%, think +3.9%, boot bench 370 -> 352 ms/tok. Byte-exact everywhere; logit fidelity 7.248e-05.","timestamp":1789771838222,"segment":1,"confidence":3.7010526315789387,"asi":{"changed":"paired attention softmax + norm scales staged into the open-time fp32 pool","combine_note":"the two candidates are additive on this workload: +2.8% and +1.5% stacked to +4.2% over the same-batch control. Orthogonal (attention inner loop vs elementwise norm path).","control":"2.6767 tok/s measured on board1 in the same parallel batch as both candidates","hypothesis":"stack board3's norm-pool candidate (+1.7% standalone, orthogonal to the attention change) on top of the accepted paired-softmax tree","kept":"e23abfe","next_action_hint":"two independent wins are now both in. Next batch candidates: (a) 4 KV positions per softmax iteration - is the win pairing or unrolling?; (b) stage the ZC-RMS scale rows so the q_norm/k_norm head loops avoid pointer churn too; (c) fix the suppressed AUTO_PROFILE path so the phase split is visible again - the profile-driven ideas in ideas.md (confpool, MLP dual-core split) cannot be prioritised without it.","numbers":"decode 2.7517 -> 2.7933 (+1.5%); vs same-batch control 2.6767 => +4.2%; prefill 2.9633, ext 2.7540, think 2.4200, boot bench 358 -> 352 ms/tok","quality":"byte-exact host 11/11, device 12/12; logit probe 7.248e-05 vs 2e-3 budget; prefix-isolation green; internal heap 30731 unchanged, psram -82 KB"}}
{"run":15,"commit":"13373e7","metric":2.7933,"metrics":{"boot_bench_tps":2.838,"device_output_exact":12,"device_token_delta":0,"ext_decode_tps":2.754,"gen_tokens":99,"host_output_exact":11,"internal_free":30731,"logit_max_delta":0.00007248,"logit_top1_match":10,"min_case_tps":2.67,"prefill_tps":2.9633,"psram_free":14635168,"think_tps":2.42},"status":"keep","description":"Hoist the fp16 norm conversion out of the constrained-logits gather loop (the 4-bit path the sampler uses in think mode). Board3 measured 2.7983 vs board1's 2.7933 control (+0.18%, inside board-to-board noise); main-board confirmation is 2.7933, unchanged, as expected since the gather path does not serve the primary prompts. Kept as a correctness-neutral micro-win for the think path (think_tps 2.42 unchanged at the reported resolution).","timestamp":1789773674311,"segment":1,"confidence":3.7010526315789387,"asi":{"changed":"nd_cq_gemv_gather: hoist nd_f16(nrm[gi]) out of the group loop","control":"board1 ran the committed tree in the same parallel batch and returned 2.7933 with every secondary identical to the previous run - the pool's control is stable to 4 decimals","dead_ends_same_batch":"board2 quad-block softmax 2.56 (-8.4%); board2 two-row LUT GEMV unroll 2.7733 (-0.7%). Both byte-exact, both recorded in ideas.md. The 4-position block spills the LX7 register file; the 2-row unroll competes with itself for flash bandwidth.","hypothesis":"the constrained-logits gather (4-bit path, think mode) is the one row loop the norm hoist never covered","kept":"13373e7","main_confirmation":"2.7933 tok/s - identical to control, as expected: the gather path only runs when the sampler restricts the vocabulary","measurement_note":"main-board confirmation reports 2.7933, identical to the control to 4 decimals, because the gather path is only used by the constrained sampler; board3's 2.7983 is +0.18% and inside per-board noise. Logged the honest main-board number rather than the board3 number.","next_action_hint":"the remaining big phase is the 2-bit LUT GEMV and it resists scheduling changes. Remaining untried structural levers: (1) reduce bytes streamed - the 2-bit rows are already minimal, so the lever is cache residency (the table is 6 KB per group and read 4x per row); (2) dual-core coverage of the MLP/Sinkhorn tail, which runs single-core while the worker idles; (3) fix AUTO_PROFILE output so the phase split is visible again.","quality":"byte-exact host 11/11 device 12/12; probe 7.248e-05; prefix-isolation green"}}
{"run":16,"commit":"8691ea7","metric":2.9467,"metrics":{"boot_bench_tps":2.997,"device_output_exact":12,"device_token_delta":0,"ext_decode_tps":2.902,"gen_tokens":99,"host_output_exact":11,"internal_free":30731,"logit_max_delta":0.00006866,"logit_top1_match":10,"min_case_tps":2.81,"prefill_tps":3.1383,"psram_free":14635168,"think_tps":2.53},"status":"keep","description":"Column-block the second half of kron_apply by 4 (the Monarch MLP's dominant matmul). Device decode 2.7933 -> 2.9467 tok/s (+5.5%), prefill +5.9%, extended +5.4%, think +4.5%, boot bench 352 -> 334 ms/tok. Byte-exact host 11/11 and device 12/12; logit fidelity 6.866e-05 vs a 2e-3 budget. Board3 measured 2.9483 in the parallel batch with the board1 control reproducing 2.7933 exactly.","timestamp":1789774508359,"segment":1,"confidence":5.315789473684198,"asi":{"also_tested_same_batch":"board2 cond_v softmax with 8 independent accumulators: 2.81 (+0.6% over control), byte-exact - real but small, not taken this cycle","changed":"kron_apply second half (c @ B) blocked by 4 columns; hada_c row held live across four accumulators","hypothesis":"the Monarch Kronecker apply has one loop-carried sum per output element, so every FMA waits on the previous one on the LX7. Column-blocking the second half by 4 gives four independent chains and keeps the shared hada_c row live across them.","kept":"8691ea7","next_action_hint":"kron_apply is the MLP's hot spot and column blocking just moved it 5.5%. The same blocking applies to the FIRST half (rows of src over a) and to the second half at a different block size (8 columns / 2 columns). Try both, and try blocking both halves together. This is the first real win in the MLP since the fp32 staging, and it contradicts my earlier note that 'scheduling is not the lever' - that was true for the bandwidth-bound GEMV, not for the compute-bound MLP.","numbers":"decode 2.7933 -> 2.9467 (+5.5%); prefill 3.1383 (+5.9%); extended 2.9020 (+5.4%); think 2.5300 (+4.5%); boot bench 352 -> 334 ms/tok","quality":"byte-exact host 11/11, device 12/12; logit probe 6.866e-05 (vs 7.248e-05 before, so the blocking did not add error); prefix-isolation green; heap unchanged","supersedes_note":"this overturns the ideas.md generalisation that inner-loop scheduling is never the lever: true for the flash-bandwidth-bound 2-bit GEMV, false for the compute-bound Monarch MLP."}}
{"run":17,"commit":"3b50d3c","metric":3.1267,"metrics":{"boot_bench_tps":3.183,"device_output_exact":12,"device_token_delta":0,"ext_decode_tps":3.076,"gen_tokens":99,"host_output_exact":11,"internal_free":30731,"logit_max_delta":0.00007248,"logit_top1_match":10,"min_case_tps":2.97,"prefill_tps":3.34,"psram_free":14635168,"think_tps":2.67},"status":"keep","description":"Column-block the first half of kron_apply as well (4 output rows per pass sharing one loaded src column). Device decode 2.9467 -> 3.1267 tok/s (+6.1%), prefill +6.4%, extended +6.0%, think +5.5%, boot bench 334 -> 314 ms/tok. Byte-exact host 11/11 and device 12/12; logit fidelity 7.248e-05. Same batch: board1 control 2.9483, board3's 8-wide second-half block 2.975.","timestamp":1789775287990,"segment":1,"confidence":6.182310469314079,"asi":{"changed":"kron_apply first half (src^T @ a) also blocked: 4 output rows per pass, one src column read shared across them","control":"board1 control 2.9483 (matches the previous kept measurement 2.9467 to board noise); board3's 8-wide second-half block 2.975 (+0.9% over the 4-wide block - real but smaller than blocking the first half)","dead_end_note":"wider (8-column) blocking of the second half helps only +0.9%; the first half was the bigger prize (+6%). Combine both next.","hypothesis":"block the first Kronecker half by 4 rows too: one src column is read once and multiplied against four a-entries, so the same accumulator-blocking that just won +5.5% on the second half applies here with the reuse running the other way","kept":"3b50d3c","next_action_hint":"kron_apply is now blocked on both halves. Remaining knobs on it: block the first half by 8 rows (mirroring the +0.9% seen on the second half at 8), and fold the p1 permutation that follows the first half into the emit loop (it is a separate 1024-element gather pass right now). After that the MLP should be near its bandwidth ceiling and attention (now paired) is the next biggest.","numbers":"decode 2.9467 -> 3.1267 (+6.1%); prefill +6.4%; extended +6.0%; think +5.5%; boot bench 334 -> 314 ms/tok","quality":"byte-exact host 11/11 and device 12/12; logit probe 7.248e-05; prefix isolation green; heap unchanged"}}
{"run":18,"commit":"c216219","metric":3.1433,"metrics":{"boot_bench_tps":3.199,"device_output_exact":12,"device_token_delta":0,"ext_decode_tps":3.09,"gen_tokens":99,"host_output_exact":11,"internal_free":26623,"logit_max_delta":0.00007248,"logit_top1_match":10,"min_case_tps":2.99,"prefill_tps":3.36,"psram_free":14635168,"think_tps":2.68},"status":"keep","description":"Pre-fold the 8-way cu conditioning blend into one scale row before the MLP gate loop. Device decode 3.1267 -> 3.1433 tok/s (+0.53%), prefill +0.6%, extended +0.5%, think +0.4%, boot bench 314 -> 313 ms/tok. Byte-exact host 11/11 and device 12/12; logit fidelity 7.248e-05. Cost: 4 KB internal scratch (internal_free 30731 -> 26623). Same batch: board1 control 3.1267, board3's engram RMS fusion 3.125 (no gain, dropped).","timestamp":1789777938071,"segment":1,"confidence":5.541864139020545,"asi":{"changed":"hadamard_mlp: fold cond[j]*cu[j][:] into one hada_n scale row (sequential), then one read per element in the SiLU loop","control":"board1 3.1267 (= committed tree exactly); board3 engram rms_unit fusion: 3.125, i.e. nothing (-0.05%) - and that change breaks n1's contract (n1 holds the attention input after block()), so it is dropped rather than kept","dead_end_note":"engram gate rms fusion: neutral on device. The site count is 2 of 8 layers so the three-pass cost is small, and it risks the n1 buffer contract for no gain.","hypothesis":"cu is staged float32 but row-major in the 8 conditioning channels, so the blend gathered 8 strided values per element; pre-folding the conditioned rows into one scale row keeps the same 8*n FMAs but makes the hot loop a single sequential read","kept":"c216219","next_action_hint":"remaining untried: (1) lane-mix loop-order swap (hres@lane currently re-reads n strided lane rows per column) - never actually measured, earlier attempts mis-applied; (2) 8-wide blocking of the first kron half (8-wide on the second half was +0.9%); (3) attention int8-pair dot is at its limit (pairing won, quads lost). Also worth a profile: ND_P_CONF has never been read on device.","numbers":"decode 3.1267 -> 3.1433 (+0.53%); prefill +0.6%; extended +0.5%; think +0.4%; boot bench 314 -> 313 ms/tok","quality":"byte-exact host 11/11 device 12/12; probe 7.248e-05 unchanged; heap: internal_free 30731 -> 26623 (the 4 KB hada_n scale row is internal RAM - headroom still comfortable)","win_pattern_note":"11th consecutive keep. Every win since #13 has reduced memory traffic or added ILP to a compute-bound kernel; nothing has helped the flash-bandwidth-bound GEMV."}}
{"run":19,"commit":"1ee8018","metric":3.1717,"metrics":{"boot_bench_tps":3.23,"device_output_exact":12,"device_token_delta":0,"ext_decode_tps":3.12,"gen_tokens":99,"host_output_exact":11,"internal_free":26623,"logit_max_delta":0.00007248,"logit_top1_match":10,"min_case_tps":3.01,"prefill_tps":3.3933,"psram_free":14635168,"think_tps":2.7},"status":"keep","description":"Widen the kron_apply second-half column block from 4 to 8 accumulators. Device decode 3.1433 -> 3.1717 tok/s (+0.90%), prefill +1.0%, extended +1.0%, think +0.75%, boot bench 313 -> 310 ms/tok. Byte-exact host 11/11 and device 12/12; logit fidelity 7.248e-05. Same batch: board1 control 3.1433, board2's lane-mix loop-order swap 3.1517 (+0.27%, real but smaller).","timestamp":1789778651660,"segment":1,"confidence":6.003289473684214,"asi":{"changed":"kron_apply second half: 8 accumulators per pass instead of 4","control":"board1 3.1433 (= committed tree); board2 lane-mix loop-order swap 3.1517 (+0.27%, byte-exact, host probe 5.341e-05 i.e. only an associativity change) - small and real, not taken this cycle","hypothesis":"the second Kronecker half gained +5.5% going from 1 to 4 accumulators; a wider block was measured at +0.9% on an earlier tree, so re-test 8-wide on the current one","kept":"1ee8018","next_action_hint":"kron knobs left: 8-wide (or 16-wide) blocking of the FIRST half (currently 4). If that saturates, the MLP is done and the next phase to attack is attention (paired; the int8 dot converts every KV byte to float per element - an int32 accumulator with a per-head scale applied once would halve that loop's instruction count) or the dual-core coverage of the MLP, which runs single-core while the worker idles.","numbers":"decode 3.1433 -> 3.1717 (+0.90%); prefill +0.99%; extended +0.97%; think +0.75%; boot bench 313 -> 310 ms/tok","quality":"byte-exact host 11/11 device 12/12; probe 7.248e-05; heap unchanged"}}
{"run":20,"commit":"7aa08d9","metric":3.1817,"metrics":{"boot_bench_tps":3.24,"device_output_exact":12,"device_token_delta":0,"ext_decode_tps":3.128,"gen_tokens":99,"host_output_exact":11,"internal_free":26623,"logit_max_delta":0.00005341,"logit_top1_match":10,"min_case_tps":3.02,"prefill_tps":3.4033,"psram_free":14635168,"think_tps":2.71},"status":"keep","description":"Reorder the mHC lane-mix matmul to accumulate lane rows sequentially instead of reading n strided lane rows per column. Device decode 3.1717 -> 3.1817 tok/s (+0.32%), prefill +0.3%, extended +0.26%, think +0.37%, boot bench 310 -> 309 ms/tok. Byte-exact host 11/11 and device 12/12; logit fidelity improved to 5.341e-05. Same batch: board1 control 3.1717, board2's 8-row first-half kron block 2.995 (-5.6%, reverted).","timestamp":1789779355842,"segment":1,"confidence":6.346483704974271,"asi":{"changed":"lane mix: for k in lanes { dst = hpost[k]*u; for j in lanes { dst += hres[k][j]*lane[j] } }","control":"board1 3.1717 (= committed tree)","dead_end_note":"kron first-half blocking by 8 rows is WORSE: 2.995 vs 3.1717 control (-5.6%), byte-exact. Reverted. The first half reuses src across k, not a across j, so 8 accumulators spill where 4 fit; the winning block size is 4 rows on the first half and 8 columns on the second. Recorded as the boundary of the ILP lever.","hypothesis":"mHC lane mixing re-reads n strided lane rows per d_model column; swapping to row-major accumulation makes both streams sequential (board3 measured 3.1817 in the same batch as this)","kept":"7aa08d9","measurement_note":"the board3 measurement in the previous parallel batch was this exact change (its board was reset to the same base); main-board confirmation matches it exactly at 3.1817.","next_action_hint":"kron is at its measured optimum (4 rows / 8 columns). Remaining structural levers: (1) attention int8 dot with an int accumulator (the paired loop converts every KV byte to float per element); (2) dual-core coverage of the MLP/elementwise tail — only GEMV rows and attention heads use the second core, and the MLP is now the biggest phase; (3) ND_P_CONF has never been measured on device — add a profile build once and read the phase split before picking more micro-targets.","numbers":"decode 3.1717 -> 3.1817 (+0.32%); prefill +0.3%; extended +0.26%; think +0.37%; boot bench 310 -> 309 ms/tok","quality":"device 12/12 and host 11/11 byte-identical; probe 5.341e-05 (down from 7.248e-05) - the reorder is a legal re-association, and smaller error"}}
