{"run":515,"commit":"2bbbd82","metric":5.3033,"metrics":{"boot_bench_tps":5.621,"device_output_exact":18,"device_token_delta":52,"ext_decode_tps":5.2269,"gen_tokens":99,"host_output_exact":19,"internal_free":12519,"logit_max_delta":0.00005341,"logit_top1_match":10,"min_case_tps":5.32,"prefill_tps":5.59,"psram_free":2052252,"think_tps":4.2},"status":"keep","description":"Tenth merge attempt on the snapshotted ring tree refused again by its own residue assert, but it produced the thing prior attempts lacked: an exact enumeration of every handshake call site. Starting from .auto/exp84/main.c.ring-spin-trace.e52ad7c in board 2, the RXQ trace strip and the predicate if->while both applied cleanly, yet after all whitespace-flexible substitutions two xSemaphore call sites survived, so the script asserted and wrote nothing - board 2 still holds the compiling snapshot (build rc=0, zero errors) and no half-converted handshake exists anywhere, which matters because that tree compiles fine and deadlocks only at runtime. A grep on the untouched snapshot now lists all nine sites and their line numbers (worker completion gives at 134 and 150, worker drain/blocking take at 139/141, caller drain/give/take at 167/174/180, and the two creations at 185-186); two gives live in the worker's second completion branch, the shape my patterns missed. Next window: rewrite worker_task and rows_dual_core with precise edits against the snapshot instead of whole-file regex, assert grep -c xSemaphore == 0, build locally, snapshot the result to .auto immediately (the #514 rule), then run the single 20-case session, where 18/20 with exactly heldout_interval_one and heldout_long_tools_note_only failing is the pass condition until the owner settles those goldens. No device run this iteration; accepted pin unchanged at 5.3033, composed stack still 5.580/5.5817 on two boards.","timestamp":1790269376668,"segment":1,"confidence":18.02457142857145,"asi":{"hypothesis":"Re-execute the #511 three-way merge on the snapshotted ring tree, this time with whitespace-flexible substitutions covering every handshake call site, and check it with a local build.","lane_board_state":"board 2 still holds the snapshot tree (ring + spin + trace) and builds clean, so nothing was degraded; I also copied that file to .auto/exp84/main.c.lean-ring.ATTEMPT, which is honestly just the snapshot - the merge did not land - so it should not be mistaken for progress.","next":"The remaining sites are line 134 (xSemaphoreGive(s_done) with a trailing comment), 139/141 (worker's drain and blocking take of s_go), 150 (worker's second give), 167 (caller's drain), 174 (caller's give), 180 (caller's blocking take), 185-186 (both creations) - all inside worker_task and rows_dual_core. Rewrite those two functions with the edit tool against the snapshot rather than pattern-matching the whole file, then assert grep -c xSemaphore == 0, build, snapshot the result to .auto, and run the 20-case session where 18/20 with exactly heldout_interval_one and heldout_long_tools_note_only failing is the pass condition.","refusal_again_correct":"The script asserted 'FAIL residue 2' and wrote nothing, so no half-converted handshake exists on any board - which is the failure mode that matters, because such a tree compiles (board 2's build returned rc=0 with zero errors) and deadlocks only at runtime. Ninth composition refused by its own assert.","sites_now_enumerated":"The grep on the untouched snapshot enumerates all nine call sites exactly: 134 xSemaphoreGive(s_done) with a trailing comment, 139 xSemaphoreTake(s_go, 0), 141 xSemaphoreTake(s_go, portMAX_DELAY), 150 xSemaphoreGive(s_done), 167 xSemaphoreTake(s_done, 0) caller drain, 174 xSemaphoreGive(s_go), 180 xSemaphoreTake(s_done, portMAX_DELAY), 185-186 the two xSemaphoreCreateBinary creations. Two of them sit in the worker's second completion branch, which is the shape my regex missed."}}
{"run":516,"commit":"df61703","metric":5.3033,"metrics":{"boot_bench_tps":5.621,"device_output_exact":18,"device_token_delta":52,"ext_decode_tps":5.2269,"gen_tokens":99,"host_output_exact":19,"internal_free":12519,"logit_max_delta":0.00005341,"logit_top1_match":10,"min_case_tps":5.32,"prefill_tps":5.59,"psram_free":2052252,"think_tps":4.2},"status":"keep","description":"The acceptance tree finally exists: lean notifications + sequence predicate + late lossless RX ring, trace removed, compiling clean. After ten refusals on textual variance, the merge was redone by verified line number - assert each of the nine enumerated handshake sites contains the expected call, substitute or delete by original index with deletions processed descending - which landed on the first attempt with zero xSemaphore residue, 2 ulTaskNotifyTake sites, 3 xTaskNotifyGive sites, the caller's while-predicate, SemaphoreHandle_t removed, the worker handle captured at creation and the guard testing !s_worker. Local build rc=0 with zero errors, and per the #514 rule the tree was snapshotted immediately to .auto/exp84/main.c.lean-ring. Provenance dfa32cefae65, full 20-case session now running on board 2. This is the tree that carries the whole measured stack (+5.2 %: asmemo, radix-4 fusion, nf16v, spin handshake, free predicate fix, lean notifications at 5.580/5.5817 on two boards) plus the console fix that lets all 20 cases run in one boot. Nothing is claimed from the running session: expected decode ~5.58 with the trace gone, and per #513 the pass condition is device_output_exact 18/20 with exactly heldout_interval_one and heldout_long_tools_note_only failing until the owner settles those two goldens - any other failing case is a genuine regression. Accepted pin unchanged at 5.3033.","timestamp":1790269556178,"segment":1,"confidence":18.02457142857145,"asi":{"hypothesis":"Stop pattern-matching a 620-line file and rewrite the handshake by verified line number: confirm each of the nine enumerated sites contains the expected call, then substitute or delete by original index (deletions processed descending so indices stay valid), with a zero-residue assert before any write.","method_finding":"Ten prior attempts failed on textual variance; targeting the enumerated sites with per-site content assertions succeeded on the first run and produced a zero-residue tree that compiles with zero errors. The reusable lesson is to verify each anchor's content at its known location rather than searching for a pattern that may or may not match - the assert becomes a proof about this file, not a hope about a pattern.","next":"Read M-leanring-b2.log in the next window for decode_tps plus device_output_exact. Expected decode ~5.58 without the trace, and 18/20 with exactly heldout_interval_one and heldout_long_tools_note_only failing is the pass condition per #513 until the owner re-captures or annotates those goldens; any other case failing is a real regression signal.","result":"MERGE LANDED: lean notifications + sequence predicate + late lossless RX ring, RXQ trace removed. xSemaphore residue is zero, ulTaskNotifyTake sites 2, xTaskNotifyGive sites 3, the caller's wait is the while-predicate form, SemaphoreHandle_t is gone, the worker handle is captured at creation, and the guard tests !s_worker. Local build rc=0 with zero errors. Tree snapshotted immediately to .auto/exp84/main.c.lean-ring per the #514 rule, provenance dfa32cefae65.","state":"Full 20-case session launched on board 2 (runner-asserted provenance dfa32cefae651e66aae79ee83d682c09, build_s=1 from the clean local build). No measurement read yet, so no acceptance claim and the pin stays 5.3033."}}
{"run":517,"commit":"df61703","metric":5.3033,"metrics":{"boot_bench_tps":5.621,"device_output_exact":18,"device_token_delta":52,"ext_decode_tps":5.2269,"gen_tokens":99,"host_output_exact":19,"internal_free":8415,"logit_max_delta":0.00005341,"logit_top1_match":10,"min_case_tps":5.32,"prefill_tps":5.59,"psram_free":2052252,"think_tps":4.2},"status":"keep","description":"Acceptance session on the merged lean+ring tree is mid-suite; only its heap figure is readable, so no claim is made. Board 2 (provenance dfa32cefae65) has printed internal_free=8,415 - the lossless RX ring's ~4.1 KB cost, consistent with the 8,247 measured earlier with the trace active and 4,104 B below the lean-only tree's 12,519 - but no decode_tps, no device_output_exact and no LANE_RC yet, which means it is inside the suite and its verdict does not exist. Recorded rather than waited on: the two prior cross-board readings of this configuration family are decode 5.55 and 5.5517 with the trace, and the expectation for this trace-free run is ~5.58 with device_output_exact 18/20 failing exactly heldout_interval_one and heldout_long_tools_note_only until the owner re-captures or annotates those goldens. Flagged for the owner: 8,415 B is the smallest internal headroom in this campaign's history - fine for the frozen workload, but it definitively closes any future internal-RAM residency idea, and if the console ring is shipped that cost should be known up front. Accepted pin unchanged at 5.3033; the composed stack's speed evidence remains 5.580/5.5817 on two boards.","timestamp":1790269605354,"segment":1,"confidence":18.02457142857145,"asi":{"hypothesis":"Read the first output of the acceptance session (lean notifications + predicate + late lossless RX ring, trace removed, provenance dfa32cefae65) on board 2.","next":"Read the full metric block next window: decode_tps (expect ~5.58 without the trace, against 5.5517 with it), boot_bench, min_case, and the compare block. Pass condition per #513 is 18/20 with exactly heldout_interval_one and heldout_long_tools_note_only failing until the owner settles those goldens; anything else failing is a real regression.","reading":"The acceptance session had printed internal_free=8,415 - the ring's ~4.1 KB cost as measured before, close to the 8,247 board-2 figure and 4,104 B below the lean tree's 12,519 - but no decode_tps, no device_output_exact and no LANE_RC line at read time, so it is mid-suite and no speed or byte-exactness claim is made.","risk_noted":"internal_free 8,415 is the smallest headroom in the campaign's history. It is adequate for the frozen workload, but any future internal-RAM resident idea (phi row residency, per-core tables) is now definitively closed by this configuration, and if the ring is shipped the owner should know the number rather than discover it later."}}
{"run":518,"commit":"df61703","metric":5.3033,"metrics":{"boot_bench_tps":5.621,"device_output_exact":18,"device_token_delta":52,"ext_decode_tps":5.2269,"gen_tokens":99,"host_output_exact":19,"internal_free":8415,"logit_max_delta":0.00005341,"logit_top1_match":10,"min_case_tps":5.32,"prefill_tps":5.59,"psram_free":2052252,"think_tps":4.2},"status":"keep","description":"The merged acceptance tree reads decode_tps 5.575, making the lossless console RX ring effectively free on the metric. Board 2, provenance dfa32cefae65 (lean notifications + sequence predicate + late RX ring, RXQ diagnostic removed) versus the same stack without the ring at 5.580 (board 1) and 5.5817 (board 3): -0.09 %, one quantisation tick. That is much cheaper than the -0.15 % and -0.18 % measured while the per-request RXQ line was still printing (#510, #499), so most of the ring's apparent cost was my diagnostic emit, not the ISR or the ring - a reminder that an instrument in the timed path is itself a candidate and must be removed before the verdict. Consequence: the fix that lets all 20 cases run in one boot costs one metric tick plus 4.1 KB of internal heap, so speed is no longer a reason to withhold it; the remaining blockers are the heap figure and the owner's decision on the two demo-timer-dependent goldens. No device_output_exact or LANE_RC line existed at read time, so no byte-exactness verdict and no acceptance claim: pass condition stays 18/20 with exactly heldout_interval_one and heldout_long_tools_note_only failing until those goldens are settled. Accepted pin unchanged at 5.3033.","timestamp":1790269644140,"segment":1,"confidence":18.02457142857145,"asi":{"hypothesis":"What does the merged acceptance tree cost on speed - lean notifications + predicate + late lossless RX ring, RXQ trace removed (provenance dfa32cefae65, board 2)?","next":"Read the compare block when it prints: 18/20 with exactly heldout_interval_one and heldout_long_tools_note_only failing is the pass condition per #513; any other failing case is a real regression. If it clears, this tree is the re-pin candidate at ~5.575-5.58 (+5.1 %), with internal_free 8,415 disclosed as its cost.","result":"decode_tps 5.575 against the same stack without the ring - 5.580 on board 1 and 5.5817 on board 3 - so the console RX ring costs 0.09 %, one quantisation tick, once its diagnostic print is gone. That is far cheaper than the -0.15 % and -0.18 % measured with the trace active (#510, #499), which means most of the ring's apparent cost was the per-request trace line, not the ISR or the ring.","significance":"The console fix that makes all 20 cases runnable in one boot is effectively free on the metric, so the only remaining reasons not to ship it are the 4.1 KB of internal heap and the owner's judgement on the two state-dependent goldens - not speed."}}
{"run":519,"commit":"df61703","metric":5.3033,"metrics":{"boot_bench_tps":5.621,"device_output_exact":18,"device_token_delta":52,"ext_decode_tps":5.2269,"gen_tokens":99,"host_output_exact":19,"internal_free":8415,"logit_max_delta":0.00005341,"logit_top1_match":10,"min_case_tps":5.31,"prefill_tps":5.59,"psram_free":2052252,"think_tps":4.2},"status":"keep","description":"Cross-board acceptance run launched while board 2's verdict is still pending. Board 3 now runs the byte-identical merged tree - lean notifications + sequence predicate + late lossless RX ring with the diagnostic removed - and the runner asserts the same provenance dfa32cefae65 as board 2, which is only meaningful because the #514 rule had already snapshotted board 3's previous tree (ring + spin + trace) into .auto/exp84, so overwriting main.c and CMakeLists.txt there destroyed nothing. Board 2's session had printed min_case_tps 5.31 and internal_free 8,415 but no device_output_exact, no DEVICE_OUTPUT_DIVERGED and no LANE_RC line at read time, i.e. still inside the suite, so no byte-exactness verdict exists and no acceptance is claimed. What the pair will settle: decode agreement around 5.575 across boards, and whether both boards fail exactly heldout_interval_one and heldout_long_tools_note_only - the pass condition recorded at #513 while the owner decides on those two demo-timer-dependent goldens. Accepted pin unchanged at 5.3033; speed evidence for the stack remains 5.575 (with ring) and 5.580/5.5817 (without).","timestamp":1790269728768,"segment":1,"confidence":18.02457142857145,"asi":{"hypothesis":"Cross-board the merged acceptance tree: board 3 now runs the byte-identical tree board 2 measured at decode 5.575 (provenance dfa32cefae65 asserted by the runner on both), because a single-board acceptance reading is not enough to re-pin.","next":"Next window reads both logs for device_output_exact. Two readings matter: agreement on decode (expect ~5.575), and the divergence set - 18/20 with exactly heldout_interval_one and heldout_long_tools_note_only failing is the pass condition per #513, and agreement on WHICH cases fail is what makes the owner's golden decision actionable rather than speculative.","plan_note":"Board 3's previous tree (ring + spin + trace) was already snapshotted to .auto/exp84 at #514, so overwriting its main.c and CMakeLists.txt loses nothing - the #514 rule paid for itself immediately.","state":"Board 2's acceptance session had printed min_case_tps 5.31 and internal_free 8,415 but no device_output_exact, no DEVICE_OUTPUT_DIVERGED and no LANE_RC at read time - still inside the suite - so no byte-exactness verdict exists and no acceptance is claimed; the pin remains 5.3033."}}
{"run":520,"commit":"df61703","metric":5.3033,"metrics":{"boot_bench_tps":5.621,"device_output_exact":18,"device_token_delta":52,"ext_decode_tps":5.2269,"gen_tokens":99,"host_output_exact":19,"internal_free":8415,"logit_max_delta":0.00005341,"logit_top1_match":10,"min_case_tps":5.31,"prefill_tps":5.59,"psram_free":2052252,"think_tps":4.2},"status":"keep","description":"Both acceptance sessions are alive and, for the first time in this era, past the point where every previous session died - but neither has produced a verdict yet, so nothing is claimed. Board 2's log (12,110 bytes and growing) ends on an EVT priming progress line, i.e. it has finished a group, re-primed, and is working toward the think group; two bench.py processes are running, which is board 2 and board 3 both executing the byte-identical merged tree (lean notifications + sequence predicate + late lossless RX ring, diagnostic removed, provenance dfa32cefae65 asserted by the runner on both). The progress itself is a measurement: before the ring, no session ever got past 16-17 requests or reached a second group's re-priming, so the ceiling fix is now observed in the acceptance configuration on both boards. What is still missing is the compare block - device_output_exact, the divergence set, and LANE_RC - so there is no byte-exactness verdict, no acceptance, and no re-pin: the pin remains 5.3033 while the stack's speed evidence stands at 5.575 with the ring and 5.580/5.5817 without. Pass condition unchanged per #513: 18/20 with exactly heldout_interval_one and heldout_long_tools_note_only failing until the owner settles those demo-timer-dependent goldens. No extra device run was added this iteration, since re-measuring an already-measured configuration would be the forbidden unchanged-verification loop.","timestamp":1790269777457,"segment":1,"confidence":18.02457142857145,"asi":{"hypothesis":"Are the two acceptance sessions (board 2 and board 3, byte-identical merged tree, provenance dfa32cefae65) progressing, and has either produced the 20-case byte-exactness verdict?","observation":"Both bench.py processes are alive and board 2's log tail is an EVT priming progress line - it is between groups, past the primary and extended sets and heading into the think group. Every pre-ring session died at 16-17 requests and never reached a second group's re-priming, so the console RX ring is now observed clearing the ceiling a third and fourth time, on both boards, in the acceptance configuration.","reading":"No verdict yet on either board: no device_output_exact, no DEVICE_OUTPUT_DIVERGED and no LANE_RC line in board 2's log (12,110 bytes, growing), and board 3's session is behind it. So no byte-exactness claim and no acceptance; the pin stays 5.3033.","why_no_control_run":"No extra device run this iteration: the acceptance configuration is already measured on two boards and both sessions are live, so the only legitimate next datum is theirs. Re-measuring the accepted image would be the unchanged-verification loop the rules forbid, and the anti-repeat guard would (correctly) refuse it."}}
