{"run":582,"commit":"e44fd08","metric":5.5767,"metrics":{"boot_bench_tps":5.658,"device_output_exact":6,"device_token_delta":0,"ext_decode_tps":5.4838,"gen_tokens":99,"host_output_exact":19,"internal_free":8415,"logit_max_delta":0.00005341,"logit_top1_match":10,"min_case_tps":5.35,"prefill_tps":5.925,"psram_free":2052252,"think_tps":4.37},"status":"discard","description":"Both live screens came back null and were reverted with hashes verified. Board 3's lutb_rows pointer plus four-codebook hoist (provenance 4d52a6427f82, objdump-confirmed 4 mul.s + 16 madd.s and the hardware loop restored) read decode 5.5767 against that board's own 5.58 at the clean acceptance provenance, i.e. -0.060 %; with #579's quartet barriers at -0.090 % that closes live-range editing in lutb_rows from both directions - the compiler's placement there is already optimal for this metric. Board 1's fw_scale in-place RMW read 5.6117 against that board's identical seed reading 5.6117, exactly zero, which is the expected outcome because #396/#404 show the shipping ngroup 6/24 path uses nd_fwht4s with the rescale folded: fw_scale is cold, so this screen measured nothing and cold-path screens are excluded from here on. Reverts are hash-proven: board 3 back to 4d3094578050, board 1 back to its 61861dd9886c seed base, and the note that board 1 sits on an older HEAD so its base has to be restored by cross-board copy, not by git checkout. Only the fused prepare+LUT lane remains live on board 2. Pin unchanged at 5.3033; the two-board seed winner still awaits owner admission.","timestamp":1790274455457,"segment":1,"confidence":12.349045578496323,"asi":{"b3_hoist":"Board 3 clean acceptance base 4d3094578050 plus the hoist, provenance 4d52a6427f82, decode 5.5767 vs the same board's 5.58 at 4d3094578050 = -0.060 % (within the one-to-two-quantum band and negative in sign), boot bench and byte-exactness normal, LANE_RC=0.","close":"lutb_rows live-range work is closed after two independent attempts: quartet barriers (-0.090 %) and pointer/codebook hoisting (-0.060 %), both byte-exact, both arithmetic-graph verified. The compiler's own placement in that loop is already a local optimum for this metric, so do not re-screen either direction.","fw_scale":"Board 1 seed base plus the in-place RMW, provenance 328118911d23, decode 5.6117 against that board's own seed reading 5.6117 = exactly 0.000 %. That is the predicted null from #396/#404: the shipping ngroup 6/24 path uses nd_fwht4s with the rescale folded, so fw_scale is not called per token and no live-range edit there can move the metric. Cold-path screens are excluded from now on.","hypothesis":"Read the two in-flight screens: board 3's lutb_rows pointer/codebook hoist and board 1's fw_scale in-place read-modify-write.","next":"The only live candidate is the fused prepare+LUT on board 2 (provenance 25ab607692d2, control 5.6117), which is the one remaining scheduling change that alters what is co-scheduled rather than how a small loop is scheduled.","restores_verified_by_hash":"board 3 engine/src/nd_quant.c reverted to its committed copy and the whole tree hashes back to exactly 4d3094578050; board 1 restored to nd_quant.c from the clean board plus the snapshotted seed .S and hashes to exactly 61861dd9886c, its own seed-base control - note board 1 sits on an older HEAD, so restoring it from its own git checkout does NOT reproduce the base and the cross-board copy is what made the hash match."}}
{"run":583,"commit":"e44fd08","metric":5.6117,"metrics":{"boot_bench_tps":5.658,"device_output_exact":6,"device_token_delta":0,"ext_decode_tps":5.4838,"gen_tokens":99,"host_output_exact":19,"internal_free":8415,"logit_max_delta":0.00005341,"logit_top1_match":10,"min_case_tps":5.35,"prefill_tps":5.925,"psram_free":2052252,"think_tps":4.37},"status":"keep","description":"Before believing anything from the fused prepare+LUT lane, I checked the artifact: board 2's needle_demo.elf exports nd_cq_prep_lut and no longer contains nd_cq_lut_build at all, which proves the three replaced call sites really route through the fused helper and the old builder was garbage-collected. That is the positive control run #333 said to always take, because an unreferenced new kernel or helper makes a lane re-measure the base and read as a null rather than as a broken experiment. The lane itself cleared measure.sh's host golden pre-check - significant because the fusion reorders the transform and table build under the host's serial split, so a dependency error would have failed there instead of on the board - and it is now inside the device suite with no decode or verdict line yet, so no speed claim is made. Control remains that board's 5.6117 seed reading. Pin still 5.3033 with the two-board seed winner awaiting owner admission.","timestamp":1790274526680,"segment":1,"confidence":12.113106610622879,"asi":{"finding":"Positive control on the fused candidate's ARTIFACT, not its source: the flashed tree's needle_demo.elf contains nd_cq_prep_lut (1 symbol) and contains nd_cq_lut_build zero times, i.e. the fused helper really replaced the old two-join path and the obsolete builder was garbage-collected. Without this check a lane that silently left the new code unreferenced would have measured the base and looked like a null result - the exact failure #333 recorded - so the eventual number is about the fusion or is not interpretable, never ambiguous.","hypothesis":"Verify from the built ELF that the fused prepare+LUT helper is actually referenced in the image before taking any reading from the lane, then report lane status.","next":"Wait for METRIC decode_tps and the 6/6 device gate; control is this board's 5.6117 seed reading at 61861dd9886c and the fusion is the single delta (provenance 25ab607692d2).","state":"Fused lane on board 2 has passed measure.sh's host golden pre-check and is inside the device suite (log 7,372 bytes, no METRIC or LANE_RC yet). The host check matters here because the fused callback changes the order in which the transform and table build run on the serial host split, so a transcription error would have stopped the lane before any flash."}}
{"run":584,"commit":"e44fd08","metric":5.6117,"metrics":{"boot_bench_tps":5.658,"device_output_exact":6,"device_token_delta":0,"ext_decode_tps":5.4838,"gen_tokens":99,"host_output_exact":19,"internal_free":8415,"logit_max_delta":0.00005341,"logit_top1_match":10,"min_case_tps":5.35,"prefill_tps":5.925,"psram_free":2052252,"think_tps":4.37},"status":"discard","description":"Fused prepare+LUT is measured and exactly null, so it is reverted. One group-split callback that transformed [g0,g1) with the unchanged radix-4 fwht_rows and then built that group range's pair-table entries removed one nd_parallel_rows join per paired CQ2 site - 18 joins per decode token across QKV/gate, out_proj and the engram slot - and board 2 read decode 5.6117 against its own 5.6117 seed-base reading, device 6/6 byte-exact with token_delta 0 and LANE_RC=0. Combined with #558 and #564, where split granularity and spin budgets were also neutral, this says the handshake cost is genuinely gone after the spin plus lean-notification work: joins are free now, so the campaign's remaining 'pay the toll fewer times' ideas have no value, and any scheduling headroom must come from which loops are co-scheduled rather than how many synchronisation points a stage carries. The candidate was ELF-verified as live before measurement (#583), so the null is about the mechanism, and board 2 is hash-verified back to its 61861dd9886c seed base with the fused symbol gone. Pin unchanged at 5.3033; the two-board seed winner (+0.599 %/+0.627 %, byte-exact) still awaits owner admission.","timestamp":1790274578175,"segment":1,"confidence":11.886014248219006,"asi":{"candidate_provenance":"board 2 seed base 61861dd9886c plus the fusion = 25ab607692d2, ELF-verified to reference nd_cq_prep_lut and to have dropped nd_cq_lut_build entirely (#583), so the null is a real measurement of the fusion and not a stale-image artefact.","control":"Board 2's own seed reading 5.6117 at 61861dd9886c - same board, one variable.","hypothesis":"Every paired CQ2 site pays two nd_parallel_rows joins although a group's transform and its pair-table entries are independent; fusing them into one group-split callback should remove 18 joins per decode token.","next":"Do not re-attempt join reduction. The remaining scheduling question is which loops are co-scheduled - e.g. giving the worker the whole transform+build+GEMV of disjoint row ranges, or overlapping the engram gather with a projection - not how many synchronisation points a stage has.","reading":"decode 5.6117 versus 5.6117 on the same board = exactly 0.000 %, device_output_exact 6/6, token_delta 0, LANE_RC=0.","rollback_reason":"Zero effect on the primary metric, so nothing to keep. Reverted by copying the clean engine sources from board 3 back onto board 2 and verified the tree hash returned to exactly its 61861dd9886c seed base, with the fused symbol gone from the model source; the confirmed seed winner is untouched."}}
{"run":585,"commit":"e44fd08","metric":5.6117,"metrics":{"boot_bench_tps":5.658,"device_output_exact":6,"device_token_delta":0,"ext_decode_tps":5.4838,"gen_tokens":99,"host_output_exact":19,"internal_free":8415,"logit_max_delta":0.00005341,"logit_top1_match":10,"min_case_tps":5.35,"prefill_tps":5.925,"psram_free":2052252,"think_tps":4.37},"status":"keep","description":"The seed mechanism's obvious cousin is closed off-device with no board spent. gemv4_tie728.S does initialize s0..s3 with four wfr instructions inside .Lgroup, so it has the same shape as the tie1n winner, but the 4-bit path only runs 24 rows x ngroup 24 = 576 groups per decode token against tie1n's 130,560, so removing four instructions per group there is 2,304 instructions = 9.6 us = +0.005 %, two orders of magnitude under the 0.2 % keep bar, and the specialization would also need to peel the first index word out of a hardware loop, duplicating the accumulate body for no payable gain. Retired on arithmetic rather than measurement, which is the cheapest kind of negative result and keeps all three boards free for work that can actually clear the bar. The re-ranked next candidate is per-row rather than per-group overhead in nd_lut2_rows_tie1n: it runs 21,760 rows per token and its row prologue recomputes cursor offsets with multiplies, so a handful of removable per-row instructions is the only instruction-count mass comparable to the seed win. Pin unchanged at 5.3033 with the two-board seed winner awaiting owner admission.","timestamp":1790274632362,"segment":1,"confidence":11.156079535456628,"asi":{"arithmetic":"phi is 3 tensors x 8 rows... the 4-bit path touches 24 rows per token with ngroup 24, i.e. 576 groups per decode token; four wfr removals per group is 2,304 instructions = 9.6 us of a ~178 us... of a 178 ms token = +0.005 %, two orders of magnitude below the 0.2 % bar. Peeling the first index word out of the hardware loop would also duplicate the accumulate body for a rounding-neutral but real code-growth risk.","hypothesis":"Does the 4-bit row kernel's per-group accumulator initialization (four wfr inside .Lgroup in gemv4_tie728.S) carry enough mass to justify the same first-iteration seeding trick that won +0.599 % in tie1n?","next":"The remaining instruction-count mass is per-ROW, not per-group: tie1n's row prologue recomputes cursor offsets with multiplies over 21,760 rows per token, so a few removable per-row instructions there would be worth roughly 0.1 % per ten instructions. That requires reading the row prologue and the cursor advance, not a guess, and is the next candidate I would build.","off_device_closure":"No. It is dead on arithmetic and was retired without a board: the 4-bit kernel's per-token group count is ~200x smaller than the CQ2 kernel's, so the same mechanism cannot pay."}}
{"run":586,"commit":"e44fd08","metric":5.6117,"metrics":{"boot_bench_tps":5.658,"device_output_exact":6,"device_token_delta":0,"ext_decode_tps":5.4838,"gen_tokens":99,"host_output_exact":19,"internal_free":8415,"logit_max_delta":0.00005341,"logit_top1_match":10,"min_case_tps":5.35,"prefill_tps":5.925,"psram_free":2052252,"think_tps":4.37},"status":"keep","description":"The per-row instruction-mass candidate is closed off-device with no board spent, and the arithmetic says why. nd_lut2_rows_tie1n's row loop re-reads two frame slots at .Ltn_row: a2 is the group counter, which the inner loop decrements to zero (addi.n a2,a2,-1) and therefore must be reseeded per row, and a4 is the pair-table cursor, which genuinely resets every row. The norm, packed and y cursors already advance by constant addi values (32 B, 2 B, 4 B) and the multiplies I suspected are in the once-per-call prologue that positions cursors at the row base, not per row. So the only removable per-row instruction is the group-counter reseed, needing a spare register to hold ngroup across the call, and 21,760 rows per token times one instruction is 21,760 cycles = 0.09 ms of a ~178 ms token = +0.05 %, under the keep bar before register-pressure risk. Combined with #585 (the 4-bit per-group seeding worth +0.005 %) this exhausts instruction-count levers after the seed winner: the seed paid because it removed four instructions across 130,560 groups per token, six times the row count, and nothing left has that product of count times cost. Remaining above-bar items are owner decisions (phi row residency against internal heap, vendor-blocked 120 MHz); engineer-side value now is admission evidence for the confirmed seed stack. Pin unchanged at 5.3033.","timestamp":1790274698899,"segment":1,"confidence":10.808046368905545,"asi":{"candidate_and_arithmetic":"tie1n's row loop reloads two frame slots per row: l32i a2,a1,20 is the group counter (the inner loop does addi.n a2,a2,-1 to zero, so it must be reseeded per row) and l32i a4,a1,16 resets the pair-table cursor, which genuinely changes every row. The norm and packed cursors already advance by constant addi (32 B/row, 2 B/norm) and y by addi 4, so there is no multiply per row - the mull I suspected is in the once-per-call prologue that positions the cursors at r0. Removable: the group-counter reload, i.e. one instruction per row, only if a register can hold ngroup for the whole call.","hypothesis":"nd_lut2_rows_tie1n runs 21,760 rows per token, so per-row prologue overhead might be the last instruction-count mass comparable to the seed win.","measured_mass":"1 x 21,760 = 21,760 cycles = 0.09 ms of a ~178 ms token = +0.05 %, below the 0.2 % keep bar before any register-pressure risk is even priced.","off_device_closure":"Yes: the per-row family is closed on arithmetic. Removable per-row work is one instruction (the group-counter reseed) worth +0.05 %, and the cursor resets that look redundant are actually per-row state. No board spent.","next":"Instruction-count levers are exhausted after the seed win - per-group mass is spent and per-row mass is 0.05 %. What remains above the bar is owner-gated: phi 4-bit row residency against the internal-heap decision, and the vendor-blocked 120 MHz. Productive engineer-side work now is admission evidence for the confirmed seed stack (bounded target-row differential on real archive bytes plus one full quality session), not more scheduling screens.","note":"Also worth recording: the seed win's 4-instructions-per-group was 130,560 groups/token, i.e. 6x the row count, which is why it paid and why per-row work cannot follow it in size."}}
{"run":587,"commit":"e44fd08","metric":5.6117,"metrics":{"boot_bench_tps":5.658,"device_output_exact":6,"device_token_delta":0,"ext_decode_tps":5.4838,"gen_tokens":99,"host_output_exact":19,"internal_free":8415,"logit_max_delta":0.00005341,"logit_top1_match":10,"min_case_tps":5.35,"prefill_tps":5.925,"psram_free":2052252,"think_tps":4.37},"status":"keep","description":"Started the seed stack's missing quality breadth: a full 20-case session on board 1 at provenance 61861dd9886c (clean acceptance base plus the first-W8D seed .S), with the runner's expectation recomputed from the built tree and the repeat override deleted. The point is not another speed number - it is that all the seed-stack rows logged so far inherited extended_decode_tps, think_tps and top1 from the acceptance tree because primary-only screens never run those groups, which is the same carried-value error this ledger has punished before. This session measures the extended, prefill, think and worst-case monitors for the image that is actually being proposed, and re-tests byte-exactness across all 20 cases; the expected outcome is 18/20 failing exactly the two demo-timer goldens that reproduced identically on all three boards of the acceptance tree, and any different divergence set would be a genuine regression from the seeded kernel and would stop admission. Pin unchanged at 5.3033.","timestamp":1790274737786,"segment":1,"confidence":10.83945973670711,"asi":{"honest_gap_this_fixes":"Every seed-stack log line so far carried the acceptance tree's extended_decode_tps, think_tps and top1 values, because AUTO_GROUPS=primary does not run those groups. That is exactly the carried-value error this ledger has repeatedly punished (#577's prefill), so the seed stack's own extended/think/prefill/monitor numbers are now being measured instead of inherited.","hypothesis":"Give the confirmed seed stack the quality breadth it currently lacks: a full 20-case session on board 1 at provenance 61861dd9886c, which measures the extended, prefill, think and worst-case monitors that primary-only screens never run.","next":"If a third case diverges, or extended/think move beyond one quantum in the wrong direction, that is a real finding and outranks any further screening.","expected":"18/20 byte-exact with the divergence set exactly {heldout_interval_one, heldout_long_tools_note_only} - those two goldens encode the firmware's demo timer and sampling counters and failed identically on all three boards of the acceptance tree, three reproductions with an identical token delta. Any other divergence set would be a real regression introduced by the seeded kernel and must stop admission.","state":"Launched, expectation asserted from the built tree, anti-repeat override removed so the guard stays armed."}}
{"run":588,"commit":"e44fd08","metric":5.6117,"metrics":{"boot_bench_tps":5.658,"device_output_exact":6,"device_token_delta":0,"ext_decode_tps":5.4838,"gen_tokens":99,"host_output_exact":19,"internal_free":8415,"logit_max_delta":0.00005341,"logit_top1_match":10,"min_case_tps":5.35,"prefill_tps":5.925,"psram_free":2052252,"think_tps":4.37},"status":"keep","description":"The anti-repeat guard did its job first: the full-session attempt on the seed stack was refused with UNCHANGED_SHIPPING_IMAGE_REFUSED for signature bd8db15f88ee and LANE_RC=4, because that image's signature is already in the history from its two primary-group confirmations and the guard keys on the image rather than on which prompt groups were executed. I did not bypass it silently. I relaunched with AUTO_ALLOW_REPEAT=1 and an explicit AUTO_REPEAT_REASON naming the genuinely new information - the seed stack has never run the extended, think, prefill or worst-case groups, so its logged monitor values were inherited from the acceptance tree rather than measured - and the new lane asserted provenance again. This is a quality-breadth session on the image actually being proposed, not a control repeat and not a speed measurement: the decisive outputs are the 20-case compare block (expected 18/20, failing exactly the two demo-timer goldens that reproduced identically on three boards) and the seed stack's own extended/think/min_case readings. Pin unchanged at 5.3033.","timestamp":1790274796128,"segment":1,"confidence":10.871056241426617,"asi":{"guard_result_first":"The anti-repeat guard refused the session with UNCHANGED_SHIPPING_IMAGE_REFUSED (signature bd8db15f88ee...) and LANE_RC=4: the seed stack's signature is already in the history from its two primary-group confirmations, and the guard keys on the image, not on which groups were run. That is the guard behaving correctly, and it stopped me from quietly re-measuring an image.","hypothesis":"Get the seed stack's full-group quality and monitor breadth, which its primary-only confirmation lanes never measured.","next":"Read METRIC ext_decode_tps, think_tps, prefill_tps, min_case_tps and the 20-case compare block for the image being proposed. A divergence outside the two known demo-timer goldens stops admission.","override_justification":"AUTO_ALLOW_REPEAT=1 with AUTO_REPEAT_REASON naming the actual new information: the same image has never run the extended, think or worst-case groups, so this is not a control repeat, it is the missing quality breadth on the proposed image. The reason is written into the lane, not hidden, and the guard's refusal is recorded above it.","state":"Relaunched with AUTO_ALLOW_REPEAT=1 and AUTO_REPEAT_REASON stating the real reason; provenance asserted again in the new log."}}
