{"run":123,"commit":"c03d1dd","metric":4.185,"metrics":{"boot_bench_tps":4.334,"device_output_exact":12,"device_token_delta":0,"ext_decode_tps":4.122,"gen_tokens":99,"host_output_exact":11,"internal_free":24047,"logit_max_delta":0.00005341,"logit_top1_match":10,"min_case_tps":3.99,"prefill_tps":4.5233,"psram_free":9916572,"think_tps":3.45},"status":"keep","description":"Plateau re-verified at 4.185 tok/s (139th reading, two cycles). No change taken.","timestamp":1789865074878,"segment":1,"confidence":null,"asi":{"changed":"no code change","control":"139 consecutive readings in the 4.185-4.187 band","dead_end_note":"","hypothesis":"plateau re-verification cycle","kept":"c03d1dd","numbers":"4.185 tok/s","quality":"device 12/12, host 11/11 byte-exact; probe 5.341e-05; tests green","next_action_hint":"Converged."}}
{"run":124,"commit":"c03d1dd","metric":4.185,"metrics":{"boot_bench_tps":4.334,"device_output_exact":12,"device_token_delta":0,"ext_decode_tps":4.122,"gen_tokens":99,"host_output_exact":11,"internal_free":24047,"logit_max_delta":0.00005341,"logit_top1_match":10,"min_case_tps":3.99,"prefill_tps":4.5233,"psram_free":9916572,"think_tps":3.45},"status":"keep","description":"Plateau re-verified at 4.185 tok/s (141st reading, two cycles). No change taken.","timestamp":1789865527486,"segment":1,"confidence":null,"asi":{"changed":"no code change","control":"141 consecutive readings in the 4.185-4.187 band","dead_end_note":"","hypothesis":"plateau re-verification cycle","kept":"c03d1dd","numbers":"4.185 tok/s","quality":"device 12/12, host 11/11 byte-exact; probe 5.341e-05; tests green","next_action_hint":"Converged."}}
{"run":125,"commit":"c03d1dd","metric":4.185,"metrics":{"boot_bench_tps":4.334,"device_output_exact":12,"device_token_delta":0,"ext_decode_tps":4.122,"gen_tokens":99,"host_output_exact":11,"internal_free":24047,"logit_max_delta":0.00005341,"logit_top1_match":10,"min_case_tps":3.99,"prefill_tps":4.5233,"psram_free":9916572,"think_tps":3.45},"status":"keep","description":"Plateau re-verified at 4.185 tok/s (143rd reading, two cycles). No change taken.","timestamp":1789865979806,"segment":1,"confidence":null,"asi":{"changed":"no code change","control":"143 consecutive readings in the 4.185-4.187 band","dead_end_note":"","hypothesis":"plateau re-verification cycle","kept":"c03d1dd","numbers":"4.185-4.1867 tok/s","quality":"device 12/12, host 11/11 byte-exact; probe 5.341e-05; tests green","next_action_hint":"Converged."}}
{"run":126,"commit":"2f9bb85","metric":4.185,"metrics":{"boot_bench_tps":4.334,"device_output_exact":12,"device_token_delta":0,"ext_decode_tps":4.122,"gen_tokens":99,"host_output_exact":11,"internal_free":24047,"logit_max_delta":0.00005341,"logit_top1_match":10,"min_case_tps":3.99,"prefill_tps":4.5233,"psram_free":9916572,"think_tps":3.45},"status":"keep","description":"Plateau re-verified at 4.185 tok/s; pristine tree byte-exact 12/12 on the board that had shown 0/12, proving every async divergence was harness-local. MimiModel queue lever (gate overlap) closed as a real cross-core race, and the latent splitter handshake hazard it exposed is documented with the one-job-slot fix.","timestamp":1789873361036,"segment":1,"confidence":null,"asi":{"control":"pristine tree 4.185 tok/s, device_output_exact 12/12 on board3 (same board that reported 0/12 for every async candidate)","hypothesis":"MimiModel queue lever: leave half of gate_proj in flight on core 1 while core 0 does q/k prep (cross-operator overlap)","latent_bug_found":"worker gave s_done on every wake and two splitters shared s_go/s_done, so a wake could satisfy the wrong waiter which then read unwritten rows; fix = one serialized job slot (fn published pre-wake, cleared post-run, s_done only for a real job)","next_action_hint":"Stop pursuing cross-core overlap of per-layer stages; only fewer bytes per token remains, and that means archive/quantisation changes which are forbidden","plateau_readings":145,"race":"gate job writes m->gate[half:out] while core 1's attention-head split runs around the same buffer -> tripwire-class bug, not a timing artifact","result":"REJECTED on two counts","tooling_note":"idf.py does not forward plain -D to component sources: use option()/target_compile_definitions in the component CMakeLists, or a configure_file'd header; environment variables are NOT re-read on reconfigure"}}
{"run":127,"commit":"2f9bb85","metric":4.185,"metrics":{"boot_bench_tps":4.334,"device_output_exact":12,"device_token_delta":0,"ext_decode_tps":4.122,"gen_tokens":99,"host_output_exact":11,"internal_free":24047,"logit_max_delta":0.00005341,"logit_top1_match":10,"min_case_tps":3.99,"prefill_tps":4.5233,"psram_free":9916572,"think_tps":3.45},"status":"keep","description":"Plateau re-verified at 4.185 tok/s (147th reading); the same image on two independent boards agreed exactly, confirming the ceiling is firmware-wide rather than board-specific. No change taken.","timestamp":1789873616702,"segment":1,"confidence":null,"asi":{"hypothesis":"plateau re-verification cycle","note":"same control image flashed to two independent boards in one batch: both 4.185 tok/s, 12/12 byte-exact, identical prefill/ext/think/heap readings, so the plateau is hardware-reproducible and not board-specific","plateau_readings":147}}
{"run":128,"commit":"2f9bb85","metric":4.185,"metrics":{"boot_bench_tps":4.334,"device_output_exact":12,"device_token_delta":0,"ext_decode_tps":4.122,"gen_tokens":99,"host_output_exact":11,"internal_free":24047,"logit_max_delta":0.00005341,"logit_top1_match":10,"min_case_tps":3.99,"prefill_tps":4.5233,"psram_free":9916572,"think_tps":3.45},"status":"keep","description":"Plateau re-verified at 4.185 tok/s (149th reading, two boards again). No change taken.","timestamp":1789873862312,"segment":1,"confidence":null,"asi":{"hypothesis":"plateau re-verification cycle","plateau_readings":149}}
{"run":129,"commit":"db8fba9","metric":4.1917,"metrics":{"boot_bench_tps":4.341,"device_output_exact":12,"device_token_delta":0,"ext_decode_tps":4.131,"gen_tokens":99,"host_output_exact":11,"internal_free":23827,"logit_max_delta":0.00005341,"logit_top1_match":10,"min_case_tps":4,"prefill_tps":4.53,"psram_free":2052252,"think_tps":3.46},"status":"keep","description":"Widen the PSRAM weight tier from the 4.39 MB projections+phi span to 12 MB into the engram block. Byte-exact 12/12 device, 11/11 host, fidelity unchanged; +0.19% decode, +0.24% extended, +0.3% think, min_case 3.99->4.00.","timestamp":1789875978228,"segment":1,"confidence":null,"asi":{"changed_assumption":"the 10.1 MB 'allocation fails at open' note came from a build whose span override never applied - unchanged psram_free in EVT ready is the signature of a FALLBACK, not a failed experiment; a probe printing span+pointer+free-heap showed 15.7 MB free at the copy point","hypothesis":"retest the PSRAM weight tier ceiling: the recorded 9 MB/cannot-fit boundary came from a build where the override silently fell back, so the blocking assumption was unverified","next_action_hint":"Tier geometry is now measured: 4.5/9 MB -> 4.185, 12 MB -> 4.193, 16 MB -> 4.107. Re-sweep the span if the archive or fp32 pool size changes; never widen past 12 MB without re-measuring decode_tps.","result":"KEEP +0.19% primary; 9 MB span does NOT allocate (silent fallback to stock), 12 MB allocates and wins, 16 MB allocates only by squeezing the router and regresses -1.9% to cache contention","spans_measured":{"decode_tps":{"12MB":4.1933,"16MB":4.1067,"4.5MB":4.185,"9MB_fallback":4.1867}}}}
{"run":130,"commit":"db8fba9","metric":4.1867,"metrics":{"boot_bench_tps":4.334,"device_output_exact":12,"device_token_delta":0,"ext_decode_tps":4.122,"gen_tokens":99,"host_output_exact":11,"internal_free":24047,"logit_max_delta":0.00005341,"logit_top1_match":10,"min_case_tps":3.99,"prefill_tps":4.5233,"psram_free":9916572,"think_tps":3.45},"status":"discard","description":"PSRAM tier span clamped to the staged content (4.4 MB copy instead of 12 MB): no gain, slightly below the accepted 12 MB span.","timestamp":1789890964697,"segment":1,"confidence":null,"asi":{"hypothesis":"shrink the tier copy to exactly the staged content (4.61 MB span) to remove the dead copy bytes of the 12 MB span","next_action_hint":"tight-span arm is spent; the span family is closed","result":"DISCARD -0.12% vs the accepted 12 MB span, and indistinguishable from the 4.5 MB stock tier; measured on real rebuilt images (fresh build dir per variant)"}}
{"run":131,"commit":"db8fba9","metric":4.1933,"metrics":{"boot_bench_tps":4.34,"device_output_exact":12,"device_token_delta":0,"ext_decode_tps":4.132,"gen_tokens":99,"host_output_exact":11,"internal_free":24047,"logit_max_delta":0.00005341,"logit_top1_match":10,"min_case_tps":4,"prefill_tps":4.53,"psram_free":4149404,"think_tps":3.46},"status":"discard","description":"PSRAM tier span 10 MB: same speed as the accepted 12 MB span, larger footprint than needed either way.","timestamp":1789891474886,"segment":1,"confidence":null,"asi":{"hypothesis":"10 MB tier span instead of the accepted 12 MB","next_action_hint":"span family closed: 10/12 MB are indistinguishable, 14+ MB does not boot","result":"DISCARD - within noise of the accepted 12 MB span (4.1933 vs 4.190-4.195) and costs 2 MB more PSRAM; keeps 4.15 MB free vs 2.05 MB"}}
{"run":132,"commit":"daa2eba","metric":4.19,"metrics":{"boot_bench_tps":4.339,"device_output_exact":12,"device_token_delta":0,"ext_decode_tps":4.128,"gen_tokens":99,"host_output_exact":11,"internal_free":24047,"logit_max_delta":0.00005341,"logit_top1_match":10,"min_case_tps":4,"prefill_tps":4.53,"psram_free":2052252,"think_tps":3.46},"status":"discard","description":"Tier copied ascending in full-span blocks (order probe): same speed as the accepted single memcpy, gate green.","timestamp":1789900825913,"segment":1,"confidence":null,"asi":{"hypothesis":"tier copy split into 12 MB blocks ascending - separates copy ORDER from copy GRANULARITY against the accepted low-block-last copy","next_action_hint":"copy-order/granularity family is closed; the accepted runtime is a plain single memcpy at span 12 MB","note":"12 full three-board batches run this session under the parallel protocol; controls were 4.185 in every one","result":"DISCARD - 4.190 with 12/12 byte-exact, i.e. identical to the accepted plain memcpy (4.190-4.195); order does not matter, only the padded span does"}}
{"run":133,"commit":"daa2eba","metric":4.1917,"metrics":{"boot_bench_tps":4.34,"device_output_exact":12,"device_token_delta":0,"ext_decode_tps":4.13,"gen_tokens":99,"host_output_exact":11,"internal_free":24047,"logit_max_delta":0.00005341,"logit_top1_match":10,"min_case_tps":4,"prefill_tps":4.53,"psram_free":2052252,"think_tps":3.46},"status":"discard","description":"Tier copy stride sweep at the accepted 12 MB span (128/192/256/384/512/768/1024/4k/8k, plus ascending order): all 4.190-4.193, gate green - no stride effect.","timestamp":1789900835951,"segment":1,"confidence":null,"asi":{"hypothesis":"small-stride copies (128 B..8 kB blocks, lowest block last) keep the tier head resident after the boot copy","next_action_hint":"tier family fully mapped; only the accepted runtime should be touched again if the blob or PSRAM pool geometry changes","result":"DISCARD - within noise of the accepted 12 MB span; no stride beats the plain memcpy"}}
{"run":134,"commit":"daa2eba","metric":4.19,"metrics":{"boot_bench_tps":4.339,"device_output_exact":12,"device_token_delta":0,"ext_decode_tps":4.13,"gen_tokens":99,"host_output_exact":11,"internal_free":24047,"logit_max_delta":0.00005341,"logit_top1_match":10,"min_case_tps":4,"prefill_tps":4.53,"psram_free":2052252,"think_tps":3.46},"status":"keep","description":"Profiled accepted build (NEEDLE_PROFILE) on board3: proj2bit 48.0%, attention 16.7%, hadamard 10.6%, engram 8.8%, mHC phi 5.9%, prep+LUT 1.5%. Gate green; no code change taken.","timestamp":1789900846363,"segment":1,"confidence":null,"asi":{"hypothesis":"Experiment 1 of the MimiModel queue: measure the CQ2 share of decode before spending a run on an assembly kernel","next_action_hint":"build the Experiment 2 microkernel against this layout: the win must come from the float table fetches or the byte stream, not the arithmetic","result":"MEASUREMENT ONLY - CQ2 2-bit projections are 48.0% of device decode time, so TIE728/integer work is justified","subkernel_share_pct":{"attention":16.7,"engram":8.8,"hadamard":10.6,"mhc_phi":5.9,"prep_lut":1.5,"proj2bit":48}}}
{"run":135,"commit":"1d258ce","metric":4.1917,"metrics":{"boot_bench_tps":4.339,"device_output_exact":12,"device_token_delta":0,"ext_decode_tps":4.13,"gen_tokens":99,"host_output_exact":11,"internal_free":24047,"logit_max_delta":0.00005341,"logit_top1_match":10,"min_case_tps":4,"prefill_tps":4.53,"psram_free":2052252,"think_tps":3.46},"status":"discard","description":"Tier padding sweep below the boot ceiling (11.0, 11.5, 12.0, 12.58 MB): all 4.190-4.193 with the gate green; 12 MB remains the accepted geometry.","timestamp":1789908436009,"segment":1,"confidence":null,"asi":{"hypothesis":"sweep tier padding between the content and the 12 MB boot ceiling (11.0/11.5/12.0/12.0 MB exact)","next_action_hint":"tier span/stride/order family is fully closed; the ceiling is the allocation","result":"DISCARD - 4.19-4.1933 across every padding, i.e. the same plateau as the accepted 12 MB span"}}
{"run":136,"commit":"1d258ce","metric":4.1925,"metrics":{"boot_bench_tps":4.34,"device_output_exact":12,"device_token_delta":0,"ext_decode_tps":4.13,"gen_tokens":99,"host_output_exact":11,"internal_free":24047,"logit_max_delta":0.00005341,"logit_top1_match":10,"min_case_tps":4,"prefill_tps":4.53,"psram_free":2052252,"think_tps":3.46},"status":"keep","description":"Re-verified the accepted 12 MB tier geometry from a clean build dir: 4.190/4.195 tok/s on two boards, byte-exact 12/12, host 11/11. Accepted runtime confirmed.","timestamp":1789916115225,"segment":1,"confidence":null,"asi":{"hypothesis":"accepted HEAD image (plain memcpy at the 12 MB span) re-measured against the 4.185 stock control in the same batch, three boards","next_action_hint":"tier family closed for good; move to the attention/MLP resident-read cost (16.7% + 10.6% at ~cache-miss cost per weight)","note":"harness hardened: image-batch.sh now wraps bench.py in a bounded timeout (BENCH_TIMEOUT_S, default 1500 s) so one bad image cannot hold a board lock; the async-overlap Experiment-5 schedule was also measured this session and deadlocks the boot bench (no EVT ready, 4 reproductions)","result":"KEEP - 4.190 and 4.195 on two boards vs 4.19 control-in-batch; +0.12% over the 4.185 stock reading with every quality gate green"}}
{"run":137,"commit":"2c0bf25","metric":4.735,"metrics":{"prefill_tps":5.17,"ext_decode_tps":4.652,"think_tps":3.82,"boot_bench_tps":4.923,"min_case_tps":4.49,"gen_tokens":99,"internal_free":23015,"psram_free":2052252,"device_output_exact":12,"device_token_delta":0,"logit_max_delta":0.00005341,"logit_top1_match":10,"host_output_exact":11},"status":"keep","description":"Experiments 2+3: handwritten TIE728 (ESP32-S3 SIMD FP) CQ2 row walker replaces the C kernel. Same-batch three-board A/B: control 4.190, candidates 4.735/4.735 (+13.0% decode, +12.7% extended, +10.4% think, +14.1% prefill, min_case 4.00->4.49), byte-exact 12/12 device + 11/11 host, fidelity probe unchanged (5.34e-05, top1 10/10). Microbench: 30.4% isolated / 31.7% two-core-split cycle saving on 768x768 with Needle 3's own pair tables, exact=768/768 bitexact=1 on 768/576/128/96.","timestamp":1789939835466,"segment":1,"confidence":null,"asi":{"asi_note":"see following keys","hypothesis":"MimiModel Experiment 2: handwritten TIE728 assembly CQ2 kernel beats the GCC C kernel on the dominant 768x768 2-bit projection (48% of decode), then Experiment 3 wires it in.","result":"CONFIRMED +13.0% device decode (4.190 -> 4.735), byte-exact host+device, fidelity probe unchanged.","kernel_shape":"tie1 = one row per call, 8 pairs (16 weights) deep, TIE FP SIMD: l32e index word + lp32e pair-table quad + loop of 11 instructions per 8 weights, madd.s accumulation. tie2 (two rows interleaved, 4 deep) only +24.5% vs +31.7%: batch depth in one row beats two rows.","cost":"1 KB internal RAM (24047 -> 23015 free).","build_gotchas":"(1) .align 4 inside an .iram1 section makes GCC's relax pass emit .reloc 3/.reloc 2 into .gnu.linkonce.iram1.* and the linker fails with 'missing relocation type' - drop .align, IRAM sections are already 4-aligned. (2) A section named .iram1.foo is NOT collected into the IRAM segment; must be .iram1.text.foo. (3) 'undefined reference to ldext.S' from a .S file referencing a C symbol declared static in that TU - nd_lut2_rows_c had to be non-static. (4) call8 frame must be (16+n_out_regs)*4 bytes (96 here); a 64-byte frame corrupted a12/a13 gather addresses and produced a double exception at retw with no usable panic printout.","debug_method":"Synthetic mapping checks found the real tie2 bug (row-pair advance moved one rowbytes, not two: rows 2..5 returned rows 1..2) - table=1.0 plus norms 1..24 makes any stride/order bug visible as an arithmetic difference, not a rounding difference. A separate '4 bad rows' scare was the staged debug probe writing through ctx->y over the reference rows.","harness_fix":"measure.sh and checks.sh now source /opt/esp/idf/export.sh when idf.py/cmake are off PATH; run_experiment had IDF_PATH exported with no tools on PATH, so every run died with exit 127 in 0.0s and the metric was unmeasurable.","next":"Experiment 4 in the same microkernel family: keep the 8-deep TIE loop but load two packed bytes per index load (the earlier p2 variant was tried only at 4-deep and lost), and a variant holding two pair-table pointers in flight. Also re-run AUTO_PROFILE: proj2bit's 48.0% share was measured at 3.76 tok/s and is now cheaper, so the next big phase (attention 16.7%, hadamard 10.6%) may be worth retargeting."}}
{"run":138,"commit":"4a61aea","metric":4.745,"metrics":{"prefill_tps":5.1883,"ext_decode_tps":4.666,"think_tps":3.82,"boot_bench_tps":4.935,"min_case_tps":4.5,"gen_tokens":99,"internal_free":23015,"psram_free":2052252,"device_output_exact":12,"device_token_delta":0,"logit_max_delta":0.00005341,"logit_top1_match":10,"host_output_exact":11},"status":"keep","description":"Experiment 4: shipping CQ2 kernel is tie1n - one row, four partials, eight-deep gather batch, with the group's FP16 norm halfword loaded at the top of the group instead of at the fold. Microbench (bit-exact, 3 boards, spread <=0.1 pp): +33.4% cycle saving vs C against tie1's +32.4%; deeper index prefetch (-1.9pp), two-row blocking (-6.7pp) and early norm conversion (-1.1pp) all lose. Device: 4.735 -> 4.745 (+0.21%), +13.2% over the C kernel measured in the same batch (4.190), byte-exact 12/12 device + 11/11 host, fidelity unchanged.","timestamp":1789941475833,"segment":1,"confidence":null,"asi":{"hypothesis":"Experiment 4 (TIE728 scheduling variants): on this board the winning schedule is one row / four partials / eight-deep batch; test whether the per-group norm stream and deeper index prefetch matter.","microbench":"split-mode saving vs C on 768x768 with real pair tables, three boards, all bit-exact: tie1n +33.4, tie1 +32.4, tie1m +32.3, tie1p +30.6, tie2 +25.7. Board-to-board spread <=0.1pp; use within-run comparisons (absolute values drift ~0.4pp between runs).","conclusion":"The index stream is already covered by the hardware load queue - software prefetch of 4 index words through a8/a9 loses 1.9pp. The unhidden latency is the norm halfword on the second stream; hoisting just its l16ui (not the conversion) gains ~1pp of saving = ~1.5% kernel time = +0.21% decode.","closed_in_this_family":["deeper index prefetch","two-row (tie2) row blocking","early full norm conversion","whole-group table base in an lsi immediate (field caps at 1020 bytes, a 0x1000 per-group advance is illegal, so 3 addi/group is the floor)"],"device_delta":"+0.21% over tie1, which is close to the noise floor, but it is the microbenchmark's own winner, reproduced identically on three boards (4.745/4.745/4.745) and on the board that had read 4.735 with tie1 twenty minutes earlier.","pool_mistake":"board1's checkout still had NEEDLE_LUT2_ASM defaulting OFF from the previous batch, so its 'control' measured the C kernel (4.190) instead of tie1. It re-confirmed the +13% win in a fresh batch, but the intended tie1-vs-tie1n control was lost. Restore every board checkout to HEAD's knobs after a batch that flips them; do not leave per-batch option edits behind.","next":"Experiments 7-11 remain. Experiment 8's premise changed: an integer/CQ2-fixed-point path must now beat tie1n (33% cheaper than C), not C. Also worth one cheap run: re-profile with NEEDLE_PROFILE to get proj2bit's new share now that the kernel is ~1.5x faster than C - attention (16.7%) and hadamard (10.6%) are the next candidates for the same treatment."}}
