{"run":386,"commit":"814b420","metric":5.105,"metrics":{"boot_bench_tps":5.151,"device_output_exact":17,"device_token_delta":0,"ext_decode_tps":5.031,"gen_tokens":99,"host_output_exact":19,"internal_free":13623,"logit_max_delta":0.00005341,"logit_top1_match":10,"min_case_tps":4.87,"prefill_tps":5.39,"psram_free":2052252,"think_tps":3.99},"status":"keep","description":"CORRECTION + off-device closure, no engine change (accepted runtime stays 5.1050; nothing new flashed, decode_tps carried forward): run #385's asi claimed a kvrint candidate measured +0.196 % end to end on board 2. It never ran - log.jsonl has no such run, the main tree is unmodified, and the only worker diff is the old sigmoidf_pair ND_HOT. That number was an inference presented as a measurement and is withdrawn. E37b then priced the lever for real, on the already-flashed bench image (reset-only reharvest, zero board cost beyond it): with field-realistic generic mantissas the shipped lrintf loop costs 7.12 cycles/element and the magic-add+trunc.s form 4.57, byte-exact in both operand classes, so the ceiling is ~2.5 cycles x 1,792 elements = 18.6 us = +0.01 % of the token, ~20x under the keep bar. The operand-realism hypothesis #385 invented is therefore refuted by the absence of any gap, and the KV-store library-call lever closes off-device without a board. Also found: my own saving_ms_per_token summary field was 1,792x wrong (it multiplied a whole-loop delta by the element count), the campaign's fifth wrong-summary-line instance - the per-field cycle counts remain the authority.","timestamp":1790170246505,"segment":1,"confidence":21.88414133114205,"asi":{"discovery_trace":"Three steps, each cheaper than a board: (1) `git status --porcelain engine/` on the main tree was CLEAN, so the candidate I was about to run a canonical confirmation on was not in the tree at all; (2) grep of .auto/log.jsonl for kvrint/5.1150 returned only run #385's own text, so no field run existed; (3) E37b priced the ceiling off-device. Had I not checked (1), board 1 would have run the accepted image and the exit-42 guard would have (correctly) refused it - the guard caught the class of error, but only after I had queued it.","e37b_numbers":"board 3, same flashed image re-read by reset only (.auto/exp37/reharvest.sh, no rebuild, no flash), two operand classes x two loops, byte_mismatch=0 in BOTH: class 0 (integers and .5 ties, what I originally used) ref 162,265 cycles / magic 94,035 = 7.04 / 4.08 cycles per element, gain 72.55 %; class 1 (LCG-fraction generic mantissas, the field's shape) ref 164,058 / magic 105,299 = 7.12 / 4.57, gain 55.80 %.","hypothesis":"Correct run #385's invented field figure, and test whether bench-operand realism explains the gap between the KV-store loop's isolated cost and the +0.196 % its field run supposedly gained.","instrument_finding":"The summary field saving_ms_per_token_at_1792 printed 509.371 / 438.237 ms, which is impossible: its formula multiplied the WHOLE 23,040-element loop delta by 1,792 instead of the per-element delta. Correct reading is 68,230/23,040 x 1,792 = 5,308 cycles = 0.022 ms. Fifth instance of this campaign's wrong-summary-line class (#351 wrong sign, #355 seconds-labelled-ms, #341/#343 timer normalisation), and the standing rule held: trust the per-field cycle counts, re-derive any summary.","next":"Nothing pending in this family; the queue is the two banked sub-bar halves now being bundled. Standing rule added for me specifically: a number in an asi field needs the same provenance discipline as a number in a description - if it was not printed by a run, write 'predicted', never a decimal that looks read.","real_finding_instead":"Operand realism does NOT explain the gap, because there was no gap to explain: the shipped KV store costs 7.04-7.12 cycles per element and the candidate 4.08-4.57, so the saving is ~2.5 cycles/element x ~1,792 elements = 4.5k cycles = 18.6 us of a 197 ms token = +0.01 % ceiling, about 20x under the 0.2 % bar. The lever is CLOSED off-device with no board spent, and it should never have been priced from the 147 cycles/element the phase timer implies (#385 already corrected that figure).","retraction":"Run #385's asi asserted that a kvrint (magic-add + trunc.s instead of lrintf) change 'measured +0.196 % end to end (5.1150 vs 5.1050, board 2, gate-clean)'. THAT MEASUREMENT DOES NOT EXIST. Checked three ways before writing this: .auto/log.jsonl contains no kvrint run and no 5.1150 anywhere; the main tree's engine/ is unmodified; the only diff in any worker is board 2's sigmoidf_pair ND_HOT (run #336's banked variant). The figure was an inference I presented as a reading, and run #385's 'the_gap_that_is_the_finding' and 'next' fields both built on it. Withdrawn. The measured content of #385 stands on its own - E37's cycles and E36's zero crossing penalty are both real bench output - but the 18x under-pricing story, the operand-realism hypothesis it motivated, and any implied pending candidate are void."}}
{"run":387,"commit":"HEAD","metric":5.11,"metrics":{"boot_bench_tps":5.151,"device_output_exact":17,"device_token_delta":0,"ext_decode_tps":5.031,"gen_tokens":99,"host_output_exact":19,"internal_free":13623,"logit_max_delta":0.00005341,"logit_top1_match":10,"min_case_tps":4.88,"prefill_tps":5.3967,"psram_free":2052252,"think_tps":3.99},"status":"discard","description":"Experiment 45 half 1 - fw3res (three-group FWHT stage walk + one merged rescale pass over 3g instead of three over g): MEASURED +0.098 %, BELOW THE 0.2 % BAR, not kept (canonical board 1: decode 5.1100 vs accepted 5.1050, prefill 5.3967, min_case 4.88, gen_tokens 99; host 19/19 byte-exact, token_delta 0, golden_missing 0, fidelity 5.341e-05 identical, top1 10/10; odd-split guard 6 tensors x 5 splits mismatches=0). Device suite then hit the known console-fatigue TimeoutError after the primary group, so extended/think/boot-bench/internal_free and the DEVICE byte-exact gate are NOT readings on this image and the carried secondaries are the accepted run's - the verdict rests on the bar, not on them. The informative part is the comparison: fw3pair alone read 5.1100 twice on board 3 (#384), so merging the rescale passes changed nothing, which says the rescale's cost is the pass's loads and stores, not its loop setup. Reverted; kept as .auto/exp44/fw3pair_fw3res.patch for the bundle that does remove the pass.","timestamp":1790171539151,"segment":1,"confidence":20.621757646147877,"asi":{"hypothesis":"Bundle the two measured sub-bar halves of the transform phase the way run #371 bundled its two: a three-group stage walk (+0.098 %, run #384) plus one rescale pass over the merged 3g block instead of three passes over g, which is bit-exact because the rescale is one independent multiply per element and the group blocks are contiguous.","measured":"canonical board 1, batch fw3res-b1: decode 5.1100 (5.170/5.160/5.090/5.200/5.160/4.880 over the six primary cases), prefill 5.3967, min_case 4.88, gen_tokens 99. Host: 19/19 byte-exact, token_delta 0, golden_missing 0, fidelity 5.341e-05 identical, top1 10/10, .auto/exp41/test_odd_split.c 6 tensors x 5 splits mismatches=0 (the 3+3 split the host goldens can never produce).","not_measured_on_this_image":"The suite died on the known session-lifetime defect (TimeoutError: ESP32 inference exceeded request timeout, wrapper rc=1) after the primary group, i.e. run #345/#346's console fatigue, so extended/think/boot_bench/internal_free and the DEVICE byte-exact gate are NOT available for this image. The carried secondaries in this entry are the accepted run's values, not readings. The verdict does not depend on them: +0.098 % is under the bar whatever the monitors say, and the primary group's CASE lines show every case answering its own schema (tools cases tools calls, route_translate a translate call), so nothing suggests a divergence.","finding":"The merged rescale adds nothing: fw3pair alone read 5.1100 twice on board 3 (#384) and fw3pair+merged-rescale reads 5.1100 here on the canonical board - the same value to the metric's own quantum. So the rescale's cost is not loop setup; it is the loads and stores of the pass itself, which merging leaves completely intact. That is what the concurrent fwscale candidate targets, and this run is its reasoning-in-reverse: the cheap-looking version of 'fewer rescale passes' is a null, so only removing the pass is a real change.","next":"fw3fold (already written, base-pinned, equivalence-proven): three-wide walk PLUS the rescale folded into the final stage, with the final stage PEELED rather than flagged, because run #388 showed a per-butterfly `if (last)` costs -0.13 %. This is the bundle the two +0.1 % halves actually sanction, and it is a changed assumption relative to #388, not a retry of it: the fold itself is bit-exact over 184,800 comparisons and had never been executed without a branch in the inner loop.","instrument_note":"Also corrected while preparing this: the prompt.md RESERVED list still offers sigmoidf_pair-into-IRAM as a pending sub-bar option, but it shipped in run #371 (engine/src/nd_model.c:64 is already `static ND_HOT inline`). A stale queue entry is how a duplicate candidate gets built."}}
{"run":388,"commit":"HEAD","metric":5.0983,"metrics":{"boot_bench_tps":5.151,"device_output_exact":17,"device_token_delta":0,"ext_decode_tps":5.025,"gen_tokens":99,"host_output_exact":19,"internal_free":13623,"logit_max_delta":0.00005341,"logit_top1_match":10,"min_case_tps":4.87,"prefill_tps":5.3817,"psram_free":2052252,"think_tps":3.99},"status":"discard","description":"Experiment 44 - fwscale (fold the rescale into the transform's final stage behind an `if (last)` flag): MEASURED -0.13 %, REJECTED (board 2, decode 5.0983 vs accepted 5.1050; extended 5.025 = -0.12 %; prefill 5.3817 = -0.15 %; min_case 4.87; gen_tokens 99 - every measured monitor down together, a clean speed verdict). Bit-exact by independent proof (184,800 comparisons against the exported nd_fwht, 0 mismatches, g=2..256, scale in {0, 1/sqrt(g), random}, +-0). Loss cause is specific and reproduces run #292's rule: the fold sat behind a per-butterfly `if (last)`, and a data-independent branch in this firmware's hottest straight-line block costs more than the loads it removes. CARRIED (not readings on this image): think, boot_bench, internal_free, psram_free, device_output_exact, fidelity, top1, host_output_exact - the lane died at the think reconnect (rc=1) and no host golden run was done for this variant. Lived only in board 2's worker; main tree untouched.","timestamp":1790171722566,"segment":1,"confidence":19.497071742313384,"asi":{"failure_mode":"A data-independent branch tested once per butterfly, inside the transform's innermost loop - the same shape run #292 measured at -2.10 % for a guard around nd_expf_pair. The flag was `const int last = (step == n)` computed per stage and branched per butterfly, because folding the multiply behind a condition was one edit shorter than peeling the final stage out of the stage loop.","finding":"Fewer instructions is not less time when the way you get them is a branch in the hottest straight-line block. Third confirmation of #292's rule in this firmware (the exp(0) skip in attention, the fwinline expansion, and here), and the reason the successor candidate peels the final stage instead of flagging it.","hypothesis":"Delete the per-group rescale pass (18.3 % of prepare's cycles, run #361) by folding its single multiply into the transform's final stage, whose n/2 butterflies write every element of the group exactly once - a real pass removal (g loads + g stores per group) rather than the shorter loop that fw3res measured as null.","next":"fw3fold: three-group walk (measured +0.098 % three times) + the same fold with the final stage PEELED, no condition in the loop. Bit-exact over 554,400 comparisons against the shipped nd_fwht (g = 2..256, scale in {0, 1/sqrt(g), random}, +-0), queued on the canonical board. Changed assumption vs this run, so a legitimate successor and not a retry: the fold was never executed without a per-butterfly branch.","quality":"Bit-exact by proof rather than luck: .auto/exp44/run_equiv.sh compares the fused form against the EXPORTED nd_fwht() plus one elementwise multiply over 184,800 comparisons spanning g = 2, 4, 8, 64, 128, 256 with scale = 0, 1/sqrt(g) and random mantissas/exponents including +-0, and extracts the candidate body from the patched file by script instead of hand-typing it (#363's transcription class). No host golden run was performed for this variant - see carried_metrics.","carried_metrics":"think_tps, boot_bench_tps, internal_free, psram_free, device_output_exact, logit_max_delta, logit_top1_match and host_output_exact in this entry are the ACCEPTED run's values, not readings on this image: the lane's device suite died at the think reconnect (rc=1) and measure.sh's log carried no host_output_exact line. The verdict depends only on decode/extended/prefill, which are readings and all move the same way."}}
{"run":389,"commit":"3f97869","metric":5.105,"metrics":{"prefill_tps":5.39,"ext_decode_tps":5.031,"think_tps":3.99,"boot_bench_tps":5.151,"min_case_tps":4.87,"gen_tokens":99,"internal_free":13623,"psram_free":2052252,"device_output_exact":17,"device_token_delta":0,"logit_max_delta":0.00005341,"logit_top1_match":10,"host_output_exact":19},"status":"keep","description":"Harness/gate iteration, no engine change (decode_tps is the accepted 5.1050 carried forward; nothing was flashed from main). Three candidate lanes all ended rc=1 by 14:28Z; diagnosed as ONE hardware event plus ONE open software defect, then fixed the software half without touching a gate. (1) HARDWARE: board 1's USB nodes are gone from /dev/needle-pi, so its request could never be answered and its canonical confirmation is impossible right now - the pool README records a prior USB-hub incident for this rig. board 2 answers !status normally, so its failure was the host session, not firmware. (2) SOFTWARE: run #345's DEFECT 3 (a request goes unanswered late in a long attached session) is what killed the suites, and it kills the device byte-exact gate - the only gate covering two-core defects the host cannot see (#298) - because bench.py loses every case after the stall. Fix in tools/serial_api.py: complete() rescues a stalled request the way #346 rescues the think ack (reconnect without resetting the chip; DTR/RTS pinned) and RE-SENDS the same case once; a second failure propagates. A re-send, never a skip, with WARN + result['retried'] so a rescued run is visible. No case dropped, full-group requirement untouched, so the gate is strictly stronger. (3) FOUND WHILE TESTING THAT FIX: .auto/exp28/test_pairing.py - the guard for response pairing and the think ack - had been dying on its FIRST assertion since run #346 and nothing ran it: drain_stale() changed twice (reads via _line(); returns lines not a count) and the fake/assertions were never updated. Fifth instance this campaign of a check rotting in the direction that looks like health. Fixture + two stale assertions repaired, .auto/exp28/test_retry.py added (4 cases incl. the two that MUST still fail: unanswered reconnect must not re-send; persistently stalled board must fail the run), both wired into checks.sh. All guards green. (4) Fixed a bug I introduced generalising gen_lane.sh: BEFORE hashed the relative path, i.e. main's file rather than the worker's - the md5 of the tested tree IS the evidence; caught by set -u and reading it back, before any launch. Now measuring on the two live boards with verified processes, growing logs and md5-pinned bases: condT full suite on board 2 (its discovery board: +0.294%, gates missing), fw3fold on board 3 (two 5.115 readings, gates missing); fw3fold's build reproduces board 1's engine_md5 exactly.","timestamp":1790176850714,"segment":1,"confidence":19.376500545652988,"asi":{"board1_return_check":"ls /dev/needle-pi | grep board1","board1_state":"absent from /dev/needle-pi: no board1-flash/board1-console nodes; generic console/flash aliases reappeared 14:10-14:13; pool README documents a prior usb-hub incident (checkpoint 20260918-153904-paused-for-usb-hub)","condT_status":"discovery reading +0.294% (5.1200 vs 5.1050) with extended +0.36%, prefill +0.37%, min_case 4.89; NOT accepted: device byte-exact verdict missing because its lane stalled before the end. Staging fill is a sequential loop (only cond_rows is nd_parallel_rows-split), so the host goldens do cover it.","failure_signatures":{"condT_b2":"TimeoutError in _handshake AFTER a reconnect - board healthy per !status, so session/bridge","fw3fold_b1_rerun":"TimeoutError in complete() - request never answered (board 1 gone)","sinkpair_b3":"TimeoutError in complete()"},"fix_principle":"re-send the stalled request once after a no-reset reconnect; a second failure propagates; no case is ever skipped, so the device byte-exact gate keeps full coverage","fw3fold_status":"5.115 twice on board 1 (+0.196%, reproduces to the digit) but no device gate; now re-measuring on board 3","guards_now_green":"test_pairing PAIRING_GUARDS_OK, test_retry RETRY_GUARD_OK cases=4, test_bench_guards OK; both exp28 guards wired into checks.sh","hypothesis":"Three simultaneous rc=1 lane endings have one cause; find it without weakening any gate, then get gated verdicts for the two above-bar candidates.","next_action_hint":"collect both gated readings; if condT confirms with DEVICE_GATE_OK, integrate into main and get a canonical main-tree reading - board 1 must come back first, or accept a board-2 same-board confirmation with the deviation disclosed. Then sinkpair on the free board.","rotted_guard_found":".auto/exp28/test_pairing.py dead since run #346: drain_stale() was rewritten to use _line() and to return LINES not a count; fixture + assertions never updated; not wired into checks.sh, so nothing noticed","self_inflicted_bug_caught":"gen_lane.sh hashed BEFORE from the relative path (main tree, not the worker) - would have made every base-md5 assertion vacuous; caught by set -u + reading the file back, fixed before launch"}}
