{"run":301,"commit":"f3ecc12","metric":5.0117,"metrics":{"boot_bench_tps":5.057,"device_output_exact":17,"device_token_delta":0,"ext_decode_tps":4.939,"gen_tokens":99,"host_output_exact":16,"internal_free":15215,"logit_max_delta":0.00005341,"logit_top1_match":10,"min_case_tps":4.79,"prefill_tps":5.2867,"psram_free":2052252,"think_tps":3.93},"status":"keep","description":"Harness regression-falsification after today's five edits to it, plus a refinement the run itself forced. Result: **6 of 6 gates CAUGHT, gates_missed=0, control green** - and this is the first time the board-gated device probe M6 actually ran, which matters because I had written it in run #298 and never executed it: untested code in a durable artifact is exactly the kind of decorative check this session has been hunting. Mutating one device golden entry made measure.sh itself exit 1 with DEVICE_OUTPUT_DIVERGED ✓. The suite also proved its own restore path: after six mutations (including an engine source mutation and a golden mutation) `git status` showed zero modified files and the device golden still had 17 cases with the mutated case intact.\n\n**Refinement the run forced:** the config/source check flagged all three workers as stale minutes after I had synced them - because `log_experiment` commits on every keep, so local HEAD moves constantly while workers stay at the last synced commit. Comparing HEAD ids would have produced a warning on nearly every run, and a check that cries wolf gets ignored, which is precisely how drift ends up being measured as a result. It now compares **tree hashes of the paths that feed the build** (engine/, esp32/, host/, tools/), which is the condition that actually invalidates a batch; `.auto/**` commits cannot change what a worker compiles. Re-run: `CONFIG_SYNC_OK boards=3 source=3`.\n\nBoth sides of that check are now falsifiable rather than structurally optimistic: `shatree()` returns MISSING for an unreadable repo instead of an empty string (so empty==empty cannot pass - the vacuous-pass class that bit this harness three times today), and two real engine commits hash differently (43b13633 vs 2a231da0). Both assertions are folded into `SELFTEST=1` and both pass.\n\nNo canonical device run was spent this iteration, deliberately: the shipping tree is byte-identical to run #298's and campaign rule #1 forbids running the accepted image standalone as a verification run, so the secondaries are #298's carried forward and decode_tps remains the accepted 5.0117 (+105.3 %). Session state: six gates with demonstrated failure modes, a pre-measurement config gate with demonstrated failure modes, and a 10-case held-out set measured to have no overfitting signature - while every 0.2 % speed candidate I could construct this session closed on measurement instead.","timestamp":1790073512127,"segment":2,"confidence":null,"asi":{"artifacts":"gate_falsify.sh executed end-to-end with the board-gated probe; board_config_check.sh refined (shipping tree hashes) + selftest extended to cover both sides","carried_forward":"no canonical device run this iteration by design: the shipping tree (engine/ esp32/ host/ tools/ model/) is byte-identical to run #298's, and campaign rule #1 forbids running the accepted image standalone as a verification run - so the secondaries are #298's, labelled as carried forward, and decode_tps remains 5.0117","finding_2":"the check compared worker HEAD ids against local HEAD, but log_experiment commits on every keep, so HEAD moves constantly while workers stay at the last synced commit - it flagged all 3 workers as stale minutes after I synced them. A check that cries wolf gets ignored, which is how drift ends up being measured as a result. Now compares tree hashes of the paths that feed the build (engine/esp32/host/tools) via a length-guarded helper that returns MISSING rather than an empty string, so an empty==empty vacuous pass is structurally impossible.","finding_3":"validated the new comparison the same way as everything else this session: shatree of a bogus dir returns MISSING (not empty), and two real engine commits hash differently (43b13633 vs 2a231da0). Both assertions folded into SELFTEST=1, so both sides of the check now have a demonstrated way to fail.","hypothesis":"After five edits to the campaign's own harness today (bench.py CASES + golden-missing metrics, checks.sh two new gates, measure.sh device gate + config warning, new config check), do all the gates still fail when their input is broken - and does the board-gated device probe M6, which I had written but never executed, actually work?","next_action_hint":"the harness is now self-protecting: 6 gates with demonstrated failure modes, a pre-measurement config/source gate whose own failure modes are demonstrated, and a widened 10-case held-out set with no overfitting signature. Remaining above-bar speed routes are owner decisions only (assertion level #293, 120 MHz #289). Next productive candidate for a fresh window: none identified above the 0.2% bar; the honest state is the final evidence table at 5.0117 (+105.3%).","revisits_run":297,"result":"6/6 gates CAUGHT, gates_missed=0, control green - including M6 executed for real for the first time: mutating one device golden entry made measure.sh itself exit 1 with DEVICE_OUTPUT_DIVERGED, proving the board-gated probe is not decorative. The suite also verified its own restore path: after 6 mutations the tree was clean (git status 0 modified) and the device golden still had 17 cases with timer60 intact."}}
{"run":302,"commit":"1828144","metric":5.0117,"metrics":{"boot_bench_tps":5.057,"device_output_exact":17,"device_token_delta":0,"ext_decode_tps":4.939,"gen_tokens":99,"host_output_exact":16,"internal_free":15215,"logit_max_delta":0.00005341,"logit_top1_match":10,"min_case_tps":4.79,"prefill_tps":5.2867,"psram_free":2052252,"think_tps":3.93},"status":"keep","description":"Disclosed repeat of the accepted runtime at 5.0117 decode tok/s (+105.3 % over the 2.44 baseline), run because the operator required a measurement this iteration; the shipping tree is byte-identical to the accepted image (git diff over engine/ esp32/ host/ tools/ model/ = 0 lines), so nothing here is a speed result and I would rather label it than invent a change to dodge the label - the ledger already ruled, at #249, that fabricating a change is worse than saying plainly what a run is. What is new is what preceded it and what it verifies.\n\n**One candidate closed on evidence before it cost a build.** Hunting for a last non-GEMV target, the qkv-tap and per-head-norm staged tables are the largest payload in the token still held in full IEEE fp32: q/k taps are 9 taps x 768 columns x 32 B = 221 KB per token, plus ~24 KB per layer of norm scales, against 3.3 ms/token of measured tap phase (1.65 %) - and it is the same mechanism class that produced this campaign's single biggest win (run #2's fp32 staging, +99.9 %), so it deserved the look. It dies on code reading: `fp16_slot[li][SLOT[f]] = p` shows these tables are *already copied into PSRAM at open*, and the 12 MB tier exists to turn mmap-flash reads into PSRAM reads - it cannot help bytes that are already in PSRAM. Residency is ruled out independently: 221 KB of taps against a 64 KB data cache. So the phase sits at the same non-resident scattered-read floor the campaign already measured for other PSRAM payloads, and the per-element conversion the backlog flagged as \"genuinely untried\" turns out to have been staged already (the function's own comment records exactly that, and it is why `tap_projection` reads `m->fp16_slot[li][tap_slot]` rather than converting in the loop). Had I built it, the run would have measured the control.\n\n**What the run verifies.** It is the first canonical run executing the full new gate set simultaneously on the real pipeline: the widened suite (17/17 device, 16/16 host byte-exact), `device_golden_missing=0` and `host_golden_missing=0`, the primary-prompt hash pin inside `checks.sh`, the new device byte-exact gate reporting `DEVICE_GATE_OK exact=17/17`, and the pre-build pool sync check running silently (no `CONFIG_DRIFT_WARN`) against a pool that is genuinely in sync. All values reproduce to the digit: decode 5.0117, extended 4.9390, think 3.93, prefill 5.2867, boot bench 5.057 / 198 ms/token, min_case 4.79, internal_free 15,215, psram_free 2,052,252, token_delta 0, fidelity 5.341e-05, top1 10/10.\n\nSession tally: four measured closures (Sinkhorn `logf` skip at 13.58 % hit rate vs a 787-cycle break-even; software prefetch, which does not exist on this core; the cache-config family at its Kconfig maxima; and this staged-table delivery closure), six gates each proven able to fail, a self-falsifying pool sync gate, and a widened 10-case held-out set measured to carry no overfitting signature. Speed work is at the measured floor: the two routes above the 0.2 % bar are both owner decisions, the assertion level (#293, frees 8,248 B and would re-price the RAM-blocked residency family, where only the 4-row CQ2 LUT residency at kbench +3.8 % is a measured winner) and 120 MHz octal memory (+3.51 %, forbidden by the documented-maxima rule).","timestamp":1790073976434,"segment":2,"confidence":null,"asi":{"candidate_tested_this_iteration":"tap/norm staged-table delivery: the tap_projection + zcrms loops are the only non-CQ GEMV mass in the phase map still held in full IEEE fp32 (q/k taps = 9 taps x 768 x 32 B = 221 KB/token, norm tables another ~24 KB/layer, ~3.3 ms/token = 1.65%, i.e. the largest format-uncompressed payload left). CLOSED before any build, on code reading: `fp16_slot[li][SLOT[f]] = p` shows these tables are already copied into PSRAM at open, and the 12 MB tier exists to turn *mmap-flash* reads into PSRAM reads - so it cannot help bytes that are already in PSRAM. 221 KB of taps against a 64 KB data cache rules residency out too, so the phase is at the same non-resident scattered-read floor already measured for other PSRAM payloads. Mechanism class was the campaign's most successful one (run #2 fp32 staging, +99.9%), which is why I checked it; the conversion itself was already staged (the function's own comment records it).","hypothesis":"Two, both resolved this iteration. (1) Speed: the qkv-tap / per-head-norm staged tables are the last large uncompressed fp32 payload in the token, so a tier or residency play might buy part of 3.3 ms - FALSIFIED off-device (see candidate_tested_this_iteration). (2) Pipeline integrity: after seven harness edits this session, does the canonical path still run end to end with every new gate live and the pool sync check quiet - CONFIRMED.","metric_note":"DISCLOSED REPEAT of the accepted 5.0117 on an unchanged shipping tree (engine/ esp32/ host/ tools/ model/ diff = 0 lines), run because the operator required a measurement this iteration. The alternative was fabricating a change to dodge the label, which the ledger (#249) already judged worse than saying plainly what a run is. This is the first canonical run that executes the FULL new gate set at once: widened 17-device/16-host suite, device_golden_missing=0, host_golden_missing=0, primary-hash pin, DEVICE_GATE_OK, and the pre-build board sync check silent (no CONFIG_DRIFT_WARN).","next_action_hint":"For a fresh window: no candidate above the 0.2% bar remains anywhere in the phase map. The two above-bar routes are owner decisions, not code (assertion level #293 frees 8,248 B and would re-price the RAM-blocked residency family, of which the 4-row CQ2 LUT residency at kbench +3.8% is the only measured winner; 120 MHz octal memory is +3.51% but forbidden by the documented-maxima rule). origin is ~20 commits behind: git push has no credentials in this container.","three_closures_this_session":"Sinkhorn logf skip (13.58% measured hit rate, 787-cycle break-even), software prefetch (no pref/dpref opcode; __builtin_prefetch emits nothing - would have read as a null result), cache-config family (S3 Kconfig maxima: 32KB/32B I-cache, no 64B I-line). Plus this iteration's staged-table delivery closure.","integrity_state":"six gates with demonstrated failure modes (gate_falsify 6/6, gates_missed=0 including the board-gated device probe), a self-falsifying pool sync gate, 10 held-out cases with no overfitting signature (unseen prompts 5.080/5.020/4.790 vs 5.0117 primary)"}}
{"run":303,"commit":"85e456f","metric":5.0117,"metrics":{"boot_bench_tps":5.057,"device_output_exact":17,"device_token_delta":0,"ext_decode_tps":4.939,"gen_tokens":99,"host_output_exact":16,"internal_free":15215,"logit_max_delta":0.00005341,"logit_top1_match":10,"min_case_tps":4.79,"prefill_tps":5.2867,"psram_free":2052252,"think_tps":3.93},"status":"keep","description":"Disclosed repeat of the accepted runtime: decode 5.0117 tok/s (+105.3 % over the 2.44 baseline) on a shipping tree byte-identical to the accepted image (git diff over engine/ esp32/ host/ tools/ model/ = 0 lines), run under the per-iteration measurement mandate. Not a speed result, and I am not dressing it as one; inventing a change to avoid the label is the move the ledger already rejected at #249.\n\nIts information content is regression evidence for this session's harness surgery. This is the second canonical run after the *full* gate set went live together - the widened 17-device/16-host suite, `device_golden_missing`/`host_golden_missing` required to be 0, the sha256 pin on the six primary prompts inside `checks.sh`, the new device byte-exact veto (`DEVICE_GATE_OK exact=17/17`), and the pre-build pool sync check (silent, i.e. genuinely in sync) - and every value reproduces to the digit: extended 4.9390, think 3.93, prefill 5.2867, boot bench 5.057 / 198 ms/token, min_case 4.79, token_delta 0, fidelity 5.341e-05 against a 2e-3 gate, top1 10/10, internal_free 15,215, psram_free 2,052,252. So widening the held-out set and hardening the gates did not perturb the metric by even one quantisation tick, which is the property the campaign needs before its numbers can be trusted across a window boundary.\n\nCadence decision recorded rather than left implicit: `make capture` is **not** due. Its trigger is a shipping code change, and no shipping file has differed from the accepted image for seven consecutive runs; it was last green on this exact image with all nine behavioural flags true. Running it would occupy a board slot and return information we already have - the same reasoning that bars unchanged-tree control batches.\n\nFive candidates were closed off-device in this window instead of on hardware: the Sinkhorn `logf` skip (13.58 % measured hit rate against a 787-cycle break-even), software prefetch (the opcode does not exist on this core and `__builtin_prefetch` compiles to nothing), the cache-config family (at its Kconfig maxima - there is no 64 B instruction line on ESP32-S3), staged tap/norm table delivery (the tables are already PSRAM-resident, so the tier cannot help, and 221 KB of taps against a 64 KB cache rules residency out), and Sinkhorn's final `n*n` exponential tail (~128 exponentials per token, an order of magnitude under the keep bar). Remaining routes above the bar are owner decisions, not code: the assertion level (#293, which frees 8,248 B of internal heap and would re-price the RAM-blocked residency family) and 120 MHz octal memory (+3.51 %, forbidden by the documented-maxima rule).","timestamp":1790074324398,"segment":2,"confidence":null,"asi":{"cadence_state":"make capture is NOT due: its trigger is a shipping code change, and engine/ esp32/ host/ tools/ model/ has been 0 lines different from the accepted image for the last seven runs (#296-#303); it was last green on this exact image with all nine behavioural flags true. Re-running it now would cost a board slot and add no information - the same rule that bars unchanged-tree control batches.","hypothesis":"Two, both cheap, both resolved without a build. (1) Does anything in the shipping image still drift between runs after this session's harness surgery - i.e. is the accepted 5.0117 signature still exactly reproducible now that the suite is 17 device / 16 host cases, the primary prompts are hash-pinned, and the device byte-exact + pool-sync gates are live? (2) Is `make capture` due, which the cadence rule ties to a shipping code change?","metric_note":"DISCLOSED REPEAT on an unchanged shipping tree (diff over engine/ esp32/ host/ tools/ model/ = 0 lines), run under the operator's per-iteration measurement mandate. Not presented as a speed result. This is the second identical-signature run after the full gate set went live, so it doubles as the regression check that the widened suite and the new gates do not perturb the metric.","next_action_hint":"Fresh window: nothing above the 0.2% bar remains in the phase map. Above-bar routes are owner decisions only - assertion level (#293, frees 8,248 B; would re-price the RAM-blocked residency family, where the 4-row CQ2 LUT residency at kbench +3.8% is the only measured winner) and 120 MHz octal memory (+3.51%, forbidden by the documented-maxima rule). Also: origin is ~21 commits behind; git push has no credentials in this container, so sync workers by local path, never git fetch origin.","screened_this_window":"five candidates closed off-device: Sinkhorn logf skip (13.58% measured hit rate vs 787-cycle break-even), software prefetch (no pref/dpref opcode; __builtin_prefetch emits nothing), cache-config maxima (S3 Kconfig offers no 64B I-line, I-cache max 32KB), staged tap/norm table delivery (already PSRAM-resident; 221KB taps vs 64KB cache), and sinkhorn's final n*n exp tail (~128 exps/token = +0.007% if removed, under the bar by an order of magnitude)"}}
{"run":304,"commit":"85e456f","metric":5.0117,"metrics":{"boot_bench_tps":5.057,"device_output_exact":17,"device_token_delta":0,"ext_decode_tps":4.939,"gen_tokens":99,"host_output_exact":16,"internal_free":15215,"logit_max_delta":0.00005341,"logit_top1_match":10,"min_case_tps":4.79,"prefill_tps":5.2867,"psram_free":2052252,"think_tps":3.93},"status":"keep","description":"Disclosed repeat #3 at 5.0117 decode tok/s (+105.3 % over the 2.44 baseline) on a shipping tree byte-identical to the accepted image (git diff over engine/ esp32/ host/ tools/ model/ = 0 lines), run only to satisfy the per-iteration measurement mandate. Every value reproduces to the digit for the third time - extended 4.9390, think 3.93, prefill 5.2867, boot bench 5.057 / 198 ms/token, min_case 4.79, 17/17 device and 16/16 host byte-exact with golden_missing=0, token_delta 0, fidelity 5.341e-05, top1 10/10, internal_free 15,215, psram_free 2,052,252 - which is precisely why a fourth would carry no information.\n\nI am recording the honest judgement rather than hiding behind the run: the campaign's own stop condition was met at #296-#302 (final evidence table updated to 5.0117 with the runs #291-#301 closures; six gates each proven able to fail; no overfitting signature on three never-measured prompt shapes; five further candidates closed off-device this window - the Sinkhorn logf skip at 13.58 % hit rate against a 787-cycle break-even, software prefetch which has no opcode on this core, the cache-config family at its Kconfig maxima, staged tap/norm table delivery which is already PSRAM-resident, and Sinkhorn's final exponential tail at an order of magnitude under the keep bar). Three consecutive unchanged-tree runs is what the rules call manufacturing verification work, and the ledger's precedent (#246-#285) shows how far an unchanged-HEAD loop degrades when each iteration must produce a number.\n\nRecommendation to the operator: interrupt the loop, or give it a target the phase map can still answer. Nothing above the 0.2 % keep bar remains inside the documented maxima and the byte-exact gate; the two routes that are above the bar are decisions, not code - the assertion level (#293: neutral speed but frees 8,248 B of internal heap, which re-prices the RAM-blocked residency family, of which only the 4-row CQ2 LUT residency at kbench +3.8 % is a measured winner) and 120 MHz octal flash+PSRAM (#289: +3.51 % measured on two boards, forbidden by the documented-maxima rule and carrying IDF's own ~20 °C random-crash caveat). Also worth doing outside this loop: origin is ~22 commits behind and `git push` has no credentials in this container.","timestamp":1790074628800,"segment":2,"confidence":null,"asi":{"hypothesis":"No new hypothesis. Three consecutive runs of an unchanged shipping tree (#302, #303, this one) is the pattern the campaign's own rules call manufacturing, and the final evidence table is already updated to 5.0117 with the session's closures. This run exists only to satisfy the per-iteration measurement mandate.","metric_note":"DISCLOSED REPEAT #3, identical signature. Shipping tree diff over engine/ esp32/ host/ tools/ model/ = 0 lines. Third consecutive unchanged-tree canonical run (#302, #303, #304); all three reproduce 5.0117 / 4.9390 / 3.93 / 5.2867 / 5.057 / 4.79 / 15,215 / 2,052,252 to the digit, so the metric is deterministic and further repeats carry no information.","next_action_hint":"STOP the loop or interrupt it: the campaign's stop condition (final evidence table written, no candidate above the 0.2% bar, two remaining routes are owner decisions) was met at run #302 and nothing since has changed it. For a fresh window, the two owner decisions to price are the assertion level (#293: frees 8,248 B internal heap, which re-prices the RAM-blocked residency family - only the 4-row CQ2 LUT residency at kbench +3.8% is a measured winner) and 120 MHz octal memory (+3.51%, forbidden by the documented-maxima rule). Also sync origin: it is ~22 commits behind and git push has no credentials in this container.","stop_condition":"met at #302: FINAL EVIDENCE TABLE updated to 5.0117 (+105.3%) with the runs #291-#301 closures; six gates proven falsifiable; no overfitting signature on unseen prompts; five more candidates closed off-device this window"}}
