{"run":152,"commit":"HEAD","metric":4.8817,"metrics":{"prefill_tps":5.2183,"ext_decode_tps":4.804,"think_tps":3.87,"boot_bench_tps":4.983,"min_case_tps":4.66,"gen_tokens":99,"internal_free":17039,"psram_free":2052252,"device_output_exact":12,"device_token_delta":0,"logit_max_delta":0.00005341,"logit_top1_match":10,"host_output_exact":11},"status":"keep","description":"Tooling-integrity cycle, no runtime change. Canonical run: 4.8817 decode / 4.804 extended / 4.66 min case, byte-exact 12/12 device + 11/11 host, fidelity 5.341e-05 top1 10/10. Chase to unblock the repo's end-to-end check (make capture, green at #143 on the pre-sampler tree) found and then ruled out two theories: it is not DTR gating (a write with DTR asserted times out too - my 6-line fallback patch was reverted as unjustified), and the board is not damaged - the pool harness measures the same board2 at 4.8817 byte-exact immediately afterwards, so the blocker is specifically serial_api.py's attach pattern against a board that was recently reset: its reads stream fine (4586 B of priming log) while every write blocks. Fifth independent confirmation of 4.8817, on two boards plus the canonical port.","timestamp":1789967995724,"segment":1,"confidence":null,"asi":{"hypothesis":"make capture is the only behavioural check of routing / second-pass tool execution / timer expiry, and the kept sampler change alters tool-call emission, so re-running it was worth the detour.","refined_blocker":"tools/serial_api.py's Device opens with dtr/rts pinned false and write_timeout=5, then its very first write (!think) blocks. Confirmed by probe: reads deliver thousands of bytes while writes time out, even with DTR asserted, and the retry-with-DTR fallback also times out. The board answers the measurement harness (bench.py) fine at 4.8817 right after, so the console itself works. Root cause is console state after a port close on a board that had just been reset - the firmware does not drain stdin during the multi-minute priming, so the device-side RX ring is full and the host's OUT path stalls; the API's handshake has no write-timeout tolerance for that window.","harness_fact_for_the_pool":"Opening and closing a pool board's console from a process that dies mid-attach can leave that board's console read-capable but write-blocked until the next reset, and each reset costs a ~5 min re-prime. Do not retry an API attach in a loop; reset once, wait for EVT ready, attach once. This is how I burned ~40 minutes of board time here.","decision":"Reverted the tooling patch (it did not fix the blocker, so shipping it would have been unjustified modification of shared harness code) and stopped the chase: capture has been green since #143 and the sampler change is already covered byte-exactly by 12 device cases plus 11 host cases plus the fidelity probe.","next":"Three-board verification batch on the accepted runtime (all 12 cases, fresh-configured images, swap board roles) to keep the control warm; after that, only verification cycles remain unless a new measurement contradicts a named floor.","state":"Best 4.8817 decode (+99.9% over the 2.44 baseline), 4.804 extended, 3.87 think, 5.22 prefill. Tree clean at HEAD, all gates green, five confirmations on two boards."}}
{"run":153,"commit":"HEAD","metric":4.8817,"metrics":{"prefill_tps":5.2183,"ext_decode_tps":4.804,"think_tps":3.87,"boot_bench_tps":4.983,"min_case_tps":4.66,"gen_tokens":99,"internal_free":17039,"psram_free":2052252,"device_output_exact":12,"device_token_delta":0,"logit_max_delta":0.00005341,"logit_top1_match":10,"host_output_exact":11},"status":"keep","description":"Verification + accounting cycle, no runtime change. Two-board batch on freshly configured HEAD images: board1 4.8817 and board2 4.8817, both byte-exact 12/12; canonical run reproduces 4.8817 / 4.804 extended / 4.66 min case with fidelity 5.341e-05 and top1 10/10 (eighth confirmation of this runtime, on three different ports). A profiled board-3 run confirmed the boot-bench phase map is untouched by the sampler work, as it must be, and closed the last unexplained number in the token: the sampler's ~10 ms residual is ~7.2 ms of nd_model_logits_subset, i.e. ~1200-1500 candidate rows x 768 at the same ~6 ns/weight the 2-bit path sustains everywhere else - a legitimate row count in vocabulary order (already ascending in this archive), not an inefficiency. Wrote the closed full-token accounting to .auto/ideas.md.","timestamp":1789970157841,"segment":1,"confidence":2870.5882352933095,"asi":{"hypothesis":"Verification batch on the accepted runtime plus the post-fix phase map, to confirm nothing regressed and to test whether any phase is still mis-attributed.","closed_now":"The subset-logits projection is at floor too: reducing the candidate count would change what the model is allowed to emit (forbidden), the gather is already in ascending row order, and per-weight it is as fast as the dominant phase. So the constrained sampler is ~2 ms of grammar work (at floor after #147 and after #149's null) plus ~7.2 ms of unavoidable GEMV.","board3_note":"Profiled build reads 4.8717 vs 4.8817 unprofiled (-0.2%), which is the timers, and bench.py does not echo per-request EVT prof lines (only the boot-bench table), so a request-path harvest needs a raw console reader - currently blocked by the API attach issue in #152. Not worth solving while nothing depends on it.","next":"Highest-value remaining work is measurement integrity, not speed: .auto/prompts.json explicitly welcomes added coverage in 'extended' (primary is frozen and untouched). After 150 runs the risk is overfitting to 11 prompts, so add 2-3 held-out extended cases that stress exactly what the campaign changed - a long tool-call JSON with many string values (the sampler's grammar path) and a long route request (the deeper attention span). Needs the harness's per-case golden mechanism checked first, and any change there re-baselines ext_decode_tps, which must be recorded. Also re-measure the noise sigma on the new runtime, since 0.03% was characterised on the pre-sampler tree.","state":"Best 4.8817 decode (+99.9% over the 2.44 baseline), 4.804 extended, 3.87 think, 5.22 prefill; byte-exact on device and host; every phase of the token now at a named, measured floor."}}
{"run":154,"commit":"HEAD","metric":4.8817,"metrics":{"prefill_tps":5.2183,"ext_decode_tps":4.804,"think_tps":3.87,"boot_bench_tps":4.985,"min_case_tps":4.66,"gen_tokens":99,"internal_free":17039,"psram_free":2052252,"device_output_exact":12,"device_token_delta":0,"logit_max_delta":0.00005341,"logit_top1_match":10,"host_output_exact":11},"status":"keep","description":"Attempted the measurement-integrity improvement the rules invite: widen `extended` (primary verified byte-identical to git before and after). Four held-out cases filled real gaps - research_and_plan had zero routing coverage, nothing tested the schema numeric bound, get_status only appeared as a memory question. Host side passed 15/15 byte-exact and the model routed research correctly and emitted the 4-digit 3600. The device run then reproducibly failed the think group after ~15 requests in one attach (the !think toggle unacked, next request times out), so goldens could not be adopted - bench.py correctly refuses a partial save. Reverted; canonical run back to green at 4.8817 / 4.804 extended / 12-of-12 byte-exact, think ok, boot bench 4.985. Two theories were tested and falsified rather than assumed; durable findings recorded in .auto/ideas.md.","timestamp":1789973389820,"segment":1,"confidence":1435.2941176466547,"asi":{"hypothesis":"After 150 runs the real risk is overfitting to 11 prompts, and .auto/prompts.json explicitly welcomes added extended coverage, so widening it is worth more than another micro-optimisation.","falsified_theories":"1) A long-running timer started by my clamp case (the grammar turns 4000s into 400s) emitting events while the host was not reading - removed the timer from both new cases, failed identically. 2) Request-line length: main.c's console reader is ND_LINE_MAX=272 and my longest line was 237 bytes, and overflow bytes are dropped rather than deferred, so no leftover could have corrupted the next command.","product_finding_kept":"main.c silently truncates any request line at 271 bytes: the read loop drops overflow characters and waits for \\n, so a longer request is answered as its first 271 characters with no error. Harmless for this benchmark (longest request today is 75 bytes) but a real defect for a device accepting arbitrary user text; the right fix is an explicit ERR line_too_long rather than a bigger buffer. Recorded in .auto/ideas.md for the owner, not fixed here because it is behaviour, not speed, and the schemas are frozen.","console_pattern":"Third independent sighting of 'console reads fine but writes block' whenever the firmware is kept out of its read loop long enough (boot priming #145, API attach #152, this 15-request sequence). Until that is addressed, benchmark enlargement needs a re-attach between groups, which is also why make capture stays blocked.","campaign_impact":"None on the metric: primary is frozen and the 12-case harness has never hit the limit in 150 runs. Best stays 4.8817 (+99.9%).","next":"Two honest options, in order: (a) verification cycles and re-measuring the noise sigma on the post-sampler runtime (0.03% was characterised on the pre-sampler tree, and future sub-1% claims need a current sigma); (b) bisect the request-count limit with a 13-case set, which makes the owner-facing report precise - worth doing only if nothing better turns up.","state":"Best 4.8817 decode, 4.804 extended, 3.87 think, 5.22 prefill; byte-exact 12/12 device + 11/11 host; tree clean at HEAD."}}
{"run":155,"commit":"de26e2e","metric":4.8817,"metrics":{"prefill_tps":5.2183,"ext_decode_tps":4.7986,"think_tps":3.87,"boot_bench_tps":4.983,"min_case_tps":4.66,"gen_tokens":99,"internal_free":17039,"psram_free":2052252,"device_output_exact":14,"device_token_delta":0,"logit_max_delta":0.00005341,"logit_top1_match":10,"host_output_exact":13},"status":"keep","description":"Benchmark-coverage extension landed: `extended` grew 5 -> 7 cases, filling real routing/grammar gaps (research_and_plan had zero coverage; nothing tested a value above the schema maximum). 14/14 device cases byte-exact against a 14-case golden, 13/13 host, primary verified byte-identical to git and still 4.8817, think ok, fidelity 5.341e-05 top1 10/10. ext_decode_tps re-baselined 4.804 -> 4.7986 (two new cases, one of them a route case at the deeper-context rate); min_case unchanged at 4.66. The new cases behave as intended and are now tripwires: research_and_plan is chosen correctly, and \"every 40000 seconds\" - out of range for the schema - comes back as set_sampling_interval{seconds:400}, the grammar's digit clamp.","timestamp":1789975352125,"segment":1,"confidence":728.3582089551835,"asi":{"hypothesis":"#154's failure was not the benchmark's fault: a 23-request single-attach probe (primary,extended,primary,extended,think) completed with zero stalls, so the console-write wall theory is falsified and the trigger was case content - a long route generation exceeding the per-request timeout. Short replacement cases should therefore adopt cleanly.","what_made_the_difference":"The rejected pair included a ~230-character route request; the accepted pair is 63 and 37 bytes. Nothing about timers, line truncation (ND_LINE_MAX=272, overflow silently dropped - separately recorded as a product defect), or request count reproduces the stall.","harness_gotcha_found":"AUTO_SAVE=1 through .auto/measure.sh did NOT write the device golden: the run reported device_output_exact=14 while .auto/golden/device.json stayed at 12 cases, and bench.py counts unseen case ids as exact, so the two new cases were silently unvalidated. bench.py device --groups primary,extended,think --save-golden (invoked directly, board already warm) is what actually froze them. Always verify by counting cases in the golden file, not by trusting the run's exact-count metric.","quality_note_for_owner":"Existing case heldout_status ('Is a timer running right now?') has expect:null and the model answers it by STARTING a 60 second timer - a wrong-tool selection that the null expectation hides. Left unchanged (the rules forbid improving a case by changing what it expects), but it is real signal.","determinism":"A same-session repeat of 11 cases returned identical tps to three decimals (0.00% difference), identical token counts and identical tool calls. Within a session the device is deterministic; the 0.07% spread measured in #144 is image/board variation, not run-to-run noise.","next":"The two new device goldens were frozen on one board, so confirm 14/14 byte-exact on the other two boards - a golden that only one board reproduces is a board artefact, not a reference. Then the campaign is back to verification cycles.","state":"Best 4.8817 decode (+99.9%), extended 4.7986 on the widened set, think 3.87, prefill 5.22; 14 device + 13 host cases byte-exact."}}
{"run":156,"commit":"de26e2e","metric":4.8817,"metrics":{"prefill_tps":5.2183,"ext_decode_tps":4.7986,"think_tps":3.87,"boot_bench_tps":4.983,"min_case_tps":4.66,"gen_tokens":99,"internal_free":17039,"psram_free":2052252,"device_output_exact":14,"device_token_delta":0,"logit_max_delta":0.00005341,"logit_top1_match":10,"host_output_exact":13},"status":"keep","description":"Three-board cross-confirmation of the widened benchmark, no code change. Fresh-configured HEAD images (identical engine_md5 across boards) measured in one batch: all three boards decode_tps=4.8817, ext_decode_tps=4.7986, device_output_exact 14/14 against the 14-case golden - so the two new goldens (research_and_plan routing, out-of-range numeric bound) are not board artefacts. Canonical run reproduces 4.8817 / 4.7986 / 14-of-14 with think ok, fidelity 5.341e-05 top1 10/10, boot bench 4.983.","timestamp":1789979365998,"segment":1,"confidence":488.00000000001046,"asi":{"hypothesis":"The two new device goldens were frozen on one board; a reference that only one board reproduces would be a board artefact, so confirm on all three before trusting them as a quality veto.","result":"Byte-exact 14/14 on all three boards and identical decode_tps to four digits on every board, including the two new cases. The widened set is a valid reference.","harness_lessons":"1) Never wrap a launcher that starts a detached batch in `timeout` - SIGTERM goes to the whole process group and killed a 25-minute three-board batch right after flashing (logs ended at flash_s=6 with no error). 2) needle-parallel captures python stdout to a file, so output is block-buffered: a board log sitting at the last flash line for ten minutes is normal buffering, not a hang. 3) AUTO_NOFLASH=1 is safe and saves ~8 min per board when the HEAD image is already flashed and verified (engine_md5 equality across boards is the cheap integrity check).","metric_stability":"decode_tps has now returned 4.8817 on ten+ measurements across three boards and two benchmark sets. Combined with the same-session repeat test (11 cases, 0.00% difference), the practical conclusion is that any non-zero delta on a same-board same-image A/B is real, and the 0.2% keep bar is very conservative.","next":"Retry `make capture` (green since #143, so due) now that the boards are idle and primed rather than freshly reset - the #152/#154 stall needed a board kept out of its console read loop, so an attach against a warm idle board may just work with no tooling change at all. If it still blocks, the right harness fix is wait-and-retry on write timeout during the handshake, not the DTR retry that already failed.","state":"Best 4.8817 decode (+99.9% over 2.44), extended 4.7986 on the widened 7-case set, think 3.87, prefill 5.22; 14 device + 13 host cases byte-exact on three boards."}}
{"run":157,"commit":"de26e2e","metric":4.8817,"metrics":{"prefill_tps":5.2183,"ext_decode_tps":4.7986,"think_tps":3.87,"boot_bench_tps":4.984,"min_case_tps":4.66,"gen_tokens":99,"internal_free":17039,"psram_free":2052252,"device_output_exact":14,"device_token_delta":0,"logit_max_delta":0.00005341,"logit_top1_match":10,"host_output_exact":13},"status":"keep","description":"Behavioural-integrity cycle, no runtime change, plus a self-correction. make capture (the repo's end-to-end check, green at #143 on the pre-sampler tree) now passes on the 4.8817 runtime: 7 real scenarios, all 9 verification flags true - routes_match, tools_match, requests_succeeded, no_external_calls, local_has_two_passes, external_stops_at_selection, telemetry_progressed, sampling_interval_applied, timer_expired. The three cycles I spent on a \"console write-block defect\" (#145/#152/#154) were chasing my own wrong argument: inside needle-board run N, /dev/ttyACM0 is the FLASH port and /dev/ttyACM1 is the console, and I had pointed needle-api at the flash port. One flag change and the API came up first try. Canonical run: 4.8817 decode, 4.7986 extended, 14/14 byte-exact, fidelity 5.341e-05 top1 10/10.","timestamp":1789980483305,"segment":1,"confidence":488.00000000001046,"asi":{"hypothesis":"After 13 kept-adjacent runs without the end-to-end check, and a sampler change that alters tool-call emission, prove the shipping path still behaves - routing, second-pass local tool execution, telemetry progress, sampling interval, timer expiry. Also test whether the previously recorded blocker was real.","result":"All 7 scenarios and 9 verification flags green, and the blocker was self-inflicted (wrong serial port). Notes in .auto/ideas.md and .auto/prompt.md corrected rather than left standing: the false part of #145/#152/#154's diagnosis is retracted there, with the fact I should have followed noted - bench.py was succeeding with the same serial_api.Device class throughout, which ruled out the driver immediately.","what_survives_the_correction":"The genuine findings stand: main.c silently truncates request lines at 271 bytes (ND_LINE_MAX=272, overflow dropped, no error); AUTO_SAVE through measure.sh does not freeze new device goldens while bench.py counts unseen case ids as exact; bench.py's per-request timeout (not any console issue) is what killed long-prompt extended cases; heldout_status has expect:null and the model answers 'Is a timer running right now?' by starting a 60 s timer.","campaign_state":"Speed: 4.8817 tok/s (+99.9% over the 2.44 baseline), deterministic to 0.00% within a session and 0.07% across boards/images. Every phase of the token is at a named, measured floor; no candidate with a live premise remains. Integrity: 14 device + 13 host cases byte-exact on three boards, fidelity probe unchanged, and now the end-to-end behavioural check green as well.","next":"Verification cycles, and re-run make capture after roughly ten further kept changes. If a future archive changes phi's in_pad/group, the PSRAM tier geometry, or the fp32-pool layout, re-measure the per-phase map once before choosing work - that map is what has been closing every candidate.","state":"Best 4.8817 decode, 4.7986 extended, 3.87 think, 5.22 prefill; tree clean; capture green; all gates green."}}
