{"run":415,"commit":"1845f25","metric":5.1167,"metrics":{"boot_bench_tps":5.162,"device_output_exact":20,"device_token_delta":0,"ext_decode_tps":5.0423,"gen_tokens":99,"host_output_exact":19,"internal_free":12855,"logit_max_delta":0.00005341,"logit_top1_match":10,"min_case_tps":4.88,"prefill_tps":5.4,"psram_free":2052252,"think_tps":3.99},"status":"keep","description":"Mechanism screen + a harness class closed + a candidate deliberately given back its field verdict; accepted runtime unchanged at 5.1167 (metric and secondaries are the accepted fw3foldnb run's carried forward - no shipping image completed this iteration; the one device image that ran was a kbench screen which never executes the request path). SCREEN (board 1, KB CV, its own control sums_bit_equal=1 so the two widths run identical arithmetic): cond_rows' stride-8 access pattern, 6,144 elements/sweep, min of 9 rounds - fp32 PSRAM warm 9.090 cycles/element, fp32 internal RAM 9.014 (residency worth 0.0 % warm, third independent confirmation of #330 that warm PSRAM equals internal), fp32 PSRAM cold behind a 96 KiB evict 18.965 (residency worth 52 % cold), fp16 PSRAM warm 73.483 and cold 73.504 - i.e. fp16 is 8.1x slower and warm==cold, which localises the cost to compute/dependency rather than delivery. MECHANISM FOUND: nd_f16's inline body ends in memcpy(&f,&bits,4), a per-element store-to-load forward inside the chain feeding the multiply. That is why run #2's fp32 staging was worth +99.9 % and it had never been priced; the header comment noted the out-of-line form was expensive but never numbered the inline one. This explains run #414's -1.89 % exactly and is written to .auto/ideas.md as nd_f16-is-a-64-cycle-operation-never-a-cast. I REFUSED TO OVERPRICE THE BENCH: I stopped condv16's lane on this number, then restarted it, because the campaign's own rule (#364/#374) is that an isolated instruction-mix number prices nothing, the only field evidence in the family (tap16) is a different loop shape - vectorisable, so it has an optimised form to destroy, unlike a single-accumulator reduction - and the field reading was nearly free. HARNESS CLASS CLOSED: the host compiler accepts an incompatible pointer initialisation as a warning while the xtensa build refuses it, so a candidate can be host-proven byte-exact and still fail to build for the device (condv16's caller kept const float *cv after the struct field became uint16_t*; host goldens passed because the pointer VALUE was right). .auto/lane_cand.sh now runs cc -fsyntax-only -Werror=incompatible-pointer-types before any flash, and its positive control is that it rejected the real file with the device's own message. Also: the first KB CV run printed KB CV SKIPPED alloc rather than mislabeling a warm pass as cold, because the evict buffer belongs to another bench's init - the screen now owns it. RECONSTRUCTED AND STAGED, NOT LAUNCHED: run #404's fusion+cold-refund state rebuilt deterministically from git (fused kernel from c64efe4 plus ND_HOT dropped and noinline added on fw_scale/nd_fwht2/nd_fwht3s; nd_quant.c only, md5 a800d1ea1896) and host-verified again: 19/19 byte-exact, token_delta 0, fidelity 5.341e-05, top1 10/10, checks rc=0. Held back deliberately because #402 measured that concurrent console traffic moves the stall earlier, and a 20-case gate attempt must run with the pool idle. Engine tree verified byte-identical to a6e7454 twice.","timestamp":1790219183420,"segment":1,"confidence":19.34201012292117,"asi":{"bench_verdict":"KB CV, board 1, 6,144 elements per sweep in cond_rows' own stride-8 pattern, min of 9 rounds, CONTROL sums_bit_equal=1 (so the two widths execute the same arithmetic and the comparison is about cost, not about two different functions): fp32 PSRAM warm 9.090 cyc/elem, fp32 internal RAM 9.014 (residency_warm = 0.0 % - warm PSRAM equals internal exactly, reproducing #330 on a third operand class), fp32 PSRAM cold with a 96 KiB evict 18.965 (residency_cold = 52 %), fp16 PSRAM warm 73.483, fp16 PSRAM cold 73.504. fp16 being 8.1x slower with warm == cold means the cost is compute/dependency, not delivery.","mechanism":"nd_f16's inline body ends in `memcpy(&f, &bits, 4)`, i.e. a per-element store-to-load forward into the dependency chain feeding the multiply - which is exactly why run #2's fp32 staging was worth +99.9 % and why the header comment says the out-of-line form cost more than the arithmetic. It was never priced. Recorded in .auto/ideas.md as: nd_f16 is a ~64-cycle operation in a dependent position, never treat it as a cast.","refused_to_overprice_the_bench":"I killed condv16's lane on this screen, then restarted it. Reason: the campaign's own rule (#364/#374) is that an isolated instruction-mix number does not price a field delta, and 8.1x is exactly the kind of number that has been wrong before; the only field evidence in the family is tap16's -1.89 %, which is a different loop shape (vectorisable, so it has an optimised form to destroy, whereas cond_rows is a single-accumulator reduction with a stride-8 load). The field reading is cheap and the lane was already 90 % done, so the candidate gets its own verdict rather than being closed by a bench. The engine tree never changed and main stayed at a6e7454 throughout (md5 5c646468b78f verified twice).","harness_class":"New class found and closed: the HOST compiler accepts an incompatible pointer initialisation as a WARNING and keeps going, while the xtensa build refuses it, so a candidate can be 'host-proven byte-exact' and still fail to build for the device. condv16's caller kept `const float *cv` while the struct field became uint16_t*, and the host goldens still passed because the pointer VALUE was right - so the host result was meaningful, but the device build refused at nd_model.c:1757. Fix: .auto/lane_cand.sh now runs `cc -fsyntax-only -Werror=incompatible-pointer-types` on the candidate before any flash; its positive control is that it rejected the real file with the same message the device gave (no ESP toolchain needed), and it passes the corrected file.","guard_that_failed_safe":"The first KB CV run printed `KB CV SKIPPED alloc` instead of measuring: the eviction buffer s_thrash belongs to Experiment 20's bench and is not allocated at my call site, so a 'cold' mode would silently have been warm. The screen now owns its evict buffer. A check that refuses rather than mislabeling is the thing this campaign keeps needing.","next1":"Read condv16's field verdict on board 3 (engine_md5 7560bf21c5ed, src_md5 535c5116b09c, host 19/19 byte-exact, TYPECHECK_OK). If it loses, the un-stage-to-fp16 family closes at zero wins with both field and mechanism evidence; if it wins, that is a real +0.2..1 % and needs a cross-board confirmation plus a look at why the loop shape matters.","next2":"Fusion gate retry with the pool IDLE. Reconstructed run #404's state deterministically from git: fused kernel from c64efe4 plus the cold-path refund (ND_HOT dropped and noinline added on fw_scale/nd_fwht2/nd_fwht3s), proven bit-exact by the existing oracle and now host-clean again (19/19, token_delta 0, fidelity 5.341e-05, top1 10/10, checks rc=0); touches nd_quant.c only (md5 a800d1ea1896). Staged as .auto/vfuse + .auto/lane_cand2.sh and deliberately NOT launched, because #402 measured that concurrent console traffic moves the stall earlier: a 20-case gate attempt must run alone. If it stalls again the candidate goes to the owner as gate-blocked with a complete record.","next3":"Refresh the final evidence table once these two land: the campaign is at 5.1167 accepted with the fusion at +0.58 % held only by the harness, and every lever family now has a measured mechanism behind it. Remaining owner-gated routes: assertion-level RAM (#293, now with no speed buyer since phi residency closed in #407), 120 MHz (#331 vendor-blocked), the 0.2 % bar itself, and the firmware/console per-boot request ceiling that is blocking the fusion.","in_flight":"board 3 = condv16 (building, provenance asserted). board 1 = free after KB CV. board 2 = tap16's suite finishing for secondaries only (its verdict was final at the primary group). No shipping-image reading completed this iteration, so decode_tps and every secondary are the accepted fw3foldnb run's values carried forward."}}
{"run":416,"commit":"a6e7454","metric":5.0017,"metrics":{"boot_bench_tps":5.162,"device_output_exact":20,"device_token_delta":0,"ext_decode_tps":5.0423,"gen_tokens":99,"host_output_exact":19,"internal_free":12855,"logit_max_delta":0.00005341,"logit_top1_match":10,"min_case_tps":4.78,"prefill_tps":5.275,"psram_free":2052252,"think_tps":3.99},"status":"discard","description":"condv16 - cond_v un-staged from fp32 to fp16, converted at use in cond_rows: MEASURED, -2.24 %, REJECTED (decode 5.0017 vs accepted 5.1167; prefill 5.2750 = -2.22 %; min_case 4.78; all six primary cases' token counts identical to the accepted run, so a pure speed verdict). Host-proven bit-exact before any flash (19/19, token_delta 0, fidelity 5.341e-05 identical, top1 10/10, checks rc=0) and the pointer-type bug the device build caught was fixed and re-verified, so this is a clean speed verdict on a correct kernel. The two field points now bracket the mechanism: the vectorisable tap loop lost -1.89 % (run #414) and the single-accumulator conditioning reduction lost -2.24 %, i.e. the loop with less independent work to hide a store-to-load forward loses more - the opposite of what a delivery story predicts and exactly what this run's mechanism screen (KB CV: fp16 73.48/73.50 cycles per element vs fp32 9.09 warm, 18.97 cold, warm==cold so compute not delivery; nd_f16's inline body ends in memcpy(&f,&bits,4)) predicts. FAMILY CLOSED at zero wins: qkv taps -1.89 %, cond_v -2.24 %, engram taps priced ~+0.02 % and never built; run #2's fp32 staging (+99.9 %) is now confirmed from the only direction it had never been tested, with the reason numbered rather than asserted. Carried (not readings on this image): ext/think/boot-bench/internal_free/psram/device-exact/fidelity/top1 - the lane wedged in the tail exactly as the accepted image does, after the primary group decided the verdict. What this leaves open, and it is the largest in-rule unshipped number: condT (cond_v CHANNEL-MAJOR, a layout change not a dtype change) measured +0.294 % twice on board 2 and was vetoed by an unexplained device-only 19/20 divergence the host cannot see; KB CV shows delivery really is worth 52 % when the table is cold, so condT's mechanism is real and what it lacks is a device-side differential for the channel-major fill - the same class of guard whose absence cost run #333 its first build. That differential is queued, and it harvests over JTAG so it can run on board 1 (whose UART console leg is measurably unreliable: nodes re-created 01:36/02:22, no STATE answered). Running now on board 2 with the pool otherwise idle: the reconstructed run #404 fusion+cold-refund gate attempt, engine_md5 c461a8be9486 asserted from the applied tree, TYPECHECK_OK, host 19/19 - +0.58 % on seven readings with zero RAM cost, blocked only by the 20-case single-session device gate. Also logged: my pkill pattern matched its own shell command line and killed the invoking bash mid-command (fourth self-kill of this class), so a launch line never ran and a board idled for one cycle.","timestamp":1790219814190,"segment":1,"confidence":19.34201012292117,"asi":{"candidate":"condv16: cond_v's staged slot kept as fp16 halfwords, converted at use in cond_rows. Bit-exact by construction (nd_f16 of the stored halfword IS the staged value) and host-proven before flashing: 19/19 byte-exact, token_delta 0, fidelity 5.341e-05 identical, top1 10/10, checks rc=0. Halves cond_rows' swept table from 24 KB to 12 KB and puts 4 useful floats per 64 B line instead of 2.","field_confirms_mechanism":"Primary group: 5.0017 = -2.24 %, prefill 5.275 = -2.22 %, min_case 4.78, every case's token count identical (sampling5 5.060, timer60 5.050, status_heap 4.980, batch 5.090, heldout_timer45 5.050, route_translate 4.780) - a pure speed verdict. The lane then wedged in the tail as the accepted image does, so ext/think/boot-bench/RAM are carried from the accepted run; the verdict does not depend on them. Two field points now bracket the mechanism: the vectorisable tap loop lost -1.89 % and the single-accumulator cond loop lost -2.24 %, i.e. the loop with LESS independent work to hide a store-to-load forward loses MORE, which is the opposite of what a delivery story predicts and exactly what the nd_f16 dependency-chain explanation predicts.","family_closed":"The 'un-stage a staged table to fp16' family closes at zero wins across three candidates: qkv taps (-1.89 % measured), cond_v (-2.24 % measured), engram taps (~9 KB/token, priced ~+0.02 %, never built). Run #2's fp32 staging is confirmed from the only direction it had never been tested, and the reason is now numbered rather than asserted: nd_f16's inline body ends in memcpy(&f,&bits,4), a per-element store-then-load inside the dependency chain, worth roughly 60 cycles in a dependent position (KB CV: fp16 73.5 vs fp32 9.09 cycles/element, warm == cold).","the_thread_this_leaves":"condT - cond_v stored CHANNEL-MAJOR, the layout rather than dtype change - measured +0.294 % twice on board 2 and was rejected for an unexplained device-only divergence (19/20 byte-exact) that the host cannot see. KB CV says delivery IS available when the table is cold (residency worth 52 %, 9.09 to 18.97 cycles/element), so condT's mechanism is real and its +0.3 % is the largest in-rule unshipped speed candidate the campaign has. What is missing is not an idea but a test: a device-side differential for the channel-major fill, the same class of guard whose absence cost run #333 its first build. That differential is the next measurement, and unlike a request-path screen it harvests over the JTAG leg, so it can run on board 1.","next1":"Fusion + cold-refund gate attempt, running now on board 2 with the pool otherwise idle (engine_md5 c461a8be9486 asserted from the applied tree, TYPECHECK_OK, host 19/19 byte-exact, fidelity identical). This is the reconstructed run #404 state, +0.58 % on seven readings with zero RAM cost, blocked only by the 20-case single-session device gate. If it reaches 20 cases the campaign ships +0.58 %; if it stalls again it goes to the owner as gate-blocked with a complete record.","next2":"Build the device-side channel-major differential in kbench (strided vs channel-major reads of the real cond_v table, row-for-row, plus the 4+4 core split the host's rows_serial cannot produce) and run it on board 1, which can only do JTAG-harvested benches. If the fill is proven device-exact, condT gets re-measured as the +0.3 % candidate it appears to be; if the differential fails, condT's divergence is explained and the thread closes.","next3":"Refresh the final evidence table when the gate attempt lands: 5.1167 accepted, fusion held at +0.58 % by the harness alone, and the owner-gated routes unchanged (assertion-level RAM #293 with no speed buyer since phi residency closed at #407, 120 MHz vendor-blocked #331, the 0.2 % bar, and the firmware per-boot request ceiling #345 DEFECT 3 that is the single hardest blocker).","board1_blocker_named":"Board 1 stays off request-driven work on measured grounds, not preference: its USB-UART console leg has been re-created at 01:36 and 02:22 and answered no STATE, while boards 2/3 nodes are unchanged since 00:22 and answer normally. Its next job is therefore the JTAG-harvested kbench differential, deliberately held until the gate attempt finishes, because #402 measured that concurrent console/USB traffic moves the stall earlier and a 20-case gate must not share the hub.","own_bug":"Fourth instance of this ledger's self-kill class: `pkill -f \"lane_cand.sh 3\"` matched the invoking shell's own command line and killed it mid-command, so the fusion launch line never ran and the board sat idle for one cycle. The bracketed-pattern form ([l]ane_cand) is the documented fix; verified afterwards that the target session was actually gone and no lane processes remained before relaunching."}}
