{"run":292,"commit":"cce5715","metric":4.99,"metrics":{"boot_bench_tps":5.03,"device_output_exact":14,"device_token_delta":0,"ext_decode_tps":4.9057,"gen_tokens":99,"host_output_exact":13,"internal_free":14191,"logit_max_delta":0.00005341,"logit_top1_match":10,"min_case_tps":4.76,"prefill_tps":5.2633,"psram_free":2052252,"think_tps":3.91},"status":"discard","description":"Skip the exactly-zero exponential in the ATTENTION softmax pairs (the 48.5 % of pairs whose running maximum is one of the two positions): MEASURED, REJECTED, reverted. This was the candidate banked and priced last cycle off the real 49,152-pair capture, and the numerics were proven before spending any board time - bit-differential against the shipped expression over the entire real fixture (98,304 elements, 23,834 of them carrying an exact zero) plus dense sweeps and non-finite/signed-zero/clamp edges = 357,792 elements, 0 bit mismatches, with nd_expf(+-0.0f) == 1.0f asserted as a precondition; host gates green (13/13 byte-exact, token_delta 0, fidelity 5.341e-05 identical to control, top1 10/10). So the arithmetic was never the issue. The device result is a REGRESSION: canonical board 4.9900 against the accepted 5.0117 (-0.43 %), with every monitor moving together - extended 4.9057 (-0.47 %), prefill 5.2633 (-0.44 %), think 3.91, min_case 4.76, boot bench 5.030 vs 5.057 (-0.53 %) - and internal_free 15,215 -> 14,191, i.e. it also cost 1,024 B of internal RAM because the branch made the compiler re-allocate the block's live set. That is precisely the risk recorded in the banked entry and measured in runs #230-231, where a guard placed around nd_expf_pair cost -2.10 %: the branch destroys the interleaving that Experiment 12's +19.96 % kernel comes from, and this loop is the worst case in the tree for a badly-predicted branch - 48.5 % hits / 51.5 % misses is close to maximally unpredictable. The contrast with run #291 is the finding worth keeping: the IDENTICAL trick won +0.200 % in Sinkhorn, because there the guard sits in a tiny 4x4 loop where the exp chain is the only thing happening, while here the guard is inserted into the hottest, most carefully-scheduled straight-line block in the firmware, where the pair call has to remain the only statement in that block for its schedule to survive. Priced at +17 % of the phase's exp work (~+0.6 %), delivered -0.43 %: the guard cost roughly twice the entire prize. Closed on measurement - do not retry a skip/guard inside the attention exp block; any further attention-exp work has to remove the call without adding a control-flow dependency.","timestamp":1790062202551,"segment":2,"confidence":null,"asi":{"boards":"canonical board 4.9900 vs the accepted 5.0117 on the same board and configuration; every secondary moved the wrong way together, so this is a code effect not board drift","branch_density":"48.5 percent hits, 51.5 percent misses - a badly-predicted branch in the hottest loop, unlike Sinkhorn's tiny loop where the same trick won","hypothesis":"48.5 pct of attention softmax pairs carry one exactly-zero argument (measured on the 49,152-pair real capture), so contributing 1.0f for it and one scalar nd_expf should beat the 198.04-cycle pair call on nearly half the pairs","internal_free_cost_bytes":1024,"measured_delta_pct":-0.43,"next_action_hint":"attention exp path is closed for guard/skip levers by two independent measurements; the pair call must stay the only statement in that block for its schedule to survive","predicted_pct":0.6,"prize_vs_reality":"fixture priced +17 pct of the phase's exp work (~+0.6 pct end to end); delivered -0.43 pct, i.e. the guard cost about 2x the entire prize","realisation":"negative - the second independent confirmation of runs #230-231 (-2.10 pct), which said a guard placed around nd_expf_pair destroys the interleaving that Experiment 12's +19.96 pct came from","verified_before_building":"bit-exact on the whole real fixture (98,304 elements, 23,834 zero-carrying pairs) and 357,792 elements with non-finite edges, 0 mismatches - numerics were never the problem; scheduling was"}}
{"run":293,"commit":"7c331af","metric":5.01,"metrics":{"boot_bench_tps":5.056,"device_output_exact":14,"device_token_delta":0,"ext_decode_tps":4.9286,"gen_tokens":99,"host_output_exact":13,"internal_free":23463,"logit_max_delta":0.00005341,"logit_top1_match":10,"min_case_tps":4.78,"prefill_tps":5.285,"psram_free":2052252,"think_tps":3.93},"status":"discard","description":"Build-config candidate: IDF assertion level 2 -> 0 (ASSERTIONS_DISABLE), the family that produced this campaign's two largest non-code wins (cache line #238, tick rate #240). MEASURED on three boards plus a canonical confirmation, and NOT SHIPPED. The speed effect is noise: canonical 5.0100 against the accepted 5.0117 (-0.03 %, inside the measured 0.071 % spread of three byte-identical images), with the batch's board 2 reading +0.16 % - one board under the bar is not a result. The finding is RAM, and it is large and reproducible: internal_free 15,215 -> 23,463 (+8,248 B, +54 %) on two boards and confirmed by the firmware's own STATE line at runtime. Mechanism: assert strings and their check code leave .flash.text/.rodata, and IRAM/rodata text is subtracted from the internal heap - the same coupling run #292 exposed from the other side (a candidate that grew IRAM cost 1,024 B of heap). Quality was never at risk: 14/14 device byte-exact, token_delta 0, prefill/extended/think/min_case/boot-bench all flat; host-side quality is unchanged by construction because only esp32/sdkconfig.defaults differs from the accepted tree (engine/ and esp32/ verified byte-identical). Not kept for two independent reasons: the primary metric is unchanged, which the campaign's keep rule settles; and disabling assertions removes runtime failure DIAGNOSTICS from a product firmware, so a real defect would surface as a silent reboot instead of an abort with a reason - that tradeoff belongs to the owner. ASSERTIONS_SILENT (level 1) was measured as the safer middle: it keeps every check and all failure detection, drops only the message strings, and still returns 6,200 B at neutral speed. Value of the null: the ledger repeatedly calls internal_free the binding constraint, and four rejected ideas were priced against 15,215 B - the 4-row CQ2 LUT residency (10.4 KB, kbench +3.8 %), the 4-bit per-core codebook tables (16 KB), the handwritten 4-bit phi kernel (~1.5 KB, +0.5 % ceiling) and the 2x4 KiB GDMA pair. If the owner accepts either level, those re-price, and the LUT residency is the only one with a measured win above 1 %. Recorded in .auto/ideas.md; config reverted, tree clean.","timestamp":1790064545702,"segment":2,"confidence":null,"asi":{"batch":"20260922T074752.510477Z, board1 pristine control read exactly 5.0117 so the batch is trustworthy; level 1 silent on board 3 read 5.0100 with internal_free 21,415; level 0 disable on board 2 read 5.0200 with internal_free 23,463","candidate":"CONFIG_COMPILER_OPTIMIZATION_ASSERTIONS_DISABLE=y (IDF assertion level 2 -> 0; the repo sets OPTIMIZATION_PERF but never the assertion level, so it has shipped at the IDF default)","decisive_number":"internal_free 15,215 -> 23,463 B (+8,248, +54%), reproduced on two boards and by the firmware's own STATE line (free_internal_bytes 22571 at runtime)","discarded_for":"primary metric unchanged (keep rule says discard if unchanged), and removing runtime failure diagnostics from a product firmware is the owner's decision, not the campaign's. ASSERTIONS_SILENT is the strictly safer middle: keeps every check, drops only the messages, still returns 6,200 B.","hypothesis":"assertions are at IDF's default level 2, so every hot FreeRTOS/IDF call - including the ~96 semaphore handshakes per decode token - carries assert/configASSERT branches; removing them should speed the token and, because assert strings and check code leave .flash.text/.rodata (which is subtracted from the internal heap), should also return internal RAM","measured_canonical":"decode 5.0100 vs the accepted 5.0117 (-0.03 pct, inside the 0.071 pct three-identical-image spread = neutral), extended 4.9286, prefill 5.285, think 3.93, min_case 4.78, boot bench 5.056, device byte-exact 14/14, token_delta 0","next_action_hint":"if the owner accepts level 0 or 1, re-price in this order: 4-row CQ2 LUT residency (10.4 KB, kbench +3.8 pct), 4-bit per-core codebook tables (16 KB), handwritten 4-bit phi kernel (~1.5 KB, ceiling +0.5 pct); all were rejected purely for lack of internal RAM","offshots":"the batch board read +0.16 pct while the canonical board read -0.03 pct on byte-identical config, so one board's sub-bar delta is not a result - only the RAM figure replicated","pkill_trap":"cost a wasted launch: pkill -f 'needle-api --serial' matched the invoking bash process's own command line and killed the shell before the detached measure.sh started; use a bracketed pattern like '[n]eedle-api' instead","quality_note":"host_output_exact / logit_max_delta / logit_top1_match are the accepted values because this candidate changes only esp32/sdkconfig.defaults - the engine source was verified byte-identical to the accepted commit, and the worker that ran the identical host tree measured 13/13 byte-exact","validity_note":"the canonical run also carried un-reverted host-screen instrumentation in engine/src/nd_model.c, but it is entirely #ifdef ND_SINK_STATS and the esp32 build never defines it, which is why internal_free matched the batch worker to the byte; file reverted and the tree verified byte-identical to the accepted 4aeb436 for engine/ and esp32/"}}
{"run":294,"commit":"9b78c31","metric":5.0117,"metrics":{"boot_bench_tps":5.057,"device_output_exact":14,"device_token_delta":0,"ext_decode_tps":4.9286,"gen_tokens":99,"host_output_exact":13,"internal_free":15215,"logit_max_delta":0.00005341,"logit_top1_match":10,"min_case_tps":4.79,"prefill_tps":5.2867,"psram_free":2052252,"think_tps":3.93},"status":"discard","description":"Priced the last above-bar candidate before writing any assembly, and the price killed it. The phi (mHC 4-bit generic path) handwritten-kernel idea carried two contradictory claims from run #141: an analytic -12 % of the phase from instruction counts, versus a diagnosis of PSRAM line-fill latency - and the ledger's neutral generic-path row blocking is what latency-bound code does when you hand it fewer issue slots. Settled it with a device microbenchmark that changes only which backing store each operand lives in, calling the shipping nd_cq_gemv_rows on real needle3.cact bytes with a real nd_cq_prepare activation: perfect residency (weights in internal RAM) buys +9.3 % of the phase, not 12 %, and the kernel cannot move the weights anyway. The same measurement then exposed something more valuable than either candidate: the field attribution is 30 cycles/weight against the warm kernel's measured 6.98, a 4.3x gap that operand placement (9.3 %) and scheduling (same kernel both ways) cannot account for, so phi's real cost is cold line fill on a 37 KB/token working set that will not fit the 32 KB data cache. That retires the assembly as the wrong instrument - the addressable share is delivery, and delivery is residency, which needs ~37 KB against 15,215 B free - so phi stays exactly as it is and the re-price, if the owner ever accepts the assertion-level change from run #293, should be a residency experiment aimed at the 4.3x gap. All four modes produced bit-identical rows (chk_mismatch=0), so the comparison measured the memory system and not four different computations. Bench source and raw device output kept in .auto/exp20/; the tree is byte-identical to the accepted runtime. Harness cost of the cycle: three rebuilds lost to NEEDLE_KBENCH=ON being unbuildable as committed (the bench includes esp_async_memcpy.h/esp_cache.h while the CMake block adds the component with target_link_libraries, which emits a bare -lesp_hw_support and fails to link - an IDF component dependency belongs in REQUIRES, not a link flag), and the option is broken from both sides, so I left it as accepted rather than half-fixing a dev tool mid-campaign and recorded the real fix instead. Canonical run restores the shipping image after the bench flash and reproduces the accepted signature to the digit; a canonical cycle is ~200 s, not the 10-13 min in the docs, because prefix priming is 143 tokens in 24 s.","timestamp":1790068082349,"segment":2,"confidence":null,"asi":{"asm_decision":"do NOT write the phi assembly: it cannot move the weights, so its ceiling is the 9.3 pct delivery bound, while the addressable share indicated by the 4.3x gap is delivery itself. If the owner ever accepts the assertion-level change (run #293, +8,248 B internal heap), the phi re-price should be a RESIDENCY experiment over the real 24-row x 3-tensor sweep, targeting the 4.3x gap rather than 12 pct.","bench_harness_facts":"kbench prints KBENCH_DONE within seconds of boot (it hooks before the caches warm), so the harvest is: open the console with DTR asserted FIRST, then reset with `python3 -m esptool --chip esp32s3 -p /dev/ttyACM0 run` and read ~60 s; opening the port after boot captures nothing. And `pkill -f 'needle-api --serial'` matched the invoking shell's own command line and killed a detached measure.sh - use a bracketed pattern.","candidate":"none shipped this iteration - the experiment was a measurement designed to price the last open candidate (handwritten TIE728 kernel for the mHC phi 4-bit GEMV) before spending ~150 lines of assembly plus a rule-#1 differential test on it","finding_delivery_bound":"four modes differing only in operand backing store (device, board 1, fresh -B build_kb -DNEEDLE_KBENCH=ON, CCOUNT 24000, min of 5 rounds rotating over 8 layer slices, results consumed through a float-register barrier, chk_mismatch=0 so all modes bit-identical): shipping path 85,844 cyc for 12,288 weights = 6.98 cyc/weight; weights in internal RAM 77,869 = 6.34. So perfect residency buys only +9.3 pct of the phase, and three placements tied at the same cycle count - the signature of a warm 32 KB data cache absorbing both operands at this working-set size.","finding_reconciliation_gap":"the field attribution (run #141: 9.2 ms of GEMVs for 24 rows x 3072 = 73,728 weights) is 30 cycles/weight, 4.3x the warm-kernel 6.98. Operand placement explains 9.3 pct of it and scheduling cannot explain any of it (same kernel both ways), so the residual is cold PSRAM line fill on the real 37 KB/token phi working set that does not fit the 32 KB cache - #141's diagnosis, now with numbers, and it also explains why C row blocking was neutral (it reuses xh, never the stall).","harness_cost":"three rebuilds lost to NEEDLE_KBENCH=ON being unbuildable as committed (bench includes esp_async_memcpy.h/esp_cache.h; the CMake block adds esp_hw_support with target_link_libraries, which emits a bare -lesp_hw_support and fails to link - an IDF component dependency belongs in REQUIRES, not a link flag). Option is broken from both sides; neither path affects any measured image and the tree was left exactly as accepted rather than half-fixed.","hypothesis":"run #141 priced the phi asm at -12 pct of the phase from instruction counts while the same run diagnosed PSRAM line-fill latency, and the ledger separately records generic-path row blocking as neutral; only one of those can be true, and the difference decides the last above-bar candidate","next_action_hint":"phi stays as it is. Remaining above-bar routes are both owner decisions, not code: the assertion level (run #293, frees 8,248 B and would re-price the residency family) and 120 MHz octal memory (+3.51 pct, forbidden by the documented-maxima rule).","verification_repeat":"the board had been flashed with the bench image, so this canonical run restored the shipping image and reproduced the accepted signature to the digit - 5.0117 decode / 4.9286 extended / 3.93 think / 5.2867 prefill / 4.79 min_case / 5.057 boot bench / internal_free 15,215 / 14-14 device + 13-13 host byte-exact / token_delta 0 / checks green, app_md5 d1cf78f72161 with build_s=20 flash_s=6 and ND_KBENCH absent from compile_commands.json. Also learned: a canonical cycle is ~200 s, not 10-13 min - prefix priming is 143 tokens in 24 s because of the fp32 staging and the tier."}}
