{"run":643,"commit":"b73ed8d","metric":5.465,"metrics":{"boot_bench_tps":5.54,"device_output_exact":6,"device_token_delta":0,"ext_decode_tps":0,"gen_tokens":99,"host_output_exact":19,"internal_free":6191,"logit_max_delta":0.00005341,"logit_top1_match":10,"min_case_tps":5.26,"prefill_tps":5.74,"psram_free":2052252,"think_tps":0},"status":"keep","description":"KV staging noinline helper (B1) reads 5.4650 on board 1 vs its own 5.4083 pin = +1.048%, device 6/6, token_delta 0, rc=0, heap 6191 (+512 B). The register-lifetime diagnosis was exactly right: giving the paired-row int8->float staging its own 32-byte noinline frame removes every per-iteration spill of the byte temporaries and the win is over 1% on the shippable base — largest single-lever gain since the pairing family. ext/think are 0.0 sentinels (primary-only screen, not measured). Preserved as nd_model.c.kvst-b1; transfer to the seed-era composition running on board 2.","timestamp":1790300868334,"segment":1,"confidence":11.334019204389579,"asi":{"hypothesis":"#B1: extract the paired-row KV byte->float staging into one ND_HOT noinline helper with its own tiny frame - the inline form spilled eight signed-byte temporaries per iteration in the 0x580-frame callback (object audit: stores+reloads +0x464..470); values untouched (same packed-word loads, same (float)(int8_t) per byte)","board":"1, pin #639 5.4083 (bundle5 + composed attention + late RX ring), engine 5a9b75f4c948","objdump":"helper is 120 B with a 32-byte frame and zero loop-body stack traffic (mentor-verified); caller's loops became two calls","heap":"6191 (+512 B vs pin)","monitors":"prefill 5.74 vs 5.687, min_case 5.26 vs 5.20 - every primary case up; ext/think = 0.0 sentinels: primary-only screen, NOT measured on this tree (mentor forbids carried values)","next":"B2 transfer of the helper to seed-era composition running (91e79eeeb304); then B1 bundle5+ONLY-ring full gate; B3 sink-aware cursor","source":"preserved/b1-recipeB/nd_model.c.kvst-b1 (file md5 31395c672ab8), host checks green on-tree"}}
{"run":644,"commit":"b73ed8d","metric":5.7367,"metrics":{"boot_bench_tps":5.812,"device_output_exact":6,"device_token_delta":0,"ext_decode_tps":0,"gen_tokens":99,"host_output_exact":19,"internal_free":4575,"logit_max_delta":0.00005341,"logit_top1_match":10,"min_case_tps":5.5,"prefill_tps":6.05,"psram_free":2052252,"think_tps":0},"status":"discard","description":"Nonpositive-domain exp-pair specialization (B2) reads 5.7367 vs the composition's 5.7467 = -0.174%, 6/6, delta 0, rc=0 — bit-exact (25.6M-case guard vs the shipped helper, 0 mismatches) but slower: the domain guard plus lost fold-ability costs more than the two sign selects it removes. RETIRED as a form; the guard's first run also caught a sign error of mine (+0.5 vs -0.5 at the subnormal edge, 11.25M mismatches) which is exactly what the host guard is for. ext/think 0.0 = primary-only screen.","timestamp":1790300944502,"segment":1,"confidence":11.334019204389579,"asi":{"hypothesis":"#B2: attention-only nd_expf_pair specialization for the online-softmax nonpositive domain - drop the per-argument sign selection (provably always -0.5f offset for z <= 0; +/-0 truncate identically), keep constants/Horner/scaling, out-of-domain falls back to the shipped pair","bit_exact":"25,600,776 comparisons against the ACTUAL shipped nd_expf_pair via the real header (.auto/exp89/test_exppair_np.c): 0 mismatches, incl. signed zero, -88 clamp neighbours, half-integer k transitions across the exponent range, inf/NaN - my first draft used +0.5f (sign reversed) and this guard caught it with 11.25M mismatches at the subnormal boundary","result":"-0.174 pct, every monitor flat-to-down (min_case 5.50 vs 5.51, heap 4575 vs 4823 -256 B) - GCC already folds what it can and the extra guard/tests cost more than the folded select; RETIRE this form (mentor confirmed), artifacts nd_model.c.npexp + nd_quant.h.npexp","board":"2, composition pin 5.7467, engine b580af16a62c","next":"b2 now runs the B1 staging-helper transfer (91e79eeeb304)"}}
{"run":645,"commit":"b73ed8d","metric":5.715,"metrics":{"boot_bench_tps":5.786,"device_output_exact":6,"device_token_delta":0,"ext_decode_tps":0,"gen_tokens":99,"host_output_exact":19,"internal_free":4063,"logit_max_delta":0.00005341,"logit_top1_match":10,"min_case_tps":5.47,"prefill_tps":6.025,"psram_free":2052252,"think_tps":0},"status":"discard","description":"Paired rescale exponentials (B3) reads 5.7150 vs the composition's 5.7467 = -0.552%, 6/6, delta 0, rc=0, heap 4063. Both heads raising their max at the same position pair is rare, so the AND-dispatch taxes every pair while the interleaved Horner saves almost nothing — the inverse of B4W, where the paired body is always hot. Retired; pairing newly adjacent scalar work is only worth building when the co-occurrence is the common case. ext/think 0.0 = primary-only.","timestamp":1790300970361,"segment":1,"confidence":11.334019204389579,"asi":{"hypothesis":"#B3: pair the two heads' RESCALE exponentials with the existing exact nd_expf_pair - both deltas computed from the OLD maxima before any update, scalar path when only one head rescales, per-head arithmetic and exceptional paths untouched","bit_exact":"pair is bit-exact by its shipped construction (out-of-domain falls back to two scalar calls); host checks 19/19 byte-exact before flash; every head's denom multiply, selective sweeps and four-wide P.V kept exactly as the composition","result":"5.7150 vs pin 5.7467 = -0.552 pct, 6/6 delta 0 rc 0, heap 4063 (-760 B) - the rescale pair fires RARELY (both heads raising max with nonzero denom simultaneously) so the dispatch costs hit every position pair while the interleave saves almost nothing; four-wide pairing helped the always-executed P.V, this is the opposite case","board":"3, composition pin 5.7467, engine 18527a7a80c9","closed":"pairing newly-adjacent scalar work pays only when the pair is common - rescale-simultaneity is ~rare; form retired with object+timing evidence, artifact nd_model.c.rspair","next":"b3 takes the corrected sink-aware cursor next (slot equivalence exhaustive test first)"}}
{"run":646,"commit":"376c9ce","metric":5.8083,"metrics":{"boot_bench_tps":5.884,"device_output_exact":6,"device_token_delta":0,"ext_decode_tps":0,"gen_tokens":99,"host_output_exact":19,"internal_free":5087,"logit_max_delta":0.00005341,"logit_top1_match":10,"min_case_tps":5.58,"prefill_tps":6.1167,"psram_free":2052252,"think_tps":0},"status":"keep","description":"KV staging helper transfer to the seed-era composition (B2) reads 5.8083 vs its 5.7467 pin = +1.072%, 6/6, token_delta 0, rc=0, prefill 6.1167, min_case 5.58, heap 5087 — reproducing the B1 +1.048% on the other base. The noinline staging frame is a base-independent ~1% codegen lever. New discovery pin 5.8083 (campaign best device reading); preserved as nd_model.c.kvst-b2. ext/think 0.0 (primary-only; gate to follow per queue).","timestamp":1790301196566,"segment":1,"confidence":11.54526748971194,"asi":{"hypothesis":"transfer of the #643 noinline KV-staging helper to the seed-era composition (identical file md5 31395c672ab8 on an identical base) - does +1.048 pct on the shippable base reproduce at the 5.7467 pin","result":"+1.072 pct, every monitor up: prefill 6.1167 vs 6.06, min_case 5.58 vs 5.51; heap 5087 (-336 vs pin)","new_pin":"B2 (and B3, same tree) pin is now 5.8083 = composition + KV staging helper; source preserved nd_model.c.kvst-b2","board":"2, engine 91e79eeeb304","next":"per refreshed queue: noinline on the EXISTING pv_pair2 (keep ND_HOT/signature/width/math - it is currently inlined into attn_heads), host tests + one primary screen vs 5.8083; call overhead may lose but the allocator boundary is now evidence-backed","cross_base":"the helper wins on BOTH bases (+1.048 bundle5-side, +1.072 seed-side) - a base-independent codegen lever, consistent with the register-lifetime diagnosis"}}
{"run":647,"commit":"50d90a0","metric":5.2933,"metrics":{"boot_bench_tps":5.359,"device_output_exact":18,"device_token_delta":52,"ext_decode_tps":5.2085,"gen_tokens":99,"host_output_exact":19,"internal_free":6191,"logit_max_delta":0.00005341,"logit_top1_match":10,"min_case_tps":5.08,"prefill_tps":5.5933,"psram_free":2052252,"think_tps":4.19},"status":"keep","description":"Ring-only discriminator (bundle5 + late RX ring, engine byte-pure accepted): 18/20 device, token_delta 52, SAME two demo-timer goldens as every unaccepted image — while the same engine without the ring is 20/20. The frozen failures therefore have a device-state path (UART-driver ISR / driver-backed stdin alone flips them); my earlier 'not arithmetic/timer-state' attribution is retracted and replaced by this measurement. Ring also costs -0.188% primary (5.2933) — it buys lossless input (wedge fix), not speed. This isolates the quality blocker as far as measurement allows: the two goldens are interrupt/timing-state sensitive, flipping under the seed-era engine AND under a pure transport change. ext 5.2085, think 4.19, all 20 cases completed.","timestamp":1790301392449,"segment":1,"confidence":11.54526748971194,"asi":{"discriminating_result":"accepted bundle5 + ONLY the late RX ring (engine = pure accepted 0c1a6272cd01, main.c transport diff only) reads 18/20 with token_delta 52 on EXACTLY the two demo-timer goldens - the same pair every unaccepted image showed. The accepted tree with the same engine and no ring is 20/20. So the frozen failures DO have a device-state path: a UART-driver ISR + driver-backed stdin alone flips them.","attribution_retraction":"my earlier 'three proofs it is NOT arithmetic' framing is RETRACTED per mentor: host-vs-device goldens differ and #633 confounded ring+attention. This run replaces argument with a discriminating measurement.","cost":"ring also costs -0.188 pct primary (5.2933 vs 5.3033), ext -0.35 pct, think -0.24 pct - polled-VFS reads were slightly faster for the benchmark's read pattern; the ring buys lossless input (the 17-case wedge fix), not speed","meaning":"the two goldens are timing/interrupt-state sensitive, flipping under BOTH the seed-era engine and a pure transport change; any fast image plus OR minus the ring reproduces the pair. This is the unresolved quality blocker isolated as far as measurement allows - owner disposition, not another gate.","board":"1, engine d6c8c1039f67 (= bundle5 engine + ring main.c/CMake), all 20 cases completed","hypothesis":"bundle5 + ONLY the late RX ring: separate transport/boot/input effects from attention changes for the two frozen failures (mentor-specified discriminating experiment)"}}
{"run":648,"commit":"50d90a0","metric":5.745,"metrics":{"boot_bench_tps":5.82,"device_output_exact":6,"device_token_delta":0,"ext_decode_tps":0,"gen_tokens":99,"host_output_exact":19,"internal_free":4823,"logit_max_delta":0.00005341,"logit_top1_match":10,"min_case_tps":5.5,"prefill_tps":6.0583,"psram_free":2052252,"think_tps":0},"status":"discard","description":"Sink-aware slot cursor (B3, corrected per run #42's failure: exhaustively host-verified equivalent, 0 mismatches over small windows and real geometry through multiple wraps) reads 5.7450 vs the composition's 5.7467 = -0.030% (neutral), 6/6, delta 0, heap identical. The two per-pair remu.s disappear from the object and nothing changes: the slot remainders were never the stall. Form retired on measurement; cursor rewrites of cheap integer math are not a lever. ext/think 0.0 (primary-only).","timestamp":1790301412513,"segment":1,"confidence":11.54526748971194,"asi":{"hypothesis":"#B3 sink-aware cursor: seed one kv_slot per run, replace the two per-position-pair remainders with the exact step rule next = (s+1 == window) ? n_sink : s+1 (exhaustive host equivalence: windows 8..512, all n_sink, bases 0..2w+3, counts past two wraps - 0 mismatches; tail uses the cursor invariant)","result":"-0.030 pct = one quantum of noise, heap unchanged - the remu.s pairs ARE removed (object) but the integer divide simply was not the stall at this cadence (two per position pair against a ~1000-cycle body)","board":"3, composition pin 5.7467, engine cdb6ba4ea983","lesson":"run #42's rejection and this null are both consistent: the slot remainders are free; cursor-form rewrites of cheap integer math are not a lever - spend effort where the object showed SPILLS, not where it showed a remu","next":"b3 takes a queue reserve: compact specialisation of the paired callback if mentor's next refresh asks, else hold on the new pin tree"}}
{"run":649,"commit":"50d90a0","metric":5.7983,"metrics":{"boot_bench_tps":5.875,"device_output_exact":6,"device_token_delta":0,"ext_decode_tps":0,"gen_tokens":99,"host_output_exact":19,"internal_free":5087,"logit_max_delta":0.00005341,"logit_top1_match":10,"min_case_tps":5.56,"prefill_tps":6.11,"psram_free":2052252,"think_tps":0},"status":"discard","description":"noinline on pv_pair2 (B2 follow-up) reads 5.7983 vs the 5.8083 pin = -0.173%, 6/6, delta 0, rc=0 — the call overhead per position pair exceeds the allocator-boundary benefit for this body. The staging-frame win is body-specific, not a general noinline policy. Retired on measurement; ext/think 0.0 (primary-only). New pin remains 5.8083 (composition + KV staging helper), whose cross-board full gate is now running on board 3.","timestamp":1790301466956,"segment":1,"confidence":11.54526748971194,"asi":{"hypothesis":"explicit noinline on the EXISTING pv_pair2 (GCC heuristically inlines it into the 0x580-frame callback; math/width/branches/signature untouched) - ask whether the staging-helper allocator-boundary win extends to the P.V body","result":"5.7983 vs 5.8083 = -0.173 pct, 6/6 delta 0 rc 0, heap unchanged - the 13-argument call per position pair costs more than the fresh frame saves; pv_pair2 is also smaller/hotter than the staging loops were, so there is less spill to win back","boundary_class":"the noinline lever pays where big spill-heavy bodies share one giant frame (staging: +1.07 pct both bases) and loses where the body is small and the call is frequent - allocator-boundary wins are per-body, not per-function","board":"2, pin 5.8083 (kvst-b2 tree), engine 8fc73f45469a","next":"b3 runs the cross-board full gate of the 5.8083 pin (allowance used); b2 reserve next: selective-sweep noinline (same spill class, rarer trigger) or mentor refresh"}}
{"run":650,"commit":"50d90a0","metric":5.805,"metrics":{"boot_bench_tps":5.882,"device_output_exact":18,"device_token_delta":52,"ext_decode_tps":5.7331,"gen_tokens":99,"host_output_exact":19,"internal_free":5087,"logit_max_delta":0.00005341,"logit_top1_match":10,"min_case_tps":5.55,"prefill_tps":6.1183,"psram_free":2052252,"think_tps":4.51},"status":"keep","description":"Staging-helper composition FULL gate on board 3 (cross-board, allowance used): decode 5.8050 = +1.010% over this board's 5.7467 pin (b2 read +1.072% → reproduced), EXTENDED 5.7331 (best measured on this pin class, +1.21% over the composition's own gate), THINK 4.51, boot bench 170 ms/token, min_case 5.55, heap 5087. Device 18/20 rc=1 with the SAME two demo-timer goldens (delta 52), all 20 cases complete, no new failure. Cross-board confirmation of the campaign's leading proposal at 5.805-5.8083.","timestamp":1790301807381,"segment":1,"confidence":11.54526748971194,"asi":{"breadth":"ext 5.7331 (+1.21 pct over the composition gate's own 5.6646 - the staging win transfers to the held-out set too), think 4.51, boot 170 ms/token, min_case 5.55, heap 5087","confirmed":"+1.010 pct on b3 vs its own 5.7467 pin (5.805), matching b2's +1.072 (5.8083) - cross-board reproduced","failure_set":"same two demo-timer goldens, delta 52, all 20 cases complete; no new failure","hypothesis":"cross-board FULL 20-case gate of the new pin (composition + KV staging helper) on board 3 - ext/think/20-case never measured on this tree (documented allowance, reason recorded)","new_state":"the staging-helper composition is the acceptance proposal: 5.805/5.8083 on two boards at full gate, ext 5.7331, think 4.51, boot 170 ms; b1 shippable-base gate in flight (5.4650 screen)","board":"3, engine 91e79eeeb304"}}
{"run":651,"commit":"50d90a0","metric":5.465,"metrics":{"boot_bench_tps":5.556,"device_output_exact":18,"device_token_delta":52,"ext_decode_tps":5.3992,"gen_tokens":99,"host_output_exact":19,"internal_free":6191,"logit_max_delta":0.00005341,"logit_top1_match":10,"min_case_tps":5.26,"prefill_tps":5.7467,"psram_free":2052252,"think_tps":4.3},"status":"keep","description":"SHIPPABLE-BASE FULL GATE (bundle5 + composed attention + staging helper + RX ring): decode 5.4650 = +3.048% over the accepted 5.3033 pin, EXTENDED 5.3992 (+3.29%), think 4.30, min_case 5.26, boot 180 ms/token, heap 6191, all 20 cases complete. Device 18/20 delta 52 — the same two demo-timer goldens that the ring ALONE flips on the byte-pure accepted engine (#647), so the pair is transport/interrupt-state sensitive, not attention arithmetic. The shippable-code path now carries +3.05% with full breadth measured on-tree; remaining gate is the owner's disposition of the two timing-sensitive goldens.","timestamp":1790301960468,"segment":1,"confidence":11.54526748971194,"asi":{"breadth":"ext 5.3992 (+3.29 pct over bundle5's 5.2269), think 4.30 (+2.4 pct), min_case 5.26, boot 180 ms/token, heap 6191","confirmed":"primary 5.4650 reproduced exactly at full gate (screen 5.4650); vs accepted pin 5.3033 = +3.048 pct on ACCEPTED quant/asm/scheduler code","failure_set":"18/20 delta 52 = the two demo-timer goldens only - and #647 showed the RING ALONE flips them on this exact engine, so this tree's pair is the transport-sensitivity signature, not attention arithmetic","hypothesis":"full 20-case breadth gate of the SHIPPABLE tree = bundle5 + composed attention + KV staging helper + late RX ring (allowance: screen consumed the signature; ext/think/20-case never run on this tree)","packet":"shippable acceptance line now: +3.048 pct primary, +3.29 pct extended, capture owed on THIS tree, frozen pair disposition is the only gate - and the ring-only discriminator (#647) localises that gate to input/ISR state, not to the engine","board":"1, engine 5a9b75f4c948"}}
{"run":652,"commit":"50d90a0","metric":5.8033,"metrics":{"boot_bench_tps":5.878,"device_output_exact":6,"device_token_delta":0,"ext_decode_tps":0,"gen_tokens":99,"host_output_exact":19,"internal_free":6111,"logit_max_delta":0.00005341,"logit_top1_match":10,"min_case_tps":5.57,"prefill_tps":6.1167,"psram_free":2052252,"think_tps":0},"status":"discard","description":"Cold-refund extraction (B2): odd-head fallback moved verbatim to a noinline cold function (host caught the missing declaration pre-flash). Reads 5.8033 vs 5.8083 pin = -0.086% — neutral/negative — while internal_free rose 5087→6111 confirming the frame shrank. Hot-loop schedule unchanged by a smaller frame: the surrounding-code-size theory is retired, third cold-null of the class. ext/think 0.0 (primary-only).","timestamp":1790302021125,"segment":1,"confidence":11.54526748971194,"asi":{"hypothesis":"#B2 reserve: move the odd-head-range fallback (dead code on every shipping geometry) VERBATIM out of the hot attn_heads callback into a noinline cold callee - one shared body, nothing transcribed twice - to shrink the 0x580-frame register allocation","result":"5.8033 vs 5.8083 = -0.086 pct (sub-quantum neutral-to-negative) at +1,024 B more internal_free (frame shrink confirmed). Mentor's warning validated: code size / frame size is not itself the metric; the hot loop's schedule did not improve","class":"third cold-code refund null (#579/#582 live ranges, this frame shrink): the hot loop's measured wins come from WHAT it computes and how data flows (pairing, staging, width), not from shrinking what surrounds it","board":"2, pin 5.8083, engine 08063ae32cf8, host caught the first extraction error (undeclared i) before any flash","next":"b2/b1 take the next queue reserves; acceptance packet (5.805-5.8083 discovery + 5.4650 shippable, capture green on b3) is complete pending owner disposition of the two timing-sensitive goldens"}}
{"run":653,"commit":"50d90a0","metric":5.465,"metrics":{"boot_bench_tps":5.551,"device_output_exact":6,"device_token_delta":0,"ext_decode_tps":0,"gen_tokens":99,"host_output_exact":19,"internal_free":5679,"logit_max_delta":0.00005341,"logit_top1_match":10,"min_case_tps":5.26,"prefill_tps":5.74,"psram_free":2052252,"think_tps":0},"status":"discard","description":"kv_stage_pair 4-word unroll (B1) reads 5.4650 = identical to the un-unrolled tree's reading on the same board = exactly zero, with -512 B heap and prefill 5.74 vs 5.7467. Staging width is at its floor; DISCARDED. Completes the width-curve readout: P.V saturated at 4, QK saturated at 8 (DOT12W -0.29%), staging 0.00, sweeps -0.11 — iteration-shape levers are closed on every attention loop.","timestamp":1790302625876,"segment":1,"confidence":11.54526748971194,"asi":{"hypothesis":"#B1 reserve: kv_stage_pair processes four packed words per iteration instead of one (per-element assignment order untouched inside each word, words independent; shipping nwords 12 = 3x4 exact with a generic tail)","result":"5.4650 = byte-identical to the same board's full-gate reading of the un-unrolled tree = exactly zero at the metric quantum; prefill -0.12 pct and -512 B heap -> strictly worse","class":"width curve now measured on four loops: P.V update saturated at 4 cells (#624), QK dot saturated at 8 columns (this window, -0.29), KV staging already at its floor at width 1 (this, 0.00), rescale sweeps null-to-negative at 4 (-0.11). GCC already extracts what these scalar loops can pipeline; the wins in this codebase came from REMOVING memory traffic (pairing, staging frames), not from widening scalar bodies","board":"1, shippable base (engine 0bf75052dd1e), host 19/19 before flash","next":"width axis CLOSED everywhere; remaining class is what-loops-share (pairing was that) - next candidates must fuse or reorder WORK, not iteration shape"}}
