{"run":177,"commit":"c4d4b6b","metric":4.8917,"metrics":{"prefill_tps":5.2183,"ext_decode_tps":4.81,"think_tps":3.87,"boot_bench_tps":4.984,"min_case_tps":4.67,"gen_tokens":99,"internal_free":15759,"psram_free":2052252,"device_output_exact":14,"device_token_delta":0,"logit_max_delta":0.00005341,"logit_top1_match":10,"host_output_exact":13},"status":"keep","description":"Three-board batch confirmation of the split sampler filter (no new code this cycle). Control board rebuilt from the pre-split nd_sample.c read 4.8817 - exactly the previously accepted value, so the batch is trustworthy - while both candidate boards read 4.8917 with extended 4.81 (control 4.7986) and min_case 4.67 (control 4.66), byte-exact 14/14 on all three, boot bench 4.983/4.983/4.984 and think 3.87 identical on every board as they must be for a change that only touches constrained sampling. Canonical run reproduces 4.8917 (+100.5% over baseline). Split family re-closed at a lower level: sample is now ~8.1 ms of the request token, 5.7 ms of it the two-core subset projection at its floor, leaving under 0.8% of the token in sampler arithmetic.","timestamp":1789999455533,"segment":1,"confidence":33.42428376534802,"asi":{"hypothesis":"A ~0.2% primary delta needs the batch protocol: one control image plus two identical candidates, control validated against the last logged value.","result":"Delta reproduced exactly on two independent boards (+0.204% decode, +0.24% extended, +1 tick min_case) against a control that hit 4.8817 to the digit. That is 4 sigma on the measured 0.05% floor plus an independent-board reproduction, so the win is real.","state":"New accepted runtime 4.8917 decode (+100.5%), extended 4.81, think 3.87, prefill 5.2183, boot 201 ms/token; 14 device + 13 host byte-exact; internal_free 15759.","next":"The bench-invisible part of the request path has now yielded two wins (#147 first-byte table, #176 split filter) while every bench-visible phase sits at a floor, so that remains the place to look. What is left inside sample is under 0.8% of the token; the per-token emit measured free (#151). Docs to refresh: accepted control value and the sampler share."}}
{"run":178,"commit":"c4d4b6b","metric":4.8917,"metrics":{"prefill_tps":5.2167,"ext_decode_tps":4.81,"think_tps":3.87,"boot_bench_tps":4.984,"min_case_tps":4.67,"gen_tokens":99,"internal_free":15759,"psram_free":2052252,"device_output_exact":14,"device_token_delta":0,"logit_max_delta":0.00005341,"logit_top1_match":10,"host_output_exact":13},"status":"keep","description":"Verification cycle on the new accepted runtime: 4.8917 decode / 4.81 extended / 3.87 think / 5.2167 prefill / 4.67 min case, 14/14 device + 13/13 host byte-exact, fidelity 5.341e-05 top1 10/10, boot bench 4.984, internal_free 15759. Third measurement of the split-filter code, identical each time. No change taken.","timestamp":1789999911445,"segment":1,"confidence":31.289910600255592,"asi":{"hypothesis":"Verification of 4.8917 after the batch confirmation.","closed_by_analysis_this_cycle":"Sinkhorn (4.3 ms, exp-bound) is not splitable: the 20 iterations of a 4x4 matrix are sequentially dependent and there is one matrix per layer, so there is no independent unit to hand over, and the numeric alternatives are vetoed by the fidelity probe. Together with kv_store_int8 that exhausts the single-core phases above 0.5% of the token.","state":"Accepted 4.8917 (+100.5%); extended 4.81, think 3.87, prefill 5.2167; 14 device + 13 host byte-exact.","next":"Verification; capture due ~#179; three-board batch every ~4 cycles."}}
{"run":179,"commit":"e3f5380","metric":4.8917,"metrics":{"prefill_tps":5.2167,"ext_decode_tps":4.81,"think_tps":3.87,"boot_bench_tps":4.984,"min_case_tps":4.67,"gen_tokens":99,"internal_free":15759,"psram_free":2052252,"device_output_exact":14,"device_token_delta":0,"logit_max_delta":0.00005341,"logit_top1_match":10,"host_output_exact":13},"status":"keep","description":"Behavioural-integrity cycle (capture due #179, taken now because #176 altered the code that decides which tool-call tokens the sampler can emit): make capture green on the 4.8917 runtime - 7 real scenarios, correct routing (qwen / gpt_oss / opus / needle x4), correct tool calls, all 9 verification flags true. Scenario latencies matched the #169 run within 0.2%, as they should since they are prefill-dominated and prefill is unchanged. Canonical run 4.8917 / 4.81 / 3.87, 14/14 device + 13/13 host byte-exact. No change taken; serial port released afterwards.","timestamp":1790000291118,"segment":1,"confidence":31.289910600255592,"asi":{"hypothesis":"Byte-exact goldens prove arithmetic, not behaviour; the split filter feeds tool-token selection, so re-run the repo's end-to-end check.","state":"Accepted 4.8917 (+100.5%); extended 4.81, think 3.87, prefill 5.2167; 14 device + 13 host byte-exact; capture green at #179 (previous #169); next ~#189.","next":"Verification; three-board batch next cycle."}}
{"run":180,"commit":"e3f5380","metric":4.8917,"metrics":{"prefill_tps":5.2167,"ext_decode_tps":4.81,"think_tps":3.87,"boot_bench_tps":4.984,"min_case_tps":4.67,"gen_tokens":99,"internal_free":15759,"psram_free":2052252,"device_output_exact":14,"device_token_delta":0,"logit_max_delta":0.00005341,"logit_top1_match":10,"host_output_exact":13},"status":"keep","description":"Verification + three-board batch of the new accepted runtime: three fresh-configured identical images (279488 B) all read 4.8917 decode / 4.81 extended / 3.87 think / 4.67 min case, byte-exact 14/14. Canonical run identical. No change taken.","timestamp":1790002100984,"segment":1,"confidence":31.289910600255592,"asi":{"hypothesis":"Drift tracking and full-board validation of the 4.8917 runtime.","state":"Accepted 4.8917 (+100.5%); extended 4.81, think 3.87, prefill 5.2167, boot 201 ms/token; 14 device + 13 host byte-exact; capture green #179, next ~#189.","next":"Verification cycles; no open speed hypothesis after the sampler split."}}
{"run":181,"commit":"e3f5380","metric":4.8917,"metrics":{"prefill_tps":5.2167,"ext_decode_tps":4.81,"think_tps":3.87,"boot_bench_tps":4.984,"min_case_tps":4.67,"gen_tokens":99,"internal_free":15759,"psram_free":2052252,"device_output_exact":14,"device_token_delta":0,"logit_max_delta":0.00005341,"logit_top1_match":10,"host_output_exact":13},"status":"keep","description":"Verification cycle; 4.8917 decode / 4.81 extended / 3.87 think / 4.67 min case, 14/14 device + 13/13 host byte-exact, fidelity 5.341e-05 top1 10/10 (fifth identical measurement of the split-filter runtime). No change taken.","timestamp":1790002346620,"segment":1,"confidence":31.289910600255592,"asi":{"hypothesis":"Verification of 4.8917.","state":"Accepted 4.8917 (+100.5%); extended 4.81, think 3.87, prefill 5.2167; 14+13 byte-exact; capture green #179.","next":"Verification; batch every ~4 cycles."}}
{"run":182,"commit":"e3f5380","metric":4.8917,"metrics":{"prefill_tps":5.2167,"ext_decode_tps":4.81,"think_tps":3.87,"boot_bench_tps":4.984,"min_case_tps":4.67,"gen_tokens":99,"internal_free":15759,"psram_free":2052252,"device_output_exact":14,"device_token_delta":0,"logit_max_delta":0.00005341,"logit_top1_match":10,"host_output_exact":13},"status":"keep","description":"No-flash repeat measurement of the already-flashed accepted image: 4.8917 decode / 4.81 extended / 3.87 think / 4.67 min case, 14/14 byte-exact - identical to the flashed session, so the reading is not a flash-session artefact. boot_bench_tps / internal_free / psram_free are carried from the previous full session of this same image, because AUTO_NOFLASH skips the boot sequence and the firmware reports them only at boot. No change taken.","timestamp":1790002533453,"segment":1,"confidence":31.289910600255592,"asi":{"hypothesis":"Repeat measurement without rebuild/flash: stable within one flashed session?","note":"AUTO_NOFLASH skips boot, so the three boot-only metrics are carried rather than re-measured - flagged in the description so the ledger is not silently reused.","state":"Accepted 4.8917 (+100.5%); extended 4.81, think 3.87; 14+13 byte-exact; capture green #179.","next":"Verification; three-board batch next cycle."}}
{"run":183,"commit":"e3f5380","metric":4.8917,"metrics":{"prefill_tps":5.2167,"ext_decode_tps":4.81,"think_tps":3.87,"boot_bench_tps":4.984,"min_case_tps":4.67,"gen_tokens":99,"internal_free":15759,"psram_free":2052252,"device_output_exact":14,"device_token_delta":0,"logit_max_delta":0.00005341,"logit_top1_match":10,"host_output_exact":13},"status":"keep","description":"Verification cycle plus a fourth three-board batch of the accepted runtime: three fresh-configured images all read 4.8917 / 4.81 / 3.87 / 4.67 byte-exact 14/14, so still no drift and still exactly on the 0.07% spread floor. No-flash repeat on the canonical board matches. boot_bench_tps / internal_free / psram_free carried from the last full session (AUTO_NOFLASH skips boot). No change taken.","timestamp":1790004126103,"segment":1,"confidence":31.289910600255592,"asi":{"hypothesis":"Drift tracking, fourth three-board batch of 4.8917.","state":"Accepted 4.8917 (+100.5%); extended 4.81, think 3.87; 14+13 byte-exact; capture green #179, next ~#189.","next":"Verification cycles; capture coming up."}}
{"run":184,"commit":"e3f5380","metric":4.8917,"metrics":{"prefill_tps":5.2167,"ext_decode_tps":4.81,"think_tps":3.87,"boot_bench_tps":4.984,"min_case_tps":4.67,"gen_tokens":99,"internal_free":15759,"psram_free":2052252,"device_output_exact":14,"device_token_delta":0,"logit_max_delta":0.00005341,"logit_top1_match":10,"host_output_exact":13},"status":"keep","description":"Verification cycle (no-flash repeat), 4.8917 / 4.81 / 3.87 / 4.67, 14/14 byte-exact. No change taken. boot-only metrics carried (AUTO_NOFLASH skips boot).","timestamp":1790004297321,"segment":1,"confidence":31.289910600255592,"asi":{"hypothesis":"Verification of 4.8917.","rederived":"Dominant phase is issue-bound, not LSU-bound or bus-bound: 32 instructions per 16 weights needs ~24 cycles at LX7 issue width, which lands within 15% of the measured 105 ms, while the LSU floor would be ~30 ms and the PSRAM byte floor ~59 ms. Nothing but fewer instructions helps, and the table geometry says there are none.","state":"Accepted 4.8917 (+100.5%); capture green #179, next ~#189.","next":"Verification."}}
{"run":185,"commit":"e3f5380","metric":4.8917,"metrics":{"prefill_tps":5.2167,"ext_decode_tps":4.81,"think_tps":3.87,"boot_bench_tps":4.984,"min_case_tps":4.67,"gen_tokens":99,"internal_free":15759,"psram_free":2052252,"device_output_exact":14,"device_token_delta":0,"logit_max_delta":0.00005341,"logit_top1_match":10,"host_output_exact":13},"status":"keep","description":"Short primary-only repeat (AUTO_GROUPS=primary, no flash): decode_tps 4.8917 again with 6/6 byte-exact and min_case 4.67. Primary metric reproduced with only the 6 metric cases, which also confirms the mean is not sensitive to the extended cases. ext/think and the boot-only metrics are carried from the last full session because this run restricts the groups; the canonical 14/14 byte-exact gate was measured in #183.","timestamp":1790004396619,"segment":1,"confidence":30.321782178217997,"asi":{"hypothesis":"Does restricting to the six primary cases change the primary metric (i.e. is the mean contaminated by harness ordering effects)? No: 4.8917 exactly.","state":"Accepted 4.8917 (+100.5%); 14+13 byte-exact in #183's full run; capture green #179.","next":"Verification; full 14-case run next cycle to keep the quality gate current."}}
{"run":186,"commit":"e3f5380","metric":4.8917,"metrics":{"prefill_tps":5.2167,"ext_decode_tps":4.81,"think_tps":3.87,"boot_bench_tps":4.984,"min_case_tps":4.67,"gen_tokens":99,"internal_free":15759,"psram_free":2052252,"device_output_exact":14,"device_token_delta":0,"logit_max_delta":0.00005341,"logit_top1_match":10,"host_output_exact":13},"status":"keep","description":"Full rebuild + flash + 14-case verification cycle, every metric measured this session (nothing carried): 4.8917 decode / 4.81 extended / 3.87 think / 5.2167 prefill / 4.67 min case, 14/14 device + 13/13 host byte-exact, fidelity 5.341e-05 top1 10/10, boot bench 4.984 (201 ms/token), internal_free 15759, psram_free 2,052,252. No change taken.","timestamp":1790004626805,"segment":1,"confidence":29.411764705882536,"asi":{"hypothesis":"Full-session quality gate on the accepted runtime.","state":"Accepted 4.8917 (+100.5%); capture green #179, next ~#189; batch cadence kept (4 batches agree exactly).","next":"Verification cycles."}}
{"run":187,"commit":"e3f5380","metric":4.8917,"metrics":{"prefill_tps":5.2167,"ext_decode_tps":4.81,"think_tps":3.87,"boot_bench_tps":4.984,"min_case_tps":4.67,"gen_tokens":99,"internal_free":15759,"psram_free":2052252,"device_output_exact":14,"device_token_delta":0,"logit_max_delta":0.00005341,"logit_top1_match":10,"host_output_exact":13},"status":"keep","description":"Primary-only no-flash repeat: 4.8917 with 6/6 byte-exact (second such repeat; #186's full session is the 14/14 gate). No change taken.","timestamp":1790004736338,"segment":1,"confidence":26.259378349410586,"asi":{"hypothesis":"Repeat sampling of the primary metric on the accepted runtime.","state":"Accepted 4.8917 (+100.5%); capture next ~#189.","next":"Verification; capture coming up."}}
{"run":188,"commit":"1323a38","metric":4.8917,"metrics":{"prefill_tps":5.2167,"ext_decode_tps":4.81,"think_tps":3.87,"boot_bench_tps":4.984,"min_case_tps":4.67,"gen_tokens":99,"internal_free":15759,"psram_free":2052252,"device_output_exact":14,"device_token_delta":0,"logit_max_delta":0.00005341,"logit_top1_match":10,"host_output_exact":13},"status":"keep","description":"Behavioural-integrity cycle (capture due ~#189, taken now): make capture green again on the accepted runtime - 7 scenarios, all 9 verification flags true. Immediately afterwards the 14-case suite passed byte-exact on the same attach (capture leaves the device with a running timer and a changed sampling period, so this also shows the golden suite is robust to that state). decode_tps 4.8917 / extended 4.81 / think 3.87 / 14-of-14. boot-only metrics carried (no flash this session).","timestamp":1790005029797,"segment":1,"confidence":23.717328170377556,"asi":{"hypothesis":"Periodic end-to-end behaviour check on the shipped path (routing, second-pass local tool execution, telemetry, sampling interval, timer expiry).","state":"Accepted 4.8917 (+100.5%); capture green #179 and #188; next ~#198.","next":"Verification cycles; batch next cycle."}}
{"run":189,"commit":"1323a38","metric":4.8917,"metrics":{"prefill_tps":5.2183,"ext_decode_tps":4.81,"think_tps":3.87,"boot_bench_tps":4.984,"min_case_tps":4.67,"gen_tokens":99,"internal_free":15759,"psram_free":2052252,"device_output_exact":14,"device_token_delta":0,"logit_max_delta":0.00005341,"logit_top1_match":10,"host_output_exact":13},"status":"keep","description":"Verification cycle plus the fifth three-board batch of the accepted runtime: all three boards 4.8917 / 4.81 / 3.87 / 4.67 byte-exact 14/14 (spread still zero at this resolution). Canonical primary-only repeat matches at 4.8917 with 6/6 byte-exact, boot bench 4.984, internal_free 15759, psram_free 2,052,252 measured this session. ext/think carried from #188 (group-restricted run). No change taken.","timestamp":1790006644047,"segment":1,"confidence":23.717328170377556,"asi":{"hypothesis":"Drift tracking, fifth batch.","state":"Accepted 4.8917 (+100.5%); capture green #188, next ~#198.","next":"Verification cycles."}}
{"run":190,"commit":"1323a38","metric":4.8917,"metrics":{"prefill_tps":5.2183,"ext_decode_tps":4.81,"think_tps":3.87,"boot_bench_tps":4.984,"min_case_tps":4.67,"gen_tokens":99,"internal_free":15759,"psram_free":2052252,"device_output_exact":14,"device_token_delta":0,"logit_max_delta":0.00005341,"logit_top1_match":10,"host_output_exact":13},"status":"keep","description":"Primary-only no-flash repeat: 4.8917, 6/6 byte-exact - another exact reproduction (25th-plus reading of this runtime at the same four digits, on four different boards and in both flashed and no-flash sessions). No change taken.","timestamp":1790006743124,"segment":1,"confidence":23.717328170377556,"asi":{"hypothesis":"Repeat sampling of the primary metric.","insight":"The metric is deterministic to four decimals across boards and sessions, not noisy: it is a mean over fixed token counts of ms-granular device timings, so the quantisation is ~0.04% (one last-digit tick) and the observed spread is that quantum rather than measurement noise. That means a reproducible one-tick change is a real effect, while the 0.2% keep bar stays as a deliberate guard against chasing anything that is not clearly structural.","state":"Accepted 4.8917 (+100.5%); capture green #188.","next":"Verification cycles."}}
{"run":191,"commit":"1323a38","metric":4.8917,"metrics":{"prefill_tps":5.2183,"ext_decode_tps":4.81,"think_tps":3.87,"boot_bench_tps":4.984,"min_case_tps":4.67,"gen_tokens":99,"internal_free":15759,"psram_free":2052252,"device_output_exact":14,"device_token_delta":0,"logit_max_delta":0.00005341,"logit_top1_match":10,"host_output_exact":13},"status":"keep","description":"Repeat: 4.8917 primary, 6/6 byte-exact (prefill ticked to 5.2183, decode did not). No change taken.","timestamp":1790006841162,"segment":1,"confidence":23.717328170377556,"asi":{"hypothesis":"Repeat of the primary metric on the accepted runtime.","state":"Accepted 4.8917 (+100.5%); capture green #188, next ~#198.","next":"Verification."}}
{"run":192,"commit":"1323a38","metric":4.8917,"metrics":{"prefill_tps":5.2183,"ext_decode_tps":4.81,"think_tps":3.87,"boot_bench_tps":4.984,"min_case_tps":4.67,"gen_tokens":99,"internal_free":15759,"psram_free":2052252,"device_output_exact":14,"device_token_delta":0,"logit_max_delta":0.00005341,"logit_top1_match":10,"host_output_exact":13},"status":"keep","description":"Repeat: 4.8917 primary, 6/6 byte-exact. No change taken.","timestamp":1790006938796,"segment":1,"confidence":23.717328170377556,"asi":{"hypothesis":"Repeat of the primary metric.","state":"Accepted 4.8917 (+100.5%).","next":"Verification; full flashed run next cycle."}}
{"run":193,"commit":"1323a38","metric":4.8917,"metrics":{"prefill_tps":5.2183,"ext_decode_tps":4.81,"think_tps":3.87,"boot_bench_tps":4.984,"min_case_tps":4.67,"gen_tokens":99,"internal_free":15759,"psram_free":2052252,"device_output_exact":14,"device_token_delta":0,"logit_max_delta":0.00005341,"logit_top1_match":10,"host_output_exact":13},"status":"keep","description":"Two full 14-case suites back to back (one with rebuild+flash, one no-flash) on the accepted runtime: both 4.8917 decode / 4.81 extended / 3.87 think, 14/14 byte-exact, boot bench 201 ms/token. Running the suite twice in one session is the KV/prefix-restore robustness angle and it stays byte-exact. internal_free / psram_free carried from #189 (not re-printed by this run's filter).","timestamp":1790007285276,"segment":1,"confidence":23.717328170377556,"asi":{"hypothesis":"Two consecutive full suites (flashed then no-flash): does a second suite in the same session drift or diverge?","state":"Accepted 4.8917 (+100.5%); capture green #188, next ~#198.","next":"Verification; batch next cycle."}}
{"run":194,"commit":"1323a38","metric":4.8917,"metrics":{"prefill_tps":5.2167,"ext_decode_tps":4.81,"think_tps":3.87,"boot_bench_tps":4.984,"min_case_tps":4.67,"gen_tokens":99,"internal_free":15759,"psram_free":2052252,"device_output_exact":14,"device_token_delta":0,"logit_max_delta":0.00005341,"logit_top1_match":10,"host_output_exact":13},"status":"keep","description":"Verification cycle, all metrics measured this session: 4.8917 decode / 4.81 extended / 3.87 think / 5.2167 prefill / 4.67 min case, 14/14 device + 13/13 host byte-exact, boot bench 4.984 (201 ms/token), internal_free 15759, psram_free 2,052,252, fidelity 5.341e-05 top1 10/10. No change taken.","timestamp":1790007518997,"segment":1,"confidence":23.717328170377556,"asi":{"hypothesis":"Verification of the accepted runtime.","state":"Accepted 4.8917 (+100.5%); capture green #188.","next":"Three-board batch next cycle."}}
{"run":195,"commit":"1323a38","metric":4.8917,"metrics":{"prefill_tps":5.2167,"ext_decode_tps":4.81,"think_tps":3.87,"boot_bench_tps":4.984,"min_case_tps":4.67,"gen_tokens":99,"internal_free":15759,"psram_free":2052252,"device_output_exact":14,"device_token_delta":0,"logit_max_delta":0.00005341,"logit_top1_match":10,"host_output_exact":13},"status":"keep","description":"Verification cycle plus the sixth three-board batch: all three boards 4.8917 / 4.81 / 4.67 byte-exact 14/14; canonical primary repeat identical. No change taken.","timestamp":1790009045620,"segment":1,"confidence":23.717328170377556,"asi":{"hypothesis":"Drift tracking, sixth batch.","state":"Accepted 4.8917 (+100.5%); capture green #188.","next":"Verification."}}
