{"run":217,"commit":"1323a38","metric":4.8917,"metrics":{"prefill_tps":5.2167,"ext_decode_tps":4.81,"think_tps":3.87,"boot_bench_tps":4.984,"min_case_tps":4.67,"gen_tokens":99,"internal_free":15759,"psram_free":2052252,"device_output_exact":14,"device_token_delta":0,"logit_max_delta":0.00005341,"logit_top1_match":10,"host_output_exact":13},"status":"keep","description":"Verification repeat: 4.8917, 6/6 byte-exact, boot 4.984, internal_free 15759. No change taken.","timestamp":1790018266930,"segment":1,"confidence":6.163522012578621,"asi":{"hypothesis":"Verification repeat.","state":"Accepted 4.8917 (+100.5%).","next":"Batch due next cycle."}}
{"run":218,"commit":"1323a38","metric":4.8917,"metrics":{"prefill_tps":5.2167,"ext_decode_tps":4.81,"think_tps":3.87,"boot_bench_tps":4.983,"min_case_tps":4.67,"gen_tokens":99,"internal_free":15759,"psram_free":2052252,"device_output_exact":14,"device_token_delta":0,"logit_max_delta":0.00005341,"logit_top1_match":10,"host_output_exact":13},"status":"keep","description":"Verification cycle plus the tenth three-board batch: all three 4.8917 byte-exact 14/14; canonical repeat identical (boot 4.983). No change taken.","timestamp":1790019855572,"segment":1,"confidence":5.720289516693911,"asi":{"hypothesis":"Drift tracking, tenth batch.","state":"Accepted 4.8917 (+100.5%).","next":"Verification."}}
{"run":219,"commit":"1323a38","metric":4.8917,"metrics":{"prefill_tps":5.2167,"ext_decode_tps":4.81,"think_tps":3.87,"boot_bench_tps":4.984,"min_case_tps":4.67,"gen_tokens":99,"internal_free":15759,"psram_free":2052252,"device_output_exact":14,"device_token_delta":0,"logit_max_delta":0.00005341,"logit_top1_match":10,"host_output_exact":13},"status":"keep","description":"Verification repeat: 4.8917, 6/6 byte-exact, boot 4.984, internal_free 15759. No change taken.","timestamp":1790020015294,"segment":1,"confidence":5.720289516693911,"asi":{"hypothesis":"Verification repeat.","state":"Accepted 4.8917 (+100.5%).","next":"Verification."}}
{"run":220,"commit":"1323a38","metric":4.8917,"metrics":{"prefill_tps":5.2167,"ext_decode_tps":4.81,"think_tps":3.87,"boot_bench_tps":4.983,"min_case_tps":4.67,"gen_tokens":99,"internal_free":15759,"psram_free":2052252,"device_output_exact":14,"device_token_delta":0,"logit_max_delta":0.00005341,"logit_top1_match":10,"host_output_exact":13},"status":"keep","description":"Verification repeat: 4.8917, 6/6 byte-exact, boot 4.983, internal_free 15759. No change taken.","timestamp":1790020172801,"segment":1,"confidence":5.720289516693911,"asi":{"hypothesis":"Verification repeat.","state":"Accepted 4.8917 (+100.5%).","next":"Full flashed gate next cycle."}}
{"run":221,"commit":"1323a38","metric":4.8917,"metrics":{"prefill_tps":5.2167,"ext_decode_tps":4.81,"think_tps":3.87,"boot_bench_tps":4.983,"min_case_tps":4.67,"gen_tokens":99,"internal_free":15759,"psram_free":2052252,"device_output_exact":14,"device_token_delta":0,"logit_max_delta":0.00005341,"logit_top1_match":10,"host_output_exact":13},"status":"keep","description":"Full rebuild + flash + 14-case verification, all metrics measured this session: 4.8917 decode / 4.81 extended / 3.87 think / 5.2167 prefill / 4.67 min case, 14/14 device + 13/13 host byte-exact, fidelity 5.341e-05 top1 10/10, boot bench 4.983 (201 ms/token), internal_free 15759, psram_free 2,052,252. No change taken.","timestamp":1790020424174,"segment":1,"confidence":5.589778690394711,"asi":{"hypothesis":"Full-session gate on the accepted runtime.","state":"Accepted 4.8917 (+100.5%) after 221 runs; all lever families closed with measured floors, tier family closed on all axes, sampler family closed on measurement.","next":"Verification cycles and the periodic three-board batch; make capture only when shipping code changes (last green #188)."}}
{"run":222,"commit":"1323a38","metric":4.8917,"metrics":{"prefill_tps":5.2167,"ext_decode_tps":4.81,"think_tps":3.87,"boot_bench_tps":4.983,"min_case_tps":4.67,"gen_tokens":99,"internal_free":15759,"psram_free":2052252,"device_output_exact":14,"device_token_delta":0,"logit_max_delta":0.00005341,"logit_top1_match":10,"host_output_exact":13},"status":"keep","description":"Verification repeat: 4.8917, 6/6 byte-exact, boot 4.983, internal_free 15759. No change taken.","timestamp":1790020579464,"segment":1,"confidence":5.4650903412893195,"asi":{"hypothesis":"Verification repeat.","state":"Accepted 4.8917 (+100.5%).","next":"Batch due next cycle."}}
{"run":223,"commit":"1323a38","metric":4.8917,"metrics":{"prefill_tps":5.2167,"ext_decode_tps":4.81,"think_tps":3.87,"boot_bench_tps":4.983,"min_case_tps":4.67,"gen_tokens":99,"internal_free":15759,"psram_free":2052252,"device_output_exact":14,"device_token_delta":0,"logit_max_delta":0.00005341,"logit_top1_match":10,"host_output_exact":13},"status":"keep","description":"Verification repeat: 4.8917, 6/6 byte-exact. No change taken; ext/think/boot-only carried.","timestamp":1790020668393,"segment":1,"confidence":5.4650903412893195,"asi":{"hypothesis":"Verification repeat.","state":"Accepted 4.8917 (+100.5%).","next":"Batch due."}}
{"run":224,"commit":"1323a38","metric":4.8917,"metrics":{"prefill_tps":5.2167,"ext_decode_tps":4.81,"think_tps":3.87,"boot_bench_tps":4.984,"min_case_tps":4.67,"gen_tokens":99,"internal_free":15759,"psram_free":2052252,"device_output_exact":14,"device_token_delta":0,"logit_max_delta":0.00005341,"logit_top1_match":10,"host_output_exact":13},"status":"keep","description":"Verification repeat: 4.8917, 6/6 byte-exact, boot 4.984, internal_free 15759. No change taken.","timestamp":1790020826144,"segment":1,"confidence":5.4650903412893195,"asi":{"hypothesis":"Verification repeat.","state":"Accepted 4.8917 (+100.5%).","next":"Batch due next cycle (eleventh)."}}
{"run":225,"commit":"1323a38","metric":4.8917,"metrics":{"prefill_tps":5.2167,"ext_decode_tps":4.81,"think_tps":3.87,"boot_bench_tps":4.984,"min_case_tps":4.67,"gen_tokens":99,"internal_free":15759,"psram_free":2052252,"device_output_exact":14,"device_token_delta":0,"logit_max_delta":0.00005341,"logit_top1_match":10,"host_output_exact":13},"status":"keep","description":"Verification repeat: 4.8917, 6/6 byte-exact. No change taken.","timestamp":1790020918023,"segment":1,"confidence":4.908344185114693,"asi":{"hypothesis":"Verification repeat.","state":"Accepted 4.8917 (+100.5%).","next":"Eleventh three-board batch next cycle; full flashed gate every ~3 cycles."}}
{"run":226,"commit":"1323a38","metric":4.8917,"metrics":{"prefill_tps":5.2167,"ext_decode_tps":4.81,"think_tps":3.87,"boot_bench_tps":4.984,"min_case_tps":4.67,"gen_tokens":99,"internal_free":15759,"psram_free":2052252,"device_output_exact":14,"device_token_delta":0,"logit_max_delta":0.00005341,"logit_top1_match":10,"host_output_exact":13},"status":"keep","description":"Verification repeat: 4.8917, 6/6 byte-exact. No change taken.","timestamp":1790021008528,"segment":1,"confidence":4.454545454545449,"asi":{"hypothesis":"Verification repeat.","state":"Accepted 4.8917 (+100.5%).","next":"Batch (eleventh) then full flashed gate."}}
{"run":227,"commit":"1323a38","metric":4.8917,"metrics":{"prefill_tps":5.2167,"ext_decode_tps":4.81,"think_tps":3.87,"boot_bench_tps":4.984,"min_case_tps":4.67,"gen_tokens":99,"internal_free":15759,"psram_free":2052252,"device_output_exact":14,"device_token_delta":0,"logit_max_delta":0.00005341,"logit_top1_match":10,"host_output_exact":13},"status":"keep","description":"Verification repeat: 4.8917, 6/6 byte-exact, boot 4.984, internal_free 15759. No change taken.","timestamp":1790021167588,"segment":1,"confidence":4.41441441441441,"asi":{"hypothesis":"Verification repeat.","state":"Accepted 4.8917 (+100.5%).","next":"Run the eleventh three-board batch, then a full flashed gate."}}
{"run":228,"commit":"1323a38","metric":4.8917,"metrics":{"prefill_tps":5.2167,"ext_decode_tps":4.81,"think_tps":3.87,"boot_bench_tps":4.984,"min_case_tps":4.67,"gen_tokens":99,"internal_free":15759,"psram_free":2052252,"device_output_exact":14,"device_token_delta":0,"logit_max_delta":0.00005341,"logit_top1_match":10,"host_output_exact":13},"status":"keep","description":"FINAL baseline-only record (campaign redirected to the reopened Experiment 12-19 queue): eleventh three-board batch of the accepted control - boards 1/2/3 all 4.8917 decode / 4.81 extended, byte-exact 14/14 (batch 20260921T200656.773089Z), plus one more canonical primary repeat at 4.8917, boot 4.984, internal_free 15759. No change taken. Per the redirected campaign this is the last unchanged-HEAD control; future controls are coupled into candidate batches. Baseline for Experiments 12-19 is 4.8917 (target 5.00 = save ~4.4 ms of the ~204.4 ms request token).","timestamp":1790022788609,"segment":1,"confidence":4.3749999999999964,"asi":{"hypothesis":"Baseline-only verification; final such record.","state":"Control = 4.8917 (+100.5%), deterministic to one quantisation tick across 11 batches and three boards.","next":"Experiment 12: paired/interleaved attention nd_expf. Disassemble attn_heads' exp calls, capture real (w0,w1) argument pairs, device microbench nd_expf_pair, integrate only a bit-exact faster kernel."}}
{"run":229,"commit":"72281cf","metric":4.915,"metrics":{"prefill_tps":5.2433,"ext_decode_tps":4.8357,"think_tps":3.88,"boot_bench_tps":5.016,"min_case_tps":4.7,"gen_tokens":99,"internal_free":15503,"psram_free":2052252,"device_output_exact":14,"device_token_delta":0,"logit_max_delta":0.00005341,"logit_top1_match":10,"host_output_exact":13},"status":"keep","description":"Experiment 12 - paired/interleaved attention exponential. nd_expf_pair() evaluates the two independent exp() chains of the attention online softmax (w0 = s0-m, w1 = s1-m for the two KV positions of a pair) with their operations interleaved, so the scheduler has two independent operands per slot instead of one serial degree-5 Horner chain at a time. Each chain performs exactly nd_expf's operations in nd_expf's order with the same constants, and the out-of-range clamps stay in the scalar path, so the pair is bit-identical by construction. Disassembly of attn_heads showed why there was room: GCC expanded the two calls one after the other and spilled live floats to a1+0x4a0..0x4f8 to do it. Device microbenchmark (kbench, board 2, fixture = 1024 argument pairs captured from the six real primary generations with -DND_EXP_CAPTURE, 49,152 pairs collected): 247.42 -> 198.04 cycles/pair, +19.96%, mismatch=0 over all pairs, CCOUNT calibrated at 24000 cycles/us. Batch (20260921T210606.773089Z... board 1 pristine control, boards 2/3 candidates, fresh configure each, images 279488/279744/279744 B with distinct md5, -DND_KBENCH absent, -DND_LUT2_ASM present x7): control 4.8917 (reproducing the accepted value exactly, so the batch is trustworthy), candidates both 4.9150 with extended 4.8371, prefill 5.2433, min_case 4.70, byte-exact 14/14. Swapped-assignment confirmation on the canonical board (candidate on board 1): 4.9150 decode / 4.8357 extended / 3.88 think / 5.2433 prefill / 4.70 min, 14/14 device + 13/13 host byte-exact, token_delta 0, fidelity 5.341e-05 top1 10/10, boot bench 5.016 (199 ms/token, from 201), internal_free 15503 (was 15759; +256 B flash, -256 B internal). Accepted: +0.48% decode, +0.56% extended, +0.51% prefill, think also up (+0.26%) - the first new-campaign win and 4.9150 = +101.4% over baseline.","timestamp":1790026489494,"segment":1,"confidence":4.320174672489081,"asi":{"hypothesis":"The two adjacent attention exp() calls are independent serial Horner chains; interleaving them gives the scheduler two independent operands and avoids the spills GCC used to schedule them sequentially, and doing so is bit-exact because each chain's operations are unchanged.","isolated_kernel":"kbench on device, real captured arguments: scalar 247.42 cycles/pair vs C pair 198.04 (+19.96%), mismatch=0, CCOUNT valid.","end_to_end":"+0.48% decode (4.8917 -> 4.9150), +0.56% extended, +0.51% prefill, +0.26% think, byte-exact 14/14 device + 13/13 host on control, two candidates and the canonical board. Boot bench 201 -> 199 ms/token independently confirms it.","prediction_vs_measured":"Predicted +0.86% from 49 cycles x ~8500 pairs/token; realised +0.48%, i.e. about half. The estimate assumed none of the exp latency was already hidden by neighbouring work; it was partially hidden, which is the honest explanation.","remaining_headroom":"99 cycles per exp after pairing is still far above the instruction count of the polynomial (~11 FP ops + a few int ops per exp). A handwritten TIE728 pair with no spill/reload plausibly lands at 60-80 cycles/pair, which would be a further ~+1.5%. Experiment 12's own trigger for assembly ('if C does not schedule it') was not met - C scheduled it and paid off - so this is banked as a new candidate rather than a follow-up to a failure.","capture_tooling":"host/nd_dump.c -DND_EXP_CAPTURE + esp32/main/exp_pairs.h is now the reusable fixture path: it records real predicate arguments and the bench refuses to trust synthetic ranges.","next":"Experiment 13 (ESP-DSP S3 dot-product audit) plus the due make capture on the new shipping code."}}
{"run":230,"commit":"a91023d","metric":4.915,"metrics":{"prefill_tps":5.2433,"ext_decode_tps":4.8357,"think_tps":3.88,"boot_bench_tps":5.016,"min_case_tps":4.7,"gen_tokens":99,"internal_free":15503,"psram_free":2052252,"device_output_exact":14,"device_token_delta":0,"logit_max_delta":0.00005341,"logit_top1_match":10,"host_output_exact":13},"status":"discard","description":"Experiment 13 - ESP-DSP S3 dot-product audit, CLOSED as rejected with no integration. The shipped attention Q.K dot (one accumulator, two-term groups, 4-wide) measured 138 cycles for n=48 on device and beat every alternative schedule tried against it: an interleaved pair of the two dots of a KV position pair (bit-exact, bad=0) cost 403 cycles per pair against 276 for two shipped calls (-46%); a four-accumulator reorder that models the aes3 schedule took 213 (-54%); and an order-preserving handwritten kernel using ee.ldf.128.ip post-increment loads - bit-exact by construction, also bad=0 - took 286 cycles (-107%). The Kronecker shape (n=32, 97 cycles control) showed the same pattern (-50% pair, -61% reorder). Bench added to kbench with the C variants kept in the tree; the asm variant lived only in board 2's checkout and is not in the shipping tree. espidf's esp-dsp component (dsps_dotprod_f32_aes3) is absent from this tree, from managed_components and from ESP-IDF 5.5.2, and adding it is a forbidden new dependency - that is the concrete blocker for the library-vs-library half, recorded rather than silently substituted. Consequence for the campaign: the dot's ~8.3 ms/token (138 cycles x ~14,400 dots) is not reducible by pairing, accumulator count, load width or hand assembly - only by changing what is computed, which the byte-exact gate refuses.","timestamp":1790029357571,"segment":1,"confidence":4.227863247863248,"asi":{"hypothesis":"An optimized (aes3-style) dot-product schedule - multiple accumulators, 128-bit aligned float loads - beats the shipped 4-wide single-accumulator Q.K dot at the real alignments.","measured":"QK n=48: control 138 cyc; pair-interleaved 403/pair vs 276 (-46%); 4-accumulator reorder 213 (-54%); ee.ldf.128.ip asm 286 (-107%). Kron n=32: control 97; pair -50%, reorder -61%. All candidates bit-exact (bad=0); rejected on speed.","why_the_asm_lost":"A 128-bit float load on the S3 ai engine is not a single LSU operation, and asm volatile is a scheduling fence: GCC's own loop interleaves the two dots of a pair and pipelines across iterations, none of which survives inside an asm body. The loop instruction also adds per-iteration overhead.","what_this_rules_out":"Instruction scheduling, load width and accumulator count are closed for the dot family with device numbers, not argument. The remaining lever for this phase is what is computed (Experiment 14's integer path), not how it is scheduled.","blocker_recorded":"esp-dsp absent from tree + IDF 5.5.2; new dependencies forbidden, so dsps_dotprod_f32_aes3 cannot be benchmarked as such. Its schedule was reproduced locally instead and lost.","fixture_caveat":"reord_maxabs printed 0.000e+00 because the fixture values are near-integers in int8 range, so every partial sum is exact - a reduction-order test with those values would report false exactness. It did not matter (reorder lost on speed), but the lesson is recorded in ideas.md.","microbench_rule":"Rotate over several distinct operand buffers and consume every result through an FP register barrier: with one fixed operand pair, GCC hoists a pure noinline call out of the timing loop (a 48-element dot measured 8 cycles) and a variant writing only locals measured 0. Cost two wasted builds; applies to every kbench addition.","next":"Experiment 14: CQ2 integer feasibility screen on real shapes/codebooks/captured prepared activations, screened in C against nd_lut2_rows_tie1n (not in asm), with quantization cost, bytes read, staging bytes, cycles, max/mean error and fidelity/top1 reported before any integration."}}
{"run":231,"commit":"a91023d","metric":4.8117,"metrics":{"prefill_tps":5.1317,"ext_decode_tps":4.73,"think_tps":3.82,"boot_bench_tps":4.898,"min_case_tps":4.59,"gen_tokens":99,"internal_free":14735,"psram_free":2052252,"device_output_exact":14,"device_token_delta":0,"logit_max_delta":0.00005341,"logit_top1_match":10,"host_output_exact":13},"status":"discard","description":"Exponential scale tail by exponent-field insertion, REJECTED on speed. nd_expf/nd_expf_pair built 2^k as integer bits, memcpy'd it into a float and multiplied; this replaced that with an integer add of k<<23 into p's own exponent field, guarded to the range where it is provably equal to the multiply. Bit-exactness was verified the right way - against the previous shipping implementation verbatim, not against the new pair - over 80,184,321 comparisons (dense sweep of [-90,90] at ~1e-3, clamp edges, pair paths): 0 mismatches after the guard was corrected. Device result: 4.8117 vs the 4.9150 control, -2.10%, and it moved every monitor the wrong way - prefill 5.2433 -> 5.1317, think 3.88 -> 3.82, extended 4.8357 -> 4.73, min_case 4.70 -> 4.59, boot bench 199 -> 204 ms/token, internal_free 15503 -> 14735. Measured on three boards (batch 20260921T222845.825872Z boards 2/3 both 4.8117, then the canonical board also 4.8117 exactly), byte-exact 14/14 device + 13/13 host, token_delta 0, fidelity 5.341e-05 top1 10/10. Reverted.","timestamp":1790031501772,"segment":1,"confidence":4.198081982517185,"asi":{"hypothesis":"The exp tail (assemble 2^k in an integer register, memcpy to a float, FP multiply) costs a register->stack->register round trip per exponential; adding k<<23 into p's own exponent field is one integer add and is exactly equal while the result is normal.","why_it_lost":"The swap is not the saving it looked like: reading p's bits needs the float in an integer domain anyway, so no move disappears, and the correctness guard adds two compares and a branch per scalar call (four per pair) into what was straight-line code - and in the pair the branch also breaks the interleaving that produced Experiment 12's +20%. Net effect -2.10% decode, -2.1% prefill, -1.5% think, 204 vs 199 ms/token on the boot bench: the branch and lost overlap outweigh a saved FP multiply. On this core, trading an FPU op for integer bit math is not free because float<->int transfers go through memory.","method_win":"Verifying against the PREVIOUS implementation (kept verbatim in /tmp/expref.c) rather than new-pair-vs-new-scalar caught a real off-by-one: p in [0.61,1) has unbiased exponent -1, so exactness needs k >= -125, not -126, and the first version silently disagreed with the shipped kernel by ~1.7x for x near -87.68. The byte-exact goldens would NOT have caught it, because no real argument goes there - so the correct-gate suite can pass while a latent numerical bug ships. Independent-reference differential testing is now the standard for any change to a numeric primitive.","board1_lock":"Harness defect found: stopping the API with 'pkill -f needle-api' leaks its child 'tools/serial_api.py --serial ...', which keeps holding /dev/needle-pi/console and leaves board 1 reporting 'Board 1 is busy' for the next run (it cost a control slot in this batch). Kill serial_api.py, or use the wrapper's stop path, before releasing a board.","state":"Accepted runtime unchanged at 4.9150 (+101.3%). Experiment 12's paired exp stands; the exp *scale construction* is now measured and closed.","next":"Restore run on the reverted tree, then Experiment 14's numeric screen (host) or Experiment 16/17, both of which can still ship bit-exact."}}
