{"run":373,"commit":"HEAD","metric":5.0483,"metrics":{"boot_bench_tps":5.088,"device_output_exact":17,"device_token_delta":0,"ext_decode_tps":4.976,"gen_tokens":99,"host_output_exact":19,"internal_free":13879,"logit_max_delta":0.00005341,"logit_top1_match":10,"min_case_tps":4.82,"prefill_tps":5.3217,"psram_free":2052252,"think_tps":3.95},"status":"discard","description":"Experiment 39 lane 2 - -O3 stacked on the accepted bundle: MEASURED, -0.166 %, REJECTED (decode 5.0483 vs 5.0567, batch 20260923T1240L, board 3, engine_md5 220c47332818). -O3 does not stack with the hand-placed levers: it gives the bundle's entire +0.198 % back and lands on exactly the value lane 1 measured from the pre-bundle base, so two independent bases converge on 5.0483. Bit-exact and gate-clean (DEVICE_GATE_OK 17/17, golden_missing=0, token_delta=0), prefill 5.3217, extended 4.976, think 3.95, boot bench 5.088. Same shape as run #335 (forced always_inline lost to merely moving the callee into IRAM): the compiler's optimization policy and the campaign's manual placement are alternative policies for the same decisions, not additive levers. Closes 'turn up the optimizer' with a 2-point bracket. Disclosed: these lanes did not emit the boot-time internal_free metric, so that field carries the accepted value rather than a fresh reading.","timestamp":1790160793779,"segment":1,"confidence":21.79166666666665,"asi":{"candidate":"Experiment 39 lane 2 (board 3, batch 20260923T1240L): -O3 on the needle component stacked ON TOP of run #371's bundle (the then-new accepted 5.0567 engine), engine_md5 220c47332818. Distinct hypothesis from lane 1, which measured -O3 in isolation: does the compiler's whole-program aggressiveness add to the two hand-placed levers, or does it undo them?","hypothesis":"If -O3's extra unrolling/inlining is orthogonal to the bundle's IRAM placement and load hoisting, the two should stack to roughly +0.23 %; if the bundle's wins are things the compiler already does differently at -O3, they collide.","result":"decode 5.0483 = -0.166 % against the accepted 5.0567, i.e. -O3 does not stack - it gives the bundle's entire +0.198 % back and lands on exactly the same value lane 1 measured from the other base (5.0483 on both boards from independent builds). Monitors: prefill 5.3217, extended 4.976, think 3.95, boot bench 5.088, gen_tokens 99, DEVICE_GATE_OK 17/17, golden_missing=0, token_delta=0.","verdict":"REJECTED, and it is a strong negative: the accepted engine stays at -O2.","conclusion":"Two independent bases converging on the identical 5.0483 says -O3 replaces the hand-placed scheduling with its own, and its own is ~0.17 % worse on this workload - the same shape of finding as run #335, where forcing always_inline on the same function was worse than merely moving the callee into IRAM. The compiler's policy and the campaign's manual placement are not additive; they are alternative policies for the same decisions. This closes 'turn up the optimizer' as a lever with a 2-point bracket rather than a single observation.","memory_note":"These two lanes did not emit the boot-time METRIC internal_free line (measure.sh's STATE reading reported identical free_internal_bytes 6,843 on both boards at the same sampling point), so the internal_free field above carries the accepted image's value rather than a fresh measurement - disclosed rather than guessed, since -O3 could in principle move IRAM text and the campaign's heap coupling (#292) makes that visible."}}
{"run":374,"commit":"5589260","metric":5.0567,"metrics":{"boot_bench_tps":5.103,"device_output_exact":17,"device_token_delta":0,"ext_decode_tps":4.985,"gen_tokens":99,"host_output_exact":19,"internal_free":13879,"logit_max_delta":0.00005341,"logit_top1_match":10,"min_case_tps":4.83,"prefill_tps":5.3367,"psram_free":2052252,"think_tps":3.96},"status":"keep","description":"Experiment 38 - cold-vs-warm x backing-store calibration of the shipped nd_fwht: MEASURED, no shipping change (decode_tps is the accepted 5.0567 carried forward; only a kbench image ran, which by design never executes the request path). It refutes run #364's CAUSE. On the operand the field actually uses (fwht_rows transforms c->xh = ND_ALLOC_FAST internal SRAM, not routed through the data cache on this part) emptying the cache with a 160 KiB PSRAM sweep changes the cost by exactly nothing: 47,470 cycles warm and cold. On a PSRAM operand the cold penalty is only +8.98 % (51,731 vs 47,470), and warm PSRAM equals internal exactly. All four modes byte-identical. So operand warmth can explain at most ~9 of a 36.75-point isolated gain, and zero of the field case - #364's decision not to ship the wide-load form stands on its own two field measurements, but its recorded explanation cannot, and the plain C unroll it therefore killed is being measured now (Experiment 40: unroll-2, unroll-4, and inlining nd_fwht into fwht_rows to remove a call per group). Method rules replaced: for an internal-SRAM operand cold-isolation is inapplicable so warm numbers are not cache-inflated; what a tight bench loop inflates is instruction mix, so per-call kernels must be screened with the field's call structure. Harness assets and three fixed bugs: idf.py needs the project dir, idf.py has no --before/--after, and a static single-call-site function is inlined so the right macro-candidate proof is a body-unique string in the ELF, not an nm symbol.","timestamp":1790160841873,"segment":1,"confidence":21.79166666666665,"asi":{"candidate":"Experiment 38 (board 1, kbench, batch 20260923T1300L): a 2x2 calibration of the shipped nd_fwht - {internal SRAM, PSRAM} x {warm, cold}, cold meaning a 160 KiB PSRAM sweep between timed calls, real n=128 six-group field shape, min of 25 rounds, all four modes byte-identical to one another (mismatch_vs_ref=0). No candidate; this prices a measurement method. Guards proved the body was really in the image before flashing: macro on kbench.c's OWN compile line (with_flag=1) and the string only the E38 body prints present in the ELF.","hypothesis":"Run #364's closure - 'the paired-butterfly transform screened +36.75 % bit-exact and delivered exactly +0.000 % on device, because the bench re-swept one block so it ran warm in the 64 KiB data cache while the field transforms a freshly prepared activation' - was the campaign's strongest methodological conclusion, and it had never been numbered. If operand warmth is the mechanism, evicting the cache must reproduce most of the delta.","result":"internal-SRAM operand (which is what the field actually uses: fwht_rows transforms c->xh, allocated ND_ALLOC_FAST): 47,470 cycles warm and 47,470 cold - a 0.0 % difference, bit-exact. PSRAM operand: 47,470 warm vs 51,731 cold = +8.98 %. And warm PSRAM equals internal exactly, so a cached PSRAM operand costs nothing extra when warm. The printed evict-penalty line was mangled by my own %.2u%% format ('. 8%' and '. 0%'); the per-field cycles are the authority and are quoted above - fourth instance this session of trusting fields over summaries (#351 wrong sign, #355 units, #341 cumulative divide).","conclusion":"Warmth can explain at most ~9 points of a 36.75-point isolated gain, and for the field's actual operand it explains ZERO, because internal SRAM is not routed through the data cache on this part and no PSRAM sweep can touch it. So #364's recorded CAUSE is refuted as an explanation, even though its DECISION (do not ship the ee.ldf/ee.stf wide-load form) stands on its own field measurement. The remaining explanation for that +36.75 % is the bench's instruction mix - 25 back-to-back transform calls with nothing else in the pipeline - not the data.","invalidates_prior_discard":"YES, and the retries are already running as Experiment 40: #360's plain C unroll-2 of the butterfly loop (+17.95 %, bit-exact, never integrated because its wide-load sibling died on device) was rejected by a mechanism E38 shows cannot be the cause, so its assumption genuinely changed and it deserves a board - along with the unroll-4 curve point and, separately, inlining nd_fwht into fwht_rows to remove a call per group (~96 calls/token), which is the third category run #333 established. The wide-load variant itself is NOT retried: it was bit-exact and still measured +0.000 % twice, which is a field verdict independent of the diagnosis.","method_rule_updated":"The old rule 'a warm kbench number prices nothing' is now too coarse and has been replaced by two sharper ones: (1) for a kernel whose operand is internal SRAM, cold-isolation is not even applicable, so a warm screen of it is not inflated by cache state and may be taken at face value; (2) what a tight back-to-back bench loop actually inflates is the instruction mix, so a screen of a per-call kernel must reproduce the field's call structure (one call per group, immediately followed by the consumer) rather than the cache state.","asset":"esp32/main/kbench.c bench_e38 (kbench-gated, so no shipping configure evaluates it) and .auto/exp38/lane.sh, which syncs its own files, proves the macro reaches kbench.c's own compile line, proves the body string is in the ELF, and refuses to flash otherwise. Three separate real bugs were fixed to get here: idf.py must run from the project directory, idf.py has no --before/--after, and a static single-call-site function is inlined so an nm-based symbol probe cannot find it (the correct artifact for a macro-gated candidate is a string only that body prints)."}}
{"run":375,"commit":"HEAD","metric":5.0483,"metrics":{"boot_bench_tps":5.088,"device_output_exact":17,"device_token_delta":0,"ext_decode_tps":4.977,"gen_tokens":99,"host_output_exact":19,"internal_free":13879,"logit_max_delta":0.00005341,"logit_top1_match":10,"min_case_tps":4.82,"prefill_tps":5.3217,"psram_free":2052252,"think_tps":3.95},"status":"discard","description":"Experiment 40 lane 3 - nd_fwht's body inlined into fwht_rows via one shared static-inline definition, removing a call per group (~96/token): MEASURED, -0.166 %, REJECTED (decode 5.0483 vs 5.0567, batch 20260923T1330L, board 3). Bit-exact and gate-clean on both sides (host 19/19 byte-exact, fidelity 5.341e-05 identical; device DEVICE_GATE_OK 17/17, golden_missing=0, token_delta=0), prefill 5.3217, extended 4.977, think 3.95, boot bench 5.088, gen_tokens 99. Counterexample to run #333's call-structure category: removing the phi call paid because the callee's schedule changed with it, while here the callee is a compact IRAM function and inlining only bloats the caller. The generator's assert also caught that a naive single replace would have hit the wrong one of two identical call lines. Repo tree unchanged.","timestamp":1790161551351,"segment":1,"confidence":21.79166666666665,"asi":{"candidate":"Experiment 40 lane 3 (board 3, batch 20260923T1330L): nd_fwht's body inlined into fwht_rows through ONE shared static-inline definition (fwht_inplace) used by both the exported nd_fwht and the hot per-group call site, removing a call per group - about 96 calls per decode token. Deliberately a single definition with no second copy of the butterfly loop anywhere, because a hand-typed transcription of this transform is exactly what made run #363 diverge 4/17 on device while its benchmark reported diff=0. The other call site (the dequant/prepare walk) was left calling the exported symbol - one lever. An assert in .auto/exp40/make_variants.py is what caught that the naive single replace would have hit the first of two identical call lines rather than the intended one.","hypothesis":"Run #333 established call/inline structure as a third category bigger than delivery and scheduling - the phi kernel was worth +0.365 % precisely because dot_group was a call per group. fwht_rows calls nd_fwht once per group, so the same lever should apply here.","result":"decode 5.0483 = -0.166 % against the accepted 5.0567. Bit-exact and gate-clean (host 19/19 byte-exact with fidelity 5.341e-05 identical before the flash; device DEVICE_GATE_OK 17/17, golden_missing=0, token_delta=0, gen_tokens 99, prefill 5.3217, extended 4.977, think 3.95, boot bench 5.088), so it is a pure speed verdict and it is slower.","verdict":"REJECTED. The repo tree never contained it (engine/src/nd_quant.c verified back at the accepted md5 e87d8e8dc77c).","conclusion":"Call removal is NOT a universally positive category, and the contrast with run #333 is the finding: removing the phi call paid because the callee's whole schedule changed with it (a per-group C call became a per-row assembly kernel), whereas here the callee is a compact ND_HOT IRAM function and inlining it merely bloats fwht_rows - the caller loses registers to the transform's temporaries and pays for it. So the category must be evaluated as 'does the body get better, not just closer', and this is the measured counterexample to keep alongside #333. Two of the three E40 levers are now closed (this and fw4 below); the third, the plain 2-way butterfly unroll, is the campaign's largest candidate since the phi asm.","next":"fw2 is being confirmed on boards 2 and 3 (batch 20260923T1400L) after reading 5.0800 on board 1 with zero measured heap cost."}}
{"run":376,"commit":"HEAD","metric":5.08,"metrics":{"boot_bench_tps":5.123,"device_output_exact":17,"device_token_delta":0,"ext_decode_tps":5.009,"gen_tokens":99,"host_output_exact":19,"internal_free":7735,"logit_max_delta":0.00005341,"logit_top1_match":10,"min_case_tps":4.85,"prefill_tps":5.3617,"psram_free":2052252,"think_tps":3.97},"status":"discard","description":"Experiment 40 lane 2 - FWHT butterfly inner loop unrolled by 4: MEASURED +0.461 % (decode 5.0800 vs 5.0567) but REJECTED ON COST - it costs 6,144 B of internal heap for zero speed over unroll-2 (batch 20260923T1330L, board 2). Every monitor up: extended 5.009 (+0.48 %), prefill 5.3617, think 3.97, boot bench 5.123 (+0.39 %, the mechanism check), min_case 4.85, DEVICE_GATE_OK 17/17, golden_missing=0, token_delta=0, bit-exact and host-proven 19/19 before flash. Cost priced mechanically with nm -S rather than inferred: nd_fwht is 100 B accepted / 174 B in fw2 with heap unchanged at 13,879 / 284 B in fw4 with heap 7,735, because this code is IRAM text and IRAM text is subtracted from the internal heap (#292's coupling). Unroll factor is therefore chosen by cost, not speed - 2 and 4 tie at 5.0800, so the campaign takes the 74-byte version; combined with #362's -28 % at unroll-8 the curve is now measured at three points.","timestamp":1790161581940,"segment":1,"confidence":21.79166666666665,"asi":{"candidate":"Experiment 40 lane 2 (board 2, batch 20260923T1330L): the FWHT butterfly inner loop unrolled by 4, generated by .auto/exp40/make_variants.py from the shipped loop text (the first generator attempt failed to compile - declarations wrapped in a nested block - which is the generator earning its keep rather than a hand-typed diff being wrong on device). Bit-exact by construction: butterflies inside one stage are disjoint index pairs, each element read and written once per stage, so grouping four moves no value, operand or order. Host-proven 19/19 byte-exact with fidelity 5.341e-05 identical before any flash.","hypothesis":"The curve point. Run #362's rescale shipped at unroll-4 (+0.332 %) and unroll-8 there measured -28 %, the LX7 register-file ceiling already recorded for kron_apply, so the question was whether the transform's optimum is at 2 or 4 - #360's isolated screen had measured unroll-2 at +17.95 % and a 4-butterfly block form at -0.30 %.","result":"decode 5.0800 = +0.461 % over the accepted 5.0567, with every monitor up together: extended 5.009 (+0.48 %), prefill 5.3617 (+0.47 %), think 3.97 (+0.25 %), boot bench 5.123 (+0.39 %, the mechanism check - the transform is inside the bench), min_case 4.85, gen_tokens 99, DEVICE_GATE_OK 17/17, golden_missing=0, token_delta=0. But internal_free 7,735 against 13,879 = -6,144 B.","verdict":"REJECTED on cost, not on speed: it is exactly as fast as fw2 (both 5.0800, from independent builds on different boards) and costs 6,144 B of a 13,879 B heap.","mechanical_pricing":"nm -S on the three images makes the asymmetry concrete rather than inferred: nd_fwht is 0x64 = 100 bytes in the accepted image, 0xae = 174 bytes in fw2 with internal_free UNCHANGED at 13,879, and 0x11c = 284 bytes in fw4 with internal_free 7,735. So the transform's code is IRAM text and IRAM text is subtracted from the internal heap (#292's documented coupling); the 184-byte growth in fw4 crosses a placement granularity and costs 6 KiB of usable heap. A 3x code growth for zero speed over fw2, on a kernel that already runs once per group, is not a trade worth making.","conclusion":"The transform unroll is worth +0.46 % and the unroll factor is chosen by cost, not by speed: 2 and 4 are indistinguishable at 5.0800, so the campaign takes the 74-byte version. This also retires the last 'we should try a bigger factor' instinct for this kernel - the curve is flat between 2 and 4 and #362 measured it falling off a cliff at 8.","next":"fw2 confirmed on boards 2 and 3 in batch 20260923T1400L; board 1's own fw2 run was still completing its extended/think groups at the time of writing, and its gates are recorded in the fw2 keep/discard line rather than here."}}
