{"run":759,"commit":"9fdb703","metric":6.0883,"metrics":{"boot_bench_tps":6.155,"device_output_exact":18,"device_token_delta":52,"ext_decode_tps":6.0162,"gen_tokens":99,"host_output_exact":19,"internal_free":11795,"logit_max_delta":0.00005341,"logit_top1_match":10,"min_case_tps":5.86,"prefill_tps":6.4283,"psram_free":2062492,"think_tps":4.67},"status":"keep","description":"Breadth promotions of both seed-line keeps, on distinct boards, each reproducing its screen value exactly. B2 (CQ2 group hardware loop, engine from #756): decode 6.0883, ext_decode_tps 6.0162, think_tps 4.67, min_case 5.86, 18/20 device with token_delta 52 (only the two #647 ring-related goldens), internal_free 11,795 - identical primary to its restricted screen, and its bitwise row differential is green at chunk 1/12/24 over 24 rows (#758). B3 (QK dot outlined to noinline qk_dot8, engine from #757): decode 6.0750, ext 6.0069, think 4.66, min_case 5.85, 18/20 with the same token_delta 52, internal_free 12,035 - also identical to its screen. So the seed line now carries two independent, breadth-gated above-bar levers on top of its 6.0617 pin: +0.44% from removing three group-control instructions per group in the dominant CQ2 phase, and +0.22% from giving the QK dot its own register window (which the live ELF justified: two float store/reload pairs through a1+0x470 inside every 8-column iteration). Neither lane's ext or think monitor regressed - ext rises with the primary on both (6.0162 and 6.0069 against the pin's 5.9777) and think is up (4.67/4.66 against 4.65), so the wins are not paid for by another path. Owed: host gates on both promoted trees, and a combined-tree composition check before either is called shipping-grade.","timestamp":1790375307976,"segment":1,"confidence":14.884081632653055}
