{"run":298,"commit":"1a9703b","metric":5.0117,"metrics":{"boot_bench_tps":5.057,"device_output_exact":17,"device_token_delta":0,"ext_decode_tps":4.939,"gen_tokens":99,"host_output_exact":16,"internal_free":15215,"logit_max_delta":0.00005341,"logit_top1_match":10,"min_case_tps":4.79,"prefill_tps":5.2867,"psram_free":2052252,"think_tps":3.93},"status":"keep","description":"Completed the falsification lens on the last gate run #297 could not reach, and it found a sixth silent-pass hole - the most consequential one, because it guards the campaign's central rule. **The device byte-exact comparison was gated by nothing.** measure.sh's only failure exits were HOST_BUILD_FAILED and FLASH_FAILED; checks.sh's byte-exact veto runs on the HOST build, where nd_parallel_rows is rows_serial. So a device-only regression - precisely the class of run #159/#162's shared 8 kB codebook table written from both cores, which was byte-exact on three boards by *timing luck* and is structurally invisible on host - would have printed device_output_exact=16/17 and the pipeline would still report PASSED, with only me reading a number as the safeguard.\n\nFix: measure.sh now tees the bench log and, for a full-group run, requires device_output_exact == device_cases and device_golden_missing == 0, printing DEVICE_OUTPUT_DIVERGED / DEVICE_GOLDEN_INCOMPLETE and exiting 1 (skipped for a restricted AUTO_GROUPS run, which does not measure the whole set; grep failures neutralised so `set -e` cannot exit on a short run).\n\nFalsified by measurement, not by argument: one character changed in one device golden entry, re-measured the already-flashed app with AUTO_NOFLASH=1 -> **DEVICE_OUTPUT_DIVERGED 16/17, exit 1**, with device_token_delta=0 - a text-only divergence with an identical token count, which is exactly what a token-count-only check would wave through. Restored with git checkout (exactly 2 DIVERGE lines, no host-side leakage) and re-measured green: DEVICE_GATE_OK exact=17/17 golden_missing=0, decode 5.0117, extended 4.9390, think 3.93, prefill 5.2867, boot bench 5.057, internal_free 15,215, psram_free 2,052,252 - identical to #296/#297, and the shipping tree (engine/ esp32/ host/ tools/ model/) is still 0 lines different from the accepted runtime.\n\nThe decisive property this establishes: the divergent run measured the *same* 5.0117 decode. Speed and quality are now independently gated on the device, so a fast-but-wrong candidate can no longer pass this pipeline - which is the whole basis on which the campaign claims +105 % without a quality trade. Six gates are now proven able to fail: host byte-exact, fidelity reference, primary-prompt hash, quality-trade (Sinkhorn) veto, non-zero test count, and device byte-exact. M6 is kept in gate_falsify.sh behind AUTO_DEVICE_FALSIFY=1 since it is the only probe that needs the board.","timestamp":1790072069507,"segment":2,"confidence":null,"asi":{"artifacts":".auto/measure.sh now gates device byte-exactness + device_golden_missing=0 and prints DEVICE_GATE_OK; .auto/gate_falsify.sh gained M6 (AUTO_DEVICE_FALSIFY=1) which is the only board-requiring probe","control":"AUTO_NOFLASH=1 canonical run with the golden restored: DEVICE_GATE_OK exact=17/17 golden_missing=0, decode 5.0117, every value identical to #296/#297. Shipping tree diff (engine esp32 host tools model) still 0 lines.","finding":"the device byte-exact gate did not exist: measure.sh's only exits were HOST_BUILD_FAILED/FLASH_FAILED, and checks.sh's byte-exact veto runs on the host build where nd_parallel_rows is rows_serial. A device-only regression - exactly the class of run #159/#162's shared-table race, which was byte-exact by timing luck and CANNOT be seen on host - would have printed device_output_exact=16/17 and the run would still report PASSED, gated only by me reading a number.","falsification":"mutated one device golden entry by one character, re-measured the already-flashed app (AUTO_NOFLASH=1): DEVICE_OUTPUT_DIVERGED 16/17, exit 1, and device_token_delta=0 - a text-only divergence with an identical token count, so a token-count check would have passed it. Restored with git checkout; exactly 2 DIVERGE lines, no host-side leakage.","hypothesis":"Complete the falsification lens: the last gate #297 could not reach was the DEVICE byte-exact compare. Test whether anything at all fails when the device generation diverges while speed is unchanged.","interpretation":"speed and quality are now independently gated on the device: the divergent run still measured 5.0117 decode, so a fast-but-wrong candidate can no longer pass the pipeline. This is the gate that guards the campaign's central rule (byte-identical output or discard, whatever it does to tok/s).","metric_note":"decode_tps 5.0117 unchanged by construction - no engine/esp32 change; the logged run is the restored-tree control.","next_action_hint":"six gates now proven falsifiable (host byte-exact, fidelity reference, primary-prompt hash, quality-trade veto, non-zero test count, device byte-exact). Speed work remains at the measured floor; the two routes above the 0.2% bar stay owner decisions (assertion level, 120 MHz).","revisits_run":297}}
{"run":299,"commit":"0a997a6","metric":5.0117,"metrics":{"boot_bench_tps":5.057,"device_output_exact":17,"device_token_delta":0,"ext_decode_tps":4.939,"gen_tokens":99,"host_output_exact":16,"internal_free":15215,"logit_max_delta":0.00005341,"logit_top1_match":10,"min_case_tps":4.79,"prefill_tps":5.2867,"psram_free":2052252,"think_tps":3.93},"status":"discard","description":"Closed the last banked transcendental candidate - the `logf(1.0f)` skip in Sinkhorn - on measurement, at the cost of one host build and zero board time. Its own banked entry demanded measuring the real hit rate rather than assuming it, and the assumption did not survive: `sum == 1.0f` fires **13.58 %** of the time across 1,448,960 logf calls from the six frozen primary prompts of the real model, where the entry had guessed a high rate and set its own gate at \">50 % to be worth board time\".\n\nI did not stop at the narrow skip, because the same data can settle a stronger bit-exact variant: `logf` is a pure function, so a memo keyed on the *exact bits* of `sum` is bit-exact by construction, with no numeric argument at all. It hits only 17.58 %, and the reason is in the same counters - the argument is essentially never repeated (>= 8,192 distinct `sum` bit patterns per prompt against ~230k calls; the distinct counter hit its 8,192 cap, so the true count is higher). Memoisation, and the 4-value special-case table for sum in {1,2,3,4}, are therefore dead on the data rather than on opinion.\n\nThe closure is by break-even arithmetic against measured rates, which is more durable than a cycle count I did not spend: 1,280 logf per token x 13.58 % = 174 skippable calls; the 0.2 % keep bar at this campaign's own measured 70 % realisation needs 0.57 ms/token = 137k cycles, so **logf would have to cost >= 787 cycles** to clear the bar. That is far above any plausible float logarithm on the LX7, so no device microbench was needed to decide it, and the number says exactly what evidence would reopen it.\n\nUnexpected value: the same counters measured `nd_expf`'s exactly-zero argument rate live at **26.07 %** of all terms, independently confirming run #291's accepted \"+0.200 %\" premise (\"a quarter of this kernel's exponentials\"). Accepted changes in this campaign rarely get their premise re-measured and confirmed.\n\nNothing was written to the shipping tree: the instrumentation was reverted (engine/ esp32/ host diff = 0 lines) and the screen patch plus raw counters are kept in `.auto/logfskip/`, with the SINKSTAT stderr line serving as its own proof the define compiled in - #242's rule that a probe is verified by differential output, not by symbol presence or a green build. Secondaries below are carried forward from run #298's canonical run on this identical tree, labelled as such (the #286/#287 convention); decode_tps remains the accepted 5.0117.","timestamp":1790072428381,"segment":2,"confidence":null,"asi":{"artifacts":".auto/logfskip/screen.patch (the ND_SINK_STATS instrumentation, reverted from the tree) + .auto/logfskip/RESULT.md with the raw counters","break_even":"0.2% keep bar at the campaign's measured 70% realisation needs 0.57 ms/token = 137k cycles; 1,280 logf/token x 13.58% = 174 skipped calls/token; so logf must cost >= 787 cycles to clear the bar. Far above any plausible float log on this core, so closed without a device microbench. Reopen only on a measured logf cost >= 787 cycles.","hypothesis":"Banked after #291: Sinkhorn's `lse = mx + logf(sum)` runs 1,280 times per decode token, and once a row/column collapses the accumulation is exactly 1.0f, so writing 0.0f for logf(1.0f) should remove a large share of libm work bit-exactly. The banked note demanded measuring the real hit rate rather than assuming it.","metric_note":"no code shipped and no device run spent - the engine tree is byte-identical to the accepted runtime (git diff over engine/ esp32/ host = 0 lines). Secondaries are carried forward from run #298's canonical run on that identical tree, labelled as carried forward, the same convention as #286/#287.","next_action_hint":"Sinkhorn's transcendental mass is now closed on both halves: the exp(0) skip shipped (#291, +0.200 %, live rate now independently measured at 26.07% of terms) and the logf skip is closed by measured hit rate + break-even. Remaining above-bar routes stay owner decisions (assertion level #293, 120 MHz #289).","revisits_run":291,"result":"measured on the real model over the 6 frozen primary prompts, 1,448,960 logf calls: sum == 1.0f fires 13.58% (the banked note required >50% to be worth board time); a stronger bit-exact variant I tested alongside - an 8-entry memo keyed on the exact bits of `sum` (valid because logf is a pure function, so identical argument bits guarantee identical result bits) - hits only 17.58%, and the argument is essentially never repeated: >= 8,192 distinct sum patterns per prompt against ~230k calls, 3.5% reuse at best, so memoisation and a 4-value special-case table for sum in {1,2,3,4} are both dead.","unexpected_bonus":"the same counters measured nd_expf's exactly-zero argument rate at 26.07% of all terms - a live confirmation of run #291's 'a quarter of the kernel's exponentials' premise, which almost no premise in this ledger gets","rollback_reason":"hit rate 13.58% is ~4x below the banked note's own >50% gate, and the break-even logf cost (787 cycles) is unreachable; nothing to revert because nothing was written to the tree."}}
{"run":300,"commit":"d939b6e","metric":5.0117,"metrics":{"boot_bench_tps":5.057,"device_output_exact":17,"device_token_delta":0,"ext_decode_tps":4.939,"gen_tokens":99,"host_output_exact":16,"internal_free":15215,"logit_max_delta":0.00005341,"logit_top1_match":10,"min_case_tps":4.79,"prefill_tps":5.2867,"psram_free":2052252,"think_tps":3.93},"status":"keep","description":"Pool-state iteration (no board time, no shipping change - decode_tps stays the accepted 5.0117, secondaries carried forward from run #298 on an identical tree). Hypothesis: the campaign assumes the three-board pool is at HEAD with the shipping build config, and #288 already proved `esp32/sdkconfig` is gitignored and survives `git reset --hard`. Both halves of that assumption were false right now.\n\n**Finding 1 - build-config drift.** board1 sat at `ASSERTION_LEVEL=2` (shipping), board2 at **0 (ASSERTIONS_DISABLE)** and board3 at **1 (SILENT)**: run #293's candidates, never cleaned up. A batch started then would have measured a control against two assertion-level candidates while believing it was measuring a code change.\n\n**Finding 2 - stale source, which is worse.** All three workers were behind HEAD (c80fbae / 7c331af / 7c331af vs 9b2f811) and boards 2 and 3 carried *different* `sdkconfig.defaults` hashes (d5895e5, 23a797f vs e974b2e) - i.e. #293's config change was baked into their tracked defaults. So the obvious remedy (delete the drifted `sdkconfig`) would have regenerated the drift straight back. Fixed properly: removed the drifted configs, then synced all three workers to HEAD **by local path** (`git fetch /workspace/esp32-needle-3 <branch> && reset --hard FETCH_HEAD`) - never `git fetch origin`, which has no credentials in this container and would reset a worker to a stale baseline, the recorded way a control reads low and invalidates a whole batch. Recheck: `CONFIG_SYNC_OK boards=3 source=3`.\n\n**Finding 3 - my own first version of this check vacuously passed**, which is the third check this session that could not fail. It anchored `^KEY=` while IDF spells the load-bearing keys as `CONFIG_COMPILER_OPTIMIZATION_ASSERTIONS_DISABLE=y` and `CONFIG_ESP32S3_DATA_CACHE_LINE_64B=y`, so it matched nothing and printed **IN SYNC on a pool that was demonstrably at three different assertion levels**. It now matches key *prefixes*, also compares each worker's HEAD commit and `sdkconfig.defaults` hash against the canonical ones, and carries `SELFTEST=1`, which asserts the comparison distinguishes a one-key difference (it does) - so the check is falsifiable rather than decorative.\n\nWired into `measure.sh` as a loud non-fatal `CONFIG_DRIFT_WARN` before the build: another worker's state cannot invalidate the canonical single-board measurement, but it invalidates the next batch, and it must be impossible to miss. Session tally on the campaign's own harness now stands at three gates that could not fail (bench golden compare, partial-save guard, this config check) and one documented knob that was never wired (`AUTO_SAVE`) - all four failed in the same direction, reporting success while verifying nothing, which is why this lens has been worth more than the 0.2 % candidates I could not find.","timestamp":1790072871708,"segment":2,"confidence":null,"asi":{"artifacts":".auto/board_config_check.sh (prefix-keyed, falsifiable via SELFTEST=1, checks build config AND source commit + sdkconfig.defaults hash), wired into measure.sh as a non-fatal CONFIG_DRIFT_WARN","breaks_the_batch_failure_mode":"a control reading low because its worker is stale looks exactly like a result; this is how a batch silently invalidates itself, and the campaign has lost ~10 device runs to build-integrity issues before","carried_forward":"secondaries from run #298's canonical run on an identical shipping tree (engine/ esp32/ host diff = 0 lines); no board time spent this iteration, deliberately","finding_1":"workers' build configs had drifted: board1 ASSERTION_LEVEL=2 (shipping), board2 =0 (ASSERTIONS_DISABLE), board3 =1 (SILENT) - run #293's candidates never cleaned up, because esp32/sdkconfig is gitignored and git reset --hard does not restore it","finding_2":"all three workers were on STALE SOURCE (board1 c80fbae, boards 2/3 7c331af vs HEAD 9b2f811) and boards 2/3 carried DIFFERENT sdkconfig.defaults hashes (d5895e5, 23a797f vs e974b2e) - so deleting the drifted sdkconfigs alone would have regenerated the drift straight back from the stale defaults","finding_3":"my first version of this very check vacuously passed: it anchored ^KEY= while IDF spells the important keys CONFIG_COMPILER_OPTIMIZATION_ASSERTIONS_DISABLE=y and CONFIG_ESP32S3_DATA_CACHE_LINE_64B=y, so it matched nothing and reported 'IN SYNC' on a demonstrably drifted pool. Caught only because I cross-checked against the grep that found the drift in the first place.","fixed":"normalised: rm board2/board3 sdkconfig, then synced all three to HEAD by LOCAL path (git fetch /workspace/esp32-needle-3 <branch> && reset --hard FETCH_HEAD) - never 'git fetch origin', which has no credentials here and would reset a worker to a stale baseline. Recheck: CONFIG_SYNC_OK boards=3 source=3.","hypothesis":"Continue the falsification lens into the hardware pool: is the three-board pool actually in the state the campaign assumes? The ledger records (#288) that esp32/sdkconfig is gitignored and therefore survives git reset --hard, and that this cost a control slot once. If a worker carries a different build config or a different commit, a 'control vs candidate' batch measures the wrong thing.","next_action_hint":"any future three-board batch is now preceded by a passing config+source sync check that can demonstrably fail. Remaining speed routes are unchanged and both are owner decisions (assertion level #293, 120 MHz #289); new closure this session: software prefetch is unavailable on this core (see separate note).","revisits_run":288,"rule_worth_keeping":"every check needs a demonstrated way to fail. This session found three checks that could not fail (bench compare, the partial-save guard, and this config check) and one knob that was never wired (AUTO_SAVE) - all four were in the campaign's own harness, and all four were in the direction of 'reports success while verifying nothing'."}}
