{"run":471,"commit":"8b3f1a9","metric":5.3033,"metrics":{"boot_bench_tps":5.343,"device_output_exact":20,"device_token_delta":0,"ext_decode_tps":5.2269,"gen_tokens":99,"host_output_exact":19,"internal_free":13367,"logit_max_delta":0.00005341,"logit_top1_match":10,"min_case_tps":5.07,"prefill_tps":5.59,"psram_free":2052252,"think_tps":4.2},"status":"keep","description":"Norm-conversion family closed across BOTH assembly walkers, off-device at zero board cost: the nf16v five-instruction form is already in use in engine/src/gemv4_tie728.S (the 4-bit row walker that serves phi and the head4 full-vocabulary projection) - one NF16V site, header notes it was copied verbatim from lut2_tie728.S so the two kernels cannot differ in norm conversion - and the only remaining ten-instruction NF16 uses are in lut2_tie728.S's eligibility-fallback variants, which the C predicate routes away for every tensor in this archive. So the obvious follow-up (apply the measured +0.642 % conversion trick to the 4-bit path) is already shipped, not open. Gate attempt #8 on board 3 (main's own tree, engine_md5=b1daae10df90) had emitted zero CASE lines when read, i.e. still in build/flash/priming, so no acceptance claim and the pin stays 5.3033; board 2 was deliberately left idle because run #402 measured that concurrent console traffic moves the wedge earlier.","timestamp":1790260114258,"segment":1,"confidence":19.620157696263252,"asi":{"changed_assumption":"None. Closes a candidate before it costs a board rather than revisiting a discard.","gate":"board 3's attempt #8 (from main's tree, runner-asserted engine_md5=b1daae10df90, EXPLICIT_REPEAT_ALLOWED carrying a run-specific reason) had emitted zero CASE lines when read - build/flash/two-prefix priming is roughly seven minutes before the first request - so no gate claim and the pin stays 5.3033. No second job was started on board 2: run #402 measured that concurrent console traffic moves the wedge earlier, so a gate attempt gets the pool to itself.","hypothesis":"The nf16v win (+0.642 %, five-instruction fp16 norm conversion replacing the ten-instruction split-and-rejoin macro) was measured on the 2-bit pair-LUT kernel. Does the 4-bit row walker still carry the expensive macro - which would make phi and the full-vocabulary head the same lever a second time?","measurement":"No, it does not: engine/src/gemv4_tie728.S uses only NF16V (one use site, line 168, with a15 as the scratch the register map already reserves for it) and its header states the macro was copied verbatim from lut2_tie728.S so the two kernels cannot differ in norm conversion. The four remaining NF16 uses in lut2_tie728.S (lines 266, 371, 373, 575) are the eligibility-fallback variants, which the C predicate already routes away for every tensor in this archive. So the fp16 norm-conversion family is exhausted across both walkers and both paths, priced by grep and code reading at zero board time.","next":"Gate reading is the only live acceptance event; after it, make capture and the re-pin. New candidates require a changed premise: dispatch is priced out at 275 splits/token (#463), the map was re-derived at the stack and matched its floors (#464), norm conversion is now measured exhausted in both kernels, and the exp/log/call-surface/tap/attention/sinkhorn families each carry measured closures. The remaining above-bar levers are the two owner decisions (assertion-level RAM funding phi residency; octal 120 MHz, vendor-blocked) plus the console-emission defect that blocks the gate itself."}}
{"run":472,"commit":"8b3f1a9","metric":5.3033,"metrics":{"boot_bench_tps":5.343,"device_output_exact":20,"device_token_delta":0,"ext_decode_tps":5.2269,"gen_tokens":99,"host_output_exact":19,"internal_free":13367,"logit_max_delta":0.00005341,"logit_top1_match":10,"min_case_tps":5.07,"prefill_tps":5.59,"psram_free":2052252,"think_tps":4.2},"status":"keep","description":"Gate attempt #8 cleared the primary group on main's own tree and is now in the extended group: board 3 read decode_tps 5.5617 (GROUP primary mean_tps 5.562, calls_ok 6/6, prefill 5.875, min_case 5.30, gen_tokens 99) - a fourth agreeing reading of the stack and the first taken with main carrying the code (runner-asserted engine_md5=b1daae10df90), matching 5.560/5.5617 from the two cross-board runs to within one quantum. device_output_exact is only printed after all 20 cases and the session re-primes between groups, so the byte-exactness verdict is still pending and no acceptance is claimed; the pin stays 5.3033. Disclosed harness error of my own: grepping this log for lines anchored at start-of-line CASE returned zero for a lane that had in fact completed six cases, because case lines here are prefixed by progress text - sixth vacuous-probe instance, caught by reading the raw tail instead of trusting the pattern.","timestamp":1790260183966,"segment":1,"confidence":19.506475800954323,"asi":{"changed_assumption":"None; gate progress plus one more agreeing reading on the main-resident tree.","gate":"device_output_exact is printed only after all 20 cases, and this session is now inside the extended group after a between-groups reconnect and re-prime, so the byte-exactness verdict is still pending and no acceptance is claimed.","harness_fact":"My own probe was wrong: grepping for lines anchored at CASE-return-zero for a lane that had actually completed six cases, because this log prefixes case lines with progress text. Sixth vacuous-probe instance; caught by reading the raw tail instead of trusting the pattern, the same lesson as run 441 - read what the tool returned, not what the pattern implies.","measurement":"Fourth independent primary-group reading of the stack, and the first taken from main's own tree rather than a worker-local payload: decode_tps 5.5617 with prefill 5.875, min_case 5.30, gen_tokens 99, calls_ok 6/6 on board 3, matching 5.560 (board 2) and 5.5617 (board 3) to within one metric quantum; runner-asserted provenance b1daae10df90 in both.","next":"Read M-gate8-b3.log again next window for device_output_exact over all 20 cases. If 20/20 with golden_missing=0 and token_delta=0, re-pin gen_lane.sh and lane_one.sh at 5.561, run make capture, then delete the worker diag_repeat_ok marker so the anti-repeat guard stays armed (run 470). If it stalls at 16-17 again, the owner packet is the route."}}
{"run":473,"commit":"8b3f1a9","metric":5.3033,"metrics":{"boot_bench_tps":5.343,"device_output_exact":20,"device_token_delta":0,"ext_decode_tps":5.2269,"gen_tokens":99,"host_output_exact":19,"internal_free":13367,"logit_max_delta":0.00005341,"logit_top1_match":10,"min_case_tps":5.07,"prefill_tps":5.59,"psram_free":2052252,"think_tps":4.2},"status":"keep","description":"Coverage-save mechanism located and read, with a false premise of mine corrected: the harness is .auto/bench.py (my grep against tools/bench.py found nothing because the path was from memory, not evidence - seventh vacuous-probe instance). The save path is gated exactly as the coverage run needs: a save requested with a restricted group set prints REFUSING to save a partial golden and clears the flag, so cases and their goldens can only be added by a full-groups run - the constraint run #296 established after a partial save would have left eight cases comparing against nothing. Board 3's gate attempt #8 had no device_output_exact line yet (log tail showed the think-mode attach), so the byte-exactness verdict is still pending, no acceptance is claimed, and the accepted runtime stays 5.3033 with its own secondaries.","timestamp":1790260255059,"segment":1,"confidence":19.506475800954323,"asi":{"changed_assumption":"None; prep plus a corrected premise, no speed claim.","false_premise_corrected":"I searched tools/bench.py and got No such file: the campaign harness lives at .auto/bench.py, not in tools/. The path came from memory rather than evidence, the seventh member of this campaign of vacuous-probe failures, and the reason to write greps against ls output rather than recollection.","gate":"board 3 attempt 8 had no device_output_exact line and the log tail showed the think-mode attach, so the verdict is still pending; no acceptance claimed and the pin stays 5.3033.","measurement":"Located and read the golden-save path the coverage run depends on. In .auto/bench.py a save requested with a restricted group set prints REFUSING to save a partial golden and clears the flag; otherwise it writes the golden when asked or when none exists. So adding cases and saving their goldens is one documented switch and must be a full-groups run by construction - the constraint run 296 established after a partial save would have left eight cases comparing against nothing.","next":"Read the gate verdict from M-gate8-b3.log next window. The coverage save is now unblocked to execute in one pass: append the four deterministic held-out shapes to extended, run the full group set with AUTO_SAVE=1 on a healthy board, verify host and device golden_missing stay zero and the original 20 cases did not drift, commit once. Keep board 2 idle during a gate session because run 402 measured that concurrent console traffic moves the wedge earlier."}}
{"run":474,"commit":"8b3f1a9","metric":5.3033,"metrics":{"boot_bench_tps":5.343,"device_output_exact":20,"device_token_delta":0,"ext_decode_tps":5.2269,"gen_tokens":99,"host_output_exact":19,"internal_free":13367,"logit_max_delta":0.00005341,"logit_top1_match":10,"min_case_tps":5.07,"prefill_tps":5.59,"psram_free":2052252,"think_tps":4.2},"status":"keep","description":"The 20-case gate is structurally unachievable, established by reading the harness rather than by another failed attempt. I launched gate attempt #9 on board 2 with AUTO_HARD_RESET=1 on the theory that the per-boot 16-17 request ceiling is why no session ever reaches 20 cases, then read tools/serial_api.py:405-427: the switch resets the chip mid-suite and re-sends the case, and the code documents that a mid-suite reset restarts the firmware's demo timer and sampling counters, that two held-out cases (heldout_interval_one, heldout_long_tools_note_only) depend on that state, and that run #391 measured exactly those two diverging after a reset - concluding that a gated run must not mix pre- and post-reset context and that the switch is for speed-only or diagnostic runs. A reset-rescued session therefore cannot be a byte-exactness gate at all, so the lane was killed inside a minute (no board time spent on an invalid gate) and the worker's repeat marker deleted so the anti-repeat guard stays armed. Consequence stated as a closure by class: 20 requests do not fit in one boot, the only documented workaround breaks the semantics being measured, and acceptance now requires fixing the console-emission defect or an owner decision on disclosed evidence. Board 3's attempt #8 continues in case this boot's ceiling is higher; no acceptance claimed and the pin stays 5.3033.","timestamp":1790260373199,"segment":1,"confidence":19.506475800954323,"asi":{"changed_assumption":"None for any prior discard - this is about the acceptance procedure, not a speed candidate.","hypothesis":"The per-boot ceiling of 16-17 requests is why no session has ever reached 20 cases, and tools/serial_api.py has a documented AUTO_HARD_RESET switch that resets the chip and re-sends the case after a silent reconnect. Would a gate run with that switch reach all 20 cases byte-exact?","invalid_by_the_harness_own_rule":"The answer is in the code I read after launching, so the lane was killed within about a minute and no board time was spent measuring an invalid gate. serial_api.py comments that a mid-suite reset restarts the firmware demo timer and sampling counters, that two held-out cases (heldout_interval_one and heldout_long_tools_note_only) depend on that state, and that run #391 measured exactly those two cases diverging after a reset; it concludes a gated run must not mix pre- and post-reset context and to opt in only for speed-only or diagnostic runs. So a reset-rescued session cannot be a byte-exactness gate at all, whatever numbers it prints.","structural_conclusion":"The 20-case single-boot gate is unachievable while the console-emission defect caps a boot at 16-17 requests: 20 requests do not fit in a boot, and the only documented workaround invalidates the semantics of the very thing being measured. Acceptance therefore requires either fixing the firmware defect or an owner decision on the disclosed evidence (four agreeing primary readings, 6/6 primary byte-exact, and 16-17 of 20 cases with zero divergences across seven attempts on two engines). This is a closure by reading the code, and it retires further gate attempts as a class rather than as a run.","next":"board 3 attempt 8 continues (it was mid-suite, still alive) in case the ceiling happens to be higher this boot; nothing is claimed from it. The loop agenda is now: owner packet already current (#465 addendum), coverage save needs the same 20-case session so it inherits the same blocker, and new speed candidates need a changed premise - dispatch priced out at 275 splits per token (#463), map re-derived and matching floors (#464), norm conversion exhausted in both kernels (#471)."}}
{"run":475,"commit":"8b3f1a9","metric":5.3033,"metrics":{"boot_bench_tps":5.343,"device_output_exact":20,"device_token_delta":0,"ext_decode_tps":5.2269,"gen_tokens":99,"host_output_exact":19,"internal_free":13367,"logit_max_delta":0.00005341,"logit_top1_match":10,"min_case_tps":5.07,"prefill_tps":5.59,"psram_free":2052252,"think_tps":4.2},"status":"keep","description":"Gate attempt #8 is stalled, not progressing: its log had not advanced for 3 min 27 s (9,693 bytes, tail still the think-attach line) while measure.sh and bench.py remained alive, i.e. the harness is inside a request timeout with the board no longer answering - the eighth session with that signature and zero divergences in every case reached, distribution now 16,16,16,17,17,17 plus this stall. Scoped the console stall suspect without touching shipping code: the emit path is plain printf plus fflush on a UART0-backed stdout with per-event flushes (main.c 522-538, 570-577) and run #418 measured the app's own emit counters freezing at chars=816 and lines=17 while the host kept reading and got EOF, which points at the stdout write path rather than the inference path. No acceptance claimed; accepted runtime unchanged at 5.3033. No speed candidate was available to run: dispatch is priced out at 275 splits per token, the phase map was re-derived at the stack and matches its floors, norm conversion is exhausted in both assembly walkers, and the transcendental, call-surface, tap, attention and memory families all carry measured closures.","timestamp":1790260465893,"segment":1,"confidence":19.506475800954323,"asi":{"changed_assumption":"None; no speed candidate this window.","hypothesis":"Is gate attempt 8 progressing, or dying at the same ceiling - and is the emit path the right suspect to hand the owner?","measurement":"Attempt 8 is stalled: log unwritten for 3m27s (9,693 bytes, tail still the think-attach line) with measure.sh and bench.py alive, i.e. the harness is inside a request timeout while the board no longer answers. Eight sessions now read 16,16,16,17,17,17 plus this stall, with zero divergences in every case reached.","suspect_scoped":"Emit path is plain printf plus fflush on UART0-backed stdout with per-event flushes (main.c 522-538, 570-577) while run 418 measured the app emit counters freezing at chars 816 and lines 17 as the host kept reading and got EOF - pointing at the stdout write path, not the inference path. Scoped only; no blind driver change on shipping code.","next":"Read attempt 8 terminal LANE_RC; re-pin and make capture only if it ever prints 20 of 20; otherwise hold 5.3033. New speed work waits on a changed premise: dispatch priced out at 275 splits per token, map re-derived and matching floors, norm conversion exhausted in both kernels."}}
{"run":476,"commit":"8b3f1a9","metric":5.3033,"metrics":{"boot_bench_tps":5.343,"device_output_exact":20,"device_token_delta":0,"ext_decode_tps":5.2269,"gen_tokens":99,"host_output_exact":19,"internal_free":13367,"logit_max_delta":0.00005341,"logit_top1_match":10,"min_case_tps":5.07,"prefill_tps":5.59,"psram_free":2052252,"think_tps":4.2},"status":"keep","description":"Gate attempt #8 terminated at 17 of 20 cases with TimeoutError \"ESP32 inference exceeded request timeout\" and LANE_RC=1, after its log sat frozen for six minutes while measure.sh and bench.py stayed alive - the seventh completed gate session reading 16,16,16,17,17,17,17 with zero divergences in every case reached across two engines, so the 20-case byte-exactness gate is still unachieved and no acceptance is claimed. Refined the defect description honestly: the harness names an inference request timeout rather than a console ack timeout, which is exactly what an outbound emission stall looks like from the host side (the EVT done line never arrives), and the case in question completes in sessions that get far enough, so a runaway generation is the weaker reading - stated as the strongest supported interpretation rather than as proof. Accepted runtime unchanged at 5.3033; further gate retries are now a scheduler error rather than research (#442 policy plus #474's finding that the only documented workaround breaks the gate's semantics), so acceptance is an owner decision on disclosed evidence.","timestamp":1790260676145,"segment":1,"confidence":19.506475800954323,"asi":{"changed_assumption":"None for discards; it refines the defect description, which matters because the owner fix depends on which path stalls.","error_text_nuance":"The harness names this an inference request timeout, not a console ack timeout. Both are consistent with an outbound emission stall - if the app stops emitting mid-generation, the done line never arrives and the harness can only report that inference exceeded its timeout - and this case completes in the sessions that get far enough, so a runaway generation is the less likely reading. Stated as the strongest reading the data supports, not as proof.","hypothesis":"Attempt 8 terminated: did it reach the byte-exactness line, and what exactly killed it?","measurement":"Attempt 8 reached 17 CASE lines then died with TimeoutError ESP32 inference exceeded request timeout and LANE_RC=1, with the log frozen from 14:29 to 14:35 while processes stayed alive. The attempt record is now 16,16,16,17,17,17,17 across seven gate sessions on two engines with zero divergences in every case reached, so the 20-case gate remains unachieved for the third independent reason chain: 20 requests do not fit in a boot, and the only documented workaround invalidates the gate semantics (#474).","next":"Nothing further to measure on the gate: nine board sessions have produced the same result, and run 442 policy plus #474 make a tenth a schedulist error rather than research. Hold at 5.3033; owner packet (#465 addendum, updated by #474/#475) is the route. New speed work waits on a changed premise, and the two above-bar levers remain owner decisions: assertion-level RAM funding phi residency, and octal 120 MHz which is vendor-blocked."}}
