{"run":355,"commit":"82fc836","metric":5.03,"metrics":{"boot_bench_tps":5.076,"device_output_exact":20,"device_token_delta":0,"ext_decode_tps":4.9577,"gen_tokens":99,"host_output_exact":19,"internal_free":14903,"logit_max_delta":0.00005341,"logit_top1_match":10,"min_case_tps":4.8,"prefill_tps":5.3083,"psram_free":2052252,"think_tps":3.94},"status":"keep","description":"Experiment 31 LANE 3 (board 3, kbench; decode_tps is the accepted 5.0300 carried forward, no shipping change): nd_cq_prepare split for the first time, on the real geometry (in_pad 768, ngroup 6, group 128). Per call: activation copy 1,954 cycles (3.3 %), FWHT 37,763 (64.1 %), scale pass 8,519 (14.5 %), whole engine call 58,901 cycles = 0.2454 ms. At ~16 calls/token the transform is ~2.5 ms of the 197 ms token and the whole call reproduces the phase map's prep+lut (3.6 ms), which cross-checks the split against an independent measurement. Two disclosures: (1) my own summary line printed the call time in seconds under a 'ms' label and therefore read '0.000 ms' - the cycles are right, the units in that one line were wrong, and the correct reading is 0.2454 ms/call and 3.93 ms/token; this is the same unit/normalisation class that produced the retired 5.7 ms projection figure (#341) and the wrong-signed spread (#351), so the campaign rule is to trust the per-field numbers and re-derive any summary. (2) The scale pass costs 11.1 cycles per element, which is far off a multiply, so it has its own small lever (ceiling +0.29 %). The keepable-looking finding is the transform: 64.1 % of prepare at 14 cycles per butterfly against a ~6-instruction body, so a 2x transform is ~1.26 ms = +0.64 % decode. That is the prize Experiment 32 is screening - and a vector form of it is already impossible on an ISA fact (no float SIMD arithmetic assembles on this part).","timestamp":1790146101571,"segment":1,"confidence":21.56916666666665,"asi":{"candidate":"LANE 3 (board 3): split nd_cq_prepare into copy / +FWHT / +scale / whole engine call, all timed in one image on the real tensor geometry (in_pad 768, ngroup 6, group 128). Run #344 priced the whole call at 0.156 ms and ~2 cycles/op but never split it, so the TIE-FWHT idea had no denominator.","harness_defect_disclosed":"my own VERDICT line printed best[3]/240e6 (SECONDS) under a 'ms' label, so it read '0.000 ms call' and '0.00 ms'. The cycles are right and the correct figures are 0.2454 ms per call and 3.93 ms of FWHT+scale+copy per token across ~16 calls. The campaign's standing rule applies: the per-field numbers are the authority, and the derived summary line is the thing to re-check - this is the same class of unit/normalisation error that produced the retired 5.7 ms projection figure in #341 and the wrong-signed spread in #351.","hypothesis":"prepare's 0.156-0.245 ms per call, ~16 times a token, is 3.6 ms of the phase map's prep+lut; whether the transform is the majority decides if a vectorised FWHT is worth designing at all.","result":"copy 1,954 cycles (3.3 % of the call), FWHT 37,763 (64.1 %), scale 8,519 (14.5 %), whole engine call 58,901 cycles = 0.2454 ms. Sum of my three stages is 48,236, so the engine's own version carries ~18 % more (padding/memset and the fp16 staging the engine does around them). 16 calls/token reproduces prep+lut = 3.6-3.9 ms.","scale_pass_finding":"8,519 cycles for 768 multiplies is 11.1 cycles per element, which is far off a multiply's floor and is why E32 lane 3 screens restrict/unroll forms of it. Its ceiling is 14.5 % of a 3.9 ms/token phase, so even making it free is +0.29 %, and halving it is +0.145 % - a real but small lever.","verdict":"KEEP as attribution, no candidate on its own: the FWHT is 64.1 % of prepare, ~2.5 ms/token, at 14 cycles per butterfly against a ~6-instruction body. That is the first above-bar-looking target found since the phi asm, and it is what Experiment 32 is screening.","next":"E32 lane 1 = scalar vs unroll vs block4 vs wide-load-fed scalar butterfly, behind the delta/constant known-answer probe; lane 2 = does my model FWHT match nd_cq_prepare bit-for-bit, and the engine call's real cost per geometry; lane 3 = the scale pass forms. The vector form is off the table on an ISA fact, not an opinion.","unit_correction":"FWHT = 37,763 cyc/call x 16 calls = 604,208 cycles = 2.52 ms/token; at 14 cycles/butterfly a 2x faster transform is ~1.26 ms = +0.64 % decode, which is 3 keep bars - that is the prize being screened, stated with the corrected units."}}
{"run":356,"commit":"3fe4627","metric":5.03,"metrics":{"boot_bench_tps":5.076,"device_output_exact":20,"device_token_delta":0,"ext_decode_tps":4.9577,"gen_tokens":99,"host_output_exact":19,"internal_free":14903,"logit_max_delta":0.00005341,"logit_top1_match":10,"min_case_tps":4.8,"prefill_tps":5.3083,"psram_free":2052252,"think_tps":3.94},"status":"keep","description":"Experiment 32 LANE 1 (board 1, kbench; decode_tps is the accepted 5.0300 carried forward, no shipping change): the FWHT screen, and the wide-load form wins on the kernel while the ISA closes the door on the version everyone would have reached for first. Float SIMD arithmetic DOES NOT EXIST on this part — ee.add.64, ee.adds.64, ee.adds.sp, ee.addsp.64, ee.vadd.64, ee.sub*.64, ee.mul*.64 and ee.ldf.32 are all rejected by the shipped assembler as \"unknown opcode or format name\" (which independently confirms what engine/src/lut2_tie728.S:24 already records), so a vectorised transform is impossible. What IS legal is the same scalar add.s/sub.s fed by wide TIE loads: **145,107 cycles scalar vs 122,162 with ee.ldf.64.ip/ee.stf.64.ip = +18.78 %**, unroll-2 +16.23 %, 4-butterfly register block -0.30 %, all bit-exact (diff 0) and all passing the known-answer probe (probe_bad=0). The transform is 64.1 % of prepare = ~2.52 ms/token, so the prize is ~0.40 ms = +0.20 % decode — exactly the keep bar, which is why it must now be measured through the real two-core call rather than priced here. Second-order finding with wider reach: **wide TIE float loads are trustworthy on plain aligned fp32 arrays**, so run #335's wrong-value defect is specific to the 2-bit decoder pattern, not to ee.ldf — that widens which kernels can use them. Honesty limit: this lane's reference was my own reconstruction, and lane 2 proves it is not bit-equal to the engine's output, so the bit-exactness claim here is relative to my model; Experiment 33 re-diffs every variant against the shipped nd_fwht symbol before anything is integrated.","timestamp":1790147457291,"segment":1,"confidence":21.56916666666665,"asi":{"candidate":"LANE 1 (board 1, kbench): four forms of the butterfly loop that dominates nd_cq_prepare, timed on the real group geometry (6 groups x g=128 = 2,688 butterflies per round), all diffed cell-by-cell. Variants: scalar control, k-loop unroll-2, 4-butterfly register block, and the SAME scalar add.s/sub.s fed by ee.ldf.64.ip wide loads + ee.stf.64.ip wide stores.","hypothesis":"run #351 measured the transform at 64.1 % of nd_cq_prepare (~2.5 ms/token) at 14 cycles per butterfly against a ~6-instruction body, so the transform has ~2x of headroom. A float-SIMD version is impossible (measured: ee.add.64 / ee.adds.64 / ee.sub*.64 / ee.mul*.64 / ee.ldf.32 are all rejected by the shipped assembler), so the question is whether fewer load/store instructions around the same scalar arithmetic pays.","result":"cycles per round: scalar 145,107 (13.50 cyc/butterfly), unroll2 124,850 (11.61) = +16.23 %, block4 145,539 (13.54) = -0.30 %, wide_load64 122,162 (11.36) = +18.78 %. diff_vs_scalar = 0,0,0,0 and the known-answer probe is clean for every variant (probe_bad=0,0,0,0), so all four compute identical bits.","scope_correction":"The reference in THIS lane was my own reconstruction of the transform, not the engine's. Run #357 (this batch's lane 2) shows the reconstruction is not bit-equal to what nd_cq_prepare produces (762 of 768 cells differ), so this lane's cycles-per-butterfly is a valid kernel comparison but its 'bit-exact' claim is only relative to my model. That is why nothing here is treated as an integration licence and Experiment 33 re-diffs every variant against the SHIPPED nd_fwht symbol.","isa_finding":"wide TIE float loads ARE trustworthy for plain aligned fp32 arrays: ee.ldf.64.ip/ee.stf.64.ip passed both the bit-differential and the known-answer probe here, so run #335's wrong-value defect is specific to the 2-bit decoder access pattern, not to the instruction. That widens what is buildable: wide loads can be used in float kernels as long as the differential says so.","verdict":"SCREEN ONLY, no candidate yet: the winner is the wide-load form at +18.78 %, worth 2.52 ms x 0.158 = 0.40 ms/token = +0.20 % decode at best, which is exactly the keep bar, so it must be measured end to end through the real two-core call, not priced from this screen.","next":"E33 lane 3 is that measurement (whole prepare, two-core, against nd_cq_prepare itself). If it shows >=13 % on the call with zero mismatches, integrate both changes (wide-load butterflies + unroll-4 rescale) and run the canonical pipeline; otherwise the family closes at screen level.","harness":"Two launcher defects found and fixed, both of which could have produced a batch that measured the wrong thing: the per-lane experiment flags are ENV VARS consumed by .auto/exp29/lane.sh (EXP30/EXP31/EXP32), so copying an experiment launcher silently re-runs the previous experiment - the first two 'E33' launches were actually re-running E32. lane.sh now passes -DND_KB_EXP33 plus a general ${KBDEFS:-} passthrough and its ELF symbol check is parameterised (${SYM:-bench_fused}), and the launcher sets EXP33=1 SYM=bench_e33. Verified on the live command lines before trusting the batch: -DND_KB_EXP32=0 -DND_KB_EXP33=1 on all three boards. Also: pkill -f \"idf.py -C /root/board-pool\" matched this shell's own command line and killed my command mid-edit (the [n]eedle-api trap from #295 recurring) - always bracket the first character."}}
{"run":357,"commit":"3fe4627","metric":5.03,"metrics":{"boot_bench_tps":5.076,"device_output_exact":20,"device_token_delta":0,"ext_decode_tps":4.9577,"gen_tokens":99,"host_output_exact":19,"internal_free":14903,"logit_max_delta":0.00005341,"logit_top1_match":10,"min_case_tps":4.8,"prefill_tps":5.3083,"psram_free":2052252,"think_tps":3.94},"status":"keep","description":"Experiment 32 LANE 2 (board 2, kbench; decode_tps is the accepted 5.0300 carried forward, no shipping change): the denominator for the prepare family, and a self-correction. nd_cq_prepare costs **58,902 cycles = 0.2454 ms at every geometry** (three 768x768 tensors and one 576x768, all in_pad 768 / ngroup 6) — independent of row count exactly as the code says it must be, so ~16 calls/token = 3.93 ms = 2 % of the token, and run #344's 0.156 ms figure is superseded (that was one core's share, not the two-core wall time this runs on). The correction: my reconstructed transform differs from the engine's output on **762 of 768 cells**, because the engine rescales each group by 1/sqrtf(g) inside fwht_rows while my model scaled once by 1/n. So run #351's 64.1 % / 14.5 % split describes MY transform, not the shipped one — the qualitative shape holds (transform dominant, scale minority, copy noise) but the percentages are not the engine's. Disclosed alongside: my own 'model_ms' field is derived from the engine's cycles, not an independent measurement, so it must not be read as two agreeing measurements. This is why Experiment 33 diffs every variant against the shipped nd_fwht symbol rather than a transcription — the rule run #338 learned, applied.","timestamp":1790147491848,"segment":1,"confidence":21.56916666666665,"asi":{"candidate":"LANE 2 (board 2, kbench): nd_cq_prepare timed per real tensor geometry, and my reconstructed transform diffed cell-by-cell against what the engine actually writes.","hypothesis":"the FWHT prize needs a real denominator. Run #344 priced the call at 0.156 ms and run #351 at 0.2454 ms; if prepare's cost depended on the tensor's row count, one phase-map figure could not be used for all ~16 calls per token.","result":"engine call = 58,902 cycles = 0.2454 ms at every geometry tested (three 768x768 tensors and one 576x768, all in_pad=768, ngroup=6). It is independent of out rows exactly as the code says it must be (prepare touches only the activation), so 0.2454 ms is the correct per-call denominator for the whole family, and run #344's 0.156 ms is superseded - it measured one core's share, not the two-core wall time.","model_mismatch":"model_vs_engine_bad = 762, 762, 764, 764 of 768 cells: my reconstruction is NOT what the engine produces, because the engine rescales each group by 1/sqrtf(g) inside fwht_rows while my model applied 1/n once at the end. So the 64.1 %/14.5 % split from run #351 came from a transform+scale that is not the shipped one, and the safe reading is: the split's SHAPE (transform dominates, scale is a minority, copy is noise) is right, but the exact percentages are my model's, not the engine's.","correction":"the 'model_ms=0.2454' field in my own output line is derived from the engine's cycles, not an independent measurement of my model - do not read it as agreement between two measurements. There is one measurement here (58,902 cycles) and one comparison (762/768 mismatch).","verdict":"KEEP as the denominator plus a correction: prepare is 0.2454 ms per call and ~16 calls/token = 3.93 ms = 2 % of the token, and no candidate may be priced off my reconstructed transform. This is what forced Experiment 33 to re-diff every variant against the shipped nd_fwht symbol instead of against a transcription (run #338's rule, applied).","next":"E33: lane 1 diffs unroll2 / wide-load64 / both against the REAL nd_fwht; lane 2 times the shipped rescale form vs unroll-4/unroll-8 at the engine's own g=128; lane 3 times the whole two-core prepare body both ways and diffs against nd_cq_prepare's own output. Integration only if lane 3 clears ~13 % with zero mismatches."}}
{"run":358,"commit":"3fe4627","metric":5.03,"metrics":{"boot_bench_tps":5.076,"device_output_exact":20,"device_token_delta":0,"ext_decode_tps":4.9577,"gen_tokens":99,"host_output_exact":19,"internal_free":14903,"logit_max_delta":0.00005341,"logit_top1_match":10,"min_case_tps":4.8,"prefill_tps":5.3083,"psram_free":2052252,"think_tps":3.94},"status":"keep","description":"Experiment 32 LANE 3 (board 3, kbench; decode_tps is the accepted 5.0300 carried forward, no shipping change): the per-group rescale inside fwht_rows. Shipped scalar loop 5,381 cycles for 768 elements = 7.01 cyc/element; **restrict-qualified: 5,381 cycles, identical, literally zero effect**; unroll-4: 2,896 = 3.77 cyc/element = **+85.81 %**, bit-exact (scale_mismatch=0 — each element is its own multiply, there is no accumulation order to move). Two things come out of it. (1) Another restrict null, and this one kills the backlog's cheapest suggestion — \"add restrict to the hot elementwise kernels (zero numerical change)\" — on measurement rather than assumption: the compiler already had the alias information the annotation supplies, exactly as in the earlier rms_unit/zcrms nulls. (2) A premise correction that shrinks the prize honestly: run #351's 11.1 cyc/element came from my reconstructed transform (see run #357), and the shipped-style loop measured in isolation is 7.01, so unroll-4 saves 3.14 cyc x 768 x ~16 calls = 0.16 ms/token = **+0.08 %**, under the keep bar alone. It is therefore bundled into the same patch as the transform instead of shipped by itself — worth taking, not worth a build.","timestamp":1790147529562,"segment":1,"confidence":21.56916666666665,"asi":{"candidate":"LANE 3 (board 3, kbench): the per-group rescale that fwht_rows runs after the transform (nd_quant.c: 'for (j = 0; j < c->g; j++) blk[j] *= c->scale;'), shipped form vs restrict-qualified vs unroll-4, on an aligned 768-float internal-RAM array, diffed bit-for-bit.","hypothesis":"run #351 measured the rescale at 11.1 cycles per element, which is nowhere near a multiply's floor, so it may have a lever worth 14.5 % of a 2 % phase.","result":"768 elements: shipped 5,381 cycles = 7.01 cyc/element, restrict-qualified 5,381 = **identical, zero effect**, unroll-4 2,896 = 3.77 cyc/element = **+85.81 %**. scale_mismatch=0, so unroll-4 is bit-exact (each element is its own multiply; no ordering to move).","second_restrict_null":"this is the campaign's Nth restrict null - the ledger already records restrict on rms_unit/zcrms as a null, and the compiler's own alias analysis already had the information the annotation gives. Recorded because it kills 'add restrict to the hot elementwise kernels', the backlog's cheapest suggested idea, for one board run.","note":"the 11.1 cyc/element premise was my reconstructed model's number (see run #357); the shipped-style loop measured in isolation here is 7.01, so the lever is smaller than the model implied: unroll-4 saves 3.14 cycles x 768 x 16 calls/token = 38.6k cycles = 0.16 ms = +0.08 % on its own, i.e. below the bar alone and only worth taking as part of the same patch as the transform.","verdict":"KEEP as a component: unroll-4 on the rescale is free, bit-exact and worth +0.08 % alone; it is bundled into the E33 lane-3 candidate rather than shipped separately, because 0.08 % cannot clear the bar on its own.","next":"harvest E33: lane 1 (variants vs the SHIPPED nd_fwht), lane 2 (rescale forms at the engine's g=128), lane 3 (whole two-core prepare body both ways vs nd_cq_prepare's own output). If lane 3 shows >=13 % with zero mismatches, patch nd_fwht + fwht_rows and run the canonical three-board batch.","backlog_next_three":"1) integrate prepare's inner loops (gated on E33 L3); 2) the same unroll/wide-load treatment for the sinkhorn 4x4 exp/log mass, the last elementwise phase with a measured floor but no scheduling attempt since #291's exact-zero skip; 3) engram gather: 12 rows x 128 weights per token is tiny, so instead price the engram's two 768x768 CQ2 GEMVs (14.2 ms/token at the 2-bit floor) against a per-token tier-hotness order - the only untested lever there is when its rows are prefetched into the tier's hot tail."}}
