{"run":521,"commit":"df61703","metric":5.3033,"metrics":{"boot_bench_tps":5.621,"device_output_exact":18,"device_token_delta":52,"ext_decode_tps":5.2269,"gen_tokens":99,"host_output_exact":19,"internal_free":8415,"logit_max_delta":0.00005341,"logit_top1_match":10,"min_case_tps":5.31,"prefill_tps":5.59,"psram_free":2052252,"think_tps":4.2},"status":"keep","description":"Progress on both acceptance sessions is confirmed by liveness measurement, but no verdict exists yet, so nothing is claimed. Board 2's log grew from 12,110 to 14,507 bytes between reads and board 3's is at 7,497 bytes (it started later), with bench.py processes live on both - the sessions are working, not wedged, which is the same non-destructive check that distinguishes a long suite from a stall in this harness. Neither has emitted device_output_exact, DEVICE_OUTPUT_DIVERGED or LANE_RC, so there is no byte-exactness verdict, no acceptance, and the pin stays 5.3033 while the stack's speed evidence stands at 5.575 with the RX ring and 5.580/5.5817 without it. I deliberately started no other experiment this iteration: the scheduling, delivery, transform, transcendental and library-call families all carry measured closures, the phase map was already re-derived at this stack, and the binding datum is the pending compare block, so another candidate would add noise rather than information - and re-measuring the accepted image is the unchanged-verification loop the campaign forbids (and its anti-repeat guard would correctly refuse it). Pass condition on arrival remains 18/20 with exactly heldout_interval_one and heldout_long_tools_note_only failing until the owner settles those demo-timer-dependent goldens.","timestamp":1790269823381,"segment":1,"confidence":18.02457142857145,"asi":{"expected_completion":"The suite is three groups with a ~5 minute re-prime between them, so ~45 minutes per session; board 2 started roughly an hour ago and board 3 ~25 minutes ago, which is consistent with growth rather than a stall. If board 2's log stops growing between reads, the next action is the timeout diagnostic rather than another read.","hypothesis":"Are the two acceptance sessions making progress or stalling - measured by byte growth and live processes rather than by reading a verdict that has not been emitted?","liveness":"Both logs are growing: board 2 went 12,110 -> 14,507 bytes between reads, board 3 is at 7,497 bytes (started ~35 min later), and bench.py processes are live. Neither has emitted device_output_exact, DEVICE_OUTPUT_DIVERGED or LANE_RC, so there is still no byte-exactness verdict, no acceptance and no re-pin.","why_no_other_experiment":"Nothing else is worth starting: the scheduling, delivery, transform, transcendental and call-surface families all carry measured closures, the phase map was re-derived at the stack, and the acceptance configuration is already measured on two boards. Starting another candidate would add noise where the binding datum is the pending compare block, and re-running the accepted image is the forbidden unchanged-verification loop."}}
{"run":522,"commit":"df61703","metric":5.3033,"metrics":{"boot_bench_tps":5.621,"device_output_exact":18,"device_token_delta":52,"ext_decode_tps":5.2269,"gen_tokens":99,"host_output_exact":19,"internal_free":8415,"logit_max_delta":0.00005341,"logit_top1_match":10,"min_case_tps":5.31,"prefill_tps":5.59,"psram_free":2052252,"think_tps":4.2},"status":"keep","description":"The merged acceptance tree is measured on two boards with the expected byte-exactness outcome, so the only thing between it and a re-pin is the owner's two goldens. Decode reads 5.575 on board 2 and 5.5783 on board 3 on the byte-identical tree (provenance dfa32cefae65: asmemo + radix-4 fusion + nf16v + spin handshake + sequence predicate + lean task notifications + late lossless console RX ring, diagnostic removed), one quantum apart, and board 2's compare block reports DEVICE_OUTPUT_DIVERGED 18/20 with LANE_RC=1 - failing exactly heldout_interval_one and heldout_long_tools_note_only, the pair run #391 documents as encoding the firmware's demo timer and sampling counters, and the same pair reproduced on this tree's earlier board-2 run (#499/#513). Against the accepted pin 5.3033 that is +5.14 % and +5.17 %, with min_case 5.31-5.32, boot bench 5.621, internal_free 8,415 (-4.1 KB for the ring), host 19/19 byte-exact and fidelity 5.341e-05 unchanged. Per #513 this is the pass condition for a candidate: 18/20 with exactly those two cases failing, and no other case regressed. Remaining blocker is therefore owner-level, not engineering: re-capture or annotate those two goldens, then one session on this exact tree should read 20/20 and the pin moves from 5.3033 to ~5.575. Accepted pin deliberately unchanged until that happens.","timestamp":1790269873533,"segment":1,"confidence":18.02457142857145,"asi":{"divergence_set_confirmed":"The failing cases are exactly heldout_interval_one and heldout_long_tools_note_only - the pair run #391 documents as depending on the firmware's demo timer and sampling counters, and the same pair reproduced on board 2's earlier run (#499/#513). Per #513's pass condition this is the expected outcome for any candidate until the owner settles those goldens; no other case regressed.","hypothesis":"Read the completed verdicts of the two acceptance sessions on the merged tree (lean notifications + sequence predicate + late lossless RX ring, diagnostic removed, provenance dfa32cefae65).","next":"One owner-level step unblocks everything: re-capture or annotate the two demo-timer-dependent goldens, after which a single session on this exact tree is expected to read 20/20 and the pin moves from 5.3033 to ~5.575. No further optimisation is needed to reach that re-pin, and nothing else in the campaign is above the keep bar inside the documented maxima and byte-exact gate.","result":"Cross-board agreement on the merged acceptance tree: decode 5.575 (board 2) and 5.5783 (board 3) - one quantum apart - with the compare block reporting DEVICE_OUTPUT_DIVERGED 18/20 and LANE_RC=1 on board 2."}}
{"run":523,"commit":"9c4f1b2","metric":5.3033,"metrics":{"boot_bench_tps":5.621,"device_output_exact":18,"device_token_delta":52,"ext_decode_tps":5.2269,"gen_tokens":99,"host_output_exact":19,"internal_free":8415,"logit_max_delta":0.00005341,"logit_top1_match":10,"min_case_tps":5.31,"prefill_tps":5.59,"psram_free":2052252,"think_tps":4.2},"status":"keep","description":"Made the owner's acceptance decision cheap instead of manufacturing another candidate. .auto/OWNER_ACCEPTANCE_PACKET.md now carries the final measured table for the acceptance tree (provenance dfa32cefae65, snapshot .auto/exp84/main.c.lean-ring): decode 5.575 on board 2 and 5.5783 on board 3 (+5.14 %/+5.17 % over the 5.3033 pin), min_case 5.31-5.32, boot bench 5.621, internal_free 8,415, device byte-exact 18/20, host 19/19, fidelity 5.341e-05 unchanged - and it names the two failing cases explicitly (heldout_interval_one, heldout_long_tools_note_only), records that they reproduce across two boards and three engines because they encode the firmware's demo timer and sampling counters (run #391), and states the console ring's measured cost as one metric tick (-0.09 %) plus 4,271 B of internal heap. The single unblocking ask is written in one line: re-capture or annotate those two goldens, after which one session on this tree should read 20/20 and the pin moves 5.3033 -> ~5.575. I deliberately ran no new candidate: every lever family carries a measured closure and the phase map was re-derived at this stack, so another sub-bar measurement would burn a board to reconfirm noise while the acceptance decision sits unmade. Accepted pin deliberately unchanged at 5.3033.","timestamp":1790269925924,"segment":1,"confidence":18.02457142857145,"asi":{"hypothesis":"The blocker is now owner-level, not engineering, so the highest-value action is to make the decision cheap: write the final two-board numbers, the exact failing cases, the measured cost of the console fix, and the single unblocking ask into .auto/OWNER_ACCEPTANCE_PACKET.md.","next":"If the owner settles the two goldens, one session on prov dfa32cefae65 is expected to read 20/20 and the pin moves to ~5.575. If they prefer not to touch goldens, the alternative disclosed option is to annotate the two cases as state-dependent and gate on the other 18 plus host 19/19 - a judgement about the quality oracle, which is deliberately not mine to make. Meanwhile board 3's session should also finish; if its compare block also fails only those two, the 18/20 pattern is three-for-three.","record_written":"The packet now carries the table (5.575 / 5.5783, min_case 5.31-5.32, boot bench 5.621, internal_free 8,415, device 18/20), the divergence pair with its cross-board and cross-engine reproduction, the ring's measured cost of one metric tick and 4,271 B, and the single ask - re-capture or annotate those two goldens - plus the statement that nothing else in the campaign is above the keep bar inside the documented maxima and the byte-exact gate.","why_not_another_candidate":"Every lever family carries a measured closure (scheduling priced out at 275 splits/token, delivery bounded by the flat 13.90 % PSRAM tax, transforms measured on every axis, transcendental and library-call surfaces exhausted), and the phase map was re-derived at this stack. Inventing another 0.1 % candidate would consume a board to reconfirm noise while the acceptance decision sits unmade."}}
{"run":524,"commit":"9c4f1b2","metric":5.3033,"metrics":{"boot_bench_tps":5.621,"device_output_exact":18,"device_token_delta":52,"ext_decode_tps":5.2269,"gen_tokens":99,"host_output_exact":19,"internal_free":8415,"logit_max_delta":0.00005341,"logit_top1_match":10,"min_case_tps":5.31,"prefill_tps":5.59,"psram_free":2052252,"think_tps":4.2},"status":"keep","description":"Board 3's cross-board acceptance reading is not usable as evidence, and the reason is reported rather than smoothed over. Its log has grown to 11,741 bytes with a live bench.py but has emitted no compare block - no device_output_exact, no DEVICE_OUTPUT_DIVERGED, no LANE_RC - so there is no third byte-exactness verdict. More importantly its tail contains 'RXQ recv=8 drop=0 fnv=e5c8430c', and RXQ is the #494 diagnostic print that the merged acceptance tree deletes; the runner had asserted trace-free provenance dfa32cefae65 for board 3, so either the flashed image is not that tree or the log carries lines from a previous boot. Consequence applied immediately: board 3's decode 5.5783 is withdrawn as cross-board evidence, so byte-exactness rests on board 2 (18/20, failing exactly heldout_interval_one and heldout_long_tools_note_only) and the merged tree's speed rests on board 2's 5.575 alone until board 3 is re-established. Next window: re-read that log's own PROVENANCE and flash lines, grep board3/esp32/build for the RXQ format string in the ELF and map - the artifact, not the source hash - and if the ELF is clean, record the contamination as a harness finding in measure.sh. Accepted pin unchanged at 5.3033; the owner ask in the packet is unchanged apart from this evidence-scope correction.","timestamp":1790269997983,"segment":1,"confidence":18.02457142857145,"asi":{"finding":"Board 3's acceptance log tail contains 'RXQ recv=8 drop=0 fnv=e5c8430c' followed by 'EVT think=0', and RXQ is the #494 diagnostic print that the merged acceptance tree deliberately REMOVES. The runner asserted provenance dfa32cefae65 (trace-free) for board 3 at launch, so either the image on the board is not that tree, or the log contains content from a previous boot. Either way this is unresolved and I am not explaining it away.","hypothesis":"Read board 3's compare block - the third independent byte-exactness verdict on the merged acceptance tree.","next":"Before using board 3's 5.5783 for anything: (1) re-read its own PROVENANCE line and the flash step in that log; (2) grep the built ELF and map in board3/esp32/build for the RXQ format string - if present, the build is the trace tree and the session's speed reading belongs to a different provenance; (3) if the ELF is clean, the RXQ line came from an earlier boot and is log contamination, which is itself a harness finding worth recording in measure.sh. Byte-exact evidence remains board 2's 18/20 with exactly the two timer-dependent goldens; speed evidence for the merged tree is currently 5.575 on board 2 alone.","result":"No compare block on board 3 yet (11,741 bytes, one bench.py alive, log tail is a timer-state line), so no third byte-exactness verdict - and one line in that log contradicts the asserted provenance, which I am reporting rather than rationalising.","rule_reinforced":"A runner-asserted hash of the SOURCE tree is not proof about the IMAGE that ran, when the log can carry lines from another boot. The check that actually binds is the built ELF - grep the format string - which is exactly the trap #333 recorded ('nm the ELF for the candidate symbol before believing a number'). I asserted provenance and still had to read the artifact."}}
{"run":525,"commit":"9c4f1b2","metric":5.3033,"metrics":{"boot_bench_tps":5.621,"device_output_exact":18,"device_token_delta":52,"ext_decode_tps":5.2269,"gen_tokens":99,"host_output_exact":19,"internal_free":8415,"logit_max_delta":0.00005341,"logit_top1_match":10,"min_case_tps":5.31,"prefill_tps":5.59,"psram_free":2052252,"think_tps":4.2},"status":"keep","description":"The #524 anomaly is confirmed by the artifact, and board 3's acceptance reading is void rather than merely suspicious. Inspection shows board 3's source esp32/main/main.c still contains the RXQ diagnostic (grep -c = 1) and the freshly built esp-idf/main/libmain.a contains the RXQ format string (strings | grep -c = 1, archive dated today 17:08) - while that session's own log line asserts engine_md5=dfa32cefae651e66..., the hash of the trace-free merged tree. Those cannot both describe one build, so either the file changed after the runner hashed and asserted it, or the provenance line and the on-disk build belong to different launches. Applied consequence: board 3's decode 5.5783 remains withdrawn, the merged acceptance tree's speed evidence is board 2's 5.575 alone, and byte-exactness is board 2's 18/20 failing exactly heldout_interval_one and heldout_long_tools_note_only. The general rule, already paid for at #333 and now again: a provenance hash computed from the source before the build is not evidence about the image that ran - the check that binds is grepping the built artifact for a string unique to the candidate (here its absence). Next: restore board 3's main.c from .auto/exp84/main.c.lean-ring, verify RXQ absent in source AND in a fresh libmain.a, recompute the expectation from that verified tree, and run one clean full session. Accepted pin unchanged at 5.3033.","timestamp":1790270052205,"segment":1,"confidence":18.02457142857145,"asi":{"artifact_evidence":"grep -c RXQ board3/esp32/main/main.c = 1; strings esp32/build/esp-idf/main/libmain.a | grep -c RXQ = 1; the archive is dated today 17:08 - i.e. it is a fresh build of a source file that still carries the diagnostic. The session log's own line reads engine_md5=dfa32cefae65, the hash of the trace-free tree.","contradiction":"The two facts cannot both be true of one build. A source file containing RXQ cannot hash to the trace-free tree's value, so either the file was modified after the runner computed and asserted the hash, or the log's provenance line belongs to a different launch than the build artifact now on disk.","hypothesis":"Resolve the #524 anomaly by inspecting the artifact rather than the source hash: does board 3's built main component still contain the RXQ diagnostic format string?","implication_applied":"Board 3's 5.5783 stays withdrawn and byte-exactness remains single-board on board 2. #524's withdrawal was correct and is now confirmed by the artifact, not just by a suspicious log line.","next":"Re-establish board 3 cleanly: restore esp32/main/main.c from .auto/exp84/main.c.lean-ring, verify grep -c RXQ == 0 in BOTH source and freshly built libmain.a, recompute the expectation hash from that verified tree, then run one full session. Only a reading whose ELF lacks RXQ and whose provenance is recomputed after the build counts as cross-board evidence; a hash computed before the build is not evidence about the image."}}
{"run":526,"commit":"9c4f1b2","metric":5.3033,"metrics":{"boot_bench_tps":5.621,"device_output_exact":18,"device_token_delta":52,"ext_decode_tps":5.2269,"gen_tokens":99,"host_output_exact":19,"internal_free":8415,"logit_max_delta":0.00005341,"logit_top1_match":10,"min_case_tps":5.31,"prefill_tps":5.59,"psram_free":2052252,"think_tps":4.2},"status":"keep","description":"Board 3's clean re-establishment failed at the artifact, and the failure indicts my own saved snapshot rather than the board. Restoring esp32/main/main.c and CMakeLists.txt from .auto/exp84/main.c.lean-ring, rebuilding from scratch (idf.py build rc=0) and then inspecting the built main component showed elf_rxq=1 - the RXQ diagnostic format string is present in esp32/build/esp-idf/main/libmain.a - with sem=0 for xSemaphore symbols, so the surviving grep match is the trace, not the handshake. Conclusion: the file I recorded at #516 as the trace-free merged tree is not that tree, so #516's claim that the merged tree is snapshotted and reproducible must be re-verified line by line and corrected if wrong. Consequence stands as in #524/#525: no board-3 cross-board reading, the merged tree's speed evidence is board 2's decode 5.575 and its byte-exactness is board 2's 18/20 failing exactly heldout_interval_one and heldout_long_tools_note_only, pending a board-2 artifact check of its own. Next window: grep -n RXQ and xSemaphore in the snapshot and in board 2's current main.c, grep board 2's built ELF for RXQ, and if board 2 is clean copy ITS file rather than the snapshot. Accepted pin unchanged at 5.3033.","timestamp":1790270129223,"segment":1,"confidence":18.02457142857145,"asi":{"diagnosis":"The snapshot .auto/exp84/main.c.lean-ring is NOT trace-free, or the grep pattern is matching something I have not distinguished: after restoring it and rebuilding from scratch (build rc=0) the main component archive still contains the RXQ format string. That means #516's snapshot is not the tree I believed it to be, so every statement of the form 'the merged tree is snapshotted and reproducible' needs line-level verification before it is used again.","hypothesis":"Re-establish board 3 cleanly from the saved snapshot, verify the built artifact contains no RXQ and no semaphore calls, recompute provenance from the verified tree, and rerun the session.","next":"Line-level inspection, not more assumptions: grep -n both RXQ and xSemaphore in .auto/exp84/main.c.lean-ring and in board 2's current esp32/main/main.c, and grep the board-2 ELF for RXQ. If board 2's artifact is clean and its session still read 18/20 with decode 5.575, board 2 remains the single valid acceptance reading and the fix for board 3 is to copy board 2's file, not the snapshot. Whatever the outcome, correct #516's record if the snapshot turns out to carry the trace.","result":"Not clean: source grep for RXQ|xSemaphore returns 1 line, and the freshly built libmain.a contains RXQ (elf_rxq=1) while xSemaphore symbols are absent (sem=0), so the remaining match is the diagnostic - the restored file still prints the trace.","self_check":"This is the third time this window that an asserted identity of a tree had to be checked against bytes rather than my own notes (#524 the log line, #525 the artifact, #526 the snapshot). The campaign's rule from #333 - trust the built artifact - is cheap and it keeps paying; the snapshot rule from #514 needs the same amendment: snapshot AND verify the artifact, or the snapshot is just another claim."}}
