{"run":139,"commit":"45531fc","metric":4.7783,"metrics":{"prefill_tps":5.2183,"ext_decode_tps":4.704,"think_tps":3.84,"boot_bench_tps":4.986,"min_case_tps":4.55,"gen_tokens":99,"internal_free":17119,"psram_free":2052252,"device_output_exact":12,"device_token_delta":0,"logit_max_delta":0.00005341,"logit_top1_match":10,"host_output_exact":11},"status":"keep","description":"Attention: attn_heads now works a whole KV group at a time, staging each position pair's K and V rows once (int8 -> float, 4 bytes per word load) and sharing them across the group's query heads (12 heads over 2 KV heads = six sharing each row). Bit-exact by construction and by measurement: host 11/11, device 12/12, token_delta 0, logit probe unchanged at 5.341e-05. Device: 4.745 -> 4.7783 (+0.70%), +14.0% over the stock C control measured in the same batch (4.190); extended +0.82%, think +0.5%, prefill +0.6%, boot +1.0%, min_case 4.50 -> 4.55.","timestamp":1789946037438,"segment":1,"confidence":null,"asi":{"hypothesis":"attention's QK dot converts every int8 K byte to float once per query head, and 12 heads share 2 KV heads, so staging each KV row once per group should remove 5/6 of the unpacking and of the cache reads with no numerical change.","result":"+0.70% decode, byte-exact everywhere. The conversion and KV traffic were real but smaller than expected: attention's 38.6 ms only gave up ~1.5 ms, so what is left in that phase is the score/softmax bookkeeping and the per-element products, not the int8 unpacking.","bit_exact_reason":"per-element expressions were kept textually identical ((float)(int8_t) of the byte becomes a staged float of the same value), each head keeps its own running max/denominator/accumulator and still meets its positions in ascending order, so every product, sum, rescale and normalisation happens in the same order as before.","splitter_trap":"The first attempt used KV groups as the parallel units (nrows=2). rows_dual_core() in main.c runs fn on one core whenever nrows/2 < 2, so the whole attention phase went single-core and decode fell to 4.1817 - below the stock C control. Units must be query heads (nh=12, half=6), and because the ranges are group-aligned each core still owns whole groups. Any future small-unit split has to clear that same threshold.","stack_cost":"attn_heads' frame is ~1.1-1.4 kB (two staged K rows + two staged V rows + per-head softmax state), so the worker task stack went 4096 -> 8192: the profiled build overflowed 4 kB and never reached EVT ready. internal_free 23015 -> 17119 (4 kB task stack + ~1.8 kB of extra code in .iram1 shifting the heap).","measured_dead_end_saves":"the single-core version was measured and reverted in-batch, not kept; its number (4.1817) is recorded here so the 12% penalty is not re-derived.","next":"Two follow-ups in this family: (1) the same staging trick cannot be applied to the sink/recent split (each run already stages its own rows), but the odd-tail path could share a row across groups; (2) attention's remaining 37 ms is score bookkeeping and products - a TIE728 kernel for the per-head dot+accumulate is the remaining idea there, and kron_apply (11.0 ms, dense fp32, no bandwidth) is the other measured candidate."}}
{"run":140,"commit":"56d2a20","metric":4.7783,"metrics":{"prefill_tps":5.2183,"ext_decode_tps":4.704,"think_tps":3.84,"boot_bench_tps":4.984,"min_case_tps":4.55,"gen_tokens":99,"internal_free":17039,"psram_free":2052252,"device_output_exact":12,"device_token_delta":0,"logit_max_delta":0.00005341,"logit_top1_match":10,"host_output_exact":11},"status":"keep","description":"Diagnostic cycle, no runtime change (4.7783 = #139 exactly): added ND_P_* sub-phase timers and measured the full per-token map on device. 201 ms token = 2-bit GEMV 86.5 (43%, of which q/k/v/gate ~59), attention head split 36.7 (18%), Hadamard MLP 24.6 (12%, kron 11.1), engram 16.4 (8%), mHC phi 4-bit 13.5 (6.7%), attn stage 5.1 (taps 3.3 / head norms 0.5 / rope 0.2 / KV store 1.1), mHC mix 4.7, sinkhorn 4.3, prep+LUT 3.5, step tail 0.5, sampler 0.0, conf pool 0.0, unattributed ~14. Byte-exact 12/12 device + 11/11 host.","timestamp":1789947885113,"segment":1,"confidence":null,"asi":{"hypothesis":"Find where the remaining ~25 ms/token goes before writing more assembly: is it per-request overhead, the sampler, UART emit, an unnamed attention stage, or an unexamined kernel?","killed_ideas":["kron_apply assembly: disassembling GCC's kron1_blocks shows entry + hardware `loop` + 6 lsi + 8 madd.s already, i.e. 1.75 instructions/product. There is nothing to win by hand-writing it.","per-request overhead / sampler / tokenizer / UART emit as the missing time: ND_P_SAMPLE = 0.0 ms, step tail 0.5 ms, and the boot-bench residual is ~14 ms of per-layer glue.","attention pre-split stage: taps+head norms+rope+KV store is 5.1 ms total (3.3/0.5/0.2/1.1). The attn-stage timer's 101.8 ms is almost all the q/k/v/gate GEMVs, which are already counted in proj2bit.","engram as an unexamined target: its key/value projections already go through nd_cq_gemv_lut2, so they use the TIE728 kernel; the rest is flash-latency gathers."],"only_clear_arithmetic_target_left":"the 4-bit generic path (dot_group, used by mHC phi_pre/post/res = 13.5 ms): its inner loop is ~5 instructions per weight (extui + addx4 + lsi(cb) + lsi(xh) + madd.s), where the 2-bit pair-LUT path runs ~3. A nibble -> codebook-float lookup table (16 floats = one 64-byte cache line, L1-hot) should cut it to ~3-4, worth +1.4-2.0% decode. Bit-exactness is achievable because the products and the four accumulators are fixed.","timers":"ND_P_KRON/BLOCK/SINK/MHCX/STEP/SAMPLE/ATTNX/TAPS/HNORM/ROPE/KVST added; they compile away when ND_PROFILE is off, so no shipping image changes.","next":"Build a 4-bit microkernel in the kbench harness against the real phi tensors (kbench currently drives only the CQ2/LUT2 context, so it needs a 4-bit path), verify bit-exactness against dot_group, then measure a device A/B."}}
{"run":141,"commit":"c585913","metric":4.77,"metrics":{"prefill_tps":5.2183,"ext_decode_tps":4.704,"think_tps":3.84,"boot_bench_tps":4.985,"min_case_tps":4.55,"gen_tokens":99,"internal_free":17039,"psram_free":2052252,"device_output_exact":12,"device_token_delta":0,"logit_max_delta":0.00005341,"logit_top1_match":10,"host_output_exact":11},"status":"discard","description":"Generic (4-bit) GEMV row blocking, three-board batch, control validated at HEAD's 4.7783 exactly: B=4 -> 4.7700 (-0.17%), B=8 -> 4.7717 (-0.14%), both byte-exact 12/12 device, token_delta 0. Rejects the premise that mHC phi's 9.2 ms is activation re-read traffic: sweeping 4 or 8 rows per activation pass changed nothing. Code reverted (NEEDLE_GEMV_BLOCK knob removed); fidelity values are the accepted ones since the change never shipped.","timestamp":1789953973791,"segment":1,"confidence":null,"asi":{"hypothesis":"mHC phi (tensors 223/224/225, in=3072, group=128, bits=4) reads its 12 KB padded activation once per output row, 24 rows per token; blocking N rows per activation sweep should cut that 4-8x for free.","result":"Null (slightly negative, within noise). Activation re-reads are not the cost.","phi_anatomy_now_measured":{"geometry":"archive directory: out=32/32/128 rows, in=3072, group=128 (24 groups), rowbytes=1536, nbytes=50688/50688/202752 - packed+norms accounting is exact","per_token":"24 rows x 1536 B = 36,864 B packed, 73,728 weights, 9.2 ms => ~125 ns/weight, ~12x the 2-bit pair-LUT path","codegen":"GCC's 4-bit loop in dot_group is a hardware `loop` with 1 l32i + 8 extui + 8 addx4 + 8 lsi(cb) + 8 lsi(xh) + 8 madd.s per 8 weights = 4.1 instructions/weight - near the floor; an asm kernel could win maybe 12% (lsc pairing of xh) = ~1.1 ms = +0.5%","memory":"phi is inside the 12 MB PSRAM weight tier (hi_p extends to phi_res's end) so it is not streaming from flash; 37 KB/token cannot stay resident in 32 KB of L2 alongside everything else, and 17 KB of free internal RAM cannot hold it","verdict":"the 12x gap is PSRAM line-fill latency on a working set that cannot be made resident. Not addressable without changing what is computed (forbidden)."},"killed_ideas":["asm microkernel for the 4-bit phi path: GCC already at 4.1 instructions/weight with a hardware loop; ceiling +0.5%, below the risk of a hand-written kernel","row blocking the generic path (this run): null","putting phi's rows in internal SRAM: 37 KB/token against 17 KB free"],"harness_gotchas":["`idf.py -D<OPTION>=ON` did NOT enable NEEDLE_KBENCH in a fresh build dir (no kbench object, binary byte-identical in size to HEAD) while the same syntax DID set NEEDLE_GEMV_BLOCK declared as set(... CACHE STRING) - prefer the cache-string form for new knobs and always verify through compile_commands.json.","the LUT2 asm define is ND_LUT2_ASM=1 while the option is NEEDLE_LUT2_ASM: a guard grepping the option name false-fails.","a stale board1 build dir silently dropped the asm kernel and read 4.2217 (= C-kernel runtime, -11.7% vs 4.7783): fresh-configure every board in a batch, and treat a low control as a build-integrity failure, not a result.","raw pyserial capture of the firmware console stalls at exactly 4096 bytes after `EVT priming tokens=14` with DTR deasserted - the USB CDC bridge needs DTR. Set dtr=True before concluding the app hung."],"next":"Only mechanism-backed item left on the map: lsc-pair the xh loads in the 4-bit loop (~+0.5%, bit-exact by construction). Everything else on the 201 ms token is at its instruction or residency floor: 2-bit GEMV 43% at 3 instructions/weight (TIE728), attention heads 18% product-bound, kron 11.1 ms at 1.75 instructions/product, engram 8% already on the asm kernel, FWHT prepare ~5 cycles/butterfly."}}
{"run":142,"commit":"66e5050","metric":4.7783,"metrics":{"prefill_tps":5.2183,"ext_decode_tps":4.704,"think_tps":3.84,"boot_bench_tps":4.984,"min_case_tps":4.55,"gen_tokens":99,"internal_free":17039,"psram_free":2052252,"device_output_exact":12,"device_token_delta":0,"logit_max_delta":0.00005341,"logit_top1_match":10,"host_output_exact":11},"status":"keep","description":"Verification cycle on the accepted tree after reverting the row-blocking experiment: 4.7783 decode (identical to the accepted best), 4.704 extended, 3.84 think, 5.218 prefill, boot bench 201 ms/token, byte-exact 12/12 device + 11/11 host, fidelity probe 5.341e-05 with top1 10/10. No change taken. Also closed the remaining MimiModel campaign items against the measured phase map instead of guessing (see asi).","timestamp":1789954500557,"segment":1,"confidence":null,"asi":{"hypothesis":"verification cycle of the accepted 4.7783 runtime; plus decide Experiments 7-11 of the MimiModel queue against the measured phase map rather than by guesswork.","campaign_closures":{"exp7_compiler_fp_candidate":"not applicable as a speed lever: the accepted runtime is bound by PSRAM line fills (2-bit GEMV, 43%), online-softmax exp() plus KV line traffic (attention, 18%), FP latency (kron, 12%) and flash gather latency (engram, 8%). No -ffast-math style change survives the byte-exact golden gate by definition, and none of those phases is issue-limited.","exp8_cq2_integer_path":"rejected on measurement. The 2-bit projection phase is 86.5 ms for ~2.2 MB of packed weights per token, i.e. ~25-30 MB/s effective - the PSRAM/stream floor, not an arithmetic limit. An integer path would shorten arithmetic only, and phi's row blocking (which also shortened nothing observable) is the direct evidence that shortening arithmetic here buys nothing.","exp9_compact_quantised_pair_LUT":"rejected. Halving the 16 KB pair table cannot help: it is L1-resident and the streamed operand is the weights. Quantising its entries also changes products, so it fails the byte-exact gate before it is even measured.","exp10_one_quantised_activation_for_qkv_gate":"already true in the shipping code, and small: one nd_cq_prepare + one LUT build serve q/k/v/gate, and the whole PREP phase is 3.5 ms = 1.7% of the token, so the maximum prize was below the quality risk of changing quantisation.","exp11_xtensa_simd_integer_dot":"the accepted kernel is already the TIE728 float path at 3 instructions/weight on a stream-bound phase; int16 SIMD was independently rejected by the MimiModel engine for the same reason (unpack dominates)."},"revival_check":"No previous discard's rollback reason is invalidated. The new stream-floor model *predicts* the old row-blocking losses (2-row -5.1%, 4-row -5%, generic-path null), and the tier-span discards stay (12 MB remains the measured optimum for a tier whose whole purpose is to keep the stream off flash).","state":"142 runs, 4.7783 tok/s = +95.7% over the 2.44 baseline, all 12 device cases and 11 host cases byte-identical, fidelity unchanged.","next":"Remaining candidates are all sub-1% and each is explained by a floor: kron needs FP-latency work (8 accumulators already break the chains), attention needs asm around exp+KV traffic (big kernel, high risk, exp is not asm-fixable), 4-bit phi needs residency it cannot get. Next useful work is periodic verification plus the repo's own end-to-end `make capture` integrity run, which has not been exercised since the TIE728 kernel landed."}}
{"run":143,"commit":"0a6ff7b","metric":4.7783,"metrics":{"prefill_tps":5.2183,"ext_decode_tps":4.704,"think_tps":3.84,"boot_bench_tps":4.983,"min_case_tps":4.55,"gen_tokens":99,"internal_free":17039,"psram_free":2052252,"device_output_exact":12,"device_token_delta":0,"logit_max_delta":0.00005341,"logit_top1_match":10,"host_output_exact":11},"status":"keep","description":"Documentation + behavioural-integrity cycle, no runtime change (4.7783 for the third consecutive run, byte-exact 12/12 device + 11/11 host, fidelity 5.341e-05 / top1 10/10). Ran the repo's own end-to-end check `demo/capture.py` against the accepted firmware on board 1: all 7 real scenarios green (routes_match, tools_match, no_external_calls, local two-pass tool execution, telemetry progress, sampling interval applied, timer expired), 11.1-17.7 s per scenario. Dispositioned MimiModel Experiments 7-11 against the measured phase map, updated .auto/mimimodel-experiments.md, and replaced the stale NEXT block in .auto/prompt.md that still ordered Experiment 2 (shipped as the TIE728 kernel at +13.0% in #137-#138) with the current state and the run-worthy work.","timestamp":1789955161024,"segment":1,"confidence":null,"asi":{"hypothesis":"Verification + integrity cycle: exercise the repo's own end-to-end behaviour check on the shipped path (TIE728 CQ2 kernel + shared KV row staging), and close Experiments 7-11 with measured dispositions rather than another build.","capture_result":"all 7 scenarios green on board1: translation/coding/architecture routed externally and stopped at selection; status/sampling/timer/batch executed locally with correct tool args; routes_match=true tools_match=true no_external_calls=true local_has_two_passes=true timer_expired=true. Run with --out /tmp/recording.json so the committed recording stays untouched.","bandwidth_accounting_added":"2-bit GEMV 86.5 ms for ~2.2 MB of packed weights per token = ~25-30 MB/s effective against ~64 MB/s achievable on octal-DTR PSRAM at 80 MHz; the LX7 is in-order with no non-blocking loads, so a software prefetch cannot overlap a line fill and the ~13 ms gap over the pure-bandwidth estimate is not prefetch-recoverable. Bytes per token are fixed by the frozen archive, so 43% of the token cannot shrink without changing quantisation (forbidden).","why_no_more_asm":"the three remaining asm candidates each sit behind a non-instruction floor: 4-bit phi (arithmetic already 4.1 instructions/weight and hidden behind PSRAM line fills), kron_apply (1.75 instructions/product, ~3.8x that in FP latency, 8 accumulators already break the chains), attention (exp() cost and KV line traffic; exp is not asm-fixable and the kernel is a big risky rewrite).","process":"prompt.md's NEXT block is now consistent with the shipped state; previously it ordered a closed experiment, which is the kind of drift that costs a 12-minute device run per re-derivation.","next":"Verification cadence; re-measure the phase map (AUTO_PROFILE=1) only if the archive, tier geometry or fp32 pool changes."}}
{"run":144,"commit":"7c2d0a1","metric":4.7783,"metrics":{"prefill_tps":5.2183,"ext_decode_tps":4.704,"think_tps":3.84,"boot_bench_tps":4.984,"min_case_tps":4.55,"gen_tokens":99,"internal_free":17039,"psram_free":2052252,"device_output_exact":12,"device_token_delta":0,"logit_max_delta":0.00005341,"logit_top1_match":10,"host_output_exact":11},"status":"keep","description":"Noise-floor characterization of the accepted runtime: three byte-identical-source images (fresh-configured, 279184 B each) measured on three boards in one batch gave 4.7800 / 4.7783 / 4.7817 decode - peak-to-peak 0.07%, sigma ~0.03% - all byte-exact 12/12. Canonical workspace run on the same tree reproduces 4.7783 exactly. No change taken. Also corrected my own bandwidth accounting for the dominant phase (see asi): it is at the instruction floor, not the bus floor, and both floors land on the same number.","timestamp":1789956842213,"segment":1,"confidence":null,"asi":{"hypothesis":"Measure the run-to-run and board-to-board spread of the primary metric on byte-identical images, so sub-1% candidate deltas have a sigma to be judged against; and re-derive the dominant phase's floor with exact byte counts instead of my earlier estimate.","noise_floor":{"primary_decode_tps":"board1 4.7800, board2 4.7783, board3 4.7817 -> spread 0.0034 (0.071% peak-to-peak), sigma ~0.0015 (0.03%)","implication":"the 0.2% keep bar is about 6 sigma, so it is conservative but not vacuous; deltas of 0.1% or less are not resolvable, which retroactively explains why ~20 instruction-scheduling experiments all read within +-0.05%","md5_note":"identical sources produce different md5 per board because ESP-IDF stamps the build time; differing md5 with identical sources is expected, identical md5 across different flags is the failure signal"},"corrected_floor_accounting_for_the_2bit_gemv":{"bytes":"per layer q(576)+k(96)+v(128)+gate(768)+out(768) = 2336 rows x 768 weights = 1.79M weights, x8 layers = 14.3M weights = 3.59 MB packed + ~0.22 MB group norms = ~3.8 MB per token","bus":"3.8 MB at ~64 MB/s achievable on octal-DTR PSRAM at 80 MHz = ~59 ms, so the measured 86.5 ms runs at 69% of bus peak","instructions":"14.3M weights x 3 instructions per weight (4 extui + 4 addx4 + 8 lsi + 8 add.s per 8 weights = the accepted kernel's floor) = 43M instructions ~ 21M cycles = ~88 ms, matching 86.5 ms at IPC ~2","conclusion":"instruction floor and 69%-of-bus both land on ~86 ms. Beating it needs fewer bytes (quantisation frozen) or a wider table that gives up address arithmetic and loses to cache misses - the quad table measured 38% slower for exactly that reason."},"revival_check":"Nothing to revive: the sigma measurement strengthens every prior null, and the corrected accounting confirms the row-blocking and scheduling nulls sat at a real floor, not a measurement artefact.","next":"Verification cadence only unless an assumption changes (archive geometry, tier size, fp32 pool). The sigma is now on record for judging future candidates."}}
