{"run":333,"commit":"a228dba","metric":5.03,"metrics":{"boot_bench_tps":5.076,"device_output_exact":17,"device_token_delta":0,"ext_decode_tps":4.956,"gen_tokens":99,"host_output_exact":16,"internal_free":14903,"logit_max_delta":0.00005341,"logit_top1_match":10,"min_case_tps":4.8,"prefill_tps":5.3067,"psram_free":2052252,"think_tps":3.94},"status":"keep","description":"Experiment 22A - integrated plain-load CQ 4-bit (mHC phi) row walker: MEASURED and KEPT, +0.365 % decode (5.0117 -> 5.0300, now +106.1 % over the 2.44 baseline). engine/src/gemv4_tie728.S replaces the per-group dot_group CALL walk in nd_cq_gemv_rows for 4-bit / group-128 tensors with ordinary fp16 norms (gate nd_gemv4_asm_ok, cached per blob+rows, C path kept as fallback, row split via nd_parallel_rows unchanged). Canonical board-1 run at the shipping config: decode 5.0300, extended 4.956 (+0.34 %), prefill 5.3067 (+0.38 %), think 3.94 (+0.26 %), boot bench 5.076 / 197 ms per token (from 5.057 / 198 - the bench moved, which is the mechanism check because phi is inside it), min_case 4.80 (best worst case seen), 17/17 device + 16/16 host byte-exact with golden_missing=0 and DEVICE_GATE_OK, token_delta 0, fidelity 5.341e-05 IDENTICAL to the control, top1 10/10, checks green. Cost internal_free 15,215 -> 14,903 (-312 B of IRAM text, the #292 heap coupling), psram unchanged. app_md5 f1fde82570d0, engine_md5 4ef369a806b3. Realisation 69 % of the isolated +11.6 % / +0.53 % prediction, in this campaign's measured band. TWO FAILED ATTEMPTS ARE RECORDED SEPARATELY, because both are findings. (1) ATTEMPT 1 was a NULL, not a result: I saved the forced-inline variant with `git diff` + `git checkout engine/src/nd_quant.c` and forgot to re-apply, so the shipping C wiring was missing while the .S still compiled and the CMake define was present. The linker GC'd the unreferenced kernel (nm showed NO nd_gemv4_rows_tie1), so that run re-measured the accepted runtime - 5.0117 and internal_free 15,215 to the digit - and the exit-42 anti-repeat guard did NOT catch it, because the extra object file changes the shipping signature. Loophole recorded: the signature catches config drift, not an unreferenced new file; the cheap guard is to assert the candidate's new symbol is in the ELF before believing the number. (2) ATTEMPT 2 was the first real build and it DIVERGED: device_output_exact=5/17, device_token_delta=175, DEVICE_OUTPUT_DIVERGED, exit 1, while being faster (5.0283) - the row-range kernel advanced its packed and norm cursors TWICE per row (the word loop already consumes a whole row: 4 B per index word = 64 B per group, 2 B per group, so both cursors land exactly on the next row when the groups run out) and the row epilogue then added rowbytes and normstep again, skipping every row after the first. The isolation screen could not see this: it called the kernel once per row, where the CALLER did that stepping. Fix = delete the two epilogue advances (documented in the .S at the site), and the correct primitive test is a multi-row differential (row-range kernel vs per-row calls), banked in .auto/ideas.md. THIS IS THE DEVICE BYTE-EXACT GATE (#298) CATCHING ITS FIRST REAL CANDIDATE: the fast-but-wrong build could not be logged as a win, and no host gate could have seen it (x86 uses the C path). LANES B AND C (owner directive: three independent lanes, pinned 5.0117 baseline, no live control; measured in the same window). 22B forced-inline C dot_group (board 2): +0.10 % decode (5.0167), extended 4.946, prefill 5.2917, think 3.94, 17/17 byte-exact, and -1,024 B of internal heap - below the bar and inside the 0.071 % three-board spread, so not confirmable and not kept; it is also the free control on mechanism: removing the same call in C buys +0.10 % end to end, so the asm's win is the whole schedule (loop + all partials in registers + the norm converted once inside), not call overhead alone. 22C wide-load fill-order probe (board 3, kbench): the ee.ldf question is ANSWERED and closed - on the two hand-computable probes (A: nibble k = k, xh[j] = 2^(j%8), cb[i] = i, expected 24608 exactly; B: all nibbles 1, cb = 1, expected 4080, permutation-invariant) the plain-load kernel is EXACT on both (A 24608.0, B 4080.0), while ee.ldf.128.ip and ee.ldf.64.ip return 4080 for A, i.e. exactly the all-one-nibble answer: with distinct nibbles they collapse to one codebook operand, so the +21/+25 % was never a permuted register list that a reorder could fix, it was lost nibble identity. The extra ~10 % above the plain form is not available this way. HARNESS, cost four dead board lanes: measure.sh died with rc=1 and a ZERO-BYTE log on a freshly synced checkout because its anti-repeat guard ended with `[ -f esp32/sdkconfig ] && sha256sum ...` inside a command substitution under `set -euo pipefail` - sdkconfig does not exist yet there (gitignored, generated by the build), so the pipeline failed and killed the run before it printed anything; fixed with if/fi plus `true` inside the hashed group (hash content unchanged) and the reason is now a comment. Also: tmux windows must run `needle-board run N -- bash .auto/measure.sh` INSIDE the window (the wrapper sets NEEDLE_BOARD/FLASH_PORT/SERIAL_PORT and takes the lock) - a direct call silently used board 1's ports and lock and died with 'Board 1 is busy'. Encoding rule added to .auto/lanes.sh, which now fails if the candidate is not visibly in the tree.","timestamp":1790112650064,"segment":1,"confidence":19.910000000000018,"asi":{"abi_fact_addx4":"addx4 ar, as, at -> ar = (as<<2)+at, DESTINATION FIRST (already recorded #332; the integration reused lut2_tie728.S's convention and it is correct).","candidate_next":"phi is now on the asm path and bit-exact. Next: (1) multi-row kbench differential (row-range vs per-row calls) so the cursor class is covered by a primitive test, not only by the device suite; (2) cross-board repeat of 5.0300 on board 2 to promote discovery -> confirmed; (3) the same call-structure question for the 2-bit path's C fallback walker (nd_lut2_rows_c) is already answered (it has its own asm kernel), so the remaining call-heavy walker is gemv_rows_generic (4-bit, currently unused by the model) - do not write for it.","device_gate_first_catch":"DEVICE_OUTPUT_DIVERGED 5/17 with decode 5.0283 (faster than the accepted 5.0117) - a fast-but-wrong build that no host gate could see (x86 compiles the C path). The #298 gate earned its keep on its first real candidate.","discovery_baseline_note":"lanes used the pinned accepted 5.0117 with the measured 0.071 pct three-board spread; +0.365 pct is ~5x the spread, and every secondary moved with the primary, so this is not board identity.","gc_null_harness_fact":"an image that COMPILES a new .S but never references it gets the section garbage-collected and measures the accepted runtime exactly (5.0117, internal_free 15,215) while the shipping signature differs (extra file) - so the exit-42 guard passes and the run looks like a candidate. Guard: nm the ELF for the candidate's new symbol before believing any number.","harness_measure_sh_bug":"set -euo pipefail + `[ -f esp32/sdkconfig ] && sha256sum ...` as the last command of the hashed command substitution: on a fresh checkout sdkconfig does not exist, pipeline status 1, CURRENT_SHIPPING_SIG assignment fails, the script exits 1 BEFORE printing anything. Four lanes died looking like a dead launcher. Found in one step with `bash -x`.","harness_tmux_rule":"tmux lane windows must exec `needle-board run N -- bash .auto/measure.sh` inside the window; calling measure.sh directly from a window silently uses board 1's ports and board 1's lock.","invalid_run_1":"attempt 1 measured 5.0117 (the accepted runtime) because my own `git checkout engine/src/nd_quant.c`, used to save the inline variant, had removed the shipping wiring and the linker GC'd the orphan kernel (nm: no nd_gemv4_rows_tie1). Disclosed, not hidden: it is a build-integrity failure, not a result.","laneB_forced_inline":"decode 5.0167 (+0.10 pct), extended 4.946, prefill 5.2917, think 3.94, 17/17 byte-exact, internal_free 14,191 (-1,024 B). Below the 0.2 pct bar and inside board spread -> rejected. Also proves the asm's win is schedule-wide, not merely call removal.","laneC_wide_load_closure":"expected A=24608 / B=4080 on hand-computable inputs: plain lsi kernel EXACT on both; ee.ldf.128.ip and ee.ldf.64.ip return A=4080 (the all-one-nibble answer) while B=4080 correct -> nibble identity is lost, so no register reorder rescues them and the +21/+25 pct was never real.","measured":"board 1 canonical at shipping config: decode 5.0300 (+0.365 pct over 5.0117), extended 4.956 (+0.34 pct), prefill 5.3067 (+0.38 pct), think 3.94, boot bench 5.076 / 197 ms per token, min_case 4.80, 17/17 device + 16/16 host byte-exact, golden_missing=0, token_delta 0, fidelity 5.341e-05 identical to control, top1 10/10, internal_free 14,903 (-312 B), app_md5 f1fde82570d0.","multrow_test_gap":"the isolation screen called the kernel per row, so the row-range cursor arithmetic it added was covered by NO primitive test; the device suite caught it. Correct follow-up: kbench differential of nd_gemv4_rows_tie1 over N rows vs N per-row calls of the proven single-row kernel.","realisation":"isolated +11.6 pct priced +0.53 pct decode; delivered +0.365 pct = 69 pct realisation, inside the campaign's 25-70 pct band for this mechanism.","row_loop_cursor_bug":"the word loop already consumes a whole row (a8 +4 B per index word = 64 B per group; a5 +2 B per group), so both cursors sit exactly on the next row when the groups run out. The epilogue's `add a8,a10` / `add a5,normstep` double-stepped and skipped every row after the first: 5/17 byte-exact, token_delta 175, still +0.33 pct faster. Fix = delete both epilogue advances."}}
{"run":334,"commit":"9003747","metric":5.0283,"metrics":{"boot_bench_tps":5.075,"device_output_exact":17,"device_token_delta":0,"ext_decode_tps":4.956,"gen_tokens":99,"host_output_exact":16,"internal_free":14903,"logit_max_delta":0.00005341,"logit_top1_match":10,"min_case_tps":4.8,"prefill_tps":5.3067,"psram_free":2052252,"think_tps":3.94},"status":"keep","description":"Experiment 22A cross-board confirmation + capture cadence, not a new candidate: the accepted runtime (run #333's integrated plain-load CQ 4-bit row walker, commit 0cbc742) measured on a SECOND board and the repo behavioural suite re-run on the shipping image. Board 2 ran the same shipping tree/config through the pool wrapper (`bash .auto/measure.sh` inside `needle-board run 2`, batch 20260922T2135L - logged here rather than through run_experiment because the campaign's run_experiment is bound to board 1/main and this measurement had to be on another board by the owner's cross-board-confirmation protocol). CROSS-BOARD RESULT: decode 5.0283 on board 2 against the pinned accepted baseline 5.0117 = +0.33 %, and against board 1's 5.0300 = -0.03 %, i.e. two boards agree to 0.03 % (five times the campaign's measured 0.071 % board spread is the discovery threshold; the agreement itself is inside it). Monitors identical: extended 4.956, think 3.94, boot bench 5.075, internal_free 14,903 (the same -312 B as board 1), psram_free 2,052,252, device_output_exact 17/17, device_golden_missing=0, token_delta 0, DEVICE_GATE_OK. So the +0.365 % is not board identity and not prompt-specific: it is promoted from discovery to confirmed, and the accepted runtime stays 5.0300 (board 1's canonical reading, the campaign's standard board). ALSO CLOSED THIS ITERATION, the cadence the campaign owes when shipping code changes: `make capture` rc=0 on this exact image with all NINE behavioural flags true (routes_match, tools_match, requests_succeeded, no_external_calls, local_has_two_passes, external_stops_at_selection, telemetry_progressed, sampling_interval_applied, timer_expired) across seven real end-to-end scenarios (translation routed externally, status/sampling/timer/batch executed locally). Harness note worth keeping: `make capture` needs the API up (it hits 127.0.0.1:8081 and fails with a bare Connection refused otherwise) and `needle-api` is /usr/local/bin/needle-api, not a Makefile target; the API was stopped by pid afterwards (pkill does not stop it - it spawns tools/serial_api.py as a child which keeps /dev/needle-pi/console and makes the next board-1 run fail with 'Board 1 is busy'), verified zero serial_api processes remaining before releasing the board. Pool state after: all three workers at 0cbc742 with the FIXED kernel, their sdkconfig removed so it regenerates from the shipping defaults, goldens/prompts/harness re-copied from main; all lane tmux sessions closed and both boards free.","timestamp":1790113176677,"segment":1,"confidence":19.910000000000018,"asi":{"accepted_runtime":"5.0300 decode tok/s (board 1 canonical, commit 0cbc742, +106.1 % over the 2.44 baseline), confirmed at 5.0283 on board 2","capture":"rc=0 on image f1fde82570d0 with all nine behavioural flags true - cadence requirement for the run #333 shipping change satisfied","cross_board_agreement":"board1 5.0300 vs board2 5.0283 = 0.03 % apart; internal_free 14,903 and boot bench 5.076/5.075 identical, so the +0.33..0.37 % delta is the kernel on both boards","next":"re-derive the per-phase profile (AUTO_PROFILE=1) against the 197 ms boot bench: phi's GEMVs should now be ~8.1 ms instead of 9.2, which re-ranks what is left. Also banked: the multi-row differential for nd_gemv4_rows_tie1 before that kernel is touched again.","harness_api_fact":"make capture requires needle-api (at /usr/local/bin, not a make target) listening on 127.0.0.1:8081; it dies with a bare Connection refused otherwise. Stop it by pid afterwards: pkill -f needle-api leaves its serial_api.py child holding /dev/needle-pi/console.","measurement_route":"board-to-board confirmation must go through the pool wrapper in a persistent tmux window (needle-board run N inside the window); run_experiment is bound to the main workspace/board 1, so a cross-board number arrives as a lane log and must be disclosed as such."}}
{"run":335,"commit":"9003747","metric":5.0367,"metrics":{"boot_bench_tps":5.085,"device_output_exact":17,"device_token_delta":0,"ext_decode_tps":4.966,"gen_tokens":99,"host_output_exact":16,"internal_free":13111,"logit_max_delta":0.00005341,"logit_top1_match":10,"min_case_tps":4.81,"prefill_tps":5.3167,"psram_free":2052252,"think_tps":3.94},"status":"discard","description":"Experiment 22D-lane-A, forced-inline sigmoidf_pair: MEASURED, +0.13 % decode on board 1 (5.0367 vs the accepted 5.0300) and +0.17 % on board 2 in the crossover (5.0367 there vs 5.0283) - BELOW the 0.2 % keep bar and the more expensive of the two variants tested against it (-1,792 B of internal heap), so not kept. Hypothesis was sound and came straight out of run #333's finding: `static inline` is a request, not a decision - GCC kept sigmoidf_pair as a real function at 0x4200ceb4, which is FLASH-mapped, while its two hot callers silu_rows (0x4037c3a4) and agate_rows (0x4037c358) are in IRAM, so the Monarch MLP's gated stage and the attention output gate paid an IRAM-to-flash call per element pair, ~3,600 times per token. Forcing always_inline removes it. Bit-exact by construction (inlining changes no operation, no argument, no order): 17/17 device + 16/16 host byte-exact, golden_missing=0, DEVICE_GATE_OK, token_delta 0, fidelity 5.341e-05 identical to the control, top1 10/10. Every monitor moved with the primary, including the boot bench (5.085 vs 5.076), which is the mechanism check because SiLU is inside the bench: extended 4.966 (+0.20 %), prefill 5.3167 (+0.19 %), think 3.94, min_case 4.81 (best worst case seen so far). The reason it is discarded rather than kept is the bar: +0.13 % on the canonical board, +0.17 % on the crossover board, mean +0.15 % - genuinely below 0.2 % on a metric whose per-variant spread is zero, not a noisy near-miss. The sibling lane (22D-B, ND_HOT on the same function, keeping the call but moving the callee into IRAM) measured BETTER on both boards (+0.165 % and +0.20 %) for half the RAM (-768 B), which is the informative result: this phase's cost was the flash crossing, not the call itself. Both variants are reverted; see 22D-B's own log line for the 2x2 table.","timestamp":1790114255625,"segment":1,"confidence":19.910000000000018,"asi":{"2x2_cross_board_table":"accepted 5.0300 (b1) / 5.0283 (b2); D1 always_inline 5.0367 (b1) AND 5.0367 (b2); D2 ND_HOT 5.0383 (b1) AND 5.0383 (b2). Each variant reads the same value on both boards, so per-variant board spread is ZERO and a +0.13 % delta is a measurement, not noise - but it is still below the bar.","disposition":"discard: mean +0.15 % over the accepted runtime is under the 0.2 % keep bar, and the RAM cost (-1,792 B) is worse than the sibling variant.","mechanism":"flash-mapped callee called from IRAM hot loops (silu_rows 0x4037c3a4, agate_rows 0x4037c358 -> sigmoidf_pair at 0x4200ceb4).","next":"audit for the same class: which IRAM-resident hot loops still call flash-mapped helpers (libm logf/expf/sqrtf, nd_tok_piece, nd_gstate_byte, pool_cell). D2-B's result says the crossing, not the call, is what costs.","verdict_rule_applied":"kept candidates must clear 0.2 % on the canonical board; the boot bench moving (5.076 -> 5.085) proves the mechanism fired, so this is a small real win, not a null - recorded so nobody re-derives it."}}
{"run":336,"commit":"9003747","metric":5.0383,"metrics":{"boot_bench_tps":5.086,"device_output_exact":17,"device_token_delta":0,"ext_decode_tps":4.966,"gen_tokens":99,"host_output_exact":16,"internal_free":14135,"logit_max_delta":0.00005341,"logit_top1_match":10,"min_case_tps":4.81,"prefill_tps":5.3167,"psram_free":2052252,"think_tps":3.94},"status":"discard","description":"Experiment 22D-lane-B, ND_HOT on sigmoidf_pair (keep the call, move the callee out of flash): MEASURED on two boards with a full crossover, +0.165 % decode on the canonical board 1 (5.0383 vs the accepted 5.0300) and +0.20 % on board 2 (5.0383 vs that board's 5.0283 accepted reading) - the better of the two variants tested (half the RAM cost of forced-inline: -768 B vs -1,792 B, and faster on both boards) but still under the 0.2 % keep bar on the canonical board, so NOT kept, and this is the campaign's best sub-bar candidate on record. THE 2x2 TABLE IS THE REAL RESULT, and it is the cleanest measurement-integrity result this campaign has: each variant reads the SAME decode on BOTH boards - accepted 5.0300/5.0283, D1 always_inline 5.0367/5.0367, D2 ND_HOT 5.0383/5.0383. Per-variant board spread is ZERO, so a +0.165 % delta is a measurement rather than a coin flip; what stops it being kept is the bar, not the evidence. Mechanism, measured rather than assumed: GCC kept `static inline` sigmoidf_pair out of line at 0x4200ceb4 (FLASH-mapped) while its two hot callers silu_rows (0x4037c3a4) and agate_rows (0x4037c358) sit in IRAM, so ~3,600 element pairs per token paid an IRAM-to-flash call. D1 deleted the call (+0.15 % mean, -1,792 B); D2 only moved the callee into IRAM and did BETTER (+0.18 % mean, -768 B). That ordering is the finding: for this phase the cost was the flash crossing (instruction-cache/fetch across the memory boundary), not the call-and-return itself - which is the opposite of what the run #333 phi result implied, where removing the call was worth +0.365 % because the callee's whole schedule also changed. Quality never at risk: 17/17 device + 16/16 host byte-exact, golden_missing=0, DEVICE_GATE_OK, token_delta 0, fidelity 5.341e-05 identical to the control, top1 10/10, and every monitor moved with the primary: extended 4.966 (+0.20 %), prefill 5.3167 (+0.19 %), boot bench 5.086 (from 5.076 - the mechanism check, SiLU is inside the bench), min_case 4.81, think 3.94. BOTH 22D variants are reverted; the exact one-line change is kept as .auto/exp22/d1-always-inline.patch and the ND_HOT form is a single sed, so re-applying D2 is one command if the owner ever sets the bar at 0.15 % or wants +0.17 % for 768 B of internal heap.","timestamp":1790114348118,"segment":1,"confidence":19.910000000000018,"asi":{"2x2_result":"accepted 5.0300(b1)/5.0283(b2) | D1 inline 5.0367/5.0367 | D2 ND_HOT 5.0383/5.0383 - zero per-variant board spread, so deltas are real.","best_subbar_candidate":"D2 = ND_HOT sigmoidf_pair, +0.165 % canonical / +0.20 % crossover, -768 B internal, all monitors positive, bit-exact. Re-apply: sed -i 's/^static inline void sigmoidf_pair/static ND_HOT inline void sigmoidf_pair/' engine/src/nd_model.c. First retry if the keep bar ever moves to 0.15 %.","board_identity_eliminated":"a variant reads the same number on both boards, so single-board canonical readings carry no board risk; the 0.071 % three-board spread is the floor of a per-variant measurement, not a per-board offset.","disposition":"discard on the bar: +0.165 % canonical is below 0.2 % - not a noise judgement, the delta is reproduced on two boards.","invalidates_prior_discard":"run #232 concluded 'placement is not a lever' from a CALLER audit (nd_sample_hidden to IRAM = +0.067 %). Both 22D variants beat that and are CALLEE placements, so the placement family is closed only for hot callers and OPEN for flash-mapped callees that hot IRAM loops call.","next":"audit the accepted ELF for IRAM hot loops calling flash-mapped targets (libm logf/expf/sqrtf, nd_tok_piece, nd_gstate_byte, fp16 helpers), then ND_HOT the top ones as separate one-line candidates - each is a 60-second patch and the class measured +0.15-0.20 % per site.","ordering_finding":"moving the callee into IRAM beat deleting the call: the flash crossing costs more than call/return, so callee placement is the cheaper first lever on any hot loop."}}
